{"title":"GUIMARÃES, José","cargoss":["Deputado federal"],"cargos_esp":[0],"datas_ini":[1912],"datas_fim":[1914],"estados":["SE"],"autor":[0],"content":"**GUIMARÃES, José**\n\n\\*militar; dep. fed. SE 1912-1914.\n\n*José Maria Moreira Guimarães* nasceu em Laranjeiras (SE) no dia 4 de\nnovembro de 1864, filho de Rufino Alves da Cruz Guimarães e de Inácia\nMaria Moreira Guimarães.\n\nEm sua cidade natal estudou as primeiras letras e iniciou o curso de\nhumanidades, que veio a concluir no Partenon Sergipense, em Aracaju, em\n1881. Partiu então para o Rio de Janeiro, capital do Império, e\nmatriculou-se na Escola Militar da Praia Vermelha, em 18 de fevereiro de\n1882. Durante o período de propaganda republicana, colaborou em 1887 com\no jornal *O Laranjeirense*.\n\nComo alferes-aluno, logo após a proclamação da República (15/11/1889)\nesteve à disposição do governo de Sergipe em 1890 para servir como\najudante de ordens. Chegou a primeiro-tenente ainda nesse mesmo ano e\nfoi promovido a capitão no ano seguinte. Combateu a Revolta da Armada em\n1893, primeiro no morro do Castelo, depois em Niterói. Formado\nengenheiro militar em 1899, estudou também medicina no Rio de Janeiro\naté o quinto ano. Em março de 1904 foi promovido a capitão do\nEstado-Maior do Exército e designado adido militar junto à legação do\nBrasil no Japão. Acompanhou a guerra russo-japonesa de 1905, tendo\nassistido aos combates que se desenrolaram em Port Arthur. De volta ao\nBrasil, comandou a 2^a^ Brigada de Cavalaria de Alegrete (RS) e em 1908\nfoi promovido a major.\n\nEm 1912 foi eleito deputado federal por Sergipe, assumindo sua cadeira\nna Câmara dos Deputados, no Rio de Janeiro, agora Distrito Federal, em\nmaio do mesmo ano. Foi promovido a tenente-coronel em 1913 e permaneceu\nno Legislativo até dezembro de 1914, quando se encerraram seu mandato e\na legislatura. Em 1919 comandou a Escola Militar do Realengo, no Rio de\nJaneiro, e em 24 de dezembro do mesmo ano foi reformado como general de\nbrigada.\n\nFoi ainda membro da Sociedade de Geografia do Rio de Janeiro, da\nSociedade de Geografia de Lisboa, da Sociedade Acadêmica de Paris e da\nSociedade de Geografia de Tóquio. Foi sócio-honorário do Instituto\nHistórico e Geográfico de São Paulo, sócio-correspondente da Sociedade\nde Geografia de Lima (Peru), sócio do Instituto Histórico e Geográfico\nBrasileiro, do Instituto Histórico e Geográfico de Sergipe e do\nInstituto Histórico e Geográfico da Paraíba. Foi também membro fundador\ndo Instituto Varnhagen e vice-presidente do Centro Sergipano (ambos no\nRio de Janeiro). Dirigiu a revista *Família Acadêmica*, da Associação\nLiterária da Escola Militar da Praia Vermelha. Esteve presente na\nimprensa periódica, escrevendo no *Correio da Manhã*, no *Jornal do*\n*Brasil*, na *Gazeta de Notícias*, em *O País*, no *Jornal do Comércio*,\nem *A Imprensa* e em *O Dia,* todos do Rio de Janeiro. Escreveu também\npara *O Estado de* *Sergipe* e o *Jornal do Povo,* de Aracaju.\n\nFaleceu no dia 10 de fevereiro de 1940.\n\nPublicou *Noções de artilharia* (1895), *Estudos militares* (1900),\n*Jogos de* *guerra* (1905), *No extremo Oriente* (1908), *Estudos e\nreflexões* (1910), *Fragmentos* (1915), *Organização da força militar*\n(1916) e *Variações filosóficas* (1920).\n\nSérgio Montalvão\n\n**FONTES:** CÂM. DEP. *Deputados brasileiros*; GUARANÁ, M. *Dicionário*;\nLojas maçônicas. Disponível em:\n*\\<*www.lojasmaconicas.com.br/avisos/grao\\_mestre\\_gob.htm\\>. Acesso em:\n20/4/2009.\n","ref":"**FONTES:** CÂM. DEP. *Deputados brasileiros*; GUARANÁ, M. *Dicionário*;\nLojas maçônicas. Disponível em:\n*\\<*www.lojasmaconicas.com.br/avisos/grao\\_mestre\\_gob.htm\\>. Acesso em:\n20/4/2009.\n","dic":"DHBPR"}
