{"title":"GURGEL, Francisco","cargoss":["Governador de estado ou do Distrito Federal","Deputado federal"],"cargos_esp":[0,0],"datas_ini":[1891,1894],"datas_fim":[1891,1899],"estados":["RN","RN"],"autor":["Renato Amado Peixoto"],"content":"**GURGEL, Francisco**\n\n\\* gov. RN 1891; dep. fed. RN 1894-1899.\n\n*Francisco Gurgel de Oliveira* nasceu em Caraúbas (RN) no dia 7 de\nsetembro de 1848, filho de Antônio Francisco de Oliveira e de Quitéria\nFerreira de São Luís.\n\nEm 24 de outubro de 1866 tornou-se genro do conselheiro Luís Gonzaga de\nBrito Guerra, barão do Assu, ministro do Supremo Tribunal de Justiça do\nImpério, ao casar-se com Maria dos Anjos de Brito Guerra, filha deste e\nde sua irmã, portanto sua sobrinha, então com 15 anos. Viúvo, voltaria a\ncasar-se em 9 de outubro de 1880 com Apolônia Ferreira da Nóbrega,\ntambém filha de Luís Gonzaga com a segunda mulher, então com 14 anos, a\nquem batizara no mesmo dia de seu primeiro casamento.\n\nPresidente da intendência de Mossoró entre 1877 e 1880, e chefe político\nda região, alcunhado de “Cônsul do Sertão”, em 1878 tornou-se líder do\nPartido Conservador no Rio Grande do Norte, designado pelo fundador do\npartido na província, o padre Antônio Joaquim Rodrigues, do púlpito de\nsua igreja. Foi também sócio-instalador da Sociedade Libertadora\nMossoroense.\n\nProclamada a República, formou junto com o sogro na oposição a Pedro\nVelho de Albuquerque Maranhão. Sua intervenção direta na política\nrepublicana aconteceu em 1891, a partir da eleição para o Congresso\nConstituinte estadual convocada por Francisco Amintas da Costa Barros,\ngovernador nomeado pelo presidente Deodoro da Fonseca e empossado em 3\nde março daquele ano. A nomeação de Amintas Barros havia acontecido\njustamente para prestigiar a oposição à liderança de Pedro Velho e José\nBernardo de Medeiros, que, na eleição para presidente da República\nrealizada pelo Congresso Nacional Constituinte em 25 de fevereiro,\nhaviam votado em Prudente de Morais. Na eleição para o Congresso\nConstituinte estadual, vencida pela oposição, Francisco Gurgel conseguiu\neleger deputados vários de seus liderados, inclusive seu sobrinho Filipe\nNéri de Brito Guerra. Por sua vez, foi eleito segundo-vice-governador do\nestado, ao lado de Miguel Joaquim de Almeida Castro, eleito governador,\ne de José Inácio Fernandes de Barros, eleito primeiro-vice. Como Miguel\nCastro se encontrava no Rio de Janeiro no exercício do mandato de\ndeputado federal, Amintas Barros passou o poder para José Inácio\nFernandes Barros. Este passou a ser pressionado para reorganizar o Poder\nJudiciário no Estado, de modo a beneficiar determinados interesses\ncomerciais e políticos, e, não querendo se indispor com esses grupos de\ninteresse, transferiu o governo a Francisco Gurgel.\n\nFrancisco Gurgel esteve à frente do governo do Rio Grande do Norte de 6\nde agosto a 9 de setembro de 1891, e nesse período reorganizou toda a\nmagistratura do estado, nomeando uma série de correligionários juízes de\ndireito e transformando outros em desembargadores, lotados num tribunal\nque havia instalado sem o organizar legalmente, o Tribunal Superior de\nRelação do Rio Grande do Norte. Chegando a Natal o presidente eleito,\neste se recusou a tomar posse frente ao tribunal montado por Francisco\nGurgel e dois dias depois declarou sem efeito os atos de nomeação de\njuízes e de criação da nova corte.\n\nA partir de então, Francisco Gurgel buscou articular-se com os\nconspiradores que planejavam a derrubada de Miguel Castro, plano esse\nque ganharia força a partir da renúncia de Deodoro à presidência da\nRepública em 23 de novembro. De fato, em 28 de novembro, Pedro Velho e\nJosé Bernardo, à frente da tropa do Exército aquartelada em Natal,\npromoveram a derrubada de Miguel Castro, deportando-o depois de preso\npara Fortaleza. O governo do estado foi então entregue a uma junta\ngovernativa que foi imediatamente apoiada por Francisco Gurgel. A junta\ndissolveu o Congresso estadual e convocou eleições para um novo\nCongresso Constituinte. Na escolha da chapa do Partido Republicano foram\ncontempladas todas as forças políticas implicadas na deposição de Miguel\nCastro. Eleitos os novos constituintes, entre os quais figuravam um\nirmão e o sobrinho de Francisco Gurgel, coube-lhes eleger os novos\ngovernantes. Pedro Velho foi eleito governador, e Francisco Gurgel,\nnovamente, segundo-vice-governador.\n\nContudo, a coligação que derrubou Miguel Castro se esboroou quando José\nBernardo passou a reivindicar para Janúncio da Nóbrega Filho o lugar de\ndeputado federal deixado vago por Pedro Velho. Este resolveu apresentar\nseu próprio irmão, Augusto Severo de Albuquerque Maranhão, contra o\ncandidato de José Bernardo, e nessa nova disputa Francisco Gurgel\npassaria a apoiar Pedro Velho emprestando-lhe os votos da região de\nMossoró. Consumada a recomposição de forças, as urnas revelaram a\nderrota do líder do Seridó, mas este conseguiu anular no Congresso\nNacional a eleição de Augusto Severo.\n\nDaí em diante os dois líderes se enfrentariam numa queda de braço\ndemorada, em que o apoio do presidente Floriano Peixoto a José Bernardo\ntornava possível novo recurso à força armada. Augusto Severo somente\nseria eleito um ano depois, em 1893, dessa vez concorrendo contra Tobias\ndo Rego Monteiro, mas Pedro Velho conseguiu manter-se no poder contando\ncom o apoio político de Francisco Gurgel. Por conta disso Francisco\nGurgel seria lembrado para suceder a Pedro Velho, mas contentou-se\napenas com a indicação para a Câmara, sendo eleito deputado pelo Rio\nGrande do Norte na legenda do Partido Republicano em 1894 e reeleito em\n1896.\n\nEm 1897, quando da cisão do Partido Republicano Federal, Pedro Velho\ndecidiu acompanhar Francisco Glicério de Cerqueira Leite e passou à\noposição, decisão apoiada por toda a bancada do Rio Grande do Norte.\nContudo, quando, em novembro daquele ano, ocorreu o atentado contra a\nvida do presidente Prudente de Morais, Francisco Gurgel divergiu de\nPedro Velho, passando imediatamente a apoiar o governo. Pedro Velho não\nperdoaria a traição, até porque foi implicado no atentado pela situação.\nCom a reaproximação de Pedro Velho com José Bernardo, a partir de suas\nposturas comuns no plano federal, o apoio de Francisco Gurgel tornou-se\ndispensável. Seus correligionários mais próximos foram então\nperseguidos, entre eles seu sobrinho Filipe Guerra e seu irmão João\nGurgel de Oliveira, aposentados por decreto pelo governador Ferreira\nChaves em 1898.\n\nAlijado da chapa partidária, Francisco Gurgel ainda tentou se reeleger\ndeputado federal em 1899 pela oposição, mas foi derrotado pela chapa\n“pedrovelhista”, que agora incluía os liderados por José Bernardo.\nConfrontado pelos novos fatos políticos, agravados pela recém-inaugurada\n“política dos governadores” do presidente Campos Sales, Francisco Gurgel\ndecidiu afastar-se da política estadual e federal, retornando a Mossoró.\n\nFaleceu na fazenda São Sebastião, no município de Mossoró, em 7 de\njaneiro de 1910.\n\nDe seu casamento com Maria dos Anjos de Brito Guerra Gurgel teve seis\nfilhos, e com Apolônia Ferreira da Nóbrega de Oliveira Gurgel teve sete.\n\nRenato Amado Peixoto\n\n**FONTES:** AMARAL, A. *Trilha*; BASTOS, S. *Roteiro*; *Biblioteca\ngenealógica brasileira* (v.8, 1942); BUENO, A. *Visões*; CASCUDO, L.\n*História da República*; CASCUDO, L. *História do Rio Grande do Norte*;\nCASCUDO, L. *Vida*; NONATO, R. *História*; ROSADO, V. *Pirapama*; SOUZA,\nI. *República*;WANDERLEY, W. *Família.*\n","ref":"**FONTES:** AMARAL, A. *Trilha*; BASTOS, S. *Roteiro*; *Biblioteca\ngenealógica brasileira* (v.8, 1942); BUENO, A. *Visões*; CASCUDO, L.\n*História da República*; CASCUDO, L. *História do Rio Grande do Norte*;\nCASCUDO, L. *Vida*; NONATO, R. *História*; ROSADO, V. *Pirapama*; SOUZA,\nI. *República*;WANDERLEY, W. *Família.*\n","dic":"DHBPR"}
