{"title":"HOLANDA, Francisco Camilo de","cargoss":["Deputado federal","Deputado federal","Presidente de associação ou confederação de empregados ou empregadores"],"cargos_esp":[0,0,0],"datas_ini":[1909,1900,1916],"datas_fim":[1916,1902,1920],"estados":["PB","PB","PB"],"autor":["Raimundo Helio Lopes"],"content":"**HOLANDA, Francisco Camilo de**\n\n\\*dep. fed. PB 1900-1902 e 1909-1916; pres. PB 1916-1920.\n\n*Francisco Camilo de Holanda* nasceu na cidade da Paraíba,\nposteriormente João Pessoa, no dia 10 de setembro de 1861.\n\nFormou-se pela Faculdade de Medicina da Bahia em 1887 e depois de\nformado aliou suas atividades profissionais ao serviço militar. Em 13 de\nabril de 1889 foi nomeado tenente cirurgião do Exército. Após a\nproclamação da República em 15 de novembro de 1889, aderiu ao novo\nregime. Em 27 de março de 1890 tornou-se capitão médico de quarta\nclasse. Durante a presidência do marechal Floriano Peixoto (1891-1894),\nesteve preso por ter apoiado o governo do marechal Deodoro da Fonseca\n(1889-1891) e ser considerado deodorista.\n\nEm 1900 foi eleito deputado federal pela Paraíba. Ao final do mandato,\nem dezembro de 1902, não foi reeleito. Continuou sua carreira militar e\nem 28 de fevereiro de 1907 tornou-se major médico graduado de terceira\nclasse, sendo efetivado em 5 de dezembro do mesmo ano. Voltou a ocupar\numa cadeira na Câmara dos Deputados em 1909, quando foi novamente eleito\ndeputado federal pela Paraíba com o apoio de Epitácio Pessoa.\nSucessivamente reeleito, renunciou ao mandato em 1916, por ter sido\neleito presidente de seu estado. Tomou posse em 22 de outubro, sucedendo\na Sólon Barbosa de Lucena. Em sua administração, reformou a capital e\nestimulou investimentos no interior do estado, através do crédito\nagrícola e do incentivo à cultura algodoeira. Em 22 de outubro de 1920,\ntransmitiu o governo a seu antecessor, Sólon de Lucena, então\nreconduzido à presidência do estado.\n\nFoi também membro do Instituo Histórico e Geográfico Paraibano.\n\nFaleceu no ano de 1946.\n\nRaimundo Helio Lopes\n\n**FONTES:** ABRANCHES, J. *Governos*; CÂM. DEP. *Deputados brasileiros*;\n*Grande encic. Delta Larousse*; INST. HIST. GEO. PARAIBANO.\n\\<www.ihgp.net/fundacao2.htm\\>. Acesso em: 18/11/2010; ODILON, M.\n*Pequeno*; PINTO, L. *Fundamentos*.\n","ref":"**FONTES:** ABRANCHES, J. *Governos*; CÂM. DEP. *Deputados brasileiros*;\n*Grande encic. Delta Larousse*; INST. HIST. GEO. PARAIBANO.\n\\<www.ihgp.net/fundacao2.htm\\>. Acesso em: 18/11/2010; ODILON, M.\n*Pequeno*; PINTO, L. *Fundamentos*.\n","dic":"DHBPR"}
