{"title":"HORN, Raulino","cargoss":["Membro de junta governativa","Governador de estado ou do Distrito Federal","Constituinte","Senador","Governador de estado ou do Distrito Federal","Governador de estado ou do Distrito Federal","Governador de estado ou do Distrito Federal"],"cargos_esp":[0,0,0,0,0,0,0],"datas_ini":[1889,1890,1891,1891,1922,1921,1920],"datas_fim":[1889,1890,1891,1899,1922,1921,0],"estados":["SC","SC",0,"SC","SC","SC","SC"],"autor":["Carolina Vianna Dantas"],"content":"**HORN, Raulino**\n\n\\*junta gov. SC 1889; gov. SC 1890; const. 1891; sen. SC 1891-1899; gov.\nSC 1920, 1921 e 1922.\n\n*Raulino Júlio Adolfo Horn* nasceu em Laguna (SC) a 1^o^ de julho de\n1849, filho do boticário alemão Eduardo Amadeus Otto Horn, chegado a\nSanta Catarina em 1838, e de Claudina Bernardina de Oliveira Medeiros.\n\nFez os estudos primários em sua cidade natal e, aos 17 anos, ingressou\nna Faculdade de Medicina do Rio de Janeiro, formando-se em farmácia. Nos\ntempos de faculdade aderiu às ideias republicanas, acompanhando as\natividades políticas de Quintino Bocaiúva, Saldanha Marinho e outras\nlideranças do movimento. Ainda no período monárquico, fundou o Partido\nRepublicano Catarinense em 1887. Foi presidente do Clube Republicano e\nfundador e presidente do Clube Abolicionista de Desterro, atual\nFlorianópolis*.* Além dessas entidades de caráter político, fundou a\nSociedade de Agricultura e a Sociedade de Catequese dos Silvícolas,\ntendo sido presidente de ambas.\n\nEm 17 de novembro de 1899, dois dias após a proclamação da República,\npassou a integrar a junta governativa de Santa Catarina, composta ainda\npelo coronel João Batista do Rego Barros Cavalcanti de Albuquerque e\nAlexandre Marcelino Bayma. Em 2 de dezembro a junta passou o governo a\nLauro Müller, então nomeado pelo governo provisório da República,\nchefiado pelo marechal Deodoro da Fonseca, governador do estado. Em\nabril de 1890 foi ele próprio nomeado primeiro-vice-governador. Assumiu\ninterinamente o governo, substituindo Lauro Müller, de 24 de agosto a 29\nde setembro de 1890. Nesse mesmo mês foi eleito senador à Assembleia\nNacional Constituinte. Voltou a substituir Lauro Müller de 5 a 8 de\noutubro, e em 15 de novembro tomou posse na Assembleia, integrando a\nComissão de Redação da Carta Constitucional. Renovou o mandato no Senado\naté 1899.\n\nEm 1919 elegeu-se deputado estadual e exerceu a presidência da\nAssembleia Legislativa até o fim do mandato em 1921. Reelegeu-se para a\nlegislatura seguinte (1922-1924), ocupando novamente o cargo de\npresidente da Assembleia. Entre 1920 e 1922 substituiu o governador\nHercílio Luz em quatro ocasiões, por curtos períodos de tempo. Em 1925\nelegeu-se mais uma vez deputado estadual, cumprindo o mandato até 1927.\n\nFaleceu em Florianópolis no dia 26 de setembro de 1927.\n\nEra casado com Henriqueta Avelino Monteiro Horn.\n\nCarolina Vianna Dantas\n\n**FONTES:** ABRANCHES, J. *Governos*; PIAZZA, W. *Dicionário*;Wikipédia.\nWalter Piazza. Disponível em:\n\\<http://pt.wikipedia.org/wiki/Walter\\_Piazza” \\\\o “Walter Piazza”\\>;\nSTOETERAU, L. *Trajetória.*\n","ref":"**FONTES:** ABRANCHES, J. *Governos*; PIAZZA, W. *Dicionário*;Wikipédia.\nWalter Piazza. Disponível em:\n\\<http://pt.wikipedia.org/wiki/Walter\\_Piazza” \\\\o “Walter Piazza”\\>;\nSTOETERAU, L. *Trajetória.*\n","dic":"DHBPR"}
