{"title":"JAIME, Tulo Hostílio","cargoss":["Deputado federal"],"cargos_esp":[0],"datas_ini":[1918],"datas_fim":[1920],"estados":["GO"],"autor":["Adrianna Setemy"],"content":"**JAIME, Tulo Hostílio**\n\n\\*dep. fed. GO 1918-1920.\n\n*Tulo Hostílio Jaime* nasceu na cidade de Goiás, então capital do estado\nde Goiás, em 23 de setembro de 1891, filho de Luís Gonzaga Jaime e de\nMaria Augusta Sócrates. Seu pai foi senador por Goiás de 1909 a 1921.\n\nFormado em direito, iniciou sua atuação na vida pública elegendo-se\ndeputado federal por Goiás em julho de 1917. Assumindo sua cadeira na\nCâmara dos Deputados, no Rio de Janeiro, então Distrito Federal, em maio\nde 1918, permaneceu no Legislativo federal até dezembro de 1920, quando\nse encerraram seu mandato e a legislatura.\n\nFaleceu em Araçuaí (MG) em 19 de novembro de 1964.\n\nEra casado com Evangelina da Cunha Melo, com quem teve quatro filhos.\n\nAdrianna Setemy\n\n**FONTES:** Projeto de imagem de publicações oficiais brasileiras do\nCenter for Research Libraries e Latin-american Microfilm Project.\n*Mensagens dos Presidentes de Província (1830-1930).* Disponível em:\n\\<www.crl.edu/content.asp?l1=4&l2=18&l3=33\\>. Acesso em: 8/1/2009.\n","ref":"**FONTES:** Projeto de imagem de publicações oficiais brasileiras do\nCenter for Research Libraries e Latin-american Microfilm Project.\n*Mensagens dos Presidentes de Província (1830-1930).* Disponível em:\n\\<www.crl.edu/content.asp?l1=4&l2=18&l3=33\\>. Acesso em: 8/1/2009.\n","dic":"DHBPR"}
