{"title":"JUNQUEIRA, Ribeiro","cargoss":["Deputado federal","Constituinte","Senador"],"cargos_esp":[0,0,0],"datas_ini":[1903,1934,1935],"datas_fim":[1930,1934,1937],"estados":["MG",0,"MG"],"autor":["Helena Faria"],"content":"**JUNQUEIRA, Ribeiro**\n\n\\*dep. fed. MG 1903-1930; const. 1934; sen. MG 1935-1937.\n\n*José Monteiro Ribeiro Junqueira* nasceu em Santa Isabel, distrito de\nLeopoldina (MG), no dia 27 de agosto de 1871, filho de José Ribeiro\nJunqueira e de Antônia Augusta Lobato Monteiro Junqueira. Também\nseguiram trajetória política seus primos Antero Andrade Botelho,\ndeputado federal por Minas Gerais (1897-1899, 1903-1923 e 1935-1937),\nalém de constituinte de 1934, e Antônio Augusto Ribeiro Junqueira,\ndeputado da Assembleia Legislativa de Minas (1927-1930).\n\nTendo iniciado seus estudos na fazenda de seus pais com um preceptor\nfrancês, frequentou depois a escola particular dirigida por Inácio Gama,\no Colégio Biolkini de Petrópolis (RJ) e o Colégio Abílio, onde concluiu\nos preparatórios em 1888. No ano seguinte matriculou-se na Faculdade de\nDireito de São Paulo, formando-se em 1893. Durante esse período presidiu\no Centro Republicano Mineiro e a Sociedade Mineira de Beneficência, além\nde colaborar no jornal *Minas Acadêmica*. Em 1894 foi nomeado promotor\ninterino de Leopoldina e em seguida foi designado promotor da comarca de\nPomba, sempre em Minas Gerais. Recusou, entretanto, este último cargo\npara permanecer em Leopoldina no exercício da advocacia. Ainda em 1894\nelegeu-se presidente do Conselho Distrital de Leopoldina, dando início a\numa série de medidas de modernização do município.\n\nEm 1895 foi eleito deputado estadual pelo distrito do Sul de Minas,\nfavorecido em grande parte pela influência de sua família na região. Na\nlegislatura seguinte, embora lhe fosse oferecida a reeleição pelo mesmo\ndistrito, não aceitou, preferindo candidatar-se por seu distrito natal.\nEleito apesar dos esforços em contrário do presidente mineiro Silviano\nBrandão, exerceu durante seu mandato firme oposição ao governo estadual.\nEm 1897 foi eleito presidente da Câmara Municipal de Leopoldina para o\ntriênio de 1898 a 1900, sendo mais tarde reeleito para o triênio\nseguinte.\n\nEm 1903 foi eleito deputado federal na legenda do Partido Republicano\nMineiro (PRM). Em maio do mesmo ano assumiu o mandato na Câmara dos\nDeputados, à qual seria sucessivamente reconduzido até 1930. Eleito\nagente executivo de Leopoldina em 1910, tornou-se membro da comissão\nexecutiva do PRM no ano seguinte. Na Câmara, exerceu várias vezes a\nliderança da bancada mineira, tendo liderado também a coligação formada\ncontra o governo do marechal Hermes da Fonseca (1910-1914). Participou\nde várias comissões durante sua permanência no Congresso, tendo relatado\nem 1912, como presidente da Comissão de Finanças, o orçamento da Viação.\nEm 1920, presidiu a Comissão de Reformas Tributárias da Câmara, que\nenviou ao Senado o projeto de reforma das tarifas aduaneiras.\n\nEm 1929, com o início da campanha liberal, ingressou na comissão\nexecutiva da Aliança Liberal que, mais tarde, no dia 15 de agosto,\nlançou as candidaturas de Getúlio Vargas e João Pessoa à presidência e à\nvice-presidência da República. Em janeiro de 1930, acompanhou os\ncandidatos liberais na viagem que estes fizeram ao Rio e a São Paulo\npara lançar a plataforma de governo. Em seguida, acompanhou João Pessoa\nem sua viagem a Minas. Em maio, participou da reunião da comissão\nexecutiva do PRM em que esta aceitou os compromissos formais que o\npresidente mineiro Antônio Carlos Ribeiro de Andrada assumira com a\nrevolução em nome do partido.\n\nApós a vitória da Revolução de 1930, teve o mandato interrompido e\nparticipou, em fevereiro de 1931, da criação da Legião de Outubro em\nMinas, sendo eleito para o conselho supremo da entidade, composto de\noito membros. Os demais eram Francisco Campos, Gustavo Capanema, Amaro\nLanari, Antônio Carlos, Venceslau Brás, Teodomiro Santiago e José\nBonifácio de Andrada e Silva. Em 4 de maio foi nomeado pelo presidente\ndo estado, Olegário Maciel, secretário de Agricultura, cargo que\nexerceria até 3 de março de 1932.\n\nAinda em agosto de 1931, durante o congresso do PRM realizado em Belo\nHorizonte, viu-se envolvido nos acontecimentos que levaram à tentativa\nde deposição de Olegário Maciel. Ribeiro Junqueira era proprietário da\nCompanhia de Força e Luz Cataguases-Leopoldina, à qual Olegário havia\nconcedido facilidades. A concessão, considerada irregular, foi o estopim\nda investida contra o governo, atribuída tanto a membros do próprio PRM\nquanto a elementos do governo federal. Na agitação que se seguiu,\nRibeiro Junqueira chegou a ser preso por um grupo de jovens.\n\nApós esses acontecimentos, ficaram abaladas as relações entre o governo\nmineiro e o governo provisório chefiado por Getúlio Vargas, e se\nacentuaram as divergências entre o PRM e Olegário Maciel. Com a\nfinalidade de promover a conciliação, chegou-se a um acordo, conhecido\ncomo Acordo Mineiro, que propunha a fusão da Legião de Outubro com o\nPRM, criando-se um partido único que serviria de base de apoio aos\ngovernos federal e estadual. Assim, em fevereiro de 1932, foi fundado o\nPartido Social Nacionalista (PSN), em cuja comissão diretora\nencontrava-se Ribeiro Junqueira. Entretanto, frente às pressões em favor\nda reconstitucionalização do país, o PSN não conseguiu manter-se e, com\na eclosão da Revolução Constitucionalista em São Paulo (9/7/1932), e foi\ndissolvido.\n\nEm 1933, foi fundado em Minas o Partido Progressista (PP), em cuja\nlegenda Ribeiro Junqueira foi eleito para a Assembleia Nacional\nConstituinte que se reuniu em 1933-1934. Em outubro de 1934 voltou a\neleger-se deputado federal na legenda do PP, e em 1935 foi eleito\nsenador pela Assembleia Constituinte de Minas Gerais. Deixou assim a\nCâmara dos Deputados e ocupou uma cadeira no Senado.\n\nNa convenção que em 25 de maio de 1937 indicou José Américo de Almeida\ncandidato à presidência da República, Ribeiro Junqueira foi um dos\nrepresentantes do PP. Com o advento do Estado Novo (10/11/1937), perdeu\no mandato de senador e não mais retornou à vida pública.\n\nEm sua atividade empresarial, além de ter sido incorporador e\ndiretor-presidente da empresa hidrelétrica já mencionada e da S.A. de\nPecúlios Zona da Mata, fundou a *Gazeta de Leopoldina* e o Ginásio\nLeopoldinense, dos quais foi também diretor, a Companhia Leiteira\nLeopoldinense, as Casas Bancárias Ribeiro Junqueira, a empresa Irmãos\nBotelho, a Companhia Fiação e Tecidos Leopoldinense, todos em Minas\nGerais, e a Companhia Carbonífera de Urussangueda do Rio Carvão, em\nSanta Catarina.\n\nFaleceu no dia 14 de maio de 1946.\n\nEra casado com Helena de Andrade Ribeiro Junqueira, com quem teve três\nfilhos.\n\nO arquivo de Ribeiro Junqueira encontra-se depositado no Centro de\nPesquisa e Documentação de História Contemporânea do Brasil (Cpdoc) da\nFundação Getulio Vargas.\n\nHelena Faria\n\n**FONTES:** ABRANCHES, J. *Governos*; ARQ. GETÚLIO VARGAS; *Boletim Min.\nTrab*. (5/1936); CONSULT. MAGALHÃES, B.; *Diário de Notícias*\n(26/5/1937); *Diário do Congresso Nacional*; FONTOURA, J. *Memórias*;\nGODINHO, V. *Constituintes*; HORTA, C. *Famílias*; *Ilustração\nBrasileira* (7/9/1922); MONTEIRO, N. *Dicionário*; MORAIS, A. *Minas*;\nNOGUEIRA FILHO, P. *Ideais*; *Personalidades*; *Rev. Arq. Públ. Mineiro*\n(12/1976); SENADO. *Anais* (1935); SODRÉ, N. *História da imprensa*.\n","ref":"**FONTES:** ABRANCHES, J. *Governos*; ARQ. GETÚLIO VARGAS; *Boletim Min.\nTrab*. (5/1936); CONSULT. MAGALHÃES, B.; *Diário de Notícias*\n(26/5/1937); *Diário do Congresso Nacional*; FONTOURA, J. *Memórias*;\nGODINHO, V. *Constituintes*; HORTA, C. *Famílias*; *Ilustração\nBrasileira* (7/9/1922); MONTEIRO, N. *Dicionário*; MORAIS, A. *Minas*;\nNOGUEIRA FILHO, P. *Ideais*; *Personalidades*; *Rev. Arq. Públ. Mineiro*\n(12/1976); SENADO. *Anais* (1935); SODRÉ, N. *História da imprensa*.\n","dic":"DHBPR"}
