{"title":"LACERDA, Joaquim","cargoss":["Senador"],"cargos_esp":[0],"datas_ini":[1897],"datas_fim":[1899],"estados":["PR"],"autor":["Luciana Pinheiro"],"content":"**LACERDA, Joaquim**\n\n\\*sen. PR 1897-1899.\n\n*Joaquim Resende Correia de Lacerda* nasceu no município da Lapa (PR) no\ndia 29 de março de 1845, filho de Manuel Correia de Lacerda e de\nLeocádia Cassiana Resende de Lacerda.\n\nComerciante, durante a Guerra do Paraguai (1864-1870) foi organizador de\num dos batalhões brasileiros que embarcaram para o combate. Em 1893,\ndurante a Revolução Federalista, que a partir de fevereiro conflagrou o\nRio Grande do Sul e em seguida avançou pelos estados de Santa Catarina e\nParaná, assumiu o comando superior da Guarda Nacional de seu município\nnatal, atuando no treinamento dos soldados que lutaram no episódio\nconhecido como cerco da Lapa. Conhecido por ser um entusiasta do regime\nmonárquico, mesmo assim recebeu o título de coronel honorário do\nExército brasileiro por sua participação na luta contra os federalistas.\n\nEm 1897 foi eleito senador pelo Paraná, com mandato até dezembro de\n1899. Assumindo sua cadeira no Senado, no Rio de Janeiro, então Distrito\nFederal, em maio do mesmo ano, passou a integrar a Comissão de Comércio,\nAgricultura e Indústria e Artes.\n\nFaleceu na Lapa no dia 12 de julho de 1905.\n\nEra casado com Maria Madalena Moogen, com quem teve um filho.\n\nLuciana Pinheiro\n\n**FONTES:** LEITE NETO, L. *Catálogo biográfico* (v.3, p.1.429); MUS.\nMAÇONICO PARANAENSE. Disponível em:\n\\<www.museumaconicoparanaense.com/\\>. Acesso em: 17/6/2010; NICOLAS, M.\n*Paraná* (p.17-18); SENADO. Disponível em: \\<www.senado.gov.br/\\>.\nAcesso em: 17/6/2010.\n","ref":"**FONTES:** LEITE NETO, L. *Catálogo biográfico* (v.3, p.1.429); MUS.\nMAÇONICO PARANAENSE. Disponível em:\n\\<www.museumaconicoparanaense.com/\\>. Acesso em: 17/6/2010; NICOLAS, M.\n*Paraná* (p.17-18); SENADO. Disponível em: \\<www.senado.gov.br/\\>.\nAcesso em: 17/6/2010.\n","dic":"DHBPR"}
