{"title":"AMARAL, Ubaldino do","cargoss":["Constituinte","Senador","Senador","Prefeito"],"cargos_esp":[0,0,0,0],"datas_ini":[1891,1892,1891,1897],"datas_fim":[1891,1894,1891,1898],"estados":[0,"PR","PR","DF"],"autor":["Luciana Pinheiro"],"content":"**AMARAL, Ubaldino do**\n\n\\*const. 1891; sen. PR 1891 e 1892-1894;min. STF1894-1896; pref. DF\n1897-1898.\n\n*Ubaldino do Amaral Fontoura*nasceu naLapa (PR) no dia 27 de agosto\nde1842, filho de Francisco das Chagas doAmaral e de Gertrudes Pilar do\nAmaral.\n\nFez os primeirosestudos no Colégio São João do Lageado,no município\npaulista de Sorocaba, e em1867 diplomou-se em ciências jurídicas\nesociais pela Faculdade de Direito de SãoPaulo. Recém-formado retornou a\nSorocaba, iniciandoa carreira de advogado. No mesmo município,onde\npermaneceu por sete anos e fundoudiversas entidades assistenciais e\nfilantrópicas,participou ativamente da fundação dos periódicos*Ipanema*\ne *Sorocabano* e trabalhou pela criaçãoda Via Férrea Sorocabana.\n\nEm 1874 transferiu-separa o Rio de Janeiro, então capitaldo Império,\ndando continuidade à carreirade advogado. Em janeiro de 1884\ntornou-semembro efetivo do Conselho Diretor daInstrução Primária e\nSecundária do municípioda Corte, por nomeação ministerial.\nAbolicionistaferrenho e republicano histórico, em novembrode 1889, logo\napós a proclamação daRepública, assumiu o cargo de Inspetorda Alfândega\ndo Rio de Janeiro. Emfevereiro seguinte foi nomeado presidente\ndaComissão Inspetora da Casa de Correçãoda capital federal. Em 1890 foi\ntambémpresidente do Conselho de Intendência Municipal.\n\nEleito senador peloParaná ao Congresso Nacional Constituinte reunidoem\n15 de novembro de 1890, neleocupou uma cadeira a partir de janeirode\n1891 e destacou-se nos trabalhos dachamada “Comissão dos 21”, a qual\npresidiu,ficando à frente das discussões referentesao projeto da\nConstituição Federal. Promulgadaa Constituição, da qual foi\nsignatário,em 24 de fevereiro de 1891, passouem maio a exercer o mandato\nordinárioaté dezembro, quando renunciou. Em junhode 1892 foi novamente\neleito senador,tomando posse no mês seguinte. Em maiode 1894 foi\nescolhido primeiro-secretário evice-presidente do Senado, funções que\ndesempenhouaté dezembro do mesmo ano. Renunciou então,mais uma vez, ao\nmandato ao sernomeado ministro do Supremo Tribunal Federal(STF), ao qual\npertenceu até maio de1896.\n\nEm 25 de novembrode 1897 foi nomeado pelo então presidenteda República\nPrudente de Morais (1894-1898)prefeito do Distrito Federal, em\nsubstituiçãoao prefeito interino Joaquim José da Rosa.Exerceu curto\nmandato administrativo, tendo renunciadoem 17 de novembro de 1898,\nalegandoincompatibilidades políticas durante o processode reforma\nadministrativa da prefeitura. Assumiuseu lugar Luís van Erven.\n\nNo decorrer de 1903 assumiu adireção do Banco da República e\ntornou-semembro do Conselho da Junta Administrativada Caixa de\nAmortização. Em 1909 exerceua presidência do Banco do Brasil.\n\nAo longo de sua trajetória profissionalexerceu também atividades\ndiplomáticas, atuandocomo árbitro brasileiro nos tribunais\nmistosbrasileiro-boliviano e brasileiro-peruano e comoembaixador da\nComissão Permanente de Arbitramentodo Tribunal de Haia. Presidente da\nSociedadede Legislação Comparada, defendeu o Paranánas discussões\nreferentes aos limites geográficoscom Santa Catarina. Foi professor de\ndiversasinstituições de ensino, entre as quaisa Faculdade Livre de\nDireito do Riode Janeiro.\n\nFaleceu no Distrito Federal em22 de janeiro de 1920.\n\nFoi casado com Rosa Cândida deOliveira Amaral.\n\nEntre suas publicações destacam-se apeça teatral *O soldado brasileiro*\n(1868), escrita emparceria com Cândido Barata Ribeiro, *Discurso no\nGrande Oriente do Brasil* (1876), *Segunda Conferência do Grande\nOriente* (1877) e *Saldanha Marinho, perfil biográfico*.\n\nLuciana Pinheiro\n\n**FONTES:** AZEVEDO, E. *Um palco*. Portaldo Colégio Estadual Dr.\nUbaldino do Amaral.Disponível em:\n\\<[www.snpubaldino.seed.pr.gov.br/](http://www.snpubaldino.seed.pr.gov.br/)\\>.\nAcesso em:8/10/2010; Portal do Museu Maçônico Paranaense.Disponível em:\n\\<[www.museumaconicoparanaense.com/](http://www.museumaconicoparanaense.com/)\\>.\nAcesso em:8/10/2010; Portal do Núcleo de MemóriaPolítica Carioca e\nFluminense. Disponível\nem:\\<[www.alerj.rj.gov.br/memoria/historia/prefdf/ubaldino\\_amaral.html](http://www.alerj.rj.gov.br/memoria/historia/prefdf/ubaldino_amaral.html)\\>.\nAcesso em:8/10/2010; Portal do Planalto Nacional. Disponívelem:\n\\<[www.planalto.gov.br/](http://www.planalto.gov.br/)\\>. Acesso em:\n8/10/2010; Portaldo Senado Federal. Disponível em:\n\\<[www.senado.gov.br/](http://www.senado.gov.br/)\\>. Acesso\nem:8/10/2010; Portal do Supremo Tribunal Federal.Disponível em:\n\\<[www.stf.jus.br/](http://www.stf.jus.br/)\\>. Acesso em: 8/10/2010.\n","ref":"**FONTES:** AZEVEDO, E. *Um palco*. Portaldo Colégio Estadual Dr.\nUbaldino do Amaral.Disponível em:\n\\<[www.snpubaldino.seed.pr.gov.br/](http://www.snpubaldino.seed.pr.gov.br/)\\>.\nAcesso em:8/10/2010; Portal do Museu Maçônico Paranaense.Disponível em:\n\\<[www.museumaconicoparanaense.com/](http://www.museumaconicoparanaense.com/)\\>.\nAcesso em:8/10/2010; Portal do Núcleo de MemóriaPolítica Carioca e\nFluminense. Disponível\nem:\\<[www.alerj.rj.gov.br/memoria/historia/prefdf/ubaldino\\_amaral.html](http://www.alerj.rj.gov.br/memoria/historia/prefdf/ubaldino_amaral.html)\\>.\nAcesso em:8/10/2010; Portal do Planalto Nacional. Disponívelem:\n\\<[www.planalto.gov.br/](http://www.planalto.gov.br/)\\>. Acesso em:\n8/10/2010; Portaldo Senado Federal. Disponível em:\n\\<[www.senado.gov.br/](http://www.senado.gov.br/)\\>. Acesso\nem:8/10/2010; Portal do Supremo Tribunal Federal.Disponível em:\n\\<[www.stf.jus.br/](http://www.stf.jus.br/)\\>. Acesso em: 8/10/2010.\n","dic":"DHBPR"}
