{"title":"LAMARTINE, Juvenal","cargoss":["Deputado federal","Senador","Governador de estado ou do Distrito Federal"],"cargos_esp":[0,0,0],"datas_ini":[1906,1927,1928],"datas_fim":[1926,1927,1930],"estados":["RN",0,"RN"],"autor":["Renato Amado Peixoto"],"content":"**LAMARTINE, Juvenal**\n\n\\* dep. fed. RN 1906-1926; sen.1927; gov. RN 1928-1930.\n\n*Juvenal Lamartine de Faria* nasceu na fazenda Rolinha em Serra Negra do\nNorte (RN) no dia 9 de agosto de 1874, filho de Clementino Monteiro de\nFaria e de Paulina Monteiro de Faria. Seu pai foi chefe político de\nSerra Negra do Norte, presidente da intendência municipal e deputado\nestadual de 1907 a 1909.\n\nEm 1880 casou-se com Silvina Bezerra de Araújo Galvão, filha de Silvino\nBezerra, chefe político de Acari (RN), na região do Seridó, que foi\nvárias vezes deputado provincial e depois vice-governador no governo\nPedro Velho de Albuquerque Maranhão, líder do Partido Republicano do Rio\nGrande do Norte. Em 1897 formou-se bacharel em ciências jurídicas e\nsociais pela Faculdade do Recife, e em 1898 Pedro Velho nomeou-o\nvice-diretor do Colégio Ateneu e chamou-o para ser redator do jornal *A\nRepública*, órgão oficial do partido. Nesse mesmo ano foi nomeado juiz\nde direito de Acari, cargo que exerceria até 1905.\n\nEm 1903, indicado por Pedro Velho, foi eleito vice-governador do Rio\nGrande do Norte na chapa do Partido Republicano Federal liderada por\nAugusto Tavares de Lira. Empossado o novo governo em 25 de março de\n1904, renunciou à vice-governança em 1905 e foi eleito deputado federal.\nA partir de então seria reeleito continuamente até 1926. Na Câmara, fez\nparte das Comissões de Marinha e Guerra, de Constituição e Justiça, de\nInstrução Pública, e das comissões especiais do Código Civil. Na\nComissão de Constituição e Justiça destacou-se pela defesa do voto\nfeminino. Fez parte também da Mesa da Câmara. Em 1926 foi o principal\nresponsável pela introdução do voto feminino na Constituição do estado\ndo Rio Grande do Norte, oito anos antes de a Constituição Federal de\n1934 ter incorporado o mesmo direito.\n\nEnquanto exercia o mandato de deputado federal, em 1923, junto com seu\nprimo José Augusto Bezerra de Medeiros, neto de José Bernardo de\nMedeiros, conseguiu reorganizar a chamada “facção do Seridó” do Partido\nRepublicano. Apoiados pelo presidente da República Artur Bernardes,\nconseguiram destituir Ferreira Chaves da chefia do partido e indicar\nJosé Augusto para governador do Rio Grande do Norte na sucessão de\nAntônio de Sousa (1920-1924). A partir da nova composição política, foi\nescolhido e eleito senador em 1927. No Senado fez parte da Comissão de\nDiplomacia e Tratados.\n\nAinda em 1927 foi eleito governador do Rio Grande do Norte, sucessão de\nJosé Augusto (1924-1928), sendo empossado em 1^o^ de janeiro de 1928.\nEmbora sobre seu governo incidissem sobremaneira os efeitos dos juros do\nempréstimo contratado em 1909 pelo então governador Alberto Maranhão,\nsua administração foi bastante dinâmica. Procurou incentivar a pecuária,\nbem como diversificar e aumentar a produção agrícola do estado por meio\nda introdução de novos cultivos e de incentivos ao crédito. Procurou\nabrir novas estradas em colaboração com a Inspetoria Federal de Obras\nContra as Secas (IFOCS) de modo a melhor escoar os produtos agrícolas.\nCuidou também da educação rural, construindo 49 escolas no interior e\nsubvencionando escolas particulares, o que fez duplicar as matrículas no\nestado, segundo Itamar de Souza.\n\nPor outro lado, percebendo sua liderança ser ameaçada tanto pelos\npartidários de João Café Filho quanto pela Aliança Liberal, passou a\nperseguir duramente a oposição, expulsando e mandando agredir seus\nadversários, bem como manipulando os resultados eleitorais. Segundo Café\nFilho, teria mandado queimar as atas das eleições municipais de 1928 em\nNatal, compondo “a bico de pena” toda a Câmara apenas com seus\ncorreligionários. Com a vitória da Revolução de 1930, seguiu em exílio\npara a Europa, transitando entre a França e a Alemanha, de onde só\nvoltaria em 1933. Nesse mesmo ano, durante a interventoria de Mário\nLeopoldo Pereira da Câmara, seu filho Otávio de Lamartine Faria foi\nmorto pela polícia militar do estado.\n\nEm 1945 organizou a União Democrática Nacional (UDN) no Grande do Norte,\nsendo escolhido seu presidente de honra. Foi também candidato a senador\nconstituinte, mas saiu derrotado. Foi colaborador do jornal *A Tribuna\nda Imprensa* e, tendo sido um dos fundadores do Instituto Histórico e\nGeográfico do Rio Grande do Norte (IHGRN), colaborou também com a\nrevista do Instituto.\n\nFaleceu em Natal em 18 de abril de 1956.\n\nDe seu casamento com Silvina Bezerra de Araújo Galvão, teve dez filhos.\nNote-se que Dinarte Mariz passou a pertencer ao mesmo grupo familiar\napós o casamento de suas duas irmãs com dois irmãos de Juvenal. Dinarte\nMariz foi senador pelo Rio Grande do Norte de 1955 a 1956, governador do\nestado de 1956 a 1961 e novamente senador de 1963 a 1984. Juvenal e\nDinarte eram tios de Morton Mariz Faria, e tios-avós da filha deste,\nVilma de Faria, que foi deputada constituinte pelo Rio Grande do Norte\nem 1987-1988, prefeita de Natal em 1989-1993 e 1997-2002, e governadora\ndo Rio Grande do Norte a partir de 2003.\n\nJuvenal Lamartine publicou *O meu governo* (1933). Como obras póstumas,\nforam publicadas *Patriarcas seridoenses* (1965) e *Velhos costumes do\nmeu sertão* (1965).\n\nRenato Amado Peixoto\n\n**FONTES:** CASCUDO, L. *Governo*; FARIA, J. *Meu governo*; MAIA, A.\n*Parlamentares*; MEDEIROS, J. *Rio Grande do Norte*; SENADO. *Anais*\n(29/11/1974); SOUZA, I. *República*; SPINELLI, J. *Oligarquia.*\n","ref":"**FONTES:** CASCUDO, L. *Governo*; FARIA, J. *Meu governo*; MAIA, A.\n*Parlamentares*; MEDEIROS, J. *Rio Grande do Norte*; SENADO. *Anais*\n(29/11/1974); SOUZA, I. *República*; SPINELLI, J. *Oligarquia.*\n","dic":"DHBPR"}
