{"title":"LEAL, Simeão","cargoss":["Deputado federal"],"cargos_esp":[0],"datas_ini":[1905],"datas_fim":[1923],"estados":["PB"],"autor":["Raimundo Helio Lopes"],"content":"**LEAL, Simeão**\n\n\\*dep. fed. PB 1905-1923.\n\n*Antônio Simeão dos Santos Leal* nasceu na cidade de Areia (PB) no dia\n11 de maio de 1874, filho de Francisco Simeão Soares da Costa e de Maria\nLaurinda da Malta Leal.\n\nFormou-se pela Faculdade de Direito do Recife em 1895. Depois de formado\nfoi nomeado promotor público na cidade natal e permaneceu no cargo de\nmaio de 1895 a junho de 1900. Durante o governo de José Peregrino de\nAraújo (1900-1904), foi nomeado chefe de polícia da Paraíba. Durante sua\ngestão, ajudou o presidente do estado a perseguir os inimigos e foi\nacusado de envolvimento no empastelamento do jornal *O Comércio*, de\npropriedade do importante jornalista paraibano Artur Aquiles, que fazia\nforte oposição a José Peregrino de Araújo.\n\nNas eleições de 1904 foi eleito primeiro-vice-presidente do estado na\nchapa liderada por Álvaro Lopes Machado, que já fora presidente estadual\n(1892-1896) e senador pela Paraíba (1897-1904). Em 1905 renunciou,\ncedendo o lugar ao padre Valfredo Leal, que também já havia sido\npresidente estadual (1896) e deputado federal (1903-1904), e era então\nsenador pela Paraíba (1905). Nesse momento de reconfiguração na política\nparaibana, concorreu à vaga aberta na Câmara com a renúncia de Valfredo\nLeal, que abrira mão de seu mandato de deputado para assumir uma cadeira\nno Senado. Foi assim eleito deputado federal em julho de 1905 e\nsucessivamente reeleito até o ano de 1923. Durante esse período foi, de\n1905 a 1914, primeiro-secretário da Mesa Diretora da Câmara.\n\nFoi também juiz de direito da comarca de Borborema (PB), provedor da\nSanta Casa de Misericórdia da Paraíba e sócio do Instituto Histórico e\nGeográfico Paraibano.\n\nRaimundo Helio Lopes\n\n**FONTES:** ABRANCHES, J. *Governos*; CÂM. DEP. *Deputados brasileiros*;\nINST. HIST. GEO. PARAIBANO. Disponível em: \\<www.ihgp.net\\>. Acesso em:\n9/12/2010; MARIZ, C. *Apanhados*.\n","ref":"**FONTES:** ABRANCHES, J. *Governos*; CÂM. DEP. *Deputados brasileiros*;\nINST. HIST. GEO. PARAIBANO. Disponível em: \\<www.ihgp.net\\>. Acesso em:\n9/12/2010; MARIZ, C. *Apanhados*.\n","dic":"DHBPR"}
