{"title":"LEÃO, Luís Cedro Carneiro","cargoss":["Deputado federal","Constituinte"],"cargos_esp":[0,0],"datas_ini":[1921,1934],"datas_fim":[1923,1934],"estados":["PE",0],"autor":[0],"content":"**LEÃO, Luís Cedro Carneiro**\n\n\\*dep. fed. PE 1921-1923; const. 1934.\n\n*Luís Cedro Carneiro Leão* nasceu no engenho do Cedro, no município do\nCabo (PE), no dia 5 de outubro de 1885, filho de Pedro Carneiro Leão e\nde Minervina Carneiro Leão. Descendia de grandes proprietários rurais.\n\nFez os estudos preparatórios no Ginásio Pernambucano, bacharelando-se em\n1908 pela Faculdade de Direito do Recife.\n\nAgricultor e advogado, viveu alheio às lutas políticas até que, após\nrecusar por diversas vezes convite para assumir o cargo de procurador\ngeral de seu estado, aceitou a indicação do governador José Bezerra\nCavalcanti para integrar a chapa de candidatos a deputado federal para a\nlegislatura de 1921 a 1923. Eleito, assumiu o mandato em maio de 1921 e\nno período seguinte participou da Reação Republicana, movimento que\npromoveu a candidatura de Nilo Peçanha à presidência da República em\noposição à de Artur Bernardes, afinal eleito em março de 1922.\n\nEm 1929-1930 participou da campanha da Aliança Liberal através de\ncolaborações para o jornal *Diário da Manhã.* Após a Revolução de 1930,\nelegeu-se, em maio de 1933, deputado à Assembleia Nacional Constituinte\nna legenda do Partido Social Democrático (PSD) de seu estado. Empossado\nem novembro do mesmo ano, participou dos trabalhos constituintes e, com\na promulgação da nova Carta em 16 de julho de 1934 e a eleição do\npresidente da República no dia seguinte, teve o mandato prorrogado,\nassim como os demais deputados, até maio de 1935.\n\nJornalista e escritor, trabalhou no *Diário* *de Pernambuco,* no *Jornal\nPequeno* e em outros órgãos pernambucanos, bem como na revista\n*Ilustração Brasileira*, do Rio de Janeiro.\n\nCasou-se com Júlia Solano Carneiro Leão.\n\n**FONTES:**ASSEMB. NAC. CONST. 1934. *Anais* (1); CÂM. DEP. *Deputados*;\nCâm. Dep. seus componentes; GODINHO, V. *Constituintes*; Ilustração\nBrasileira (11/1922).\n","ref":"**FONTES:**ASSEMB. NAC. CONST. 1934. *Anais* (1); CÂM. DEP. *Deputados*;\nCâm. Dep. seus componentes; GODINHO, V. *Constituintes*; Ilustração\nBrasileira (11/1922).\n","dic":"DHBPR"}
