{"title":"AMÉRICO, Pedro","cargoss":["Constituinte","Deputado federal"],"cargos_esp":[0,0],"datas_ini":[1891,1891],"datas_fim":[1891,1893],"estados":[0,"PB"],"autor":["Raimundo Helio Lopes"],"content":"**AMÉRICO, Pedro**\n\n\\* pintor; const. 1891; dep. fed.PB 1891-1893.\n\n*Pedro Américo de Figueiredo e Melo* nasceu emAreias (PB) no dia 23 de\nabrilde 1843, filho de Daniel Eduardo deFigueiredo Melo e de Feliciana\nCirne deFigueiredo.\n\nEm 1851, a convite do entãopresidente da província da Paraíba\nAntônioCoelho de Sá Albuquerque (1851-1853), onaturalista francês\nLouis-Jacques Brunet chefiouuma expedição que objetivava explorar\neretratar a geografia, a fauna e aflora da província. No ano seguinte,\naochegarem à cidade de Areias, Brunet eo alemão Bindseil, desenhista da\nexpedição,conheceram Pedro Américo, então com noveanos, reconheceram seu\ntalento para odesenho e o convidaram para integrar acomitiva que por\ncerca de 20 mesespercorreu toda a Paraíba e parte dePernambuco, Ceará,\nRio Grande do Nortee Piauí.\n\nEm 1854, depois dessa experiênciae com a ajuda do presidente\ndaprovíncia, Pedro Américo mudou-se para acidade do Rio de Janeiro,\nentão capitaldo Império, onde ingressou na AcademiaImperial de Belas\nArtes e no ColégioPedro II para dar prosseguimento a seusestudos.\nSegundo Lilia Moritz Schwartz, “oimperador conheceu Pedro Américo quando\nesteera aluno do Colégio Pedro II epintava às escondidas um quadro\nseu”.Depois desse encontro, o imperadortornou-se seu protetor. Durante\nos anosem que esteve na Academia, Pedro Américoproduziu estudos e\ndesenhos, destacando-se umasérie de pinturas religiosas pedidas\npelobispo Félix Maria. Nesse período, atéo ano de 1857, conquistou 15\nmedalhasde ouro e de prata, além de diplomase premiações.\n\nEm 1859 foi para a França,financiado pelo governo imperial. Seu\nfinanciamentofoi obtido graças ao imperador Pedro II,já que naquele ano\nnão houve otradicional prêmio de viagem à Europadestinado aos melhores\nalunos da Academiade Belas Artes. Matriculou-se na Escolade Belas Artes\nde Paris, no Institutode Física e na Faculdade de Ciênciasda Sorbonne.\nEstudou com Claude Bernard,Despretz, Saint-Claire Deville, Leon\nCogniet,Horace Handrin, Horace Vernet e Jean DominiqueIngres, e durante\nesses estudos aproximouas reflexões sobre a arte com aciência, marca\nconstante em suas pinturase textos. Na Escola de Belas Artesde Paris,\nfoi agraciado com o Prêmiode Primeira Classe, e na Sorbonne recebeuo\ndiploma de doutor em ciências naturais.Ainda durante sua estada na\nEuropa, viajoupela Inglaterra, Bélgica e Itália.\n\nRetornou ao Brasil em 1864 etornou-se professor, por concurso, da\ncadeirade desenho da Academia Imperial de BelasArtes. Segundo Ronaldo\nVainfas, “lecionou porpouco tempo, granjeando inimigos na Cortee o\ndesafeto do próprio imperador, quereprovara sua tela *A carioca*, de\n1864,por julgá-la licenciosa”. Retornou à Europaem 1865 e aí aprofundou\nseus estudosartísticos e filosóficos. Em 1866 viajouà Argélia,\ninfluenciado pelo exotismo quemarcava as artes francesas, e em\n1869doutorou-se em ciências na Universidade deBruxelas, onde defendeu\ntese sobre a liberdadedo método e do espírito de sistemano estudo da\nnatureza, intitulada *La science et les systèmes: questions d*’*historie\net de philosophie*. Em1869 casou-se com Carlota de Araújo\nPorto-Alegre,filha de Araújo Porto-Alegre, o barãode Santo Ângelo,\nmembro do Instituo Históricoe Geográfico Brasileiro, ex-diretor da\nAcademiaImperial de Belas Artes e cônsul doBrasil em Portugal.\n\nEm 1870 voltou ao Brasil, assumiua cadeira de estética na Academia\nImperialde Belas Artes e iniciou uma fasecélebre em sua carreira.\nDestacam-se nesseperíodo as obras *Batalha do campo* (1871), *D. Pedro\nna abertura da Assembleia Geral* (1872) e *Batalha do Avaí* (1877).Este\núltimo quadro foi pintado em Florença,na Itália, e contou com o apoioda\nmunicipalidade local, que destinou umabiblioteca para a execução da\nobra. Suaapresentação contou com a presença doimperador Pedro II e\nrecebeu grande destaquena imprensa europeia. Quando o quadrochegou ao\nBrasil e foi aberto àexposição, Pedro Américo foi acusado deplagiar o\nquadro de Gustave Doré, *Batalha de Monte Belo*. Segundo Ronaldo\nVainfas, “Américonão assinou o quadro e, para refutaras críticas,\npublicou, em francês, o *Discurso sobre o plágio na literatura e na\narte*, no ano de 1880”.A despeito de toda a controvérsia, aexposição\nteve grande público e a rendafoi doada aos órfãos do Rio deJaneiro e aos\nflagelados da seca nordestinade 1877.\n\nEntre os anos de 1878 e1885 morou na Itália, onde produziu *David e\nAbzag* (1879), *Judite e Olofernes* (1880), uma novaversão da obra *A\ncarioca* (1882), *Joanna d*’*Arc* (1883) e *Moisés e Jocabed* (1884). Em\n1885, devolta ao Rio de Janeiro, retomou seucargo de professor da\nAcademia Imperialde Belas Artes, mas dois anos depoisvoltou à Itália.\nAli pintou a famosaobra *Independência ou morte* (1888), sob encomenda\ndogoverno de São Paulo, retratando o gritodo Ipiranga de Pedro I.\n\nDepois que o marechal Deodoro daFonseca, sustentado por setores do\nExércitoe por civis, depôs o gabinete deministros do Império, chefiado\npelo viscondede Ouro Preto, e instalou o regimerepublicano em 15 de\nnovembro de 1889,foi eleito deputado federal constituinte peloestado da\nParaíba. Assumiu sua cadeiraem 15 de novembro de 1890, quandofoi\ninstalada a Assembleia Nacional Constituinteno Rio de Janeiro, agora\nDistrito Federal,e depois de promulgada a nova Cartaconstitucional, em\n24 de fevereiro de1891, passou a cumprir em junho seguinteo mandato\nordinário na Câmara dos Deputadosaté dezembro de 1893. Em agosto de1891,\nassinou a proposta de emenda àConstituição que daria uma pensão ao\nex-imperadorPedro II, que foi rejeitada pelo antigomonarca.\n\nEm 1893 produziu uma de suasobras mais famosas, *Tiradentes\nesquartejado*, consideradauma alegoria à jovem República.\n\nFoi condecorado como grão cavaleiroda Ordem Romana do Santo Sepulcro,\ncavaleiroda Ordem da Coroa da Alemanha edignitário da Ordem da Rosa do\nBrasil.\n\nFaleceu em Florença no dia 7de outubro de 1905. Seus despojos\nforamtrasladados para o Brasil e sepultadosno cemitério de Areias, sua\ncidade natal.Seu irmão Aurélio de Figueiredo tambémfoi pintor de grande\nprestígio.\n\nPublicou *La réforme de l*’*Académie des Beaux-Arts de Paris* (1862), *A\nluz zodiacal* (1869), *Memória sobre a conjugação da espirogira quinina*\n(1896), *Discursos na Academia de Belas-Artes do Rio de Janeiro* (1882),\n*O holocausto* (1882), *Amor de esposo* (1882),*Estudos filosóficos\nsobre as belas-artes na antiguidade* (1882), *De l*’*enseignement libre\ndes sciences naturelles* (1882), *O brado do Ipiranga* (1888),*O plágio*\n(1890), *Discursos parlamentares* (1892), *Curso de estética, professado\nna Academia de Belas-Artes do Rio de Janeiro*, *O foragido* (1900),*Na\ncidade eterna* (1901).\n\nRaimundo Helio Lopes\n\n**FONTES:** ABRANCHES, J. *Governos*;ACAD. PARAIBANA DE LETRAS.\nDisponível em: \\<www.aplpb.com.br\\>.Acesso em: 26/1/2011; AYÁLA, W.\n*Dicionário*;CARVALHO, J. *D. Pedro II*; Dicionário das artesvisuais na\nParaíba. Disponível em:\n\\<www.artesvisuaisparaiba.com.br/histxix.php\\>.Acesso em: 26/1/2011;\nREIS JÚNIOR, J.*História*; SCHWARCZ, L. *Barbas*; VAINFAS,\nR.*Dicionário.*\n","ref":"**FONTES:** ABRANCHES, J. *Governos*;ACAD. PARAIBANA DE LETRAS.\nDisponível em: \\<www.aplpb.com.br\\>.Acesso em: 26/1/2011; AYÁLA, W.\n*Dicionário*;CARVALHO, J. *D. Pedro II*; Dicionário das artesvisuais na\nParaíba. Disponível em:\n\\<www.artesvisuaisparaiba.com.br/histxix.php\\>.Acesso em: 26/1/2011;\nREIS JÚNIOR, J.*História*; SCHWARCZ, L. *Barbas*; VAINFAS,\nR.*Dicionário.*\n","dic":"DHBPR"}
