{"title":"LEON, Adolfo Pereira Burgos Ponce de","cargoss":["Deputado federal"],"cargos_esp":[0],"datas_ini":[1894],"datas_fim":[1898],"estados":["RJ"],"autor":["Luciana Pinheiro"],"content":"**LEON, Adolfo Pereira Burgos Ponce de**\n\n\\*dep. fed. RJ 1894-1898.\n\n*Adolfo Pereira Burgos Ponce de Leon* nasceu em Pernambuco, filho de\nAntônio de Burgos Ponce de Leon e de Teresa Adelaide de Siqueira\nCavalcanti Ponce de Leon.\n\nBacharel em ciências jurídicas e sociais, transferiu-se para Barra\nMansa, na província do Rio de Janeiro, onde se estabeleceu como advogado\ne foi juiz municipal e de órfãos. Filiado ao Partido Conservador, em\n1887 foi eleito vereador em Barra Mansa. Após a proclamação da República\n(15/11/1889), continuou a ser eleito vereador e exerceu mandato até\n1892, tendo sido presidente da Câmara Municipal. Foi também deputado\nestadual e secretário do Interior e Justiça.\n\nEm 1894 foi eleito deputado federal pelo estado do Rio de Janeiro. Tomou\nposse na Câmara dos Deputados em maio do mesmo ano, com mandato até\ndezembro de 1896. Reeleito para a legislatura seguinte, exerceu o\nmandato até meados de 1898, quando renunciou e foi substituído por João\nFrancisco Barcelos.\n\nEra casado com Fabrízia Carneiro de Campos, filha de Joaquim José\nCarneiro dos Santos, o visconde de Caravelas. Seu filho Luís Carneiro de\nCampos Ponce de Leon foi vereador em Barra Mansa, deputado estadual e\ndeputado federal pelo Rio de Janeiro de 1915 a 1917.\n\nLuciana Pinheiro\n\n**FONTES:** ABRANCHES, J. *Governos* (v.1); CÂM. DEP. *Deputados\nbrasileiros* (p.9); Histórico Genealógico. Disponível em:\n\\<www.genealogy.com/\\>. Acesso em: 16/11/2010*.*\n","ref":"**FONTES:** ABRANCHES, J. *Governos* (v.1); CÂM. DEP. *Deputados\nbrasileiros* (p.9); Histórico Genealógico. Disponível em:\n\\<www.genealogy.com/\\>. Acesso em: 16/11/2010*.*\n","dic":"DHBPR"}
