{"title":"LESSA, Otávio Rocha de Lemos","cargoss":["Deputado federal"],"cargos_esp":[0],"datas_ini":[1906],"datas_fim":[1908],"estados":["AL"],"autor":[0],"content":"**LESSA, Otávio Rocha de Lemos**\n\n\\*dep. fed. AL 1906-1908.\n\n*Otávio Rocha de Lemos Lessa* nasce em Coruripe (AL) no dia 15 de\ndezembro de 1881, filho de Macário das Chagas Rocha Lessa. Seu pai foi\nsenador por Alagoas de 1905 a 1906 e governador interino do estado.\n\nFormado pela Faculdade de Direito do Recife, foi promotor público em sua\ncidade natal de 1900 a 1902 e secretário do Interior de Alagoas de 1902\na 1905, no governo Joaquim Vieira Malta. A partir de 1904 foi também\nprofessor de história geral no Liceu de Maceió.\n\nEleito deputado federal por Alagoas, exerceu o mandato na Câmara dos\nDeputados, no Rio de Janeiro, então Distrito Federal, de maio de 1906 a\ndezembro de 1908.\n\nReynaldo de Barros\n\n**FONTES:** BARROS, F. *A B C das Alagoas*; CÂM. DEP. *Deputados\nbrasileiros*.\n","ref":"**FONTES:** BARROS, F. *A B C das Alagoas*; CÂM. DEP. *Deputados\nbrasileiros*.\n","dic":"DHBPR"}
