{"title":"LESSA, Pedro","cargoss":["Ministro do Supremo Tribunal Federal"],"cargos_esp":[0],"datas_ini":[1907],"datas_fim":[1921],"estados":[0],"autor":[0],"content":"**LESSA, Pedro**\n\n\\*magistrado; min. STF 1907-1921.\n\n*Pedro Augusto Carneiro Lessa* nasceu na cidade do Serro, província de\nMinas Gerais, no dia 25 de setembro de 1859, filho do coronel José Pedro\nLessa e de Francisca Amélia Carneiro Lessa.\n\nApós concluir o curso de humanidades na província natal, matriculou-se\nna Faculdade de Direito de São Paulo. No segundo ano do curso dirigiu\ncom Alberto Sales e Alcides Lima a folha republicana *O Federalista*.\nColou grau de bacharel em ciências jurídicas e sociais em 30 de outubro\nde 1883 e apresentou tese de doutorado em 13 de maio de 1884. Ainda em\n1883 foi nomeado secretário da Relação de São Paulo. Em 1887 fez\nconcurso para lente substituto da Faculdade de Direito, obteve o\nprimeiro lugar, mas não foi nomeado pela princesa Isabel e a ela enviou\nprotesto contra a preterição. Em outro concurso em 1888 obteve o cargo\nde lente substituto, e em 1891 foi promovido a professor catedrático.\nNesse mesmo ano foi chefe de polícia da cidade de São Paulo.\n\nEleito deputado à Assembleia Constituinte paulista em 1891, participou\nativamente da elaboração da Constituição do estado, mas não se\ninteressou em ingressar na política. A sua atividade profissional foi\ndedicada exclusivamente ao magistério superior – lecionando a cadeira de\nfilosofia do direito – e à advocacia, uma das bancas mais prestigiosas\ndo estado de São Paulo. Além de filosofia e direito, tinha interesse por\nliteratura, história e ciências sociais. Em 1900 publicou “É a história\numa ciência?”, inicialmente prefácio da tradução da *História da\ncivilização* de Buckle, e em 1905 “O determinismo psíquico e a\nimputabilidade e responsabilidade criminais”, memória apresentada ao\nCongresso Científico Latino-Americano.\n\nNomeado ministro do Supremo Tribunal Federal (STF) na vaga de Lúcio de\nMendonça, por decreto de 29 de outubro de 1907 do presidente Afonso\nPena, tomou posse a 3 de dezembro, sendo-lhe prestada homenagem de\ndespedida por iniciativa do Centro XI de Agosto. Foi um defensor da\nmissão do STF como verdadeiro poder, e os seus votos, vencedores ou\nvencidos, constituíram sempre pronunciamentos importantes. Desempenhou\npapel relevante no alargamento da aplicação do habeas corpus,\nconstituindo a “doutrina brasileira do habeas corpus”. Para Castro\nRebelo, foi ele no Brasil “o juiz que melhor serviu à liberdade,\nservindo à justiça”.\n\nFoi eleito para a Academia Brasileira de Letras em 1910, na vaga de\nLúcio de Mendonça. Em 1912 tornou-se membro do Instituto Histórico e\nGeográfico Brasileiro. Participou intensamente do movimento nacionalista\ne presidiu a Liga da Defesa Nacional.\n\nFoi casado com Paula de Aguiar.\n\nFaleceu no Rio de Janeiro, então Distrito Federal, no dia 25 de julho de\n1921.\n\nEntre outros trabalhos, publicou, em 1909, *Dissertações e polêmicas*,\nreunindo estudos jurídicos anteriores ao ingresso no STF, e *Discursos*;\nem 1912, *Estudos de filosofia do direito*; em 1915, *Do Poder\nJudiciário*; e em 1916, *Discursos e conferências*, com conferências\nsobre João Francisco Lisboa e Francisco Adolfo de Varnhagen. Em 1925 foi\npublicado o volume póstumo *Reforma constitucional*, reunindo trabalhos\nsobre o assunto.\n\nAlberto Venâncio Filho\n\n**FONTES:** LAGO, L. *Supremo*; REALE, M. *Pedro Lessa*; REBELLO, E.\n*Pedro Lessa*; RODRIGUES, L. *História*; SUPR. TRIB. FED. Memória\nJurisprudencial (2007); VAMPRÉ, S. *Memórias.*\n","ref":"**FONTES:** LAGO, L. *Supremo*; REALE, M. *Pedro Lessa*; REBELLO, E.\n*Pedro Lessa*; RODRIGUES, L. *História*; SUPR. TRIB. FED. Memória\nJurisprudencial (2007); VAMPRÉ, S. *Memórias.*\n","dic":"DHBPR"}
