{"title":"LEVY, Artur","cargoss":["Revolucionário ou revoltoso","Presidente de associação ou confederação de empregados ou empregadores"],"cargos_esp":[0,"Petrobras"],"datas_ini":[1922,1954],"datas_fim":[1922,1956],"estados":[0,0],"autor":[0],"content":"**LEVY, Artur**\n\n\\*militar; rev. 1922; pres. Petrobras 1954-1956.\n\n*Artur Levy* nasceu em Cuiabá no dia 8 de outubro de 1902, filho de\nHenrique Levy e de Joselina Castelo Levy.\n\nCursou o Colégio Militar de Barbacena (MG) de 1913 a 1919, ingressando\nno ano seguinte na Escola Militar do Realengo, no Rio de Janeiro, então\nDistrito Federal.\n\nComo aluno da Escola Militar, participou da Revolta de 5 de Julho de\n1922, movimento que deu origem ao ciclo de revoltas tenentistas da\ndécada de 1920. Deflagrado no Rio de Janeiro e em Mato Grosso em\nprotesto contra a eleição de Artur Bernardes para a presidência da\nRepública e as punições impostas aos militares pelo governo Epitácio\nPessoa com a prisão do marechal Hermes da Fonseca e fechamento do Clube\nMilitar, o movimento foi prontamente debelado pelas forças federais.\n\nEm consequência de sua participação no levante, Artur Levy foi afastado\nda Escola Militar. Prosseguiu seus estudos de engenharia no Instituto\nEletrotécnico e Mecânico de Itajubá (MG) entre 1923 e 1925 e, diplomado\nengenheiro, retornou nesse último ano a Mato Grosso, onde trabalhou na\nconstrução da primeira usina hidrelétrica do rio da Casca. Durante a\nexecução da obra foi encarregado da construção da linha de transmissão\nda usina até Cuiabá e da subestação daquela cidade. De 1925 a 1926\nchefiou a construção da rede de distribuição de energia elétrica e água\nda capital mato-grossense, chefiando no ano seguinte as obras destinadas\nà construção da estação de bombas para o abastecimento de água de sua\ncidade natal. Exerceu ainda a função de inspetor de luz e água de\nCuiabá, tendo unificado todos os serviços de água e luz da cidade\ndurante o período de 1926 a 1928. Nos dois anos seguintes dedicou-se à\nmedição de terras no sul de Mato Grosso.\n\nCom a vitória da Revolução de 1930, foi anistiado e retornou à vida\nmilitar no posto de primeiro-tenente. Ainda em 1930 fez um estágio de\natualização e revisão do curso de engenharia no 1^o^ Batalhão de\nEngenharia (1^o^ BE), com sede no Rio de Janeiro. De 1931 ao ano\nseguinte serviu no 6^o^ BE, sediado em Aquidauana (MT), onde exerceu\ninterinamente as funções de comandante e subcomandante. Comandou também\no destacamento da unidade encarregada da construção das rodovias Corumbá\n(MS)-Porto Suarez (Bolívia) e Porto Murtinho (MS)-Bela Vista (MS).\n\nServia no Destacamento Néri da Fonseca, em Porto Murtinho, quando, em\njulho de 1932, eclodiu a Revolução Constitucionalista de São Paulo,\nmovimento que se estendeu ao território do atual estado de Mato Grosso\ndo Sul. Participou da repressão aos rebeldes nos combates de Porto\nEsperança, Porto Murtinho e São Roque e tomou parte ainda em todos os\nreconhecimentos aéreos na região, bem como nas operações fluviais a\nbordo dos navios *Oiapoque* e *Pernambuco,* da flotilha de Ladário (MS).\nFoi promovido a capitão no mesmo mês em que eclodiu a revolução, afinal\ndebelada em outubro.\n\nEm 1933 fez o curso da Escola de Aperfeiçoamento de Oficiais, servindo\nno ano seguinte e em 1936 como instrutor de oficiais na Escola de Armas.\nDe 1937 a 1939 fez o curso da Escola de Estado-Maior, sendo promovido a\nmajor nesse ínterim, em maio de 1938. Após concluir o curso, estagiou\ndurante o ano de 1940 no Estado-Maior do Exército (EME) e no\nestado-maior regional da 3^a^ Região Militar (3^a^ RM), sediada no Rio\nGrande do Sul.\n\nTransferido ainda em 1940 para o 2^o^ Batalhão Ferroviário em Rio Negro\n(PR), representou seu batalhão no III Congresso de Engenharia e\nLegislação Ferroviária, realizado em Belo Horizonte. Foi subcomandante,\nprimeiro-engenheiro e fiscal administrativo do batalhão, e foi promovido\na tenente-coronel em dezembro de 1941. Durante a construção do\nTronco-Principal-Sul pelo 2^o^ Batalhão Ferroviário, foi subchefe de uma\nparte da obra, a estrada de ferro Rio Negro-Caxias (RS). Removido em\nseguida para o estado-maior-regional da 5^a^ RM, com sede em Curitiba,\nfoi chefe de seção. Em 1942 chefiou o Serviço de Engenharia da 5^a^ RM,\ntendo participado de todas as obras militares, desapropriações e\ntombamentos de fortificações nos estados do Paraná e de Santa Catarina.\nChefiou também em 1942 o curso de engenharia do Curso Regional de\nAperfeiçoamento de Oficiais (CRAO/5^a^ RM), dirigindo ainda o Círculo\nMilitar de Curitiba.\n\nDe volta ao Rio de Janeiro em 1942, foi designado para servir no 1^o^\nBE, logo depois transformado em 7^o^ BE e transferido para Petrolina\n(PE), que passou a ser sua sede provisória. Como comandante da unidade,\nchefiou a construção da rodovia Petrolina-Leopoldina (Parnamirim), do\nporto fluvial de Petrolina e da rede ferroviária do campo de instrução\nde Engenho Aldeia (PR). Com a declaração de guerra do governo brasileiro\naos países do Eixo em agosto de 1942 – já em plena Segunda Guerra\nMundial – e a criação da Força Expedicionária Brasileira (FEB), para\ncombater ao lado dos países aliados na Europa, o 7^o^ BE, pertencente à\n7^a^ Divisão de Infantaria (7^a^ DI), iniciou os preparativos para a\ncampanha. Em 1944, Artur Levy estagiou durante três meses em Fort\nBelvoir, nos EUA, como parte do treinamento para a campanha, mas não\nchegou a seguir para o teatro de operações na Itália.\n\nDe volta ao Brasil após o treinamento, serviu no EME como adjunto da\n4^a^ Seção no período de 1944 a 1945, frequentando nessa época o curso\nde transportes do Exército. Foi também representante do EME no Plano\nRodoviário Nacional, que levou à constituição da comissão responsável\npela elaboração da Lei n^o^ 8.463, de 27 de dezembro de 1945 – Lei\nJoppert –, a qual possibilitou o desenvolvimento da rede rodoviária\nbrasileira.\n\nNo CNP\n\nAinda em 1945 foi nomeado representante do Ministério da Guerra junto ao\nConselho Nacional do Petróleo (CNP). No ano seguinte foi transferido\npara a Diretoria de Engenharia como chefe da 2^a^ Divisão, que passara\npor uma reestruturação, cabendo-lhe a direção de todas as comissões\nmilitares da rede, anteriormente sob responsabilidade do EME. Promovido\na coronel em março de 1946, chefiou também a Comissão de Estudos do\nOleoduto Santos-São Paulo-Campinas, do CNP, entre 1946 e 1947.\n\nEm fevereiro desse último ano foi nomeado pelo presidente da República,\nEurico Dutra (1946-1951), membro de uma comissão especial encarregada de\nelaborar um anteprojeto de legislação sobre o petróleo. A comissão era\npresidida por Odilon Braga e dela também faziam parte os engenheiros\nGlycon de Paiva, Avelino Inácio de Oliveira, Antônio José Alves de Sousa\ne Rui de Lima e Silva. O objetivo básico do anteprojeto era dispor sobre\na concessão do direito de exploração do petróleo a empresas estrangeiras\ne regular a formação de empresas brasileiras para a exploração de\nrefinarias, levando em conta o artigo 153 da Constituição de 1946 e as\ndiretrizes já traçadas pelo CNP.\n\nO texto enviado ao Congresso Nacional em fevereiro de 1948 determinava\ncomo disposições básicas que as jazidas de petróleo continuariam no\ndomínio privado da União como bens inalienáveis e imprescindíveis; a\npesquisa e lavra dessas jazidas seriam declaradas de utilidade pública e\nda exclusiva competência da União, o mesmo ocorrendo com a refinação do\npetróleo nacional ou importado e seu transporte. O ponto central do\nanteprojeto referia-se à execução dessas operações pela União, sendo\nconsideradas duas possibilidades: por administração direta ou por via de\nsubordinações e concessões a serem exploradas por uma empresa privada, o\nque assegurava um direito real de posse, administração e exploração\neconômica pelo capital privado. Houve grande resistência no Congresso, e\nos debates em torno do anteprojeto chegaram a um impasse quanto ao\ncontrole estatal sobre os trustes, ao grau de participação estrangeira,\nà necessidade de atração de capitais estrangeiros para o país e aos\nprazos das concessões de jazidas. Em consequência, o anteprojeto foi\narquivado.\n\nArtur Levy permaneceu na Diretoria de Engenharia até 1948, quando foi\nlicenciado do Exército e posto à disposição do Ministério da Viação.\nAinda em 1948 tornou-se membro da comissão dos recursos do Brasil no\nsetor de combustíveis na Missão Abbink, nome pelo qual ficou conhecida a\nComissão Brasileiro-Americana de Estudos Econômicos. Constituída nesse\nano por um grupo de técnicos norte-americanos enviados ao Brasil sob a\ndireção de John Abbink e por um grupo de técnicos brasileiros chefiados\npor Otávio Gouveia de Bulhões, a comissão mista tinha como objetivo\nanalisar os fatores que tendiam a promover ou a retardar o\ndesenvolvimento econômico brasileiro e retomava o princípio da\ncooperação econômica estabelecido pela Missão Cooke em 1942. O resultado\ndos trabalhos da comissão foram publicados em fevereiro de 1949,\ntornando-se conhecidos como *Relatório Abbink.*\n\nTambém em 1948, Artur Levy assumiu a chefia dos trabalhos de construção\nda rede de oleodutos Santos-São Paulo, da estrada de ferro\nSantos-Jundiaí, função que exerceu até 1952. No ano seguinte passou a\nintegrar a Comissão de Localização da Refinaria de 45 mil barris\ndiários, criada pelo CNP e depois transformada em Comissão de\nLocalização da Refinaria de Cubatão (SP), na Baixada Santista. Designado\nassessor da Comissão Interestadual da Bacia Paraná-Uruguai em 1952, no\nano seguinte assumiu a presidência da Comissão de Estudos da Rede de\nOleodutos Nacionais do CNP, que iniciou seus trabalhos pelo oleoduto\nParanaguá (PR)-Curitiba. Foi também chefe da Comissão de Estudos da Rede\nMilitar de Oleodutos, do Ministério da Guerra, e, no período de 1953 a\n1954, presidiu a I Comissão Especial das Indústrias Petroquímicas, órgão\ndo CNP, chefiando ainda as obras de construção da fábrica de\nfertilizantes de Cubatão.\n\nPresidente da Petrobras\n\nCom a criação da Petrobras em outubro de 1953, Artur Levy foi escolhido\npelo então presidente da República, Getúlio Vargas, para integrar a\nprimeira diretoria da empresa. No ano seguinte tornou-se membro da\nComissão de Incorporação de Bens da empresa, ocasião em que deixou a\nfunção de representante do Ministério da Guerra junto ao CNP.\n\nEm setembro de 1954 substituiu Juraci Magalhães na presidência da\nPetrobras. Durante sua gestão, inaugurou a Refinaria Presidente\nBernardes e a fábrica de asfalto, ambas em Cubatão, e a usina\nexperimental de xisto, em Tremembé (SP). Firmou também o contrato de\nmontagem de uma fábrica de fertilizantes, descobriu petróleo na bacia\nAmazônica, iniciou um esquema de reserva de dólares para os programas da\nPetrobras e intensificou as pesquisas de petróleo em território\nbrasileiro. Em 1955 integrou a Comissão de Implantação das Indústrias\nPesadas e presidiu a Associação dos Refinadores Nacionais, entidade que\ncongregava os refinadores de petróleo particulares e estatais. Deixou a\npresidência da Petrobras em 1^o^ de fevereiro do ano seguinte, quando\nfoi substituído por Janari Nunes. Ainda em 1956 fez o curso da Escola\nSuperior de Guerra (ESG), ao término do qual apresentou a monografia\n*Combustíveis, um grave problema nacional.*\n\nAo retornar ao Exército após o período de licença, serviu na Diretoria\nde Comunicações do Exército, do Departamento Geral de Material Bélico,\ncomo chefe de gabinete, tendo ocupado interinamente o cargo de diretor\npor diversas vezes entre 1957 e 1958. Nesse último ano frequentou o\ncurso de treinamento em problemas de desenvolvimento da Comissão\nEconômica para a América Latina (CEPAL), passando para a reserva em\ndezembro de 1958 com a patente de general de divisão. Chefiou a\nconstrução da Refinaria Duque de Caxias, em Duque de Caxias (RJ), a\npartir de 1959, e foi presidente da Casa de Mato Grosso de 1960 a 1962.\nCom a entrada em operação da Refinaria Duque de Caxias em 1961,\ntornou-se seu superintendente, atuando ainda como diretor-técnico da\nEmpresa de Construção e Pavimentação de 1963 a 1964.\n\nEm 1964 foi chefe de gabinete da presidência da Petrobras, ocupada então\npelo general Osvino Ferreira Alves. Apoiou o movimento político-militar\nde março desse ano, que derrubou o governo de João Goulart (1961-1964),\ne de 1965 a 1967 foi superintendente geral do Departamento Industrial da\nPetrobras. Em 1967 participou do VII Congresso Mundial do Petróleo,\nrealizado na cidade do México, como chefe da delegação da Petrobras.\n\nPresidente da Associação Brasileira de Normas Técnicas (ABNT), cuja\nestrutura dinamizou de 1967 a 1969, frequentou em agosto do ano seguinte\no curso de atualização doutrinária da ESG. No campo da iniciativa\nprivada foi diretor da Eletrossiderúrgica (Sibra), em Aratu (BA), de\n1968 a 1973, da Estamparia Metalúrgica Vitória, no Rio de Janeiro, de\n1968 a 1971, e da Betanil Indústrias Químicas, em Alcântara, no\nmunicípio de São Gonçalo (RJ), a partir de 1973, tendo atuado ainda como\nassistente-técnico da Empreendimentos Técnicos de Estradas (Etec) a\npartir de 1974.\n\nTornou-se membro da Associação dos Diplomados da Escola Superior de\nGuerra (ADESG), do Instituto Brasileiro de Petróleo (IBP), do Clube de\nEngenharia e do Clube Militar.\n\nArtur Levy faleceu no Rio de Janeiro no dia 18 de novembro de 1993.\n\nEra casado com Dulce Alves Baeta Levy.\n\nAlém de artigos e conferências sobre a questão energética publicados nas\nrevistas *Petróleo, Boletim da Associação de* *Engenheiros* e *Boletim\nda ADESG,* publicou *Energia não se importa* (1962). O arquivo de Artur\nLevy encontra-se depositado no Centro de Pesquisa e Documentação de\nHistória Contemporânea do Brasil (Cpdoc) da Fundação Getulio Vargas.\n\n**FONTES:**BULHÕES, O*. Margem*; COHN, G. *Petróleo*;CORRESP. PETROBRAS;\nENTREV. BIOG.; *Globo* (23/11/1993); MIN. GUERRA. *Almanaque* (1958);\nREIS, A. *Bibliografia nac.*\n","ref":"**FONTES:**BULHÕES, O*. Margem*; COHN, G. *Petróleo*;CORRESP. PETROBRAS;\nENTREV. BIOG.; *Globo* (23/11/1993); MIN. GUERRA. *Almanaque* (1958);\nREIS, A. *Bibliografia nac.*\n","dic":"DHBPR"}
