{"title":"LIMA FILHO, Francisco Alves de","cargoss":["Deputado federal"],"cargos_esp":[0],"datas_ini":[1912],"datas_fim":[1914],"estados":["PB"],"autor":["Raimundo Helio Lopes"],"content":"**LIMA FILHO, Francisco Alves de**\n\n\\*dep. fed. PB 1912-1914.\n\n*Francisco Alves de Lima Filho* nasceu em Catolé do Rocha (PB).\n\nFormou-se em medicina e depois de formado clinicou na cidade de Paraíba\ndo Norte, posteriormente chamada João Pessoa. Tornou-se também professor\nde francês no Liceu Paraibano.\n\nDepois que o marechal Deodoro da Fonseca, sustentado por setores do\nExército e por civis, depôs o gabinete de ministros do Império chefiado\npelo visconde de Ouro Preto e instalou o regime republicano em 15 de\nnovembro de 1889, aderiu à República e foi eleito deputado estadual na\nParaíba por uma legislatura. Em 1912 foi eleito deputado federal e\nocupou uma cadeira na Câmara dos Deputados, na cidade do Rio de Janeiro,\nentão Distrito Federal, de maio desse ano a dezembro de 1914.\n\nRaimundo Helio Lopes\n\n**FONTES:** ABRANCHES, J. *Governos*; CÂM. DEP. *Deputados brasileiros.*\n","ref":"**FONTES:** ABRANCHES, J. *Governos*; CÂM. DEP. *Deputados brasileiros.*\n","dic":"DHBPR"}
