{"title":"LIMA, Antônio Austregésilo Rodrigues de","cargoss":["Deputado federal"],"cargos_esp":[0],"datas_ini":[1920],"datas_fim":[1930],"estados":["PE"],"autor":["Marcos Paulo Torres"],"content":"**LIMA, Antônio Austregésilo Rodrigues de**\n\n\\*dep. fed. PE 1920-1930.\n\n*Antônio Austregésilo Rodrigues de Lima* nasceu na cidade do Recife no\ndia 21 de abril de 1876, filho do advogado José Austregésilo Rodrigues\nLima e de Maria Adelaide Feitosa Lima.\n\nFoi educado no Colégio das Artes, em Recife, onde conheceu Tobias\nBarreto e participou precocemente do movimento literário e artístico da\nEscola de Recife. Ainda com 16 anos mudou-se para o Rio de Janeiro,\nentão Distrito Federal, ingressou na Faculdade de Medicina e formou-se\nem 1899 com a tese *Estudo clínico do delírio*. Especializou-se no\nestudo das doenças mentais. Indicado por Miguel Couto, catedrático da\nFaculdade de Medicina, em 1901 tornou-se diretor do laboratório e, um\nano após, médico da Santa Casa de Misericórdia.\n\nDurante o governo de Rodrigues Alves (1902-1906), integrou a equipe do\nprofessor Juliano Moreira, um dos pioneiros da psiquiatria no Brasil,\nque assumira a Diretoria de Assistência aos Alienados. Em 1909 foi\nnomeado pela Congregação da Faculdade de Medicina professor substituto\nde clínica médica, patologia interna e clínica propedêutica. Em 1912 foi\nnomeado professor da recém-fundada cátedra de neurologia. Eleito para a\ncadeira n^o^ 30 da Academia Brasileira de Letras em 29 de agosto de\n1914, sucedendo a Heráclito Graça, tomou posse no dia 3 de dezembro,\nrecebido pelo Acadêmico Mário de Alencar.\n\nIngressou na política em 1920, ao ser eleito, em eleição suplementar,\ndeputado federal por Pernambuco. Reeleito em 1921, 1924, 1927 e 1930,\nteve o mandato interrompido em outubro desse ano em decorrência da\nvitória da revolução que levou Getúlio Vargas ao poder e dissolveu os\nórgãos legislativos do país.\n\nFoi também professor, ensaísta, criador da primeira Escola de\nNeurologia, fundador dos Arquivos Brasileiros de Medicina e dos Arquivos\nBrasileiros de Neurologia e de Psiquiatria, e representou o Brasil em\nvários congressos internacionais de Neurologia. Além disso, foi membro e\npresidente da Academia Nacional de Medicina e da Sociedade Brasileira de\nNeurologia; membro da Academia das Ciências de Lisboa, da Academia de\nMedicina de Paris e da Academia de Medicina de Nova Iorque, professor\nhonorário da Faculdade de Medicina de Pernambuco e professor emérito da\nUniversidade do Brasil.\n\nFaleceu na cidade do Rio de Janeiro, então estado da Guanabara, no dia\n23 de dezembro de 1960.\n\nSobre medicina e psicologia, além de sua tese, publicou *Clínica\nneurológica* (3 v., 1917, 1923 e 1945); *Clínica médica* (1917); *As\npsiconeuroses* (1933); *Novas aquisições no domínio da neurologia*\n(1934); *L’Analyse mentale dans les psychonevroses* (1936); *Patologia\nmental* (1948) e *Psicologia e psicoterapia* (1951). Publicou também\n*Manchas* (prosa poética, 1898); *Palavras acadêmicas* (discursos,\n1916),*Vidas desgraçadas* (romance, 1950), e os seguintes ensaios:\n*Pequenos males* (1917), *O mal da vida* (1920), *Preceitos e conceitos*\n(1921), *Educação da alma* (1921), *Pessimismo risonho* (1922), *Livro\ndos sentimentos* (1923), *Meditações* (1923), *Perfil da mulher\nbrasileira* (1924), *As forças curativas do espírito* (1926), *O meu e o\nteu, forças psicológicas* (1932), *Caracteres humanos* (1933), *Lições\nda vida* (1934), *Disciplina espiritual* (1934), *Ascensão espiritual*\n(1934), *Viagem interior* (1935), *Pensar, sentir e atuar* (1935),\n*Estátuas harmoniosas* (1940), *Perfis de loucos* (estudos psicológicos,\n1943), *Afeto e inteligência* (1943), *Moral biológica* (1945) e *Da\nbiótica humana* (1953). Suas obras completas foram publicadas, em 10\nvolumes, pela Editora Guanabara (1945-1947).\n\nMarcos Paulo Torres\n\n**FONTES:**ACAD. BRAS. LET. Disponível em:\n\\<www.academia.org.br/abl/cgi/cgilua.exe/sys/start.htm?infoid=148&sid=288\\>.\nAcesso em: 1/11/2011; CÂM. DEP. *Deputados brasileiros*; FUND. JOAQUIM\nNABUCO.\n","ref":"**FONTES:**ACAD. BRAS. LET. Disponível em:\n\\<www.academia.org.br/abl/cgi/cgilua.exe/sys/start.htm?infoid=148&sid=288\\>.\nAcesso em: 1/11/2011; CÂM. DEP. *Deputados brasileiros*; FUND. JOAQUIM\nNABUCO.\n","dic":"DHBPR"}
