{"title":"LIMA, Antônio Rodrigues","cargoss":["Deputado Geral","Deputado federal","Deputado federal"],"cargos_esp":[0,0,0],"datas_ini":[1881,1909,1894],"datas_fim":[1884,1920,1905],"estados":["BA","BA","BA"],"autor":["Raimundo Helio Lopes"],"content":"**LIMA, Antônio Rodrigues**\n\n\\*dep. geral BA 1881-1884; dep. fed. BA 1894-1905 e 1909-1920.\n\n*Antônio Rodrigues Lima* nasceu na cidade de Paraguassu (BA) no ano de\n1854.\n\nFormou-se pela Faculdade de Medicina da Bahia em 1875 e depois de\nformado viajou para a Europa, onde aperfeiçoou seus estudos. De volta ao\nBrasil, foi eleito deputado provincial na Bahia. Em 1881 foi eleito\ndeputado geral e assumiu sua cadeira na Assembleia Geral, no Rio de\nJaneiro, então capital do Império. Apoiou o gabinete liberal de Manuel\nPinto de Sousa Dantas e encerrou seu mandato em 1884. Ainda durante o\nImpério, defendeu a causa abolicionista.\n\nDepois da proclamação da República em 15 de novembro de 1889, aderiu ao\nnovo regime. Em 1894 foi eleito deputado federal pela Bahia e em maio\nassumiu sua cadeira na Câmara dos Deputados, no Rio de Janeiro, agora\nDistrito Federal. Em 1896 conseguiu sua transferência como professor da\nFaculdade de Medicina da Bahia para a Faculdade de Medicina do Rio de\nJaneiro. Foi reeleito em 1897 e em 1900, e nesse último ano participou\ndo 4^o^ Congresso Médico Nacional, realizado durante a comemoração do\n4^o^ Centenário do Descobrimento do Brasil. Durante o evento, foi\nconcebida a ideia da construção de uma maternidade escola na cidade do\nRio de Janeiro. Além de Antônio Rodrigues Lima, contribuíram para a\nconcretização desse projeto os médicos Werneck de Almeida, Gonçalves\nPenas, Vieira Souto e Azevedo Júnior. No parlamento, liderou uma\ncampanha para que o Congresso Nacional ajudasse financeiramente o\nprojeto, o que resultou na compra da sua futura sede, na rua das\nLaranjeiras, em 1901. Em 1903 conseguiu mais um mandato como deputado\nfederal e, em 18 de janeiro de ano seguinte, foi considerado o fundador\ne nomeado primeiro diretor da Maternidade Escola do Rio de Janeiro, que\nposteriormente seria incorporada à Faculdade de Medicina da Universidade\nFederal do Rio de Janeiro. Em dezembro de 1905 concluiu seu mandato, ao\nfinal da legislatura.\n\nVoltou a ser eleito deputado federal pelo estado da Bahia em 1909, o\nmesmo ocorrendo em 1912, 1915 e 1917. Permaneceu na Câmara dos Deputados\naté dezembro de 1920, quando concluiu seu último mandato. Durante sua\nvida parlamentar legislou sobre higiene pública e fez parte das\ncomissões de Instrução e Saúde Pública. Foi também membro da Academia\nNacional de Medicina.\n\nFaleceu na cidade do Rio de Janeiro em 1923.\n\nPublicou diversos trabalhos na área médica, com destaque para *Haverá\ndiferença entre septicemia, a infecção purulenta e a febre puerperal?*\n(1875) e *Prenhez ectópica* (1914).\n\nRaimundo Helio Lopes\n\n**FONTES:** ABRANCHES, J. *Governos*; CÂM. DEP. *Deputados brasileiros*;\n*Grande encic. Delta Larousse*; MIN. EDU. Disponível em:\n\\<http://portal.mec.gov.br/sesu/arquivos/pdf/humat.pdf\\>. Acesso em:\n16/2/2011.\n","ref":"**FONTES:** ABRANCHES, J. *Governos*; CÂM. DEP. *Deputados brasileiros*;\n*Grande encic. Delta Larousse*; MIN. EDU. Disponível em:\n\\<http://portal.mec.gov.br/sesu/arquivos/pdf/humat.pdf\\>. Acesso em:\n16/2/2011.\n","dic":"DHBPR"}
