{"title":"LIMA, Álvaro Moreira de Barros Oliveira","cargoss":["Governador de estado ou do Distrito Federal"],"cargos_esp":[0],"datas_ini":[1890],"datas_fim":[1891],"estados":["PI"],"autor":["Raimundo Helio Lopes"],"content":"**LIMA, Álvaro Moreira de Barros Oliveira**\n\n\\*gov. PI 1890-1891.\n\n*Álvaro Moreira de Barros Oliveira Lima* foi bacharel em direito e\ngovernador do Piauí.\n\nDepois que o governador Gregório Taumaturgo de Azevedo deixou o governo\ndo Piauí em 4 de junho de 1890, o cargo foi ocupado por Joaquim Nogueira\nParanaguá, até 23 de agosto, Gabino Besouro, até 19 de outubro, e João\nda Cruz e Santos, até 27 de dezembro. Nessa data tomou posse Álvaro\nMoreira de Barros Oliveira Lima, que reuniu a Assembleia Constituinte\nestadual, promulgou a primeira Constituição republicana piauiense e\norganizou a eleição indireta para governador. Em 28 de maio de 1891\ntransmitiu o cargo ao governador eleito Gabriel Luís Ferreira.\n\nRaimundo Helio Lopes\n\n**FONTES:** BASTOS, C. *Dicionário*; GONÇALVES, W. *Grande*; REGO NETO,\nH. *Fatos.*\n","ref":"**FONTES:** BASTOS, C. *Dicionário*; GONÇALVES, W. *Grande*; REGO NETO,\nH. *Fatos.*\n","dic":"DHBPR"}
