{"title":"LIMA, Carlos Jorge Calheiros de","cargoss":["Membro de junta governativa","Deputado federal"],"cargos_esp":[0,0],"datas_ini":[1891,1894],"datas_fim":[1891,1896],"estados":["AL","AL"],"autor":[0],"content":"**LIMA, Carlos Jorge Calheiros de**\n\n\\* militar; junta gov. AL 1891; dep. fed. AL 1894-1896.\n\n*Carlos Jorge Calheiros de Lima* nasceu no dia 16 de julho de 1860.\n\nSentou praça no Exército em novembro de 1878, cursou a Escola Militar,\ntornou-se alferes aluno em 1883 e foi promovido a segundo-tenente em\n1884. Ocupava o posto de capitão quando integrou a junta governativa que\nassumiu o governo de Alagoas em 23 de novembro de 1891, em substituição\na Manuel José de Araújo Góis. A junta, composta ainda pelo\ntenente-coronel José Correia Teles, Manuel Ribeiro de Meneses e Jacinto\nde Assunção Pais de Mendonça Castelo Branco, ficou no poder até o dia 28\nseguinte, quando passou o governo alagoano a Manuel Gomes Ribeiro,\npresidente do Senado estadual.\n\nEleito deputado federal por Alagoas em 1894, assumiu sua cadeira na\nCâmara dos Deputados, no Rio de Janeiro, então Distrito Federal, em maio\ndesse ano e nela permaneceu até dezembro de 1896, quando se encerraram a\nlegislatura e o seu mandato.\n\nFoi promovido a coronel em 1910.\n\nReynaldo de Barros\n\n**FONTES:** BARROS, F. *A B C das Alagoas*; CÂM. DEP. *Deputados\nbrasileiros*.\n","ref":"**FONTES:** BARROS, F. *A B C das Alagoas*; CÂM. DEP. *Deputados\nbrasileiros*.\n","dic":"DHBPR"}
