{"title":"LIMA, Francisco Cornélio da Fonseca","cargoss":["Deputado federal"],"cargos_esp":[0],"datas_ini":[1894],"datas_fim":[1908],"estados":["PE"],"autor":["Raimundo Helio Lopes"],"content":"**LIMA, Francisco Cornélio da Fonseca**\n\n\\*dep. fed. PE 1894-1908.\n\n*Francisco Cornélio da Fonseca Lima* nasceu em Pernambuco.\n\nFormou-se pela Faculdade de Direito do Recife e em seguida foi nomeado\npromotor público na cidade de Palmares (PE). Iniciou sua vida política\nainda durante o Império, quando se filiou ao Partido Conservador. Por\nessa agremiação foi eleito diversas vezes deputado provincial.\n\nDepois da proclamação da República (15/11/1889), foi eleito deputado\nestadual em Pernambuco e fez parte da Assembleia responsável pela\nelaboração da primeira Constituição republicana do estado. Em 1894 foi\neleito deputado federal. Assumiu sua cadeira na Câmara dos Deputados, no\nRio de Janeiro, então Distrito Federal, em maio desse ano, e foi\nsucessivamente reeleito. Em várias ocasiões, foi relator na Câmara do\norçamento do Ministério do Interior. Exerceu o mandato até 5 de outubro\nde 1908, quando faleceu na cidade do Rio de Janeiro.\n\nFoi também prefeito da cidade de Água Preta (PE). No campo jornalístico,\ncolaborou com o periódico pernambucano *A Cidade*.\n\nRaimundo Helio Lopes\n\n**FONTES:** ABRANCHES, J. *Governos*; CÂM. DEP. *Deputados brasileiros*;\n*Grande encic. Delta Larousse*; NASCIMENTO, L. *História* (v.3).\n","ref":"**FONTES:** ABRANCHES, J. *Governos*; CÂM. DEP. *Deputados brasileiros*;\n*Grande encic. Delta Larousse*; NASCIMENTO, L. *História* (v.3).\n","dic":"DHBPR"}
