{"title":"LINS, Leopoldo Marinho de Paula","cargoss":["Deputado federal"],"cargos_esp":[0],"datas_ini":[1909],"datas_fim":[1911],"estados":["PE"],"autor":["Raimundo Helio Lopes"],"content":"**LINS, Leopoldo Marinho de Paula**\n\n\\*dep. fed. PE 1909-1911.\n\n*Leopoldo Marinho de Paula Lins* nasceu em Barreiros (PE) no dia 13 de\ndezembro de 1857, filho de José Lins de Barros e de Blandícia de Paula\nLins.\n\nIngressou na Faculdade de Direito do Recife em 1877, formou-se em 1881 e\nem dezembro desse ano foi nomeado promotor público em sua cidade natal.\nExerceu o cargo até 2 de agosto de 1883, quando foi transferido para o\nestado do Rio Grande do Sul como juiz municipal dos termos reunidos das\ncidades de Conceição do Arroio e Torres. Depois de uma rápida atividade\nno município de São João de Montenegro (RS), foi nomeado juiz municipal\nde Santarém (PA) em julho de 1885, mas não aceitou o cargo. Voltou para\nPernambuco e tornou-se promotor público na cidade de Palmares em 1891.\n\nIniciou sua vida política ainda durante o Império, quando ingressou nas\nfileiras do Partido Liberal. Depois da proclamação da República\n(15/11/1889), apoiou o governo do presidente Floriano Peixoto\n(1891-1894). Em 1892 foi eleito prefeito do município de Palmares, e em\n1893, deputado estadual. Em 1897 foi eleito senador estadual em\nPernambuco e em 1899 foi nomeado pelo governador Segismundo Antônio\nGonçalves chefe de polícia do estado.\n\nEm 1909 foi eleito deputado federal. Ocupou uma cadeira na Câmara dos\nDeputados, no Rio de Janeiro, então Distrito Federal, até o ano de 1911,\nquando renunciou ao mandato devido à derrota que Francisco de Assis Rosa\ne Silva, seu líder político, sofreu em Pernambuco com a chegada ao poder\nde Dantas Barreto. Assumiu sua vaga Esmeraldino Olímpio Torres Bandeira.\n\nRaimundo Helio Lopes\n\n**FONTES:** ABRANCHES, J. *Governos*; CÂM. DEP. *Deputados brasileiros*;\nFERREIRA, P. *Pinto.*\n","ref":"**FONTES:** ABRANCHES, J. *Governos*; CÂM. DEP. *Deputados brasileiros*;\nFERREIRA, P. *Pinto.*\n","dic":"DHBPR"}
