{"title":"LIRA, Antônio Alves Pereira de","cargoss":["Constituinte","Deputado federal"],"cargos_esp":[0,0],"datas_ini":[1891,1891],"datas_fim":[1891,1911],"estados":[0,"PE"],"autor":["Raimundo Helio Lopes"],"content":"**LIRA, Antônio Alves Pereira de**\n\n\\*const. 1891; dep. fed. PE 1891-1911.\n\n*Antônio Alves Pereira de Lira* nasceu em Timbaúba (PE) no dia 9 de\nsetembro de 1857.\n\nFormou-se em medicina em 1884 e nesse mesmo ano iniciou-se na política\nelegendo-se deputado provincial em Pernambuco. Exerceu o mandato até\ndezembro de 1885.\n\nDepois da proclamação da República (15/11/1889), foi eleito deputado\nconstituinte por Pernambuco. Promulgada a Constituição em 24 de\nfevereiro de 1891, em junho seguinte passou a exercer o mandato\nordinário até 1893. Foi sucessivamente reeleito de 1894 até 1909, e\ndurante essas legislaturas fez parte da Comissão de Diplomacia da Câmara\ndos Deputados.\n\nNo campo jornalístico, colaborou com o *Diário de Pernambuco*.\n\nRaimundo Helio Lopes\n\n**FONTES:** ABRANCHES, J. *Governos*; CÂM. DEP. *Deputados brasileiros*;\nNASCIMENTO, L. *História* (v.1).\n","ref":"**FONTES:** ABRANCHES, J. *Governos*; CÂM. DEP. *Deputados brasileiros*;\nNASCIMENTO, L. *História* (v.1).\n","dic":"DHBPR"}
