{"title":"LOPES, Aristarco Xavier","cargoss":["Deputado Geral","Deputado federal"],"cargos_esp":[0,0],"datas_ini":[1888,1912],"datas_fim":[1889,1920],"estados":["PE","PE"],"autor":["Raimundo Helio Lopes"],"content":"**LOPES, Aristarco Xavier**\n\n\\*dep. geral PE 1888-1889; dep. fed. PE 1912-1920.\n\n*Aristarco Xavier Lopes* nasceu em Água Preta (PE) no dia 28 de dezembro\nde 1854.\n\nFormou-se em direito e foi promotor de justiça em Recife de 1888 a 1892.\nIniciou a vida política ainda durante o Império, quando foi eleito\ndeputado provincial em Pernambuco na legenda do Partido Conservador. Em\n1888 elegeu-se deputado geral por Pernambuco e exerceu o mandato até a\nproclamação da República (15/11/1889).\n\nNo regime republicano, foi eleito senador estadual em 1892 e exerceu o\nmandato até 1894. Eleito deputado federal por Pernambuco em 1912 e\nreeleito 1915 e 1918, participou da Comissão de Diplomacia e Tratados da\nCâmara dos Deputados, onde permaneceu até dezembro de 1920.\n\nNo campo jornalístico, colaborou com os periódicos pernambucanos *O\nTempo* e *A Ordem*.\n\nRaimundo Helio Lopes\n\n**FONTES:** ABRANCHES, J. *Governos*; CÂM. DEP. *Deputados brasileiros*;\nNASCIMENTO, L. *História* (v.2, v.3).\n","ref":"**FONTES:** ABRANCHES, J. *Governos*; CÂM. DEP. *Deputados brasileiros*;\nNASCIMENTO, L. *História* (v.2, v.3).\n","dic":"DHBPR"}
