{"title":"ANDRADE, Jáder de","cargoss":["Deputado federal"],"cargos_esp":[0],"datas_ini":[1921],"datas_fim":[1923],"estados":["PE"],"autor":["Raimundo Helio Lopes"],"content":"**ANDRADE, Jáder de**\n\n\\* dep. fed. PE 1921-1923.\n\n*Jáder de Andrade* iniciou sua vida profissionalno jornalismo\npernambucano colaborando com diversosjornais do estado, nos quais\nescreviaversos satíricos.\n\nQuando o *Diário de Pernambuco* foi compradopela família de Carlos\nBenigno Pereirade Lira Filho, em janeiro de 1913,foi contratado como\nredator-secretário do jornal.Além dessa empresa, trabalhou em\ndiversosoutros periódicos de Pernambuco, como *A Serra*,*A Pimenta*, *A\nLanceta*, *Noites de Natal* e *Estrelas de junho*.\n\nEm março de 1921 foi eleitodeputado federal por Pernambuco. Assumiu\nsuacadeira na Câmara dos Deputados, no Riode Janeiro, então Distrito\nFederal, emmaio seguinte e exerceu o mandato atédezembro de 1923. Voltou\nentão ao jornalismoe tornou-se editor do *Diário de Pernambuco*.\n\nDurante o governo de Estácio Coimbraem Pernambuco (1926-1930) assumiu,\nem 1929,a Secretaria de Viação e Obras Públicase, em 1930, a Secretaria\nde Agricultura.\n\nFaleceu em Recife em 1^o^de outubro de 1931.\n\nRaimundo Helio Lopes\n\n**FONTES:** CÂM. DEP. *Deputados brasileiros*;LEVINE, R. *Velha usina*;\nNASCIMENTO, L. *História* (v.1, 7).\n","ref":"**FONTES:** CÂM. DEP. *Deputados brasileiros*;LEVINE, R. *Velha usina*;\nNASCIMENTO, L. *História* (v.1, 7).\n","dic":"DHBPR"}
