{"title":"LOREIRO, Trigo de","cargoss":["min STJ","Ministro do Supremo Tribunal Federal","Procurador-geral da República"],"cargos_esp":[0,0,0],"datas_ini":[1890,1891,1894],"datas_fim":[1890,1894,1894],"estados":[0,0,0],"autor":["Eduardo Junqueira"],"content":"**LOREIRO, Trigo de**\n\n\\*magistrado; min. STJ 1890; min. STF 1891-1894; proc. geral Rep. 1894.\n\n*Ovídio Fernandes Trigo de Loureiro*, nasceu em 1828, filho de Lourenço\nTrigo de Loureiro e de Umbelina Luísa Fernandes da Silva. Seu pai foi\ndesembargador, com exercício nas Relações de Porto Alegre e da Corte.\n\nFormou-se em ciências jurídicas e sociais na Faculdade de Direito de São\nPaulo, recebendo o grau de bacharel em 1848. Em 1850 foi nomeado juiz\nmunicipal e de órfãos do termo de Cachoeira, na província de São Pedro\ndo Rio Grande. Nomeado juiz de direito da comarca de Caçapava, na mesma\nprovíncia, em setembro de 1861, foi removido para comarca de Bagé em\n1866. Exerceu a seguir suas funções na magistratura em comarcas da\nprovíncia de São Paulo. Em 1875 foi nomeado desembargador da Relação de\nCuiabá. Removido em 1877 para a Relação de Ouro Preto, chegou à Relação\nda Corte em maio de 1882. Fez parte do Conselho Supremo Militar de\nJustiça, corte de última instância, cuja competência era o julgamento de\ncrimes militares no Império, sendo nomeado juiz togado em janeiro de\n1887, em substituição a Viriato Bandeira Duarte.\n\nChefe de polícia na Corte em 1888, em junho de 1890 foi nomeado ministro\ndo Supremo Tribunal de Justiça, durante o curto período em que esta\ncorte, oriunda do Império, funcionou na República, preenchendo a vaga\naberta em decorrência do falecimento do ministro Luís José de Sampaio.\nCom a criação do Supremo Tribunal Federal (STF) em outubro de 1890, a\npartir do modelo da Suprema Corte norte-americana, foi nomeado um de\nseus ministros. Tomou posse em fevereiro do ano seguinte, quando da\ninstalação do novo órgão. Foi procurador geral da República a partir de\n1894, quando o ocupante do cargo era escolhido entre os membros do STF.\nFoi aposentado por decreto ainda nesse mesmo ano.\n\nFaleceu na cidade do Rio de Janeiro, então Distrito Federal, em 26 de\nnovembro de 1904.\n\nEduardo Junqueira\n\n**FONTES:** MATTOSO, P. *Supremo Tribunal*; MELLO FILHO, J. *Notas*;\nRODRIGUES, L. *História*; SUP. TRIB. FED. Disponível em:\n\\<www.stf.jus.br/portal/ministros\\>.\n","ref":"**FONTES:** MATTOSO, P. *Supremo Tribunal*; MELLO FILHO, J. *Notas*;\nRODRIGUES, L. *História*; SUP. TRIB. FED. Disponível em:\n\\<www.stf.jus.br/portal/ministros\\>.\n","dic":"DHBPR"}
