{"title":"LORETO, Galdino Lins de Barros","cargoss":["Membro de junta governativa","Deputado federal"],"cargos_esp":[0,0],"datas_ini":[1891,1894],"datas_fim":[1892,1905],"estados":["ES","ES"],"autor":["Nara Saletto","Fernando Achiamé"],"content":"**LORETO, Galdino Lins de Barros**\n\n\\*junta gov. ES 1891-1892; dep. fed. ES 1894-1905.\n\n*Galdino Teixeira Lins de Barros Loreto* nasceu em Águas Belas (PE) a 18\nde fevereiro de 1866, filho de Galdino Eleutério Teixeira de Barros\nLoreto e de Luísa Lins de Albuquerque Barros.\n\nDe família de recursos modestos, seu pai, professor, faleceu antes que\ncompletasse sua formação em Recife, o que o obrigou a trabalhar para\ncustear seus estudos. Cursou o Liceu de Artes e Ofícios, à noite. Ao se\nformar, tornou-se professor do ensino particular e começou a colaborar\nem órgãos literários. Fez o curso de direito, no qual se diplomou em\n1888, enquanto continuava sua atividade no magistério, lecionando no\nliceu no qual estudara. Em abril de 1889 tornou-se funcionário do\nTesouro da Província de Pernambuco, mas permaneceu poucos meses no\ncargo.\n\nNo início da República transferiu-se para o Espírito Santo, onde ocupou\no cargo de promotor e depois juiz municipal em Guarapari, e também\norganizou uma escola noturna. Criada a Justiça Federal em outubro de\n1890, foi nomeado juiz substituto no Espírito Santo. Em dezembro de\n1891, após a renúncia de Deodoro da Fonseca à presidência da República e\na posse do vice-presidente Floriano Peixoto, o que provocou a\ndestituição dos governos estaduais ligados ao marechal Deodoro, entre os\nquais o do barão de Monjardim no Espírito Santo, Galdino foi indicado\nmembro da junta governativa instalada no estado, ao lado do coronel\nInácio Henrique de Gouveia e de Graciano dos Santos Neves. Sua escolha\ncertamente foi determinada por políticos federais, pois não há qualquer\nregistro, inclusive na imprensa, de sua participação na política\nestadual até aquele momento.\n\nA junta governativa, instalada a 19 de dezembro de 1891, dissolveu a\nAssembleia estadual, restabeleceu como Constituição provisória o projeto\nelaborado no governo de Afonso Cláudio, e convocou e organizou eleições\npara uma nova Constituinte. Dissolveu também o Tribunal de Justiça e\nreorganizou-o, sob a presidência do ex-governador Afonso Cláudio. A\nAssembleia Constituinte foi instalada em 9 de abril de 1892, votou a\nConstituição com base no projeto de Afonso Cláudio, e elegeu José de\nMelo Carvalho Muniz Freire presidente do estado, tendo como\nsegundo-vice-presidente Galdino Loreto. Ao assumir o governo a 3 de maio\nde 1892, Muniz Freire nomeou Galdino chefe de polícia, cargo equivalente\nao atual secretário de Segurança Pública.\n\nNas eleições federais de 1894, Galdino foi incluído na chapa de\ncandidatos à Câmara de Deputados do Partido Republicano Construtor\n(PRC). Daí em diante, integrou todas as chapas governistas até sua\nmorte. Foi eleito para todas as legislaturas, exceto em 1906, quando foi\nreconhecida, pela Comissão de Verificação de Poderes da Câmara dos\nDeputados, uma chapa dissidente do PRC encabeçada por Muniz Freire, e\nnão a do então presidente estadual Henrique Coutinho. Em 1909 foi\nnovamente eleito, mas faleceu antes do início da nova legislatura. No\nintervalo, ou seja, entre 1906 e 1909, foi deputado estadual. Quando o\nPRC se dividiu entre Muniz Freire e o presidente Henrique Coutinho em\n1905, ficou ao lado deste e teve uma atuação importante em seu favor\ntanto na Câmara de Deputados quanto, sobretudo, na Assembleia estadual,\nbem como publicando artigos na imprensa do Rio de Janeiro. Em 1908, no\ngoverno de Jerônimo Monteiro, chefiou uma comissão encarregada de\nassinar um convênio com o estado de Minas Gerais, segundo o qual a\nquestão de limites entre os dois estados, na região do alto vale do rio\nItapemirim, seria resolvida por arbitramento.\n\nSimultaneamente à carreira política, exerceu o jornalismo e o\nmagistério, tendo sido professor catedrático da Escola Normal do\nEspírito Santo.\n\nFaleceu no Rio de Janeiro no dia 11 de abril de 1909.\n\nPublicou *Devaneios literários* em 1886.\n\nNara Saletto/Fernando Achiamé\n\n**FONTES:** ASSEMB. LEGIS. ES. *Anais* (1906); *Comércio do Espírito\nSanto* (1896-1897, 1908-1909); *Estado do Espírito Santo* (1891-1904);\n*Jornal Oficial* (1906-1907); PEREIRA, A. *Homens.*\n","ref":"**FONTES:** ASSEMB. LEGIS. ES. *Anais* (1906); *Comércio do Espírito\nSanto* (1896-1897, 1908-1909); *Estado do Espírito Santo* (1891-1904);\n*Jornal Oficial* (1906-1907); PEREIRA, A. *Homens.*\n","dic":"DHBPR"}
