{"title":"LUCENA, Henrique Pereira de","cargoss":["Presidente de associação ou confederação de empregados ou empregadores","Presidente de associação ou confederação de empregados ou empregadores","Presidente de associação ou confederação de empregados ou empregadores","Presidente de associação ou confederação de empregados ou empregadores","Deputado Geral","Governador de estado ou do Distrito Federal","Ministro da Justiça","Ministro da Agricultura","Ministro da Fazenda","Ministro do Supremo Tribunal Federal"],"cargos_esp":[0,0,0,0,0,0,0,0,0,0],"datas_ini":[1872,1872,1877,1885,1886,1890,1891,1891,1891,1891],"datas_fim":[1872,1875,1878,1886,1889,1890,1891,1891,1891,1892],"estados":["RN","PE","BA","RS","PE","PE",0,0,0,0],"autor":["Eduardo Junqueira"],"content":"**LUCENA, Henrique Pereira de**\n\n\\*magistrado; pres. RN 1872; pres. PE 1872-1875; pres. BA 1877-1878;\npres. RS 1885-1886; dep. geral PE 1886-1889; gov. PE 1890; min. Just.\n1891; min. Agric. 1891; min. Faz. 1891; min. STF 1891-1892.\n\n \n\n*Henrique Pereira de Lucena*, futuro *barão de Lucena*, nasceu em\nLimoeiro, atual Bom Jardim (PE), em 27 de maio de 1835, filho de\nHenrique Pereira de Lucena e de Ana Barbosa da Silva.\n\nFez os estudos secundários no Imperial Colégio de Pedro II, no Rio de\nJaneiro, então capital do Império, e de volta à província natal\ningressou em 1853 na Faculdade de Direito do Recife, recebendo em 1858 o\ngrau de bacharel em ciências jurídicas e sociais.\n\nIniciou a vida pública como delegado de polícia em Recife. Após\nparticipar das forças que pacificaram a localidade de Ouricuri, no\nagreste pernambucano, onde facções lutavam pelo poder local, ingressou\nna magistratura como juiz municipal e de órfãos do termo de Goiana (PE)\ne ali permaneceu até 1869. Ao longo desse período, foi agraciado por dom\nPedro II com o grau de cavaleiro da Ordem da Rosa, em 1860, e com o\nhábito da Ordem de Cristo, em 1866. Em 1869 foi nomeado juiz de direito\nda comarca de Teixeira (PB), em 1872 foi designado para a comarca de\nPalmares (PE) e dali foi removido para Jaboatão (PE).\n\nAinda em 1872 foi nomeado presidente da província do Rio Grande do\nNorte. Entre 5 de novembro do mesmo ano e 10 de maio de 1875 foi\npresidente da província de Pernambuco e realizou uma série de obras\npúblicas que fizeram com que seu nome despontasse como exemplo de\nadministração e de governo. Teve novas experiências administrativas como\npresidente da província da Bahia, de 1877 a 1878, e da província do Rio\nGrande do Sul, de 28 de outubro de 1885 a 8 de maio de 1886, quando,\neleito deputado geral por Pernambuco, transferiu-se para a Corte e foi\nsubstituído pelo vice-presidente e comandante das armas, o então general\nManuel Deodoro da Fonseca, seu amigo pessoal. Durante a legislatura\n1886-1889, foi eleito presidente da Câmara para o biênio 1888-1889,\ncomandando assim a discussão, votação e aprovação da Lei Áurea, assinada\npela princesa Isabel, regente do Império, em 13 de maio de 1888. Ainda\nem 1888 recebeu da princesa Isabel o título de barão de Lucena.\n\nEncontrava-se no parlamento quando Deodoro da Fonseca proclamou a\nRepública em 15 de novembro de 1889. Retornou então à magistratura,\nassumindo, no Rio de Janeiro, a vara dos Feitos da Fazenda Nacional. Ali\npermaneceu por pouco tempo, dado que o governo provisório chefiado por\nDeodoro o nomeou governador de Pernambuco. Em 4 de agosto de 1890\nassumiu assim o governo pernambucano, substituindo Ambrósio Machado da\nCunha Cavalcanti. Em 23 de outubro passou o governo a José Antônio\nCorreia da Silva.\n\nJá figura destacada no panorama político, jurista de renome nacional, em\nnovembro de 1890 foi designado para o Supremo Tribunal Federal (STF),\ncorte constitucional criada em outubro nos moldes da Suprema Corte\nnorte-americana. Embora o Senado houvesse rejeitado seu nome para o STF,\nfoi daqueles personagens que, mesmo identificados com a monarquia, se\nmantiveram em altas funções no aparelho de Estado, pelo menos até a\nsubida de Floriano Peixoto ao poder. Assim, em 22 de janeiro de 1891,\ndiante da demissão coletiva do ministério motivada por divergências com\nDeodoro da Fonseca, foi chamado, junto com políticos do antigo regime\nmonárquico, a substituir os demissionários. Assumiu na ocasião os\nministérios da Justiça e da Agricultura, Comércio e Obras Públicas e\ntomou posse também no STF quando este foi instalado, em 28 de fevereiro\nde 1891. Tendo deixado em 22 de maio a pasta da Justiça, em 4 de julho\ndeixou a da Agricultura para assumir o Ministério da Fazenda. Nele\npermaneceu até a renúncia de Deodoro e a posse de Floriano, em 23 de\nnovembro de 1891, e pouco depois disso, em janeiro de 1892, foi\naposentado do STF. Após a aposentadoria, recolheu-se à vida privada,\ncaindo no ostracismo político.\n\nFaleceu no Rio de Janeiro, então Distrito Federal, no dia 10 de dezembro\nde 1913.\n\nFoi casado com Zília Sofia Carneiro Campelo. Seu sobrinho Epitácio\nPessoa, filho de sua irmã Henriqueta Barbosa de Lucena, foi constituinte\nde 1891 e deputado pela Paraíba (1891-1893), ministro da Justiça\n(1898-1901), ministro do STF (1902-1912), senador (1912-1919 e\n1924-1930) e presidente da República (1919-1922). O irmão deste, Antônio\nPessoa, foi presidente da Paraíba (1915-1916) e pai de Carlos Pessoa,\ndeputado federal por esse estado de 1925 a 1929. A irmã de ambos, Maria\nPessoa Cavalcanti de Albuquerque, era mãe João Pessoa, ministro do\nSuperior Tribunal Militar (1919-1928), presidente da Paraíba (1928-1930)\ne candidato da Aliança Liberal a vice-presidente da República, cujo\nassassínio foi o estopim da Revolução de 1930.\n\nEduardo Junqueira\n\n**FONTES:** MATTOSO, P. *Supremo Tribunal*; MELLO FILHO, J. *Notas*;\nRODRIGUES, L. *História*; SUP. TRIB. FED. Disponível em:\n\\<www.stf.jus.br/portal/ministros\\>.\n","ref":"**FONTES:** MATTOSO, P. *Supremo Tribunal*; MELLO FILHO, J. *Notas*;\nRODRIGUES, L. *História*; SUP. TRIB. FED. Disponível em:\n\\<www.stf.jus.br/portal/ministros\\>.\n","dic":"DHBPR"}
