{"title":"LUCENA, Sólon Barbosa de","cargoss":["Presidente de associação ou confederação de empregados ou empregadores","Deputado federal","Presidente de associação ou confederação de empregados ou empregadores"],"cargos_esp":[0,0,0],"datas_ini":[1916,1917,1920],"datas_fim":[1916,1920,1924],"estados":["PB","PB","PB"],"autor":["Raimundo Helio Lopes"],"content":"**LUCENA, Sólon Barbosa de**\n\n\\*pres. PB 1916; dep. fed. PB 1917-1920; pres. PB 1920-1924.\n\n*Sólon Barbosa de Lucena* nasceu na cidade de Bananeiras (PB) no ano de\n1877, filho de Virgínio de Melo e de Amélia Barbosa de Lucena. Seu\ntio-avô Henrique Pereira de Lucena, o barão de Lucena, presidiu várias\nprovíncias durante o Império, e já na República foi governador de\nPernambuco (1890), ministro da Justiça, da Agricultura e da Fazenda\n(1891) e ministro do Supremo Tribunal Federal (STF). Seus primos em\nsegundo grau Epitácio Pessoa e Antônio da Silva Pessoa foram, o\nprimeiro, constituinte de 1891 e deputado pela Paraíba (1891-1893),\nministro da Justiça (1898-1901), ministro do STF (1902-1912), senador\n(1912-1919 e 1924-1930) e presidente da República (1919-1922); o\nsegundo, presidente da Paraíba (1915-1916) e pai de Carlos Pessoa,\ndeputado federal por esse estado (1925-1929). A irmã de ambos, Maria\nPessoa Cavalcanti de Albuquerque, era mãe João Pessoa, ministro do\nSuperior Tribunal Militar (1919-1928), presidente da Paraíba (1928-1930)\ne candidato da Aliança Liberal a vice-presidente da República, cujo\nassassínio foi o estopim da Revolução de 1930.\n\nSólon de Lucena foi professor em sua cidade natal e dedicou-se muitos\nanos ao magistério. Em 1913 foi eleito deputado estadual na Paraíba e\nlogo designado presidente da Assembleia Legislativa. Como tal, em 24 de\njulho de 1916 assumiu a presidência do estado depois da licença, e\nposterior falecimento, do então presidente estadual e seu primo Antônio\nda Silva Pessoa. Chegou ao cargo depois que o vice-presidente Pedro\nBandeira abriu mão de ocupá-lo. Permaneceu no poder até 22 de outubro do\nmesmo ano, quando foi substituído por Francisco Camilo de Holanda,\neleito para o quadriênio 1916-1920.\n\nEm 4 de setembro de 1917 foi eleito deputado federal pela Paraíba na\nvaga aberta com a saída de Francisco Camilo de Holanda, e no ano\nseguinte foi reeleito para legislatura 1918-1920. Em 1920 voltou ao\ngoverno da Paraíba, agora eleito para o quadriênio 1920-1924, sucedendo\na Francisco Camilo de Holanda. Durante esses anos, teve o apoio do\nsenador e depois presidente da República Epitácio Pessoa, também seu\nprimo. Em sua administração, houve investimentos no serviço de água e\nesgoto da capital paraibana. Seu sucessor foi João Suassuna.\n\nFaleceu na cidade da Paraíba, posteriormente João Pessoa, em 1926.\n\nSeu neto Humberto Coutinho de Lucena foi deputado federal (1959-1971 e\n1975-1979) e senador pelo estado da Paraíba (1979-1998).\n\nRaimundo Helio Lopes\n\n**FONTES:** ABRANCHES, J. *Governos*; MARIZ, C. *Apanhados*; ODILON, M.\n*Pequeno*; PINTO, L. *Fundamentos.*\n","ref":"**FONTES:** ABRANCHES, J. *Governos*; MARIZ, C. *Apanhados*; ODILON, M.\n*Pequeno*; PINTO, L. *Fundamentos.*\n","dic":"DHBPR"}
