{"title":"ANDRADE, João Batista de Sá","cargoss":["Constituinte"],"cargos_esp":[0],"datas_ini":[1891],"datas_fim":[1891],"estados":[0],"autor":["Raimundo Helio Lopes"],"content":"**ANDRADE, João Batista de Sá**\n\n\\* const. 1891; dep. fed. PB1891-1893.\n\n*João Batista de Sá Andrade* nasceu na cidadede Sousa (PB) no ano de\n1865, filhodo desembargador Manuel Xavier de Andrade.\n\nFormou-se pela Faculdade de Medicinada Bahia em 1889. Durante o\ncurso,fez parte do Grêmio Republicano da faculdadee militou defendendo\nas ideias de SilvaJardim.\n\nDepois que o marechal Deodoro daFonseca instalou o regime republicano\nem15 de novembro de 1889, foi eleitodeputado constituinte pelo estado da\nParaíbaem setembro de 1890. Assumiu sua cadeiraem 15 de novembro\nseguinte, quando foiinstalada a Assembleia Nacional Constituinteno Rio\nde Janeiro, agora Distrito Federal.Promulgada a nova Carta\nconstitucional em24 de fevereiro de 1891, em junhopassou a cumprir o\nmandato ordinário,até dezembro de 1893. Durante esses anos,fez forte\noposição ao governo do presidenteFloriano Peixoto.\n\nApós deixar a Câmara dos Deputadosretornou ao estado da Paraíba, onde\npassoua clinicar. Foi nomeado inspetor de higienee ocupou esse cargo por\nmuitos anos.Em 1905, foi um dos sócios-fundadoresdo Instituo Histórico e\nGeográfico daParaíba. Devido a problemas de saúde veiopara o Rio de\nJaneiro, para tratamentomédico, e aí faleceu no dia 23de julho de 1912.\n\nRaimundo Helio Lopes\n\n**FONTES:** ABRANCHES, J. *Governos*;CÂM. DEP. *Deputados brasileiros*;\nINST. HIST.GEO. PARAIBANO. Disponível em: \\<www.ihgp.net\\>.Acesso em:\n2/12/2010; ODILON, M. *Pequeno dicionário.*\n","ref":"**FONTES:** ABRANCHES, J. *Governos*;CÂM. DEP. *Deputados brasileiros*;\nINST. HIST.GEO. PARAIBANO. Disponível em: \\<www.ihgp.net\\>.Acesso em:\n2/12/2010; ODILON, M. *Pequeno dicionário.*\n","dic":"DHBPR"}
