{"title":"MACEDO, Erasmo Vieira de","cargoss":["Deputado federal"],"cargos_esp":[0],"datas_ini":[1912],"datas_fim":[1917],"estados":["PE"],"autor":["Raimundo Helio Lopes"],"content":"**MACEDO, Erasmo Vieira de**\n\n\\*dep. fed. PE 1912-1917.\n\n*Erasmo Vieira de Macedo* nasceu em Nazaré (PE) no dia 4 de dezembro de\n1870, filho de Manuel de Macedo e de Maria Vieira de Macedo.\n\nTrabalhou no comércio na cidade de Itabaiana (PB) e depois em Recife. Em\n1904 ingressou na Faculdade de Direito do Recife e formou-se em 1908.\nDepois de formado continuou na atividade comercial e em 1912 fundou o\nBanco Auxiliar do Comércio.\n\nIniciou sua vida política em Pernambuco, onde foi um dos mais fortes\nopositores da facção política liderada por Francisco de Assis Rosa e\nSilva. Atuou assim intensamente na campanha que culminou com a chegada\nde Dantas Barreto ao governo pernambucano em 1911. Depois desse\nmovimento, tornou-se presidente do Banco do Estado de Pernambuco.\n\nEm 1912 foi eleito deputado federal e em maio assumiu sua cadeira na\nCâmara dos Deputados no Rio de Janeiro, então Distrito Federal. Reeleito\nem 1915, licenciou-se em 1917 para fazer uma viagem aos Estados Unidos a\nfim de tratar de assuntos comerciais relacionados à Primeira Guerra\nMundial. Permaneceu na Câmara até dezembro desse ano, quando se\nencerraram seu mandato e a legislatura.\n\nNo campo jornalístico, colaborou com os jornais *A Província* e *Jornal\ndo* *Comércio*, bem como com a revista *O Batista,* todos de Pernambuco.\n\nRaimundo Helio Lopes\n\n**FONTES:** ABRANCHES, J. *Governos*; CÂM. DEP. *Deputados brasileiros*;\nLEVINE, R. *Velha*; NASCIMENTO, L. *História* (v.2, 3, 7).\n","ref":"**FONTES:** ABRANCHES, J. *Governos*; CÂM. DEP. *Deputados brasileiros*;\nLEVINE, R. *Velha*; NASCIMENTO, L. *História* (v.2, 3, 7).\n","dic":"DHBPR"}
