{"title":"MACHADO, Álvaro Lopes","cargoss":["Presidente de associação ou confederação de empregados ou empregadores","Senador","Presidente de associação ou confederação de empregados ou empregadores","Senador"],"cargos_esp":[0,0,0,0],"datas_ini":[1892,1897,1904,1906],"datas_fim":[1896,1904,1905,1912],"estados":["PB","PB","PB","PB"],"autor":["Raimundo Helio Lopes"],"content":"**MACHADO, Álvaro Lopes**\n\n\\*militar; pres. PB 1892-1896; sen. PB 1897-1904; pres. PB 1904-1905;\nsen. PB 1906-1912.\n\n*Álvaro Lopes Machado* nasceu em Areias (PB) no dia 5 de março de 1857,\nfilho de João Lopes Machado e de Avelina Amália da Fonseca. Seu irmão\nJoão Lopes Machado foi presidente da Paraíba de 1908 a 1912.\n\nIngressou no Exército em janeiro de 1876 e tornou-se alferes aluno em\njaneiro de 1879. Foi promovido a segundo-tenente em julho de 1880, a\nprimeiro-tenente em julho do ano seguinte e a capitão em novembro de\n1887. Com essa patente formou-se em ciências físicas e matemáticas na\nEscola Militar em 1888. Depois da proclamação da República (15/11/1889),\ntornou-se major graduado em outubro de 1890 e major efetivo em março de\n1891.\n\nIngressou na política depois que o marechal Deodoro da Fonseca renunciou\nà presidência da República, em 23 de novembro de 1891. O vice-presidente\nFloriano Peixoto assumiu então a presidência e destituiu os governantes\nestaduais que apoiavam Deodoro. Foi o caso de Venâncio Neiva, que deixou\no governo da Paraíba em 27 de novembro. Depois de um curto período no\nqual o estado foi governado por uma junta governativa composta pelo\ncoronel Cláudio do Amaral Savaget, Eugênio Toscano de Brito e Joaquim\nFerreira de Carvalho, Álvaro Lopes Machado assumiu o governo, em 18 de\nfevereiro de 1892. Sua nomeação foi influenciada por João Coelho\nGonçalves Lisboa, republicano histórico e florianista.\n\nAo assumir o governo do estado, fundou o Partido Republicano da Paraíba,\nrevogou a Constituição promulgada no governo de Venâncio Neiva,\nreorganizou a Assembleia Legislativa estadual e aprovou uma nova Carta\nmagna. Foi então confirmado, via eleição indireta, presidente do estado.\nNa sua administração, teve como aliado o vice-presidente, padre Valfredo\nLeal. Reformou o Liceu Paraibano, fez investimentos nos sistemas\nrodoviário e ferroviário, instalou linhas telegráficas e criou a\nImprensa Oficial. Em 17 de maio de 1896 renunciou ao mandato para\nconcorrer a uma vaga no Senado e foi substituído por Valfredo Leal.\nEste, por seu turno, em 22 de outubro seguinte foi substituído por\nAntônio Alfredo da Gama e Melo.\n\nEleito senador pela Paraíba, tomou posse em 1897. Continuou sua carreira\nmilitar e em 14 de dezembro de 1900 chegou a tenente-coronel. Em 1904\nrenunciou ao mandato de senador, pois foi mais uma vez eleito presidente\nda Paraíba, sucedendo a José Peregrino de Araújo. De volta ao governo\nparaibano em 22 de outubro, continuou aliado do padre Valfredo Leal,\nnovamente vice-presidente do estado. Um ano depois, em 28 de outubro de\n1905, renunciou ao governo para mais uma vez concorrer ao Senado\nFederal, cedendo o lugar ao padre Valfredo. Eleito, tomou posse em 1906.\nEm 5 de agosto de 1908 foi promovido a coronel e pouco depois\nreformou-se como general. No Senado, foi membro das comissões de Obras\nPúblicas e Empresas Privilegiadas, de Finanças, e de Marinha e Guerra.\n\nFoi também professor militar e sócio-benemérito do Instituto Histórico e\nGeográfico Paraibano. Recebeu a Medalha de Ouro por serviços militares\nrelevantes.\n\nFaleceu na cidade do Rio de Janeiro no dia 30 de janeiro de 1912, no\nexercício do mandato de senador.\n\nRaimundo Helio Lopes\n\nFONTES: ABRANCHES, J. *Governos*; *Grande encic. Delta Larousse*; LEITE\nNETO, L. *Catálogo* *biográfico*; PINTO, L. *Fundamentos*; VELHO\nSOBRINHO, J. *Dicionário*.\n","ref":"FONTES: ABRANCHES, J. *Governos*; *Grande encic. Delta Larousse*; LEITE\nNETO, L. *Catálogo* *biográfico*; PINTO, L. *Fundamentos*; VELHO\nSOBRINHO, J. *Dicionário*.\n","dic":"DHBPR"}
