{"title":"MAGALHÃES, Gabriel de Paula Almeida","cargoss":["Deputado federal"],"cargos_esp":[0],"datas_ini":[1891],"datas_fim":[1893],"estados":["MG"],"autor":["Luciana Pinheiro"],"content":"**MAGALHÃES, Gabriel de Paula Almeida**\n\n\\*dep. fed. MG 1891-1893.\n\n*Gabriel de Paula Almeida Magalhães* nasceu em São João Del Rei (MG) no\ndia 15 de setembro de 1833, filho de Francisco de Paula de Almeida\nMagalhães e de Mariana Carolina de Magalhães Leite.\n\nFormado em 1855 pela Faculdade de Direito de São Paulo, atuou por longo\ntempo como advogado nas cidades mineiras de São João Del Rei e\nLeopoldina, tendo participado ativamente da criação nesta última da\nSanta Casa de Misericórdia.\n\nProclamada a República em 15 de novembro de 1889 e convocadas as\neleições para o Congresso Nacional Constituinte, em 15 de setembro de\n1890 foi eleito deputado por Minas Gerais na legenda do Partido\nRepublicano Mineiro. Tomou posse em 15 de novembro, participou da\nelaboração da Constituição promulgada em 24 de fevereiro de 1891 e, com\no início, em maio, da legislatura ordinária, tomou assento na Câmara dos\nDeputados até dezembro de 1893.\n\nFaleceu em São João Del Rei, em 10 de dezembro de 1904.\n\nEra casado com Maria do Carmo Monteiro Almeida Magalhães.\n\nLuciana Pinheiro\n\n**FONTES:** CÂM. DEP. *Deputados brasileiros* (p.109); MONTEIRO, N.\n*Dicionário* (v.2, p.391).\n","ref":"**FONTES:** CÂM. DEP. *Deputados brasileiros* (p.109); MONTEIRO, N.\n*Dicionário* (v.2, p.391).\n","dic":"DHBPR"}
