{"title":"MAGALHÃES, Landulfo Machado","cargoss":["Deputado federal","Deputado federal","Deputado federal","Deputado federal"],"cargos_esp":[0,0,0,0],"datas_ini":[1919,1909,1900,1894],"datas_fim":[1923,1914,1902,1896],"estados":["MG","MG","MG","MG"],"autor":["Luciana Pinheiro"],"content":"**MAGALHÃES, Landulfo Machado**\n\n\\*dep. fed. MG 1894-1896, 1900-1902, 1909-1914 e 1919-1923.\n\n*Landulfo Machado Magalhães* nasceu em Ponte Nova (MG) no dia 15 de\njaneiro de 1861, filho de Francisco Machado de Magalhães e de Antônia\nFelícia Rosa de Magalhães.\n\nCursou humanidades no Seminário de Mariana (MG) e em 1884 ingressou na\nFaculdade de Medicina do Rio de Janeiro, então capital do Império, mas\ndiplomou-se pela Faculdade de Medicina da Bahia em 1889. Abolicionista e\nentusiasta da República, já nos tempos de estudante tinha militância\npolítica. Em maio de 1888 criou o Clube República Federal, que serviu de\nnúcleo para a organização do Partido Republicano da Bahia. Após a\nproclamação da República (15/11/1889) elegeu-se vereador no distrito de\nPedra da Anta, em Viçosa (MG), e exerceu o mandato de 1891 a 1893,\nacumulando a atividade de delegado de higiene entre 1891 e 1894. No\ncontexto da Revolta da Armada (1893-1894), deu apoio ao presidente\nFloriano Peixoto (1891-1894).\n\nEm 1894 foi eleito pela primeira vez deputado federal por Minas Gerais.\nAssumindo sua cadeira na Câmara dos Deputados, no Rio de Janeiro, então\nDistrito Federal, em maio do mesmo ano, ocupou-a até dezembro de 1896,\nquando se encerraram seu mandato e a legislatura. Voltou a ser eleito\ndeputado federal por Minas Gerais para mais três períodos: 1900-1902,\n1909-1911, 1912-1914. Estando em curso a legislatura 1918-1920, ainda\numa vez foi eleito deputado federal, em 1919. Reeleito em 1921, cumpriu\no mandato até dezembro de 1923.\n\nFoi ainda senador estadual em Minas Gerais, presidente do diretório do\nPartido Republicano Mineiro (PRM) e diretor da redação do periódico *A\nRepública Federal*. Fora da esfera política, clinicou em Pedra do Anta.\n\nFaleceu em Ponte Nova no dia 15 de agosto de 1932.\n\nEra casado com Maria Mosqueira de Magalhães.\n\nLuciana Pinheiro\n\n**FONTES:** CÂM. DEP. *Deputados brasileiros* (p.169); Censo-Guia de\nArchivos de España e Iberoamerica. Disponível em:\n\\<http://censoarchivos.mcu.es/CensoGuia/fondoDetail.htm?id=562948\\>.\nAcesso em: 9/9/2010; INST. HIST. GEO. BRAS. Disponível em:\n\\<www.ihgb.org.br/\\>. Acesso em: 9/9/2010; MONTEIRO, N. *Dicionário*\n(v.2, p.392).\n","ref":"**FONTES:** CÂM. DEP. *Deputados brasileiros* (p.169); Censo-Guia de\nArchivos de España e Iberoamerica. Disponível em:\n\\<http://censoarchivos.mcu.es/CensoGuia/fondoDetail.htm?id=562948\\>.\nAcesso em: 9/9/2010; INST. HIST. GEO. BRAS. Disponível em:\n\\<www.ihgb.org.br/\\>. Acesso em: 9/9/2010; MONTEIRO, N. *Dicionário*\n(v.2, p.392).\n","dic":"DHBPR"}
