{"title":"MAGALHÃES, Olinto de","cargoss":["Ministro das Relações Exteriores","Deputado federal"],"cargos_esp":[0,0],"datas_ini":[1898,1921],"datas_fim":[1902,1926],"estados":[0,"MG"],"autor":["Cristina Luna","Luciana Pinheiro"],"content":"**MAGALHÃES, Olinto de**\n\n\\*diplomata; min. Rel. Ext. 1898-1902; dep. fed. MG 1921-1926.\n\n*Olinto Máximo de Magalhães* nasceu em Barbacena (MG) em 11 de janeiro\nde 1867, filho de José Máximo de Magalhães e de Porfíria Heliodora\nMarques de Magalhães.\n\nEstudou em sua cidade natal no Colégio Providência, antecessor do\nColégio Abílio, do barão de Macaúbas, e fez o curso preparatório no\nColégio Paixão, no município fluminense de Petrópolis. Formou-se pela\nFaculdade de Medicina do Rio de Janeiro em 1887 e depois estudou clínica\ncirúrgica em Paris.\n\nApoiou o movimento republicano e a proclamação da República, em 15 de\nnovembro de 1889. Após a promulgação da primeira Constituição\nrepublicana em 24 de fevereiro de 1891, foi eleito para o primeiro\nCongresso Constituinte de seu estado natal. Em 1892, por indicação do\npresidente Floriano Peixoto (1891-1894), que era amigo seu e de seu pai,\nfoi nomeado segundo-secretário da legação brasileira em Viena, na\nÁustria-Hungria. Pouco depois, foi transferido para os Estados Unidos,\nonde serviu como segundo-secretário junto à missão especial que advogou\nos direitos do Brasil em Washington, no arbitramento da questão de\nMissões. A missão foi liderada por José Maria da Silva Paranhos, o barão\ndo Rio Branco, e contou ainda com a participação dos também secretários\nDomício da Gama e Domingos Olímpio Braga Cavalcanti, do contra-almirante\nJosé Cândido Guilhobel e do general Dionísio Evangelista de Castro\nCerqueira. Segundo Luís Viana Filho, o barão do Rio Branco procurou se\ninformar sobre os integrantes da missão antes que chegassem a\nWashington, e a respeito de Olinto de Magalhães foi-lhe dito que não\nfalava inglês, já havia servido em Viena, fora médico de Floriano\nPeixoto e era padrinho do filho do marechal. A questão das Missões\nenvolveu o Brasil e a Argentina e girou em torno da posse do território\nconhecido como Missões. Foi arbitrada com ganho de causa para o Brasil\npelo presidente norte-americano Grover Cleveland, em 1895.\n\nAo término dessa missão, Olinto de Magalhães foi transferido para Vera\nCruz, no México, como encarregado de negócios, e ali lhe tocou presidir\no Congresso de Americanistas de 1895. Logo em seguida foi transferido\npara Paris como plenipotenciário, em 1897 foi designado para São\nPetersburgo e em 1898 para Berna. Foi então convidado pelo presidente da\nRepública Campos Sales (1898-1902) para ocupar a pasta das Relações\nExteriores. O convite ocorreu quando participava de jantar em Paris\norganizado pelo barão do Rio Branco em homenagem a Campos Sales, que se\nencontrava em viagem pela Europa. Ainda de acordo com Luís Viana Filho,\nOlinto de Magalhães titubeou frente ao convite, por ser muito jovem e\nconsiderar-se despreparado. Contudo, após intermediações de amigos,\nentre eles o próprio barão do Rio Branco, acabou por aceitá-lo.\n\nManteve-se à frente do Itamarati durante todo o quadriênio seguinte,\napenas com breve interrupção ocasionada pela viagem do chefe de Estado a\nBuenos Aires, em 1900, durante a qual, seguindo também para o rio da\nPrata, passou o ministério interinamente a Joaquim Tomás do Amaral, o\nvisconde de Cabo Frio. Sua longa permanência no cargo contrastou com o\nrodízio de ministros na pasta das Relações Exteriores que caracterizou\nos três governos anteriores. Segundo Clodoaldo Bueno, esse rodízio teria\nsido gerado por uma ausência de diretrizes na política externa\nbrasileira.\n\nImportantes negócios diplomáticos foram tratados pela Chancelaria\ndurante a presidência de Campos Sales, entre eles a questão de limites\nentre o Brasil, a Inglaterra e França. Inicialmente, o barão do Rio\nBranco recebera a incumbência de defender o Brasil frente aos dois\npaíses. Contudo, diante da enorme demanda da missão, preferiu se ater ao\nlitígio com a França e acabou por sugerir Joaquim Nabuco para a defesa\nbrasileira frente à Inglaterra. A recomendação foi acatada por Olinto de\nMagalhães e pelo presidente Campos Sales, e Nabuco foi convidado por\nambos a dirigir a questão de limites do Brasil com a Inglaterra acerca\ndas fronteiras com a Guiana, em 5 de março de 1899.\n\nNa época, Sousa Correia era o ministro plenipotenciário brasileiro na\nInglaterra e gozava da amizade do primeiro-ministro britânico Lord\nSalisbury. As sugestões para o arbitramento da questão eram, contudo,\ndiscordantes, pois a Inglaterra preferia um tribunal, enquanto o Brasil\ntinha preferência por um chefe de Estado estrangeiro para decidir o\nlitígio. A posição brasileira acabou se sobrepondo, e Nabuco, o barão do\nRio Branco e Sousa Correia deliberaram que o chefe de Estado mais\nfavorável ao Brasil seria o grão-duque de Baden. A indicação foi\nsurpreendentemente aceita por Salisbury, mas foi recusada por Olinto de\nMagalhães, que alegou ser o grão-duque de Baden apenas um suserano e não\num chefe de Estado. Assim, a missão brasileira liderada por Nabuco optou\npor um acordo e não pelo arbitramento, por considerar que a primeira\nsolução lhe seria mais favorável, visto que o árbitro desejado não fora\naceito.\n\nNesse ínterim, o barão do Rio Branco venceu o litígio com a França em\ntorno do território do Oiapoque, que foi arbitrado pelo Conselho Federal\nsuíço, e a Inglaterra viu que não podia subestimar o Brasil acerca de\nquestões de fronteiras. Por outro lado, o governo Campos Sales se\naproximava do fim, e tanto o presidente como Olinto de Magalhães\nreconheceram que seria uma demonstração de fraqueza fazer um acordo\namigável com a Inglaterra. Com isso, foi decidido por ambos os países\ncontendores que a questão seria arbitrada por Vítor Emanuel, rei da\nItália. A escolha do árbitro foi criticada por Nabuco e sua equipe e\npelo barão do Rio Branco, que alegaram estar a Itália sujeita ao poder\nbritânico. Todavia, Olinto de Magalhães e o presidente Campos Sales\nconcordaram com a escolha, que, de fato, se revelou prejudicial ao\nBrasil quando o rei italiano divulgou a sua decisão, em junho de 1904.\nNesse momento, o Brasil já tinha outro governo e outro chanceler.\n\nTerminada sua gestão no ministério, Olinto de Magalhães retornou em 1903\na seu posto em Berna, na Suíça. Foi depois removido para Paris, onde se\nmanteve por vários anos, competindo-lhe dirigir a missão brasileira\ndurante o agitado período da Primeira Guerra Mundial (1914-1918). Após o\ntérmino do conflito mundial, foi delegado do Brasil à Conferência de Paz\nde Versalhes, em 1918, sob a chefia de Epitácio Pessoa.\n\nAposentado, foi eleito deputado federal por Minas Gerais para a\nlegislatura 1921-1923. Reeleito para o período seguinte, exerceu o\nmandato até 1926. Na Câmara dos Deputados, integrou a Comissão de\nDiplomacia e Tratados.\n\nFaleceu no Rio de Janeiro em 24 de maio de 1948.\n\nEra casado com Isabel Porciúncula de Magalhães.\n\nCristina Luna/ Luciana Pinheiro\n\n**FONTES:** CÂM. DEP. *Deputados brasileiros* (p.201); KOIFMAN, F.\n*Quixote*; MIN. REL. EXT. *Ministros*; MIN. REL. EXT. *Relatório* (1898,\n1899, 1900, 1901, 1902); MONTEIRO. N. *Dicionário* (v.2, p.393-394);\nPLANALTO. Disponível em: \\<www.planalto.gov.br/\\>. Acesso em: 30/9/2010;\nVIANA FILHO, L. *Vida*.\n","ref":"**FONTES:** CÂM. DEP. *Deputados brasileiros* (p.201); KOIFMAN, F.\n*Quixote*; MIN. REL. EXT. *Ministros*; MIN. REL. EXT. *Relatório* (1898,\n1899, 1900, 1901, 1902); MONTEIRO. N. *Dicionário* (v.2, p.393-394);\nPLANALTO. Disponível em: \\<www.planalto.gov.br/\\>. Acesso em: 30/9/2010;\nVIANA FILHO, L. *Vida*.\n","dic":"DHBPR"}
