{"title":"MAIA, Alfredo de","cargoss":["Deputado federal"],"cargos_esp":[0],"datas_ini":[1915],"datas_fim":[1920],"estados":["AL"],"autor":[0],"content":"**MAIA, Alfredo de**\n\n\\*dep. fed. AL 1915-1920.\n\n*Alfredo de Maia* nasceu em Atalaia (AL) no dia 7 de fevereiro de 1880,\nfilho de Manuel Melquisedeque de Farias Maia e de Francisca Emília de\nFarias Maia. Seu pai foi deputado provincial no Império e deputado\nestadual no início da República.\n\nEstudou em sua terra natal e formou-se pela Faculdade de Direito da\nBahia em 1903. Como estudante colaborou no *Diário da Bahia*. Trabalhou\ndepois no gabinete do governador da Bahia Severino Vieira, que o\nconheceu como orador de sua turma na solenidade de diplomação, e logo\nvoltou a Alagoas, onde apoiou o governador Euclides Malta e foi nomeado\nconsultor jurídico do estado. Exerceu o mandato de deputado estadual de\n1905 a 1910. Colaborou também no primeiro número da revista\n*Exedra***,** em 1907.\n\nEm 1915, já filiado ao Partido Republicano Conservador (PRC), foi eleito\ndeputado federal por seu estado natal. Assumindo sua cadeira na Câmara\ndos Deputados, no Rio de Janeiro, então Distrito Federal, em maio do\nmesmo ano, foi reeleito para um novo mandato em 1918. Permaneceu no\nLegislativo federal até dezembro de 1920, quando se encerrou a\nlegislatura. De volta a Alagoas, continuou a atuar na política local.\n\nEncontrava-se na Paraíba em 1930, quando os revolucionários vitoriosos o\nescolheram como um dos membros da junta revolucionária. Regressou a\nMaceió e foi nomeado secretário de Fazenda no governo do interventor\nHermilo de Freitas Melro (1930-1931). Foi também procurador geral do\nestado. Em 1945 foi fundador e presidente da União Democrática Nacional\n(UDN), tendo renunciado ao posto em 1946. Foi ainda membro do Instituto\nHistórico e Geográfico de Alagoas (IHGA).\n\nFaleceu em Maceió no dia 19 de novembro de 1967.\n\nFoi casado com Regina Clark Acióli, com quem teve quatro filhos. Um\ndeles, Emílio Eliseu de Maia, foi deputado federal por Alagoas de 1935 a\n1937.\n\nPublicou *Versos íntimos*.\n\nReynaldo de Barros\n\n**FONTES:** BARROS, F. *A B C das Alagoas*; CÂM. DEP. *Deputados\nbrasileiros*.\n","ref":"**FONTES:** BARROS, F. *A B C das Alagoas*; CÂM. DEP. *Deputados\nbrasileiros*.\n","dic":"DHBPR"}
