{"title":"MALTA JÚNIOR, João Francisco","cargoss":["Deputado federal"],"cargos_esp":[0],"datas_ini":[1900],"datas_fim":[1902],"estados":["SP"],"autor":["Carlos Alberto Ungaretti Dias"],"content":"**MALTA JÚNIOR, João Francisco**\n\n\\*dep. fed. SP 1900-1902.\n\n*João Francisco Malta Júnior* nasceu na província de São Paulo. Sua\nfamília exercia grande influência em Taubaté.\n\nFormou-se em ciências jurídicas e sociais na Faculdade de Direito de São\nPaulo e ingressou na política filiando-se ao Partido Republicano\nPaulista (PRP). Nessa legenda foi eleito três vezes deputado estadual:\nnas legislaturas 1892-1894, 1895-1897 e 1898-1900. No Legislativo de São\nPaulo defendeu a adoção de penas severas para o crime de furto. Ganhou\ndestaque na área da educação ao propor, através de projetos de lei, a\ncriação de dezenas de escolas nas cidades de Caraguatatuba, São José dos\nCampos, Poá, Guaratinguetá, Caçapava e Taubaté, Brotas, Jaboticabal e\nSão José do Paraitinga, entre outras.\n\nProsseguindo sua carreira política, em março de 1900 foi eleito deputado\nfederal por São Paulo para a legislatura 1900-1902, sempre na legenda do\nPRP. Assumindo sua cadeira na Câmara dos Deputados, no Rio de Janeiro,\nentão Distrito Federal, em maio do mesmo ano, nela permaneceu até 17 de\njulho de 1902, quando faleceu no exercício do mandato.\n\nCarlos Alberto Ungaretti Dias\n\n**FONTES:** ABRANCHES, J. *Governos* (v.2); CALIMAN, A. *Legislativo*;\n*Correio Paulistano* (18/4/1915); Estudo sobre. Disponível em:\n\\<www.estudosobre.com/C%C3%A2mara\\_do\\_Congresso\\_Legislativo\\_do\\_Estado\\_de\\_S%C3%A3o\\_Paulo\\>;\nFONSECA, A.; FONTES JUNIOR, A. *Câmara* (1919, 1930).\n","ref":"**FONTES:** ABRANCHES, J. *Governos* (v.2); CALIMAN, A. *Legislativo*;\n*Correio Paulistano* (18/4/1915); Estudo sobre. Disponível em:\n\\<www.estudosobre.com/C%C3%A2mara\\_do\\_Congresso\\_Legislativo\\_do\\_Estado\\_de\\_S%C3%A3o\\_Paulo\\>;\nFONSECA, A.; FONTES JUNIOR, A. *Câmara* (1919, 1930).\n","dic":"DHBPR"}
