{"title":"MARANHÃO, Apolinário Florentino de Albuquerque","cargoss":["Deputado federal"],"cargos_esp":[0],"datas_ini":[1906],"datas_fim":[1908],"estados":["PE"],"autor":["Raimundo Helio Lopes"],"content":"**MARANHÃO, Apolinário Florentino de Albuquerque**\n\n\\*dep. fed. PE 1906-1908.\n\n*Apolinário Florentino de Albuquerque Maranhão* nasceu em Águas Belas\n(PE) no dia 19 de julho de 1840.\n\nParticipou da Guerra do Paraguai (1864-1870) como voluntário. Depois do\nconflito continuou ligado ao Exército e em 1872 foi nomeado tabelião\npúblico na cidade de Recife.\n\nDepois da proclamação da República (15/11/1889), foi eleito deputado\nestadual em Pernambuco. Em sua vida política fez oposição à corrente\nliderada por Francisco de Assis Rosa e Silva. Em 1906 foi eleito\ndeputado federal por Pernambuco e ocupou uma cadeira na Câmara dos\nDeputados, no Rio de Janeiro, então Distrito Federal, de maio desse ano\naté dezembro de 1908.\n\nRaimundo Helio Lopes\n\n**FONTES:** ABRANCHES, J. *Governos*; CÂM. DEP. *Deputados brasileiros*.\n","ref":"**FONTES:** ABRANCHES, J. *Governos*; CÂM. DEP. *Deputados brasileiros*.\n","dic":"DHBPR"}
