{"title":"MARANHÃO, Júlio Carneiro de Albuquerque","cargoss":["Deputado federal"],"cargos_esp":[0],"datas_ini":[1915],"datas_fim":[1917],"estados":["PE"],"autor":["Raimundo Helio Lopes"],"content":"**MARANHÃO, Júlio Carneiro de Albuquerque**\n\n\\*dep. fed. PE 1915-1917.\n\n*Júlio Carneiro de Albuquerque Maranhão* nasceu em Pernambuco.\n\nFormou-se pela Faculdade de Direito do Recife e, além de exercer a\nadvocacia, foi dono de uma usina de açúcar. Na política pernambucana,\natuou intensamente contra a facção liderada por Francisco de Assis Rosa\ne Silva. Por essa militância, esteve ao lado do grupo político que\norganizou a campanha que culminou com a chegada de Dantas Barreto ao\ngoverno do estado em 1911.\n\nEm 1915 foi eleito deputado federal. Permaneceu na Câmara dos Deputados,\nno Rio de Janeiro, então Distrito Federal, de maio desse ano até\ndezembro de 1917, quando se encerraram seu mandato e a legislatura.\n\nRaimundo Helio Lopes\n\n**FONTES:** ABRANCHES, J. *Governos*; CÂM. DEP. *Deputados brasileiros.*\n","ref":"**FONTES:** ABRANCHES, J. *Governos*; CÂM. DEP. *Deputados brasileiros.*\n","dic":"DHBPR"}
