{"title":"MARCONDES FILHO","cargoss":["Deputado federal","Ministro do Trabalho","Ministro da Justiça","Constituinte","Senador","Ministro da Justiça"],"cargos_esp":[0,0,0,0,0,0],"datas_ini":[1927,1941,1942,1946,1946,1955],"datas_fim":[1930,1945,1945,1946,1955,1955],"estados":["SP",0,0,0,"SP",0],"autor":["Jorge Miguel Mayer"],"content":"**MARCONDES FILHO**\n\n\\*dep. fed. SP 1927-1930; min. Trab. 1941-1945; min. Just. 1942-1945;\nconst. 1946; sen. SP 1946-1955; min. Just. 1955.\n\n*Alexandre Marcondes Machado Filho* nasceu na cidade de São Paulo em 3\nde agosto de 1892, filho de Alexandre Marcondes Machado e de Maria\nAlbertina Marcondes Machado. Depois de exercer o magistério, seu pai\ntornou-se industrial do ramo da seda.\n\nMarcondes Filho cursou o secundário no Colégio São Luís, em Itu (SP), e\nem seguida ingressou na Faculdade de Direito de São Paulo, pela qual se\nbacharelou em 1914. Ainda acadêmico, trabalhou no escritório da jurista\nAlfredo Pujol, companheiro e advogado de Rui Barbosa na Campanha\nCivilista (1910), e foi secretário de Bernardino de Campos, importante\nmembro do Partido Republicano Paulista (PRP), então dominante no estado\ne muito influente na vida nacional. Graças a essas atividades, desde a\njuventude conviveu com o mundo político, principalmente em São Paulo e\nno Rio de Janeiro, então Distrito Federal.\n\nDepois de formado, tornou-se promotor público na capital paulista, mas\nexonerou-se do cargo para organizar um dos mais movimentados escritórios\nde advocacia da cidade, especializado em direito comercial. Foi um dos\nfundadores do Instituto dos Advogados de São Paulo, integrando-se mais\ntarde à sua diretoria.\n\nPolítico Paulista\n\n Em 1926, seu nome foi incluído por Carlos de Campos, presidente de São\nPaulo, na chapa do PRP para a Câmara de Vereadores da capital. Eleito,\nfoi escolhido líder da bancada situacionista. Impressionado com o\ncrescimento do recém-fundado Partido Democrático (PD), que aglutinava a\noposição liberal ao PRP, sugeriu a seus correligionários medidas\nvoltadas para a dinamização das atividades partidárias, como a criação\nde um jornal popular diferente do *Correio Paulistano*, órgão oficial do\nPRP.\n\nEleito deputado federal por São Paulo, na legenda do PRP, para a\nlegislatura 1927-1929, continuou a combater sistematicamente as posições\ndo PD e tornou-se importante auxiliar de Manuel Vilaboim e de José\nCardoso de Almeida, que lideravam a maioria parlamentar em apoio ao\ngoverno de Washington Luís. Coerente com sua proposta anteriormente\nformulada, foi fundador e diretor do *São Paulo-Jornal*.\n\nConcluído o mandato na Câmara dos Deputados, foi reeleito em 1^o^ de\nmarço de 1930, no mesmo dia em que Júlio Prestes derrotou Getúlio Vargas\nna disputa pela presidência da República. A vitória situacionista nessas\neleições foi contestada por importantes setores da oposição, que se\nvoltaram para a preparação de um levante armado contra o governo\nfederal. Em meio ao crescimento das tensões, Marcondes Filho pronunciou\num inflamado discurso na Câmara em favor do reconhecimento do resultado\noficial do pleito. Entretanto, a revolução foi deflagrada em 3 de\noutubro e, ao cabo de 21 dias de luta, alcançou a vitória, conduzindo à\nformação de um governo provisório chefiado por Vargas (3/11/1930). As\natividades parlamentares foram suspensas, e o *São Paulo-Jornal* foi\nempastelado, a exemplo de outros jornais situacionistas. Marcondes Filho\nretornou então ao exercício da advocacia, aumentando o prestígio de seu\nescritório. Pouco depois, foi eleito para o conselho da seção paulista\nda Ordem dos Advogados do Brasil.\n\nO período posterior à vitória da Revolução de 1930 foi marcado, em São\nPaulo, pelo acirramento dos conflitos entre as correntes políticas\ntradicionais no estado e as forças tenentistas apoiadas pelo governo\nprovisório. Os paulistas reivindicavam a devolução da autonomia estadual\ne a rápida reconstitucionalização do país, enquanto os “tenentes”\ndefendiam o aprofundamento das medidas revolucionárias. Em 19 de janeiro\nde 1932, Marcondes Filho foi um dos signatários do manifesto em que o\nPRP acusava o governo provisório (a “ditadura de Vargas”) de solapar o\nregime republicano e democrático. Esse documento desempenhou importante\npapel na aproximação entre os dois grandes partidos do estado, que\nformaram a Frente Única Paulista (FUP) e lideraram a deflagração da\nRevolução Constitucionalista em 9 de julho de 1932. Depois de quase três\nmeses de combates, os revolucionários foram derrotados e suas principais\nlideranças embarcaram para o exílio.\n\nNo Ministério do Trabalho\n\nMarcondes Filho só retornou à vida pública depois da implantação do\nEstado Novo (10/11/1937). Convidado por Vargas, assumiu a\nvice-presidência do Departamento Administrativo do Estado de São Paulo\n(DAESP), presidido por Gofredo Teixeira da Silva Teles e reunido pela\nprimeira vez em julho de 1939. O DAESP era encarregado de aprovar\nempreendimentos e decretos da administração estadual paulista,\nconstituindo-se em uma instância de controle federal sobre São Paulo. Em\n1940, Marcondes Filho integrou a representação do Brasil no Congresso de\nDireito Internacional Privado, realizado em Montevidéu.\n\nEm junho de 1941, o ministro do Trabalho, Indústria e Comércio, Valdemar\nFalcão, foi indicado para o Supremo Tribunal Federal e substituído\ninterinamente por Dulfe Pinheiro Machado. Em dezembro Vargas convidou\nMarcondes Filho para o cargo, ressaltando sua ligação com São Paulo,\nonde se encontrava grande parte da indústria instalada em território\nnacional. Segundo o historiador John Foster Dulles, essa escolha teve\nrelação com a crise política que em meados do ano levara à demissão do\ninterventor paulista, Ademar de Barros. Nos anos seguintes, a atuação de\nMarcondes Filho no governo federal ganhou grande expressão, levando-o a\nacumular a pasta do Trabalho com a da Justiça entre 1942 e 1945.\n\nEm 29 de dezembro de 1941, Marcondes Filho assumiu a chefia do\nMinistério do Trabalho, criado depois da Revolução de 1930 numa\ndemonstração da maior importância que o governo passou a conceder à\nindústria e ao operariado. A política oficial em relação aos\ntrabalhadores fora marcada nos anos anteriores pela combinação de\nconcessões efetivas a alguns de seus interesses – como a implantação do\nsalário mínimo em 1940 – com a subordinação crescente do movimento\noperário ao Estado, expressa inclusive na Constituição de 1937. A\nConstituição considerava o empregado, o empregador e o Estado como um só\nconjunto e determinava que a produção seria organizada em corporações\nque, “colocadas sob a assistência e proteção do Estado, são órgãos deste\ne exercem funções de poder público”. Somente os sindicatos regularmente\nreconhecidos pelo Ministério do Trabalho poderiam exercer seu papel de\nrepresentação, e a greve, definida como “recurso antissocial”, era\nproibida. Ao Ministério do Trabalho estavam vinculados os institutos de\nseguro social e de aposentadorias e pensões criados na década de 1930,\nalém do Serviço de Alimentação e Previdência Social (SAPS).\n\nMarcondes Filho deu continuidade à política social aplicada pelo Estado\nNovo. Em 1942, regulamentou o decreto de 8 de julho de 1940 que criou o\nimposto sindical, obrigando o trabalhador a contribuir com o equivalente\na um dia de trabalho anual em benefício da associação profissional de\nsua categoria, embora esse pagamento não implicasse sindicalização. A\narrecadação do imposto, feita através do Banco do Brasil, conferia ao\nEstado grande soma de recursos e maior capacidade de interferência na\nvida sindical. No mesmo ano, foi criado o Serviço Nacional de\nAprendizagem Industrial (Senai), instituição de direito privado\nsubordinada à Confederação Nacional da Indústria (CNI) e sustentada pela\ncontribuição compulsória das empresas, proporcional à sua folha de\npagamentos.\n\nCom a entrada do Brasil na Segunda Guerra Mundial, em agosto de 1942,\nforam tomadas medidas para aumentar o controle do ministério sobre o\nmovimento operário. No dia 31 desse mês, foi decretado que todas as\ncategorias passariam a colaborar “permanentemente com os poderes\npúblicos… no desenvolvimento da consciência cívica nacional… nos planos\nde mobilização econômica… na propaganda do serviço militar” etc. As\nassembleias ou reuniões de conselhos de representantes dos sindicatos\npassaram a depender de aprovação prévia das autoridades do Ministério do\nTrabalho, que deveriam também ser consultadas no caso dessas entidades\npretenderem se filiar a quaisquer movimentos, mesmo de caráter cívico.\nEsse elenco de medidas foi acrescido do decreto de 16 de setembro de\n1943, determinando que os dissídios coletivos só poderiam ser iniciados\ndepois de audiência dos sindicatos com o ministro do Trabalho,\nencarregado de apreciar sua oportunidade. Além disso, o quórum exigido\npara a realização de assembleias passou de 1/3 para a metade dos\nassociados dos sindicatos. Na mesma época, a pedido dos industriais, o\ngoverno permitiu o aumento da jornada diária de trabalho para dez horas.\n\nCoube a Marcondes Filho coordenar os trabalhos desenvolvidos por Dorval\nde Lacerda, Arnaldo Lopes Sussekind e José Segadas Viana, visando a\nsistematizar e ordenar toda a matéria referente à legislação social e à\norganização sindical. Desses estudos resultou a Consolidação das Leis do\nTrabalho (CLT), apresentada em 1^o^ de maio de 1943 e, no essencial,\nvigente até os dias atuais. Nela, foram minuciosamente regulamentadas as\nrelações entre empregados e empregadores, a proteção ao trabalhador e as\ncondições do trabalho fabril (horários, férias, higiene, iluminação,\nsegurança, trabalho noturno etc.), com especificações para diversas\nprofissões.\n\nA CLT regulou também as penalidades aplicáveis a operários e patrões em\ncaso de desobediência a seus dispositivos ou de decisões dos tribunais e\njuntas de conciliação da Justiça do Trabalho, onde, entre os juízes,\nteriam assento representantes classistas. Foi mantido o princípio do\nsindicato único por categoria, cujo reconhecimento continuou dependendo\ndo Ministério do Trabalho, que controlava minuciosamente o processo\neleitoral e a administração dos recursos da entidade, além de poder\ninterferir em seu funcionamento. Segundo o artigo 528 da CLT, “ocorrendo\ndissídios ou circunstâncias que perturbem o funcionamento do sindicato,\no Ministério do Trabalho, Indústria e Comércio poderá nele intervir por\nintermédio de delegado com atribuições para administração da associação,\ne executar ou propor medidas necessárias para normalizar-lhe o\nfuncionamento”.\n\nA CLT não foi apenas uma compilação das leis existentes. Representou, em\nmuitos aspectos, uma ampliação dos direitos do trabalhador, o que, junto\ncom outras medidas tomadas pelo Estado Novo, conferiu grande\npopularidade a Vargas e ao próprio Marcondes Filho, que dispunha de um\nprograma radiofônico semanal durante a *Hora do Brasil*.\n\nNo Ministério da Justiça\n\nA partir de 1942, a evolução da conjuntura internacional começou a\nprovocar divergências no interior do governo brasileiro, que desde 1939\nassumira posição de neutralidade em relação à Segunda Guerra Mundial,\nchegando a manifestar em algumas ocasiões velada simpatia pelas forças\ndo Eixo. A situação mudou com a entrada dos Estados Unidos na guerra e a\ncrescente simpatia da opinião pública pelos Aliados. Esses fatores\nrepercutiram fortemente no governo brasileiro, que foi submetido a\npressões internas e externas para romper relações com os países do Eixo.\nOsvaldo Aranha, ministro das Relações Exteriores e detentor de grande\nprestígio no governo, adotou uma posição abertamente favorável à\nparticipação do Brasil na luta contra o nazifascismo, sendo apoiado pelo\nministro da Fazenda, Artur de Sousa Costa. Entretanto, o chefe de\npolícia do Distrito Federal, Filinto Müller, e os generais Eurico Gaspar\nDutra e Pedro Aurélio de Góis Monteiro, respectivamente ministro da\nGuerra e chefe do Estado-Maior do Exército, opunham-se a essa\norientação. Segundo Edgar Carone, Marcondes Filho também era contrário\nao rompimento com o Eixo.\n\nEntre 15 e 28 de janeiro de 1942, foi realizada no Rio de Janeiro a III\nReunião de Consulta dos Ministros das Relações Exteriores das Repúblicas\nAmericanas, convocada pelos Estados Unidos. Durante o encontro o Brasil\nse posicionou ao lado dos Aliados e no último dia anunciou o rompimento\nde suas relações com o Eixo. Tal decisão provocou um aguçamento dos\nconflitos internos do governo e fortaleceu a atuação dos setores\nfavoráveis ao envio de tropas para a Europa. Pouco depois, os\nestudantes, defensores dessa proposta, resolveram promover uma\ngigantesca passeata no dia 4 de julho, data da independência dos Estados\nUnidos, obtendo o apoio de Osvaldo Aranha e de Ernâni Amaral Peixoto,\ninterventor federal no estado do Rio de Janeiro. Filinto Müller tentou\nimpedir a realização do ato, o que motivou violenta reação de Vasco\nLeitão da Cunha, chefe de gabinete e várias vezes ministro interino da\nJustiça. Eclodiu então dentro do governo uma grave crise ligada à\nquestão da participação brasileira na guerra, que levou ao afastamento\ndos principais expoentes civis pró-Eixo, como Filinto Müller, Francisco\nCampos (ministro da Justiça) e Lourival Fontes (chefe do Departamento de\nImprensa e Propaganda – DIP), embora não tenha havido mudanças nos altos\npostos militares.\n\nEm 17 de julho de 1942, Marcondes Filho assumiu assim, interinamente, a\nchefia do Ministério da Justiça, que passou a acumular com a pasta do\nTrabalho. Para a chefia de polícia do Distrito Federal foi nomeado o\ntenente-coronel Alcides Gonçalves Etchegoyen, e para o DIP, o major\nAntônio José Coelho dos Reis. Marcondes Filho foi efetivado no\nMinistério da Justiça em 28 de abril de 1943, quando crescia a oposição\nao Estado Novo.\n\nEm agosto seguinte, a Ordem dos Advogados do Brasil organizou um\ncongresso jurídico nacional para comemorar seu centenário, e convidou\nMarcondes Filho para presidi-lo. Durante o evento, grande número de\nparticipantes enviou um requerimento ao ministro solicitando a\nrealização de três sessões plenárias para a discussão de teses sobre\ndireitos humanos e democracia. O pedido foi negado, o que levou muitos\ncongressistas, entre os quais Pedro Aleixo e os demais delegados\nmineiros, a abandonar o encontro. O incidente motivou um almoço de\ndesagravo a Pedro Aleixo e originou o chamado *Manifesto dos mineiros*,\nlançado em 24 de outubro de 1943, reivindicando a implantação da\ndemocracia liberal. O documento obteve grande repercussão em todo o\npaís.\n\nNessa época, a oposição passou a defender a realização do plebiscito\nprevisto pela Constituição de 1937 para seis anos após a instalação do\nEstado Novo, destinado a referendar ou não o regime e a permanência de\nVargas na chefia do governo. Em discurso pronunciado no dia 10 de\nnovembro de 1943 durante a Conferência dos Conselhos Administrativos do\nEstado, Marcondes Filho justificou o adiamento do plebiscito em função\ndo estado de guerra, que provocara a suspensão “dos direitos\nindispensáveis ao livre exercício de qualquer processo de voto para a\nmanifestação da opinião pública”.\n\nDiante do enfraquecimento do regime, novas propostas políticas começaram\na ser formuladas a partir do próprio governo. Marcondes Filho propôs a\nrealização de eleições através da estrutura corporativa dos sindicatos\npor considerar esta “a maneira mais exequível e apropriada no Brasil\npara estabelecer o regime definitivo”. Embora a ideia tivesse encontrado\nforte oposição entre personalidades ligadas ao governo, Vargas afirmou,\nem discurso pronunciado no dia do sexto aniversário do Estado Novo, sua\nintenção de atribuir nova função política aos sindicatos. Segundo ele,\ndepois da guerra a estrutura política da nação seria reajustada através\nde consultas populares: “das classes trabalhadoras organizadas tiraremos\nde preferência os elementos necessários à representação nacional”.\n\nA partir de 1944, o quadro político se alterou rapidamente, com o\ncrescimento da oposição nos meios civis e militares. Em agosto, Osvaldo\nAranha e João Alberto Lins de Barros (revolucionário de 1930 e\npresidente da Fundação Brasil Central) pediram demissão de suas funções.\nGóis Monteiro, Juraci Magalhães, Eduardo Gomes, Cordeiro de Farias e\noutros influentes militares passaram a criticar abertamente o regime. Em\njaneiro de 1945, o I Congresso Brasileiro de Escritores se posicionou em\ndefesa da redemocratização. No mês seguinte, a publicação de uma\nentrevista de José Américo de Almeida no *Correio da Manhã* marcou o fim\nda censura à imprensa. No plano internacional, a iminente derrota do\nEixo contribuía para o fortalecimento das correntes democráticas.\n\nNesse contexto, Vargas encarregou Marcondes Filho de estudar as\nprovidências necessárias para a reabertura dos órgãos de representação\npolítica. Em 22 de fevereiro de 1945, recebeu deste uma exposição de\nmotivos quanto à adaptação das normas constitucionais à nova situação. O\ndocumento, publicado na íntegra no dia seguinte pelo jornal\nsituacionista carioca *O Radical*, enfatizava que a iniciativa do\nprocesso de redemocratização partia do próprio governo e defendia a\nrealização de eleições diretas para os poderes Executivo e Legislativo\ntanto em nível federal quanto estadual. Desaconselhava, entretanto, a\nconvocação de uma assembleia constituinte, reivindicação oposicionista,\ndefendendo que a liberalização deveria ocorrer nos marcos da\nConstituição de 1937.\n\nEsse documento, recebido com muitas críticas pela oposição, serviu de\nbase para a elaboração da Lei Constitucional n^o^ 9, também conhecida\ncomo Ato Adicional, de 28 de fevereiro de 1945, que fixou o prazo de 90\ndias para a convocação das eleições. A reação oposicionista à nova lei\ntambém foi extremamente negativa, chegando o *Diário Carioca* a publicar\nem manchete: “Em moldes totalitários! Decretado o Ato Adicional.\nMantidos os poderes ditatoriais do presidente da República.” Depois\ndessa reação negativa, Marcondes Filho foi substituído no Ministério da\nJustiça em 3 de março de 1945 pelo interventor federal em Pernambuco,\nAgamenon Magalhães, amigo pessoal do general Dutra. Manteve-se,\nentretanto, no cargo de ministro do Trabalho.\n\nA Formação do PTB e o Fim do Estado Novo\n\nEm março de 1945, os agrupamentos que deram origem aos novos partidos\npolíticos já estavam em vias de organização. No dia 27 desse mês, o\ninterventor federal em Minas Gerais, Benedito Valadares, apresentou a\ncandidatura do general Dutra à presidência. Em 7 de abril, importantes\nsetores oposicionistas, que apoiavam a candidatura de Eduardo Gomes,\nfundaram a União Democrática Nacional (UDN). Em 8 de abril, mais de\ncinco mil pessoas assinaram a ata de fundação do Partido Social\nDemocrático (PSD), formado principalmente em torno dos interventores\nfederais nos estados, com o apoio de Getúlio. Em meio às pressões, o\ngoverno decretou a anistia, em 18 de abril.\n\nNesse processo de reorganização partidária, Marcondes Filho, também\napoiado por Vargas, passou a dedicar-se à organização do Partido\nTrabalhista Brasileiro (PTB), que foi fundado em 15 de maio de 1945. A\nmovimentação em torno do PTB coincidiu com o chamado “movimento\nqueremista”, que reivindicava a convocação de uma constituinte com\nGetúlio Vargas no poder. Tal política era endossada pelo movimento\nsindical e também pelo Partido Comunista Brasileiro, então Partido\nComunista do Brasil (PCB), que nesse mês retornou à legalidade.\n\nEm 28 de maio de 1945 foi decretada a Lei Eleitoral, definindo as\ncondições (voto secreto, universal e obrigatório) do pleito para a\npresidência da República, para o Conselho Federal (que, na Constituição\nde 1937, correspondia ao Senado) e para a Câmara dos Deputados, e\nfixando a data de 2 de dezembro seguinte para a sua realização. O mesmo\ndecreto marcou para 6 de maio de 1946 as eleições para os governos e\nassembleias legislativas estaduais. A partir dessa lei, os partidos e\nagrupamentos políticos começaram a tomar providências para a obtenção do\nregistro junto à Justiça Eleitoral.\n\nA convenção nacional do PTB realizou-se no Rio de Janeiro em 14 de\nsetembro de 1945 e elegeu o mineiro Paulo Baeta Neves para a presidência\ndo partido. Getúlio Vargas e Marcondes Filho foram escolhidos,\nrespectivamente, presidente e vice-presidente de honra da agremiação.\nNesse período, a participação política dos sindicatos aumentou, com a\nrealização de uma série de comícios coordenados pelo Movimento\nUnificador dos Trabalhadores (MUT). No dia 10 de outubro Vargas\ndiscursou sobre os quatro objetivos fundamentais do PTB: “Primeiro,\ndefender os trabalhadores das tentativas de absorção por parte de\nelementos extremistas; segundo, evitar que os operários constituam massa\nde manobra para os políticos; terceiro, permitir que os trabalhadores\nescolham ‘representantes saídos do seu seio’; quarto, permitir a\n‘organização constitucional em bases verdadeiramente democráticas’.”\n\nA oposição via com crescente preocupação o surgimento do PTB e o\ncrescimento do “movimento queremista” (apoiado pelos comunistas),\ntemendo que Vargas estivesse preparando as condições para sua\npermanência no poder. Assim, a antecipação das eleições para prefeitos e\ngovernadores também para 2 de dezembro foi interpretada como o início de\numa manobra para o cancelamento do pleito, o que levou os liberais a\napelar diretamente para a intervenção das forças armadas a fim de forçar\na renúncia de Vargas.\n\nNo dia 27 de outubro, o chefe de polícia do Distrito Federal, João\nAlberto, proibiu a realização de um comício programado pelos sindicatos,\no que levou Getúlio a substituí-lo por seu irmão Benjamim Vargas. Essa\nmedida encontrou forte resistência entre civis e militares, levando à\ndeflagração, no dia 29, de um golpe militar articulado pelo general Góis\nMonteiro, que em agosto assumira o Ministério da Guerra. Na ausência de\num Poder Legislativo, o presidente do Supremo Tribunal Federal, José\nLinhares, assumiu a presidência da República e, em consequência,\nMarcondes Filho deixou o Ministério do Trabalho, permanecendo algum\ntempo em prisão domiciliar.\n\nDurante o Estado Novo, Marcondes Filho se empenhou também em aprimorar\nos instrumentos estatais de apoio à industrialização, tendo sido o\ncriador, em 1944, do Conselho Nacional de Política Industrial e\nComercial (CNPIC), que contou com a participação do empresário Roberto\nSimonsen.\n\nNo Senado\n\nApós a queda do Estado Novo, Marcondes Filho retornou a São Paulo com a\nsaúde gravemente abalada. Encontrava-se ainda internado em hospital\nquando, no dia 2 de dezembro de 1945, foi eleito senador por São Paulo à\nAssembleia Nacional Constituinte na legenda do PTB, junto com Getúlio\nVargas. Entretanto, só teve condições de assumir efetivamente o mandato\ndurante a legislatura ordinária que se seguiu ao fim dos trabalhos\nconstituintes, passando então a presidir a Comissão Interparlamentar de\nDireito Social. Nesse período, defendeu na tribuna do Senado sua gestão\nà frente do Ministério do Trabalho e o próprio Estado Novo, exerceu a\npresidência da Comissão Técnica de Trabalho e Legislação Social, e\napresentou projetos criando a disciplina de psicologia médica no ensino\nde nível superior e o Código Brasileiro de Radiodifusão.\n\nEm 1951, Vargas retornou à presidência através do voto direto, tendo\ncomo companheiro de chapa João Café Filho, que, de acordo com a\nConstituição de 1946, tornou-se vice-presidente da República e\npresidente do Senado. Entre julho e dezembro, Marcondes Filho exerceu a\npresidência da comissão executiva da seção paulista do PTB, que\nconseguiu, nos pleitos municipais realizados nesse período, elevar de\noito para 82 o número de seus prefeitos no estado. Ainda em 1951,\napoiado por Café Filho, Marcondes Filho derrotou Fernando Melo Viana na\ndisputa pela vice-presidência do Senado, posto que ocuparia durante três\nanos através de sucessivas reeleições. Viajou em 1952 para a Europa a\nfim de estudar uma solução para o problema de novas instalações para o\nSenado. No dia 1^o^ de junho, obteve uma audiência com o papa Pio XII e\ntornou-se portador de uma mensagem sua ao povo brasileiro, que teve\nampla divulgação no país.\n\nSempre fiel a Vargas, Marcondes Filho teve seu nome cogitado em 1954\npara candidatar-se ao governo de São Paulo, o que não se verificou. Em\nmarço desse ano, foi nomeado vice-presidente da delegação brasileira à\nConferência de Caracas, que discutiu a situação das colônias e\nterritórios ocupados por potências extracontinentais na América. Os\nbrasileiros defenderam a tese de que a solução do problema fosse buscada\nno foro da Organização das Nações Unidas (ONU), mas sua proposta foi\nderrotada pelo projeto argentino, que afirmava a competência da\ncomunidade das repúblicas americanas para buscar sozinha o fim da\ndominação estrangeira sobre aqueles territórios. Em 12 de abril de 1954,\nMarcondes Filho ocupou a tribuna do Senado para fazer um minucioso\nrelato sobre sua participação na conferência.\n\nCom o suicídio de Vargas e a ascensão de Café Filho à presidência da\nRepública em agosto de 1954, Marcondes Filho passou a ocupar a\npresidência do Senado. No exercício dessas funções, conseguiu obter o\nconsenso das correntes parlamentares na interpretação do texto\nconstitucional a fim de que o novo presidente pudesse ser formalmente\nempossado perante o Congresso, e sustentou também – com êxito – a tese\nde que não havia necessidade de eleger novo vice-presidente. Pouco\ndepois, Café Filho, interessado em obter o apoio do PTB para seu\ngoverno, convidou Marcondes Filho a reassumir o Ministério do Trabalho,\nmas este declinou do convite, afirmando que sua participação no Senado\nera mais conveniente aos interesses de São Paulo.\n\nMarcondes Filho não foi incluído na lista de candidatos do PTB às\neleições parlamentares de 3 de outubro de 1954. Em fevereiro do ano\nseguinte, substituiu o demissionário Miguel Seabra Fagundes no\nMinistério da Justiça. Sua nomeação, que contrabalançava a forte posição\nda UDN no gabinete de Café Filho, foi recebida com hostilidade pelo\ngovernador de São Paulo, Jânio Quadros, e pelos ministros militares mais\npróximos daquele partido, gerando o boato de que Juarez Távora (chefe da\nCasa Militar), Eduardo Gomes (ministro da Aeronáutica) e Edmundo Amorim\ndo Vale (ministro da Marinha) pediriam demissão, o que não chegou a\nocorrer.\n\nDe Volta ao Ministério da Justiça\n\nMarcondes Filho elaborou o programa básico do governo de Café Filho,\npublicado em 30 de março de 1955 com o objetivo de conciliar todas as\nprincipais correntes políticas e ampliar a base de sustentação do\ngoverno. Entretanto, suas propostas fundamentais geraram grande\npolêmica. Pretendia reduzir os gastos públicos supérfluos, reprimir a\nespeculação, coibir os lucros ilícitos e taxar rigorosamente os\nexcessivos, atrair capitais estrangeiros e manter a legislação vigente\nsobre a exploração do petróleo. Falava também em “apressar a adoção de\nleis e medidas administrativas que… corrijam a inconveniência do nosso\nregime de exploração da terra”, defendendo o acesso do trabalhador à\nterra e a extensão do sistema de previdência social ao campo. Do ponto\nde vista político, propunha que a Constituição fosse emendada, a fim de\ntornar necessária a obtenção de maioria absoluta de votos para a eleição\ndo presidente, dos governadores e dos prefeitos. Determinava ainda a\nadoção de uma reforma eleitoral, o cancelamento do registro dos partidos\nque não elegessem candidatos para as assembleias legislativas e a\nproibição aos parlamentares de mudar de legenda durante o exercício do\nmandato.\n\nMarcondes Filho encomendou em seguida ao ministro Edgar Costa,\npresidente do Tribunal Superior Eleitoral, a preparação de um projeto de\nreforma do Código Eleitoral, tendo em vista o pleito de 3 de outubro de\n1955. A proposta então elaborada – e posteriormente recusada pela Câmara\ndos Deputados por 97 votos contra 11 – indicava providências visando à\nmelhor identificação dos eleitores e instituía a cédula oficial de\nvotação (na época, cada partido imprimia suas próprias cédulas).\n\nEm 18 de abril de 1955, Marcondes Filho pediu demissão do ministério,\nsendo substituído por José Eduardo Prado Kelly, membro da UDN. Sua\ndecisão foi tomada em consequência do acordo entre Jânio Quadros e Café\nFilho, pelo qual o primeiro abriu mão de sua candidatura à presidência\nda República em troca da indicação de José Maria Whitaker e Otávio\nMarcondes Ferraz para os ministérios da Fazenda e de Viação e Obras\nPúblicas, respectivamente. Essa mudança no gabinete, realizada na\nprimeira quinzena de abril, enfraqueceu a posição de Marcondes Filho,\nque, ao pedir demissão, ressaltou a falta de apoio do governo de São\nPaulo a seu nome.\n\nQuatro meses após sua renúncia, partiu para a Europa, cumprindo a\nmissão, confiada pelo Ministério da Educação e Cultura, de estudar as\nmedidas necessárias ao incremento da cooperação intelectual\nluso-brasileira. Durante a viagem, encontrou-se novamente com o papa Pio\nXII, a quem entregou uma mensagem de agradecimento de Café Filho pela\natenção dedicada pelo Sumo Pontífice à idealização do Congresso\nEucarístico Internacional no Rio de Janeiro em 1955.\n\nDe volta ao Brasil, retirou-se definitivamente da vida pública e retomou\nsuas atividades profissionais em São Paulo, onde faleceu em 16 de\noutubro de 1974.\n\nEra casado com Maria Mercedes Marcondes Machado.\n\nPublicou inúmeros artigos, discursos e conferências. Seu arquivo\nencontra-se depositado no Centro de Pesquisa e Documentação de História\nContemporânea do Brasil (Cpdoc) da Fundação Getulio Vargas.\n\nJorge Miguel Mayer\n\n**FONTES:** ARAÚJO, A. *Chefes*; ARQ. NAC. *Relação*; CÂM. DEP.\n*Deputados*; CARONE, E. *Estado*; CISNEIROS, A. *Parlamentares*;\nCONSULT. MAGALHÃES, B.; *Correio da Noite* (10/2/1943); CORRESP. MIN.\nTRAB.; *Diário do* *Congresso Nacional*; DINIZ, E. *Empresário*;\n*Documentário foto-biográfico*; DULLES, J. *Getúlio*; *Encic. Mirador*;\n*Estado de S. Paulo* (3/4/1945); FICHÁRIO PESQ. M. AMORIM; *Grande\nencic. Delta*; IANNI, O. *Estado e* *capitalismo*; IANNI, O. *Estado e\nplanejamento*; *Jornal do Brasil* (17/10/1974); LEITE, A. *História*;\nLEITE, A. *Páginas*; MACEDO, N. *Aspectos*; MELO, L. *Dicionário*; MIN.\nGUERRA. *Almanaque*; MIN. GUERRA. *Anais*; MIN. MAR. *Almanaque*;\n*Ministros da Justiça*;*Personalidades*; RODRIGUES, L. *Conflito*;\nSENADO. *Relação*; SENADO. *Relação dos líderes*; SENADO. *Senado*;\nSILVA, G. *Constituinte*; SILVA, H. *1945*; SOUSA, J. *Índice*; WEFFORT,\nF. *Origens*.\n","ref":"**FONTES:** ARAÚJO, A. *Chefes*; ARQ. NAC. *Relação*; CÂM. DEP.\n*Deputados*; CARONE, E. *Estado*; CISNEIROS, A. *Parlamentares*;\nCONSULT. MAGALHÃES, B.; *Correio da Noite* (10/2/1943); CORRESP. MIN.\nTRAB.; *Diário do* *Congresso Nacional*; DINIZ, E. *Empresário*;\n*Documentário foto-biográfico*; DULLES, J. *Getúlio*; *Encic. Mirador*;\n*Estado de S. Paulo* (3/4/1945); FICHÁRIO PESQ. M. AMORIM; *Grande\nencic. Delta*; IANNI, O. *Estado e* *capitalismo*; IANNI, O. *Estado e\nplanejamento*; *Jornal do Brasil* (17/10/1974); LEITE, A. *História*;\nLEITE, A. *Páginas*; MACEDO, N. *Aspectos*; MELO, L. *Dicionário*; MIN.\nGUERRA. *Almanaque*; MIN. GUERRA. *Anais*; MIN. MAR. *Almanaque*;\n*Ministros da Justiça*;*Personalidades*; RODRIGUES, L. *Conflito*;\nSENADO. *Relação*; SENADO. *Relação dos líderes*; SENADO. *Senado*;\nSILVA, G. *Constituinte*; SILVA, H. *1945*; SOUSA, J. *Índice*; WEFFORT,\nF. *Origens*.\n","dic":"DHBPR"}
