{"title":"MARIZ, Antônio Marques da Silva","cargoss":["Deputado federal"],"cargos_esp":[0],"datas_ini":[1894],"datas_fim":[1902],"estados":["PB"],"autor":["Raimundo Helio Lopes"],"content":"**MARIZ, Antônio Marques da Silva**\n\n\\*dep. fed. PB 1894-1902.\n\n*Antônio Marques da Silva Mariz* nasceu na cidade de Sousa (PB).\n\nFormou-se em medicina e depois de formado clinicou por muitos anos no\nestado da Paraíba.\n\nIngressou na atividade política ainda durante o Império, quando se\nfiliou ao Partido Liberal. Depois que o marechal Deodoro da Fonseca,\nsustentado por setores do Exército e por civis, depôs o gabinete de\nministros do Império chefiado pelo visconde de Ouro Preto e instalou o\nregime republicano em 15 de novembro de 1889, aderiu à República e logo\nelegeu-se deputado estadual na Paraíba, participando da Assembleia\nConstituinte do estado. Em 1894 foi eleito deputado federal pela\nParaíba. Reeleito em 1897 e em 1900, ocupou uma cadeira na Câmara dos\nDeputados, no Rio de Janeiro, então Distrito Federal, até dezembro de\n1902.\n\nSeu filho José Marques da Silva Mariz foi deputado estadual (1928-1930),\nparticipou da Revolução de 1930, foi interventor na Paraíba (1934-1935)\ne voltou à Assembleia Legislativa estadual (1951-1953). Seu neto e\nhomônimo Antônio Mariz foi deputado federal (1971-1983), constituinte\n(1987-1988), mais uma vez deputado federal (1987-1991), senador\n(1991-1994) e governador da Paraíba (1995).\n\nRaimundo Helio Lopes\n\n**FONTES:** ABRANCHES, J. *Governos*; CÂM. DEP. *Deputados brasileiros.*\n","ref":"**FONTES:** ABRANCHES, J. *Governos*; CÂM. DEP. *Deputados brasileiros.*\n","dic":"DHBPR"}
