{"title":"MARQUES, Joaquim Costa","cargoss":["Deputado federal","Presidente de associação ou confederação de empregados ou empregadores","Deputado federal"],"cargos_esp":[0,0,0],"datas_ini":[1906,1911,1918],"datas_fim":[1911,1915,1920],"estados":["MT","MT","MT"],"autor":[0],"content":"**MARQUES, Joaquim Costa**\n\n**\\***dep. fed. MT 1906-1911; pres. MT 1911-1915; dep. fed. MT\n1918-1920.\n\n*Joaquim Augusto da Costa Marques*nasceu no município de Poconé (MT) no\ndia 7 de junho de 1861, filho de Salvador da Costa Marques e de Augusta\nNunes Rondon Marques, neta do barão de Poconé. Seu pai foi\ntenente-coronel da Guarda Nacional, chefe político no Império e\nproprietário de grandes extensões de terras; sua mãe também descendia de\nfamília de fazendeiros.\n\nIniciou seus estudos em Poconé e com 12 anos de idade foi para Cuiabá,\nonde se matriculou no Seminário da Conceição. Em 1882 foi para o Rio de\nJaneiro para fazer os estudos preparatórios, e em seguida mudou-se para\nSão Paulo, onde se bacharelou em 1891 pela Faculdade de Direito do Largo\nde São Francisco. Retornou a Mato Grosso, abriu escritório de advocacia\ne iniciou as atividades profissionais na cidade de Cáceres.\n\nFoi deputado estadual nos triênios 1898-1900 e 1900-1902. No movimento\narmado de 1899, que opôs Generoso Ponce à família Murtinho, ficou do\nlado de Ponce. Em 1906 foi eleito deputado federal e assumiu o mandato\nna Câmara dos Deputados no Rio de Janeiro, então Distrito Federal. Ainda\nnesse ano participou, junto com Generoso Ponce, do movimento político\nque derrotou o então presidente do estado Totó Pais. Foi reeleito\ndeputado federal em 1909, mas em 1911, já filiado ao Partido Republicano\nConservador **(**PRC), criado pelo senador Antônio Azeredo, de cujo\ndiretório era membro, renunciou ao mandato para assumir a presidência de\nMato Grosso, sucedendo a Pedro Celestino Correia da Costa.\n\nEmpossado em 15 de agosto de 1911, ainda nesse ano criou a Secretaria de\nInterior, Justiça e Fazenda e a Secretaria de Agricultura, Indústria,\nComércio, Viação e Obras Públicas do estado. Foi o primeiro governante\nrepublicano a completar integralmente o mandato sem nenhuma interrupção\nou afastamento da administração estadual. Transmitiu o governo em 15 de\nagosto de 1915 a Caetano Manuel de Faria e Albuquerque. Em 1918 voltou a\nser eleito deputado federal e exerceu o mandato até dezembro de 1920. Em\n1931 foi prefeito da cidade de Cáceres por curto espaço de tempo.\n\nEra proprietário da Usina da Ressaca, que produzia açúcar e aguardente,\no maior empreendimento no gênero no município de Cáceres.\n\nFaleceu na cidade de Cáceres no dia 2 de dezembro de 1939.\n\nJoão Edson Fanaia\n\n**FONTES:** ABRANCHES, J. *Governo*s; MARQUES FILHO, J. *Trajetória*;\nPÓVOAS, N. *Galeria*.\n","ref":"**FONTES:** ABRANCHES, J. *Governo*s; MARQUES FILHO, J. *Trajetória*;\nPÓVOAS, N. *Galeria*.\n","dic":"DHBPR"}
