{"title":"MARQUES, Manuel de Sampaio","cargoss":["Membro de junta governativa","Deputado federal"],"cargos_esp":[0,0],"datas_ini":[1894,1906],"datas_fim":[1894,1911],"estados":["AL","AL"],"autor":[0],"content":"**MARQUES, Manuel de Sampaio**\n\n\\* junta gov. AL 1894; dep. fed. AL 1906-1911.\n\n*Manuel de Sampaio Marques* nasceu em São Miguel dos Campos (AL) no dia\n24 de maio de 1866 (ou 1869), filho de Antônio Jerônimo Marques e de\nJucunda Catarina de Sampaio Marques.\n\nEstudou em Maceió, concluindo os preparatórios no Liceu Alagoano.\nFormou-se em medicina pela Faculdade da Bahia em 1890, com a tese\n“Histeria no homem”. Foi médico do Serviço de Higiene Municipal de\nMaceió, secretário da Fazenda e professor de mineralogia e geologia do\nLiceu Alagoano.\n\nAo lado de José Tavares da Costae Francisco Soares Palmeira, integrou a\njunta governativa que substituiu o governador deposto Gabino Besouro,\naclamada em 16 de julho de 1894. A junta só permaneceu no poder até o\ndia seguinte, quando transmitiu o governo ao presidente do Tribunal\nSuperior do Estado, Tibúrcio Valeriano da Rocha Lins. No ano seguinte\nfoi eleito deputado estadual para a legislatura 1895-1896. Em 7 de\njaneiro de 1905 tomou posse na intendência de Maceió, pela qual\nrespondeu até 7 de janeiro de 1907. Foi ainda eleito deputado federal\npara as legislaturas 1906-1908 e 1909-1911.\n\nMédico da Santa Casa de Misericórdia, foi também foi diretor e provedor\nda instituição. Foi sócio do Instituto Histórico e Geográfico de Alagoas\ne grão-mestre da loja maçônica Perfeita Amizade Alagoana.\n\nFaleceu em Maceió no dia 2 de julho de 1951.\n\nReynaldo de Barros\n\n**FONTES:** BARROS, F. *A B C das Alagoas*; CÂM. DEP. *Deputados\nbrasileiros*.\n","ref":"**FONTES:** BARROS, F. *A B C das Alagoas*; CÂM. DEP. *Deputados\nbrasileiros*.\n","dic":"DHBPR"}
