{"title":"MARTINS, Eliseu de Sousa","cargoss":["Presidente de associação ou confederação de empregados ou empregadores","Presidente de associação ou confederação de empregados ou empregadores","Constituinte","Senador"],"cargos_esp":[0,0,0,0],"datas_ini":[1878,1879,1891,1891],"datas_fim":[1879,1880,1891,1894],"estados":["RN","ES",0,"PI"],"autor":["Raimundo Helio Lopes"],"content":"**MARTINS, Eliseu de Sousa**\n\n\\*pres. RN 1878-1879; pres. ES 1879-1880; const. 1891; sen. PI\n1891-1894.\n\n*Eliseu de Sousa Martins* nasceu em Gurgueia (PI) em 1842.\n\nBacharelou-se na Faculdade de Direito do Recife e iniciou a vida\npolítica ainda no Império, quando se filiou ao Partido Liberal. Foi\npresidente da província do Rio Grande do Norte de 1878 a 1879 e da\nprovíncia do Espírito Santo de 1879 a 1880.\n\nProclamada a República (15/11/1889) e convocadas as eleições para o\nCongresso Nacional Constituinte, foi eleito senador pelo Piauí em\nsetembro de 1890. Tomou posse em 15 de novembro e, durante os trabalhos\nde elaboração da primeira Constituição republicana do Brasil, integrou,\ncomo primeiro-secretário, a Mesa Diretora da Constituinte. Depois de\npromulgada a Constituição em 24 de fevereiro de 1891, em junho seguinte\npassou a exercer o mandato ordinário.\n\nFaleceu em 1894 no exercício do mandato.\n\nRaimundo Helio Lopes\n\n**FONTES:** ABRANCHES, J. *Governos*; LEITE NETO, L. *Catálogo\nbiográfico*.\n","ref":"**FONTES:** ABRANCHES, J. *Governos*; LEITE NETO, L. *Catálogo\nbiográfico*.\n","dic":"DHBPR"}
