{"title":"MARTINS, Eneias","cargoss":["Deputado federal","Deputado federal","Deputado federal","Governador de estado ou do Distrito Federal"],"cargos_esp":[0,0,0,0],"datas_ini":[1894,1903,1897,1913],"datas_fim":[1896,1905,1899,1917],"estados":["PA","AM","AM","PA"],"autor":["Adrianna Setemy"],"content":"**MARTINS, Eneias**\n\n\\*jornalista; dep. fed. PA 1894-1896; dep. fed. AM 1897-1899 e\n1903-1905; gov. PA 1913-1917.\n\n*Eneias Martins* nasceu em Cametá (PA) em 1872, filho de um modesto\nprofessor primário.\n\nFez o curso secundário em Belém, no Liceu Paraense, e de lá partiu para\nPernambuco, onde se bacharelou em ciências jurídicas e sociais na\nFaculdade de Direito do Recife em 1893. Logo em seguida regressou a\nBelém e, mediante concurso, foi nomeado professor de história do Liceu\nParaense.\n\nDe 1894 e 1896 exerceu o mandato de deputado federal pelo Pará, eleito\npelo Partido Republicano Federal. Em 1895, fundou *A Folha do Norte*,\njornal diário de conteúdo noticioso, político e literário, que teve seu\nprimeiro número veiculado em 1^o^ de janeiro de 1896. O objetivo\nprincipal do jornal era lutar pelo desenvolvimento político e social da\nregião e defender o Partido Republicano Federal, então chefiado por\nLauro Sodré. Nesse período foi também procurador fiscal do estado do\nAmazonas e, por conta disso, esteve na América do Norte a fim de\nnegociar um empréstimo para aquele estado. Em 1897 foi reeleito deputado\nfederal, mas agora pelo estado do Amazonas. Exerceu o mandato até o fim\nda legislatura, em 1899.\n\nDe volta à Câmara dos Deputados entre 1903 e 1905, destacou-se em 1903\nna defesa do Tratado de Petrópolis, que formalizou a incorporação do\nAcre ao território brasileiro e pôs fim à disputa entre Brasil e\nBolívia. Sua atuação lhe valeu o reconhecimento de suas qualidades de\ndiplomata pelo barão do Rio Branco, que o nomeou sucessivamente ministro\ndo Brasil na Colômbia, no Peru e em Lisboa. Entretanto, não chegou a\nocupar o último posto, pois, como o barão do Rio Branco foi acometido\npor graves problemas renais, nomeou-o subsecretário do gabinete do\nMinistério das Relações Exteriores. Assumiu interinamente o ministério\nentre os dias 10 e 14 de fevereiro de 1912.\n\nEm 1^o^ de fevereiro de 1913 assumiu o governo do estado do Pará,\nsucedendo a João Antônio Luís Coelho. Em 27 de dezembro de 1916 foi\ndeposto por um levante militar, e em janeiro de 1917 embarcou para o Rio\nde Janeiro. Após sua saída, o governo foi entregue ao desembargador\nAugusto Borborema, presidente do Tribunal de Justiça do estado. Em 1^o^\nde fevereiro, este foi substituído por Lauro Sodré, que iniciou assim\nseu segundo governo no Pará.\n\nFaleceu no Rio de Janeiro em 2 de julho de 1919.\n\nAdrianna Setemy\n\n**FONTES:** *Capital*: Diário Republicano da Noite (Lisboa, 9/2/1912). O\nsr. Dr. Enéas Martins, ministro do Brasil em Portugal;. Projeto de\nimagem de publicações oficiais brasileiras do Center for Research\nLibraries e Latin-american Microfilm Project. *Mensagens dos Presidentes\nde Província (1830-1930).* Disponível em:\n\\<www.crl.edu/content.asp?l1=4&l2=18&l3=33\\>. Acesso em: 8/1/2009.\n","ref":"**FONTES:** *Capital*: Diário Republicano da Noite (Lisboa, 9/2/1912). O\nsr. Dr. Enéas Martins, ministro do Brasil em Portugal;. Projeto de\nimagem de publicações oficiais brasileiras do Center for Research\nLibraries e Latin-american Microfilm Project. *Mensagens dos Presidentes\nde Província (1830-1930).* Disponível em:\n\\<www.crl.edu/content.asp?l1=4&l2=18&l3=33\\>. Acesso em: 8/1/2009.\n","dic":"DHBPR"}
