{"title":"MARTINS, Manuel Joaquim de Mendonça","cargoss":["Deputado federal","Senador"],"cargos_esp":[0,0],"datas_ini":[1915,1921],"datas_fim":[1920,1930],"estados":["AL","AL"],"autor":[0],"content":"**MARTINS, Manuel Joaquim de Mendonça**\n\n\\*dep. fed. AL 1915-1920; sen. AL 1921-1930.\n\n*Manuel Joaquim de Mendonça Martins* nasceu no Rio de Janeiro, então\ncapital do Império, no dia 19 de fevereiro de 1885, filho de Elísio\nFirmo Martins e de Justina de Mendonça Castelo Branco.\n\nFez os primeiros estudos e bacharelou-se pela Faculdade de Direito do\nRio de Janeiro, então Distrito Federal, em 1910.\n\nTransferindo-se para Alagoas, aí exerceu a advocacia e se dedicou à\natividade agrícola em Camaragibe. Foi eleito deputado estadual na\nlegislatura 1913-1914, e deputado federal por Alagoas nas legislaturas\n1915-1917 e 1918-1920. Em 1921 conquistou uma cadeira no Senado Federal\ncom mandato de nove anos. Reeleito, teria o mandato interrompido em\noutubro de 1930, pela revolução que conduziu Getúlio Vargas ao poder e\nfechou os órgãos legislativos do país. Em sua passagem pelo Senado foi\nquarto-secretário de 1921 a 1922 e primeiro-secretário de 1923 a 1930.\n\nCom a reconstitucionalização do país após a promulgação da Constituição\nde 1934, voltou a exercer o mandato de deputado estadual em Alagoas\nentre 1935 e 1937. Nesse último ano mais uma vez os órgãos legislativos\nforam fechados, agora pelo golpe do Estado Novo.\n\nReynaldo de Barros\n\n**FONTES:** BARROS, F. *A B C das Alagoas*; CÂM. DEP. *Deputados\nbrasileiros*; LEITE NETO, L. *Catálogo biográfico*.\n","ref":"**FONTES:** BARROS, F. *A B C das Alagoas*; CÂM. DEP. *Deputados\nbrasileiros*; LEITE NETO, L. *Catálogo biográfico*.\n","dic":"DHBPR"}
