{"title":"MARTINS, Sousa","cargoss":["Ministro do Supremo Tribunal Federal"],"cargos_esp":[0],"datas_ini":[1894],"datas_fim":[1896],"estados":[0],"autor":["Eduardo Junqueira"],"content":"**MARTINS, Sousa**\n\n\\*magistrado; min. STF 1894-1896.\n\n*Antônio de Sousa Martins* nasceu em Oeiras, província do Piauí, em\n1829, filho de Manuel de Sousa Martins e de Ana Rodrigues de Santana.\n\nObteve o grau de bacharel em ciências jurídicas e sociais pela Faculdade\nde Direito de Olinda em 1853 e iniciou a carreira na magistratura ao\nser, no ano seguinte, nomeado juiz municipal e de órfãos em sua terra\nnatal. Ali permaneceu até 1859, quando assumiu idêntico cargo no termo\nde Santo Antônio da Patrulha, também no Piauí. Habilitado nos termos da\nlei, foi nomeado juiz de direito da comarca de Alegrete, no Rio Grande\ndo Sul, por decreto de outubro de 1860. Entre 1862 e 1864, foi chefe de\npolícia do Espírito Santo e Minas Gerais. Dali foi designado para a\ncomarca de Taubaté, São Paulo, até 1866, quando deixou a província\npaulista por haver sido removido para a comarca de Itapicuru-Mirim, no\nMaranhão. Em 1873 foi removido para a comarca da Paraíba.\n\nEm 1878 foi nomeado desembargador da Relação de Cuiabá, e em 1880 foi\nremovido para a de Ouro Preto. Nessa Relação, exerceu o cargo de\nprocurador da coroa, soberania e fazenda nacional, de 1880 a outubro de\n1881, quando foi removido para a Relação de Porto Alegre. Em 1882 foi\npresidente da Relação gaúcha, cargo a que foi reconduzido por decreto em\n1885 e 1888 e por eleição de seus pares em sessão de março de 1890, já\nno período republicano. Com a reorganização da Justiça sob a República,\nem janeiro de 1891 foi nomeado juiz da Corte de Apelação do Distrito\nFederal, nome dado à antiga Relação do Império, e eleito seu\nvice-presidente. Ainda em 1891, foi nomeado ministro adjunto do Conselho\nSupremo Militar, em substituição a José da Mota Azevedo Correia, que\nfora aposentado, razão por que deixou suas funções naquela Corte de\nApelação.\n\nNomeado ministro do Supremo Tribunal Federal (STF), tomou posse em\noutubro de 1894 e foi nomeado procurador geral da República,\npermanecendo no exercício de suas funções até falecer. Faleceu na cidade\ndo Rio de Janeiro, então Distrito Federal, no dia 25 de dezembro de\n1896.\n\nFoi casado com Gertrudes Ataíde Martins.\n\nEduardo Junqueira\n\n**FONTES:** MATTOSO, P. *Supremo Tribunal*; MELLO FILHO, J. *Notas*;\nRODRIGUES, L. *História*; SUP. TRIB. FED. Disponível em:\n\\<www.stf.jus.br/portal/ministros\\>.\n","ref":"**FONTES:** MATTOSO, P. *Supremo Tribunal*; MELLO FILHO, J. *Notas*;\nRODRIGUES, L. *História*; SUP. TRIB. FED. Disponível em:\n\\<www.stf.jus.br/portal/ministros\\>.\n","dic":"DHBPR"}
