{"title":"MASCARENHAS, Domingos","cargoss":["Deputado federal"],"cargos_esp":[0],"datas_ini":[1906],"datas_fim":[1930],"estados":["RS"],"autor":["Raimundo Helio Lopes"],"content":"**MASCARENHAS, Domingos**\n\n\\*dep. fed. RS 1906-1930.\n\n*Domingos Pinto de Figueiredo Mascarenhas Júnior* nasceu em Pelotas (RS)\nno dia 10 de fevereiro de 1866, filho de Domingos Pinto de Figueiredo\nMascarenhas e de Florinda Amália Barcelos Mascarenhas.\n\nAinda durante o Império, ingressou na Faculdade de Medicina da cidade do\nRio de Janeiro, então capital do Império. Ainda estudante dessa\nfaculdade, passou a defender as causas republicana e abolicionista,\nsendo um dos fundadores do Clube Republicano da Escola de Medicina e do\nClube Republicano Sul Rio-Grandense. Por sua atividade política,\naproximou-se de Silva Jardim e o auxiliou em muitas de suas atividades.\n\nDepois da proclamação da República (15/11/1889) fez parte da brigada\nacadêmica, criada para preservar as instituições públicas durante as\nagitações e instabilidades políticas dos primeiros momentos\nrepublicanos. Em seguida, tornou-se autoridade policial do Distrito\nFederal, como passou a ser denominada a cidade do Rio de Janeiro após a\npromulgação da primeira Constituição republicana brasileira em 24 de\nfevereiro de 1891.\n\nPassou a fazer oposição ao governo do presidente Deodoro da Fonseca\n(1889-1891) depois que ele, em 3 de novembro de 1891, diante da\nimpossibilidade de resolver a crise política por que passava o seu\ngoverno, dissolveu o Congresso Nacional. A Marinha, apoiada pelos\nestados de São Paulo, Minas Gerais e Rio Grande do Sul, iniciou uma\nrevolta na baía da Guanabara. Nesse momento, Domingos Mascarenhas\ningressou no corpo armado de alunos da Escola Militar da Praia Vermelha,\nsob o comando de Serzedelo Correia, que pedia a revogação da dissolução\ndo Legislativo. Diante da ameaça de uma guerra civil, Deodoro renunciou\nno dia 23 desse mesmo mês, assumindo o vice-presidente Floriano Peixoto\n(1891-1894). Domingos Mascarenhas passou a apoiar o governo de Floriano\ne foi um dos fundadores do Batalhão Benjamin Constant, um dos\nagrupamentos militares responsáveis pela defesa do governo federal\ndurante a Revolta da Armada. Essa revolta se estendeu de setembro de\n1893 a março de 1894, sob a chefia do almirante Custódio de Melo e mais\ntarde do almirante Luís Felipe Saldanha da Gama, envolvendo a Esquadra\nsediada na baía da Guanabara com o objetivo de derrubar Floriano\nPeixoto. A insurreição, que incluiu a tomada da capital de Santa\nCatarina por destacamentos rebeldes, encerrou-se com o asilo dos\nrevoltosos em embarcações portuguesas fundeadas no Rio de Janeiro.\n\nApós a revolta, ainda em 1894, Domingos Mascarenhas formou-se em\nmedicina e passou a clinicar em Bajé (RS). Alguns meses depois mudou-se\npara a Europa, estudando dois anos em hospitais de Paris. Retornou a\nBajé, onde integrou o núcleo de positivistas, seguidores da filosofia de\nAugusto Comte. Nesse período, ingressou no Partido Republicano\nRio-Grandense (PRR), agremiação fundada em 23 de fevereiro de 1882 e\nliderada por Júlio de Castilhos, tornando-se um dos chefes políticos\nestaduais.\n\nFoi eleito deputado federal pelo estado do Rio Grande do Sul em janeiro\nde 1903. Assumindo, em maio seguinte, sua cadeira na Câmara dos\nDeputados no Rio de Janeiro, então Distrito Federal, foi sucessivamente\nreeleito até a legislatura iniciada em maio de 1930, sempre na legenda\ndo PRR. Não concluiu esse último mandato, pois, em outubro seguinte, com\na vitória da Revolução de 1930 que depôs o presidente Washington Luís\n(1926-1930) e levou Getúlio Vargas ao poder, todos os órgãos\nlegislativos do país foram extintos.\n\nJoão Neves da Fontoura definiu Domingos Mascarenhas em suas memórias\ncomo “devotado desde Castilhos ao Rio Grande e ao nosso grêmio\npartidário”.\n\nFaleceu no Rio de Janeiro no dia 21 de maio de 1940.\n\nRaimundo Helio Lopes\n\n**FONTES:** ABRANCHES, J. *Governos*; CÂM. DEP. *Deputados brasileiros*;\nFONTOURA*,* J. *Memórias.*\n","ref":"**FONTES:** ABRANCHES, J. *Governos*; CÂM. DEP. *Deputados brasileiros*;\nFONTOURA*,* J. *Memórias.*\n","dic":"DHBPR"}
