{"title":"MATOS, Pindaíba de","cargoss":["Ministro do Supremo Tribunal Federal"],"cargos_esp":[0],"datas_ini":[1894],"datas_fim":[1910],"estados":[0],"autor":["Eduardo Junqueira"],"content":"**MATOS, Pindaíba de**\n\n\\*magistrado; min. STF 1894-1910.\n\n*Eduardo Pindaíba de Matos* nasceu na província do Maranhão no dia 11 de\noutubro de 1831.\n\nEm 1851 graduou-se em ciências jurídicas e sociais na Faculdade de\nDireito de Olinda. Iniciou a carreira na magistratura na província do\nRio de Janeiro, ao ser nomeado juiz municipal e de órfãos do termo de\nItaguaí, em 1854, e do termo de Mangaratiba, no ano seguinte. Em 1859\nfoi nomeado chefe de polícia do Rio Grande do Sul. Permaneceu nesse\ncargo até 1861, quando, de volta à magistratura, foi nomeado juiz de\ndireito da comarca de Mogi-Mirim, na província de São Paulo. Exerceu\ncargo de chefe de polícia nas províncias de Minas Gerais (1862-1863),\nEspírito Santo (1864-1865), Pernambuco (1865-1866) e Rio de Janeiro\n(1867-1868). Depois de seu retorno à magistratura, foi designado para a\ncomarca de Turiaçu, no Maranhão, e para as comarcas fluminenses de\nResende e Barra Mansa. Foi vice-presidente da província do Rio de\nJaneiro de 1869 a 1870.\n\nEm 1878, foi nomeado desembargador da Relação do Ceará, sendo removido,\ndepois, para a Relação da Corte, em abril de 1880. Aí exerceu o cargo de\nprocurador da Coroa, em 1885, nos assuntos relativos ao Ministério dos\nNegócios da Justiça. Foi ministro adjunto do Conselho Supremo Militar e\nde Justiça em 1888, substituindo José Antônio de Magalhães Castro. Com o\nadvento da República, foi nomeado, em novembro de 1890, juiz da Corte de\nApelação do Distrito Federal, tribunal de segunda instância sucessor da\nantiga Relação da Corte. Em março de 1891 foi eleito, em sessão plenária\ndesse tribunal, vice-presidente da corte.\n\nDesignado ministro do Supremo Tribunal Federal (STF) numa das últimas\nnomeações para a corte feitas pelo governo Floriano Peixoto (1891-1894),\ntomou posse na vaga decorrente da aposentadoria de Joaquim da Costa\nBarradas, em outubro de 1894. Exerceu a presidência do STF a partir de\nabril de 1908 até passar à inatividade, aposentado por decreto de\ndezembro de 1910.\n\nFaleceu na cidade de Petrópolis (RJ) no dia 20 de fevereiro de 1913.\n\nFoi casado com Emiliana Guimarães Pindaíba de Matos.\n\nEduardo Junqueira\n\n**FONTES:** MATTOSO, P. *Supremo Tribunal*; MELLO FILHO, J. *Notas*;\nRODRIGUES, L. *História*; SUP. TRIB. FED. Disponível em:\n\\<www.stf.jus.br/portal/ministros\\>.\n","ref":"**FONTES:** MATTOSO, P. *Supremo Tribunal*; MELLO FILHO, J. *Notas*;\nRODRIGUES, L. *História*; SUP. TRIB. FED. Disponível em:\n\\<www.stf.jus.br/portal/ministros\\>.\n","dic":"DHBPR"}
