{"title":"MATOSO, Eusébio de Queirós Carneiro","cargoss":["Deputado federal"],"cargos_esp":[0],"datas_ini":[1894],"datas_fim":[1896],"estados":["RJ"],"autor":[0],"content":"**MATOSO, Eusébio de Queirós Carneiro**\n\n\\*dep. fed. RJ 1894-1896.\n\n*Eusébio de Queirós Carneiro Matoso* nasceu em Macaé (RJ). Era neto do\ncélebre Eusébio de Queirós, ministro da Justiça de 1848 a 1852 e\nresponsável pela Lei Eusébio de Queirós, que proibiu o tráfico negreiro\npara o Brasil.\n\nFormado em medicina, começou a clinicar em sua cidade natal. Em 1894 foi\neleito deputado federal pelo 2^o^ distrito do estado do Rio de Janeiro,\ne exerceu seu mandato de 3 de maio daquele ano até 31 de dezembro de\n1896.\n\nApós deixar a Câmara dos Deputados, transferiu-se para São Paulo, onde\nvoltou a atuar como médico, agora na Santa Casa da Misericórdia. Chefiou\no setor de oftalmologia da Santa Casa de 1899 a 1914 e dirigiu a\nprimeira campanha oficial contra o tracoma no estado de São Paulo,\ncontribuindo para a criação de postos antitracomatosos em cidades com\nmaior incidência da doença no interior paulista. Durante sua gestão, os\nregistros da Santa Casa apontam que o setor de oftalmologia teve o\nsegundo maior número de consultas do hospital, além de se ter\ntransformado em centro de treinamento para médicos do interior e\nreferência no país.\n\nIzabel Pimentel da Silva\n\n**FONTES:** ABRANCHES, J. *Governos*; CÂM. DEP. *Deputados brasileiros*;\nCONS. REG. MED. SP. Disponível em:\n\\<www.cremesp.org.br/?siteAcao=Revista&id=205\\>.\n","ref":"**FONTES:** ABRANCHES, J. *Governos*; CÂM. DEP. *Deputados brasileiros*;\nCONS. REG. MED. SP. Disponível em:\n\\<www.cremesp.org.br/?siteAcao=Revista&id=205\\>.\n","dic":"DHBPR"}
