{"title":"MEDEIROS, Bianor de","cargoss":["Deputado federal"],"cargos_esp":[0],"datas_ini":[1924],"datas_fim":[1930],"estados":["PE"],"autor":["Raimundo Helio Lopes"],"content":"**MEDEIROS, Bianor de**\n\n\\*dep. fed. PE 1924-1930.\n\n*Bianor Gadault Fonseca de Medeiros* nasceu em Recife no dia 25 de\nagosto de 1865, filho de Manuel Fonseca de Medeiros e de Maria Amélia\nGadault de Medeiros.\n\nIniciou seus estudos no Ginásio Pernambucano e em 1884 ingressou na\nFaculdade de Direito do Recife. Ainda acadêmico, iniciou sua atividade\nprofissional ao se tornar escrevente do Arsenal de Guerra, em 1885, e\npraticante dos Correios, em 1887, quando assumiu o posto de auxiliar de\ngabinete de um dos diretores. Defensor das causas abolicionista e\nrepublicana, formou-se em 1888 e no ano seguinte foi nomeado promotor\npúblico em Bom Jardim (PE). Em 1890 tornou-se juiz municipal em\nAnchieta, no Espírito Santo, e pouco tempo depois se transferiu para\nVitória, mas em 1891 deixou esse estado para assumir o cargo de gerente\nda Empresa Fluvial de Navegação do São Francisco, com sede em Penedo, em\nAlagoas.\n\nDe volta a Pernambuco, em 1895 foi eleito deputado estadual.\nSucessivamente reeleito até 1904, durante esses anos participou de\nvárias comissões legislativas. No período seguinte, atuou junto à\nprefeitura de Recife. Em 1924 foi eleito deputado federal por Pernambuco\ne em maio assumiu sua cadeira na Câmara dos Deputados, no Rio de\nJaneiro, então Distrito Federal. Foi reeleito em 1927 e em 1930, mas\nteve seu mandato interrompido após a vitória da Revolução de outubro de\n1930, que levou Getúlio Vargas ao poder e extinguiu todos os órgãos\nlegislativos do país.\n\nFoi também professor de diversas instituições: Ginásio Pernambucano,\nEscola Normal, Liceu de Artes e Ofícios e Escola Politécnica, todos no\nestado de Pernambuco. Na cidade do Rio de Janeiro, advogou, lecionou em\nmuitos estabelecimentos (como o Instituto Comercial, a Academia de Altos\nEstudos e a Faculdade de Letras e Filosofia), foi inspetor escolar e\ndiretor-gerente do Banco Popular do Brasil. No campo jornalístico, atuou\nem vários jornais e revistas literárias em Pernambuco e no Rio: *O Seis\nde Março*, *Homens e Letras*, *A Cultura Acadêmica: ciências e letras*,\n*Gazeta da Tarde*, *Tribuna Acadêmica*, *Diário de Notícias*, *Jornal do\nComércio*, *Gazetinha*, *Diário de Pernambuco*, *Jornal do Recife*.\nFundou, ao lado de Celso de Sousa, o jornal *O Estado*. Foi fundador e\nsócio da Academia Pernambucana de Letras, sócio-efetivo do Instituto\nArqueológico de Pernambuco, sócio-honorário da Sociedade de Artistas\nMecânicos e Liberais de Pernambuco, e sócio-benemérito da Sociedade\nPropagadora de Instrução Pública de Pernambuco.\n\nFaleceu na cidade do Rio de Janeiro no dia 15 de julho de 1933.\n\nPublicou *Contos mal contados*, *Ad lucem*, *Flores em profusão*,\n*Feições artísticas*, *Frei Caneca*, *Lastenia* e *Falando à mocidade*.\n\nRaimundo Helio Lopes\n\n**FONTES:** CÂM. DEP. *Deputados brasileiros*; NASCIMENTO, L. *História*\n(v.6); VELHO SOBRINHO, J. *Dicionário.*\n","ref":"**FONTES:** CÂM. DEP. *Deputados brasileiros*; NASCIMENTO, L. *História*\n(v.6); VELHO SOBRINHO, J. *Dicionário.*\n","dic":"DHBPR"}
