{"title":"MEDEIROS, Maurício de","cargoss":["Deputado federal","Deputado federal","Ministro da Saúde"],"cargos_esp":[0,0,0],"datas_ini":[1927,1921,1955],"datas_fim":[1930,1922,1958],"estados":["RJ","RJ",0],"autor":["Vera Calicchio"],"content":"**MEDEIROS, Maurício de**\n\n\\*jornalista; dep. fed. RJ 1921-1922 e 1927-1930; min. Saúde 1955-1958.\n\n*Maurício Campos de Medeiros* nasceu no Rio de Janeiro, então capital do\nImpério, em 14 de julho de 1885, filho do quarto casamento de Joaquim\nJosé de Campos da Costa de Medeiros, conselheiro do Império. Sua mãe,\nMaria Carolina Ribeiro de Medeiros, era viúva do caricaturista Henrique\nFleuiss.\n\nÓrfão de pai aos sete anos, Maurício foi viver sob a tutela do irmão\nJosé Joaquim Medeiros e Albuquerque, escritor, jornalista e político\n(deputado federal por Pernambuco de 1894 a 1896, de 1901 a 1902 e de\n1904 a 1911), que exerceu grande influência sobre suas ideias e\natividades posteriores. Completou os estudos básicos no Ginásio\nNacional, hoje Colégio Pedro II, e em 1901 matriculou-se na Faculdade de\nMedicina. Diplomou-se em farmácia em 1903 e foi escolhido delegado\nbrasileiro ao I Congresso Internacional de Estudantes, reunido na cidade\nitaliana de Milão em 1906. No ano seguinte, concluiu o curso de\nmedicina.\n\nDepois de formado, substituiu o irmão Medeiros e Albuquerque em uma\nseção diária da *Gazeta de Notícias*, iniciando longa militância na\nimprensa, continuada nos anos seguintes com colaborações no *Correio\nPaulistano* e *A Notícia*. Fez também várias viagens à Europa,\nfrequentando cursos de especialização em histopatologia e fisiologia em\nParis, Munique e Viena, e participando, em 1909, dos congressos\ninternacionais de psicologia e de medicina realizados respectivamente em\nGenebra e Budapeste. A atuação permanente na medicina e no jornalismo\nmarcaria toda a sua vida profissional. De volta ao Brasil, substituiu\nJoão do Rio como autor de uma crônica diária no jornal *A Noite*,\nintitulada “O momento”, e foi aprovado, em 1912, no concurso para\nlivre-docência da cadeira de fisiologia na faculdade em que estudara.\nDois anos depois, também através de concursos, tornou-se livre-docente\ndas cadeiras de patologia geral na Faculdade de Medicina e de psicologia\nna Escola Normal do Distrito Federal, depois Instituto de Educação.\n\nPouco depois do início da Primeira Guerra Mundial, em 1914, tornou-se\nfundador e secretário geral da Liga Pró-Aliados, que atuou até o fim do\nconflito. Em 1915 foi nomeado diretor geral de Higiene do estado do Rio\nde Janeiro e no ano seguinte foi eleito deputado estadual na legenda do\nPartido Republicano, prosseguindo no *Correio da Manhã* e em *A Época*\nsua pregação contrária à neutralidade adotada pelo Brasil diante da\nguerra. Era amigo e admirador de Nilo Peçanha, que foi nomeado ministro\ndas Relações Exteriores em maio de 1917, pouco depois do afundamento de\num navio mercante brasileiro pelos alemães. Esse fato desencadeou fortes\npressões favoráveis à declaração de guerra contra a Alemanha, afinal\nassinada pelo presidente Venceslau Brás (1914-1918) em outubro seguinte.\nSem perder seu mandato parlamentar, Maurício de Medeiros integrou a\nMissão Médica Militar que o Brasil enviou à França, sendo comissionado\nno posto de tenente-coronel-médico e lotado na chefia do serviço de\nneuropsiquiatria do Hospital Brasileiro de Paris, que funcionou nos\núltimos meses do conflito.\n\nConsiderando o parlamento “o único poder legitimamente representativo da\nopinião em uma democracia”, Maurício de Medeiros via no presidencialismo\na raiz de todos os males da história republicana do Brasil, por conduzir\nfrequentemente a “regimes autoritários e ditatoriais”. Defendia a forma\nfederativa de governo e a autonomia estadual, “em nada contrários ao\nparlamentarismo”. Deixando a Câmara estadual fluminense em 1920, foi\neleito no ano seguinte deputado federal pelo estado do Rio. Assumiu o\nmandato na Câmara dos Deputados em maio de 1921, mas em janeiro de 1922\nafastou-se a fim de prestar concurso para professor da seção de\npatologia geral da Faculdade de Medicina do Rio de Janeiro. Aprovado,\nfoi nomeado em setembro seguinte.\n\nEm janeiro de 1923 foi secretário geral do efêmero governo fluminense de\nRaul Fernandes (de 31 de dezembro de 1922 a 11 de janeiro de 1933), que\nfoi substituído pelo interventor federal Aurelino Leal, nomeado pelo\npresidente Artur Bernardes (1922-1926). Em 1924 tornou-se redator-chefe\ndo *Diário de Medicina*. Em 1927, durante o governo do presidente\nWashington Luís (1926-1930), foi novamente eleito deputado federal pelo\nestado do Rio de Janeiro. Na legislatura 1927-1929, integrou as\ncomissões de Legislação Social e de Instrução da Câmara, foi delegado à\nConferência Interparlamentar de Comércio, reunida em Versalhes, na\nFrança, em 1928, e votou a favor da concessão de anistia aos envolvidos\nnos levantes tenentistas de 1922 e 1924, que, segundo ele, haviam\nexpressado um “sentimento de revolta contra o governo unipessoal”\nexercido por Epitácio Pessoa (1919-1922) e, depois, Artur Bernardes. A\nproposta recebeu apenas 18 votos favoráveis na Câmara, insuficientes\npara sua aprovação.\n\nReeleito deputado federal pelo estado do Rio em março de 1930, teve o\nmandato interrompido pela revolução que em outubro depôs Washington Luís\ne levou à formação do governo provisório chefiado por Getúlio Vargas.\nAinda em 1930 passou um mês na União Soviética, e no ano seguinte lançou\num livro considerado simpático ao regime vigente nesse país. Foi então\nacusado pela imprensa governista de pertencer à Internacional Comunista,\no que provocou a apreensão do livro por ordem de João Batista Luzardo,\nchefe de polícia do Distrito Federal.\n\nNo primeiro semestre de 1932, publicou outra obra, intitulada *Outras\nrevoluções virão*, criticando “a falta de orientação doutrinária e de\nqualquer política sistematizada” por parte do governo provisório, o\nqual, segundo ele, incorria nos mesmos vícios do presidencialismo\nvigente na Primeira República, sufocando o Poder Legislativo. Como\ncolaborador do *Diário Carioca* e do jornal paulista *A Gazeta*,\nfrequentemente criticou os rumos tomados pela Revolução de 1930,\npublicando artigos contra, entre outras coisas, “o projeto\nultrarreacionário de repressão ao comunismo”, o “espantoso decreto\nintroduzindo o ensino religioso nas escolas” e as “tendências fascistas\nda Legião Liberal Mineira” liderada por Francisco Campos. Criticou\ntambém o Clube 3 de Outubro, “partidário da extrema violência”.\n\nApesar de afastado de atividades políticas desde 1930 e mundialmente\nconhecido por suas contribuições à psiquiatria, Maurício de Medeiros foi\natingido pelas medidas repressivas adotadas pelo governo de Vargas\ndepois da fracassada Revolta Comunista de novembro de 1935. Em abril do\nano seguinte, foi demitido junto com vários colegas do cargo de\ncatedrático de clínica propedêutica médica, que ocupava desde 1934. Só\nseria reintegrado nessas funções em maio de 1945, por sentença do Poder\nJudiciário. Voltou à faculdade na cátedra de clínica psiquiátrica em\nabril de 1946, durante a redemocratização do país que se seguiu à\nderrubada do Estado Novo, e em setembro desse ano foi nomeado diretor do\nInstituto de Psiquiatria da Universidade do Brasil, hoje Universidade\nFederal do Rio de Janeiro (UFRJ). Representou o Brasil no Congresso\nMundial de Psiquiatria, realizado em Paris em 1950, e nos dois primeiros\ncongressos internacionais de neuropatologia, realizados respectivamente\nem Roma (1952) e Londres (1955). Aposentou-se por limite de idade em\n1955, e em agosto desse ano tomou posse na cadeira n^o^ 38 da Academia\nBrasileira de Letras.\n\nEm 19 de novembro de 1955 foi nomeado ministro da Saúde pelo presidente\nNereu Ramos, que atendeu à indicação de Ademar de Barros, líder do\nPartido Social Progressista (PSP), ao qual era filiado. Foi mantido no\ncargo pelo presidente Juscelino Kubitschek, que tomou posse em 31 de\njaneiro de 1956, e em março de 1958 foi designado para integrar uma\ncomissão, presidida pelo ministro da Viação Lúcio Meira, encarregada de\ncoordenar o auxílio à região Nordeste, que sofria os efeitos de uma seca\nde grandes proporções. Deixou a pasta da Saúde em 3 de julho de 1958,\nsendo substituído por Mário Pinotti. Em 1962 começou a colaborar no\njornal carioca *O Globo*, onde assinou uma coluna esporádica sobre\nassuntos políticos até morrer, em 23 de julho de 1966.\n\nTeve três filhos de seu primeiro casamento, com Ana de Medeiros, e uma\nfilha em segundas núpcias, com Denise de Medeiros.\n\nMembro de inúmeras associações médicas e culturais, nacionais e\ninternacionais, deixou publicadas diversas obras, notadamente sobre\ntemas médicos, entre as quais: *Métodos em psicologia* (tese, 1907),\n*Fisiologia da secreção intestinal* (1913), *Partenogênese em patologia*\n(1913), *A reforma constitucional fluminense de 1920* (1922),\n*Coloidoclasia* (1923), *Peço a palavra!* (discursos, 1923), *O soro\nsanguíneo em patologia* (1925), *Ciência impura* (ensaios, 1928),\n*Supranormais* (1930), *Rússia: impressões de viagem* (1931), *Outras\nrevoluções virão* (1932), *Psicoterapia* (1933), *Segredo conjugal*\n(novela, 1933), *Ideias, homens e fatos* (1934), *Pensamentos de\nMedeiros e Albuquerque* (1935), *Folhas secas* (1941), *Aspectos da\npsicologia infantil* (1941), *Temas falados* (1945), *Joaquim Nabuco*\n(ensaio, 1949), *No mundo do ensino* (1954), *O casamento* (1956), *O\ninconsciente diabólico* (1959) e *Homens notáveis* (1964).\n\nVera Calicchio\n\n**FONTES:** ACAD. BRAS. LETRAS. *Anuário* (1960, 1961, 1962); ARQ.\nGETÚLIO VARGAS; BRINCHES, V. *Dicionário*; CORTÉS, C. *Homens*;\nCOUTINHO, A. *Brasil*; *Encic. Mirador*; *Globo* (24/6/1966); *Grande\nencic. Delta*; *Jornal do Brasil* (24/6/1966); *Jornal do Comércio*, Rio\n(22/11/1955); KUBITSCHEK, J. *Meu* (3); MEDEIROS, M. *Homens*; MEDEIROS,\nM. *Outras*; MEDEIROS, M. *Peço*; MEDEIROS, M. *Rússia*; MIN. GUERRA.\n*Almanaque*; PEIXOTO, A. *Getúlio*; QUADROS, J.; ARINOS, A. *História*;\nRIBEIRO FILHO, J. *Dicionário*.\n","ref":"**FONTES:** ACAD. BRAS. LETRAS. *Anuário* (1960, 1961, 1962); ARQ.\nGETÚLIO VARGAS; BRINCHES, V. *Dicionário*; CORTÉS, C. *Homens*;\nCOUTINHO, A. *Brasil*; *Encic. Mirador*; *Globo* (24/6/1966); *Grande\nencic. Delta*; *Jornal do Brasil* (24/6/1966); *Jornal do Comércio*, Rio\n(22/11/1955); KUBITSCHEK, J. *Meu* (3); MEDEIROS, M. *Homens*; MEDEIROS,\nM. *Outras*; MEDEIROS, M. *Peço*; MEDEIROS, M. *Rússia*; MIN. GUERRA.\n*Almanaque*; PEIXOTO, A. *Getúlio*; QUADROS, J.; ARINOS, A. *História*;\nRIBEIRO FILHO, J. *Dicionário*.\n","dic":"DHBPR"}
