{"title":"MEIRA JÚNIOR, João Alves de","cargoss":["Deputado federal","Deputado federal"],"cargos_esp":[0,0],"datas_ini":[1935,1924],"datas_fim":[1937,1926],"estados":["SP","SP"],"autor":["Carlos Alberto Ungaretti Dias"],"content":"**MEIRA JÚNIOR, João Alves de**\n\n\\*dep. fed. SP 1924-1926 e 1935-1937.\n\n*João Alves de Meira Júnior* nasceu em Piraí, hoje Barra do Piraí (RJ),\nem 26 de setembro de 1875, filho de João Alves de Meira e de Margarida\nRubião Alves Meira. Seu irmão Domingos Rubião Alves Meira foi reitor da\nUniversidade de São Paulo de 1939 a 1941.\n\nApós os estudos de humanidades, matriculou-se na Faculdade de Direito de\nSão Paulo, bacharelando-se em ciências jurídicas e Sociais em 1895. Em\nseguida estabeleceu escritório de advocacia em Ribeirão Preto, onde\nfixou residência, tornando-se um dos advogados mais conhecidos da\nregião. A partir de 1897 exerceu cargos públicos. Foi delegado de\npolícia e, depois, vereador e presidente da Câmara Municipal,\nrespondendo pela administração da cidade.\n\nFoi um dos fundadores e o primeiro presidente da Companhia Cervejaria\nPaulista, estabelecida em 25 de abril de 1913. No ano seguinte voltou à\nCâmara Municipal de Ribeirão Preto e participou da aprovação do projeto\nque originou a construção do Palácio Rio Branco, na época chamado Paço\nMunicipal, cuja fachada apresenta uma mescla de estilos barroco e\nmoderno. O prédio sede da prefeitura e também da Câmara foi inaugurado\nem 26 de maio de 1917,ocupando Meira Júnior na ocasião o cargo de\nvice-presidente da edilidade.\n\nEstando em curso a legislatura 1924-1926, em 21 de setembro de 1924 foi\neleito deputado federal por São Paulo com 7.248 votos, para preencher a\nvaga aberta por Gabriel Ribeiro dos Santos, nomeado secretário da\nAgricultura no governo de Carlos de Campos. Reconhecido pela Comissão de\nPoderes do Congresso Nacional dia 4 de novembro, tomou posse na sessão\nde 3 de dezembro seguinte. Deixou a Câmara dos Deputados em 31 de\ndezembro de 1926, ao se encerrar a legislatura.\n\nCom a morte do senador estadual Teodoro Dias de Carvalho, foi indicado\npara a sua vaga, sendo eleito em 30 de outubro de 1928, com 75.596\nvotos, pelo Partido Republicano Paulista (PRP). Tomou posse em 29 de\ndezembro do mesmo ano e passou a integrar a Comissão de Agricultura,\nTerras Públicas e Minas. Teve o mandato interrompido pela Revolução de\n1930, que levou Getúlio Vargas ao poder e suprimiu os órgãos\nlegislativos do país.\n\nAo longo desses anos esteve entre os idealizadores e construtores do\nTeatro Pedro II, em Ribeirão Preto, inspirado em casas de espetáculos\neuropeias. O teatro foi inaugurado em 1930 e integrava um conjunto de\nobras que incluía um edifício comercial e um hotel. Na época, as obras\najudaram a dinamizar a economia local, contribuindo para enfrentar a\ncrise econômica de 1929. Outro destaque na área cultural foi sua\nparticipação na fundação da Orquestra Sinfônica de Ribeirão Preto.\n\nAfastado da política desde 1930, em 1934 foi nomeado pelo presidente da\nRepública Getúlio Vargas juiz da Câmara de Reajustamento Econômico do\nMinistério da Fazenda, exercendo a função até 1935. Também em 1934 foi\nmais uma vez eleito deputado federal, agora na legenda do Partido\nConstitucionalista de São Paulo. Exerceu o mandato de 3 de maio de 1935\na 10 de novembro de 1937, quando da instauração do Estado Novo, que\nsuprimiu todos os órgãos legislativos do país.\n\nFoi presidente da Ordem dos Advogados do Brasil (OAB), Regional de\nRibeirão Preto, entre 1937 e 1939, e voltou à presidência do órgão entre\n1949 e 27 de julho de 1952, quando faleceu. Como manifestação de pesar,\na Assembleia Legislativa de São Paulo suspendeu os trabalhos naquele\ndia.\n\nFoi casado com Maria Antonieta Loiola Meira, com quem teve oito filhos.\n\nPublicou, com a colaboração de Fabio de Sá Barreto e Camilo Matos, *O\ncrime de Cravinhos* (1920).\n\nEm 1955, a prefeitura de Ribeirão Preto construiu uma escultura do dr.\nJoão Alves Meira Júnior, em estilo neoclássico, que foi instalada na\npraça XV de Novembro daquela cidade.\n\nCarlos Alberto Ungaretti Dias\n\n**FONTES:** CALIMAN, A. *Legislativo*; *Correio Paulistano* (30/7/1952);\n*Folha da Manhã* (29/7/1952); FONSECA, A.; FONTES JUNIOR, A. *Câmara*;\nOAB. Disponível em: \\<www.oabrp.org.br/index.php\\>; PREF. RIBEIRÃO\nPRETO. Disponível em:\n\\<www.ribeiraopreto.sp.gov.br/scultura/arqpublico/monumentos/i14m-2-meirajunior.php\\>;\nWikipédia. Disponível em:\n\\<http://pt.wikipedia.org/wiki/Senado\\_do\\_Congresso\\_Legislativo\\_do\\_Estado\\_de\\_S%C3%A3o\\_Paulo\\>.\n","ref":"**FONTES:** CALIMAN, A. *Legislativo*; *Correio Paulistano* (30/7/1952);\n*Folha da Manhã* (29/7/1952); FONSECA, A.; FONTES JUNIOR, A. *Câmara*;\nOAB. Disponível em: \\<www.oabrp.org.br/index.php\\>; PREF. RIBEIRÃO\nPRETO. Disponível em:\n\\<www.ribeiraopreto.sp.gov.br/scultura/arqpublico/monumentos/i14m-2-meirajunior.php\\>;\nWikipédia. Disponível em:\n\\<http://pt.wikipedia.org/wiki/Senado\\_do\\_Congresso\\_Legislativo\\_do\\_Estado\\_de\\_S%C3%A3o\\_Paulo\\>.\n","dic":"DHBPR"}
