{"title":"MELO, Abelardo de","cargoss":["Deputado federal"],"cargos_esp":[0],"datas_ini":[1904],"datas_fim":[1905],"estados":["RJ"],"autor":["Luciana Pinheiro"],"content":"**MELO, Abelardo de**\n\n\\*dep. fed. RJ 1904-1905.\n\n*Abelardo Saturnino Teixeira de Melo* nasceu em Campos (RJ) em 1866,\nfilho de José Alexandre Teixeira de Melo.\n\nBacharel em direito, iniciou sua trajetória profissional como advogado e\nmagistrado. Foi também vereador e presidente da Câmara Municipal de\nCampos e deputado estadual.\n\nApós ter ocupado o cargo de secretário geral do estado do Rio de Janeiro\nno governo de Nilo Peçanha (1903-1906), e estando em curso a legislatura\n1903-1905, candidatou-se a deputado federal em substituição a Lourenço\nBatista, o barão de Miracema, que havia renunciado ao mandato. Foi\neleito em abril de 1904 e tomou posse na Câmara dos Deputados, no Rio de\nJaneiro, então Distrito Federal, em maio. Não completou, porém, o\nmandato, que se encerraria em dezembro de 1905, pois faleceu em setembro\ndesse ano.\n\nReconhecido por sua retórica, assinou diversos artigos em jornais do Rio\nde Janeiro.\n\nLuciana Pinheiro\n\n**FONTES:** ABRANCHES, J. *Governos* (v.2, p.143-144); CÂM. DEP.\n*Deputados brasileiros* (p.7); VELHO SOBRINHO, J. *Dicionário* (v.1,\np.23).\n","ref":"**FONTES:** ABRANCHES, J. *Governos* (v.2, p.143-144); CÂM. DEP.\n*Deputados brasileiros* (p.7); VELHO SOBRINHO, J. *Dicionário* (v.1,\np.23).\n","dic":"DHBPR"}
