{"title":"MELO, Paulo Júlio de","cargoss":["Deputado federal"],"cargos_esp":[0],"datas_ini":[1909],"datas_fim":[1917],"estados":["ES"],"autor":["Nara Saletto"],"content":"**MELO, Paulo Júlio de**\n\n\\*dep. fed. ES 1909-1917.\n\n*Paulo Júlio de Melo* nasceu em Pernambuco no dia 30 de dezembro de\n1869.\n\nBacharelou-se pela Faculdade de Direito do Recife e mudou-se para o\nEspírito Santo, onde foi juiz substituto nas comarcas de Santa\nLeopoldina e Viana. Iniciou sua carreira política no governo municipal\nde Santa Leopoldina, que chefiou de 1908 a 1915 como aliado dos\nMonteiro, que então dominavam a política capixaba – Jerônimo Monteiro\npresidiu o estado de 1908 a 1912, e seu aliado e sucessor Marcondes\nAlves de Sousa, de 1912 a 1916. Simultaneamente, foi deputado estadual e\npresidiu a Assembleia Legislativa em 1908 e 1909.\n\nEm 1909 foi eleito para uma das poucas e cobiçadas vagas de deputado\nfederal pelo Partido Republicano Espírito-Santense (PRES), presidido por\nJerônimo Monteiro. Assumiu em 29 de novembro sua cadeira na Câmara dos\nDeputados, no Rio de Janeiro, então Distrito Federal, e foi reeleito em\n1912 e 1915. Porém em 1916, quando Bernardino Monteiro, irmão de\nJerônimo Monteiro, foi apresentado como candidato à presidência do\nestado, uniu-se à bancada federal capixaba, dirigida pelo senador João\nLuís Alves e pelo deputado federal Torquato Moreira, na oposição a essa\ncandidatura. Os opositores apresentaram uma chapa formada por José Gomes\nPinheiro Júnior, antigo adversário dos Monteiro, e por Alexandre Calmon,\ncomo candidato a vice, e conseguiram inicialmente o apoio do presidente\nda República Venceslau Brás (1914-1918). Desencadeou-se então a mais\ngrave crise política da Primeira República no Espírito Santo, conhecida\ncomo Revolta do Xandoca, apelido do coronel Alexandre Calmon, chefe\npolítico de Colatina e um dos principais líderes do movimento.\n\nDiante do conflito, muitas vezes violento, em muitos municípios, e da\nforte repressão policial à oposição em Vitória, centenas de pessoas se\nrefugiaram em Minas e no estado do Rio de Janeiro. A 23 de maio de 1916,\nquando terminou o mandato de Marcondes Alves de Sousa, havia duas\nassembleias, ambas se declarando legítimas, e cada uma delas reconheceu\ne empossou um presidente do estado: Bernardino Monteiro recebeu o\nmandato de Marcondes de Sousa e ocupou o palácio, enquanto a oposição\ninstalou seu governo em Colatina e recorreu ao governo federal, pedindo\na intervenção no estado. O caso passou ao Congresso Nacional, onde os\nparlamentares de oposição, entre os quais Paulo de Melo, todos antigos\naliados dos Monteiro, fizeram sérias acusações a estes nas acaloradas\nsessões em que o tema foi discutido, entre maio e agosto. Venceslau Brás\nrecuou no apoio à oposição e, finalmente, no dia 17 de agosto, foi\nrecusada a intervenção federal no estado, o que garantiu a posse de\nBernardino Monteiro. Dias depois, foi aprovada a anistia a todos os\nenvolvidos.\n\nPaulo de Melo concluiu seu mandato na Câmara dos Deputados em dezembro\nde 1917, e, diante da vitória dos Monteiro, sua carreira política de se\nencerrou.\n\nNara Saletto\n\n**FONTES:** CÂM. DEP. Intervenção nos estados (v.10); CÂM. DEP.\nDeputados brasileiros; CHEQUER FILHO, N. Revolta; Jornal Oficial (1907).\n","ref":"**FONTES:** CÂM. DEP. Intervenção nos estados (v.10); CÂM. DEP.\nDeputados brasileiros; CHEQUER FILHO, N. Revolta; Jornal Oficial (1907).\n","dic":"DHBPR"}
