{"title":"MELO, Raul Cardoso de","cargoss":["Deputado federal"],"cargos_esp":[0],"datas_ini":[1912],"datas_fim":[1923],"estados":["SP"],"autor":["Carlos Alberto Ungaretti Dias"],"content":"**MELO, Raul Cardoso de**\n\n\\*dep. fed. SP 1912-1923.\n\n*Raul Renato Cardoso de Melo*nasceu em São Paulo no dia 25 de fevereiro\nde 1875. Era descendente dos Lemes, que estavam em São Paulo desde o\nséculo XVI. Já os Cardoso chegaram com Joaquim José de Cardoso,\nintegrante da comitiva que acompanhou a família real portuguesa em 1808\ne se estabeleceu na vila de Areias.\n\nBacharel em ciências jurídicas e sociais, foi promotor público da\ncomarca de Piraju (SP) de 24 de dezembro de 1896 a 10 de janeiro de\n1898. Estabeleceu escritório de advocacia em São Paulo, e aí foi também\ndelegado de polícia, professor catedrático de direito comercial da\nFaculdade de Direito, diretor-presidente da Empresa de Eletricidade de\nBauru e da Companhia de Diversões.\n\nIniciou a carreira política elegendo-se deputado federal por São Paulo\nna legenda do Partido Republicano Paulista (PRP), para a legislatura\n1912-1914. Assumindo sua cadeira na Câmara dos Deputados, no Rio de\nJaneiro, então Distrito Federal, em maio de 1912, foi reeleito para a\nlegislatura 1915-1917, e integrou na Câmara a Comissão de Finanças e a\nComissão Especial de Justiça Militar. Voltou a ser reeleito para as\nlegislaturas 1918-1920 e 1921-1923, mas renunciou ao mandato nesse\núltimo ano para assumir uma cadeira no Senado paulista. Integrou a\nComissão de Indústria, Comércio e Obras Públicas e a Comissão de\nEstatística de São Paulo, e concluiu o mandato em dezembro de 1924.\n\nMorreu em São Paulo no dia 11 de outubro de 1929.\n\nEra casado com Ismênia Guedes Cardoso de Melo, com quem teve dois\nfilhos. A família Melo teve diversos representantes nas áreas jurídica e\npolítica de São Paulo, entre eles José Joaquim Cardoso de Melo Neto,\nprofessor da Faculdade de Direito, prefeito de São Paulo em 1930,\nconstituinte de 1934 e várias vezes deputado federal, governador e\ninterventor em São Paulo de 1937 a 1938.\n\nCarlos Alberto Ungaretti Dias\n\n**FONTES:** ABRANCHES, J. *Governos* (v.2); ADDUCI, C. *Pátria*;\nAlmanaque Folha. Disponível em:\n\\<http://almanaque.folha.uol.com.br/brasil\\_19fev1921.htm\\>; CALIMAN, A.\n*Legislativo*; *Folha da Noite* (19/2/1921); FONSECA, A.; FONTES JUNIOR,\nA. *Câmara*; LEME, L. *Genealogia*; MELO, L. *Dicionário*; Migalhas.\nDisponível em: \\<www.migalhas.com.br/mig\\_amanhecidas.aspx?cod1=73405;\nPUC SP. Disponível em:\n\\<www.pucsp.br/neils/downloads/v11\\_12\\_cassia.pdf\\>; Zé Moleza.\nDisponível em:\n\\<www.zemoleza.com.br/noticia/520643/entrelinha\\_-\\_15/09/2008.html\\>.\n","ref":"**FONTES:** ABRANCHES, J. *Governos* (v.2); ADDUCI, C. *Pátria*;\nAlmanaque Folha. Disponível em:\n\\<http://almanaque.folha.uol.com.br/brasil\\_19fev1921.htm\\>; CALIMAN, A.\n*Legislativo*; *Folha da Noite* (19/2/1921); FONSECA, A.; FONTES JUNIOR,\nA. *Câmara*; LEME, L. *Genealogia*; MELO, L. *Dicionário*; Migalhas.\nDisponível em: \\<www.migalhas.com.br/mig\\_amanhecidas.aspx?cod1=73405;\nPUC SP. Disponível em:\n\\<www.pucsp.br/neils/downloads/v11\\_12\\_cassia.pdf\\>; Zé Moleza.\nDisponível em:\n\\<www.zemoleza.com.br/noticia/520643/entrelinha\\_-\\_15/09/2008.html\\>.\n","dic":"DHBPR"}
