{"title":"MELO, Veríssimo de","cargoss":["Deputado federal"],"cargos_esp":[0],"datas_ini":[1915],"datas_fim":[1923],"estados":["RJ"],"autor":["Luciana Pinheiro"],"content":"**MELO, Veríssimo de**\n\n\\*dep. fed. RJ 1915-1923.\n\n*Inácio Veríssimo de Melo* nasceu em Resende (RJ) no dia 24 de julho de\n1873, filho de Veríssimo José de Melo e de Rosa Louzada Melo.\n\nTransferindo-se com a família para Nova Friburgo (RJ), aí iniciou seus\nestudos com professor particular e mais tarde no Liceu Nacional. Em 1891\ningressou na Faculdade de Direito de São Paulo, mas no ano seguinte\nmudou-se para a Faculdade Livre de Ciências Jurídicas e Sociais da\ncidade do Rio de Janeiro, pela qual se diplomou em 1894.\n\nRecém-formado, deu início à carreira profissional em 1895, ao assumir\npor 12 anos a promotoria pública da cidade fluminense de Macaé, onde\ntambém foi inspetor escolar por oito anos. Em 1903, quando as comarcas\nde Santa Maria Madalena, Barra de São João, São Francisco de Paula e São\nSebastião do Alto, foram anexadas a Macaé, sua jurisdição a elas se\nestendeu. Foi ainda curador geral de órfãos, de ausentes e de massas\nfalidas nessas localidades. Em 1907, no governo de Alfredo Augusto\nGuimarães Backer (1906-1910), assumiu a chefia de Polícia do estado do\nRio de Janeiro. Enquanto esteve no cargo, criou a delegacia auxiliar e o\ngabinete de identificação na capital, além da inspetoria de veículos. Em\n1909 foi nomeado secretário geral do estado do Rio, cargo no qual\npermaneceu até o fim do mandato de Alfredo Backer.\n\nEm 1915 foi eleito deputado federal pelo estado do Rio de Janeiro para a\nlegislatura 1915-1917. Tomou posse na Câmara dos Deputados, no Distrito\nFederal, em maio do mesmo ano e foi reeleito para as duas legislaturas\nseguintes, exercendo o mandato até dezembro de 1923. Na Câmara, foi\nmembro das comissões do Código Civil e do Código das Águas.\n\nRepresentou a Fundação Afonso Pena no acordo celebrado entre a\ninstituição e o Departamento Nacional de Assistência Pública, visando à\nincorporação de todo o acervo da fundação ao patrimônio do departamento,\nconsagrada pelo Decreto-Lei n^o^ 19.923, de 27 de abril de 1931,\nassinado pelo presidente da República Getúlio Vargas (1930-1945).\n\nFaleceu em 1933. Logo após sua morte, seu nome foi dado a uma praça no\nmunicípio de Macaé.\n\nLuciana Pinheiro\n\n**FONTES:** ABRANCHES, J. *Governos*.(v.2); CÂM. DEP. *Deputados\nbrasileiros* (1826-1976, p.115); CÂM. DEP. Disponível em:\n\\<www2.camara.gov.br/\\>. Acesso em: 12/12/2010; GOV. EST. RJ. Disponível\nem: \\<www.governo.rj.gov.br/\\>. Acesso em: 11/12/2010; PLANALTO.\nDisponível em: \\<www.planalto.gov.br\\>. Acesso em: 12/12/2010; PREF.\nMUN. MACAÉ. Disponível em: \\<www.macae.rj.gov.br/\\>. Acesso em:\n11/12/2010.\n","ref":"**FONTES:** ABRANCHES, J. *Governos*.(v.2); CÂM. DEP. *Deputados\nbrasileiros* (1826-1976, p.115); CÂM. DEP. Disponível em:\n\\<www2.camara.gov.br/\\>. Acesso em: 12/12/2010; GOV. EST. RJ. Disponível\nem: \\<www.governo.rj.gov.br/\\>. Acesso em: 11/12/2010; PLANALTO.\nDisponível em: \\<www.planalto.gov.br\\>. Acesso em: 12/12/2010; PREF.\nMUN. MACAÉ. Disponível em: \\<www.macae.rj.gov.br/\\>. Acesso em:\n11/12/2010.\n","dic":"DHBPR"}
