{"title":"MENDES, João","cargoss":["Ministro do Supremo Tribunal Federal"],"cargos_esp":[0],"datas_ini":[1916],"datas_fim":[1922],"estados":[0],"autor":["Eduardo Junqueira"],"content":"**MENDES, João**\n\n\\* min. STF 1916-1922.\n\n*João Mendes de Almeida Júnior* nasceu em São Paulo no dia 30 de março\nde 1856, filho de João Mendes de Almeida e de Ana Rita Fortes Leite\nLobo. Seu pai foi advogado, magistrado, jornalista e político, ligado\naos conservadores do Império. Teve atuação destacada em diversas\nlegislaturas, como deputado geral por São Paulo e pelo Maranhão.\n\nBacharel em ciências jurídicas e sociais pela Faculdade de Direito de\nSão Paulo em 1877, e doutor em 1880, nesse ano foi eleito vereador à\nCâmara Municipal paulista, que presidiu no biênio 1881-1882. Após a\nrealização de concurso em 1889, tornou-se lente substituto da Faculdade\nde Direito de São Paulo, passando a reger as cadeiras de direito\neclesiástico, criminal e civil. Em março de 1891 tornou-se lente\ncatedrático da mesma faculdade. Eminente processualista, nesse mesmo ano\npresidiu comissão encarregada de organizar as bases doutrinárias e\nlegais para a elaboração de dois códigos de processo, um civil e outro\ncriminal, dado que no Brasil estavam em vigor os Regulamentos 737 e 738,\nde 1850, diplomas processuais adstritos ao Código Comercial, portanto,\narcaicos para a realidade jurídica brasileira de então. De 1910 a 1916\nfoi diretor da Faculdade de Direito de São Paulo.\n\nApós carreira dedicada ao magistério e à advocacia, em dezembro de 1916\nfoi nomeado ministro do Supremo Tribunal Federal (STF) pelo presidente\nVenceslau Brás, para ocupar vaga aberta com o falecimento de Eneias\nGalvão. Após deixar a direção da Faculdade de Direito de São Paulo,\ntomou posse em janeiro de 1917. Aposentado por decreto em outubro de\n1922, retirou-se da vida pública.\n\nFoi casado com Leontina Novais.\n\nFaleceu em 25 de fevereiro de 1923 na cidade do Rio de Janeiro.\n\nAutor de vasta obra sobre todos os domínios do direito, publicou, em\nsucessivas edições, *Elementos de lógica e da psicologia – uma sinopse\nda história da filosofia*, *Noções ontológicas de Estado, soberania,\nautonomia, federação, fundação* e *Órgãos da fé pública*.\n\nEm sua homenagem, o Poder Judiciário paulista deu seu nome ao fórum\ncentral da comarca da capital, construído na década de 1950.\n\nEduardo Junqueira\n\n**FONTES:** MATTOSO, P. *Supremo Tribunal*; MELLO FILHO, J. *Notas*;\nSUP. TRIB. FED. Disponível em: \\<www.stf.jus.br/portal/ministros\\>.\n","ref":"**FONTES:** MATTOSO, P. *Supremo Tribunal*; MELLO FILHO, J. *Notas*;\nSUP. TRIB. FED. Disponível em: \\<www.stf.jus.br/portal/ministros\\>.\n","dic":"DHBPR"}
