{"title":"MENDONÇA, Lúcio de","cargoss":["Ministro do Supremo Tribunal Federal"],"cargos_esp":[0],"datas_ini":[1895],"datas_fim":[1907],"estados":[0],"autor":["Eduardo Junqueira"],"content":"**MENDONÇA, Lúcio de**\n\n\\*magistrado; min. STF 1895-1907.\n\n*Lúcio de Mendonça* nasceu em Piraí, província do Rio de Janeiro, no dia\n10 de março de 1854, filho de Salvador Furtado de Mendonça e de Amália\nde Meneses Drumond de Mendonça.\n\nGraduou-se em ciências jurídicas e sociais pela Faculdade de Direito de\nSão Paulo em novembro de 1877 e ainda nesse mesmo ano iniciou a carreira\ncomo promotor público de Itaboraí, no Rio de Janeiro. No ano seguinte,\nfoi transferido para São Gonçalo de Sapucaí, em Minas Gerais, onde\nesteve até 1885. Nesse ano mudou-se para Valença, na província\nfluminense, instalando banca de advocacia e colaborando em jornais da\ncidade, ocasião em que se mostrou adepto das ideias republicanas e\npositivistas. Fundou o Clube Republicano de Valença, a exemplo do que já\nfizera em Minas Gerais, instalando clubes republicanos nas comarcas onde\natuava como promotor.\n\nEm 1888, transferiu-se para a cidade do Rio de Janeiro, então capital do\nImpério. Proclamado o regime republicano em 15 de novembro de 1889, foi\nnomeado secretário do ministro da Justiça, cargo no qual se dedicava ao\nexercício de funções burocráticas e de que foi exonerado, a pedido, em\njaneiro do ano seguinte, por haver sido nomeado curador das massas\nfalidas da capital federal. Em fevereiro de 1891 foi nomeado diretor\ngeral da Secretaria da Justiça e aí permaneceu até março de 1895, data\nem que foi nomeado ministro do Supremo Tribunal Federal (STF) em\nsubstituição a Afonso Augusto Moreira Pena, que não aceitou a nomeação.\nTomou posse em abril do mesmo ano, sendo o primeiro ministro do STF\nnomeado pelo presidente Prudente de Morais (1894-1898). Exerceu a função\nde procurador geral da República em 1897, quando o ocupante do cargo era\nescolhido entre os membros do STF.\n\nUm dos idealizadores da Academia Brasileira de Letras, ajudou a fundar\nentidade em 1897, junto com outros intelectuais de seu tempo. Atribui-se\na ele a atuação de bastidores junto aos órgãos do governo republicano a\nfim de obter apoio para a instalação da Academia, fato que lhe valeu ser\nreferido entre os confrades como “O fundador”. Ocupou a cadeira 11, para\na qual escolheu como patrono o poeta romântico Fagundes Varela.\n\nFoi o relator do pedido de habeas corpus impetrado em 1907 por dom Luís\nde Orleans e Bragança, neto do imperador deposto em 1889, que pretendia,\nem viagem que fazia aos países platinos, desembarcar no Rio de Janeiro,\nnão obstante proibição expressa do governo federal. Tal proibição se\ndera pelo temor de que a presença do herdeiro do trono brasileiro\npudesse inflamar a facção restauradora ainda viva e ser causa de\ndesordem pública. Lúcio de Mendonça decidiu não conceder a ordem ao\nimpetrante, sob o argumento de que o decreto de banimento da família\nreal não fora derrogado pela Constituição de 1891. Com isso, dom Luís\nnão pôde desembarcar no Rio de Janeiro, sendo saudado no convés do navio\nem que viajava por simpatizantes da restauração capitaneados pelo\nconselheiro Lafaiete. Apenas os ministros Alberto Torres e Amaro\nCavalcanti julgaram favoravelmente às pretensões do príncipe.\n\nFoi aposentado como ministro do STF em outubro de 1907.\n\nSua obra foi vasta. Entre poemas, contos e romances, publicou: *Névoas\nmatutinas* (1872); *Alvoradas* (1875); *Visão do abismo* (1888); *O\nescândalo* e *Esboços e perfis* (1889); *Lições de política positiva,\nconferências* (1893); *Canções de outono* (1896); *Horas do bom tempo*\n(1901) e *Murmúrios e clamores* (1902), além da coletânea de trabalhos\nrealizados no campo do direito intitulada *Páginas jurídicas, estudos,\npareceres e decisões* (1903).\n\nFaleceu na cidade do Rio de Janeiro, então Distrito Federal, no dia 23\nde novembro de 1909.\n\nFoi casado com Anita Sussekind de Mendonça.\n\nEduardo Junqueira\n\n**FONTES:** MATTOSO, P. *Supremo Tribunal*; MELLO FILHO, J. *Notas*;\nRODRIGUES, L. *História*; SUP. TRIB. FED. Disponível em:\n\\<www.stf.jus.br/portal/ministros\\>.\n","ref":"**FONTES:** MATTOSO, P. *Supremo Tribunal*; MELLO FILHO, J. *Notas*;\nRODRIGUES, L. *História*; SUP. TRIB. FED. Disponível em:\n\\<www.stf.jus.br/portal/ministros\\>.\n","dic":"DHBPR"}
