{"title":"MENESES, Ajuricaba de","cargoss":["Deputado federal"],"cargos_esp":[0],"datas_ini":[1926],"datas_fim":[1929],"estados":["AM"],"autor":["Inoã Pierre Carvalho Urbinati"],"content":"**MENESES, Ajuricaba de**\n\n\\*dep. fed. AM 1926-1929.\n\n*Ajuricaba Aprígio de Meneses* candidatou-se a deputado federal pelo\nestado do Amazonas em 1924, mas não foi eleito. Em 1926, ao lado de\nJoaquim Tanajura, médico e posteriormente prefeito de Manaus, e do\nvereador Júlio Verne, entre outros, participou da inauguração da sala de\ncinema O Popular, em Manaus, pertencente à empresa J. Fontenelle & Cia.,\nde propriedade de Jonas Fontenelle.\n\nEstando em curso a legislatura 1924-1926, em 11 de outubro de 1926\nassumiu uma cadeira de deputado federal pelo Amazonas na Câmara dos\nDeputados, no Rio de Janeiro, então Distrito Federal, com mandato até 31\nde dezembro seguinte. No início de 1927 foi reeleito para a legislatura\n1927-1929. Em 1928 abriu seu próprio cinema, o Ideal Cine-Teatro, no\nbairro de Aparecida, em Manaus. Deixou a Câmara em 31 de dezembro de\n1929, quando se encerraram seu mandato e a legislatura.\n\nInoã Pierre Carvalho Urbinati\n\n**FONTES:** CÂM. DEP. *Deputados brasileiros*; Jus Brasil. Disponível\nem:\n\\<www.jusbrasil.com.br/diarios/1836375/dou-secao-1-28-02-1924-pg-24\\>.\nAcesso em: 16/2/2011, 17/3/2011; Skyscrapercity. Disponível em:\n\\<www.skyscrapercity.com/showthread.php?t=1253403&page=7\\>. Acesso em:\n16/2/2011, 17/3/2011.\n","ref":"**FONTES:** CÂM. DEP. *Deputados brasileiros*; Jus Brasil. Disponível\nem:\n\\<www.jusbrasil.com.br/diarios/1836375/dou-secao-1-28-02-1924-pg-24\\>.\nAcesso em: 16/2/2011, 17/3/2011; Skyscrapercity. Disponível em:\n\\<www.skyscrapercity.com/showthread.php?t=1253403&page=7\\>. Acesso em:\n16/2/2011, 17/3/2011.\n","dic":"DHBPR"}
