{"title":"MENESES, João","cargoss":["Deputado federal"],"cargos_esp":[0],"datas_ini":[1918],"datas_fim":[1920],"estados":["SE"],"autor":[0],"content":"**MENESES, João**\n\n\\*dep. fed. SE 1918-1920.\n\n*João Meneses* nasceu no engenho Cabral, nas proximidades de Japarutaba\n(SE), em 11 de outubro de 1866, filho de Jorge Palatem de Meneses e de\nEusébia do Espírito Santo.\n\nEducado pelo tio, coronel João Nepomuceno de Meneses, e pelo padrinho de\nbatismo, coronel de José de Barros Acióli de Meneses, começou a\ntrabalhar ainda muito jovem, como tipógrafo em Aracaju. Fez os estudos\npreparatórios em Salvador, mas não prosseguiu os estudos superiores. Na\ncapital baiana, começou a atuar na imprensa em 1887. Colaborou no\n*Jornal do Povo* e na *Gazeta da Tarde*, este último um órgão\nrepublicano e abolicionista para o qual escreveu uma série de versos\nhumorísticos intitulada “Bródio dos estudantes”, com o pseudônimo de\nLisandro.\n\nCom a proclamação da República ingressou na política, eleito deputado\nestadual em Sergipe no pleito de 1891. Participou da primeira Assembleia\nEstadual Constituinte sergipana, dissolvida juntamente com a derrubada\ndo presidente estadual Vicente Ribeiro. Após esses acontecimentos,\nresidiu durante um curto período no Rio de Janeiro, tendo nesse momento\ningressado no quadro de funcionários da prefeitura do Distrito Federal.\nPediu exoneração do cargo que ocupava e disputou, com sucesso, uma vaga\nna Assembleia Legislativa de Sergipe para o período de 1892-1894.\nReeleito, cumpriu mais um mandato de deputado estadual, entre 1894-1896.\nAliado do então presidente sergipano, coronel Manuel Prisciliano de\nOliveira Valadão, dele recebeu a indicação para diretor do *Diário\nOficial* do estado. No segundo período administrativo de Oliveira\nValadão (1914-1918), ocupou o posto de diretor da Secretaria Geral do\nEstado, sendo aposentado por decreto de 29 de outubro de 1917.\n\nEleito deputado federal por Sergipe, representou seu estado na Câmara\ndos Deputados entre 1918 e 1920.\n\nFaleceu em Aracaju no dia 18 de outubro de 1924.\n\nSérgio Montalvão\n\n**FONTES:** CÂM. DEP. *Deputados Brasileiros*; GUARANÁ, M. *Dicionário.*\n","ref":"**FONTES:** CÂM. DEP. *Deputados Brasileiros*; GUARANÁ, M. *Dicionário.*\n","dic":"DHBPR"}
