{"title":"METELO JÚNIOR, José Maria","cargoss":["Deputado federal","Deputado federal","Senador","Deputado federal"],"cargos_esp":[0,0,0,0],"datas_ini":[1918,1912,1919,1921],"datas_fim":[1919,1914,1921,1923],"estados":["DF","DF","DF","DF"],"autor":[0],"content":"**METELO JÚNIOR, José Maria**\n\n\\*dep. fed. DF 1912-1914 e 1918-1919; sen. DF 1919-1921; dep. fed. DF\n1921-1923.\n\n*José Maria Metelo Júnior* nasceu na cidade do Rio de Janeiro, então\ncapital do Império, no dia 26 de abril de 1882, filho de José Maria\nMetelo e de Francisca Chichorro Galvão Metelo. Seu pai foi eleito\ndeputado geral pela província de Mato Grosso em 1885, na legenda do\nPartido Liberal, e também foi senador de 1900 a 1917.\n\nBacharelou-se em ciências jurídicas e sociais pela Faculdade de Direito\ndo Rio de Janeiro e em 1902 passou a atuar como advogado. Entre janeiro\ne outubro de 1907, foi delegado da polícia do Rio de Janeiro, no\ndistrito de Irajá; a partir de outubro de 1907, passou a exercer o mesmo\ncargo no distrito de Santa Rita, onde permaneceu até fevereiro de 1910.\nA partir de então, foi superintendente de Limpeza Pública e Particular,\naté novembro de 1910.\n\nEm 1912, foi eleito deputado federal pelo Distrito Federal. Exerceu seu\nmandato de 21 de maio de 1912 a 31 de dezembro de 1914. Voltou à Câmara\ndos Deputados em 1918, mas no ano seguinte passou a ocupar uma cadeira\nno Senado Federal, onde permaneceu até 1921. Após deixar o Senado foi\nmais uma vez eleito deputado federal, e exerceu seu mandato de 7 de maio\nde 1921 a 31 de dezembro de 1923.\n\nAlém de advogado e político, foi também jornalista. Foi redator da\n*Gazeta da Tarde* e de *A Imprensa*, redator-chefe de *A Noite*,\nredator-secretário de *O País*, além de ter colaborado para o *Malho* e\na *Tribuna*.\n\nIzabel Pimentel da Silva\n\n**FONTES:** ABRANCHES, J. *Governos*; CÂM. DEP. *Deputados brasileiros*\n(1826-1976); LEITE NETO, L.*Catálogo biográfico*; SENADO. Dados\nbiográficos dos senadores do Rio de Janeiro; Senado Federal.\n","ref":"**FONTES:** ABRANCHES, J. *Governos*; CÂM. DEP. *Deputados brasileiros*\n(1826-1976); LEITE NETO, L.*Catálogo biográfico*; SENADO. Dados\nbiográficos dos senadores do Rio de Janeiro; Senado Federal.\n","dic":"DHBPR"}
