{"title":"MILANEZ, Prudêncio Cotegipe","cargoss":["Deputado federal"],"cargos_esp":[0],"datas_ini":[1909],"datas_fim":[1911],"estados":["PB"],"autor":["Raimundo Helio Lopes"],"content":"**MILANEZ, Prudêncio Cotegipe**\n\n\\*dep. fed. PB 1909-1911.\n\n*Prudêncio Cotegipe Milanez* nasceu na cidade de Areia (PB) no dia 13 de\nfevereiro de 1863, filho de Abdon Felinto Milanez e de Gracinda Cotegipe\nMilanez. Seu pai foi senador pela Paraíba de 1894 a 1902. Seu irmão\nAbdon Felinto Milanez Filho foi engenheiro, músico, deputado federal\npela Paraíba (1903-1905) e diretor do Instituto Nacional de Música\n(1916-1922).\n\nFormou-se pela Faculdade de Direito do Recife em 1889. Depois de\nformado, mudou-se para o Rio de Janeiro, então Distrito Federal, onde se\ntornou funcionário do Ministério da Guerra em janeiro de 1891. Em 1892\nfoi eleito deputado estadual na Paraíba, mas teve que renunciar ao cargo\ndevido à incompatibilidade, prevista na Lei Eleitoral vigente, entre o\nmandato e o emprego no Ministério da Guerra. Continuou com sua carreira\nnesse ministério, no qual foi promovido e, em 26 de novembro de 1907,\nnomeado chefe de sessão. Ali conheceu o escritor Lima Barreto, com quem\ntravou forte amizade. Lima Barreto lhe dedicaria o livro *Histórias e\nsonhos*, publicado em 1920, poucos anos depois de seu falecimento.\n\nEm 1908 foi novamente eleito deputado estadual na Paraíba, mas no ano\nseguinte renunciou ao cargo, pois foi eleito deputado federal. Assumiu o\nmandato em maio de 1909 e representou a Paraíba na Conferência\nAçucareira promovida no Rio de Janeiro, em 1910, pela Sociedade Nacional\nde Agricultura. Em 1911, foi um dos organizadores de outra conferência\nnos mesmos moldes, agora na cidade de Campos (RJ). Concluiu seu mandato\nno final desse ano.\n\nTambém foi capitão honorário do Exército, com honras de tenente-coronel,\ngraças ao cargo que ocupou no Ministério da Guerra, e sócio do Instituto\nHistórico e Geográfico Paraibano.\n\nRaimundo Helio Lopes\n\n**FONTES:** ABRANCHES, J. *Governos*; CÂM. DEP. *Deputados brasileiros*;\nINST. HIST. GEO. PARAIBANO. Disponível em: \\<www.ihgp.net\\>. Acesso em:\n8/12/2010.\n","ref":"**FONTES:** ABRANCHES, J. *Governos*; CÂM. DEP. *Deputados brasileiros*;\nINST. HIST. GEO. PARAIBANO. Disponível em: \\<www.ihgp.net\\>. Acesso em:\n8/12/2010.\n","dic":"DHBPR"}
