{"title":"ARAÚJO, Izidro Leite Ferreira de","cargoss":["Deputado federal"],"cargos_esp":[0],"datas_ini":[1904],"datas_fim":[1905],"estados":["PB"],"autor":["Raimundo Helio Lopes"],"content":"**ARAÚJO, Izidro Leite Ferreira de**\n\n\\* dep. fed. PB 1904-1905.\n\n*Izidro Leite Ferreira de Araújo* nasceu em Piancó(PB) no dia 23 de\nfevereiro de1873, filho de José Peregrino de Araújo.Seu pai foi\npresidente do estado daParaíba de 1900 a 1904.\n\nIngressou no Exército em 13 defevereiro de 1890. Em 1893, lutou aolado\ndas tropas federais durante a Revoltada Armada, levante de oposição ao\npresidenteFloriano Peixoto que, sob a chefia doalmirante Custódio de\nMelo e mais tardedo almirante Luís Felipe Saldanha da Gama,envolveu a\nesquadra fundeada na baía deGuanabara. A insurreição, que e se\nestendeude setembro de 1893 a março de1894, incluiu a tomada da capital\ndeSanta Catarina por destacamentos rebeldes ese encerrou com o asilo dos\nrevoltososem embarcações portuguesas fundeadas no Riode Janeiro. Foi\npromovido a segundo-tenenteem novembro de 1894 e a primeiro-tenenteem\noutubro de 1898. Durante esses anosfez o curso de engenharia do\nExércitoe tornou-se bacharel em matemática e ciênciasfísicas.\n\nIngressou na política com o apoiode seu pai, então presidente da\nParaíba,elegendo-se deputado federal em fevereiro de1904 na eleição\nespecial realizada parapreencher a vaga aberta com o falecimentodo\ndeputado João Soares Neiva. Foi reconhecidoem 26 de maio e exerceu o\nmandatoaté o final da legislatura em dezembrode 1905.\n\nDeixando a Câmara dos Deputadoscontinuou na vida militar, e em\nfevereiroe maio de 1912 foi promovido respectivamentea capitão graduado\ne efetivo. Foi tambémsócio-efetivo do Instituto Histórico e\nGeográficoParaibano.\n\nRaimundo Helio Lopes\n\n**FONTES:** ABRANCHES, J. *Governos*;CÂM. DEP. *Deputados brasileiros*;\nINST. HIST.GEO. PARAIBANO. Disponível em: \\<www.ihgp.net\\>.Acesso em:\n2/12/2010; MARIZ, C. *Apanhados.*\n","ref":"**FONTES:** ABRANCHES, J. *Governos*;CÂM. DEP. *Deputados brasileiros*;\nINST. HIST.GEO. PARAIBANO. Disponível em: \\<www.ihgp.net\\>.Acesso em:\n2/12/2010; MARIZ, C. *Apanhados.*\n","dic":"DHBPR"}
