{"title":"MIRANDA, Bento José de","cargoss":["Deputado federal"],"cargos_esp":[0],"datas_ini":[1915],"datas_fim":[1929],"estados":["PA"],"autor":["Adrianna Setemy"],"content":"**MIRANDA, Bento José de**\n\n\\*dep. fed. PA 1915-1929.\n\n*Bento José de Miranda* foi eleito pela primeira vez deputado federal\npelo Pará na legenda do Partido Republicano Federal para a legislatura\n1915-1917. Assumindo sua cadeira na Câmara dos Deputados, no Rio de\nJaneiro, então Distrito Federal, no dia 3 de maio de 1915, foi reeleito\npara as quatro legislaturas seguintes. Permaneceu na Câmara até 31 de\ndezembro de 1929, quando se encerrou seu ultimo mandato.\n\nAdrianna Setemy\n\n**FONTES:** CÂM. DEP. *Deputados brasileiros*; Projeto de imagem de\npublicações oficiais brasileiras do Center for Research Libraries e\nLatin-american Microfilm Project. *Mensagens dos Presidentes de\nProvíncia (1830-1930).* Disponível em:\n\\<www.crl.edu/content.asp?l1=4&l2=18&l3=33\\>. Acesso em: 8/1/2009.\n","ref":"**FONTES:** CÂM. DEP. *Deputados brasileiros*; Projeto de imagem de\npublicações oficiais brasileiras do Center for Research Libraries e\nLatin-american Microfilm Project. *Mensagens dos Presidentes de\nProvíncia (1830-1930).* Disponível em:\n\\<www.crl.edu/content.asp?l1=4&l2=18&l3=33\\>. Acesso em: 8/1/2009.\n","dic":"DHBPR"}
