{"title":"MIRANDA, Rodolfo","cargoss":["Constituinte","Deputado federal","Ministro da Agricultura"],"cargos_esp":[0,0,"Ind e Com"],"datas_ini":[1891,1891,1909],"datas_fim":[1891,1893,1910],"estados":[0,"SP",0],"autor":["Carlos Alberto Ungaretti Dias"],"content":"**MIRANDA, Rodolfo**\n\n\\*const. 1891; dep. fed. SP 1891-1893; min. Agric. Ind. e Com.\n1909-1910.\n\n*Rodolfo Nogueira da Rocha Miranda*nasceu em Resende (RJ) no dia 8 de\nnovembro de 1860, filho de Luís da Rocha Miranda Sobrinho e de Amélia da\nRocha Miranda, barões do Bananal. Era neto do coronel Antônio José\nNogueira, revolucionário de 1842, e sobrinho do conselheiro João da\nSilva Carrão, presidente da província de São Paulo, ministro da Fazenda\nda Coroa e senador do Império.\n\nEmbora fosse de família tradicionalmente vinculada ao Partido Liberal,\ndestacou-se como propagandista da República. Ainda bem jovem, escreveu\nnos jornais *Eco Juvenil* e *Iracema*, defendendo o regime republicano,\ne esteve presente na Convenção de Itu, realizada de 1873. Em 1880 viajou\npara a Europa e aí fez seus estudos superiores, no Colégio de França e\nna Sorbonne, em Paris. Retornando em 1883, fixou-se em sua grande\nfazenda de café nas proximidades de São Simão (SP) e logo se transformou\nna principal liderança republicana da região. Nesse período, escreveu\ndiversas *Cartas ao Diário Popular*. Em 1885 foi eleito para a Câmara de\nSão Simão, até então dominada pelos conservadores e liberais. Em janeiro\nde 1888 conseguiu aprovar uma moção defendendo a abolição da escravidão\nno município.\n\nApós a proclamação da República em 15 de novembro de 1889, assumiu o\ngoverno municipal de São Simão, mas ainda no mesmo ano voltou para a\nEuropa. Regressando ao Brasil no ano seguinte, na eleição de 15 de\nsetembro foi eleito para a Assembleia Nacional Constituinte como\nrepresentante de São Paulo. Tomou posse em 15 de novembro, tornando-se,\ncom 29 anos, o parlamentar mais jovem no plenário. Durante os trabalhos,\ndestacou-se na defesa de questões agrícolas. Encerrou o mandato em\ndezembro de 1893.\n\nNo governo de Nilo Peçanha (1909-1910) foi ministro da Agricultura,\nIndústria e Comércio. Durante sua gestão, organizou a pasta e introduziu\nnovas políticas para a modernização da agricultura. Foi então que, em 20\nde outubro de 1910, Nilo Peçanha assinou o Decreto n^o^ 8.319 criando o\nensino agronômico, o que daria origem à Escola Superior de Agricultura e\nMedicina Veterinária, instalada em 1911 no palácio do Duque de Saxe, no\nMaracanã, Rio de Janeiro. No ministério, reorganizou também o Jardim\nBotânico e o Museu Nacional, favoreceu a cafeicultura, e criou as\nescolas de aprendizes artífices e estabelecimentos de base para a\ninstalação de matadouros modelos. Foi ainda responsável pela remodelação\nda Escola de Minas de Ouro Preto (MG) e pela criação da Bolsa de\nCorretores e Mercadorias, do Serviço de Veterinária e do Serviço de\nAprendizados Agrícolas. Também foi fundador da Estação Experimental de\nCana, em Campos (RJ), e promoveu ampla reorganização do Serviço\nGeológico e Mineralógico do Brasil e da Escola de Agricultura.\n\nDestaque particular mereceu sua participação na criação do Serviço de\nProteção aos Índios e Localizações dos Trabalhadores Nacionais, ocorrida\nem 20 de junho de 1910, através do Decreto n^o^ 8.072. A medida tinha\npor finalidade afastar a Igreja Católica da catequese e transformar o\níndio num trabalhador nacional. A iniciativa baseou-se nos trabalhos das\nComissões de Linhas Telegráficas em Mato Grosso, dirigidos por Cândido\nMariano da Silva Rondon, que seria dirigente do Serviço de Proteção ao\nÍndio (SPI) por longos anos.\n\nMembro da comissão diretora do Partido Republicano Paulista (PRP),\nvoltou a ocupar cargo eletivo ao ser eleito senador estadual em 1919 e\nreeleito em 1928. No Senado paulista, foi presidente da Comissão de\nIndústria, Obras Públicas e Estatística. Em 1929 fez vários discursos\ndefendendo a candidatura de Júlio Prestes à presidência da República, e\nem outubro de 1930, com a vitória da Revolução, afastou-se da atividade\npolítica.\n\nProprietário de enormes glebas na zona da Alta Paulista, em 1925,\nenquanto estava no Senado estadual, foi um dos fundadores da povoação de\nAlto Cafezal, hoje cidade de Marília (SP). Em 1928, juntamente com o\nirmão e sócio Luís Miranda, derrubou 250 hectares de matas entre os rios\nPeixe e Feio, para a criação de uma cidade. Em 17 de setembro desse ano,\na nascente povoação foi elevada a distrito de paz, com o nome de\nPatrimônio de Otomânia; em dezembro, passou a se chamar distrito de\nPompéia, em homenagem à esposa de Rodolfo Miranda, Aretuza Pompéia da\nRocha Miranda. Em 1938, o distrito foi elevado à condição de cidade de\nPompéia.\n\nJornalista, escreveu para o jornal *Correio Paulistano* e tornou-se um\nde seus proprietários. Seu nome também está associado à Escola de\nComércio Álvares Penteado, de São Paulo, da qual foi fundador e primeiro\npresidente.\n\nFaleceu em São Paulo em 13 de novembro de 1943, aos 81 anos.\n\nTeve um casal de filhos. Luís Rodolfo Miranda foi presidente do conselho\nsuperior das Caixas Econômicas, deputado estadual e senador, de 1948 a\n1951.\n\nFoi homenageado com a denominação do município de Mirandópolis (SP),\nsituado a 73 km de Araçatuba, em reconhecimento pela ajuda que a\npovoação recebeu em seus primeiros anos do então ministro da\nAgricultura.\n\nCarlos Alberto Ungaretti Dias\n\n**FONTES:** ASSOC. COM. EMPR. Disponível em:\n\\<www.acepompeia.com.br/cidade.php\\>; CALIMAN, A. *Legislativo*; CÂM.\nDEP. SP; CAM. MUN. POMPÉIA. Disponível em:\n\\<www.pompeia.sp.gov.br/index2.php?pag=historia\\>; *Folha da Manhã*\n(14/11/1941); Folha de região. Disponível em:\n\\<www.folhadaregiao.com.br/noticia?54578\\>; FONSECA, A.; FONTES JUNIOR,\nA. *Câmara*; FONSECA, A.; FONTES JUNIOR, A. *Câmara*; PREF.\nINCONFIDENTES. Disponível em:\n\\<www.inconfidentes.mg.gov.br/cidade.php?codigo=1\\>; SENADO. Disponível\nem:\n\\<www.senado.gov.br/sf/SENADORES/senadores\\_biografia.asp?codparl=2047&li=38&lcab=1937-1946&lf=38\\>;\nSérgio de Freitas. Disponível em: \\<www.sfreinobreza.com/NobB.htm\\>;\nUFRRJ. Disponível em:\n\\<www.ufrrj.br/cem-anos/paginas/home.php?id=Reitor\\>. VAMPRÉ, S.\n*Memórias*; WIGKEIT, J. *Precursores.*\n","ref":"**FONTES:** ASSOC. COM. EMPR. Disponível em:\n\\<www.acepompeia.com.br/cidade.php\\>; CALIMAN, A. *Legislativo*; CÂM.\nDEP. SP; CAM. MUN. POMPÉIA. Disponível em:\n\\<www.pompeia.sp.gov.br/index2.php?pag=historia\\>; *Folha da Manhã*\n(14/11/1941); Folha de região. Disponível em:\n\\<www.folhadaregiao.com.br/noticia?54578\\>; FONSECA, A.; FONTES JUNIOR,\nA. *Câmara*; FONSECA, A.; FONTES JUNIOR, A. *Câmara*; PREF.\nINCONFIDENTES. Disponível em:\n\\<www.inconfidentes.mg.gov.br/cidade.php?codigo=1\\>; SENADO. Disponível\nem:\n\\<www.senado.gov.br/sf/SENADORES/senadores\\_biografia.asp?codparl=2047&li=38&lcab=1937-1946&lf=38\\>;\nSérgio de Freitas. Disponível em: \\<www.sfreinobreza.com/NobB.htm\\>;\nUFRRJ. Disponível em:\n\\<www.ufrrj.br/cem-anos/paginas/home.php?id=Reitor\\>. VAMPRÉ, S.\n*Memórias*; WIGKEIT, J. *Precursores.*\n","dic":"DHBPR"}
