{"title":"ARAÚJO, João Vieira de","cargoss":["Presidente de associação ou confederação de empregados ou empregadores","Constituinte","Deputado federal","Deputado federal"],"cargos_esp":[0,0,0,0],"datas_ini":[1874,1891,1897,1891],"datas_fim":[1875,1891,1911,1893],"estados":["AL",0,"PE","PE"],"autor":["Marcos Paulo Torres"],"content":"**ARAÚJO, João Vieira de**\n\n\\* pres. AL 1874-1875; const. 1891;dep. fed. PE 1891-1893 e 1897-1911.\n\n*João Vieira de Araújo* nasceu na cidadedo Recife em 1844.\n\nFoi deputado e presidente da provínciade Alagoas, nomeado por carta\nimperialde 21 de março de 1874. Exerceuo governo alagoano de 12 de\nabrildesse ano a 25 de abril de 1875.\n\nCom o advento da República emnovembro de 1889, foi eleito\ndeputadoconstituinte por Pernambuco em setembro de1890. Assumiu sua\ncadeira em 15 denovembro seguinte, quando foi instalada aAssembleia\nNacional Constituinte no Rio deJaneiro, agora Distrito Federal, e,\npromulgadaa nova Carta constitucional em 24 defevereiro de 1891, em\njunho seguinte passoua cumprir o mandato ordinário, até dezembrode 1893.\nVoltou a ser eleito deputadofederal por seu estado natal em 1897e ocupou\nsua cadeira na Câmara emmaio desse ano. Reeleito para as\nquatrolegislaturas seguintes, permaneceu no Legislativoaté dezembro de\n1911.\n\nFaleceu no ano de 1922.\n\nEscreveu vários livros, entre osquais *Memórias da Faculdade de Direito\ndo Recife* (1879) e *O projeto do Código Penal* (1895).\n\nMarcos Paulo Torres\n\n**FONTES:** CÂM. LEGIS. FED.; CÂM.DEP. *Deputados brasileiros.*\n","ref":"**FONTES:** CÂM. LEGIS. FED.; CÂM.DEP. *Deputados brasileiros.*\n","dic":"DHBPR"}
