{"title":"MONTE, Manuel Clementino do","cargoss":["Deputado federal","Deputado federal","Deputado federal","Senador"],"cargos_esp":[0,0,0,0],"datas_ini":[1927,1913,1894,1930],"datas_fim":[1929,1914,1896,1930],"estados":["AL","AL","AL","AL"],"autor":[0],"content":"**MONTE, Manuel Clementino do**\n\n\\*dep. fed. AL 1894-1896, 1913-1914 e 1927-1929; sen. AL 1930.\n\n*Manuel Clementino do Monte* nasceu em Penedo (AL) no dia 17 de março de\n1859.\n\nFez o curso primário em sua cidade natal e o secundário na Bahia e no\nLiceu de Maceió. Ingressou na Faculdade de Direito do Recife em 1877, e\nem 1880 se transferiu para São Paulo, bacharelando-se pela Faculdade de\nDireito do Largo de São Francisco em 1881. Depois de formado regressou a\nPenedo e ingressou na política filiando-se ao Partido Liberal do\nImpério. Nessa legenda foi eleito, no ano seguinte, deputado provincial\nem Alagoas para a legislatura de 1882 a 1883. Reeleito para as três\nlegislaturas seguintes (1884 a 1889), presidiu a Assembleia Legislativa\nestadual nesse último ano.\n\nJá após a proclamação da República em 15 de novembro de 1889, tornou-se\nredator e diretor da revista *O Direito*, no Rio de Janeiro, em 1893. No\nano seguinte foi eleito deputado federal por Alagoas. Assumindo sua\ncadeira na Câmara dos Deputados no Rio de Janeiro, então Distrito\nFederal, em maio de 1894, exerceu seu mandato até dezembro de 1896,\nquando terminou a legislatura.\n\nPor um período abandonou a política e montou escritório de advocacia no\nRio de Janeiro. Retornou a Alagoas em 1911 e passou a combater o governo\nde Euclides Malta (1906-1912). Voltou a assumir uma cadeira de deputado\nfederal em agosto de 1913, tendo exercido o seu mandato até dezembro do\nano seguinte. Após algum tempo sem concorrer a cargo eletivo, foi\nnovamente eleito deputado federal por Alagoas em 1927, assumindo seu\nmandato em maio desse ano. Em 15 de abril de 1928 ingressou como sócio\nno Instituto Histórico e Geográfico de Alagoas. Permaneceu na Câmara dos\nDeputados até dezembro de 1929, quando se encerrou a legislatura.\n\nEm 1930 foi eleito senador por Alagoas. Assumiu sua cadeira em maio, mas\npermaneceu no Senado só até outubro, quando, após a vitória da Revolução\nde 1930, todos os órgãos legislativos do país foram dissolvidos.\n\nFoi ainda membro da comissão diretora do Partido Economista Democrático\nde Alagoas.\n\nFaleceu no Rio de Janeiro no dia 7de março de 1948.\n\nPublicou *Breve resenha dos fatos de Penedo (AL), no tricentenário de 12\nde abril de 1636 a 12 de abril de 1936* (1936) e *Memória sobre\nFernandes de Barros (Dr. Manuel Joaquim Fernandes de Barros)* (1940),\nalém de várias apelações.\n\nReynaldo de Barros\n\n**FONTES:** BARROS, F. *A B C das Alagoas*; CÂM. DEP. *Deputados\nbrasileiros*; LEITE NETO, L. *Catálogo biográfico* (v.4, p.1.967/8).\n","ref":"**FONTES:** BARROS, F. *A B C das Alagoas*; CÂM. DEP. *Deputados\nbrasileiros*; LEITE NETO, L. *Catálogo biográfico* (v.4, p.1.967/8).\n","dic":"DHBPR"}
