{"title":"MONTEIRO, Bernardino de Sousa","cargoss":["Senador","Presidente de associação ou confederação de empregados ou empregadores","Senador"],"cargos_esp":[0,0,0],"datas_ini":[1909,1916,1920],"datas_fim":[1916,1920,1930],"estados":["ES","ES","ES"],"autor":["Nara Saletto"],"content":"**MONTEIRO, Bernardino de Sousa**\n\n\\*sen. ES 1909-1916; pres. ES 1916-1920; sen. ES 1920-1930.\n\n*Bernardino de Sousa Monteiro* nasceu em Cachoeiro de Itapemirim (ES) a\n6 de outubro de 1864, filho de Francisco de Sousa Monteiro e de\nHenriqueta Rios de Sousa. Seu pai, mineiro de nascimento, mudou-se para\no Espírito Santo nos primeiros tempos da expansão do café no vale do rio\nItapemirim e se tornou um grande fazendeiro, com atuação política no\nmunicípio de Cachoeiro. Em Minas, trabalhara para o comerciante\nBernardino Ferreira Rios, que também migrou para o Espírito Santo na\nmesma época e se estabeleceu com fazenda e grande comércio em Cachoeiro.\nFrancisco casou-se com uma filha dele, Henriqueta, com quem teve 11\nfilhos, quase todos ligados à vida pública do Espírito Santo: Jerônimo,\nBernardino, Antônio e José foram políticos, Fernando foi bispo do\nEspírito Santo, Maria casou-se com o deputado federal Manuel Leite de\nNovais Melo, Bárbara foi mãe de Carlos Lindenberg, governador do estado\ne senador, e Henriqueta casou-se com Florentino Ávidos, que seria\npresidente do estado e senador após a morte dela. A família Monteiro\nliderou a oligarquia capixaba durante a maior parte da Primeira\nRepública.\n\nBernardino foi criado na fazenda Monte Líbano, uma das mais ricas da\nregião, junto aos pais e irmãos. Quando chegou a hora de iniciar os\nestudos secundários foi enviado para o Caraça, colégio de irmãos\nlazaristas famoso pela rigidez de sua disciplina, em Minas Gerais.\nTerminado o curso, em 1886, passou ao Seminário São José, no Rio de\nJaneiro, em companhia do irmão Fernando, mas não completou a formação,\npois desistiu da carreira eclesiástica, e ingressou na Faculdade de\nDireito de São Paulo, na qual se formou em 1893. Voltou para Cachoeiro,\niniciou o exercício da advocacia e casou-se com Iná, filha do então\nsenador pelo Espírito Santo Gil Goulart, que havia sido uma importante\nliderança política em Cachoeiro no Império. O casal foi residir na\nchácara de Goulart, que se mudara para o Rio de Janeiro, e lá formou uma\nnumerosa família.\n\nEm 1896, Bernardino se elegeu para o Conselho Municipal de Cachoeiro,\npelo Partido Republicano Construtor (PRC), que governava o estado, em\neleição contestada pela oposição e somente decidida com a intervenção do\npresidente Muniz Freire e da Corte de Justiça. Naquele ano, iniciou-se\num forte movimento de oposição no estado e no âmbito federal, e\nBernardino e Gil Goulart dele participaram. Como oposicionista,\nreelegeu-se em 1900 e em 1904. No ano seguinte houve uma grande mudança\nna política capixaba, com a divisão das forças governistas entre o\npresidente do estado Henrique Coutinho e Muniz Freire, até então a\nprincipal liderança do PRC. Bernardino posicionou-se ao lado do\npresidente Coutinho, e passou a integrar a base governista e o PRC. Em\n1906 integrou a chapa do partido como candidato a deputado federal,\nporém o Congresso Nacional reconheceu a chapa dissidente, encabeçada por\nMuniz Freire, candidato a senador, e não a do governo estadual. No ano\nseguinte, Bernardino foi eleito deputado estadual (1907-1910),\nacumulando esse mandato com o de conselheiro municipal, que renovou em\n1908, o que era permitido na época.\n\nTambém em 1908, seu irmão Jerônimo foi eleito presidente do estado e\npromoveu a reunião da maior parte das forças políticas estaduais em\ntorno da criação de um novo partido, o Partido Republicano\nEspírito-Santense (PRES), presidido por ele, em substituição ao PRC, que\nfoi extinto. Em 1909, Bernardino foi eleito senador. No Senado, travou\nem 1912 uma rumorosa polêmica com Muniz Freire, saindo em defesa de\nJerônimo, contra o qual aquele parlamentar apresentara sérias denúncias.\n\nEm 1916, Bernardino foi lançado candidato à presidência do estado, e sua\ncandidatura provocou a mais séria crise política da Primeira República\nno Espírito Santo. Vários aliados, incluindo a bancada capixaba no\nCongresso Nacional – exceto ele próprio e Jerônimo, então deputado –, o\nlíder do governo na Assembleia Legislativa, o vice-presidente do estado\ne numerosos governos municipais promoveram um forte movimento de\noposição, acusando os Monteiro de procurar consolidar uma oligarquia\nfamiliar no estado e de terem levado as finanças estaduais a uma\nsituação de insolvência. Entre os parlamentares, o senador João Luís\nAlves e o deputado Torquato Moreira dirigiram a oposição e conseguiram o\napoio do presidente da República Venceslau Brás (1914-1918), que estava\nempenhado no saneamento financeiro do país e procurou em vão demover os\nMonteiro daquela candidatura, dando suporte, no início, à oposição.\nContra Bernardino, foi lançado José Gomes Pinheiro Júnior, antigo\nadversário dos Monteiro e também político de Cachoeiro, para a\npresidência do estado, e Alexandre Calmon, chefe político de Colatina,\npara a vice-presidência. O conflito se estendeu a numerosos municípios,\nem muitos casos com grande violência, e provocou a fuga de centenas de\npessoas para Minas Gerais e para o estado do Rio de Janeiro.\n\nRealizadas as eleições, as duas facções proclamaram eleitos e empossaram\nseus candidatos pelas duas Assembleias que funcionavam, cada qual se\ndeclarando legítima. Bernardino tinha a vantagem de ocupar o palácio; a\noposição fixou a sede de seu governo em Colatina e recorreu à instância\nfederal, pedindo a intervenção no estado e o reconhecimento de seus\ncandidatos. A violência se agravou e só não foi maior porque os rebeldes\nforam ludibriados numa compra de armas que fizeram, o que deixou suas\nforças inferiorizadas diante dos governistas, que dispunham da polícia,\nalém de tropas de coronéis. O episódio ficou conhecido como Revolta do\nXandoca, apelido de Alexandre Calmon.\n\nNo Congresso Nacional travaram-se longas discussões, nas quais os\nparlamentares rebeldes faziam pesadas acusações aos Monteiro,\nparticularmente a Jerônimo, e ao governo. O caso se arrastou por alguns\nmeses e terminou com a vitória dos Monteiro, mas eles saíram desgastados\ndo episódio, principalmente Jerônimo, dadas as denúncias apresentadas\npor seus ex-aliados. No dia 17 de agosto foi recusada, pela Câmara, a\nintervenção no Espírito Santo, o que garantia a posse de Bernardino, e a\n1^o^ de setembro foi aprovada uma anistia a todos os envolvidos.\n\nA primeira tarefa de Bernardino era a pacificação do estado e, com ela,\na governabilidade, o que ele conseguiu realizar paulatinamente, com\nhabilidade. A crise econômica foi revertida com o fim da Primeira Guerra\nMundial, em 1918, e a alta acentuada do preço do café causou uma receita\nrecorde em 1919 permitindo desafogar as finanças estaduais. Porém\nBernardino encampou o Banco Hipotecário e Agrícola do Espírito Santo,\nassumindo uma nova e pesada dívida. A economia começava a se\ndiversificar, beneficiando-se das indústrias de açúcar e de tecidos no\nvale do Itapemirim, do aumento da exportação de madeira e do impulso\ndado pelo governo à produção de cacau. A principal realização de seu\ngoverno foi a elaboração e o início da execução de um projeto de viação\npara o estado, incluindo as primeiras rodovias destinadas ao tráfego\nautomotivo e uma ferrovia ligando Cachoeiro ao porto de Itapemirim.\n\nAo final do mandato, em 1920, Bernardino enfrentou nova crise\nsucessória, dessa vez dividindo os Monteiro. Ele e Jerônimo entraram em\nchoque a respeito do candidato a sua sucessão. O senador Nestor Gomes\nfoi escolhido como candidato de conciliação, e as eleições se realizaram\nsem problemas, embora em clima tenso, pois os partidários de Jerônimo\nacusavam o governo de perseguir seus aliados. Após o pleito a situação\nse agravou, com os jeronimistas denunciando demissões de funcionários\nnomeados por Jerônimo e invasões policiais violentas de fazendas de seus\naliados. Em maio, aproximando-se o final do mandato de Bernardino, os\njeronimistas decidiram não reconhecer a eleição de Nestor. A Assembleia\nLegislativa se dividiu em duas, cada qual se reunindo separadamente e se\ndeclarando legítima. A Assembleia jeronimista elegeu Etienne Dessaune\npresidente da Casa, negou o reconhecimento da eleição de Nestor e,\nficando assim vago o cargo de presidente do estado, a 23 de maio\nempossou Dessaune como presidente. A Assembleia bernardinista não tinha\no quórum mínimo necessário para dar posse a Nestor, nem o controle da\nsede e dos livros da Assembleia, em mãos dos jeronimistas, mas se reuniu\nno palácio, acrescentou nomes de adversários à ata, e empossou Nestor.\n\nNessa altura, o conflito já se tornara armado, e a polícia se rebelara\ncontra seus chefes governistas e saíra em apoio a Jerônimo, ficando\nBernardino e Nestor apenas com a guarda do palácio e capangas dos\ncoronéis. A posse de Nestor se deu no palácio sitiado, onde se\nentrincheiravam seus partidários. Começou o tiroteio, pondo em pânico a\ncapital. No dia 27 de maio o presidente Epitácio Pessoa (1919-1922)\ndecretou intervenção federal no estado, e as tropas do Exército\nassumiram o controle da cidade. O caso passou ao Congresso Nacional, que\nconfirmou a posse de Nestor Gomes.\n\nBernardino saíra vitorioso e daí em diante se tornou o político mais\npoderoso do estado, controlando a máquina do PRES. Porém teve que\naceitar a presença de antigos adversários, como Pinheiro Júnior, no\ndiretório do partido. Por seu lado, Nestor Gomes, bem como seus\nsucessores, exerciam o poder que lhes dava o cargo e não foram submissos\na ele. Bernardino voltou ao Senado no mesmo ano e nele permaneceu até\n1930, quando faleceu a 12 de maio, antes de tomar posse após uma nova\nreeleição.\n\nDe seu casamento com Iná Goulart teve 11 filhos, um dos quais, Nelson\nGoulart Monteiro, fez longa carreira política, iniciada na Primeira\nRepública como deputado estadual (1919-1930) e continuada após 1930 como\ndeputado estadual, secretário de governo e deputado federal pelo Partido\nSocial Democrático (PSD) em duas legislaturas.\n\nNara Saletto\n\n**FONTES:** CÂM. DEP. *Intervenção* (1917, 1923); Caso do Espírito\nSanto: como nasceu; Caso do Espírito Santo: pela verdade; CHEQUER FILHO,\nN. *Revolta*; MONTEIRO, Bernardino de Souza. Mensagem dirigida ao\nCongresso Legislativo 13/9/1917, 16/10/1918, 12/10/1919); NOVAES, H.\n*Memórias*; NOVAES, M. *Jerônimo*; SANTOS, A. *Republicano*.\n","ref":"**FONTES:** CÂM. DEP. *Intervenção* (1917, 1923); Caso do Espírito\nSanto: como nasceu; Caso do Espírito Santo: pela verdade; CHEQUER FILHO,\nN. *Revolta*; MONTEIRO, Bernardino de Souza. Mensagem dirigida ao\nCongresso Legislativo 13/9/1917, 16/10/1918, 12/10/1919); NOVAES, H.\n*Memórias*; NOVAES, M. *Jerônimo*; SANTOS, A. *Republicano*.\n","dic":"DHBPR"}
