{"title":"MONTEIRO, Carneiro","cargoss":["Constituinte","Deputado federal","Presidente de associação ou confederação de empregados ou empregadores","Senador"],"cargos_esp":[0,0,0,0],"datas_ini":[1891,1891,1892,1907],"datas_fim":[1891,1907,1892,1920],"estados":[0,"RS","RS","RS"],"autor":[0],"content":"**MONTEIRO, Carneiro**\n\n\\*const. 1891; dep. fed. RS 1891-1907; pres. RS 1892; sen. RS 1907-1920.\n\n*Vitorino Ribeiro Carneiro Monteiro* nasceu em Alegrete (RS) no dia 26\nde abril de1859, filho do tenente-general Vitorino José Carneiro\nMonteiro, barão de São Borja, e de Benevenuta Carneiro Monteiro. Seu\navô, brigadeiro Bento Manuel Ribeiro, foi um importante militar com\ngrande destaque na Guerra Cisplatina e na Guerra dos Farrapos.\n\nMatriculou-se na Escola Militar e cedo se manifestou republicano,\ncontrariando as tradições conservadoras da família e de seu irmão mais\nvelho, Severino Ribeiro, conservador militante e chefe político em\nAlegrete. Além de cursar a Escola Militar, bacharelou-se na Faculdade de\nDireito de São Paulo em 1883.\n\nDepois da proclamação da República (15/11/1889), foi eleito em 15 de\nsetembro de 1890 deputado federal constituinte pelo Rio Grande do Sul na\nlegenda do Partido Republicano Rio-Grandense (PRR), liderado por Júlio\nde Castilhos. Assumiu sua cadeira em 15 de novembro, quando foi\ninstalado o Congresso Nacional Constituinte, e participou da elaboração\nda Constituição que foi promulgada em 24 de fevereiro de 1891. No dia\nseguinte, quando a Assembleia elegeu o presidente da República,\nmanifestaram-se sintomas de ruptura na liderança exercida por Castilhos:\nembora a orientação dada pelo PRR fosse de apoio à candidatura do\nmarechal Deodoro da Fonseca, Vitorino Carneiro Monteiro, Assis Brasil,\nManuel da Rocha Osório e Alcides Lima votaram em Prudente de Morais.\n\nEm 3 de maio de 1891, ao ter início a legislatura ordinária, Carneiro\nMonteiro tomou assento na Câmara dos Deputados. Em 15 de julho, eleito\npela Constituinte estadual, Júlio de Castilhos assumiu o governo do Rio\nGrande do Sul. Em 3 de novembro, diante das dificuldades políticas que\nenfrentava, o marechal Deodoro da Fonseca decidiu fechar o Congresso\nNacional, provocando protestos em vários pontos do país. Júlio de\nCastilhos de início não se manifestou, mas no dia 12 de novembro acabou\npor declarar-se a favor de Deodoro. No dia seguinte foi obrigado a\nrenunciar, entregando o poder a uma junta governativa formada por Assis\nBrasil, João de Barros Cassal e o general Domingos Barreto Leite. Cinco\ndias depois, Assis Brasil renunciou, passando Barreto Leite e Barros\nCassal a se revezar no comando do estado. Em 23 de novembro, diante da\nameaça de oficiais da Marinha de bombardear o Rio de Janeiro, o próprio\nDeodoro renunciou, sendo substituído pelo vice-presidente marechal\nFloriano Peixoto.\n\nA instabilidade no Rio Grande do Sul prosseguiu durante todo o ano de\n1892. Em 8 de junho Barros Cassal foi substituído no governo por José\nAntônio Correia da Câmara, o visconde de Pelotas, que por sua vez foi\nderrubado nove dias depois por um movimento articulado por Júlio de\nCastilhos. Este, contudo, depois de vitorioso, não assumiu o poder.\nApesar das divergências anteriores envolvendo a eleição de Deodoro,\npreferiu entregar o governo a Carneiro Monteiro, que o exerceu até 27 de\nsetembro e o transferiu então a Fernando Abbott, secretário do Interior.\nAbbott conduziu as eleições que mais uma vez levaram Júlio de Castilhos\nao poder e em 25 de janeiro de 1893 transmitiu-lhe o governo. No mês\nseguinte, eclodiu a Revolução Federalista.\n\nDurante o conflito entre os federalistas (maragatos), de um lado, e os\nrepublicanos castilhistas e mais o governo federal de Floriano Peixoto,\nde outro, que se estendeu de fevereiro de 1893 a agosto de 1895,\nCarneiro Monteiro foi nomeado ministro plenipotenciário no Uruguai.\nNessa função, assinou em Montevidéu, em fevereiro de 1894, protocolo\nsobre as reclamações do governo Oriental pela morte de uruguaios na\nfronteira durante a Revolução Federalista. Mesmo como ministro, foi\nreeleito deputado federal em 1894. Deixou o posto em Montevidéu em março\nde 1895, tomou assento na Câmara dos Deputados e, quatro vezes reeleito,\nnela permaneceu até o ano de 1907. Na Câmara, foi membro da Comissão de\nFinanças e aliado do senador gaúcho Pinheiro Machado.\n\nEm 3 de março de 1907 foi eleito senador pelo Rio Grande do Sul, na vaga\naberta com a renúncia de Ramiro de Barcelos, e permaneceu no Senado\nFederal até o ano de 1920.\n\nFaleceu a bordo do navio *Itapuca*, indo para o Rio de Janeiro, em 30 de\nmaio de 1920.\n\nRaimundo Hélio Lopes\n\n**FONTES:** ABRANCHES, J. *Governos*; BELOCH, I.; ABREU, A.\n*Dicionário*; O’DONNELL, F. *Apparício.*\n","ref":"**FONTES:** ABRANCHES, J. *Governos*; BELOCH, I.; ABREU, A.\n*Dicionário*; O’DONNELL, F. *Apparício.*\n","dic":"DHBPR"}
