{"title":"MORAIS, Albérico Dias de","cargoss":["Deputado federal"],"cargos_esp":[0],"datas_ini":[1924],"datas_fim":[1929],"estados":["DF"],"autor":["Evelyn Morgan Monteiro Paiva"],"content":"**MORAIS, Albérico Dias de**\n\n\\*dep. fed. DF 1924-1929.\n\n*Albérico Dias de Morais* foi eleito pela primeira vez intendente do\nConselho Municipal do Rio de Janeiro, então Distrito Federal, em 1911.\nNesse mesmo ano integrou a Comissão Permanente do Orçamento, Fazenda e\nPatrimônio. Sucessivas vezes reeleito a partir de 1913, exerceu o\nmandato até 1925. Nos anos de 1913 e 1914 foi primeiro-secretário da\nMesa Diretora do Conselho.\n\nFiliado ao Partido Republicano do Distrito Federal, nessa legenda foi\neleito deputado pelo Distrito Federal em 1924. Assumindo sua cadeira na\nCâmara dos Deputados no dia 12 de junho do mesmo ano, foi reeleito para\na legislatura seguinte em 1927. Permaneceu no Legislativo até 31 de\ndezembro de 1929, quando se encerraram o seu mandato e a legislatura.\n\nEvelyn Morgan Monteiro Paiva\n\n**FONTES:** *Arquivo IHGB.* Fundo Paulo de Frontin; CÂM. DEP. *Deputados\nbrasileiros*; CONS. MUN. DF. *Anais* (1911-1925).\n","ref":"**FONTES:** *Arquivo IHGB.* Fundo Paulo de Frontin; CÂM. DEP. *Deputados\nbrasileiros*; CONS. MUN. DF. *Anais* (1911-1925).\n","dic":"DHBPR"}
