{"title":"MORAIS, Jorge de","cargoss":["Deputado federal","Senador","Deputado federal"],"cargos_esp":[0,0,0],"datas_ini":[1905,1909,1927],"datas_fim":[1908,1911,1930],"estados":["AM","AM","AM"],"autor":["Inoã Pierre Carvalho Urbinati"],"content":"**MORAIS, Jorge de**\n\n\\*dep. fed. AM 1905-1908; sen. AM 1909-1911; dep. fed. AM 1927-1930.\n\n*Jorge de Morais* nasceu em Manaus no dia 18 de julho de 1872, segundo\nDunshee de Abranches, ou 1878, de acordo com Agnelo Bittencourt.\n\nCursou a Faculdade de Medicina da Bahia, em Salvador, na qual se\ndestacou obtendo altas notas. Depois viajou pela Europa, fazendo cursos\nde especialização em vários países, como Alemanha, Suíça, Áustria e\nItália, e demorando-se em Paris para aprofundar os estudos. De volta a\nManaus, casou-se, mas sua esposa faleceu pouco tempo depois.\n\nDurante a Guerra de Canudos (1896-1897) voltou à Bahia e foi contratado\ncomo cirurgião pelo Hospital de São Bento, em Salvador. Em 1898 foi\nnomeado médico legista da chefatura de polícia da capital amazonense e\nmédico do estado. Também em Manaus tornou-se cirurgião da Beneficência\nPortuguesa e da Santa Casa de Misericórdia, bem como médico do Instituto\nBenjamin Constant. De 1904 a 1905 integrou a Comissão de Saneamento de\nManaus.\n\nNesse último ano, estando em curso a legislatura 1903-1905, foi eleito\ndeputado federal pelo Amazonas em pleito suplementar, para ocupar a\ncadeira deixada vaga pela renúncia de Antônio de Sá Peixoto, que havia\nsiso eleito senador. Assumindo sua cadeira na Câmara dos Deputados, no\nRio de Janeiro, então Distrito Federal, em 1^o^ de julho de 1905,\nformulou projetos para a campanha em prol da educação física e da\nhigiene militar. Foi reeleito no ano seguinte e exerceu seu mandato até\n31 de dezembro de 1908, quando se encerrou a legislatura. Em 1909 foi\neleito senador pelo Amazonas, em nova vaga aberta por Sá Peixoto, que\nhavia sido eleito vice-governador do estado. Assumiu em 27 de maio sua\ncadeira no Senado Federal e passou a integrar a Comissão de Instrução\nPública. Em setembro de 1910 proferiu o discurso de agradecimento ao\npolítico francês Georges Clemenceau, que se encontrava em visita ao\nBrasil. No mês seguinte, em meio à forte crise política enfrentada pelo\ngoverno amazonense, apoiou o governador Antônio Bittencourt (1908-1913)\ne tomou parte na defesa de Manaus contra o bombardeio das forças\nfederais.\n\nPermaneceu no Senado até abril de 1911, quando renunciou ao mandato por\nter sido eleito o primeiro superintendente municipal (prefeito)\nconstitucional de Manaus, apoiado por Bittencourt. Assumiu o cargo em\nsubstituição a Adrião Ribeiro Nepomuceno. Ao longo de sua gestão,\nenfrentou dificuldades financeiras, tendo que lidar com um magro\norçamento municipal. Permaneceu à frente do Executivo municipal até\n1913, quando foi substituído por Henrique Ferreira Pena de Azevedo.\n\nApós algum tempo sem cargo eletivo, voltou a ser eleito deputado federal\npelo Amazonas em 1927. Assumiu em maio desse ano sua cadeira na Câmara\ndos Deputados e foi reeleito em 1930, mas teve o mandato interrompido em\noutubro, com a vitória do movimento revolucionário que levou Getúlio\nVargas ao poder e extinguiu todos os órgãos legislativos do país.\n\nFoi ainda professor da Escola Normal de Manaus, do Ginásio Amazonense e\nda Universidade do Amazonas, diretor do Laboratório de Análise do estado\ne um dos fundadores da Academia Amazonense de Letras, onde criou a\ncadeira de Osvaldo Cruz.\n\nFaleceu no Rio de Janeiro em março de 1947.\n\n*Inoã Pierre Carvalho Urbinati*\n\n**FONTES:** ABRANCHES, J. *Governos*; BITTENCOURT, A. *Dicionário*;\nLEITE NETO, L. *Catálogo biográfico* (v.3, p.1.455/6); Wikipédia.\nDisponível em:\n\\<http://pt.wikipedia.org/wiki/Anexo:Lista\\_de\\_prefeitos\\_de\\_Manaus\\>.\nAcesso em: 29/7/2011.\n","ref":"**FONTES:** ABRANCHES, J. *Governos*; BITTENCOURT, A. *Dicionário*;\nLEITE NETO, L. *Catálogo biográfico* (v.3, p.1.455/6); Wikipédia.\nDisponível em:\n\\<http://pt.wikipedia.org/wiki/Anexo:Lista\\_de\\_prefeitos\\_de\\_Manaus\\>.\nAcesso em: 29/7/2011.\n","dic":"DHBPR"}
