{"title":"MOREIRA, Colares","cargoss":["Presidente de associação ou confederação de empregados ou empregadores","Senador"],"cargos_esp":[0,0],"datas_ini":[1902,1909],"datas_fim":[1906,1910],"estados":["MA","MA"],"autor":["Alan Carneiro","Raimundo Helio Lopes"],"content":"**MOREIRA, Colares**\n\n\\*pres. MA 1902-1906; sen. MA 1909-1910.\n\n*Alexandre Colares Moreira Júnior* nasceu em Codó (MA) no dia 8 de\nfevereiro de 1849, filho de Alexandre Colares Moreira e de Maria Isabel\nde Assis Moreira.\n\nCursou o secundário no Liceu Maranhense, em São Luís. Foi juiz de paz de\n1874 a 1881, e também em 1874 elegeu-se deputado provincial no Maranhão.\nExerceu o mandato até 1879 e foi membro da Comissão de Orçamento da\nAssembleia Provincial. Voltou a ser eleito deputado provincial em 1889,\nmas teve o mandato interrompido com a proclamação da República em 15 de\nnovembro.\n\nEm 1890 foi nomeado inspetor do Tesouro Público do Maranhão por Pedro\nAugusto Tavares Júnior, primeiro governador do estado no período\nrepublicano. Foi também um dos organizadores do diretório do Partido\nRepublicano Conservador do Maranhão, a primeira agremiação partidária do\nestado criada sob o novo regime. Eleito vereador em São Luís, exerceu o\nmandato até 1892. Em 1897 foi nomeado intendente da capital maranhense,\nfunção que exerceu até dezembro de 1900.\n\nEm 1902 foi eleito primeiro-vice-presidente do estado do Maranhão,\nenquanto Manuel Lopes da Cunha era eleito presidente. Quando este\nadoeceu e se licenciou do governo em 19 de novembro, foi substituído por\npoucos dias pelo terceiro-vice-presidente, Raimundo Nogueira da Cruz e\nCastro, já que o primeiro e o segundo vices se encontravam ausentes do\nestado. Logo em seguida Colares Moreira retornou e assumiu o governo até\no fim do quadriênio, em 1906, quando foi substituído pelo novo\npresidente estadual Benedito Pereira Leite. Durante esses anos, o estado\ndo Maranhão, em especial a capital São Luís, foi assolada por uma\nepidemia de peste bubônica que cobriu o último trimestre de 1903 e se\nprolongou até a metade do ano de 1904. Também em sua administração foi\ncriada a Repartição de Obras Públicas, Viação, Indústria, Terras e\nColonização, em 1905.\n\nFoi novamente intendente de São Luís entre 1906 e 1909. Nesse último ano\nfoi eleito senador pelo Maranhão para preencher a vaga aberta pela morte\ndo senador e conselheiro Augusto Olímpio Gomes de Castro. Ficou no\nSenado até início do ano de 1910, quando renunciou. Voltou ao Maranhão e\ntornou-se presidente do diretório do Partido Republicano Conservador. Em\n1912 foi novamente eleito intendente da capital maranhense, assumindo o\ncargo em janeiro de 1913. Durante essa gestão, assinou contrato para\nobras de saneamento da cidade, fez estudos sobre a limpeza de rios e\nmananciais, e proibiu a construção de cortiços e a circulação de\nanimais, como gado e aves, no perímetro urbano. Também na sua\nadministração foram recebidos os restos mortais do escritor Odorico\nMendes, em 26 de novembro de 1915. Em dezembro do mesmo ano, sua gestão\nencerrou-se.\n\nFoi também coronel comandante da Guarda Nacional em São Luís, diretor do\nBanco do Maranhão, da Companhia de Navegação a Vapor do Maranhão, do\nExpediente do Tesouro Público e de Obras Públicas do Maranhão.\n\nFaleceu em São Luís no dia 1^o^ de outubro de 1917.\n\nAlan Carneiro/Raimundo Helio Lopes\n\n**FONTES:** ABRANCHES, J. *Governos*; LEITE NETO, L. *Catálogo\nbiográfico* (v.1, p.1.13/4); MARQUES, C. *Dicionário*; MEIRELES, M.\n*História*; SENADO. Disponível em:\n\\<www.senado.gov.br/sf/senadores/senadores\\_biografia.asp?codparl=1374&li=28&lcab=1909-1911&lf=28\\>.\nAcesso em: 22/9/2008.\n","ref":"**FONTES:** ABRANCHES, J. *Governos*; LEITE NETO, L. *Catálogo\nbiográfico* (v.1, p.1.13/4); MARQUES, C. *Dicionário*; MEIRELES, M.\n*História*; SENADO. Disponível em:\n\\<www.senado.gov.br/sf/senadores/senadores\\_biografia.asp?codparl=1374&li=28&lcab=1909-1911&lf=28\\>.\nAcesso em: 22/9/2008.\n","dic":"DHBPR"}
