{"title":"MORGAN, Edwin","cargoss":["Embaixador do(a) EUA no Brasil"],"cargos_esp":["Bras"],"datas_ini":[1912],"datas_fim":[1933],"estados":[0],"autor":["Francisco Figueira"],"content":"**MORGAN, Edwin**\n\n\\*diplomata norte-americano; emb. EUA no Bras. 1912-1933.\n\n*Edwin Vernon Morgan* nasceu na cidade de Aurora, estado de Nova Iorque\n(EUA), em 22 de fevereiro de 1865. Filho de uma influente família\nrepublicana, teve benefícios pelos laços de sangue. Seu avô fora eleito\npara a Câmara dos Representantes em 1852, e um primo para o governo de\nNova Iorque durante a Guerra de Secessão (1861-1865). Socialmente\nimportantes, os Morgan tinham alguma riqueza adquirida no mercado de\ncrédito, incluindo participação na fundação da empresa American Express.\nEdwin sempre teve, portanto, meios financeiros além do modesto salário\noferecido na época para diplomatas dos Estados Unidos.\n\nEstudou história em Harvard, graduou-se em 1890 e no ano seguinte obteve\no diploma de mestre. Em 1892 foi para a Alemanha estudar por 12 meses.\nEm 1895 tornou-se instrutor de história no Adelbert College, em\nCleveland, Ohio (EUA).\n\nSua entrada no serviço diplomático estadunidense aconteceu em 1900. Tal\nemprego só foi conseguido devido a conexões políticas, como de costume\nna época. Morgan seria o retrato perfeito de um diplomata\nnorte-americano que surgia no começo do século XX. Tais profissionais\neram formados por uma das universidades da “Ivy League” (Liga da Hera,\nconjunto das universidades mais tradicionais do Nordeste dos EUA),\nentravam no Departamento de Estado aos 30 e poucos anos e escalavam a\nhierarquia até seu ápice profissional como embaixadores em uma grande\ncapital europeia. Os primeiros cargos de Morgan foram na Coreia e na\nRússia. Subiu rapidamente na escala profissional até conquistar o cargo\nde ministro em Cuba em 1905. Quatro anos depois foi transferido para o\nUruguai, onde ocupou a mesma posição. Em 1911 nova mudança, dessa vez\npara o velho continente, para trabalhar em terras lusas. Finalmente, em\n1912, aportou na baía de Guanabara para ser embaixador dos EUA no\nBrasil, posto que ocupou por 21 anos, até 1933, e que seria o último de\nsua carreira diplomática.\n\nChamado por seus colegas de “King of Rio”, tinha trânsito e importância\nno Rio de Janeiro, então capital federal, em um período de crescente\ninfluência norte-americana em substituição à inglesa. Ficou famoso por\norganizar grandes recepções, e alguns historiadores lhe atribuem a\ncriação da popular bebida caipirinha. De tão identificado com o Brasil,\npermaneceu em território verde e amarelo após a aposentadoria e foi\natendido no desejo de que seus restos mortais ficassem em Petrópolis\n(RJ).\n\nO Rei do Rio\n\nDe início, Edwin Morgan se viu navegando em mares agitados. Causava\nproblemas diplomáticos a política brasileira de valorização do café, que\nera liderada pelo estado de São Paulo e consistia em queimar estoques e\ndiminuir a oferta do produto no mercado internacional para subir seu\npreço. Os EUA, um dos principais importadores do produto, abriram uma\ninvestigação em seu Departamento de Justiça sobre o que chamavam de\n*trust* do café. O embaixador brasileiro em Washington à época protestou\ne reclamou de interferência em assuntos internos de seu país. A réplica\nfoi ainda mais dura, e parecia que o incidente só crescia até a chegada\nda nova voz de Morgan. O novato lembrou aos dois lados a importância de\numa boa relação: os EUA queriam exercer a liderança nas Américas, e o\nBrasil queria garantir o comércio, principal tópico de negociação\ninternacional do país no início do século XX. Com as eleições\npresidenciais de 1912 e a vitória de Woodrow Wilson, Morgan sugeriu à\nnova administração que convidasse o ministro brasileiro das Relações\nExteriores, Lauro Müller, para uma visita a Washington. Com a atuação de\nEdwin Morgan, o confronto que se criava foi extinto.\n\nDa visita de Lauro Müller, outro incidente, este menor, surgiu. Quando\nda volta do ministro ao Rio de Janeiro, o embaixador quis recebê-lo com\numa festa. Porém os membros da Câmara dos Deputados não foram\nconvidados, e surgiu um mal-estar, que, apesar de rapidamente resolvido\npor Morgan, chegou a ser notícia internacional no *New York Times*.\n\nDas muitas festas e recepções que Morgan organizou, uma se destaca pela\ncuriosidade. Stephen Duggs, educador norte-americano, parou no Brasil\ndurante sua viagem à América Latina para estudar a educação nos países\nda região. Dessa visita surgiu o atual Instituto Brasil-Estados Unidos\n(Ibeu). Ao voltar, Duggs escreveu um livro em que contava sobre sua\nviagem e citava algumas curiosidades sobre o embaixador que o recebera.\nMorgan era exímio conhecedor da história e da cultura brasileiras, e\ntambém da literatura e das instituições. O enviado também contou que\nMorgan era amado pelos brasileiros e estava tão inserido no ambiente\ncarioca que os comerciantes dos EUA o acusavam de defender também os\ninteresses do Brasil, às vezes em oposição aos norte-americanos. Mesmo\nassim, Duggs chamou Morgan de “Grande embaixador americano”.\n\nA adaptação de Morgan foi também em parte facilitada por sua riqueza\nfamiliar. O uso da fortuna pessoal para o patrocínio das artes e para\nfestas trouxe ao embaixador uma simpatia local ainda maior. No exercício\nda profissão, Morgan se destacava dos outros embaixadores pela\nfacilidade de acesso às autoridades e pela influência junto ao governo.\nTudo isso lhe trouxe a alcunha de “Rei do Rio”. Sua importância era tão\ngrande já em 1913 que foi o único diplomata norte-americano a permanecer\nem cargo de embaixador depois da eleição dos democratas com Wilson.\n\nEm 1919, a Conferência de Paris provocou uma disputa no Brasil sobre\nquem seria enviado como representante brasileiro. Rui Barbosa teve seu\nnome citado pela imprensa. O jurista já se tornara famoso\ninternacionalmente pela destacada atuação em Haia, onde ganhou o\nrespeito das mais importantes delegações por sua inteligência aguda e\nsua fluência em vários idiomas. Depois de muitas idas e vindas, muita\ndisputa interna, Rui foi convidado e recusou, alegando ter sido o\nconvite muito tardio. O senador Epitácio Pessoa chefiou a delegação,\nonde tratou, como de costume, de questões comerciais.\n\nA intriga que envolveu o nome de Rui Barbosa e sua recusa deram espaço\npara acusações posteriores de que os EUA não teriam querido a presença\ndo intelectual, pois o considerariam muito independente. Rui poderia não\nser o “voto certo” para os norte-americanos. No entanto, Rui recusou o\nconvite por orgulho próprio, pois não fora o primeiro nome lembrado e\nnão queria se submeter aos comandos burocráticos de Domício da Gama no\nItamarati.\n\nO fato é que as relações entre Brasil e Estados Unidos melhoravam dia\napós dia. A estratégia da potência era aumentar o comércio e o\ninvestimento nos países latino-americanos. Maior estímulo era dado às\nexportações do Brasil para reverter a já histórica balança comercial\ndesfavorável. O embaixador Morgan não era o mais ferrenho defensor desse\ntipo de esforço, chamado de diplomacia do dólar, mas atuava junto ao\ngoverno local e conseguiu menores tarifas para as exportações\nnorte-americanas. Contudo, outro ponto foi mais importante: a decadência\neuropeia. Enquanto os EUA surgiam como nova potência, as velhas caíam\ndevido à Grande Guerra. O comércio externo europeu diminuía\nsensivelmente, e também a velha influência britânica na *terra\nbrasilis*, abrindo um vácuo para os EUA.\n\nO desejo dos EUA de vender esbarrou na fraca economia brasileira e na\nfalta de segurança econômica, ameaçadas por políticas públicas que\nsurgiam subitamente, como a da valorização do café. Morgan soube lidar\ncom os dois lados, sempre reforçando as relações políticas. Com o passar\ndo tempo, o embaixador começou a desejar ser reconhecido por sua\ncompetência e passar para o mesmo posto em um país europeu mais\nprestigiado. No entanto, o que foi reconhecido não foi tanto da\ncapacidade de Morgan, e sim da dependência em relação a ele. Tal\nsentimento só aumentou quando, durante a Revolução de 1930, o embaixador\nestava de férias em Paris. Pego de surpresa, teve que voltar às pressas.\nEnquanto isso, a embaixada ficou sob a responsabilidade de um\nfuncionário inexperiente.\n\nAo chegar, Morgan mais uma vez serviu brilhantemente de canal, dessa vez\nentre os americanos e os novos mandatários. O presidente Hoover, do alto\ndo Distrito de Columbia, já ordenava embargos contra a revolução –\ncuriosamente era a primeira vez que os EUA tomavam tal atitude contra um\npaís sul-americano. Mal chegado de Paris, Morgan já começou a trabalhar\na relação. Declarou que a junta militar que assumiu o poder após a queda\nde Washington Luís era de conhecidos seus e que as bandeiras vermelhas\nnas ruas significavam revolução, não comunismo. Mais um acerto do\nembaixador.\n\nO tempo passava, novos governos assumiam nos Estados Unidos e não\nqueriam substituí-lo. Morgan lutou, mas aceitou seu destino e ficou no\nRio de Janeiro até sua aposentadoria e morte, em 1934, e depois seus\nrestos mortais foram guardados em Petrópolis. Nessa cidade, antes de\nmorrer, Morgan morara no palácio do Grão-Pará.\n\nFrancisco Figueira\n\n**FONTES:** BUENO, C.; CERVO, A. *Política*; DUGGS, S. *Professor*;\nGARCIA, E. *Brasil*; *New York Times.* Forgot to ask deputies\n(16/9/1913). Disponível em:\n\\<http://query.nytimes.com/mem/archive-free/pdf?\\_r=1&res=9807E2D8123FE633A25755C1A96F9C946296D6CF\\>.\nAcesso em: 11/11/2009; NOLAN, C. *Notable*; *Time Magazine.* The\nCabinet. (3/11/1930). Disponível em:\n\\<www.time.com/time/magazine/article/0,9171,882354,00.html\\>. Acesso em:\n11/11/2009.\n","ref":"**FONTES:** BUENO, C.; CERVO, A. *Política*; DUGGS, S. *Professor*;\nGARCIA, E. *Brasil*; *New York Times.* Forgot to ask deputies\n(16/9/1913). Disponível em:\n\\<http://query.nytimes.com/mem/archive-free/pdf?\\_r=1&res=9807E2D8123FE633A25755C1A96F9C946296D6CF\\>.\nAcesso em: 11/11/2009; NOLAN, C. *Notable*; *Time Magazine.* The\nCabinet. (3/11/1930). Disponível em:\n\\<www.time.com/time/magazine/article/0,9171,882354,00.html\\>. Acesso em:\n11/11/2009.\n","dic":"DHBPR"}
