{"title":"MOTA, Apulcro","cargoss":["Presidente de associação ou confederação de empregados ou empregadores"],"cargos_esp":[0],"datas_ini":[1898],"datas_fim":[1899],"estados":["SE"],"autor":["Raimundo Helio Lopes"],"content":"**MOTA, Apulcro**\n\n\\* militar; pres. SE 1898-1899.\n\n*Apulcro Mota Rebelo* nasceu em São Cristóvão (SE) no dia 7 de outubro\nde 1857, filho de Francisco Mota Rebelo e de Maria Angélica Mota Tojal.\n\nCursou humanidades no Ateneu Sergipano e seguiu a carreira ligada à\nadministração financeira. Em 1879 tornou-se segundo escriturário da\nalfândega de Aracaju, chegando a tesoureiro interino em 1881. No ano\nseguinte foi nomeado primeiro escriturário da Tesouraria Geral de\nSergipe e, em 1883, tornou-se procurador fiscal, passando a inspetor da\nalfândega em 1884. Em dezembro desse ano ocupou o mesmo cargo na cidade\nde Vitória, capital da então província do Espírito Santo.\n\nDepois da proclamação da República (15/11/1889), foi nomeado secretário\nde governo durante a administração de Vicente Luís de Oliveira Ribeiro\n(1891). Ocupou o mesmo cargo interinamente em outubro de 1896, durante o\ngoverno de José Joaquim Lobo (1896), e em março de 1898, na\nadministração de Martinho César da Silveira Garcez (1898). Em 8 de julho\ndesse ano foi nomeado secretário geral do governo de Martinho Garcez.\n\nRenunciou pouco tempo depois à secretaria geral para assumir seu mandato\nde deputado estadual, para a legislatura de 1898 a 1899. Na Assembleia\nLegislativa foi eleito presidente da Casa e, com a renúncia de Martinho\nGarcez em 14 de agosto de 1898, assumiu o governo do estado de Sergipe.\nPermaneceu na chefia do Executivo estadual até 24 de outubro de 1899,\nquando assumiu o Monsenhor Olímpio Campos (1899-1902), eleito para o\ncargo.\n\nReeleito deputado estadual em 1900, também foi eleito vice-presidente do\nestado, cargo que ocupou até 1902.\n\nNo campo jornalístico, fundou o periódico *Eco Liberal* e colaborou com\no *Jornal de Sergipe, A Reforma, Gazeta de Sergipe* e *Diário da Manhã*.\n\nFoi sócio-honorário do Instituto Histórico e Geográfico de Sergipe e\ncoronel da Guarda Nacional.\n\nFaleceu em Aracaju no dia 25 de fevereiro de 1924.\n\nPublicou: *O meu crime* (1887), *O desfalque da tesouraria da Fazenda*\n(1889), *José Faro – elogio fúnebre* (1889), *Memorial dos cargos\nocupados até 27 de dezembro* *de 1889* (1890), *Relatório dos negócios\ndo estado de Sergipe apresentado ao Exmo. Sr.* *Dr. Daniel Campos pelo\nsecretário geral do estado* (1898), *Mensagem apresentada à* *Assembleia\nLegislativa pelo presidente do estado* (1899).\n\nRaimundo Helio Lopes\n\n**FONTES:** BITENCOURT, L. *Homens*; DANTAS, J. *História*; GUARANÁ, M.\n*Dicionário*.\n","ref":"**FONTES:** BITENCOURT, L. *Homens*; DANTAS, J. *História*; GUARANÁ, M.\n*Dicionário*.\n","dic":"DHBPR"}
