{"title":"MOTA, Cândido","cargoss":["Deputado federal"],"cargos_esp":[0],"datas_ini":[1909],"datas_fim":[1917],"estados":["SP"],"autor":["Carlos Alberto Ungaretti Dias"],"content":"**MOTA, Cândido**\n\n\\*dep. fed. SP 1909-1917.\n\n*Cândido Nazianzeno Nogueira da Mota* nasceu em Porto Feliz (SP) em 9 de\nmaio de 1870, filho do educador Fernando Maria Nogueira da Mota e de\nMariana Francisca da Mota. Seu primo Cesário Mota foi deputado federal\npor São Paulo de 1891 a 1899.\n\nQuando ainda era menino a família mudou-se para Capivari (SP), e aí\nestudou humanidades com o pai. Em 1888 matriculou-se na Faculdade de\nDireito de São Paulo e em 1891 formou-se em ciências jurídicas e\nsociais. Seguiu carreira jurídica, como promotor público em Amparo\n(1892-1896) e na capital do estado (1896). No governo Campos Sales em\nSão Paulo, foi nomeado segundo-delegado de polícia da capital\n(1896-1897). Foi também professor substituto de direito criminal da\nFaculdade de Direito de São Paulo de 1897 a 1908, na vaga deixada por\nSeverino Prestes, passando depois a professor catedrático.\n\nObteve o primeiro mandato em 1898, quando foi eleito deputado estadual\npelo Partido Republicano Paulista (PRP) para a legislatura 1898-1900.\nIntegrou então as comissões de Instrução Pública e de Justiça,\nConstituição e Poderes da Câmara Estadual. Reeleito para o período\n1901-1903, continuou membro desta última. Foi figura de destaque no\nLegislativo paulista, tendo participado intensamente dos debates e\napresentado numerosos projetos, entre eles o do “Instituto Educativo\nPaulista”, que deu origem à lei estadual n^o^ 844, de 10 de outubro de\n1902, criando o Instituto Disciplinar de São Paulo. O instituto,\ninstalado em 1903 no bairro do Tatuapé, na capital paulista, veio\noperacionalizar preceitos legais estabelecidos no Código Penal de 1890,\nque previam a inimputabilidade criminal da criança e seu recolhimento em\nestabelecimento disciplinar. Cabia-lhe “incutir hábitos de trabalho e\neducar, fornecendo instrução literária, profissional e industrial,\nespecialmente agrícola, a menores vadios, vagabundos, abandonados e\nviciados”. A lei deu origem a vários estudos sobre segurança e trabalhos\nbiográficos sobre Cândido Mota.\n\nEm 1906 foi eleito vereador na cidade de São Paulo, mas no ano seguinte\nganhou novo mandato de deputado estadual, na legislatura 1907-1909.\nNesse período teve participação ativa nos debates sobre a reforma da\nConstituição do Estado de São Paulo, concluída em 1908. Foi também\ndelegado oficial do Brasil no I Congresso Científico Pan-Americano,\nrealizado em Santiago, no Chile (25/12/1908 a 5/1/1909), sobre o qual\npublicou relatório. Participou ainda do I Congresso Jurídico Brasileiro,\nintegrando comissão que representou a Faculdade de Direito de São Paulo.\nPublicou diversos artigos em jornais, como jurisconsulto.\n\nEm 1909 foi eleito deputado federal para a legislatura 1909-1911 e,\ndepois, reeleito para o período 1912-1914. Na Câmara dos Deputados\nparticipou de várias comissões, entre elas a comissão especial de\nJustiça Militar, na qual foi relator geral do projeto de reorganização\nda Justiça Penal Militar. Ainda integrou as comissões de Instrução\nPública e de Poderes. Tratou da Campanha Civilista, da intervenção no\nestado do Rio de Janeiro e do “problema siderúrgico”, e em dezembro de\n1912 foi nomeado membro da comissão especial encarregada da elaboração\nde um projeto de Código Penal Militar. Foi reeleito mais uma vez, para a\nlegislatura 1915-1917, mas em maio de 1916 renunciou ao mandato para\nassumir a Secretaria da Agricultura do Estado de São Paulo, no governo\nde Altino Arantes. Durante sua gestão, apresentou relatório onde já\ndestacava a necessidade urgente de realizar obras no rio Tietê para\ncombater as enchentes e os despejos residuais.\n\nEm 29 de abril de 1922, foi eleito senador estadual com mandato até\n1928. Foi escolhido primeiro-secretário do Senado Estadual e integrou a\nComissão de Redação. Desde 1920, o antigo povoado de Parada do Jacu, no\noeste do estado, então elevado à categoria de vila, passara a se chamar\nCândido Mota, homenagem prestada pelo amigo e fundador do povoado,\ncoronel Valêncio Carneiro de Castro. Em 1923 a vila foi transformada no\nmunicípio de Cândido Mota.\n\nFaleceu em São Paulo no dia 16 de março de 1942.\n\nEra casado com Clara do Amaral Mota, sua prima-irmã.\n\nCarlos Alberto Ungaretti Dias\n\n**FONTES:** ABRANCHES, J. *Governos* (v.2); AMARAL, A. *Dicionário*;\nCALIMAN, A. *Legislativo*; *Correio Paulistano* (1/5/1916); FONSECA, A.;\nFONTES JUNIOR, A. *Câmara*; FONSECA, S. *Do abandonado*; LEME, L.\n*Genealogia*; LOIOLA, E.; SALLA, F. *Construção*; MOTTA, C*. Relatório*;\nVAMPRÉ, S. *Memórias*.\n","ref":"**FONTES:** ABRANCHES, J. *Governos* (v.2); AMARAL, A. *Dicionário*;\nCALIMAN, A. *Legislativo*; *Correio Paulistano* (1/5/1916); FONSECA, A.;\nFONTES JUNIOR, A. *Câmara*; FONSECA, S. *Do abandonado*; LEME, L.\n*Genealogia*; LOIOLA, E.; SALLA, F. *Construção*; MOTTA, C*. Relatório*;\nVAMPRÉ, S. *Memórias*.\n","dic":"DHBPR"}
