{"title":"MOURA, Hastínfilo de","cargoss":["Comandante da 2^a^ Região Militar","Governador de estado ou do Distrito Federal"],"cargos_esp":[0,0],"datas_ini":[1926,1930],"datas_fim":[1930,1930],"estados":[0,"SP"],"autor":["Robert Pechman"],"content":"**MOURA, Hastínfilo de**\n\n\\*militar; comte 2^a^ RM 1926-1930; gov. SP 1930.\n\n*Hastínfilo de Moura* nasceu em Itapicuru-Mirim (MA) no dia 22 de\ndezembro de 1865, filho de João Ribeiro de Moura.\n\nFez seus primeiros estudos em São Luís, no Colégio da Imaculada\nConceição e no Liceu Maranhense. Em 1885 assentou praça e viajou para o\nRio de Janeiro, então capital do Império, ingressando na Escola Militar.\nEm 1888 foi declarado alferes aluno e desligado da Escola Militar pela\nreforma do ensino no Exército, sendo transferido para a Escola Superior\nde Guerra (ESG), criada naquele ano. Cursava a ESG quando tomou parte,\nainda como alferes aluno, do movimento militar que resultou na\ninstauração da República. Juntamente com outros alunos, assinou\n(11/11/1889) um compromisso em que estes se declaravam dispostos a\nseguir o líder republicano Benjamin Constant, professor da escola, “até\no terreno da resistência armada”. A guarnição da ESG esteve à frente das\nunidades militares que se movimentaram no dia 15 de novembro.\n\nEm 1890 foi promovido a segundo-tenente. Concluiu o curso de engenharia\nmilitar em 1892, e no mesmo ano foi colocado à disposição do Ministério\nda Viação para trabalhar como engenheiro na Estrada de Ferro Central do\nBrasil. Em 1893 foi promovido a capitão e transferido para a fortaleza\nde Santa Cruz. Teve então a oportunidade de participar de diversos\ncombates contra as forças navais que se levantaram contra Floriano\nPeixoto na Revolta da Armada. Ao longo de um período de seis meses, as\nforças revoltosas procuraram, em diversas oportunidades e sem lograr\nêxito, romper a linha de fogo dos fortes legalistas e ganhar o alto-mar.\n\nEm maio de 1894 integrou-se à Comissão do Planalto Central do Brasil, do\nMinistério da Indústria e Obras Públicas, encarregada de escolher e\ndemarcar o local da construção da nova capital do país. Em 1907 foi\nnomeado membro de uma comissão do Ministério da Guerra na Europa, onde\npermaneceu por dois anos e meio. Nesse período, em 1908, foi promovido a\nmajor. Regressando ao Brasil, assumiu o comando da fortaleza de São\nJoão, no Rio de Janeiro.\n\nEm 1911 foi promovido a tenente-coronel e em 1912 retornou à Europa na\nComissão de Compras do Exército, passando a dirigir a seção da comissão\nem Berlim, na Alemanha. De volta da Europa em 1914, assumiu em 1915 o\ncomando da fortaleza de Laje. Em 1916 foi nomeado chefe de gabinete do\ndiretor de Material Bélico do Exército, sendo promovido a coronel em\n1917. No ano seguinte assumiu a direção do Arsenal de Guerra do Rio de\nJaneiro, posto que ocupava quando foi nomeado (julho de 1919) chefe do\nEstado-Maior da Presidência da República, por ato do presidente Epitácio\nPessoa. Ainda no governo de Epitácio Pessoa participou da repressão ao\nmovimento revolucionário de julho de 1922. No fim do governo (novembro\nde 1922), promovido a general de brigada, assumiu o comando da 1^a^\nBrigada de Artilharia. Em 1923, foi nomeado diretor do Material Bélico\ndo Exército, participando ainda da Comissão de Promoções.\n\nPromovido a general de divisão em 1926, foi nomeado comandante da 2^a^\nRegião Militar, em São Paulo. Exercia esse comando quando eclodiu a\nRevolução de 1930. As primeiras notícias sobre o início da revolução\nchegaram a São Paulo no próprio dia 3 de outubro, e já no dia 5 o\ncomandante da 2^a^ RM deslocou tropas para guarnecer as divisas com\nMinas Gerais e com o Paraná, ameaçadas pelas forças revolucionárias.\n\nNo entanto, segundo o próprio general Hastínfilo, a deposição de\nWashington Luís, com a instalação de uma junta governativa (24/10/1930),\nsomada à adesão ao movimento do comandante da Força Pública de São Paulo\n(a maior força militar do estado), tirou qualquer veleidade de reação do\ncomandante da 2^a^ RM. Legalista e amigo de Júlio Prestes, presidente de\nSão Paulo e eleito presidente da República, mas impedido pela revolução,\no general Hastínfilo foi chamado ao palácio e convidado a assumir o\ngoverno do estado. Recusando num primeiro momento, cedeu afinal, com a\ncondição de que Júlio Prestes e Heitor Penteado, vice-presidente do\nestado, firmassem um documento formalizando o apelo que lhe faziam.\nAssim, em 24 de outubro, depois de o presidente estadual e todo o\nsecretariado terem assinado o termo de renúncia o general Hastínfilo\nassumiu o governo de São Paulo.\n\nO relato desses acontecimentos feito por João Neves da Fontoura e Renato\nJardim é algo diferente. Segundo essa versão, no dia 24 de outubro, o\ngeneral Hastínfilo teria recebido um telegrama em que a junta\ngovernativa lhe transmitia a ordem de assumir o governo de São Paulo,\nmas ter-se-ia recusado a fazê-lo por não se julgar qualificado para\ntanto. Dirigindo-se então ao palácio do governo, ter-se-ia reunido com\nJúlio Prestes, Heitor Penteado e o comandante da Força Pública,\nJoviniano Brandão, e comunicado aos presentes o teor do telegrama que\nrecebera. Hastínfilo e Brandão teriam decidido solucionar a questão\nordenando a deposição das armas na divisa do estado e o apoio às forças\nrevolucionárias.\n\nO fato é que ainda no dia 24 de outubro o general Hastínfilo assumiu o\ngoverno do estado, Heitor Penteado retirou-se livremente, e Júlio\nPrestes, sob a proteção de Hastínfilo, asilou-se no consulado inglês. O\ngeneral enfrentou sérios problemas para a formação do secretariado,\nenfrentando pressões de membros do Partido Democrático de São Paulo que\nse consideravam os legítimos representantes da revolução no estado. No\ndia 28 de outubro, o general Hastínfilo recebeu um telegrama da junta\nprovisória, determinando que o governo fosse entregue a Francisco Morato\ne que partisse imediatamente para o Rio de Janeiro. Já no Rio,\nHastínfilo foi transferido para a reserva, a pedido, em 15 de novembro\nde 1930. A partir de então fixou residência no Rio, onde faleceu no dia\n25 de junho de 1956.\n\nA única obra que publicou foi *Da Primeira à Segunda República* (1936).\n\nRobert Pechman\n\n**FONTES:** ARAÚJO, A. *Chefes*; CONSULT. MAGALHÃES, B.; *Encic.\nMirador*; FONTOURA, J. *Memórias*; *Grande encic. Delta*; JARDIM, R.\n*Aventura*; *Jornal do Comércio*, Rio (25, 26/6/1956); LEITE, A.\n*História*; NOGUEIRA FILHO, P. *Ideais*; SILVA, H. *1922*.\n","ref":"**FONTES:** ARAÚJO, A. *Chefes*; CONSULT. MAGALHÃES, B.; *Encic.\nMirador*; FONTOURA, J. *Memórias*; *Grande encic. Delta*; JARDIM, R.\n*Aventura*; *Jornal do Comércio*, Rio (25, 26/6/1956); LEITE, A.\n*História*; NOGUEIRA FILHO, P. *Ideais*; SILVA, H. *1922*.\n","dic":"DHBPR"}
