{"title":"MOURÃO, João Tolentino Guedelha","cargoss":["Deputado federal"],"cargos_esp":[0],"datas_ini":[1897],"datas_fim":[1904],"estados":["MA"],"autor":["Raimundo Helio Lopes"],"content":"**MOURÃO, João Tolentino Guedelha**\n\n\\*dep. fed. MA 1897-1904.\n\n*João Tolentino Guedelha Mourão* nasceu em Pastos-Bons (MA) em 1842,\nfilho de João da Silveira Guedelha e de Eufrosina Mourão.\n\nApós frequentar um seminário de padres na província natal, prosseguiu\nseus estudos eclesiásticos na Europa, onde colou grau na Universidade de\nRoma. De volta ao Brasil, residiu no Pará, onde colaborou no periódico\ncatólico *Boa Nova*, foi monsenhor, reitor do seminário de padres e\ndepois bispo, em substituição de Antônio Macedo Costa. Retornou então ao\nMaranhão e fixou residência em São Luís. Aí fundou, em 1880, o jornal\n*Civilização*, no qual moveu forte campanha contra Tobias Barreto e o\njornal *O Pensador*, de caráter anticlerical.\n\nApós a proclamação da República filiou-se ao Partido Católico, que\najudou a fundar ao lado do líder político Luís Antônio Domingues da\nSilva – o partido se fundiria depois com os partidos Nacional e\nRepublicano Constitucional. Foi deputado estadual constituinte e\nsignatário da Constituição maranhense em 1892. Reeleito para outras\nlegislaturas, chegou a assumir a presidência da Assembleia.\n\nEm 1897 foi eleito deputado federal pelo Maranhão e em 17 de fevereiro\nde 1899 foi eleito bispo, em substituição a Antônio Cândido de\nAlvarenga. Ocupou a posição até 31 de outubro, quando foi substituído\npor Luís Francisco de Sales Pessoa. Reeleito deputado federal em 1900 e\n1903, exerceu o mandato até 4 de dezembro de 1904, quando faleceu.\n\nFoi também sócio-correspondente Instituto Histórico e Geográfico\nBrasileiro e professor de italiano no Liceu Maranhense.\n\nPublicou em folheto *Conferências pregadas na Igreja de S. Antônio* e\n*Oração fúnebre*, esta proferida quando da morte do papa Pio IX.\n\nRaimundo Helio Lopes\n\n**FONTES:** ABRANCHES, J. *Governos*; MARQUES, C. *Dicionário.*\n","ref":"**FONTES:** ABRANCHES, J. *Governos*; MARQUES, C. *Dicionário.*\n","dic":"DHBPR"}
