{"title":"MURTINHO, José","cargoss":["Deputado federal","Deputado federal","Senador"],"cargos_esp":[0,0,0],"datas_ini":[1907,1897,1912],"datas_fim":[1908,1899,1930],"estados":["DF","DF","MT"],"autor":[0],"content":"**MURTINHO, José**\n\n\\*dep. fed. DF 1897-1899 e 1907-1908; sen. MT 1912-1930.\n\n*José Antônio Murtinho* nasceu em Cuiabá no dia 15 de janeiro de 1847,\nfilho de José Antônio Murtinho e de Rosa Joaquina Murtinho. Seu pai era\nmédico e foi presidente da província de Mato Grosso durante o Império.\nSeu irmão Joaquim Murtinho foi constituinte de 1891, senador por Mato\nGrosso de 1891 a 1896, ministro da Indústria, Viação e Obras Públicas de\n1896 a 1897, ministro da Fazenda de 1898 a 1902 e novamente senador de\n1902 a 1911. Outro irmão, Manuel Murtinho, foi presidente de Mato Grosso\nde 1891 a 1895 e ministro do Supremo Tribunal Federal de 1897 a 1917.\n\nFormou-se pela Faculdade de Medicina do Rio de Janeiro e bacharelou-se\nem matemática e ciências físicas e naturais pela Escola Politécnica.\nRepublicano histórico, foi signatário do Manifesto Republicano de 1870.\n\nEm 1897 foi eleito deputado federal pelo Distrito Federal, para a\nlegislatura 1897-1899. No curso da legislatura 1906-1908 voltou à Câmara\ndos Deputados entre 11 de maio de 1907 e 31 de dezembro de 1908. Em Mato\nGrosso, foi deputado estadual de 1909 a 1912. Eleito e reeleito senador\npor Mato Grosso, ocupou uma cadeira no Senado Federal de 1912 a 1930.\n\nFaleceu em 11 de novembro de 1930.\n\nJoão Edson Fanaia\n\n**FONTES:** ABRANCHES, J. *Governo*s; CASTRO, A.; CASTGNINO, A.\n*Senado*; LEITE NETO, L. *Catálogo biográfico.*\n","ref":"**FONTES:** ABRANCHES, J. *Governo*s; CASTRO, A.; CASTGNINO, A.\n*Senado*; LEITE NETO, L. *Catálogo biográfico.*\n","dic":"DHBPR"}
