{"title":"MURTINHO, Manuel","cargoss":["Presidente de associação ou confederação de empregados ou empregadores","Ministro do Supremo Tribunal Federal"],"cargos_esp":[0,0],"datas_ini":[1891,1897],"datas_fim":[1895,1917],"estados":["MT",0],"autor":[0],"content":"**MURTINHO, Manuel**\n\n**\\***magistrado**;** pres. MT 1891-1895; min. STF 1897-1917.\n\n*Manuel José Murtinho*nasceu em Cuiabá no dia 15 de dezembro de 1845,\nfilho de José Antônio Murtinho e de Rosa Joaquina Murtinho. Seu pai era\nmédico e foi presidente da província de Mato Grosso durante o Império.\nSeu irmão Joaquim Murtinho foi senador por Mato Grosso de 1890 a 1896,\nministro da Indústria, Viação e Obras Públicas de 1896 a 1897, ministro\nda Fazenda de 1898 a 1902 e novamente senador de 1903 a 1911. Outro\nirmão, José Antônio Murtinho, foi deputado federal pelo Distrito Federal\nde 1897 a 1899 e de 1907 a 1908, e senador por Mato Grosso de 1912 a\n1930.\n\nFez os estudos preparatórios no Colégio Kopke, em Petrópolis (RJ), e\ndepois no Colégio Episcopal São Pedro de Alcântara, também conhecido\ncomo Colégio dos Padres Paiva, no Rio de Janeiro, então capital do\nImpério. Em 1869 bacharelou-se pela Faculdade de Direito do Largo de São\nFrancisco, em São Paulo. De volta a Mato Grosso, exerceu a magistratura\nem São Luís de Cáceres como juiz municipal e de órfãos, de abril de 1871\na novembro de 1875, e juiz seccional, de março de 1878 até 1889.\n\nFiliado ao Partido Liberal do Império, em 8 de junho de 1889 foi nomeado\npelo visconde de Ouro Preto primeiro-vice-presidente da província de\nMato Grosso. Pouco depois da proclamação da República pelo marechal\nDeodoro da Fonseca em 15 de novembro de 1889, foi mais uma vez nomeado,\npor decreto de 5 de fevereiro de 1890, primeiro-vice-presidente do\nestado de Mato Grosso. Em junho seguinte foi enviado à comarca de Cuiabá\ne, em janeiro de 1891, nomeado juiz seccional. Filiado ao Partido\nRepublicano, fundado por seu aliado Generoso Ponce, ainda nesse ano foi\neleito deputado constituinte estadual, participou da elaboração da\nConstituição do estado e, em 15 de agosto, foi eleito o primeiro\npresidente constitucional de Mato Grosso, enquanto Ponce era eleito\nvice-presidente. Tomou posse no dia seguinte, mas, em virtude de um\nmovimento armado comandado pelo ex-presidente estadual Antônio Maria\nCoelho, foi afastado em 1^o^ de fevereiro de 1892. Graças à reação\narmada comandada por Generoso Ponce, foi reempossado no dia 20 de julho\ndo mesmo ano. Em 15 de agosto de 1895 transmitiu o governo a Antônio\nCorreia da Costa.\n\nFoi nomeado ministro do Supremo Tribunal Federal (STF) em janeiro de\n1897, na vaga aberta em decorrência do falecimento de Antônio de Sousa\nMartins. Foi eleito vice-presidente do tribunal em setembro de 1913.\n\nFaleceu no Rio de Janeiro, então Distrito Federal, no dia 22 de abril de\n1917.\n\nEra casado com Francelina Guedes Murtinho, com quem teve muitos filhos.\n\nJoão Edson Fanaia/ Eduardo Junqueira\n\n**FONTES:** CORREIA FILHO, V. *História*; FANAIA, J. *Elites*; PONCE\nFILHO, G. *Generoso*; MENDONÇA, E. *Datas*; MENDONÇA, R. *História das*.\n","ref":"**FONTES:** CORREIA FILHO, V. *História*; FANAIA, J. *Elites*; PONCE\nFILHO, G. *Generoso*; MENDONÇA, E. *Datas*; MENDONÇA, R. *História das*.\n","dic":"DHBPR"}
