{"title":"MÜLLER, Eugênio Luís","cargoss":["Governador de estado ou do Distrito Federal","Deputado federal"],"cargos_esp":[0,0],"datas_ini":[1912,1915],"datas_fim":[1912,1920],"estados":["SC","SC"],"autor":["Carolina Vianna Dantas"],"content":"**MÜLLER, Eugênio Luís**\n\n\\*gov. SC 1912; dep. fed. SC 1915-1920.\n\n*Eugênio Luís Müller* nasceu em Itajaí (SC) no dia 13 de novembro de\n1856, filho de Pedro Müller e de Ana Maria Michels Müller. Seu irmão\nLauro Müller foi governador de Santa Catarina (1889-1890 e 1902),\ndeputado federal (1891-1899), senador (1900-1902, 1907-1912 e\n1917-1926), ministro da Indústria, Viação e Obras Públicas (1902-1906) e\nministro das Relações Exteriores (1912-1917).\n\nFez os primeiros estudos em Itajaí, trabalhando no comércio local. Aos\n11 anos de idade veio para o Rio de Janeiro, então capital do Império,\nonde passou a trabalhar como caixeiro. Regressando a Itajaí, abriu sua\nprópria casa comercial e passou a advogar. Também trabalhou como\ntabelião, escrivão, tesoureiro e agente.\n\nFoi eleito deputado estadual em Santa Catarina para as legislaturas\n1907-1909 e 1910-1912. Também em 1910 foi eleito vice-governador do\nestado, ao lado do governador Vidal Ramos, a quem substituiu de setembro\na novembro de 1912. Em 1915 foi eleito deputado federal por Santa\nCatarina e em 1918 foi reeleito, exercendo o mandato até dezembro de\n1920. Fixou residência no Rio de Janeiro, então Distrito Federal, e\npassou a trabalhar como tabelião.\n\nFaleceu no Rio de Janeiro no dia 20 de maio de 1936.\n\nEra casado com Guilhermina Büchelle Müller, com quem teve oito filhos.\n\nCarolina Vianna Dantas\n\n**FONTES:** ABRANCHES, J. *Governos*; CÂM. DEP. *Deputados brasileiros*;\nPIAZZA, W. *Dicionário*.\n","ref":"**FONTES:** ABRANCHES, J. *Governos*; CÂM. DEP. *Deputados brasileiros*;\nPIAZZA, W. *Dicionário*.\n","dic":"DHBPR"}
