{"title":"MÜLLER, Lauro","cargoss":["Governador de estado ou do Distrito Federal","Constituinte","Governador de estado ou do Distrito Federal","Deputado federal","Senador","Governador de estado ou do Distrito Federal","min Ind","Senador","Ministro das Relações Exteriores","Senador"],"cargos_esp":[0,0,0,0,0,0,0,0,0,0],"datas_ini":[1889,1891,1891,1891,1900,1902,1902,1907,1912,1917],"datas_fim":[1890,1891,1891,1899,1902,1902,1906,1912,1917,1926],"estados":["SC",0,"SC","SC","SC","SC",0,"SC",0,"SC"],"autor":["Paulo Brandi Cachapuz"],"content":"**MÜLLER, Lauro**\n\n\\*gov. SC 1889-1890; const. 1891; gov. SC 1891; dep. fed. SC 1891-1899;\nsen. SC 1900-1902; gov. SC 1902; min. Ind. 1902-1906; sen. SC 1907-1912;\nmin. Rel. Ext. 1912-1917; sen. SC 1917-1926.\n\n*Lauro Severiano Müller* nasceu em Itajaí (SC) no dia 8 de novembro de\n1863, filho dos imigrantes alemães Peter Müller e de Ana Michels Müller.\nSeu pai chegou a Santa Catarina em 1829 junto com as primeiras famílias\nalemãs que se estabeleceram na província. Seu irmão Eugênio Luís Müller\nfoi deputado estadual (1907-1910), vice-governador (1910-1914) e\ndeputado federal por Santa Catarina (1915-1920). Seu primo Filipe\nSchmidt foi deputado federal por Santa Catarina (1891-1893), duas vezes\ngovernador do estado (1898-1902 e 1914-1918) e senador (1903-1914 e\n1918-1926).\n\nEducado em escolas particulares alemãs de Itajaí e Blumenau (SC), aos 16\nanos mudou-se para Niterói, então capital da província do Rio de\nJaneiro, onde foi recebido por um tio comerciante. Em fevereiro de 1882,\nassentou praça no corpo de alunos da Escola Militar da Praia Vermelha,\nno Rio de Janeiro. Promovido a alferes-aluno em 1885, foi um dos\ndiscípulos diletos do tenente-coronel Benjamin Constant Botelho de\nMagalhães, que exerceu influência marcante na formação de toda uma\ngeração de jovens oficiais atraídos pela doutrina positivista e pelo\nideal republicano.\n\nAderiu ao movimento abolicionista e foi coautor do folheto *Ceará:\nhomenagem dos alunos da Escola Militar*, publicado em comemoração à\nlibertação dos escravos na província cearense. Foi colaborador da\n*Revista da Família Acadêmica*, junto com outros jovens colegas da\nescola, como Euclides da Cunha, Cândido Rondon e Tasso Fragoso. Após\nconcluir os cursos de artilharia e estado-maior de primeira classe,\nformou-se engenheiro em 1888. Em janeiro de 1889, foi promovido a\nsegundo-tenente e transferido para a recém-criada Escola Superior de\nGuerra (ESG), sempre no Rio de Janeiro.\n\nParticipou do movimento de 15 de novembro de 1889 que derrubou a\nmonarquia e desempenhou papel relevante na implantação da nova ordem\npolítica no país. Atuou na sedição sob a liderança de Benjamin Constant,\nídolo da mocidade militar republicana e uma das figuras de proa da\nconspiração contra o regime monárquico. Na semana que antecedeu o\nlevante, junto com outros jovens oficiais do Exército, assinou\ndeclarações, que ficaram conhecidas como “pactos de sangue”, garantindo\napoio incondicional a Benjamin Constant no embate contra o governo\nimperial.\n\nPraticamente restrito ao Rio de Janeiro, o levante militar foi\nrapidamente vitorioso. Ao amanhecer do dia 15 de novembro, o marechal\nDeodoro da Fonseca assumiu o comando das tropas que cercaram o\nquartel-general do Exército, no centro da capital. Ali se encontravam os\nprincipais líderes monarquistas e forças da polícia e da Marinha,\nmobilizadas para dar combate aos rebeldes. Não houve refrega. O único\nepisódio sangrento do dia ocorreu justamente quando Lauro Müller e o\ntenente Adolfo Peña deram voz de prisão ao ministro da Marinha, José da\nCosta Azevedo, o barão de Ladário. O ministro reagiu e foi ferido à\nbala.\n\nDeodoro da Fonseca assumiu a chefia do governo provisório e, por\nrecomendação de Benjamin Constant e do líder republicano catarinense\nAntônio Justiniano Esteves Júnior, Lauro Müller foi nomeado governador\nde Santa Catarina.\n\nGovernador de Santa Catarina\n\nLauro Müller tomou posse do cargo de governador em 2 de dezembro de\n1889, sucedendo à junta provisória formada por Raulino Horn, o coronel\nJoão Batista do Rego Barros Cavalcanti de Albuquerque e Alexandre\nMarcelino Bayma. No mês seguinte, dissolveu as câmaras municipais e\ncriou os conselhos de intendentes. A maioria dos nomeados era de\nrepublicanos, o que gerou protestos de liberais e conservadores que\nhaviam aderido ao novo regime.\n\nPromovido a primeiro-tenente em janeiro de 1890 e, dois meses depois, a\ncapitão, foi um dos 40 militares eleitos em setembro de 1890 para a\nAssembleia Nacional Constituinte e para a primeira legislatura do\nCongresso Nacional, sendo substituído no governo estadual pelos\nvice-governadores Raulino Horn e Gustavo Richard. Representante da\nbancada catarinense na comissão de 21 membros que analisou o projeto de\nConstituição apresentado pelo governo provisório, destacou-se como\ndefensor da autonomia dos estados e da lei de naturalização dos\nestrangeiros e como autor da proposta de transferência da capital da\nRepública para o Planalto Central, incorporada ao texto da Constituição\nde 24 de fevereiro de 1891. Na eleição indireta realizada ao término dos\ntrabalhos da Constituinte, apoiou a candidatura vitoriosa de Deodoro da\nFonseca a presidente da República.\n\nEm 12 de junho de 1891, foi eleito governador de Santa Catarina pelos\nconstituintes estaduais. Chegou a assumir o governo, mas optou por\nexercer o mandato de deputado federal, transmitindo a chefia do\nExecutivo ao vice-governador Gustavo Richard em 29 de junho. Apoiou o\nchamado golpe de Deodoro, quando este dissolveu o Congresso Nacional em\n3 de novembro, e pouco depois, em 10 de novembro, voltou a assumir o\ngoverno catarinense. Entretanto, sua permanência no cargo logo se tornou\ninsustentável. A pressão civil e militar contra o golpe provocou a\nrenúncia de Deodoro em 23 de novembro e a ascensão ao poder do\nvice-presidente Floriano Peixoto, que anulou a dissolução do Congresso.\nSeguiu-se, em vários estados, a deposição dos governadores deodoristas.\n\nEm Santa Catarina, a oposição estadual moveu cerrada campanha contra\nLauro Müller na capital – então chamada Desterro – e em vários\nmunicípios. Republicanos de Blumenau, liderados por Hercílio Luz,\nformaram uma coluna armada que se pôs a caminho da capital para defender\no governador. Mas, sem a garantia das tropas federais, Müller avaliou\nque suas chances de resistência eram mínimas e renunciou ao governo em\n28 de dezembro. Em seu lugar assumiu Firmino Lopes Rego, comandante da\nGuarnição Militar do Desterro, que governou Santa Catarina por um dia e\nem seguida transmitiu o governo a uma junta composta por Cristóvão Nunes\nPires, coronel Luís dos Reis Falcão e Artur Deocleciano de Oliveira. Em\n1^o^ de março de 1892 foi nomeado interventor no estado Manuel Joaquim\nMachado, que em 15 de setembro seria eleito governador.\n\nA Revolução Federalista e a Reconciliação com Floriano Peixoto\n\nLauro Müller retomou o mandato de deputado em abril de 1892, por ocasião\nda reabertura dos trabalhos do Congresso Nacional. De imediato, integrou\na minoria parlamentar de oposição, apoiando o fim das medidas\nrepressivas contra militares e civis acusados de conspiração para a\nderrubada do governo Floriano Peixoto. Na mesma época, estabeleceu\nrelações com dirigentes do Partido Operário Brasileiro, organizado pelo\ntipógrafo Luís França e Silva. Em maio, solicitou à Câmara que\nexaminasse a representação do partido em favor da instituição das oito\nhoras de trabalho.\n\nEm 1893, reconciliou-se com Floriano Peixoto, apoiando o governo federal\nna luta contra a Revolução Federalista e a Revolta da Armada. De todo\nmodo, suas relações com Floriano permaneceram marcadas por uma\ndesconfiança mútua, conforme revelou mais tarde a um jornalista. “O\nFloriano não gostava de mim; para ele, soldado só nas fileiras […]. Não\nqueria saber de quem tivesse estudos […]. Nunca se referiu à minha\npatente; tratou-me sempre por doutor […]. Defendia-o na Câmara em\ndiscursos comedidos, sem desperdício de palavras, para lhe parecerem\nsinceras”.\n\nIniciada em fevereiro de 1893 no Rio Grande do Sul, a Revolução\nFederalista transformou-se no mais violento conflito armado da Primeira\nRepública, com milhares de mortos e prisioneiros degolados ou fuzilados.\nA revolução foi provocada pela acirrada disputa entre os partidários de\nJúlio de Castilhos, chefe do Partido Republicano Rio-Grandense (PRR), e\nos aliados de Gaspar Silveira Martins, que formaram o Partido\nFederalista. Defensores do parlamentarismo e da revogação da\nConstituição estadual positivista, os federalistas e dissidentes do PRR\nnão se conformaram com a volta de Castilhos ao governo estadual – também\nele, após a renúncia de Deodoro, havia sido deposto em 1891, mas voltara\nao governo em janeiro de 1893 – e optaram pelo confronto armado. A luta\nsó terminaria em agosto de 1895, no governo do presidente Prudente de\nMorais.\n\nLauro Müller aplaudiu a intervenção de Floriano Peixoto no conflito e o\nenvio de tropas do Exército para o combate aos federalistas, também\nconhecidos como maragatos. Em julho de 1893 discursou na Câmara,\ndenunciando a revolução que ameaçava “avassalar o país” e criticando a\nideia do plebiscito nacional para a adoção do regime parlamentarista,\nadvogada por Silveira Martins. Enquanto isso, em Santa Catarina, o\ngovernador Manuel Joaquim Machado se aproximava dos federalistas e\nrompia com o governo central, deixando o governo no mês de junho e sendo\nsubstituído pelo primeiro-vice-governador Eliseu Guilherme da Silva.\n\nEm setembro, teve início a Revolta da Armada no Rio de Janeiro. Com o\napoio de um grupo de altos oficiais da Marinha, o almirante Custódio de\nMelo tentou forçar a renúncia de Floriano, sublevando diversas unidades\nencouraçadas na baía de Guanabara. Ante a resistência das forças de\nterra, o almirante deslocou parte da esquadra rebelde para Santa\nCatarina, aliando-se aos federalistas. Enquanto Eliseu Guilherme da\nSilva passava o governo ao segundo-vice-governador, Cristóvão Nunes\nPires, os revoltosos ocuparam Desterro e instalaram um governo\nprovisório da República chefiado pelo capitão de mar e guerra Frederico\nGuilherme de Lorena.\n\nNo mês seguinte, Lauro Müller incorporou-se à força expedicionária\nlegalista do general Francisco de Paula Argolo, incumbida de impedir o\navanço da coluna revolucionária de Gumercindo Saraiva, proveniente do\nRio Grande do Sul, sobre Santa Catarina. Mal equipadas e inferiorizadas\nnumericamente, as tropas legalistas evitaram o combate direto, recuando\npara Curitiba. Os maragatos de Gumercindo Saraiva prosseguiram a\nofensiva: conquistaram a capital paranaense, o porto de Paranaguá e a\ncidade de Lapa (PR), marchando em direção a Itararé (SP).\n\nMüller retirou-se com as tropas legalistas para São Paulo e não\nparticipou das operações militares subsequentes contra os federalistas.\nEm março de 1894, as forças de Gumercindo deixaram o Paraná e recuaram\npara o Rio Grande do Sul. Em 22 de abril, o coronel Antônio Moreira\nCésar foi nomeado interventor federal em Santa Catarina, assumindo o\ncontrole da situação no estado. Seu governo, marcado pela repressão\nimplacável contra os federalistas, estendeu-se até setembro, quando\nHercílio Luz foi empossado como primeiro governador eleito pelo voto\ndireto. Um dos primeiros atos do governador foi a mudança do nome da\ncapital estadual para Florianópolis, em homenagem a Floriano Peixoto.\n\nReeleito deputado federal, Lauro Müller retomou a atividade parlamentar\nem outubro de 1894. Tornou-se a figura de maior prestígio da política\ncatarinense no cenário nacional, ao mesmo tempo em que Hercílio Luz se\nconsagrava como principal chefe político no nível estadual. Na Câmara\ndos Deputados, integrou o grupo de parlamentares florianistas do Partido\nRepublicano Federal (PRF) que, sob a liderança do deputado paulista\nFrancisco Glicério, tentou, sem êxito, tutelar as ações do presidente\nPrudente de Morais (1894-1898). Reeleito deputado em 1896, renunciou à\nComissão de Orçamento em junho seguinte, em solidariedade a Francisco\nGlicério, derrotado na eleição para a presidência da Câmara pelo\ndeputado baiano Artur Rios. Também em 1897, cuidou da organização do\nPartido Republicano Catarinense (PRC), juntamente com o governador\nHercílio Luz, com quem acertou a composição dos principais diretórios\nmunicipais. De volta ao Rio de Janeiro, participou da convenção\noposicionista que lançou o nome de Lauro Sodré às eleições presidenciais\nde março de 1898, vencidas por Campos Sales, ex-presidente do estado de\nSão Paulo. A eleição para o governo catarinense ocorreu no mesmo ano,\ncom a vitória do capitão Filipe Schmidt, deputado constituinte em 1891 e\nprimo de Müller.\n\nMinistro da Indústria, Viação e Obras Públicas\n\nEm 1899, Lauro Müller apoiou a reforma do regimento da Câmara dos\nDeputados, concebida pelo presidente Campos Sales (1898-1902) com o\nobjetivo de assegurar a diplomação dos candidatos das situações\ndominantes em cada estado na legislatura seguinte. A reforma fazia parte\ndo projeto político mais amplo de Campos Sales, tornando-se uma das\npeças básicas para a efetivação da chamada “política dos governadores”.\nAs primeiras eleições realizadas à sombra do pacto proposto por Campos\nSales ocorreram em dezembro de 1899, e o reconhecimento dos diplomas dos\ndeputados e senadores (um por estado, pois a renovação foi de apenas um\nterço) seguiu exatamente a regra proposta pelo presidente. Ao mesmo\ntempo em que encerrou seu mandato de deputado federal, Lauro Müller foi\neleito senador por Santa Catarina, derrotando o general Alexandre Bayma.\n\nEm 1901, atuou como mediador da crise no PRC entre a ala dissidente de\nHercílio Luz, defensor da reconciliação com os federalistas, e o grupo\ndo governador Filipe Schmidt, contrário à aproximação com a oposição\nestadual. Müller apoiou a ideia da reconciliação e conseguiu reunificar\no partido. Proclamado chefe supremo do PRC, foi eleito governador de\nSanta Catarina em agosto de 1902. Empossado no mês seguinte, já em\nnovembro passou a chefia da administração estadual ao vice-governador\nVidal Ramos, acedendo ao convite do presidente eleito Rodrigues Alves\n(1902-1906) para integrar seu ministério.\n\nAssumiu o Ministério da Indústria, Viação e Obras Públicas em novembro\nde 1902, destacando-se como um dos principais responsáveis pela\nremodelação do porto do Rio de Janeiro, obra prioritária do programa de\ngoverno do presidente Rodrigues Alves. A modernização do porto e a\nreforma urbana liderada pelo prefeito Francisco Pereira Passos\ntransformariam radicalmente a fisionomia da capital da República.\n\nO plano das obras do porto do Rio de Janeiro ficou a cargo de uma\ncomissão presidida por Müller e integrada pelos engenheiros Francisco\nBicalho, Paulo de Frontin, Gabriel Osório de Almeida, José Freire\nParreiras Horta, Manuel Maria de Carvalho e Domingos de Sabóia e Silva.\nNo lugar dos antigos trapiches e desembarcadouros, o plano previu a\nconstrução de um cais de 3.300 metros de extensão, o aterro de uma faixa\ncontígua para a instalação de armazéns e guindastes elétricos e a\nabertura da avenida do Cais (depois chamada Rodrigues Alves). Também foi\nprevista a abertura de duas grandes vias para a comunicação do porto com\na cidade: a avenida Central (depois denominada Rio Branco) e a avenida\ndo Mangue (futura Francisco Bicalho).\n\nEm maio de 1903, o governo brasileiro negociou um empréstimo de 8,5\nmilhões de libras com os banqueiros ingleses Rothschild para a\nconstrução do porto e as obras complementares. Ao câmbio da época, o\nempréstimo correspondia a 136 mil contos, quase metade do orçamento\nfederal. No mês seguinte, Rodrigues Alves e os ministros Lauro Müller e\nLeopoldo Bulhões (Fazenda) promulgaram o Decreto n^o^ 4.859, que criou a\nCaixa Especial dos Portos, estabelecendo um regime cambial especial para\na execução das obras de melhoramentos dos portos em geral. As obras do\nporto do Rio foram contratadas com a firma inglesa C. H. Walker e\ntiveram início em março de 1904. O primeiro trecho do cais foi\ninaugurado em novembro de 1906, ao término do mandato de Rodrigues\nAlves. Os trabalhos foram concluídos cinco anos mais tarde.\n\nO processo de reurbanização da capital federal ensejou acirrada disputa\nentre duas companhias interessadas na primazia do fornecimento de\nenergia elétrica ao mercado carioca: a Guinle & Cia, empresa pertencente\na Cândido Gaffrée e Eduardo Guinle, concessionários das Docas de Santos,\ne a The Rio de Janeiro Tramway, Light and Power Company, pertencente ao\nmesmo grupo de capitalistas canadenses e norte-americanos que\ncontrolavam a São Paulo Light, concessionária dos serviços de\neletricidade na capital paulista.\n\nLauro Müller viu-se diretamente envolvido pela disputa entre a Guinle &\nCia e a Rio Light. Em dezembro de 1904, em meio à luta nos bastidores\nentre as duas empresas, o ministro promulgou o Decreto n^o^ 5.407,\nregulando “o aproveitamento da força hidráulica para transformação em\nenergia elétrica aplicada a serviços federais”. Considerado o embrião da\nlegislação brasileira sobre energia elétrica, o decreto estabeleceu\nbasicamente os seguintes princípios: concessão sem privilégio no prazo\nde 90 anos; reversão para a União dos bens utilizados na concessão;\nrevisão da tarifa ao final do terceiro ano e, daí por diante, a cada\ncinco anos; redução tarifária sempre que os lucros líquidos de\nconcessionário superassem a remuneração anual de 12% sobre o capital\naprovado pelo governo; autorização para o concessionário promover\ndesapropriação; e competência exclusiva da União para autorizar\nconcessões de aproveitamentos hidrelétricos nos rios de domínio federal.\n\nApós a promulgação do Decreto n^o^ 5.407, o advogado Alexander Mackenzie\nsolicitou permissão do governo para a Rio Light atuar no país. Lauro\nMüller rejeitou o requerimento. Sua negativa, abrindo espaço para a\natuação da Guinle & Cia nas atividades de energia elétrica no Rio de\nJaneiro, rendeu acalorados debates na imprensa. Mackenzie e o empresário\nnorte-americano Percival Farquhar agiram prontamente para fazer impor os\ninteresses da Rio Light, contando com o auxílio do embaixador dos\nEstados Unidos no Brasil, David Thompson.\n\nEm maio de 1905, Lauro Müller reviu sua posição e assinou o decreto que\nautorizou o funcionamento da Rio Light no país. A batalha jurídica e\npolítica de Eduardo Guinle e Cândido Gaffrée contra a Light durou vários\nanos. Apesar de algumas contramarchas, a empresa estrangeira garantiu o\nmonopólio dos serviços de energia elétrica no Rio de Janeiro.\n\nA construção ferroviária ganhou certo alento durante a gestão de Lauro\nMüller no Ministério da Viação. A extensão das linhas em tráfego teve um\nacréscimo de 1.560 quilômetros, atingindo o total de 17.240 quilômetros.\n\nA Estrada de Ferro Central do Brasil (EFCB) prolongou a chamada Linha do\nCentro, alcançando as cidades de Cordisburgo, Curvelo e Corinto, em\nMinas Gerais. O alargamento da bitola da EFCB no ramal de São Paulo,\nobra essencial para a ligação entre as duas maiores cidades do país, foi\nbastante adiantado.\n\nEm outubro de 1904, Lauro Müller autorizou a Companhia Estrada de Ferro\nNoroeste do Brasil a promover a ligação entre Bauru (SP) e Cuiabá,\nlevando em conta a importância estratégica da comunicação ferroviária\nentre a região Sudeste e o estado do Mato Grosso. Posteriormente, o\ngoverno federal modificou as condições da concessão e o traçado da\nferrovia. Formada por capitais brasileiros e franco-belgas, a Companhia\nNoroeste ficou encarregada da construção do trecho entre Bauru e a\nlocalidade paulista de Itapura, próxima ao rio Paraná. A implantação da\nferrovia no território mato-grossense foi confiada a outra empresa. Em\nsetembro de 1906, o primeiro trecho de cem quilômetros da Companhia\nNoroeste foi aberto ao tráfego em cerimônia que contou a presença de\nMüller, do presidente do estado de São Paulo, Jorge Tibiriçá, e vários\npolíticos paulistas.\n\nEm junho de 1905, o Ministério da Viação promoveu concorrência para a\nimplantação da ferrovia Madeira-Mamoré, vencida pelo engenheiro Joaquim\nCatramby. Importa assinalar que a assinatura do Tratado de Petrópolis em\nnovembro de 1903 obrigara o Brasil a assumir os custos da construção da\nferrovia, como forma de compensação à Bolívia pela perda do Acre. A\nconcessão outorgada ao engenheiro Catramby foi adquirida pela\nMadeira-Mamoré Railway, empresa ligada à Brazil Railway, do empresário\nPercival Farquhar, que levou a cabo o empreendimento.\n\nRaposa de Espada à Cinta\n\nLauro Müller participou discretamente dos entendimentos para a sucessão\ndo presidente Rodrigues Alves. A discussão em torno do problema\nsucessório começou em meados de 1904 e se prolongou até setembro de\n1905, quando o vice-presidente Afonso Pena foi consagrado candidato\noficial. O grande derrotado foi o próprio Rodrigues Alves que trabalhou,\nsem sucesso, pela indicação de Bernardino de Campos, ex-ministro da\nFazenda e duas vezes presidente do estado de São Paulo.\n\nPromovido a tenente-coronel em novembro de 1906, às vésperas da posse do\ngoverno Afonso Pena (1906-1909), Lauro Müller foi substituído no\nMinistério da Indústria, Viação e Obras Públicas pelo engenheiro baiano\nMiguel Calmon. Em março de 1907, foi mais uma vez eleito senador,\nocupando a vaga de Gustavo Richard, que fora eleito governador de Santa\nCatarina no ano anterior. Tomou posse do mandato em maio e viajou à\nEuropa para um prolongado tratamento de saúde. Durante sua ausência, o\nsenador Hercílio Luz entrou em conflito com Gustavo Richard, rompendo\npublicamente com o governador catarinense em fevereiro de 1908. Dois\nmeses depois, Lauro Müller reuniu a bancada federal catarinense no Rio\nde Janeiro e renunciou à chefia do PRC. Tudo indica que sua renúncia era\numa manobra calculada para ganhar tempo, fortalecer sua liderança e\nisolar Hercílio Luz. Seis meses depois, sem a participação do senador\ndissidente, uma assembleia do PRC reconduziu-o ao cargo de presidente do\npartido.\n\nConsiderado um político astucioso, militar de formação, mas diplomata\npor temperamento, Lauro Müller ganhou na época o apelido de “Raposa de\nespada à cinta” que lhe teria sido dado pelo senador gaúcho Pinheiro\nMachado.\n\nDestacou-se como um dos articuladores da candidatura do marechal Hermes\nda Fonseca à sucessão presidencial de 1910. Sobrinho de Deodoro da\nFonseca, o marechal assumira o Ministério da Guerra no início do governo\nAfonso Pena. Em maio de 1909, o movimento hermista passou a contar com o\napoio dos senadores Pinheiro Machado, Francisco Sales (MG) e outros\nlíderes de grande influência, em rota de colisão com o presidente da\nRepública e o grupo conhecido como “jardim de infância” que dava\nsustentação ao governo. Hermes da Fonseca pediu demissão do ministério\nno dia 14 de maio, e sua candidatura foi oficializada imediatamente em\nconvenção de senadores e deputados presidida por Pinheiro Machado. Por\nsugestão de Lauro Müller, a convenção aprovou o nome do governador\nmineiro Venceslau Brás como companheiro de chapa do marechal Hermes.\n\nA morte de Afonso Pena em junho de 1909 e a ascensão ao poder do vice\nNilo Peçanha, aliado de Pinheiro Machado, favoreceram em ampla medida a\ncandidatura de Hermes. O senador baiano Rui Barbosa apresentou-se como\nconcorrente, assumindo a liderança da Campanha Civilista de oposição.\nHermes e Rui travaram a primeira disputa eleitoral acirrada da história\nrepublicana. A Campanha Civilista teve grande repercussão junto às\nclasses médias urbanas, logrando boa votação em vários estados,\ninclusive Santa Catarina, onde contou com o apoio de Hercílio Luz.\n\nTal como esperado, Hermes venceu as eleições presidenciais e tomou posse\nem novembro de 1910. Em 1911, Müller proferiu discurso de saudação ao\nprimeiro ano do governo Hermes, publicado em edição do *Jornal do\nComércio*, do Rio de Janeiro, sob o título *Os ideais republicanos*.\n\nSucessor de Rio Branco\n\nLauro Müller interrompeu a carreira parlamentar em fevereiro de 1912, ao\nser designado ministro das Relações Exteriores pelo presidente Hermes da\nFonseca (1910-1914), logo após o falecimento de José Maria da Silva\nParanhos Júnior, o barão do Rio Branco, grande nome da história\ndiplomática brasileira e chefe do Itamaraty desde 1902. Rio Branco\ncomandou a política externa brasileira durante o governo de quatro\npresidentes (compôs o ministério de Rodrigues Alves juntamente com\nMüller) e foi o idealizador da “aliança especial” com os Estados Unidos\ncomo linha mestra da diplomacia nacional. Continuador da política\namericanista, Lauro Müller manteve-se à frente do Itamaraty durante o\nrestante do governo Hermes e parte do governo de Venceslau Brás\n(1914-1918). Ainda em setembro de 1912 foi eleito para a vaga do barão\ndo Rio Branco na Academia Brasileira de Letras.\n\nEm diversos episódios, demonstrou o desejo de acompanhar a posição\nnorte-americana nas questões internacionais. Em fevereiro de 1912,\nrecém-nomeado chanceler (na mesma época foi promovido a coronel),\ninstruiu o embaixador brasileiro em Washington, Domício da Gama, a\nconsultar o Departamento de Estado sobre um levante ocorrido no\nParaguai, acrescentando que o fazia por desejar sempre marchar de acordo\ncom os EUA. Em sua resposta, o embaixador afirmou que o Brasil não devia\nsubordinar seu comportamento na América do Sul à audiência e, muito\nmenos, à aprovação do governo norte-americano.\n\nOutro momento de independência demonstrado por Domício da Gama ocorreu\nquando da denominada questão do truste do café. Em maio de 1912, o\nDepartamento de Justiça dos EUA propôs ação contra um dos principais\nexecutivos do comitê de valorização do café de São Paulo, por violação\nda Lei Sherman antitruste, requerendo a venda imediata de 950 mil sacas\nde café estocadas em Nova Iorque. O embaixador Domício da Gama\nconsiderou a ação contrária ao direito de São Paulo manter contratos\ninternacionais e criticou desabridamente a posição norte-americana em\ndiscurso na Pan-American Society. Lauro Müller desaprovou o discurso,\nprocurando solucionar a questão por via diplomática. O Departamento de\nJustiça norte-americano aceitou as negociações, mas condicionou-as à\nvenda, no mercado livre, do estoque de café pelo comitê de valorização\naté abril do ano seguinte. A ação judicial foi suspensa. Em janeiro de\n1913, foi revelado que o comitê de valorização havia retirado todo o\nestoque de café que se encontrava nos EUA.\n\nPrimeiro chanceler brasileiro a viajar para o exterior em missão\noficial, Lauro Müller visitou Washington e outras cidades\nnorte-americanas em junho de 1913. Foi recebido pelo presidente Woodrow\nWilson e recebeu o grau de doutor *honoris causa* da Universidade de\nHarvard.\n\nMüller também deu continuidade ao esforço do barão do Rio Branco para\namenizar as tensões com a Argentina. A seu pedido, o ex-presidente\nCampos Sales cumpriu uma breve missão como ministro plenipotenciário do\nBrasil em Buenos Aires em maio e junho de 1912. Em retribuição, o\nex-presidente argentino Júlio Roca também foi designado para cumprir no\nRio de Janeiro funções de ministro em missão especial no mesmo ano.\n\nEm agosto de 1914, quando o marechal Hermes da Fonseca declarou a\nneutralidade do Brasil diante da guerra recém-conflagrada na Europa,\nLauro Müller estava licenciado do Itamaraty por motivo de saúde.\nReassumiu o posto logo em seguida e expediu novas instruções para\ngarantir a neutralidade e salvaguardar os interesses do país. No mesmo\nano, foi promovido a general de brigada.\n\nEm maio de 1915, visitou o Uruguai, Argentina e Chile. Juntamente com o\npresidente uruguaio Feliciano Vieira, inaugurou o marco divisório de\nAceguá, dando cumprimento ao tratado sobre os limites de domínio da\nlagoa Mirim e do rio Jaguarão, celebrado pelos dois países em outubro de\n1909. Em Buenos Aires, assinou com os chanceleres da Argentina e Chile o\ntratado sobre arbitragem de disputas conhecido como Tratado do ABC. O\ndocumento previa que as controvérsias entre Argentina, Brasil e Chile,\nou entre dois deles, seriam submetidas a uma comissão permanente que se\nreuniria em Montevidéu. Os três países obrigavam-se a não praticar atos\nde hostilidade enquanto a comissão não tivesse apresentado seu parecer.\n\nLauro Müller viajou novamente aos EUA em junho de 1916, dessa vez para\ntratamento de saúde. Visitou uma estação de águas no estado de Indiana\ne, por sugestão de Alexander Mackenzie, estendeu a viagem ao Canadá.\nDurante sua ausência de cinco meses, o embaixador Luís Martins de Sousa\nDantas chefiou interinamente o Itamaraty.\n\nO desenrolar da Primeira Guerra Mundial e a campanha pela entrada do\nBrasil na guerra contra a Alemanha acabariam provocando seu pedido de\ndemissão do Itamaraty. Em janeiro de 1917, o governo alemão optou pela\nguerra submarina total, autorizando o afundamento de navios mercantes\nque mantivessem comércio com a Inglaterra, França e Itália. O chanceler\nbrasileiro protestou contra o bloqueio marítimo, mas insistiu na posição\nde neutralidade, ao passo que os EUA optaram, de imediato, pelo\nrompimento de relações com a Alemanha.\n\nEm 11 de abril, o governo brasileiro rompeu relações com o Império\nAlemão, em decorrência do torpedeamento do vapor *Paraná* na costa\nfrancesa e sob pressão da forte campanha de solidariedade aos países\naliados, liderada por Rui Barbosa. Cinco dias antes, o presidente\nnorte-americano Woodrow Wilson assinara a declaração de guerra contra a\nAlemanha. O rompimento de relações com Berlim não bastou, porém, para\nacalmar os ânimos que se exaltavam no país. A ascendência germânica de\nMüller foi invocada para colocá-lo em situação desconfortável no\nItamaraty. Em virtude da oposição de parlamentares e jornalistas, Müller\nrenunciou à pasta no dia 3 de maio, sendo substituído por Nilo Peçanha.\nEm junho, o governo brasileiro revogou a lei da neutralidade, invocando\na solidariedade continental e amizade tradicional com os EUA.\n\nLauro Müller voltou ao Senado em outubro de 1917, a tempo de votar\nfavoravelmente à entrada do Brasil na Primeira Guerra Mundial ao lado\ndos EUA e países aliados. Sua volta foi assegurada pela renúncia do\nsenador Abdon Batista e a realização de eleição extraordinária, à qual\nconcorreu como candidato do PRC.\n\nNo ano seguinte, apoiou a indicação de Abdon Batista para a sucessão do\ngovernador Felipe Schmidt, enfrentando, porém, a oposição de Hercílio\nLuz e outras lideranças estaduais. Diante do impasse, aceitou encabeçar\na chapa do PRC, ficando acertado que Hercílio Luz, candidato a vice,\nassumiria o governo do estado. O acordo foi cumprido à risca. Müller foi\neleito governador, mas abdicou do cargo, perdendo a condição de\nprincipal líder do PRC para Hercílio Luz.\n\nReeleito senador em fevereiro de 1921, desempenhou papel secundário na\ncampanha de Artur Bernardes nas eleições presidenciais do ano seguinte.\n\nFaleceu no Rio de Janeiro em 30 de julho de 1926.\n\nFoi casado com Luísa de Andrade Müller, com quem teve três filhos. Um\ndeles, Antônio Pedro de Andrade Müller, foi deputado estadual em Santa\nCatarina (1919-1930). Seu sobrinho José Eugênio Müller foi deputado\nfederal por Santa Catarina (1934-1937) e pelo estado do Rio de Janeiro\n(1957).\n\nO nome de Lauro Müller foi dado a um município da zona carbonífera de\nSanta Catarina.\n\nPaulo Brandi Cachapuz\n\n**FONTES:** ABRANCHES, J. *Governos*; ABRANCHES, J. *Como*; BANDEIRA, L.\n*Presença*; BARRETO FILHO, F. *Sucessores*, v.1; BEIGUELMAN, P.\n*Pequenos*; BELLO, J. *História*; BOITEUX, L. *Notas*; BUENO, C*.\nPolítica*; CABRAL, O. *Santa Catharina*; CÂM. DEP. *Anais* (10/6 –\n31/7/1891, 28/7/1891. p.587-589, 1- 3/11/1891, 3/11/1891, p.41, 1-\n31/7/1893, 26/7/1893, p.489-492, 1-31/10/1894, 2/10/1894, p.46,\n3/6/1897, p.75, 2-31/10/1899, 13/10/1899, p.286-287, 23/10/1899, p.590);\nCARONE, E. *República Velha*; CORRÊA, L. *Origens*; CARVALHO, J. *Forças\narmadas*; CASTRO, C. *Militares*; CASTRO, C. *Proclamação*; Diário do\ncongresso nacional (XII, n.1, 1/5/1900, p.1-4, XIX, n.2, 5/5/1907, XIX,\nn.8, 12/5/1907, XXVIII, n.127, 29/9/1917, p.2.681, XXVIII, n.150,\n27/10/1917, p.3.506); *Enc. Simpozio*. Disponível em:\n\\<www.cfh.ufsc.br/\\~simpozio/EncReg/EncSC/MegaHSC/SC%20Primeira%20Republica/91sc2015-2041.htm\\>;\nFERREIRA, M. *República*; FRANCO, A. *Rodrigues*; GAULD. C. *Farquhar*;\nGHIRARDELLO N. *Beira*; GOMES, A. *Invenção*; KONDER, M. *Lauro*;\nLAMARÃO, S. *Capital*; LAMARÃO, S. *Dos*; LAHMEYER, E.; LEVY, M.\n*Estudos*; LEMOS R. *Benjamin*; LENZI, C. *Partidos*; MCDOWALL, D.\n*Light*; Mensagem do coronel Gustavo Richard (29/9/1891); OCTAVIO FILHO,\nR. *Lauro*, p.172-188; PAULI, E. *Hercílio*; SOUZA, M. *Processo*;\n*Revista do Instituto Histórico e Geográfico Brasileiro* (Tomo 99, v.153\n1/1926), p.494-498; TELLES, P. *História*; VILLELA, A; SUZIGAN W.\n*Política.*\n","ref":"**FONTES:** ABRANCHES, J. *Governos*; ABRANCHES, J. *Como*; BANDEIRA, L.\n*Presença*; BARRETO FILHO, F. *Sucessores*, v.1; BEIGUELMAN, P.\n*Pequenos*; BELLO, J. *História*; BOITEUX, L. *Notas*; BUENO, C*.\nPolítica*; CABRAL, O. *Santa Catharina*; CÂM. DEP. *Anais* (10/6 –\n31/7/1891, 28/7/1891. p.587-589, 1- 3/11/1891, 3/11/1891, p.41, 1-\n31/7/1893, 26/7/1893, p.489-492, 1-31/10/1894, 2/10/1894, p.46,\n3/6/1897, p.75, 2-31/10/1899, 13/10/1899, p.286-287, 23/10/1899, p.590);\nCARONE, E. *República Velha*; CORRÊA, L. *Origens*; CARVALHO, J. *Forças\narmadas*; CASTRO, C. *Militares*; CASTRO, C. *Proclamação*; Diário do\ncongresso nacional (XII, n.1, 1/5/1900, p.1-4, XIX, n.2, 5/5/1907, XIX,\nn.8, 12/5/1907, XXVIII, n.127, 29/9/1917, p.2.681, XXVIII, n.150,\n27/10/1917, p.3.506); *Enc. Simpozio*. Disponível em:\n\\<www.cfh.ufsc.br/\\~simpozio/EncReg/EncSC/MegaHSC/SC%20Primeira%20Republica/91sc2015-2041.htm\\>;\nFERREIRA, M. *República*; FRANCO, A. *Rodrigues*; GAULD. C. *Farquhar*;\nGHIRARDELLO N. *Beira*; GOMES, A. *Invenção*; KONDER, M. *Lauro*;\nLAMARÃO, S. *Capital*; LAMARÃO, S. *Dos*; LAHMEYER, E.; LEVY, M.\n*Estudos*; LEMOS R. *Benjamin*; LENZI, C. *Partidos*; MCDOWALL, D.\n*Light*; Mensagem do coronel Gustavo Richard (29/9/1891); OCTAVIO FILHO,\nR. *Lauro*, p.172-188; PAULI, E. *Hercílio*; SOUZA, M. *Processo*;\n*Revista do Instituto Histórico e Geográfico Brasileiro* (Tomo 99, v.153\n1/1926), p.494-498; TELLES, P. *História*; VILLELA, A; SUZIGAN W.\n*Política.*\n","dic":"DHBPR"}
