{"title":"NATAL, Joaquim Xavier Guimarães","cargoss":["Membro de junta governativa","Constituinte","Deputado federal","Ministro do Supremo Tribunal Federal","Procurador-geral da República"],"cargos_esp":[0,0,0,0,0],"datas_ini":[1889,1891,1891,1905,1909],"datas_fim":[1890,1891,1893,1905,1910],"estados":["GO",0,"GO",0,0],"autor":["Adrianna Setemy"],"content":"**NATAL, Joaquim Xavier Guimarães**\n\n\\*junta gov. GO 1889-1890; const. 1891; dep. fed. GO 1891-1893; min. STF\n1905; proc. ger. Rep. 1909-1910.\n\n*Joaquim Xavier Guimarães Natal* nasceu na cidade de Goiás, capital da\nprovíncia de Goiás, no dia 25 de dezembro de 1860, filho de Luís Pedro\nXavier Guimarães e de Leonor Gertrudes Fialho Guimarães.\n\nIniciou os estudos no Liceu Goiano e depois seguiu para a capital\npaulista, onde obteve o título de bacharel em ciências jurídicas e\nsociais na Faculdade de Direito em novembro de 1882. Recém-formado,\nregressou à província natal e em 1883 foi nomeado promotor público e\ncurador geral dos órfãos da comarca da capital. Exerceu tais funções até\n17 de janeiro de 1885, quando foi nomeado juiz substituto, cargo que\ndesempenhou por quatro anos. Por essa época casou-se com Ângela de\nBulhões Jardim, pertencente à família que desde o início da década de\n1880 era a principal detentora do poder regional, irmã de Leopoldo\nBulhões, que viria a ser um dos mais destacados representantes de Goiás\nnos primeiros governos republicanos.\n\nApós a proclamação da República em 15 de novembro de 1889, o então\npresidente da província Eduardo Augusto Montandon foi deposto em 6 de\ndezembro, e o marechal Deodoro da Fonseca, chefe do governo provisório\ndo país, nomeou para seu lugar o tenente-coronel Bernardo Vasques,\ncomandante do 1^o^ Regimento de Artilharia a Cavalo. Este, porém, não\nchegou a tomar posse, pois os grupos políticos locais se articularam a\nfim de que uma junta representativa de seus interesses fosse nomeada\npara exercer provisoriamente o governo. A junta, composta por Joaquim\nXavier Guimarães Natal, José Joaquim de Sousa e Eugênio Augusto de Melo,\ntomou posse em 7 de dezembro de 1889 – mesmo mês em que Guimarães Natal\nfoi nomeado juiz de direito da comarca de Rio das Pedras – e governou\naté 24 de fevereiro de 1890, quando foi substituída por Rodolfo Gustavo\nda Paixão, nomeado presidente de Goiás por Deodoro. Na mesma ocasião,\nGuimarães Natal foi nomeado primeiro-vice-presidente.\n\nDesde os primeiros tempos do novo regime os políticos goianos, numa\ntentativa de superar as divergências políticas pré-existentes,\norganizaram-se em torno do Centro Republicano, liderado pelas famílias\nBulhões e Caiado, ao qual Guimarães Natal se filiou. Entretanto, as\nantigas disputas logo afloraram e resultaram na formação de outros dois\npartidos, o Partido Católico, liderado pelo cônego Inácio Xavier da\nSilva, e o Partido Republicano Federal, resultante de uma cisão no\nCentro Republicano. Além disso, o rompimento determinou o modo\ndivergente como os grupos políticos locais se alinharam, uns aos\nmilitares que estavam no poder, outros às oligarquias cafeeiras que lhes\nfaziam oposição. De toda forma o Centro Republicano constituiu a\nprincipal expressão política dos defensores da autonomia estadual e, por\nesse motivo, seu grupo se opôs ao governo de Rodolfo da Paixão.\n\nNas eleições de setembro de 1890 para a Assembleia Nacional\nConstituinte, Guimarães Natal foi eleito deputado por Goiás, assim como\nSebastião Fleury Curado e Leopoldo Bulhões, enquanto José Joaquim de\nSousa, Antônio Amaro da Silva Canedo e Antônio da Silva Paranhos foram\neleitos senadores. Tomou posse em 15 de novembro seguinte e, por decreto\nde 2 de dezembro, foi nomeado juiz federal em Goiás. Promulgada a\nConstituição federal em 24 de fevereiro de 1891, a partir de maio passou\na exercer o mandato ordinário na Câmara dos Deputados até dezembro de\n1893. Paralelamente foram convocadas as constituintes estaduais, e o\nCentro Republicano de Goiás elegeu a maioria dos deputados, entre eles\nGuimarães Natal. Tomou parte assim nas discussões e conflitos políticos\nque culminaram com a promulgação da Constituição estadual de Goiás em\n1^o^ de junho de 1891, da qual foi signatário.\n\nEm 1897 foi membro da comissão encarregada de elaborar o plano da\nreforma constitucional, e em 1898, participou da comissão incumbida da\nreforma do Código do Processo Criminal. Em setembro de 1905 foi nomeado\nministro do Supremo Tribunal Federal (STF), na vaga decorrente do\nfalecimento de Antônio Joaquim Macedo Soares, e de dezembro de 1909 a\nnovembro de 1910 foi procurador geral da República. Vice-presidente do\nMontepio de Economia dos Servidores do Estado desde 1907, presidiu a\nentidade no triênio 1924-1927. Aposentou-se em abril de 1927.\n\nFaleceu no Rio de Janeiro, então Distrito Federal, em 22 de junho de\n1933.\n\nDe seu casamento com Ângela de Bulhões Jardim teve uma filha.\n\nAdrianna Setemy\n\n**FONTES:** ABRANCHES, J. *Governos* (v.1); MATTOSO, P. *Supremo\nTribunal*; MELLO FILHO, J. *Notas*; Projeto de imagem de publicações\noficiais brasileiras do Center for Research Libraries e Latin-american\nMicrofilm Project. *Mensagens dos Presidentes de Província (1830-1930).*\nDisponível em: \\<www.crl.edu/content.asp?l1=4&l2=18&l3=33\\>. Acesso em:\n8/1/2009; RODRIGUES, L. *História*; SUP. TRIB. FED. Disponível em:\n\\<www.stf.jus.br/portal/ministros\\>.\n","ref":"**FONTES:** ABRANCHES, J. *Governos* (v.1); MATTOSO, P. *Supremo\nTribunal*; MELLO FILHO, J. *Notas*; Projeto de imagem de publicações\noficiais brasileiras do Center for Research Libraries e Latin-american\nMicrofilm Project. *Mensagens dos Presidentes de Província (1830-1930).*\nDisponível em: \\<www.crl.edu/content.asp?l1=4&l2=18&l3=33\\>. Acesso em:\n8/1/2009; RODRIGUES, L. *História*; SUP. TRIB. FED. Disponível em:\n\\<www.stf.jus.br/portal/ministros\\>.\n","dic":"DHBPR"}
