{"title":"NEVES SOBRINHO, Joaquim José de Faria","cargoss":["Deputado federal"],"cargos_esp":[0],"datas_ini":[1908],"datas_fim":[1911],"estados":["PE"],"autor":["Raimundo Helio Lopes"],"content":"**NEVES SOBRINHO, Joaquim José de Faria**\n\n\\*dep. fed. PE 1908-1911.\n\n*Joaquim José de Faria Neves Sobrinho* nasceu em Recife no dia 2 de\nabril de 1872.\n\nFormou-se pela Faculdade de Direito do Recife em 1891, e no ano seguinte\nfoi nomeado promotor público da comarca de Bezerros (PE). Além das\natividades ligadas ao direito, foi professor de latim do Ginásio\nPernambucano, em Recife.\n\nIniciou sua vida política em 1898, quando foi eleito deputado estadual\nem Pernambuco. Sucessivamente reeleito até 1907, no ano seguinte foi\neleito senador estadual, mas não chegou a concluir seu mandato, pois em\nsetembro foi eleito deputado federal na vaga aberta com o falecimento de\nMalaquias Antônio Gonçalves e assumiu uma cadeira na Câmara os\nDeputados, no Rio de Janeiro, então Distrito Federal. Reeleito nas\neleições regulares de 1909, exerceu o mandato até o fim da legislatura,\nem 1911.\n\nNo campo jornalístico, foi redator do *Diário de Pernambuco* e do\n*Estado de Pernambuco,* e colaborou ainda com os periódicos\npernambucanos *Jornal do Comércio*, *Revista Contemporânea* e *Almanaque\nde Pernambuco*. Foi também membro da Academia Pernambucana de Letras.\n\nFaleceu na cidade do Rio de Janeiro no dia 4 de janeiro de 1927.\n\nPublicou *Quimeras* (1890), *O hidrófobo* (contos, 1896), *Morbus*\n(romance, 1898), *Estrofes* (1911), *Pôr de sol* (1920), *Sol posto*\n(1923) e *Crepúsculo* (1924). Em edições póstumas saíram *Noite* (1935)\ne *Poesias* (1949).\n\nRaimundo Helio Lopes\n\n**FONTES:** ABRANCHES, J. *Governos*; CÂM. DEP. *Deputados brasileiros*;\nNASCIMENTO, L. *História* (v.1, 2, 6). Pernambuco de A-Z. Disponível em:\n\\<www.pe-az.com.br/\\>. Acesso em: 22/11/2010.\n","ref":"**FONTES:** ABRANCHES, J. *Governos*; CÂM. DEP. *Deputados brasileiros*;\nNASCIMENTO, L. *História* (v.1, 2, 6). Pernambuco de A-Z. Disponível em:\n\\<www.pe-az.com.br/\\>. Acesso em: 22/11/2010.\n","dic":"DHBPR"}
