{"title":"NEVES, Graciano dos Santos","cargoss":["Membro de junta governativa","Presidente de associação ou confederação de empregados ou empregadores","Deputado federal"],"cargos_esp":[0,0,0],"datas_ini":[1891,1896,1906],"datas_fim":[1892,1897,1908],"estados":["ES","ES","ES"],"autor":["Nara Saletto","Fernando Achiamé"],"content":"**NEVES, Graciano dos Santos**\n\n\\*junta gov. ES 1891-1892; pres. ES 1896-1897; dep. fed. ES 1906-1908.\n\n*Graciano dos Santos Neves* nasceu em São Mateus (ES) no dia 12 de julho\nde 1868, filho de Graciano dos Santos Neves e de Constância Gomes da\nCunha Santos Neves. Pertencia a importante família de São Mateus,\nformada por baianos que se radicaram naquela cidade e se uniram por\nnumerosos casamentos à oligarquia local. Sua mãe era irmã do barão de\nAimorés, e seu pai, nascido na Bahia, foi deputado provincial.\n\nFez os estudos preparatórios no Rio de Janeiro e ingressou na Escola\nPolitécnica, porém não concluiu o curso de engenheiro, passando à\nFaculdade de Medicina, na qual se formou em 30 de dezembro de 1889. Logo\nretornou ao Espírito Santo, onde se envolveu na política, atuando a\nfavor do novo regime e do governador nomeado para o estado, Afonso\nCláudio. Em São Mateus, fundou um jornal, *Norte do Espírito Santo*,\nalinhado com o Partido Republicano Construtor (PRC), e fez oposição\naguerrida ao governo do marechal Deodoro da Fonseca, após ter este\ndeposto o governador do Espírito Santo Henrique Coutinho, membro do seu\npartido. Combateu duramente o golpe desfechado por Deodoro em 3 de\nnovembro de 1891, dissolvendo o Congresso Nacional, e por conta disso o\npresidente estadual Alfeu Adolfo Monjardim de Andrade, o barão de\nMonjardim – a quem também combatia – chegou a ordenar sua prisão. Antes\nque esta se concretizasse, porém, tanto o governo federal quanto o\ngoverno estadual chegaram ao fim.\n\nDeodoro renunciou em 23 de novembro de 1891, e no mesmo dia o\nvice-presidente Floriano Peixoto assumiu a presidência. Iniciaram-se\nentão nos estados, com o apoio do novo presidente e da facção militar a\nele aliada, rebeliões contra os governantes ligados a Deodoro. No\nEspírito Santo o movimento rebelde foi comandado politicamente pelo PRC,\ncom a participação das forças do Exército sediadas no estado, e depôs o\nvice-governador, Antônio Gomes Aguirre, que substituía o barão de\nMonjardim. Em 9 de dezembro foi instalada uma junta governativa, e\nGraciano, credenciado por sua atuação anterior, foi escolhido como um de\nseus membros, ao lado do comandante do 32^o^ Batalhão de Infantaria, o\ncoronel Inácio Henrique de Gouveia, e de Galdino Lins de Barros Loreto,\napoiado por políticos federais.\n\nA junta governativa dissolveu a Assembleia, adotou como Constituição\nprovisória o projeto elaborado no governo de Afonso Cláudio, já\nutilizado nos governos anteriores do PRC, e convocou eleições para uma\nnova Constituinte estadual. Esta foi instalada a 9 de abril de 1892, e a\n2 de maio elegeu José de Melo Carvalho Muniz Freire, então deputado\nfederal, para a presidência do estado, e Graciano Neves para a primeira\nvice-presidência. Nessa condição, Graciano assumiu o governo entre 2 de\nagosto e 5 de outubro do mesmo ano, por motivo de licença do presidente.\nAo final de um governo exitoso, Muniz Freire escolheu pessoalmente\nGraciano como candidato à sua sucessão. Eleito, contra o candidato da\noposição, senador Domingos Vicente, dissidente do PRC, Graciano tomou\nposse a 23 de maio de 1896.\n\nApós um período de prosperidade no Espírito Santo, graças aos bons\npreços e à expansão da produção do café, cujo auge se deu no governo de\nMuniz Freire, o mandato de Graciano começou no início da crise daquele\nproduto, que criou sérios problemas para a economia brasileira e a\ncapixaba, baseadas na monocultura cafeeira. A crise provocou a\ndesvalorização da moeda nacional, dificultando o pagamento da dívida\nexterna que o estado havia contraído para financiar seu plano\nferroviário, e a queda da receita estadual, sustentada pelo imposto de\nexportação sobre o café. Graciano teve que reduzir os gastos do estado,\nparalisando obras em Vitória e interrompendo o contrato para a\nintrodução de imigrantes; manteve, porém, a construção da Estrada de\nFerro Sul do Espírito Santo. Essa política de restrição de gastos\npúblicos e a recusa do presidente em tomar diversas medidas solicitadas\npelo diretório de seu partido, do qual ele não participava, levaram a um\nconflito que se agravou rapidamente, facilitado pela ausência de seu\nprincipal aliado, Muniz Freire, que se encontrava na França em comissão\ndo governo.\n\nSimultaneamente, a divisão instalada na política federal, com a formação\nde uma forte e violenta oposição ao governo de Prudente de Morais\n(1894-1898), atingiu o estado, mantendo um clima de alta tensão\npolítica. A oposição estadual uniu-se à federal e criou uma seção\nregional do Partido Republicano Federal (PRF), ligada à ala florianista\ne aos jacobinos que combatiam Prudente. Quando este se licenciou, por\nmotivo de doença, o vice-presidente da República, Manuel Vitorino, da\noposição, passou a substituir os chefes das repartições federais no\nEspírito Santo (como a Capitania dos Portos) por partidários da\noposição. Fortalecidos e comandados pelo deputado federal Torquato\nMoreira, presidente do PRF local, esses oposicionistas acirraram o\ncombate ao governo estadual. Graciano, que até então era respeitado por\nsua cultura e integridade de caráter, passou a ser combatido ferozmente.\nNão tinha gosto pelo exercício do poder e da administração pública e,\ndiante da pressão ao mesmo tempo interna ao partido e externa,\nlicenciou-se do cargo a 22 de agosto de 1897 e não reassumiu o governo,\napresentando sua renúncia em setembro seguinte. Substituiu-o então o\nvice-presidente Constante Gomes Sodré. Retomou a clínica médica,\ndesempenhou várias comissões públicas nessa área e foi professor da\nEscola Normal, recém-criada no estado.\n\nEm 1906, após o rompimento entre Muniz Freire e o presidente Henrique\nCoutinho ocorrido no ano anterior, que dividiu o PRC e a política do\nestado, Graciano apoiou Muniz e fez parte da chapa dissidente\napresentada e encabeçada por esse último nas eleições para Congresso\nNacional, como candidato a deputado federal. Embora a chapa tenha sido\nderrotada na eleição estadual, foi reconhecida pela Comissão de\nVerificação do Congresso, e Graciano exerceu o mandato de deputado\nfederal de 1906 a 1908.\n\nEm 1908, Jerônimo Monteiro foi eleito presidente do estado e, poucos\nmeses depois, conseguiu reunir quase todas as forças políticas capixabas\npara a criação de uma nova agremiação, o Partido Republicano\nEspírito-Santense (PRES), presidido por ele, em substituição ao PRC, que\nfoi extinto. Poucos políticos permaneceram na oposição, mas entre eles\nestava Graciano Neves, que não deu trégua a Jerônimo na Câmara de\nDeputados. Terminado seu mandato, não tinha condições de se reeleger,\nmas apresentou-se como candidato avulso e foi o primeiro mais votado\nabaixo da chapa oficial. Como um dos membros dessa chapa, Galdino\nLoreto, faleceu antes do início da legislatura, Graciano tentou se fazer\nreconhecer em seu lugar, mas não conseguiu vencer a força dos aliados de\nJerônimo Monteiro, entre os quais Torquato Moreira, que foi eleito\nsegundo-vice-presidente da Câmara.\n\nGraciano permaneceu no Rio de Janeiro, onde foi técnico do Jardim\nBotânico, tendo ocupado sua direção interinamente. Por concurso de 1913\nocupou o cargo de professor da Escola Superior de Agricultura,\nlecionando as disciplinas de botânica, morfologia e fisiologia vegetal.\nCasou-se com Áurea Santos Neves e faleceu naquela cidade a 21 de abril\nde 1922.\n\nPublicou *Doutrina do engrossamento* (1901 [primeira edição, com\npseudônimo], 1935, 1980 e 1999), uma série de artigos com o título de\n“Meia ciência” no jornal *O Estado do Espírito Santo*, e foi colaborador\ndos periódicos *A Imprensa*, *O País* e *Jornal do Brasil* (com o\npseudônimo de Brasílio Machado).\n\nNara Saletto/Fernando Achiamé\n\n**FONTES:** *Comércio do Espírito Santo* (1896-1897); *Estado do\nEspírito Santo* (1891-1896); *Jornal Oficial* (1906); NOVAES, H.\n*Memórias*; NOVAES, M. *História*; PEREIRA, A. *Homens*.\n","ref":"**FONTES:** *Comércio do Espírito Santo* (1896-1897); *Estado do\nEspírito Santo* (1891-1896); *Jornal Oficial* (1906); NOVAES, H.\n*Memórias*; NOVAES, M. *História*; PEREIRA, A. *Homens*.\n","dic":"DHBPR"}
