{"title":"NOGUEIRA, Almeida","cargoss":["Deputado Geral","Deputado Geral","Deputado Geral","Constituinte","Deputado federal"],"cargos_esp":[0,0,0,0,0],"datas_ini":[1886,1881,1878,1891,1891],"datas_fim":[1889,1884,0,1891,1896],"estados":["SP","SP","SP",0,"SP"],"autor":["Dirceu Franco"],"content":"**NOGUEIRA, Almeida**\n\n\\*dep. geral SP 1878, 1881-1884 e 1886-1889; const. 1891; dep. fed. SP\n1891-1896.\n\n*José Luís de Almeida Nogueira* nasceu na fazenda Loanda, município de\nBananal, na então província de São Paulo, no dia 4 de fevereiro de 1851,\nfilho de Pedro Ramos Nogueira, o barão de Joatinga, e de Plácida Maria\nde Almeida.\n\nEstudou as primeiras letras na fazenda do pai e aos dez anos foi para a\nEuropa, acompanhado de um preceptor. Estudou humanidades na Institution\nPrunières e no Lycée Bonaparte (Condorcet) em Paris. Retornou ao Brasil\nem julho de 1863 e continuou os estudos na fazenda paterna sob\norientação dos professores Farjon e Joubert, ambos bacharéis, em letras\ne ciências, respectivamente. Em 1867 foi para a capital da província a\nfim de fazer o preparatório no Curso Anexo e ingressar na Faculdade de\nDireito. Defendeu suas teses em 1874.\n\nEm novembro de 1873 foi eleito deputado provincial pelo Partido\nConservador para a legislatura 1874-1875. Eleito deputado geral por São\nPaulo, ocupou uma cadeira na Assembleia Geral em 1878, de 1881 a 1884, e\nde 1886 a 1889. Mesmo tendo votado a favor da Lei Áurea, era partidário\nda tese da abolição gradual da escravidão com indenização aos\nfazendeiros, paga em escala de valor decrescente ano após ano.\n\nÀ época da proclamação da República, em 15 de novembro de 1889, ocupava\no cargo de redator-chefe do *Correio Paulistano*. Tradicional órgão do\nPartido Conservador, o jornal movia forte oposição ao gabinete liberal\npresidido pelo visconde de Ouro Preto e, influenciado pelo conselheiro\nAntonio Prado, também combatia o governo provincial do general Couto de\nMagalhães. A adesão de Almeida Nogueira ao novo sistema político ocorreu\nsomente no dia 17 de novembro, em reunião de correligionários no Teatro\nSão José. Em 1890 foi eleito deputado constituinte por São Paulo e tomou\nposse em 15 de novembro. Após a promulgação da Constituição em 24 de\nfevereiro de 1891, exerceu o mandato ordinário de maio seguinte a\ndezembro de 1893 e foi reeleito para a legislatura 1894-1896. Ocupou\nainda uma cadeira no Senado Estadual entre 1898 e 1903.\n\nLente de finanças e contabilidade pública da Faculdade de Direito de São\nPaulo, passou boa parte de sua vida colecionando notas sobre a vida dos\nestudantes que passaram pela faculdade. Desse trabalho metódico resultou\na obra *Tradições e reminiscências da Faculdade de Direito de S. Paulo.\nEstudantes, estudantões e estudantadas*, inicialmente publicada em\nfascículos no *Correio Paulistano* e posteriormente coligida em nove\nvolumes pela Tipografia Vanorden. Foi também catedrático de economia\npolítica na mesma faculdade.\n\nFaleceu no Rio de Janeiro no dia 17 de julho de 1914.\n\nOutras obras de sua autoria são *Direito civil – na herança ou no legado\ncondicional transmite-se a esperança* ridebitum-iri*?* (1872), *Ensaios\njurídicos e sociais* (1873), *Teses e dissertações para o doutoramento*\n(1874), *Direito constitucional – monografia sobre a tese: podem os\nestados e os municípios contrair empréstimos externos?* (1904),\n*Economia política – estudo sobre a denominação* e *Economia política –\nqual o objeto da economia política?*\n\nDirceu Franco\n\n**FONTES:** CÂM. DEP. *Deputados brasileiros*; FONSECA, A.; FONTES JR.,\nA. *Senado*.\n","ref":"**FONTES:** CÂM. DEP. *Deputados brasileiros*; FONSECA, A.; FONTES JR.,\nA. *Senado*.\n","dic":"DHBPR"}
