{"title":"NOGUEIRA, Arlindo Francisco","cargoss":["Deputado federal","Governador de estado ou do Distrito Federal","Deputado federal"],"cargos_esp":[0,0,0],"datas_ini":[1900,1900,1905],"datas_fim":[1900,1904,1908],"estados":["PI","PI",0],"autor":["Raimundo Helio Lopes"],"content":"**NOGUEIRA, Arlindo Francisco**\n\n\\* dep. fed. PI 1900; gov. PI 1900-1904; dep. fed. 1905-1908.\n\n*Arlindo Francisco Nogueira* nasceu em Valença (PI) no dia 2 de dezembro\nde 1853.\n\nFormou-se em direito na Faculdade de Direito do Recife em 1877. Logo\napós concluir o curso foi nomeado promotor público em Valença e em 1879\nfoi transferido para a cidade de Parnaíba, onde exerceu o mesmo cargo\naté 1884. Nesse ano tornou-se juiz municipal em Alenquer (PA). Em 1887\nretornou ao Piauí e assumiu a promotoria pública de Amarante até 1889,\nquando foi nomeado juiz municipal de Valença por dois anos. Exerceu a\nmesma função em Campo Maior, em 1891, e em Picos, em 1892. Retornou a\nValença e aí também foi juiz municipal entre os anos de 1892 e 1896. Foi\nnomeado procurador geral do estado do Piauí junto ao Tribunal de Justiça\ne ocupou o cargo de 1896 a 1904.\n\nIniciou sua vida política durante o governo estadual de Raimundo Artur\nde Vasconcelos (1896-1900), quando foi secretário de polícia. Eleito\ndeputado federal pelo do Piauí, assumiu o mandato em maio de 1900, mas\nrenunciou por ter sido eleito governador do estado. Tomou posse em 1^o^\nde julho e teve seu governo marcado por uma grave seca que atingiu a\nRegião Nordeste. Deu início ao serviço de abastecimento de água de\nTeresina e promoveu reformas no ensino público. Em 1^o^ de julho de 1904\ntransferiu o governo ao sucessor Álvaro de Assis Osório Mendes, e no ano\nseguinte elegeu-se novamente deputado federal. Com sucessivas\nreeleições, ocupou uma cadeira na Câmara até 1908.\n\nFaleceu na cidade de Teresina em 19 de outubro de 1917.\n\nRaimundo Helio Lopes\n\n**FONTES:** ABRANCHES, J. *Governos*; BASTOS, C. *Dicionário*; CÂM. DEP.\n*Deputados brasileiros*; CHAVES, J. *Apontamentos*.\n","ref":"**FONTES:** ABRANCHES, J. *Governos*; BASTOS, C. *Dicionário*; CÂM. DEP.\n*Deputados brasileiros*; CHAVES, J. *Apontamentos*.\n","dic":"DHBPR"}
