{"title":"OITICICA, Francisco de Paula Leite e","cargoss":["Constituinte","Deputado federal","Senador"],"cargos_esp":[0,0,0],"datas_ini":[1891,1891,1894],"datas_fim":[1891,1893,1900],"estados":[0,"AL","AL"],"autor":[0],"content":"**OITICICA, Francisco de Paula Leite e**\n\n\\*const. 1891; dep. fed. AL 1891-1893; sen. AL 1894-1900.\n\n*Francisco de Paula Leite e Oiticica* nasceu no engenho Mundaú, em Santa\nLuzia do Norte (AL), no dia 2 de abril de 1853, filho de Manuel\nRodrigues Leite e Oiticica e de Francisca Hermínia do Rego Leite e\nOiticica.\n\nDiplomado pela Faculdade de Direito do Recife em 1872, com 19 anos,\nregressou a Alagoas e tornou-se promotor público da comarca de Anadia.\nFoi também deputado provincial na legislatura 1874-1875. Passou em\nseguida um período em Oliveira (MG) como juiz municipal, mas regressou a\nMaceió em 1884. Nomeado chefe de polícia interino pelo presidente da\nprovíncia José Moreira Alves da Silva (1886-1887), lançou campanha pela\ncriação de um asilo para os loucos, que até então eram recolhidos em\ncondições desumanas à cadeia pública. O asilo foi inaugurado em 27 de\nmarço de 1887 sob sua direção, e em seguida começaram os esforços para a\nconstrução de um prédio próprio. O Asilo Santa Leopoldina seria\ninaugurado em 10 de fevereiro de 1889.\n\nProclamada a República, foi mais uma vez nomeado chefe de polícia de\nAlagoas, no governo de Pedro Paulino da Fonseca (1889-1890). Em 15 de\nsetembro de 1890 foi eleito deputado por Alagoas ao Congresso Nacional\nConstituinte, e tomou posse em 15 de novembro. Após a promulgação da\nConstituição, em 24 de fevereiro de 1891, passou, em junho, a ocupar uma\ncadeira na Câmara dos Deputados, com mandato até dezembro de 1893.\nEleito senador na vaga de na vaga de Floriano Peixoto, que em novembro\nde 1893 assumiu a presidência da República, exerceu o mandato de maio de\n1894 até janeiro de 1900 e participou da Comissão de Finanças do Senado.\nQuando, em 1906, tentou-se eleger J. J. Seabra senador por Alagoas,\nrebelou-se contra essa candidatura e apresentou a sua própria, mas o\nresultado final foi a anulação do pleito.\n\nMembro fundador da Academia Alagoana de Letras, foi o primeiro ocupante\nda cadeira 38. Foi também sócio do Instituto Arqueológico e Geográfico\nde Alagoas, e presidente da instituição de 8 de dezembro de 1922 até\nfalecer, e membro da Sociedade Alagoana de Agricultura. Foi professor\ncatedrático de alemão no Liceu Alagoano e professor no Liceu de Artes e\nOfícios, no Rio de Janeiro.\n\nFaleceu no Rio de Janeiro no dia 15 de julho de 1927.\n\nEscreveu nos jornais *O Rebate, Diário da Manhã, Diário de Pernambuco,\nJornal do Comércio,* do Rio de Janeiro, e *Correio de Maceió.* Além de\nnumerosos artigos na *Revista do Instituto Arqueológico e Geográfico de\nAlagoas*, publicou, entre outros trabalhos, *D. Clara Camarão* (drama,\n1877); *Pai* (s.d., drama); *Discurso pronunciado na sessão comemorativa\nda emancipação política de Alagoas, em 16/9/1898* (1898); *Manifesto\npolítico* *dirigido aos eleitores do estado de Alagoas para a eleição de\num senador da República, a realizar-se em 1^o^de setembro de 1906*\n(1906); *A situação financeira (males e remédios)* (1923); ‘A arte da\nrenda do Nordeste’ **(***Livro do Nordeste,* comemorativo do primeiro\ncentenário do *Diário de Pernambuco,* 1925); *Messias de Gusmão*\n(discurso pronunciado na Academia Alagoana de Letras sobre o patrono de\nsua cadeira, na sessão solene de 7/9/1925**,** 1926).\n\nReynaldo de Barros\n\n**FONTES:** BARROS, F. *A B C das Alagoas*; CÂM. DEP. *Deputados\nbrasileiros*; LEITE NETO, L. *Catálogo biográfico* (v.2, p.887/8).\n","ref":"**FONTES:** BARROS, F. *A B C das Alagoas*; CÂM. DEP. *Deputados\nbrasileiros*; LEITE NETO, L. *Catálogo biográfico* (v.2, p.887/8).\n","dic":"DHBPR"}
