{"title":"OLIVEIRA, Artur Deocleciano de","cargoss":["Membro de junta governativa"],"cargos_esp":[0],"datas_ini":[1891],"datas_fim":[1892],"estados":["SC"],"autor":["Carolina Vianna Dantas"],"content":"**OLIVEIRA, Artur Deocleciano de**\n\n\\* militar; junta gov. SC 1891-1892.\n\n*Artur Deocleciano de Oliveira* nasceu na cidade de Desterro, atual\nFlorianópolis, no dia 3 de fevereiro de 1866, filho de Manuel José de\nOliveira e de Mariana Amália da Fonseca Oliveira.\n\nIngressou na Marinha de Guerra como guarda-marinha em 1885. De 29 de\ndezembro de 1891 a 1^o^ de março de 1892 integrou, junto com o coronel\nLuís dos Reis Falcão e Cristóvão Nunes Pires, a junta governativa\nprovisória que, em razão da renúncia do governador Lauro Müller,\ngovernou de Santa Catarina até a posse do interventor Manuel Joaquim\nMachado.\n\nFoi reformado, a pedido, em 1914.\n\nFaleceu no Rio de Janeiro, então Distrito Federal, no dia 3 de janeiro\nde 1920.\n\nCarolina Vianna Dantas\n\n**FONTES:** ABRANCHES, J. *Governos*; PIAZZA, W. *Dicionário*;\nSTOETERAU, L. *Trajetória*; Wikipédia. Disponível em:\n\\<http://pt.wikipedia.org/wiki/Walter\\_Piazza”\\\\o“Walter Piazza\\>.\n","ref":"**FONTES:** ABRANCHES, J. *Governos*; PIAZZA, W. *Dicionário*;\nSTOETERAU, L. *Trajetória*; Wikipédia. Disponível em:\n\\<http://pt.wikipedia.org/wiki/Walter\\_Piazza”\\\\o“Walter Piazza\\>.\n","dic":"DHBPR"}
