{"title":"OLIVEIRA, Francisco Régis de","cargoss":["Ministro das Relações Exteriores"],"cargos_esp":[0],"datas_ini":[1912],"datas_fim":[1913],"estados":[0],"autor":["Cristina Luna"],"content":"**OLIVEIRA, Francisco Régis de**\n\n\\*diplomata; min. Rel. Ext. 1912-1913.\n\n*Francisco Régis de Oliveira* nasceu no Rio de Janeiro, então capital do\nImpério, em 1852.\n\nFez carreira diplomática e, em 1871, já era adido de primeira classe na\nÁustria-Hungria. Em 1885 dirigiu interinamente a missão brasileira no\nParaguai e no ano seguinte assinou em Assunção um protocolo sobre\nnavegação e comércio de cabotagem entre Paraguai e Brasil. Promovido a\nministro residente em 1888, competiu-lhe assinar em Madri, um ano\ndepois, o protocolo final da conferência internacional para a proteção\nda propriedade industrial.\n\nElevado a ministro plenipotenciário, passou em 1890 a São Petersburgo e,\ndepois, a Viena. Em 1893 foi transferido para a Itália e aí permaneceu\naté 1898, quando retornou a Viena até 1902. Em 1905 passou a servir em\nLondres e, em 1908, foi cumulativamente creditado na Noruega, onde\nassinou na cidade de Cristiania uma convenção geral de arbitramento. Em\n1910, na Inglaterra, representou o Brasil nos funerais do rei Eduardo\nVII e na coroação do rei Jorge V. Retornou a Roma em 1911, como\nembaixador em missão especial, por ocasião do cinquentenário da\nUnificação Italiana.\n\nEm 1912, no governo Hermes da Fonseca, foi nomeado subsecretário de\nEstado das Relações Exteriores, sendo titular da pasta Lauro Müller.\nComo ministro interino, baixou a Nova Consolidação Consular e\nDiplomática.\n\nFaleceu em Portugal em 1916.\n\nEra casado com Amélia da Silva Guimarães. Seu filho Raul Régis de\nOliveira também seguiu a carreira diplomática.\n\nCristina Luna\n\n**FONTES:** MIN. REL. EXT. *Ministros*; MIN. REL. EXT. *Relatório*\n(1871).\n","ref":"**FONTES:** MIN. REL. EXT. *Ministros*; MIN. REL. EXT. *Relatório*\n(1871).\n","dic":"DHBPR"}
