{"title":"OLIVEIRA, Pedro Luís de","cargoss":["Deputado federal"],"cargos_esp":[0],"datas_ini":[1915],"datas_fim":[1917],"estados":["MG"],"autor":[0],"content":"**OLIVEIRA, Pedro Luís de**\n\n\\*dep. fed. MG 1915-1917.\n\n*Pedro Luís de Oliveira* nasceu em Conceição do Serro, atual Conceição\ndo Mato Dentro (MG), em 1872.\n\nFez os estudos secundários no Ginásio de Ouro Preto (MG), onde também se\nformou em farmácia. Frequentou durante um ano a Faculdade Livre de\nDireito de Minas Gerais mas, transferindo-se para o Rio de Janeiro,\nentão Distrito Federal, ingressou na Faculdade de Medicina, pela qual se\nformou em 1900. Retornou a Minas Gerais e passou a exercer a clínica\nmédica em sua cidade natal.\n\nIngressou na política em 1903 ao ser eleito deputado estadual. Assumiu,\nnesse mesmo ano, sua cadeira na Assembleia Legislativa mineira e exerceu\no mandato até 1906. Voltou a ser eleito em 1911 e permaneceu no\nLegislativo estadual até 1914. No ano seguinte foi eleito deputado\nfederal por Minas Gerais. Assumindo, em 3 de maio do mesmo ano, sua\ncadeira na Câmara dos Deputados no Rio de Janeiro, passou a integrar a\nComissão de Saúde Pública.\n\nFaleceu em Conceição do Serro em 25 de maio de 1917, no exercício do\nmandato.\n\nIoneide Piffano Brion de Souza\n\n**FONTES:** BARBOSA, W. *História de Minas*; CÃM. DEP. *Deputados\nbrasileiros*; HORTA, C. *Famílias* (p.111-142); MONTEIRO, N.\n*Dicionário*; NOGUEIRA, G. *Genealogias*; VASCONCELOS, D. *História*.\n","ref":"**FONTES:** BARBOSA, W. *História de Minas*; CÃM. DEP. *Deputados\nbrasileiros*; HORTA, C. *Famílias* (p.111-142); MONTEIRO, N.\n*Dicionário*; NOGUEIRA, G. *Genealogias*; VASCONCELOS, D. *História*.\n","dic":"DHBPR"}
