{"title":"OLIVEIRA, Sérgio Ulrich de","cargoss":["Deputado federal","Deputado federal"],"cargos_esp":[0,0],"datas_ini":[1927,1921],"datas_fim":[1930,1923],"estados":["RS","RS"],"autor":["Raimundo Helio Lopes"],"content":"**OLIVEIRA, Sérgio Ulrich de**\n\n\\*dep. fed. RS 1921-1923 e 1927-1930.\n\n*Sérgio Ulrich de Oliveira* nasceu em Uruguaiana (RS) no dia 11 de maio\nde 1873, filho de José Sérgio de Oliveira e de Isolete de Lara Ulrich.\n\nFormou-se na Faculdade de Direito de São Paulo no ano de 1894,\ntornando-se promotor público em Uruguaiana em 1896.\n\nEm 1901 foi eleito deputado estadual no Rio Grande do Sul na legenda do\nPartido Republicano Rio-Grandense (PRR). Assumiu, nesse mesmo ano, sua\ncadeira na Assembleia Legislativa gaúcha, para a qual foi reeleito,\nsucessivamente, até 1920. Foi um dos principais líderes do PRR em sua\ncidade natal.\n\nEm 1921 foi eleito deputado federal pelo estado do Rio Grande do Sul.\nAssumiu, em maio desse mesmo ano, sua cadeira na Câmara dos Deputados no\nRio de Janeiro, então Distrito Federal, e exerceu seu mandato até\ndezembro de 1923, quando se encerrou a legislatura. Participou da\nRevolução de 1923, guerra civil que opôs no Rio Grande do Sul os\nrepublicanos, liderados pelo então presidente do estado Antônio Augusto\nBorges de Medeiros (1916-1928), aos federalistas, liderados por Joaquim\nFrancisco de Assis Brasil. Estes, denunciando fraude, rebelaram-se\ncontra a reeleição de Borges de Medeiros para o quinto mandato como\npresidente do estado. A luta se estendeu de janeiro a novembro de 1923 e\nfoi encerrada com a assinatura do Pacto de Pedras Altas pelos líderes\nAssis Brasil e Borges de Medeiros. Esse acordo determinou a permanência\nde Borges no governo, mas vedou nova reeleição. Durante o conflito,\nSérgio Ulrich foi comandante da Guarda Republicana, juntamente com o\nentão intendente municipal José Antonio Flores da Cunha, de 29 de março\na 3 de abril de 1923, na defesa de Uruguaiana cercada pelas forças\nfederalistas sob o comando de Honório Lemos.\n\nEm 1926 foi secretário de Obras Públicas do governo Borges de Medeiros\n(1913-1928). Só em janeiro de 1927 voltou a ser eleito deputado federal\npelo Rio Grande do Sul, sempre na legenda do PRR, assumindo, em maio\ndesse ano, sua cadeira na Câmara dos Deputados no Rio de Janeiro. Em\n1930 foi reeleito, mas teve seu mandato interrompido em outubro desse\nano com a vitória da Revolução de 1930 que depôs o presidente Washington\nLuís (1926-1930), levou Getúlio Vargas ao poder e fechou todos os órgãos\nlegislativos do país.\n\nDepois da Revolução de 1930 passou a militar na oposição ao governo de\nGetúlio Vargas. Participou da Frente Única Rio-Grandense e concorreu à\nConstituinte de 1933, mas não foi eleito.\n\nFaleceu em 1955.\n\nEra casado com Antônia Majo.\n\nRaimundo Helio Lopes\n\n**FONTES:** ABRANCHES, J. *Governos*; AITA, C.; AXT, G.; ARAÚJO, V.\n*Parlamentares*; CÂM. DEP. *Deputados*.\n","ref":"**FONTES:** ABRANCHES, J. *Governos*; AITA, C.; AXT, G.; ARAÚJO, V.\n*Parlamentares*; CÂM. DEP. *Deputados*.\n","dic":"DHBPR"}
