{"title":"OTONI, Cristiano Benedito","cargoss":["Deputado Geral","Deputado Geral","Senador","Senador"],"cargos_esp":[0,0,0,0],"datas_ini":[1861,1848,1879,1892],"datas_fim":[1868,1848,1889,1896],"estados":["MG","MG","ES","MG"],"autor":["Luciana Pinheiro"],"content":"**OTONI, Cristiano Benedito**\n\n\\*militar; dep. geral MG 1848 e 1861-1868; sen. ES 1879-1889; sen. MG\n1892-1896.\n\n*Cristiano Benedito Otoni* nasceu em Serro (MG) no dia 17 de maio de\n1811, filho de Jorge Benedito Otoni e de Rosália Benedito Otoni. Seu pai\nfoi vereador no município de Vila do Príncipe. Seu irmão, o primeiro\nTeófilo Benedito Otoni, foi deputado geral (1838-1841, 1845-1848,\n1861-1863) e senador (1864-1869) por Minas Gerais, e fundou a vila de\nFiladélfia, origem do município que posteriormente recebeu seu nome;\noutro irmão, o padre Honório Benedito Otoni, foi também deputado geral\n(1880-1883).\n\nTransferindo-se em 1828 para o Rio de Janeiro, então capital do Império,\ningressou na Academia de Marinha, de onde saiu guarda-marinha. Formou-se\ntambém em engenharia pela Escola Militar. De 1830 a 1833 foi professor\nde geometria em Ouro Preto e em 1834 foi nomeado lente substituto da\nAcademia de Marinha. Nesse mesmo ano deu início à carreira política como\ndeputado provincial na província do Rio de Janeiro, por um biênio. Após\no término do mandato retomou as atividades docentes, sendo promovido em\n1844 a professor catedrático da Academia de Marinha. Em 1846 foi nomeado\noficial de gabinete do Ministério da Marinha.\n\nEm 1848 exerceu por poucos meses o mandato de deputado geral Minas\nGerais. No início da década de 1850 passou a trabalhar na Companhia\nEstrada de Ferro Pedro II, ficando responsável pela organização da\nconstrução de ferrovias destinadas a integrar as províncias brasileiras.\nEm 1855, quando do início das obras ferroviárias, foi nomeado primeiro\ndiretor da companhia, cargo que exerceria por dez anos. Ainda em 1855\nreformou-se como capitão-tenente da Marinha.\n\nVoltou a exercer mandato eletivo em 1861, quando se candidatou pelo\nPartido Liberal e foi eleito deputado geral por Minas. Reeleito para\nmais duas legislaturas, ocupou uma cadeira na Assembleia Geral até\ndezembro de 1868. Em 1870 participou ativamente da produção do Manifesto\nRepublicano. Em 1879 foi eleito senador pela província do Espírito Santo\ne exerceu o mandato no Senado até 1889. Professor honorário da Academia\nde Belas Artes, teve seu nome incluído por dom Pedro II no Conselho do\nImperador. Além disso, recebeu os títulos de oficial da Ordem de São\nLeopoldo da Bélgica e de dignitário da Ordem do Cruzeiro.\n\nProclamada a República em 15 de novembro de 1889 e promulgada a primeira\nConstituição Republicana em 24 de fevereiro de 1891, candidatou-se pelo\nPartido Republicano Mineiro (PRM) à vaga deixada no Senado por Cesário\nAlvim, que em junho foi eleito presidente do estado de Minas Gerais.\nTomou posse em setembro de 1892 e integrou a Comissão de Obras Públicas\ne Empresas Privilegiadas.\n\nFaleceu no Rio de Janeiro em 18 de maio de 1896, em pleno exercício do\nmandato.\n\nConsiderado reformador do ensino da matemática no Brasil, publicou cerca\nde duas dezenas de trabalhos, entre os quais se destacam *Teoria das\nmáquinas a vapor* (1844); *Juízo crítico sobre o compêndio de geometria\nadotado pela Academia de Marinha do Rio de Janeiro* (1845); *Elementos\nde aritmética* (1952); *Estrada de Ferro D. Pedro II – Coleção de\nartigos de fundo do “Correio Mercantil”* (1857); *O futuro das estradas\nde ferro no Brasil* (1859).\n\nTambém tiveram destaque na política mineira seus sobrinhos Teófilo\nCarlos Benedito Otoni, deputado geral (1878-1881) e presidente da\nprovíncia de Minas Gerais em 1882; Epaminondas Esteves Otoni, deputado\nestadual (1895-1906) e deputado federal (1906-1920); Carlos Honório\nBenedito Otoni, vice-presidente de Minas Gerais e deputado federal\n(1901-1905), e Teófilo Benedito Otoni, deputado federal (1900-1922).\n\nLuciana Pinheiro\n\n**FONTES:** ASSOC. NAC. PRESERVAÇÃO FERROV. Disponível em:\n\\<www.anpf.com.br/\\>. Acesso em: 24/7/2010; MAR. BRAS. Disponível em:\n\\<www.mar.mil.br/\\>. Acesso em: 25/7/2010; MONTEIRO, N. *Dicionário*\n(v.2, p.492-493); PREF. CRISTIANO OTONI. Disponível em:\n\\<www.cristianootoni.mg.gov.br/\\>. Acesso em: 24/7/2010; SENADO.\n\\<www.senado.gov.br/\\>. Acesso em: 24/7/2010.\n","ref":"**FONTES:** ASSOC. NAC. PRESERVAÇÃO FERROV. Disponível em:\n\\<www.anpf.com.br/\\>. Acesso em: 24/7/2010; MAR. BRAS. Disponível em:\n\\<www.mar.mil.br/\\>. Acesso em: 25/7/2010; MONTEIRO, N. *Dicionário*\n(v.2, p.492-493); PREF. CRISTIANO OTONI. Disponível em:\n\\<www.cristianootoni.mg.gov.br/\\>. Acesso em: 24/7/2010; SENADO.\n\\<www.senado.gov.br/\\>. Acesso em: 24/7/2010.\n","dic":"DHBPR"}
