{"title":"PASSOS, Francisco de Oliveira","cargoss":["Presidente de associação ou confederação de empregados ou empregadores","Presidente de associação ou confederação de empregados ou empregadores","Presidente de associação ou confederação de empregados ou empregadores","Constituinte"],"cargos_esp":["CIB","FIRJ","CIB",0],"datas_ini":[1926,1931,1933,1934],"datas_fim":[1931,1935,1935,1934],"estados":[0,0,0,0],"autor":[0],"content":"**PASSOS, Francisco de Oliveira**\n\n\\*pres. CIB 1926-1931; pres. FIRJ 1931-1935; pres. CIB 1933-1935; const.\n1934.\n\n*Francisco de Oliveira Passos* nasceu no Rio de Janeiro, então capital\ndo Império, no dia 2 de julho de 1878, filho de Francisco Pereira Passos\ne de Maria Rita de Andrade Passos. Seu pai foi prefeito do Distrito\nFederal de 1902 a 1906.\n\nFez os estudos preparatórios no Colégio Abílio e no Internato Pedro II,\nambos no Rio de Janeiro. Depois seguiu para a Alemanha, onde se formou\nengenheiro civil em março de 1901 pela Real Escola Superior Politécnica\nda Saxônia, em Dresden.\n\nDe volta ao Brasil, trabalhou como engenheiro na Leopoldina Railway e,\nmais tarde, na Estrada de Ferro Central do Brasil. De 1904 a 1908, foi\nconsultor técnico da Prefeitura do Distrito Federal. Seus dois primeiros\nanos de consultoria ocorreram durante a gestão de Pereira Passos, seu\npai, cuja administração transformou profundamente a cidade.\n\nSob o pseudônimo de Áquila, obteve o primeiro lugar na concorrência\nefetuada pela prefeitura para a escolha do projeto do Teatro Municipal\ndo Rio de Janeiro. Na realidade, foram dois os projetos vencedores do\nprimeiro prêmio, devido à decisão da comissão julgadora de reunir o\nprimeiro e o segundo prêmios num só. O segundo projeto ganhador,\nentretanto, não obteve aprovação. Seu projeto, com algumas alterações,\nfoi finalmente aprovado em novembro de 1904. Em julho de 1909, já no\ngoverno de Nilo Peçanha, inaugurou-se o Teatro Municipal.\n\nCom o falecimento de seu irmão, Paulo Pereira Passos, Francisco de\nOliveira Passos tornou-se industrial e passou a dirigir a firma Comércio\ne Indústria Paulo Passos S.A., especializada na indústria e no comércio\nde madeiras e outros materiais de construção. Tornou-se também\npresidente do Sindicato das Indústrias de Serraria e do Centro dos\nIndustriais de Serraria do Rio de Janeiro. A partir de 1926, assumiu uma\nposição de liderança dentro da classe empresarial. No último período de\nexistência do Centro Industrial do Brasil (CIB), de 1926 a 1931, foi\npresidente dessa entidade, dinamizando-a e projetando-a nacionalmente. O\nCIB surgira, em agosto de 1904, da fusão entre a Sociedade Auxiliadora\nda Indústria Nacional, criada em 1827, e o Centro Industrial de Fiação e\nTecelagem do Rio de Janeiro. Em 1928, tornou-se também membro do\nConselho Nacional do Trabalho, órgão criado em 1923 em substituição ao\nDepartamento Nacional do Trabalho.\n\nA situação de crise social imperante na década de 1920, devido ao\ncrescente aumento do custo de vida e à consequente redução do poder\naquisitivo da população, refletia-se na indústria, cujas encomendas eram\ncanceladas. Além disso, havia os problemas da retração do crédito e da\nconcorrência das manufaturas estrangeiras, beneficiadas pelas baixas\ntarifas e pela elevação da taxa de câmbio ocorrida em 1925.\n\nEm 1928, na condição de presidente do CIB, Oliveira Passos solicitou ao\ngoverno medidas “de defesa” da indústria nacional. Suas sugestões foram\nendossadas pelo *Jornal do Comércio*, apesar de esse órgão conservador,\nde tendências anti-industrialistas, ter sempre combatido a política\nprotecionista. O memorial então apresentado por Oliveira Passos ao\npresidente Washington Luís pleiteava, entre outras, as seguintes medidas\nprotecionistas: facilidade de crédito pelo Banco do Brasil,\nestabilização cambial e elevação das tarifas aduaneiras para as\nmanufaturas de lã e algodão.\n\nEm agosto de 1929, uma comissão de representantes das classes\nconservadoras entregou a Washington Luís uma mensagem de solidariedade\nque fora aprovada na Associação Comercial do Rio de Janeiro (ACRJ). Da\ncomissão faziam parte, além da diretoria da ACRJ, Francisco de Oliveira\nPassos, pelo CIB, Carlos Teles da Rocha Faria e Vicente Galliez, que\nrepresentavam o Centro dos Industriais de Fiação e Tecelagem de Algodão\n(CIFTA).\n\nEm 12 de dezembro de 1931, o CIB transformou-se em Federação Industrial\ndo Rio de Janeiro (FIRJ), devido à necessidade de se congregarem as\natividades industriais localizadas no estado e na cidade do Rio de\nJaneiro. No triênio 1931-1934, a diretoria da FIRJ foi basicamente a\nmesma do antigo CIB, tendo Oliveira Passos como presidente e, entre seus\nmembros, os industriais Guilherme Guinle, Carlos Teles da Rocha Faria,\nEuvaldo Lodi, Vicente Galliez e Raimundo Otoni de Castro Maia.\n\nApós a Revolução de 1930, concretizou-se a tentativa de organização\npolítica do empresariado, com a fundação, em 1932, do Partido\nEconomista. Visando congregar todas as classes produtoras, o Partido\nEconomista contou com ampla participação do Centro dos Industriais de\nFiação e Tecelagem de São Paulo, do Centro das Indústrias de Calçados e\nComércio de Couro, do CIFTA e da FIRJ. Foi Oliveira Passos quem teve\natuação mais destacada. Dizia então: “Já é tempo de as classes\ntrabalhadoras deixarem a posição subalterna de parte meramente passiva\nda sociedade política, com a incumbência exclusiva de proporcionar os\nrecursos que o país necessita para o seu desenvolvimento”.\n\nEm 1933, a FIRJ enviou ao governo provisório um relatório em que\ndescrevia a situação de crise econômica do país. Em relação ao crédito\nbancário, a FIRJ aconselhava minimizar a escassez de reservas cambiais.\nComo presidente da entidade, Oliveira Passos afirmou haver necessidade\nde um protecionismo “inteligente, racional e lógico”, considerando ainda\n“necessidade a defesa alfandegária, toda vez que ela coincida com os\ninteresses da própria coletividade nacional”.\n\nEm 25 de janeiro de 1933, foi fundada a Confederação Industrial do\nBrasil (CIB), de acordo com proposta de Oliveira Passos. Como delegado\nda FIRJ, participou da sessão de instalação da nova CIB, tendo sido\neleito seu primeiro presidente. Uma das finalidades dessa confederação\nera o estabelecimento de uma associação mais sólida entre os diversos\ngrupos empresariais do Brasil. Mais tarde, em 1938, a CIB passaria a\nchamar-se Confederação Nacional da Indústria.\n\nAinda em 1933, Oliveira Passos, pela CIB, e Serafim Valandro, presidente\nda Federação das Associações Comerciais do Brasil, enviaram telegrama ao\nchefe do governo provisório protestando contra a disposição\ngovernamental de limitar aos sindicatos legalmente reconhecidos a\nfaculdade de eleger os representantes dos empregadores à Assembleia\nNacional Constituinte. Em 19 de abril, diante da irredutibilidade do\ngoverno em relação ao assunto, o conselho deliberativo da CIB pediu às\nfederações e associações filiadas que promovessem, com a máxima\nurgência, a sindicalização dos diversos setores que representavam. Na\nmesma data, vários membros da CIB foram designados para incentivar a\nfundação dos sindicatos industriais, cabendo a Oliveira Passos fazê-lo\njunto à FIRJ. Em julho de 1933, Oliveira Passos foi eleito deputado\nclassista à Assembleia Nacional Constituinte.\n\nEm 1934, a FIRJ conseguiu a abolição da cláusula-ouro, substituída por\ntécnica mais simples de controle cambial. O governo provisório atendeu\nàs reivindicações dos industriais contra os impostos estaduais e\nintermunicipais e contra a cobrança em ouro dos serviços de fornecimento\nde energia elétrica para fins industriais no Distrito Federal. No mesmo\nano, Francisco de Oliveira Passos foi reeleito presidente da FIRJ para o\nperíodo 1934-1936. Em 4 de fevereiro de 1935, renunciou ao cargo, tendo\nsido substituído por Carlos Teles da Rocha Faria. Também nesse ano\nRoberto Simonsen assumiu a presidência da CIB.\n\nOliveira Passos pertenceu ao Conselho Consultivo do Distrito Federal.\nFoi presidente do Conselho de Contribuintes e membro do conselho diretor\ndo Clube de Engenharia.\n\nFaleceu no dia 1^o^ de janeiro de 1958.\n\nSônia Dias\n\n**FONTES:** ASSEMB. NAC. CONST. 1934. *Anais*; CÂM. DEP. *Deputados*;\nCONF. INDUSTRIAL DO BRASIL. *Relatório*; CONSULT. MAGALHÃES, B.; DINIZ,\nE. *Empresário*; FED. INDUSTRIAL DO RJ. *Relatório*; GODINHO, V.\n*Constituintes*; LEME, M. *Ideologia*; LUZ, N. *Luta*; REIS, J. *Rio*.\n","ref":"**FONTES:** ASSEMB. NAC. CONST. 1934. *Anais*; CÂM. DEP. *Deputados*;\nCONF. INDUSTRIAL DO BRASIL. *Relatório*; CONSULT. MAGALHÃES, B.; DINIZ,\nE. *Empresário*; FED. INDUSTRIAL DO RJ. *Relatório*; GODINHO, V.\n*Constituintes*; LEME, M. *Ideologia*; LUZ, N. *Luta*; REIS, J. *Rio*.\n","dic":"DHBPR"}
