{"title":"PASSOS, Gervásio de Brito","cargoss":["Senador"],"cargos_esp":[0],"datas_ini":[1908],"datas_fim":[1915],"estados":["PI"],"autor":["Raimundo Helio Lopes"],"content":"**PASSOS, Gervásio de Brito**\n\n\\*sen. PI 1908-1915.\n\n*Gervásio de Brito Passos* nasceu em Piracuruca (PI) em 23 de junho de\n1837, filho do coronel Pedro de Brito Passos e de Ana Maria Machado de\nCerqueira. Sua família detinha grande influência na política regional.\n\nEm 1855 ingressou na Guarda Nacional como tenente e filiou-se ao Partido\nConservador. Nomeado capitão em 1860 e major em 1864, nesse último ano\nfoi designado juiz de paz. Durante a Guerra do Paraguai (1864-1870),\najudou no recrutamento de soldados no Piauí. Ainda durante o conflito,\nfoi nomeado tenente-coronel, em 1869. Em 1876 deixou o cargo de juiz de\npaz e elegeu-se vereador em Piracuruca. Em 1878, presidiu o Conselho\nMunicipal. Na década de 1880 exerceu o mandato de deputado provincial em\ntrês legislaturas: 1883-1883, 1884-1885 e 1888-1889. Em 1888 tornou-se\ncoronel da Guarda Nacional. Por seus serviços públicos, recebeu a\ncomenda de Ordem da Rosa do imperador Pedro II.\n\nDepois da proclamação da República (15/11/1889), exerceu o mandato de\ndeputado estadual entre 1896 e 1900, assumindo por um período a\npresidência da Assembleia Legislativa piauiense. Retornou à política\napenas em 1907, quando voltou a se eleger deputado estadual. Contudo,\nrenunciou ao mandato em 1908, por ter sido eleito senador pelo Piauí.\nOcupou uma cadeira no Senado até 1915 e durante esses anos fez parte da\nComissão de Redação. Em 1916, foi eleito pela Assembleia Legislativa\npiauiense para o cargo de desembargador do Tribunal Especial.\n\nFaleceu em Piracuruca em 7 de fevereiro de 1923.\n\nRaimundo Helio Lopes\n\n**FONTES:** ABRANCHES, J. *Governos*; BRITO, A. *Família*; CHAVES, J.\n*Apontamentos*; LEITE NETO, L. *Catálogo biográfico*; Piracuruca.\nDisponível em:\n\\<www.piracuruca.com/colunatexto.asp?codigo\\_=273&codigo\\_1=O%20Memorista\\>.\n","ref":"**FONTES:** ABRANCHES, J. *Governos*; BRITO, A. *Família*; CHAVES, J.\n*Apontamentos*; LEITE NETO, L. *Catálogo biográfico*; Piracuruca.\nDisponível em:\n\\<www.piracuruca.com/colunatexto.asp?codigo\\_=273&codigo\\_1=O%20Memorista\\>.\n","dic":"DHBPR"}
