{"title":"PASSOS, Sezefredo dos","cargoss":["Ministro da Guerra"],"cargos_esp":[0],"datas_ini":[1926],"datas_fim":[1930],"estados":[0],"autor":["Robert Pechman"],"content":"**PASSOS, Sezefredo dos**\n\n\\*militar; min. Guerra 1926-1930.\n\n*Nestor Sezefredo dos Passos* nasceu em Desterro, hoje Florianópolis, no\ndia 29 de fevereiro de 1872, filho de José Filipe dos Passos e de Maria\nVicência dos Passos.\n\nSentou praça em 1888, matriculando-se no curso preparatório anexo à\nentão Escola Militar da Corte. Em 1890, sua matrícula foi transferida\npara o primeiro ano do curso geral da Escola Tática e de Tiro de Rio\nPardo (RS). Em 1891, foi incluído no 6^o^ Regimento de Cavalaria, em\nSanta Vitória do Palmar (RS). Por ter-se envolvido na Revolução\nFederalista, iniciada em 1893 no Rio Grande do Sul, nesse mesmo ano foi\ndesligado do Exército.\n\nTransferiu-se então para Porto Alegre, onde se empregou no comércio e\ndeu aulas. Beneficiado pela anistia de outubro de 1895, voltou ao\nExército no posto de alferes-aluno. Foi servir no 36^o^ Batalhão de\nInfantaria, aquartelado em Florianópolis, em cuja imprensa colaborou,\nescrevendo em *O Estado*. Voltou à Escola Militar em 1899. Recebeu o\ngrau de bacharel em matemática e ciências físicas em 1902, ano em que\nobteve a promoção a segundo-tenente. Em 1903, passou a primeiro-tenente.\n\nNesse posto, tomou parte, em Mato Grosso, nas lutas que se travaram\nentre os “legalistas” de Generoso Pais Leme de Sousa Ponce e a oposição\n“nacional”. Esta, desgostosa de haver perdido as eleições para a\nAssembleia Constituinte do estado, aliou-se a um grupo de militares,\ndepôs as autoridades locais e obrigou o presidente do estado, Manuel\nJosé Murtinho, a renunciar.\n\nSezefredo dos Passos participou também da construção de linhas\ntelegráficas efetuada pela Missão Rondon, que percorreu o estado de Mato\nGrosso. Em 1904 serviu em Corumbá (MT) e, em 1905, dirigiu a construção\ndo ramal do forte de Coimbra (MT), o qual também comandou. Em 1906,\natuou em operações de guerra em Cuiabá, na mesma luta entre legalistas e\nnacionais que se vinha estendendo desde 1892. Foi promovido a capitão em\n1907.\n\nEm 1909, foi classificado na 10^a^ Companhia Isolada de Infantaria, em\nSão Paulo e desempenhou, interinamente, as funções de chefe do\nestado-maior da 10^a^ Inspeção Permanente. Ainda nesse ano, representou\nno Sul do país os interesses do Ministério da Marinha. Em 1910 seguiu\npara Santos (SP) a fim de proteger o porto e a fortaleza de Itaipus\ncontra possíveis ataques dos navios participantes da Revolta da Chibata,\nsublevação de marinheiros comandada por João Cândido.\n\nEm 1911, em Manaus, voltou a fazer parte da comissão de linhas\ntelegráficas encarregada do trecho Mato Grosso-Amazonas. Servindo em\nSanta Catarina em 1912, atuou em Campos Novos na luta contra os rebeldes\ndo Contestado, movimento popular de caráter messiânico. Em 1914, ano em\nque foi promovido a major, combateu os revoltosos em Taquaruçu e\nCaraguatá (SC) e, em 1915, lutou no reduto de Santa Maria (SC).\n\nTransferido em 1916 para o 2^o^ Regimento de Infantaria, na cidade do\nRio de Janeiro, então Distrito Federal, ali comandou o 5^o^ Batalhão. Em\n1917 foi promovido a tenente-coronel, servindo depois no gabinete do\ngeneral Alberto Cardoso de Aguiar, ministro da Guerra. Em 1919, recebeu\na patente de coronel. Foi transferido para o Rio Grande do Sul em 1920\ne, em 1921, matriculou-se no curso de revisão de estado-maior. Em 1922,\nexerceu o comando da Escola Militar do Estado Maior.\n\nEm julho de 1922, estava no comando do 1^o^ Regimento de Infantaria,\naquartelado na Vila Militar, no Distrito Federal, quando ali ocorreu o\nlevante dos tenentes, articulado com as rebeliões do forte de Copacabana\ne da Escola Militar do Realengo. Os sediciosos protestavam contra o\nfechamento do Clube Militar e a prisão do marechal Hermes da Fonseca, no\nprimeiro movimento do ciclo de revoltas armadas que marcou a década de\n1920 no país.\n\nNo dia 4 de julho de 1922, véspera da data marcada para a sublevação, o\ncoronel Sezefredo dos Passos recebeu ordem de prender, na estação da\nVila, os oficiais suspeitos das articulações. Na madrugada do dia 5,\nsurpreendeu no cassino da Vila Militar o tenente Frederico Cristiano\nBuys, que estava organizando os revoltosos. Estes foram presos, depois\nque Sezefredo dos Passos mandou cercar o local. O coronel contribuiu,\nassim, para dominar o levante, que ficou limitado à Escola Militar e ao\nforte de Copacabana, e foi sufocado no mesmo dia. Em agosto de 1922, foi\npromovido a general de brigada.\n\nEm 1924, comandando uma unidade de combate, participou da luta contra os\nrebeldes de São Paulo, que, em levante irrompido em 5 de julho,\npretendiam depor o presidente Artur Bernardes. Esse movimento\ndesdobrou-se em duas fases. Na primeira, os revolucionários ocuparam a\ncapital e algumas cidades de São Paulo; na segunda, os sediciosos\npaulistas, retirando-se para o interior, uniram-se aos gaúchos para\nformar a Coluna Prestes, que ao longo de 12 meses percorreu o interior\ndo Brasil.\n\nEm março de 1925, Sezefredo dos Passos, com o general Cândido Mariano da\nSilva Rondon, dirigiu as operações de guerra contra esses revoltosos,\nque haviam assumido o controle da situação no oeste do Paraná. Ocupando\numa vasta região que ia de Guaíra a Foz do Iguaçu, os revolucionários\nderam início à Campanha do Paraná, “uma das mais violentas de que há\nmemória nos fastos militares do Brasil”, segundo Lourenço Moreira Lima\nem seu livro *A Coluna Prestes*. Os soldados do governo constituíam um\ncorpo de cerca de 12 mil homens, composto das melhores tropas do país e\nmunido de todos os recursos necessários à campanha. No entanto, apesar\nde sua grande superioridade, o corpo legalista foi rechaçado por algum\ntempo, até a chegada de reforços, quando as tropas governamentais\nforçaram a queda de Catanduvas, principal reduto revolucionário.\n\nEm 1926 Sezefredo dos Passos foi promovido a general de divisão, tendo\nfeito parte da Comissão de Promoções do Exército. Com a ascensão de\nWashington Luís à presidência da República, foi designado ministro da\nGuerra, assumindo a pasta em 15 de novembro de 1926.\n\nDurante sua gestão, foi promulgada (1927) a Lei n^o^ 1.569, que criava a\narma de aviação do Exército, dando impulso definitivo ao uso militar da\naviação no Brasil. Na oportunidade, adquiriu-se copioso material para\nessa arma e ampliou-se o Campo dos Afonsos (Rio). Foi criada, ainda, a\nEscola de Educação Física do Exército.\n\nComo ministro da Guerra, Sezefredo dos Passos recusou-se a fornecer\narmas a João Pessoa, presidente da Paraíba, para debelar a luta armada\nque havia irrompido em Princesa, hoje Princesa Isabel (PB), em 9 de\njunho de 1930. João Pessoa havia sido candidato à vice-presidência da\nRepública na chapa da Aliança Liberal, liderada por Getúlio Vargas, e os\naliancistas acusavam o governo federal de ter fomentado a rebelião de\nPrincesa.\n\nCom a Revolução de outubro de 1930 e a deposição de Washington Luís,\ndeixou o ministério, foi reformado (27/11/1930) e, depois, exilado,\nradicando-se em Portugal. Em outubro de 1932, foi um dos brasileiros que\nacolheram, no cais de Lisboa, os revolucionários de 1932, exilados pelo\ngoverno. Depois de vários anos, regressou ao Brasil e recolheu-se à vida\nprivada.\n\nFaleceu no Rio de Janeiro, no dia 18 de outubro de 1941.\n\nRobert Pechman\n\n**FONTES:** ARQ. GETÚLIO VARGAS; CABRAL, O. *História*; CONSULT,\nMAGALHÃES, B.; COUTINHO, L. *General*; *Encic. Mirador*; FERREIRA FILHO,\nA. *História*; *Grande encic. Delta*; JAMUNDÁ, T.*Catarinenses*; *Jornal\ndo Comércio*, Rio (19/9/1941); SILVA, H. *1922*; SILVA, H. *1932*;\nSILVA, Z. *Perfis*; TIAGO, A. *História*; WANDERLEY, N. *História*.\n","ref":"**FONTES:** ARQ. GETÚLIO VARGAS; CABRAL, O. *História*; CONSULT,\nMAGALHÃES, B.; COUTINHO, L. *General*; *Encic. Mirador*; FERREIRA FILHO,\nA. *História*; *Grande encic. Delta*; JAMUNDÁ, T.*Catarinenses*; *Jornal\ndo Comércio*, Rio (19/9/1941); SILVA, H. *1922*; SILVA, H. *1932*;\nSILVA, Z. *Perfis*; TIAGO, A. *História*; WANDERLEY, N. *História*.\n","dic":"DHBPR"}
