{"title":"PEDROSA, Jônatas de Freitas","cargoss":["Senador","Senador","Governador de estado ou do Distrito Federal"],"cargos_esp":[0,0,0],"datas_ini":[1907,1898,1913],"datas_fim":[1912,1906,1917],"estados":["AM","AM","AM"],"autor":["Maria Eugenia Bertarelli"],"content":"**PEDROSA, Jônatas de Freitas**\n\n\\*militar; sen. AM 1898-1906 e 1907-1912; gov. AM 1913-1917.\n\n*Jônatas de Freitas Pedrosa* nasceu na Bahia no dia 8 de abril de 1848.\n\nGraduou-se na Faculdade de Medicina da Bahia em 1873. Tornou-se médico\ndo Exército brasileiro e chegou a Manaus em 1876, como segundo-tenente\ncirurgião do Corpo de Saúde. Deixou o posto em agosto de 1878, quando\nfoi nomeado médico da Guarda Policial e comissário vacinador. Em maio de\n1879 foi nomeado professor da cadeira de francês do Liceu Amazonense. No\nmesmo ano ocupou o cargo de primeiro-suplente de juiz municipal em\nManaus. Em junho de 1882 tornou-se diretor da Escola Normal e em abril\nde 1885 assumiu interinamente o cargo de diretor da Instrução Pública.\nEm julho seguinte foi nomeado médico do Instituto Amazonense e, em\nagosto, inspetor da Saúde Pública. Em janeiro de 1889 fundou o Ateneu\nAmazonense, na cidade de Manaus.\n\nEm 1898 foi eleito senador federal pelo Amazonas e exerceu o mandato até\n1906. No ano seguinte retornou ao Senado Federal e aí permaneceu até\n1912, quando, por ter sido eleito governador do Amazonas, renunciou ao\nmandato. Assumiu o governo do estado em 1^o^ de janeiro de 1913, num\nperíodo marcado por intensa crise da borracha. A forte concorrência do\nproduto no mercado externo e, posteriormente, a instabilidade causada\npela Primeira Guerra Mundial foram alguns dos fatores responsáveis pela\ncrise econômica do Amazonas durante seu governo. Além disso, enfrentou\numa forte oposição liderada pelo coronel Antônio Guerreiro Antony, que\ncontava com o apoio do senador Rui Barbosa. Seu governo chegou ao fim no\ndia 1^o^ de janeiro de 1917, quando tomou posse o sucessor Pedro de\nAlcântara Bacelar.\n\nFaleceu na cidade de Manaus no dia 7 de julho de 1922.\n\nCasou-se duas vezes, a primeira com Ermelinda Pedrosa, com quem teve\nseis filhos, e a segunda com Carolina Pedrosa.\n\nMaria Eugenia Bertarelli\n\n**FONTES:** BITTENCOURT, A. *Dicionário*; CASA CIVIL. GOV. AM.\nDisponível em:\n\\<[www.casacivil.am.gov.br](http://www.casacivil.am.gov.br/)\\>. Acesso\nem: 10/8/2010; GOV. AM. Bib. Virtual. Disponível em:\n\\<[www.bv.am.gov.br](http://www.bv.am.gov.br/)\\>. Acesso em: 10/8/2010;\nSENADO. Disponível em:\n\\<[www.senado.gov.br](http://www.senado.gov.br/)\\>. Acesso em:\n29/7/2010.\n","ref":"**FONTES:** BITTENCOURT, A. *Dicionário*; CASA CIVIL. GOV. AM.\nDisponível em:\n\\<[www.casacivil.am.gov.br](http://www.casacivil.am.gov.br/)\\>. Acesso\nem: 10/8/2010; GOV. AM. Bib. Virtual. Disponível em:\n\\<[www.bv.am.gov.br](http://www.bv.am.gov.br/)\\>. Acesso em: 10/8/2010;\nSENADO. Disponível em:\n\\<[www.senado.gov.br](http://www.senado.gov.br/)\\>. Acesso em:\n29/7/2010.\n","dic":"DHBPR"}
