{"title":"PEIXOTO, Artur Vieira","cargoss":["Deputado federal"],"cargos_esp":[0],"datas_ini":[1897],"datas_fim":[1899],"estados":["AL"],"autor":[0],"content":"**PEIXOTO, Artur Vieira**\n\n\\*dep. fed. AL 1897-1899.\n\n*Artur Vieira Peixoto* nasceu no engenho Itamaracá, em Murici (AL), no\ndia 12 de setembro de 1865, filho de José Vieira de Araújo Peixoto e de\nTeresa Josefina Peixoto. Seu pai, senhor de engenho e influente político\nprovincial, criou, além dos filhos, o sobrinho e afilhado Floriano\nVieira Peixoto, que viria a ser também seu genro, posto que se casou com\nsua filha Josina Vieira Peixoto. Floriano Peixoto viria a ser ministro\nda Guerra (1890-1891), senador por Alagoas (1891-1893), vice-presidente\n(1891) e presidente (1891-1894) da República.\n\nArtur Peixoto fez os estudos primários e preparatórios em Maceió. Em\n1888 matriculou-se na Faculdade de Direito do Recife, mas após a\nproclamação da República (15/11/1889) transferiu-se para o Rio de\nJaneiro e foi auxiliar de gabinete do primo e cunhado marechal Floriano\nPeixoto, quando este ocupou o cargo de ministro da Guerra. Nomeado para\na Secretaria do Ministério da Guerra, prosseguiu seus estudos e em 1893\nformou-se pela Faculdade Livre de Direito do Rio de Janeiro. Durante a\nRevolta da Armada, deflagrada em setembro de 1893, fez parte do Batalhão\nAcadêmico e recebeu o título de major honorário do Exército.\n\nRegressando a Alagoas em 1896, foi chefe de polícia do estado. Em\nseguida foi eleito, pelo 1^o^ Distrito, deputado federal para a\nlegislatura que se estendeu de maio de 1897 a dezembro de 1899.\n\nFaleceu no dia 31 de dezembro de 1943.\n\nPublicou *Floriano Peixoto: vida e governo* (prefácio de Lauro Sodré, em\nparceria com Francolino Cameu, 1925) e *Floriano. Memórias e documentos.\nBibliografia do marechal Floriano Peixoto* (1939).\n\nReynaldo de Barros\n\n**FONTES:** BARROS, F. *A B C das Alagoas*; CÂM. DEP. *Deputados\nbrasileiros*.\n","ref":"**FONTES:** BARROS, F. *A B C das Alagoas*; CÂM. DEP. *Deputados\nbrasileiros*.\n","dic":"DHBPR"}
