{"title":"PEIXOTO, Carlos","cargoss":["Deputado federal","Deputado federal"],"cargos_esp":[0,0],"datas_ini":[1915,1903],"datas_fim":[1917,1911],"estados":["MG","MG"],"autor":[0],"content":"**PEIXOTO, Carlos**\n\n\\*dep. fed. MG 1903-1911 e 1915-1917.\n\n*Carlos Peixoto de Melo Filho* nasceu na cidade de Ubá, na Zona da Mata\ndo estado de Minas Gerais, no dia 1^o^ de junho de 1871, filho de Carlos\nPeixoto de Melo, que fora senador no Império, e de Agostina Brandão\nPeixoto de Melo, pertencente a uma tradicional família da região.\n\nConcluiu os estudos preparatórios no Ateneu Mineiro aos 13 anos de idade\ne precisou de uma autorização especial do ministro da Justiça para se\nmatricular em 1885 na Academia de Direito de São Paulo. Sua turma, que\nse formou em 1889, era das mais ilustres, com nomes como João Luís\nAlves, Edmundo Lins, Mendes Pimentel, Herculano de Freitas, Paulo Prado,\nAfonso Arinos e Otávio Mendes.\n\nRecém-formado, voltou à terra natal para exercer a advocacia durante\ndois anos, adquirindo logo a fama de grande orador. Na ocasião\nparticipou do júri que colocou em rivalidade na cidade as famílias\nSoares de Moura e Peixoto de Melo. Em seguida ingressou na magistratura\ncomo juiz municipal em Ubá. Em 1895 retomou a banca de advocacia,\nparticipou ativamente das lutas políticas locais e se elegeu agente\nexecutivo do município.\n\nEm 1903 foi eleito para a Câmara estadual mineira como representante do\n2^o^ distrito de Ubá e em pouco tempo ascendeu à posição de líder do\ngoverno Francisco Sales (1902-1906). Participou da discussão dos\nprojetos de reforma constitucional e de reforma eleitoral com grande\ndestaque, mas permaneceu na Câmara estadual apenas por quatro meses. Em\n3 de agosto de 1903 foi eleito deputado federal na vaga de Carlos Vaz de\nMelo, por sua vez eleito para o Senado Federal, e em setembro foi\nreconhecido. A bancada mineira na Câmara dos Deputados era composta de\n37 representantes, enquanto a segunda bancada, a paulista, era limitada\na 22. Foi o período do apogeu da política mineira no plano federal. Sua\nestreia provocou sensação quando do pedido de licença para processar um\ndeputado, em que se conclamava a bancada mineira à “*libertas quae sera\ntamen*”, ao que respondeu com o “*sub lege libertas*”. Na idade de 34\nanos foi elevado a líder do governo Rodrigues Alves (1902-1906).\n\nCom a ascensão à presidência da República de Afonso Pena, em 1906,\nconsolidou-se o prestígio mineiro. Afonso Pena escolheu ministros de\npouca idade, como Tavares de Lira para a Justiça e Davi Campista para a\nFazenda. Preterida a indicação de Rui Barbosa para o Ministério da\nJustiça, nomeou Miguel Calmon. Em discurso na Câmara, Augusto de Freitas\ndeclarou que parecia o país estar sendo convertido num verdadeiro\n“jardim de infância”. Faziam parte do Jardim de Infância Davi Campista,\nJoão Luís Alves, James Darcy, Gastão da Cunha, Miguel Calmon, Calógeras\nEstevão Lobo e Elói de Sousa. O grupo ainda contava com o apoio de\nintelectuais como Euclides da Cunha, Manuel Bonfim e Afrânio Peixoto,\nprevendo-se a criação de um Ministério da Educação, que seria entregue a\neste último.\n\nNo Congresso Nacional, estabeleceu-se então o confronto entre o senador\nPinheiro Machado, que até então havia detido a liderança política, e o\njovem deputado Carlos Peixoto, que em 1907 foi eleito presidente da\nCâmara. No final desse ano, Germano Hasslocher, adepto de Pinheiro\nMachado, censurou James Darcy por ficar indiferente aos ataques contra o\nseu chefe. Com temperamento impulsivo, James Darcy abandonou de vez a\nvida pública. Conta-se que Pinheiro Machado teria dito: “Despencou-se o\nprimeiro-galho do Jardim de Infância, agora vai a árvore”.\n\nA presidência de Afonso Pena foi período de grandes realizações,\nprevendo-se a sua sucessão por João Pinheiro, com quem se consolidaria o\nprocedimento de renovação. Mas com a morte de Afonso Pena em 1909, os\nplanos de modernização foram afastados. A tentativa de lançamento da\ncandidatura de Davi Campista não encontrou apoio. Carlos Peixoto foi\nreeleito presidente da Câmara e encontrou obstáculos nessa reeleição. O\ngrupo de Pinheiro Machado tentou uma reforma do regimento que diminuía\nos poderes do presidente da Casa, encontrando-se uma forma de transação.\n\nAo ser reeleito presidente da Câmara em 15 de março de 1909, Carlos\nPeixoto fez um discurso de posse afirmativo. Nele dizia “que somos\ncapazes de praticar a liberdade civil, impedindo que se degenere a\ndemagogia inconsciente que conduz à anarquia e assim abre caminho fácil\na perigosas aventuras de violência, fonte e matriz do cesarismo e da\ntirania”. Com o reconhecimento da bancada goiana, porém, Carlos Peixoto\nse sentiu desprestigiado e renunciou à presidência da Câmara. Declarou\nque, tendo deixado de dirigir a bancada mineira, renunciava ao posto,\nmas conservava o mandato, que pertencia a seus eleitores. Participou da\nCampanha Civilista de Rui Barbosa e falou na convenção realizada no\nTeatro Lírico no dia 22 de agosto de 1909. Retornou aos debates\nparlamentares, sem maior vigor. Encerrando o mandato em dezembro de\n1911, afastou-se da política.\n\nEm 1915 voltou à Câmara e passou a integrar a Comissão de Finanças. Os\nRelatórios da Receita para os exercícios de 1915, 1916 e 1917 foram\ndocumentos importantes da vida parlamentar.\n\nFaleceu no Rio de Janeiro, então Distrito Federal, em 29 de agosto de\n1917, aos 46 anos.\n\nAlberto Venâncio Filho\n\n**FONTES:** CARVALHO, A. *Estadistas*; DUARTE, M. *Carlos*; FONSECA, E.\n*Presidentes*; FRANCO, A. *Estadista*; VENANCIO FILHO, A. *Carlos*;\nVIEIRA, J. *Cadeia.*\n","ref":"**FONTES:** CARVALHO, A. *Estadistas*; DUARTE, M. *Carlos*; FONSECA, E.\n*Presidentes*; FRANCO, A. *Estadista*; VENANCIO FILHO, A. *Carlos*;\nVIEIRA, J. *Cadeia.*\n","dic":"DHBPR"}
