{"title":"PEIXOTO, Floriano","cargoss":["Ministro da Guerra","Constituinte","Senador","Presidente de associação ou confederação de empregados ou empregadores","Vice-presidente da República","Presidente da República"],"cargos_esp":[0,0,0,"STM",0,0],"datas_ini":[1890,1891,1891,1891,1891,1891],"datas_fim":[1891,1891,1891,1893,1891,1894],"estados":[0,0,"AL",0,0,0],"content":"**PEIXOTO, Floriano**\n\n\\*militar; min. Guerra 1890-1891; const. 1891; sen. AL 1891; pres. STM\n1891-1893; vice-pres. Rep. 1891; pres. Rep. 1891-1894.\n\n*Floriano Vieira Peixoto* – também conhecido como *A Esfinge*, *Marechal\nde Ferro* e *Consolidador da República* – nasceu no engenho de Riacho\nGrande, em Ipioca, distrito de Maceió, em 30 de abril de 1839, filho de\nManuel Vieira de Araújo Peixoto e de Ana Joaquina de Albuquerque\nPeixoto. Muito pobres, seus pais o entregaram, ainda recém-nascido, ao\ntio e padrinho coronel José Vieira de Araújo Peixoto, senhor de engenho\ne influente político provincial, que dispunha de melhores recursos\nmateriais para criá-lo.\n\nFez os estudos primários em Maceió, inicialmente com um clérigo amigo de\nseu padrinho, e depois em regime de internato no Colégio Espírito Santo,\nna mesma cidade. Em 1855, mudou-se para o Rio de Janeiro, então capital\ndo Império, onde ingressou no Colégio São Pedro de Alcântara para fazer\no curso secundário. No dia 1^o^ de maio de 1857 assentou praça como\nsoldado voluntário no 1^o^ Batalhão de Artilharia a Pé, e no ano\nseguinte ingressou na Escola Central do Exército – como, naquele ano,\npassou a se chamar a Escola Militar do Rio de Janeiro. Após concluir o\ncurso, foi declarado segundo-tenente em 2 de dezembro de 1861, passando\na integrar o Corpo de Artilharia.\n\nEra primeiro-tenente desde 30 de dezembro de 1863, quando, em maio de\n1865, teve início a guerra da Tríplice Aliança – formada por Argentina,\nBrasil e Uruguai – contra o Paraguai, que desde novembro do ano anterior\nvinha adotando atitudes hostis aos interesses brasileiros. Seguiu então\npara o Rio Grande do Sul juntamente com o 1^o^ Batalhão de Voluntários\nda Pátria, nome dado aos corpos de soldados criados pelo governo\nbrasileiro para ampliar os efetivos do Exército nacional. Já no\nParaguai, foi promovido a capitão em 22 de janeiro de 1866, assumindo o\ncomando de uma bateria do 1^o^ Batalhão de Artilharia a Pé. Daí em\ndiante e até o fim do conflito, participaria de alguns dos mais\nimportantes episódios militares da guerra, como as batalhas de Tuiuti,\nItororó, Lomas Valentinas e Angostura.\n\nIncorporado, ainda em 1866, ao Batalhão de Engenheiros do 1^o^ Corpo do\nExército, lá estreitou os laços de amizade com o capitão Benjamin\nConstant Botelho de Magalhães, que lhe dera aulas na Escola Central e\nque com ele viria a desempenhar papel destacado na implantação da\nRepública no Brasil. Em julho de 1867, foi desligado do batalhão para\nassumir a função de fiscal do 25^o^ Corpo de Voluntários da Pátria do\n1^o^ Corpo do Exército, sendo nomeado major em comissão. Em dezembro,\nfoi designado para comandar o 9^o^ Batalhão de Infantaria. Em 20 de\nfevereiro de 1869 foi promovido a major, por atos de bravura. Terminada\na guerra em 1^o^ de março de 1870, foi promovido a tenente-coronel em 9\nde abril seguinte, por serviços relevantes.\n\nDe volta ao Rio de Janeiro em setembro de 1870, submeteu-se ao exame de\nmineralogia, única disciplina que lhe faltava para completar o\nbacharelado em ciências físicas e matemáticas, e foi aprovado. No final\ndo ano foi nomeado inspetor encarregado das fortificações e demais obras\nmilitares em Mato Grosso. Em seguida, tornou-se membro da Comissão de\nMelhoramentos de Material do Exército. Alegando querer evitar confusões\ncom um homônimo, conseguiu do Ministério da Guerra, por portaria datada\nde 4 de janeiro de 1872, retirar o Vieira de seu nome. No dia 11 de maio\ndo mesmo ano casou-se com a filha de seu pai adotivo e, portanto, sua\nprima, Josina Vieira Peixoto, com quem viria a ter sete filhos.\n\nPromovido a coronel em 18 de abril de 1874, por serviços relevantes, foi\nnomeado para o comando do 3^o^ Regimento de Artilharia a Cavalo, no qual\npermaneceu por quatro anos. Em março de 1879 assumiu a direção do\nArsenal de Guerra de Pernambuco, com a função de inspecionar os\nestabelecimentos militares da região Nordeste. Nessa época, teve como\najudante o capitão Marciano Augusto Botelho de Magalhães, irmão do agora\nmajor Benjamin Constant, o que reforçaria os laços de amizade entre\neles, iniciados na Escola Central e aprofundados no Paraguai. Permaneceu\nno posto até novembro de 1881, quando pediu exoneração.\n\nEm 1882, atuou como fiscal dos exames ginasiais de Maceió. Promovido a\nbrigadeiro em 13 de janeiro de 1883, foi integrado ao corpo do\nEstado-Maior General. Recebeu, no mesmo ano, o título de sócio do Clube\nAbolicionista Ceará Livre, graças a declarações que fizera em prol da\nlibertação dos escravos, que aconteceria naquela província no ano\nseguinte.\n\nLigado ao Partido Liberal, em setembro de 1884 tornou-se comandante das\narmas e presidente da província de Mato Grosso, sucedendo ao marechal\nManuel de Almeida da Gama Lobo Coelho d’Eça, barão de Batovi. Procurou\napoiar a indústria extrativa do mate e reprimiu índios que ameaçavam\nCuiabá, capital da província. Exerceu o cargo até outubro do ano\nseguinte, quando, com a ascensão do conservador barão de Cotejipe à\nchefia do Conselho e Ministros, o transferiu ao vice-presidente José\nJoaquim Ramos Ferreira. Permaneceu então durante algum tempo em Alagoas,\nonde se dedicou ao engenho de cana da família.\n\nDurante a chamada Questão Militar – série de episódios que opuseram\nmilitares ao governo imperial na segunda metade da década de 1880 –\nexpressou em carta de 10 de julho de 1887 ao amigo e general João Soares\nNeiva grande insatisfação com o estado da política nacional. Mesmo sendo\nliberal, o que o levava a não desejar um regime militar no Brasil,\nsentia-se obrigado a reconhecer que o “governo da espada” é que sabia\n“purificar o sangue do corpo social, que, como o nosso, está\ncorrompido”.\n\nPromovido a marechal de campo em 6 de julho de 1889, foi, dois dias\ndepois, nomeado ajudante-general do Exército. O cargo lhe conferia a\nposição de primeira autoridade do Exército e era cumulativo com o\ncomando da Guarnição da Corte e Província do Rio de Janeiro, estando\nsubordinados a ele todos os comandantes de armas das províncias, as duas\nbrigadas da Corte e a do Paraná. Na época, segundo Raimundo Teixeira\nMendes, teria sido procurado por emissários de Benjamin\\\n Constant para saber sua posição quanto a uma conspiração republicana\nque estava em curso. A um oficial amigo que o sondara, teria aconselhado\nque apoiasse o movimento, caso verificasse tratar-se uma iniciativa\nséria e unificadora dos militares.\n\nIntensificadas as articulações contra o regime monárquico, informou ao\nministro da Justiça sobre elas de maneira genérica, observando que era\npreciso confiar na lealdade dos chefes militares. No entanto, quando, na\nmanhã de 15 de novembro, os principais membros do governo foram cercados\npor tropas lideradas pelo general Deodoro da Fonseca e pelo agora\ntenente-coronel Benjamin Constant, recusou-se a comandar a resistência\nimperial. Ao chefe do Gabinete de Ministros, visconde de Ouro Preto, que\nlhe ordenou o assalto às posições rebeldes, lembrando que no Paraguai os\nsoldados brasileiros se haviam apoderado de artilharia em condições mais\nadversas, teria respondido: “Sim, mas lá tínhamos pela frente inimigos e\naqui somos todos brasileiros”. Em seguida, o Quartel-General foi tomado,\ne os membros do governo foram presos, consumando-se o fim da monarquia\nno país.\n\nA República\n\nNo dia 16 de novembro, o primeiro número do *Diário Oficial da República\ndos Estados Unidos do Brasil* informou a composição do novo governo:\nDeodoro da Fonseca (presidente), tenente-coronel Benjamin Constant\n(Guerra), Aristides Lobo (Interior), Rui Barbosa (Fazenda),\ncontra-almirante Eduardo Wandenkolk (Marinha), Quintino Bocaiúva\n(Relações Exteriores, cumulativamente com Agricultura, Comércio e Obras\nPúblicas, enquanto o futuro titular, Demétrio Ribeiro, não chegava do\nRio Grande do Sul). Tampouco se encontrava no Rio de Janeiro o futuro\nministro da Justiça, Manuel Ferraz de Campos Sales, de São Paulo. Na\ntarde do mesmo dia, o governo provisório prestou juramento na Câmara\nMunicipal do Rio de Janeiro.\n\nMantido no cargo de ajudante-general do Exército, Floriano comandou, sob\nas ordens de Benjamin Constant, a repressão a movimentos entendidos como\nrestauradores pelo governo provisório. Embora os monarquistas viessem\naderindo em massa ao novo regime, era forte o temor de que focos de\ninsubordinação militar pudessem ser capitalizados por forças\nantirrepublicanas. Algumas manifestações monarquistas de pequena\nexpressão aconteceram em Santa Catarina, Mato Grosso e Maranhão,\nresultando na prisão dos líderes.\n\nDiariamente circulavam na capital federal boatos sobre revoltas da Força\nPública, da Marinha etc. No dia 18 de dezembro, foram presos cerca de 30\npraças do 2^o^ Regimento de Artilharia de Campanha, acusados de sair em\npasseata dando vivas ao imperador. Não obstante fosse a revolta limitada\ne frágil, o governo reagiu violentamente, mobilizando contingentes de\nvárias forças, prendendo líderes monarquistas e, por fim, baixando em 23\nde dezembro um decreto – que a oposição logo apelidaria de\n“decreto-rolha” – com base no qual poderia ser julgado militarmente, por\numa comissão formada pelo ministro da Guerra, e punido com as “penas de\nsedição” qualquer indivíduo que conspirasse ou atentasse contra a\nRepública. Para executar o decreto, o ministro da Guerra organizou a\nComissão Mista Militar de Sindicâncias, que agiu com severidade e\naplicou pesadas penas, inclusive a de morte. A imprensa foi duramente\natingida pelo “decreto-rolha”. A *Tribuna Liberal*, monarquista, foi\nimpedida de circular, enquanto outros jornais, ameaçados, restringiram\ndrasticamente o noticiário político. O decreto atingiu, também, jovens\noficiais ligados a Benjamin Constant que, pela imprensa, faziam críticas\nao governo provisório. Deodoro exigiu do ministro da Guerra que\nordenasse a Floriano Peixoto, na qualidade de ajudante-general do\nExército, fazer cessarem tais manifestações.\n\nEm 30 de janeiro de 1890, Floriano foi promovido a tenente-general,\nposto mais alto da carreira no Exército e que, por decreto baixado dois\nmeses depois, seria substituído na nomenclatura militar pelo de\nmarechal. Perturbações no meio militar, em geral resultantes de\nrivalidades entre oficiais que haviam erigido Deodoro da Fonseca e\nBenjamin Constant em símbolos de propostas políticas concorrentes,\ngeravam instabilidade no regime que se instalava. No interior do governo\nprovisório, Deodoro considerava a ação do ministro da Guerra\ninsuficiente para restabelecer a disciplina no meio militar. Assim,\nconseguiu, em reunião do Conselho de Ministros realizada em 19 de abril\nde 1890, que se criasse o Ministério da Instrução Pública, Correios e\nTelégrafos e que Benjamin Constant fosse indicado para dirigi-lo.\nFloriano Peixoto foi então nomeado, por decreto baixado dois dias\ndepois, ministro da Guerra. Benjamin Constant ainda permaneceu à frente\ndo Ministério da Guerra até 22 de junho, quando transmitiu o cargo ao\nnovo ajudante-general do Exército, general José Simeão de Oliveira, que\ndaria posse ao sucessor oficial. Em 19 de agosto Floriano também\nsucederia a Rui Barbosa na vice-chefia do governo provisório.\n\nFloriano teve atuação discreta no interior do governo, não se envolvendo\nnas frequentes disputas internas. Nas eleições para a Assembleia\nNacional Constituinte, realizadas em 15 de setembro de 1890, foi eleito\nsenador por Alagoas. Permaneceu ministro até 20 de janeiro de 1891,\nquando, em decorrência de uma crise no governo provisório, em que o\npresidente se isolou de seus colaboradores, todos os ministros se\ndeclararam demissionários. Aceita formalmente a renúncia por Deodoro no\ndia seguinte, chegou ao fim primeiro governo republicano no Brasil. No\nnovo ministério, que foi anunciado poucos dias depois e despertou\nresistências generalizadas, sobressaiu o barão de Lucena, ministro da\nJustiça. Em 14 de fevereiro de 1891, Floriano foi nomeado conselheiro de\nGuerra do Conselho Supremo Militar e de Justiça, órgão máximo da Justiça\nMilitar, que em 1893 se transformaria no Supremo Tribunal Militar (STM).\n\nQuando, durante os trabalhos da Assembleia Nacional Constituinte, que se\ninstalara em 15 de novembro de 1890, se iniciaram as articulações para a\neleição dos futuros presidente e vice-presidente da República, a serem\nescolhidos pelo voto dos deputados e senadores constituintes, o nome de\nFloriano despontou como uma alternativa militar ao de Deodoro, tido por\nmuitos como excessivamente centralizador e autoritário, além de\ninfluenciado por Lucena, um assessor monarquista de recente conversão à\nRepública. No entanto, diante de sondagens que indicavam o amplo apoio\ndos militares a Deodoro, Floriano, além de lançar-se candidato a\npresidente, candidatou-se a vice-presidente na chapa oposicionista,\nencabeçada por Prudente de Morais, líder republicano paulista e\npresidente do Congresso Nacional. As forças situacionistas apoiaram a\nchapa composta por Deodoro da Fonseca e Eduardo Wandenkolk, agora\nvice-almirante.\n\nPromulgada a primeira Constituição republicana em 24 de fevereiro de\n1891, no dia seguinte realizaram-se as eleições, em ambiente de grande\ntensão provocada por boatos segundo os quais a guarnição militar\nfecharia o Congresso se Deodoro perdesse. Deodoro foi eleito com 129\nvotos, contra 97 dados a Prudente de Morais e três a Floriano Peixoto.\nEste, por seu turno, ficou em primeiro lugar para vice-presidente com\n153 votos, tendo recebido 57. Como a Constituição permitia a eleição de\ncandidatos de chapas diferentes, Deodoro e Floriano foram consagrados,\nrespectivamente, os primeiros presidente e vice-presidente\nconstitucionais do Brasil republicano e empossados no dia 26.\n\nDurante o governo constitucional de Deodoro, Floriano manteve-se em\nposição discreta. Empenhava-se, contudo, em solapar as bases do\npresidente no meio militar, formando uma corrente oposicionista. Em 1^o^\nde novembro de 1891, foi procurado pelo ministro da Justiça, barão de\nLucena, que lhe solicitou que assumisse a presidência do Senado – que\ncabia constitucionalmente ao vice-presidente da República –, para evitar\no avanço de um projeto de lei sobre responsabilidade do presidente que\nnão convinha ao governo. Floriano alegou estar doente e não o atendeu.\n\nSofrendo contestações no Parlamento e na caserna e com problemas de\nsustentação em estados importantes, como Minas Gerais e São Paulo,\nDeodoro dissolveu o Congresso no dia 3 de novembro de 1891, esperando\nreverter a situação. A medida, inconstitucional, foi logo apelidada de\n“golpe Lucena”. No dia seguinte, Deodoro decretou o estado de sítio para\no Distrito Federal e Niterói. Em manifesto aos brasileiros, explicou sua\natitude, argumentando com a necessidade de retificar a Constituição,\nprincipalmente para fortalecer o Poder Executivo da União. Para isso,\ndecretou a convocação de eleições de deputados para novo Congresso\nConstituinte. Em resposta, o Congresso Nacional lançou, no mesmo dia e\nassinado por 114 parlamentares, entre deputados e senadores, o Manifesto\nà Nação Brasileira, denunciando a violência do governo.\n\nDos governadores, apenas Lauro Sodré, do Pará, manifestou-se\npublicamente contra o golpe no dia seguinte. Pouco tempo depois,\ncontudo, estava estruturada a resistência em vários estados, nos setores\nmilitares e no meio sindical de Santos (SP) e da capital federal.\nFloriano participava de reuniões com a oposição. Cauteloso, insistia na\nnecessidade de conquistar a adesão de mais tropas antes de desencadear o\ncontragolpe. No dia 21 de novembro, finalmente, os ferroviários\ndeflagraram uma greve no Rio de Janeiro, enquanto se concluíam os\npreparativos para a ação militar, iniciada na madrugada de 23: revolta\nde unidades da Marinha fundeadas na baía da Guanabara, apoiada por\ncontingentes do Exército em terra. Doente, Deodoro ainda esboçou uma\nreação, mas acabou renunciando na mesma manhã. Floriano Peixoto foi\nbuscado em casa para receber o cargo de presidente da República.\n\nPresidente da República\n\n            Envolto no clima de mobilização popular que a notícia da\nrenúncia de Deodoro causou na capital federal, Floriano – que não teria\nvice-presidente, porque faria questão de manter-se nessa condição até o\nfim de seu mandato − foi empossado no próprio dia 23 de novembro de\n1891. No manifesto que lançou então, consignou a ação legalista de\nsetores das forças armadas e de cidadãos, que teriam restabelecido a\nConstituição e as leis, suspensas pela ação do presidente demissionário.\nNo mesmo dia tornou-se, de acordo com o regulamento da instituição, pelo\nqual a presidência cabia ao chefe do Estado, presidente do Conselho\nSupremo Militar e de Justiça. Permaneceria no cargo até julho de 1893,\nquando seria modificado o modo de escolha do presidente.\n\nO novo ministério foi composto, inicialmente, por Francisco de Paula\nRodrigues Alves Filho (Fazenda), José Higino Duarte Pereira (Justiça e,\ncumulativamente, Secretaria de Estado da Instrução Pública, Correios e\nTelégrafos), contra-almirante Custódio José de Melo (Marinha), José\nSimeão de Oliveira (Guerra), Constantino Luís Paleta (Relações\nExteriores), Antão Gonçalves de Faria (Agricultura) e Antônio Paulino\nLimpo de Abreu (Indústria, Viação e Obras Públicas). Entre os civis,\napenas o ministro da Fazenda representava uma força política importante\n– o Partido Republicano Paulista (PRP), ao qual era ligado, embora\ntivesse sido monarquista até recentemente.\n\nAs primeiras medidas políticas tomadas pelo novo governo foram a\nrevogação do estado de sítio e a reabertura do Congresso Nacional. Em\nseguida, respaldado na progressiva ativação popular antideodorista e no\nPRP, o governo investiu, em dezembro, contra os presidentes de estados\nque de alguma maneira haviam apoiado – todos, com exceção do Pará − o\ngolpe do mês anterior. Pacífica ou violentamente, esses governantes\nestaduais foram sendo derrubados por facções internas, com o apoio do\ngoverno federal.\n\nA reação de setores deodoristas e oposicionistas independentes fez-se,\nde um lado, no Congresso, onde a minoria tentou barrar a ação\nintervencionista do governo federal. De outro, segmentos militares,\nprincipalmente oficiais do Exército e praças da Marinha, lançaram, no\nRio de Janeiro, movimentos de oposição armada a Floriano, todos de pouca\nexpressão. Em janeiro de 1892, Campos Sales, no Senado, e Inocêncio\nSerzedelo Correia, na Câmara dos Deputados, conseguiram o fim das\nsessões do Congresso para que o governo “pudesse agir sozinho, sem\nembaraços parlamentares e na plenitude de suas prerrogativas”, na\nrepressão aos elementos perturbadores da ordem. Estava apresentada a\nsenha para o estabelecimento de situações de exceção que permitiriam ao\nExecutivo instrumentalizar politicamente todos os recursos jurídicos do\nEstado, o que contribuiria para que a Floriano fosse atribuída a pecha\nde ditador.\n\nOutra estratégia da oposição foi a contestação da legalidade do mandato\npresidencial do vice-presidente. A Constituição Federal estabelecia que,\nse o cargo de presidente da República ficasse vago antes de cumpridos\ndois anos do mandato, haveria nova eleição, direta. Entretanto, suas\nDisposições Transitórias davam margem ao entendimento de que isso não se\naplicava ao primeiro mandato republicano, já que definiam que no\nprimeiro período presidencial o presidente e o vice-presidente seriam\nescolhidos por eleição indireta. Em torno dessa questão hermenêutica\norganizaram-se os campos políticos contra e a favor de Floriano. A\noposição exigia o seu impedimento ou renúncia, o que abriria caminho\npara novas eleições presidenciais, consideradas necessárias, também, por\nalguns setores favoráveis ao governo, militares e civis, inclusive\nmembros do PRP.\n\nEm 6 de abril de 1892, 13 oficiais-generais das duas armas – entre os\nquais o vice-almirante Eduardo Wandenkolk − publicaram um manifesto\ndirigido a Floriano Peixoto, onde faziam críticas severas à condução do\ngoverno na crise dos estados, afirmavam não querer passar por\ncorresponsáveis pela desorganização em que as unidade federadas se\nencontravam e, por fim, defendiam a realização de eleições para o cargo\nde presidente como o único caminho para superar a crise. No dia\nseguinte, também recorrendo a um manifesto, Floriano criticou a atitude\ndos oficiais e garantiu que usaria dos poderes extraordinários a ele\nconferidos pelo Congresso para salvar sua autoridade e a honra da\nRepública. E, ato contínuo, demitiu de suas comissões e reformou\ncompulsoriamente os 13 signatários do manifesto oposicionista, que\ntambém seriam expulsos do Clube Militar. Pedido de habeas corpus em\nfavor dos punidos foi negado pelo Supremo Tribunal Federal (STF) por um\nvoto, resultado atribuído a ameaças que Floriano teria feito aos juízes.\n\nA oposição ainda tentou pressionar o governo a partir das ruas. No dia\n10, foi organizada no Centro do Rio de Janeiro uma manifestação em\nhomenagem a Deodoro da Fonseca e contra Floriano, frustrada pelo mau\nestado de saúde do ex-presidente. O governo a usou como pretexto para a\ndecretação, no dia 12, do estado de sítio, com a suspensão dos direitos\nconstitucionais na capital federal por 72 horas. Sob a acusação de crime\nde sedição, oposicionistas civis e militares foram presos e muitos\ndeles, com base em decreto baixado dois dias depois, condenados ao\ndesterro em pontos longínquos do país. No Senado, Campos Sales\napresentou, com o apoio de Floriano, projeto de regulamentação do estado\nde sítio, para armar o Executivo de recursos com que enfrentar as\nameaças à ordem. Contudo, segundo seu depoimento, a iniciativa foi\nbloqueada por partidários do governo, que consideravam a medida\ninsuficiente e julgavam necessário o estabelecimento de tribunais de\nexceção.\n\nNo dia 8 de junho, proposta de anistia feita pela oposição foi aprovada\nno Congresso, beneficiando todos os atingidos pelo decreto do dia 12 de\nabril. Em 23 de agosto, morreu o general Deodoro da Fonseca.\n\nAs Guerras Civis\n\nDisputas pelo poder estadual no Rio Grande do Sul entre federalistas −\nantigos monarquistas, de tendência liberal e parlamentarista, liderados\npor Gaspar da Silveira Martins − e republicanos − partidários do\npositivista Júlio de Castilhos – levaram, em junho de 1892, a conflitos\narmados. Embora Castilhos tivesse endossado o golpe deodorista em 1891,\nFloriano apoiava os republicanos. Os embates envolveram, basicamente,\ntropas privadas dos “coronéis” latifundiários sulistas, de ambos os\nlados, e do Exército, em apoio aos republicanos. Marcados por extrema\nviolência, terminaram com a vitória dos republicanos e a posse de Júlio\nde Castilhos no governo gaúcho em janeiro de 1893.\n\nNão cessaram, entretanto, as tensões entre as correntes políticas\ngaúchas. Perseguidos pelo governo estadual, que transformou a Guarda\nCivil na Brigada Militar e era sustentado por Floriano Peixoto, milhares\nde oposicionistas precisaram emigrar para o Uruguai. E foi de lá que\npartiram para invadir o Rio Grande do Sul em fevereiro de 1893, sob o\ncomando supremo do general João “Joca” Nunes Tavares. Após algumas\nvitórias dos oposicionistas, Castilhos reagiu, apoiado pelas tropas do\ngoverno federal e especialmente pelo PRP, que conseguiu do Congresso\nestadual paulista autorização para prestar auxílio material ao governo\nda União para a manutenção da ordem republicana, o que, naquele momento,\nsignificava reprimir a revolta gaúcha, classificada pelo situacionismo\ncomo monarquista e restauradora. Em maio, as tropas federalistas\nremanescentes retornaram ao Uruguai.\n\nNesse ínterim, Floriano Peixoto sofria progressiva oposição de oficiais\nda Armada, que o acusavam de hostilizar a força e bloquear a pretensão\npresidencial do contra-almirante Custódio José de Melo, que em abril\nrenunciou ao cargo de ministro da Marinha. A crise se evidenciou com a\ndificuldade que Floriano encontrou para nomear o novo ministro,\nrecebendo recusas de dois convidados. Em maio, a escolha do presidente\ndo Clube Naval, por grande maioria de votos, indicou a tendência da\noficialidade à oposição. O eleito foi Eduardo Wandenkolk, notório\nantiflorianista que se encontrava na Argentina para se articular com os\nfederalistas gaúchos. Frustrado seu projeto, Wandenkolk foi preso ainda\nem maio, quando retornava por mar ao Rio de Janeiro.\n\nA deterioração das relações entre Floriano – que em 25 de julho deixou a\npresidência do STM, mas se manteve como ministro da corte − e\nimportantes lideranças da Marinha ensejou a articulação de novo\nmovimento, que ficaria conhecido como Revolta da Armada. Sob o comando\nde Custódio de Melo, o movimento eclodiu na madrugada do dia 6 de\nsetembro de 1893, quando foi apresentado um ultimato ao presidente,\nacompanhado por dois manifestos à nação, um do comandante e outro de\ndeputados que haviam aderido ao movimento. Entre outras acusações,\nFloriano era chamado de ditador, por ter anulado a autonomia dos estados\ne estimulado a “luta fratricida” no sul.\n\nImediatamente, Floriano determinou a convocação dos oficiais da Marinha\ne considerou desertores cerca de trezentos deles. No dia 10 de setembro,\nfoi decretado o estado de sítio para a capital federal e Niterói (RJ).\nDurante três meses, travaram-se combates na baía da Guanabara e no\nlitoral fluminense. O bombardeio da capital federal e a intervenção de\nnações estrangeiras que tinham navios fundeados na baía criaram\ncondições para um acordo em 5 de outubro, pelo qual os revoltosos\ncessariam o ataque ao Rio e Floriano não tomaria iniciativas contra eles\ne pararia de armar-se. Embora permanecesse o estado belicoso, a revolta\nficava estagnada, restringindo-se os combates nas águas da baía, sob a\nsupervisão de testemunhas situadas em um navio de guerra estrangeiro.\n\nNos primeiros dias de novembro Custódio de Melo dirigiu-se para o Sul,\ncom o objetivo de unir-se aos federalistas gaúchos, ainda em guerra\ncontra o governo estadual. Em dezembro, com a adesão do almirante\nSaldanha da Gama à revolta – o que lhe deu um tom monarquista −, o\ncomando do movimento no Rio de Janeiro passou às suas mãos. Reorganizada\na esquadra revoltosa e tomando o governo a ofensiva, o conflito entrou\nem fase ainda mais violenta. Os combates se concentraram na baía de\nGuanabara, em torno do controle das ilhas e das cidades do Rio de\nJaneiro e Niterói.\n\nEntrementes, a conquista pelos revoltosos gaúchos de Desterro, capital\nde Santa Catarina, facilitada pela simpatia do governador pelo\nmovimento, abrira o caminho para a expansão da revolta federalista no\nestado e, a partir daí, no Paraná. Impondo sucessivas derrotas às forças\nlegalistas, os revoltosos tomaram Curitiba em janeiro de 1894.\n\nPara fazer face ao avanço do movimento rebelde, Floriano conseguiu que o\nCongresso baixasse medidas de reforço à capacidade repressiva do Estado.\nEm 28 de fevereiro de 1894, o Decreto n^o^ 1.681 declarou sujeitos à\njurisdição do foro militar os crimes que se relacionassem à rebelião.\nEssas disposições foram ampliadas em 5 de março pelo Decreto n^o^ 1.685.\nReproduzia-se o espírito do Decreto n^o^ 61 e do Regulamento n^o^ 23,\nambos de 24 de outubro de 1838, que estabeleceram, respectivamente, a\nidentificação do “estado de rebelião” ao “estado de guerra” para efeitos\npenais e a aplicação das leis específicas para tempo de guerra nos\nlugares que se achassem em “estado de rebelião”. Constituía-se, assim, a\nJustiça Militar em instrumento de defesa do Estado, que o chefe do\nExecutivo e suas bases de apoio militares e civis, no Congresso e fora\ndele, entendiam estar sendo ameaçado.\n\nAinda em março, tropas comandadas por Gumercindo Saraiva estacionaram\njunto à localidade paulista de Itararé. Contudo, diante do poderio das\nforças paulistas e da falta de apoio dos revoltosos do Rio de Janeiro,\ncom problemas para manter o movimento, o comandante federalista optou\npor retornar ao Rio Grande e concentrar esforços na luta contra Júlio de\nCastilhos.\n\nNa baía de Guanabara, dadas a precariedade do material bélico de que\ndispunham e a impossibilidade de sair pela barra rumo ao alto-mar, os\nrevoltosos buscaram asilo em navios portugueses em 13 de março de 1894,\ndepois que o governo sequer aceitou discutir suas condições de paz.\n\nA reorganização das forças legalistas, após a derrota da Revolta da\nArmada, inverteu os rumos da guerra civil. Retomados, em abril, Santa\nCatarina – cuja capital Desterro seria rebatizada de Florianópolis –, e\nem maio, o Paraná, desencadeou-se no mês seguinte a perseguição a uma\ncoluna federalista cujos integrantes, em grande número, buscaram refúgio\nno Uruguai. Após sangrentos combates em Forquilha (RS) e a morte de\nGumercindo Saraiva em agosto, outras duas colunas tomaram o mesmo rumo,\ndesviando, contudo, para a Argentina, onde chegariam em setembro de\n1894. As operações federalistas seriam retomadas com nova invasão do Rio\nGrande do Sul, ainda em setembro. O conflito só seria resolvido já no\ngoverno de Prudente de Morais, que assumiu presidência da República em\n15 de novembro de 1894. Acertadas, 23 de agosto de 1895, as condições de\npaz, no dia 21 de outubro seguinte o Congresso transformaria em lei o\nprojeto de anistia política apresentado pelo governo. \n\nAs guerras civis ocorridas durante o mandato presidencial de Floriano\nPeixoto forçaram uma definição maior de certos aspectos da recente\nlegalidade institucional republicana no tocante à situação dos militares\nem face das leis. A Carta de 1891 tornara constitucional a questão do\ndireito castrense – até então situado na linha de comando militar –,\ndispondo que os militares de terra e mar teriam direito a foro especial\nnos delitos militares, foro esse que deveria ser composto de um Supremo\nTribunal Militar e dos conselhos necessários para a formação da culpa e\njulgamento dos crimes, ficando a organização e a definição de\natribuições do tribunal a serem reguladas por lei ordinária. A Justiça\nMilitar foi, aliás, a única justiça especializada reconhecida pela\nConstituição, ainda que mantida fora do poder Judiciário. Assim, ainda\nem 1890 o governo provisório instituíra o Código Disciplinar da Armada\n(21/6), abolira a pena de galés e reduzira para 30 anos as penas\nperpétuas (20/9). Em 5 de novembro, baixara o Código Penal da Armada\n(CPA), que, no entanto, seguiria uma trajetória tortuosa, resultante das\npolêmicas que despertou. Reformado a partir de autorização concedida ao\nMinistério da Marinha por decreto de 14 de fevereiro de 1891, em 7 de\nmarço o CPA recebeu sua versão definitiva. No entanto, seria considerado\ninconstitucional pela primeira legislatura ordinária republicana e, em\n1893, nulo, pelo STF.\n\nA ação repressiva de Floriano durante a revolta no Sul colocou, pela\nprimeira vez na República, o foro militar em questão, em duas situações\ndistintas, mas ambas de natureza política. A primeira, em 25 de julho de\n1893, referiu-se ao enquadramento do contra-almirante Eduardo\nWandenkolk, então senador e um dos líderes da revolta. O que\nprevaleceria na definição da instância adequada para julgá-lo: a\ncondição de parlamentar, com direito a foro civil, ou a de militar, que\no enquadrava no Código Penal da Armada? A segunda situação foi a\ntentativa de também enquadrar na legislação penal militar civis presos\ndurante a revolta e reclusos em unidades militares. Vários argumentos\ncontra o enquadramento no CPA foram, então, usados. Um deles apelava ao\nartigo 60 da Constituição, que determinava o julgamento de crimes\npolíticos por juízes e tribunais federais civis; como a revolta se\nenquadrava nesse caso, não havia por que submeter os envolvidos ao foro\nmilitar. Outro argumento lembrava que a origem do CPA era uma\nautorização concedida pelo governo provisório, ditatorial, utilizada\nindevidamente já no período constitucional. Quando o STF declarou a\nnulidade do CPA em 1893, Floriano Peixoto, em represália, passou a\nobstar o funcionamento do tribunal, deixando, por meses, de preencher as\nvagas que se abriam e recusando-se a empossar o presidente eleito pela\ncasa, função que lhe cabia por determinação legal. A questão só seria\nresolvida em 1899, quando o Congresso legalizou o CPA, determinando sua\nextensão ao Exército.\n\nAdministração e Política\n\nA administração de Floriano Peixoto foi constrangida, em grande parte,\npor desdobramentos da conjuntura de transição para a República. Havia,\nainda, problemas no setor produtivo relacionados com a extinção do\ntrabalho escravo e agravados por uma forte seca em 1889, que demandavam\nauxílio governamental à agricultura. No plano da política\neconômico-financeira, a principal questão com que o governo teve de\nlidar foi herança do último governo imperial e de Deodoro: a política\nemissionista que provocou intensa e descontrolada especulação\nfinanceira, escalada inflacionária e rápida desvalorização cambial. Tal\npolítica resultaria, em fins 1891, na chamada crise do Encilhamento,\nmarcada pela falência de grande número de empresas.\n\nA prioridade máxima do programa de governo no período foi o combate ao\ndéficit orçamentário pela elevação das receitas, mas Floriano precisou\ncom frequência recorrer à emissão de moeda para financiá-lo.\nDificuldades advieram, também, das determinações constitucionais que\nexigiram reformas nos serviços federais e retiraram do governo fontes de\nrenda, transferidas para os estados. O equilíbrio orçamentário se tornou\numa meta mais distante, ainda, em razão dos crescentes gastos de\nnatureza militar, decorrentes das guerras civis enfrentadas pelo governo\nno período.\n\nO quadro econômico-financeiro espelhava a administração como um todo.\nNão deixou Floriano, praticamente, obra administrativa. Na síntese de\nJosé Maria Belo: “O governo, obrigado a defender-se por toda parte, não\npode ter nenhum programa. Vive o dia a dia dos expedientes que lhe\nsugerem os seus improvisados conselheiros ou os seus efêmeros\nministros”. Entretanto, ainda que sem seguir um programa, o governo\nprocurou incentivar as ainda incipientes indústrias nacionais,\nconcentradas majoritariamente na capital federal. Nesse sentido,\nconseguiu aprovar um decreto que concedia auxílios financeiros às\nempresas.\n\nSatisfez, também, necessidades prementes de setores urbanos pobres, ao\nmenos da cidade do Rio de Janeiro. O governo federal e a prefeitura da\ncapital, a ele alinhada, adotaram medidas − como a redução dos aluguéis\nde residências operárias, o barateamento da carne, o combate à\nespeculação altista com gêneros de primeira necessidade e aos cortiços,\napelidados de “cabeças de porco” – que os analistas identificam como o\nelemento que atraiu para a figura de Floriano um setor republicano\nradical. Constituído por militares, civis positivistas e membros das\ncamadas médias urbanas, esse setor se autoproclamava “jacobino”, numa\nalusão ao “jacobinismo”, tendência política revolucionária surgida\ndurante a Revolução Francesa, em fins do século XVIII. Os jacobinos\nbrasileiros eram nacionalistas, chegando à xenofobia em relação à\ncolônia portuguesa no país, associada ao monarquismo. E militaristas,\nvendo nos militares o verdadeiro repositório de patriotismo republicano.\n\nO jacobinismo é associado, em sua origem, às posições assumidas por\nFloriano Peixoto durante a Revolta da Armada em defesa da cidade,\nperante os bombardeios, e dos interesses nacionais, nas negociações com\nas esquadras estrangeiras. Nas palavras de Sertório de Castro: “Nasceu,\nentão, entre contínuas agitações populares, o jacobinismo feroz que\ndeveria passar, como uma herança de ódios e paixões, sem freio, ao\ngoverno Prudente de Morais. Floriano saía da peleja […] cercado de\nadmirações e de ódios, encarnando para a grande maioria da nação o\nprincípio da lei e da autoridade, símbolo da própria República”. O\njacobinismo florianista constituiria uma força política expressiva\ndurante a presidência de Prudente de Morais − o primeiro governo\nrepublicano capitaneado por um civil −, quando se extinguiria como\nmovimento, após organizar a tentativa de assassiná-lo, em 1897.\n\nSucessão Presidencial\n\nO nome do sucessor de Floriano Peixoto começou a ser negociado em meados\nde 1893. Da base política governamental surgida no Congresso durante as\nrevoltas, criou-se nesse ano uma nova agremiação partidária, sob a\nliderança de Francisco Glicério, representante dos republicanos\npaulistas. De âmbito nacional, o Partido Republicano Federal (PRF) se\nconstituiu de um amplo leque de forças, que cobria quase todos os\nmatizes do espectro político da época. O candidato à presidência\nescolhido pelo novo partido foi Prudente de Morais, republicano\nhistórico, ex-presidente da Constituinte republicana, representante dos\ncafeicultores e um dos principais chefes do PRP, maior sustentáculo\npolítico e material do governo federal durante as guerras civis.\n\nEm meio a boatos sobre suas intenções de lançar candidato próprio ou,\nmesmo, dar um golpe e prorrogar sua estada no poder, Floriano acatou a\nindicação de Prudente. Entretanto, deixou entender que este não era o\nnome da sua preferência, e no dia da posse, 15 de novembro de 1894, não\nesteve no palácio para lhe transmitir o cargo, o que foi feito por um\nministro do governo que findava.\n\nAinda no poder, Floriano Peixoto já tinha a saúde em estado muito\nprecário. Findo o governo, mudou-se para uma fazenda no distrito de\nDivisa, em Barra Mansa (RJ), para recuperar-se. Lá, no dia 29 de junho\nde 1895, morreu.\n\nEm 1926, o distrito de Divisa seria rebatizado Floriano; em 1943\npassaria a chamar-se Ribeirão da Divisa, voltando a denominar-se\nFloriano em 1951.\n\nSobre sua vida e trajetória política, foram publicados *Páginas do\npassado*. *Floriano Peixoto na intimidade o mesmo na vida*, de Serzedelo\nCorreia (1919); *Biografia do marechal Floriano Peixoto*, de Artur\nPeixoto (1939); *No tempo de Floriano*, de Sílvio Peixoto (1939);\n*Floriano Peixoto*, de Salm de Miranda (1963); *Floriano Peixoto - O\nConsolidador da República*, de Ciro Silva (1963), e *Floriano Peixoto\nvida e governo*, de Francolino Cameu e Artur Vieira Peixoto (1983). Foi\nretratado na minissérie televisiva *República*, no filme *Policarpo\nQuaresma, herói do Brasil* e no documentário *A esfinge* (2007).\n\nRenato Lemos\n\n**FONTES**: BASTOS, P. *Superior Tribunal Militar*; BELLO, J.\n*História*; BENTO, C. Exército; Biblioteca IBGE. Disponível em:\n\\<http://biblioteca.ibge.gov.br/visualizacao/dtbs/riodejaneiro/barramansa.pdf\\>.\nAcesso em 25/4/2010; CAMPOS SALES, M. *Da propaganda*; CASTRO, S.\n*República*; KOIFMAN, F. Presidentes; LEMOS, R. *Benjamin Constant*;\nMemória Globo. Disponível em:\n\\<http://memoriaglobo.globo.com/Memoriaglobo/0,27723,GYN0-5273-234287,00.html\\>.\nAcesso em: 20/11/2011; MIN. GUERRA. *Almanaque* (1895); PENNA, L.\n*Progresso*; PENNA, L. *República*; VILLELA, A.; SUZIGAN, W. *Política*;\nSUP. TRIB. FED. Disponível em:\n\\<www.stm.jus.br/institucional/ministros-desde-1808/min\\_STM\\_desde1808.pdf\\>.\nAcesso em: 22/4/2010.\n","ref":"","dic":"DHBPR"}
