{"title":"PEIXOTO, Manuel Rodrigues","cargoss":["Deputado Geral","Deputado Geral","Deputado federal"],"cargos_esp":[0,0,0],"datas_ini":[1886,1881,1906],"datas_fim":[1889,1884,1908],"estados":["RJ","RJ","RJ"],"autor":["Luciana Pinheiro"],"content":"**PEIXOTO, Manuel Rodrigues**\n\n\\* dep. geral RJ 1881-1884 e 1886-1889; dep. fed. RJ 1906-1908.\n\n*Manuel Rodrigues Peixoto* nasceu em Campos (RJ) no dia 1^o^ de agosto\nde 1843, filho de Germano Rodrigues Peixoto e de Maria Josefa da Silva\nPeixoto.\n\nFez os primeiros estudos em seu município natal e cursou humanidades no\nColégio Marinho, na cidade do Rio de Janeiro, então capital do Império.\nEm 1860 matriculou-se na Faculdade de Direito de São Paulo e formou-se\nquatro anos depois. Iniciou carreira profissional como advogado em\nCampos. Aí foi também promotor público, juiz de órfãos substituto e, de\n1869 a 1873, juiz municipal. Em 1874 assumiu a direção da Estrada de\nFerro Carangola e em 1881 fundou o engenho central do Cupim, com vistas\nà produção de açúcar.\n\nTambém em 1881, último ano da legislatura iniciada em 1878, elegeu-se\ndeputado geral pela província do Rio de Janeiro, renovando o mandato\npara a legislatura 1882-1884. Abolicionista e defensor dos ideais\nrepublicanos, voltou à Assembleia Geral na legislatura 1886-1889,\ndurante a qual votou a favor da lei que aboliu a escravatura.\n\nEm 1904 foi nomeado por Nilo Peçanha, então presidente do estado do Rio\nde Janeiro (1903-1906), prefeito de Campos. Comandou a prefeitura de seu\nmunicípio natal até 1905. Em 1906 foi eleito deputado federal e tomou\nposse na Câmara dos Deputados, no Distrito Federal, em maio do mesmo\nano, com mandato até dezembro de 1908. Durante o ano de 1912 trabalhou\npara o Ministério da Agricultura, a convite do então ministro Pedro\nManuel de Toledo, realizando estudos junto aos núcleos coloniais\nmantidos pelo governo federal nos estados das regiões Sul e Sudeste.\n\nFaleceu em 29 de setembro de 1919.\n\nFoi casado com Maria Isabel de Miranda Manhães, neta dos barões de\nAbadia.\n\nAutor de poesias, conferências e artigos jornalísticos sobre temas\nligados à política e à agricultura, foi importante colaborador dos\nperiódicos *Monitor Campista*, *O Futuro, A Luta* e *Diário do Rio de\nJaneiro*. Publicou diversos panfletos, como *Sobre questões sociais*, *A\nquestão religiosa*, *Sobre a baixa do preço do açúcar,* *Alguns\ndiscursos parlamentares proferidos no ano de 1888* e *A República ou a\nMonarquia?* Sob o pseudônimo Eguesto, publicou ainda *A lavoura em\nCampos e a baixa do açúcar* (1874), *A crise do açúcar e a transformação\ndo trabalho* (1885), *Colonização* (1886), *Discursos parlamentares*\n(1888), *Questões sociais* (1903) e *Programa de administração* (1904).\n\nLuciana Pinheiro\n\n**FONTES:** ABRANCHES, J. *Governos*; CÂM. DEP. *Deputados brasileiros*;\nCORDEIRO, H. *Manuel*; CPDOC. Disponível em: \\<http://cpdoc.fgv.br/\\>.\nAcesso em: 23/1/2010; Instituto Historiar. Disponível em:\n\\<http://institutohistoriar.blogspot.com/\\>. Acesso em: 23/1/2010.\n","ref":"**FONTES:** ABRANCHES, J. *Governos*; CÂM. DEP. *Deputados brasileiros*;\nCORDEIRO, H. *Manuel*; CPDOC. Disponível em: \\<http://cpdoc.fgv.br/\\>.\nAcesso em: 23/1/2010; Instituto Historiar. Disponível em:\n\\<http://institutohistoriar.blogspot.com/\\>. Acesso em: 23/1/2010.\n","dic":"DHBPR"}
