{"title":"PENA, Afonso","cargoss":["Deputado Geral","Ministro da Guerra","min Agricultura","Ministro do Interior","Deputado Geral","Presidente de associação ou confederação de empregados ou empregadores","Presidente de associação ou confederação de empregados ou empregadores","Vice-presidente da República","Presidente da República"],"cargos_esp":[0,0,0,0,0,0,"Bco da Rep",0,0],"datas_ini":[1878,1882,1883,1885,1886,1892,1894,1902,1906],"datas_fim":[1884,1882,1884,1885,1889,1894,1898,1906,1909],"estados":["MG",0,0,0,"MG","MG",0,0,0],"autor":[0],"content":"**PENA, Afonso**\n\n\\* dep. geral MG 1878-1884; min. Guerra 1882; min. Agricultura\n1883-1884; min. Interior 1885; dep. geral MG 1886-1889; pres. MG\n1892-1894; pres. Bco da Rep. 1894-1898; vice-pres. Rep. 1902-1906; pres.\nRep. 1906-1909.\n\n*Afonso Augusto Moreira Pena* nasceu em Santa Bárbara do Mato Dentro,\natual município de Santa Bárbara (MG), no dia 30 de novembro de 1847,\nfilho de Domingos José Teixeira da Pena e de Ana Moreira Teixeira Pena.\nSeu pai, português de nascimento, seguiu inicialmente a carreira\nmilitar, mas depois a abandonou. Era proprietário de terras e de uma\nlavra de ouro. Sua mãe provinha de uma importante família mineira que\ntinha o controle político sobre o município de Santa Bárbara.\n\nCursou o primário em sua terra natal e aos dez anos de idade tornou-se\naluno interno no famoso Colégio Caraça, fundado por padres lazaristas,\nonde concluiu o curso de humanidades em 1864. Seu pai era um dos maiores\ncredores do colégio. Sua educação era o que de melhor uma família\ntradicional mineira poderia oferecer. O currículo incluía teologia,\nética e língua estrangeira, especialmente o francês. O jovem Afonso foi\nconsiderado um aluno brilhante desde a mais tenra idade. Em 1866\nmudou-se para São Paulo para cursar a Faculdade de Direito, onde obteria\no título de bacharel em 1870 e seria colega de Rui Barbosa, Bias Fortes,\nJoaquim Nabuco, Castro Alves e Rodrigues Alves, entre outros. Desse\ngrupo foi o único a receber o grau de doutor, após defender a tese\nintitulada “Letra de câmbio”.\n\nAinda estudante fundou com Rodrigues Alves o periódico *Imprensa\nAcadêmica*, voltado para a discussão de matérias jurídicas e políticas.\nPoucas cópias restaram desse jornal, mas através de alguns de seus\nartigos remanescentes percebe-se a influência sobre seu pensamento de\nautores franceses como Victor Hugo, Balzac e Zola. Pela análise de seus\ntrabalhos escolares, percebe-se igualmente em sua formação uma filiação\nao jusnaturalismo e uma franca oposição ao positivismo jurídico,\ndiscussões muito presentes no contexto da chamada “geração de 1870”. Sua\noposição ao positivismo derivava de seu arraigado catolicismo e de suas\nsimpatias pela instituição monárquica. Os positivistas brasileiros\nadvogavam a separação entre Estado e Igreja, bem como a instituição de\numa república militar no país. Tais plataformas afastaram Afonso Pena do\ncomtismo.\n\nTambém em seus tempos de estudante, dois movimentos dividiam o debate\npolítico nacional: o abolicionismo e o republicanismo. Comprometeu-se\ncom o primeiro e recusou o segundo. Coerente com seus princípios,\nnegou-se a assinar o Manifesto Republicano de 1870, por achar que o\nBrasil ainda não estava preparado para uma mudança de regime. Como\nmuitos, considerava que o povo brasileiro não possuía educação\nsuficiente para conviver com uma forma de governo na qual fosse chamado\na participar com frequência. Já suas relações com o abolicionismo eram\neivadas de complexidade. Ao mesmo tempo em que se autoproclamava um\nabolicionista e não tinha, salvo engano, nenhum escravo de sua\npropriedade, temia que a manumissão imediata redundasse em danos\neconômicos irreversíveis para os proprietários. Por essa razão, era\nfavorável à indenização após a abolição e à imigração como forma mais\neficiente de substituição da mão de obra. Ao pensar assim, caminhava ao\nlado de muitos outros políticos, especialmente os conservadores,\nresponsáveis pelo progressivo atraso do fim da escravidão no Brasil.\n\nMuito embora não tenha participado da maçonaria, instituição da qual\nfaziam parte vários de seus contemporâneos, integrou uma sociedade\nsecreta estudantil chamada *Burschenschaft*, ou Bucha, como era\nconhecida na Faculdade de Direito. Tal organização havia sido criada\npara prestar solidariedade a pessoas que não pudessem custear seus\nestudos, e dela fizeram parte importantes líderes políticos do Brasil.\nConversavam em linguagem secreta, abusavam dos rituais e tratavam-se\nmutuamente como “bucheiros”. Afonso Pena era o chefe da “comunhão geral\nda Bucha”. Havia várias outras confrarias semelhantes em outras\nfaculdades brasileiras, e todas elas começaram a perder força após 1930.\n\nAlém da Bucha, Afonso Pena participava de outra confraria, não secreta,\no Ateneu Paulistano. A agremiação tinha por objetivo o cultivo das\nletras, a discussão da história do Brasil e o debate político\ncontemporâneo. Sabe-se que Afonso Pena produziu uma série de publicações\npara essa agremiação, mas poucos resquícios restaram delas.\n\nTrajetória Política no Império\n\nTendo recusado o convite para ser professor da faculdade pela qual se\nhavia graduado, voltou para Santa Bárbara e iniciou sua vida\nprofissional como advogado. Mais tarde transferiu-se para Barbacena\n(MG), cidade na qual se tornou conhecido por advogar em defesa de\nescravos.\n\nComo desde a juventude já manifestava vinculações políticas, não tardou\npara que ingressasse no Partido Liberal em 1874. Candidatou-se a\ndeputado provincial e, eleito, permaneceu na Assembleia Provincial entre\n1874 e 1878. Logo após, elegeu-se deputado geral. Iniciou seu primeiro\nmandato na Câmara dos Deputados ainda em 1878, renovou-o até 1884 e\nvoltou à casa de 1886 até 1889. Sua ascensão no Partido Liberal foi\nfacilitada pelo patronato político de duas figuras célebres no Império:\nMartinho de Campos e Afonso Celso. O apoio político era requisito\nessencial para que as nomeações partidárias ocorressem. Muito embora\nAfonso Pena tenha sido um crítico desses mecanismos de acesso e se tenha\nempenhado em combatê-los, deles não pôde abrir mão, sob pena de frear\nsuas ambições políticas. Talvez tenha sido por essa razão que sempre se\nrecusou a ocupar cargos de direção em partidos políticos, declinando\ninúmeros convites.\n\nEnquanto deputado geral, Afonso Pena destacou-se na defesa das reformas\neleitorais, para que o número de eleitores fosse ampliado, a partir da\ndiminuição das exigências de renda necessárias à qualificação prévia dos\nvotantes. A contundência de suas aspirações reformistas levou-o,\ninclusive, a criticar a postura de seu próprio partido e a ressaltar a\nnecessidade da implantação no Brasil do voto direto e do voto distrital.\nAo mesmo tempo, foi um defensor incansável da ampliação da autonomia dos\nmunicípios, que considerava ser uma das bases principais de um regime\nliberal. Por essa época, mostrou-se cada vez mais vinculado aos\npressupostos do liberalismo político e econômico, sobretudo no que se\nreferia à não intervenção do Estado na economia. Tais princípios se\nfragilizariam no decorrer de sua carreira política, principalmente ao\nassumir cargos executivos. Aos poucos, foi caminhando rumo a uma postura\npor ele próprio qualificada de “protecionismo moderado”.\n\nAo longo de sua experiência política, seu interesse pelas finanças\npúblicas foi crescendo, e o ideal de responsabilidade fiscal tornou-se\num desafio pessoal. A ausência de cursos de economia no país abria\nespaço para que os bacharéis, médicos e engenheiros se especializassem\nno trato com a questão econômica, a partir da leitura autodidata de\nmanuais estrangeiros, sobretudo britânicos. Afonso Pena era um deles.\n\nSua experiência em postos executivos iniciou-se como ministro em três\ndiferentes pastas, tendo para isso que se licenciar de seu mandato\nparlamentar. Foi ministro da Guerra em 1882, da Agricultura, Comércio e\nObras Públicas em 1883-1884, e do Interior e Justiça em 1885. Apesar de\nter sido um civil a ocupar uma pasta militar, foi bem recebido pelos\nmilitares por defender a liberdade de expressão dos servidores e por\nadvogar a urgência de uma reforma que envolvesse o crescimento do número\nde efetivos do Exército, o aumento de suas dotações orçamentárias e sua\nurgente profissionalização. Parte dessas intenções só seria de fato\nefetivada quando assumiu a presidência da República, em 1906.\n\nComo ministro do Interior e Justiça teve a oportunidade de reformular\ntodo o sistema policial, modernizando seus equipamentos e aumentando\nsuas remunerações, para que os policiais pudessem dedicar-se\nexclusivamente às suas funções e para que fosse possível atrair para a\nforça policial pessoal mais qualificado. Foi também responsável por\nreformas no sistema penitenciário, para que melhores condições de\nsegurança e higiene pudessem ser implantadas. Nesse campo viveria seu\nmaior dilema, ao ter que reforçar o aprisionamento de escravos\nfugitivos, bem como levar a julgamento os abolicionistas que os\nauxiliavam nas fugas.\n\nNessa etapa de sua vida é que suas ambiguidades em relação à abolição\nficaram mais nítidas. Ao se tornar uma liderança de grande projeção\nnacional, suas ações passaram a refletir o abandono do ideal\nabolicionista da juventude em prol de uma preocupação maior com o\nimpacto das mudanças propostas e com a fidelidade a seu partido\npolítico. Nas discussões travadas no seio do Parlamento em relação à\nabolição, preocupou-se em acompanhar as votações da bancada mineira, que\ntemia o impacto negativo da abolição sem indenização sobre a saúde\nfinanceira da cafeicultura do estado. Tendo votado a favor da Lei Áurea,\ntrês anos depois manifestaria novamente seus temores em relação ao\nimpacto que a nova lei teria sobre a nação.\n\nPor ter uma relação muito próxima a Afonso Celso – que então recebeu o\ntítulo de visconde de Ouro Preto –, tornou-se conselheiro de Estado no\nano de 1888. Nessa função foi designado para compor a comissão\nresponsável pela reformulação do Código Civil Brasileiro, missão\ninterrompida pelo golpe militar que em 15 de novembro de 1889 implantou\na República no Brasil.\n\nA República no Brasil\n\nA reação de Afonso Pena diante da República, bem como a de boa parte dos\nmonarquistas convictos destronados, foi de aceitação resignada, motivada\npelo temor de que qualquer reação ao regime imposto mergulhasse o país\nem uma guerra civil, ainda mais cruenta do que a que se anunciava a\npartir da intervenção civil-militar. Muito embora pretendesse afastar-se\nda política, retomando seus projetos pessoais, aos poucos percebeu que o\ncenário sofria pequenas transformações e que seus inimigos de ontem\npoderiam tornar-se os amigos de amanhã.\n\nApós o 15 de novembro, os embates políticos dividiram a elite mineira.\nTão logo Deodoro da Fonseca assumiu a chefia do governo provisório,\nindicou para o governo de Minas o político Cesário Alvim, que se havia\nconvertido ao republicanismo muito tardiamente, desagradando assim aos\nprincipais membros da propaganda no estado. Dada sua trajetória política\nprévia e seu já conhecido papel conciliador na política, Afonso Pena –\nque havia atuado politicamente em maioria liberal ou conservadora com\ngrande desenvoltura – foi convidado pelo recém-criado Partido\nRepublicano Mineiro (PRM) a candidatar-se a senador estadual\nconstituinte em 1891, com a missão de ajudar a apaziguar os conflitos\nque emergiam no estado. Lá estava ele de volta à política, após breve\ninterregno. A seu favor contava sua relativa neutralidade em relação aos\nembates dos republicanos históricos contra os adesistas. Surpreendido\ncom o apoio recebido dos políticos do estado, dedicou-se com afinco ao\nprocesso de elaboração da Constituição estadual, liderando a comissão\ncriada para propor seu pré-projeto.\n\nO texto aprovado resultou em boa parte de suas ideias. O projeto previa\nconferir maior autonomia aos municípios, garantindo-lhes rendas extras.\nRecomendava a construção de uma nova capital para o estado, previa uma\nestrutura bicameral e o fortalecimento do Judiciário. Entre os projetos\npropostos o menos consensual era o da mudança da capital de Ouro Preto.\nPara evitar o acirramento das diferenças, Afonso Pena conseguiu que\nfosse aprovado o adiamento da decisão até que uma comissão de\nespecialistas, encarregada de estudar as diferentes possibilidades,\napresentasse aos parlamentares propostas mais específicas que melhor\nfundamentassem suas decisões. Com esse adiamento pôde construir a\nestabilidade necessária para que fossem votados outros projetos de\ninteresse do estado.\n\nEnquanto senador estadual, envolveu-se em outras questões que refletiam\nseu compromisso com a melhoria da situação econômica de Minas. Nesse\ncampo travou uma luta contra os interesses da Cia Leopoldina de Estradas\nde Ferro, de propriedade de ingleses e maior ferrovia do estado.\nColocando-se como porta-voz dos interesses dos cafeicultores mineiros,\naprovou medida que obrigava a companhia a cumprir integralmente com seus\ncompromissos, sob pena de perder a concessão de operar no país.\n\nDestacou-se também por sua preocupação de tornar o Poder Judiciário no\nestado mais forte e mais democrático. Nesse sentido, recomendou\nfortemente que os candidatos aos postos judiciários fossem nomeados\nmediante concurso público, ao invés de o serem com base em critérios\npuramente personalísticos, tal como vinha ocorrendo com frequência. Esta\núltima proposta revelava seu compromisso com a formação de uma\nburocracia mais técnica e menos vinculada à política de favorecimentos\npessoais, tão comum no Brasil. Muito embora não se possa afirmar que\ntenha sido um gestor que abriu mão das indicações pessoais ou mesmo do\nnepotismo, nota-se, em variadas ocasiões, sua preferência pelos\ncritérios de competência sobre o de favorecimentos pessoais. Tal postura\nse expressaria também na escolha de seu ministério quando presidente da\nRepública.\n\nAs disputas nacionais que marcaram a primeira década republicana tiveram\nrepercussões no destino de Afonso Pena. O fechamento do Congresso\nNacional por Deodoro (3/11/1891) levou Pena a renunciar a seu mandato em\nprotesto. Ao confrontar Deodoro nacionalmente, afastou-se de vez do\nalvinismo em Minas e ganhou o apoio de grande parte da elite mineira,\nque se sentia excluída das principais articulações políticas no interior\ndo estado.\n\nDe Presidente de Minas a Vice-Presidente da República\n\nApós a renúncia de Deodoro (23/11/1891), dificilmente Cesário Alvim –\nentão em seu segundo período no governo – conseguiria manter seu poder\nno estado, fortemente ameaçado por uma intervenção federal. Por outro\nlado, as ameaças separatistas internas se aprofundavam, dando sinais\ninequívocos da fragilidade do governo estadual. A renúncia de Alvim em\nfevereiro de 1892 abriu espaço para a emergência do nome de Afonso Pena\ncomo o único capaz de retomar a estabilidade política em Minas Gerais.\nSeu nome surgiu como um consenso natural entre as diversas forças em\nluta para suceder a Alvim.\n\nSua rápida passagem pelo governo de Minas, de 1892 a 1894, quando foi\nsubstituído por Bias Fortes, foi marcada por significativas realizações.\nEmpenhou-se na construção da nova capital, Belo Horizonte, e na fundação\nda Faculdade de Direito de Minas. Trabalhou pelo fortalecimento do\nensino público, criando vários grupos escolares pelo interior do estado.\n\nAos poucos, as vinculações de Afonso Pena com propostas mais\nintervencionistas cresciam, à medida que tentava resolver os sérios\nproblemas econômicos do estado. Um deles consistia na evasão de divisas\nprovenientes da exportação do café mineiro pelo porto do Rio de Janeiro.\nA solução do problema se deu através da criação de uma alfândega seca em\nJuiz de Fora, cidade que polarizava a produção cafeeira majoritária do\nestado, e da realização de um acordo com o presidente Floriano Peixoto,\nque garantia as rendas sobre o café para o estado produtor. Com isso, os\ncofres de Minas Gerais tiveram sua renda ampliada, diminuindo\nsensivelmente sua dependência econômica em relação ao Rio de Janeiro.\n\nA defesa da taxação de produtos estrangeiros importados como forma de\nsubsidiar a produção genuinamente nacional expressou mais uma vez seu\ncompromisso com as teses protecionistas. Naquela altura, Afonso Pena\natribuía ao Estado nacional um papel modernizador, capaz de conferir\nestímulos fundamentais ao crescimento econômico de uma nação que se via\njovem e emergente. Destaque-se que a mudança em sua trajetória, que\nmarcou o abandono das teses do *laissez-faire*, se deu a partir de suas\nprimeiras experiências em cargos executivos de maior monta, ou seja, a\npartir da década de 1880.\n\nOutro aspecto de seu intervencionismo manifestou-se através do\nestabelecimento de uma política imigrantista mais incisiva no estado.\nApós recusar a imigração chinesa, que para ele implicava o aporte de mão\nde obra não qualificada, apostou na vinda de imigrantes europeus com\nsuas famílias, em um projeto de colonização mais efetivo e permanente,\ntal como ocorrera nos Estados Unidos. Em que pesem os esforços\ngovernamentais realizados para esse fim, o número de imigrantes que\nforam trazidos para Minas foi bem menor do que o daqueles que migraram\npara outros estados brasileiros. Por um lado, o relativo fracasso da\nexperiência pode ser explicado em razão dos baixos salários pagos no\nestado e do seu sistema de parceria, que não atraía muito os imigrantes.\nPor outro lado, a epidemia de cólera que assolava Minas assustava os\nestrangeiros. Além disso, outros países apresentavam-se como mais\natraentes para os imigrantes europeus, como os Estados Unidos e a\nArgentina, por conta do clima mais ameno e das melhores condições de\ntrabalho propostas.\n\nNo que tange à política nacional, Afonso Pena foi signatário do\n“Manifesto aos Mineiros”, publicado no jornal *O País*, documento\nescrito com o objetivo de conferir sustentação política a Floriano em\nseu duro embate contra a Revolta da Armada. Sua postura afastava\nqualquer ameaça de intervenção em Minas e conferia a Floriano o apoio\nirrestrito em sua luta contra os rebeldes, inclusive oferecendo a ele o\napoio da Força Pública mineira em caso de necessidade. No entanto, esse\napoio a Floriano não significou um compromisso irrestrito com a\npermanência do marechal no poder. Afonso Pena mostrou-se claramente\nfavorável ao retorno dos civis ao controle da República, conferindo\nsustentação política à candidatura de Prudente de Morais no intricado\nprocesso sucessório que se anunciava.\n\nEm meio às intensas disputas que marcavam não só a política mineira como\na nacional, Afonso Pena foi convidado a ocupar postos variados no\nprimeiro governo civil republicano, chefiado por Prudente de Morais\n(1894-1898). Após ter recusado vários convites, aceitou apenas o posto\nde presidente do Banco da República, principal estabelecimento bancário\nda época, cargo em que permaneceu de 1895 até 1898.\n\nA opção de Afonso Pena justificava-se por sua longa amizade, que datava\ndos tempos de faculdade, com o então ministro da Fazenda, Rodrigues\nAlves. Juntos, empreenderiam uma série de reformas econômicas no sentido\nde resolver a crise financeira em que se encontrava o país após o\nEncilhamento. Tais medidas implicavam a recuperação do crédito nacional\ne o estabelecimento de medidas de contenção dos gastos públicos e de\nvalorização da moeda. Vinculado a uma plataforma ainda mais\nprotecionista, Pena sugeriu a Prudente de Morais que estabelecesse uma\npolítica tarifária que tributasse os produtos estrangeiros que tivessem\nsimilares produzidos no Brasil, principalmente os produtos têxteis e\nalimentícios, o que foi aprovado pelo Congresso em 1896.\n\nDurante o governo de Campos Sales (1898-1902), após uma breve passagem\npela Câmara de Belo Horizonte, onde foi presidente do Conselho\nDeliberativo, foi designado, em 1899, presidente da Comissão Industrial\nde Minas Gerais, instituição criada com o fim de desenvolver a indústria\nextrativa do estado. O relatório do trabalho da comissão concluiu pela\nnecessidade de investimento estatal com o fim de modernizar a\nmaquinaria, diminuir os custos com fretes na zona metalúrgica do estado\ne construir vias férreas que facilitassem o transporte do minério. Para\nque tais objetivos fossem contemplados, Afonso Pena sugeriu que fosse\nestabelecida uma parceria entre o capital estatal e estrangeiro,\nviabilizando o crescimento do setor.\n\nSeu retorno ao Senado Estadual (1899-1902) foi interrompido por ter sido\nconvidado a ocupar o lugar de Silviano Brandão, que em março de 1902 foi\neleito vice-presidente da República na chapa encabeçada por Rodrigues\nAlves, mas faleceu antes da posse.\n\nNa condição de vice-presidente (1902-1906), Afonso Pena capacitou-se\npara disputar a presidência. Na ocasião, os principais conflitos que\ndividiam as elites políticas mineiras encontravam-se razoavelmente\narrefecidos, possibilitando ao estado emergir como força política\nconsistente na disputa por fatias de poder no novo regime. No entanto,\nos paulistas, líderes do processo de implantação da República, não se\ndisporiam a abandonar o projeto de eleger a quarta presidência\nsucessiva, com a indicação de Bernardino de Campos.\n\nAo lado de Minas Gerais, outras oligarquias de maior importância no\nquadro nacional igualmente aspiravam a uma maior participação. Dessa\nforma, diferentemente das três sucessões anteriores, a de Rodrigues\nAlves foi objeto de disputas intensas entre os estados, que viam na\ntentativa de prorrogação da hegemonia paulista sobre a nação um\nobstáculo às suas pretensões.\n\nPela primeira vez, parte dos grandes estados conseguiu se unir em torno\nde uma candidatura presidencial que não fosse a preferida dos paulistas.\nTal coligação ficou conhecida como “o Bloco” e reuniu os estados de\nMinas Gerais, Rio Grande do Sul, Bahia e Rio de Janeiro. Dos vários\nnomes apresentados como pré-candidatos à presidência da República, o de\nAfonso Pena pareceu ser o mais forte. A chapa Afonso Pena-Nilo Peçanha\n(RJ) foi eleita para governar o Brasil de 1906 a 1910 com 97,9% dos\nvotos e a participação de 1,4% de votantes. Derrotados em suas\npretensões, os paulistas se afastaram e permaneceram num ostracismo\npolítico prolongado, só interrompido após a sucessão de Venceslau Brás\n(1914-1918).\n\nPresidente da República\n\nAntes de assumir a presidência, Pena fez uma viagem de três meses pelo\npaís com o objetivo de conhecer melhor a realidade nacional. Percorreu\nmais de 21 mil quilômetros e visitou 18 capitais brasileiras. Seus\nrelatos pessoais de viagem informam que boa parte de seus colaboradores\nfoi escolhida a partir do conhecimento travado com novas lideranças nas\nvárias regiões visitadas. Por essa razão, cercou-se de ministros e\napoiadores muito jovens e ainda desconhecidos no cenário político na\nocasião. Dada essa circunstância, seu grupo de sustentação política\nficou conhecido como “Jardim de infância”. À exceção de Rio Branco,\nministro das Relações Exteriores, e dos ministros militares – Hermes da\nFonseca e Alexandrino Alencar – os demais ministros foram escolhidos à\nrevelia das lideranças oligárquicas consolidadas, boa parte delas\nresponsáveis por sua própria eleição – a exemplo do político baiano Rui\nBarbosa e do gaúcho Pinheiro Machado. Expressava-se aqui a preferência\njá anunciada de Afonso Pena por critérios de recrutamento político menos\npersonalísticos e mais técnicos.\n\nPor essa razão, seu governo foi sustentado por dois grupos distintos que\ndisputavam entre si: de um lado, os membros do “Jardim de infância”, que\nocupavam importantes pastas ministeriais e tinham apoio de boa parte da\nimprensa e importante sustentação no Parlamento a partir das lideranças\nde Carlos Peixoto (presidente da Câmara) e James Darci (líder da\nmaioria); de outro, os políticos mais tradicionais que se reuniam no\n“Bloco”, capitaneados por Pinheiro Machado. Esse agrupamento havia sido\nresponsável pela eleição de Pena e se sentia excluído após a escolha dos\nministros. Porém o presidente eleito fazia questão de mostrar-se\nindependente em relação a ambos os grupos. Em discurso proferido por\nocasião da posse do governador mineiro João Pinheiro, Pena teria\nressaltado sua intenção de estar acima de todas as divergências\npolíticas, escapando da tutela de qualquer agrupamento ou partido. Os\njornais do dia seguinte atribuíram-lhe uma frase, segundo fontes\ndisponíveis jamais proferida, mas que sintetizava seus anseios por\nautonomia: “Quem faz política sou eu.” Afonso Pena tentaria arduamente\nmanter os dois grupos políticos sob seu controle, num esforço\nconciliador que já se tornara a marca de sua personalidade.\n\nEntre suas inúmeras realizações à frente do governo brasileiro\ndestacaram-se um forte investimento na infraestrutura do país, a partir\nda construção de portos, de uma usina hidroelétrica e da expansão das\nredes férrea e telegráfica. No campo social foram realizadas inúmeras\nobras de saneamento básico, com a reorganização do Instituto de\nManguinhos – que passou a se chamar Osvaldo Cruz – e a criação de uma\nrepartição internacional de higiene pública, como em outros países\neuropeus.\n\nNo que tange à política econômica, sua maior contribuição foi a\nviabilização do Convênio de Taubaté, primeira política de proteção ao\ncafé instituída no Brasil, através da participação do governo federal\ncomo avalista do empréstimo financeiro que tornou possível efetivá-lo.\nComo se sabe, o convênio foi uma operação que envolveu os três estados\ncafeicultores do período, São Paulo, Minas Gerais e Rio de Janeiro. Mas\na presença de uma parceria mineiro-fluminense no poder alterou os rumos\ndo convênio após sua aprovação em 1906. As operações eram sempre\ncapitaneadas por São Paulo, o maior produtor nacional de café, e muitas\ndas decisões tomadas iam de encontro aos interesses de produtores\nmineiros e fluminenses. Tão logo se fez necessária uma participação\nmaior da União na operação, mudanças tiveram que ser feitas para que os\ninteresses dos três estados envolvidos fossem contemplados.\n\nPara que o volumoso empréstimo internacional, que viabilizaria a compra\ndo café e sua posterior estocagem, fosse contratado, o aval da União se\nfazia necessário, uma vez que os credores internacionais exigiam\ngarantias de ressarcimento que iam além das disponibilidades\norçamentárias de São Paulo. Afonso Pena condicionou seu aval ao\natendimento dos interesses específicos da cafeicultura mineira e também\nfluminense, que produziam um café de qualidade inferior, preterido nas\noperações de compra pelos cafeicultores paulistas. Dessa forma, a União\nsó viabilizou a operação a partir da obediência a três condições\nbásicas: a inclusão dos tipos inferiores nas operações, a inclusão de\nfiscais mineiros e fluminenses na comissão responsável pela\nclassificação dos tipos de café e a garantia do apoio dos paulistas à\ncandidatura de Davi Campista à sucessão presidencial. O aval da União ao\nempréstimo que viabilizaria o convênio só ocorreu em novembro de 1908,\napós todas as condições terem sido atendidas, não obstante as contínuas\npressões exercidas pelos paulistas sobre o Catete desde 1906.\n\nA manutenção da estabilidade cambial e o equilíbrio das finanças\npúblicas foram garantidos pelo bom funcionamento da Caixa de Conversão.\nO instituto não pôde ser aprovado em conjunto com a lei que instituiu o\nConvênio de Taubaté, em razão da oposição que lhe fazia o então\npresidente Rodrigues Alves. Rodrigues Alves e seu ministro da Fazenda,\narraigados na ortodoxia liberal, recusavam qualquer tipo de controle do\nEstado sobre o câmbio. Mas Afonso Pena, já eleito e ainda não empossado,\nconcordara plenamente com o instituto, por julgá-lo condição\nindispensável ao equilíbrio das finanças públicas. Tal apoio atestava\nmais uma vez as contínuas vinculações de Pena a uma política econômica\nmenos ortodoxa e mais intervencionista sobre a economia.\n\nNo que tange à defesa nacional, a presidência de Afonso Pena destacou-se\npela reorganização do Exército brasileiro, sobretudo a partir da\ninstituição do serviço militar obrigatório, garantindo à força o\ncrescimento contínuo do número de seus efetivos e sua\nprofissionalização. Ocorreu também uma reorganização da Marinha, através\nde seu reaparelhamento com a compra de novos navios.\n\nDestacou-se ainda, entre suas incontáveis realizações, o estabelecimento\nde uma política imigrantista mais efetiva, preocupação que o acompanhava\ndesde o período em que fora presidente de Minas Gerais. Sua opção foi\npela criação de colônias que receberiam os estrangeiros para a produção\nespecífica de trigo e vinho no Sul do país. Foi igualmente em seu\ngoverno que a imigração japonesa para o Brasil recebeu incentivo\nespecial, o que resultou na vinda de 781 imigrantes para trabalhar na\ncafeicultura paulista. Estima-se que cerca de cem mil colonos entraram\nno Brasil ao longo de seu mandato.\n\nPena foi também o criador de uma nova pasta, o Ministério dos Negócios\nda Agricultura, Indústria e Comércio, o qual só veio a funcionar\nefetivamente após sua morte. Tal pasta reunia os interesses de outros\nsetores agrícolas que não os do café. Segundo informações disponíveis, a\ncriação da nova pasta significou a abertura de um espaço político para a\nmanifestação de interesses de um setor da elite política brasileira mais\ncomprometida com as propostas de diversificação da pauta de exportação\nagrícola do país. Destaque-se que, entre os presidentes da Primeira\nRepública, Afonso Pena era o mais comprometido com o desenvolvimento\nindustrial do país, muito embora não deixasse de lado os interesses\nagrários, então predominantes. Provavelmente esse interesse resultava de\nsuas próprias experiências como homem de negócios.\n\nEnquanto Afonso Pena esteve à frente do Catete, João Pinheiro, seu\naliado político, era presidente de Minas e membro do “Jardim de\ninfância”. Tudo caminhava em direção à escolha de seu nome como\ncandidato à sucessão presidencial, muito embora outros nomes\nalternativos já surgissem. A morte prematura de João Pinheiro mudaria a\nordem dos acontecimentos, abrindo espaço para negociações e disputas\npolíticas, muito comuns em cada sucessão da Primeira República.\n\nRui Barbosa saíra fortalecido por sua participação na Conferência de\nHaia e se colocava como candidato. Hermes da Fonseca, ministro de Afonso\nPena, havia igualmente aumentado seu capital político pelas mudanças que\nhavia feito em benefício do Exército, principalmente a instituição do\nsorteio militar obrigatório. Um terceiro nome havia sido colocado, o de\nRodrigues Alves, logo descartado pelo Catete, a despeito das relações de\namizade, por este não ter aderido à política cambial em vigor. Na\nausência de nomes que lhe agradassem, Afonso Pena indicou seu ministro\nda Fazenda, Davi Campista, que se havia destacado no controle sobre a\nCaixa de Conversão e no acompanhamento das operações envolvidas no\nConvênio de Taubaté.\n\nPorém nenhuma das candidaturas postas chegava sequer a aglutinar as\nbases de apoio do governo. O nome de Campista não agradava a todos os\nmembros do “Jardim de infância”, e os integrantes do “Bloco” dividiam-se\nentre os vários nomes anunciados. Afonso Pena tinha assim suas bases\ndivididas. Manteve sua insistência no nome de Davi Campista, mas a\nindicação sofreu veto por parte dos mais preeminentes líderes políticos\nde Minas, como Venceslau Brás e Bias Fortes, além dos membros do\n“Bloco”.\n\nPinheiro Machado apressou-se em articular a candidatura militar de\nHermes da Fonseca, compondo a chapa Hermes da Fonseca-Venceslau Brás.\nCom isso, o Rio Grande do Sul e Minas Gerais caminhavam juntos à revelia\ndo Catete. Pena sentia que suas bases políticas em Minas encontravam-se\nbastante fragilizadas. E nacionalmente só contava com o apoio de São\nPaulo, apoio muito tímido devido às circunstâncias em que fora obtido.\nEm razão dessa difícil conjuntura, coube-lhe apenas recuar, retirando a\ncandidatura de Campista. A insistência de Rui em manter-se candidato\nacabou lhe carreando o apoio dos paulistas, que temiam pelos rumos do\nconvênio, uma vez que Pinheiro Machado, padrinho da chapa\nHermes-Venceslau, se havia oposto duramente à política de valorização do\ncafé. Além dos paulistas, parte da oligarquia baiana estava com Rui, bem\ncomo alguns setores das oligarquias mineiras (o grupo do “Jardim de\ninfância”) e parte das oligarquias fluminenses. O resultado foi a\nocorrência de uma primeira árdua disputa eleitoral no país, travada\nentre civilistas e hermistas.\n\nAfonso Pena não pôde, porém, acompanhar o desfecho dessa história.\nMorreu no dia 14 de junho de 1909 no palácio do Catete, após ser\nacometido de forte pneumonia. O agravamento da doença se deu em razão da\nperda de seu jovem filho Álvaro, da morte de um irmão querido e,\ncertamente, da impossibilidade de fazer seu sucessor. Seu mandato foi\nconcluído pelo vice-presidente Nilo Peçanha.\n\nAlém de ter feito uma proeminente carreira política, Afonso Pena foi um\ndos fundadores da Faculdade Livre de Ciências Jurídicas e Sociais,\ncriada em 1892 e sediada em Ouro Preto, da qual foi diretor e professor\nde economia política e ciência das finanças. Advogado, político e\nprofessor, foi também um homem de negócios. Seus pais lhe deixaram\npropriedades e riquezas a serem administradas. Além de uma mina de ouro,\nque teve que ser vendida após contínua queda da produção, por volta do\nfinal do século XIX Pena possuía uma fábrica têxtil, vendida na primeira\ndécada do novo século XX para a família Mascarenhas, conhecida entre as\nmais industrialistas do período em Minas Gerais. Tinha ainda inúmeros\ninvestimentos no mercado financeiro nacional e internacional. Para\nauxiliá-lo nesse campo contava com a valiosa ajuda de João Ribeiro de\nOliveira Sousa, que veio a tornar-se, por sua indicação, presidente do\nmaior banco de Minas Gerais, o Banco de Crédito Real, e depois\npresidente do Banco do Brasil, em seu período na presidência da\nRepública.\n\nCasado com Maria Guilhermina de Oliveira Pena, filha do visconde de\nCarandaí e descendente do marquês de Maricá, Afonso Pena teve nove\nfilhos, quatro mulheres e cinco homens. O filho Afonso Pena Júnior foi\nministro da Justiça e membro da Academia Brasileira de Letras. A filha\nMaria da Conceição Moreira Pena casou-se com Edmundo da Veiga, a quem\nnomeou, quando presidente de Minas, diretor da Imprensa Oficial do\nestado, e quando presidente da República, seu primeiro-secretário. Era\ntambém cunhado e primo de Feliciano Pena, deputado e senador por Minas\nGerais.\n\nCláudia Maria Ribeiro Viscardi\n\n**FONTES:** BARBOSA, F *JK*; CARVALHO, A. *Vultos*; CARVALHO, A.\nC*onspiração*; CARVALHO, D. *Capítulos*; FRANCO, A. *Estadista*; FRANCO,\nA. *Rodrigues*; LACOMBE, A. *Afonso Pena*; MENDONÇA, S. *Ruralismo*;\nMONTEIRO, N. *Dicionário*; MORAES FILHO, E. *Campanha*; PENNA, A.\n*Alguns*; REIS, M. *Trajetória*; VIEIRA, J. *Cadeia*; VISCARDI, C.\n*Teatro*; WEINER, J. *Afonso Pena*.\n","ref":"**FONTES:** BARBOSA, F *JK*; CARVALHO, A. *Vultos*; CARVALHO, A.\nC*onspiração*; CARVALHO, D. *Capítulos*; FRANCO, A. *Estadista*; FRANCO,\nA. *Rodrigues*; LACOMBE, A. *Afonso Pena*; MENDONÇA, S. *Ruralismo*;\nMONTEIRO, N. *Dicionário*; MORAES FILHO, E. *Campanha*; PENNA, A.\n*Alguns*; REIS, M. *Trajetória*; VIEIRA, J. *Cadeia*; VISCARDI, C.\n*Teatro*; WEINER, J. *Afonso Pena*.\n","dic":"DHBPR"}
