{"title":"PENA, Domingos Moreira dos Santos","cargoss":["Deputado federal"],"cargos_esp":[0],"datas_ini":[1907],"datas_fim":[1911],"estados":["MG"],"autor":["Luciana Pinheiro"],"content":"**PENA, Domingos Moreira dos Santos**\n\n\\*dep. fed. MG 1907-1911.\n\n*Domingos Moreira dos Santos Pena* nasceu em Santa Bárbara (MG) no dia 7\nde janeiro de 1855. Seu tio Afonso Pena foi deputado, ministro da Guerra\n(1882), ministro da Agricultura (1883-1884), ministro do Interior\n(1885), presidente de Minas Gerais (1892-1894) vice-presidente\n(1902-1906) e presidente da República (1906-1909).\n\nMédico graduado pela Faculdade de Medicina do Rio de Janeiro, depois de\nformado retornou à cidade natal e aí passou a clinicar. Exerceu também\nas funções de presidente da Intendência Municipal e de delegado de\nHigiene.\n\nEntusiasta do governo republicano, em 1907, no decorrer da legislatura\n1906-1908, foi eleito deputado federal na vaga de Manuel Tomás de\nCarvalho Brito. Tomou posse na Câmara dos Deputados em maio de 1907 e em\n1909 foi reeleito. Nesse mesmo ano participou da Campanha Civilista de\nRui Barbosa. Após o término de seu mandato em dezembro de 1911, foi\neleito em 1912 vereador em Santa Bárbara e escolhido presidente da\nCâmara Municipal.\n\nFaleceu em sua cidade natal em 28 de agosto de 1912.\n\nEra casado com Inês de Castro Moreira Pena.\n\nLuciana Pinheiro\n\n**FONTES:** CÂM. DEP. *Deputados brasileiros* (p.68); MONTEIRO, N.\n*Dicionário* (v.2, p.515).\n","ref":"**FONTES:** CÂM. DEP. *Deputados brasileiros* (p.68); MONTEIRO, N.\n*Dicionário* (v.2, p.515).\n","dic":"DHBPR"}
