{"title":"PENTEADO, Joaquim Augusto de Barros","cargoss":["Deputado federal"],"cargos_esp":[0],"datas_ini":[1906],"datas_fim":[1923],"estados":["SP"],"autor":["Dirceu Franco"],"content":"**PENTEADO, Joaquim Augusto de Barros**\n\n\\*dep. fed. SP 1906-1923.\n\n*Joaquim Augusto de Barros Penteado* nasceu em Limeira (SP) no dia 3 de\nagosto de 1872, filho de Manuel de Toledo Barros e de Maria Augusta\nPenteado de Barros. Seu pai, herdeiro de tradicional família mineira,\ninstalou-se em Limeira no final do século XIX a fim de prosperar na\ncafeicultura e foi chefe do Executivo da cidade em 1888 e 1900.\n\nApós estudar nos colégios Bacelar e Moretzsohn, bacharelou-se em\nciências jurídicas e sociais pela Faculdade de Direito de São Paulo em\n1894. Retornou então à cidade natal para iniciar sua carreira como\nadvogado, político, jornalista e fazendeiro. Dedicando-se à produção de\nlaranja, concorreu em prestígio com as tradicionais fazendas de café.\n\nEleito pela primeira vez para a Câmara Municipal de Limeira em 1895,\npelo Partido Republicano Paulista (PRP), conseguiu se reeleger até 1902.\nEm 1904 foi eleito deputado estadual e destacou-se por conseguir\nincentivos para a conclusão da construção do edifício que abrigou o\nGrupo Escolar de Santa Bárbara. Em 1906 elegeu-se deputado federal.\nAssumindo o mandato em maio, permaneceu longos anos na capital do país,\nconseguindo se reeleger para mais cinco legislaturas. Após encerrar o\núltimo mandato na Câmara dos Deputados em dezembro de 1923, foi eleito\nsenador estadual na vaga deixada por Lacerda Franco, com mandato de 1925\na 1927. Em função de seu prestígio e influência, ocupou a posição de\nsegundo-secretário da Mesa Diretora do Senado Estadual.\n\nComo jornalista, foi responsável pela criação e direção do jornal\n*Limeirense*.\n\nFaleceu em Limeira no dia 3 de abril de 1949.\n\nDirceu Franco\n\n**FONTES:** CÂM. DEP. *Deputados brasileiros*; CARACANHA, L. *Primeira*;\nFONSECA, A.; FONTES JR., A. *Senado*.\n","ref":"**FONTES:** CÂM. DEP. *Deputados brasileiros*; CARACANHA, L. *Primeira*;\nFONSECA, A.; FONTES JR., A. *Senado*.\n","dic":"DHBPR"}
