{"title":"PEREGRINO, Cícero","cargoss":["Prefeito"],"cargos_esp":[0],"datas_ini":[1918],"datas_fim":[1922],"estados":["DF"],"autor":[0],"content":"**PEREGRINO, Cícero**\n\n\\* pref. DF 1918-1922.\n\n*Manuel Cícero Peregrino da Silva* nasceu em Recife em 1866, filho de\ntradicional família pernambucana.\n\nBacharel pela Faculdade de Direito do Recife, aí ocupou posteriormente a\nfunção de bibliotecário. Pelo trabalho desenvolvido na biblioteca da\ninstituição, de que tomou conhecimento o então ministro da Justiça\nEpitácio Pessoa (1898-1901), foi nomeado diretor da Biblioteca Nacional\nem 30 de julho de 1900, cargo que exerceria, com interrupções, até 1924.\n\nEm seus relatórios anuais, costumava expor a necessidade de uma nova\nsede para a Biblioteca Nacional, à época localizada no largo da Lapa em\num prédio que não comportava adequadamente o imenso volume de obras. Com\nessa preocupação, ampliou a capacidade do prédio para a aquisição de\nnovas obras, além de implantar serviços de ordem técnica. O novo prédio\nda Biblioteca Nacional, na avenida Central, depois avenida Rio Branco,\nno Centro do Rio de Janeiro, teve sua pedra fundamental lançada em 1905\ne foi inaugurado em 29 de outubro de 1910.\n\nCícero Peregrino propôs também algumas reformas administrativas, que\nforam incluídas no Decreto n^o^ 8.835, de 11 de julho de 1911. Entre\noutras medidas, o decreto criou um conselho consultivo, determinou os\ndeveres dos diretores e promoveu o aprimoramento dos funcionários da\nBiblioteca Nacional. Foram assim introduzidos cursos técnicos de\nformação e capacitação dos bibliotecários, o que resultou na concepção,\nainda em 1911, do primeiro curso de biblioteconomia do Brasil, origem do\ncurso de graduação da atual Universidade Federal do Rio de Janeiro. O\nDecreto n^o^ 8.835 indicava ainda que caberia à Biblioteca Nacional um\nlevantamento das coleções bibliográficas existentes no país, a fim de\nque fossem registradas em um único catálogo, cuja cópia seria enviada ao\nInstituto Internacional de Bibliografia de Bruxelas. O decreto também\ndeterminava que as instituições brasileiras se responsabilizassem pelo\nenvio à Biblioteca Nacional dos exemplares do que era editado em todas\nas regiões do país, de modo a torná-la uma instituição de preservação do\npatrimônio bibliográfico brasileiro.\n\nEm 1918, quando Rodrigues Alves foi eleito presidente da República,\nespeculava-se que seria escolhido prefeito do Distrito Federal o\nengenheiro Paulo de Frontin. Entretanto, o presidente eleito não teve\nchance de tomar posse, por problemas de saúde. Quem passou a ocupar o\ncargo interinamente foi o vice-presidente Delfim Moreira (15 de novembro\nde 1918 a 28 de julho de 1919), que nomeou Cícero Peregrino prefeito do\nDistrito Federal. Na ocasião este era diretor geral de Instrução do\nprefeito Amaro Cavalcanti (1917-1918), a quem veio substituir. Empossado\nem 16 de novembro de 1918, exerceria o cargo até 22 de janeiro de 1922.\nSua administração não teve um programa de grandes proporções. Como\nprefeito interino, limitou-se a dar continuidade às obras da\nadministração anterior. Exerceu rígido controle sobre as despesas\nmunicipais, somente empregando recursos nos gastos imprescindíveis.\n\nFoi ainda reitor da Universidade do Rio de Janeiro entre os anos de 1926\ne 1930, e em 1937 foi indicado pelo presidente Getúlio Vargas como um\ndos representantes do Brasil no I Congresso de História da Expansão\nPortuguesa no Mundo, em Lisboa. Presidiu o Instituto Histórico e\nGeográfico Brasileiro (IHGB) entre 1938 e 1939 e foi um dos fundadores\ndo Instituto Histórico de Petrópolis, criado em 1938 com apoio do IHGB.\n\nFaleceu no Rio de Janeiro em 1956.\n\nSão de sua autoria os seguintes livros: *A justiça penal entre os\nromanos* (1895), *Da* *admissibilidade da prescrição em matéria penal*\n(1896), *Catálogo geral da Biblioteca de Direito do Recife* (1896), *O\npatriarca dos jornalistas brasileiros* (1923), *Pernambuco e a\nConfederação do Equador* (1924) e *Apontamentos sobre as primeiras\nrelações diplomáticas entre a República do Peru e o Império do Brasil*\n(1925).\n\nCláudia Mesquitta\n\n**FONTES:** ANDRADE, R. *Manuel*; REIS, J. *Rio de Janeiro.*\n","ref":"**FONTES:** ANDRADE, R. *Manuel*; REIS, J. *Rio de Janeiro.*\n","dic":"DHBPR"}
