{"title":"PEREIRA, Antônio Prado Lopes","cargoss":["Presidente de associação ou confederação de empregados ou empregadores","Deputado federal","Deputado federal"],"cargos_esp":[0,0,0],"datas_ini":[1910,1912,1919],"datas_fim":[1910,1914,1930],"estados":["MG","MG","PA"],"autor":["Adrianna Setemy","Vanessa Lana"],"content":"**PEREIRA, Antônio Prado Lopes**\n\n\\*pres. MG 1910; dep. fed. MG 1912-1914; dep. fed. PA 1919-1930.\n\n*Antônio Prado Lopes Pereira* nasceu em Curralinho, na ilha de Marajó\n(PA), no dia 24 de maio de 1864, filho do militar João Lopes Pereira e\nde Maria Craveiro Lopes Pereira.\n\nApós estudar no Seminário do Carmo e no Liceu Paraense, em Belém,\ntransferiu-se para o Rio de Janeiro, então capital do Império, e aí se\nformou em engenharia civil na Escola Politécnica em 1888. Já como\nengenheiro, participou do quadro técnico da Estrada de Ferro\nRecife-Caruaru, em Pernambuco, e das comissões de estudos das estradas\nde ferro Baturité, entre os estados do Ceará e Pernambuco, e Leopoldina\nRailway, entre a cidade de Carangola (MG) e o estado do Espírito Santo,\nbem como da comissão que estudou o prolongamento da Central do Brasil de\nOuro Preto a Itabira do Mato Dentro (atual Itabira), em Minas Gerais.\nFoi ainda membro da Comissão Construtora da Nova Capital de Minas\nGerais, Belo Horizonte, cujos trabalhos se estenderam de 1894 a 1897.\nApós a inauguração da cidade tornou-se empresário, fundando a empresa de\nconstrução civil Prado Lopes, que construiu edifícios públicos na\ncapital mineira. Cursou também a Faculdade de Livre Direito de Minas\nGerais e bacharelou-se em 1905.\n\nIngressou na política em 1907 como deputado estadual em Minas Gerais e\nrenovou o mandato até 1914. Presidente da Assembleia, exerceu\ninterinamente o governo de Minas entre 5 de fevereiro e 21 de março de\n1910 por conta do afastamento do presidente do estado Venceslau Gomes e\ndo vice-presidente Júlio Bueno Brandão, para candidatura a outros cargos\neletivos, e dos problemas de saúde do presidente do Senado Estadual,\nAntônio Gonçalves Chaves Júnior, que o impediram de assumir o cargo. Em\n1911, foi um dos fundadores da Escola Livre de Engenharia de Belo\nHorizonte, na qual se tornaria professor das cadeiras de Estradas de\nferro e de rodagem e de Materiais de construção.\n\nAntes de completar o último mandato de deputado estadual, elegeu-se\ndeputado federal por Minas em 1912. Assumindo sua cadeira na Câmara dos\nDeputados, no Rio de Janeiro, então Distrito Federal, no dia 3 de maio\ndo mesmo ano, exerceu o mandato até 31 de dezembro de 1914. Em 1917\ndeixou Minas Gerais para exercer a função de superintendente da\nCompanhia de Estradas de Ferro Minas de São Jerônimo, no Rio Grande do\nSul.\n\nEstando em curso a legislatura 1918-1920, foi novamente eleito deputado\nfederal, agora pelo Pará, em eleição suplementar realizada em 1919.\nTomou posse no dia 23 de maio e foi reeleito para as legislaturas\n1921-1923, 1924-1926, 1927-1929 e 1930-1932. Foi líder de bancada,\npresidente e relator da Comissão de Obras Públicas e da Comissão de\nFinanças. Teve o mandato interrompido em 23 de outubro de 1930 com a\nvitória da revolução que levou Getúlio Vargas ao poder extinguiu todos\nos órgãos legislativos do país. Transferiu-se então para São Paulo e\nposteriormente para o Rio de Janeiro, onde residiu até falecer, em 20 de\nagosto de 1941.\n\nEra casado com Joaquina de Gouveia Proença.\n\nAdrianna Setemy/ Vanessa Lana\n\n**FONTES:** CÂM. DEP. *Deputados brasileiros*; GOV. MG. Disponível em:\n\\<www.mg.gov.br/governomg/comunidade/governomg/galeria-de-governadores/antonio-do-prado-lopes-pereira/5794\\>.\nAcesso em: 20/5/2010; MONTEIRO, N. *Dicionário*; Projeto de imagem de\npublicações oficiais brasileiras do Center for Research Libraries e\nLatin-american Microfilm Project. *Mensagens dos Presidentes de\nProvíncia (1830-1930).* Disponível em:\n\\<www.crl.edu/content.asp?l1=4&l2=18&l3=33\\>. Acesso em: 8/1/2009.\n","ref":"**FONTES:** CÂM. DEP. *Deputados brasileiros*; GOV. MG. Disponível em:\n\\<www.mg.gov.br/governomg/comunidade/governomg/galeria-de-governadores/antonio-do-prado-lopes-pereira/5794\\>.\nAcesso em: 20/5/2010; MONTEIRO, N. *Dicionário*; Projeto de imagem de\npublicações oficiais brasileiras do Center for Research Libraries e\nLatin-american Microfilm Project. *Mensagens dos Presidentes de\nProvíncia (1830-1930).* Disponível em:\n\\<www.crl.edu/content.asp?l1=4&l2=18&l3=33\\>. Acesso em: 8/1/2009.\n","dic":"DHBPR"}
