{"title":"PEREIRA, Baltasar de Albuquerque Martins","cargoss":["Deputado federal"],"cargos_esp":[0],"datas_ini":[1912],"datas_fim":[1920],"estados":["PE"],"autor":["Raimundo Helio Lopes"],"content":"**PEREIRA, Baltasar de Albuquerque Martins**\n\n\\*dep. fed. PE 1912-1920.\n\n*Baltasar de Albuquerque Martins Pereira* nasceu em Recife no dia 6 de\njaneiro de 1862, filho de Guilhermino de Albuquerque Martins Pereira e\nde Teodolina Jacome Martins Pereira.\n\nFez os estudos secundários em Recife e depois ingressou na Faculdade de\nDireito, mas abandonou o curso após dois anos para ingressar no\nExército. Ainda estudante, foi auxiliar de redação do jornal *A\nProvíncia* e fundou, em 1887, a revista literária *A Alvorada*. Como\ntenente do Exército atuou na Força Pública de Pernambuco em 1890.\nAbandou em seguida a vida militar para se dedicar às atividades\nliterárias e jornalísticas e à vida política. De 1891 a 1911 foi redator\nde *A Província* e em 1894 foi diretor geral da Secretaria do Conselho\nMunicipal de Recife. Por suas atividades literárias fundou em Recife, em\n1906, o Grêmio Literário Baltasar Pereira, do qual faziam parte Mendes\nMartins, Manuel Duarte, Oscar Brandão, Afonso Saldanha, Adelmar Tavares,\nSilva Lobo, Samuel Lins, Silveira Carvalho, Horácio Saldanha, Uriel de\nHolanda e outros. Em 1912 escreveu no jornal *O Norte* e posteriormente\nno *A Ordem*. Também escreveu nos periódicos pernambucanos *Jornal\nPequeno*, *O Tempo* e *Revista Pernambucana*.\n\nAinda em 1912 foi eleito deputado federal por Pernambuco. Assumiu em\nmaio sua cadeira na Câmara dos Deputados, no Rio de Janeiro, então\nDistrito Federal, e em 1914 representou seu estado no I Congresso\nNacional de História, realizado na capital do país. Em 1915 foi reeleito\ndeputado federal e no ano seguinte representou Pernambuco em um\ncongresso realizado na Paraíba que discutiu o fim dos impostos entre os\ndois estados. Em 1918 teve o mandato renovado até dezembro de 1920.\nDurante esses anos, foi líder da bancada de seu estado e membro da\nComissão de Finanças.\n\nNo Rio de Janeiro, colaborou com a *Revista da Semana* e *Careta*.\n\nFaleceu nessa cidade em 4 de agosto de 1928.\n\nPublicou *Vida alheia* (1892), *Cousas simples* (1894), *Traves e\nArgueiros* (1900), *Furo*s (1900), *Cousas de ontem* (1903), *Fábulas em\nprosa* (1906) e *Livro de fábulas* (1925).\n\nRaimundo Helio Lopes\n\n**FONTES:** ABRANCHES, J. *Governos*; CÂM. DEP. *Deputados brasileiros*;\nVELHO SOBRINHO, J. *Dicionário*.\n","ref":"**FONTES:** ABRANCHES, J. *Governos*; CÂM. DEP. *Deputados brasileiros*;\nVELHO SOBRINHO, J. *Dicionário*.\n","dic":"DHBPR"}
