{"title":"PEREIRA, Bento Carneiro de Almeida","cargoss":["Deputado federal"],"cargos_esp":[0],"datas_ini":[1893],"datas_fim":[1893],"estados":["RJ"],"autor":["Adrianna Setemy"],"content":"**PEREIRA, Bento Carneiro de Almeida**\n\n\\*dep. fed. RJ 1893.\n\n*Bento Carneiro de Almeida Pereira* nasceu em Macaé (RJ) no dia 7 de\nsetembro de 1852, filho de João de Almeida Pereira Filho e de Mariana\nAntônia Carneiro de Almeida Pereira. Seu pai foi presidente da província\ndo Rio de Janeiro, ministro dos Negócios do Império, deputado geral e\nconselheiro.\n\nFormou-se na Faculdade de Direito de São Paulo. Após concluir seus\nestudos, retornou à província natal, onde, além de advogar, tornou-se\nfazendeiro. Filiado ao Partido Conservador, foi deputado provincial no\nRio de Janeiro, mas perdeu o mandato em novembro de 1889, após a\nproclamação da República, quando foram extintos todos os órgãos\nlegislativos do Império. Passou então a assessor de João Caetano\nCarneiro da Silva, o visconde de Quissamã, junto ao Partido Conservador,\nem Macaé.\n\nEm 1893, último ano da legislatura 1891-1893, foi eleito deputado\nfederal pelo estado do Rio de Janeiro após a renúncia do deputado\nBatista da Mota. Assumindo sua cadeira na Câmara dos Deputados, no Rio\nde Janeiro, então Distrito Federal, em 2 de maio, aí permaneceu até 31\nde dezembro. Após o final de seu mandato mudou-se para São Paulo e lá\npassou a exercer a advocacia.\n\nFaleceu no dia 20 de junho de 1931.\n\nEra casado com Maria Francisca Carneiro de Queirós Matoso, com quem teve\nquatro filhos.\n\nAdrianna Setemy\n\n**FONTES:** ABRANCHES, J. *Governos* (v.1); BRITO, C. *Mulher*; CÂM.\nDEP. *Deputados brasileiros.*\n","ref":"**FONTES:** ABRANCHES, J. *Governos* (v.1); BRITO, C. *Mulher*; CÂM.\nDEP. *Deputados brasileiros.*\n","dic":"DHBPR"}
