{"title":"PEREIRA, Cleto Nunes","cargoss":["Deputado federal","Senador"],"cargos_esp":[0,0],"datas_ini":[1894,1898],"datas_fim":[1894,1908],"estados":["ES","ES"],"autor":["Nara Saletto","Fernando Achiamé"],"content":"**PEREIRA, Cleto Nunes**\n\n\\*dep. fed. ES 1894; sen. ES 1898-1908.\n\n*Cleto Nunes Pereira* nasceu em Vitória em 3 de maio de 1855, filho de\nManuel Nunes Pereira e de Francisca Pinto da Rocha Pereira.\n\nFez seus primeiros estudos em Vitória e o curso de humanidades no Rio de\nJaneiro. Pretendia cursar a Faculdade de Direito de São Paulo, mas, por\nrazões de família, teve que voltar para Vitória. Em 1876 foi nomeado\nfuncionário do Ministério da Fazenda na capital capixaba, onde fez\ncarreira, chegando a ocupar o cargo de tesoureiro da Alfândega, que\ndeixaria em 1886. Paralelamente, exerceu o jornalismo em diversos\nperiódicos, e fundou com Muniz Freire o primeiro jornal diário capixaba,\n*A Província do Espírito Santo*. Participou ativamente da campanha\nabolicionista, na imprensa e em sociedades criadas com tal finalidade.\nEm 1877, foi iniciado pedreiro-livre na Loja Maçônica União e Progresso\nde Vitória, na qual ocupou o cargo de venerável em 1884, 1890, 1891 e\n1893, além de atuar como líder da maçonaria no Espírito Santo.\n\nIngressou no Partido Liberal e foi eleito deputado provincial na\nlegislatura de 1879-1880. No final do Império foi secretário do governo\nda província, até a proclamação da República. No novo regime, tornou-se\num dos políticos mais influentes do estado. Participou em 1890 da\nfundação do Partido Republicano Construtor (PRC), que reunia a maioria\ndos republicanos, uma corrente liberal, e um grupo conservador. Esse\npartido governou o estado desde sua fundação até 1908, com um único\nintervalo em 1891, e Cleto Nunes esteve sempre ligado a sua direção,\nfazendo parte do diretório central em momentos importantes.\n\nPresidiu o governo municipal de Vitória, o primeiro eleito na República,\nem 1892, e foi reeleito, com mandato até 1900. Em 1892 foi também eleito\ndeputado à Constituinte estadual e a presidiu, acumulando os mandatos\nestadual e o municipal, o que na época era permitido e muito comum. Em\n1894 foi eleito deputado federal, mas não exerceu o cargo, dedicando-se\nao governo municipal e à política partidária.\n\nFoi eleito senador em 1898, na vaga aberta pela morte de Eugênio Amorim,\ne, ao terminar o mandato por este iniciado, foi reeleito em 1904. No\nSenado, foi membro das comissões de Obras Públicas e de Comércio,\nAgricultura, Indústria e Artes.\n\nFaleceu em Nova Friburgo (RJ) no dia 11 de abril de 1908, no exercício\ndo mandato de senador.\n\nFoi casado em primeiras núpcias com Adelina Bastos Nunes, com quem teve\ncinco filhos, e em segundas núpcias com Laudelina de Araújo Nunes, com\nquem teve seis filhos.\n\nNara Saletto/Fernando Achiamé\n\n**FONTES:** *Cachoeirano* (1912-1913); *Cleto Nunes*; *Comércio do\nEspírito Santo* (1896-1900); *Estado* (1921-1922); *Estado do Espírito\nSanto* (1890-1904); FRAGA, C. *Loja*; FREIRE, M. *República*; PEREIRA,\nA. *Homens*.\n","ref":"**FONTES:** *Cachoeirano* (1912-1913); *Cleto Nunes*; *Comércio do\nEspírito Santo* (1896-1900); *Estado* (1921-1922); *Estado do Espírito\nSanto* (1890-1904); FRAGA, C. *Loja*; FREIRE, M. *República*; PEREIRA,\nA. *Homens*.\n","dic":"DHBPR"}
