{"title":"PEREIRA, Manuel Agapito","cargoss":["Deputado federal"],"cargos_esp":[0],"datas_ini":[1915],"datas_fim":[1917],"estados":["AM"],"autor":["Inoã Pierre Carvalho Urbinati"],"content":"**PEREIRA, Manuel Agapito**\n\n\\*magistrado; dep. fed. AM 1915-1917.\n\n*Manuel Agapito Pereira* nasceu em Pernambuco em 24 de março de 1864,\nfilho do coronel Manuel Dionísio Pereira e de Joaquina Emídia Pereira.\n\nIngressou na Faculdade de Direito do Recife em 1880, concluindo o curso\nem 1884. Em junho do ano seguinte foi nomeado promotor público da\ncomarca de Taquaretinga (PE), mas em outubro exonerou-se. Seguiu para o\nAmazonas em 1886 e foi nomeado juiz municipal de Manicoré e Borba, no\nrio Madeira, exercendo o cargo até outubro de 1889, quando foi nomeado\nprocurador fiscal da província do Amazonas. Em janeiro de 1890, logo\napós o início do regime republicano, foi nomeado promotor público de\nManaus e em seguida juiz de direito da segunda vara da capital.\nParticipou do primeiro Congresso Constituinte do Estado, mas renunciou\nao mandato em outubro de 1891, para se dedicar à magistratura. Naquele\nmesmo ano deixou de exercer o cargo de promotor público de Manaus e logo\ndepois foi designado juiz de direito da comarca de Lábrea, no rio Purus.\nEm 1897 foi nomeado desembargador do Superior Tribunal de Justiça do\nEstado do Amazonas, que representou no Congresso Jurídico realizado no\nRio de Janeiro em 1900. No ano seguinte assumiu o cargo de\nvice-presidente do Tribunal de Justiça do Amazonas e, em 1902, o de\npresidente dessa corte.\n\nEm 1912 foi eleito deputado à Assembleia Legislativa do Amazonas e\nexerceu a presidência da casa de 1913 a 1914. No ano seguinte foi eleito\ndeputado federal por esse estado. Assumiu em maio de 1915 sua cadeira na\nCâmara dos Deputados, no Rio de Janeiro, então Distrito Federal, e\nexerceu seu mandato até dezembro de 1917, quando se encerrou a\nlegislatura.\n\nAposentou-se como desembargador do Superior Tribunal de Justiça do\nAmazonas.\n\nFaleceu no Recife vítima de acidente de trânsito.\n\nEra casado com Leonídia Regulo Pereira, com quem teve filhos.\n\nInoã Pierre Carvalho Urbinati\n\n**FONTES:** ABRANCHES, J. *Governos*; BITTENCOURT, A. *Dicionário*; CÂM.\nDEP. *Deputados brasileiros*; Jus Brasil. *Diário oficial da união*.\nDisponível em:\n\\<www.jusbrasil.com.br/diarios/1988290/dou-secao-1-15-08-1920-pg-15\\>.\nAcesso em: 10/3/2011; TRIB. JUST. AM. Disponível em:\n\\<www.tjam.jus.br/index.php?option=com\\_content&view=article&id=5&Itemid=9\\>.\nAcesso em: 10/3/2011.\n","ref":"**FONTES:** ABRANCHES, J. *Governos*; BITTENCOURT, A. *Dicionário*; CÂM.\nDEP. *Deputados brasileiros*; Jus Brasil. *Diário oficial da união*.\nDisponível em:\n\\<www.jusbrasil.com.br/diarios/1988290/dou-secao-1-15-08-1920-pg-15\\>.\nAcesso em: 10/3/2011; TRIB. JUST. AM. Disponível em:\n\\<www.tjam.jus.br/index.php?option=com\\_content&view=article&id=5&Itemid=9\\>.\nAcesso em: 10/3/2011.\n","dic":"DHBPR"}
