{"title":"PESSOA, Antônio da Silva","cargoss":["Presidente de associação ou confederação de empregados ou empregadores"],"cargos_esp":[0],"datas_ini":[1915],"datas_fim":[1916],"estados":["PB"],"autor":["Raimundo Helio Lopes"],"content":"**PESSOA, Antônio da Silva**\n\n\\*pres. PB 1915-1916.\n\n*Antônio da Silva Pessoa* nasceu em Umbuzeiro (PB) no dia 17 de março de\n1863, filho de José da Silva Pessoa e de Henriqueta de Lucena Pessoa.\nSeu pai foi coronel da Guarda Nacional e senhor de engenho. Seu tio\nmaterno Henrique Pereira de Lucena, o barão de Lucena, foi presidente\ndas províncias do Rio Grande do Norte (1872), Pernambuco (1872-1875),\nBahia (1877-1878) e Rio Grande do Sul (1885-1886), deputado geral por\nPernambuco (1886-1889), governador de Pernambuco (1890), ministro da\nJustiça (1891), da Agricultura (1891) e da Fazenda (1891) e ministro do\nSupremo Tribunal Federal (1891-1892). Seu irmão Epitácio Pessoa foi\nconstituinte de 1891 e deputado pela Paraíba (1891-1893), ministro da\nJustiça (1898-1901), ministro do Supremo Tribunal Federal (1902-1912),\nsenador (1912-1919 e 1924-1930) e presidente da República (1919-1922).\n\nDesde jovem dedicou-se à agricultura e à pecuária no estado da Paraíba.\nEm 1890, por influência do barão de Lucena, foi nomeado inspetor\naduaneiro na Alfândega Federal de Recife e logo depois\nsegundo-escriturário do consulado da Paraíba. Passou em seguida a\nprimeiro-escriturário da Alfândega de Pernambuco e, em 1896, a\nprimeiro-escriturário da Alfândega de Santos (SP). Dois anos depois\nvoltou a Pernambuco e foi nomeado conferente da Alfândega.\n\nIngressou na política paraibana em 1912, quando seu irmão Epitácio\nPessoa indicou seu nome para concorrer à presidência do estado na\nsucessão de João Lopes Machado, em oposição ao padre Valfredo Leal. A\nsolução foi o nome de João Pereira de Castro Pinto, que permitiu o\nconsenso entre as duas forças. De qualquer forma, o grupo político\nliderado por Epitácio Pessoa saiu fortalecido da disputa, pois este foi\neleito senador na vaga aberta com a renúncia de Castro Pinto, e\nconseguiu que Antônio Pessoa se tornasse primeiro-vice-presidente\nestadual. A administração de Castro Pinto foi marcada pelo combate ao\ncangaço, intensa crise financeira e fortes disputas envolvendo as\nfacções políticas lideradas por Epitácio Pessoa e Valfredo Leal. Nesse\ncontexto, Castro Pinto renunciou em 24 de julho de 1915, e Antônio\nPessoa assumiu o governo estadual.\n\nEm sua gestão fundou inúmeras escolas na capital e no interior, promoveu\no Congresso do Algodão, combateu a crise financeira herdada do\nantecessor e introduziu o ensino de desenho e trabalhos manuais nas\nescolas da capital. No dia 24 de julho de 1916 licenciou-se do cargo\npara resolver problemas ligados à saúde. Em seu lugar, assumiu o\npresidente da Assembleia Legislativa, Sólon Barbosa de Lucena, já que o\nvice-presidente do estado, Pedro Bandeira, havia renunciado ao cargo.\n\nFoi também assistente de Brigada da Infantaria da Guarda Municipal da\ncapital da Paraíba, conferente da Alfândega do Rio de Janeiro, e\nintegrou a Irmandade da Santa Casa de Misericórdia.\n\nFaleceu na cidade Umbuzeiro (PB) no dia 31 de outubro de 1916.\n\nFoi casado com Margarida de Assunção Santiago. Seu filho Carlos da Silva\nPessoa foi deputado federal pela Paraíba (1925-1929), e seu sobrinho\nJoão Pessoa foi ministro do Supremo Tribunal Militar (1919-1928),\npresidente da Paraíba (1928-1930) e candidato a vice-presidente na chapa\nliderada por Getúlio Vargas nas eleições presidenciais de 1930.\n\nRaimundo Helio Lopes\n\n**FONTES:** MARIZ, C. *Apanhados*; Núcleo de Documentação e Informação\nHistórica Regional. Disponível em:\n\\<www.ndihr.ufpb.br/programa/inventario.html\\>. Acesso em: 1/12/2010;\nPINTO, L. *Fundamentos*.\n","ref":"**FONTES:** MARIZ, C. *Apanhados*; Núcleo de Documentação e Informação\nHistórica Regional. Disponível em:\n\\<www.ndihr.ufpb.br/programa/inventario.html\\>. Acesso em: 1/12/2010;\nPINTO, L. *Fundamentos*.\n","dic":"DHBPR"}
