{"title":"PESSOA, Carlos da Silva","cargoss":["Deputado federal"],"cargos_esp":[0],"datas_ini":[1924],"datas_fim":[1929],"estados":["PB"],"autor":["Raimundo Helio Lopes"],"content":"**PESSOA, Carlos da Silva**\n\n\\*dep. fed. PB 1924-1929.\n\n*Carlos da Silva Pessoa* nasceu em Recife em 1886, filho de Antônio da\nSilva Pessoa e de Margarida de Assunção Santiago. Seu pai foi presidente\nda Paraíba de 1915 a 1916. Seu tio Epitácio Pessoa foi constituinte de\n1891 e deputado pela Paraíba (1891-1893), ministro da Justiça\n(1898-1901), ministro do Supremo Tribunal Federal (1902-1912), senador\n(1912-1919 e 1924-1930) e presidente da República (1919-1922).\n\nFoi eleito deputado estadual na Paraíba em 1920 e permaneceu na\nAssembleia Legislativa até 1924, ano em que foi eleito deputado federal.\nAssumiu em maio sua cadeira na Câmara dos Deputados, no Rio de Janeiro,\nentão Distrito Federal, e em 1927 foi reeleito. Concluiu o mandato em\ndezembro de 1929.\n\nFaleceu em 1949.\n\nRaimundo Helio Lopes\n\n**FONTES:** CÂM. DEP. *Deputados brasileiros*; ODILON, M. *Pequeno.*\n","ref":"**FONTES:** CÂM. DEP. *Deputados brasileiros*; ODILON, M. *Pequeno.*\n","dic":"DHBPR"}
