{"title":"PESSOA, Lindolfo","cargoss":["Deputado federal"],"cargos_esp":[0],"datas_ini":[1921],"datas_fim":[1930],"estados":["PR"],"autor":["Luciana Pinheiro"],"content":"**PESSOA, Lindolfo**\n\n\\*dep. fed. PR 1921-1930.\n\n*Lindolfo Pessoa da Cruz Marques* nasceu em Bananeiras (PB) no dia 11 de\nfevereiro de 1882, filho de Antônio Tertuliano da Cruz Marques e de\nLeonila Pessoa da Cruz Marques.\n\nBacharelou-se pela Faculdade de Direito do Recife em 1904 e logo após a\nformatura transferiu-se para o Paraná. Em 1905 tornou-se promotor\npúblico do município de São José da Boa Vista. Manteve-se no cargo por\napenas três meses, por ter sido nomeado delegado de polícia em Curitiba,\nfunção que exerceu até o ano seguinte. Foi então nomeado promotor de\njustiça da capital paranaense, posto que abandonou tempos depois em\nvirtude de sua aprovação no concurso para juiz de direito. Nomeado para\na comarca de Imbituba, aí permaneceu até 1915, quando solicitou\ntransferência para a cidade de Campo Largo. Em 1916 assumiu a chefia da\npolícia curitibana por cinco anos.\n\nEleito deputado federal para a legislatura 1921-1923, tomou posse na\nCâmara em maio de 1921, passando a residir no Rio de Janeiro. Foi\nreeleito para as três legislaturas seguintes, mas teve o mandato\ninterrompido em outubro de 1930, em decorrência da vitória da revolução\nque levou Getúlio Vargas ao poder e extinguiu os órgãos legislativos do\npaís. Durante sua passagem pela Câmara apontou a necessidade de\nconstrução de uma estrada de ferro que ligasse o Brasil à Assunção. Após\na reconstitucionalização, candidatou-se em 1934 a deputado estadual na\nlegenda da União Republicana Paranaense e foi eleito.\n\nFoi também juiz de direito nos municípios paranaenses de Guarapuava e\nPalmas, e juiz do cível e comércio em Curitiba. Integrou ainda o quadro\nde professores da Faculdade de Direito da Universidade do Paraná,\ninstituição na qual era lente catedrático de direito constitucional.\n\nLuciana Pinheiro\n\n**FONTES:** CÂM. DEP. *Deputados brasileiros* (p.172); NICOLAS, M. *Cem\nanos* (p.422-423); VARGAS, T. *Laerte*.\n","ref":"**FONTES:** CÂM. DEP. *Deputados brasileiros* (p.172); NICOLAS, M. *Cem\nanos* (p.422-423); VARGAS, T. *Laerte*.\n","dic":"DHBPR"}
