{"title":"PINTO, Alfredo","cargoss":["Deputado federal","Ministro da Justiça","Ministro da Guerra","Ministro do Supremo Tribunal Federal"],"cargos_esp":[0,0,0,0],"datas_ini":[1897,1919,1919,1921],"datas_fim":[1902,1921,1919,1923],"estados":["MG",0,0,0],"autor":["Eduardo Junqueira"],"content":"**PINTO, Alfredo**\n\n\\* dep. fed. MG 1897-1902; min. Just. 1919-1921; min. Guerra 1919; min.\nSTF 1921-1923.\n\n*Alfredo Pinto Vieira de Melo* nasceu em Recife no dia 20 de junho de\n1863, filho de João Vieira de Melo e Silva e de Maria Pinto Vieira de\nMelo.\n\nBacharel em ciências jurídicas e sociais pela Faculdade de Direito do\nRecife em 1886, iniciou carreira na magistratura no ano seguinte, ao ser\nnomeado promotor público da comarca de Baependi, na província de Minas\nGerais. Em 1890 tornou-se juiz de direito de Ouro Fino, na mesma\nprovíncia, e no período compreendido entre 1893 e 1896 exerceu o cargo\nde chefe de polícia do estado, nos governos de Afonso Pena e Bias\nFortes.\n\nEm 1897 foi eleito deputado federal por Minas Gerais. Reeleito em 1900,\nfoi presidente da Comissão de Constituição e Justiça e membro especial\nda comissão chefiada por Clóvis Bevilácqua, que elaborou o projeto de\nCódigo Civil, atuando ainda como relator da primeira parte do Livro IV,\nintitulado “Do direito das sucessões”. Em dezembro de 1902 deixou o\nparlamento para se dedicar à advocacia na capital federal, ao mesmo\ntempo em que foi nomeado representante da Fazenda Nacional junto à\nComissão de Obras do Porto do Rio de Janeiro pelo presidente Rodrigues\nAlves (1902-1906), durante o período de grandes reformas urbanas por que\npassou a cidade. Entre 1906 e 1909, na presidência de Afonso Pena, a\nquem já havia assessorado no governo de Minas Gerais, foi chefe de\npolícia do Distrito Federal. Durante sua gestão fundou a Colônia\nCorrecional de Dois Rios, na Ilha Grande, e o Serviço de Identificação\nda Capital Federal, considerado então uma das mais importantes\ninstituições de registro, cuja função era a de proporcionar informações\nsobre os indivíduos com antecedentes criminais.\n\nPor ocasião do fim do governo Afonso Pena, em 1909, retornou às suas\natividades no foro do Rio de Janeiro e foi eleito presidente do\nInstituto dos Advogados Brasileiros (IAB) para o período de 1910 a 1913.\nIntegrou, como representante desse órgão de classe, a comissão de\njuristas encarregada de elaborar um projeto de Código do Processo Civil,\nComercial e Penal do Distrito Federal. Em 1914 participou do I Congresso\nde História Nacional, organizado pelo Instituto Histórico e Geográfico\nBrasileiro (IHGB), com a tese intitulada *O Poder Judiciário no Brasil\n(1532-1871)*. Durante o governo Epitácio Pessoa (1919-1922), foi\nministro da Justiça e Negócios Interiores, de 1919 a 1921, e ministro\ninterino da Guerra, em 1919.\n\nJá considerado notável jurista, com relevantes serviços prestados à\nadministração pública, em agosto de 1921 foi nomeado ministro do Supremo\nTribunal Federal (STF) pelo presidente Epitácio Pessoa, preenchendo a\nvaga surgida com o falecimento de Pedro Lessa. Foi, ainda, professor da\nFaculdade Livre de Ciências Jurídicas e Sociais do Rio de Janeiro. No\nexercício de suas funções no STF, faleceu na cidade do Rio de Janeiro em\n8 de julho de 1923.\n\nEntre os trabalhos que publicou em diversas revistas especializadas de\ndireito, destacam-se *Educação científica, O júri* e *Direitos das\nsucessões*.\n\nEduardo Junqueira\n\n**FONTES:** GUIMARÃES, L. *Primeiro* (v.9); MATTOSO, P. *Supremo\nTribunal*; MELLO FILHO, J. *Notas*; SUP. TRIB. FED. Disponível em:\n\\<www.stf.jus.br/portal/ministros\\>.\n","ref":"**FONTES:** GUIMARÃES, L. *Primeiro* (v.9); MATTOSO, P. *Supremo\nTribunal*; MELLO FILHO, J. *Notas*; SUP. TRIB. FED. Disponível em:\n\\<www.stf.jus.br/portal/ministros\\>.\n","dic":"DHBPR"}
