{"title":"PINTO, Firmiano de Morais","cargoss":["Deputado federal","Deputado federal","Prefeito","Deputado federal"],"cargos_esp":[0,0,0,0],"datas_ini":[1900,1897,1920,1926],"datas_fim":[1902,1897,1926,1930],"estados":["SP","SP","SP","SP"],"autor":["Dirceu Franco"],"content":"**PINTO, Firmiano de Morais**\n\n\\*dep. fed. SP 1897 e 1900-1902; pref. SP 1920-1926; dep. fed. SP\n1926-1930.\n\n*Firmiano de Morais Pinto* nasceu em Itu (SP) no dia 4 de maio de 1861,\nfilho de Antônio José Pinto e de Francisca Emília de Morais. Seus avós\nforam o alferes Antônio Pinto, de Itu, e o capitão-mor Joaquim Vieira de\nMorais, de Porto Feliz. Sua irmã, Albertina de Morais Pinto, casou-se\ncom Martinho da Silva Prado Júnior, de abastada família de\ncafeicultores, constituinte e deputado federal por São Paulo em 1891.\n\nÓrfão de pai na mais tenra idade, mudou-se para São Paulo e estudou em\nescolas públicas. Cursou a Faculdade de Direito do Largo de São\nFrancisco e obteve o título de bacharel em ciências jurídicas e sociais\nem 1882.\n\nIniciou a carreira política com o conselheiro Francisco de Carvalho\nSoares Brandão, presidente da província de São Paulo (1882-1883), do\nqual foi secretário de polícia. No ano da abolição da escravatura, era\njuiz municipal em Limeira. Após a proclamação da República, foi nomeado\nintendente municipal na capital paulista.\n\nEleito deputado federal por São Paulo em 1896, renunciou ao mandato no\ninício da legislatura, em 1897, para assumir o cargo de secretário do\nestado de São Paulo na administração Campos Sales (1896-1897). Como\nsecretário da Agricultura, destacou-se pelo esforço favorável à\nintrodução no estado de imigrantes, sobretudo italianos. Em 1900 foi\nnovamente eleito deputado federal e ocupou uma cadeira na Câmara de\nentão até 1902. Mantendo boas relações com a Europa, foi designado\ncomissário de São Paulo em Paris entre 1912 e 1916.\n\nEm 1920 foi eleito prefeito da capital paulista e exerceu o cargo até\n1926. Destacou-se então pelo modo como tratou com os líderes da Revolta\nde 1924. Em meio ao conflito, conseguiu garantir o abastecimento da\ncidade, orgulhando-se por não tê-la abandonado. O episódio custou-lhe um\nprocesso movido pelo governo federal, que o acusou de cumplicidade na\nrelação com as tropas de Isidoro Dias Lopes. Voltou à Câmara dos\nDeputados entre maio e dezembro de 1926, e entre maio de 1927 e dezembro\nde 1929. Mais uma vez reeleito, iniciou novo mandato em maio de 1930,\nmas perdeu-o em outubro, com a vitória da Revolução de 1930. A partir de\nentão, além de cuidar de sua grande criação de cavalos, foi em duas\nocasiões eleito diretor e presidente do Jockey Club.\n\nFaleceu no dia 8 de fevereiro de 1938.\n\nFoi casado com a filha do conde do Pinhal.\n\nDirceu Franco\n\n**FONTES:** CÂM. DEP. *Deputados brasileiros*; FONSECA, A.; FONTES JR.,\nA. *Senado.*\n","ref":"**FONTES:** CÂM. DEP. *Deputados brasileiros*; FONSECA, A.; FONTES JR.,\nA. *Senado.*\n","dic":"DHBPR"}
