{"title":"PINTO, João Pereira de Castro","cargoss":["Deputado federal","Senador","Presidente de associação ou confederação de empregados ou empregadores"],"cargos_esp":[0,0,0],"datas_ini":[1906,1908,1912],"datas_fim":[1908,1912,1915],"estados":["PB","PB","PB"],"autor":["Raimundo Helio Lopes"],"content":"**PINTO, João Pereira de Castro**\n\n\\*dep. fed. PB 1906-1908; sen. PB 1908-1912; pres. PB 1912-1915.\n\n*João Pereira de Castro Pinto* nasceu em Mamanguape (PB) no dia 3 de\nnovembro de 1863, filho de José Pereira de Castro Pinto e de Maria\nRicarda Cavalcanti de Albuquerque.\n\nIniciou seus estudos no Liceu Paraibano e daí transferiu-se para a\ncapital pernambucana, onde se bacharelou na Faculdade de Direito. Depois\nde formado, foi nomeado promotor público em Mamanguape e permaneceu no\ncargo entre 1889 e 1891. Ingressou na política ainda durante o Império,\nquando defendeu a causa abolicionista.\n\nApós a proclamação da República, foi eleito deputado estadual\nconstituinte na Paraíba em 1891. Em seguida foi nomeado procurador\nseccional da República no estado. Em 1895 abandonou esse posto e no ano\nseguinte foi nomeado professor de matemática do Liceu Paraibano. Foi um\nsevero crítico do primeiro governo de Álvaro Lopes Machado (1892-1896).\nEm 1898 advogou, por poucos meses, na cidade de Vitória, e logo depois\nse mudou para Fortaleza, onde foi promotor público até meados de 1899.\nAinda nesse ano foi transferido para Belém, onde assumiu a mesma função.\nFoi então convidado pelo governador do Pará, José Pais de Carvalho\n(1897-1901), para ser seu chefe de gabinete. Foi também professor de\nlógica do Ginásio Paraense e redator do jornal *A Província do Pará*.\nDurante esses anos, reconciliou-se com o senador e ex-presidente\nparaibano Álvaro Lopes Machado.\n\nEm 1906 foi eleito deputado federal pela Paraíba na legenda do Partido\nRepublicano. Ocupou uma cadeira na Câmara dos Deputados até 1908, quando\nrenunciou para ocupar uma cadeira no Senado, para o qual foi eleito na\nvaga aberta com o falecimento do senador Antônio Alfredo da Gama e Melo.\nEm 1912, encerrado seu mandato de senador, concorreu à reeleição e foi\nvitorioso, mas não voltou ao Senado, pois nesse mesmo ano foi eleito\npresidente da Paraíba.\n\nSua eleição foi fruto de uma disputa entre dois prestigiados líderes\npolíticos estaduais, Epitácio Pessoa e o padre Valfredo Leal, quanto ao\nnome a ser indicado na sucessão de João Lopes Machado. O primeiro\nalmejava lançar a candidatura de seu irmão Antônio da Silva Pessoa,\nenquanto o segundo pretendia disputar ele mesmo a eleição. A solução foi\nJoão Pereira de Castro Pinto, nome de consenso entre as duas forças. De\ntoda forma, ao final da disputa o grupo político liderado por Epitácio\nPessoa saiu fortalecido, pois este foi eleito senador na vaga aberta com\na renúncia de João Pereira de Castro Pinto, e conseguiu que seu irmão\nAntônio da Silva Pessoa se tornasse primeiro-vice-presidente estadual.\n\nA administração de João Pereira de Castro Pinto foi marcada pelo combate\nao cangaço, por intensa crise financeira e por fortes disputas entre as\nfacções políticas lideradas por Epitácio Pessoa e Valfredo Leal.\nRenunciou ao mandato em 24 de julho de 1915, sendo substituído por\nAntônio da Silva Pessoa. Depois disso abandonou a vida política e\nmudou-se para o Rio de Janeiro, onde passou a administrar um cartório de\nregistro de títulos e documentos.\n\nTambém foi patrono da Academia Paraibana de Letras e membro do Instituto\nHistórico e Geográfico Paraibano.\n\nFaleceu na cidade do Rio de Janeiro em 11 de julho de 1944.\n\nPublicou *Conferência proferida a 5 de agosto no Centro Paraibano do Rio\nde* *Janeiro* (1921), *Discursos parlamentares* (1902) e *O estado da\nParaíba do Norte* (1914).\n\nRaimundo Helio Lopes\n\n**FONTES:** ABRANCHES, J. *Governos*; ACAD. PARAIBANA. LET. Disponível\nem: \\<www.aplpb.com.br\\>. Acesso em: 15/11/2010; ALMEIDA, H.\n*Contribuição*; LEITE NETO, L. *Catálogo biográfico*; PINTO, L.\n*Fundamentos.*\n","ref":"**FONTES:** ABRANCHES, J. *Governos*; ACAD. PARAIBANA. LET. Disponível\nem: \\<www.aplpb.com.br\\>. Acesso em: 15/11/2010; ALMEIDA, H.\n*Contribuição*; LEITE NETO, L. *Catálogo biográfico*; PINTO, L.\n*Fundamentos.*\n","dic":"DHBPR"}
