{"title":"PIRES, Cristóvão Nunes","cargoss":["Membro de junta governativa","Governador de estado ou do Distrito Federal"],"cargos_esp":[0,0],"datas_ini":[1891,1893],"datas_fim":[1892,1894],"estados":["SC","SC"],"autor":["Carolina Vianna Dantas"],"content":"**PIRES, Cristóvão Nunes**\n\n\\*junta gov. SC 1891-1892; gov. SC 1893-1894.\n\n*Cristóvão Nunes Pires* nasceu na cidade de Desterro, atual\nFlorianópolis, no dia 7 de julho de 1834, filho de Luís Nunes Pires e de\nLuísa Alves Nunes Pires.\n\nFez os estudos primários com o pai, tendo, depois, aprendido pintura nos\nEstados Unidos, na República do Prata e na cidade do Rio de Janeiro.\nNegociante e industrial no Desterro, durante o Império foi deputado\nprovincial em Santa Catarina de 1882 a 1883 e de 1886 a 1887.\n\nJá na República, com a renúncia de Lauro Müller ao governo de Santa\nCatarina em 28 de dezembro de 1891, integrou, ao lado do coronel Luís\ndos Reis Falcão e de Artur Deocleciano de Oliveira, a junta governativa\nprovisória que governou o estado até 1^o^ de março de 1892, quando o\ntenente Manuel Joaquim Machado tomou posse como interventor no estado.\nEm setembro seguinte, quando a Assembleia estadual elegeu o tenente\nManuel Joaquim Machado governador, foi eleito segundo-vice-governador,\nenquanto Eliseu Guilherme da Silva era eleito primeiro-vice.\n\nQuando Manuel Joaquim Machado foi afastado do governo, em 18 de junho de\n1893, Eliseu Guilherme da Silva assumiu o lugar deste, mas, devido a\npressões políticas de seus adversários, como Hercílio Luz, foi também\nforçado a afastar-se. Em 24 de setembro seguinte Cristóvão Nunes Pires\nassumiu assim, pela segunda vez, o governo do estado. Entre 8 e 11 de\noutubro foi substituído por Francisco Sales Brasil, mas em seguida\nreassumiu o posto. A Revolução Federalista iniciada no Rio Grande do\nSul, reforçada por parte dos envolvidos na Revolta da Armada, chegava\nentão a Santa Catarina, com os revoltosos ocupando Desterro e instalando\num governo provisório da República chefiado pelo capitão de mar e guerra\nFrederico Guilherme de Lorena. Em 22 de abril de 1894, o coronel Antônio\nMoreira César, nomeado interventor federal em Santa Catarina, substituiu\nCristóvão Nunes Pires. Moreira César assumiu o controle da situação,\npuniu revolucionários e não revolucionários, ordenou prisões e\nfuzilamentos, e manteve-se à frente do estado até a posse do governador\neleito Hercílio Luz em 28 de setembro. Pouco antes disso, em 21 de\nsetembro, Cristóvão Pires faleceu na cidade de Biguaçu (SC).\n\nEra casado com Maria José da Costa Nunes Pires, com quem teve filhos.\n\nCarolina Vianna Dantas\n\n**FONTES:** ABRANCHES, J. *Governos*; PIAZZA, W. *Dicionário*;\nSTOETERAU, L. *Trajetória*; Wikipédia. Disponível em:\n\\<http://pt.wikipedia.org/wiki/Walter\\_Piazza\\>.\n","ref":"**FONTES:** ABRANCHES, J. *Governos*; PIAZZA, W. *Dicionário*;\nSTOETERAU, L. *Trajetória*; Wikipédia. Disponível em:\n\\<http://pt.wikipedia.org/wiki/Walter\\_Piazza\\>.\n","dic":"DHBPR"}
