{"title":"PONCE, Generoso","cargoss":["Presidente de associação ou confederação de empregados ou empregadores","Senador","Presidente de associação ou confederação de empregados ou empregadores","Deputado federal"],"cargos_esp":[0,0,0,0],"datas_ini":[1892,1894,1907,1909],"datas_fim":[1892,1902,1908,1911],"estados":["MT","MT","MT","MT"],"autor":["Alan Carneiro"],"content":"**PONCE, Generoso**\n\n\\*pres. MT 1892; sen. MT 1894-1902; pres. MT 1907-1908; dep. fed. MT\n1909-1911.\n\n*Generoso Pais Leme de Sousa Ponce* nasceu em Cuiabá no dia 10 de julho\nde 1852, filho do alferes José Ponce Martins e de Corsina Romana de\nSousa.\n\nPassou os primeiros anos de sua vida no forte do Príncipe da Beira,\nimportante monumento erigido para defender as fronteiras brasileiras, do\nqual seu pai era comandante. Estudou no Seminário de Cuiabá e em 1865,\ncom 13 anos, alistou-se como voluntário da pátria na Guerra do Paraguai\n(1864-1870), da qual saiu como primeiro-sargento cadete. Terminada a\nguerra, dedicou-se nos primeiros tempos à lavoura, e depois ao comércio.\nEm 1870 passou a trabalhar na casa comercial de Firmo José de Matos, o\nbarão de Casalvasco. No ano seguinte, casou-se com Maria de Almeida de\nSousa Ponce, com quem teve dois filhos. Tendo enviuvado, contraiu novas\nnúpcias, em 1878, com Mariana Vaz Guimarães de Sousa Ponce, com quem\nteria oito filhos.\n\nDesde cedo começou a militar na política filiando-se ao Partido Liberal,\ndo qual foi chefe nos últimos anos da monarquia. Eleito nessa época\ndeputado provincial, exerceu o mandato de 1882 a 1889. Com a proclamação\nda República em 15 de novembro de 1889 pelo marechal Manuel Deodoro da\nFonseca, logo aderiu ao novo regime. Fundou o Partido Republicano em\nMato Grosso em janeiro de 1890, e no ano seguinte foi eleito deputado\nestadual constituinte. Quando da promulgação da nova Constituição em\nagosto de 1891, e da eleição de Manuel José Murtinho, do Partido\nRepublicano, como o primeiro presidente constitucional do estado, foi\neleito primeiro-vice-presidente, enquanto José da Silva Rondon e Pedro\nCelestino Correia da Costa eram escolhidos, respectivamente, segundo e\nterceiro-vice-presidentes.\n\nQuando, no dia 3 de novembro de 1891, o marechal Deodoro deu um golpe de\nEstado e fechou o Congresso Nacional, praticamente todos os governadores\nou presidentes de estado aderiram ao ato presidencial. Mas houve também\nreações, que levaram Deodoro a renunciar 20 dias depois. O\nvice-presidente da República, marechal Floriano Peixoto, assumiu então a\npresidência, e sua primeira atitude foi depor os 19 governantes que\nhaviam aderido ao golpe. Embora, sem muita convicção, Manuel Murtinho\ntivesse manifestado sua adesão, foi mantido à frente do governo de Mato\nGrosso. Iniciou-se então um movimento, comandado pelo general Antônio\nMaria Coelho, e apoiado pelo major Antônio Aníbal da Mota, que havia\nassumido o comando do 21^o^ Batalhão, sediado em Corumbá (MT), para\nderrubar o presidente do estado. No dia 1^o^ de fevereiro de 1892 o\npresidente Manuel Murtinho foi deposto, e uma junta governativa assumiu\no poder. Essa junta, integrada pelos coronéis Luís Benedito Pereira\nLeite e José Marques de Fontes, e pelo major Antônio Aníbal da Mota, só\npermaneceu dois dias no comando do estado, pois, no dia 3 de fevereiro,\no governo foi entregue ao coronel Pereira Leite.\n\nA oposição ao retorno de Manuel Murtinho à presidência do estado se\nconsolidava em Cuiabá e se alastrava pelo interior. A Câmara Municipal\nda capital chegou a enviar uma mensagem ao presidente Floriano Peixoto\nsolicitando que não insistisse na tentativa de impor um governante,\ncontrariando a vontade do povo. Assim sendo, evitaria derramamento de\nsangue. Diante dessa situação, Generoso Ponce resolveu preparar uma\nreação em defesa da legalidade. Mobilizou um exército de três mil\nhomens, denominado “Legião Floriano Peixoto”, e o dividiu em unidades\nregulares sob sua chefia. Segundo narra Generoso Ponce Filho em sua obra\n*Generoso Ponce, um chefe*, a 1^a^ Brigada foi entregue ao general\nSeveriano de Cerqueira Daltro; a 2^a^ ao general de brigada reformado\nJoão de Oliveira Melo, o Melo Bravo, herói da Guerra do Paraguai; a 3^a^\nao tenente-coronel da Guarda Nacional Francisco Alexandre Ferreira\nMendes; a 4^a^ ao tenente-coronel reformado Joaquim Ferreira da Silva; a\n5^a^, de Cavalaria, ao tenente-coronel da Guarda Nacional João Antônio\nNunes da Cunha; e a 6^a^ ao major reformado do Exército Manuel Rodrigues\nBenfica.\n\nNo dia 7 de maio de 1892, Generoso Ponce, à frente das tropas, entrou\nvitorioso em Cuiabá e, como primeiro-vice-presidente do estado, assumiu\na chefia do governo. Permaneceu provisoriamente no cargo até o dia 20 de\njulho seguinte, quando Manuel Murtinho reassumiu a presidência. Com esse\nato, foi restabelecida a legalidade no estado. Seu empenho lhe valeu o\ntítulo de coronel honorário do Exército, concedido pelo presidente\nFloriano Peixoto.\n\nRetomando seu mandato de deputado estadual, permaneceu no Legislativo\nmato-grossense até 1894, quando foi eleito senador. Nesse período\ntrabalhou assiduamente na imprensa mato-grossense, tornando-se, ainda em\n1892, o principal redator do jornal *O Mato Grosso*. Em 1895 fundou o\njornal *O Republicano,* do qual também foi diretor*.* Exerceu seu\nmandato no Senado, no Rio de Janeiro, então Distrito Federal, até 1902.\nEm 1905 voltou a ser eleito deputado estadual em Mato Grosso, com\nmandato até 1907. Em 1906 chefiou a revolução que culminou com a morte\ndo presidente do estado Antônio Pais de Barros, conhecido como Totó\nPais.\n\nEm 15 de agosto de 1907 assumiu a presidência de Mato Grosso em\nsubstituição a Pedro Leite Osório. Permaneceu à frente do Executivo\nestadual até o dia 12 de outubro de 1908, quando, por motivo de doença,\nrenunciou. Na oportunidade foi substituído por Pedro Celestino Correia\nda Costa. Em 1909 foi eleito deputado federal por seu estado e em maio\nassumiu uma cadeira na Câmara dos Deputados, onde sustentou forte\ncampanha contra a administração do Loide Brasileiro. Exerceu o mandato\naté o dia 7 de novembro de 1911, quando faleceu no Rio de Janeiro.\n\nSeu filho Generoso Ponce Filho foi constituinte em 1934 e deputado\nfederal por Mato Grosso de 1935 a 1937.\n\nAlan Carneiro\n\n**FONTES:** MENDONÇA, R. *Dicionário*; MENDONÇA, R. *História*; SENADO.\nDisponível em:\n\\<www.senado.gov.br/sf/senadores/senadores\\_biografia.asp?codparl=1714&li=23&lcab=1894-1896&lf=23\\>.\nAcesso em: 18/9/2008; SENADO. Disponível em:\n\\<www.senado.gov.br/sf/senadores/senadores\\_biografia.asp?codparl=1714&li=25&lcab=1900-1902&lf=25\\>.\nAcesso em: 18/9/2008; Tio Sam. Disponível em:\n\\<www.tiosam.net/enciclopedia/index.asp?q=Generoso\\_Pais\\_Leme\\_de\\_Sousa\\_Ponce\\>.\nAcesso em: 5/1/2009.\n","ref":"**FONTES:** MENDONÇA, R. *Dicionário*; MENDONÇA, R. *História*; SENADO.\nDisponível em:\n\\<www.senado.gov.br/sf/senadores/senadores\\_biografia.asp?codparl=1714&li=23&lcab=1894-1896&lf=23\\>.\nAcesso em: 18/9/2008; SENADO. Disponível em:\n\\<www.senado.gov.br/sf/senadores/senadores\\_biografia.asp?codparl=1714&li=25&lcab=1900-1902&lf=25\\>.\nAcesso em: 18/9/2008; Tio Sam. Disponível em:\n\\<www.tiosam.net/enciclopedia/index.asp?q=Generoso\\_Pais\\_Leme\\_de\\_Sousa\\_Ponce\\>.\nAcesso em: 5/1/2009.\n","dic":"DHBPR"}
