{"title":"AZEVEDO, Henrique Pena de","cargoss":["Deputado federal"],"cargos_esp":[0],"datas_ini":[1906],"datas_fim":[1911],"estados":["AM"],"autor":["Inoã Pierre Carvalho Urbinat"],"content":"**AZEVEDO, Henrique Pena de**\n\n\\* dep. fed. AM 1906-1911.\n\n*Henrique Pena de Azevedo* nasceu em Manausno dia 20 de janeiro de 1854.\n\nComerciante e coronel da GuardaNacional, foi juiz municipal de 1876\na1880. Ainda sob o Império, militou noPartido Republicano, mas filiou-se\ndepois aoPartido Liberal, do qual foi um dosdiretores até 1889. Em 1882\nelegeu-sedeputado provincial no Amazonas. Quatro anosmais tarde, passou\na exercer o cargode primeiro juiz de paz. Com aproclamação da República\nem 15 de novembrode 1889, perdeu o mandato de deputadoprovincial e, no\nano seguinte, foi exoneradodo cargo de primeiro juiz de paz.\n\nDe janeiro a março de 1891foi superintendente municipal de Manaus.\nEm1901 foi eleito deputado estadual no Amazonase exerceu o mandato até\n1903. Em1906 foi eleito deputado federal. Assumindoem maio desse ano sua\ncadeira naCâmara dos Deputados, no Rio de Janeiro,então Distrito\nFederal, foi reeleito em1909 e permaneceu no Legislativo até dezembrode\n1911, quando se encerraram seu mandatoe a legislatura. De regresso a\nManaus,voltou a exercer o cargo de superintendenteda capital amazonense.\n\nFaleceu em 1914.\n\nInoã Pierre Carvalho Urbinat\n\n**FONTES:** ABRANCHES, J. C*ongressos*;CÂM. DEP. *Deputados\nbrasileiros.*\n","ref":"**FONTES:** ABRANCHES, J. C*ongressos*;CÂM. DEP. *Deputados\nbrasileiros.*\n","dic":"DHBPR"}
