{"title":"AZEVEDO, José da Costa","cargoss":["Deputado Geral","Ministro da Marinha"],"cargos_esp":[0,0],"datas_ini":[1878,1889],"datas_fim":[1881,1889],"estados":["AM",0],"autor":["Alan Carneiro"],"content":"**AZEVEDO, José da Costa**\n\n\\* militar; dep. geral AM 1878-1881;min. Mar. 1889; sen. AM 1894-1897\ne1903-1904.\n\n*José da Costa Azevedo*, futuro *barão de Ladário*,nasceu no Rio de\nJaneiro, então capitaldo Império, no dia 30 de novembrode 1823, filho de\nJosé da CostaAzevedo. Seu pai foi um renomado cientistae desenvolveu\nprojetos na área de educação.Seu tio-avô, também homônimo, era frade;foi\nprofessor do Seminário de Olinda (PE)e depois da Academia Militar do\nRiode Janeiro.\n\nEstudou matemática e ciências físicasna Escola da Marinha no Rio\ndeJaneiro, tornando-se oficial da Marinha deGuerra. Em 1853, como\ncapitão-tenente daArmada, era membro da Comissão de Limitesno Rio Grande\ndo Sul. Em 1855 fundounessa província o jornal *O Povo*, que defendiaa\nposição do liberalismo dito “histórico”.Em 1860, já como capitão de\nfragata,dirigiu trabalhos hidrográficos no Norte dopaís a fim de\nesclarecer a Comissãode Limites entre o Brasil e a GuianaFrancesa.\nAuxiliou também a Comissão deLimites do Brasil com o Peru. Chefioua\nEsquadra brasileira na Guerra do Paraguai(1864-1870) e foi condecorado\ncom o títulode barão de Ladário.\n\nMembro do Partido Liberal do Império,foi eleito deputado geral pelo\nAmazonase exerceu seu mandato de 1878 a1881. Foi o último ministro da\nMarinhado Império, tendo exercido o cargo noGabinete Ouro Preto. Quando\nda proclamaçãoda República, em 15 de novembro de1889, reagiu ao\nmovimento e ficou gravementeferido. Foi socorrido pelo próprio\nmarechalDeodoro da Fonseca, que liderou o golpede Estado.\n\nNo período seguinte, participou ativamentedos estudos sobre as\nfronteiras do Brasilcom o Peru, Venezuela e Bolívia. Divergiucom vigor\nde Quintino Bocaiúva sobre aquestão e também sobre o território\ndePalmas, que se encontrava em litígio coma Argentina em 1891.\n\nEm 1894 foi eleito senador peloAmazonas, na vaga aberta com a mortedo\nsenador Joaquim Leovigildo Coelho emoutubro do ano anterior. Exerceu seu\nmandatoaté 1897 e voltou a ser eleitoem 1903. Sua indicação para o\nSenadofoi uma imposição do senador gaúcho elíder nacional José Gomes\nPinheiro Machado,em oposição à indicação de Antônio Bittencourtfeita\npelo governador amazonense Silvério Nerycom a aprovação do Partido\nDemocrata.Sua eleição foi confirmada por um parecerda Comissão dos\nCinco, responsável peladivulgação dos eleitos. Esse parecer foisubmetido\nà votação no plenário do Senado,e após dois empates, só na\nterceiratentativa, e por apenas um voto dediferença, foi aprovado.\nAssumiu assim suacadeira no Senado em maio de 1903,e foi designado\nmembro da Comissão deMarinha e Guerra. Faleceu em 24 deoutubro de 1904,\nno exercício do mandato.\n\nPublicou várias cartas hidrográficas levantadaspara subsidiar comissões\nde limites, alémdos artigos “Investigação astronômica: memóriacientífica\nacerca da longitude da torredo Arsenal da Marinha de Pernambuco”\n(*Revista Trimensal do Instituto Histórico e Geográfico Brasileiro*) e\n“Aquestão das missões estudada à luz dosdocumentos: esclarecimentos para\nos membros doCongresso” (*Correio do Povo*, 1891).\n\nAlan Carneiro\n\n**FONTES:** LEITE NETO, L. *Catálogo biográfico*; SENADO. Disponível em:\n\\<www.senado.gov.br/sf/senadores/senadores\\_biografia.asp?codparl=1904&li=23&lcab=1894-1896&lf=23\\>.Acesso\nem: 18/9/08.\n","ref":"**FONTES:** LEITE NETO, L. *Catálogo biográfico*; SENADO. Disponível em:\n\\<www.senado.gov.br/sf/senadores/senadores\\_biografia.asp?codparl=1904&li=23&lcab=1894-1896&lf=23\\>.Acesso\nem: 18/9/08.\n","dic":"DHBPR"}
