{"title":"RABELO, Manuel","cargoss":["Revolucionário ou revoltoso","Interventor","Ministro do Supremo Tribunal Militar"],"cargos_esp":[0,0,0],"datas_ini":[1922,1931,1941],"datas_fim":[1922,1932,1945],"estados":[0,"SP",0],"autor":["Robert Pechman"],"content":"**RABELO, Manuel**\n\n\\*militar; rev. 1922; interv. SP 1931-1932; min. STM 1941-1945.\n\n*Manuel Rabelo* nasceu em Barra Mansa (RJ) no dia 11 de janeiro de 1878,\nfilho de Eduardo Rabelo e Maria Teodora Marcondes dos Reis, neta do\nbarão do Rio Claro.\n\nSentou praça em março de 1893, apresentando-se à Escola Militar do Rio\nde Janeiro, então Distrito Federal. Ainda no mesmo ano foi mobilizado\npara o combate à Revolta da Armada, levante de parte da Esquadra que\nvisava à derrubada de Floriano Peixoto. Iniciado em setembro de 1893 na\nbaía de Guanabara, o movimento estendeu-se até Santa Catarina e foi\ndominado em março de 1894. Em janeiro de 1896, Rabelo desligou-se da\nEscola Militar do Distrito Federal por problemas de saúde,\ntransferindo-se para a Escola Militar do Rio Grande do Sul. Retornou ao\nRio em 1898, reingressando na mesma academia do Exército. Bacharelou-se\nfinalmente em matemática e ciências físicas e mais tarde em engenharia\nmilitar.\n\nAlferes-aluno em 1901, era adepto do positivismo e pertenceu ao grupo de\ndiscípulos do tenente-coronel Benjamin Constant Botelho de Magalhães, um\ndos principais articuladores do movimento militar que culminou com a\nproclamação da República em 1889.\n\nJovem Sertanista\n\nEm 1906, foi escolhido pelo então major Cândido Rondon, também\npositivista e também ex-discípulo de Benjamin Constant, para fazer parte\nda Comissão Construtora de Linhas Telegráficas do Mato Grosso ao\nAmazonas, que ficaria conhecida como Comissão Rondon.\n\nPromovido a segundo-tenente em janeiro de 1907, no mês seguinte\nreuniu-se à comissão, ficando a seu serviço até junho de 1909. Durante\nesse período realizou levantamentos topográficos, fixou de coordenadas\ngeográficas e foi um dos orientadores da construção da linha telegráfica\nentre Cuiabá e São Luís de Cáceres, hoje Cáceres (MT). Com a criação do\nServiço de Proteção aos Índios (SPI) em 1910, incorporou-se ao órgão no\nano seguinte, em São Paulo. Participou ainda da pacificação de grupos de\níndios caingangues que dificultavam a construção do trecho da Estrada de\nFerro Noroeste entre São Paulo e Mato Grosso.\n\nEm agosto de 1911 foi promovido a primeiro-tenente, e em novembro de\n1915 retornou ao serviço da comissão chefiada por Rondon, na época\nempenhada no levantamento cartográfico de Mato Grosso e no trabalho com\nas populações indígenas. Promovido a capitão em 1917, desligou-se da\ncomissão em abril do ano seguinte.\n\nNo 5 de Julho de 1922\n\nManuel Rabelo servia em Mato Grosso quando eclodiu, no Rio de Janeiro, o\nlevante tenentista contra a posse de Artur Bernardes. Apoiou o movimento\ne aderiu às forças rebeladas do general Clodoaldo da Fonseca, comandante\nda 1^a^ Circunscrição Militar de Mato Grosso. As tropas mato-grossenses\nsublevadas marcharam em direção a São Paulo, mas foram surpreendidas na\ndivisa entre os dois estados com a notícia da derrota do movimento e da\nrendição dos revoltosos do Rio de Janeiro. Clodoaldo da Fonseca depôs as\narmas e foi preso no dia 11 de julho, mas Rabelo só foi capturado no mês\nseguinte. Libertado em 1927, só foi julgado em fevereiro de 1928, sendo\ncondenado a um ano e meio de prisão, pena muito inferior ao tempo que já\npassara detido.\n\nCom a vitória da Revolução de 1930, foi anistiado no dia 12 de novembro,\nassim como todos os participantes dos movimentos tenentistas da década\nde 1920. Reintegrado à carreira militar e promovido a major e a\ntenente-coronel por decreto no dia 15 de novembro, assumiu em janeiro de\n1931 o comando do 4^o^ Regimento de Infantaria, sediado em Quitaúna\n(SP).\n\nInterventor em São Paulo\n\nDepois da revolução, São Paulo não conseguiu encontrar um *modus\nvivendi* com o novo governo federal. As lideranças tradicionais do\nestado opunham-se às forças do tenentismo, favorecidas pelo governo\nprovisório chefiado por Getúlio Vargas. O Partido Democrático (PD), que\napoiara a revolução, pretendia também o governo do estado, e tendia cada\nvez mais para a oposição à medida que o governo federal insistia em\nnomear para a interventoria paulista ou homens ligados visceralmente ao\ntenentismo, como João Alberto Lins de Barros (interventor de novembro de\n1930 a julho de 1931), ou nomes de pouca expressão, sem liderança\npolítica efetiva no estado, como Laudo de Camargo (interventor de julho\na novembro de 1931).\n\nNo dia 13 de novembro de 1931, Manuel Rabelo foi nomeado por Vargas\ninterventor em São Paulo. Seu nome era apoiado por João Alberto, Pedro\nAurélio de Góis Monteiro (então comandante da 2^a^ Região Militar) e\nMiguel Costa (comandante da Força Pública do estado), figuras\nproeminentes do tenentismo.\n\nEntretanto, agravava-se a crise no estado. Crescia a impaciência com a\npresença no governo de um elemento alheio à política paulista, o que era\nencarado como uma “ocupação”, e reivindicava-se a nomeação de um\ninterventor “civil e paulista”. As divergências entre o governo federal\ne as lideranças políticas estaduais tornavam-se cada vez mais profundas.\n\nPor outro lado, as primeiras medidas tomadas por Rabelo na interventoria\ncontribuíram para acentuar em todos os níveis a oposição ao seu governo.\nPositivista ortodoxo, o novo interventor adotou na correspondência\noficial do estado as formas de tratamento preconizadas por seu credo,\nusando para seus colaboradores o título de “cidadão” e ficando por isso\nconhecido no estado como “cidadão Rabelo”. Outras medidas que tomou,\ncomo uma longa e detalhada comunicação que fez publicar no *Diário\nOficial* do estado tratando da proteção à mendicância, eram encaradas\ncomo manifestações de excentricidade e de incompetência para o exercício\ndo cargo, embora reconhecidamente caritativas e generosas.\n\nAlém disso, emitiu em dezembro decreto ampliando as atribuições do\ncomando geral da Força Pública, beneficiando Miguel Costa. Em janeiro de\n1932, promoveu a reorganização da instrução pública no estado, revogando\no ensino religioso e, segundo seus oponentes, transformando o ensino\npúblico em um “prolongamento da Legião Revolucionária” (organização\ntenentista também liderada por Miguel Costa). Criou ainda o Departamento\nde Trânsito e Policiamento, o Serviço Sanitário, a Seção de Estudos e\nProfilaxia do Impaludismo e a Inspetoria de Higiene e Assistência\nDentária.\n\nAo longo dos meses de janeiro e fevereiro de 1932, a oposição\nrecrudesceu. O Partido Republicano Paulista (PRP), representante dos\ninteresses contrariados pela Revolução de 1930, ressurgia. Em 13 de\njaneiro, o PD lançou manifesto rompendo com o governo e afirmando que a\ninterventoria de Rabelo, “que não passa de uma sombra do capitão João\nAlberto”, agravara sensivelmente a situação do estado. A partir de\nentão, o PD procurou aproximar-se do PRP, promovendo a formação, em\nfevereiro, da Frente Única Paulista (FUP) ou Frente Única de São Paulo\n(FUSP), com o fim de congregar as forças políticas do estado contrárias\nao domínio dos tenentistas.\n\nAo mesmo tempo, sucediam-se insistentes rumores anunciando a\nsubstituição de Rabelo por um paulista civil. Finalmente, no dia 3 de\nmarço, Vargas encontrou uma solução política aceitável, exonerando o\ncoronel Rabelo e nomeando interventor o paulista Pedro de Toledo,\nintimamente ligado ao PD. Embora politicamente sua posição fosse\ninsustentável, Manuel Rabelo deixou a interventoria cercado de respeito\ne até da estima dos paulistas, segundo depoimentos de alguns de seus\nmais ferrenhos opositores, como Paulo Nogueira Filho.\n\nÀs Vésperas da Revolução Constitucionalista\n\nAo assumir o posto de interventor, Pedro de Toledo constituiu um\nsecretariado em que se combinavam “tenentes” e políticos paulistas. No\nentanto, a crise evoluiu, e em pouco tempo os grupos paulistas\ndescontentes já contavam com considerável apoio popular.\n\nNo dia 23 de maio de 1932, realizou-se em São Paulo uma série de\nmanifestações de rua em favor da autonomia paulista e da\nconstitucionalização. O ministro da Fazenda Osvaldo Aranha, que se\nencontrava na cidade representando o governo provisório, foi alvo de\nviolentos ataques dos oradores. Ainda assim, negociou a formação de um\nnovo secretariado para São Paulo, dessa vez composto apenas de políticos\nda FUP.\n\nNa capital federal, entretanto, decidiu-se nomear, em contrapartida, o\ncoronel Manuel Rabelo para o comando da 2^a^ RM. Rabelo partiu\nimediatamente para São Paulo, acompanhado de um grupo de oficiais de\nconfiança e com instruções de levar a efeito diversas medidas previstas\nem um “plano estratégico” preparado por Góis Monteiro, seu antecessor no\ncomando da região. Com a finalidade de manter a ordem, impedir levantes\ne assegurar o controle militar do estado para o governo federal, o plano\nprevia a transferência das sedes de várias unidades, a mudança do\nquartel-general para uma chácara afastada da capital e a unificação do\ncomando da polícia e do Exército, concentrando-se grande parte da tropa\nna capital, pronta para entrar em ação a qualquer momento. Em telefonema\na Osvaldo Cordeiro de Farias, “tenente” e chefe de polícia de São Paulo\naté o dia 24, João Alberto, que se encontrava no Rio de Janeiro, afirmou\nque Rabelo levava instruções para “ocupar militarmente” São Paulo.\n\nA caminho de São Paulo, Rabelo principiou a executar o plano de Góis\nMonteiro. Consultou chefes de diversas guarnições do interior, sondando\nsua disposição e transferindo alguns para São Paulo. Ao chegar à\ncapital, reuniu-se com os comandantes militares, examinando a situação\nda cidade e discutindo a repressão aos distúrbios de rua. Em seguida,\nrumou para o palácio dos Campos Elísios, sede do governo estadual,\nafirmando ao interventor Pedro de Toledo que pretendia prestigiá-lo,\n“enquanto se mantivesse dentro da lei”. Em seguida, no dia 29 de maio,\nunificou os comandos do Exército e da Força Pública, mas ante a forte\nreação que a medida provocou decidiu revogá-la em 1^o^ de junho. A\nconcentração de tropas na capital já reduzira a agitação, e Rabelo pôde\nadotar atitudes mais conciliadoras.\n\nEm 7 de julho, dois dias antes da eclosão da Revolução\nConstitucionalista, Vargas exonerou Manuel Rabelo do comando da 2^a^\nRegião Militar, em mais uma tentativa de chegar a um acordo com o\ngoverno paulista, e nomeou para substituí-lo o general José Luís Pereira\nde Vasconcelos.\n\nNo dia 18 de julho, em meio ao movimento paulista, que só terminaria em\n1^o^ de outubro, Manuel Rabelo foi nomeado comandante interino da\ncircunscrição militar de Campo Grande, atual capital de Mato Grosso do\nSul. Em setembro foi promovido a general de brigada e em março do ano\nseguinte foi nomeado para o comando da 7^a^ RM, sediada em Recife.\n\nO General e a Constituinte\n\nPouco depois de assumir o posto, em abril, Manuel Rabelo foi convidado\npor um grupo de oficiais positivistas para assumir a presidência do\nClube Republicano Ditatorial, que pretendia fazer do Brasil uma ditadura\nrepublicana, “governo constitucional de um só poder que bem sabe\nconciliar a Liberdade com a força e a responsabilidade”.\n\nEm novembro de 1933, poucos dias antes do início dos trabalhos da\nConstituinte, deu entrevista ao jornal baiano *A Tarde*, firmando\nposição contrária à Assembleia. Em nova entrevista, dessa vez a *O\nJornal*, do Rio, declarou que a Constituinte não era “representativa da\nvontade nacional”, pois as eleições de maio de 1933, que escolheram os\nrepresentantes dos estados, haviam sido tão “defeituosas” como as da\n“República Velha”.\n\nAs declarações tiveram grande repercussão na Assembleia. Na sessão\nrealizada em 2 de março de 1934, foram lidos vários requerimentos, entre\neles um assinado por Augusto Simões Lopes, pedindo que se enviasse um\nofício a Góis Monteiro, então ministro da Guerra, repudiando as\nexpressões “injuriosas e pejorativas” da entrevista. Quatro dias depois,\nem carta dirigida ao presidente da Assembleia, Antônio Carlos Ribeiro de\nAndrada, Góis Monteiro dizia que o general Rabelo confirmara a\nentrevista, mas fazia a ressalva de que o redator não soubera expressar\nseu pensamento, pois não pretendera desrespeitar a Constituinte e seus\nmembros.\n\nNo dia 18 de março, Rabelo escreveu ao ministro da Guerra propondo a\nintervenção das forças armadas no processo político, por meio de uma\n“proclamação ao povo”. O plano previa a dissolução da Assembleia e a\npromulgação da Constituição gaúcha de Júlio de Castilhos, a primeira\nconstituição republicana do Rio Grande do Sul. Essa Carta Constitucional\n– considerada por Rabelo “o tipo que melhor se aproxima da Constituição\npreconizada para o regime republicano ditatorial” – sofreria alguns\nadendos, como o aumento dos órgãos administrativos e a adoção de medidas\npara incorporar o proletariado à sociedade. Vargas seria mantido como\nchefe da nação, com poderes para nomear os governadores dos estados.\n\nEm abril de 1934, o interventor federal no Rio Grande do Sul, José\nAntônio Flores da Cunha, enviou um telegrama a Vargas informando-lhe ter\nsabido que os generais Manuel Rabelo, Manuel de Cerqueira Daltro Filho,\nda 2^a^ RM, Álvaro Guilherme Mariante, da 1^a^ RM, e Constâncio\nDeschamps Cavalcanti, da 4^a^ RM, eram favoráveis à ditadura ou à\neleição de Góis Monteiro. No telegrama, Flores lamentava a passividade\nde Vargas e afirmava estar pronto para a luta, que se dispunha a iniciar\ntão logo se convencesse de que seria inútil esperar mais.\n\nEm novas declarações a *O Jornal*, em julho, Rabelo afirmou considerar\nimpossível um governo exercer seu mandato com a Constituição que estava\nem vias de ser aprovada. Referia-se a ela como um “produto híbrido” da\nConstituição de 1891, esta “quase perfeita”. Segundo ele, “a parte boa\nda Constituição de 1891 foi completamente deturpada, e a ruim mantida e\naté piorada, o que acabou por reduzi-la a um amontoado de\ninconsequências e inutilidades para o Brasil”.\n\nDe 1935 a 1943\n\nComo sempre preocupado com questões sociais, e impressionado com a\nmiséria em Recife, em agosto de 1935 Manuel Rabelo procurou apresentar\nsoluções para o problema dos mocambos, promovendo reuniões com membros\ndo governo estadual e da Igreja.\n\nEm outubro de 1935 foi enviado a Natal, incluída na jurisdição da 7^a^\nRM que comandava, para procurar manter a ordem no Rio Grande do Norte. A\ncampanha eleitoral para o governo do estado vinha se desenvolvendo em\nclima de violência, opondo as facções de Rafael Fernandes e Mário\nCâmara.\n\nNo final de novembro, ao eclodir em Natal e depois em Recife a Revolta\nComunista, Manuel Rabelo se encontrava no Rio de Janeiro. Só retornou a\nRecife no dia 25, quando o levante já havia sido sufocado. Antes e\ndepois do movimento, Rabelo foi considerado, segundo Robert Levine,\naliado potencial dos comunistas, a respeito dos quais afirmara, na\ncarta-manifesto do Clube Republicano Ditatorial (8/4/1933) que eram\n“sinceramente amigos da liberdade”. Dissera ainda que, embora “sua\nsolução [fosse] ilusória e subversiva”, devia-se “apreciar os nobres\nsentimentos que caracterizam o comunismo, recusando, contudo, as teorias\nque lhe servem de órgãos provisórios”.\n\nManuel Rabelo só permaneceu no comando da 7^a^ RM até janeiro de 1936.\nNo ano seguinte, foi nomeado diretor de engenharia do Departamento de\nAdministração do Exército. Promovido a general de divisão em junho de\n1938, em agosto assumiu o comando da 5^a^ RM e da 5^a^ Divisão de\nInfantaria, sediada em Curitiba.\n\nEm agosto de 1939 foi nomeado inspetor da arma e dos serviços de\nengenharia do Exército e, em dezembro do mesmo ano, ingressou na\ncomissão de regulamentação da Lei de Promoções do Exército. Ainda em\ndezembro de 1939, tornou-se membro do Conselho Nacional de Proteção aos\nÍndios. Como o SPI, o conselho também era presidido por Cândido Rondon.\n\nEm setembro de 1941, o general Rabelo foi nomeado ministro do então\nSupremo – hoje Superior – Tribunal Militar (STM).\n\nPresidente da Sociedade Amigos da América\n\nO general Rabelo foi um dos principais articuladores da Sociedade Amigos\nda América, cuja presidência assumiu no momento da fundação, em janeiro\nde 1943, no contexto da Segunda Guerra Mundial. A sociedade defendia a\naproximação entre o Brasil e os Estados Unidos, e o embaixador\nnorte-americano apoiou a iniciativa, comparecendo à sessão inaugural.\n\nA Sociedade Amigos da América tinha caráter antifascista e congregava\nelementos do governo favoráveis aos Aliados e setores oposicionistas\nliberais, além de comunistas. Dela faziam parte Virgílio e Afonso Arinos\nde Melo Franco, além de militares como os generais Rondon e Júlio\nCaetano Horta Barbosa. Depois de sua fundação, expandiu-se por outros\nestados, instalando uma filial em São Paulo, onde contou com o apoio da\nUnião Nacional dos Estudantes e do Centro Acadêmico 11 de Agosto. Ao\nlado da Liga de Defesa Nacional, da Sociedade Brasileira dos Escritores\ne dos estudantes, a sociedade constituiu um dos mais importantes\nelementos de pressão sobre o governo em defesa da democratização e da\ncriação da Força Expedicionária Brasileira.\n\nRabelo e a Sociedade Amigos da América foram considerados comunistas\npelo ministro da Guerra, general Eurico Gaspar Dutra, o qual determinou\nque suas atividades sofressem vigilância e restrições. A pedido de\nViriato Vargas e outros, o Departamento de Imprensa e Propaganda passou\na censurar as notícias relacionadas à sociedade. O comandante da 7^a^ RM\npediu a Dutra que proibisse a ida de Rabelo a Recife, onde, segundo ele,\n“os comunistas agitavam a pretexto de promover a sociedade”.\n\nEm maio de 1943, a entidade organizou, em Belo Horizonte, uma Semana\nAntifascista. Em outubro do mesmo ano, a polícia impediu no Rio de\nJaneiro a realização de reunião em que Osvaldo Aranha, à época ministro\ndas Relações Exteriores, seria empossado na vice-presidência da\nsociedade.\n\nAcatando sugestão de Dutra, Getúlio Vargas pediu ao general Rabelo que\nnão desenvolvesse “quaisquer atividades que possam afetar o alto\ninteresse da defesa nacional ou que criem dissensões no Exército”.\n\nEm abril de 1944, o general Rabelo foi eleito vice-presidente do STM.\nMantendo-se na presidência da Sociedade Amigos da América, em agosto do\nmesmo ano enviou ofício ao ministro Osvaldo Aranha comunicando-lhe que\nhavia sido novamente escolhido para a vice-presidência da entidade.\nOsvaldo Aranha aceitou no dia 10 de agosto, e no mesmo dia, por ordem de\nCoriolano de Góis, chefe de polícia do Distrito Federal, a sede da\nsociedade – instalada no prédio do Automóvel Clube – foi invadida pela\npolícia e fechada. No dia seguinte, Osvaldo Aranha almoçava no Automóvel\nClube quando a polícia tornou a invadir o prédio, o que o levou a\nexonerar-se do Ministério das Relações Exteriores.\n\nEm dezembro de 1944, o general Rabelo deixou a vice-presidência do STM,\npermanecendo contudo como ministro. No dia 20 de abril de 1945, obteve\ndo novo chefe de polícia, João Alberto, autorização para reabrir a\nSociedade Amigos da América.\n\nFaleceu no Rio de Janeiro sete meses depois, no dia 18 de novembro de\n1945.\n\nDeixou publicados os livros *Combatendo a tirania: discursos contra o\nnazi-nipo-fascismo* (1944) e *Pela grandeza do Brasil*.\n\nRobert Pechman\n\n**FONTES:**ARAÚJO, A. *Chefes*; ARQ. GETÚLIO VARGAS; CARONE, E.\n*Estado*; CARONE, E. *República nova*; CARONE, E. *Terceira*; CLUBE\nREPUBLICANO DITATORIAL. *Programa*; CONSULT. MAGALHÃES, B; CORRESP. SUP.\nTRIB. MILITAR; *Cronologia da Assembleia*; DULLES, J. *Getúlio*; *Encic.\nMirador*; FIGUEIREDO, E. *Contribuição*; *Grande encic. Delta*; JARDIM,\nR. *Aventura*; *Jornal do Brasil*; LAGO, L. *Conselheiros*; LEITE, A.\n*História*; LEVINE, R. *Vargas*; MIN. GUERRA. *Almanaque*; NOGUEIRA\nFILHO, P. *Ideais*; *Novo dic. de história*; PEIXOTO, A. *Getúlio*;\nPOPPINO, R. *Federal*; SILVA, H. *1922*; SILVA, H. *1935*; *Tarde*.\n","ref":"**FONTES:**ARAÚJO, A. *Chefes*; ARQ. GETÚLIO VARGAS; CARONE, E.\n*Estado*; CARONE, E. *República nova*; CARONE, E. *Terceira*; CLUBE\nREPUBLICANO DITATORIAL. *Programa*; CONSULT. MAGALHÃES, B; CORRESP. SUP.\nTRIB. MILITAR; *Cronologia da Assembleia*; DULLES, J. *Getúlio*; *Encic.\nMirador*; FIGUEIREDO, E. *Contribuição*; *Grande encic. Delta*; JARDIM,\nR. *Aventura*; *Jornal do Brasil*; LAGO, L. *Conselheiros*; LEITE, A.\n*História*; LEVINE, R. *Vargas*; MIN. GUERRA. *Almanaque*; NOGUEIRA\nFILHO, P. *Ideais*; *Novo dic. de história*; PEIXOTO, A. *Getúlio*;\nPOPPINO, R. *Federal*; SILVA, H. *1922*; SILVA, H. *1935*; *Tarde*.\n","dic":"DHBPR"}
