{"title":"RAMOS, Manuel Vitorino de Paula","cargoss":["Deputado federal","Deputado federal"],"cargos_esp":[0,0],"datas_ini":[1909,1894],"datas_fim":[1911,1907],"estados":["SC","SC"],"autor":["Carolina Vianna Dantas"],"content":"**RAMOS, Manuel Vitorino de Paula**\n\n\\*dep. fed. SC 1894-1907 e 1909-1911.\n\n*Manuel Vitorino de Paula Ramos* nasceu em Recife no dia 27 de agosto de\n1860, filho de José Francisco de Paula Ramos.\n\nFez os estudos primários e secundários em sua cidade natal. Depois\nformou-se engenheiro, em 1883, na Escola Politécnica do Rio de Janeiro,\nentão capital do Império. Exerceu a engenharia em Minas Gerais, como\nengenheiro-chefe das Comissões de Terras de Ponte Nova e Manhuaçu, em\nSanta Catarina, como delegado da Inspetoria Geral das Terras e\nColonização nas colônias de Brusque, Luís Alves e Blumenau, e no Rio de\nJaneiro, como engenheiro-fiscal das estradas de ferro.\n\nMembro do Partido Republicano Federal, iniciou a carreira política em\n1891, quando foi eleito deputado à Assembleia Constituinte de Santa\nCatarina. Por sua efetiva participação no combate à Revolução\nFederalista (1893-1895), recebeu do presidente Floriano Peixoto\n(1891-1894) a patente de tenente-coronel do Exército brasileiro.\n\nEm 1894 foi eleito deputado federal por Santa Catarina para a\nlegislatura 1894-1896, sendo reeleito para mais quatro mandatos\nconsecutivos. Entretanto, renunciou ao seu quinto mandato em 1907 para\nassumir o cargo de diretor do Serviço de Propaganda e Expansão do Brasil\nna Europa. Logo depois voltou a eleger-se deputado federal por Santa\nCatarina, cumprindo o mandato de 1909 a 1911. Foi eleito mais uma vez em\n1912, mas não foi reconhecido pela Câmara, então responsável por validar\nas eleições.\n\nFaleceu em 1925.\n\nEra casado e deixou filhos.\n\nCarolina Vianna Dantas\n\n**FONTES:** ABRANCHES, J. *Governos*; PIAZZA, W. *Dicionário*.\n","ref":"**FONTES:** ABRANCHES, J. *Governos*; PIAZZA, W. *Dicionário*.\n","dic":"DHBPR"}
