{"title":"REGIS, Gustavo Lebon","cargoss":["Deputado federal"],"cargos_esp":[0],"datas_ini":[1915],"datas_fim":[1917],"estados":["SC"],"autor":["Carolina Vianna Dantas"],"content":"**REGIS, Gustavo Lebon**\n\n\\* militar; dep. fed. SC 1915-1917.\n\n*Gustavo Lebon Regis* nasceu na cidade de Parati, atual Araquari (SC),\nno dia 18 de fevereiro de 1874, filho de Alexandre Justino Regis e de\nLuísa Lebon Regis.\n\nFez os estudos primários em Joinville (SC), transferindo-se\nposteriormente para Campo Alegre (SC), onde se empregou no comércio. Em\n1891, a convite de Lauro Müller, fixou-se em Desterro, atual\nFlorianópolis, e começou a cursar o ginásio. No ano seguinte\nmatriculou-se na Escola Militar. Em 1894, como alferes-aluno da Escola\nMilitar, tomou parte no combate à Revolução Federalista na cidade de\nLapa (PR). Manejando um canhão *Krupp*, acabou saindo de combate\ngravemente ferido. Em 1902 formou-se, obtendo os diplomas de engenheiro\nmilitar e de bacharel em matemática.\n\nIniciou a carreira política como deputado estadual em Santa Catarina na\nlegislatura 1902-1903. Reeleito para quatro mandatos consecutivos, em\n1910 participou da Assembleia Constituinte de Santa Catarina e em 1912\nfoi presidente da Assembleia. Entre os anos de 1911 e 1912 ocupou\ninterinamente o cargo de prefeito de Florianópolis em três ocasiões: de\n31 de outubro de 1911 a 1^o^ de fevereiro de 1912; de 10 de fevereiro a\n3 de março de 1912; e de 19 a 22 de abril de 1912. Foi também secretário\nda Fazenda, Viação e Obras Públicas e Agricultura do Estado de Santa\nCatarina de janeiro de 1913 a outubro de 1914.\n\nEm 1915 foi eleito deputado federal por Santa Catarina. Durante sua\npassagem pela Câmara dos Deputados, de 1915 a 1917, integrou a Comissão\nDemarcadora de Limites entre os Estados de Santa Catarina e Paraná,\nformada após a Guerra de Contestado (1912-1916). Como militar, foi\nsucessivamente promovido, de alferes comissionado, em 1894, até obter a\npatente de coronel efetivo, em 1923.\n\nFaleceu na cidade do Rio de Janeiro, então Distrito Federal, no dia 19\nde abril de 1930.\n\nCarolina Vianna Dantas\n\n**FONTES:** ABRANCHES, J. *Governos*; HOERNER JUNIOR, V. *Maragatos*;\nPIAZZA, W. *Dicionário*.\n","ref":"**FONTES:** ABRANCHES, J. *Governos*; HOERNER JUNIOR, V. *Maragatos*;\nPIAZZA, W. *Dicionário*.\n","dic":"DHBPR"}
