{"title":"AZEVEDO, Sandoval Soares de","cargoss":["Deputado federal"],"cargos_esp":[0],"datas_ini":[1927],"datas_fim":[1930],"estados":["MG"],"autor":[0],"content":"**AZEVEDO, Sandoval Soares de**\n\n\\* dep. fed. MG 1927-1930.\n\nSandoval Soares de Azevedo nasceuem Minas Gerais.\n\nIngressou na política ao ser eleitodeputado federal por seu estado\nnatal.Assumiu sua cadeira na Câmara dos Deputadosno Rio de Janeiro,\nentão Distrito Federal,em 3 de maio de 1927. Reeleitoem 1930, permaneceu\nna Câmara dos Deputadosaté 23 de outubro desse ano, quandoteve o mandato\ninterrompido pela Revoluçãode 1930, que levou Getúlio Vargas aopoder e\nextinguiu todos os órgãos legislativosdo país.\n\nFaleceu em Minas Gerais.\n\nIoneide Piffano Brion de Souza\n\n**FONTES:** ARRUDA, M. *Mitologia*; BARBOSA,W. *História*; CÂM. DEP.\n*Deputados brasileiros*;HORTA, C. *Famílias*; VASCONCELOS, D.\n*História.*\n","ref":"**FONTES:** ARRUDA, M. *Mitologia*; BARBOSA,W. *História*; CÂM. DEP.\n*Deputados brasileiros*;HORTA, C. *Famílias*; VASCONCELOS, D.\n*História.*\n","dic":"DHBPR"}
