{"title":"REIS, Pereira","cargoss":["Deputado federal"],"cargos_esp":[0],"datas_ini":[1900],"datas_fim":[1908],"estados":["RN"],"autor":["Renato Amado Peixoto"],"content":"**REIS, Pereira**\n\n\\*dep. fed. RN 1900-1908.\n\n*Manuel Pereira Reis* nasceu em Salvador no dia 12 de novembro de\n1837,filho do livreiro português Joaquim Pereira Reis.\n\nApós a morte do pai, mudou-se para o Rio de Janeiro, então capital do\nImpério, em 1856. Completou os estudos secundários no mosteiro de São\nBento e em 1857 matriculou-se no Imperial Liceu de Artes e Ofícios,\nperíodo em que se dedicou à pintura e se tornou amigo de Pedro Américo.\nNomeado adjunto do professor de desenho da Escola Naval em 1858, anos\ndepois, em 1867 foi designado professor de topografia e desenho\ntopográfico da mesma escola.\n\nEngenheiro e bacharel em ciências físicas e matemáticas pela Escola\nCentral, depois Escola Politécnica, em 1872, no ano seguinte foi\nagraciado com a Ordem da Rosa, por ter inventado um instrumento para\nmedir frações de segundo. Em 1874 recusou convite para integrar a\nComissão de Limites com a Bolívia, por estar realizando, como praticante\ndo Imperial Observatório, medições geográficas no Rio Grande do Sul.\nDois anos depois, foi nomeado astrônomo do Imperial Observatório,\ntornando-se responsável pela direção da instituição em caso de\nimpedimento do diretor, o francês Emmanuel Liais. Ainda em 1876,\nparticipou da elaboração da Carta Geral do Império junto ao Ministério\nda Agricultura. Na qualidade de chefe da Comissão Astronômica do\nMinistério da Agricultura, em 1877 determinou a diferença de latitudes e\nlongitudes entre o Imperial Observatório e Barra do Piraí, utilizando\npara tal fim, pela primeira vez no Brasil, o telégrafo.\n\nEm 1878 envolveu-se numa polêmica com Emmanuel Liais e depois com o\nsucessor deste, o belga Luiz Cruls. A polêmica, que se iniciou com as\ndenúncias de Pereira Reis de favorecimentos pessoais no Observatório,\nculminou na sua saída voluntária daquela instituição. Contudo, a troca\nde acusações perduraria mais de 30 anos, alcançando as páginas dos\njornais e a tribuna da Câmara dos Deputados, e desdobrando-se, de parte\na parte, na imputação de incompetência técnica. Muito provavelmente, a\npolêmica tinha raízes mais profundas, derivando do sentimento de\ninsatisfação contra o desligamento do Observatório do âmbito da Escola\nCentral, exigência feita em 1870 por Liais.\n\nSintomaticamente, Pereira Reis ingressou na Escola Politécnica já em\n1879, passando a lente da cadeira de astronomia em 1881, com o título de\ndoutor em matemática. Nesse mesmo ano, fundou o Observatório Astronômico\nda Escola Politécnica (hoje o Observatório do Valongo, pertencente à\nUniversidade Federal do Rio de Janeiro, UFRJ), do qual se tornou o\nprimeiro diretor. Ainda em 1881, foi encarregado de examinar a planta\ncadastral da cidade do Rio de Janeiro levantada pelo engenheiro João\nRocha Fragoso. Em 1883, juntamente com Conrado Jacob de Niemeyer,\nexecutou o plano de linha e o cadastro de Copacabana, e assumiu o cargo\nde chefe da Comissão da Carta Cadastral do Rio de Janeiro.\n\nConvidado por Raimundo Teixeira Mendes, presidente do Apostolado\nPositivista do Brasil e seu contemporâneo na Escola Central, foi um dos\nresponsáveis pela elaboração do novo pavilhão nacional após a\nproclamação da República (15/11/1889), cabendo-lhe organizar a posição\ndas estrelas no dístico da bandeira.\n\nEm 1900, deixou a chefia da Comissão da Carta Cadastral – que foi\nresponsável pela organização da carta cadastral e topográfica do\nDistrito Federal, a principal fonte de que se serviu o prefeito\nFrancisco Pereira Passos para sua reforma urbanística – e foi convidado\npara chefiar a Comissão de Limites com a Bolívia. Contudo, não aceitou o\ncargo por ter sido eleito deputado federal pelo Rio Grande do Norte, na\nlegenda do Partido Republicano Federal. Fora indicado pelo líder\npolítico daquele estado, Pedro Velho de Albuquerque Maranhão, para\nconcorrer à eleição como candidato extraoficial, e foi eleito, ainda que\nnão fosse conhecido no Rio Grande do Norte. Sua ligação com o grupo que\ncontrolava a política no Rio Grande do Norte datava da década de 1880,\nquando Augusto Severo de Albuquerque Maranhão, irmão de Pedro Velho,\nfrequentou seu curso na Escola Politécnica. Quando Augusto Severo\nconcebeu em 1893 o balão “Bartolomeu de Gusmão”, seu projeto recebeu a\naprovação de Pereira Reis. Anos depois, Pereira Reis envolveu-se\npessoalmente com outro projeto de Augusto Severo, o do balão dirigível\n*Pax* (Severo morreu na explosão do *Pax*, ocorrida em Paris em maio de\n1902).\n\nEmpossado na legislatura 1900-1902 e reeleito para as duas legislaturas\nseguintes (1903-1905 e 1906-1908), Pereira Reis centrou sua atuação na\nCâmara na busca de recursos destinados a combater os efeitos da seca no\nRio Grande do Norte, conseguindo, em 1904, constituir junto ao\nMinistério da Indústria, Viação e Obras Públicas, a chamada Comissão de\nPerfuração de Poços, da qual foi nomeado diretor. Sediada em Natal, a\ncomissão funcionou até 1906, direcionando parte das verbas destinadas às\nobras contra as secas para o estado. Por conta de sua posição, visitou\nos Estados Unidos em busca de novos métodos de prospecção, importando\nmáquinas e trazendo técnicos daquele país. Envolveu-se ainda na chamada\n“questão de Grossos”, que opôs Rio Grande do Norte e Ceará na disputa de\numa área fronteiriça. Operou no levantamento da área disputada, de modo\na subsidiar os esforços empreendidos na defesa das pretensões do Rio\nGrande do Norte.\n\nAbandonando a carreira política e retirando-se também do magistério,\nvoltou a dedicar-se à pintura.\n\nFaleceu em Barbacena (MG) em 24 de junho de 1922.\n\nEra casado com Adelaide Margarida de Azevedo Reis, com que teve um\nfilho.\n\nPublicou *Teoria completa dos cometas* (1881); *Determinação das\ndiferenças de latitude e de longitude entre o Imperial Observatório\nAstronômico do Rio de Janeiro e a Barra do Piraí* (1877); *O céu na\nlatitude de 23º sul - mapa circular rotatório* (1887); *Planta da cidade\ndo Rio de Janeiro* (1894).\n\nRenato Amado Peixoto\n\n**FONTES:** AZEVEDO, F. *Ciências*; BARATA, M. *Escola*; CASCUDO, L.\n*Vida*; FERNANDES, A. *Pioneiro*; OLIVEIRA, J.; VIDEIRA, A. *Polêmicas*\n(p.42-52); RUBENS, C. *Pequena*; SOUZA, I.; MEDEIROS FILHO, J. *Seca*.\n","ref":"**FONTES:** AZEVEDO, F. *Ciências*; BARATA, M. *Escola*; CASCUDO, L.\n*Vida*; FERNANDES, A. *Pioneiro*; OLIVEIRA, J.; VIDEIRA, A. *Polêmicas*\n(p.42-52); RUBENS, C. *Pequena*; SOUZA, I.; MEDEIROS FILHO, J. *Seca*.\n","dic":"DHBPR"}
