{"title":"RESENDE, José Augusto Pereira de","cargoss":["Deputado federal"],"cargos_esp":[0],"datas_ini":[1927],"datas_fim":[1929],"estados":["SP"],"autor":[0],"content":"**RESENDE, José Augusto Pereira de**\n\n\\* dep. fed. SP 1927-1929.\n\n*José Augusto Pereira de Resende* nasceu em Santa Cruz (ES) no dia 21 de\ndezembro de 1872.\n\nFez os primeiros estudos no Espírito Santo, em 29 de dezembro de 1890\nprestou os exames preparatórios no então Distrito Federal e a seguir\nmatriculou-se na Faculdade de Medicina e de Farmácia do Rio de Janeiro.\nFez sua residência médica no Hospital da Brigada Policial e prestou os\nexames finais em dezembro de 1897, sendo aprovado em obstetrícia e\nginecologia formando-se no ano seguinte. No dia 17 de janeiro de 1898,\ndefendeu tese e foi também aprovado.\n\nTransferindo-se para São Paulo, foi residir na cidade de São Manuel e aí\npassou a clinicar. Também nessa cidade conheceu sua esposa, descendente\nda família Barros, de grande prestígio na região. Devido a seu trabalho\ncomo médico, recebeu apoio e simpatia da população, que em 1905 o elegeu\nvereador à Câmara Municipal. Eleito presidente da casa, exerceu também o\ncargo de prefeito de São Manuel e tornou-se chefe do Partido Republicano\nPaulista (PRP) no município.\n\nEm 1922, seu nome foi indicado pelo PRP para concorrer a deputado\nestadual como representante do 5^o^ Distrito. Eleito, foi escolhido\nmembro da Comissão de Redação e da Comissão de Obras Públicas, Viação e\nAviação da Câmara Estadual. Foi reeleito em 1925, mas renunciou poucos\nmeses depois, quando, em 29 de novembro e foi eleito, com 103.680 votos,\nsenador estadual. Assumiu sua cadeira em 13 de julho de 1926 na vaga de\nWashington Luís, que havia sido eleito para o Senado Federal, e passou a\nintegrar a Comissão de Higiene Pública. Mais uma vez renunciou ao\nmandato, ao ser eleito deputado federal em 24 de fevereiro de 1927.\nTomou posse na Câmara dos Deputados, no Rio de Janeiro, então capital\nfederal, no dia 3 de maio, com mandato até dezembro de 1929, enquanto\nsua cadeira no Senado paulista era ocupada por Américo de Campos. Foi\nnovamente eleito senador estadual em 30 de maio de 1930, substituindo\nJosé Alves Guimarães Júnior, que havia falecido, mas em outubro\nseguinte, com a vitória das forças revolucionárias chefiadas por Getúlio\nVargas, teve o mandato interrompido. Retornou então a São Manoel,\npassando a se dedicar à medicina e à sua propriedade agrícola.\n\nApós a Revolução Constitucionalista de 1932, lançou seu sobrinho Ademar\nde Barros na política. Ademar havia passado dois anos no exílio por sua\nparticipação no movimento armado contra Vargas, quando atuou como\ncapitão médico na região do Túnel, no vale do Paraíba, sob o comando do\ncoronel Euclides Figueiredo. Quando voltou ao Brasil foi convidado por\nseu tio, chefe do PRP na região de Botucatu, para concorrer às eleições\nde outubro 1934. Acabou eleito deputado constituinte estadual, iniciando\nassim longa carreira política, que o levaria a ser interventor federal\nem São Paulo (1938-1941), governador (1947-1951 e 1963-1966), prefeito\nda capital paulista, (1957-1961) e duas vezes candidato à presidência da\nRepública, em 1955 e 1960.\n\nPereira de Resende foi acionista e membro do conselho fiscal da\nSociedade Anônima Fábrica de Tecidos Nossa Senhora Mãe dos Homens,\nsediada na cidade de Porto Feliz e presidida por seu cunhado Antônio\nEmídio de Barros. Durante vários anos fez parte do corpo de jurados do\nTribunal do Júri da comarca da capital de São Paulo.\n\nFaleceu em São Paulo em 27 de junho de 1961.\n\nFoi casado com Romana de Barros Resende, com quem teve dois filhos.\n\nAntônio Sérgio Ribeiro\n\n**FONTES:**CALIMAN, A. *Legislativo*; *Diário Oficial da União*; *Folha\nde S.Paulo* (28/6/1961); FONSECA, A.; FONTES JUNIOR, A. *Câmara*;\nRIBEIRO, A. *Poder*.\n","ref":"**FONTES:**CALIMAN, A. *Legislativo*; *Diário Oficial da União*; *Folha\nde S.Paulo* (28/6/1961); FONSECA, A.; FONTES JUNIOR, A. *Câmara*;\nRIBEIRO, A. *Poder*.\n","dic":"DHBPR"}
