{"title":"ÁLVARES, Domingos Quadros Barbosa","cargoss":["Deputado federal"],"cargos_esp":[0],"datas_ini":[1921],"datas_fim":[1930],"estados":["MA"],"autor":["Raimundo Helio Lopes"],"content":"**ÁLVARES, Domingos Quadros Barbosa**\n\n\\* dep. fed. MA 1921-1930.\n\nDomingos Quadros Barbosa Álvares nasceuem São Bento (MA) no dia 28\ndenovembro de 1880.\n\nIniciou sua vida política no governode Benedito Pereira Leite, entre os\nanosde 1906 e 1910, quando ocupou ocargo de secretário geral do estado\ndoMaranhão. Em 1911 foi eleito deputadoestadual. Nesse período estreou\nna literatura,foi um dos fundadores da Academia Maranhensede Letras, em\n1908, e da Federaçãodas Academias de Letras do Brasil. Dirigiua Imprensa\nOficial do Maranhão em trêsocasiões: 1908, 1912 e 1913.\n\nEleito deputado federal pelo Maranhãoem 1921, reelegeu-se sucessivas\nvezes até1930, mas teve o mandato interrompidocom a vitória da revolução\nde outubrodaquele ano, que fechou o Congresso Nacionale extinguiu todos\nos órgãos legislativosdo país.\n\nNo campo jornalístico, colaborou emdiversos órgãos no Maranhão, entre\nosquais *A Revista do Norte*, a revista *Atenas*, ojornal *Pacotilha*, o\n*Diário Oficial do Estado* e outrosmais. Faleceu na cidade do Rio\ndeJaneiro, então Distrito Federal, no dia26 de dezembro de 1946.\n\nEntre seus descendentes destaca-se ocantor e compositor Carlos Lyra, seu\nneto.\n\nPublicou *As cruzadas, mosaicos* (contos, 1908);*O dominó vermelho*\n(contos, 1909); *Contos da minha terra* (1911);*Silhuetas* (perfis\nbiográficos, 1911); e *Os irmãos Azevedo, em Conferências* (1939).\nTambém compôs em versosum fabulário intitulado *Jardim Zoológico*,\nparcialmentepublicado em periódicos.\n\nRaimundo Helio Lopes\n\n**FONTES:** ACAD. MARANHENSE. Disponívelem:\n\\<www.academiamaranhense.org.br/\\>. Acesso em:5/6/2010; MARQUES, C.\nDicionário.\n","ref":"**FONTES:** ACAD. MARANHENSE. Disponívelem:\n\\<www.academiamaranhense.org.br/\\>. Acesso em:5/6/2010; MARQUES, C.\nDicionário.\n","dic":"DHBPR"}
