{"title":"RIBEIRO, Artur","cargoss":["Ministro do Supremo Tribunal Federal"],"cargos_esp":[0],"datas_ini":[1923],"datas_fim":[1936],"estados":[0],"autor":["Eduardo Junqueira"],"content":"**RIBEIRO, Artur**\n\n\\* magistrado; min. STF 1923-1936.\n\n*Artur Ribeiro de Oliveira* nasceu na província de Minas Gerais no dia\n12 de junho de 1866, filho de Joaquim Ribeiro de Oliveira e de Adelina\nRibeiro de Oliveira\n\nBacharel em ciências jurídicas e sociais pela Faculdade de Direito de\nSão Paulo em 1888, no ano seguinte iniciou a carreira na magistratura\ncomo promotor público da comarca de Entre Rios, na província do Rio de\nJaneiro. Em março de 1892, transferiu-se para Caeté, em Minas Gerais,\ntornando-se o primeiro juiz de direito da comarca. Em junho de 1895 foi\nremovido mais uma vez para a comarca de Entre Rios, agora no posto de\njuiz de direito.\n\nEm 1903 foi nomeado pelo presidente de Minas Gerais, Francisco Antônio\nde Sales, procurador geral do estado. Em 1907 deixou essa função para\ntomar assento, como desembargador, no Tribunal da Relação – corte de\nsegunda instância que, em Minas Gerais, não modificou sua denominação\nvinda do tempo do Império. Foi presidente desse tribunal entre 1919 e\n1923. Em julho desse ano foi nomeado pelo presidente Venceslau Brás\nministro do Supremo Tribunal Federal (STF), preenchendo vaga surgida com\nfalecimento de Alfredo Pinto, nome também ligado ao estado de Minas\nGerais. Foi, ainda, lente da cadeira de direito penal da Faculdade de\nDireito de Belo Horizonte.\n\nFaleceu no exercício de suas funções em 24 de março de 1936, na cidade\ndo Rio de Janeiro.\n\nFoi casado com Maria Eugênia Ribeiro de Oliveira.\n\nEduardo Junqueira\n\n**FONTES:** MATTOSO, P. *Supremo Tribunal*; MELLO FILHO, J. *Notas*;\nSUP. TRIB. FED. Disponível em: \\<www.stf.jus.br/portal/ministros\\>.\n","ref":"**FONTES:** MATTOSO, P. *Supremo Tribunal*; MELLO FILHO, J. *Notas*;\nSUP. TRIB. FED. Disponível em: \\<www.stf.jus.br/portal/ministros\\>.\n","dic":"DHBPR"}
