{"title":"RIBEIRO, Bento","cargoss":["Prefeito"],"cargos_esp":[0],"datas_ini":[1910],"datas_fim":[1914],"estados":["DF"],"autor":[0],"content":"**RIBEIRO, Bento**\n\n\\* militar; pref. DF 1910-1914.\n\n*Bento Manuel Ribeiro Carneiro Monteiro* nasceu em Jaguarão (RS) em\n1856.\n\nSeguiu a carreira militar, chegando a general. Quando da posse do\nmarechal Hermes da Fonseca na presidência da República, em 15 de\nnovembro de 1910, foi nomeado prefeito do Distrito Federal, sucedendo a\nSerzedelo Correia.\n\nAo tomar posse na prefeitura, implantou um programa rigoroso de\ncontenção de despesas, na tentativa de estabilizar as finanças\nmunicipais. Conseguiu autorização da Intendência Municipal para unificar\ne consolidar a dívida flutuante, deu continuidade às obras iniciadas e\ndesenvolveu algumas, tentando respeitar as limitações financeiras com se\ndeparou. No entanto, com o passar do tempo, suavizou o programa de\nredução de despesas e gerou gastos, deixando para o sucessor um déficit\nigual ao que encontrara.\n\nA instrução pública no Distrito Federal era na época bastante\ndeficiente. De acordo com levantamento realizado em 1906, durante o\nmandato do prefeito Pereira Passos, 52,46% das crianças da capital\nfederal eram analfabetas. Com 37.899 alunos matriculados em 1906, o Rio\nde Janeiro deveria contar com cerca de 1.263 escolas, porém havia\nsomente 282. De 1906 até 1910 a população em idade escolar cresceu, e\ncom ela o problema da instrução pública primária da cidade. Apesar de\ntodos esses fatores, Bento Ribeiro não deu especial ênfase à questão da\ninstrução. Deu porém grande contribuição à cultura, concedendo à\nBiblioteca Municipal autonomia administrativa. Com a transferência da\nEscola Normal para um novo edifício construído no Estácio, sua antiga\nsede foi restaurada para que a Biblioteca Municipal fosse ali instalada,\npodendo voltar-se para as suas finalidades e organizar seus serviços e\nlivros.\n\nSensível à má remuneração do funcionalismo municipal, Bento Ribeiro\ndefendeu junto ao Legislativo o aumento dos vencimentos dos\nfuncionários. Também reduziu a jornada de trabalho dos empregados no\ncomércio e regularizou a venda avulsa de jornais, revistas e periódicos;\nfoi um dos primeiros políticos brasileiros a tratar de questões\nreferentes às condições de trabalho.\n\nTentou concretizar um projeto não realizado de Pereira Passos, a criação\nde um Parque Zoológico, mas não dispunha de terreno apropriado. O parque\nda Quinta da Boa Vista, após ter sido remodelado e incorporado ao\npatrimônio da prefeitura, foi cotado para abrigar o Zoológico.\nEntretanto, tal projeto somente seria realizado anos mais tarde, na\ngestão do prefeito Henrique Dodsworth (1937-1945). No setor de jardins,\na sua administração foi especialmente eficiente, conservando e repondo\nárvores em locais públicos.\n\nDeu continuidade às obras de viação iniciadas na administração anterior,\nbem como à conservação e melhoramento de alguns logradouros públicos,\ncom a pavimentação de ruas, conservação de estradas e caminhos,\nconstrução de muralhas de sustentação, obras contra inundações,\ncanalizações de rios, construção de galerias de águas pluviais, bueiros,\npontes etc. Em março de 1913, a ressaca do mar causou sérios prejuízos à\ncidade. Coube ao prefeito realizar as obras de reparo, principalmente na\navenida Beira-Mar, no Flamengo, na praia de Botafogo e na antiga praia\nda Saudade, faceando a avenida Pasteur. Em 1914, urbanizou a área do\nforte de Copacabana, no promontório em que se situava a Igrejinha de\nCopacabana, posteriormente demolida. Firmou com a Companhia Mercado\nMunicipal o contrato de exploração do Mercado da rua Dom Manuel e a\nutilização da respectiva doca, e autorizou a Companhia Jardim Botânico a\nprolongar as linhas de bondes de Ipanema até o Leblon.\n\nDurante todo o período em que esteve à frente da prefeitura, lançou um\nempréstimo interno de 20 milhões de cruzeiros, destinado a custear as\nobras que provavelmente seriam iniciadas e a impedir as inundações da\ncidade.\n\nAo final do governo Hermes da Fonseca, em 15 de novembro de 1914, deixou\na prefeitura, sendo substituído por Rivadávia Correia.\n\nFaleceu no Rio de Janeiro em 28 de agosto de 1921.\n\nCláudia Mesquitta\n\n**FONTES:** BERGER, P. *Dicionário*; REIS, J. *Rio de Janeiro*;\nTEIXEIRA, A. *Estrutura.*\n","ref":"**FONTES:** BERGER, P. *Dicionário*; REIS, J. *Rio de Janeiro*;\nTEIXEIRA, A. *Estrutura.*\n","dic":"DHBPR"}
