{"title":"RIBEIRO, Cardoso","cargoss":["Ministro do Supremo Tribunal Federal"],"cargos_esp":[0],"datas_ini":[1927],"datas_fim":[1932],"estados":[0],"autor":["Eduardo Junqueira"],"content":"**RIBEIRO, Cardoso**\n\n\\* magistrado; min. STF 1927-1932.\n\n*Francisco Cardoso Ribeiro* nasceu em Cachoeira, na província de São\nPaulo, no dia 17 de maio de 1876.\n\nEm 1895, tornou-se bacharel em ciências jurídicas e sociais pela\nFaculdade de Direito de São Paulo. Iniciou a carreira na magistratura no\nano seguinte, ao ser nomeado promotor público de Pindamonhangaba.\nNomeado juiz de direito em 1896, atuou nas comarcas de Campos Novos de\nParanapanema, Santa Cruz do Rio Pardo, Taubaté, Atibaia e Campinas. Em\n1920, sob o governo de Washington Luís em São Paulo, foi nomeado\nsecretário da Justiça e Segurança Pública. Promoveu a reforma judiciária\ndo estado em 1921, introduzindo o concurso para ingresso na\nmagistratura, além de outras medidas de caráter progressista como a\nsupressão das custas e a abolição dos despachos remunerados. Terminado o\ngoverno de Washington Luís, deixou a secretaria. Entre 1924 e 1927 atuou\ncomo conselheiro do Tribunal de Contas do Estado de São Paulo, assumiu a\nvara de menores da capital paulista e a seguir foi nomeado ministro do\nTribunal de Justiça. Nessa corte, atuou na Câmara Criminal.\n\nEm abril de 1927 foi nomeado ministro do Supremo Tribunal Federal (STF)\npor Washington Luís, então presidente da República, na vaga proveniente\nda aposentadoria de Guimarães Natal. No exercício de suas funções no\nSTF, faleceu em 16 de maio de 1932, na cidade do Rio de Janeiro.\n\nFoi casado com Eponina Cardoso Ribeiro.\n\nEduardo Junqueira\n\n**FONTES:** MATTOSO, P. *Supremo Tribunal*; MELLO FILHO, J. *Notas*;\nSUP. TRIB. FED. Disponível em: \\<www.stf.jus.br/portal/ministros\\>.\n","ref":"**FONTES:** MATTOSO, P. *Supremo Tribunal*; MELLO FILHO, J. *Notas*;\nSUP. TRIB. FED. Disponível em: \\<www.stf.jus.br/portal/ministros\\>.\n","dic":"DHBPR"}
