{"title":"RIBEIRO, Carlos Leite","cargoss":["Deputado federal","Prefeito","Deputado federal"],"cargos_esp":[0,0,0],"datas_ini":[1900,1902,1905],"datas_fim":[1902,1902,1905],"estados":["DF","DF","DF"],"autor":["Izabel Silva"],"content":"**RIBEIRO, Carlos Leite**\n\n**\\***dep. fed. DF 1900-1902; pref. DF 1902; dep. fed. DF 1905.\n\n*Carlos Leite Ribeiro* nasceu no Rio de Janeiro, então capital do\nImpério, no dia 5 de abril de 1858.\n\nEm 1897, recebeu a patente de tenente-coronel da Guarda Nacional. No ano\nseguinte foi nomeado delegado da 7^a^ Circunscrição Policial do Rio de\nJaneiro, agora Distrito Federal, e de 1899 a 1902 foi intendente do\nConselho Municipal. Em 1900, foi eleito deputado federal. Exerceu seu\nmandato na Câmara dos Deputados de 22 de junho de 1900 a setembro de\n1902, quando foi nomeado prefeito do Distrito Federal pelo então\npresidente da República Campos Sales (1898-1902), substituindo Joaquim\nXavier da Silveira Júnior.\n\nAo assumir a prefeitura em 27 de setembro de 1902, alterou algumas leis\nmunicipais relativas às questões de higiene e segurança pública e\nexecutou melhoramentos na cidade, como a reforma do calçamento da rua do\nOuvidor. O Rio de Janeiro era então o centro político, econômico e\nsocial do país e, no contexto da *belle époque*, o *glamour* carioca\nestava concentrado na pequena rua, ponto de encontro da elite, por onde\ndesfilavam os elegantes, cultos e ricos. Fechando a longa lista de\nprefeitos dos anos iniciais da República, encerrou sua gestão em 29 de\ndezembro de 1902. No dia seguinte, nomeado pelo novo presidente da\nRepública, Rodrigues Alves (1902-1906), que tomara posse em novembro, o\nengenheiro Francisco Pereira Passos iniciou sua administração,\ninaugurando nova fase na história da cidade.\n\nEm 1905, foi novamente eleito deputado federal pelo Distrito Federal,\nocupando uma cadeira na Câmara de 12 de maio a 31 de dezembro, quando se\nencerrou a legislatura de 1905.\n\nO Decreto de n^o^ 2.875, de 16 de junho de 1926, criou a rua Leite\nRibeiro, no bairro do Méier, em sua homenagem.\n\nFaleceu no Rio de Janeiro, no dia 14 de fevereiro de 1945, em sua\nresidência na rua Bento Lisboa.\n\nIzabel Silva\n\n**FONTES:** ABRANCHES, J. *Governos*; ARQ. NAC. Disponível em:\n\\<www.arquivonacional.gov.br\\>; ASSEMB. LEGISL. RJ. *Núcleo de Memória\nPolítica Carioca e Fluminense*. Disponível em:\n\\<www.alerj.rj.gov.br/memoria/historia\\>; BLAKE, A. *Diccionario* (v.2);\nCÂM. DEP. *Deputados brasileiros* CÂM. DEP. Disponível em:\n\\<www2.camara.gov.br\\>; CASTRO, J. *Milícia*; *Grande. encic. Delta\nLarousse*; REIS, J. *Rio de Janeiro*; SOUSA, J. *Índice*.\n","ref":"**FONTES:** ABRANCHES, J. *Governos*; ARQ. NAC. Disponível em:\n\\<www.arquivonacional.gov.br\\>; ASSEMB. LEGISL. RJ. *Núcleo de Memória\nPolítica Carioca e Fluminense*. Disponível em:\n\\<www.alerj.rj.gov.br/memoria/historia\\>; BLAKE, A. *Diccionario* (v.2);\nCÂM. DEP. *Deputados brasileiros* CÂM. DEP. Disponível em:\n\\<www2.camara.gov.br\\>; CASTRO, J. *Milícia*; *Grande. encic. Delta\nLarousse*; REIS, J. *Rio de Janeiro*; SOUSA, J. *Índice*.\n","dic":"DHBPR"}
