{"title":"RIO, Pires do","cargoss":["Ministro da Viação e Obras Públicas","Deputado federal","Prefeito","Ministro da Fazenda"],"cargos_esp":[0,0,"São Paulo",0],"datas_ini":[1919,1924,1926,1945],"datas_fim":[1922,1925,1930,1946],"estados":[0,"SP",0,0],"autor":["Jorge Miguel Mayer"],"content":"**RIO, Pires do**\n\n\\*jornalista; min. Viação 1919-1922; dep. fed. SP 1924-1925; pref. São\nPaulo 1926-1930; min. Faz. 1945-1946.\n\n*José Pires do Rio* nasceu em Guaratinguetá (SP) no dia 26 de novembro\nde 1880.\n\nFez seus primeiros estudos no Ginásio São Joaquim, de Lorena (SP),\ningressando depois no curso anexo mantido pela Faculdade de Direito de\nSão Paulo. Com 16 anos de idade matriculou-se na Escola de Engenharia de\nOuro Preto (MG), pela qual se formou em 1903, recebendo como prêmio uma\nviagem à Europa. Diplomou-se também pela Escola de Farmácia da mesma\ncidade, cujo curso frequentou enquanto completava os últimos anos do\nanterior.\n\nIniciou sua carreira profissional como engenheiro nas obras do porto do\nRio de Janeiro, então Distrito Federal, sendo encarregado, entre 1906 e\n1910, de diversas missões no exterior. Depois de lecionar hidráulica na\nEscola Politécnica da Bahia entre 1912 e 1914, trabalhou na construção\ndo porto do Rio Grande (RS), sendo nomeado a seguir diretor de um dos\ndistritos da Inspetoria de Obras contra as Secas.\n\nEstudioso das fontes de energia, foi comissionado pelo governo federal\npara estudar a potencialidade do carvão mineral – sua especialidade –\nextraído no Rio Grande do Sul. Em 1916 publicou *O combustível na\neconomia universal*, no qual atribuiu ao emprego do carvão de pedra\nenorme importância na industrialização e na construção do poderio das\nnações, opinião que reafirmaria em 1942 no prefácio à segunda edição,\nonde apontou a existência de reservas de carvão suficientes “para\nmilênios de utilização” enquanto o petróleo, segundo ele, se esgotaria\nna década de 1960.\n\nTrabalhou como inspetor federal nas estradas de ferro Madeira-Mamoré e\nBelém-Bragança até 1919, quando, apesar de praticamente desconhecido no\nplano nacional, foi escolhido para ocupar o Ministério da Viação e Obras\nPúblicas do governo de Epitácio Pessoa (1919-1922). A eleição do novo\npresidente da República, oriundo da Paraíba, bem como a composição do\nseu gabinete – desprovido de nomes de expressão nacional e sem\ncompromisso direto com os grandes estados – refletia a fórmula de\nconciliação encontrada pelas principais forças políticas do país depois\nda morte do presidente eleito, Rodrigues Alves, em 15 de janeiro de\n1919.\n\nDurante a gestão de Pires do Rio no ministério, foram contratadas firmas\nestrangeiras de engenharia para a realização de obras de grande porte\nvoltadas principalmente para o combate às secas do Nordeste, como o\nreservatório de Orós (CE), com capacidade de represar quatro bilhões de\nmetros cúbicos de água. Visando assegurar a continuidade do apoio\nfinanceiro para esses projetos, foi criado um fundo especial para\nfinanciamento de obras de irrigação de terras cultiváveis no Nordeste,\ncomposto de 2% da receita anual da União e dos estados da região.\nEntretanto, esses trabalhos foram interrompidos no governo de Artur\nBernardes, só recuperando o seu dinamismo após a Revolução de 1930.\n\nEntre 24 de maio e 15 de novembro de 1922, Pires do Rio acumulou\ninterinamente a pasta da Agricultura, Indústria e Comércio, em virtude\nda exoneração do titular Ildefonso Simões Lopes. Com o fim do governo de\nEpitácio Pessoa, retornou a São Paulo, onde foi eleito deputado federal\nem 1924, iniciando o mandato no dia 3 de maio. Renunciou às funções\nparlamentares em 31 de dezembro de 1925 para concorrer vitoriosamente ao\ncargo de prefeito municipal de São Paulo, que assumiu no ano seguinte e\nexerceu também durante o governo estadual de Júlio Prestes (1927-1930).\nComo prefeito contratou o engenheiro Francisco Prestes Maia, que\nelaborou o plano urbanístico da cidade, incluindo a retificação do rio\nTietê e a construção de praças e avenidas.\n\nReeleito em 1930, teve sua posse impedida pela vitória da Revolução de\nOutubro, que o manteve afastado de cargos públicos por vários anos.\nNesse período mudou-se para o Rio de Janeiro, onde foi diretor da\nCompanhia Comércio e Navegação, dedicada à construção naval, e\ndiretor-tesoureiro do *Jornal do Brasil* que, na época, atravessava\ndifícil situação financeira. Exerceu esse cargo até o fim de sua vida e\ndefiniu uma orientação comercial que prevaleceu até 1950, fazendo com\nque o jornal se concentrasse nos anúncios, abdicando de maior\nenvolvimento nas questões políticas e culturais do país. Sua política de\ncontenção de despesas provocou inúmeras divergências e atritos com o\ncorpo de funcionários.\n\nEm 1937, foi convidado pelo ministro da Agricultura, Odilon Braga, para\npresidir a Comissão do Petróleo, embrião do Conselho Nacional do\nPetróleo, criado no ano seguinte. Em 1939 tornou-se vice-presidente do\nrecém-criado Conselho Nacional de Águas e Energia Elétrica, cargo em que\npermaneceu até 1944.\n\nApós a deposição de Getúlio Vargas, ocorrida em 29 de outubro de 1945, o\npresidente do Supremo Tribunal Federal (STF), José Linhares, assumiu em\ncaráter provisório a presidência da República e convidou Aníbal Freire –\ntambém ministro do STF e membro da direção do *Jornal do Brasil* – para\nocupar o Ministério da Fazenda. Este, alegando idade avançada, indicou o\nnome de Pires do Rio que, nomeado no dia l^o^ de novembro de 1945,\nassumiu o cargo em uma conjuntura marcada pelo fim do Estado Novo e a\nvitória dos países aliados na Segunda Guerra Mundial. As potências\nocidentais vitoriosas, lideradas pelos Estados Unidos, preconizavam o\nfim do protecionismo econômico e a busca de estabilidade cambial e\nmonetária dentro das normas definidas na Conferência de Bretton Woods\n(Estados Unidos, 1944), procurando eliminar os entraves à expansão do\ncomércio mundial.\n\nFortalecido pela conjuntura internacional, um grupo de economistas\nbrasileiros encabeçado por Eugênio Gudin criticava profundamente o\ngoverno Vargas, atacando sobretudo a intervenção estatal na economia e a\nadoção de medidas protecionistas no campo das relações de comércio.\nPires do Rio posicionava-se em um meio-termo entre o que considerava\n“excessivo protecionismo” e o total liberalismo alfandegário preconizado\npelos seguidores de Gudin. Conforme escreveu no relatório intitulado *As\ncondições atuais do Brasil*, apresentado ao presidente José Linhares em\ndezembro de 1945, “sem tarifas aduaneiras o Brasil não poderia sustentar\nvárias indústrias agrárias, como a de laticínios e a de açúcar, e não\npoderia talvez explorar as salinas de sua terra. Cumpre, entretanto, não\nexagerar esse protecionismo para não sacrificar a maioria do povo\nbrasileiro à minoria industrial do país”.\n\nSegundo ele, o principal problema da economia brasileira era a inflação,\nque desde 1940 apresentava tendência crescente, alimentada pela emissão\nde papel-moeda para cobrir o déficit orçamentário, “velha moléstia do\nBrasil financeiro”. A manutenção de uma taxa cambial artificialmente\nbaixa para proteger os industriais e os exportadores de café e algodão,\na compra de ouro pelo Tesouro Nacional e a realização de obras públicas\ninúteis eram, a seu ver, os principais fatores deficitários que\nprecisavam ser combatidos. Empenhado em evitar novas emissões, Pires do\nRio recorreu à venda de parte do ouro existente para fornecer numerário\nao Tesouro, limitou as operações da Carteira de Redescontos do Banco do\nBrasil e transferiu para a Superintendência da Moeda e do Crédito\n(Sumoc), criada em fevereiro de 1945, as atribuições da Caixa de\nMobilização e Fiscalização Bancária. Entretanto, o aumento geral dos\nservidores civis e militares, incluindo reformados, inativos e\npensionistas, elevou as despesas públicas no exercício de 1946 em mais\nde dois bilhões de cruzeiros, sem que tivesse havido previsão de\nrecursos destinados ao seu pagamento, o que frustrou parcialmente as\nmedidas financeiras e administrativas de sua gestão no combate à\ninflação.\n\nO ministro referendou ainda decretos-leis e decretos criando o Serviço\nde Importação Aérea e a Estação Aduaneira em São Paulo, alterando o\nregulamento para a fiscalização aduaneira dos transportes aéreos, e\nsubstituindo a Tesouraria da Caixa de Amortização pelas tesourarias da\nDívida Pública Interna e Fundada e a Tesouraria do Meio Circulante.\nNesse período, o Departamento Administrativo do Serviço Público (DASP)\nteve suas atribuições restringidas ao estudo e orientação dos problemas\nde administração pública, tornando-se órgão consultivo do serviço civil\nfederal, sem poder executivo ou fiscalizador, transferidos para os\npróprios ministérios de cada área. Em virtude dessa reorganização, o\nConselho de Administração do Material e a Divisão do Material, que\nintegravam o DASP, passaram a se subordinar ao Departamento Federal de\nCompras do Ministério da Fazenda.\n\nNo dia 31 de janeiro de 1946 o general Eurico Gaspar Dutra tomou posse\nna presidência da República, e no dia seguinte Pires do Rio transmitiu\nseu cargo para o novo titular da pasta da Fazenda, Gastão Vidigal.\n\nFaleceu em Calcutá, na Índia, durante excursão turística, no dia 23 de\njulho de 1950. Era celibatário. Estudioso de economia e sócio-honorário\ndo Instituto Histórico e Geográfico de São Paulo, em cuja revista\ncolaborou, Pires do Rio deixou as seguintes obras: *O combustível na\neconomia universal* (1916), *Assuntos de política econômica* (1917),\n*Ofício* (1928), *Realidades econômicas do Brasil* (1945), *As condições\natuais do Brasil* (1945) e *A moeda brasileira e seu perene caráter\nfiduciário* (1947).\n\nSeu nome foi dado a um município do estado de Goiás.\n\nJorge Miguel Mayer\n\n**FONTES:**BELEZA, N. *Evolução*; BULHÕES, A. *Ministros*; CONSULT.\nMAGALHÃES, B.; COSTA, E. *Grandes*; *Encic. Mirador*; *Grande encic.\nDelta*; HIRSCHOWICZ, E. *Contemporâneos*; LEITE, A. *Páginas*; LIMA, J.\n*Como*; MELO, L. *Dicionário*; MIN. FAZ. *Ministros*; *Novo dic. de\nhistória*; *Personalidades*; PESQ. F. BARBOSA; SILVA, H. *1945*.\n","ref":"**FONTES:**BELEZA, N. *Evolução*; BULHÕES, A. *Ministros*; CONSULT.\nMAGALHÃES, B.; COSTA, E. *Grandes*; *Encic. Mirador*; *Grande encic.\nDelta*; HIRSCHOWICZ, E. *Contemporâneos*; LEITE, A. *Páginas*; LIMA, J.\n*Como*; MELO, L. *Dicionário*; MIN. FAZ. *Ministros*; *Novo dic. de\nhistória*; *Personalidades*; PESQ. F. BARBOSA; SILVA, H. *1945*.\n","dic":"DHBPR"}
