{"title":"ROCHA, Alfredo Casimiro da","cargoss":["Deputado federal"],"cargos_esp":[0],"datas_ini":[1894],"datas_fim":[1899],"estados":["SP"],"autor":["Raimundo Helio Lopes"],"content":"**ROCHA, Alfredo Casimiro da**\n\n\\*dep. fed. SP 1894-1899.\n\n*Alfredo Casimiro da Rocha* nasceu em Salvador no dia 4 de março de\n1856, filho de Filipa Joaquina Dantas.\n\nFez os estudos iniciais com muita dificuldade, já que sua mãe, negra\npobre de Salvador, não pôde matriculá-lo em um bom colégio. Com ajuda de\nalguns professores da capital baiana, ingressou Faculdade de Medicina da\nBahia e formou-se em 1877. Sua tese de doutoramento intitulou-se *Do\ndiagnóstico e tratamento do beribéri.*\n\nEm 1878 mudou-se para a província de São Paulo em busca de um melhor\nlugar para desenvolver sua prática profissional, fugindo do preconceito\nde sua cidade natal. De início morou em Avaré, mas devido a uma infecção\npulmonar mudou-se para Cunha, em busca de um clima onde poderia combater\na doença. Nessa cidade estabeleceu-se como médico de grande importância\ne iniciou sua carreira política. Em 1879 foi eleito vereador pelo\nPartido Liberal. Defendeu a causa republicana, fundando o Clube\nRepublicano de Cunha, e a causa abolicionista, atuando na libertação de\nmuitos escravos da cidade. Em 1883, já filiado ao Partido Republicano\nPaulista (PRP), chegou à presidência da Câmara Municipal. Tornou-se\nimportante líder político, sendo representante do município nas\nconvenções do PRP realizadas em 1887, 1888 e 1889. Ainda durante o\nImpério casou-se a primeira vez, com Adélia Rocha, falecida em 1887, com\nquem teve sua primeira filha.\n\nQuando o marechal Deodoro da Fonseca, sustentado por setores do Exército\ne por civis, instalou o regime republicano em 15 de novembro de 1889,\nfoi um dos líderes do movimento em Cunha. Nesse momento, aproximou-se de\nFrancisco Glicério, líder republicano paulista de quem seria aliado\ndurante toda a vida. Em 1892, foi eleito deputado estadual pelo PRP para\na legislatura 1892-1894. Em 1894 foi eleito deputado federal pelo estado\nde São Paulo e em 1897foi reeleito. Ocupou uma cadeira na Câmara dos\nDeputados, no Rio de Janeiro, então Distrito Federal, de maio de 1894\naté dezembro de 1899. Como deputado federal, fez parte da Comissão de\nInstrução Pública e Higiene. Em 1902 uniu-se a Maria do Carmo Rodrigues,\ncom quem teve dois filhos e somente se casaria oficialmente em 15 de\ndezembro de 1930.\n\nEm 1907 foi mais uma vez eleito deputado estadual pelo PRP.\nSucessivamente reeleito, exerceria o mandato até o ano de 1923,\nacumulando-o com outras funções. Além de continuar representando Cunha\nem vários congressos estaduais do PRP, em 1916 voltou à Câmara Municipal\ndessa cidade, assumindo a presidência da Casa. Em 1918 combateu a\nepidemia de gripe espanhola que assolava o município e em 1923 renunciou\nao mandato para assumir a prefeitura de Cunha, até 1924. Em 1925\nelegeu-se senador estadual pelo PRP, permanecendo no Senado paulista até\noutubro de 1930, quando da vitória da revolução que levou Getúlio Vargas\nao poder e extinguiu todos os órgãos legislativos do país.\n\nOpositor do governo Vargas, em 1932 apoiou a Revolução\nConstitucionalista, deflagrada em São Paulo exigindo a\nreconstitucionalização imediata do país, e ofereceu préstimos às tropas\nrevoltosas. Após o conflito, em 16 de dezembro de 1933, foi nomeado pelo\ninterventor Armando Sales (1933-1935) prefeito de Cunha, mas ocupou o\ncargo por poucos dias, falecendo em 29 de dezembro.\n\nOracy Nogueira escreveu sobre ele *Negro político, político negro: a\nvida do doutor Alfredo Casimiro da Rocha, parlamentar da República\nVelha.*\n\nRaimundo Helio Lopes\n\n**FONTES:** ABRANCHES, J. *Governos*; CALIMAN, A. *Legislativo*;\nNOGUEIRA, O. *Negro político.*\n","ref":"**FONTES:** ABRANCHES, J. *Governos*; CALIMAN, A. *Legislativo*;\nNOGUEIRA, O. *Negro político.*\n","dic":"DHBPR"}
