{"title":"ROCHA, Álvaro","cargoss":["Deputado federal","Interventor"],"cargos_esp":[0,0],"datas_ini":[1924,1947],"datas_fim":[1927,1947],"estados":["RJ","RJ"],"autor":[0],"content":"**ROCHA, Álvaro**\n\n\\*dep. fed. RJ 1924-1927; interv. RJ 1947.\n\n*Álvaro Rocha Pereira da Silva* nasceu na freguesia de Nossa Senhora da\nPiedade das Ipiabas, no município de Valença, atualmente vila de\nIpiabas, no município de Barra do Piraí (RJ), em 9 de fevereiro de 1874,\nfilho do tenente-coronel João José Pereira da Silva e de Guilhermina\nRocha Pereira da Silva.\n\nFrequentou o internato do Colégio Pedro II, no Rio de Janeiro, então\ncapital do Império, até o quinto ano. Ingressou então no curso anexo da\nFaculdade de Direito de São Paulo, pela qual se bacharelou em 1895.\nAinda nesse ano foi nomeado oficial de gabinete do presidente do estado\ndo Rio de Janeiro, Joaquim Maurício de Abreu, permanecendo no cargo até\no fim do governo, em dezembro de 1897. Em 1898 passou a residir em Barra\ndo Piraí e ali exerceu a advocacia até setembro, quando foi nomeado\npromotor de justiça. Posteriormente, deixou essa função para militar na\npolítica nas fileiras do Partido Republicano Fluminense (PRF), cuja\ncomissão executiva passou a integrar. Foi vereador em Barra do Piraí em\nvárias legislaturas a partir de 1907, tendo presidido, desse ano até\n1910, a Câmara Municipal.\n\nEleito deputado à Assembleia Legislativa do estado do Rio de Janeiro,\nfoi escolhido líder da maioria em 1913 e 1914. Defendeu a autonomia\nfluminense contra o que denominava “ditadura judiciária”, a qual\nfinalmente triunfou com a ascensão de Nilo Peçanha à presidência do\nestado em 31 de dezembro de 1914. Em dezembro de 1915 elegeu-se\nnovamente vereador, passando a controlar, juntamente com seus\ncorreligionários, a Câmara Municipal de Barra do Piraí. Insatisfeito com\nos resultados eleitorais, o vereador oposicionista Antônio Brás de\nMorais Barbosa apresentou recurso visando a anular a eleição de alguns\nvereadores pertencentes à situação. Esse objetivo foi atingido, o que\nlhe permitiu elevar o número de correligionários de dois para oito\nvereadores e assim obter a presidência da casa. Álvaro Rocha, ainda que\ntenha garantido seu mandato, passou à condição de oposicionista.\n\nEm 1923, já no governo de Artur Bernardes (1922-1926), os políticos\nsituacionistas em Barra do Piraí, que faziam oposição ao governo\nfederal, foram depostos, e Álvaro Rocha voltou a orientar a política\nsituacionista do município, o que faria até 1930. Ainda em 1923, eleito\npara a Assembleia Legislativa, integrou a Comissão de Verificação de\nPoderes da eleição do presidente e vice-presidente do estado, efetuada\ndurante o período de intervenção federal. Nesse mesmo ano, conseguiu que\na Light estendesse as linhas telefônicas de Barra do Piraí até Ipiabas.\nEm dezembro de 1923 cessou a intervenção federal, e Feliciano Pires de\nAbreu Sodré assumiu a presidência do estado (1923-1927).\n\nEm 1924 elegeu-se deputado federal, exercendo o mandato até 1926. Nesse\nperíodo, participou da reforma da Constituição. Foi reeleito em 1927,\nmas renunciou ao mandato no mesmo ano para exercer as funções de\nsecretário do Interior e Justiça do estado do Rio, durante o governo\nManuel Duarte (1927-1930). Com a Revolução de 1930, que resultou na\ndeposição de Manuel Duarte e sua substituição por Demócrito Barbosa,\ndeixou a secretaria e voltou para Barra do Piraí, reabrindo sua banca de\nadvogado.\n\nEm 1934 retornou à política e obteve a primeira suplência de deputado\nfederal na legenda do Partido Evolucionista. Durante o governo de\nProtógenes Pereira Guimarães (1935-1937), foi presidente da comissão\nencarregada da nova divisão administrativa do estado do Rio. Em\nfevereiro de 1939, já na vigência do Estado Novo (1937-1945), foi\nnomeado membro do conselho administrativo da Caixa Econômica Federal do\nestado, instalada em Niterói.\n\nApós a redemocratização do país, foi nomeado, em 8 de fevereiro de 1947,\ninterventor federal no estado do Rio de Janeiro, em substituição a\nFrancisco Santos. Exerceu esse cargo até 24 de fevereiro, quando foi\nsubstituído pelo general Edmundo de Macedo Soares e Silva.\n\nFoi também presidente do Conselho Administrativo do Estado do Rio de\nJaneiro. Prestou serviços profissionais gratuitos à Casa de Caridade\nSanta Rita, de cujas primeiras administrações participou, e presidiu o\nantigo Banco Popular, posteriormente denominado Banco da Barra do Piraí.\nFoi ainda delegado escolar e adjunto de procurador secional da\nRepública.\n\nFaleceu em Niterói em 1964.\n\n**FONTES:**ASSEMB. LEGISL. RJ. *Anais* (26/7-31/10 1912). BARCELOS, A.\n*Barra*; CÂM. DEP. *Deputados*; CORRESP. GOV. EST. RJ; *Encic. Mirador*;\nIORIO, L. *Valença*; LACOMBE, L. *Chefes*.\n","ref":"**FONTES:**ASSEMB. LEGISL. RJ. *Anais* (26/7-31/10 1912). BARCELOS, A.\n*Barra*; CÂM. DEP. *Deputados*; CORRESP. GOV. EST. RJ; *Encic. Mirador*;\nIORIO, L. *Valença*; LACOMBE, L. *Chefes*.\n","dic":"DHBPR"}
