{"title":"ROCHA, Domingos José da","cargoss":["Deputado federal"],"cargos_esp":[0],"datas_ini":[1891],"datas_fim":[1893],"estados":["MG"],"autor":["Luciana Pinheiro"],"content":"**ROCHA, Domingos José da**\n\n\\*dep. fed. MG 1891-1893.\n\n*Domingos José da Rocha* nasceu em Cachoeiro do Itapemirim (ES) no dia\n27 de agosto de 1862, filho de Bento José da Rocha e de Felícia de Pinho\nSouto Rocha.\n\nFormou-se pela Escola de Minas de Ouro Preto em 1882, especializando-se\nna área de engenharia de minas, e no ano seguinte iniciou carreira\ndocente dando aulas de matemática no prédio anexo à escola. Após prestar\nconcurso em 1884, tornou-se professor catedrático de resistência dos\nmateriais, construções e estradas de ferro.\n\nReconhecido por ser grande entusiasta da República, em 1888 esteve\npresente ao Congresso Republicano reunido em Ouro Preto. Já sob o novo\nregime, foi designado vice-governador de Minas Gerais e em 1890 assumiu\ninterinamente o governo em três ocasiões, nos meses de julho, agosto e\noutubro, substituindo os governadores provisórios João Pinheiro da Silva\ne Crispim Jacques Bias Fortes. Depois de promulgada a Constituição de 24\nde fevereiro de 1891, foi eleito deputado federal por Minas e exerceu o\nmandato de 3 de maio de 1891 a 31 de dezembro de 1893. Na Câmara dos\nDeputados, foi membro da Comissão de Obras Públicas e da comissão\nencarregada da elaboração do plano de viação férrea federal. Com o\ntérmino seu mandato, voltou a atuar como docente das disciplinas de\npontes e viadutos e de estradas ordinárias e estradas de ferro. Durante\no ano de 1901 foi nomeado vice-diretor da Escola de Minas de Ouro Preto,\ncargo que ocupou até 1904.\n\nFoi ainda diretor da Usina Wigg e colaborador da Cerâmica Caeté, ambas\nlocalizadas em Minas Gerais. Foi presidente da comissão criada pelo\ngoverno de Minas com o objetivo de escolher a nova capital e integrou a\nequipe encarregada de propor a nova divisão política, administrativa e\njudiciária do estado.\n\nFaleceu em 16 de novembro de 1914, no Rio de Janeiro.\n\nCasou-se com Maria Augusta Fleury da Rocha.\n\nLuciana Pinheiro\n\n**FONTES:** CÂM. DEP. *Deputados brasileiros* (p.68); MONTEIRO, N.\n*Dicionário* (v.2, p.593).\n","ref":"**FONTES:** CÂM. DEP. *Deputados brasileiros* (p.68); MONTEIRO, N.\n*Dicionário* (v.2, p.593).\n","dic":"DHBPR"}
