{"title":"ROCHA, Francisco","cargoss":["Deputado federal","Constituinte","Deputado federal"],"cargos_esp":[0,0,0],"datas_ini":[1921,1934,1935],"datas_fim":[1930,1934,1937],"estados":["BA",0,"BA"],"autor":[0],"content":"**ROCHA, Francisco**\n\n\\*dep. fed. BA 1921-1930; const. 1934; dep. fed. BA 1935-1937.\n\n*Francisco Joaquim da Rocha* nasceu em Barra do Rio Grande (BA) no dia\n23 de abril de 1883, filho do coronel Francisco Joaquim da Rocha e de\nMaria Francisca da França Rocha. Seu primo Geraldo Rocha foi\nproprietário do jornal *A Noite*, do Rio de Janeiro, então Distrito\nFederal, e fundador de *A Nota* e *O Mundo*. Seu sobrinho, Antônio\nBalbino de Carvalho Filho, foi deputado federal pela Bahia (1951-1953 e\n1954-1955), ministro da Educação (1953-1954), governador da Bahia\n(1955-1959), consultor geral da República (1961-1962), ministro da\nIndústria e Comércio (1963) e senador pela Bahia (1963-1971).\n\nFez os estudos preparatórios no Colégio São José, em sua cidade natal,\ningressando depois na Faculdade de Medicina da Bahia, em Salvador.\nDurante o curso, foi designado pelo governador Marcelino de Sousa\n(1904-1908) para chefiar a turma de estudantes da faculdade encarregada\nde debelar febres na zona do rio São Francisco.\n\nFormou-se em dezembro de 1906 com a tese *Delírio nas moléstias\ninfecciosas*.\n\nExerceu a clínica médica no Amazonas e atuou ainda na Saúde Pública de\nPorto Velho e, mais tarde, em Bananeiras (BA), onde se elegeu intendente\nmunicipal por sugestão do governador do estado, desejoso de pôr termo à\nluta entre os partidos locais. Desde seus primeiros passos na cena\npolítica, filiou-se ao Partido Republicano Democrático (PRD), chefiado\npor José Joaquim Seabra, ao lado do qual participou em 1910 da vitoriosa\ncampanha do marechal Hermes da Fonseca para a presidência da República.\n\nEm 1919 foi eleito, como candidato avulso, deputado estadual na Bahia. A\npartir de 1921, na legenda do PRD, elegeu-se deputado federal para todas\nas legislaturas da Primeira República até a que se iniciou em maio de\n1930 e foi interrompida pela Revolução de Outubro, que dissolveu todos\nos órgãos legislativos do país.\n\nApoiou a Revolução Constitucionalista de São Paulo em julho de 1932. Em\nmaio do ano seguinte, nas eleições para a Assembleia Nacional\nConstituinte, elegeu-se deputado por seu estado na legenda do PRD,\napoiado pelas correntes políticas do sertão do São Francisco e Lavras\nDiamantinas, sob a liderança de Franklin de Albuquerque. Após os\ntrabalhos constituintes, que se estenderam de novembro de 1933 a julho\nde 1934 e terminaram com a promulgação da nova Constituição (16/7/1934)\ne a eleição do presidente da República no dia seguinte, teve, assim como\nos demais constituintes, seu mandato prorrogado até maio do ano\nseguinte. Mais uma vez elegeu-se deputado em outubro de 1934, iniciando\nnovo mandato em maio de 1935. Com o golpe do Estado Novo em 10 de\nnovembro de 1937, que dissolveu todos os órgãos legislativos do país,\nteve o mandato suspenso.\n\nFaleceu no Rio de Janeiro, então Distrito Federal, no dia 12 de\nfevereiro de 1960.\n\nFoi casado com Cantinília Rocha.\n\n**FONTES:**Boletim Min. Trab. (5/1936); CÂM. DEP. *Deputados*; Câmara\nDep. seus componentes; Diário do Congresso Nacional; GODINHO, V.\n*Constituintes*; *Ilustração Brasileira* (10/1922).\n","ref":"**FONTES:**Boletim Min. Trab. (5/1936); CÂM. DEP. *Deputados*; Câmara\nDep. seus componentes; Diário do Congresso Nacional; GODINHO, V.\n*Constituintes*; *Ilustração Brasileira* (10/1922).\n","dic":"DHBPR"}
