{"title":"BAHIA, Alcides","cargoss":["Deputado federal"],"cargos_esp":[0],"datas_ini":[1924],"datas_fim":[1926],"estados":["AM"],"autor":["Inoã Pierre Carvalho Urbinati"],"content":"**BAHIA, Alcides**\n\n\\*dep. fed. AM 1924-1926.\n\n*Alcides Bahia* era afrodescendente e filho de pais desconhecidos,\npossivelmente, segundo Agnelo Bittencourt, “gente da mais humilde camada\nsocial”. De acordo com o mesmo autor, pode ter nascido no Pará.\n\nNa juventude, viajou para o Rio de Janeiro, então capital do Império, e\nmatriculou-se na Escola Politécnica. Consta que, num comício\nabolicionista no largo da Carioca, falou com tanta eloquência que teria\nemocionado o líder negro José do Patrocínio.\n\nEm Belém, foi jornalista de oposição a Antônio Lemos, aliado de Lauro\nSodré, escrevendo na *República.* Fugindo para Manaus, passou a\ntrabalhar no *Comércio do Amazonas*, sob a direção de Rocha dos Santos.\nIngressou depois no *Amazonas*, tornando-se um defensor aguerrido dos\ngovernos de Silvério Nery (1900-1903), Constantino Nery (1904-1907),\nAfonso de Carvalho (1907-1908), Antônio Bittencourt (1908-1910) e,\ndepois, de Pedro de Alcântara Bacelar (1917-1921) e Rego Monteiro\n(1921-1924). Em 1908 integrou a Comissão Organizadora do Governo do\nAmazonas, encarregada de celebrar o I Centenário da Abertura dos Portos\nBrasileiros às Nações Amigas, ao lado de Antônio Monteiro de Sousa,\nAlfredo da Mata e Agnelo Bittencourt.\n\nSob a liderança de Rego Monteiro, foi eleito deputado federal em 1924.\nAssumiu em maio sua cadeira na Câmara dos Deputados, no Rio de Janeiro,\nentão Distrito Federal, e nela permaneceu até dezembro de 1926, quando\nse encerraram seu mandato e a legislatura.\n\nTrabalhou ainda em outros jornais e foi um dos fundadores da Academia\nAmazonense de Letras, além de seu orador.\n\nFaleceu em Manaus no dia 4 de outubro de 1934.\n\nEra casado com Antônia Bahia, professora de música e canto. Não teve\ndescendência, mas adotou Moacir Bahia, que foi funcionário do Ministério\ndo Trabalho.\n\nColaborou com João Batista de Faria e Sousa em vários livros, inclusive\nem *A imprensa no Amazonas, de 1852 a 1908*.\n\nInoã Pierre Carvalho Urbinati\n\n**FONTES:** BITTENCOURT, A. *Dicionário*; Casa Civil do Amazonas.\nDisponível em: \\<www.casacivil.am.gov.br/imp\\_gov.php\\>. Acesso em:\n24/11/2010; CÂM. DEP. *Deputados brasileiros* (1826-1976); Nação\nMestiça. Disponível em: \\<www.nacaomestica.org/bahia\\_alcides.htm\\>.\nAcesso em: 20/11/2010.\n","ref":"**FONTES:** BITTENCOURT, A. *Dicionário*; Casa Civil do Amazonas.\nDisponível em: \\<www.casacivil.am.gov.br/imp\\_gov.php\\>. Acesso em:\n24/11/2010; CÂM. DEP. *Deputados brasileiros* (1826-1976); Nação\nMestiça. Disponível em: \\<www.nacaomestica.org/bahia\\_alcides.htm\\>.\nAcesso em: 20/11/2010.\n","dic":"DHBPR"}
