{"title":"ROLLEMBERG, Gonçalo","cargoss":["Presidente de associação ou confederação de empregados ou empregadores","Senador"],"cargos_esp":[0,0],"datas_ini":[1894,1918],"datas_fim":[1895,1926],"estados":["SE","SE"],"autor":["Pierre Fernandes"],"content":"**ROLLEMBERG, Gonçalo**\n\n\\*pres. SE 1894-1895; sen. SE 1918-1926.\n\n*Gonçalo de Faro Rollemberg* nasceu no engenho Maria Teles, município de\nMaroim (SE), em 13 de setembro de 1860, filho de Manuel Rollemberg de\nMeneses e de Maria de Faro Rollemberg.\n\nCursou durante três anos a Faculdade de Medicina da Bahia,\ntransferindo-se depois para o Rio de Janeiro, onde obteve o título de\ndoutor em 1881. Nesse mesmo ano foi eleito deputado provincial em\nSergipe.\n\nNo regime republicano, foi eleito em 1894 vice-presidente de seu estado\nna chapa encabeçada por Manuel Valadão, que tomou posse em 24 de\noutubro. Substituiu o titular de 11 de dezembro de 1894 a 16 de\nfevereiro de 1895. Voltou à cena política em 1918, eleito senador por\nseu estado para um mandato de nove anos.\n\nFoi casado com Aurélia Dias Dantas Melo, filha de Antônio Dias Coelho e\nMelo, o barão da Estância, senador sergipano no período imperial. Seu\nfilho, Antônio Dias Rollemberg, foi deputado federal por Sergipe entre\n1915 e 1917.\n\nFaleceu em 14 de setembro de 1927.\n\nAlém de artigos na imprensa, escreveu *Hepatite aguda* (tese apresentada\nà Faculdade de Medicina do Rio de Janeiro em 1881).\n\nPierre Fernandes\n\n**FONTES:** GUARANÁ, M. *Dicionário*; LEITE NETO, L. *Catálogo\nbiográfico.*\n","ref":"**FONTES:** GUARANÁ, M. *Dicionário*; LEITE NETO, L. *Catálogo\nbiográfico.*\n","dic":"DHBPR"}
