{"title":"ROMEIRO, Francisco","cargoss":["Deputado federal"],"cargos_esp":[0],"datas_ini":[1903],"datas_fim":[1911],"estados":["SP"],"autor":["Carlos Alberto Ungaretti Dias"],"content":"**ROMEIRO, Francisco**\n\n\\*dep. fed. SP 1903-1911.\n\n*Francisco Marcondes Romeiro* nasceu em Pindamonhangaba (SP) em 28 de\ndezembro de 1841, filho do comendador José Romeiro de Oliveira e de Ana\nMarcondes de Moura Romeiro.\n\nEstudou humanidades no Colégio Baependi e ingressou na Faculdade de\nMedicina do Rio de Janeiro em 1861, recebendo o grau de doutor em 1866.\nEm janeiro de 1867 estabeleceu clínica em sua cidade natal e tornou-se\ntambém presidente do Banco Municipal.\n\nRepublicano histórico, em 1869 foi eleito para a Câmara Municipal de\nPindamonhangaba e escolhido seu presidente, respondendo pela intendência\nmunicipal. Reelegeu-se seguidamente e permaneceu à frente da Câmara\nMunicipal até o final do Império. Assumiu também o cargo de provedor da\nSanta Casa de Misericórdia de Pindamonhangaba em 1872 e destacou-se no\ncombate à varíola que acometeu os moradores da cidade, recebendo a\ncomenda de oficial da Ordem da Rosa pelos relevantes serviços prestados\nà comunidade. Foi o organizador do Código de Posturas do município de\nPindamonhangaba, apresentado à Assembleia Provincial de São Paulo e\naprovado em sessão de 23 de março de 1876. Em 1888, ganhou notoriedade\nao promover em 22 de fevereiro a libertação dos escravos em\nPindamonhangaba, alguns meses antes da aprovação da Lei Áurea.\n\nApós a proclamação da República em 15 de novembro de 1889, continuou\ndesfrutando de grande prestígio político. Voltou a eleger-se vereador e\na presidir a Câmara de Pindamonhangaba entre 1899 e 1904. Na época\ninstalou o primeiro serviço de captação de água encanada da cidade,\nutilizando como manancial o córrego do Felipe, que parte da serra da\nMantiqueira, atual parque ecológico municipal do Trabiju.\n\nEm 1903, foi eleito deputado federal por São Paulo para a legislatura\n1903-1905. Renovou o mandato mais duas vezes, nas legislaturas 1906-1908\ne 1909-1911, sempre pelo Partido Republicano Paulista (PRP).\n\nFaleceu em Pindamonhangaba, em 24 de outubro de 1911, aos 71 anos de\nidade.\n\nEscreveu estudos na área médica, como *Do glaucoma*; *Da asfixia por\nsubmersão*; *Do raquitismo*; *Diagnóstico diferencial entre o tifo e a\nfebre amarela*, todos produzidos no Rio de Janeiro em 1866. Também\napresentou à Câmara Municipal, em 1874, um *Relatório da epidemia de\nvaríola em Pindamonhangaba*.\n\nSeu nome foi dado à principal praça da cidade de Pindamonhangaba.\n\nCarlos Alberto Ungaretti Dias\n\n**FONTES:** ABRANCHES, J. Governos (v.2); Correio Paulistano\n(26/10/1911); Dicionário de ruas. Disponível em:\n\\<www.dicionarioderuas.prefeitura.sp.gov.br/PaginasPublicas/ListaLogradouro.aspx\\>; \nMARCONDES, A. *Pindamonhangaba*; Pindavale. Disponível em:\n\\<www.pindavale.com.br/pindamonhangaba/prefeitos.asp\\>; *São Paulo e\nseus homens*; Tribuna do Norte. Disponível em:\n\\<www.tribunadonorte.net/edicoesanteriores/180408/cultura.htm\\>.\n","ref":"**FONTES:** ABRANCHES, J. Governos (v.2); Correio Paulistano\n(26/10/1911); Dicionário de ruas. Disponível em:\n\\<www.dicionarioderuas.prefeitura.sp.gov.br/PaginasPublicas/ListaLogradouro.aspx\\>; \nMARCONDES, A. *Pindamonhangaba*; Pindavale. Disponível em:\n\\<www.pindavale.com.br/pindamonhangaba/prefeitos.asp\\>; *São Paulo e\nseus homens*; Tribuna do Norte. Disponível em:\n\\<www.tribunadonorte.net/edicoesanteriores/180408/cultura.htm\\>.\n","dic":"DHBPR"}
