{"title":"ROSA JÚNIOR","cargoss":["Constituinte","Senador"],"cargos_esp":[0,0],"datas_ini":[1891,1891],"datas_fim":[1891,1900],"estados":[0,"SE"],"autor":[0],"content":"**ROSA JÚNIOR**\n\n\\*militar; const. 1891; sen. SE 1891-1900.\n\n*Manuel da Silva Rosa Júnior* nasceu na cidade de São Cristóvão, então\ncapital da província de Sergipe, no dia 10 de junho de 1840, filho de\nManuel da Silva Rosa e de Constância Cândida da Silva Rosa.\n\nIngressou no Exército em 1858, concluiu a Escola Militar em 1860 e\nparticipou da Guerra do Paraguai (1864-1870), tendo recebido a medalha\ndo mérito militar por sua atuação na campanha. Recebeu também o título\nde oficial da Ordem de São Bento.\n\nCom a proclamação da República em 15 de novembro de 1889, foi indicado\ncandidato a senador constituinte pelo marechal Deodoro da Fonseca, chefe\ndo governo provisório, mas seu nome não foi referendado pelo então\npresidente de Sergipe, Felisbelo Freire (1889-1890), que acabou\ndestituído por essa divergência política. Em setembro de 1890 foi afinal\neleito senador constituinte por Sergipe. Assumiu sua cadeira no\nCongresso Nacional Constituinte em 15 de novembro seguinte, participou\nda elaboração da Constituição promulgada em 24 de fevereiro de 1891, e\nem junho passou a exercer o mandato ordinário, integrando as comissões\nde Marinha e de Finanças do Senado. Foi reformado no posto de general de\nbrigada em 1892 e permaneceu no Senado até 31 de janeiro de 1900, quando\nse encerraram seu mandato e a legislatura.\n\nFaleceu no Rio de Janeiro no dia 29 de março de 1915.\n\nPublicou *Compêndio elementar do sistema métrico decimal* (1873).\n\nSérgio Montalvão\n\n**FONTES:** BITTENCOURT, L. *Homens.* Disponível em:\n\\<http://iaracaju.infonet.com.br/serigysite/\\>; LEITE NETO, L. *Catálogo\nbiográfico* (v.4, p.1.973-1.974).\n","ref":"**FONTES:** BITTENCOURT, L. *Homens.* Disponível em:\n\\<http://iaracaju.infonet.com.br/serigysite/\\>; LEITE NETO, L. *Catálogo\nbiográfico* (v.4, p.1.973-1.974).\n","dic":"DHBPR"}
