{"title":"SALES, Antônio de Pádua","cargoss":["Deputado federal"],"cargos_esp":[0],"datas_ini":[1894],"datas_fim":[1896],"estados":["SP"],"autor":["Dirceu Franco"],"content":"**SALES, Antônio de Pádua**\n\n\\*dep. fed. SP 1894-1896.\n\n*Antônio de Pádua Sales* nasceu em Campinas (SP) em 2 de novembro de\n1860, filho de Estanislau de Campos Sales e de Maria Perpétua de\nOliveira.\n\nBacharel pela Faculdade de Direito de São Paulo em 1884, retornou à\ncidade natal para iniciar a carreira de advogado. Foi então eleito\nprimeiro juiz de paz da paróquia de Santa Cruz, em Campinas.\n\nJá após a proclamação da República, foi eleito deputado federal por São\nPaulo para a legislatura 1894-1896. Concluído o mandato na Câmara dos\nDeputados, foi deputado estadual em duas legislaturas e senador estadual\nquatro. Foi ainda secretário da Agricultura no governo Manuel Joaquim\nAlbuquerque Lins (1908-1912) em São Paulo, e ministro da Agricultura na\npresidência de Delfim Moreira (1918-1919). Além de importante lavrador\nde café, desempenhou função de destaque na direção do Partido\nRepublicano Paulista (PRP).\n\nCorreligionário de Washington Luís, presidente deposto pela Revolução de\n1930, compôs o poder civil da Revolução Constitucionalista de 1932. Sob\na chefia de Pedro de Toledo, e ao lado de Francisco Morato e dos\ngenerais Bertoldo Klinger e Isidoro Dias Lopes, formou a junta\nrevolucionária que assumiu o comando do estado de São Paulo.\n\nFoi ainda presidente do Banco do Comércio e Indústria de São Paulo e da\nCompanhia Paulista de Estradas de Ferro.\n\nFaleceu a 29 de março de 1957.\n\nDirceu Franco\n\n**FONTES:** CÂM. DEP. *Deputados brasileiros*; FONSECA, A.; FONTES JR.,\nA. *Senado***.**\n","ref":"**FONTES:** CÂM. DEP. *Deputados brasileiros*; FONSECA, A.; FONTES JR.,\nA. *Senado***.**\n","dic":"DHBPR"}
