{"title":"SALES, Francisco","cargoss":["Deputado federal","Presidente de associação ou confederação de empregados ou empregadores","Senador","Ministro da Fazenda","Senador"],"cargos_esp":[0,0,0,0,0],"datas_ini":[1900,1902,1906,1910,1915],"datas_fim":[1902,1906,1910,1913,1923],"estados":["MG","MG","MG",0,"MG"],"autor":["Vanessa Lana"],"content":"**SALES, Francisco**\n\n\\*dep. fed. MG 1900-1902; pres. MG 1902-1906; sen. MG 1906-1910; min.\nFaz. 1910-1913; sen. MG 1915-1923.\n\n*Francisco Antônio de Sales* nasceu na vila de Lavras do Funil, atual\nmunicípio de Lavras (MG), no dia 29 de janeiro de 1864, filho de Firmino\nAntônio de Sales e de Ana Cândida de Sales. Seu pai, fazendeiro, foi\nagente executivo municipal e tenente-coronel da Guarda Nacional. Seu\nirmão Pedro Sales foi presidente do diretório do Partido Republicano\nMineiro (PRM) em Lavras, vereador e intendente do município.\n\nApós ter sido alfabetizado pelo padre Américo Brasileiro, cursou o\nsecundário em sua cidade natal, em seguida no Seminário de Mariana (MG),\ne concluiu essa fase dos estudos em Ouro Preto (MG), em 1881.\nBacharelou-se em ciências jurídicas e sociais pela Faculdade de Direito\nde São Paulo em 1886.\n\nLogo após a formatura, retornou a Lavras do Funil, onde advogou e se\nengajou na propaganda republicana. Fez conferências em várias cidades\nmineiras e incentivou a criação de clubes que mais tarde se uniram ao\nPRM. Com a proclamação da República foi nomeado juiz municipal em Lima\nDuarte (MG), mas não permaneceu por muito tempo no cargo, deixando a\nmagistratura para voltar-se para a atividade política. Foi filiado ao\nPRM e militante partidário até os últimos anos de sua vida pública.\n\nEleito deputado estadual constituinte em 1891, logo após assumir o\nmandato foi escolhido presidente da Assembleia estadual. Participou\ntambém de diversas comissões, como a de Orçamento, de Justiça Civil e\nCriminal. Em 1894 foi convidado pelo presidente do estado Crispim\nJacques Bias Fortes para assumir a Secretaria de Finanças. Permaneceu no\ncargo durante todo o governo Bias Fortes, de 7 de setembro de 1894 a 6\nde setembro de 1898. Acumulou também a Secretaria da Agricultura,\nComércio e Obras Públicas, substituindo Francisco Sá, de 25 de maio de\n1897 a 6 de setembro de 1898. Mesmo após a posse de Silviano Brandão no\ngoverno mineiro em 7 de setembro de 1898, permaneceu à frente da\nSecretaria de Finanças até 20 de outubro seguinte. Entre suas\nrealizações, destacam-se os esforços de sistematização nos serviços de\narrecadação estadual, de maior rigidez no planejamento do orçamento\npúblico, e de reorganização da Imprensa Oficial, de modo a dotá-la de\nregulamentação própria. Seu prestígio como político e gestor foi\nreconhecido na convenção do PRM de 1898, na qual foi eleito membro da\ncomissão executiva do partido. Nesse posto, assegurou a força das\nlideranças municipais.\n\nEm 1899 foi eleito senador estadual, mas não chegou a tomar posse, por\nter sido nomeado por Silviano Brandão prefeito de Belo Horizonte. Esteve\nà frente da prefeitura de 1^o^ de fevereiro a 2 de setembro de 1899,\nquando se afastou para se integrar ao corpo docente da Faculdade Livre\nde Direito de Minas Gerais. Contudo, no ano seguinte João Luís Alves foi\nnomeado para a cátedra que ocupava, o que o levou a deixar a faculdade.\nFoi novamente eleito para o Senado mineiro, mas não assumiu o mandato\npor decisão da comissão executiva do PRM, liderada por Crispim Jacques\nBias Fortes, que julgou mais conveniente naquele momento indicá-lo para\na Câmara dos Deputados. Foi então eleito deputado federal para a\nlegislatura 1900-1902. Empossado em 15 de novembro de 1900, integrou a\nComissão de Reconhecimento de Poderes e a Comissão de Orçamento da\nCâmara.\n\nA proximidade da sucessão de Silviano Brandão no governo mineiro gerou\ntensão no interior do PRM em torno da indicação do sucessor. Além do\nnome de Francisco Sales, foi também citado com fervor o do político\nBernardo Pinto Monteiro. Em 1^o^ de março de 1902 realizaram-se as\neleições, e Sales saiu vitorioso. Logo após assumir o cargo em 7 de\nsetembro seguinte, compôs seu secretariado com personagens mais novos na\ncena política: Delfim Moreira da Costa Ribeiro na Secretaria do\nInterior, Antônio Carlos Ribeiro de Andrada na Secretaria de Finanças, e\no coronel Francisco Bressane de Araújo na prefeitura de Belo Horizonte.\nAlém de ter buscado reforçar o PRM, organizou, em maio de 1903, o I\nCongresso Agrícola, Industrial e Comercial, que discutiu medidas\nemergenciais para o desenvolvimento da produtividade agrícola e o\nfomento à industrialização e à livre circulação de produtos. As\ndiscussões travadas no evento influíram na orientação da política\neconômica mineira e do Brasil, com destaque para o protecionismo, a\nlegislação de águas, a valorização do café e estabilização da moeda. O\ngoverno também promoveu mudanças na Brigada Policial, com a\ntransferência do comando da corporação para o chefe de polícia (Decreto\nn^o^ 1.573, de 24/1/1903). Conferiu especial atenção aos aspectos\neducacionais, principalmente na instrução primária, e investiu na\nestabilização econômica, com o estímulo às atividades produtivas, e a\nredução e fixação de tributos.\n\nAo completar seu mandato como presidente de Minas em 7 de setembro de\n1906, Francisco Sales passou o governo a João Pinheiro e foi eleito\nsenador. Renunciou, porém, em 1910, em um momento em que a política\nnacional vivenciava a Campanha Civilista, movimento que polarizou a\ndisputa presidencial entre o baiano Rui Barbosa e o marechal Hermes da\nFonseca. Com a vitória de Hermes da Fonseca e sua posse em 15 de\nnovembro daquele ano, assumiu o Ministério da Fazenda e permaneceu no\nposto até 1913. Em linha semelhante à adotada no governo mineiro, buscou\naumentar a arrecadação pública, reorganizar a concessão e a obtenção de\ncréditos, estimular o comércio e proteger a atividade industrial.\nReorganizou a Caixa de Conversão, a Delegacia do Tesouro Nacional em\nLondres, a realização de operações de crédito no exterior e a emissão de\npapel-moeda e apólices para compromissos do tesouro público.\n\nEm 1915 retornou ao Senado Federal e renovou seu mandato até 1923.\nParticipou da Comissão de Redação de Leis, da Comissão de Saúde Pública\ne da Comissão de Estatística e Colonização.\n\nFaleceu no Rio de Janeiro, então Distrito Federal, em 16 de janeiro de\n1933.\n\nEra casado com Ana Adalgisa de Aquino Sales.\n\nVanessa Lana\n\n**FONTES:** GOV. MG. Disponível em:\n\\<www.mg.gov.br/governomg/comunidade/governomg/galeria-de-governadores/francisco-antonio-de-salles/5794\\>.\nAcesso em: 10/5/2010; MONTEIRO, N. *Dicionário*.\n","ref":"**FONTES:** GOV. MG. Disponível em:\n\\<www.mg.gov.br/governomg/comunidade/governomg/galeria-de-governadores/francisco-antonio-de-salles/5794\\>.\nAcesso em: 10/5/2010; MONTEIRO, N. *Dicionário*.\n","dic":"DHBPR"}
