{"title":"BANDEIRA, Esmeraldino","cargoss":["Deputado federal","Ministro da Justiça","Deputado federal"],"cargos_esp":[0,0,0],"datas_ini":[1900,1909,1910],"datas_fim":[1909,1910,1911],"estados":["PE",0,"PE"],"autor":["Marcos Paulo Torres "],"content":"**BANDEIRA, Esmeraldino**\n\n\\*dep. fed. PE 1900-1909; min. Just. 1909-1910; dep. fed. PE 1910-1911.\n\n*Esmeraldino Olímpio Torres Bandeira* nasceu na cidade do Recife em 27\nde fevereiro de 1865.\n\nMatriculou-se na Faculdade de Direito do Recife em 1885, recebendo o\ngrau de bacharel em ciências jurídicas e sociais em 1889.\n\nRepublicano histórico, após formar-se foi oficial maior da Secretaria do\nGoverno do Estado de Pernambuco, deputado estadual de 1893 a 1895,\nprocurador geral da República no governo de Prudente de Morais\n(1894-1898), e prefeito do Recife de 1898 a 1902. Eleito deputado\nfederal por Pernambuco pela primeira vez em março de 1900, tomou posse\nem maio desse ano e foi três vezes reeleito: em 1903, 1906 e 1909. Nesse\nano deixou a Câmara dos Deputados para assumir, em 18 de junho, o\nMinistério da Justiça do governo Nilo Peçanha. Findo o governo, em 15 de\nnovembro de 1910, retornou à Câmara e nela permaneceu até o fim da\nlegislatura, em dezembro de 1911.\n\nFoi também professor de direito criminal da Faculdade de Direito do Rio\nde Janeiro, então Distrito Federal.\n\nFaleceu no Rio de Janeiro em 1928.\n\nPublicou entre outras obras *Política criminal* (1912), *Curso de\nDireito Penal Militar* (1915), *Direito, Justiça e Processo Militar*\n(1^o^ e 2^o^ v., 1919), e *Tratado de Direito Penal Militar Brasileiro*\n(v. 1, 1925).\n\nMarcos Paulo Torres \n\n**FONTES:** CÂM. DEP.; FUND. JOAQUIM NABUCO.\n","ref":"**FONTES:** CÂM. DEP.; FUND. JOAQUIM NABUCO.\n","dic":"DHBPR"}
