{"title":"SAMPAIO, Carlos","cargoss":["Prefeito"],"cargos_esp":[0],"datas_ini":[1920],"datas_fim":[1922],"estados":["DF"],"autor":[0],"content":"**SAMPAIO, Carlos**\n\n\\* pref. DF 1920-1922.\n\n*Carlos César de Oliveira Sampaio* nasceu no Rio de Janeiro, então\ncapital do Império, em 13 de setembro de 1861, filho do negociante\nJoaquim José de Oliveira Sampaio e de Rosa Júlia Moreira Sampaio. Foi\nbatizado em Lisboa em 1^o^ de março de 1862.\n\nIniciou os estudos em casa, tendo como professora a irmã mais velha, com\nquem aprendeu noções de língua portuguesa, inglesa e francesa. Aos dez\nanos de idade foi matriculado pela primeira vez em uma escola, ambiente\nao qual não se acostumou de imediato, mas a que foi obrigado a se\nadaptar por exigência do pai. Destacou-se depois pelo desempenho\npositivo em seus preparatórios, nos quais foi aprovado com distinção na\nmaioria dos casos. Antes de completar 14 anos matriculou-se na Escola\nPolitécnica, onde recebeu os títulos de engenheiro civil, engenheiro\ngeógrafo e bacharel em ciências físicas e matemáticas antes dos 19 anos.\n\nAprovado em concurso, tomou posse como professor catedrático da\nPolitécnica em 23 de janeiro de 1882. Fez também concurso para a Escola\nde Marinha (depois chamada Escola Naval), passando por uma série de\nexames que envolviam conhecimentos de matemática, navegação, balística e\nartilharia, entre outros assuntos, e foi aprovado e classificado em\nprimeiro lugar. Tornou-se assim, aos 21 anos, professor de duas\ninstituições de ensino superior. Nessa fase, escreveu dois livros:\n*Geometria aplicada* e *Mecânica aplicada às máquinas*, de que\napareceria apenas o primeiro volume em 1918.\n\nEm 1889 participou da operação “Água em Seis Dias”, cuja meta era\nconstruir em prazo curtíssimo um aqueduto com capacidade para\ntransportar, ao longo de quatro mil quilômetros, 16 milhões de litros\ndiários para solucionar o problema de falta de água no Rio de Janeiro,\nmetrópole em rápido crescimento que então sofria os efeitos de\nprolongada estiagem agravada por tórrido verão. O engenheiro Paulo de\nFrontin foi o principal realizador da operação e contou com a importante\ncolaboração dos engenheiros Carlos Sampaio e Júlio Paranaguá, que\nfinalizaram o projeto depois de superar as difíceis condições impostas\npela natureza: violentos temporais que atingiram a cidade e dificultaram\ndesde a locomoção dos operários da obra até o transporte do material que\nseria utilizado para a construção do aqueduto.\n\nApós a proclamação da República, Carlos Sampaio atuou em algumas das\nvárias companhias então criadas. Dirigiu a Companhia Telefônica e\nparticipou da Empresa Industrial de Melhoramentos do Brasil, que mais\ntarde recebeu a concessão para a construção o porto do Rio de Janeiro,\npara a qual ficou incumbido de conseguir – e obteve – recursos. Foi\ntambém convidado para representar os interesses financeiros dos grupos\neuropeus membros do Sindicato Farquhar, do qual várias companhias faziam\nparte, entre elas a Madeira-Mamoré, a Estrada de Ferro Sorocaba, a\nBrazilian Cattle, a Port of Pará e a Estrada de Ferro São Paulo-Rio\nGrande, conjunto usualmente chamado de Brasil Railway. Despertou sua\natenção o fato de o índice de mortalidade entre os trabalhadores da\nMadeira-Mamoré ser muito alto, e então pediu que o cientista e\nsanitarista Oswaldo Cruz investigasse as causas do problema e oferecesse\na solução. Esta consistiu em uma série de recomendações que mais tarde\nseriam utilizadas por outros sanitaristas.\n\nA primeira vez que participou de uma grande empreitada foi a convite do\nengenheiro Luís Rafael Vieira Souto, em 1891, quando juntos realizaram o\narrasamento do morro do Senado, cujas sobras seriam utilizadas para\naterrar o antigo saco de São Diogo, as praias Formosa, das Palmeiras e\ndos Lázaros, que poderiam representar risco à saúde publica devido ao\nlixo depositado no local. O transporte da terra oriunda do morro foi\nfacilitado pelo então prefeito Barata Ribeiro, médico e ciente dos\nbenefícios que o aterro da área traria para a higiene e saúde da cidade.\n\nEm janeiro de 1920 foi nomeado para representar o Brasil na Conferência\nde Trabalho em Washington, com mais dois delegados. Logo depois foi\nescolhido para ser presidente da delegação brasileira à II Conferência\nFinanceira Pan-Americana.\n\nConvidado pelo presidente Epitácio Pessoa (1919-1922) para assumir a\nprefeitura do Distrito Federal em substituição ao prefeito Sá Freire,\ntomou posse em 7 de junho de 1920 com a missão de preparar a cidade para\nos eventos comemorativos do I Centenário de Independência do Brasil.\nDeparou-se a princípio com o pouco tempo disponível e com as condições\nprecárias das finanças da prefeitura, e sofreu oposições, muito mais de\ncunho político do que resultantes de divergências a respeito da\nadministração da cidade. Embora possuísse densos conhecimentos nos\ndiferentes ramos da engenharia, convidou seu amigo Vieira Souto para ser\nseu conselheiro técnico.\n\nExecutou obras de grande relevância para a cidade, tais como o\narrasamento do morro do Castelo, que foi considerada a mais importante\nrealizada em sua gestão. Na área resultante do desmonte do morro deveria\nser montada a Exposição Internacional do I Centenário da Independência\ndo Brasil, que deveria ser inaugurada em 7 de setembro de 1922. Os\nfatores adversos eram muitos, pois além do pouco tempo havia interesses\ncontrários e o receio de suprimir um local de valor histórico. Por outro\nlado, o morro do Castelo era considerado por muitos um empecilho à\nventilação e ao saneamento da cidade, e seu desmonte era recomendado\ndesde 1816 por Azeredo Coutinho.\n\nPara o prefeito, que já havia participado do desmonte do morro do\nSenado, o desmonte não apresentava problemas técnicos. A princípio a\nobra teve um progresso lento devido à escassez de recursos técnicos e\nfinanceiros, ao processo de desapropriação dos prédios e à necessidade\nde alojamento da população afetada. Porém houve um fator favorável: a\ncurta distância do trajeto a ser percorrido para levar o material\noriundo do morro arrasado até a praia de Santa Luzia e a enseada da\nGlória, onde seria depositado no mar. Com a aplicação posterior de novas\ntécnicas, a introdução do desmonte hidráulico e o uso de bombas\npotentes, a obra alcançou o rendimento máximo. No ano do centenário a\nmaior parte da área já estava pronta para receber a exposição.\n\nAs obras da avenida de contorno do morro da Viúva foram complementares\nao arrasamento do morro do Castelo. Tendo sido sua construção aprovada\npelo projeto n^o^ 1.373, de 16 de outubro de 1920, a via foi inaugurada\nna época em que se comemorava o I Centenário de Independência e foi\ndenominada avenida Rui Barbosa, pelo Decreto n^o^ 1.757, de 12 de\nsetembro de 1922, uma homenagem do prefeito ao jurista ainda vivo na\népoca.\n\nAs obras de calçamento, reposição, reparos e conservação foram uma\nconstante no governo de Carlos Sampaio e se estenderam a diversas partes\nda cidade. Entre elas, figuram a reconstrução e reposição da\npavimentação da avenida Atlântica, destruída em partes pela ressaca; a\nconstrução da avenida Presidente Wilson, resultante do arrasamento do\nmorro do Castelo e da Exposição do I Centenário; o início da construção\nda avenida Epitácio Pessoa, parte do plano, aprovado em 26 de fevereiro\nde 1922, de embelezamento e saneamento da lagoa Rodrigo de Freitas,\ncujas margens eram tidas como não habitáveis por possuírem focos de\ndoenças; a construção da avenida Maracanã, considerada obra relevante\npara o saneamento e urbanização da região, evitando que as inundações\nfrequentes do rio Maracanã dificultassem o tráfego para alguns bairros\nda Zona Norte. Outras importantes intervenções foram a desobstrução dos\nrios Trapicheiro, Joana e Maracanã; a construção da avenida do Exército\nem São Cristóvão, destinada às paradas militares do 7 de setembro; a\nconstrução do Hotel 7 de Setembro na avenida Rui Barbosa, e do Pronto\nSocorro do Lido, em Copacabana. Carlos Sampaio ainda construiu,\nremodelou ou ampliou 20 edifícios que abrigavam escolas, concluiu as\ninstalações de dez agências da prefeitura e adquiriu e remodelou o\nTeatro São Pedro, atualmente Teatro João Caetano.\n\nAo deixar a prefeitura em 15 de novembro de 1922, ao final do governo\nEpitácio Pessoa, teve como sucessor Alaor Prata. No período seguinte\nescreveu o livro *Memória histórica e obras da prefeitura do Rio de\nJaneiro de 8 de junho de 1920 a 15 de novembro de 1922*, no qual fica\nevidente um prolongado exame dos problemas urbanos de sua cidade natal.\n\nFaleceu em Paris em 18 de setembro de 1930.\n\nCláudia Mesquitta\n\n**FONTES:** REIS. J. *Administrações; Revista Clube de Engenharia* (v.4,\np.91-96, 9/1961). Centenário de Carlos Sampaio.\n","ref":"**FONTES:** REIS. J. *Administrações; Revista Clube de Engenharia* (v.4,\np.91-96, 9/1961). Centenário de Carlos Sampaio.\n","dic":"DHBPR"}
