{"title":"SANTOS, Francisco Alves dos","cargoss":["Deputado federal"],"cargos_esp":[0],"datas_ini":[1914],"datas_fim":[1918],"estados":["SP"],"autor":["Carlos Alberto Ungaretti Dias"],"content":"**SANTOS, Francisco Alves dos**\n\n\\*dep. fed. SP 1914-1918.\n\n*Francisco Alves dos Santos*nasceu em Mogi-Mirim (SP) em 26 de maio de\n1870, filho de Francisco Alves dos Santos e de Maria Januária da Cunha\nSantos. Seu pai foi deputado provincial em São Paulo.\n\nFormou-se pela Faculdade de Direito de São Paulo e tornou-se delegado de\npolícia. Abriu escritório de advocacia em Mogi Mirim e iniciou-se na\npolítica sendo eleito vereador e presidente da Câmara Municipal, o que o\nlevou a responder também pela administração da cidade durante nove anos.\n\nEm 1^o^ de março de 1914 foi eleito deputado federal por São Paulo na\nvaga de Adolfo Afonso da Silva Gordo. Foi reeleito para a legislatura\n1915-1917, sempre pelo Partido Republicano Paulista (PRP).\n\nMorreu em Campinas (SP) em 2 de setembro de 1954.\n\nFoi casado em primeiras núpcias com Maria Rocha dos Santos e, depois,\ncom Julina da Rocha Santos. Teve quatro filhos.\n\nSeu nome foi dado à praça Dr. Francisco Alves dos Santos em sua cidade\nnatal.\n\nCarlos Alberto Ungaretti Dias\n\n**FONTES:** ABRANCHES, J. *Governos* (v.2); *Folha da Manhã* (3/9/1954);\nLEME, L. *Genealogia.*\n","ref":"**FONTES:** ABRANCHES, J. *Governos* (v.2); *Folha da Manhã* (3/9/1954);\nLEME, L. *Genealogia.*\n","dic":"DHBPR"}
