{"title":"SANTOS, João Batista Pereira dos","cargoss":["Deputado federal"],"cargos_esp":[0],"datas_ini":[1902],"datas_fim":[1911],"estados":["RJ"],"autor":["Luciana Pinheiro"],"content":"**SANTOS, João Batista Pereira dos**\n\n\\* dep. fed. RJ 1902-1911.\n\nJoão Batista Pereira dos Santos nasceu em Rio Bonito (RJ).\n\nIniciou a carreira política como vereador em sua cidade natal, onde foi\npresidente da Câmara Municipal. Elegeu-se deputado estadual no Rio de\nJaneiro em 26 de dezembro de 1897 para a legislatura 1898-1901.\n\nFoi eleito deputado federal pelo estado do Rio de Janeiro em eleição\nsuplementar realizada na legislatura 1900-1902 e tomou posse na Câmara\ndos Deputados no Rio de Janeiro, então Distrito Federal, em 16 de maio\ndesse último ano. Reeleito para as legislaturas 1903-1905, 1906-1908 e\n1909-1911, exerceu o mandato até 31 de dezembro desse último ano.\n\nLuciana Pinheiro\n\n**FONTES:** ABRANCHES, J. *Governos* (p.55); CÂM. DEP. *Deputados\nbrasileiros* (p.122).\n","ref":"**FONTES:** ABRANCHES, J. *Governos* (p.55); CÂM. DEP. *Deputados\nbrasileiros* (p.122).\n","dic":"DHBPR"}
