{"title":"SANTOS, Teófilo Fernandes dos","cargoss":["Presidente de associação ou confederação de empregados ou empregadores","Deputado Geral","Deputado Geral","Presidente de associação ou confederação de empregados ou empregadores","Constituinte","Deputado federal"],"cargos_esp":[0,0,0,0,0,0],"datas_ini":[1879,1886,1881,1889,1891,1891],"datas_fim":[1879,1889,1884,1889,1891,1897],"estados":["SE","AL","AL","PI",0,"AL"],"autor":[0],"content":"**SANTOS, Teófilo Fernandes dos**\n\n\\*pres. SE 1879; dep. geral AL 1881-1884 e 1886-1889; pres. PI 1889;\nconst. 1891; dep. fed. AL 1891-1897.\n\n*Teófilo Fernandes dos Santos* nasceu em Penedo (AL) em 1847.\n\nBacharelou-se pela Faculdade de Direito do Recife. De volta a Alagoas,\nfiliou-se ao Partido Liberal do Império foi eleito deputado provincial\npara as legislaturas de 1864 a 1869 e de 1878 a 1879, sempre pelo 2^o^\ndistrito. Presidiu a província de Sergipe em 1879 e depois foi eleito\ndeputado geral por Alagoas. Exerceu seu mandato de 1881 a 1884 e de 1886\na 1889. Nesse último ano foi presidente da província do Piauí.\n\nApós a proclamação da República em 15 de novembro de 1889, foi eleito\ndeputado constituinte por Alagoas. Assumiu sua cadeira no Congresso\nNacional Constituinte em 15 de novembro de 1890, participou dos\ntrabalhos de elaboração da primeira Constituição republicana do Brasil,\npromulgada em 24 de fevereiro de 1891, e em junho seguinte, ao ter\ninício a legislatura ordinária, ocupou uma cadeira na Câmara dos\nDeputados. Foi reeleito para as legislaturas de 1894 a 1896 e 1897 a\n1899.\n\nFaleceu no Rio de Janeiro no dia 8 de junho de 1897, em pleno exercício\ndo mandato.\n\nReynaldo de Barros\n\n**FONTES:** BARROS, F. *A B C das Alagoas*; CÂM. DEP. *Deputados\nbrasileiros*.\n","ref":"**FONTES:** BARROS, F. *A B C das Alagoas*; CÂM. DEP. *Deputados\nbrasileiros*.\n","dic":"DHBPR"}
