{"title":"SARAIVA, Canuto","cargoss":["Ministro do Supremo Tribunal Federal"],"cargos_esp":[0],"datas_ini":[1908],"datas_fim":[1919],"estados":[0],"autor":["Eduardo Junqueira"],"content":"**SARAIVA, Canuto**\n\n\\*magistrado; min. STF 1908-1919.\n\n*Canuto José Saraiva* nasceu em Areias, na província de São Paulo, no\ndia 23 de setembro de 1854, filho de Joaquim José Saraiva e de\nLeopoldina Maria Saraiva.\n\nEm 1875 formou-se em ciências jurídicas e sociais pela Faculdade de\nDireito de São Paulo. Iniciou a carreira ao ser nomeado promotor público\nem sua cidade natal. Exerceu a função até ser nomeado juiz municipal de\nórfãos de Piracicaba, também na província de São Paulo, em outubro de\n1877. Em 1878 foi eleito vereador e vice-presidente da Câmara Municipal\nda cidade.\n\nEm dezembro de 1886 voltou à magistratura ao ser nomeado juiz de direito\nda comarca de Araraquara. Em 1890 foi removido para a de Sorocaba, e em\n1892 foi promovido a desembargador do Tribunal de Justiça de São Paulo.\nEm maio de 1908 foi nomeado ministro do Supremo Tribunal Federal (STF),\nna vaga aberta em decorrência do falecimento de Piza e Almeida, também\nnome ligado ao estado de São Paulo. Tomou posse em junho do mesmo ano,\nem clara indicação de que o preenchimento de vagas no STF obedecia,\nagora, a critérios ditados pela região de onde provinha o novo membro da\ncorte. Em 1909, no STF, foi relator do recurso impetrado pela União em\nface da concessão de habeas corpus a um grupo de intendentes impedidos\nde tomar posse no Conselho Municipal do Distrito Federal por decreto do\npresidente Afonso Pena, ao qual foi negado provimento.\n\nFaleceu na cidade do Rio de Janeiro, então Distrito Federal, no dia 25\nde maio de 1919, no exercício de suas funções.\n\nFoi casado com Engrácia de Matos Saraiva.\n\nEduardo Junqueira\n\n**FONTES:** MATTOSO, P. *Supremo Tribunal;* MELLO FILHO, J. *Notas*;\nRODRIGUES, L. *História*; SUP. TRIB. FED. Disponível em:\n\\<www.stf.jus.br/portal/ministros\\>.\n","ref":"**FONTES:** MATTOSO, P. *Supremo Tribunal;* MELLO FILHO, J. *Notas*;\nRODRIGUES, L. *História*; SUP. TRIB. FED. Disponível em:\n\\<www.stf.jus.br/portal/ministros\\>.\n","dic":"DHBPR"}
