{"title":"SARMENTO, Alberto","cargoss":["Deputado federal"],"cargos_esp":[0],"datas_ini":[1906],"datas_fim":[1917],"estados":["SP"],"autor":["Raimundo Helio Lopes"],"content":"**SARMENTO, Alberto**\n\n\\*dep. fed. SP 1906-1917.\n\n*Alberto Sarmento* nasceu em Mogi Mirim (SP) no dia 10 de abril de 1864,\nfilho de José Joaquim de Morais Sarmento e de Ana Teresa Duarte.\n\nFormou-se em ciências jurídicas e sociais na Faculdade de Direito do\nLargo São Francisco em 1892. Depois de formado passou a advogar em\nCampinas (SP) e tornou-se delegado de polícia, em 1895, e promotor\npúblico interino, em 1889. Nesse mesmo ano, quando da epidemia de febre\namarela, fundou a Associação Protetora dos Pobres de Campinas. Ainda\ndurante o Império defendeu a causa republicana, militando nas fileiras\ndo Partido Republicano Paulista (PRP) e escrevendo em vários jornais\npaulistas e fluminenses.\n\nDepois da proclamação da República (15/11/1889), participou do combate à\nRevolução Federalista, guerra civil que conflagrou o Rio Grande do Sul,\nSanta Catarina e Paraná entre fevereiro de 1893 e agosto de 1895, opondo\nos federalistas ligados a Gaspar Silveira Martins aos republicanos\nligados a Júlio de Castilhos, este apoiado pelo presidente Floriano\nPeixoto (1891-1894). O conflito envolveu amplas forças militares locais\ne remanescentes da Revolta da Armada, aliados aos federalistas, e\nencerrou-se com a vitória dos republicanos. Durante os combates, foi ao\nParaná em um dos batalhões que defendiam o governo de Floriano e\ncombateu as tropas de Gumercindo Saraiva, líder federalista. Após esse\nconflito, foi agraciado com as honras de major honorário do Exército,\nentre outras condecorações militares.\n\nEm 1896 foi eleito deputado estadual em São Paulo na legenda do PRP,\npara preencher a vaga aberta com a renúncia de um dos deputados. Durante\no mandato propôs a criação da Sociedade de Agricultores Paulistas,\nentidade que favoreceria os cafeicultores. Ficou no parlamento estadual\nmenos de um ano, e ao final da legislatura, em 1897, voltou a residir em\nCampinas. Nessa cidade, em 1904, foi eleito vereador.\n\nEm 1906, elegeu-se deputado federal por São Paulo na legenda do PRF. Foi\nsucessivamente reeleito e permaneceu na Câmara dos Deputados, no Rio de\nJaneiro, então Distrito Federal, até o ano de 1917. Ao longo dos\nmandatos presidiu a Comissão de Diplomacia e de Tratados da Câmara, na\nqual se notabilizou por proferir pareceres sobre diversos temas\njurídicos e de relações internacionais. Em 1919 foi convidado pelo\npresidente Epitácio Pessoa (1919-1922) para a pasta das Relações\nExteriores, mas não pôde assumir por estar enfermo.\n\nFez parte do corpo editorial do *Diário de Campinas* e colaborou em\ndiversos jornais do Rio de Janeiro e São Paulo. Foi também\nsócio-correspondente da Associação de Jornalistas do Porto, de Portugal,\ne fundador do Asilo dos Órfãos, Asilo dos Inválidos e da Liga Operária,\ntodos de Campinas. Foi condecorado com as insígnias da Legião de Honra,\nda França, da ordem da Coroa, da Itália, e da ordem de São Leopoldo, da\nBélgica.\n\nFaleceu em Correias (RJ) no dia 13 de abril de 1927.\n\nFoi casado com Francisca Tibau Sarmento.\n\nPublicou *Os crimes célebres de São Paulo – histórico e julgamento dos\ncrimes mais importantes ocorridos nesta província, acompanhado de\nconsiderações jurídicas* (1886), *Nova pátria*, *Separação da Igreja e\ndo Estado*, *Organização municipal*, *Os* *partidos políticos*, *No\nparlamento – discursos e pareceres*, *Caixa de conversão*, *Tráfico* *de\nbrancas*, *A questão florestal*, *Discursos*, *O Brasil na guerra*, *Os\nnavios alemães*, *O* *blackout*, *A guerra europeia* e *O armistício*.\n\nRaimundo Helio Lopes\n\n**FONTES:** ABRANCHES, J. *Governos*; CALIMAN, A. *Legislativo*;\nCASALECHI, J. *Partido*; MELO, L. *Dicionário.*\n","ref":"**FONTES:** ABRANCHES, J. *Governos*; CALIMAN, A. *Legislativo*;\nCASALECHI, J. *Partido*; MELO, L. *Dicionário.*\n","dic":"DHBPR"}
