{"title":"SARMENTO, Joaquim José Paes da Silva","cargoss":["Presidente de associação ou confederação de empregados ou empregadores","Constituinte","Senador"],"cargos_esp":[0,0,0],"datas_ini":[1884,1891,1891],"datas_fim":[1884,1891,1902],"estados":["AM",0,"AM"],"autor":["Maria Eugenia Bertarelli"],"content":"**SARMENTO, Joaquim José Paes da Silva**\n\n\\*pres. AM 1884; const. 1891; sen. AM 1891-1902.\n\n*Joaquim José Pais da Silva Sarmento* nasceu em Manaus no dia 7 de\noutubro de 1845, filho de Joaquim José Pais da Silva Sarmento.\n\nAinda muito jovem começou a trabalhar na Fazenda Pública da província do\nAmazonas, na qual assumiu diversas funções até ocupar o posto de\ninspetor de Ensino, no qual se aposentaria. Chegaria também a\ntenente-coronel da Guarda Nacional.\n\nSegundo-vice-presidente da província, assumiu o governo do Amazonas como\npresidente interino entre 12 de julho e 11 de outubro de 1884. Durante\nesse período, enfrentou uma grave epidemia de varíola em toda a\nprovíncia.\n\nProclamada a República em 15 de novembro de 1889, e convocadas as\neleições para o Congresso Nacional Constituinte, foi eleito senador pelo\nAmazonas em 15 de setembro de 1890 e tomou posse em 15 de novembro\nseguinte. Participou dos trabalhos constituintes, foi um signatários da\nConstituição promulgada em 24 de fevereiro de 1891, e em junho passou a\nexercer o mandato ordinário no Senado, até dezembro de 1893. Reeleito\nsenador em março de 1894, com 3.122 votos, para um mandato de nove anos,\ndeixou o Senado em dezembro de 1902. Em 1912 foi superintendente\nmunicipal (prefeito) de Manaus.\n\nFoi também diretor do Instituto Benjamin Constant, internato para\nmeninas órfãs, e colaborador do jornal *Amazonas*.\n\nFaleceu no dia 10 de março de 1914.\n\nMaria Eugenia Bertarelli\n\n**FONTES:** BITTENCOURT, A. *Dicionário*; PLANALTO. *Constituição de\n1891.* Disponível em: \\<www.planalto.gov.br\\>. Acesso em: 29/10/2010;\nSENADO. Disponível em: \\<www.senado.gov.br\\>. Acesso em: 29/10/2010;\n*Diário oficial da união* (2/5/1894, p.4, seção 1).\n","ref":"**FONTES:** BITTENCOURT, A. *Dicionário*; PLANALTO. *Constituição de\n1891.* Disponível em: \\<www.planalto.gov.br\\>. Acesso em: 29/10/2010;\nSENADO. Disponível em: \\<www.senado.gov.br\\>. Acesso em: 29/10/2010;\n*Diário oficial da união* (2/5/1894, p.4, seção 1).\n","dic":"DHBPR"}
