{"title":"SEABRA, J. J.","cargoss":["Constituinte","Deputado federal","Deputado federal","Ministro do Interior","Deputado federal","Ministro da Viação e Obras Públicas","Governador de estado ou do Distrito Federal","Deputado federal","Senador","Governador de estado ou do Distrito Federal","Constituinte","Deputado federal"],"cargos_esp":[0,0,0,"e Just",0,0,0,0,0,0,0,0],"datas_ini":[1891,1897,1891,1902,1909,1910,1912,1916,1917,1920,1934,1935],"datas_fim":[1891,1902,1893,1906,1910,1912,1915,1917,1920,1924,1934,1937],"estados":[0,"BA","BA",0,"BA",0,"BA","BA","BA","BA",0,"BA"],"autor":[0],"content":"**SEABRA, J. J.**\n\n\\*const. 1891; dep. fed. BA 1891-1893 e 1897-1902; min. Interior e Just.\n1902-1906; dep. fed. BA 1909-1910; min. Viação 1910-1912; gov. BA\n1912-1915; dep. fed. BA 1916-1917; sen. BA 1917-1920; gov. BA 1920-1924;\nconst. 1934; dep. fed. BA 1935-1937.\n\n*José Joaquim Seabra*nasceu em Salvador no dia 21 de agosto de 1855,\nfilho de José Joaquim Seabra e de Leopoldina Alves Seabra.\n\nConcluindo os preparatórios em Salvador e ingressando na Faculdade de\nDireito do Recife, colaborou na *Revista Acadêmica de Ciências e\nLetras*. Bacharelou-se em 1877, ocasião em que recebeu o prêmio\ndestinado ao melhor aluno do estabelecimento. Depois da formatura, de\nvolta à Bahia, foi nomeado primeiro-promotor público de Salvador pelo\nentão presidente da província, Henrique Pereira de Lucena, barão de\nLucena. Retornou em seguida a Recife para doutorar-se em direito.\nAprovado em concurso para lente substituto da faculdade onde estudara,\nrecebeu a nomeação em março de 1880.\n\nTido como notável orador, participou da campanha abolicionista e, em\n1889, elegeu-se deputado geral pela Bahia, inscrevendo em seu programa a\ntese da federação das províncias. Devido à proclamação da República\n(15/11/1889), não chegou a assumir o mandato. Após a mudança do regime,\nfoi nomeado lente catedrático de economia política e diretor da\nFaculdade de Direito do Recife.\n\nNa Primeira República\n\nEm setembro de 1890 J. J. Seabra foi eleito deputado pela Bahia ao\nCongresso Nacional Constituinte. Participou da elaboração da\nConstituição promulgada em 24 de fevereiro de 1891, da eleição do\nmarechal Deodoro da Fonseca para presidente constitucional da República\nno dia seguinte, e, com o início em junho da legislatura ordinária,\ncontinuou na Câmara dos Deputados, com mandato até dezembro de 1893.\nAdepto da política do marechal Deodoro da Fonseca, e do ministro barão\nde Lucena, apoiou o golpe de Deodoro em 3 de novembro de 1891, que\ndissolveu o Congresso Nacional. Com a renúncia de Deodoro 20 dias\ndepois, passou a mover cerrada oposição ao sucessor deste, o\nvice-presidente marechal Floriano Peixoto (1891-1894), participando em\n1892 das manifestações públicas que visavam à sua deposição e à retomada\ndo cargo presidencial por Deodoro. Fracassada a rebelião, foi um dos\ndeportados para Cucuí, no alto Amazonas, e perdeu o cargo de diretor da\nFaculdade de Direito do Recife.\n\nAnistiado logo depois, voltou aos trabalhos na Câmara e continuou em\nfirme campanha contra o governo. Quando, a 6 de setembro de 1893,\neclodiu a Revolta da Armada, sob o comando do almirante Custódio de\nMelo, juntou-se aos rebeldes a bordo do navio *Aquidabã*. Em seguida,\nacometido de malária, teve que se exilar em Montevidéu. Na capital\nuruguaia, escreveu violentos artigos de denúncia contra Floriano Peixoto\nnos jornais *El Siglo* e *La Razón*. Também publicou artigos em *El\nDiario*, de Buenos Aires.\n\nDecretada a anistia no governo de Prudente de Morais (1894-1898), voltou\nao Brasil em outubro de 1895 e obteve reintegração em suas funções na\nFaculdade de Direito do Recife em 1897, tendo sido recebido com festas\npelos estudantes e pela congregação.\n\nAinda em 1897, elegeu-se deputado federal pela Bahia para a legislatura\n1897-1899. Logo após tomar posse, no dia 28 de maio, apresentou na\nCâmara uma moção de solidariedade a Prudente de Morais por sua firmeza\nem sufocar uma rebelião da Escola Militar desencadeada dois dias antes.\nA moção, proposta em um momento de forte crise, em meio à campanha de\nCanudos, demandava principalmente uma definição do Partido Republicano\nFederal (PRF), o qual, embora aliado do governo, não lhe prestava apoio\nincondicional. Apesar de derrotada no Congresso, a iniciativa de Seabra\nenfraqueceu a unidade do PRF e desencadeou o processo que iria conduzir\nà sua cisão e ao fortalecimento da posição do presidente da República.\n\nReeleito deputado federal para a legislatura 1900-1902, foi líder da\nmaioria na Câmara no último ano da presidência de Campos Sales\n(1898-1902). Em 15 de novembro de 1902, renunciou ao mandato para\nassumir o Ministério do Interior e Justiça do governo Rodrigues Alves\n(1902-1906). Nesse cargo, em novembro de 1904 esteve ao lado do\npresidente durante a revolta da Escola Militar contra a Lei da Vacinação\nObrigatória. Deixou o ministério em maio de 1906 e elegeu-se senador por\nAlagoas. Sua eleição, entretanto, não foi reconhecida.\n\nEm 1909, foi novamente eleito deputado federal pela Bahia e voltou a\nexercer a liderança da maioria na Câmara. Renunciou, porém, mais uma vez\nao mandato, para assumir em 1910 a pasta da Viação no governo do\nmarechal Hermes da Fonseca (1910-1914). Enquanto ministro, promoveu a\nduplicação da estrada da serra do Mar.\n\nCandidato ao governo da Bahia nas eleições de janeiro de 1912, enfrentou\nacirrada oposição, numa situação de crise estadual em que a cidade de\nSalvador chegou até mesmo a ser bombardeada por suas próprias\nfortalezas, por ordem do comandante da região militar. Apesar do clima\ntenso, Seabra foi eleito no dia 28 de janeiro, tendo renunciado ao\nministério na véspera, e tomou posse no dia 29 de março. Seu governo foi\nrelativamente tranquilo. Para executar o vasto programa de obras que\nelaborou, pediu a banqueiros ingleses um empréstimo de três milhões de\nlibras, conseguindo apenas um milhão. A quantia foi empregada na\nremodelação da cidade de Salvador e no desenvolvimento de vias de\ncomunicação. Além disso, criou a Imprensa Oficial e o Tribunal de Contas\ndo estado.\n\nEm agosto de 1915, Seabra passou o governo a seu substituto\nconstitucional, coronel Augusto Rodrigues da Costa, e reelegeu-se\ndeputado federal. Em 29 de março de 1916 tomou posse no governo baiano\nseu aliado Antônio Muniz, enquanto ele próprio voltava, em maio, à\nCâmara dos Deputados. No exercício de mais esse mandato, foi membro das\ncomissões de Justiça e de Finanças da Câmara e presidente da Comissão\nEspecial do Código Civil. Em 1917, foi eleito para o Senado Federal em\nsubstituição a José Marcelino de Sousa, que havia falecido.\n\nDurante o governo de Antônio Muniz (1916-1920), seu amigo pessoal,\nfundou na Bahia o Partido Republicano Democrático (PRD), ao qual Muniz\ntambém se filiou. Em 1919, cogitou-se de seu nome para candidato à\npresidência da República, em pleito resultante do falecimento do\nmandatário eleito, Rodrigues Alves. A escolha, entretanto, recaiu sobre\nEpitácio Pessoa.\n\nEm 1920, ao mesmo tempo em que forças federais intervinham na Bahia para\nesmagar o movimento dos “coronéis” do interior contra o governo de\nAntônio Muniz, Seabra foi mais uma vez eleito governador da Bahia,\nembora já se pudesse sentir seu enfraquecimento político, e sua\ncandidatura tivesse de enfrentar a oposição, entre outros, de Rui\nBarbosa, que comandou pessoalmente a campanha de seu adversário. Nesse\nsegundo governo, construiu vias férreas e estabelecimentos de ensino\nprimário, secundário e superior, tendo ainda desenvolvido obras no porto\nda capital. Na verdade, a ação de J. J. Seabra à frente do governo da\nBahia se estendeu de 1912 a 1924, levando-se em conta a perfeita\nidentificação de Antônio Muniz com as diretrizes de seu chefe político.\n\nEm 1922, Seabra foi candidato à vice-presidência da República na chapa\nda Reação Republicana, encabeçada por Nilo Peçanha. Participou assim da\nintensa campanha eleitoral em que se procurou indispor com as forças\narmadas o outro candidato à presidência, Artur Bernardes, atribuindo-lhe\na autoria das chamadas “cartas falsas”, nas quais teria insultado os\nmilitares. Publicados no *Correio da Manhã*, os documentos foram objeto\nde sindicância que concluiu mais tarde por sua inautenticidade. O\nepisódio suscitou a formação de uma comissão de inquérito no Clube\nMilitar e acirrou a oposição das forças armadas a Bernardes.\n\nTendo perdido as eleições, Seabra tentou ainda assim conquistar o cargo\npor ocasião da morte, antes da posse, do vice-presidente eleito Urbano\nSantos. Afirmando ter sido Seabra o segundo candidato mais votado, o\njuiz federal o apoiou, mas o Supremo Tribunal Federal (STF) decidiu-se\npor Estácio Coimbra, que foi eleito indiretamente pelo Congresso\nNacional, como candidato único.\n\nConsiderado um dos inspiradores da Revolta de 5 de Julho de 1922, e sem\ncontar com o apoio da presidência da República e dos “coronéis” locais,\nSeabra perdeu sua força política. Em março de 1924 foi eleito para\nsubstituí-lo no governo baiano um candidato de oposição ao PRD. Pela\nprimeira vez em 12 anos Seabra deixava de ganhar um pleito na Bahia. O\nnovo governador, Francisco Marques de Góis Calmon, tomou posse sob\nestado de sítio, dado o tenso ambiente político no estado. Com isso,\nSeabra exilou-se na Europa, de onde retornou somente em 1927. Nesse ano,\nfoi eleito intendente do Conselho Municipal do Distrito Federal, sendo\nmais tarde escolhido para presidir o mesmo conselho.\n\nEmpolgado pela plataforma da Aliança Liberal, a ela aderiu e, em 20 de\nsetembro de 1929, participou, como representante da Bahia, da convenção\nnacional destinada a indicar os candidatos liberais à presidência e à\nvice-presidência da República, respectivamente Getúlio Vargas e João\nPessoa. Foi também escolhido presidente honorário da comissão executiva\nda Aliança Liberal, tendo ainda participado na Bahia da caravana liberal\nque percorreu diversos estados no Nordeste, discursando nos comícios\nrealizados em Salvador e Ilhéus.\n\nNo Pós-1930\n\nEm 1930, após a derrota dos candidatos liberais nas eleições de março,\nesteve inicialmente ao lado do movimento revolucionário que depôs\nWashington Luís e impediu a posse de Júlio Prestes. Com a mudança de\nregime, foi nomeado juiz do Tribunal Especial pelo governo provisório\nchefiado por Getúlio Vargas. Em 1932, no entanto, já em desacordo com os\nrumos tomados pela revolução, apoiou a Revolução Constitucionalista\ndesencadeada em São Paulo no mês de julho. Na Bahia, colocou-se em\nfranca oposição ao interventor Juraci Magalhães, que, para pacificar o\nestado, estabeleceu uma aliança com a força antirrevolucionária do\ncoronelismo local, enquanto desencadeava uma forte campanha contra\naqueles que denominou “bacharéis personalistas do passado”.\n\nEleito para a Assembleia Nacional Constituinte de 1933 na legenda A\nBahia Ainda é a Bahia, J. J. Seabra atuou em oposição a Vargas, o que o\ncolocava em minoria dentro da bancada baiana, liderada por Antônio\nGarcia de Medeiros Neto. Discordou publicamente da realização de\neleições presidenciais antes de ser aprovada a nova Carta\nConstitucional. De igual modo, criticou a prorrogação dos mandatos dos\ndeputados constituintes no período compreendido entre julho de 1934,\nquando se promulgou a Constituição, e outubro do mesmo ano, quando se\nrealizaram novas eleições para a Câmara dos Deputados.\n\nNesse pleito, em que também foram escolhidos representantes para as\nassembleias estaduais, o Partido Social Democrático da Bahia, de Juraci\nMagalhães, elegeu 18 dos 24 deputados. Para a Câmara dos Deputados,\nSeabra foi o único oposicionista vitorioso, eleito na legenda Governador\nOtávio Mangabeira, que reunia a Liga de Ação Social e Política (LASP) e\no partido que chefiava, o PRD. Em novembro de 1937, com a implantação do\nEstado Novo, encerrou sua vida pública, mantendo-se porém em\nintransigente oposição a Vargas.\n\nMorreu no Rio de Janeiro, em 5 de dezembro de 1942. Pouco depois, no dia\n16, seu corpo foi trasladado para Salvador. Em sua homenagem, a cidade\nbaiana de Campestre foi rebatizada como Doutor Seabra, atualmente\nSeabra.\n\nCasado com Amélia de Freitas Seabra, teve quatro filhos.\n\nDeixou escritos textos de crítica ao governo baiano posterior à\nRevolução de 1930: Humilhação e devastação da Bahia: análise documentada\nda administração do sr. Juraci Magalhães, reunida e anotada por Nélson\nde Sousa Carneiro (1933), Esfola de um mentiroso: estudo documentado da\nação política e administrativa do interventor Juraci Magalhães na Bahia,\ncontendo um esclarecimento completo em torno do assassinato do general\nLavenère Wanderley na Paraíba em outubro de 1930 (1936). A seu respeito,\nA. Borges Barros escreveu *Dr. J. J. Seabra: sua vida na República*\n(1931).\n\nAmélia Coutinho\n\n**FONTES:** ASSEMB. NAC. CONST. 1934. *Anais*; BELEZA, N. *Evolução*;\nBoletim Min. Trab. (5/1936); CÂM. DEP. *Deputados*; Câm. Dep. seus\ncomponentes; CARNEIRO, G. *História*; Cronologia da Assembleia; *Diário\nde Notícias*, Rio; Diário do Congresso Nacional; *Encic. Mirador*;\nFONTOURA, J. *Memórias*; GODINHO, V. *Constituintes*; *Grande encic.\nDelta*; GUIMARÃES, A. *Dicionário*; JARDIM, R. Aventura; *Jornal do\nComércio*, Rio; LEITE, A. *História*; LIRA, A. *Senado*; MORAIS, A.\n*Minas*; MOREIRA, J. *Dicionário*; PANG, Eul-Soo. *Coronelismo*;\nPEREIRA, N. *Faculdade*; SOUSA, A. *Baianos*.\n","ref":"**FONTES:** ASSEMB. NAC. CONST. 1934. *Anais*; BELEZA, N. *Evolução*;\nBoletim Min. Trab. (5/1936); CÂM. DEP. *Deputados*; Câm. Dep. seus\ncomponentes; CARNEIRO, G. *História*; Cronologia da Assembleia; *Diário\nde Notícias*, Rio; Diário do Congresso Nacional; *Encic. Mirador*;\nFONTOURA, J. *Memórias*; GODINHO, V. *Constituintes*; *Grande encic.\nDelta*; GUIMARÃES, A. *Dicionário*; JARDIM, R. Aventura; *Jornal do\nComércio*, Rio; LEITE, A. *História*; LIRA, A. *Senado*; MORAIS, A.\n*Minas*; MOREIRA, J. *Dicionário*; PANG, Eul-Soo. *Coronelismo*;\nPEREIRA, N. *Faculdade*; SOUSA, A. *Baianos*.\n","dic":"DHBPR"}
