{"title":"BARATA, Manuel","cargoss":["Constituinte","Senador"],"cargos_esp":[0,0],"datas_ini":[1891,1891],"datas_fim":[1891,1906],"estados":[0,"PA"],"autor":["Adrianna Setemy"],"content":"**BARATA, Manuel**\n\n\\* const. 1891; sen. PA 1891-1906.\n\n*Manuel de Melo Cardoso Barata* nasceu em Belém no dia 4 de agosto de\n1841, filho de Manuel José de Melo Freire Barata e de Jacinta Maria de\nMelo Freire Barata.\n\nComo seu pai era um abastado fazendeiro na ilha de Marajó, grande\nproprietário de imóveis na cidade de Belém e capitão da Guarda Nacional,\nteve as condições necessárias para sair de Belém e cursar a Faculdade de\nDireito do Recife, pela qual se formou em 1872 em ciências jurídicas e\nsociais. Em 1878 foi subdelegado do 1^o^ Distrito de Belém e entre 1879\ne 1882 foi vereador na Câmara Municipal da mesma cidade. Em 1886\nparticipou da fundação do Clube Republicano do Pará, associação criada\ncom o intuito de propagar os ideais republicanos na província. Foi seu\nvice-presidente em 1887 e presidente em 1888, quando também fez parte da\ncomissão de elaboração do estatuto do Clube.\n\nLogo após a proclamação da República, em 15 de novembro de 1889, foi\ndeposto o então presidente da província do Pará, o monarquista Antônio\nJosé Ferreira Braga. Dois dias depois foi empossada uma junta\ngovernativa provisória, chefiada pelo doutor Justo Leite Chermont e\ncomposta pelo tenente-coronel Bento José Fernandes Júnior e pelo capitão\nde fragata José Maria do Nascimento. Em 17 de dezembro Justo Chermont e\nManuel Barata foram nomeados pelo governo provisório chefiado pelo\nmarechal Deodoro da Fonseca, respectivamente, governador e\nvice-governador do Pará.\n\nRealizadas as eleições para o Congresso Nacional Constituinte em\nsetembro de 1890, Manuel Barata foi eleito senador pelo Pará. Assumiu o\nmandato em 15 de novembro e foi um dos signatários da Constituição de 24\nde fevereiro de 1891. Sucessivamente reeleito, permaneceu no Senado até\n1906, quando decidiu afastar-se da vida política a fim de dedicar-se à\npesquisa histórica.\n\nFaleceu em Belém do Pará, no dia 13 de outubro de 1916.\n\nFoi sócio-honorário do Instituto Histórico e Geográfico Brasileiro\n(IHGB), onde se encontram depositadas sua biblioteca de obras raras\nsobre o Brasil e, especialmente, sobre a Amazônia, além de sua opulenta\ncoleção de mapas. Para homenageá-lo, o IHGB colocou na antessala de\nconsulta seu retrato a óleo, como guardião dos amantes da literatura\nhistórica. Foi membro, também, dos Institutos Históricos de São Paulo,\nBahia e Ceará.\n\nEscreveu diversos manuscritos de cunho genealógico referentes ao Pará, o\nque lhe valeu o título de patrono da cadeira número 20 do Colégio\nBrasileiro de Genealogia. Entre as suas publicações, destacam-se os\nseguintes trabalhos: *Formação histórica do Pará: obras reunidas*\n(reeditado em 1973), *Fundação de Belém: estudo da história paraense com\ndocumentos inéditos* (1904), *A jornada de Francisco Caldeira de\nCastello Branco* (1904), *A Confederação dos Tamoios* (1905) e *Antiga\nprodução e exportação do Pará* (1915).\n\nAdrianna Setemy\n\n**FONTES:** FLORES, M. *Dicionário*; Projeto de imagem de publicações\noficiais brasileiras do Center for Research Libraries e Latin-american\nMicrofilm Project. *Mensagens dos Presidentes de Província (1830-1930).*\nDisponível em: \\<www.crl.edu/content.asp?l1=4&l2=18&l3=33\\>. Acesso em:\n8/1/2009.\n","ref":"**FONTES:** FLORES, M. *Dicionário*; Projeto de imagem de publicações\noficiais brasileiras do Center for Research Libraries e Latin-american\nMicrofilm Project. *Mensagens dos Presidentes de Província (1830-1930).*\nDisponível em: \\<www.crl.edu/content.asp?l1=4&l2=18&l3=33\\>. Acesso em:\n8/1/2009.\n","dic":"DHBPR"}
