{"title":"SILVA, Antonino Freire da","cargoss":["Governador de estado ou do Distrito Federal","Deputado federal","Senador","Senador"],"cargos_esp":[0,0,0,0],"datas_ini":[1910,1913,1930,1919],"datas_fim":[1012,1916,1930,1926],"estados":["PI","PI","PI","PI"],"autor":["Raimundo Helio Lopes"],"content":"**SILVA, Antonino Freire da**\n\n\\*gov. PI 1910-1012; dep. fed. PI 1913-1916; sen. PI 1919-1926 e 1930.\n\n*Antonino Freire da Silva* nasceu na cidade de Amarante (PI) em 1876,\nfilho de Francisco Rodrigues da Silva e de Carolina Freire da Silva.\n\nIngressou na Escola Politécnica do Rio de Janeiro em 1894 e concluiu o\ncurso em 1899. Depois de formado voltou ao estado natal e durante o\ngoverno de Álvaro de Assis Osório Mendes foi diretor de obras públicas.\nSua gestão caracterizou-se pela construção e reforma de vários prédios\npúblicos. Além dessa atividade, foi professor do Liceu Piauiense e de\noutras escolas do estado. Também escreveu para vários jornais e revistas\ncomo *A Imprensa*, *Habeas Corpus* e *O Nortista*, e fundou o jornal *A\nPátria*, ao lado de Miguel Rosa e Abdias da Costa Neves.\n\nEm 1908, quando Anísio Auto de Abreu foi eleito governador do Piauí, foi\nescolhido vice-governador do estado e acumulou o cargo de diretor de\nobras públicas. Como a morte do governador em 1909, assumiu o governo do\nestado Manuel Raimundo da Paz. Em 15 de março de 1910 foi sua vez de\nassumir o governo, o que fez até ser substituído pelo novo governador\nMiguel de Paiva Rosa em 1^o^ de julho de 1912. Durante esses dois anos,\nrealizou diversas obras: iniciou o serviço de iluminação de Teresina e a\nconstrução do cemitério municipal, criou a Escola Normal, a biblioteca\npública, a imprensa oficial, a escola de aprendizes artífices e ampliou\no serviço de abastecimento de água da capital.\n\nEm 1913 elegeu-se deputado federal na vaga aberta com a morte do\ndeputado federal João Gayoso. Exerceu o mandato até 1916. Em 1919 foi\neleito pela primeira vez senador pelo estado do Piauí, até o ano de\n1926. Voltou a ocupar um lugar no Senado em abril de 1930, mas no mesmo\nano teve o mandato interrompido com a vitória da Revolução de 1930, que\nlevou Getúlio Vargas ao poder e extinguiu todos os órgãos legislativos\ndo país. No Senado, foi membro da Comissão de Obras Públicas e Empresas\nPrivilegiadas. Durante seu mandato, também trabalhou, ao lado dos\nsenadores Pires Rebelo, Eurípedes Clementino de Aguiar, Aristides Rocha\ne Mendes Tavares, na revisão do contrato entre a União e a Companhia de\nMelhoramentos do Maranhão para a incorporação em suas obras do trecho da\nestrada de ferro entre as cidades de Petrolina (PE) e Teresina e seus\nramais situados em território piauiense.\n\nFaleceu em Teresina em 15 de setembro de 1934.\n\nRaimundo Helio Lopes\n\n**FONTES:** ABRANCHES, J. *Governos*; GONÇALVES, W. *Grande*; LEITE\nNETO, L. *Catálogo biográfico*; REGO NETO, H. *Fatos.*\n","ref":"**FONTES:** ABRANCHES, J. *Governos*; GONÇALVES, W. *Grande*; LEITE\nNETO, L. *Catálogo biográfico*; REGO NETO, H. *Fatos.*\n","dic":"DHBPR"}
