{"title":"SILVA, Antônio Augusto da","cargoss":["min STJ","Ministro do Supremo Tribunal Federal"],"cargos_esp":[0,0],"datas_ini":[1889,1891],"datas_fim":[1890,1891],"estados":[0,0],"autor":["Eduardo Junqueira"],"content":"**SILVA, Antônio Augusto da**\n\n\\*magistrado; min. STJ 1889-1890; min. STF 1891.\n\n*Antônio Augusto da Silva* nasceu em Salvador, filho de Antônio Augusto\nda Silva. Seu pai, bacharel pela Universidade de Coimbra, foi ministro\ndo Superior Tribunal de Justiça do Império.\n\nBacharelou-se em ciências jurídicas e sociais pela Faculdade de Direito\nde Olinda em 1844. Iniciou a carreira na magistratura como juiz\nmunicipal e de órfãos dos termos reunidos de Estância e Santa Luzia, na\nprovíncia de Sergipe, até 1854, quando se transferiu para Nazaré.\nNomeado juiz de direito em 1857, assumiu suas funções na comarca da\nGraça, província de Santa Catarina, sendo a seguir designado para a\ncomarca alagoana de Porto Calvo. Entre 1864 e 1866 foi chefe de polícia\ndas províncias do Rio Grande do Norte, Alagoas e Maranhão. De volta às\nfunções judicantes em dezembro de 1869, teve nova designação para a 2^a^\nvara do crime, na capital do Maranhão. Em fevereiro de 1871 foi nomeado\njuiz de direito da vara da provedoria de capelas e resíduos da mesma\ncapital.\n\nEm novembro de 1875, foi nomeado desembargador da Relação de Belém do\nPará. Removido ainda no mesmo ano para a de São Luís do Maranhão,\ntransferiu-se para a Relação da Corte em 1886. Em julho de 1889, foi\nnomeado ministro do Supremo Tribunal de Justiça do Império, na vaga\ndecorrente da aposentadoria de José Antônio de Magalhães Castro. Nesse\nmesmo mês foi agraciado por dom Pedro II com o foro de fidalgo cavaleiro\ne o título do Conselho.\n\nApós a República, seguiu para o Supremo Tribunal Federal (STF), tribunal\nconstitucional criado em outubro de 1890 nos moldes da Suprema Corte\nnorte-americana. Instalado o novo órgão em fevereiro do ano seguinte,\npraticamente não atuou, pois foi aposentado em março.\n\nFaleceu na cidade do Rio de Janeiro, então Distrito Federal, no dia 3 de\noutubro de 1892.\n\nSeu filho Antônio Augusto da Silva Júnior foi ministro da Indústria,\nViação e Obras Públicas em 1902, último ano do governo de Campos Sales\n(1898-1902).\n\nEduardo Junqueira\n\n**FONTES:** MATTOSO, P. *Supremo Tribunal*; MELLO FILHO, J. *Notas*;\nRODRIGUES, L. *História*; SUP. TRIB. FED. Disponível em:\n\\<www.stf.jus.br/portal/ministros\\>.\n","ref":"**FONTES:** MATTOSO, P. *Supremo Tribunal*; MELLO FILHO, J. *Notas*;\nRODRIGUES, L. *História*; SUP. TRIB. FED. Disponível em:\n\\<www.stf.jus.br/portal/ministros\\>.\n","dic":"DHBPR"}
