{"title":"SILVA, Carlos Marcelino da","cargoss":["Deputado federal"],"cargos_esp":[0],"datas_ini":[1897],"datas_fim":[1902],"estados":["AM"],"autor":["Inoã Pierre Carvalho Urbinati"],"content":"**SILVA, Carlos Marcelino da**\n\n\\*dep. fed. AM 1897-1902.\n\n*Carlos Marcelino da Silva* nasceu em Manaus no dia 4 de abril de 1859,\nfilho de Mariano Sabino da Silva e de Marcolina Batista da Silva. Seu\npai foi comandante de um presídio militar no Império.\n\nApós fazer seus primeiros estudos em Manaus, transferiu-se para o Rio de\nJaneiro, então capital do Império, e se matriculou na Escola Militar da\nPraia Vermelha, da qual foi posteriormente desligado, obtendo baixa do\nserviço militar. De volta ao Norte do país, foi aprovado em concurso\npara a Repartição dos Correios e Telégrafos de Belém do Pará, lá\nchegando a contador. Exerceu depois o cargo de guarda-mor da Alfândega\ndaquela cidade. Em 1883 casou-se em Belém com Heliodora Ferreira da\nSilva, com quem teria dez filhos.\n\nApós a proclamação da República (15/11/1889), ingressou na política\nfiliando-se ao Partido Republicano Federal (PRF), cujo chefe no Amazonas\nera Eduardo Ribeiro, que havia sido seu colega na Escola Militar. Em\n1890 foi eleito deputado estadual no Amazonas e participou da Assembleia\nConstituinte do estado em 1891. Seis anos depois foi eleito deputado\nfederal pelo Amazonas. Em maio de 1897 assumiu sua cadeira na Câmara dos\nDeputados, no Rio de Janeiro, então Distrito Federal, e foi reeleito\npara a legislatura seguinte. Permaneceu na Câmara até dezembro de 1902,\nquando se encerrou o seu mandato. No ano seguinte voltou a se candidatar\na deputado federal, mas não foi eleito. Sua derrota é creditada à\ndivergência que teve com Silvério Nery, então governador do Amazonas\n(1900-1903), quanto à condução do processo eleitoral no estado, fato que\no levou a contestar o resultado.\n\nFaleceu no Rio de Janeiro no dia 2 de junho de 1904.\n\nInoã Pierre Carvalho Urbinati\n\n**FONTES:** ABRANCHES, J. *Governos*; CÂM. DEP. *Deputados brasileiros*;\nCASA CIVIL AM. Disponível em: \\<www.casacivil.am.gov.br/imp\\_gov.php\\>.\nAcesso em: 19/11/2010, 7/12/2010.\n","ref":"**FONTES:** ABRANCHES, J. *Governos*; CÂM. DEP. *Deputados brasileiros*;\nCASA CIVIL AM. Disponível em: \\<www.casacivil.am.gov.br/imp\\_gov.php\\>.\nAcesso em: 19/11/2010, 7/12/2010.\n","dic":"DHBPR"}
