{"title":"SILVA, Domingos Sérgio Saboia e","cargoss":["Deputado federal"],"cargos_esp":[0],"datas_ini":[1900],"datas_fim":[1911],"estados":["CE"],"autor":[0],"content":"**SILVA, Domingos Sérgio Saboia e**\n\n\\*dep. fed. CE 1900-1911.\n\n*Domingos Sérgio Saboia e Silva* nasceu em Sobral (CE), filho do coronel\nDomingos José de Saboia e Silva e de Maria Clara de Saboia e Silva.\n\nFormou-se em engenharia e teve papel de destaque nas obras de construção\ndos portos de Santos (SP) e de Belém e na reforma do porto do Ceará. Foi\ntambém, em 1902, um dos idealizadores da ponte metálica que se tornaria\nponto turístico da cidade de Fortaleza.\n\nIngressando na política, foi eleito deputado federal pelo Ceará para a\nlegislatura 1900-1902. Assumiu sua cadeira na Câmara dos Deputados, no\nRio de Janeiro, então Distrito Federal, em maio de 1900 e foi reeleito\npara as três legislaturas seguintes. Exerceu o mandato até dezembro de\n1911.\n\nKleiton de Sousa Moraes\n\n**FONTES:** NOBRE, F. *1001* (p.358); STUDART, G. *Geographia*\n(p.230-231).\n","ref":"**FONTES:** NOBRE, F. *1001* (p.358); STUDART, G. *Geographia*\n(p.230-231).\n","dic":"DHBPR"}
