{"title":"SILVA, Francisco Augusto de Lima e","cargoss":["Ministro do Tribunal de Contas"],"cargos_esp":[0],"datas_ini":[1893],"datas_fim":[1894],"estados":[0],"autor":[0],"content":"**SILVA, Francisco Augusto de Lima e**\n\n\\*min. TCU 1893-1894.\n\n*Francisco Augusto de Lima e Silva* nasceu no Rio de Janeiro, então\ncapital do Império, no dia 16 de outubro de 1832, filho de Francisco\nAugusto de Lima e de Maria Rita Nóbrega.\n\nEntre 1851 e 1856 foi terceiro-escriturário da Contadoria Geral de\nGuerra. Na mesma Contadoria, foi segundo-escriturário de 1856 a 1858 e\nprimeiro-escriturário de 1858 a 1865. Nesse ano, durante a Guerra do\nParaguai (1864-1870), tornou-se chefe da Repartição Fiscal do Ministério\nda Guerra. Integrou o 9^o^ e, posteriormente, o 4^o^ Corpo de\nVoluntários da Pátria, nome dado aos corpos de soldados criados pelo\ngoverno brasileiro no início do conflito militar com o Paraguai. Em 1867\ne 1868, recebeu duas medalhas como membro da Força Expedicionária\nBrasileira. Além disso, por conta de sua participação na Guerra do\nParaguai, foi condecorado em 1870 com a medalha em forma de cruz e\npassador de ouro, e em 1873 recebeu honras de coronel do Exército. Foi\ntambém conselheiro do Império e recebeu a condecoração de cavaleiro da\nOrdem de Nosso Senhor Jesus Cristo.\n\nMesmo após a proclamação da República permaneceu na Contadoria Geral de\nGuerra, da qual foi diretor até 1893. Ainda nesse ano tornou-se diretor\ngeral da Contabilidade do Tesouro Nacional e tomou posse, em 17 de\njaneiro, como ministro do Tribunal de Contas da União (TCU). O tribunal,\ncriado pelo Decreto n^o^ 966-A, de 7 de novembro de 1890, por iniciativa\ndo então ministro da Fazenda, Rui Barbosa, e norteado pelos princípios\nda autonomia, fiscalização, julgamento, vigilância e energia, foi\ninstitucionalizado definitivamente pela Constituição de 1891, ainda por\ninfluência de Rui Barbosa. Contudo, sua efetiva instalação só ocorreu em\n17 de janeiro de 1893, graças ao empenho de Serzedelo Correia, ministro\nda Fazenda do governo do presidente Floriano Peixoto (1891-1894).\nOriginariamente o TCU era responsável pelo exame, revisão e julgamento\nde todas as operações relacionadas à receita e à despesa da União. A\nConstituição de 1891 conferiu-lhe competência para liquidar as contas da\nreceita e da despesa e verificar sua legalidade antes de serem prestadas\nao Congresso Nacional.\n\nMembro da primeira leva de ministros do TCU, exerceu o cargo durante\ntodo o ano de 1893 e aposentou-se em 5 de maio de 1894.\n\nFaleceu em 9 de agosto de 1905.\n\nIzabel Pimentel da Silva\n\n**FONTES:** DORATIOTO, F. *Maldita*; TRIB. CONT. UNIÃO. Disponível em:\n\\<http://portal2.tcu.gov.br/portal/page/portal/TCU\\>; TRIB. CONT. UNIÃO.\n*Ministros do Tribunal.*\n","ref":"**FONTES:** DORATIOTO, F. *Maldita*; TRIB. CONT. UNIÃO. Disponível em:\n\\<http://portal2.tcu.gov.br/portal/page/portal/TCU\\>; TRIB. CONT. UNIÃO.\n*Ministros do Tribunal.*\n","dic":"DHBPR"}
