{"title":"SILVA, Francisco Xavier da","cargoss":["Presidente de associação ou confederação de empregados ou empregadores","Presidente de associação ou confederação de empregados ou empregadores","Presidente de associação ou confederação de empregados ou empregadores","Presidente de associação ou confederação de empregados ou empregadores","Senador"],"cargos_esp":[0,0,0,0,0],"datas_ini":[1908,1900,1894,1892,1916],"datas_fim":[1912,1904,1896,1893,1922],"estados":["PR","PR","PR","PR","PR"],"autor":["Luciana Pinheiro"],"content":"**SILVA, Francisco Xavier da**\n\n\\*pres. PR 1892-1893, 1894-1896, 1900-1904 e 1908-1912; sen. PR\n1916-1922.\n\n*Francisco Xavier da Silva* nasceu em Castro (PR) no dia 2 de abril de\n1838, filho de Davi Antônio Xavier da Silva e de Generosa de Monte\nCarmelo Xavier.\n\nDiplomado em 1860 pela Faculdade de Direito de São Paulo, retornou ao\nParaná e assumiu o cargo de juiz municipal na comarca de seu município\nnatal. Ingressou na política ainda durante o Império, ao assumir o cargo\nde intendente municipal de Castro de 1877 a 1881. Após a instauração do\nregime republicano (15/11/1889), do qual se tornou entusiasta, foi\nnovamente nomeado intendente de Castro e manteve-se no comando da cidade\naté 1891.\n\nEm 25 de fevereiro de 1892 tomou posse no governo do Paraná em\nsubstituição à junta governativa formada por Roberto Ferreira, Bento\nJosé Lamenha Lins e Joaquim Monteiro de Carvalho e Silva, que governava\no estado desde 29 de novembro de 1891. Em abril de 1893 afastou-se do\ngoverno por motivo de doença, sendo substituído, de início, pelo vice\nVicente Machado da Silva Lima. Sucederam-se vários presidentes nomeados\n– Teófilo Soares Gomes, João Meneses Dória, Francisco José Cardoso\nJúnior, Tertuliano Teixeira de Freitas e Antônio José Ferreira Braga –\naté que, em meados de 1894, Vicente Machado da Silva Lima reassumiu o\ngoverno para logo depois transmiti-lo ao titular. Governou até 25 de\nfevereiro de 1896, quando tomou posse o sucessor José Pereira dos Santos\nAndrade.\n\nVoltou a assumir a presidência do Paraná em 25 de fevereiro de 1900,\nsucedendo agora a José Pereira dos Santos Andrade. Durante seu segundo\ngoverno manteve as prioridades do primeiro e investiu em obras públicas,\nsobretudo na construção de prédios escolares e na ampliação de estradas.\nAlém disso, criou políticas de incentivo à imigração e investiu em\natividades agrícolas. Em 25 de fevereiro de 1904 transmitiu o cargo a\nVicente Machado da Silva Lima.\n\nLíder carismático no Paraná, em 1908 iniciou sua terceira e última\npassagem pela presidência do estado. Em 25 de fevereiro assumiu o\ngoverno o vice-presidente Manuel de Alencar Guimarães, que lhe\ntransmitiu o poder em 26 de abril. Governou até o fim do quadriênio, em\n25 de fevereiro de 1912, quando tomou posse Carlos Cavalcanti de\nAlbuquerque.\n\nVoltou a exercer cargo eletivo em 1916, quando, no curso da legislatura\n1915-1917, foi eleito senador pelo Paraná. Ocupou uma cadeira no Senado\nFederal até a data de sua morte, tornando-se conhecido como um político\naustero e comedido no tocante ao gasto de dinheiro público.\n\nFaleceu no Rio de Janeiro em 11 de junho de 1922.\n\nLuciana Pinheiro\n\n**FONTES:** ARQ. PUB. PR. Disponível em:\n\\<www.arquivopublico.pr.gov.br/\\>. Acesso em: 12/10/2010; CASA CIVIL PR.\nDisponível em: \\<www.casacivil.pr.gov.br/\\>. Acesso em: 12/10/2010;\nPLANALTO. Disponível em: \\<www.planalto.gov.br/\\>. Acesso em:\n12/10/2010; SENADO. Disponível em: \\<www.senado.gov.br/\\>. Acesso em:\n12/10/2010.\n","ref":"**FONTES:** ARQ. PUB. PR. Disponível em:\n\\<www.arquivopublico.pr.gov.br/\\>. Acesso em: 12/10/2010; CASA CIVIL PR.\nDisponível em: \\<www.casacivil.pr.gov.br/\\>. Acesso em: 12/10/2010;\nPLANALTO. Disponível em: \\<www.planalto.gov.br/\\>. Acesso em:\n12/10/2010; SENADO. Disponível em: \\<www.senado.gov.br/\\>. Acesso em:\n12/10/2010.\n","dic":"DHBPR"}
