{"title":"SILVA, José Joaquim Monteiro da","cargoss":["Senador","Deputado federal"],"cargos_esp":[0,0],"datas_ini":[1888,1891],"datas_fim":[1889,1893],"estados":["MG","MG"],"autor":["Luciana Pinheiro"],"content":"**SILVA, José Joaquim Monteiro da**\n\n\\*sen. MG 1888-1889; dep. fed. MG 1891-1893\n\n*José Joaquim Monteiro da Silva*, futuro *barão de Santa Helena*, nasceu\nna paróquia de Brumado (MG) no dia 27 de agosto de 1827, filho de\nProtásio Antônio da Silva e de Ana Helena Monteiro de Castro.\n\nCursou humanidades em Congonhas do Campo, dedicando-se posteriormente às\natividades de fazendeiro e banqueiro. Em 1867 recebeu o título de barão\ndo governo imperial, e em 1881 foi eleito vereador em Juiz de Fora (MG)\ncom mandato de três anos. Foi então escolhido presidente da Câmara e\nagente executivo municipal. Em 1885 foi nomeado vice-presidente da\nprovíncia de Minas e em 1888 tornou-se senador vitalício, cargo que\nexerceu por pouco tempo, em decorrência do final do Império.\n\nApós a instauração da República em novembro de 1889, voltou a exercer\ncargo eletivo em 1891, quando foi eleito deputado federal por Minas\nGerais. Tomou posse na Câmara dos Deputados, no Rio de Janeiro, então\nDistrito Federal, em maio do mesmo ano e exerceu o mandato até dezembro\nde 1893. Após o término de seu mandato, assumiu a presidência do Banco\nde Crédito Real de Minas Gerais, do qual foi um dos fundadores.\nManteve-se na gestão dessa instituição financeira até falecer.\n\nAo longo de sua trajetória participou ativamente da criação da Estrada\nde Ferro União Mineira, da qual foi diretor. Entre as condecorações que\nrecebeu destacam-se a comenda da Ordem de Cristo e a patente de coronel\nda Guarda Nacional.\n\nFaleceu em Juiz de Fora no dia 30 de outubro de 1897.\n\nCasou-se, em primeiras núpcias, com Francisca Monteiro de Barros e,\nposteriormente, com Maria Teresa Monteiro de Castro.\n\nLuciana Pinheiro\n\n**FONTES:** CÂM. DEP. *Deputados brasileiros* (p.154); CÂM. MUN. JUIZ DE\nFORA. Disponível em: \\<http://isal.camarajf.mg.gov.br\\>. Acesso em:\n25/8/2010; MONTEIRO, N. *Dicionário* (v.2, p.652-653).\n","ref":"**FONTES:** CÂM. DEP. *Deputados brasileiros* (p.154); CÂM. MUN. JUIZ DE\nFORA. Disponível em: \\<http://isal.camarajf.mg.gov.br\\>. Acesso em:\n25/8/2010; MONTEIRO, N. *Dicionário* (v.2, p.652-653).\n","dic":"DHBPR"}
