{"title":"SILVA, José Moreira Alves da","cargoss":["Presidente de associação ou confederação de empregados ou empregadores","Presidente de associação ou confederação de empregados ou empregadores","Presidente de associação ou confederação de empregados ou empregadores","Deputado federal"],"cargos_esp":[0,0,0,0],"datas_ini":[1885,1886,1888,1897],"datas_fim":[1886,1887,1889,1906],"estados":["RN","AL","MA","PE"],"autor":["Raimundo Helio Lopes"],"content":"**SILVA, José Moreira Alves da**\n\n\\*pres. RN 1885-1886; pres. AL 1886-1887; pres. MA 1888-1889; dep. fed.\nPE 1897-1906.\n\n*José Moreira Alves da Silva* nasceu no município de Escada (PE) no dia\n28 de novembro de 1850.\n\nFormou-se pela Faculdade de Direito do Recife e iniciou sua vida\npolítica ainda durante o Império, quando ingressou no Partido\nConservador. Foi deputado provincial em Pernambuco na legislatura\n1876-1878 e, nos últimos anos do Império, por influência de seu partido,\nassumiu a presidência de várias províncias: do Rio Grande do Norte, de\n1885 até outubro de 1886, de Alagoas, de 1886 a setembro de 1887, e do\nMaranhão, de abril de 1888 a junho de 1889.\n\nDepois da proclamação da República (15/11/1889), aderiu ao movimento\nrepublicano e em 1891 foi nomeado notário público na cidade de Recife.\nEleito deputado estadual, exerceu o mandato de 1892 a 1893. Em 1897 foi\neleito deputado federal e, várias vezes reeleito, ocupou uma cadeira na\nCâmara dos Deputados, no Rio de Janeiro, então Distrito Federal, até o\nano de 1906. Depois disso, foi nomeado desembargador no território do\nAcre.\n\nFaleceu no Acre no dia 8 de maio de 1909.\n\nRaimundo Helio Lopes\n\n**FONTES:** ABRANCHES, J. *Governos*; CÂM. DEP. *Deputados brasileiros.*\n","ref":"**FONTES:** ABRANCHES, J. *Governos*; CÂM. DEP. *Deputados brasileiros.*\n","dic":"DHBPR"}
