{"title":"SILVA, Luís Antônio Domingues da","cargoss":["Deputado Geral","Deputado federal","Presidente de associação ou confederação de empregados ou empregadores","Deputado federal"],"cargos_esp":[0,0,0,0],"datas_ini":[1886,1892,1910,1915],"datas_fim":[1889,1910,1914,1922],"estados":["MA","MA","MA","MA"],"autor":["Raimundo Helio Lopes"],"content":"**SILVA, Luís Antônio Domingues da**\n\n\\*dep. geral MA 1886-1889; dep. fed. MA 1892-1910; pres. MA 1910-1914;\ndep. fed. MA 1915-1922.\n\n*Luís Antônio Domingues da Silva* nasceu na cidade de Turiaçu (MA) no\ndia 11 de junho de 1862, filho de Francisco Domingues da Silva e de\nAntônia de Oliveira Domingues da Silva. Seu avô paterno, homônimo de seu\npai, foi ministro do Supremo Tribunal de Justiça durante o Império. Seu\ntio foi o barão de Tromaí, e seu irmão José Domingues da Silva foi\npresidente do Instituo Histórico e Geográfico do Maranhão.\n\nFez os estudos iniciais no Internato Pernambucano e logo depois\ningressou na Faculdade de Direito do Recife, onde se formou bacharel em\n1883. Ainda estudante iniciou-se na política sob a influência do barão\nde Tromaí, defendendo a causa abolicionista e trabalhando como redator\nnos periódicos *O Abolicionista* e *Revista Acadêmica*.\n\nEm 1884 candidatou-se pela primeira vez a deputado geral pelo Maranhão.\nFoi derrotado pelo conselheiro Almeida de Oliveira por uma pequena\nmargem de votos, mas conseguiu se eleger deputado provincial pelo\nPartido Conservador. Foi afinal eleito deputado geral, e\nconcomitantemente reeleito deputado provincial, com mandato de 1886 a\n1889, chegando a presidente da Assembleia Provincial.\n\nApós a proclamação da República, filiou-se ao Partido Católico, que\najudou a fundar ao lado do líder político e religioso João Tolentino\nGuedelha Mourão – o partido se fundiria depois com os partidos Nacional\ne Republicano Constitucional. Em 1892 foi eleito deputado federal,\njuntamente com Benedito Pereira Leite e Cristino Cruz, depois da\nanulação dos diplomas de Damaso Pereira, do barão do Alto Mearim e do\npadre Joaquim Sampaio Castelo Branco. Foi reeleito sucessivas vezes até\na legislatura 1909-1911, quando renunciou para assumir o governo do\nestado do Maranhão.\n\nSua chegada ao governo do estado ocorreu em um conturbado momento da\npolítica maranhense no qual atuou significativamente. O vice-presidente\nestadual Artur Quadros Colares Moreira assumira o governo do Maranhão em\n25 de maio de 1908, em virtude do afastamento do titular Benedito Leite\npara tratamento de saúde. Em 25 de fevereiro de 1909 Colares Moreira\nviajou para a Paraíba e para o Rio de Janeiro, então Distrito Federal,\npara tratar de assuntos particulares e políticos, visando às próximas\neleições estaduais, e foi substituído pelo presidente da Assembleia\nLegislativa, Mariano Martins Lisboa Neto. Quando Colares regressou a São\nLuís, em 12 junho, o presidente em exercício recusou-se a entregar-lhe o\ngoverno, afirmando que havia perdido o mandato ao se ausentar do estado\nsem autorização do Poder Legislativo. A contenda só foi resolvida com a\nintervenção de políticos importantes no cenário nacional, como Nilo\nPeçanha e Pinheiro Machado. Ficou decidido então que Mariano Martins\nLisboa Neto renunciaria à presidência do Congresso estadual e Artur\nQuadros Colares Moreira à vice-presidência do estado, passando o governo\nem 29 de junho de 1909 às mãos do novo chefe do Legislativo estadual,\nAmérico Vespúcio Reis.\n\nDurante toda essa disputa, Luís Antônio Domingues da Silva teve papel\nrelevante, articulando no Rio de Janeiro e no Maranhão o fim das\ntensões. Assim, nas eleições seguintes, foi eleito presidente do estado\ncomo candidato único, e em 1^o^ de março de 1910 recebeu o governo das\nmãos do interino Frederico de Sá Filgueiras. Fez uma administração\nmarcada por empréstimos importantes para sanar dívidas estaduais, por\nbenefícios à lavoura e por melhorias nas estradas de ferro e na\nnavegação fluvial. No campo educacional, restabeleceu a Escola de\nEducandos Artífices, reformou o Liceu Maranhense e a Escola Modelo\nBenedito Leite, e criou a Inspetoria Geral da Instrução Pública. Comprou\nainda para o estado a coleção artística de Artur Azevedo, teatrólogo,\njornalista e contista maranhense renomado nacionalmente. Encerrou seu\ngoverno em 1^o^ de março de 1914, quando teve início o de Herculano Nina\nParga.\n\nDepois de ter sido presidente do estado, foi novamente eleito deputado\nfederal pelo Maranhão em 1915, e sucessivamente reeleito até a\nlegislatura 1921-1923. Na Câmara dos Deputados, foi membro da Comissão\nde Constituição e Justiça e da Comissão Especial do Código Civil, na\nqual atuou nos capítulos sobre posse e propriedade. Também representou a\nCâmara dos Deputados no Congresso Jurídico Americano.\n\nAlém da política, exerceu por muitos anos a advocacia e dirigiu negócios\nda família. No campo jornalístico, escreveu no periódico *A Cruzada*,\nórgão do Partido Católico do Maranhão. Também foi membro da Academia\nMaranhense de Letras.\n\nFaleceu na cidade de São Luís no dia 11 de julho de 1922.\n\nFoi casado com Aureliana de Viveiros Coqueiro, filha de João Antônio\nCoqueiro, diretor Colégio Pedro II, no Rio de Janeiro, entre os anos de\n1901 e 1905.\n\nPublicou os seguintes folhetos: *Ensino agrícola – discurso na\nAssembleia Provincial do Maranhão* (1885), *Casamento civil e divórcio*,\n*Aos meus amigos mineiros – discurso no banquete oferecido à bancada\nmineira*, *Elementos para a resposta da Comissão da Câmara dos Deputados\nao senador Rui Barbosa* e *Carta aberta ao general Pinheiro Machado\nsobre o empréstimo externo do Maranhão*. A seu respeito, Virgílio\nDomingues Filho publicou *Vida e obra de Luís Domingues* (1982). Elevada\na município em 1961, a vila Carutapera recebeu o nome de Luís Domingues\nem sua homenagem.\n\nRaimundo Helio Lopes\n\n**FONTES:** ABRANCHES, J. *Governos*; DOMINGUES FILHO, V. *Vida*;\nMARQUES, C. *Dicionário*; MEIRELES, M. *História.*\n","ref":"**FONTES:** ABRANCHES, J. *Governos*; DOMINGUES FILHO, V. *Vida*;\nMARQUES, C. *Dicionário*; MEIRELES, M. *História.*\n","dic":"DHBPR"}
