{"title":"SIMAS, Fernando","cargoss":["Deputado federal"],"cargos_esp":[0],"datas_ini":[1891],"datas_fim":[1893],"estados":["PR"],"autor":["Luciana Pinheiro"],"content":"**SIMAS, Fernando**\n\n\\*dep. fed. PR 1891-1893.\n\n*Fernando Machado Simas* nasceu em Paranaguá (PR) no dia 24 de abril de\n1851, filho de Manuel Inácio de Simas e de Helena Gutierrez Simas.\n\nApós concluir o curso de humanidades em Curitiba, transferiu-se para o\nRio de Janeiro, então capital do Império, e diplomou-se em farmácia pela\nFaculdade de Medicina. Como farmacêutico, atuou no Rio, em Petrópolis\n(RJ) e em diversos municípios paranaenses, entre os quais Curitiba e\nParanaguá, onde fundou a Farmácia Simas. Ainda nos tempos imperiais foi\nentusiasta da causa abolicionista, propalada através do periódico *Livre\nParaná*, do qual foi fundador.\n\nRepublicano ferrenho, após a instauração da República foi um dos sete\nnomes escolhidos pelo presidente do estado do Rio de Janeiro, em agosto\nde 1890, para compor o Conselho da Intendência de Petrópolis, que tinha\nentre suas principais incumbências organizar as eleições para a primeira\nCâmara Municipal eleita no período republicano. Já após a promulgação da\nConstituição de 24 de fevereiro de 1891, foi eleito deputado federal\npelo Paraná, com mandato de maio de 1891 a dezembro de 1893. Encerrada a\nlegislatura manteve-se na capital federal, onde deu continuidade ao seu\ntrabalho à frente da Farmácia Simas.\n\nAlém de farmacêutico, jornalista e político, trabalhou como naturalista\ndo Jardim Botânico do Rio de Janeiro. Foi também membro da Academia\nParanaense de Letras.\n\nFaleceu no Rio de Janeiro, então Distrito Federal, em 17 de setembro de\n1916.\n\nLuciana Pinheiro\n\n**FONTES:** ACAD. PARANAENSE DE LET. Disponível em:\n\\<www.academiapr.org.br/\\>. Acesso em: 22/6/2010; CÂM. DEP. *Deputados\nbrasileiros* (p.82); CÂM. MUN. PETRÓPOLIS. Disponível em:\n\\<www.cmp.rj.gov.br/\\>. Acesso em: 22/6/2010; NICOLAS, M. *Cem anos*\n(p.20-21).\n","ref":"**FONTES:** ACAD. PARANAENSE DE LET. Disponível em:\n\\<www.academiapr.org.br/\\>. Acesso em: 22/6/2010; CÂM. DEP. *Deputados\nbrasileiros* (p.82); CÂM. MUN. PETRÓPOLIS. Disponível em:\n\\<www.cmp.rj.gov.br/\\>. Acesso em: 22/6/2010; NICOLAS, M. *Cem anos*\n(p.20-21).\n","dic":"DHBPR"}
