{"title":"ACIÓLI JÚNIOR, João Batista","cargoss":["Deputado federal","Governador de estado ou do Distrito Federal","Senador"],"cargos_esp":[0,0,0],"datas_ini":[1912,1915,1927],"datas_fim":[1914,1918,1928],"estados":["AL","AL","AL"],"autor":[0],"content":"**ACIÓLI JÚNIOR, João Batista**\n\n\\* dep. fed. AL 1912-1914;gov. AL 1915-1918; sen. AL 1927-1928.\n\n*João Batista Acióli Júnior* nasceu em Maragogi(AL) no dia 19 de agosto\nde 1877,filho de João Batista Acióli e deAntônia Vieira Acióli.\n\nFez o curso primário no interiorde Pernambuco, o secundário em Recife,e\nestudou engenharia civil na Escola Politécnicado Rio de Janeiro, então\nDistrito Federal.Formado em 1900, retornou a Alagoas eaí se dedicou à\nagricultura, em especialà cultura da cana-de-açúcar e à\nindústriaaçucareira, dirigindo o engenho Maçangano, desua família.\n\nNa política de Alagoas, destacou-sepela oposição à oligarquia dominante,\nchefiadapor Euclides Malta, que governou o estadode 1900 a 1903 e de\n1906 a1912. Deputado federal na legislatura 1912-1914,em 12 de março de\n1915 elegeu-segovernador de Alagoas, pelo Partido Democrático,sucedendo\na Clodoaldo da Fonseca. Suaeleição teve como base um acordo\npolíticocujos efeitos duraram menos do que seesperava. Empossado em 12\nde junho seguinte,teve o primeiro ano de governo prejudicadopela\ntentativa de intervenção federal incitadapelos conservadores, que\nafirmavam ser AntônioGuedes Nogueira o candidato eleito.\n\nEm sua gestão – na qualfoi festejado o centenário de Alagoas,em 1917 –\ncuidou da recuperação dasfinanças estaduais, com severa redução\ndedespesas, além de manter o respeito àsdecisões da Justiça, inclusive\nna integraçãode funcionários públicos demitidos no governoanterior.\nTambém em 1917 assinou com umaempresa particular um contrato para\naexploração do petróleo alagoano, por meioda destilação do xisto\nbetuminoso. Terminouo governo desligado do partido políticoque o\nelegera. Seu sucessor, em 12de junho de 1918, foi José Fernandesde\nBarros Lima.\n\nApós 1918, regressou à atividadeagrícola, dedicando-se também à pecuária\neà cultura do coco. Em 1927 elegeu-sesenador. Assumiu sua cadeira no\nSenadoem abril do mesmo ano e faleceuem Maragogi no dia 9 de novembrode\n1928, em pleno exercício do mandato.\n\nPublicou *Pobre Alagoas! Ao país –- documentação comentada* (1922) e\n*Política de Alagoas. Resposta ao senador Fernandes Lima* (1927).\n\nReynaldo de Barros\n\n**FONTES:**ACIOLY JÚNIOR, J. *Mensagem*;ACIOLY JÚNIOR, J. *Mensagem\napresentada*; ACIOLYJÚNIOR, J. *Mensagem dirigida*; BARROS, F. *A B C\ndas Alagoas.*\n","ref":"**FONTES:**ACIOLY JÚNIOR, J. *Mensagem*;ACIOLY JÚNIOR, J. *Mensagem\napresentada*; ACIOLYJÚNIOR, J. *Mensagem dirigida*; BARROS, F. *A B C\ndas Alagoas.*\n","dic":"DHBPR"}
