{"title":"SOARES, Cláudio Oscar","cargoss":["Deputado federal"],"cargos_esp":[0],"datas_ini":[1918],"datas_fim":[1930],"estados":["PB"],"autor":["Raimundo Helio Lopes"],"content":"**SOARES, Cláudio Oscar**\n\n\\*dep. fed. PB 1918-1930.\n\n*Cláudio Oscar Soares* foi eleito deputado federal pelo estado da\nParaíba em 1918. Assumiu sua cadeira na Câmara dos Deputados, no Rio de\nJaneiro, então Distrito Federal, em maio desse ano, e foi sucessivamente\nreeleito até 1930. Em outubro desse ano teve o mandato interrompido com\na vitória da Revolução de 1930 que levou Getúlio Vargas ao poder e\nextinguiu todos os órgãos legislativos do país.\n\nFoi também sócio do Instituto Histórico e Geográfico Paraibano.\n\nRaimundo Helio Lopes\n\n**FONTES:** CÂM. DEP. *Deputados brasileiros*; INST. HIST. GEO.\nPARAIBANO. Disponível em: \\<www.ihgp.net\\>. Acesso em: 13/1/2011.\n","ref":"**FONTES:** CÂM. DEP. *Deputados brasileiros*; INST. HIST. GEO.\nPARAIBANO. Disponível em: \\<www.ihgp.net\\>. Acesso em: 13/1/2011.\n","dic":"DHBPR"}
