{"title":"SOARES, Macedo","cargoss":["Ministro do Supremo Tribunal Federal"],"cargos_esp":[0],"datas_ini":[1892],"datas_fim":[1905],"estados":[0],"autor":["Eduardo Junqueira"],"content":"**SOARES, Macedo**\n\n\\*magistrado; min. STF 1892-1905.\n\n*Antônio Joaquim de Macedo Soares* nasceu em Maricá (RJ) no dia 14 de\njaneiro de 1838, filho de Joaquim Mariano de Azevedo Soares e de Maria\nde Macedo Soares.\n\nFez os estudos preparatórios no Seminário Episcopal do Rio de Janeiro,\nde onde saiu em 1855. Sem vocação para os estudos religiosos,\nmatriculou-se na Faculdade de Direito de São Paulo, recebendo, em 1861,\no grau de bacharel em ciências jurídicas e sociais. Depois de formado\ndedicou-se ao jornalismo e à literatura, notabilizando-se por sua\ncrítica ao romantismo brasileiro, além de advogar no interior da\nprovíncia do Rio de Janeiro. Em dezembro de 1862 foi nomeado juiz\nmunicipal e de órfãos dos termos reunidos de Saquarema e Araruama, na\nprovíncia fluminense, e em 1874 foi designado juiz de direito da comarca\nde São José e Campo Largo, na província do Paraná. Abolicionista e\nsimpático à ideia republicana, em 1876 foi removido para a comarca de\nMar de Espanha, em Minas Gerais, ali permanecendo até 1882, quando se\ntransferiu para a comarca de Cabo Frio, no Rio de Janeiro. Finalmente,\nassumiu a 2^a^ vara comercial da Corte, em 1886. Aí se encontrava em\nnovembro de 1889, quando foi proclamada a República.\n\nCom a reorganização da Justiça pelo governo provisório do novo regime,\nfoi nomeado, em novembro de 1890, juiz da Corte de Apelação do Distrito\nFederal, tribunal de segunda instância que sucedeu à antiga Relação do\nImpério. Permaneceu no cargo até 1892, quando foi nomeado ministro do\nSupremo Tribunal Federal (STF). Faleceu na cidade do Rio de Janeiro,\nentão Distrito Federal, no dia 14 de agosto de 1905, no exercício de\nsuas funções no STF.\n\nFoi casado com Teodora Álvares de Azevedo.\n\nJurisconsulto erudito, dono de grande cultura, publicou obras não só no\ncampo do direito civil e comercial, sua especialidade jurídica, como\ntambém compêndios de história e filologia, crítica literária,\ngenealogias de famílias fluminenses e estudos sobre literatura, além de\naventurar-se no domínio da composição musical. Notabilizou-se por\nelaborar, em seu tempo, a análise mais acurada da obra romântica de\nGonçalves Dias, além de outros poetas menores como Teixeira de Melo e\nBittencourt Sampaio. Firmou-se assim como um dos críticos mais\npenetrantes da segunda metade do século XIX, o que permitiu que muitos o\nvissem como um antecipador, em pleno período romântico, do realismo no\nâmbito da crítica literária, cuja contribuição para o projeto de uma\nliteratura nacional não se deixou influenciar pelo ufanismo de seus\ncontemporâneos. De sua imensa obra, destacam-se o artigo “Da crítica\nbrasileira”, publicado na *Revista Popular* em 1860, *Nobiliarquia\nfluminense* (1874), *Dicionário brasileiro de língua portuguesa* (1889)\ne o manuscrito intitulado “Campanha jurídica pela libertação dos\nescravos”, que veio a público em 1938.\n\nEduardo Junqueira\n\n**FONTES:** BAUMGARTEN, C. *Crítica*; MATTOSO, P. *Supremo Tribunal;*\nMELLO FILHO, J. *Notas*; RODRIGUES, L. *História*; SUP. TRIB. FED.\nDisponível em: \\<www.stf.jus.br/portal/ministros\\>.\n","ref":"**FONTES:** BAUMGARTEN, C. *Crítica*; MATTOSO, P. *Supremo Tribunal;*\nMELLO FILHO, J. *Notas*; RODRIGUES, L. *História*; SUP. TRIB. FED.\nDisponível em: \\<www.stf.jus.br/portal/ministros\\>.\n","dic":"DHBPR"}
