{"title":"SODRÉ, Antônio Cândido","cargoss":["Deputado federal"],"cargos_esp":[0],"datas_ini":[1897],"datas_fim":[1900],"estados":["RS"],"autor":["Raimundo Helio Lopes"],"content":"**SODRÉ, Antônio Cândido**\n\n\\*dep. fed. RS 1897-1900.\n\n*Antônio Cândido de Azevedo Sodré* nasceu em Maricá (RJ), filho do\ncapitão José Paulo de Azevedo Sodré e de Cândida de Azevedo Sodré.\n\nFormou-se em engenharia pela Escola Politécnica do Rio de Janeiro, então\ncapital do Império. Depois de formado, tornou-se diretor de Obras\nPúblicas no estado de São Paulo. Após alguns anos, mudou-se para o Rio\nGrande do Sul para assumir a direção da estrada de ferro que ligava\nPorto Alegre a Uruguaiana.\n\nNesse estado, iniciou sua trajetória política, filiando-se ao Partido\nRepublicano Rio-Grandense (PRR), liderado por Júlio de Castilhos, em\ncuja legenda foi eleito deputado federal pelo Rio Grande do Sul em\njaneiro de 1897. Assumindo, em maio desse ano, sua cadeira na Câmara dos\nDeputados no Rio de Janeiro, agora Distrito Federal, foi reeleito em\njaneiro de 1900, mas, cerca de um mês após o início da legislatura,\nfaleceu no Rio de Janeiro em 17 de junho desse ano.\n\nEra casado com Helenita Ferreira Porto. Seu filho, Alcindo de Azevedo\nSodré, foi jornalista, historiador, idealizador e primeiro diretor do\nMuseu Imperial de Petrópolis, vereador e prefeito interino dessa cidade\nnos anos de 1923, 1939 e 1945.\n\nRaimundo Helio Lopes\n\n**FONTES:** ABRANCHES, J. *Governos*; AITA, C.; AXT, G.; ARAÚJO, V.\n*Parlamentares*; CÂM. DEP. *Deputados brasileiros*; Mundia, Disponível\nem: \\<www.mundia.com/br/Person/27181860/2009087946\\>. Acesso em:\n17/1/2012; Registro de casamento da Catedral (livro 10, p.11).\nDisponível no Arquivo Público de Porto Alegre.\n","ref":"**FONTES:** ABRANCHES, J. *Governos*; AITA, C.; AXT, G.; ARAÚJO, V.\n*Parlamentares*; CÂM. DEP. *Deputados brasileiros*; Mundia, Disponível\nem: \\<www.mundia.com/br/Person/27181860/2009087946\\>. Acesso em:\n17/1/2012; Registro de casamento da Catedral (livro 10, p.11).\nDisponível no Arquivo Público de Porto Alegre.\n","dic":"DHBPR"}
