{"title":"SODRÉ, Feliciano","cargoss":["Presidente de associação ou confederação de empregados ou empregadores","Senador"],"cargos_esp":[0,0],"datas_ini":[1923,1928],"datas_fim":[1927,1930],"estados":["RJ","RJ"],"autor":["Raimundo Helio Lopes"],"content":"**SODRÉ, Feliciano**\n\n\\*militar; pres. RJ 1923-1927; sen. RJ 1928-1930.\n\n*Feliciano Pires de Abreu Sodré Júnior* nasceu em Macaé (RJ) no dia 30\nde setembro de 1881, filho de Feliciano Pires Abreu Sodré e de Carolina\nAlves de Abreu Sodré.\n\nIngressou no Exército como voluntário quando se alistou nas forças\nfederais que combatiam na Guerra de Canudos, rebelião popular de cunho\nmessiânico liderada por Antônio Conselheiro iniciada no sertão baiano em\nnovembro de 1896. Durante o conflito, lutou no batalhão liderado por\nCláudio do Amaral Savaget, antigo integrante da junta governativa da\nParaíba (1891-1892). Foi ferido nos combates no sertão baiano e teve que\nretornar ao estado natal. Matriculou-se a seguir na Escola Militar da\nPraia Vermelha, no Rio de Janeiro, então Distrito Federal, onde fez os\ncursos de estado-maior e engenharia e bacharelou-se em matemática e\nciências físicas, em 1907. Permaneceria no Exército por vários anos,\nchegando a tenente-coronel em 1926.\n\nIniciou-se na política com a ajuda do então ministro da Guerra Hermes da\nFonseca (1906-1909), que o encarregou, como tenente-engenheiro, da\nconstrução do forte da cidade de Macaé, que seria inaugurado em 1910.\nCom esse trabalho, construiu uma base política no município e, em\ndezembro de 1909, foi eleito deputado estadual na legenda do Partido\nRepublicano Fluminense (PRF) para a legislatura que se iniciaria no ano\nseguinte. Sua eleição foi apoiada por Oliveira Botelho, então deputado\nfederal (1907-1910), importante aliado do então presidente da República\nNilo Peçanha (1909-1910) e candidato à presidência do estado do Rio na\nsucessão de Alfredo Backer (1906-1910). Mesmo ligado a Oliveira Botelho,\ne apesar de mostrar-se opositor de Alfredo Backer, principalmente após o\nrompimento deste com Nilo Peçanha, não era identificado como nilista. Em\nmarço de 1910, mesmo antes de assumir sua cadeira na Assembleia\nLegislativa do Rio de Janeiro (ALERJ), apoiou a eleição de Hermes da\nFonseca para a presidência da República (1910-1914).\n\nEm julho de 1910, assumiu sua cadeira na ALERJ e manteve-se ao lado de\nOliveira Botelho nas divergências envolvendo a eleição deste para a\npresidência estadual. Na ocasião se enfrentaram dois grupos de\nparlamentares: um ligado a Alfredo Backer, defensor da candidatura de\nManuel Edwiges Queirós Viana, e outro ligado a Nilo Peçanha e a seu\ncandidato Oliveira Botelho. O antagonismo entre as duas facções culminou\ncom a divisão da Assembleia Legislativa em duas, tendo cada qual\nproclamado a eleição de seu candidato no dia 10 de julho de 1910. Em\nconsequência dessa divisão, nos dias seguintes às eleições os dois\ngrupos acabaram deixando a capital do estado e retirando-se para\nPetrópolis. Prevendo a interferência do governo da União, o grupo fiel a\nBacker conseguiu um habeas corpus do Supremo Tribunal Federal (STF) que\nreconhecia sua legitimidade como assembleia. Não obstante, o governo\nfederal enviou tropas às repartições públicas, ao palácio do governo e à\nprópria Assembleia, e o Congresso passou a debater a intervenção\nfederal, terminando por autorizá-la. O impasse permanecia, e quando\nHermes da Fonseca assumiu a presidência da República (15/11/1910)\nencontrou o chamado “Caso Fluminense” nessa situação. Backer abandou o\npalácio do governo no final de dezembro, e o grupo que o apoiava deu\nposse ao candidato que elegera, Manuel Edwiges. No entanto, o governo\nfederal interveio, e a posse de Edwiges, realizada fora da Assembleia,\nfoi tornada sem efeito, sendo empossado o candidato Oliveira Botelho,\nsimpático a Hermes da Fonseca, no dia 31 de dezembro de 1910.\n\nEm 1911 Feliciano Sodré renunciou a seu mandato de deputado estadual\npara assumir a prefeitura de Niterói por nomeação de Oliveira Botelho e\npor indicação de Pinheiro Machado, senador gaúcho (1890-1915) e um dos\nprincipais nomes da política nacional. A partir desse momento, sua\nligação com Oliveira Botelho foi fortalecida, levando-os a permanecer\naliados em suas trajetórias políticas. Sua administração em Niterói,\nentre janeiro de 1911 e março de 1914, foi marcada pela tentativa de\nremodelação da cidade, com a construção de vilas operárias e novas vias,\nalém de melhorias no serviço de água e saneamento urbano. Essas obras\nforam apoiadas pelo governo estadual, o que gerou críticas por parte da\nimprensa.\n\nNa política, Sodré passou a integrar o Partido Republicano Conservador\nFluminense (PRCF), agremiação criada em fevereiro de 1911 a partir da\nfusão do PRF com o Partido Republicano Conservador (PRC), fundado por\nPinheiro Machado uma semana antes da posse de Hermes da Fonseca na\npresidência da República com o objetivo de promover a união das\noligarquias dominantes e dos militares em uma agremiação nacional que\napoiaria o novo governo. Com essa mudança, a sigla PRF ficou sendo\nutilizada pela oposição.\n\nEm 1914, Sodré candidatou-se à presidência do estado do Rio de Janeiro,\napoiado por Oliveira Botelho, Hermes da Fonseca e Pinheiro Machado. Com\nesse apoio, Oliveira Botelho, cada vez mais ligado a Hermes e a Pinheiro\nMachado no âmbito federal, rompeu com Nilo Peçanha, que não concordou\ncom a candidatura defendida pelo governo estadual, nem com a\ninterferência federal na política fluminense. Nilo Peçanha candidatou-se\nele próprio à presidência do estado, e o grupo nilista voltou a usar a\nsigla do PRF para sua candidatura.\n\nDurante a campanha eleitoral, Nilo Peçanha percorreu todo o estado\npromovendo comícios e teve como aliado o jornal carioca *Correio da\nManhã*, dirigido por Edmundo Bittencourt. Enquanto Feliciano Sodré\ntambém viajava procurando apoio das lideranças estaduais, Oliveira\nBotelho convocou a ALERJ para uma sessão extraordinária, na qual\npretendia derrubar a Mesa Diretora da casa, composta por políticos\nnilistas. Diante da ameaça, a oposição solicitou um habeas corpus\npreventivo junto ao STF, que, ao ser concedido em 6 de junho de 1914,\nprovocou a divisão da Assembleia em dois grupos: um apoiado pelo STF e\noutro pelos governos estadual e federal. Enquanto o primeiro buscava\ncontinuar a atividade legislativa, o segundo recusava-se a participar.\nNo dia 21 do mesmo mês, quando os nilistas conseguiram um quórum de 23\ndeputados para formar a sessão, os botelhistas reuniram-se em local\ndiferente, formando-se duas assembleias legislativas, a exemplo do que\nocorrera nas eleições estaduais de 1910.\n\nDepois do pleito de 12 de julho de 1914, os dois grupos se declararam\nvencedores e foram reconhecidos pelas respectivas assembleias. Em\noutubro, ainda como presidente da República, Hermes da Fonseca enviou\nmensagem à Câmara dos Deputados criticando a decisão do STF na disputa\neleitoral fluminense. Tal fato foi encarado como uma tentativa do\npresidente, apoiado por Pinheiro Machado, de intervir no estado do Rio\nde Janeiro. No entanto, como Hermes da Fonseca estava nos últimos dias\nde seu governo – que terminaria em 15 de novembro –, a Câmara não\naprovou a intervenção. Em 16 de dezembro, o STF homologou outro habeas\ncorpus garantindo a eleição de Nilo Peçanha para seu segundo mandato\ncomo presidente do estado do Rio (1914-1917). A contenda só foi\nresolvida quando o recém-empossado presidente da República, Venceslau\nBrás (1914-1918), assegurou a posse de Nilo Peçanha e colocou tropas à\ndisposição do juiz federal do estado. O presidente adotou tal medida em\nrespeito à posição do STF e devido à reaproximação política entre ele e\no novo presidente fluminense que, mesmo sem ter apoiado seu nome como\ncandidato à presidência da República, nunca se mostrara seu opositor.\nSegundo Mônica Kornis, “o apoio de Venceslau certamente expressava o\nreconhecimento do prestígio político de Nilo, mas também é possível que\ntenha pesado na decisão presidencial a rearticulação política do eixo\nMinas-São Paulo, que tinha como um dos seus objetivos o enfraquecimento\nde Pinheiro Machado, o grande sustentáculo de Feliciano Sodré e do\nantinilismo”.\n\nDepois dessa derrota, Feliciano Sodré continuou na política fluminense,\natuando ao lado de Oliveira Botelho na oposição ao segundo governo\nestadual de Nilo Peçanha e aos governos nilistas de Francisco Guimarães\n(1917), Agnelo Gerard Collet (1917-1918) e Raul Veiga (1918-1922). Em\n1919 a oposição ao nilismo fortaleceu-se após a vitória de Epitácio\nPessoa (1919-1922) no pleito presidencial. Como Nilo Peçanha apoiou o\ncandidato derrotado Rui Barbosa, a oposição estadual ganhou mais espaço\npolítico e teve mais força e recursos eleitorais, liderada,\nprincipalmente, por Feliciano Sodré e Oliveira Botelho. Em março de\n1922, o nilismo sofreu mais um forte abalo, com a derrota de Nilo\nPeçanha na eleição para a presidência da República na chapa da Reação\nRepublicana, e a vitória de Artur Bernardes (1922-1926). Depois dos\nsucessivos reveses na esfera federal, o nilismo entrou em derrocada.\n\nCom essa nova conjuntura, ainda em 1922 Feliciano Sodré concorreu\nnovamente à presidência do estado apoiado por Oliveira Botelho, contra o\ncandidato nilista Raul Fernandes. Foi candidato na legenda do PRF, já\nque esse partido abrigava a oposição ao nilismo desde 1920, quando Nilo\nPeçanha e seus aliados passaram a utilizar a sigla do Partido\nRepublicano do Rio de Janeiro (PRRJ). Em sua plataforma de governo,\ndestacaram-se as críticas às práticas políticas nilistas, as propostas\nde moralização dos processos eleitorais, e as promessas de melhoria dos\ntransportes, da educação e do crédito rural. Além disso, propunha uma\nnova alternativa econômica para o estado, com o investimento em\natividades ligadas ao desenvolvimento industrial e urbano, visando a\nconter o êxodo da população urbana fluminense.\n\nO pleito realizado em 9 de julho de 1922 foi marcado pelo estado de\nsítio decretado no estado do Rio de Janeiro e no Distrito Federal devido\nà revolta irrompida em 5 de julho na Vila Militar, na Escola Militar do\nRealengo e no Forte de Copacabana. O movimento, que envolveu também a\nguarnição de Mato Grosso e iniciou o ciclo das revoltas tenentistas da\ndécada de 1920, foi deflagrado em protesto contra a eleição de Artur\nBernardes para a presidência da República e as punições impostas pelo\ngoverno Epitácio Pessoa aos militares, com o fechamento do Clube Militar\ne a prisão do marechal Hermes da Fonseca.\n\nRealizada a apuração da eleição fluminense, ambas as chapas\nconcorrentes, alegando fraude na contagem de votos do oponente,\nproclamaram eleitos os seus candidatos. A oposição nilista, derrotada no\npleito, pretendia comparecer à seção de reconhecimento e rebelar-se\ncontra a diplomação dos novos parlamentares. Tentando evitar essa\nmanifestação, no dia 17 as forças situacionistas colocaram tropas da\npolícia no prédio da ALERJ, para impedir o ingresso de seus opositores.\nDiante disso, estes ocuparam o prédio da Câmara Municipal de Niterói e\nformaram outra Assembleia, declarando-se o verdadeiro Poder Legislativo\nestadual.\n\nJá que o reconhecimento do presidente do estado era da competência da\nAssembleia, a dualidade de assembleias ensejou a dualidade de governos.\nOs nilistas temiam que o novo presidente Artur Bernardes decretasse a\nintervenção federal no estado do Rio e por isso apresentaram ao STF um\npedido de habeas corpus que assegurasse a posse de seu candidato.\nAtendido o pedido, Raul Fernandes foi investido na presidência do\nestado, recebendo o cargo de Raul Veiga, no dia 31 de dezembro de 1922.\nEntretanto, Feliciano Sodré também foi empossado por “sua” assembleia no\nmesmo dia. Logo depois, com a cobertura do governo federal, os\npartidários de Feliciano Sodré depuseram prefeitos adversários e\nfecharam câmaras municipais sob o controle dos nilistas. Enquanto isso\nacontecia, a Polícia Militar se recolheu aos quartéis, declarando só\nacatar ordens do governo central. Alegando a duplicidade de poderes no\nRio de Janeiro, Artur Bernardes decretou a intervenção federal no estado\ne entregou o Executivo fluminense a Aurelino Leal em 10 de janeiro de\n1923. O interventor anulou as eleições e marcou outras para meses\ndepois.\n\nFeliciano Sodré angariou o apoio do interventor e foi eleito presidente\ndo estado do Rio de Janeiro em 28 de outubro de 1923. Nesse pleito, os\nnilistas não apresentaram candidatos ao Executivo nem ao Legislativo\nestadual. Durante seu governo, Feliciano Sodré procurou estabelecer suas\npróprias bases políticas, buscando o apoio dos grandes estados do país,\natravés da adesão à política de defesa do café. Seu governo foi também\nmarcado pela tentativa de dar mais autonomia ao estado do Rio em relação\nao Distrito Federal, que possuía maior preponderância econômica. Sua\nprincipal estratégia foi a construção do porto e a criação da alfândega\nem Niterói, obras que mesmo com todo o empenho do governo não entraram\nem funcionamento efetivo durante a Primeira República.\n\nNas eleições federais de 1924, Feliciano Sodré apoiou a eleição de toda\na chapa do PRF, enquanto o PRRJ não conseguiu eleger nenhum candidato.\nEm 1926 apoiou a candidatura de Washington Luís à presidência da\nRepública (1926-1930) e lançou, para a sucessão estadual, Manuel Duarte,\ndeputado federal desde 1924. A eleição de seu candidato teve apoio de\nparte dos nilistas, chamados nesse momento de “nilistas acordistas” e\nque se autodesignaram “membros dissidentes do PRRJ”. Os termos do acordo\nentre as duas facções previam o apoio mútuo nas eleições de 1927:\nenquanto os nilistas apoiariam o candidato de Feliciano Sodré nas\neleições para o Executivo estadual, o PRF garantiria a representação da\noposição nas eleições para os Legislativos federal e estadual. Com esse\nacordo, parte dos nilistas voltou a ocupar cargos públicos.\n\nCom o apoio dos nilistas, Manuel Duarte foi eleito presidente do estado\ndo Rio de Janeiro no pleito de abril de 1927. Depois de transmitir o\ncargo, Feliciano Sodré foi eleito senador na vaga aberta com a renúncia\nde Manuel Duarte, que se elegera senador em fevereiro de 1927 para\nfortalecer ainda mais seu nome na disputa estadual. Em maio de 1928\nSodré assumiu sua cadeira no Senado, onde fez parte da Comissão de\nDiplomacia, Tratados e Legislação. Em outubro de 1930 perdeu o mandato\nem decorrência da vitória da Revolução de 1930, que levou Getúlio Vargas\nao poder e extinguiu todos os órgãos legislativos do país.\n\nEm 1934 surgiram disputas pela direção do PRF relacionadas à eleição da\ncomissão executiva e à formulação de um novo programa partidário. Nesse\nembate, o grupo liderado por Oliveira Botelho se sobrepôs ao liderado\npor Manuel Duarte, que depois dessa derrota interna desligou-se do PRF e\nfundou no mês de maio o Partido Evolucionista do Rio de Janeiro. Nessa\nnova reformulação, Feliciano Sodré, que até então estava afastado do\nPRF, foi convidado a liderar o partido, fato confirmado na eleição da\nnova comissão executiva, em agosto de 1934, da qual passou a fazer parte\nao lado de Oliveira Botelho, José de Morais, Thiers Cardoso, Horácio\nMagalhães, Arnaldo Tavares, Sílvio Rangel, Jaime de Barros, Godofredo\nPinto, Mendes Anta e Norival de Freitas. Sob sua liderança, nas eleições\nde outubro de 1934 para a Câmara dos Deputados e para a Assembleia\nConstituinte estadual o PRF não conseguiu eleger nenhum deputado federal\ne elegeu apenas um deputado estadual, Arnaldo Tavares.\n\nFaleceu na cidade de Niterói em 26 de agosto de 1944.\n\nFoi casado com Maria Hortência Vilanova Machado de Abreu Sodré, com quem\nteve quatro filhos.\n\nRaimundo Helio Lopes\n\n**FONTES:** ASSEMB. LEGISL. RJ. Disponível em:\n\\<www.alerj.rj.gov.br/memoria/historia/gov88975/feliciano\\_sodre.html\\>.\nAcesso em: 17/3/2011; BELOCH, I.; ABREU, A. *Dicionário*; COL. BRAS.\nGENEALOGIA. Disponível em:\n\\<www.cbg.org.br/arquivos\\_genealogicos\\_r\\_02.html\\>. Acesso em:\n17/3/2011; FERREIRA, M. *Busca*; FERREIRA, M. *República*; KORNIS, M.\n*Enfrentamento*; LACOMBE, L. *Chefes*; LEITE NETO, L. *Catálogo\nbiográfico*; RAHAL, A. *Centenário.*\n","ref":"**FONTES:** ASSEMB. LEGISL. RJ. Disponível em:\n\\<www.alerj.rj.gov.br/memoria/historia/gov88975/feliciano\\_sodre.html\\>.\nAcesso em: 17/3/2011; BELOCH, I.; ABREU, A. *Dicionário*; COL. BRAS.\nGENEALOGIA. Disponível em:\n\\<www.cbg.org.br/arquivos\\_genealogicos\\_r\\_02.html\\>. Acesso em:\n17/3/2011; FERREIRA, M. *Busca*; FERREIRA, M. *República*; KORNIS, M.\n*Enfrentamento*; LACOMBE, L. *Chefes*; LEITE NETO, L. *Catálogo\nbiográfico*; RAHAL, A. *Centenário.*\n","dic":"DHBPR"}
