{"title":"SOUSA, Antônio Ennes de","cargoss":["Deputado federal","Presidente de associação ou confederação de empregados ou empregadores"],"cargos_esp":[0,"SNA"],"datas_ini":[1891,1897],"datas_fim":[1891,1897],"estados":["MA",0],"autor":["Raimundo Helio Lopes"],"content":"**SOUSA, Antônio Ennes de**\n\n\\*dep. fed. MA 1891; pres. SNA 1897.\n\n*Antônio Ennes de Sousa* nasceu em São Luís do Maranhão no dia 6 de maio\nde 1848, filho de Sebastião José de Sousa e de Maria A. Ennes de Sousa.\n\nEm 1867 mudou-se para a Europa, onde estudou na Universidade da\nSorbonne, em Paris. Retornou ao Maranhão e atuou no comércio do estado\naté 1873. Regressou então à Europa e formou-se na Universidade de\nZurique, na Suíça. Depois, ingressou na Academia Real de Minas de\nFreiberg, na Saxônia, onde conseguiu o diploma de engenheiro de minas.\nDe volta ao Brasil, tornou-se professor da Escola Politécnica do Rio de\nJaneiro.\n\nIngressou na política depois da proclamação da República, quando foi\neleito, em 1891, deputado federal pelo Maranhão. Tomou posse em maio e\nrenunciou pouco tempo depois para tornar-se diretor da Casa da Moeda do\nBrasil. Foi um dos fundadores e o primeiro presidente, em 1897, da\nSociedade Nacional de Agricultura. Foi também membro da Academia\nBrasileira de Ciências, da Sociedade de Ciências Naturais de Zurique, na\nSuíça, e da Sociedade de Química de Berlim, na Alemanha.\n\nFaleceu no Rio de Janeiro em 1920.\n\nPublicou vários livros: *Conferências públicas* (1870), *Discurso sobre\na organização da biblioteca popular do Maranhão* (1871), *Relatório da\nexposição maranhense de 1871 e 1872*, *Dissertação sobre os amálgamas*\n(1876), *Dissertação sobre a mineração e metalurgia de ouro* (1878), *O\ntrabalho e a vida subterrânea* (1880), *Estudos sobre a carta geológica\ne mineralógica do Brasil* (1880), *Estudo completo sobre os trabalhos de\ndesmonte* (1881), *Os metais: ciência vulgarizada* (1881), *Portos do\nBrasil, especialmente os do Maranhão e do Ceará* (1881), *Estudo físico\ne químico sobre o meteorito caído em 1880 no Itapicuru-mirim, Maranhão,\nque se acha no Museu Nacional* (1881), *Estudo químico e industrial\nsobre o carvão de pedra da Chapada, província do Maranhão* (1881), *O\ncarvão de pedra de Chapada, no Maranhão*, *Terrenos auríferos de\nCantagalo*, *Memória sobre os terrenos do Rio de Janeiro*, *Natureza –\nPoemas*, *Memorial sobre a mineralogia no Museu Nacional*, *A mineração\ne a metalurgia de ferro (estudo sobre a fábrica de Ipanema).*\n\nRaimundo Helio Lopes\n\n**FONTES:** ABRANCHES, J. *Governos*; BLAKE, A. *Diccionário*; *Grande\nencic. Delta Larousse*; MARQUES, C. *Dicionário*.\n","ref":"**FONTES:** ABRANCHES, J. *Governos*; BLAKE, A. *Diccionário*; *Grande\nencic. Delta Larousse*; MARQUES, C. *Dicionário*.\n","dic":"DHBPR"}
