{"title":"SOUSA, Arquimedes de Oliveira e","cargoss":["Deputado federal"],"cargos_esp":[0],"datas_ini":[1930],"datas_fim":[1930],"estados":["PE"],"autor":["Raimundo Helio Lopes"],"content":"**SOUSA, Arquimedes de Oliveira e**\n\n\\*dep. fed. PE 1930.\n\n*Arquimedes de Oliveira e Sousa* foi membro do Partido Republicano\nFederal de Pernambuco, agremiação política liderada por Francisco de\nAssis Rosa e Silva. Assumiu a prefeitura do Recife em 1909 e nesse mesmo\nano tornou-se presidente de honra do primeiro Tiro de Guerra do\nNordeste, e 13^o^ do país, instalado na cidade. Ao fim de sua gestão, em\n1913, foi substituído na prefeitura da capital pernambucana por Eudoro\nCorreia.\n\nEm 1930 foi eleito deputado federal por Pernambuco. Assumiu em maio sua\ncadeira na Câmara dos Deputados, no Rio de Janeiro, então Distrito\nFederal, mas teve o mandato interrompido em outubro seguinte com a\nvitória da Revolução de 1930, que levou Getúlio Vargas ao poder e\nextinguiu todos os órgãos legislativos do país.\n\nRaimundo Helio Lopes\n\n**FONTES:** CÂM. DEP. *Deputados brasileiros*; LEVINE, R. *Velha.*\n","ref":"**FONTES:** CÂM. DEP. *Deputados brasileiros*; LEVINE, R. *Velha.*\n","dic":"DHBPR"}
