{"title":"SOUSA, Benedito de","cargoss":["Deputado federal"],"cargos_esp":[0],"datas_ini":[1900],"datas_fim":[1908],"estados":["MT"],"autor":[0],"content":"**SOUSA, Benedito de**\n\n**\\***dep. fed. MT 1900-1908.\n\n*Benedito Crispiniano de Sousa*nasceu em Barra (BA) em outubro de 1859.\n\nBacharelou-se pela Faculdade de Direito do Recife em 1882, e foi\npromotor público e juiz municipal em Juazeiro (CE) até 1888.\n\nTransferindo-se para Mato Grosso, pertenceu ao Partido Republicano,\ncriado em 1890 por Generoso Ponce em oposição ao Partido Nacional\nliderado por Antônio Maria Coelho. Foi secretário de governo do marechal\nMallet em 1891 e depois disso foi juiz de direito e desembargador até\n1899. Foi eleito deputado federal por Mato Grosso em 1900. Assumindo em\nmaio desse ano sua cadeira na Câmara dos Deputados, no Rio de Janeiro,\nentão Distrito Federal, foi reeleito para as duas legislaturas\nseguintes.\n\nFaleceu no Rio de Janeiro no dia 28 de fevereiro de 1908, no exercício\ndo mandato.\n\nJoão Edson Fanaia\n\n**FONTES:** ABRANCHES, J. *Governos*; CÂM. DEP. *Deputados Brasileiros*;\nFANAIA, J. *Elites.*\n","ref":"**FONTES:** ABRANCHES, J. *Governos*; CÂM. DEP. *Deputados Brasileiros*;\nFANAIA, J. *Elites.*\n","dic":"DHBPR"}
