{"title":"SOUSA, Celso Florentino Henriques de","cargoss":["Deputado federal"],"cargos_esp":[0],"datas_ini":[1900],"datas_fim":[1905],"estados":[0],"autor":["Raimundo Helio Lopes"],"content":"**SOUSA, Celso Florentino Henriques de**\n\n\\*dep. fed. 1900-1905.\n\n*Celso Florentino Henriques de Sousa* nasceu em Recife no dia 28 de\njulho de 1859, filho de Brás Florentino Henriques de Sousa. Seu pai foi\npresidente da província do Maranhão de 1869 a 1870.\n\nFormou-se pela Faculdade de Direito do Recife em 1881 e depois de\nformado foi nomeado promotor público da cidade Ingá (PB), onde exerceu a\nfunção até 1884. Nesse ano foi nomeado juiz municipal em Bananeiras (PB)\ne, depois de alguns meses, tornou-se promotor em Campina Grande (PB),\nonde permaneceu até outubro de 1886. Em seguida foi procurador fiscal em\nNatal, até junho de 1888. Abandou esse cargo para tornar-se secretário\ndo governo do Rio Grande do Norte, posto que ocupou por um ano. De volta\na Pernambuco, em 1891 foi nomeado promotor das cidades de Capelas e\nResíduos, delegado de polícia e fiscal do Banco Emissor de Pernambuco,\naté 1892. Também foi professor de latim no Ginásio Pernambucano e\ndelegado literário municipal.\n\nEm 1895 fundou o jornal *O Estado* e iniciou a carreira política, sendo\neleito deputado estadual. Permaneceu no Legislativo do estado até 1900,\nquando foi eleito deputado federal. Em maio desse ano assumiu sua\ncadeira na Câmara dos Deputados, no Rio de Janeiro, então Distrito\nFederal, e, reeleito em 1903, exerceu o mandato até dezembro de 1905.\nPassou então a advogar na cidade do Rio de Janeiro.\n\nColaborou ainda com o jornal *O Estado de Pernambuco* (PE). Foi\nsócio-efetivo e honorário do Instituto Arqueológico e Geográfico de\nPernambuco e membro da Sociedade de São Vicente de Paulo.\n\nRaimundo Helio Lopes\n\n**FONTES:** ABRANCHES, J. *Governos*; CÂM. DEP. *Deputados brasileiros*;\nNASCIMENTO, L. *História.*\n","ref":"**FONTES:** ABRANCHES, J. *Governos*; CÂM. DEP. *Deputados brasileiros*;\nNASCIMENTO, L. *História.*\n","dic":"DHBPR"}
