{"title":"SOUSA, Heitor de","cargoss":["Deputado federal","Ministro do Supremo Tribunal Federal"],"cargos_esp":[0,0],"datas_ini":[1918,1926],"datas_fim":[1926,1929],"estados":[0,0],"autor":["Eduardo Junqueira"],"content":"**SOUSA, Heitor de**\n\n\\* magistrado; dep. fed. 1918-1926; min. STF 1926-1929.\n\n*Heitor de Sousa* nasceu em Estância, província de Sergipe, no dia 29 de\nmaio de 1871, filho de Jucundino Vicente de Sousa e de Maria Heitor de\nSousa.\n\nBacharelou-se em ciências jurídicas e sociais pela Faculdade de Direito\ndo Recife em 1890 e iniciou carreira na magistratura em 1891, ao ser\nnomeado juiz municipal de Caconde e Limeira, no estado de São Paulo. Em\n1893 foi promovido a juiz substituto, vindo a atuar na da comarca de\nCarangola, na Zona da Mata mineira. Aí ingressou no Partido Republicano\nMineiro (PRM), fundou jornais e envolveu-se com a política local.\nPermaneceu em Carangola até em 1895, quando foi nomeado juiz de direito\nda comarca de Campo Largo, no estado do Paraná. Pouco depois requereu\ndisponibilidade e regressou a Carangola para se dedicar exclusivamente à\nadvocacia, à política e ao jornalismo.\n\nEm 1900, transferiu residência e banca para o município de Cataguases\n(MG). Aí também atuou como jornalista e advogado, e foi eleito vereador\nà Câmara Municipal. Já figura de destaque no panorama político regional,\ne membro do diretório do PRM, foi deputado estadual em Minas Gerais de\n1903 a 1910. Na Assembleia mineira, foi presidente das comissões de\nConstituição, Legislação e Justiça; Redação das Leis; Justiça Civil e\nCriminal, e Legislação e Poderes. Ao concluir o último mandato, foi\nnomeado pelo presidente estadual Júlio Bueno Brandão subprocurador geral\ndo estado. Em abril de 1914, foi nomeado lente de direito internacional\nda Faculdade de Direito de Minas Gerais. Também nesse ano foi\nreconduzido ao cargo de subprocurador geral por Delfim Moreira, que\nassumira a presidência do estado.\n\nCom a saída de Delfim Moreira do governo mineiro para disputar a\nvice-presidência da República, em foi eleito deputado federal pelo\nEspírito Santo. Exerceu o mandato nas legislaturas 1918-1920, 1921-1923\ne 1924-1926. Depois de permanecer por quase oito anos no Congresso\nNacional, já figura destacada no meio jurídico do país, foi nomeado pelo\npresidente Washington Luís, em junho de 1926, ministro do Supremo\nTribunal Federal (STF), na vaga surgida com o falecimento de Herculano\nde Freitas.\n\nFaleceu em 11 de janeiro de 1929, enquanto trabalhava em seu gabinete no\nSTF.\n\nAlém de ter sido redator do *Diário de Minas Gerais* e outros periódicos\nde grande circulação no território mineiro, publicou diversos trabalhos\njurídicos e pareceres, sobretudo no campo da organização judiciária. Sua\nobra encontra-se dispersa em revistas, jornais especializados e\npublicações oficiais.\n\nFoi casado com Marieta Frust de Sousa.\n\nEduardo Junqueira\n\n**FONTES:** MATTOSO, P. *Supremo Tribunal;* MELLO FILHO, J. *Notas*;\nSUP. TRIB. FED. Disponível em: \\<www.stf.jus.br/portal/ministros\\>.\n","ref":"**FONTES:** MATTOSO, P. *Supremo Tribunal;* MELLO FILHO, J. *Notas*;\nSUP. TRIB. FED. Disponível em: \\<www.stf.jus.br/portal/ministros\\>.\n","dic":"DHBPR"}
