{"title":"SOUSA, João Francisco de Paula","cargoss":["Senador"],"cargos_esp":[0],"datas_ini":[1895],"datas_fim":[1901],"estados":["SP"],"autor":[0],"content":"**SOUSA, João Francisco de Paula**\n\n\\* sen. SP 1895-1901.\n\n*João Francisco de Paula Sousa* nasceu em Itu (SP) entre 1828 e 1831,\nfilho de Francisco de Paula Sousa e Melo e de Maria de Barros Leite. Era\ndescendente de tradicional e abastada família paulista. Seu pai foi\ndeputado às Cortes de Lisboa, membro do Conselho Geral da província de\nSão Paulo, constituinte de 1823, deputado geral entre 1826 e 1833,\nsenador do Império entre 1833 e 1851, ministro dos Negócios do Império e\nda Fazenda, presidente do Conselho de Ministros e conselheiro do\nImpério. Seu irmão Antônio Francisco de Paula Sousa foi deputado\nprovincial, deputado geral, e ministro da Agricultura, Comércio e Obras\nPúblicas do Império; outro irmão, Bento Francisco de Paula Sousa, foi\ndeputado provincial, presidente da Assembleia Legislativa de São Paulo\nem duas oportunidades, deputado geral, ministro da Marinha, e\nconselheiro do Império. Sua irmã Francisca de Sousa Queirós foi a\nbaronesa de Limeira.\n\nFez os primeiros estudos em sua cidade e posteriormente foi para o Rio\nde Janeiro, então sede da Corte, onde se matriculou na Faculdade de\nMedicina. Logo após ter-se formando foi para a Europa e frequentou\nvárias clínicas e hospitais, especializando-se em diferentes áreas\nmédicas na França. De volta ao Brasil, estabeleceu-se em sua cidade\nnatal, mas não exerceu a profissão de médico. Grande proprietário rural\ne cafeicultor, e chefe do Partido Liberal em sua região, foi eleito\ndeputado à Assembleia Provincial de São Paulo para as legislaturas\n1866-1867 e 1868-1869. Ao término do último mandato resolveu voltar à\nEuropa, onde permaneceu algum tempo.\n\nQuando da Convenção Republicana de Itu, realizada em 18 de abril de\n1873, seus participantes decidiram que era necessário fundar um jornal\nque divulgasse suas ideias na capital da província. Coube a Américo\nBrasiliense de Almeida Melo e Manuel Ferraz de Campos Sales o trabalho\nde arregimentação dos sócios comanditários. Àquela altura Paula Sousa já\nhavia retornado ao Brasil, e, apesar de ser da corrente liberal e não\nrepublicana, Brasiliense, de quem era velho amigo, não teve dúvidas em\nconvidá-lo e solicitar sua colaboração financeira. A princípio Paula\nSousa não concordou, por entender que não se via como sócio de uma\nempresa jornalística, e desejou sucesso para a sociedade. Contudo,\ngraças à insistência de seu amigo, acabou aceitando o convite e\nsubscreveu a quantia de dois contos de réis para compor o capital da\nsociedade. Finalmente em 1^o^ de novembro de 1874, em reunião realizada\nem São Paulo, foi constituída uma sociedade comanditária formada por 21\ncotistas. Por terem contribuído com as maiores cotas, Rangel Pestana e\nAmérico de Campos foram escolhidos para redatores do novo órgão de\nimprensa. Era a fundação do jornal *A Província de São Paulo*, que\ncomeçou a circular em 4 de janeiro de 1875 e que, com o advento da\nRepública em 15 de novembro de 1889, passaria a intitular-se, em janeiro\nde 1890, *O Estado de São Paulo*.\n\nJá no governo de Prudente de Morais (1894-1898), com a nomeação de\nFrancisco de Paula Rodrigues Alves para o Ministério da Fazenda do\ngoverno, Paula Sousa foi indicado pelo Partido Republicano Paulista\n(PRP) para ocupar a vaga deste no Senado Federal. Foi assim eleito\nsenador em 15 de abril de 1895 e assumiu o mandato em 30 de maio,\nexercendo-o até fins de 1901. Por um acordo político entre as lideranças\ndo PRP após o grave embate que provocou a cisão ocorrida em 1897, sua\ncadeira seria ocupada no ano seguinte pelo general Francisco Glicério,\nque se encontrava no ostracismo. No Senado Federal, Paula Sousa foi\nmembro das comissões de Justiça e Legislação e de Saúde Pública,\nEstatística e Colonização. Em 4 de junho de 1904, sempre pelo PRP, foi\neleito para o Senado Estadual paulista na vaga de Manuel Joaquim de\nAlbuquerque Lins, que havia sido nomeado secretário da Fazenda. Tomou\nposse em 1^o^ de julho seguinte e foi indicado membro da Comissão de\nRedação.\n\nFaleceu em São Paulo em 12 de janeiro de 1906, no exercício do mandato\nde senador estadual.\n\nDe seu primeiro casamento teve um filho. Foi casado em segundas núpcias\ncom sua prima Gabriela Aguiar Paes de Barros, filha do barão de\nPiracicaba. Seu sobrinho Antônio Francisco de Paula Sousa foi deputado\nestadual, ministro das Relações Exteriores e da Indústria, Viação e\nObras Públicas do governo Floriano Peixoto, fundador e diretor da Escola\nPolitécnica de São Paulo.\n\nPublicou os trabalhos *Funções do baço* (1873); *Memória sobre a\noportunidade e uso de sulfato de quinino nas afecções palustres* (1874);\n*Memória sobre a prostituição no país, suas causas e medidas a adotar\npara a sua não propagação* (1876); e *Parecer médico legal sobre o\nestado mental de Bento de Sousa Borges* (1879). Escreveu ainda os\nartigos “Apontamentos para a história da medicina”, para *Progresso\nMédico* (1876), e “Fisiologia do cérebro”, para *Revista Médica* (1877),\ne colaborou na *Revista Clínica do Hospital de São João Batista de\nNiterói* (1879).\n\nAntônio Sérgio Ribeiro\n\n**FONTES:** ABRANCHES, J. *Governos*; CALIMAN, A. *Legislativo*;\n*Correio Paulistano* (13/1/1906); *Estado de S. Paulo* (1/2/1975);\nRIBEIRO, J. *Chronologia*; SENADO, *Dados*.\n","ref":"**FONTES:** ABRANCHES, J. *Governos*; CALIMAN, A. *Legislativo*;\n*Correio Paulistano* (13/1/1906); *Estado de S. Paulo* (1/2/1975);\nRIBEIRO, J. *Chronologia*; SENADO, *Dados*.\n","dic":"DHBPR"}
