{"title":"SOUSA, José da Costa Machado e","cargoss":["Presidente de associação ou confederação de empregados ou empregadores","Deputado federal"],"cargos_esp":[0,0],"datas_ini":[1867,1891],"datas_fim":[1868,1896],"estados":["MG","MG"],"autor":["Luciana Pinheiro"],"content":"**SOUSA, José da Costa Machado e**\n\n\\*pres. MG 1867-1868; dep. fed. MG 1891-1896\n\n*José da Costa Machado e Sousa* nasceu em Baependi (MG) no dia 5 de\njulho de 1829.\n\nFormado em 1853 pela Faculdade de Direito de São Paulo, iniciou sua\ncarreira como advogado atuando em Minas Gerais e na capital paulistana.\nFoi suplente de deputado geral entre os anos de 1857 e 1860, e logo após\nelegeu-se deputado provincial em São Paulo na legislatura 1862-1863. Em\noutubro de 1867 foi nomeado presidente de Minas Gerais, permanecendo à\nfrente do governo provincial até agosto de 1868.\n\nJá na República, após a promulgação da Constituição de 24 de fevereiro\nde 1891, foi eleito deputado federal por Minas Gerais, com mandato de\nmaio do mesmo ano a dezembro de 1893. Foi reeleito para a legislatura\nseguinte e permaneceu na Câmara dos Deputados até dezembro de 1896.\n\nFaleceu em São Paulo em 14 de julho de 1925.\n\nLuciana Pinheiro\n\n**FONTES:** CÂM. DEP. *Deputados brasileiros* (p.148); MONTEIRO, N.\n*Dicionário* (v.2, p.673).\n","ref":"**FONTES:** CÂM. DEP. *Deputados brasileiros* (p.148); MONTEIRO, N.\n*Dicionário* (v.2, p.673).\n","dic":"DHBPR"}
