{"title":"SOUSA, José Gonçalves de","cargoss":["Deputado federal"],"cargos_esp":[0],"datas_ini":[1912],"datas_fim":[1926],"estados":["MG"],"autor":["Luciana Pinheiro"],"content":"**SOUSA, José Gonçalves de**\n\n\\*dep. fed. MG 1912-1926.\n\n*José Gonçalves de Sousa* nasceu no arraial de Santana de São João Acima\n(MG), filho de José Gonçalves de Sousa Moreira e de Delfina Maria\nGonçalves de Sousa.\n\nCursou humanidades no tradicional Colégio do Caraça e no Ginásio de Ouro\nPreto, em sua província natal. Em 1886 diplomou-se pela Faculdade de\nDireito de São Paulo. Recém-formado, retornou a Minas Gerais e foi\nnomeado promotor público em Pará. Posteriormente foi promotor e inspetor\nescolar em Três Rios, e juiz municipal e juiz de direito em Pitangui,\naté 1896. Abandonando a magistratura para se dedicar à indústria,\ntornou-se gerente da Companhia Industrial Pitanguiense, empresa que mais\ntarde dirigiu por seis anos.\n\nIngressou na vida política em 1897 ao se eleger vereador em Pitangui. No\ndecorrer de seus sete anos de mandato também foi presidente da Câmara e\nagente executivo municipal. Em 1899 elegeu-se deputado estadual, com\nmandato até 1902. Em 1903 assumiu uma cadeira no Senado Estadual e nela\npermaneceu até setembro de 1910, quando foi nomeado secretário estadual\nda Agricultura, Indústria, Terras, Viação e Obras Públicas. Em 1911\nparticipou ativamente da fundação da Escola Livre de Engenharia de Belo\nHorizonte.\n\nVoltou a exercer novo mandato eletivo em 1912, quando foi eleito\ndeputado federal pelo Partido Republicano Mineiro (PRM). Tomou posse na\nCâmara dos Deputados, no Rio de Janeiro, então Distrito Federal, em maio\ndo mesmo ano e foi reeleito para as quatro legislaturas seguintes:\n1915-1917, 1918-1920, 1921-1923 e 1924-1926. No decorrer do período foi\nmembro da Comissão de Tomada de Contas (1923) e vice-presidente da\nCâmara (1924).\n\nAo longo de sua trajetória profissional fundou a Companhia de Tecidos\nSantanense, que presidiu até falecer.\n\nCasou-se com Cecília Bahia Gonçalves de Sousa.\n\nLuciana Pinheiro\n\n**FONTES:** CÂM. DEP. *Deputados brasileiros* (p.152); MONTEIRO, N.\n*Dicionário* (v.2, p.674).\n","ref":"**FONTES:** CÂM. DEP. *Deputados brasileiros* (p.152); MONTEIRO, N.\n*Dicionário* (v.2, p.674).\n","dic":"DHBPR"}
