{"title":"SOUSA, José Soriano de","cargoss":["Ministro do Supremo Tribunal Federal"],"cargos_esp":[0],"datas_ini":[1927],"datas_fim":[1932],"estados":[0],"autor":[0],"content":"**SOUSA, José Soriano de**\n\n\\*magistrado; min. STF 1927-1932.\n\n*José Soriano de Sousa Filho* nasceu em Recife no dia 8 de dezembro de\n1863, filho do professor de direito José Soriano de Sousa.\n\nFormou-se em 1884 pela Faculdade de Direito do Recife. Promotor em\nNazaré (PE) em 1887, foi nomeado em agosto desse mesmo ano\njuiz-substituto em Santos (SP). Exerceu a função até fevereiro de 1888,\nquando foi nomeado juiz municipal e da Vara de Órfãos em Uberaba (MG).\nApós a reorganização judiciária do estado de São Paulo, concluída em\n1894, foi nomeado, ainda nesse ano, juiz de direito da comarca de Jaú\n(SP). Daí foi transferido em 1896 para a 2^a^ Vara de Campinas (SP),\nonde exerceu a judicatura até dezembro de 1914, quando se tornou\nministro do Tribunal de Justiça de São Paulo, com assento na Câmara\nCível.\n\nEm fevereiro de 1927 foi nomeado pelo presidente Washington Luís\n(1926-1930) ministro do Supremo Tribunal Federal (STF). Como ministro do\nSTF, em maio de 1932 assumiu a vice-presidência do Tribunal Superior de\nJustiça. Nesse mesmo mês, contudo, foi aposentado por ter atingido o\nlimite de idade para o cargo.\n\nFoi também catedrático da Faculdade de Direito de Recife.\n\nFaleceu na cidade do Rio de Janeiro, então Distrito Federal, no dia 6 de\noutubro de 1938.\n\nEra casado com Regina Henrique de Sousa, com quem teve quatro filhos.\n\n**FONTES:** BALEEIRO, A. *Supremo*; COSTA, E. *Grandes*; *Grande encic.\nDelta*; LAGO, L. *Supremo*; MACEDO, R. *Efemérides*.\n","ref":"**FONTES:** BALEEIRO, A. *Supremo*; COSTA, E. *Grandes*; *Grande encic.\nDelta*; LAGO, L. *Supremo*; MACEDO, R. *Efemérides*.\n","dic":"DHBPR"}
