{"title":"SOUTO FILHO, Antônio da Silva","cargoss":["Deputado federal","Constituinte","Deputado federal"],"cargos_esp":[0,0,0],"datas_ini":[1930,1934,1935],"datas_fim":[1930,1934,1937],"estados":["PE",0,"PE"],"autor":[0],"content":"**SOUTO FILHO, Antônio da Silva**\n\n\\*dep. fed. PE 1930; const. 1934; dep. fed. PE 1935-1937.\n\n*Antônio da Silva Souto Filho* nasceu em Garanhuns (PE) no dia 29 de\nagosto de 1886, filho do coronel Antônio da Silva Souto e de Maria de\nMoura Souto.\n\nEstudou no Ginásio Alagoano e bacharelou-se pela Faculdade de Direito do\nRecife. Após ter participado da campanha vitoriosa de Emílio Dantas\nBarreto para o governo de Pernambuco, quando da posse deste em 1911 foi\ndesignado seu oficial gabinete. Em 1915 foi nomeado curador geral de\nórfãos e interditos da Comarca de Recife.\n\nEleito deputado estadual pelo Partido Democrático, exerceu a liderança\nda maioria na Assembleia pernambucana. Senador estadual em 1927, foi\ntambém escolhido líder da maioria na casa. No pleito de março de 1930,\nelegeu-se deputado federal por Pernambuco, sendo empossado em maio\nseguinte. Embora ligado ao situacionismo, votou contra o governo\nfederal, que se recusava a reconhecer a bancada paraibana eleita pela\noposição. Após a Revolução de Outubro de 1930, teve o mandato\ninterrompido e foi demitido de seu cargo judiciário.\n\nIniciado o processo de reconstitucionalização do país, em janeiro de\n1933 participou da fundação do Partido Social Republicano de Pernambuco,\nsendo designado vice-presidente da agremiação. Fazendo oposição ao\nPartido Social Democrático, criado pelo interventor federal Carlos de\nLima Cavalcanti, foi o único candidato de seu partido a se eleger, em\nmaio de 1933, deputado à Assembleia Nacional Constituinte. Empossado em\nnovembro do mesmo ano, participou dos trabalhos constituintes e em junho\ndo ano seguinte votou contra a elegibilidade do chefe do governo\nprovisório, Getúlio Vargas, para a presidência da República. Após a\npromulgação da nova Carta (16/7/1934) e a eleição de Vargas no dia\nseguinte, teve o mandato estendido até abril de 1935. Ainda em 1934, no\nmês de outubro, elegeu-se deputado federal por Pernambuco, iniciando\nnovo mandato em maio de 1935.\n\nFoi também diretor do vespertino *A Rua*, de Recife.\n\nFaleceu no Recife no dia 19 de junho de 1937, em pleno exercício do\nmandato.\n\nEra casado com Francisca Salgado Guedes de Nogueira Souto, com quem teve\nquatro filhos.\n\n**FONTES:** ASSEMB. NAC. CONST. 1934. *Anais* (1); CÂM. DEP.\n*Deputados*; *Câm. Dep. seus componentes*; *Cronologia da Assembleia*;\nGODINHO, V. *Constituinte*; INF. Maria Gerusa Souto.\n","ref":"**FONTES:** ASSEMB. NAC. CONST. 1934. *Anais* (1); CÂM. DEP.\n*Deputados*; *Câm. Dep. seus componentes*; *Cronologia da Assembleia*;\nGODINHO, V. *Constituinte*; INF. Maria Gerusa Souto.\n","dic":"DHBPR"}
