{"title":"SOUTO, Teodureto","cargoss":["Deputado Geral","Presidente de associação ou confederação de empregados ou empregadores","Presidente de associação ou confederação de empregados ou empregadores","Constituinte","Senador"],"cargos_esp":[0,0,0,0,0],"datas_ini":[1878,1883,1884,1891,1891],"datas_fim":[1881,1883,1884,1891,1893],"estados":["CE","SC","AM",0,"CE"],"autor":[0],"content":"**SOUTO, Teodureto**\n\n\\*dep. geral CE 1878-1881; pres. SC 1883; pres. AM 1884; const. 1891;\nsen. CE 1891-1893.\n\n*Teodureto Carlos de Faria Souto* nasceu em Ipu (CE) no dia 4 de\nnovembro de 1841, filho de José Francisco Souto.\n\nFormou-se pela Faculdade de Direito do Recife em 1865, sendo em seguida\nnomeado coletor de rendas provinciais em Ipu. Demitido do cargo, seguiu\npara a província do Rio de Janeiro e abriu um escritório de advocacia em\nCantagalo. De volta ao Ceará, ingressou na política filiando-se ao\nPartido Liberal do Império, em cuja legenda foi eleito deputado geral\npara a legislatura 1878-1881. Em 1883 presidiu a então província de\nSanta Catarina e no ano seguinte a província do Amazonas. Nesta última\nfez campanha abolicionista e assinou o documento de libertação dos\nescravos.\n\nCom a proclamação da República, foi designado, juntamente com Justiniano\nde Serpa, Martinho Rodrigues e Bezerril Fontenelle, para elaborar o\nprojeto da Constituição do estado do Ceará. Em 1890 representou o estado\nna Exposição Continental de São Paulo. Nesse mesmo ano foi eleito\nsenador pelo Ceará ao Congresso Nacional Constituinte. Por ter sido o\nmenos votado dos três senadores eleitos, ganhou um mandato de apenas\ntrês anos. Tomou posse em 15 de novembro de 1890, participou da\nelaboração da Constituição promulgada em 24 de fevereiro de 1891 e a\npartir de junho passou a exercer o mandato ordinário. Foi membro da\nComissão de Finanças do Senado.\n\nFoi ainda presidente do Banco do Brasil e diretor do Banco da República.\n\nFaleceu em Nova Friburgo (RJ) no dia 11 de agosto de 1893, em pleno\nexercício do mandato de senador.\n\nKleiton de Sousa Moraes\n\n**FONTES:** GIRÃO, V. *Ceará* (p.63); GUIMARÃES, H. *Deputados* (p.504);\nLEITE NETO, L. *Catálogo biográfico* (v.4).\n","ref":"**FONTES:** GIRÃO, V. *Ceará* (p.63); GUIMARÃES, H. *Deputados* (p.504);\nLEITE NETO, L. *Catálogo biográfico* (v.4).\n","dic":"DHBPR"}
