{"title":"SÓCRATES, Eduardo Artur","cargoss":["Deputado federal"],"cargos_esp":[0],"datas_ini":[1906],"datas_fim":[1911],"estados":["GO"],"autor":["Adrianna Setemy"],"content":"**SÓCRATES, Eduardo Artur**\n\n\\*militar; dep. fed. GO 1906-1911.\n\n*Eduardo Artur Sócrates* foi eleito deputado federal pelo estado de\nGoiás para as legislaturas de 1906 a 1908 e de 1909 a 1911. Militar de\ncarreira, foi comandante da Escola Militar do Realengo de novembro de\n1917 a maio de 1919, quando ocupava o posto de general de brigada.\n\nCasou-se com Vitoriana Alves de Castro.\n\nAdrianna Setemy\n\n**FONTES:** Projeto de imagem de publicações oficiais brasileiras do\nCenter for Research Libraries e Latin-american Microfilm Project.\n*Mensagens dos Presidentes de Província (1830-1930).* Disponível em:\n\\<www.crl.edu/content.asp?l1=4&l2=18&l3=33\\>. Acesso em: 8/1/2009.\n","ref":"**FONTES:** Projeto de imagem de publicações oficiais brasileiras do\nCenter for Research Libraries e Latin-american Microfilm Project.\n*Mensagens dos Presidentes de Província (1830-1930).* Disponível em:\n\\<www.crl.edu/content.asp?l1=4&l2=18&l3=33\\>. Acesso em: 8/1/2009.\n","dic":"DHBPR"}
