{"title":"SÓLON, Frederico","cargoss":["Presidente de associação ou confederação de empregados ou empregadores","Deputado federal"],"cargos_esp":[0,0],"datas_ini":[1891,1893],"datas_fim":[1891,1893],"estados":["MT","MT"],"autor":[0],"content":"**SÓLON, Frederico**\n\n\\*militar; pres. MT 1891; dep. fed. MT 1893.\n\n*Frederico Sólon de Sampaio Ribeiro*nasceu em Porto Alegre em 1840.\n\nMilitar de carreira, ingressou no Exército como praça em 1857 e atingiu\na patente de general de divisão em 1899.\n\nDurante a crise política em Mato Grosso que culminou com o afastamento\ndo primeiro governador republicano, Antônio Maria Coelho, foi enviado ao\nestado com o objetivo de anular as eleições realizadas para a Assembleia\nLegislativa e realizar novo pleito que garantisse a vitória dos\ncorreligionários de Generoso Ponce. Com esse fim, exerceu o governo de\nMato Grosso pelo curto período de 16 de fevereiro a 1^o^ de abril de\n1891, quando foi substituído por José da Silva Rondon, e obteve como\ncompensação política uma cadeira de deputado federal por Mato Grosso.\nExerceu seu mandato na Câmara dos Deputados, no Rio de Janeiro, então\nDistrito Federal, de maio a dezembro de 1893.\n\nFaleceu em Belém em 1900.\n\nJoão Edson Fanaia\n\n**FONTES:** ABRANCHES, J. *Governo*s; CÂM. DEP. *Deputados brasileiros*;\nFANAIA, J. *Elites*.\n","ref":"**FONTES:** ABRANCHES, J. *Governo*s; CÂM. DEP. *Deputados brasileiros*;\nFANAIA, J. *Elites*.\n","dic":"DHBPR"}
