{"title":"BARCELOS, Cristóvão","cargoss":["Revolucionário ou revoltoso","Constituinte","Chefe do Estado-Maior do Exército"],"cargos_esp":[0,0,0],"datas_ini":[1930,1934,1944],"datas_fim":[1930,1934,1946],"estados":[0,0,0],"autor":["Renato Lemos"],"content":"**BARCELOS, Cristóvão**\n\n\\*militar; rev. 1930; const. 1934; ch. EME 1944-1946.\n\n*Cristóvão de Castro Barcelos* nasceu em Campos (RJ) no dia 25 de julho\nde 1883, filho de João Gomes Sobral Barcelos e de Teresa de Castro\nBarcelos.\n\nEstudou no Liceu de Humanidades de Campos e, em 1901, assentou praça,\ningressando depois na Escola Militar do Brasil, no Rio de Janeiro, então\nDistrito Federal. Declarado aspirante a oficial em 1909, em 1911 foi\npromovido a segundo-tenente e, em outubro de 1917, a primeiro-tenente.\nEm janeiro de 1918 seguiu para a França, integrando a comissão\nbrasileira de estudos, operações de guerra e aquisição de material. Em\nplena Primeira Guerra Mundial, acompanhou operações dos Aliados e\npermaneceu na França até junho de 1919, tendo realizado estudos na\nEscola de Saint-Cyr. Em janeiro de 1919, ainda na França, foi promovido\na capitão por atos de bravura praticados durante a guerra.\n\nDe volta ao Brasil, ingressou em março de 1922 na Escola de Estado-Maior\ndo Exército, no Rio, cujo curso concluiu em janeiro de 1925. Entre\nfevereiro de 1927 e fevereiro de 1930 chefiou a 3^a^ Circunscrição de\nRecrutamento, sediada em Vitória. Promovido a major em novembro de 1928,\nchegou à patente de tenente-coronel em fevereiro de 1930. Nesse mesmo\nmês, durante a campanha eleitoral para a sucessão do presidente\nWashington Luís, chefiou a caravana oposicionista da Aliança Liberal que\npercorreu cidades dos estados do Rio de Janeiro e do Espírito Santo. Em\nVitória, reagiu a tiros ao ataque movido por forças policiais contra os\noposicionistas, que realizavam um grande comício e endereçavam duras\ncríticas ao governo federal. Em outubro, participou da revolução que\ndepôs Washington Luís, chefiando tropas em operação na região situada\nentre as cidades mineiras de Além-Paraíba e Carangola.\n\nLogo após a tomada do poder pelos revolucionários, vários grupos\ncomeçaram a se reunir em segredo, procurando chegar a uma forma de\norganização que pudesse manter e defender os princípios da revolução.\nCristóvão Barcelos frequentou reuniões de um desses grupos, embriões do\nfuturo Clube 3 de Outubro, no bairro carioca da Gávea. A elas\ncompareciam também Virgílio de Melo Franco, Juraci Magalhães, Herculino\nCascardo, João Alberto Lins de Barros e outros.\n\nPromovido a coronel em abril de 1931, assumiu em junho desse ano o\ncomando da Escola de Estado-Maior do Exército. Em julho de 1932, com a\neclosão da Revolução Constitucionalista de São Paulo, combateu os\npaulistas à frente do Destacamento Coronel Barcelos, envolvido em\nchoques na região da serra da Mantiqueira (MG). Em setembro, foi\npromovido a general de brigada.\n\nApós a derrota dos constitucionalistas em outubro de 1932 e a posterior\nconvocação de eleições para a Assembleia Nacional Constituinte, o\ngeneral Barcelos participou, em dezembro do mesmo ano, da fundação do\nPartido Socialista Fluminense (PSF). Dois meses depois, desligou-se do\nPSF e engajou-se na tentativa de unificar partidariamente os antigos\nadeptos da candidatura de Nilo Peçanha, adversário de Artur Bernardes\nnas eleições presidenciais de 1922. Entretanto, frustraram-se os\nesforços de unificação dos nilistas, resultando daí a criação de dois\npartidos: a União Progressista Fluminense (UPF), liderada por Cristóvão\nBarcelos e José Eduardo Prado Kelly, e o Partido Popular Radical (PPR),\nchefiado por Raul Fernandes e José Eduardo de Macedo Soares. Membro da\nprimeira comissão diretora da UPF, Cristóvão Barcelos foi um dos quatro\ndeputados eleitos na legenda, em maio de 1933, para Assembleia Nacional\nConstituinte.\n\nNa Constituinte\n\nLogo após a instalação da Assembleia, em novembro de 1933, Cristóvão\nBarcelos foi um dos protagonistas da disputa que se travou pela\npresidência da Mesa Diretora. A direção da Constituinte tinha particular\nimportância política, já que um dos encargos de seus membros seria a\neleição do presidente da República.\n\nO chefe do governo provisório, Getúlio Vargas, tentando articular sua\npermanência no poder, procurava consolidar aliança com setores das\noligarquias regionais. Nesse sentido, apoiou a indicação de Antônio\nCarlos Ribeiro de Andrada, deputado pelo Partido Progressista de Minas\nGerais e ex-presidente de seu estado, para a presidência da Assembleia.\nOutras candidaturas se apresentaram, inclusive a de Cristóvão Barcelos,\nque teria, segundo os informes do líder político mineiro Virgílio de\nMelo Franco e de Getúlio Vargas, o apoio de deputados classistas e de\nrepresentantes das oposições do Distrito Federal, Bahia e São Paulo.\nCirculavam também no palácio Tiradentes, onde se reuniam os\nconstituintes, rumores de que o capitão-tenente Ari Parreiras,\ninterventor no Distrito Federal, e o general Pedro Aurélio de Góis\nMonteiro, pretendente à sucessão de Vargas, viam com simpatia a\ncandidatura do general Barcelos.\n\nEntretanto, nas eleições para a presidência da Mesa realizadas no dia 13\nde novembro, Cristóvão Barcelos recebeu apenas um voto contra os 138 que\nelegeram Antônio Carlos. Foi, contudo, escolhido segundo-vice-presidente\nda Assembleia.\n\nNa sessão de 7 de dezembro, propôs a transferência da capital do país\npara o ponto mais central do território brasileiro, argumentando que sua\nexperiência na Primeira Guerra Mundial, quando Paris e Londres foram\nespecialmente visadas, ensinava que a sede do governo federal deveria\nsituar-se em um local mais protegido do ponto de vista militar. A\nproposta, contudo, não foi aceita.\n\nEm janeiro de 1934, foi um dos constituintes que se opuseram à proposta\ndo líder da maioria, Antônio Medeiros Neto, no sentido de inverter a\nordem dos trabalhos da Assembleia, o que implicaria que a eleição do\npresidente da República fosse realizada antes que se promulgasse a nova\nConstituição. Contrário à medida, o general Barcelos participou de uma\nreunião no gabinete do general Góis Monteiro, à qual também compareceram\nVirgílio de Melo Franco, João Alberto e Valdemar Mota. Nesse encontro,\nficou concertada a aceitação da Fórmula Simões Lopes, sugerida pelo\ndeputado Augusto Simões Lopes, segundo a qual a eleição presidencial\nseria precedida da votação, em primeiro turno, do projeto da\nConstituição.\n\nNo mês de março, quando se discutiu na Assembleia a possibilidade de\nprorrogação dos mandatos dos constituintes, que desse modo executariam\nfunções para as quais não haviam sido eleitos, o general Barcelos\nassumiu posição decididamente contrária à medida. Na semana seguinte, em\nreunião com os líderes de bancadas, pronunciou-se sobre a concessão do\ndireito de voto aos sargentos, questão que dividia as oposições dentro\ndo próprio Exército. Argumentando que se produziriam efeitos nefastos\npara a disciplina militar, solicitou que fosse encontrada uma forma de\nrecuar, anulando a decisão já tomada. Sua proposta foi debatida, mas\nacabou recusada pela maioria dos líderes.\n\nEm junho, já perto do final dos trabalhos constituintes, o general\nBarcelos votou, juntamente com Nilo Alvarenga e Asdrúbal Gwyer de\nAzevedo, a favor de que a Assembleia atribuísse ao presidente da\nRepública, até a promulgação da nova Constituição, os poderes\ndiscricionários conferidos em 1930 ao cargo de presidente,\natribuindo-lhe funções próprias dos poderes Executivo e Legislativo.\n\nCom Prado Kelly, Nilo Alvarenga e Abelardo Marinho, Cristóvão Barcelos\nassinou as emendas n^o^ 897, criando o Conselho Federal, responsável\npelo planejamento quinquenal da produção do país, e n^o^ 899, garantindo\no direito à educação para todos os brasileiros. Integrou ainda a\ncomissão nomeada pelo presidente da Assembleia para apresentar a Getúlio\nVargas congratulações pela decretação da anistia para os acusados de\ncrimes políticos.\n\nA Sucessão Fluminense de 1935\n\nEncerrados os trabalhos da Constituinte em julho de 1934, com a\npromulgação da nova Constituição e a eleição de Vargas para a\npresidência daRepública, entrou em fase decisiva o processo de\nreconstitucionalização nos estados. Em outubro, realizaram-se eleições\npara a Câmara dos Deputados e para as assembleias constituintes\nestaduais, encarregadas também de eleger governadores e senadores. No\nestado do Rio, a UPF elegeu 19 deputados, enquanto a coligação do PSF\ncom o PPR conseguiu fazer 23 representantes.\n\nDois fatores, porém, tornavam especialmente complexa a conjuntura\npolítica fluminense. Em primeiro lugar, também no estado do Rio se\nregistrava uma característica do processo de reconstitucionalização nas\ndemais unidades da Federação: o governo federal, através dos\ninterventores, não lograra organizar-se politicamente de forma autônoma,\npermanecendo ligado a alianças com os tradicionais setores oligárquicos.\nDessa maneira, o interventor Ari Parreiras não conseguia dirigir sua\nprópria sucessão, disputada pelo general Barcelos, candidato da UPF e\napoiado pelo Partido Evolucionista do Distrito Federal e um deputado\ndissidente do PSF, e pelo almirante Protógenes Guimarães, ministro da\nMarinha e candidato da Coligação Radical Socialista.\n\nO segundo fator a tornar mais complexa a conjuntura política fluminense\nera a interferência do governo federal e de alguns governos estaduais na\nsucessão. Mal haviam terminado os trabalhos da Assembleia Nacional\nConstituinte, já iam avançadas as articulações entre forças empenhadas\nnas eleições diretas para a presidência da República, previstas para os\nprimeiros meses de 1938. O governo do estado do Rio assumia assim grande\nimportância, atraindo a atenção de diversos grupos relevantes no plano\nnacional. Os governos do Rio Grande do Sul e de Minas Gerais apoiavam\nCristóvão Barcelos, enquanto os governos federal e de São Paulo eram\nfavoráveis a Protógenes Guimarães.\n\nApós tentar em vão um acordo entre os partidos adversários, o\ninterventor, sentindo fugir-lhe ao controle o processo eleitoral,\napresentou ao presidente Vargas, em janeiro de 1935, sua renúncia ao\ncargo, no que não foi atendido. Agravaram-se, a partir de então, as\nsuspeitas de que o governo federal estaria preparando a substituição do\ninterventor por algum elemento ligado ao seu esquema político. Em\ntelegrama datado de março de 1935, o general Barcelos denunciava a José\nAntônio Flores da Cunha, interventor no Rio Grande do Sul, as supostas\nmanobras do presidente.\n\nDe acordo com um relatório apresentado em setembro a Getúlio Vargas pelo\nministro da Justiça, Vicente Rao, Cristóvão Barcelos teria sido instado\npor Benedito Valadares, interventor federal em Minas Gerais e seu amigo\nparticular, a procurar uma solução conciliatória com os demais partidos\nfluminenses. Insistira porém em manter sua candidatura ao governo\nestadual, declarando, além disso, que “chegaria até à inimizade pessoal\ncom o presidente, não hesitando em levantar a rebelião no estado e a\nmorrer na luta”.\n\nEm 25 de setembro de 1935 realizaram-se as eleições, marcadas por atos\nde violência que chegaram a provocar ferimentos à bala em um deputado do\nPSF e no próprio general Barcelos. O almirante Protógenes Guimarães\nvenceu o pleito, mas a UPF entrou com recurso, alegando as precárias\ncondições de segurança em que este fora realizado, e conseguiu que a\nJustiça Eleitoral anulasse o resultado e convocasse novas eleições.\n\nFlores da Cunha, empenhado em obstruir o projeto continuísta de Vargas,\napoiou o recurso impetrado pelo general Barcelos, acusando o presidente\nde pressionar os constituintes fluminenses, através do ministro da\nJustiça, para que votassem em Protógenes Guimarães. No dia 12 de\nnovembro de 1935 realizaram-se novas eleições, vencidas por um voto de\ndiferença pelo almirante Protógenes. As relações entre Vargas e Flores\nda Cunha deterioraram-se aceleradamente a partir dessa disputa\neleitoral, e às vésperas da decretação do Estado Novo (novembro de 1937)\nFlores da Cunha acabaria renunciando ao governo gaúcho e partindo para o\nexílio.\n\nDe Volta à Caserna\n\nDe fevereiro de 1936 a março de 1937 o general Barcelos comandou a 8^a^\nBrigada de Infantaria, e em dezembro seguinte assumiu o comando da 7^a^\nRegião Militar, sediada em Recife. Promovido a general de divisão em\njunho de 1938, deixou o comando da 7^a^ RM em agosto.\n\nPresidente da Comissão Central de Requisições do Exército a partir de\njaneiro de 1939, comandou até 1942 a 4^a^ Região Militar e a 4^a^\nDivisão de Infantaria, ambas em Minas Gerais. Ainda em 1942 desempenhou\nas funções de inspetor do 3^o^ Grupo de Regiões Militares e, em\ndezembro, foi nomeado chefe da Comissão do Rio de Janeiro na Comissão\nMista de Defesa Brasil-Estados Unidos, criada para regular a\nparticipação das forças militares dos dois países na defesa continental.\nPermaneceu na comissão até 1944.\n\nDe 1943 a 1945 integrou a Comissão de Promoções do Exército, e em\ndezembro de 1944 tornou-se chefe do Estado-Maior do Exército, cargo que\ncontinuou a ocupar, mesmo depois da queda de Getúlio Vargas\n(29/10/1945), até fevereiro de 1946.\n\nFaleceu no Rio de Janeiro em 1946.\n\nFoi casado com Olga de Carvalho Barcelos.\n\nRenato Lemos\n\n**FONTES:**ASSEMB. NAC. CONST. 1934. *Anais*; CÂM. DEP. *Deputados*;\n*Cronologia da Assembleia*; *Encic. Mirador*; GODINHO, V.\n*Constituintes*; *Grande encic. Delta*; LAGO, L. *Generais*; MIN.\nGUERRA. *Almanaque* (1944); MIN. REL. EXT. *Relatório*; NOVAIS, M.\n*História*; SILVA, H. *1930*; SILVA, H. *1932*; SILVA, H. *1933*; SILVA,\nH. *1934*; SILVA, H. *1935*; SILVA, H. *1937*; SILVA, H. *1944*.\n","ref":"**FONTES:**ASSEMB. NAC. CONST. 1934. *Anais*; CÂM. DEP. *Deputados*;\n*Cronologia da Assembleia*; *Encic. Mirador*; GODINHO, V.\n*Constituintes*; *Grande encic. Delta*; LAGO, L. *Generais*; MIN.\nGUERRA. *Almanaque* (1944); MIN. REL. EXT. *Relatório*; NOVAIS, M.\n*História*; SILVA, H. *1930*; SILVA, H. *1932*; SILVA, H. *1933*; SILVA,\nH. *1934*; SILVA, H. *1935*; SILVA, H. *1937*; SILVA, H. *1944*.\n","dic":"DHBPR"}
