{"title":"TAVARES, Arnaldo","cargoss":["Deputado federal"],"cargos_esp":[0],"datas_ini":[1928],"datas_fim":[1930],"estados":["RJ"],"autor":[0],"content":"**TAVARES, Arnaldo**\n\n\\*dep. fed. RJ 1928-1930.\n\n*Arnaldo Tavares* nasceu no Rio de Janeiro, então capital do Império, em\n11 de julho de 1873.\n\nBacharelou-se em direito no início da década de 1890 e de julho de 1894\na abril de 1897 foi promotor público na sua cidade natal.\n\nSua vida política teve início com sua eleição para deputado estadual no\nestado do Rio de Janeiro pelo Partido Republicano Fluminense. Assumiu\nsua cadeira na Assembleia Legislativa em Niterói 1901 e, reeleito para\nas legislaturas seguintes, nela permaneceu até 1912. Durante esse\nperíodo foi primeiro-secretário da Assembleia de 1904 a 1906 e\nprimeiro-vice-presidente da Mesa Diretora de 1907 a 1909.\nConcomitantemente, em 1904 foi eleito presidente da Câmara de São João\nda Barra (RJ), com mandato até 1910. No entanto, recusou o cargo, por já\nestar na Assembleia Estadual.\n\nEm 1928, em eleição suplementar, foi eleito deputado federal por seu\nestado natal. Assumiu sua cadeira na Câmara dos Deputados em 9 de maio e\nexerceu o mandato até dezembro de 1929. Reeleito em março de 1930, teve\no mandato interrompido em 23 de outubro de 1930, com a vitória da\nRevolução que levou Getúlio Vargas ao poder e extinguiu todos os órgãos\nlegislativos do país. Em dezembro do mesmo ano foi indicado membro do\nConselho Consultivo do estado do Rio de Janeiro.\n\nRetornou à Assembleia Legislativa fluminense em 1935, em meio ao\nprocesso de reconstitucionalização iniciado com a promulgação da\nConstituição Federal em julho de 1934. Foi indicado presidente da\nAssembleia Legislativa e nela permaneceu até 1936.\n\nFoi também foi secretário estadual de Interior e Justiça,\nvice-presidente do Instituto da Ordem dos Advogados no estado do Rio de\nJaneiro e ministro do Tribunal de Contas.\n\nFaleceu em Niterói em 1950.\n\nIoneide Piffano Brion de Souza\n\n**FONTES:** CÂM. DEP. *Deputados brasileiros*; *Bio*. Arnaldo Tavares.\nDisponível em:\n\\<http://carlosaadesa.wordpress.com/aspectos-culturais-sanjoanenses/parte-iv/\\>.\nAcesso em: 20/12/2010.\n","ref":"**FONTES:** CÂM. DEP. *Deputados brasileiros*; *Bio*. Arnaldo Tavares.\nDisponível em:\n\\<http://carlosaadesa.wordpress.com/aspectos-culturais-sanjoanenses/parte-iv/\\>.\nAcesso em: 20/12/2010.\n","dic":"DHBPR"}
