{"title":"TAVARES, Necésio José","cargoss":["Deputado federal","Deputado federal"],"cargos_esp":[0,0],"datas_ini":[1900,1892],"datas_fim":[1901,1893],"estados":["MG","MG"],"autor":["Luciana Pinheiro"],"content":"**TAVARES, Necésio José**\n\n\\*dep. fed. MG 1892-1893 e 1900-1901.\n\n*Necésio José Tavares* nasceu na vila de São Bento do Tamanduá, atual\nItapecerica (MG), no dia 22 de novembro de 1846, filho de José Antônio\nTavares e de Ana da Silva Tavares.\n\nCursou humanidades no Colégio do Caraça, tradicional instituição de\nensino de Minas Gerais entre o Império e a República. Transferindo-se\npara o Rio de Janeiro, então capital do Império, matriculou-se na\nAcademia de Medicina, instituição pela qual se diplomou em 1877.\nIngressou na política ainda no Império, quando foi eleito vereador no\nmunicípio mineiro de Juiz de Fora. Partidário dos ideais republicanos,\nem 1888 participou ativamente da criação do Partido Republicano Mineiro\n(PRM), do qual se tornou secretário quando da eleição da primeira\ncomissão executiva.\n\nApós a proclamação da República (15/11/1889) e a promulgação da\nConstituição de 24 de fevereiro de 1891, foi eleito para Câmara dos\nDeputados no Rio de Janeiro, então Distrito Federal, na vaga aberta em\ndecorrência do falecimento do deputado mineiro Astolfo Pio da Silva\nPinto. Assumiu uma cadeira em outubro de 1892 e exerceu o mandato até\ndezembro de 1893, quando se encerrou a legislatura.\n\nEm 1895 foi eleito para o Senado estadual mineiro para duas legislaturas\nconsecutivas. Renunciou a seu segundo mandato de senador estadual em\n1900 por ter sido eleito deputado federal por Minas Gerais. Em maio\ndesse mesmo ano retornou ao Rio de Janeiro e tomou posse de sua cadeira\nna Câmara dos Deputados, mas não concluiu o mandato. Faleceu no distrito\nde São Pedro do Pequeri, atual Pequeri (MG), no dia 10 de novembro de\n1901.\n\nEra casado com Jovita Campos de Assis.\n\nLuciana Pinheiro\n\n**FONTES:** CÂM. DEP. *Deputados brasileiros* (p.196); MONTEIRO, N.\n*Dicionário* (v.2, p.683).\n","ref":"**FONTES:** CÂM. DEP. *Deputados brasileiros* (p.196); MONTEIRO, N.\n*Dicionário* (v.2, p.683).\n","dic":"DHBPR"}
