{"title":"TOSTES, Olavo","cargoss":["Deputado federal"],"cargos_esp":[0],"datas_ini":[1930],"datas_fim":[1930],"estados":["MG"],"autor":["Luciana Pinheiro"],"content":"**TOSTES, Olavo**\n\n\\*dep. fed. MG 1930.\n\n*Olavo Tostes* nasceu em Miracema (RJ) no dia 31 de março de 1889, filho\nde Francisco Dias Tostes e de Fausta de Barros Tostes.\n\nFormou-se pela Faculdade de Direito do Rio de Janeiro, então Distrito\nFederal, e em seguida transferiu-se para Muriaé, município mineiro onde\niniciou a militância política e exerceu o mandato de vereador.\n\nEm março de 1930 foi eleito deputado federal por Minas Gerais na legenda\ndo Partido Republicano Mineiro (PRM) e em maio tomou posse na Câmara dos\nDeputados, no Rio de Janeiro. Teve o mandato interrompido em outubro, em\ndecorrência da vitória da revolução que levou Getúlio Vargas ao poder e\nextinguiu todos os órgãos legislativos do país. Mais tarde filiou-se à\nUnião Democrática Nacional (UDN).\n\nFaleceu em Muriaé no dia 15 de outubro de 1950.\n\nEra casado com Elvira de Barros Tostes. Seu filho Olavo Tostes Filho\nchegou a ser eleito deputado estadual em Minas Gerais, mas não tomou\nposse por ter escolhido atuar como juiz de direito no Rio de Janeiro.\n\nLuciana Pinheiro\n\n**FONTES:** CÂM. DEP. *Deputados brasileiros* (p.201); MONTEIRO, N.\n*Dicionário* (v.2, p.690).\n","ref":"**FONTES:** CÂM. DEP. *Deputados brasileiros* (p.201); MONTEIRO, N.\n*Dicionário* (v.2, p.690).\n","dic":"DHBPR"}
