{"title":"VARGAS, Getúlio","cargoss":["Deputado federal","Ministro da Fazenda","Presidente de associação ou confederação de empregados ou empregadores","Revolucionário ou revoltoso","Presidente da República","Constituinte","Senador","Presidente da República"],"cargos_esp":[0,0,0,0,0,0,0,0],"datas_ini":[1923,1926,1928,1930,1930,1946,1946,1951],"datas_fim":[1926,1927,1930,1930,1945,1946,1949,1954],"estados":["RS",0,"RS",0,0,0,"RS",0],"autor":["Paulo Brandi Cachapuz"],"content":"**VARGAS, Getúlio**\n\n\\*dep. fed. RS 1923-1926; min. Faz. 1926-1927; pres. RS 1928-1930; rev.\n1930; pres. Rep. 1930-1945; const. 1946; sen. RS 1946-1949; pres. Rep.\n1951-1954.\n\n*Getúlio Dornelles Vargas* nasceu em São Borja (RS) no dia 19 de abril\nde 1882, filho de Manuel do Nascimento Vargas e de Cândida Dornelles\nVargas. Ainda jovem, alterou o ano de nascimento para 1883, fato somente\ndescoberto durante a comemoração de seu centenário. Em 1902, ao realizar\nexames preparatórios para o curso de direito, Vargas declarou –\nprovavelmente pela primeira vez – uma idade diferente da real. Mais\ntarde, ao ingressar na Faculdade de Direito de Porto Alegre, em março de\n1904, apresentou uma certidão militar comprovadamente rasurada no trecho\nque informava a data de nascimento. Desde então, constou em registros e\ndocumentos oficiais, artigos e livros sobre sua pessoa, o ano de 1883\ncomo o de seu nascimento.\n\nVargas era descendente de uma família politicamente proeminente em São\nBorja, região de colonização jesuítica junto ao rio Uruguai, na\nfronteira com a Argentina, palco de rumorosas lutas no século XIX. Seu\navô paterno, Evaristo José Vargas, lutou como soldado voluntário da\nRepública de Piratini durante a Guerra dos Farrapos. Foi casado com\nLuísa Maria Teresa Vargas, com quem teve 14 filhos. Os avós maternos,\nSerafim Dornelles e Umbelina Dornelles, pertenciam a uma família\ntradicional, descendente de imigrantes portugueses dos Açores. Serafim\nDornelles foi major de milícias, próspero comerciante e também um dos\nmais ricos estancieiros de São Borja.\n\nO pai de Getúlio, Manuel do Nascimento Vargas, combateu na Guerra do\nParaguai, distinguindo-se como herói militar. Começou a guerra como\nsimples cabo para encerrá-la como tenente-coronel. Uma vez desligado do\nExército, estabeleceu-se como fazendeiro em São Borja e em 1872 casou-se\ncom Cândida Dornelles, com quem teve cinco filhos: Viriato, Protásio,\nGetúlio, Espártaco e Benjamim. No final do Império, tornou-se o chefe\npolítico local do Partido Republicano Rio-Grandense (PRR). Em 1893, já\nna República, combateu os federalistas que se insurgiram contra o\ngoverno de Júlio de Castilhos no Rio Grande do Sul, desencadeando a\nchamada Revolução Federalista. Bateu-se contra as tropas de Dinarte\nDornelles, tio materno de Getúlio e líder federalista no município, o\nque contribuiu para que se introduzisse e permanecesse viva dentro da\nfamília Vargas a acirrada e histórica contradição entre “chimangos”\n(republicanos) e “maragatos” (federalistas). A guerra civil terminou em\n1895 com a vitória dos republicanos e o PRR tornou-se o partido\ndominante no estado, sob a direção de Júlio de Castilhos e seu sucessor\nAntônio Augusto Borges de Medeiros. Manuel Vargas recebeu uma promoção a\ncoronel de Floriano Peixoto e outra a general de brigada, concedida por\nPrudente de Morais. Em 1907 foi intendente – cargo correspondente ao do\natual prefeito – de São Borja, o mesmo acontecendo mais tarde com seus\nfilhos Viriato e Protásio.\n\nGetúlio Vargas fez os estudos primários na sua cidade natal. Em 1897,\nseguiu para Ouro Preto, na época capital de Minas Gerais, onde já se\nencontravam os irmãos mais velhos, matriculando-se no curso de\nhumanidades. No ano seguinte, porém, os três foram obrigados a deixar\nOuro Preto, devido ao envolvimento de Viriato e Protásio numa briga de\nestudantes que resultou na morte de um jovem paulista de família\ntradicional, Carlos de Almeida Prado. Viriato chegou a ser pronunciado\npelo promotor público, fato que mais tarde viria comprometer os Vargas\nna política gaúcha.\n\nEm 1898, Getúlio decidiu seguir carreira militar, solicitando matrícula\nna Escola Preparatória e de Tática de Rio Pardo (RS), primeiro passo no\ncaminho do oficialato. Getúlio teve de esperar um ano por falta de vaga,\nsegundo Barros Vidal. Com o objetivo de facilitar sua matrícula na\nescola de Rio Pardo, alistou-se em fevereiro de 1899 no 6^o^ Batalhão de\nInfantaria, sediado em São Borja. Foi rapidamente promovido a\nsegundo-sargento. Em março de 1900, matriculou-se afinal na Escola\nPreparatória e de Tática de Rio Pardo. Em maio de 1902, porém\ndesligou-se da escola, em solidariedade a alguns colegas que haviam sido\nexpulsos por um incidente disciplinar. Voltou à tropa, dessa vez no\n25^o^ Batalhão de Infantaria, sediado em Porto Alegre. Predisposto a\nabandonar a carreira das armas, matriculou-se na Escola Brasileira com o\nintuito de completar o curso secundário, já decidido a estudar direito.\nNo começo de 1903, quando se preparava para deixar o Exército, surgiu\numa ameaça de conflito armado entre o Brasil e a Bolívia, em decorrência\nda disputa pelo território do Acre. Apresentando-se à sua unidade,\npartiu em fevereiro para Corumbá (MS), no então estado de Mato Grosso. A\nQuestão do Acre, porém, foi resolvida pela diplomacia do barão do Rio\nBranco e não pelas armas, como esperava Vargas.\n\nEm dezembro de 1903, após dar baixa do Exército, Getúlio ingressou na\nFaculdade de Direito de Porto Alegre como aluno ouvinte. Em março de\n1904, matriculou-se no segundo ano da faculdade, após prestar exames das\ncadeiras que constituíam o primeiro ano do curso de direito. Na\nfaculdade, revelou-se discípulo fiel do castilhismo, integrando-se à\nmocidade estudantil republicana. O positivismo – ideologia oficial do\nPRR – teve, porém, uma influência limitada em sua formação intelectual.\nQuando estudante, Getúlio interessou-se mais por Herbert Spencer e\nCharles Darwin do que por Auguste Comte. Cultivou também o gosto pela\nliteratura. Admirador de Émile Zola, publicou um artigo na revista\nestudantil *Panthum* enaltecendo sua posição frente ao caso Dreyfus e\nsuas tendências progressistas.\n\nVargas começou a trilhar o caminho da política gaúcha em agosto de 1906,\nao ser escolhido orador dos estudantes na homenagem prestada ao\npresidente eleito Afonso Pena, quando de sua visita a Porto Alegre. Em\n1907, ingressou efetivamente na política partidária republicana,\njuntamente com toda uma geração de estudantes gaúchos que se\nnotabilizaria na política nacional e que seria chamada por Joseph Love\nde a “geração de 1907”. Nesse ano, o Partido Federalista desencadeou uma\ngrande campanha para suplantar o domínio do PRR, lançando a candidatura\nde Fernando Abbot, um republicano dissidente, às eleições de novembro\npara o governo do estado. Borges de Medeiros, que terminava seu segundo\nmandato no Executivo gaúcho, decidiu não concorrer à reeleição,\nindicando a candidatura de Carlos Barbosa Gonçalves.\n\nCom seus colegas de faculdade João Neves da Fontoura, Firmino Paim\nFilho, Maurício Cardoso e numerosos estudantes, Vargas fundou o Bloco\nAcadêmico Castilhista em apoio à candidatura republicana. O bloco contou\ntambém entre seus membros com dois cadetes da Escola de Guerra de Porto\nAlegre que viriam a desempenhar um papel importante na vida de Vargas:\nEurico Gaspar Dutra e Pedro Aurélio de Góis Monteiro. Com o apoio do\nsenador José Gomes Pinheiro Machado, o bloco lançou o jornal *O Debate*,\ndirigido por Paim Filho e do qual Vargas tornou-se secretário de\nredação. Eleito sem dificuldade em novembro, Carlos Barbosa iria\ngovernar o Rio Grande do Sul de 1908 a 1913, no intervalo entre dois\nlongos períodos de governo de Borges de Medeiros.\n\nEm dezembro de 1907, Vargas formou-se em ciências jurídicas e sociais e\nmais uma vez foi escolhido o orador da turma. Sua participação na\ncampanha de Carlos Barbosa impressionara favoravelmente a Borges, que,\ncomo chefe do PRR, dispunha de enorme poder pessoal e detinha a decisão\nfinal sobre todas as coisas, das questões mais importantes às mais\nsecundárias. Assim, em janeiro de 1908, Vargas foi nomeado segundo\npromotor público do Tribunal de Porto Alegre.\n\nUm de seus primeiros biógrafos, Paul Frischauer, comentando a\nrepercussão pública do ato de nomeação, aludiu a uma caricatura\npublicada no jornal oposicionista *Petit Journal*. No desenho, via-se\nBorges de Medeiros, cercado por várias crianças, cujos rostos eram os\ndos redatores de *O Debate*. “Bom, meninos”, perguntava Borges, “que\nquerem agora? Uma caixinha de chocolate para cada um?” E a resposta de\nGetúlio: “Não, quero ser promotor público”.\n\nNa verdade, como escreveu o promotor e historiador gaúcho Miguel\nFrederico do Espírito Santo, o exercício de cargo público e, para os\nbacharéis de Direito, o de promotor público, era um reconhecimento do\npartido por serviços prestados.\n\nAlguns meses mais tarde, o nome de Getúlio foi incluído na lista dos\ncandidatos do PRR à Assembleia dos Representantes, como era denominada\noficialmente assembleia gaúcha. Vargas passou o cargo de promotor a João\nNeves e voltou a São Borja, onde constituiu uma banca de advocacia e\nestendeu os contatos com os correligionários de seu pai, garantindo\napoio eleitoral à sua candidatura.\n\nO Deputado Getúlio Vargas\n\nEm março de 1909, Vargas foi eleito à Assembleia dos Representantes na\nlegenda do PRR. A Assembleia gaúcha era uma instituição com funções\nbastante limitadas, devido à extrema concentração de poderes do\nExecutivo estadual. Pela Constituição rio-grandense, o presidente do\nestado detinha uma autoridade legal equivalente a um poder ditatorial. A\nAssembleia reunia-se durante três meses por ano com o fim exclusivo de\nvotar o orçamento e examinar as contas do governo. Getúlio iria\naproveitar os longos períodos de recesso parlamentar para dedicar-se às\nsuas atividades de advogado em São Borja.\n\nEm março de 1911, casou-se com Darci Lima Sarmanho, filha de Antônio\nSarmanho, estancieiro e diretor de banco em São Borja. Desse casamento,\nrealizado apenas no registro civil, nasceriam os filhos Lutero, Jandira,\nAlzira, Manuel Antônio e Getúlio.\n\nEm 1913, foi novamente eleito deputado estadual, mas renunciou ao\nmandato na sessão inaugural da legislatura, em outubro, por desacordo\ncom o governador Borges de Medeiros. Em discurso na Assembleia, deu a\nentender que a renúncia era um protesto contra a intervenção de Borges\nnas eleições de Cachoeira, atual Cachoeira do Sul. Nesse município, a\nlista de candidatos do PRR havia sido modificada por João Neves e Odon\nCavalcanti. Os deputados eleitos foram preteridos pelo governador e\nobrigados a renunciar aos seus mandatos.\n\nO rompimento não oficial com Borges ocorreu ao mesmo tempo em que o\nirmão Viriato foi obrigado a deixar a intendência e a chefia do PRR em\nSão Borja, em virtude da abertura de inquérito policial para apuração de\ndenúncias de contrabando e outros delitos. O autor das denúncias era o\nmédico Benjamin Torres, antigo protegido político da família Vargas,\nque, ao romper com eles, aliou-se Rafael Escobar, inimigo ferrenho do\ngeneral Manuel Vargas.\n\nInterrompida a carreira parlamentar, Getúlio voltou a São Borja e à sua\nbanca de advocacia. Durante três anos, permaneceram estremecidas suas\nrelações com Borges de Medeiros, que chegou a incentivar a disputa pelo\npoder entre grupos republicanos de São Borja. Com o assassinato de\nBenjamim Torres em março de 1915, as suspeitas recaíram sobre Viriato,\nque se refugiou na Argentina até ser absolvido. Entrementes, Borges\nreconduziu o general Manuel Vargas à chefia local do PRR.\n\nNo final de 1916, Borges de Medeiros buscou reconciliar-se com Getúlio,\noferecendo-lhe a chefia de polícia de Porto Alegre. Getúlio recusou o\ncargo, mas posteriormente aceitou sua inclusão na lista de candidatos à\nAssembleia. Eleito em 1917, recuperou rapidamente o tempo perdido fora\nda política. Prestigiado por Borges de Medeiros, começou a desempenhar\nna Assembleia as funções de líder do PRR, embora sem diploma expresso.\nComo explicou João Neves, “líder majoritário não havia. A tradição\ncastilhista desconhecia a figura do líder. Talvez porque o Partido\nRepublicano até ali ocupara unanimemente todas as cadeiras. Líder dava a\nideia de divisão, de luta, de fracionamento”.\n\nNa Assembleia, Getúlio tomou algumas iniciativas isoladas e pessoais\npara congregar as forças políticas gaúchas. Em outubro de 1917, ao\nmanifestar o apoio do governo do estado à declaração de guerra do Brasil\ncontra a Alemanha, conclamou os deputados do PRR e do Partido\nFederalista a superarem suas divergências e “ante o sentimento de perigo\ncomum unirem-se sob a mesma bandeira”. Quando o armistício foi assinado\nem novembro de 1918, defendeu a concórdia entre os povos, após denunciar\na “arrogância” do Império alemão e o “militarismo prussiano”. O discurso\nfoi aplaudido não só por seus correligionários, mas também pelos\ndeputados federalistas.\n\nEntretanto, em sua opinião, a guerra europeia trouxera uma lição nova,\ncomprovando “a inépcia” dos parlamentos “para a solução dos mais graves\nproblemas que agitam a vida nacional dos países onde vigora”. Ao\nprotesto de que não se deveria confundir a presença do governo na vida\nnacional com essa presença na emergência de guerra, redarguiu: “Tanto\nnão é assim que, após a terminação da guerra, os poderes públicos\ncontinuaram a intervir na atividade privada, mantendo os serviços com o\nintuito de restringir a ganância dos particulares”.\n\nSua reeleição para a Assembleia em 1921 foi assegurada com\ntranquilidade, porém com a situação política nacional tumultuada pela\ndisputa em torno da sucessão do presidente da República Epitácio Pessoa.\nBorges de Medeiros levantou-se contra a candidatura de Artur Bernardes,\narticulada por Minas Gerais e São Paulo, denunciando o arranjo político\ncomo uma forma de garantir recursos para o esquema de valorização do\ncafé, quando o país necessitava de finanças equilibradas. Getúlio,\nacompanhando a posição do PRR, participou da campanha da Reação\nRepublicana, movimento em favor da candidatura de Nilo Peçanha\narticulado pelo Rio Grande do Sul, Bahia, Pernambuco e estado do Rio.\n\nApesar de acirrada disputa, Artur Bernardes venceu as eleições em março\nde 1922. Sua vitória comprovava o poderio eleitoral da aliança entre\nMinas e São Paulo, os dois estados de maior expressão socioeconômica do\npaís, detentores do controle da vida política nacional desde o princípio\ndo século. Essa aliança, resultado lógico dos interesses econômicos\ncomuns aos dois estados cafeeiros, tinha por corolário um esquema de\nrevezamento na presidência da República, conhecido como a “política do\ncafé com leite”.\n\nEntretanto, a eleição de Bernardes foi contestada pela oposição civil e,\nprincipalmente, por jovens oficiais do Exército, que se tornariam\nconhecidos como os “tenentes”. A crise culminou com a Revolta de 5 de\nJulho de 1922, que foi imediatamente sufocada pelo governo, mas marcou o\ninício das revoltas tenentistas da década de 1920. A rebelião contou com\na adesão das guarnições de Campo Grande, de Niterói, então capital do\nestado do Rio de Janeiro, e do Rio de Janeiro, então Distrito Federal, e\nnesta última cidade, especialmente a guarnição do forte de Copacabana,\nque caiu na manhã do dia 6, no episódio que ficou conhecido como Os 18\ndo Forte. Diante do levante, seguindo a nova orientação do PRR, expressa\nno manifesto Pela ordem de Borges de Medeiros, Getúlio defendeu a\ndissolução da Reação Republicana e prestou solidariedade a Epitácio\nPessoa e Artur Bernardes.\n\nEm outubro de 1922 Vargas foi indicado e eleito à Câmara Federal para\ncompletar o mandato vago por morte do deputado gaúcho Rafael Cabeda.\nEntretanto, devido à proximidade das eleições governamentais no Rio\nGrande do Sul, adiou sua partida para o Rio. Pela primeira vez, desde\n1907, ocorreu uma situação competitiva na sucessão gaúcha. Borges de\nMedeiros, candidato ao quinto mandato de cinco anos, defrontou-se com a\noposição dos federalistas, dos republicanos dissidentes e dos\ndemocráticos, unidos em torno da candidatura de Joaquim Francisco de\nAssis Brasil. O pleito realizou-se em 25 de novembro de 1922 em meio a\nrumores de um levante contra Borges e acusações de fraude de ambos os\nlados. Vargas foi designado presidente da Comissão de Constituição e\nPoderes da Assembleia, encarregada de apurar os votos e proclamar o\ncandidato vencedor.\n\nEm 17 de janeiro de 1923, a comissão proclamou a vitória de Borges, por\n106 mil votos contra 32 mil. Segundo uma versão que circulou na época, a\ncomissão chegara anteriormente à conclusão de que Borges perdera a\ndisputa, não conseguindo a maioria de 3/4 dos votos, exigidos pela\nConstituição estadual para sua reeleição. Diante do impasse, Vargas e\nseus dois colegas da comissão, os deputados Ariosto Pinto e José\nVasconcelos, teriam ido à presença de Borges para expor a situação. Ao\nrecebê-los, Borges teria declarado efusivamente: “Sei que vêm\ncumprimentar-me, porque estou reeleito.” Sem jeito de contrariar o\nchefe, a comissão se teria retirado sem dizer a que vinha, reformulando\nem seguida seus cálculos.\n\nEm 25 de janeiro de 1923, Assis Brasil e antigos caudilhos federalistas\ninsurgiram-se com o objetivo de depor Borges, desencadeando violenta\nguerra civil no estado. Nomeado tenente-coronel por decreto de Borges,\nVargas partiu para São Borja, assumindo o comando do 7^o^ Corpo\nProvisório, tropa irregular composta de civis recrutados. Mas não chegou\na participar dos combates, pois, ameaçado de perder sua cadeira na\nCâmara Federal, interrompeu a luta e foi para o Rio de Janeiro assumir\nmais uma missão delegada pelo PRR.\n\nNa Câmara, Getúlio trabalhou para evitar a intervenção federal em seu\nestado, buscando contornar as dificuldades geradas pelo apoio\nanteriormente dado por Borges à Reação Republicana. Desenvolveu também\num esforço de aproximação com os representantes gaúchos de oposição,\nampliou suas relações com os parlamentares de outros estados, sobretudo\nde São Paulo, e estabeleceu vínculos com o poder central que\nbeneficiaram a imagem do Rio Grande do Sul junto aos centros decisórios\nda política nacional. A guerra civil no Rio Grande do Sul terminou em\ndezembro de 1923 por um acordo de paz assinado sob a égide do governo\nfederal em Pedras Altas, estância de Assis Brasil. O Pacto de Pedras\nAltas vedou nova reeleição de Borges, mas garantiu o mandato que exercia\nno Executivo estadual.\n\nReeleito deputado federal em 1924, Vargas assumiu a liderança da bancada\nrepublicana gaúcha na Câmara. Nessa condição, apoiou as medidas de\nexceção propostas por Bernardes, às voltas com generalizado e\npersistente descontentamento da opinião pública e intermitentes\nrebeliões tenentistas. Entre outros movimentos armados, Bernardes\nenfrentou a Revolta de 1924 em São Paulo, chefiada pelo general Isidoro\nDias Lopes, e a Coluna Prestes, contingente rebelde liderado pelo\ncapitão Luís Carlos Prestes e o major Miguel Costa que percorreu o\ninterior do país de abril de 1925 até fevereiro de 1927, dando combate\nàs tropas legais.\n\nEm 1925, Vargas participou da comissão encarregada de estudar a reforma\nda Constituição de 1891. A revisão constitucional foi proposta por\nBernardes, visando a ampliar o poder do governo central perante os\nestados. Vargas concordou com as modificações pedidas, condenando o\n“antirrevisionismo sistemático”. Na ocasião, manifestou-se também contra\no ensino religioso nas escolas. Em maio de 1926, passou a integrar a\nComissão de Finanças da Câmara, na qual permaneceria até o final de seu\nmandato, em novembro.\n\nApesar da tensão causada pelas rebeliões tenentistas e pelo estado de\nsítio em vigor, a sucessão de Bernardes foi das mais tranquilas da\nRepública Velha. Sem qualquer oposição, Washington Luís e Fernando de\nMelo Viana, até então presidentes respectivamente de São Paulo e Minas\nGerais, foram eleitos presidente e vice-presidente da República em março\nde 1926.\n\nMinistro da Fazenda\n\nEm 15 de novembro de 1926, Washington Luís assumiu a presidência,\nempossando Vargas no Ministério da Fazenda. Essa escolha tinha o claro\npropósito de reconciliar o Rio Grande do Sul com a aliança Minas-São\nPaulo. Além disso, o programa de estabilização financeira anunciado por\nWashington Luís era bem visto por Borges de Medeiros, que expressara\nrepetidas vezes seu interesse na estabilidade dos preços internos.\nVargas manifestou-se a princípio contra sua indicação, alegando, em\ncarta a Borges, que não possuía qualificação suficiente em finanças, mas\nacabou sendo convencido pelo presidente gaúcho a aceitar a designação.\n\nA passagem de Vargas pelo Ministério da Fazenda duraria pouco mais de um\nano, correspondendo à época de êxitos da política econômico-financeira\nde Washington Luís. Vargas tratou basicamente de implementar a reforma\nmonetária, aprovada pelo Congresso ainda em dezembro de 1926. A reforma\ninstituiu o retorno do padrão-ouro e criou um novo fundo de\nestabilização cambial chamado Caixa de Estabilização, à qual caberia\nemitir papel-moeda contra reserva de 1% de ouro. Passaram a existir dois\nmeios circulantes no país, um conversível e outro não, e a taxa de\ncâmbio foi fixada acima dos índices de mercado com objetivo de favorecer\nas exportações e proteger a indústria nacional.\n\nEm agosto de 1927, Borges de Medeiros indicou as candidaturas de Vargas\ne João Neves da Fontoura respectivamente à presidência e à\nvice-presidência do Rio Grande do Sul. Embora impossibilitado pelo Pacto\nde Pedras Altas de concorrer à nova eleição, Borges havia conservado a\nchefia do PRR, o que lhe garantia a escolha de seu substituto. Por outro\nlado, tanto Vargas como João Neves tinham uma concepção da política, se\nnão menos autoritária que Borges, ao menos mais liberal em relação às\noposições gaúchas. O “liberalismo” de Vargas era considerado excepcional\nmesmo dentro do PRR, sobretudo por seus membros mais antigos, dedicados\nseguidores do castilhismo. Como naquele momento, segundo Alexandre\nBarbosa Lima Sobrinho em seu clássico livro sobre a Revolução de 1930,\n“urgia encontrar para o governo gaúcho, depois de lutas tão ásperas, um\nhomem conciliador que os partidos e as facções recebessem com a mesma\nboa vontade”, Vargas era o candidato ideal.\n\nEm outubro de 1927, uma convenção do PRR aprovou por aclamação a chapa\nVargas – João Neves. A Aliança Libertadora, de oposição, fundada em 1924\npor federalistas e dissidentes republicanos, não apresentou candidato,\nmas colocou grandes esperanças na chapa republicana, vendo em sua\nvitória a possibilidade de um governo mais liberal. Vargas foi eleito em\nnovembro seguinte, sem que fosse preciso participar da campanha em seu\nestado. Em dezembro, exonerou-se do Ministério da Fazenda e em discurso\npronunciado ainda no Rio de Janeiro insinuou que as divergências no Rio\nGrande do Sul deveriam ser abandonadas no interesse da paz com os\nlibertadores.\n\nPresidente do Rio Grande do Sul\n\nEm 25 de janeiro de 1928, Getúlio assumiu a presidência do Rio Grande do\nSul. Sua primeira preocupação foi estabelecer um *modus vivendi* com\nBorges a fim de assegurar a independência político-administrativa de seu\ngoverno. Vargas iria governar com certa autonomia, apesar da influência\npreponderante de Borges nos assuntos de política partidária. O primeiro\npasso nesse sentido foi a nomeação dos secretários de estado a partir de\nsua própria escolha, sem levar em conta as indicações feitas por Borges.\nPara a Secretaria do Interior e Justiça foi nomeado Osvaldo Aranha, o\nmais jovem representante da nova geração de republicanos gaúchos, famoso\npor sua combatividade durante a guerra civil de 1923. Firmino Paim\nFilho, amigo de Vargas desde os tempos da faculdade, recebeu o cargo de\nsecretário da Fazenda. João Fernandes Moreira ocupou a Secretaria de\nObras Públicas e Florêncio de Abreu, seu concunhado, a chefia de\npolícia.\n\nVargas reorientou a ação econômica e política do governo gaúcho,\nconseguindo resultados amplamente positivos. No plano econômico, tomou\numa série de medidas de amparo à lavoura e à pecuária, atendendo,\nsobretudo às reivindicações dos produtores de charque e arroz.\n\nEm junho de 1928, obteve autorização da Assembleia, inclusive com o voto\nda oposição, para contratação de empréstimo externo de 42 milhões de\ndólares, tendo em vista o resgate e consolidação de dívidas e a criação\ndo Banco do Estado do Rio Grande do Sul (BERGS), sob controle\nmajoritário estatal. O banco ampliou a disponibilidade de créditos e\nflexibilizou critérios para sua concessão. O grosso de seus recursos,\nnos primeiros tempos, foi destinado ao setor pecuário, afetado por\nviolentas flutuações nos preços e na produção desde o final da Primeira\nGuerra Mundial.\n\nEm novembro do mesmo ano, Vargas conseguiu a aprovação no Congresso da\nLei de Desnacionalização do Charque, que considerava estrangeiro todo\ncharque brasileiro que transitasse por território uruguaio na demanda de\nportos nacionais. A medida visava a coibir o contrabando de charque\nuruguaio que entrava no Brasil, disfarçado como produto gaúcho ou\nmato-grossense. Vargas obteve também importantes concessões econômicas\ndo governo federal para diminuir os custos do frete no Rio Grande do\nSul. Nesse caso, incluíram-se o auxílio para a expansão do sistema\nferroviário rio-grandense e a transferência dos portos de Pelotas e\nTorres para o controle do estado. Seu governo também subsidiou o\nnascente comércio exportador de charque e arroz, diminuindo as tarifas\nferroviárias para os dois produtos.\n\nOutra forma de atuação de Vargas foi o estímulo à organização dos\nsindicatos de produtores. O êxito do sindicato dos arrozeiros, criado em\n1926 com o objetivo de controlar a oferta e manter os preços altos,\npropiciou um surto geral de “associatividade” no estado no final da\ndécada de 1920. Ao término de seu primeiro ano de governo, Vargas expôs\no seu pensamento a respeito: “Ao Estado cabe estimular o surgimento\ndessa mentalidade associativa, valorizada com sua autoridade, exercendo\nsobre ela certo controle para lhe evitar os excessos. [...] Organizados\npara a defesa dos interesses comuns, [os sindicatos] têm uma dupla\nvantagem: para os associados a união torna-os mais fortes, para o\ngoverno, o trato direto com os dirigentes de classe facilita, pelo\nentendimento com poucos, a satisfação do interesse de muitos”.\n\nNo plano político, Vargas buscou também um acordo com a oposição,\nconseguindo pôr termo a quase 30 anos de violentas lutas\ninterpartidárias no estado. A oposição, reorganizada em março de 1928 em\ntorno do Partido Libertador (PL), sucessor da Aliança Libertadora,\nobteve garantias políticas jamais concedidas por Borges de Medeiros.\nVargas incluiu na administração estadual membros do PL e tomou medidas\npara assegurar eleições honestas. Em março de 1929, por exemplo, mandou\nrecontar os votos numa eleição municipal que o PL considerava\nfraudulenta, permitindo à oposição conquistar uma nova cadeira na\nAssembleia dos Representantes. O PRR não opôs restrições a esses\nesforços conciliadores, apesar de todo o peso da tradição castilhista.\nAssim, nesse mesmo ano de 1929, Vargas teve condições de unificar a\npolítica do Rio Grande do Sul e empreender a primeira tentativa direta\nde um político gaúcho para chegar à presidência da República.\n\nA Aliança Liberal\n\nA candidatura de Vargas às eleições presidenciais de 1930 nasceu do\nacordo entre o Rio Grande do Sul e Minas Gerais, marcando o rompimento\ndos dois estados com o governo federal. Foi o presidente de Minas,\nAntônio Carlos Ribeiro de Andrada, quem iniciou as articulações para uma\ncandidatura de oposição. Antônio Carlos esperava ser o próximo\npresidente, tendo em conta o esquema de revezamento entre Minas e São\nPaulo no governo federal. Com efeito, a eleição de um candidato de São\nPaulo em 1926 implicara um acordo tácito pelo qual Minas voltaria ao\npoder em 1930. No quadriênio Washington Luís surgiram, porém,\ndivergências na “política café com leite”, a propósito do programa de\nestabilização financeira e da “valorização do café”. Isto não seria\ngrave não fossem pretensões dos grupos políticos de São Paulo em manter\no controle direto do governo federal. No decorrer de 1928, tornou-se\nclaro o interesse de Washington Luís em apoiar a candidatura de Júlio\nPrestes, antigo líder do Partido Republicano Paulista (PRP) e seu\nsucessor no governo paulista.\n\nAntônio Carlos buscou o apoio do Rio Grande do Sul a fim de se opor a\nesses planos. Como observou Boris Fausto, “para lançar o Rio Grande do\nSul em uma contenda que representaria uma ruptura na acomodação com o\ngoverno federal era necessário oferecer ao estado a própria\npresidência”. Do lado gaúcho, João Neves tornou-se o grande articulador\ndessa solução. Em dezembro de 1928 ele acenou com a possibilidade de uma\ncandidatura gaúcha, ao ser sondado pelo deputado mineiro Afrânio de Melo\nFranco.\n\nWashington Luís pressentiu a cisão com os mineiros e procurou\ncomprometer o Rio Grande do Sul com seus planos. Ainda em 1928, informou\na Vargas, por intermédio do deputado gaúcho José Antônio Flores da\nCunha, que se dispunha a considerar um candidato gaúcho, se porventura\nMinas bloqueasse o nome de Júlio Prestes. Dessa forma, o Rio Grande,\nterceiro estado em importância eleitoral e tradicionalmente um contendor\nde segundo plano, tornava-se a peça-chave do jogo sucessório.\n\nEm janeiro de 1929, Vargas soube por autorização expressa de Antônio\nCarlos que Minas estava definitivamente deliberada a recusar o nome de\nJúlio Prestes e a apoiar uma candidatura gaúcha ao Catete. Getúlio\nrespondeu em termos evasivos: não repeliu a ideia, mas lembrou os\nvínculos de cooperação entre seu governo e a administração federal. Ao\nque tudo indicava, Minas se atiraria isolada a uma luta, sem grandes\npossibilidades de êxito. Quando muito, conseguiria reunir à sua volta os\npequenos partidos de oposição que haviam surgido na década de 1920: a\ndissidência republicana paulista, que deu origem ao Partido Democrático\n(PD), e a carioca, que em 1928 se uniu aos paulistas e aos libertadores\ngaúchos no Partido Democrático Nacional.\n\nDe janeiro a maio de 1929, os entendimentos entre Minas e o Rio Grande\npermaneceram em suspenso. Enquanto isso, Washington Luís insistia em que\no debate sucessório fosse iniciado apenas em setembro, isto é, seis\nmeses antes das eleições marcadas para março de 1930. Em maio, porém, a\nquestão sucessória foi levantada no Congresso Nacional. Vargas escreveu\nentão uma carta confidencial ao presidente, declarando-se à margem das\nmanobras sucessórias e prometendo-lhe o apoio do PRR “no momento\npreciso”.\n\nEm junho, João Neves encontrou-se no Rio com o secretário do Interior de\nMinas, Francisco Campos, incumbido por Antônio Carlos de obter uma\nresolução definitiva do Rio Grande do Sul. João Neves apressou-se em\naceitar o acordo proposto por Minas, sem consultar previamente Vargas ou\nBorges de Medeiros. As conversações resultaram na assinatura de um pacto\nsecreto de aliança entre Minas e o Rio Grande do Sul, firmado em 17 de\njunho por João Neves, Francisco Campos e o deputado José Bonifácio\nRibeiro de Andrada, irmão de Antônio Carlos. Conhecido como o Pacto do\nHotel Glória, o acordo prescrevia o veto ao nome de Júlio Prestes e a\napresentação de um candidato gaúcho à sucessão presidencial,\nnomeadamente Vargas ou Borges de Medeiros. Ficou também consignado que o\nacordo só entraria em vigor após a homologação de Borges. Depois de\nmuita hesitação, Borges e Vargas aceitaram os termos do acordo.\n\nEm 11 de julho, Vargas escreveu a Washington Luís, comunicando sua\ncandidatura, mas deixando claro que não oporia obstáculo a uma solução\ndiferente caso o nome de Júlio Prestes fosse posto de lado. O presidente\nnão se abriu a qualquer espécie de entendimento. Comunicou aos demais\ngovernadores de estado a candidatura de Júlio Prestes, recebendo o apoio\nde todos, com exceção de João Pessoa, da Paraíba, que aceitara concorrer\nà vice-presidência na chapa oposicionista. O convite a João Pessoa fora\nfeito à última hora, depois da recusa da Bahia, Pernambuco e Rio de\nJaneiro, estados de maior importância eleitoral que a Paraíba.\n\nEm 30 de julho, a comissão executiva do Partido Republicano Mineiro\n(PRM) aprovou por unanimidade as candidaturas de Vargas e João Pessoa à\npresidência e vice-presidência da República, respectivamente. No dia\nseguinte, o PL deu apoio aos seus nomes, integrando-se ao PRR na Frente\nÚnica Gaúcha (FUG). O próximo passo foi a criação no início de agosto da\nAliança Liberal, coligação oposicionista de âmbito nacional, tendo como\npresidente o mineiro Afonso Pena Júnior e vice-presidente o gaúcho\nIldefonso Simões Lopes.\n\nA Aliança Liberal congregou a ampla maioria dos representantes políticos\ndo Rio Grande ao Sul, Minas e Paraíba, à qual veio juntar-se o PD de São\nPaulo e o PD do Distrito Federal. A campanha foi marcada por uma série\nde recuos e tentativas de conciliação com o governo federal,\nempreendidas, sobretudo, por Vargas. Em meados de agosto, Vargas propôs\na seus aliados a formação de uma nova chapa de oposição, composta de\ncandidatos de Pernambuco e do Ceará, a fim de ampliar a frente\nantipaulista. Ante a recusa dos presidentes dos dois estados, Vargas\nsugeriu novamente a apresentação de um terceiro candidato. Mas\nWashington Luís manteve-se intransigente em relação à candidatura Júlio\nPrestes.\n\nEm 12 de setembro, uma convenção de delegados dos partidos dominantes de\n17 estados, liderados por São Paulo, homologou as candidaturas de Júlio\nPrestes para a presidência e de Vital Soares, governador da Bahia, para\na vice-presidência da República. Oito dias depois, a Aliança Liberal, em\nconvenção realizada no Rio, aprovou a chapa Vargas-João Pessoa e sua\nplataforma eleitoral, redigida pelo gaúcho Lindolfo Collor. O programa,\nsegundo Boris Fausto, “refletia as aspirações das classes dominantes\nregionais não associadas ao núcleo cafeeiro e tinha por objetivo\nsensibilizar a classe média”. Na parte econômica, “defendia a\nnecessidade de se incentivar a produção nacional em geral e não apenas o\ncafé, combatia o esquema de valorização do café e por isso mesmo não\ndiscordava nesse ponto da política de Washington Luís”. Insinuava a\nnecessidade de industrialização, mantendo, porém, velha distinção entre\nindústrias naturais e artificiais. Preconizava medidas de proteção aos\ntrabalhadores, como a extensão do direito à aposentadoria, a aplicação\nda Lei de Férias e a regulamentação do trabalho do menor e da mulher.\nMas a grande arma e denominador comum da Aliança Liberal, para Boris\nFausto, era “a defesa da representação popular, através do voto secreto\ne da designação de magistrados para a presidência das mesas eleitorais”.\nOutra proposta de grande efeito na campanha foi a anistia ampla a todos\nos presos políticos processados e perseguidos desde 5 de julho de 1922.\n\nA partir das convenções de setembro, ficou perfeitamente definida a\nsituação de inferioridade da Aliança Liberal na disputa sucessória.\nVargas enfrentaria a máquina oficial em 17 estados e, tendo-se em conta\nos padrões de controle eleitoral da República Velha, suas chances de\nvitória eram extremamente pequenas.\n\nMinas era o principal reduto eleitoral da Aliança Liberal e Antônio\nCarlos comprometera-se em manter a coesão do PRM. Em outubro, contudo, o\npartido sofreu uma grave cisão. O vice-presidente da República Fernando\nde Melo Viana rompeu com a direção do PRM ao ser preterido na sucessão\nde Antônio Carlos no governo do estado. A crise resultou na formação da\nConcentração Conservadora, movimento que promoveu em Minas as\ncandidaturas de Júlio Prestes à presidência da República e de Melo Viana\nà presidência do estado.\n\nEm consequência da cisão em Minas, Vargas esboçou uma nova tentativa de\nrecuo. Propôs a seus aliados retirar-se da disputa em troca de\nconcessões reabilitadoras na plataforma de Júlio Prestes. Firmino Paim\nFilho foi encarregado de consultar Washington Luís e os principais\ndirigentes da Aliança Liberal. Washington Luís recusou-se a abandonar o\nnome de Júlio Prestes, o que, ao lado da inflexibilidade de Antônio\nCarlos, levou à manutenção da candidatura Vargas.\n\nEm fins de 1929, a corrente mais radical da Aliança Liberal, formada por\nseus políticos mais jovens, como João Neves, Osvaldo Aranha e Virgílio\nde Melo Franco (filho de Afrânio de Melo Franco), passou a admitir a\nhipótese de desencadear um movimento armado, no caso da derrota nas\nurnas. Como primeiro passo, buscou-se a colaboração dos “tenentes”,\ntendo-se em conta seu passado revolucionário, sua experiência militar e\nseu prestígio no interior do Exército. Essa aproximação já estava em\ncurso desde o início da campanha sucessória, mas os contatos se\ndesenvolviam com grande dificuldade, devido a desconfianças recíprocas.\nNa Aliança Liberal, estavam alguns dos principais adversários dos\n“tenentes”, notadamente Artur Bernardes, Epitácio Pessoa e João Pessoa,\no qual, como promotor militar, fora acusador de muitos militares\nrebeldes. Por outro lado, para os velhos dirigentes oligárquicos da\nAliança, os “tenentes” personificavam a ameaça de derrubada do regime e,\nconsequentemente, de suas próprias bases de sustentação política.\n\nVários oficiais revolucionários, como Juarez Távora, João Alberto Lins\nde Barros e Antônio de Siqueira Campos, aderiram aos poucos à ideia de\ncolaborar com a Aliança Liberal, apesar da posição em contrário de Luís\nCarlos Prestes, o chefe supremo do movimento tenentista. Prestes\nencontrava-se a meio caminho em seu processo de adesão ao Partido\nComunista Brasileiro, então Partido Comunista do Brasil (PCB), e\ncomeçava, portanto, a abraçar uma nova concepção da revolução\nbrasileira. Em setembro, Prestes entrou secretamente em contato com\nVargas para declarar que somente o apoiaria se a via revolucionária\nfosse adotada. No íntimo, Prestes tinha a impressão de apresentar uma\ncondição impossível de ser cumprida. Em 13 de setembro Vargas transmitiu\na João Neves sua opinião a respeito das declarações de Prestes “Penso\nque não nos é lícito lançarmos o país numa revolução, sacrificarmos\nmilhares de vidas, arruinar e empobrecer o Estado, só para combater um\nhomem que atualmente nos desafia que é o presidente da República”.\n\nNos últimos meses de 1929, Aranha, João Neves e Virgílio de Melo Franco\nestabeleceram contato direto com Siqueira Campos, Juarez Távora e João\nAlberto, que retornaram clandestinamente do exílio, e ainda com outros\noficiais revolucionários, que, por já terem cumprido pena, estavam em\nliberdade, como Eduardo Gomes e Osvaldo Cordeiro de Farias. Por\ninsistência de seus companheiros, Prestes viajou clandestinamente a\nPorto Alegre para conversar com Osvaldo Aranha e Vargas.\n\nA história dos encontros entre Vargas e Luís Carlos Prestes permanece\nobscura em vários pontos, como, por exemplo, em relação às datas.\nSegundo Hélio Silva, Carone e outros autores, os encontros ocorreram em\nnovembro de 1929 e fevereiro de 1930. Prestes, em depoimento publicado\nem 1982, mencionou duas datas diferentes: setembro de 1929 e janeiro de\n1930. Resta ainda saber por que o ex-comandante da Coluna Prestes\nrecebeu uma substancial quantia de dinheiro, após ter recusado a chefia\nmilitar da revolução.\n\nA primeira fase da conspiração não implicou ainda a preparação efetiva\npara a luta armada, mesmo porque os principais dirigentes da Aliança\nLiberal não pensavam em romper os limites do sistema. A frase atribuída\na João Pessoa resume perfeitamente essa perspectiva: “Nunca contarão\ncomigo para um movimento armado. Prefiro dez Júlio Prestes a uma\nrevolução”. Vargas, por seu lado, tomou uma atitude ambivalente diante\nda ação conspirativa: permitiu que Aranha, João Neves e os mineiros\nperseguissem um caminho belicoso, mas ao mesmo tempo autorizou Paim\nFilho a manter os laços vitais com o governo federal.\n\nEm dezembro de 1929, Paim Filho, agindo com autorização expressa de\nVargas, negociou e conseguiu firmar com Washington Luís, à revelia de\nMinas, da Paraíba e até mesmo dos líderes gaúchos, um acordo secreto com\no governo federal. Por esse acordo, Vargas assumiu o compromisso de não\ndeixar o seu estado para fazer propaganda eleitoral e de apoiar o\ngoverno federal no caso de uma vitória de Júlio Prestes. De sua parte,\nWashington Luís e Júlio Prestes comprometiam-se a reconhecer os\ncandidatos do PRR que fossem eleitos em março para o Congresso (seriam\nrenovados a Câmara e 1/3 do Senado), a não combater o reconhecimento de\nVargas caso este fosse eleito e, no caso de uma vitória do governo, a\nrestabelecer as relações com o Rio Grande do Sul nos termos anteriores à\ndivergência sobre a sucessão presidencial. O cumprimento desse acordo\nimplicaria muito provavelmente na desagregação e liquidação da Aliança\nLiberal.\n\nNessa mesma época, entretanto, o governo federal também enfrentava\ndificuldades, embora de outra ordem. A crise econômica internacional,\nirrompida em outubro de 1929, estava solapando o programa de\nestabilidade da moeda e provocando consequências desastrosas para os\ncafeicultores e os círculos financeiros de São Paulo. Em poucos meses\ntodas as reservas de ouro acumuladas à custa de empréstimos externos\nforam tragadas pelos capitais em fuga do país. Segundo o comentário que\ncomeçou a circular, o “general café” se havia voltado contra o\npresidente. Houve, de fato, divergências entre os cafeicultores e o\ngoverno, pois Washington Luís recusou-se a emitir novos financiamentos e\na conceder a moratória, reclamados pela lavoura paulista. Diz Boris\nFausto: “Independentemente do fato de que a crise só tenha repercutido\nno Brasil com toda sua intensidade em 1931... independentemente do fato\nde que a oposição não [tivesse] plena consciência de seu alcance e não a\n[utilizasse] a fundo, ela [golpeou] o governo ao produzir o desencontro\nentre o Estado, como representante político da burguesia cafeeira, e os\ninteresses imediatos da classe”.\n\nNo Congresso, João Neves aplaudiu a resistência de Washington Luís em\natender às reivindicações dos cafeicultores paulistas, mas criticou\nacerbamente sua imprevidência. Em 26 de dezembro, após várias sessões\ntumultuadas, o deputado aliancista gaúcho Ildefonso Simões Lopes revidou\numa agressão de seu colega situacionista de Pernambuco, Manuel de Sousa\nFilho, abatendo-o a tiros no recinto do palácio Tiradentes.\n\nEm meio à radicalização da campanha, Vargas violou o acordo com\nWashington Luís, viajando para o Rio de Janeiro no final de dezembro. No\ndia seguinte à sua chegada, entretanto, avistou-se com o presidente,\nreiterando sua disposição de respeitar o *modus vivendi* estabelecido\npor Paim Filho. Em 2 de janeiro de 1930, ao lado de João Pessoa, Vargas\nleu sua plataforma, não em recinto fechado como fizera Júlio Prestes,\nmas em praça pública, para uma grande multidão que se concentrou na\nesplanada do Castelo. Estendeu sua viagem a São Paulo e Santos (SP),\nonde foi recebido com demonstrações populares de apoio, regressando em\nseguida a Porto Alegre. A campanha da oposição prosseguiu com a\norganização das caravanas liberais que percorreram Minas e as principais\ncidades do Norte e Nordeste, sob a chefia de João Pessoa.\n\nNo fim de fevereiro, Vargas retirou-se temporariamente para São Borja,\nnomeando Osvaldo Aranha presidente interino do Rio Grande do Sul e\nexplicando que “escrúpulos de ordem moral o impediam de continuar no\ncargo durante a eleição”.\n\nNeste último mês ocorreram choques violentos em Garanhuns (PE), Vitória\ne Montes Claros (MG). Nesta última cidade, um comício da Concentração\nConservadora foi interrompido por um tiroteio que deixou vários mortos e\nferidos, incluindo-se entre os últimos o vice-presidente Melo Viana,\npisoteado no tumulto que se estabeleceu. O conflito mais importante\neclodiu na Paraíba, em 28 de fevereiro, véspera das eleições. Foi a\nrevolta da cidade de Princesa, atual Princesa Isabel, liderada por José\nPereira, chefe político do município, que congregou a oposição paraibana\nao governo de João Pessoa e contou com o apoio do Catete. Antes e depois\ndas eleições, o governo federal hostilizou abertamente os estados de\nMinas e da Paraíba.\n\nA Revolução de 1930\n\nAs eleições de 1^o^ de março de 1930, realizadas no estilo tradicional\nda República Velha, deram afinal a vitória a Júlio Prestes, como já era\nesperado. Além de vencer por grande diferença nos estados\nsituacionistas, o candidato oficial obteve 50 mil votos em Minas e a\nterça parte da votação na Paraíba. A fraude, praxe na época, dominou o\npleito de parte a parte. De outra forma seria impossível explicar o\nfabuloso resultado obtido por Vargas em seu estado com 298 mil votos\ncontra apenas 982 dados a seu concorrente. Mesmo assim, Júlio Prestes\nchegou a cerca de um milhão e cem mil votos, contra 737 mil dados a\nVargas. Pelo Bloco Operário e Camponês, organização patrocinada pelo\npequeno PCB, fundado em 1922, concorreu o operário Minervino de Oliveira\ncom uma votação ínfima.\n\nEm 11 de março, antes de voltar a Porto Alegre para reassumir o governo\nestadual, Vargas telegrafou a Osvaldo Aranha, considerando “quixotesca”\na continuação da luta. Em 19 de março, Borges de Medeiros, em entrevista\npublicada pelo jornal *A Noite*, reconheceu enfaticamente a vitória de\nJúlio Prestes, dando por encerrada a campanha da oposição e a FUG. A\nentrevista provocou forte reação de Osvaldo Aranha, João Neves e Flores\nda Cunha contra o que consideraram uma completa capitulação. Borges\nviu-se forçado a retificar suas declarações para evitar a ameaça de\ncisão no PRR. Em fins de março, admitiu o prosseguimento da luta pela\nação parlamentar e a pregação doutrinária.\n\nNesse ínterim, Virgílio de Melo Franco e João Batista Luzardo, dirigente\ndo PL, conseguiram articular um entendimento com Epitácio Pessoa e\nAntônio Carlos em favor da alternativa revolucionária. Luzardo foi\nautorizado por Antônio Carlos a declarar aos chefes políticos gaúchos\nque Minas aceitaria a solução sediciosa, caso o Rio Grande do Sul a\nadotasse. Epitácio Pessoa concordou com a fórmula, comprometendo-se a\nconsultar João Pessoa, a quem caberia a última palavra sobre a Paraíba.\nNo final de março, após ser informado sobre esses contatos, Vargas\nconcordou com a preparação do movimento armado, deixando a Osvaldo\nAranha a responsabilidade de sua coordenação.\n\nAranha acelerou a conspiração reativando seus contatos com os tenentes.\nNo início de abril, a participação dos tenentes na revolução ficou\ndefinitivamente acertada: Juarez Távora chefiaria o levante no Norte,\nJoão Alberto e outros oficiais ajudariam o movimento no Sul e Siqueira\nCampos dirigiria o setor mais difícil – a capital paulista. Para chefiar\no estado-maior revolucionário, dada a desistência de Luís Carlos\nPrestes, os gaúchos escolheram um oficial de carreira, em vez de um\n“tenente”. O tenente-coronel Pedro Aurélio de Góis Monteiro, na época\ncomandante de urna guarnição no Rio Grande do Sul, foi convidado a\nassumir o encargo. Na década de 1920, ele combatera militarmente os\n“tenentes” da Coluna Prestes.\n\nTambém por iniciativa de Aranha foram encomendadas armas à\nTchecoslováquia no valor de 16 mil contos de réis. O Rio Grande do Sul\nparticiparia com metade dessa soma, cabendo a Minas seis mil contos e\ndois mil à Paraíba. Em meados de abril, Antônio Carlos e Epitácio Pessoa\nconcordaram com o esquema proposto para a compra de armas. Francisco\nCampos viajou então a Porto Alegre para verificar in loco os\npreparativos da revolução. Com Vargas e Osvaldo Aranha, ele acertou o\nesquema de participação de Minas no levante. A tarefa militar desse\nestado seria distrair as tropas federais que nele se encontravam e\nfechar as próprias fronteiras, a fim de atrair os contingentes do\nExército estacionados em São Paulo.\n\nNo fim de abril, Vargas aprovou um documento elaborado por João Neves\nsobre a orientação da bancada do PRR na legislatura que se iniciaria em\nmaio. Tratava-se de um memorando de sete itens, sancionado por Borges de\nMedeiros em sua estância de Irapuazinho. Conhecido como o Heptálogo de\nIrapuazinho, o documento estabelecia como pontos principais a oposição\nnão sistemática do PRR ao governo federal, a defesa da plataforma\naliancista e a apresentação de projeto de lei de reforma eleitoral, a\ndefesa dos candidatos aliancistas de Minas e Paraíba não reconhecidos\npelas juntas de apuração eleitoral, a assistência aos governos desses\ndois estados contra a intervenção federal, o fornecimento de armas a\nJoão Pessoa para a luta contra a Revolta de Princesa e a recondução de\nJoão Neves à liderança da bancada republicana gaúcha na Câmara.\n\nPaim Filho, preocupado com a manutenção do modus vivendi com o governo\nfederal, não concordou com o Heptálogo. Em carta a Borges, denunciou as\nintenções revolucionárias de João Neves, mas omitiu o acordo firmado em\ndezembro de 1929 com Washington Luís. Para contornar a dificuldade,\nVargas e Borges autorizaram Paim Filho, eleito senador em março, a\ndefender sua posição pessoal no Congresso.\n\nEm 3 de maio de 1930, o Congresso reiniciou seus trabalhos. O estudo das\neleições presidenciais e da renovação dos mandatos legislativos\nconstituiu sua primeira tarefa. A maioria governista se serviu,\narbitrariamente do processo de reconhecimento dos candidatos para punir\nas representações aliancistas de Minas e da Paraíba. A “degola” atingiu\ntodos os candidatos apoiados por João Pessoa, beneficiando os\npartidários de José Pereira. A representação do PRM sofreu um corte de\n14 deputados numa bancada de 37, sendo diplomados em seus lugares\ncandidatos da Concentração Conservadora. No caso de Minas, diz John\nWirth, “o desastre foi agravado pela perda de todas as presidências de\ncomissões e pela imposição de sanções econômicas federais”.\nSintomaticamente, o Rio Grande do Sul atravessou ileso o expurgo. Em\nfins de maio o novo Congresso aprovou os resultados das eleições,\ndeclarando Júlio Prestes presidente eleito.\n\nO arbítrio do reconhecimento dos poderes constituiu-se em mais um fator\nde indignação contra Washington Luís, sobretudo em Minas Gerais. Em 27\nde maio, a comissão executiva do PRM convocada por Antônio Carlos\naprovou por unanimidade a participação de Minas no movimento armado.\n\nEntrementes, as articulações revolucionárias na área dos “tenentes”\nsofreram um rude golpe com a ruptura de Luís Carlos Prestes com a\nAliança Liberal. No seu Manifesto de maio, Prestes condenou a “revolução\nda oligarquia”, propondo um programa de revolução agrária e\nanti-imperialista.\n\nEm 1^o^ de junho, Vargas lançou um manifesto à nação, condenando a\ndepuração das bancadas mineira e paraibana e anunciando para breve a\n“necessária retificação” do regime. Mas temperou seus ataques, afirmando\nque as modificações dos “nossos hábitos e costumes” poderiam ter lugar\n“dentro da ordem”.\n\nAinda em junho, a conspiração sofreu um colapso – voltando praticamente\nà estaca zero – devido às hesitações de Vargas e Antônio Carlos. O\npresidente de Minas começou a reduzir seus compromissos com a revolução\nno princípio do mês. Em entrevista com João Neves e Flores da Cunha,\nmanifestou seu propósito de transformar os compromissos militares\nesboçados em compromissos políticos definidos para uma ação pacífica. No\ndecorrer do mês, Antônio Carlos pôde constatar a precariedade da\norganização militar do movimento em Minas e outros pontos do país,\nsobretudo em São Paulo. Em 17 de junho, ele enviou a Osvaldo Aranha um\nradiograma – principal meio de contato entre os conspiradores –\nconsiderando o movimento inteiramente sem articulação e sem\nprobabilidade de êxito. Ante a resposta violenta de Aranha, e preocupado\ncom a repercussão de sua atitude, Antônio Carlos procurou transferir a\nresponsabilidade da participação ou não de Minas na revolução a seu\nsucessor no governo do estado – eleito em março – Olegário Maciel.\n\nO recuo de Antônio Carlos foi o pretexto de que se serviu Vargas para\ntambém recuar. O efeito acumulado desses acontecimentos provocou uma\ncrise nos planos revolucionários. Em 27 de junho, Osvaldo Aranha\nrenunciou ao seu posto de governo no Rio Grande do Sul, justificando seu\nato num radiograma indignado a Virgílio de Melo Franco: “Minha convicção\nvocê e eu vítimas de uma mistificação vergonhosa. Estou farto dessa\ncomédia. Impossível continuar sob direção chefe tão fraco que desanima\npróprios soldados”. Vargas aceitou a demissão, nomeando João Simplício\nAlves de Carvalho para a Secretaria do Interior. A primeira tentativa de\ndesencadear a revolução fracassara.\n\nNo início de julho, os conspiradores mais obstinados recomeçaram por\nconta própria a trama interrompida. Em Minas, Artur Bernardes apoiou a\ntodo transe as articulações de Virgílio de Melo Franco. A pedido de\nVirgílio, escreveu a Olegário Maciel dando-lhe certeza de seu apoio ao\nmovimento armado. Embora lhe parecesse inconveniente a revolução,\nOlegário cedeu diante dos argumentos de Bernardes. No final de julho,\ndeclarou a Lindolfo Collor e Maurício Cardoso estar de acordo com o\nmovimento, desde que ele fosse deflagrado antes de sua posse no governo\nde Minas, marcada para 7 de setembro.\n\nEntretanto, nem Vargas nem Antônio Carlos deram sinal de mudança durante\no mês. A conspiração tendia a se extinguir, quando ocorreu o assassínio\nde João Pessoa, em Recife, no dia 26 de julho. Embora o crime tenha sido\ncometido por razões de ordem pessoal, os líderes aliancistas lançaram\nimediatamente a culpa sobre o governo federal. Antônio Carlos propôs a\nVargas o lançamento de um manifesto, responsabilizando Washington Luís\ncomo mandante do assassínio e declarando-o, por isso, fora da lei.\nVargas repeliu a ideia: “Um manifesto dessa natureza, sem a sua imediata\ne lógica sucessão, seria um suicídio e um crime.” Enquanto isso, tropas\nfederais intervinham na Paraíba para evitar represálias contra a\noposição paraibana. José Pereira apressou-se em depor as armas, pondo\nfim à Revolta de Princesa.\n\nO trágico desaparecimento de João Pessoa provocou grande comoção\nnacional, dando novo alento às articulações revolucionárias. Vargas\nautorizou Aranha a retomar seus preparativos e as conversações entre\nMinas e o Rio Grande do Sul foram reatadas.\n\nAranha marcou a deflagração do movimento para 26 de agosto (trigésimo\ndia da morte de João Pessoa), mas foi necessário transferir a data, pois\na revolução não parecia perfeitamente preparada. Na verdade, Vargas\nainda não havia decidido comprometer o Rio Grande do Sul no levante.\nNuma reunião com Aranha, Flores da Cunha e João Neves, ele declarou que\nnão poderia se aventurar a passo tão arriscado, contrariando a\norientação de Borges de Medeiros, francamente contrário à revolução.\nBorges sabia da conspiração em preparo, mas nunca fora “oficialmente”\nconsultado sobre o assunto. Em 24 de agosto, Vargas informou a Borges\nestar disposto a suspender todas as atividades conspiratórias, mas ao\nmesmo tempo encarregou Aranha de obter sua adesão. Borges acabou por se\nrender aos argumentos de Aranha, prometendo auxiliar o movimento dentro\nde suas possibilidades. No final de agosto, Vargas declarou-se pronto a\nseguir a orientação dada pelo chefe do PRR.\n\nEm 11 de setembro, Góis Monteiro e Aranha comunicaram a seus\ncompanheiros que a preparação estava concluída. No Rio Grande do Sul, o\nmovimento já contava com importantes ramificações no interior do\nExército e o apoio dos principais comandantes da Brigada Militar,\nmilícia estadual tão bem equipada quanto as forças do Exército\nestacionadas no estado. Em Minas, a Força Pública também estava pronta\npara a luta.\n\nEntretanto, Vargas e Borges consideravam indispensável obter, senão o\napoio, pelo menos a neutralidade dos altos comandantes militares do Rio\nde Janeiro. Em 12 de setembro, Lindolfo Collor partiu para a capital,\nonde manteve contatos com diversos oficiais, entre os quais os generais\nAugusto Tasso Fragoso, Francisco Ramos de Andrade Neves e Alfredo Malan\nd’Angrogne. Estabeleceram-se, assim entendimentos para uma intervenção\npacificadora no caso de um conflito prolongado.\n\nNas últimas semanas que precederam a revolução, Vargas procurou\ndissimular seu envolvimento na conspiração, buscando, sobretudo\ndespistar o senador Paim Filho e o comandante da 3^a^ Região Militar\n(3^a^ RM), sediada no Rio Grande do Sul, o general Gil de Almeida, ambos\nfortemente leais a Washington Luís. Paim Filho foi induzido a transmitir\ninformações tranquilizadoras ao presidente, negando a participação de\nVargas na trama revolucionária. Enquanto isso, Vargas entendia-se com o\ngeneral, confidenciando-lhe certos detalhes inconsequentes da revolução.\nMas Gil de Almeida percebeu a artimanha: em 15 de setembro alertou o\nministro da Guerra, general Nestor Sezefredo dos Passos, sobre as reais\nintenções de Vargas. Apesar de todas as advertências, Washington Luís\nnão ordenou nenhuma medida preventiva para deter a revolução, sendo\nsurpreendido pelos acontecimentos.\n\nEm 25 de setembro, Vargas e Aranha decidiram desencadear a revolução no\ndia 3 de outubro. Segundo o plano adotado, o movimento deveria irromper\nsimultaneamente no Rio Grande do Sul, Minas e estados do Nordeste.\n\nA revolução começou em Porto Alegre às cinco horas da tarde de 3 de\noutubro, com um ataque bem planejado ao comando da 3^a^ RM. Em 20\nminutos, o general Gil de Almeida foi feito prisioneiro. Em Belo\nHorizonte, o movimento começou ao mesmo tempo, mas no Nordeste, por um\nequívoco de Juarez Távora, a revolução irrompeu na madrugada do dia 4.\nDiz Boris Fausto: “A adesão do Exército foi quase imediata no Sul,\ntambém se concretizando em Minas e no Nordeste, apesar de algumas\nresistências nessas áreas. Apenas em São Paulo delineou-se um choque\ndecisivo de maiores proporções”.\n\nSintomaticamente, em 3 de outubro, início da revolução, Getúlio começou\na escrita de um diário que se estenderia até 1942, contendo o registro\nde suas atividades políticas e também anotações esparsas sobre sua vida\nprivada. Os pequenos cadernos do diário foram guardados secretamente por\nAlzira Vargas do Amaral Peixoto (1914-1992), filha predileta de Vargas.\nSua existência foi noticiada apenas em 1995. O *Diário de Vargas* foi\npublicado no ano seguinte.\n\nAo iniciar o diário, Getúlio conta os primeiros arranjos para o\nmovimento e as razões que o levaram a se rebelar:\n\n“Quatro e meia. Aproxima-se a hora. Examino-me e sinto-me com o espírito\ntranquilo de quem joga um lance decisivo porque não encontrou outra\nsaída digna para seu estado. A minha sorte não me interessa e sim a\nresponsabilidade de um ato que decide do destino da coletividade. Mas\nesta queria a luta, pelo menos nos seus elementos mais sadios, vigorosos\ne ativos. Não terei depois uma grande decepção? Como se torna\nrevolucionário um governo cuja função é manter a ordem? E se perdermos?\nEu serei depois apontado como o responsável, por despeito, por ambição,\nquem sabe? Sinto que só o sacrifício da vida poderá resgatar o erro de\num fracasso”.\n\nNa madrugada de 4 outubro, todas as unidades militares de Porto Alegre\njá se encontravam sob o controle dos revolucionários. No interior do\nestado quase não houve luta. Vargas divulgou, no mesmo dia 4, um\nmanifesto conclamando o povo gaúcho às armas: “Estamos diante de uma\ncontrarrevolução para readquirir a liberdade, para restaurar a pureza do\nregime republicano.” Dizia no final: “Rio Grande, de pé, pelo Brasil!\nNão poderás falhar ao teu destino heroico.” Os gaúchos atenderam ao\napelo com entusiasmo e em poucos dias cerca de 50 mil voluntários\nalistaram-se para lutar na insurreição.\n\nEm Belo Horizonte, apesar da resistência do 12^o^ Regimento de\nInfantaria (12^o^ RI), que durou cinco dias, o domínio da cidade foi\nrápido. No interior do estado algumas guarnições federais (Juiz de Fora,\nTrês Corações), permaneceram fiéis a Washington Luís, mas limitaram sua\nação à resistência dentro dos quartéis. Após a rendição do 12^o^ RI, as\nforças mineiras concentraram-se na região de fronteira com São Paulo e o\nRio de Janeiro, conseguindo deter a invasão de tropas legalistas.\n\nNo Norte e no Nordeste, o movimento foi amplamente vitorioso. Em três\ndias, Juarez Távora e os tenentes assumiram o controle de quase todos os\nestados, enviando tropas para dominar a Bahia e o Pará sob o comando de\nJuraci Magalhães e Landri Sales, respectivamente.\n\nEm 5 de outubro, as forças gaúchas partiram em direção a Santa Catarina\ne ao Paraná. A resistência de Florianópolis não chegou a ameaçar o êxito\nda ofensiva. No Paraná, o Exército se sublevou em apoio à revolução,\ndepondo o governo do estado. Em 11 de outubro, Vargas passou o governo\ngaúcho a Osvaldo Aranha e rumou para Ponta Grossa (PR), onde, ao chegar,\ndia 17, estabeleceu seu quartel-general e assumiu o comando das forças\nrevolucionárias em marcha para a capital da República.\n\nEm meados de outubro, a revolução já era vitoriosa em quase todo o país,\nrestando apenas São Paulo, Rio de Janeiro, Bahia e Pará sob controle do\ngoverno federal. A principal frente de luta localizava-se na divisa de\nSão Paulo com o Paraná. Em Itararé (SP), as forças revolucionárias\nvindas do Sul viram-se diante de uma das maiores concentrações militares\narticuladas pelos governistas. O choque decisivo foi, entretanto,\nevitado pela intervenção da cúpula militar do Rio de Janeiro: em 24 de\noutubro, um grupo de oficiais-generais, liderados por Augusto Tasso\nFragoso, exigiu a renúncia de Washington Luís. Ante a negativa do\npresidente, os militares determinaram o cerco do palácio Guanabara e sua\nprisão.\n\nWashington Luís foi substituído por uma junta governativa provisória,\ncomposta pelo general Tasso Fragoso, seu chefe, o general João de Deus\nMena Barreto e o almirante Isaías de Noronha. Ainda no dia 24, a junta\norganizou um novo ministério, do qual faziam parte, entre outros, o\ngeneral José Fernandes Leite de Castro (Guerra), Isaías de Noronha\n(Marinha) e Afrânio de Melo Franco (Relações Exteriores). Com a situação\nna capital sob controle, a junta enviou o primeiro de uma série de\ntelegramas a Vargas, propondo a suspensão total das hostilidades em todo\no país, mas nada adiantando sobre a transferência do poder aos chefes da\nrevolução. As verdadeiras intenções da junta não eram claras. A nomeação\ndo ministério e a adoção de medidas legislativas indicavam sua\ndisposição em permanecer no poder como um fato consumado. A situação\ntornou-se ainda mais dúbia com a designação do general Hastínfilo de\nMoura, comandante legalista da 2^a^ RM, para o cargo de interventor em\nSão Paulo e com as declarações do novo chefe de polícia no Rio, coronel\nBertoldo Klinger, prometendo reprimir as manifestações públicas na\ncapital em favor dos revolucionários.\n\nDe Ponta Grossa, Vargas comunicou imediatamente à junta que prosseguiria\na luta se não fosse reconhecido como chefe de um governo provisório. Ao\nmesmo tempo, ordenou às forças revolucionárias que prosseguissem seu\navanço em direção à capital do país. Em 28 de outubro, o impasse foi\nfinalmente superado, após entendimento firmado por Aranha e Collor,\nemissários de Vargas, com o general Tasso Fragoso. Em proclamação ao\npaís, a junta comunicou a decisão de transmitir o poder a Vargas.\n\nA caminho do Rio, em trem militar, Vargas passou por São Paulo, onde\ndeixou o “tenente” João Alberto como “delegado militar da revolução” no\nestado. Em 31 de outubro, precedido por três mil soldados gaúchos,\ndesembarcou no Rio, de uniforme militar e com um grande chapéu gaúcho,\nsendo recebido com uma manifestação apoteótica de apoio. Finalmente, em\n3 de novembro de 1930, Getúlio Vargas tomou posse como chefe do Governo\nProvisório. Os soldados gaúchos fizeram então o que ficaria registrado\nna crônica como o gesto simbólico da vitória: amarraram seus cavalos no\nobelisco da Avenida Rio Branco, no Rio.\n\nA Era Vargas\n\nLíder civil do movimento revolucionário que determinou o fim da Primeira\nRepública, Getúlio Vargas tornou-se a figura dominante da política\nnacional durante quase um quarto de século. Sua trajetória nesse período\nfoi reconstituída, passo a passo, no *Dicionário Histórico Biográfico\nBrasileiro pós-1930*. Trata-se aqui de apresentá-la sinteticamente, dos\nprimeiros tempos no poder ao trágico desaparecimento em 1954, destacando\nos acontecimentos de maior relevo e as mudanças institucionais que deram\nsentido à chamada Era Vargas.\n\nComo chefe do Governo Provisório, Getúlio assumiu poderes ditatoriais,\ndissolvendo o Congresso Nacional, as assembleias legislativas e câmaras\nmunicipais. Sem fixar prazo, prometeu convocar eleições para uma\nAssembleia Constituinte encarregada de estabelecer novo ordenamento\njurídico-político em substituição à primeira constituição republicana.\n\nOs presidentes estaduais, exceto o de Minas Gerais, foram substituídos\npor interventores federais, vários deles pertencentes às fileiras do\nmovimento tenentista. Vargas concedeu anistia aos tenentes, instituiu o\nTribunal Especial como órgão de justiça revolucionária e criou os\nministérios do Trabalho, Indústria e Comércio e da Educação e Saúde.\n\nOs primeiros titulares das novas pastas foram o gaúcho Lindolfo Collor\n(Trabalho) e o mineiro Francisco Campos (Educação). Outros personagens\nde proa do novo governo foram Osvaldo Aranha (ministro da Justiça e\ndepois da Fazenda), Góes Monteiro (logo promovido a general), João\nAlberto (interventor em São Paulo), Juarez Távora (delegado militar da\nrevolução nos estados do Norte) e José Américo de Almeida (ministro da\nViação e Obras Públicas).\n\nO Governo Provisório promulgou as leis que regularam o trabalho das\nmulheres e dos menores, a concessão de férias e o limite de oito horas\nde jornada de trabalho. Também iniciou as reformas que puseram fim à\nestrutura descentralizada da Primeira República. Em 1931, o chamado\nCódigo dos Interventores proibiu os estados de contrair empréstimos sem\na autorização do governo federal e restringiu os recursos que cada\nestado poderia destinar às suas forças policiais, impedindo-as de\nrivalizar com o Exército nacional. A União assumiu o controle da\npolítica cafeeira e promoveu a destruição de estoques invendáveis com o\nobjetivo de evitar maiores baixas nos preços. As constantes\ndesvalorizações cambiais beneficiaram o setor exportador e também\nconstituíram uma proteção à indústria nacional.\n\nOs primeiros tempos do governo Vargas foram marcados pela acirrada\ndisputa entre os “tenentes” e os quadros políticos tradicionais. Os\n“tenentes” empreenderam uma ofensiva até certo ponto radical para\nquebrar o poder de oligarquias estaduais, notadamente na região\nNordeste.\n\nGetúlio desenvolveu um difícil exercício de equilíbrio político. Apoiou\ntacitamente a ação tenentista e o prolongamento da ditadura, mas se\ndeparou com o descontentamento da elite paulista, empenhada na defesa da\nautonomia estadual e da constitucionalização do país. Em fevereiro de\n1932, promulgou o Código Eleitoral, instituindo o voto secreto, o\ndireito de voto feminino e a Justiça Eleitoral. Também se comprometeu\ncom a realização do pleito para Constituinte, mas a oposição continuou\nduvidando de suas reais intenções.\n\nEm julho de 1932, São Paulo levantou-se em armas contra o Governo\nProvisório, iniciando a Revolução Constitucionalista. O movimento\nsedicioso contou com a adesão entusiástica da classe média paulista, mas\nnão recebeu a ajuda de outros estados. Vargas denunciou seu caráter\n“reacionário” e “separatista” e, com o apoio da maior parte do Exército,\nconduziu a luta até a capitulação dos rebeldes. A guerra civil durou\ntrês meses, ocasionando seiscentos mortos e milhares de feridos.\n\nA vitória militar contra os rebeldes garantiu a Getúlio uma ampla margem\nde influência sobre a Constituinte, eleita em maio de 1933. Os\nresultados do pleito asseguraram a vitória dos novos partidos estaduais\norganizados pelos interventores, exceto em São Paulo, Rio Grande do\nNorte e Ceará.\n\nA Constituição promulgada em julho de 1934 ampliou os poderes da União e\nsancionou a maior parte da legislação social e econômica do Governo\nProvisório. Todavia, estabeleceu um modelo de organização política mais\nliberal e menos centralizador do que desejava Vargas, eleito presidente\ncom os votos de 175 constituintes contra 71 dados a vários candidatos,\nentre os quais, Borges de Medeiros, anistiado junto com outros\nparticipantes da Revolução Constitucionalista.\n\nFindo o Governo Provisório, teve início o período de governo\nconstitucional, marcado por uma radicalização ideológica sem precedentes\nna história do país. À direita, a Ação Integralista Brasileira (AIB), de\nPlínio Salgado, ganhou uma notável projeção com um ideário nacionalista\ne antiliberal, de inspiração fascista. À esquerda, o Partido Comunista\nBrasileiro (PCB) ampliou sua rede de apoio a partir do ingresso oficial\nde Luís Carlos Prestes em suas fileiras. Seguindo o modelo das frentes\npopulares que surgiam na Europa para combater o fascismo, os comunistas\norganizaram a Aliança Nacional Libertadora (ANL) com a participação de\nsocialistas e liberais progressistas.\n\nO governo reagiu à mobilização aliancista, propondo uma Lei da Segurança\nNacional, aprovada pelo Congresso com o voto dos liberais. Em julho de\n1935, Vargas decretou a dissolução da ANL, em resposta ao manifesto de\nPrestes em favor da implantação de um governo popular, nacional e\nrevolucionário. Com o apoio da Internacional Comunista (Comintern), o\nPCB optou pela via insurrecional. Em novembro de 1935, o partido\npromoveu uma rebelião militar em Natal, Recife e Rio de Janeiro,\nprontamente sufocada pelas forças legalistas.\n\nA Revolta Comunista de 1935 aplainou o caminho para o endurecimento do\nregime. De imediato, foram aprovadas emendas constitucionais que\natribuíram ao presidente o poder de declarar o estado de guerra e de\ndemitir sumariamente funcionários públicos. Foram presos milhares de\ncivis e militares, a maioria sem qualquer participação no movimento\nrevolucionário. A tortura de suspeitos políticos tornou-se frequente.\nAlém da instauração do estado de guerra, o Congresso autorizou a\nabertura de processo contra parlamentares presos e a criação do Tribunal\nde Segurança Nacional para julgar os comprometidos com a revolta\ncomunista.\n\nA questão sucessória veio à baila no começo de 1937, propiciando um\nafrouxamento das medidas repressivas. Apresentaram-se candidatos o\nex-governador paulista Armando de Sales Oliveira, pela oposição, o\nex-ministro José Américo, apoiado pela maioria dos governadores e\nmembros do governo federal, e o chefe integralista Plínio Salgado.\n\nVargas adotou atitude de aparente neutralidade que apenas contribuiu\npara o esvaziamento da campanha de José Américo. Na verdade, ele\nacalentava o projeto de permanência no poder e de mudança do regime com\napoio de elementos civis, entre os quais, o jurista Francisco Campos, e\nmilitares de sua confiança, notadamente os generais Eurico Gaspar Dutra,\nministro da Guerra, e Góis Monteiro, chefe do Estado-Maior do Exército.\nOs preparativos do golpe foram acelerados após a “descoberta” de um\nsuposto plano insurrecional comunista, conhecido como Plano Cohen. O\ngoverno sabia que o documento era apócrifo, mas usou-o como pretexto\npara instaurar novamente o estado de guerra, reacender a campanha\nanticomunista e isolar os adversários.\n\nEm 10 de novembro de 1937, Vargas liderou o golpe que suspendeu as\neleições e instaurou a ditadura do Estado Novo. Os protestos foram\nisolados. Apenas dois governadores, Juraci Magalhães (Bahia) e Lima\nCavalcanti (Pernambuco), tiveram de ser substituídos. O governador\nFlores da Cunha (Rio Grande do Sul) já havia renunciado e partido para o\nexílio em Montevidéu.\n\nUma nova constituição entrou imediatamente em vigor, sancionando a\ndissolução do Congresso e de todos os órgãos legislativos. A Carta de\n1937 manteve o regime federativo, mas conferiu a preeminência da União\nsobre os estados e municípios, vedando inclusive a utilização de\nbandeiras, hinos ou escudos pelos estados. O presidente da República\npodia nomear e demitir os interventores que escolhiam, por sua vez, os\nprefeitos, num completo verticalismo autoritário.\n\nVargas também decretou a dissolução dos partidos políticos, inclusive a\nAIB, que apoiara a mudança do regime. Frustrados na expectativa de\nparticipar do governo, os integralistas tramaram o seu próprio golpe e,\nem maio de 1938, empreenderam um ataque ao Palácio Guanabara, no Rio de\nJaneiro. O fracasso da revolta deu a Getúlio a oportunidade de eliminar\na única força política que escapava ao seu controle. Os integralistas\nmais incômodos e figuras da oposição liberal foram obrigados a deixar o\npaís.\n\nA censura aos meios de comunicação (rádio, cinema e imprensa escrita)\ntornou-se mais rigorosa. Em 1939, o governo criou o Departamento de\nImprensa e Propaganda (DIP), órgão responsável pela difusão da ideologia\nestadonovista e pela construção de imagens idealizadas a respeito de\nGetúlio, como a de “pai dos pobres”.\n\nA máquina do Estado cresceu em complexidade com a criação de numerosos\nórgãos destinados a racionalizar a economia e a administração.\nInstitutos, comissões e conselhos, compostos por técnicos, militares e\nempresários industriais, passaram a cobrir todas as áreas de decisão do\nExecutivo. O Departamento Administrativo do Serviço Público (DASP)\ncentralizou a reforma administrativa no setor do funcionalismo, segundo\ncritérios burocráticos de recrutamento e promoção.\n\nO processo de modernização conservadora, iniciado em 1930, ganhou maior\namplitude e coerência e Getúlio transformou-se na liderança simbólica de\ntodas as realizações do governo e do projeto de “construção nacional”.\n\nA ampliação da legislação trabalhista e de previdência social foi um dos\nlegados mais importantes do Estado Novo. Merecem destaque a\nregulamentação da Justiça do Trabalho (1939) e da Lei do Salário Mínimo\n(1940), bem como a instituição do regime de sindicato único por\ncategoria profissional e do imposto sindical. O novo formato da\nlegislação social brasileira – voltada para os trabalhadores urbanos –\nfoi sistematizado em 1943 com a promulgação da Consolidação das Leis do\nTrabalho (CLT).\n\nA intervenção do Estado na economia intensificou-se com a criação das\nprimeiras empresas estatais. Em 1941, foi constituída a Companhia\nSiderúrgica Nacional (CSN), encarregada da construção da usina\nsiderúrgica de Volta Redonda (RJ). No ano seguinte, foi a vez da\nCompanhia Vale do Rio Doce (CVRD) para a exploração das jazidas de ferro\nde Minas Gerais.\n\nNo plano internacional, Vargas manteve num primeiro momento a política\nde equidistância em face dos Estados Unidos e da Alemanha, buscando\ntirar vantagem da rivalidade entre as duas potências econômicas e\nmilitares da época. Em certa medida, essa política refletia a própria\ndivisão de forças no governo entre elementos pró-americanos, como o\nchanceler Osvaldo Aranha, e admiradores da Alemanha nazista, como Dutra\ne Góes Monteiro.\n\nCom a eclosão da Segunda Guerra Mundial em 1939, o presidente declarou a\nneutralidade brasileira. Em 1940, pronunciou um discurso ambíguo sobre a\nsituação mundial, interpretado como uma ameaça de que o Brasil se\nassociaria aos países do Eixo, mas depois autorizou a utilização de\nbases militares no Norte e Nordeste pelos Estados Unidos. Em\ncontrapartida, assegurou o apoio financeiro e técnico norte-americano\npara o projeto siderúrgico de Volta Redonda.\n\nA entrada dos EUA na guerra em dezembro de 1941 forçou o fim da\nneutralidade brasileira. Em janeiro de 1942, tal como recomendado na\nconferência de chanceleres americanos do Rio de Janeiro, Vargas rompeu\nrelações diplomáticas e comerciais com a Alemanha, Itália e Japão. Em\nclima de comoção nacional causado pelo afundamento de navios brasileiros\npor submarinos alemães, o Brasil declarou guerra ao Eixo em agosto de\n1942. A declaração foi precedida de manifestações populares contra o\nnazi-fascismo que provocaram a primeira crise do regime e a saída do\nministro Francisco Campos. Além da ajuda para o reaparelhamento\neconômico e militar do país, Vargas conseguiu que o governo Roosevelt\napoiasse o envio da Força Expedicionária Brasileira (FEB) para combater\nna Itália.\n\nA participação do Brasil na guerra ao lado das nações democráticas criou\numa contradição insanável para o regime. O presidente percebeu que a\nguerra contra o nazi-fascismo implicaria inexoravelmente o fim da\nditadura. Assim sendo, tratou de consolidar seu prestígio popular,\nespecialmente junto à classe operária, postulando uma nova doutrina\npolítica. Essa doutrina foi o trabalhismo, enunciado por Getúlio e seu\nministro do Trabalho, Alexandre Marcondes Filho, em falas especiais no\nprograma radiofônico *A hora do Brasil*.\n\nO primeiro pronunciamento da oposição liberal contra a ditadura ocorreu\nem outubro de 1943 com o lançamento do *Manifesto aos mineiros*,\nassinado por personalidades de Minas Gerais. A partir do segundo\nsemestre de 1944, a crise do regime se tornou evidente. Osvaldo Aranha\nrenunciou ao Itamarati e os generais Dutra e Góes Monteiro passaram a\ndefender o fim do Estado Novo em contatos com civis e militares.\n\nEm fevereiro de 1945, a censura à imprensa foi liquidada com a\nentrevista de José Américo ao jornal *Correio da Manhã*, exigindo a\nrealização de eleições e o retorno das liberdades democráticas. Poucos\ndias após a publicação da entrevista, Vargas decretou o Ato Adicional\nque estabeleceu um prazo para a convocação de eleições gerais. Em\nseguida, articulou o lançamento da candidatura do general Dutra à sua\nsucessão.\n\nO processo de democratização se fortaleceu com a anistia aos presos e\nexilados políticos, a legalização do PCB e a organização de três novos\npartidos de âmbito nacional: o Partido Social Democrático (PSD), a União\nDemocrática Nacional (UDN) e o Partido Trabalhista Brasileiro (PTB). Na\ndisputa contra a candidatura udenista do brigadeiro Eduardo Gomes, o\ngeneral Dutra contaria com o apoio do PSD e do PTB, ambos criados sob a\ninspiração direta de Vargas.\n\nO PSD foi organizado em cada estado pelos interventores, apoiando-se na\nmáquina política e administrativa do Estado Novo. O partido também se\nvaleu das alianças que o regime de Vargas celebrou com líderes do\nempresariado, como Roberto Simonsen, que via na intervenção estatal a\ncondição de desenvolvimento industrial do país. A UDN agrupou líderes\nliberais, conservadores e, no início, até mesmo elementos da esquerda\nnão comunista. O PTB representou o esforço de Getúlio em\ninstitucionalizar sua grande popularidade entre as massas e os\nsindicatos e, ao mesmo tempo, constituía a tentativa de atalhar à\nesquerda a marcha dos comunistas.\n\nEm julho de 1945, começou a ganhar corpo um movimento liderado por\ndirigentes sindicais em favor da permanência de Vargas no poder. O\npresidente não encorajou abertamente o movimento queremista, assim\nchamado por causa da palavra de ordem “Queremos Getúlio”, mas nada fez\npara evitar as grandes manifestações de massa que se sucederam em várias\ncidades, sobretudo no Rio de Janeiro, com apoio dos comunistas.\n\nEm 29 de outubro, sob suspeita de continuísmo, Vargas foi deposto por um\ngolpe militar liderado por Góes Monteiro, recém-nomeado ministro da\nGuerra. Em comunicado à nação, Getúlio declarou que renunciara por\nvontade própria e sem guardar malquerença com as Forças Armadas. Viajou\npara São Borja e contribuiu decisivamente para vitória eleitoral de\nDutra em dezembro de 1945 com a diretiva conhecida como “Ele disse”. Foi\ntambém o candidato que obteve os resultados mais espetaculares no pleito\npara a Assembleia Constituinte: elegeu-se senador por dois estados e\ndeputado por sete.\n\nVargas continuou sendo o divisor de águas da política nacional durante o\nmandato do general Dutra, embora tenha permanecido a maior parte do\ntempo em São Borja. Compareceu a poucas sessões da Constituinte e do\nSenado na legislatura que se seguiu à promulgação da Carta de 1946. Não\nchegou mesmo a assinar a quarta constituição republicana que\nrestabeleceu o regime democrático, mantendo, contudo a estrutura\nsindical corporativista, assim como a capacidade intervencionista e\nregulatória do Estado.\n\nNas eleições de 1947, percorreu vários estados, apoiando em regra os\ncandidatos do PTB às assembleias legislativas e do PSD aos governos\nestaduais. Definiu assim uma parte substancial da estratégia que haveria\nde levá-lo novamente ao poder: “Manter a lealdade dos tradicionais\ncaciques políticos do interior, através do PSD, ao mesmo tempo em que\nconseguia força eleitoral nas cidades, por meio do PTB”, como escreveu\nThomas Skidmore.\n\nQuando fracassaram os entendimentos entre o PSD e a UDN para uma\ncandidatura comum, o ex-ditador surgiu como candidato do PTB em aliança\ncom o Partido Social Progressista (PSP), do governador paulista Ademar\nde Barros. O apoio de Ademar foi muito importante para sua vitória,\nassim como o de alguns setores do PSD que abandonaram o candidato\nCristiano Machado.\n\nEm outubro de 1950, foi eleito presidente com 3,8 milhões de votos\n(49%), derrotando o brigadeiro Eduardo Gomes, novamente lançado pela\nUDN, e Cristiano Machado. Seu companheiro de chapa, o pessepista João\nCafé Filho, conquistou a vice-presidência.\n\nVargas tomou posse em 31 de janeiro de 1951 com um ministério de\npredominância conservadora, composto por representantes do PSD (Justiça,\nFazenda, Exterior, Educação e Saúde), PTB (Trabalho), PSP (Viação e\nObras Públicas) e até mesmo da UDN (Agricultura), nesse caso com a clara\nintenção de arrefecer o ânimo oposicionista udenista. Constituiu um\nórgão de assessoramento e planejamento econômico com técnicos de\norientação nacionalista, que cuidaram da elaboração dos projetos da\nPetrobras e Eletrobras.\n\nSeu segundo governo promoveu várias medidas destinadas a incentivar o\ndesenvolvimento econômico, com ênfase na industrialização. No fim de\n1951, o Congresso aprovou o Fundo de Reaparelhamento Econômico,\nconcebido pelo ministro Horácio Lafer (Fazenda) para o financiamento em\nmoeda nacional de um amplo programa de investimentos em infraestrutura.\nVargas também propôs a criação do Banco Nacional de Desenvolvimento\nEconômico (BNDE) para a administração do fundo e dos recursos em moeda\nestrangeira que vinham sendo negociados com os Estados Unidos. O BNDE\nfoi constituído em junho de 1952 como agência permanente de fomento do\ndesenvolvimento de setores básicos da economia brasileira.\n\nO projeto da Petrobras enfrentou críticas tanto de nacionalistas quanto\nde adversários da intervenção estatal no setor de petróleo. Suscitou uma\ncampanha acirrada e afinal vitoriosa pelo monopólio estatal do petróleo,\nnão previsto no texto original. A lei de criação da Petrobras,\nsancionada por Vargas em outubro de 1953, descartou a participação\nprivada. A maior surpresa foi a mudança de posição da UDN que advogou o\nmonopólio estatal.\n\nNa área militar, Getúlio logo se viu enredado pelo confronto entre a ala\nnacionalista e a corrente pró-americana e anticomunista, composta em\ngrande parte por oficiais hostis ao presidente. Recusou a participação\nde tropas brasileiras na Guerra da Coreia, mas aceitou a renovação do\nacordo militar com os Estados Unidos em março de 1952. Na mesma ocasião,\nviu-se obrigado a demitir seu ministro da Guerra, o nacionalista\nEstillac Leal.\n\nNa área econômica, o governo também se viu diante de sérias dificuldades\nem decorrência do avanço da inflação e do agravamento do déficit do\nbalanço de pagamentos. Vargas preocupou-se em preservar seu capital\npolítico junto aos trabalhadores urbanos. Já em 1951, concedeu um\naumento de 20% do valor real do salário mínimo (congelado durante a\nadministração Dutra) e aboliu o “atestado de ideologia” para\nparticipação na vida sindical. A alta do custo de vida provocou uma\nsérie de greves nos grandes centros urbanos em 1953.\n\nA oposição udenista redobrou os ataques contra Getúlio, com o apoio da\nmaioria da imprensa. O único jornal de grande circulação com orientação\nfavorável ao governo era *Última Hora*, pertencente a Samuel Wainer. Uma\ncampanha capitaneada pelo jornalista Carlos Lacerda, em seu diário\n*Tribuna da Imprensa*, resultou na instauração de uma Comissão\nParlamentar de Inquérito (CPI) para apurar o suposto favorecimento do\npresidente e de seus familiares na concessão de empréstimo do Banco do\nBrasil a empresa de Wainer.\n\nEm junho de 1953, Vargas reorganizou o ministério a fim de enfrentar as\nmúltiplas pressões que se avolumavam. As mudanças incluíram a designação\nde Osvaldo Aranha para a Fazenda e de João Goulart para o ministério do\nTrabalho. Presidente nacional do PTB, Goulart era um dos amigos mais\npróximos de Vargas e elemento de confiança nos meios sindicais. A\natuação do jovem ministro alarmou industriais, eleitores de classe média\ne militares conservadores. A oposição logo interpretou a escolha de\nGoulart como parte de um plano varguista para implantar um “regime\nsindicalista”, similar ao estabelecido pelo presidente argentino Juan\nDomingo Perón.\n\nA insatisfação militar contra o governo tornou-se manifesta em fevereiro\nde 1954 com a divulgação do chamado *Memorial dos coronéis*, assinado\npor oficiais que serviam no Rio de Janeiro, em protesto contra o que\nconsideravam a deterioração dos padrões materiais e morais do Exército.\nO documento também criticava a proposta de elevação de 100% do salário\nmínimo anunciada por Goulart, que foi afastado do ministério, assim como\no general Ciro Espírito Santo Cardoso, destituído da pasta da Guerra.\n\nDois meses depois, o ex-chanceler João Neves da Fontoura forneceu mais\nmunição à oposição, denunciando entendimentos secretos entre Vargas e\nPerón para a formação de um bloco antiamericano no hemisfério, composto\npor Argentina, Brasil e Chile. Em maio, Getúlio anunciou a decisão de\ndobrar o salário mínimo, provocando uma tempestade de críticas.\n\nEmbora desgastado por sucessivas crises, o presidente ainda conseguia se\nequilibrar no poder, quando um acontecimento traumático tornou\nextraordinariamente grave sua posição. Na madrugada de 5 de agosto de\n1954, Carlos Lacerda sofreu um atentado a bala quando chegava à sua\nresidência no Rio de Janeiro. O jornalista escapou com um ferimento no\npé, mas o major Rubens Vaz, integrante de um grupo de oficiais da\nAeronáutica que lhe dava proteção, morreu na hora.\n\nComprovada a participação de elementos da guarda pessoal de Getúlio, a\nUDN passou a exigir sua renúncia. Gregório Fortunato e os demais\nimplicados no atentado foram presos pela Aeronáutica. A descoberta de\ntransações irregulares promovidas por Gregório abalou ainda mais a\nimagem do governo. Brigadeiros lotados no Rio exigiram a saída de\nVargas. Comandantes da Marinha e do Exército endossaram a exigência. Um\nmanifesto assinado por 37 generais abalou a última linha de sustentação\nmilitar do presidente, representada pelo ministro da Guerra, Zenóbio da\nCosta.\n\nNa madrugada de 24 de agosto, Getúlio concordou em se licenciar do\ncargo, após dramática reunião ministerial. Por volta das 7h, o Exército\ntransmitiu o ultimato: o afastamento teria de ser definitivo. Uma hora e\nmeia depois, sozinho em seu quarto no Palácio do Catete, o presidente\nGetúlio Vargas cometeu suicídio, disparando um tiro na altura do\ncoração.\n\nVargas legou uma apaixonada *Carta Testamento*, logo irradiada para todo\no país, conferindo sentido épico e político à sua morte. A carta\napontava à nação os responsáveis pelo gesto extremo, denunciando em tom\nangustioso a campanha subterrânea de grupos internacionais e aliados\ninternos contra a política trabalhista e nacionalista. Massas de\ntrabalhadores saíram às ruas nas grandes cidades, manifestando pesar e\nrevolta pela morte do presidente. Houve incidentes violentos, como a\ndepredação de jornais antigetulistas e o ataque à embaixada\nnorte-americana na capital. Uma enorme multidão acompanhou no Rio o\ncortejo que conduziu o corpo de Vargas ao aeroporto Santos Dumont para o\ntraslado até São Borja.\n\nO desenlace da crise de agosto de 1954 revigorou o carisma e o mito de\nVargas, marcando profundamente o imaginário e a vida política\nbrasileira. Teve o efeito de reverter a enorme vantagem da oposição -\ntornada governo com a posse de Café Filho – e deu novo alento à aliança\nentre o PSD e o PTB, consagrada nas eleições de 1955 com a vitória de\nJuscelino Kubitschek para a presidência e João Goulart para a\nvice-presidência.\n\nVários parentes de Getúlio Vargas e elementos ligados à sua família\ntiveram uma atuação de certo relevo na vida política e administrativa do\npaís. Entre seus filhos, Lutero Sarmanho Vargas foi um dos fundadores do\nPTB, deputado federal pelo Distrito Federal de 1951 a 1959, deputado à\nAssembleia Constituinte da Guanabara em 1961, embaixador do Brasil em\nHonduras em 1962 e no México em 1963. Alzira Sarmanho Vargas foi\nauxiliar de gabinete da Presidência da República de 1937 a 1945. Pelo\nseu casamento com Ernâni Amaral Peixoto, passou a assinar-se Alzira\nVargas do Amaral Peixoto. A partir da morte de sua mãe (1968), tornou-se\npresidente da Casa do Pequeno Jornaleiro. Manuel Antônio (Maneco)\nSarmanho Vargas foi prefeito de Porto Alegre de 1958 a 1960.\n\nCelina Vargas do Amaral Peixoto, filha de Alzira e Ernâni do Amaral\nPeixoto, foi fundadora e diretora do Centro de Pesquisa e Documentação\nde História Contemporânea do Brasil (Cpdoc) da Fundação Getulio Vargas\ndesde sua criação em 1973 até 1990, diretora do Arquivo Nacional, de\n1980 a 1990, e superintendente e depois diretora geral da FGV de 1990 a\n1997.\n\nA obra publicada de Getúlio Vargas é constituída por discursos e\nmensagens, reunidos em *A nova política do Brasil* (1938-1947, 11v.), *A\npolítica trabalhista do Brasil* (1950), *A campanha presidencial*\n(1951), *O governo trabalhista do Brasil* (1952-1969, 4v.), *A política\nnacionalista do petróleo no Brasil* (1964) e *Getúlio Vargas**:\ndiscursos 1903-1929* (1997).\n\nVargas foi biografado por dezenas de autores, entre os quais: André\nCarrazoni, *Getúlio Vargas* (1939), Paul Frischauer, *Presidente Vargas*\n(1943), Barros Vidal, *Um destino a serviço do Brasil* (1945), Alzira\nVargas do Amaral Peixoto, *Getúlio Vargas, meu pai* (1960), Carlos\nHeitor Cony, *Quem matou Vargas* (1974), John W. Foster Dulles, *Getúlio\nVargas, biografia política* (1974), Maria Lúcia Teixeira Werneck Viana,\n*Getúlio Vargas* (1974), Boris Fausto, *Getúlio Vargas: o poder e o\nsorriso* (2006).\n\nA era Vargas ocupa um lugar destacado nas obras sobre a história\nbrasileira contemporânea em seus mais diversos aspectos políticos,\neconômicos e sociais.\n\nSeu nome foi dado a três municípios brasileiros. No Rio Grande do Sul, o\nmunicípio de Getúlio Vargas foi criado em 1934 quando o distrito de\nErechim foi desmembrado do município de mesmo nome. Em Santa Catarina, o\ndistrito de Nova Breslau, pertencente ao município de Ibirama, passou a\nter a denominação de Getúlio Vargas em 1938 e de Presidente Getúlio em\n1944. Em 1953, foi elevado à categoria de município com a denominação de\nPresidente Getúlio. No Maranhão, o município de Presidente Vargas foi\ncriado em 1954 com o desmembramento do distrito de Paranaidji do\nmunicípio de Carolina.\n\nO arquivo particular de Getúlio Vargas encontra-se depositado no Cpdoc,\nseus diários pessoais foram publicados pelas pesquisadoras Maria Celina\nD’Araújo, Regina da Luz Moreira e Ângela de Castro Gomes, sob o título\nGetúlio Vargas: diário (1995, 2v.).\n\nPaulo Brandi Cachapuz\n\n**FONTES:** AITA, C; AXT, G. *Getúlio*; ARAÚJO, R. V. *Vargas*; AXT, G.\n*Emergência*; AXT, G. *Governo*; BRANDI, P. *Vargas*; COLUSSI, E; DIEHL,\nA. A. *Cultura*; COLUSSI, E. *Violência*; D’ARAÚJO, M. C. *Fio*; Da\nvida; FARIA, A. A; BARROS, E. L. *Getúlio*; FAUSTO, B. *Getúlio*;\nFAUSTO, B. *História*; FAUSTO, B. *Memória*; GOMES, A. C. *Escrita*;\nPINHEIRO, P. S. *Getúlio*; QUADROS, J; FRANCO, A. A. Melo. *História*;\nREZENDE, S. G. *Vargas*; SILVA, R. M; CACHAPUZ, P. B; LAMARÃO, S.\n*Getúlio*; ANDRADE, M. 1930; ARQ. GETÚLIO VARGAS; BEIGUELMAN, P.\n*Processo*; BELO, J. *História*; BORGES, V. *Getúlio*; BOURNE, R.\n*Getúlio*; CAMARGO, A. *Carisma*; CARONE, E. *República velha*; CARONE,\nE. *Revoluções*; CARONE, E. *Tenentismo*; CARRAZONI, A. *Getúlio*;\nCARRAZONI, A. *Perfil*; CONY, C. *Quem*; COUTINHO, L. *General*; DULLES,\nJ. *Getúlio*; Encic. Mirador; Energia; FAORO, R. *Donos*; FAUSTO, B.\n*Crise*; FAUSTO, B. *Pequenos*; FAUSTO, B. *Revolução*; FAUSTO, B.\n*Revolução* 1930; FONTOURA, J. *Memórias*; FRANCO, A. *Estadista*;\nFRANCO, V. *Outubro*; FRISCHAUER, P. *Presidente*; FUND. GETULIO VARGAS.\n*Revolução*; FURTADO, C. *Formação*; GOMES, A. *Burguesia*; GOMES, A.\n*Regionalismo*; Grande encic. Delta; *História do Século*; JARDIM, Z.\n*Trajetória*; LEVINE, R. *Regime*; LIMA SOBRINHO, A. *Verdade*; LOVE, J.\n*Regionalismo*; MAGALHÃES JÚNIOR, R. *Getúlio*; MARTINS, W. *História*;\nMENDES JÚNIOR, A. *Brasil*; MORAIS FILHO, E. *Problema*; PEIXOTO, A.\n*Getúlio*; PESAVENTO, S. *República*; PINHEIRO, P. *Getúlio*; *Revolução\nde 1930*; SCHNEIDER, R. *Flores*; SILVA, H. *História*; SILVA, H. 1930;\nSILVA, H. *Vargas*; SKIDMORE, T. *Brasil*; SOUSA, M. *Processo*;\nTAVARES, J. *Getúlio*; TRINDADE, H. *Aspectos*; VERGARA, L. *Fui*;\nVIANNA, M. *Getúlio*; VIDAL, B. *Destino*; VILELA, A. *Política*.\n","ref":"**FONTES:** AITA, C; AXT, G. *Getúlio*; ARAÚJO, R. V. *Vargas*; AXT, G.\n*Emergência*; AXT, G. *Governo*; BRANDI, P. *Vargas*; COLUSSI, E; DIEHL,\nA. A. *Cultura*; COLUSSI, E. *Violência*; D’ARAÚJO, M. C. *Fio*; Da\nvida; FARIA, A. A; BARROS, E. L. *Getúlio*; FAUSTO, B. *Getúlio*;\nFAUSTO, B. *História*; FAUSTO, B. *Memória*; GOMES, A. C. *Escrita*;\nPINHEIRO, P. S. *Getúlio*; QUADROS, J; FRANCO, A. A. Melo. *História*;\nREZENDE, S. G. *Vargas*; SILVA, R. M; CACHAPUZ, P. B; LAMARÃO, S.\n*Getúlio*; ANDRADE, M. 1930; ARQ. GETÚLIO VARGAS; BEIGUELMAN, P.\n*Processo*; BELO, J. *História*; BORGES, V. *Getúlio*; BOURNE, R.\n*Getúlio*; CAMARGO, A. *Carisma*; CARONE, E. *República velha*; CARONE,\nE. *Revoluções*; CARONE, E. *Tenentismo*; CARRAZONI, A. *Getúlio*;\nCARRAZONI, A. *Perfil*; CONY, C. *Quem*; COUTINHO, L. *General*; DULLES,\nJ. *Getúlio*; Encic. Mirador; Energia; FAORO, R. *Donos*; FAUSTO, B.\n*Crise*; FAUSTO, B. *Pequenos*; FAUSTO, B. *Revolução*; FAUSTO, B.\n*Revolução* 1930; FONTOURA, J. *Memórias*; FRANCO, A. *Estadista*;\nFRANCO, V. *Outubro*; FRISCHAUER, P. *Presidente*; FUND. GETULIO VARGAS.\n*Revolução*; FURTADO, C. *Formação*; GOMES, A. *Burguesia*; GOMES, A.\n*Regionalismo*; Grande encic. Delta; *História do Século*; JARDIM, Z.\n*Trajetória*; LEVINE, R. *Regime*; LIMA SOBRINHO, A. *Verdade*; LOVE, J.\n*Regionalismo*; MAGALHÃES JÚNIOR, R. *Getúlio*; MARTINS, W. *História*;\nMENDES JÚNIOR, A. *Brasil*; MORAIS FILHO, E. *Problema*; PEIXOTO, A.\n*Getúlio*; PESAVENTO, S. *República*; PINHEIRO, P. *Getúlio*; *Revolução\nde 1930*; SCHNEIDER, R. *Flores*; SILVA, H. *História*; SILVA, H. 1930;\nSILVA, H. *Vargas*; SKIDMORE, T. *Brasil*; SOUSA, M. *Processo*;\nTAVARES, J. *Getúlio*; TRINDADE, H. *Aspectos*; VERGARA, L. *Fui*;\nVIANNA, M. *Getúlio*; VIDAL, B. *Destino*; VILELA, A. *Política*.\n","dic":"DHBPR"}
