{"title":"VASCONCELOS, José Marcelino Pessoa de","cargoss":["Presidente de associação ou confederação de empregados ou empregadores","Deputado federal"],"cargos_esp":[0,0],"datas_ini":[1898,1900],"datas_fim":[1900,1902],"estados":["ES","ES"],"autor":["Nara Saletto","Fernando Achiamé"],"content":"**VASCONCELOS, José Marcelino Pessoa de**\n\n\\*pres. ES 1898-1900; dep. fed. ES 1900-1902.\n\n*José Marcelino Pessoa de Vasconcelos* nasceu em Vitória, no dia 4 de\nnovembro de 1864, filho de José Marcelino Pereira de Vasconcelos e de\nJoaquina Pessoa e Vasconcelos. Seu pai foi deputado provincial e\ndeputado geral, além de advogado, jornalista, servidor público destacado\ne escritor com muitas obras publicadas, entre elas *Jardim poético*\n(1856) e *Ensaio sobre a história e estatística da província do Espírito\nSanto* (1857).\n\nFez os primeiros estudos em escola particular de Vitória, e os\npreparatórios no Ateneu Provincial, na mesma cidade. Continuou sua\nformação no Rio de Janeiro, inicialmente na Escola Politécnica, cujo\ncurso não concluiu, e depois na Faculdade de Medicina, pela qual se\nformou em 1889. Voltou, então, ao Espírito Santo, fixando-se em\nCachoeiro de Itapemirim e exercendo a clínica médica. Em 1894 retornou a\nVitória, onde foi nomeado médico da Hospedaria de Imigrantes e professor\nda Escola Normal do estado, recém-criada.\n\nEm 1895, foi eleito deputado estadual pelo Partido Republicano\nConstrutor (PRC), então no governo. Ao final de seu mandato, foi\nescolhido pelo partido candidato à presidência do estado na vaga aberta\npela renúncia de Graciano Santos Neves, que foi substituído\ninterinamente pelo vice-presidente Constante Gomes Sodré. Eleito, tomou\nposse a 6 de janeiro de 1898.\n\nEra um momento no qual se somavam dificuldades financeiras e políticas.\nUma crise econômica provocada pela queda acentuada do preço do café no\nmercado internacional atingia duramente o Espírito Santo, cuja economia\nse baseava naquele produto, e reduzia as receitas do tesouro estadual,\nenquanto a alta do câmbio onerava o pagamento da dívida externa. No\ncampo político, havia grande agitação no país e no estado – o que levara\nà renúncia o presidente Graciano Neves. No plano nacional, a oposição\nrefluíra após o fracassado atentado à vida do presidente Prudente de\nMorais em novembro de 1897, e a repressão que se seguira, mas o ambiente\npolítico ainda era de grande tensão. No estado, o pior momento também já\npassara, pois a oposição local, ligada à federal, fora atingida pelos\nacontecimentos, tanto mais que um de seus mais importantes chefes, o\ndeputado federal Torquato Moreira, estivera envolvido no atentado ao\npresidente da República. A radicalização política que marcara o ano de\n1897 levara o Partido Autonomista (PA), do barão de Monjardim, a se unir\nao PRC, formando o Partido Republicano Construtor Autonomista (PRCA),\nmas essa fusão provocou turbulência no PRC, que no ano anterior já\nsofrera uma cisão da qual saíra uma dissidência que incluía importantes\nchefes políticos.\n\nJosé Marcelino era um novato na política capixaba, não tinha uma forte\nliderança e nunca participara da direção do partido. Fora escolhido\ncandidato no auge da luta política, quando o principal líder do PRC,\nMuniz Freire, viera da Europa, onde se encontrava em missão oficial,\nespecialmente para administrar a crise política surgida na sua ausência,\ne retornara antes da posse do novo presidente.\n\nPara enfrentar a crise financeira, José Marcelino promoveu novos cortes\nnas despesas públicas com o funcionalismo civil e a força policial e\ntentou, sem sucesso, aprovar no Legislativo a criação do imposto\nterritorial, acompanhada da redução do imposto de exportação sobre o\ncafé, igualando sua alíquota à do Rio de Janeiro e Minas Gerais. Assinou\num empréstimo com o Banco da República, cujas negociações já se\nprocessavam no governo anterior. Esse empréstimo deu certo desafogo às\nfinanças estaduais e permitiu continuar, embora lentamente, a construção\nda Estrada de Ferro Sul do Espírito Santo, grande empreendimento dos\ngovernos anteriores. Mas, como a crise do café se estendeu por vários\nanos, acabou criando sérios problemas para o governo seguinte.\n\nSem força no partido, José Marcelino entrou em choque com o diretório\ncentral, e o conflito dividiu o Legislativo estadual. José Marcelino\nchegou a apresentar sua renúncia, porém, depois de quatro meses de\nembates e negociações, chegou-se a uma conciliação. O partido começou a\nser realmente pacificado após o retorno definitivo de Muniz Freire ao\nestado, em abril de 1899, quando a política federal também se acalmara,\ncom o início do governo de Campos Sales (15 de novembro de 1898). Tal\nquadro permitiu a José Marcelino desfrutar de alguma tranquilidade no\núltimo ano de sua administração, encerrada a 23 de maio de 1900, quando\nMuniz Freire iniciou seu segundo governo.\n\nPoucos meses depois foi eleito deputado federal, tendo tomado posse em\noutubro de 1900. Não completou o mandato, pois faleceu precocemente em\n11 de julho de 1902, no Rio de Janeiro. Não consta que tenha se casado.\n\nNara Saletto/Fernando Achiamé\n\n**FONTES:** *Comércio do Espírito Santo* (1898-1900); *Jornal Oficial*\n(11/7/1906); MORAES, P. *Dicionário*; NOVAES, H. *Memórias*; PEREIRA, A.\n*Homens*; VASCONCELOS, José Marcelino Pessoa de. Mensagem ao Congresso\nLegislativo (7/9/1898).\n","ref":"**FONTES:** *Comércio do Espírito Santo* (1898-1900); *Jornal Oficial*\n(11/7/1906); MORAES, P. *Dicionário*; NOVAES, H. *Memórias*; PEREIRA, A.\n*Homens*; VASCONCELOS, José Marcelino Pessoa de. Mensagem ao Congresso\nLegislativo (7/9/1898).\n","dic":"DHBPR"}
