{"title":"VASCONCELOS, José Vicente Meira de","cargoss":["Constituinte","Deputado federal","Membro de junta governativa","Deputado federal"],"cargos_esp":[0,0,0,0],"datas_ini":[1891,1891,1891,1912],"datas_fim":[1891,1893,1892,1914],"estados":[0,"PE","PE","PE"],"autor":["Raimundo Helio Lopes"],"content":"**VASCONCELOS, José Vicente Meira de**\n\n\\*const. 1891; dep. fed. PE 1891-1893; junta gov. PE 1891-1892; dep.\nfed. PE 1912-1914.\n\n*José Vicente Meira de Vasconcelos* nasceu em Olinda (PE) no dia 5 de\nabril de 1850, filho de José Lourenço Meira de Vasconcelos.\n\nIngressou na Faculdade de Direito do Recife em 1866 e formou-se em 1870.\nEnquanto estudante fundou o jornal *Madressilva*, destinado à defesa dos\ndireitos das mulheres e ao debate literário. Depois de formado, advogou\ne lecionou na cidade de Itambé (PE).\n\nEm 1872 foi nomeado oficial de gabinete do presidente da província de\nPernambuco, Henrique Pereira de Lucena, posteriormente barão de Lucena.\nPermaneceu no cargo até setembro de 1874, quando assumiu a promotoria\npública da comarca de Itambé e iniciou o processo jurídico de apuração\ndos envolvidos na revolta de Quebra-Quilos. Três meses depois foi\ntransferido para Olinda, onde atuou no apaziguamento de disputas entre\nalguns bispos da cidade e o governo imperial. Permaneceu nessa comarca\naté agosto de 1878, quando se mudou para Recife e fundou o jornal\n*Gazeta da Tarde*, em 1879. Em 1882 foi eleito deputado provincial em\nPernambuco e teve o mandato renovado até 1889.\n\nDepois da proclamação da República (15/11/1889), foi membro do Conselho\nde Intendência de Recife entre dezembro de 1889 e meados de 1890. Ainda\nem 1890 foi eleito deputado federal constituinte pelo estado de\nPernambuco e assumiu sua cadeira em 15 de novembro, quando foi instalada\na Assembleia Nacional Constituinte no Rio de Janeiro, agora Distrito\nFederal. Promulgada a nova Carta constitucional em 24 de fevereiro de\n1891, em junho seguinte passou a cumprir o mandato ordinário, até\ndezembro de 1893.\n\nDurante esse período fez parte também, ao lado de Ambrósio Machado da\nCunha Cavalcanti e de Joaquim Mendes Ouriques Jaques, da junta\ngovernativa que substituiu o governador de Pernambuco Antônio\nEpaminondas de Barros Correia, o barão de Contendas, deposto em 18 de\ndezembro de 1891. Eleito vice-governador, Ambrósio Machado da Cunha\nCavalcanti respondeu pelo governo de 7 até 20 de abril de 1892, quando\nAlexandre José Barbosa Lima, governador eleito, tomou posse.\n\nNovamente eleito deputado federal por Pernambuco para a legislatura\n1912-1914, fez parte da Comissão de Constituição e Justiça e das\ncomissões especiais da Câmara dos Deputados criadas para estudar os\nmeios de combater o analfabetismo e para analisar as denúncias contra o\npresidente marechal Hermes da Fonseca (1910-1914).\n\nNo campo jornalístico, colaborou com os periódicos pernambucanos *Jornal\nPequeno*, *A* *Madressilva*, *Gazeta da Tarde* e *Revista Acadêmica da\nFaculdade de Direito* *do Recife*. Foi também professor de direito\ninternacional público e privado, diplomacia e história dos tratados na\nFaculdade de Direito do Recife.\n\nRaimundo Helio Lopes\n\n**FONTES:** ABRANCHES, J. *Governos*; CÂM. DEP. *Deputados brasileiros*;\nNASCIMENTO, L. *História* (v.2, 5, 6).\n","ref":"**FONTES:** ABRANCHES, J. *Governos*; CÂM. DEP. *Deputados brasileiros*;\nNASCIMENTO, L. *História* (v.2, 5, 6).\n","dic":"DHBPR"}
