{"title":"VAZ, Henrique Cesar de Sousa","cargoss":["Deputado federal"],"cargos_esp":[0],"datas_ini":[1899],"datas_fim":[1899],"estados":["MG"],"autor":["Luciana Pinheiro"],"content":"**VAZ, Henrique Cesar de Sousa**\n\n\\*dep. fed. MG 1899.\n\n*Henrique César de Sousa Vaz* nasceu em Teresópolis (RJ), filho de Sousa\nVaz e de Filomena Cândida da Fonseca Vaz.\n\nFormou-se pela Faculdade de Medicina do Rio de Janeiro, então capital do\nImpério, em 1874. Passou anos de sua vida em São João Nepomuceno (MG),\nonde clinicou, foi redator do jornal *Minas Livre*, exerceu o mandato de\nvereador e foi presidente da Câmara Municipal. Também em Juiz de Fora\n(MG) trabalhou como médico. Além disso, foi produtor agrícola e\ncomandante da Guarda Nacional, com a patente de tenente-coronel.\n\nEm 1898, no decorrer da legislatura 1897-1899, foi eleito deputado\nfederal por Minas Gerais. Tomou posse na Câmara dos Deputados, no Rio de\nJaneiro, então Distrito Federal, em maio de 1899 e exerceu o mandato até\nnovembro.\n\nFaleceu em Juiz de Fora em 9 de junho de 1905.\n\nLuciana Pinheiro\n\n**FONTES:** CÂM. DEP. *Deputados brasileiros* (p.109); MONTEIRO, N.\n*Dicionário* (v.2, p.704).\n","ref":"**FONTES:** CÂM. DEP. *Deputados brasileiros* (p.109); MONTEIRO, N.\n*Dicionário* (v.2, p.704).\n","dic":"DHBPR"}
