{"title":"VAZ, José Viana","cargoss":["Deputado Geral","Governador de estado ou do Distrito Federal"],"cargos_esp":[0,0],"datas_ini":[1881,1890],"datas_fim":[1885,1891],"estados":["MA","MA"],"autor":["Alan Carneiro","Raimundo Helio Lopes"],"content":"**VAZ, José Viana**\n\n\\*jornalista; dep. geral MA 1881-1885; gov. MA 1890-1891.\n\n*José Viana Vaz* nasceu em São Luís do Maranhão no dia 22 de junho de\n1852, filho de José Caetano Vaz.\n\nFormou-se pela Faculdade de Direito do Recife em 1878, e ainda estudante\nfundou, em 1877, ao lado de Antônio de Almeida Oliveira e Sousa Freitas,\no periódico *O Democrata*. Ingressou na política filiando-se ao Partido\nLiberal do Império. Eleito deputado geral pelo Maranhão pela primeira\nvez em 1881, exerceu o mandato até 1885. Em 1886, agora com Casimiro\nDias Vieira Júnior, fundou o jornal *O Liberal*, e em 1889 foi eleito\ndeputado à Assembleia provincial maranhense.\n\nJá na República, em 5 de junho de 1890 foi nomeado fiscal de empréstimo\nà lavoura do Banco Hipotecário e Comercial do Maranhão. No governo do\ncapitão-tenente Manuel Inácio Belfort Vieira, iniciado em 25 de julho do\nmesmo ano, foi nomeado vice-governador do Maranhão, assim como Tarquínio\nLopes. Em 28 de outubro seguinte assumiu o governo do estado em\nsubstituição ao titular. Estimulou a agricultura, a partir do\nfinanciamento do crédito, incentivou a construção de fábricas de tecidos\ne bens de consumo e elevou alguns povoados à categoria de vila. No\nâmbito educacional, criou várias escolas e introduziu as cadeiras de\nhistória e corografia do Brasil no Liceu Maranhense. Em 24 de novembro\nde 1890 foi nomeado juiz seccional do Maranhão, para instalar a Justiça\nFederal do estado. Tomou posse em 3 de março de 1891 e no dia seguinte\ntransmitiu o governo a Tarquínio Lopes. Permaneceria como juiz seccional\npor 31 anos. Auxiliou com seus conhecimentos jurídicos na elaboração da\nprimeira Constituição republicana maranhense.\n\nFoi ainda inspetor de instrução pública em São Luís e primeiro diretor\nda Faculdade de Direito do Maranhão.\n\nFaleceu em São Luís no dia 5 de janeiro de 1922.\n\nAlan Carneiro/Raimundo Helio Lopes\n\n**FONTES:** CONS. JUST. FED. *Repertório*; MARQUES, C. *Dicionário*;\nMEIRELES, M. *História*; PLANALTO. Disponível em:\n\\<“www.planalto.gov.br/infger\\_07/governadores/GOV-MA.htm\\>. Acesso em:\n5/3/2010.\n","ref":"**FONTES:** CONS. JUST. FED. *Repertório*; MARQUES, C. *Dicionário*;\nMEIRELES, M. *História*; PLANALTO. Disponível em:\n\\<“www.planalto.gov.br/infger\\_07/governadores/GOV-MA.htm\\>. Acesso em:\n5/3/2010.\n","dic":"DHBPR"}
