{"title":"VEIGA JÚNIOR, Dídimo Agapito da","cargoss":["Ministro do Tribunal de Contas","Presidente de associação ou confederação de empregados ou empregadores"],"cargos_esp":[0,"TCU"],"datas_ini":[1893,1895],"datas_fim":[1919,1918],"estados":[0,0],"autor":[0],"content":"**VEIGA JÚNIOR, Dídimo Agapito da**\n\n\\*min. TCU 1893-1919; pres. TCU 1895-1918.\n\n*Dídimo Agapito da Veiga Júnior* nasceu em Nova Friburgo (RJ) no dia 28\nde junho de 1847, filho de Dídimo Agapito da Veiga e de Francisca Osório\nda Veiga.\n\nBacharelou-se em 1868 pela Faculdade de Direito de São Paulo. Como seu\npai, dedicou-se à magistratura. Foi juiz municipal de São João da Barra\n(RJ), juiz de órfãos em Campos (RJ), juiz de direito em Nova Friburgo\n(RJ) e em Cachoeiro de Itapemirim (ES). Ao longo de sua vida, Dídimo\nAgapito da Veiga Júnior também assumiu, já sob o regime republicano, em\n1891, o cargo de procurador fiscal e diretor do Tesouro Nacional. Em 17\nde janeiro de 1893, tomou posse como ministro do Tribunal de Contas. O\ntribunal, criado pelo Decreto n^o^ 966-A, de 7 de novembro de 1890, por\niniciativa do então ministro da Fazenda, Rui Barbosa, e norteado pelos\nprincípios da autonomia, fiscalização, julgamento, vigilância e energia,\nfoi institucionalizado definitivamente pela Constituição de 1891, ainda\npor influência de Rui Barbosa. Contudo, sua efetiva instalação só\nocorreu em 17 de janeiro de 1893, graças ao empenho de Serzedelo\nCorreia, ministro da Fazenda do governo do presidente Floriano Peixoto\n(1891-1894). Originariamente o TCU era responsável pelo exame, revisão e\njulgamento de todas as operações relacionadas à receita e à despesa da\nUnião. A Constituição de 1891 conferiu-lhe competência para liquidar as\ncontas da receita e da despesa e verificar sua legalidade antes de serem\nprestadas ao Congresso Nacional.\n\nMembro da primeira leva de ministros do TCU, de 1895 a 1918 exerceu a\npresidência do tribunal e de 1895 a 1917 foi também ministro relator das\ncontas do governo da República. Deixou o TCU ao se aposentar, em\nnovembro de 1919.\n\nFaleceu em 10 de novembro de 1939.\n\nPublicou *A crença* (1864); *Palestra acadêmica* (revista científica e\nliterária de periodicidade mensal, publicada em 1866 sob sua direção e a\nde Cândido Leitão e Leôncio de Carvalho); *Ondinas: poesias* (1868);\n*Palmas e louros* (1869); *Mariposas: poesias* (1870); *Direito criminal\n– Da tentativa e da cumplicidade* (1871); *A lei do recrutamento*\n(1876); *Direito criminal – Da autoria* (1876); *Marcas de fábrica*\n(1877); *Primeiras linhas sobre o processo orfanológico por José Pereira\nde Carvalho* (1880); *Direito civil – Servidões reais* (1887); *Tratado\nde direito hipotecário* (1888); *Comentário da lei das sociedades\nanônimas* (1891); *Regulamentação da função dos corretores de fundos de\ndezembro de 1896*; *Projeto de reorganização do Tribunal de Contas*;\n*Projeto de regulamentação do funcionamento das companhias de seguros de\nvida marítimos e terrestres nacionais e estrangeiros (aprovados pelo\nDecreto n^o^ 4.270 de 10 de dezembro de 1901)*; *Projeto do código de\ncontabilidade pública, de acordo com a autorização contida no art. 2^o^,\nnúmero IX, da Lei n^o^ 953, de 29 de dezembro de 1902*; *Relatório das\nteses de direito internacional privado no congresso jurídico brasileiro*\n(1908); *Projeto de reorganização do Tesouro Nacional (Lei n^o^ 2.053 de\n30 de julho e Decreto n^o^ 7751 de 23 de dezembro de 1909)*; *Relatório\ne parecer das contas do governo nos anos de 1895 a 1917*; *Comentários\ndo código civil – Direito das coisas*; *Comentário do código do comércio\n– Lições de ciências das finanças*; *Enfiteuse e servidões reais*;\n*Usufruto, uso e habitação*; *Penhor e anticrese*; e ainda *Sobre a\ntentativa: a autoria e a cumplicidade*.\n\nIzabel Pimentel da Silva\n\n**FONTES:** BLAKE, A. *Diccionario*; GUIMARÃES, A. *Diccionario*; SILVA,\nI. *Diccionario*; SOUSA, J. *Índice*; TRIB. CONT. UNIÃO. Disponível em:\n\\<http://portal2.tcu.gov.br/portal/page/portal/TCU\\>; TRIB. CONT. UNIÃO.\n*Ministros do Tribunal.*\n","ref":"**FONTES:** BLAKE, A. *Diccionario*; GUIMARÃES, A. *Diccionario*; SILVA,\nI. *Diccionario*; SOUSA, J. *Índice*; TRIB. CONT. UNIÃO. Disponível em:\n\\<http://portal2.tcu.gov.br/portal/page/portal/TCU\\>; TRIB. CONT. UNIÃO.\n*Ministros do Tribunal.*\n","dic":"DHBPR"}
