{"title":"VEIGA, Raul","cargoss":["Deputado federal","Presidente de associação ou confederação de empregados ou empregadores","Deputado federal"],"cargos_esp":[0,0,0],"datas_ini":[1909,1918,1927],"datas_fim":[1917,1922,1930],"estados":["RJ","RJ","RJ"],"autor":["Raimundo Helio Lopes"],"content":"**VEIGA, Raul**\n\n\\*dep. fed. RJ 1909-1917; pres. RJ 1918-1922; dep. fed. RJ 1927-1930.\n\n*Raul de Morais Veiga* nasceu na fazenda da Barra, em São Francisco de\nPaula, atual Trajano de Morais (RJ), no dia 24 de outubro de 1878, filho\nde João Henriques da Veiga e de Antônia da Silva Morais. Sua mãe\npertencia a uma família de grandes proprietários rurais e cafeicultores,\nenquanto seu pai, médico, era sobrinho do comissário de café Feliciano\nJosé Henriques, que tratava dos interesses da família Morais no Rio de\nJaneiro. Seu primo José Antônio de Morais foi deputado federal pelo\nestado do Rio de Janeiro de 1918 a 1920 e de 1924 a 1930.\n\nNo fim da década de 1880, o casal João Henriques e Antônia mudou-se para\nNova Friburgo (RJ) para garantir a educação dos dez filhos nos colégios\nda cidade. Assim, Raul estudou no Colégio Anchieta. Concluiu o curso\nsecundário no Rio de Janeiro, então Distrito Federal, no Colégio João\nAlfredo, ingressou na Escola Politécnica e formou-se em engenharia civil\nem 1899. Depois de formado, trabalhou em Niterói, onde foi engenheiro da\nComissão de Saneamento de 1904 a 1905 e entrou em contato com o grupo\npolítico liderado por Nilo Peçanha. Presidente do estado do Rio de 1903\na 1906, Nilo seria também vice-presidente, de 1906 a 1909, e presidente\nda República, de 1909 a 1910.\n\nEm 1906 Raul Veiga foi eleito deputado estadual pelo Partido Republicano\nFluminense (PRF). Tinha suas bases políticas no município de São\nFrancisco de Paula, assim como o primo José de Morais. Na Assembleia\nestadual, logo integrou a Comissão de Obras Públicas e depois a Comissão\nde Finanças. Em 1909, ao final da legislatura, não concorreu à\nreeleição, pois se candidatou a deputado federal. Foi eleito com o apoio\nde Nilo Peçanha, e da mesma forma o apoiou, e ao PRF, nas diversas\ncrises políticas ligadas às disputas eleitorais que levaram à\npresidência estadual Alfredo Backer (1907-1910), Oliveira Botelho\n(1910-1914) e o próprio Nilo, pela segunda vez (1914-1917). Foi\nsucessivamente reeleito deputado federal até 1917. Durante esses anos,\nfoi secretário da Câmara dos Deputados e membro da Comissão de Obras\nPúblicas.\n\nDepois da saída de Nilo Peçanha do governo estadual para assumir o\nMinistério das Relações Exteriores, em maio de 1917, iniciaram-se as\ndiscussões no PRF envolvendo a sucessão estadual do ano seguinte. Dois\nnomes surgiram como possíveis candidatos do partido: João Guimarães,\nlíder campista e sem ligações políticas fora do estado, e Raul\nFernandes, deputado federal desde 1909. Raul Veiga apoiou o segundo,\nmas, evitando o racha político no PRF, Nilo Peçanha influenciou os dois\ncandidatos a recusarem a indicação. Raul Veiga e Raul Fernandes passaram\nentão a articular a candidatura do próprio Nilo para o seu terceiro\nmandato no governo do estado, e os deputados estaduais simpáticos a essa\nideia propuseram uma reforma constitucional que lhe garantisse\nlegitimidade. Nas eleições para o Congresso Nacional de março de 1918, a\nchapa que receberia o apoio do PRF foi definida por Raul Fernandes,\nsuplantando a comissão executiva do partido. Desse modo, na tentativa de\nmais um reeleição, Raul Veiga não recebeu o apoio de seu partido e foi\nderrotado em seu distrito eleitoral por seu primo José de Morais, que\nfoi eleito deputado federal. Por sua vez, Nilo Peçanha, que teve seu\nnome aclamado na convenção do PRF para a escolha do candidato ao governo\nestadual, recusou sua indicação e recomendou a candidatura de Raul\nVeiga. A proposta foi aceita pelo partido e não houve necessidade de uma\nnova reunião para homologá-la. Em julho Raul Veiga foi eleito e assumiu\na presidência do estado em dezembro de 1918.\n\nDurante seu governo, as bases políticas do nilismo foram abaladas. Nilo\nPeçanha, na sucessão presidencial de 1919, apoiou Rui Barbosa, que foi\nderrotado por Epitácio Pessoa, eleito presidente da República\n(1919-1922). Com isso, a oposição ao nilismo, liderada principalmente\npelo ex-presidente estadual Oliveira Botelho (1910-1914) e por Feliciano\nSodré, ganhou mais espaço político no estado e teve mais força e\nrecursos eleitorais. Em maio de 1920, o PRF realizou uma convenção já\npensando na sucessão presidencial de 1922, na qual pretendia eleger Nilo\nPeçanha. Durante a convenção ficou definido que a executiva do partido\ndeveria ser controlada por políticos influentes na esfera federal, em\numa tentativa de dirimir as divergências entre Nilo e o governo federal,\ne assim fortalecer seu nome para as próximas eleições presidenciais.\nTambém se formalizou a passagem da liderança do partido para Raul Veiga,\npois logo depois do encontro Nilo viajou para a Europa, de onde só\nretornaria em junho de 1921. Além disso, depois dessa convenção, os\nnilistas passaram a referir-se a seu partido como Partido Republicano do\nRio de Janeiro (PRRJ), em vez de PRF, sigla que passou a ser adotada\npela oposição.\n\nApós toda essa articulação política, Nilo Peçanha foi candidato à\npresidência da República na chapa da Reação Republicana, mas foi\nderrotado em março de 1922 por Artur Bernardes (1922-1926). Com essa\nderrota no âmbito federal, o nilismo fluminense entrou em derrocada. Na\nsucessão estadual desse mesmo ano, o PRRJ lançou Raul Fernandes ao\ngoverno, enquanto a oposição apoiou Feliciano Sodré. O pleito realizado\nem 9 de julho foi marcado pelo estado de sítio decretado no estado do\nRio de Janeiro e no Distrito Federal devido à revolta irrompida em 5 de\njulho na Vila Militar, na Escola Militar do Realengo e no Forte de\nCopacabana. O movimento, que envolveu também a guarnição de Mato Grosso\ne iniciou o ciclo das revoltas tenentistas da década de 1920, foi\ndeflagrado em protesto contra a eleição de Artur Bernardes para a\npresidência da República e as punições impostas pelo governo Epitácio\nPessoa aos militares, com o fechamento do Clube Militar e a prisão do\nmarechal Hermes da Fonseca.\n\nRealizada a apuração da eleição fluminense, ambas as chapas\nconcorrentes, alegando fraude na contagem de votos do oponente,\nproclamaram eleitos os seus candidatos. Poucos dias depois, deveriam ser\nreconhecidos na Assembleia Legislativa (ALERJ) os deputados estaduais\neleitos em dezembro anterior. A oposição nilista, derrotada nesse\npleito, pretendia comparecer à seção de reconhecimento e rebelar-se\ncontra a diplomação dos novos parlamentares. Tentando evitar essa\nmanifestação, no dia 17 as forças situacionistas colocaram tropas da\npolícia no prédio da ALERJ, para impedir o ingresso de seus opositores,\nos quais, diante dessa proibição, ocuparam o prédio da Câmara Municipal\nde Niterói e formaram outra Assembleia, declarando-se o verdadeiro Poder\nLegislativo estadual. Já que o reconhecimento do presidente do estado\nera da competência da Assembleia, a dualidade de assembleias ensejou a\ndualidade de governos. Por temerem que o novo presidente Artur Bernardes\ndecretasse a intervenção federal no estado do Rio, os nilistas\napresentaram ao Supremo Tribunal Federal (STF) um pedido de habeas\ncorpus que assegurasse a posse de seu candidato. Atendido o pedido, Raul\nFernandes foi investido na presidência do estado, recebendo o cargo de\nRaul Veiga no dia 31 de dezembro de 1922. Entretanto, Feliciano Sodré\ntambém foi empossado por “sua” assembleia no mesmo dia. Logo depois, com\na cobertura do governo federal, os partidários de Feliciano Sodré\ndepuseram prefeitos adversários e fecharam câmaras municipais sob o\ncontrole dos nilistas. Enquanto isso acontecia, a Polícia Militar se\nrecolheu aos quartéis, declarando só acatar ordens do governo central.\nAlegando a duplicidade de poderes no Rio de Janeiro, Artur Bernardes\ndecretou a intervenção federal no estado e em 10 de janeiro de 1923\nentregou o Executivo fluminense a Aurelino Leal. O interventor anulou as\neleições legislativas de dezembro de 1921 e a de julho de 1922, marcando\noutras para outubro de 1923. Feliciano Sodré concorreu novamente e foi\neleito com o apoio de Bernardes para o período de 1923 a 1927.\n\nApós essa derrota, Raul Veiga e o grupo nilista só se reorganizaram em\nfevereiro de 1926, quando lançaram um manifesto apoiando a candidatura\nde Washington Luís à presidência da República. Com essa atitude de apoio\nao mesmo candidato de Feliciano Sodré, o PRRJ procurou se conciliar com\no governo estadual, mas sem perder seu caráter de oposição. Com a\nvitória de Washington Luís (1926-1930), o PRRJ formou uma nova\nexecutiva, liderada por Raul Veiga, e em 4 de dezembro de 1926 realizou\numa nova convenção, na qual foi debatida a aproximação com o governo na\nindicação do candidato às eleições para o governo estadual. O grupo\nliderado por Raul Veiga defendeu o acordo com o governo de Sodré e o\napoio ao candidato do PRF Manuel Duarte, enquanto a outra facção,\nchamada de “nilistas vermelhos”, liderada por Maurício de Lacerda,\nex-deputado federal (1912-1920), defendeu a candidatura de João\nGuimarães. A maioria do PRRJ decidiu pela ratificação da candidatura de\nJoão Guimarães e pela participação nas eleições federais, estaduais e\nmunicipais de 1927. Os “nilistas acordistas”, derrotados internamente,\npassaram a se autodesignar “membros dissidentes do PRRJ”, e lançaram as\ncandidaturas avulsas de Raul Veiga, Maurício de Medeiros e Eduardo\nCotrim Filho para a Câmara dos Deputados nas vagas destinadas à\noposição.\n\nNesse pleito, realizado em fevereiro de 1927, Raul Veiga foi eleito\ndeputado federal. Em 1930 concorreu à reeleição, sendo incluído, como\nnilista acordista, na chapa apoiada pelo PRF e pelo presidente estadual\nManuel Duarte (1927-1930). Reassumiu sua cadeira na Câmara dos Deputados\nem maio, mas teve seu mandato interrompido em outubro seguinte com a\nvitória da Revolução de 1930, que levou Getúlio Vargas ao poder e\nextinguiu todos os órgãos legislativos do país.\n\nCom o fim da Primeira República, retirou-se da vida política.\n\nFaleceu na cidade do Rio de Janeiro, em 23 de janeiro de 1947.\n\nFoi casado com Orlinda Martins da Rocha, com quem teve seis filhos.\n\nRaimundo Helio Lopes\n\n**FONTES:** ABRANCHES, J. *Governos* (1889-1917); ASSEMB. LEGISL. RJ.\nDisponível em:\n\\<www.alerj.rj.gov.br/memoria/historia/gov88975/raul\\_veiga.html\\>.\nAcesso em: 17/3/2011; BELOCH, I.; ABREU, A. *Dicionário*; COL. BRAS.\nGENEALOGIA. Disponível em:\n\\<www.cbg.org.br/arquivos\\_genealogicos\\_r\\_02.html\\>. Acesso em:\n17/3/2011; FERREIRA, M. *República*; LACOMBE, L. *Chefes*.\n","ref":"**FONTES:** ABRANCHES, J. *Governos* (1889-1917); ASSEMB. LEGISL. RJ.\nDisponível em:\n\\<www.alerj.rj.gov.br/memoria/historia/gov88975/raul\\_veiga.html\\>.\nAcesso em: 17/3/2011; BELOCH, I.; ABREU, A. *Dicionário*; COL. BRAS.\nGENEALOGIA. Disponível em:\n\\<www.cbg.org.br/arquivos\\_genealogicos\\_r\\_02.html\\>. Acesso em:\n17/3/2011; FERREIRA, M. *República*; LACOMBE, L. *Chefes*.\n","dic":"DHBPR"}
