{"title":"VIANA, Antônio Vicente Bulcão","cargoss":["Governador de estado ou do Distrito Federal","Governador de estado ou do Distrito Federal"],"cargos_esp":[0,0],"datas_ini":[1930,1925],"datas_fim":[1930,1926],"estados":["SC","SC"],"autor":["Carolina Vianna Dantas"],"content":"**VIANA, Antônio Vicente Bulcão**\n\n\\*militar; gov. SC 1925-1926 e 1930.\n\n*Antônio Vicente Bulcão Viana* nasceu em São Francisco do Conde (BA) no\ndia 11 de janeiro de 1875, filho de Francisco Vicente Viana e de Flora\nde Araújo de Aragão Bulcão Viana.\n\nFormou-se pela Faculdade de Medicina da Bahia em 1897 e no ano seguinte\nentrou para o Corpo de Saúde do Exército. Posteriormente foi transferido\npara Santa Catarina, Rio Grande do Sul e Bahia sucessivamente. Em 1905\nfoi novamente transferido para Santa Catarina, lotado no Hospital\nMilitar de Florianópolis.\n\nEm 1922 foi eleito deputado estadual em Santa Catarina, com mandato até\n1924. Reeleito para as legislaturas 1925-1927 e 1928-1930, foi escolhido\npresidente da Assembleia. Ocupou o cargo de governador do estado de\nSanta Catarina de novembro de 1925 a setembro de 1926, substituindo\nAntônio Pereira da Silva e Oliveira, vice-governador efetivado após a\nmorte do governador Hercílio Luz. Transferiu então o governo a Adolfo\nKonder.\n\nEntrou para a reserva do Exército como general de brigada.\n\nFaleceu em Florianópolis em 26 de março de 1940.\n\nEra casado com Augusta Ferreira de Viana Bandeira, com quem teve filhos.\n\nCarolina Vianna Dantas\n\n**FONTES:** PIAZZA, W. *Dicionário*; STOETERAU, L. *Trajetória*;\nWikipédia. Disponível em:\n\\<http://pt.wikipedia.org/wiki/Walter\\_Piazza\\>.\n","ref":"**FONTES:** PIAZZA, W. *Dicionário*; STOETERAU, L. *Trajetória*;\nWikipédia. Disponível em:\n\\<http://pt.wikipedia.org/wiki/Walter\\_Piazza\\>.\n","dic":"DHBPR"}
