{"title":"VIEIRA JÚNIOR, Casimiro Dias","cargoss":["Constituinte","Deputado federal","Presidente de associação ou confederação de empregados ou empregadores","Presidente de associação ou confederação de empregados ou empregadores"],"cargos_esp":[0,0,0,0],"datas_ini":[1891,1891,1896,1893],"datas_fim":[1891,1892,1897,1895],"estados":[0,"MA","MA","MA"],"autor":["Raimundo Helio Lopes"],"content":"**VIEIRA JÚNIOR, Casimiro Dias**\n\n\\*const. 1891; dep. fed. MA 1891-1892; pres. MA 1893-1895 e 1896-1897.\n\n*Casimiro Dias Vieira Júnior* nasceu na cidade de Guimarães (MA) em\n1853.\n\nFormou-se pela Faculdade de Direito do Recife e foi promotor público em\nViana (MA) de 1878 a 1881. Iniciou sua vida política ainda durante o\nImpério, quando se filiou ao Partido Liberal e atuou na facção liderada\npor Francisco de Paula Belfort Duarte. Ao lado de José Viana Vaz, fundou\no jornal *O Liberal* em 1886.\n\nDepois da proclamação da República, foi eleito deputado à Assembleia\nNacional Constituinte, que se instalou em 15 de novembro de 1890, e fez\nparte da Comissão dos 21, responsável pela análise e pela redação do\nprojeto de Constituição. Promulgada a Carta constitucional em 24 de\nfevereiro de 1891, passou em junho a exercer o mandato ordinário.\n\nEm 1892 foi eleito primeiro-vice-presidente do estado do Maranhão, ao\nlado do presidente Manuel Inácio Belfort Vieira. Quando este se afastou\npara tratamento de saúde, o segundo-vice-presidente Alfredo da Cunha\nMartins o substituiu entre 30 de novembro de 1892 e 27 de outubro de\n1893. Nesse dia, Casimiro Dias Vieira Júnior assumiu o governo do estado\ne o exerceu até 2 de fevereiro de 1895. Em alternância com Belfort\nVieira e Alfredo da Cunha Martins, voltou a assumir o governo de agosto\na dezembro de 1895 e de abril de 1896 a março de 1897. Nesse ano, quando\nocupava o posto de cônsul brasileiro em Londres, foi novamente eleito\ndeputado federal, mas não chegou a tomar posse, pois faleceu pouco\ndepois.\n\nRaimundo Helio Lopes\n\n**FONTES:** ABRANCHES, J. *Governos*; MARQUES, C. *Dicionário*;\nMEIRELES, M. *História.*\n","ref":"**FONTES:** ABRANCHES, J. *Governos*; MARQUES, C. *Dicionário*;\nMEIRELES, M. *História.*\n","dic":"DHBPR"}
