{"title":"VIEIRA, Belfort","cargoss":["Presidente de associação ou confederação de empregados ou empregadores","Constituinte","Deputado federal","Presidente de associação ou confederação de empregados ou empregadores","Presidente de associação ou confederação de empregados ou empregadores","Senador","min Marinha"],"cargos_esp":[0,0,0,0,0,0,0],"datas_ini":[1890,1891,1891,1895,1892,1897,1912],"datas_fim":[1890,1891,1892,1895,1892,1909,1913],"estados":["MA",0,"AM","MA","MA","MA",0],"autor":["Luciana Pinheiro"],"content":"**VIEIRA, Belfort**\n\n\\* militar; pres. MA 1890; const. 1891; dep. fed. AM 1891-1892; pres. MA\n1892 e 1895; sen. MA 1897-1909; min. Marinha 1912-1913.\n\n*Manuel Inácio Belfort Vieira* nasceu em São Luís do Maranhão no dia 30\nde abril de 1854, filho do conselheiro João Pedro Dias Vieira e de\nIsabel Nunes Belfort. Seu pai foi senador do Império (1861-1870),\nministro dos Assuntos Estrangeiros (1864-1865), ministro da Marinha\n(1864) e ministro da Agricultura (1864). Seu irmão João Pedro Belfort\nVieira foi presidente da província do Piauí (1879-1880), constituinte de\n1891, senador pelo Maranhão (1891-1897) e ministro do Supremo Tribunal\nFederal (1897-1910).\n\nEngenheiro geógrafo formado pela Escola Politécnica do Rio de Janeiro,\niniciou carreira na Marinha em 1871 quando ingressou na Escola Naval.\nTornou-se guarda-marinha dois anos depois, foi promovido a\nsegundo-tenente em 1875 e a primeiro-tenente em 1879. Foi inspetor de\nmáquinas e de estabelecimentos navais, e comandou a Escola de Aprendizes\nMarinheiros de Santa Catarina, a Divisão de Couraçados e a Divisão de\nCruzadores.\n\nEra capitão-tenente quando, em 25 de julho de 1890, assumiu o cargo de\npresidente do Maranhão em substituição a Augusto Olímpio Gomes de\nCastro. Em 15 de setembro seguinte foi eleito deputado constituinte pelo\nestado do Amazonas. Transmitiu o governo maranhense em 28 de outubro a\nJosé Viana Vaz e tomou posse no Congresso Nacional Constituinte em 15 de\nnovembro. Após a promulgação da Constituição em 24 de fevereiro de 1891,\ne o início, em maio, da legislatura ordinária, ocupou uma cadeira na\nCâmara dos Deputados. Renunciou, porém, ao mandato para assumir\nnovamente o governo do Maranhão em 8 de janeiro de 1892, substituindo a\njunta governativa formada por Francisco da Cunha Machado, o\ncapitão-tenente Oton de Carvalho Bulhão, Raimundo Joaquim Ewerton Maia e\nBenedito Pereira Leite. Em 30 de novembro do mesmo ano deixou o governo,\nsubstituído por Alfredo da Cunha Martins, mas a ele retornou ainda uma\nvez, entre 2 de fevereiro e 13 de agosto de 1895, quando o transmitiu a\nCasimiro Dias Vieira Júnior.\n\nEleito senador pelo Maranhão para preencher a vaga do irmão João Pedro\nBelfort Vieira, que renunciou ao mandato após ter sido nomeado ministro\ndo STF, tomou posse em janeiro de 1897. Em 1900 foi reeleito para mais\nnove anos de mandato. Nesse período foi promovido a capitão de fragata e\na capitão de mar e guerra. Após concluir o mandato em 1909 retomou suas\natividades como militar e em 1911 foi promovido a contra-almirante.\n\nEm 11 de janeiro de 1912 foi nomeado pelo presidente da República\nmarechal Hermes da Fonseca (1910-1914) ministro da Marinha, em\nsubstituição ao contra-almirante Joaquim Marques Batista de Leão.\nDurante sua atuação no ministério enfatizou a formação de novos quadros\na partir da remodelação estrutural da Escola de Aprendizes Marinheiros e\nda Escola de Grumetes. Permaneceu no ministério até 12 de julho de 1913,\nquando, em decorrência do seu frágil estado de saúde, foi substituído\ninterinamente pelo general Vespasiano Gonçalves de Albuquerque e Silva.\nEm seguida foi promovido a almirante.\n\nAo longo de sua carreira militar e política recebeu diversas\ncondecorações, entre as quais o título de comendador da Ordem de São\nBento de Aviz e a medalha Militar de Ouro.\n\nFaleceu no Rio de Janeiro em 31 de julho de 1913.\n\nCasou-se com Carolina Cadet de Sousa.\n\nPublicou *Relatório apresentado ao sr. vice-almirante ministro da\nMarinha pelo capitão de mar e guerra Manuel Inácio Belfort Vieira,\ninspetor dos navios e estabelecimentos navais e mais dependências do\nMinistério da Marinha* (1909).\n\nLuciana Pinheiro\n\n**FONTES:** Leblon. *Guia de Ruas.* Disponível em:\n\\<http://leblon.com.br/pra-almbel.shtml\\>. Acesso em: 10/2/2011; MAR.\nBRAS. Disponível em: \\<https://www.mar.mil.br/\\>. Acesso em: 10/3/2011;\nPLANALTO. Disponível em: \\<www.planalto.gov.br/\\>. Acesso em: 10/3/2011;\nSENADO. Disponível em: \\<www.senado.gov.br/\\>. Acesso em: 10/2/2011;\nSUP. TRIB. FED. Disponível em: \\<www.stf.jus.br/\\>. Acesso em:\n10/3/2011; VELHO SOBRINHO, J. *Dicionário* (p.224-225).\n","ref":"**FONTES:** Leblon. *Guia de Ruas.* Disponível em:\n\\<http://leblon.com.br/pra-almbel.shtml\\>. Acesso em: 10/2/2011; MAR.\nBRAS. Disponível em: \\<https://www.mar.mil.br/\\>. Acesso em: 10/3/2011;\nPLANALTO. Disponível em: \\<www.planalto.gov.br/\\>. Acesso em: 10/3/2011;\nSENADO. Disponível em: \\<www.senado.gov.br/\\>. Acesso em: 10/2/2011;\nSUP. TRIB. FED. Disponível em: \\<www.stf.jus.br/\\>. Acesso em:\n10/3/2011; VELHO SOBRINHO, J. *Dicionário* (p.224-225).\n","dic":"DHBPR"}
