{"title":"BARRETO, Emídio Dantas","cargoss":["Ministro da Guerra","Governador de estado ou do Distrito Federal","Senador","Deputado federal"],"cargos_esp":[0,0,0,0],"datas_ini":[1910,1911,1916,1921],"datas_fim":[1911,1915,1918,1923],"estados":[0,"PE","PE","PE"],"autor":["Marcos Paulo Torres"],"content":"**BARRETO, Emídio Dantas**\n\n\\*militar; min. Guerra 1910-1911; gov. PE 1911-1915; sen. PE 1916-1918;\ndep. fed. PE 1921-1923.\n\n*Emídio Dantas Barreto* nasceu em Bom Conselho (PE) no dia 23 de março\nde 1850.\n\nPertencente a uma família de escassos recursos financeiros, ainda na\ninfância dedicou-se junto com um irmão à venda de joias pelos sertões do\nNordeste. Aos 15 anos de idade tornou-se voluntário das tropas\npernambucanas que seguiram para a Guerra do Paraguai (1864–1870). Um ano\nantes do fim da guerra, já era considerado um ex-combatente e foi\npromovido a alferes. Durante a construção de sua carreira militar,\npassou por cursos de artilharia, cavalaria e infantaria. Em 1879 foi\npromovido a tenente, e em 1882, devido aos estudos realizados, passou a\ncapitão; em 1890, por mérito, foi promovido a major, e em 1894, a\ntenente-coronel. Em 1897 chegou a coronel, em 1906 a general de brigada\ne, por fim, em 1908, a general de divisão. Ao longo desse período\nparticipou ativamente da Revolta da Armada (1893-1894) e da repressão à\nGuerra de Canudos (1897).\n\nNo governo Hermes da Fonseca (1910-1914), foi nomeado ministro da\nGuerra. Assumiu o cargo em 15 de novembro de 1910, sucedendo ao general\nJosé Bernardino Borman, e exerceu-o até 1911, quando resolveu concorrer\nao governo de Pernambuco na sucessão de Herculano Bandeira de Melo,\nsendo substituído no ministério pelo general Antônio Mena Barreto.\n\nSua candidatura foi apresentada com o apoio dos militares, e contra ela\nfoi lançada a de Francisco de Assis Rosa e Silva, chefe da facção que\ndominava o estado e que era apoiada pelas forças políticas civis. Em\nvirtude da disputa, ocorreram episódios como brigas, tiroteios e troca\nde insultos entre os “dantistas” e os “rosistas”, além de manifestações\nnas ruas, invasões de quartéis policiais e do palácio do governo,\nfechamento de jornais e de casas comerciais. As notícias de violência e\nterror nas ruas da capital pernambucana chegaram ao Rio de Janeiro,\ncapital federal na época, e a Lisboa, onde os incidentes foram relatados\nnos jornais. Só após a intervenção de Estácio Coimbra, que como\npresidente da Assembleia Legislativa substituiu interinamente Herculano\nBandeira de Melo no governo, a realização da eleição e a convocação do\nCongresso estadual para o reconhecimento do candidato eleito, a situação\ncomeçou a se normalizar. Apesar das denúncias de fraudes nas eleições,\nDantas Barreto foi legitimado como governador de Pernambuco, sendo sua\nvitória anunciada pelo jornal *Diário de Pernambuco* no dia 21 de\nnovembro de 1911. Tomou posse em 19 de dezembro e durante sua\nadministração atuou fortemente no combate aos grupos de cangaceiros,\nenviando forças volantes para o interior com o objetivo de extinguir os\ngrupos de bandoleiros. Governou até 18 de dezembro de 1915, quando\npassou o poder a Manuel Antônio Pereira Borba.\n\nAinda em 1915 elegeu-se senador e de 1916 a 1918 ocupou uma cadeira no\nSenado. Eleito deputado federal em março de 1921, representou Pernambuco\nna Câmara dos Deputados até o fim da legislatura, em dezembro de 1923.\n\nFaleceu no Rio de Janeiro no dia 8 de março de 1931, deixando registrada\nsua atuação nas carreiras militar e política. Sua dedicação à produção\nde trabalhos científicos, estudos de guerra, romances históricos, textos\nteatrais, crônicas e artigos em revistas e jornais lhe haviam rendido,\nno início de 1911, a cadeira n^o^ 27 da Academia Brasileira de Letras,\nsucedendo ao político, historiador, diplomata e abolicionista Joaquim\nNabuco, falecido em 1910.\n\nEntre suas produções literárias conhecidas estão *A condessa Hermínia*\n(teatro, 1883); *Lucinda e Coleta, episódios da vida fluminense* (1883);\n*Margarida Nobre* (romance, 1886); *A última expedição de Canudos*\n(história, 1898); *Acidentes da guerra. Operações de Canudos*,\n(história, 1915); *Expedição a Mato Grosso. A revolução de 1906* (1907);\n*Impressões militares* (1910); *A destruição de Canudos* (ensaio\nhistórico, 1912); *Discurso político* (1912) e *Conspirações* (1917).\n\nMarcos Paulo Torres\n\n**FONTES:** Biblioteca Virtual. Disponível em:\n\\<www.biblio.com.br/defaultz.asp?link=www.biblio.com.br/conteudo/biografias/dantasbarreto.htm\\>;\nDUARTE, J. *Almanaque*; PORTO, J. *Tempos de Estácio*; PORTO, J. *Tempos\nda República*; VAINSENCHER, S. *Emídio.*\n","ref":"**FONTES:** Biblioteca Virtual. Disponível em:\n\\<www.biblio.com.br/defaultz.asp?link=www.biblio.com.br/conteudo/biografias/dantasbarreto.htm\\>;\nDUARTE, J. *Almanaque*; PORTO, J. *Tempos de Estácio*; PORTO, J. *Tempos\nda República*; VAINSENCHER, S. *Emídio.*\n","dic":"DHBPR"}
