{"title":"VIEIRA, João Pedro Carvalho","cargoss":["Deputado federal"],"cargos_esp":[0],"datas_ini":[1914],"datas_fim":[1914],"estados":["MA"],"autor":["Raimundo Helio Lopes"],"content":"**VIEIRA, João Pedro Carvalho**\n\n\\*dep. fed. MA 1914.\n\n*João Pedro Carvalho Vieira* nasceu no Rio de Janeiro, então capital do\nImpério, no dia 28 de abril de 1877, filho de Antônio Sales Belfot\nVieira e de Josefa de Figueiredo Carvalho Vieira. Seu avô paterno, João\nPedro Dias Vieira, foi senador do Império, e seu avô materno, José Pedro\nDias de Carvalho, foi conselheiro de Estado e senador do Império.\n\nFez os primeiros estudos no Ginásio Nacional e no Colégio Tijuca, e\nformou-se pela Faculdade Livre de Direito do Rio de Janeiro. Sua vida\nprofissional esteve ligada à sua vida política. Em 1894 ingressou no\nSenado Federal como funcionário e no ano seguinte mudou-se para o\nMaranhão, ocupando o cargo de secretário particular do presidente do\nestado Manuel Inácio Belfort Vieira. Como funcionário do Senado, foi\nnomeado segundo-oficial da secretaria em 1901, primeiro-secretário em\n1903 e vice-diretor em 1910.\n\nEm 14 de julho de 1914 foi eleito deputado federal pelo Maranhão e em 18\nde agosto foi reconhecido. Ocupou uma cadeira na Câmara dos Deputados\naté dezembro de 1914, quando se encerrou a legislatura.\n\nNo campo jornalístico, colaborou com os periódicos *O País*, *Jornal do\nComércio* e *Correio da Noite*.\n\nSeu filho, João Pedro Gouveia de Carvalho Vieira, foi senador pelo\nestado do Rio de Janeiro nos anos de 1963, 1964, 1966 e 1967.\n\nRaimundo Helio Lopes\n\n**FONTES:** ABRANCHES, J. *Governos*; MARQUES, C. *Dicionário*.\n","ref":"**FONTES:** ABRANCHES, J. *Governos*; MARQUES, C. *Dicionário*.\n","dic":"DHBPR"}
