{"title":"VILASBOAS, João","cargoss":["Deputado federal","Revolucionário ou revoltoso","Constituinte","Senador","Constituinte","Senador"],"cargos_esp":[0,0,0,0,0,0],"datas_ini":[1927,1932,1934,1935,1946,1946],"datas_fim":[1930,1932,1934,1937,1946,1963],"estados":["MT",0,0,"MT",0,"MT"],"autor":["Vilma Keller"],"content":"**VILASBOAS, João**\n\n\\*dep. fed. MT 1927-1930; rev. 1932; const. 1934; sen. MT 1935-1937;\nconst. 1946; sen. MT 1946-1963.\n\n*João Vilasboas* nasceu em São Luís de Cáceres, atual Cáceres (MT), no\ndia 21 de abril de 1891, filho do coronel Benedito Pio Vilasboas e de\nJosefina Gaíva Vilasboas.\n\nIniciou os estudos no Liceu Salesiano de Artes e Ofícios de Cuiabá,\nconcluindo o curso preparatório em 1908. Matriculou-se em seguida na\nFaculdade de Direito do Rio de Janeiro, então Distrito Federal, e\ndiplomou-se em 1913. De volta a Mato Grosso, tornou-se delegado na\ncapital, assumindo em 1915 as funções de chefe de polícia do estado. Foi\ntambém redator dos jornais mato-grossenses *O Estado* (1915-1916) e *O\nRepublicano* (1917-1926).\n\nNa Primeira República\n\nIniciou suas atividades políticas ao ser eleito deputado estadual para a\nlegislatura de 1918-1920 na legenda do Partido Conservador de Mato\nGrosso, que fora fundado em 1899 a partir de uma dissidência no Partido\nRepublicano do estado. Tornando-se o líder da bancada dos conservadores,\nopôs-se ao presidente estadual dom Francisco de Aquino Correia, bispo de\nPrusiade, que fora eleito como candidato de conciliação pelos dois\npartidos rivais. Em 1921, as duas agremiações se fundiram, concordando\nseus líderes em indicar o senador Pedro Celestino Correia da Costa como\ncandidato à presidência do estado para o quadriênio 1922-1926.\nDesenvolvendo forte campanha contra essa fusão, Vilasboas conseguiu\nfundar um novo partido ainda naquele ano. Em março foi eleito deputado\nfederal, mas, em virtude de sua postura oposicionista, não foi\nreconhecido e não chegou a tomar posse na Câmara dos Deputados.\n\nAdepto da Reação Republicana, Vilasboas tornou-se o líder, em Mato\nGrosso, do movimento que promoveu entre 1921 e 1922 a candidatura de\nNilo Peçanha à presidência da República – também para o quadriênio\n1922-1926 – em oposição à de Artur Bernardes. Terminado o movimento com\na eleição deste último, refugiou-se na Bolívia. De volta ao Brasil, em\nmarço de 1924 voltou a ser eleito deputado federal, e mais uma vez a\nhostilidade que lhe votava o governo de seu estado fez com que fosse\n“depurado” com o concurso de elementos dos partidos dominantes. Em 1927\nreelegeu-se deputado federal, e dessa vez conseguiu exercer o mandato\naté o fim da legislatura, em 1929. Novamente reeleito em 1930,\ndestacou-se na Câmara como integrante da Comissão de Finanças e exerceu\natividades parlamentares até o fechamento do Congresso Nacional,\ndecorrente da vitória da Revolução de 1930, que colocou Getúlio Vargas\nno poder. Durante esse período continuou a exercer a jornalismo, como\nredator do jornal *O Democrata* (1926-1930), de Mato Grosso, além de\ncolaborar em jornais de São Paulo, Rio de Janeiro e Rio Grande do Sul.\n\nDe 1930 a 1945\n\nNo período seguinte à revolução de 1930, participou da fase preparatória\nda Revolução Constitucionalista de 1932. O levante, liderado pelos\npaulistas, dirigia-se contra o governo provisório de Getúlio Vargas e\nreivindicava a imediata reconstitucionalização do país. Apoiando o\ngeneral Bertoldo Klinger, comandante militar de Mato Grosso, que se\ncolocara ao lado dos revoltosos paulistas, atuou como elemento de\nligação entre os revolucionários do sul do estado e os da capital, e por\nessa razão foi detido em Corumbá (MS).\n\nConvocadas as eleições para a Assembleia Nacional Constituinte em maio\nde 1933, foi organizado em março desse ano o Partido Liberal\nMato-Grossense, liderado pelo interventor federal Leônidas Antero de\nMatos. Vilasboas foi eleito deputado constituinte na legenda desse\npartido e participou dos trabalhos da Assembleia, que conduziram à\npromulgação da nova Constituição brasileira, em 16 de julho de 1934,e\nteve o mandato estendido até maio de 1935.\n\nAinda em 1934, as forças políticas mato-grossenses de oposição ao\ngoverno de Leônidas de Matos rearticularam-se para formar o Partido\nEvolucionista de Mato Grosso. Nas eleições estaduais de outubro desse\nano, o Partido Liberal elegeu nove deputados estaduais e um federal,\nenquanto o partido da oposição elegia 15 deputados estaduais e três\nfederais, constituindo assim maioria na Assembleia Constituinte\nestadual. A Assembleia estava encarregada, por sua vez, de eleger o\ngovernador constitucional do estado e dois senadores.\n\nNo decorrer da campanha desenvolvida em torno das eleições para o\ngoverno estadual, a oposição a Leônidas de Matos se fortaleceu,\ncongregando, além do Partido Evolucionista, uma facção do próprio\nPartido Liberal liderada por Vilasboas. As forças oposicionistas\narticularam-se em torno de Mário Correia da Costa, antigo presidente do\nestado, lançando a candidatura de Filinto Müller para disputar o pleito.\nDiante do aumento da tensão em Mato Grosso, o governo federal nomeou um\nnovo interventor em outubro de 1934, César de Mesquita Serva. Em março\nde 1935, este foi substituído por Fenelon Müller, irmão de Filinto\nMüller. Este, por sua vez, desistiu de sua candidatura em favor de\nFenelon.\n\nNo entanto, as forças oposicionistas não apoiaram Fenelon Müller e\nlançaram a candidatura do próprio Mário Correia da Costa. Um dos\nprincipais articuladores desse acordo foi João Vilasboas, então chefe do\nPartido Liberal, que, em troca do apoio a Mário Correia da Costa,\ngarantiu sua própria eleição para o Senado. A comissão diretora do\npartido lançou a seguir um manifesto reafirmando essa decisão, assinado,\nentre outros, por Vilasboas.\n\nEnquanto a tensão política se agravava, determinando nova intervenção\nfederal em 30 de agosto de 1935, oficializada com a substituição de\nFenelon Müller pelo coronel Newton Cavalcanti, os oposicionistas do\nPartido Liberal se refugiaram no quartel do 16^o^ Batalhão de Caçadores\n(BC). A Assembleia Constituinte estadual acabou por ser instalada em 7\nde setembro, elegendo Mário Correia da Costa governador do estado, e\nJoão Vilasboas e Vespasiano Barbosa Martins, ambos do Partido Liberal,\nsenadores.\n\nEm princípios de 1936, a coligação que elegeu Mário Correia da Costa se\ndesarticulou, dando origem a dois novos partidos: de um lado, o Partido\nRepublicano Mato-Grossense, reunindo aquele político e seus seguidores\npertencentes aos já extintos partidos Evolucionista e Liberal, e, de\noutro, a Aliança Mato-Grossense, liderada por Vilasboas e Vespasiano\nMartins, congregando os membros dos dois antigos partidos que apoiavam\nFilinto Müller.\n\nEm 22 de dezembro, elementos ligados ao governo levaram a cabo um\natentado contra alguns oposicionistas, saindo feridos no episódio\nVilasboas e Vespasiano Martins. Vilasboas denunciou o governador junto à\nCorte de Apelação, acusando-o de crime de responsabilidade. Os deputados\nda oposição pediram garantias e asilo no quartel do 16^o^ BC. Com o\nagravamento da situação, o governo federal enviou tropas a Cuiabá para\ngarantir o funcionamento da Assembleia Legislativa. Durante as eleições\nmunicipais de 20 de janeiro de 1937, o jornal *O Evolucionista*, órgão\nda Aliança Mato-Grossense, foi submetido à censura. Nova intervenção do\ngoverno federal ocorreu em 6 de março, quando foi afastado Correia da\nCosta e nomeado interventor o capitão Manuel Ari da Silva Pires, que\ngovernou até setembro. Nesse mês, a Assembleia Legislativa elegeu Júlio\nMüller governador de Mato Grosso.\n\nEm 25 de maio do mesmo ano, quando da convenção de lançamento da\ncandidatura oficial de José Américo de Almeida à presidência da\nRepública, a Aliança Mato-Grossense fez-se representar por João\nVilasboas e Vespasiano Martins. Vilasboas exerceu seu mandato de senador\npor Mato Grosso até 10 de novembro de 1937, quando, com a implantação do\nEstado Novo, o Congresso Nacional foi fechado. Em 1940, tornou-se membro\ndo Conselho Nacional do Trabalho.\n\nDepois do Estado Novo\n\nCom o fim do Estado Novo e o início do processo de redemocratização do\npaís, Vilasboas elegeu-se senador por Mato Grosso à Assembleia Nacional\nConstituinte na legenda da União Democrática Nacional (UDN) no pleito de\n2 de dezembro de 1945, ao lado de seu correligionário Vespasiano\nMartins. Fundada em abril daquele ano, a UDN aglutinava as forças\npolíticas que faziam oposição a Getúlio Vargas. Vilasboas participou dos\ntrabalhos da Constituinte desde sua instalação, em 2 de fevereiro de\n1946, até a promulgação da nova Carta, em 18 de setembro do mesmo ano.\nCom a transformação da Assembleia em Congresso ordinário, teve seu\nmandato estendido até 31 de janeiro de 1955.\n\nJoão Vilasboas votou contra a cassação dos mandatos dos parlamentares\ncomunistas, medida que decorreu da suspensão do registro do Partido\nComunista Brasileiro, então chamado Partido Comunista do Brasil (PCB) em\n1947 e foi aprovada no Senado em outubro desse ano, embora só fosse\nefetivada em janeiro de 1948. Nesse último ano, atuou como\nsegundo-secretário do Senado e membro da Comissão Especial de Regimento\nComum. Em 1950, voltou a assumir as funções de segundo-secretário do\nSenado.\n\nNas eleições de 3 de dezembro de 1954, foi reeleito senador por Mato\nGrosso na legenda da UDN e, em 1959, tornou-se no Senado líder do\npartido e líder da minoria – formada pela UDN e pelo Partido Libertador\n(PL). Em 1962, a liderança da minoria – então constituída pela UDN, o PL\ne o Partido Trabalhista Nacional (PTN) – continuou sob sua\nresponsabilidade. No pleito de 3 de outubro desse ano, candidatou-se\npela terceira vez a senador por Mato Grosso na legenda da UDN, mas não\nconseguiu número suficiente de votos. Foram eleitos, por esse estado,\nFilinto Müller e Vicente Bezerra Neto, ambos apoiados pela coligação\nentre o Partido Trabalhista Brasileiro (PTB) e o Partido Social\nDemocrático (PSD). Vilasboas deixou sua cadeira no Senado em 31 de\njaneiro de 1963.\n\nExerceu a profissão de advogado em Mato Grosso e no Distrito Federal,\ntornando-se depois consultor jurídico de seu estado natal. Foi diretor\nda *Gazeta Oficial* de Mato Grosso e membro da Associação de Imprensa\nMato-Grossense e da Academia Mato-Grossense de Letras.\n\nFaleceu no Rio de Janeiro no dia 3 de maio de 1985.\n\nEra casado com Isabel Santiago Vilasboas, com quem teve duas filhas.\n\nPublicou *Hipoteca naval*.\n\nVilma Keller\n\n**FONTES:**ARQ. GETÚLIO VARGAS; *Boletim Min. Trab*. (5/1936); BRAYNER,\nF. *Verdade*; CÂM. DEP. *Deputados*; CISNEIROS, A. *Parlamentares*;\n*Diário de Notícias* (26/5/1937); *Diário do Congresso Nacional*;\n*Globo* (4/5/1985); GODINHO, V. *Constituintes*; LEITE, A. *Páginas*;\nMENDONÇA, R. *Dicionário*; SENADO. *Anais* (1935); SENADO. *Relação*;\nSENADO. *Relação dos líderes*; SILVA, G. *Constituinte*;SOUSA, J*.\nÍndice*.\n","ref":"**FONTES:**ARQ. GETÚLIO VARGAS; *Boletim Min. Trab*. (5/1936); BRAYNER,\nF. *Verdade*; CÂM. DEP. *Deputados*; CISNEIROS, A. *Parlamentares*;\n*Diário de Notícias* (26/5/1937); *Diário do Congresso Nacional*;\n*Globo* (4/5/1985); GODINHO, V. *Constituintes*; LEITE, A. *Páginas*;\nMENDONÇA, R. *Dicionário*; SENADO. *Anais* (1935); SENADO. *Relação*;\nSENADO. *Relação dos líderes*; SILVA, G. *Constituinte*;SOUSA, J*.\nÍndice*.\n","dic":"DHBPR"}
