{"title":"VITORINO, Manuel","cargoss":["Governador de estado ou do Distrito Federal","Senador","Vice-presidente da República","Presidente da República"],"cargos_esp":[0,0,0,0],"datas_ini":[1889,1891,1894,1896],"datas_fim":[1890,1894,1898,1897],"estados":["BA","BA",0,0],"autor":["Silvia Noronha Sarmento"],"content":"**VITORINO, Manuel**\n\n\\*gov. BA 1889-1890; sen. BA 1891-1894; vice-pres. Rep. 1894-1898; pres.\nRep. 1896-1897.\n\n*Manuel Vitorino Pereira* nasceu em Salvador no dia 30 de janeiro de\n1853, filho de Vitorino José Pereira e de Carolina Maria Franco Pereira.\nSeu pai, marceneiro português, chegou à Bahia na década de 1830 e aí\nestabeleceu uma oficina e loja de móveis. Sua mãe era filha de\ncomerciantes portugueses. Os quatro irmãos tiveram profissões variadas:\num marceneiro, um padre, um médico e um militar que morreu na Guerra do\nParaguai.\n\nNa infância, Manuel Vitorino foi aprendiz na loja de móveis do pai,\ntrabalhando como marceneiro por seis anos. Mais tarde, seguindo o\nexemplo do irmão Antônio Pacífico Pereira, ingressou na Faculdade de\nMedicina da Bahia. A partir do segundo ano do curso, passou a se\nsustentar dando aulas particulares de química. Formou-se em 1876,\napresentando tese de doutoramento sobre “Moléstias parasitárias mais\nfrequentes nos climas subtropicais”. No mesmo ano, ingressou no Partido\nLiberal, liderado na Bahia pelo senador Manuel Pinto de Sousa Dantas.\nFoi professor substituto de ciências acessórias, disciplina que reunia\nconhecimentos de física, química, mineralogia, medicinal legal e\nfarmácia. Pouco depois, aos 25 anos, tornou-se catedrático de medicina\nlegal. Entre 1879 e 1880 fez uma viagem à Europa que o estimulou a\ndesenvolver ideias políticas e abolicionistas. De volta, foi aprovado em\nconcurso para professor de clínica cirúrgica (1883), conquistando sua\nsegunda cátedra na Faculdade de Medicina.\n\nA partir de abril de 1885, assumiu a secretaria do diretório do Partido\nLiberal na Bahia e a chefia de redação do *Diário da Bahia*, jornal\nvinculado ao partido. Aí publicou artigos, criticando o gabinete\nchefiado por João Maurício Wanderley, o barão de Cotegipe. Foi o início\nde sua carreira política. Em maio de 1889, na convenção nacional do\nPartido Liberal, no Rio de Janeiro, acompanhou Rui Barbosa num voto em\nseparado em defesa do federalismo e do fim da vitaliciedade dos\nsenadores. Em 15 de novembro do mesmo ano, o regime monárquico foi\nderrubado por um golpe militar que proclamou a República. Na Bahia, onde\no movimento republicano contava com poucos representantes, o novo regime\nsó foi proclamado dois dias depois.\n\nO primeiro governador empossado foi Virgílio Damásio, vice-presidente do\nPartido Republicano da Bahia (PRB). Porém, cinco dias depois, Virgílio\ndeixou o cargo por pressões políticas, vindas especialmente de Rui\nBarbosa, que desejava que o posto fosse ocupado por Manuel Vitorino.\nEste relutou antes de aceitá-lo, por não integrar o grupo dos chamados\n“republicanos históricos”, mas assumiu o governo do estado no dia 23 de\nnovembro. No ato de posse, declarou extintos os antigos partidos Liberal\ne Conservador, remanescentes do Império. Entre várias medidas voltadas\npara a educação, promulgou um ato criando o ensino primário obrigatório\ne leigo. Seu governo durou apenas cinco meses. Manuel Vitorino não se\nsustentou politicamente no cargo, especialmente depois que grupos\nadversários organizaram um comício para, ao mesmo tempo, pedir sua saída\ndo governo e homenagear o marechal Hermes Ernesto da Fonseca, irmão do\npresidente Deodoro e comandante das armas na Bahia. Ao reprimir a\nmanifestação, Manuel Vitorino foi censurado por Deodoro e pediu\nexoneração. Deixou o governo em 26 de abril de 1890, passando-o ao\nmarechal Hermes Ernesto.\n\nAinda em 1890, Manuel Vitorino candidatou-se a deputado federal\nconstituinte, mas, apesar de bem votado, não teve sua eleição\nreconhecida. No ano seguinte, eleito senador estadual pelo Partido\nFederalista da Bahia, foi um dos principais formuladores da Constituição\ndo estado, tendo assumido a defesa do presidencialismo e de um Executivo\nforte. Em 1891, ocupou uma cadeira no Senado Federal, na vaga aberta\npela renúncia de José Antônio Saraiva. A partir de então, aproximou-se\ndo grupo político do vice-presidente Floriano Peixoto, afastando-se de\nRui Barbosa, que lhe fazia oposição. Em 1893 participou ativamente da\nreunião de fundação do Partido Republicano Federal (PRF), o primeiro\npartido criado com o objetivo de obter representatividade nacional.\nReeleito, em setembro do mesmo ano foi indicado candidato do PRF à\nvice-presidência da República, formando chapa com o paulista Prudente de\nMorais, candidato a presidente no quadriênio 1894-1898. Ambos foram\neleitos, na primeira eleição presidencial direta do país. Na condição de\nvice-presidente, acumulou a presidência do Senado, conforme estabelecia\na Constituição da época. Elaborou, também, um estudo sobre o saneamento\ndo Rio de Janeiro. No dia 10 de novembro de 1896, assumiu a presidência\nda República devido ao afastamento de Prudente de Morais, por motivo de\ndoença.\n\nLigado aos partidários de Floriano Peixoto, os chamados jacobinos,\nManuel Vitorino não mantinha boa relação com o presidente afastado. Em\nseu governo, procurou colocar em prática suas próprias ideias e\ninteresses políticos. Mudou ministros, comprou nova sede para o governo\nfederal, o palácio do Catete, arrendou estradas de ferro a companhias\nestrangeiras para saldar compromissos da dívida externa e, atendendo a\nsolicitação do governador da Bahia, Luís Viana, mandou a terceira\nexpedição federal, sob o comando do coronel Moreira César, cognominado\n“o Treme-Terra”, para reprimir o movimento de Canudos. O fracasso dessa\nexpedição, com a morte do temível coronel, teve desastrosa repercussão\nnacional.\n\nA presidência Manuel Vitorino manteve-se apenas quatro meses. No dia 4\nde março de 1897, sem qualquer aviso, Prudente de Morais apresentou-se\npara reassumir o cargo. Retornando à condição de vice-presidente, Manuel\nVitorino aliou-se à oposição. Em 5 de novembro de 1897, na chegada ao\nRio de Janeiro dos militares vitoriosos em Canudos, Prudente de Morais\nfoi alvo de um atentado. O soldado Marcelino Bispo de Melo não conseguiu\natingir o presidente, mas acabou matando, a punhaladas, o marechal\nCarlos Machado Bittencourt, ministro da Guerra.\n\nO vice-presidente Manuel Vitorino foi indiciado no inquérito sobre o\natentado, acusado de envolvimento. Respondeu com um *Manifesto* em que\nproclamava inocência. Seu nome não foi incluído no despacho final do\nprocesso, mas sua carreira política não teria mais futuro. Findo o\nmandato, passou a atuar no jornalismo, publicando críticas ao novo\npresidente Campos Sales, sucessor de Prudente de Morais, no *Correio da\nManhã*. Nessa época, provavelmente como represália, o governo vetou a\nprorrogação de sua licença da Faculdade de Medicina da Bahia, o que\ninviabilizava sua permanência no Rio de Janeiro. Adoeceu subitamente de\ncolibacilose intestinal quando preparava seu retorno a Salvador. Faleceu\nquatro dias depois, aos 49 anos, no dia 9 de novembro de 1902, no Rio de\nJaneiro.\n\nFoi casado com Maria Amélia da Silva Lima, filha de José Francisco da\nSilva Lima, seu professor na Faculdade de Medicina. O casal teve oito\nfilhos.\n\nSilvia Noronha Sarmento\n\n**FONTES:** KOIFMAN, F. *Presidentes*; SAMPAIO, C. *Partidos*; SENADO.\n*Períodos Legislativos da Primeira República-1890-1934.* Disponível em:\n\\<www.senado.gov.br\\>. Acesso em: 14/10/2005; TAVARES, L. *Manoel*.\n","ref":"**FONTES:** KOIFMAN, F. *Presidentes*; SAMPAIO, C. *Partidos*; SENADO.\n*Períodos Legislativos da Primeira República-1890-1934.* Disponível em:\n\\<www.senado.gov.br\\>. Acesso em: 14/10/2005; TAVARES, L. *Manoel*.\n","dic":"DHBPR"}
