{"title":"WERNECK, Américo","cargoss":["Deputado federal"],"cargos_esp":[0],"datas_ini":[1906],"datas_fim":[1908],"estados":["RJ"],"autor":["Luciana Pinheiro"],"content":"**WERNECK, Américo**\n\n\\*dep. fed. RJ 1906-1908.\n\n*Américo Werneck* nasceu em Paraíba do Sul (RJ) no dia 13 de março de\n1855, filho de Inácio dos Santos Werneck e de Luísa Amélia de Oliveira,\nbarões de Bemposta.\n\nApós ter cursado o Colégio Kopke, no município fluminense de Petrópolis,\ne o Colégio Pedro II, no Rio de Janeiro, então capital do Império,\nmatriculou-se na Escola Central, depois Escola Politécnica, pela qual se\ndiplomou engenheiro civil em 1877. Lavrador atuante nos estados do Rio\nde Janeiro e de Minas Gerais, desde os tempos imperiais mostrou-se ativo\ndefensor das ideias republicanas, sobre as quais escrevia artigos na\n*Gazeta Sul Mineira*, fundada pelo Partido Republicano em São Gonçalo do\nSapucaí. Publicou também artigos na *Gazeta de Petrópolis* e colaborou\nem importantes jornais como *Gazeta de Notícias*, *O País*, *Jornal do\nComércio* e *A Época.*\n\nNa eleição de 24 de abril de 1892, elegeu-se deputado estadual no Rio de\nJaneiro. Durante o mandato foi eleito membro da Comissão das Obras\nPúblicas.\n\nEm setembro de 1898 foi nomeado secretário de Agricultura e Obras\nPúblicas do estado de Minas Gerais, no governo de Francisco Silviano de\nAlmeida Brandão (1898-1902), permanecendo no cargo até fevereiro de\n1901. Em 1902 foi eleito deputado estadual no estado do Rio e ocupou uma\ncadeira na Assembleia Legislativa fluminense até 1904. Durante seu\nmandato participou ativamente das ações que levaram à criação do imposto\nterritorial. Em abril de 1904, no governo de Nilo Peçanha (1903-1906),\ntornou-se consultor técnico de Obras Públicas, Comércio e Indústria do\nestado do Rio, mantendo-se nessa função por dois anos.\n\nEm 1906 foi eleito deputado federal pelo estado do Rio de Janeiro e\ntomou posse em maio do mesmo ano, cumprindo o mandato até dezembro de\n1908. Retornou então a Minas Gerais, elegendo-se prefeito do município\nde Águas Virtuosas do Lambari.\n\nFaleceu no Rio de Janeiro em 17 de setembro de 1927.\n\nFoi casado com Judite de Lemos Werneck e posteriormente com Regina de\nAndrade Werneck.\n\nEntre suas publicações, destacam-se os romances *Morena* (1893),\n*Graciema* (1898) e *Judite, por seu noivo Américo Werneck* (1912), além\ndos estudos *O divórcio* (1896), A *arte de educar os* filhos (1897),\n*Reforma do sistema tributário* (1899), *Revisão constitucional* (1918),\n*Problemas fluminenses*, *o Brasil: seu presente e futuro*, *Erros e\nvícios da organização republicana*, *Reflexões sobre a crise\nfinanceira*, *Estudos mineiros, Indústria de transporte* e *A crise.*\n\nLuciana Pinheiro\n\n**FONTES:** ABRANCHES, J. *Governos* (v.2, p.221-222); ASSEMB. LEGISL.\nRJ. *Anais* (8/1892); CÂM. DEP. *Deputados brasileiros* (p.19); GOV. RJ.\nDisponível em: \\<www.governo.rj.gov.br/\\>. Acesso em: 1/12/2010; GOV.\nMG. Disponível em: \\<www.mg.gov.br/\\>. Acesso em: 1/12/2010; VELHO\nSOBRINHO, J. *Dicionário* (v.1, p.349-350).\n","ref":"**FONTES:** ABRANCHES, J. *Governos* (v.2, p.221-222); ASSEMB. LEGISL.\nRJ. *Anais* (8/1892); CÂM. DEP. *Deputados brasileiros* (p.19); GOV. RJ.\nDisponível em: \\<www.governo.rj.gov.br/\\>. Acesso em: 1/12/2010; GOV.\nMG. Disponível em: \\<www.mg.gov.br/\\>. Acesso em: 1/12/2010; VELHO\nSOBRINHO, J. *Dicionário* (v.1, p.349-350).\n","dic":"DHBPR"}
