{"title":"WHITAKER, Firmino","cargoss":["Ministro do Supremo Tribunal Federal"],"cargos_esp":[0],"datas_ini":[1927],"datas_fim":[1934],"estados":[0],"autor":["Eduardo Junqueira"],"content":"**WHITAKER, Firmino**\n\n\\* magistrado; min. STF 1927-1934.\n\n*Firmino Antônio da Silva Whitaker Filho* nasceu na cidade de São Paulo\nno dia 13 de março de 1866, filho de Firmino Antônio da Silva Whitaker e\nde Guilhermina Flora dos Anjos.\n\nEm 1886 obteve o grau de bacharel em ciências jurídicas e sociais pela\nFaculdade de Direito de São Paulo e no ano seguinte iniciou carreira na\nmagistratura, ao ser nomeado promotor público na comarca de Lençóis e,\ndepois, na comarca de Tatuí, onde também se tornou membro do Conselho\nSuperior de Instrução Pública. Em 1888 assumiu o posto de juiz municipal\ne de órfãos de Mogi-Mirim. Em novembro de 1892, após a reorganização da\nJustiça de São Paulo, foi nomeado juiz de direito de Mogi-Mirim, cargo\nque exerceu por mais de 17 anos.\n\nEm janeiro de 1910 foi nomeado ministro do Tribunal de Justiça de São\nPaulo – graças ao princípio da autonomia federativa, que permitia aos\nestados organizar sua Justiça como bem lhes aprouvesse, a corte de\nsegunda instância de São Paulo dava a seus membros o título de ministro.\nEm novembro de 1921, foi eleito presidente do Tribunal, tendo sido\nreeleito por duas vezes, até 1927. Em abril desse ano foi nomeado pelo\npresidente Washington Luís ministro do Supremo Tribunal Federal (STF),\nna vaga surgida com o falecimento de Augusto Olímpio Viveiros de Castro,\ne em junho seguinte tomou posse. Foi aposentado a pedido em março de\n1934, o que permite supor que estivesse contrariado com as perspectivas\npolíticas e institucionais surgidas após o movimento de outubro de 1930,\ndadas a trajetória e as ligações que mantinha com São Paulo.\n\nFaleceu no Rio de Janeiro, no dia 21 de dezembro de 1934.\n\nFoi casado com Ana de Oliveira Luz.\n\nPublicou *O júri* (1904), *Terras* (1915), *Desapropriações* (1925),\n*Sursis* (1930) e as memórias *Minha vida (só para meus filhos)* (1934).\n\nEduardo Junqueira\n\n**FONTES:** MATTOSO, P. *Supremo Tribunal*; MELLO FILHO, J. *Notas*;\nSUP. TRIB. FED. Disponível em: \\<www.stf.jus.br/portal/ministros\\>.\n","ref":"**FONTES:** MATTOSO, P. *Supremo Tribunal*; MELLO FILHO, J. *Notas*;\nSUP. TRIB. FED. Disponível em: \\<www.stf.jus.br/portal/ministros\\>.\n","dic":"DHBPR"}
