{"title":"BARRETO, Marcolino Lopes","cargoss":["Deputado federal"],"cargos_esp":[0],"datas_ini":[1912],"datas_fim":[1930],"estados":["SP"],"autor":["Henrique Sugahara Francisco"],"content":"**BARRETO, Marcolino Lopes**\n\n\\*dep. fed. SP 1912-1930.\n\n*Marcolino Lopes Barreto* nasceu em Pirassununga (SP) no dia 12 de abril\nde 1862.\n\nFoi comerciante e lavrador de café no atual município de São Carlos\n(SP). Em 30 de janeiro de 1912, foi eleito deputado federal pelo 2^o^\nDistrito do Estado de São Paulo para a legislatura 1912-1914. Reeleito\npara as seis legislaturas seguintes, permaneceu na Câmara dos Deputados\naté novembro de 1930, quando Revolução de outubro, vitoriosa, levou\nGetúlio Vargas, fechou o Congresso e dissolveu todos os órgãos\nlegislativos do país.\n\nUma de suas fazendas, a do Canchim, estabelecida no século XIX, foi\nentregue ao Banco do Brasil em pagamento de dívida à época da crise\nmundial de 1929. Após alguns anos, a área foi assumida pelo Ministério\nda Agricultura, que, em 1935, estabeleceu na antiga propriedade uma\nestação experimental de pesquisas. Em 1970, com a implantação da Empresa\nBrasileira de Pesquisa Agropecuária (Embrapa), a estação seria\nincorporada à recém-criada entidade, passando a constituir uma de suas\nunidades de pesquisa.\n\nLopes Barreto também integrou a Sociedade Rural Brasileira, fundada em\n19 de maio de 1919 com o intuito de coordenar ações para incentivar a\natividade agropecuária.\n\nFaleceu no anode 1932.\n\nHenrique Sugahara Francisco\n\n**FONTES:** ABRANCHES, J. *Governos*; EMBRAPA. Disponível em:\n\\<www.cppse.embrapa.br/a-unidade/020index.htm\\>; INST. OSWALDO GALOTTI.\nDisponível em: \\<\nwww.oswaldogalotti.com.br/materias/read.asp?Id=1413&Secao=107\\>.\nPERISSINOTO, R. *Estado*.\n","ref":"**FONTES:** ABRANCHES, J. *Governos*; EMBRAPA. Disponível em:\n\\<www.cppse.embrapa.br/a-unidade/020index.htm\\>; INST. OSWALDO GALOTTI.\nDisponível em: \\<\nwww.oswaldogalotti.com.br/materias/read.asp?Id=1413&Secao=107\\>.\nPERISSINOTO, R. *Estado*.\n","dic":"DHBPR"}
