{"title":"BARRETO, Otávio Hamilton Tavares","cargoss":["Governador de estado ou do Distrito Federal","Deputado federal"],"cargos_esp":[0,0],"datas_ini":[1920,1924],"datas_fim":[1921,1929],"estados":["PE","PE"],"autor":["Raimundo Helio Lopes"],"content":"**BARRETO, Otávio Hamilton Tavares**\n\n\\*gov. PE 1920-1921; dep. fed. PE 1924-1929.\n\n*Otávio Hamilton Tavares Barreto* foi deputado estadual em Pernambuco em\nvárias legislaturas. Entre 1919 e 1923 foi presidente da Assembleia\nLegislativa estadual e, como tal, substituiu entre 28 de outubro de 1920\ne 3 de junho de 1921 o governador José Rufino Bezerra Cavalcanti,\nafastado por motivo de doença. Substitui-o Severino Marques de Queirós\nPinheiro, até a posse do governador eleito Sérgio Lins de Barros Loreto,\nem 18 de outubro de 1922.\n\nFoi eleito deputado federal por Pernambuco em 1924. Assumiu sua cadeira\nna Câmara dos Deputados no Rio de Janeiro, então Distrito Federal, em\nmaio desse ano e exerceu o mandato até dezembro de 1926. Em 1927 foi\nreeleito, permanecendo na Câmara até dezembro de 1929, quando se\nencerrou a legislatura.\n\nColaborou com a *Revista Acadêmica da Faculdade de Direito do Recife*.\n\nRaimundo Helio Lopes\n\n**FONTES:** ASSEMB. LEGISL. PE. Disponível em: \\<www.alepe.pe.gov.br\\>.\nAcesso em: 25/10/2010; CÂM. DEP. *Deputados brasileiros*; LEVINE, R.\n*Velha*; NASCIMENTO, L. *História* (v.6).\n","ref":"**FONTES:** ASSEMB. LEGISL. PE. Disponível em: \\<www.alepe.pe.gov.br\\>.\nAcesso em: 25/10/2010; CÂM. DEP. *Deputados brasileiros*; LEVINE, R.\n*Velha*; NASCIMENTO, L. *História* (v.6).\n","dic":"DHBPR"}
