{"title":"BARROS, Fábio da Silveira","cargoss":["Deputado federal"],"cargos_esp":[0],"datas_ini":[1916],"datas_fim":[1917],"estados":["PE"],"autor":["Raimundo Helio Lopes"],"content":"**BARROS, Fábio da Silveira**\n\n\\*dep. fed. PE 1916-1917.\n\n*Fábio da Silveira Barros* nasceu em Gameleira (PE) no dia 16 de outubro\nde 1866, filho de Francisco de Barros Veloso da Silveira e de Maria\nHonória Veloso da Silveira.\n\nIniciou seus estudos no Colégio São José da Bahia e em 1888 formou-se\npela Faculdade de Medicina desse estado. Clinicou em Pernambuco até o\nano de 1895 e depois disso passou a se dedicar às atividades agrícolas e\nindustriais, a partir do cultivo da cana-de-açúcar e da administração de\nusinas de açúcar.\n\nIniciou sua vida política em 1892, quando foi nomeado para o Conselho\nMunicipal do Recife e ocupou o posto de primeiro-secretário. Em 1911 foi\nnomeado inspetor federal de agricultura do estado de Pernambuco, cargo\nque ocupou até o ano seguinte. Em 1912 foi eleito senador estadual em\nPernambuco; sucessivamente reeleito, exerceu o mandato até 1916. Durante\nesses anos, chegou a assumir por algum tempo a presidência do Senado\nestadual.\n\nEm 1916 assumiu uma cadeira na Câmara dos Deputados no Rio de Janeiro,\nentão Distrito Federal, na vaga aberta com o falecimento do deputado\nJosé Augusto do Amaral. Permaneceu na Câmara até dezembro de 1917, ao\nfinal do mandato e da legislatura. Regressou então ao estado natal e\nvoltou a exercer mandatos no Legislativo estadual. Em 1927 arrendou a\nUsina Frei Caneca, fundada pelo governo do estado em 1886, uma das mais\nimportantes da região.\n\nNo campo jornalístico, fundou o periódico *O Estado* e foi redator do\njornal *A República,* ambos em Pernambuco.\n\nRaimundo Helio Lopes\n\n**FONTES:** ABRANCHES, J. *Governos*; CÂM. DEP. *Deputados brasileiros*;\nGASPAR, L. *Usina*.\n","ref":"**FONTES:** ABRANCHES, J. *Governos*; CÂM. DEP. *Deputados brasileiros*;\nGASPAR, L. *Usina*.\n","dic":"DHBPR"}
