{"title":"BARROS, Lucas Monteiro de","cargoss":["Deputado federal"],"cargos_esp":[0],"datas_ini":[1897],"datas_fim":[1899],"estados":["SP"],"autor":["Henrique Sugahara Francisco"],"content":"**BARROS, Lucas Monteiro de**\n\n**\\***dep. fed. SP 1897-1899.\n\n*Lucas Monteiro de Barros* nasceu na cidade de São Paulo no dia 14 de\ndezembro de 1861, filho de Rodrigo Antônio Monteiro de Barros e de Ana\nFrancisca da Silva Prado. Seu pai, bacharel em direito e fazendeiro, foi\nvereador em Jundiaí e deputado provincial de 1858 a 1863. Era bisneto de\nLucas Antônio Monteiro de Barros, primeiro barão e visconde de Congonhas\ndo Campo, e primeiro presidente da província de São Paulo, em 1824.\n\nFoi fazendeiro e vereador em Jundiaí. Foi eleito deputado estadual para\na legislatura 1891-1892 pelo Partido Republicano Paulista (PRP), e\nreeleito para as legislaturas 1892-1894 e 1895-1897. Já em 1896 foi\neleito pelo quinto distrito de São Paulo para uma cadeira na Câmara dos\nDeputados na legislatura 1897-1899.\n\nFaleceu na capital paulista no dia 22 de janeiro de 1903.\n\nEra casado com Leonídia de Lacerda Monteiro de Barros, filha dos barões\nde Arari, com quem teve uma filha.\n\nHenrique Sugahara Francisco\n\n**FONTES:** ABRANCHES, J. *Governos*; Jbcultura*.* Disponível em:\n\\<www.jbcultura.com.br/gde\\_fam/pafg238.html\\>; LEME, L. *Genealogia*\n(v.5); VASCONCELOS, J; VASCONCELOS, R. *Archivo.*\n","ref":"**FONTES:** ABRANCHES, J. *Governos*; Jbcultura*.* Disponível em:\n\\<www.jbcultura.com.br/gde\\_fam/pafg238.html\\>; LEME, L. *Genealogia*\n(v.5); VASCONCELOS, J; VASCONCELOS, R. *Archivo.*\n","dic":"DHBPR"}
