{"title":"BARROS, Manuel Gouveia","cargoss":["Deputado federal"],"cargos_esp":[0],"datas_ini":[1916],"datas_fim":[1926],"estados":["PE"],"autor":["Raimundo Helio Lopes"],"content":"**BARROS, Manuel Gouveia**\n\n\\*dep. fed. PE 1916-1926.\n\n*Manuel Gouveia Barros* nasceu no município de Bonito (PE) no ano de\n1881.\n\nIniciou seus estudos no Ginásio Pernambucano e em 1899 matriculou-se na\nFaculdade de Medicina do Rio de Janeiro. Formou-se em 1905 ao defender a\ntese intitulada *O crescimento e seu papel na patologia*.\n\nEm 1907 passou a residir em Recife, onde começou a clinicar. Em 1912,\ndurante o governo de Dantas Barreto, foi nomeado diretor de Higiene e\nSaúde Pública de Pernambuco. Fez reformas no Serviço Sanitário,\norganizou o Código Sanitário, combateu as epidemias de peste bubônica,\nfebre amarela e varíola que assolavam o estado e instituiu serviços de\nassistência pública em Recife. Permaneceu no cargo até 1916.\n\nNesse mesmo ano candidatou-se a deputado federal na vaga surgida com a\nrenúncia de Manuel Borba, que foi eleito governador de Pernambuco.\nConseguiu eleger-se e logo passou a integrar a Comissão de Saúde\nPública. Reeleito para mais duas legislaturas, ocupou uma cadeira na\nCâmara dos Deputados, no Rio de Janeiro, então Distrito Federal, até\ndezembro de 1926.\n\nFoi também professor da Faculdade de Medicina de Pernambuco.\n\nNo campo jornalístico, foi redator do jornal *O Norte* e colaborou com\nos periódicos *Jornal do Comércio*, *Jornal de Medicina de Pernambuco*,\n*A* *Evolução* e *Arquivos de higiene pública e medicina tropical*,\ntodos de Pernambuco.\n\nPublicou *Ensaio de um estudo sintético do crescimento e do seu papel em\npatologia*, *Magnetismo, hipnotismo e sugestão*, *Profilaxia do crime e\ntratamento do criminoso*, *Profilaxia da varíola e a legislação nacional\ne internacional em referência com o segredo profissional e a notificação\nobrigatória*, *Profilaxia da febre amarela no Recife* (1912), *A higiene\nno tempo e no espaço – discurso*, e *O problema fundamental do Brasil –\ndiscurso na Câmara dos Deputados apresentando um projeto sobre o\nsaneamento do Brasil* (1916).\n\nRaimundo Helio Lopes\n\n**FONTES:** ABRANCHES, J. *Governos*; CÂM. DEP. *Deputados brasileiros*;\nLEVINE, R. *Velha*; NASCIMENTO, L. *História* (v.3); NASCIMENTO, L.\n*História* (v.7).\n","ref":"**FONTES:** ABRANCHES, J. *Governos*; CÂM. DEP. *Deputados brasileiros*;\nLEVINE, R. *Velha*; NASCIMENTO, L. *História* (v.3); NASCIMENTO, L.\n*História* (v.7).\n","dic":"DHBPR"}
