{"title":"BARROSO, Euclides","cargoss":["Deputado federal"],"cargos_esp":[0],"datas_ini":[1909],"datas_fim":[1911],"estados":["CE"],"autor":[0],"content":"**BARROSO, Euclides**\n\n\\*dep. fed. CE 1909-1911.\n\n*Euclides Barroso* nasceu na cidade de Canindé (CE) no dia 22 de\nfevereiro de 1861, filho do coronel Paulino Joaquim Barroso e de\nFrancisca Carolina Barroso.\n\nEstudou humanidades no colégio Ateneu Cearense, em Fortaleza, de 1873 a\n1877, e cursou os preparatórios Liceu do Ceará. Indo para o Rio de\nJaneiro em 1878, matriculou-se na Escola Politécnica e recebeu o título\nde engenheiro civil em 1883.\n\nAinda em 1882 começou a trabalhar na Repartição Geral dos Telégrafos,\ninicialmente como inspetor de primeira classe, e depois como\nengenheiro-ajudante e engenheiro-chefe do distrito telegráfico do\nMaranhão. Nesse período esteve no Piauí, na Bahia e no Maranhão fazendo\ntrabalhos de campo com o objetivo de construir trechos de linhas\ntelegráficas. Depois de idas e vindas ao Ceará, retornou de vez a esse\nestado em 1895, designado chefe do distrito telegráfico. Em 1900 foi\nescolhido vice-diretor da Repartição Geral dos Telégrafos, e em 1908 foi\no representante brasileiro na Conferência Internacional Telegráfica\nreunida em Lisboa. No ano seguinte publicou *A Conferência Telegráfica\nInternacional de Lisboa. Visitas a diversas administrações telegráficas\nda Europa* (Relatórios apresentados ao ministro da Indústria, Viação e\nObras Públicas Miguel Calmon Du Pin e Almeida).\n\nEleito deputado federal pelo Ceará, exerceu o mandato de maio de 1909 a\ndezembro de 1911. No governo do presidente Venceslau Brás (1914-1918)\nfoi nomeado diretor dos Telégrafos Nacionais.\n\nKleiton de Sousa Moraes\n\n**FONTES:** STUDART, G. *Dicionário* (v.1, p.248-250).\n","ref":"**FONTES:** STUDART, G. *Dicionário* (v.1, p.248-250).\n","dic":"DHBPR"}
