{"title":"BATISTA, Abdon","cargoss":["Presidente de associação ou confederação de empregados ou empregadores","Deputado federal","Governador de estado ou do Distrito Federal","Deputado federal","Senador","Deputado federal"],"cargos_esp":[0,0,0,0,0,0],"datas_ini":[1889,1903,1906,1910,1912,1918],"datas_fim":[1889,1905,1906,1912,1917,1920],"estados":["SC","SC","SC","SC","SC","SC"],"autor":["Carolina Vianna Dantas"],"content":"**BATISTA, Abdon**\n\n\\*pres. SC 1889; dep. fed. SC 1903-1905; gov. SC 1906; dep. fed. SC\n1910-1912; sen. SC 1912-1917; dep. fed. SC 1918-1920.\n\n*Abdon Batista* nasceu em Salvador no dia 30 de julho de 1852, filho de\nHermenegildo Batista e de Maria Girard Batista.\n\nFormou-se pela Faculdade de Medicina da Bahia e praticou clínica médica\nem Salvador até 1870, quando migrou para o Espírito Santo e, em seguida,\npara Santa Catarina. Nesse estado, trabalhou como médico na cidade de\nSão Francisco do Sul e comprou o jornal *O Globo* de Joinville, passando\na editá-lo em São Francisco sob o título de *O Democrata*. Também se\ndedicou a atividades comerciais e industriais na região.\n\nFiliado ao Partido Liberal, foi eleito deputado provincial em Santa\nCatarina e exerceu o mandato de 1884 a 1885. Três anos depois\nreelegeu-se para a legislatura 1888-1889, tendo exercido a presidência\nda Assembleia durante todo o período. Foi ainda presidente da província\nde Santa Catarina de 26 de junho a 19 de julho de 1889.\n\nApós a proclamação da República em 15 de novembro de 1889 aderiu ao novo\nregime, mas logo depois desligou-se do Partido Republicano Catarinense.\nFoi um dos fundadores da União Federalista, transformada mais tarde em\nPartido Federalista de Santa Catarina. Em 1891 elegeu-se deputado à\nAssembleia Constituinte do estado, cumprindo mandato até 1894. Ao mesmo\ntempo foi prefeito de Joinville de 1893 a 1894. Nesse último ano, em\nrazão da repressão à Revolução Federalista, asilou-se na Argentina. De\nvolta ao Brasil em 1901, foi eleito deputado estadual mas, como não teve\nsua eleição validada, não assumiu o mandato.\n\nEm 1903 elegeu-se deputado federal por Santa Catarina para a legislatura\n1903-1905. Eleito vice-governador do estado em 1906, assumiu o governo\nem novembro desse ano, substituindo o governador Gustavo Richard. Em\n1910, voltou a ocupar uma cadeira de deputado federal por Santa\nCatarina, em função da renúncia de Vidal Ramos, e exerceu o mandato até\no fim da legislatura, em 1911. Reeleito, iniciou novo mandato em 1912,\nmas renunciou no mesmo ano para ocupar uma cadeira no Senado, deixada\nvaga por Lauro Müller, que havia sido nomeado ministro das Relações\nExteriores no governo do marechal Hermes da Fonseca (1910-1914). Com a\nvolta de Lauro Müller em 1917, deixou o Senado. No ano seguinte,\nelegeu-se novamente deputado federal para a legislatura 1918-1920.\nVoltou a responder pela prefeitura de Joinville de 1915 a 1918 e de 1919\na 1921.\n\nFaleceu em Joinville no dia 15 de março de 1922.\n\nEra casado com Teresa Nóbrega Oliveira, com quem teve oito filhos.\n\nCarolina Vianna Dantas\n\n**FONTES:** ABRANCHES, J. *Governos*; PIAZZA, W. *Dicionário*;\nSTOETERAU, L. *Trajetória*; Wikipédia. Disponível em:\n\\<http://pt.wikipedia.org/wiki/Walter\\_Piazza” \\\\o “Walter Piazza\\>.\n","ref":"**FONTES:** ABRANCHES, J. *Governos*; PIAZZA, W. *Dicionário*;\nSTOETERAU, L. *Trajetória*; Wikipédia. Disponível em:\n\\<http://pt.wikipedia.org/wiki/Walter\\_Piazza” \\\\o “Walter Piazza\\>.\n","dic":"DHBPR"}
