{"title":"BATISTA, Benedito Galvão Pereira","cargoss":["Deputado federal"],"cargos_esp":[0],"datas_ini":[1903],"datas_fim":[1908],"estados":["RJ"],"autor":["Adrianna Setemy"],"content":"**BATISTA, Benedito Galvão Pereira**\n\n\\*dep. fed. RJ 1903-1908.\n\n*Benedito Galvão Pereira Batista* nasceu em Campos (RJ) no dia 7 de\nsetembro de 1852.\n\nFormou-se em medicina e em 1877 começou a clinicar em sua cidade natal.\nIniciou a carreira política elegendo-se vereador em 1886. Assumindo sua\ncadeira na Câmara Municipal de Campos, exerceu seu mandato até 1889.\n\nCom o advento da República, em 1895 elegeu-se deputado estadual no Rio\nde Janeiro. Assumiu nesse mesmo ano sua cadeira na Assembleia\nLegislativa e exerceu o mandato até 1897. Voltou a concorrer a novo\ncargo eletivo em 1903, quando foi eleito deputado federal pelo estado do\nRio de Janeiro. Assumindo em maio desse ano sua cadeira na Câmara dos\nDeputados, no Rio de Janeiro, então Distrito Federal, exerceu o mandato\naté dezembro de 1905. No ano seguinte foi reeleito e permaneceu no\nLegislativo até dezembro de 1908, quando se encerrou seu mandato.\n\nAdrianna Setemy\n\n**FONTES:** ABRANCHES, J. *Governos* (v.1); AITA, C.; AXT, G.; ARAUJO,\nV. *Parlamentares*; BRITO, C. *Mulher*.\n","ref":"**FONTES:** ABRANCHES, J. *Governos* (v.1); AITA, C.; AXT, G.; ARAUJO,\nV. *Parlamentares*; BRITO, C. *Mulher*.\n","dic":"DHBPR"}
