{"title":"BATISTA, HOMERO","cargoss":["Constituinte","Deputado federal","Deputado federal","Presidente de associação ou confederação de empregados ou empregadores","Ministro da Fazenda"],"cargos_esp":[0,0,0,"BB",0],"datas_ini":[1891,1906,1891,1914,1919],"datas_fim":[1891,1914,1893,1918,1922],"estados":[0,"RS","RS",0,0],"autor":["Paulo Donadio"],"content":"**BATISTA, H****OMERO**\n\n\\*const. 1891; dep. fed. RS 1891-1893 e 1906-1914; pres. BB 1914-1918;\nmin. Faz. 1919-1922.\n\n*Homero Batista* nasceu em São Borja (RS) no dia 30 de janeiro de 1860,\nfilho do professor Felisberto Batista da Costa, presidente da Câmara\nMunicipal da cidade, e de Henriqueta de Sá Batista. Seu irmão Álvaro\nBatista foi deputado federal pelo Rio Grande do Sul de 1915 a 1923 e de\n1927 a 1929.\n\nEm 1879 ingressou na Faculdade de Direito de São Paulo e ao mesmo tempo\ntrabalhou como tipógrafo e jornalista em folhas republicanas, entre elas\na *Tribuna Liberal* e o *Jornal da Tarde*. Foi signatário da Profissão\nde Fé Republicana, formulada por estudantes gaúchos em 1881, e em 1883\ntransferiu-se para a Faculdade de Direito do Recife, como integrante de\num grupo de 93 estudantes republicanos. Formou-se em 1884 e a partir de\nentão engajou-se na propaganda abolicionista e republicana. De volta a\nSão Borja, fundou, junto com o irmão Álvaro, o jornal *O Município*, e\ncriou com seus correligionários o Clube Republicano, autor da moção\nplebiscitária de 13 de janeiro de 1888, que propunha a realização de um\nplebiscito nacional sobre a sucessão em caso de morte do imperador.\n\nProclamada a República, esteve à frente da Superintendência de Fazenda\ndo Estado do Rio Grande do Sul. Em setembro de 1890 foi eleito deputado\nfederal constituinte na legenda do Partido Republicano Rio-Grandense\n(PRR). Assumiu o mandato em 15 de novembro, participou da elaboração da\nConstituição promulgada em 24 de fevereiro de 1891 e a partir de maio\npassou a exercer o mandato ordinário, até dezembro de 1893, integrando\nas comissões de Instrução, Fazenda, Revisão do Código Penal e Orçamento.\nDurante a Revolução Federalista (1893-1895), alinhou-se com os\npositivistas de Júlio de Castilhos e fundou em Porto Alegre o jornal *A\nRepública*. Em 1896 rompeu com os castilhistas e, na companhia de\nDemétrio Ribeiro e Francisco Miranda, abriu uma dissidência no PRR,\ndenunciando o abandono dos princípios defendidos na luta republicana\npelo partido histórico.\n\nReconciliado com os líderes republicanos locais, voltou à cena política\napenas em 1906, quando foi eleito deputado federal. Reeleito em 1909, ao\nlongo de dois mandatos consecutivos exerceu, na Comissão de Finanças, o\npapel de relator dos orçamentos de pensões, Marinha, receita geral e\ntarifas alfandegárias. Alguns de seus pareceres foram publicados em\nlivro. Estudioso não apenas de economia, mas também de história,\ntornou-se membro do Instituto Histórico e Geográfico Brasileiro, em\n1913. Mais uma vez eleito deputado em 1914, no início do mandato foi\nnomeado pelo presidente Venceslau Brás presidente do Banco do Brasil.\nDurante a Primeira Guerra Mundial, adotou medidas para conter a saída de\nouro para o exterior. Com apoio do Congresso, realizou uma mudança\nradical em relação à política anterior, dando ao banco novas funções.\nInstituiu a administração de operações de redesconto, que permitiam, em\nface da escassez de crédito, estimular a circulação de moeda e o\nfinanciamento da produção. Em sua gestão o Banco do Brasil ganhou\nenvergadura, crescendo de quatro para 39 o número de agências\ndistribuídas pelo país.\n\nAo deixar o Banco do Brasil em 1918, ocupou por breve período uma\ncadeira na direção da empresa Sul América Seguros, e em 1919 foi\nconvidado pelo presidente Epitácio Pessoa (1919-1922) para o Ministério\nda Fazenda. Manteve a política da administração anterior e criou a\nCarteira de Redescontos do Banco do Brasil. Na conjuntura do pós-guerra,\ncontra as tentativas de mobilização das reservas nacionais, conseguiu\nquase dobrar o estoque brasileiro de ouro. Segundo analistas\ncontemporâneos, orientava-se pela “escola financeira clássica”.\nContribuiu para a remodelação do Tesouro e da Casa da Moeda, a\nintrodução de novos regulamentos, o melhoramento da fiscalização nos\nportos e a expansão do Banco do Brasil. Deixou projetos de redução de\ntarifas aduaneiras e criação de zonas francas.\n\nNo Distrito Federal, foi ainda catedrático de direito administrativo da\nFaculdade de Direito e professor da Faculdade de Filosofia e Letras.\nTambém foi membro da diretoria da Liga da Defesa Nacional e fundador do\nInstituto Histórico e Geográfico do Rio Grande do Sul.\n\nMorreu no Rio de Janeiro, no dia 14 de outubro de 1924.\n\nCasado em primeiras núpcias com Beatriz Martins Batista, teve três\nfilhos, entre eles o desembargador Homero Martins Batista, presidente do\nTribunal de Justiça do Estado do Rio Grande do Sul em 1954-1955. Com\nAlice Castilhos Batista, teve cinco filhos.\n\nPublicou trabalhos parlamentares, conferências e outros escritos de\nhistória e economia: *Tiradentes e a República* (1888); *Pela Federação*\n(1892); *A Revolução e o estado de sítio no Rio Grande do Sul* (1894);\n*Perfil biográfico de Manuel dos Santos Loureiro* (1900); *A Marinha\nNacional* (1910); *Orçamento da Marinha* *(1909-10)*; *Orçamento da\nReceita Geral* *(1911-12-13)*; *Revoluções brasileiras de 1817 e 1835*\n(1918); *Revisão das tarifas das alfândegas* (1921); *Retrospecto\nadministrativo (1919-1922)*; *Unificação do padrão monetário* (1923);\n*Zonas francas nos principais portos do país* (1923); *A tirania legal*;\n*Os precursores*; *A organização dos Estados*; *A evolução tarifaria*;\n*Instituições fundamentais da Marinha*.\n\nPaulo Donadio\n\n**FONTES:***Federação* (10/8/1925); FRANCO, S. *Partido*;*Jornal do\nComércio* (4/9/1913, 15/10/1924); MARTINS, A. *Escritores.*\n","ref":"**FONTES:***Federação* (10/8/1925); FRANCO, S. *Partido*;*Jornal do\nComércio* (4/9/1913, 15/10/1924); MARTINS, A. *Escritores.*\n","dic":"DHBPR"}
