{"title":"BAYMA, Celso","cargoss":["Deputado federal","Senador"],"cargos_esp":[0,0],"datas_ini":[1909,1927],"datas_fim":[1926,1930],"estados":["SC","SC"],"autor":["Carolina Vianna Dantas"],"content":"**BAYMA, Celso**\n\n\\*dep. fed. SC 1909-1926; sen. SC 1927-1930.\n\n*Celso Bayma* nasceu na cidade de Assunção, no Paraguai, no dia 8 de\njulho de 1874, filho de Alexandre Bayma e de Manuela Sion de Bayma.\n\nFez o curso secundário no Rio de Janeiro, então capital do Império, e em\n1892, já na República, bacharelou-se pela Faculdade Livre de Direito na\nmesma cidade. Passou então a exercer a advocacia, e em 1898 foi nomeado\ncoadjuvante de ensino no Colégio Militar do Rio de Janeiro. Em 1903 foi\npromovido a adjunto e, em 1906, a lente catedrático de História\nUniversal.\n\nIniciou a carreira política ao eleger-se deputado à Assembleia\nLegislativa de Santa Catarina em 1901. Reeleito em 1904 e em 1907,\nocupou uma cadeira no Legislativo estadual até 1909. Logo em seguida foi\neleito deputado federal por Santa Catarina para a legislatura 1909-1911.\nNesse último ano apresentou à Câmara dos Deputados um projeto de lei de\ncriação da Ordem dos Advogados Brasileiros, mas não teve sucesso. Foi\nreeleito deputado federal por mais cinco legislaturas consecutivas,\ncumprindo mandato até 1926.\n\nEm 1927 foi eleito senador por Santa Catarina para um mandato de nove\nanos, mas, em função da Revolução de 1930 e do fechamento dos órgãos\nlegislativos do país, não chegou a concluí-lo.\n\nFaleceu em 26 de junho de 1935.\n\nDeixou publicada a obra *Acumulações remuneradas*;*discursos\npronunciados por Celso Bayma* (1909).\n\nCarolina Vianna Dantas\n\n**FONTES:** ABRANCHES, J. *Governos*; PIAZZA, W. *Dicionário*; VENÂNCIO\nFILHO, A. *Notícia*.\n","ref":"**FONTES:** ABRANCHES, J. *Governos*; PIAZZA, W. *Dicionário*; VENÂNCIO\nFILHO, A. *Notícia*.\n","dic":"DHBPR"}
