{"title":"BELO, José Maria de Albuquerque","cargoss":["Deputado federal","Senador"],"cargos_esp":[0,0],"datas_ini":[1927,1930],"datas_fim":[1929,1930],"estados":["PE","PE"],"autor":["Raimundo Helio Lopes"],"content":"**BELO, José Maria de Albuquerque**\n\n\\*dep. fed. PE 1927-1929; sen. PE 1930.\n\n*José Maria de Albuquerque Belo* nasceu em Barreiros (PE) em 1885.\n\nIniciou os estudos em sua cidade natal e prosseguiu-os em Recife, cidade\npara onde se transferiu depois que sua família, de tradição usineira,\nvendeu suas terras e seu engenho para o primo Estácio Coimbra, deputado\nfederal, governador de Pernambuco e vice-presidente da República durante\no governo de Artur Bernardes (1922-1926). Depois de alguns anos,\nmudou-se para o Rio de Janeiro, então Distrito Federal, e ingressou na\nFaculdade de Direito. Ao longo do curso teve diversos cargos públicos,\nconseguidos com a ajuda de Estácio Coimbra. Passou a frequentar círculos\njornalísticos e literários, trabalhou em jornais e passou nove meses na\nEuropa como assessor da delegação brasileira à Conferência de Versalhes,\nrealizada em 1919, em Paris, para estabelecer os termos da paz das\nnações derrotadas na Primeira Guerra Mundial.\n\nEm 1927 foi eleito deputado federal por Pernambuco, onde tinha boas\nrelações com usineiros e fazendeiros e não se identificava com nenhuma\nfacção política, a despeito das fortes relações que tinha com o primo\nEstácio Coimbra. Assumiu sua cadeira na Câmara dos Deputados em maio do\nmesmo ano e exerceu o mandato até dezembro de 1929. No ano seguinte foi\neleito senador por Pernambuco. Assumiu sua cadeira no Senado Federal em\n21 de abril de 1930, mas teve o mandato interrompido em outubro seguinte\ncom a vitória da Revolução de 1930, que levou Getúlio Vargas ao poder e\nextinguiu todos os órgãos legislativos do país.\n\nDepois desses anos, dedicou-se à advocacia, ao magistério na Faculdade\nde Direito do Rio de Janeiro e às carreiras literária, jornalística e\ndiplomática. Foi auxiliar contratado em Nova Iorque, cônsul em\nEstocolmo, no Havre e em Hamburgo, segundo-secretário em Bonn e Porto\nPríncipe, e de novo cônsul em Dacar e Miami. Foi também relator de\ndebates da Câmara dos Deputados e bibliotecário dessa casa legislativa.\n\nNo campo jornalístico, colaborou com os periódicos *Diário de\nPernambuco* e *Jornal do Comércio* e foi diretor do jornal *A\nProvíncia*, todos de Pernambuco.\n\nFaleceu no Rio de Janeiro em 1959.\n\nPublicou *Novos estudos críticos* (1917), *Rui Barbosa e escritos\ndiversos* (1918). Disponível em:\n\\<www.literaturabrasileira.ufsc.br/Consulta/buscaNova/Catalogo.php?obra=9734\\>*Ensaios\npolíticos e literários* (1918), *À margem dos livros* (1922), *Os\nexilados* (1927), *A noção filosófica e social do direito. Breve ensaio\nda metodologia* (1933), *Inteligência do Brasil* (1935), *Democracia e\nantidemocracia* (1936), *Imagens de hoje e de ontem* (1936), *A questão\nsocial e a solução brasileira* (1936), *Retrato de Eça de Queiroz*\n(1945), *Retrato de Machado de Assis* (1952), *Memórias* (1958), *A\nHistory of Modern Brazil (1889-1954)* (1968) e *História da República\n(1889-1954)* (7. ed., 1976).\n\nRaimundo Helio Lopes\n\n**FONTES:** LEITE NETO, L. *Catálogo biográfico*; LEVINE, R. *Velha*;\nNASCIMENTO, L. *História* (v.1, 2, 3).\n","ref":"**FONTES:** LEITE NETO, L. *Catálogo biográfico*; LEVINE, R. *Velha*;\nNASCIMENTO, L. *História* (v.1, 2, 3).\n","dic":"DHBPR"}
