{"title":"BELO, Oliveira","cargoss":["Presidente de associação ou confederação de empregados ou empregadores","Presidente de associação ou confederação de empregados ou empregadores","Presidente de associação ou confederação de empregados ou empregadores","Deputado federal"],"cargos_esp":[0,0,0,0],"datas_ini":[1880,1883,1889,1902],"datas_fim":[1880,1884,1889,1902],"estados":["SE","PR","SC","RJ"],"autor":["Luciana Pinheiro"],"content":"**BELO, Oliveira**\n\n\\* pres. SE 1880; pres. PR 1883-1884; pres. SC 1889; dep. fed. RJ 1902.\n\n*Luís Alves Leite de Oliveira Belo* nasceu em Niterói no dia 5 de março\nde 1849, filho de Luís Alves Leite de Oliveira Belo e de Eulália\nPulqueria de Oliveira Bulhões.\n\nBacharel em ciências jurídicas e sociais pela Faculdade de Direito de\nSão Paulo, foi membro do Partido Liberal e exerceu diversos mandatos de\ndeputado provincial na província do Rio de Janeiro. Nos anos finais do\nImpério assumiu sucessivamente a presidência de três províncias: de maio\na julho de 1880 governou Sergipe, de setembro de 1883 a junho de 1884\ngovernou o Paraná e em meados de 1889 assumiu a presidência de Santa\nCatarina, mantendo-se à frente do governo até a proclamação da\nRepública, em 15 de novembro.\n\nEstando em curso a legislatura 1900-1902, foi eleito deputado federal\npelo estado do Rio de Janeiro e exerceu o mandato na Câmara dos\nDeputados, no Distrito Federal, entre os meses de setembro e dezembro de\n1902.\n\nAo longo de sua trajetória profissional presidiu a Sociedade Nacional de\nAgricultura, foi diretor do *Diário Oficial* e integrou o Conselho de\nInstrução Pública em Niterói. Reconhecido por sua habilidade como orador\ne escritor, foi membro da Sociedade Partenon Literário.\n\nFaleceu no Rio de Janeiro em 23 de maio de 1915.\n\nFoi casado com Leôncia de Sousa Breves e teve oito filhos.\n\nEm sua vasta obra publicada, destacam-se *Discursos na maçonaria em São\nPaulo* (1872), *A Igreja perante a história* (1873), *A educação\nnacional* (1873) e *O espírito do século XIX* (1874), *Política geral –\ndiscurso na Assembleia do Rio de Janeiro* (1874), *Ensaio da tribuna\npopular* (1875) e *Os farrapos* (1877).\n\nLuciana Pinheiro\n\n**FONTES:** ABRANCHES, J. *Governos* (v.2, p.57-58); ARQ. PUB. PARANÁ.\nDisponível em: \\<www.arquivopublico.pr.gov.br/\\>. Acesso em: 20/1/2010;\nCÂM. DEP. *Deputados brasileiros* (p.175); GOV. EST. SANTA CATARINA.\nDisponível em: \\<www.sc.gov.br/\\>. Acesso em: 20/1/2011; História do\nCafé no Brasil Imperial. Disponível em: \\<www.brevescafe.oi.com.br/\\>.\nAcesso em: 20/1/2011; Palácio Olímpio Campos. Disponível em:\n\\<www.palacioolimpiocampos.se.gov.br/\\>. Acesso em: 20/1/2010.\n","ref":"**FONTES:** ABRANCHES, J. *Governos* (v.2, p.57-58); ARQ. PUB. PARANÁ.\nDisponível em: \\<www.arquivopublico.pr.gov.br/\\>. Acesso em: 20/1/2010;\nCÂM. DEP. *Deputados brasileiros* (p.175); GOV. EST. SANTA CATARINA.\nDisponível em: \\<www.sc.gov.br/\\>. Acesso em: 20/1/2011; História do\nCafé no Brasil Imperial. Disponível em: \\<www.brevescafe.oi.com.br/\\>.\nAcesso em: 20/1/2011; Palácio Olímpio Campos. Disponível em:\n\\<www.palacioolimpiocampos.se.gov.br/\\>. Acesso em: 20/1/2010.\n","dic":"DHBPR"}
