{"title":"BERREDO, Antônio Eduardo de","cargoss":["Deputado federal"],"cargos_esp":[0],"datas_ini":[1894],"datas_fim":[1899],"estados":["MA"],"autor":["Raimundo Helio Lopes"],"content":"**BERREDO, Antônio Eduardo de**\n\n\\*dep. fed. MA 1894-1899.\n\n*Antônio Eduardo de Berredo* nasceu na cidade de Caxias (MA).\n\nFormado em medicina, iniciou sua vida política ainda no Império, quando\nse elegeu deputado provincial no Maranhão. Após a proclamação da\nRepública, foi eleito vereador à Câmara Municipal de Caxias em 1893.\n\nEm 1894 foi eleito deputado federal pelo Maranhão e em maio assumiu o\nmandato Câmara de Deputados, no Rio de Janeiro, então Distrito Federal.\nReeleito para a legislatura seguinte, concluiu o segundo mandato em\n1899. Tentou novamente eleger-se, mas não teve êxito. Deixou então a\npolítica e passou a clinicar na cidade natal.\n\nFaleceu no ano de 1916.\n\nRaimundo Helio Lopes\n\n**FONTES:** ABRANCHES, J. *Governos*; CÂM. DEP. *Deputados brasileiros*;\nMARQUES, C. *Dicionário*.\n","ref":"**FONTES:** ABRANCHES, J. *Governos*; CÂM. DEP. *Deputados brasileiros*;\nMARQUES, C. *Dicionário*.\n","dic":"DHBPR"}
