{"title":"BESSA, Gumercindo","cargoss":["Deputado federal"],"cargos_esp":[0],"datas_ini":[1909],"datas_fim":[1911],"estados":["SE"],"autor":[0],"content":"**BESSA, Gumercindo**\n\n\\*dep. fed. SE 1909-1911.\n\n*Gumercindo de Araújo Bessa* nasceu em Estância (SE) no dia 2 de janeiro\nde 1859, filho de Urbano Joaquim Soledade e de Francisca Carolina de\nAraújo Bessa.\n\nFez os estudos primários e parte dos secundários em sua cidade natal.\nDepois, em Salvador, frequentou o Seminário Episcopal da Bahia, entre\n1876 e 1879. Pouco antes de concluir o curso canônico, optou pela\ncarreira jurídica. Na Faculdade de Direito do Recife obteve o grau de\nbacharel em 1885. Foi aluno de destaque e recebeu da congregação menção\nhonrosa declarando-o apto a lecionar direito em qualquer faculdade do\nmundo.\n\nRecém-formado, foi promotor público na cidade de São Cristóvão (SE).\nPediu exoneração do cargo em 1886, após desentender-se com o juiz local\npor questões relativas à interpretação da doutrina jurídica. A partir de\nentão voltou-se para o jornalismo, como redator de *A Reforma*, e\ningressou na política, eleito deputado provincial em Sergipe na última\nlegislatura do Império. Exerceu também a advocacia em escritório\nparticular localizado na cidade de Aracaju. Com o advento da República,\nobteve novo mandato na Assembleia Legislativa sergipana, tendo\nparticipado da elaboração da primeira Constituição estadual. Em 1891,\nocupou os cargos de juiz de casamentos, desembargador e presidente do\nTribunal de Apelação do Estado de Sergipe. Em 1894, na gestão de Manuel\nValadão, assumiu a chefatura de polícia.\n\nEm 1906, enfrentou Rui Barbosa na ação envolvendo a reivindicação do\nterritório do Acre pelo estado do Amazonas. Seu *Memorial em prol dos\nacreanos* reuniu tantas informações de ordem histórica e tamanha\nerudição jurídica que acabou derrotando seu adversário, considerado o\nmais ilustre conhecedor do direito no Brasil. Seus esforços conseguiram\ngalvanizar a atenção de todo o país, e, a título de recompensa por suas\naptidões e talentos, a intendência do Alto Acre concedeu o nome de\nGumercindo Bessa à principal rua da vila de Rio Branco. Segundo o\nhistoriador Luís Antônio Barreto, a abundância e a riqueza dos\nargumentos utilizados no processo pelo jurista sergipano teriam ensejado\na expressão “à beça” (originariamente “à Bessa”) como sinônimo de algo\nabundante, copioso.\n\nGumercindo Bessa foi eleito deputado federal por Sergipe na legislatura\nde 1909-1911, com os votos dados pelos opositores do monsenhor Olímpio\nCampos, presidente do estado de 1899 a 1902, mentor da primeira\noligarquia política local, figura contra a qual moveu alongada campanha\nna imprensa.\n\nFaleceu em Nossa Senhora do Socorro (SE) no dia 24 de agosto de 1913.\n\nAlém de artigos na imprensa, escreveu *O que é direito* (1885),\nmonografia para obtenção do grau de bacharel. Foi escolhido patrono da\nAcademia Sergipana de Imprensa e patrono da cadeira de número 6 da\nAcademia Sergipana de Letras. Em sua homenagem seu nome foi dado ao\nprédio do Tribunal de Justiça do Estado de Sergipe.\n\nSérgio Montalvão\n\n**FONTES:** ACAD. SERGIPANA LET. Disponível em:\n\\<www.infonet.com.br/asl/\\>; BARRETO, L. *Pequeno*; BITTENCOURT, L.\n*Homens*; DANTAS, J. *História*; GUARANÁ, M. *Dicionário*.\n","ref":"**FONTES:** ACAD. SERGIPANA LET. Disponível em:\n\\<www.infonet.com.br/asl/\\>; BARRETO, L. *Pequeno*; BITTENCOURT, L.\n*Homens*; DANTAS, J. *História*; GUARANÁ, M. *Dicionário*.\n","dic":"DHBPR"}
