{"title":"BEZAMAT, Alberto","cargoss":["Deputado Geral","def fed"],"cargos_esp":[0,0],"datas_ini":[1885,1903],"datas_fim":[1889,1905],"estados":["RJ","RJ"],"autor":["Luciana Pinheiro"],"content":"**BEZAMAT, Alberto**\n\n\\*dep. geral RJ 1885-1889; def. fed. RJ 1903-1905.\n\n*Alberto Bezamat* nasceu em Campos (RJ).\n\nBacharel pela Faculdade de Direito de São Paulo em 1870, retornou ao\nmunicípio natal e deu início à trajetória profissional atuando como\nadvogado. Ingressou na política filiando-se ao Partido Conservador e foi\ndeputado provincial em várias legislaturas. Em 1885 foi eleito pela\nprimeira vez deputado geral pela província do Rio de Janeiro. Reeleito\nno ano seguinte, exerceu o mandato até 1889.\n\nJá na República, candidatou-se a deputado federal pelo estado do Rio em\n1903 e foi eleito. Tomou posse em maio na Câmara dos Deputados e exerceu\no mandato até o fim da legislatura, em dezembro de 1905.\n\nAo longo de sua trajetória profissional foi também como juiz de direito\nem Santos (SP).\n\nFaleceu em 4 de julho de 1906.\n\nFoi casado com Eugênia de Albuquerque Bezamat.\n\nLuciana Pinheiro\n\n**FONTES:** ABRANCHES, J. *Governos*. (v.2, p.143); CÂM. DEP. *Deputados\nbrasileiros* (p.13); Novo Milênio: Histórias e lendas de Santos.\nDisponível em: \\<www.novomilenio.inf.br/santos/h0412.htm\\>. Acesso em:\n18/11/2010; VELHO SOBRINHO, J. *Dicionário* (v.1, p.128).\n","ref":"**FONTES:** ABRANCHES, J. *Governos*. (v.2, p.143); CÂM. DEP. *Deputados\nbrasileiros* (p.13); Novo Milênio: Histórias e lendas de Santos.\nDisponível em: \\<www.novomilenio.inf.br/santos/h0412.htm\\>. Acesso em:\n18/11/2010; VELHO SOBRINHO, J. *Dicionário* (v.1, p.128).\n","dic":"DHBPR"}
