{"title":"BITTENCOURT FILHO, Francisco","cargoss":["Deputado federal","Deputado federal"],"cargos_esp":[0,0],"datas_ini":[1921,1909],"datas_fim":[1926,1911],"estados":["DF","DF"],"autor":["Carolina Vianna Dantas"],"content":"**BITTENCOURT FILHO, Francisco**\n\n**\\***dep. fed. DF 1909-1911 e 1921-1926.\n\n*Francisco Joaquim de Bittencourt da Silva Filho* nasceu na cidade do\nRio de Janeiro, então capital do Império, em 1856, filho do arquiteto\nBittencourt da Silva. Seu pai fundou o Liceu de Artes e Ofícios do Rio\nde Janeiro.\n\nFormou-se em ciências jurídicas e sociais e desde jovem envolveu-se na\npolítica do Distrito Federal. Elegeu-se intendente municipal em 1904,\nreelegendo-se para a legislatura seguinte, em 1907. Em 1909 elegeu-se\npela primeira vez deputado federal pelo Distrito Federal para a\nlegislatura 1909-1911. Nesse último ano, com a morte do pai, assumiu a\ndireção do Liceu de Artes e Ofícios, cargo que ocuparia até a morte.\n\nEm 1912 foi reeleito deputado federal mas não foi reconhecido e, por\nisso, deixou a Câmara dos Deputados. Em 1921 foi eleito novamente, e\ndessa vez diplomado. Foi reeleito e empossado na legislatura seguinte,\niniciada em 1924 e concluída em 1926.\n\nFaleceu em 1928.\n\nCarolina Vianna Dantas\n\n**FONTES:** ABRANCHES, J. *Governos*; CÂM. DEP. *Deputados brasileiros*;\n*Encic. Itaú Cultural. Artes Visuais*. Disponível em:\n\\<www.itaucultural.org.br/\\>.\n","ref":"**FONTES:** ABRANCHES, J. *Governos*; CÂM. DEP. *Deputados brasileiros*;\n*Encic. Itaú Cultural. Artes Visuais*. Disponível em:\n\\<www.itaucultural.org.br/\\>.\n","dic":"DHBPR"}
