{"title":"AFONSO, Almino Álvares","cargoss":["Constituinte","Deputado federal","Senador"],"cargos_esp":[0,0,0],"datas_ini":[1891,1891,1894],"datas_fim":[1891,1893,1899],"estados":["RN","RN","RN"],"autor":["Renato Amado Peixoto"],"content":"**AFONSO, Almino Álvares**\n\n\\* const. RN 1891; dep.fed. RN 1891-1893; sen. RN 1894-1899.\n\n*Almino Álvares Afonso* nasceu no municípiode Martins, hoje Patu (RN),\nno dia17 de abril de 1840, filho de FranciscoManuel Álvares Afonso e de\nLuísa CândidaTeles de Meneses.\n\nÓrfão de pai aos oito anose de origem muito humilde, mudou-se coma\nfamília em 1853 para Catolé doRocha (PB). Graças ao apoio de seutio,\nJosé Torquato de Sá Cavalcanti, conseguiucursar a Faculdade de Direito\ndo Recife,pela qual se bacharelou em 1871.\n\nEm 1872 foi nomeado promotor públicoda comarca de Guariba (PB), de\nondefoi obrigado a seguir para o Cearáem 1874 por conta dos distúrbios\nqueacompanharam o movimento do “quebra-quilos”.Chegando a Fortaleza,\ndenunciou como causadoresdo movimento os atos do presidente daParaíba,\nSilvino Carneiro da Cunha, acusando-otambém de conivência com os crimes\nperpetradosna ocasião. No Ceará foi nomeado secretárioda presidência da\nprovíncia e, depois,juiz municipal de Cascavel e Aquiraz,onde exerceu\nainda as funções de comissáriodurante as secas de 1877 e 1879.Nesse\nperíodo, viajou ao Rio de Janeiropara encontrar-se com o José Maria\ndaSilva Paranhos, o visconde do Rio Branco,de quem se teria tornado\níntimo. Convidadoentão pelo próprio dom Pedro II paraum encontro,\nrecusou-se a conhecê-lo alegandonão querer violar seus princípios\npolíticos.\n\nEm 1880 passou a exercer emFortaleza o cargo de procurador fiscaldos\nFeitos da Fazenda Geral. Filiou-senesse período ao grupo mais radical\ndaSociedade Cearense Libertadora, tornando-se redatordo jornal *O\nLibertador* e advogado de váriosabolicionistas processados por roubo de\nescravos.Participou da agitação e da organizaçãodo movimento\nantiescravista nas províncias daParaíba, do Rio Grande do Norte,\ndoCeará, de Pernambuco, do Piauí e doMaranhão. Foi um dos responsáveis\ndiretospelos movimentos e pelos resultados obtidosno Ceará e no Rio\nGrande do Norte,como a greve dos jangadeiros de 1881,provavelmente a\nprimeira greve política doBrasil; a abolição da escravidão em\nváriosmunicípios do Ceará e na capital, Fortaleza;a abolição da\nescravidão em Mossoró (RN)no ano de 1883; e a abolição daescravidão na\nprovíncia do Ceará em 1884.\n\nEm 1883 foi demitido do cargode procurador fiscal pelo então\npresidenteda província do Ceará, Domingos AntônioRaiol, por causa do\ndiscurso que proferiudurante o embarque do 15^o^ Batalhãode Infantaria,\ntransferido de Fortaleza paraBelém do Pará por conta do envolvimentode\nseus membros com o movimento antiescravista.Esse episódio contribuiu\ndiretamente para oacirramento do movimento antiescravista em todoo\nBrasil, dada sua repercussão à época,e serviu como justificativa para a\nconferênciarealizada no Rio de Janeiro, em queJosé do Patrocínio,\nperante cerca de duasmil pessoas, atacou fortemente João Lustosada Cunha\nParanaguá, o marquês de Paranaguá,então presidente do Conselho de\nMinistros.\n\nEm 1884 partiu para o Amazonas,a fim de concluir trabalhos de\nadvocaciadeixados inconclusos por seu falecido irmãoDeocleciano Álvares\nAfonso. Em Manaus, integrou-seà Comissão Central Abolicionista\nAmazonense eparticipou da instalação da Sociedade Libertadora25 de Março\ne da campanha pelaabolição, que levaram à abolição da escravidãona\ncidade e depois em toda a provínciano mesmo ano. Dinamizou também a\ncampanharepublicana fundando o jornal *Rio Branco*. Em1887, foi eleito\npresidente da CâmaraMunicipal de Manaus na legenda do\nPartidoConservador.\n\nEm 1886 publicou *Os Rodrigões do Império*,panfleto em que criticava a\nvida dissolutada Corte, apontando diretamente os desviosde Carlota\nJoaquina, de dom Pedro I,de dom Pedro II e do conde D’Eu,e acusando\ntambém a instituição monárquicade ser a causa do atraso brasileiro.\n\nEm 1889, ainda no Império, candidatou-sea deputado geral pelo Rio Grande\ndoNorte na legenda do Partido Conservador,mas não foi eleito. Já na\nRepública,em 1890, elegeu-se deputado constituinte peloRio Grande do\nNorte na legenda PartidoRepublicano, tendo sido mais votado,\ninclusive,que os candidatos do partido ao Senado.Empossado na\nConstituinte em 15 de novembrode 1890, apresentou a emenda que\nasseguravaa representação das minorias; a que garantiao casamento civil;\ne a que permitiaa cada culto religioso manter cemitériospróprios e\nseparados. Combateu o dispositivoconstitucional que previa a anexação\ndosestados, bateu-se contra a subvenção aoscultos religiosos e a favor\nda liberdadetotal de imprensa.\n\nEm 1892, tornou-se um dos principaisdefensores do governo Floriano\nPeixoto (1891-1894),chegando mesmo a liderar no Amazonas aderrubada do\ngovernador Gregório Taumaturgo deAzevedo. Ficou afastado do Congresso\nporquase um ano e recusou-se a receberos vencimentos daquele período.\n\nEm 1893, como único parlamentardo Rio Grande do Norte envolvido nadefesa\ndo reconhecimento de Augusto Severode Albuquerque Maranhão, irmão de\nPedroVelho de Albuquerque Maranhão, líder doPartido Republicano e\ngovernador do RioGrande do Norte (1892-1896), atacou duramentePrudente\nde Morais, então presidente deSão Paulo, acusando-o de iniciar a\ninstalaçãode sua oligarquia naquele estado.\n\nEm 1894, foi eleito senador peloRio Grande do Norte na legenda doPartido\nRepublicano por indicação direta dePedro Velho e contra a vontade\ndeFloriano Peixoto, que apoiava a indicaçãode Amaro Cavalcanti Soares de\nBrito. NoSenado, combateu as tentativas de deporPedro Velho. Tornou-se\ntambém um dos maisaguerridos oposicionistas do governo Prudentede Morais\n(1894-1898), denunciando a violaçãoda imunidade parlamentar durante o\nestadode sítio decretado após a tentativa deassassinato do presidente.\nBateu-se pela necessidadede consulta ao Senado quando se dispusessesobre\nquestões de soberania nacional, elutou pelo aumento do orçamento e\ndosefetivos militares. Combateu a redução doimposto sobre o sal\nestrangeiro, defendidapelo representante do Rio Grande do SulJosé Gomes\nPinheiro Machado, argumentando afavor do produto potiguar. Pesou em\nsuaposição o fato de que responsabilizavadiretamente o presidente\nPrudente de Moraispela morte de seu filho, cadete daEscola Militar\ndeportado para o Acre porindisciplina. Em 1899 regressou ao Cearápor\nconselho médico.\n\nAo longo da carreira dirigiu ojornal *O Libertador*, em Fortaleza, e\nfoiredator dos periódicos *Abolicionista Amazonense* e *O Rio Branco*,\nem Manaus.\n\nFaleceu na cidade de Fortalezaa 13 de fevereiro de 1899.\n\nEra casado com Abigail de SousaMartins, com quem teve cinco filhos.\n\nPublicou *Uma nota sobre o quebra-quilos na Paraíba* (1875);e *Os\nRodrigões do Império, ou caráter da única monarquia americana* (1886).A\nseu respeito foram publicadas as seguintesobras: *A abolição antes da\nLei Áurea, Almino Afonso, o abolicionista e republicano histórico*\n(1972);*Almino Afonso: o poeta, outros depoimentos* (1993); *Polianteia:\nAlmino Afonso – tribuno da abolição* (1998).\n\nRenato Amado Peixoto\n\n**FONTES:** AFFONSO, A. *Palavras*; CARDOSO,R. *Memórias*; *Estado do\nAmazonas*; MAIOR, A. *Quebra-quilos*;MEDEIROS, J. *Rio*; ONOFRE, M*.\nAbolição*;SOARES, A. *Diccionario*.\n","ref":"**FONTES:** AFFONSO, A. *Palavras*; CARDOSO,R. *Memórias*; *Estado do\nAmazonas*; MAIOR, A. *Quebra-quilos*;MEDEIROS, J. *Rio*; ONOFRE, M*.\nAbolição*;SOARES, A. *Diccionario*.\n","dic":"DHBPR"}
