{"title":"BLUM, Emílio","cargoss":["Deputado federal"],"cargos_esp":[0],"datas_ini":[1894],"datas_fim":[1896],"estados":["SC"],"autor":["Carolina Vianna Dantas"],"content":"**BLUM, Emílio**\n\n\\*dep. fed. SC 1894-1896.\n\n*Emílio Ramos Blum* nasceu na cidade de Bagé (RS) no dia 10 de abril de\n1861, filho de Jacques Blum e de Amélia Blum, ambos franceses.\n\nDos 13 aos 20 anos de idade residiu em Paris com o objetivo de estudar\nengenharia. Em 1880, já formado, regressou ao Brasil e fixou-se na\ncidade de Desterro, atual Florianópolis. A partir de então envolveu-se\ncom a campanha republicana na província de Santa Catarina.\n\nApós a proclamação da República (15/11/1889), iniciou sua carreira\npolítica como superintendente municipal de Desterro. Em 1891 foi eleito\ndeputado constituinte estadual, com mandato até 1893. Entretanto, em\nfunção dos conflitos entre legalistas e federalistas a Constituinte foi\ndissolvida. Emílio Blum engajou-se na defesa das forças legais e por\nisso recebeu a patente de coronel do então presidente Floriano Peixoto\n(1891-1894).\n\nNo início de 1894 foi eleito deputado federal por Santa Catarina,\ncumprindo o mandato de 1894 a 1896. Em seguida retornou à política\nlocal, assumindo novamente a cadeira de deputado estadual, como suplente\nconvocado, em 1900. Em 1906 foi mais uma vez eleito deputado estadual,\ncom mandato de 1907 a 1909. Participou da Assembleia Constituinte\nestadual de 1910 e das duas legislaturas seguintes (1910-1912 e\n1913-1915).\n\nFaleceu na cidade de Mendes (RJ) no dia 5 de março de 1918, deixando\ndescendência. Seu filho Heitor Blum foi prefeito de Florianópolis.\n\nCarolina Vianna Dantas\n\n**FONTES:** ABRANCHES, J. *Governos;* PAULI, E. *Enciclopédia;* PIAZZA,\nW. *Dicionário*.\n","ref":"**FONTES:** ABRANCHES, J. *Governos;* PAULI, E. *Enciclopédia;* PIAZZA,\nW. *Dicionário*.\n","dic":"DHBPR"}
