{"title":"BOCAIÚVA, Quintino","cargoss":["Ministro das Relações Exteriores","Senador","Senador","Senador","Presidente de associação ou confederação de empregados ou empregadores","Senador"],"cargos_esp":[0,0,0,0,0,0],"datas_ini":[1889,1900,1892,1890,1900,1909],"datas_fim":[1891,1900,1899,1891,1903,1912],"estados":[0,"RJ","RJ","RJ","RJ","RJ"],"autor":["Renato Lemos"],"content":"**BOCAIÚVA, Quintino**\n\n\\* min. Rel. Ext. 1889-1891; sen. RJ 1890-1891, 1892-1899 e 1900; pres.\nRJ 1900-1903; sen. RJ 1909-1912.\n\n*Quintino Antônio Ferreira de Sousa* nasceu no Rio de Janeiro, então\ncapital do Império, em 4 de dezembro de 1836, filho de Quintino Ferreira\nde Sousa e de Maria Candelária Moreno y Alagon. Sua mãe era filha de\nespanhol e uruguaia e natural da Argentina, onde viveu até os dez anos\nde idade.\n\nMIS\n\n![Descrição: G:\\\\Trabalho para a Mirna\\\\MIS\\\\Imagens MIS\\\\Quintino\nBacaiúva.jpg](BOCAI%c3%9aVA,%20Quintino_arquivos/image001.jpg)\n\nQuintino Bocaiúva.\n\nCom morte do pai em 1849, Quintino transferiu-se para a cidade de São\nPaulo, onde no ano seguinte, graças ao apoio financeiro de um tio,\niniciou os estudos no curso de humanidades anexo à Faculdade de Direito.\nNa capital paulista fez, em 1852, suas primeiras incursões na atividade\njornalística, publicando poemas escritos em espanhol e artigos em *O\nAcaiaba*, jornal literário acadêmico, e *A Honra*, periódico político\nque fundou em 1853 com Antônio Ferreira Viana e em cujas páginas\napresentou suas primeiras posições republicanas. Na ocasião, estimulado\npelo nativismo indigenista que seduzia os estudantes, substituiu o\nsobrenome paterno por *Bocaiúva*, nome dado por indígenas a uma espécie\nde palmeira muito encontradiça no Brasil.\n\nEscritor, Jornalista, Republicano\n\nEm decorrência de problemas financeiros, abandonou os estudos em São\nPaulo e retornou à Corte. Aí iniciou a carreira de teatrólogo, com a\nencenação, em 2 de janeiro de 1856, de sua peça *Trovador* no Teatro São\nJanuário. Em seguida seriam montadas, em julho de 1860, *Onfália*, no\nTeatro Variedades, e em julho de 1861, *Os mineiros da desgraça*, no\nGinásio Dramático. Tendo trabalhado no *Correio Mercantil* de 1860 a\n1864, a partir de março de 1860 passou a editar com Joaquim Saldanha\nMarinho o *Diário do Rio de Janeiro*, que, fundado em 1821 com perfil\npopular e apolítico, deixara de circular no ano anterior. Em sua nova\nfase, afinado com o Partido Liberal, o jornal, que tinha o escritor\nMachado de Assis entre seus colaboradores, faria marcantes coberturas\ndas questões de política externa brasileira na região do Prata. Ainda em\n1860, no mês de dezembro, casou-se com Luísa Amélia de Almeida Costa,\ncom quem teria sete filhos.\n\nIngressou na organização maçônica paulista Loja Amizade em 1861, ano em\nque, sob pseudônimo, publicou *A opinião e a coroa*, panfleto político.\nNo ano seguinte, lançou *Lírica nacional*, coletânea de poemas seus e de\noutros escritores brasileiros e primeiro volume da coleção Biblioteca\nBrasileira, que concebeu e na qual seriam publicadas mais 11 obras de\nvários autores, entre os quais José de Alencar e Manuel Antônio de\nAlmeida, e que, em julho de 1863, se transformaria em revista mensal. No\nano seguinte publicou, também sob pseudônimo, *Os nossos homens*, outro\npanfleto político.\n\nDurante a guerra da Tríplice Aliança contra o Paraguai (1865-1870), foi\ncorrespondente na Argentina, ocasião em que, segundo alguns autores,\nconsolidou suas convicções republicanas. Durante o conflito, desenvolveu\natividades comerciais, como a exploração de contratos de fornecimento ao\nexército. Depois de tentar lucros com o arrendamento de uma estrada de\nferro no Paraguai, nomeou, para liquidar a sua participação no negócio,\no advogado Francisco Xavier da Cunha, que viria a ser seu companheiro na\nimprensa republicana e, no primeiro ano da República, ministro\nplenipotenciário do Brasil na Itália.\n\nPreocupado com alternativas à mão de obra escrava, associou-se em 1866 a\nBernardo Caymari, capitalista cubano, para fundar a Sociedade Imperial\nde Imigração. O propósito da empresa era atrair para o trabalho na\nagricultura brasileira imigrantes norte-americanos, especialmente\nsulistas descontentes com a derrota na Guerra de Secessão (1861-1865).\nViajou, em 25 de agosto desse ano, para a cidade de Nova Iorque, onde\natuaria como agente de imigração até 1867. Como Saldanha Marinho\nassumira, no início de 1865, a presidência da província de Minas Gerais,\na propriedade do *Diário do Rio de Janeiro* passou a Sebastião Gomes da\nSilva Belfort, ficando Machado de Assis responsável pela direção\neditorial. Na volta ao Brasil, visitou a Argentina e o Paraguai e, em\n1867, com a ajuda financeira de Bernardo Caymari, readquiriu o controle\ndo jornal.\n\nNo ano seguinte, a crise política gerada pela queda do gabinete chefiado\npor Zacarias de Góis e Vasconcelos em decorrência de conflitos com o\nduque de Caxias, então comandante em chefe do Exército brasileiro no\nParaguai, levou o Partido Liberal à cisão. Na ocasião, uma de suas\ncorrentes, defensora do federalismo, aproximou-se dos republicanos.\nAinda em 1868 Quintino publicou o opúsculo *A crise da lavoura*, em que\ndefendia o emprego de imigrantes chineses como alternativa à mão de obra\nescrava, e no ano seguinte lançou o panfleto *Guerra do Paraguai, a nova\nfase*. Em julho de 1870, retornando da Argentina, onde participara das\ncomemorações do fim do conflito com o Paraguai, pronunciou uma palestra\npública no Teatro São Luís, no Rio de Janeiro, em que comparou as\nsociedades do Rio da Prata, republicanas, com a brasileira.\n\nEm 3 de novembro, uniu-se aos liberais dissidentes para fundar, em um\nsobrado da rua do Ouvidor, n^o^ 29, o Clube Republicano da cidade do Rio\nde Janeiro, que contou incialmente com 15 sócios. Integrou a Comissão\nDiretora, juntamente com Saldanha Marinho, Lafayette Rodrigues Pereira e\nAristides da Silveira Lobo, bem como o grupo que fundou o jornal *A\nRepública*, em cuja primeira edição foi lançado, em 3 de dezembro, o\n*Manifesto Republicano*, redigido por ele e Salvador de Mendonça. Entre\nos quase 60 signatários do documento encontravam-se também Saldanha\nMarinho, Aristides Lobo, Cristiano Benedito Ottoni, Flávio Farnese,\nLafayette Rodrigues Pereira, Pedro Antônio Ferreira Viana, Pedro\nBandeira de Gouveia, Francisco Rangel Pestana, Miguel Ferreira Vieira e\nJosé Lopes Trovão.\n\nA ideia de república aparecia expressamente no documento apenas uma vez,\nquando, na conclusão, este se apresentava como defensor da “bandeira do\npartido republicano federativo”. A adjetivação refletia a escolha de um\ndos dois eixos centrais do conteúdo do manifesto – o federalismo,\njustificado por razões naturais, ligadas à topografia do país: “No\nBrasil, antes ainda da ideia democrática, encarregou-se a natureza de\nestabelecer o princípio federativo”. A democracia – e não a república –\nera o outro eixo. O manifesto refletia a influência das experiências\nrepublicanas modernas – principalmente a estadunidense e a francesa −,\nem que a alternativa à forma monárquica era legitimada pela soberania\npopular e regulada pelo direito. Subjacente a ambos os eixos, estava a\nrepulsa ao absolutismo, atribuído ao sistema político imperial e\napontado como a gênese de todos os problemas encontrados na sociedade\nbrasileira. Dessa perspectiva liberal-democrática, o manifesto\napresentava críticas a vários aspectos da vida nacional: as práticas de\ncorrupção e concessão de privilégios; as prerrogativas do trono; o\ncentralismo da administração; a ausência das liberdades de consciência,\neconômica, de imprensa, de associação, de ensino e individual; o sistema\nrepresentativo limitado etc. Como alternativa, propunha a reforma da\nsociedade por meio de uma Assembleia Constituinte, com “amplas\nfaculdades para instaurar um novo regime”, baseado nos princípios da\n“democracia moderna”.\n\nO jornal *A República* circularia, inicialmente, três vezes por semana.\nSeus principais redatores eram Miguel Vieira Ferreira, Flávio Farnese,\nAristides Lobo, Lafayette Rodrigues Pereira e Rangel Pestana. Tinha como\nobjetivos principais demonstrar os malefícios que a monarquia trazia\npara o país e divulgar as ideias republicanas, comparando as duas formas\nde governo.\n\nA propaganda da doutrina do Clube Republicano – chamado também de\nPartido Republicano − seria feita, ainda, por meio de conferências,\nproferidas inicialmente por Quintino, Salvador de Mendonça, Miguel\nVieira Ferreira e Júlio César de Freitas Coutinho. A divulgação do\n*Manifesto Republicano* estimulou o surgimento de clubes e jornais em\nvárias regiões, mas a expansão do movimento seria desigual pelo resto\npaís. Apenas onde havia fortes tradições liberais ou republicanas, como\nem Minas Gerais e Pernambuco, as adesões começaram a acontecer logo,\nembora sem traduzir-se necessariamente em organização partidária.\n\nEm 4 de outubro de 1871, *A República*, agora sob a direção de Luís\nBarbosa da Silva, que o garantia financeiramente, passou a ser impresso\nem oficina própria e se tornou diário. Com uma tiragem de dois mil\nexemplares e circulação em cinco províncias, além da Corte, tinha como\nredatores Quintino, Salvador de Mendonça, Pompílio de Albuquerque e\nJoaquim Garcia Pires de Almeida. Entre as principais teses que defendeu\nem suas páginas, estavam a separação da Igreja do Estado e o\nestabelecimento da Federação. Desde suas primeiras edições, o jornal\nprocurou aproximar-se de setores militares descontentes com a monarquia.\nA guerra contra o Paraguai provocara desgastes na relação entre muitos\noficiais e dirigentes políticos, ao mesmo tempo em que contribuíra para\ndotá-los de um espírito de corpo. Iniciara-se, no imediato pós-guerra,\numa sucessão de conflitos entre membros das forças armadas e\ngovernantes. *A República* discutia esses conflitos, que inicialmente\neram de natureza profissional, e tornavam problemáticas as relações\ndisciplinares. Por meio da seção “À classe militar”, abordava questões\ncomo o código disciplinar, em especial o recurso a castigos físicos como\nforma de punição, mas também debatia a participação das forças armadas\nna sociedade brasileira, acusando o governo imperial de desrespeitar a\nliberdade pessoal dos militares e questionando a necessidade de um\nexército permanente. Embora o Partido Republicano tenha surgido\ndefendendo um caminho pacífico para a substituição do regime, há\nindicações de que militares republicanos, aliciados secretamente pelo\noficial Pompílio de Albuquerque, chegaram a esboçar, em 1871, um plano\nde aprisionamento da família real e tomada do poder por meios violentos.\n\nEm fevereiro de 1872 Luís Barbosa da Silva, Salvador de Mendonça e\nSilveira de Meneses se tornaram proprietários de *A República* e\nampliaram sua circulação por meio de uma campanha de sorteios que elevou\na tiragem, em outubro, a 12 mil exemplares, e as assinaturas, a quase\ndez mil. Ainda assim o jornal passava por dificuldades financeiras, para\ncuja superação Quintino foi a peça-chave, novamente graças a capital\nfornecido por Bernardo Caymari. Em consequência, assumiu a sua direção\nem 9 de outubro. Tendo declarado que o jornal não seria mais porta-voz\ndo Partido Republicano, embora mantivesse a orientação republicana,\npassou a receber críticas de setores partidários e em fins novembro foi\nsubstituído no cargo por Francisco Cunha.\n\nEm dezembro de 1872, Quintino foi escolhido por republicanos da Corte e\nde Niterói (RJ) para compor a comissão central que deveria consolidar a\nunidade do partido, integrada também por Saldanha Marinho, Pedro\nBandeira de Gouveia, Francisco Cunha, Salvador de Mendonça, Antônio\nFerreira de Meneses e Elói Ottoni, logo substituído por Pedro Antônio\nFerreira Viana. A comissão assumiu também a direção de *A República*,\nque voltou ao papel de porta-voz oficial do partido. Em janeiro de 1873\nfoi criado o Clube Republicano Federal, para substituir o Clube\nRepublicano, como base do partido na Corte e adjacências. A diretoria\nficou composta por Augusto Fomm, presidente, e Pompílio de Albuquerque,\nsecretário. Em fevereiro, quando Quintino e vários colaboradores\ncomemoravam a proclamação da república na Espanha, a sede de *A\nRepública* foi atacada por agentes de polícia e militares. Em\nconsequência, o jornal foi suspenso, só voltando a circular em 15 de\nabril.\n\nTambém em abril de 1873 foi fundado na cidade de Itu o Partido\nRepublicano Paulista (PRP), o único partido de fato que os republicanos\nconseguiriam construir durante a monarquia. Nele se organizariam\nmédicos, engenheiros, advogados, jornalistas e comerciantes, em geral\nmaioria nos núcleos republicanos de outras regiões, mas também\nexpressivo contingente de fazendeiros de café do Oeste paulista, que\nrepresentaram 50% dos delegados presentes ao ato de fundação. O projeto\nrepublicano federalista oferecia a esses proprietários rurais uma\nefetiva via de acesso ao poder político, uma vez que o poder econômico\neles já encarnavam.\n\nO surgimento do Partido Republicano brasileiro coincidiu com o\nincremento da campanha abolicionista. Combatida por grande parte da\npopulação urbana, por setores do Exército, da Igreja Católica e do\npróprio grupo politicamente dirigente, inclusive o imperador, a\nescravidão constituía a principal questão a ser resolvida pela sociedade\nbrasileira. O sistema de exploração do trabalho escravo havia sofrido\nforte abalo em 1850, com a proibição do tráfico internacional de\ncativos. A Lei do Ventre Livre, que declarou livres os filhos de\nmulheres escravas nascidos a partir da data da sua promulgação, em 28 de\nsetembro de 1871, tivera impacto político importante, provocando cisões\nno Partido Conservador. Enquanto crescia a campanha antiescravista,\nfaziam-se evidentes as ambiguidades do republicanismo em face da\nescravidão, tema de resto ausente do manifesto de 1870. Para os\nrepublicanos paulistas, a abolição se apresentava como um problema de\noportunidade política. Sua posição se pautava, pragmaticamente, pela\nnecessidade de assegurar o apoio dos fazendeiros. Grande parte deles era\nproprietária de escravos e se aproximava da corrente republicana atraída\npela proposta federalista. Responsáveis pela área mais dinâmica da\neconomia nacional, empenhavam-se em reverter o sistema\npolítico-administrativo imperial, altamente centralizado e limitador do\nuso, em proveito próprio, dos vultosos recursos gerados na região. Em\nrelação ao trabalho escravo, contudo, procuravam eximir-se da\nresponsabilidade pela formulação de alternativas, defendendo a tese de\nque era um problema a ser resolvido pela monarquia e pelos partidos que\ntinham acesso ao poder, de acordo com as condições de cada província\ninteressada, como convinha ao espírito federalista. Entretanto,\ndefenderam uma posição unitária em defesa dos interesses dos\nproprietários de escravos, sustentando a bandeira da indenização, em\nrespeito ao direito de propriedade.\n\nPersistindo no esforço para dar ao movimento uma feição partidária, os\nrepublicanos da cidade e da província do Rio de Janeiro, reunidos em\ncongresso de 29 de junho a 1^o^ de julho de 1873, elegeram Quintino\nBocaiúva para a nova comissão diretora do partido, juntamente com Pedro\nBandeira de Gouveia e Francisco Cunha. Durante os trabalhos, Quintino\napresentou uma proposta de criação da União Republicana Federal, que\naglutinaria, de maneira independente, clubes e outras organizações\nlocais, com um centro político na Corte. A organização deveria, também,\nempenhar-se em promover a propaganda republicana e a educação popular,\nbem como fundar três jornais − no Norte, no Sul e no Rio de Janeiro. A\nexpansão do republicanismo, contudo, não foi conseguida, e a União teve\nvida curta.\n\nEm 28 de fevereiro de 1874, depois de ter alcançado grande tiragem,\ncalculada em 12 mil exemplares diários, *A República* deixou de\ncircular. Ainda nesse ano, Quintino passou a atuar em *O Cruzeiro*.\n\nEntrando o movimento em maré vazante, importantes republicanos, entre os\nquais Cristiano Benedito Ottoni e Lafayette Rodrigues Pereira,\nretornaram ao campo monarquista liberal. Por orientação de Quintino, o\npartido concorreu em maio de 1877 às eleições municipais no Rio de\nJaneiro, apresentando os nomes dos liberais Antônio Felício dos Santos e\nCristiano Ottoni e o do republicano Saldanha Marinho, que não\nconseguiram votação muito expressiva.\n\nEm 15 de agosto de 1881, na assembleia do Partido Republicano, Quintino\nteve seu nome lançado como candidato a deputado geral por três distritos\ndo Rio de Janeiro. Na ocasião, comprometeu-se a defender as bandeiras do\nabolicionismo e do republicanismo e combateu o caminho da revolução\narmada para a mudança de regime. Apoiado financeiramente por Bernardo\nCaymari e Francisco de Paula Mayrink, empresário e banqueiro, assumiu no\nmês seguinte o controle do jornal *O Globo*, anunciando a orientação\nrepublicana, embora não partidária, que lhe imprimiria. O pleito se\nrealizou em outubro, segundo as normas da chamada Lei Saraiva, que no\nmesmo ano implantara o sistema de eleições diretas, mas Quintino não\nlogrou eleger-se. Em fevereiro do ano seguinte o Partido Republicano\nrenovou a sua comissão executiva, que passou a ser constituída por\nSaldanha Marinho, Ubaldino do Amaral Fontoura, Augusto César de Miranda\nAzevedo, Antônio Ennes de Sousa, Luís Leitão, Jerônimo Simões, Antônio\nJustiniano Esteves Júnior, Vicente de Sousa e Aristides Lobo.\n\nTendo *O Globo* deixado de circular em 31 de março 1883, Quintino\nparticipou da fundação de *O País*, que começou a circular em 1^o^ de\noutubro de 1884. Na condição de redator-chefe do jornal, cujo\nproprietário era João José dos Reis, visconde de São Salvador de\nMatosinhos, manteria a linha republicana não partidária que vinha\ncaracterizando sua atividade jornalística. O jornal teria importante\nparticipação na vida política do país, intervindo na discussão de\nproblemas candentes como a abolição da escravatura e a substituição da\nmonarquia pela república. Sua destacada atuação à frente do periódico\nculminaria uma trajetória que lhe valeria, em meados da década de 1880,\no epíteto de “Príncipe dos jornalistas brasileiros”.\n\n*O País* surgiu em uma conjuntura em que as relações entre os militares\ne as autoridades do Império se tornavam especialmente tensas,\nconfigurando o que ficaria conhecido como “Questão Militar”. Episódios\nprotagonizados pelos coronéis Antônio de Sena Madureira e Ernesto\nAugusto da Cunha Matos, que recorreram à imprensa para defender direitos\nque entendiam ameaçados pelo governo, resultaram em sérias punições aos\nreclamantes. Contra elas, mobilizaram-se oficiais de várias guarnições,\nem especial gaúchas, autorizados pelo comandante das armas e\nvice-presidente da província do Rio Grande do Sul, general Manuel\nDeodoro da Fonseca, que, em consequência, foi demitido de seus cargos.\nNa Corte, a situação provocou reuniões de oficiais, sob a liderança\nascendente do major Benjamin Constant Botelho de Magalhães, professor de\nmatemática na Escola Militar do Brasil.\n\nEm 1885, ano em que Quintino enviuvou, Manuel Ferraz de Campos Sales e\nPrudente de Morais se elegeram deputados gerais pelo PRP, tornando-se,\nportanto, os primeiros parlamentares nacionais republicanos. Em setembro\ndesse ano, Quintino foi eleito para um novo diretório provincial\nfluminense, juntamente com Aristides Lobo, José do Patrocínio, Pedro\nAntônio Ferreira Viana, José Antônio Pedreira de Magalhães Castro,\nEsteves Júnior e Ubaldino do Amaral. Concorreu, no início do ano\nseguinte, a uma cadeira de deputado geral, juntamente com José do\nPatrocínio e Ubaldino do Amaral, mas nenhum deles logrou eleger-se. Em\njunho, foi eleito para um órgão que o Partido Republicano chamou de\nAssembleia Constitucional, composta por 21 membros, entre os quais\nSaldanha Marinho, João Clapp e José do Patrocínio. Voltou a disputar uma\neleição em outubro, agora para o Senado, em chapa com Saldanha Marinho e\nFrancisco Rangel Pestana, mas foram todos derrotados.\n\nAs relações entre militares e o governo entraram em fase de grande\ndesgaste em 1887, propiciando a projeção de novos líderes entre os\noficiais, em particular o general Deodoro da Fonseca e o major Benjamin\nConstant. A reivindicação de direitos políticos análogos aos exercidos\npelos cidadãos civis implicava a contestação dos padrões disciplinares e\nhierárquicos baseados na ideia da “obediência passiva e inconsciente”. A\nimprensa republicana permanecia discutindo o papel dos militares na\nsociedade brasileira, defendendo a formação de um exército permanente\nconstituído por cidadãos conscientes de seus direitos − “soldados\ncidadãos”. Quintino, à frente de *O País*, se destacava na propaganda\ndessa proposta, juntamente com Júlio de Castilhos, em *A Federação*, e\nRui Barbosa, no *Diário de Notícias*.\n\nParticipou, em junho de 1887, do Congresso Republicano Federal,\nconvocado para unificar as correntes republicanas. Enviaram delegados as\nprovíncias do Espírito Santo, Goiás, Minas Gerais, Pará, Paraná,\nPernambuco, Rio de Janeiro, Santa Catarina e São Paulo, além da Corte.\nDurante o evento, foi eleito vice-presidente do conselho federal do\npartido, juntamente com Saldanha Marinho (presidente), Aristides Lobo\n(secretário), Campos Sales e Ubaldino do Amaral. Os delegados aprovaram\numa constituição partidária, que garantia a autonomia e a independência\ndas organizações locais, e um manifesto, que atribuía à monarquia todos\nos problemas nacionais e reproduzia o programa liberal-democrático já\nanunciado em 1870, acrescido de referências ao “empobrecimento geral da\nnação” e ao efeito depauperador que a cobrança do imposto de exportação\ne as altas tarifas de transporte vinham exercendo sobre a agricultura.\nEm seu último parágrafo, o manifesto apontava a escravidão como\nprincipal problema a ser solucionado com urgência. Se a monarquia\npersistisse na recusa a resolvê-lo em definitivo, os republicanos a\naboliriam dentro um prazo que não passaria de julho de 1889, em\nhomenagem ao centenário da Revolução Francesa e da Declaração dos\nDireitos do Homem. Assinaram o manifesto, além de Quintino, entre\noutros, Saldanha Marinho, Campos Sales, Rangel Pestana, Aristides Lobo e\nUbaldino do Amaral.\n\nEm nova disputa por uma cadeira no Senado, em setembro de 1887, Quintino\nfoi mais uma vez derrotado. Sua candidatura a deputado geral em inícios\ndo ano seguinte, novamente pelo primeiro distrito do Rio de Janeiro,\npotencializou divergências de interesses entre abolicionistas e\nrepublicanos. A Confederação Abolicionista apoiava o adversário de\nQuintino, Antônio Ferreira Viana, do Partido Conservador e então\nministro da Justiça, mas comprometido com a extinção do trabalho\nescravo. Republicanos abolicionistas entendiam ser seu dever apoiá-lo\npara fortalecer o movimento, então em fase ascendente. Quintino manteve\na candidatura, mas Ferreira Viana venceu a eleição. José do Patrocínio,\npresidente da Confederação Abolicionista, transferiu-se para o campo\nmonarquista para apoiar a atuação da princesa Isabel, então regente, no\nsentido da abolição da escravatura, finalmente consumada em maio de\n1888.\n\nEm outubro de 1888, Quintino participou de outro Congresso Republicano,\nao qual enviaram delegados apenas as províncias da Bahia, Espírito\nSanto, Rio de Janeiro e São Paulo, além da Corte. Em fins desse ano, *O\nPaís* inseriu entre suas colunas uma seção oficial do Partido\nRepublicano, assinada por Antônio da Silva Jardim, o principal líder da\ncorrente defensora de caminhos revolucionários para a implantação da\nRepública. Em 5 de março de 1889, Quintino recebeu uma carta de\nFrancisco Glicério, um dos mais importantes dirigentes do PRP,\ninstando-o a aproveitar qualquer movimento militar que surgisse para\ndesfechar um golpe decisivo no regime, e respondeu que ainda não era o\nmomento oportuno. No mesmo mês, os republicanos gaúchos se declararam\npreparados para a revolução. Começava-se a admitir, no interior do\nPartido Republicano, a hipótese de apoiar um movimento militar para\ndepor a monarquia.\n\nEm maio de 1889, o Congresso Republicano, reunido em São Paulo,\nconsagrou a tese, da qual Quintino era o mais expressivo defensor, de\nque se deveria privilegiar uma campanha doutrinária pela imprensa como\ncaminho para o advento gradual da República. Entretanto, ele mesmo\nadvertiu seus correligionários para a eventualidade de terem de recorrer\nà ação armada para atingir os objetivos do partido. De comum acordo, os\nmembros do conselho federal pediram demissão de seus cargos e Quintino\nfoi eleito chefe nacional. Essa decisão implicou a derrota da corrente\nliderada por Silva Jardim e integrada, principalmente, pelos dirigentes\nrepublicanos de Pernambuco e Rio Grande do Norte. Ainda em maio, Silva\nJardim declarou que não reconhecia a chefia de Quintino, rompendo com o\npartido. Em fins de julho, novo congresso foi realizado, desta feita em\nJuiz de Fora (MG), comparecendo representantes apenas de Minas Gerais,\nParaná, Rio de Janeiro, Santa Catarina e São Paulo. O evento não deixou\nregistros.\n\nEm outubro de 1889, Quintino procurou Benjamin Constant, agora\ntenente-coronel, para conversar sobre o momento político. No encontro,\nrealizado no dia 26, foi acertado um plano de contatos com outros\nelementos republicanos, que aconteceriam nos dias seguintes. Convieram,\nainda, que seria importante publicar artigos que acirrassem o ânimo do\nExército contra o governo, atribuindo-lhe medidas contrárias ao moral e\nà economia pessoal dos militares, bem como a seus direitos à\nestabilidade e vitaliciedade no cargo. Nos dias seguintes, *O País*\npublicou vários artigos na linha acertada, um dos quais acusava o\ngoverno de pretender reapresentar ao Parlamento a “lei do montepio\nobrigatório”, considerada pelos militares lesiva aos seus direitos e\nbrios. Esse artigo, comentado e endossado em seguida por Rui Barbosa nas\npáginas do *Diário de Notícias*, teve forte repercussão sobre a\noficialidade do Exército.\n\nQuintino participou, na noite do dia 11 de novembro, de uma reunião com\nmilitares e civis envolvidos na conspiração republicana na residência do\nmarechal Deodoro da Fonseca, que anunciou sua adesão à ideia de derrubar\na monarquia. Na ocasião, Quintino foi incumbido de organizar o futuro\nministério republicano. Em novo encontro, fixou-se o dia 20 de novembro\npara a deflagração do levante. Entretanto, instigados por boatos de que\no governo prenderia alguns dos líderes da conspiração, os corpos\nmilitares aquartelados no bairro de São Cristóvão decidiram entrar em\nação. Na madrugada de 15 de novembro, cercaram o Quartel-General do\nExército, onde se encontravam reunidos os ministros. Em poucos minutos a\nforça que guarnecia o prédio foi dominada, sem reação, e logo\nconfraternizou com os rebeldes.\n\nDeposto o governo, Quintino Bocaiúva, Benjamin Constant, Deodoro, Rui\nBarbosa e outros líderes do movimento reuniram-se para discutir as bases\ndo governo provisório republicano, enquanto, na Câmara Municipal, José\ndo Patrocínio, na condição de vereador mais moço, dava por oficialmente\nproclamada a República no Brasil. No dia seguinte, o primeiro número do\n*Diário Oficial da República dos Estados Unidos do Brasil* informava a\ncomposição do governo inaugural do novo regime: Deodoro da Fonseca\n(presidente), Benjamin Constant (Guerra), Aristides Lobo (Interior), Rui\nBarbosa (Fazenda), Eduardo Wandenkolk (Marinha), Quintino Bocaiúva\n(Relações Exteriores, cumulativamente com a Agricultura, Comércio e\nObras Públicas, enquanto o futuro titular, Demétrio Ribeiro, não chegava\ndo Rio Grande do Sul, o que aconteceria no dia 6 de dezembro). Também\nainda não se encontrava no Rio de Janeiro o futuro ministro da Justiça,\nCampos Sales. À tarde, o governo provisório prestou juramento na Câmara\nMunicipal do Rio de Janeiro.\n\nNo Ministério das Relações Exteriores\n\nQuintino substituiu José Francisco Viana no Ministério das Relações\nExteriores e teve como primeira tarefa a negociação do reconhecimento\ndiplomático do novo regime. Em dois meses, praticamente todos os países\nda América e da Europa já haviam normalizado as relações oficiais com o\nBrasil.\n\nSimultaneamente, reabriu as negociações em torno da região de Palmas, a\noeste dos atuais estados do Paraná e de Santa Catarina, cuja posse vinha\nsendo objeto de disputa com a Argentina desde 1857. Imbuído do espírito\nde solidariedade americana que caracterizava grande parte dos líderes\nrepublicanos desde o manifesto de 1870, tratou com a Argentina de\nmaneira que se afastava do tradicional clima de rivalidade presente nas\nrelações entre os dois países durante o Império. As tratativas\nresultaram no Tratado das Missões, ou Tratado de Montevidéu, assinado na\ncapital uruguaia em 25 de janeiro de 1890. Visto como uma vitória pelos\nargentinos, o acordo despertou amplas e intensas reações desfavoráveis\nno Brasil. Quintino foi alvo de várias acusações, entre as quais a de\nter entregado ao país vizinho territórios sobre os quais o Brasil teria\nlegítimo direito de propriedade. De quebra, explicava-se essa suposta\nbenevolência pela origem argentina de sua mãe. Para defendê-lo, seus\ncolegas ministros decidiram, em março, que eram responsáveis\ncoletivamente por todas as decisões políticas do governo provisório. O\ntratado seria, contudo, recusado pela comissão especial da Câmara dos\nDeputados em 6 de agosto de 1891. Considerando que, pelos seus termos, o\nBrasil abria mão de territórios legitimamente seus, a comissão\nrecomendou que os deputados não lhe dessem sanção. Quintino iria à\nCâmara em duas ocasiões explicar as negociações, acabando por concordar\ncom o parecer da comissão, que, contra apenas cinco votos, seria\naprovado na Câmara em 10 de agosto. Em 1895, o litígio seria resolvido\ndefinitivamente, em favor do Brasil, por arbitragem do presidente\nestadunidense Grover Cleveland.\n\nQuintino coordenou, também, a participação brasileira na Conferência dos\nEstados Independentes da América, convocada pelos Estados Unidos e em\nandamento na cidade de Washington desde outubro de 1889. Estavam\npresentes 17 países do continente, registrando-se apenas a ausência da\nRepública Dominicana, que já havia feito um acordo em separado com o\npaís anfitrião. A mudança de regime político implicou a substituição do\nrepresentante brasileiro, Lafayette Rodrigues Pereira, nomeado ainda\npelo imperador, por Salvador de Mendonça, então cônsul geral em Nova\nIorque. As instruções recebidas pela delegação brasileira, no sentido de\nentender-se com a norte-americana em todos os pontos possíveis, eram\ncoerentes com a perspectiva dos republicanos históricos, que pretendiam\nreorientar a atuação do país no cenário internacional reduzindo o peso\ndas conexões europeias e colaborando na formação de um eixo americano.\n\nA conferência discutiu, entre outros pontos, a criação de uma moeda\ncomum para as transações comerciais entre os países do continente; a\nformação de uma união aduaneira; a definição de regras comuns para o\ndireito de porto; a adoção do sistema métrico decimal nas alfândegas\npelas nações americanas que ainda não o houvessem feito; a instituição\nde práticas bancárias interamericanas e a criação do Banco Internacional\nAmericano. Recomendou-se, também, a adoção dos tratados sobre\npropriedade literária e artística, patentes e marcas, celebrados pelos\njuristas reunidos no Congresso Sul-Americano de Montevidéu entre 1888 e\n1889. Apesar do empenho dos Estados Unidos em estabelecer normas que\nconsagrariam a sua hegemonia econômica no continente, a conferência,\nencerrada em 19 de abril de 1891, resultaria apenas na criação de um\nescritório de distribuição de informações comerciais sobre os países,\nsubordinado ao governo norte-americano.\n\nEm 25 de maio de 1890, Quintino foi beneficiado por uma premiação\ncoletiva decidida pelo chefe do governo provisório, que, por decreto,\ntornou generais de brigada todos os ministros civis, como reconhecimento\nde “serviços prestados à pátria”. No início do segundo semestre do ano,\ncandidatou-se a senador pelo estado do Rio de Janeiro na Assembleia\nNacional Constituinte. Com a exceção de Benjamin Constant, todos os\nministros do governo provisório disputaram as eleições. Realizado o\npleito em 15 de setembro, foi eleito, sendo empossado em 15 de novembro.\nOs registros dos trabalhos na fase em que se discutiu o projeto\nconstitucional preparado pelo governo provisório apontam sua presença na\nmaioria das sessões, mas sem discursar ou intervir em debates. Teve,\nporém, como membro da Comissão de Constituição, Poderes e Diplomacia,\nintensa participação nas discussões sobre o regimento da Assembleia.\n\nEm janeiro de 1891, abriu-se uma crise no governo provisório, decorrente\nda insistência do marechal Deodoro da Fonseca em deferir o pleito que\nvinha fazendo um amigo seu para que lhe fosse concedida garantia de\njuros para a construção e exploração de um porto em Torres, no Rio\nGrande do Sul. O pedido encontrou resistência generalizada entre os\nministros. Quintino, embora considerando a obra importante, acompanhou\nos colegas na posição contra a concessão de juros. Irredutíveis o chefe\ndo governo e seus ministros, o impasse se resolveu com a renúncia\ncoletiva do ministério em 20 de janeiro de 1891. Ao deixar a pasta, em\nque seria substituído por Justo Leite Chermont, faltava à República ser\nreconhecida por apenas quatro países. Dez dias depois, foi firmado o\nAcordo Aduaneiro com os Estados Unidos da América, que também vinha\nsendo negociado desde o Império e assinalou a transição da política\nexterna brasileira no sentido pan-americano e da subordinação à\npreponderância estadunidense.\n\nQuando, ainda durante os trabalhos da Assembleia Nacional Constituinte,\nse iniciaram as negociações para a eleição dos futuros presidente e\nvice-presidente da República, a serem escolhidos pelo voto dos deputados\ne senadores constituintes, o nome do marechal Deodoro da Fonseca\ndespontou como a alternativa situacionista, tendo como companheiro de\nchapa o vice-almirante Eduardo Wandenkolk. Floriano Peixoto\ncandidatou-se a vice-presidente na chapa oposicionista, encabeçada por\nPrudente de Morais, presidente da Constituinte. Promulgada, em 24 de\nfevereiro de 1891, a primeira Constituição republicana, no dia seguinte\nse realizaram as eleições, em ambiente de grande tensão, provocada por\nboatos segundo os quais a guarnição militar fecharia o Congresso se\nDeodoro perdesse. Deodoro saiu vitorioso e Floriano Peixoto foi o mais\nvotado para vice-presidente. Como a legislação permitia a eleição de\ncandidatos de chapas diferentes, Deodoro e Floriano foram consagrados,\nrespectivamente, os primeiros presidente e vice-presidente\nconstitucionais do Brasil republicano, e foram empossados no dia 26. Em\nseguida, a Assembleia Nacional Constituinte se transformou em Congresso\nordinário, iniciando-se a primeira legislatura em 15 de junho.\n\nNo Senado\n\nTratado pelos seus pares como “Patriarca da República”, Quintino foi um\ndos republicanos históricos que, no Senado, se preocuparam, em agosto de\n1891, com a situação que poderia se configurar no caso de morte do\npresidente e do vice-presidente, ambos em delicado estado de saúde.\nDesconfiavam do seu principal assessor político, o barão de Lucena, de\nrecente conversão ao campo republicano. Chegou-se a discutir a hipótese\nde, no caso de impedimento dos dois, Quintino ficar encarregado de\norganizar um novo governo. Abertas as negociações com Lucena em torno de\numa reestruturação ministerial, sua disposição de reservar apenas duas\npastas para os republicanos históricos não alcançou apoio consensual\nentre eles, e Quintino, que reassumiu o posto no jornal *O País* em\nsetembro, foi o autor da proposta final, de rejeição do acordo com o\nlíder deodorista.\n\nSofrendo contestações no Parlamento e na caserna e com problemas de\nsustentação em estados importantes, como Minas Gerais e São Paulo,\nDeodoro dissolveu o Congresso no dia 3 de novembro de 1891, esperando\nreverter a situação. A medida, inconstitucional, foi logo apelidada de\n“Golpe Lucena”. No dia seguinte, Deodoro decretou o estado de sítio para\no Distrito Federal e Niterói. Em manifesto aos brasileiros, explicou sua\natitude argumentando com a necessidade de retificar a Constituição,\nprincipalmente para fortalecer os poderes do Executivo da União. Para\nisso, convocou eleições para novo Congresso constituinte. Em resposta, o\nCongresso Nacional lançou, no mesmo dia e assinado por 114\nparlamentares, um manifesto à nação brasileira, denunciando a violência\ndo governo. Pouco tempo depois, estava estruturada a resistência em\nvários estados, entre setores militares e no meio sindical de Santos\n(SP) e da capital federal. No dia 21 de novembro, os ferroviários\ndeflagraram uma greve no Rio de Janeiro. Quintino, embora, como\ndeclararia publicamente anos depois, se mantivesse à margem das\narticulações que se desenvolviam para reverter o golpe, foi preso no dia\n22, juntamente com outros parlamentares considerados de oposição. A\nreação militar iniciou-se na madrugada seguinte, com a revolta de\nunidades da Marinha fundeadas na baía da Guanabara, apoiadas por\ncontingentes do Exército em terra. Doente, Deodoro ainda esboçou uma\nreação, mas acabou renunciando nessa mesma manhã, transferindo o cargo\npara o vice-presidente Floriano Peixoto.\n\nQuintino, alegando não querer dar margem à acusação de que devia seu\nmandato de senador à influência de Deodoro, renunciou em 17 de dezembro.\nRetornando oficialmente à direção editorial de *O País*, apoiou o\ngoverno de Floriano, cuja legalidade era questionada pela oposição, que\nsustentava a necessidade de nova eleição para presidente.\n\nEm agosto de 1892, ano em que desposou Ana Bianca Rossi, italiana com\nquem teria oito filhos, reelegeu-se para o Senado na vaga aberta pela\nsua própria renúncia. Integrou, em 1893, a Comissão de Finanças da casa,\ne em 8 de julho liderou, com Francisco Glicério e Aristides Lobo, a\nreunião de fundação do Partido Republicano Federal. Realizada a\nconvenção partidária, seu nome foi o mais votado para compor a comissão\nexecutiva provisória, seguindo-se os de Glicério, Aristides Lobo,\nRaimundo Nina Ribeiro, Artur Rios, Joaquim José de Almeida Pernambuco e\nJoão Cordeiro. Primeira tentativa de criação de um partido de âmbito\nnacional na república, o PRF se organizou em torno de um programa de\ncinco pontos: defesa da Constituição de 1891; luta pela liberdade\neleitoral e pela difusão do ensino popular; afirmação da autonomia dos\nestados; reerguimento do crédito público e colaboração irrestrita na\nprática das liberdades constitucionais. Em 30 de agosto, foi eleito\ntambém para a comissão executiva do Partido Republicano Fluminense\n(PRF), juntamente com Bento Carneiro de Almeida Pereira, Alberto Torres,\nPaulino José de Sousa Júnior, Adolfo Pereira de Burgos Ponce de Leon,\nFrancisco Santiago e Ernesto Brasílio.\n\nDiante da rebelião contra o governo federal deflagrada em 6 de setembro\nde 1893, sob a liderança do contra-almirante Custódio José de Melo −\nex-ministro da Marinha, da Guerra e das Relações Exteriores −, e que\nficaria conhecida como Revolta da Armada, encabeçou, uma semana depois,\na lista de signatários do manifesto de senadores em defesa de Floriano\nPeixoto, acusado de ditador e de fomentador da Revolução Federalista,\nguerra civil que estourara no ano anterior no Rio Grande do Sul. Durante\ntrês meses, ocorreram combates na baía da Guanabara e no litoral\nfluminense. O bombardeio da capital federal e a intervenção de nações\nestrangeiras que tinham navios fundeados na baía criaram condições para\num acordo em 5 de outubro de 1893, pelo qual os revoltosos cessariam o\nataque à cidade e Floriano não tomaria iniciativas contra eles, parando\nde armar-se. Embora permanecesse o estado belicoso, a revolta estagnou,\nrestringindo-se a embates nas águas da baía sob supervisão de\ntestemunhas situadas em um navio de guerra estrangeiro. Com a adesão do\nalmirante Luís Filipe Saldanha da Gama à revolta, o comando no Rio de\nJaneiro passou às suas mãos, e Custódio de Melo dirigiu-se para o Sul,\ncom o objetivo de unir-se aos federalistas gaúchos. Reorganizada a\nesquadra revoltosa e tomando o governo a ofensiva, o conflito entrou em\nfase ainda mais violenta. Finalmente, dadas a precariedade do material\nbélico de que dispunham e a impossibilidade de sair pela barra rumo ao\nalto-mar, em 13 de março de 1894 os revoltosos buscariam asilo em navios\nportugueses, depois que o governo sequer aceitou discutir suas condições\nde paz.\n\nO Partido Republicano Federal defendeu a candidatura de Prudente de\nMorais à presidência da República, vitoriosa no pleito realizado em 1^o^\nde março de 1894. Nas eleições legislativas realizadas na mesma data,\nQuintino foi reeleito para o Senado. Durante esse mandato, presidiu a\nComissão de Constituição, Poderes e Diplomacia. Quando, no ano seguinte,\no presidente empreendeu os esforços finais para terminar a guerra civil\nno Rio Grande do Sul, Quintino se opôs à sua política em relação aos\nfederalistas. Alinhando-se com aqueles que, como Francisco Glicério e o\nlíder republicano gaúcho José Gomes Pinheiro Machado, em nome do\nrespeito ao rigor com que Floriano Peixoto enfrentara o conflito,\ndefendiam a rendição incondicional dos rebeldes, emitiu, em junho,\nparecer contrário ao projeto que lhes concedeu anistia, afinal tornado\nlei em outubro. Foi contrário, também, ao Protocolo de Pacificação\nfirmado entre o governo e os federalistas em 10 de julho, que preparou a\npaz definitiva, alcançada no mês seguinte.\n\nÀ frente d’*O País*, passou a fazer oposição aberta ao governo federal,\nmas, dizendo-se desiludido com a política, recolheu-se em 1896 à sua\nfazenda em Pindamonhangaba (SP), embora sem renunciar ao mandato ou\nlicenciar-se no Senado. Diante da cisão do Partido Republicano Federal,\nocorrida em maio de 1897, permaneceu na agremiação, integrando, com\nPinheiro Machado e Francisco Glicério, a corrente que manteve a direção\ndo partido por meio da comissão renovada em 23 de junho, para a qual os\ntrês foram eleitos, com Tomás Delfino, Joaquim Pernambuco, Joaquim\nGonçalves Ramos, Pedro Velho e Lauro Müller. Combatendo Prudente de\nMorais no Senado e nas páginas de *O País*, articulou-se com civis e\nmilitares que acabaram por tentar assassiná-lo em 5 de novembro de 1897,\nepisódio em que morreu o ministro da Guerra, marechal Carlos Machado\nBittencourt. Por motivos de saúde, Quintino obteve, nesse mesmo mês,\ndispensa da Comissão de Constituição, Poderes e Diplomacia. Permaneceu,\nporém, na oposição, recusando o candidato do presidente à sua sucessão,\nCampos Sales, então à frente do governo de São Paulo. Seu nome,\njuntamente com o de Júlio de Castilhos, esteve entre os oposicionistas\nindicados para disputar a eleição, mas a maioria optou pelo de Lauro\nSodré, ex-governador do Pará. Realizado em 1^o^ de março de 1898, o\npleito foi vencido por Campos Sales.\n\nDe volta ao Senado, foi eleito membro da Comissão de Finanças em maio de\n1898. Durante o governo de Campos Sales (1898-1902), que, antes mesmo de\nempossado, declarara desejar vê-lo como seu sucessor, Quintino, alegando\ndivergências de interpretação quanto à doutrina republicana, se oporia à\n“política dos governadores”, concebida pelo presidente para, apoiando-se\nnas correntes dominantes nos estados, garantir alguma estabilidade ao\nsistema político nacional, abalado por violentas disputas, em todos os\nníveis, entre facções adversárias. Embora tivesse divulgado um manifesto\nem que afirmava não desejar novo mandato, foi reeleito senador em 30 de\ndezembro de 1899.\n\nPresidente do Estado do Rio De Janeiro\n\nAinda em fins de 1899, Quintino Bocaiúva teve seu nome apresentado por\nCampos Sales e Nilo Peçanha como alternativa de conciliação entre as\ncorrentes políticas fluminenses que disputavam acirradamente a sucessão\nde Alberto Torres (1897-1900) na presidência do estado do Rio de\nJaneiro. Anunciada em 22 de junho de 1900 pelo PRF, sua candidatura\nrecebeu o apoio do Partido Autonomista e do Partido Republicano do Rio\nde Janeiro (PRRJ), que já havia lançado o nome de Hermogêneo Silva, mas\no retirou da disputa. Candidato único, foi eleito em 8 de julho, tendo\nFrancisco Rangel Pestana, Antônio Augusto Pereira Lima e Antonino Fialho\ncomo vice-presidentes. Em seguida, integrou, em outubro, a comitiva que\nacompanhou Campos Sales a Buenos Aires, em viagem de retribuição à\nvisita do presidente Júlio Roca fizera ao Brasil. Foi o encarregado de\nresponder à saudação com que o presidente do Senado argentino recebeu os\ncongressistas brasileiros. Após renunciar ao Senado mais uma vez, foi\nempossado no Executivo fluminense em 31 de dezembro de 1900. No ano\nseguinte tornou grão-mestre do Grande Oriente do Brasil, posto mais\nelevado da hierarquia da ordem maçônica, que ocuparia até 1904.\n\nMal iniciara o governo no estado do Rio de Janeiro, em março de 1901\nQuintino teve seu nome indicado pelo PRF para a sucessão de Campos\nSales. Recebeu o apoio do PRRJ, do Clube Republicano Quintino Bocaiúva,\nfundado em setembro na sede da Sociedade Aliança Operária, em Niterói,\nda União Operária, da União Cívica Quintino Bocaiúva, do Clube Popular\nde São Cristóvão e da Loja Maçônica de Batatais (SP), mas não das\ncorrentes políticas dos outros estados. A convenção nacional realizada\nno Rio de Janeiro em 20 de setembro consagrou a candidatura de Francisco\nde Paula Rodrigues Alves, de São Paulo. Apenas a representação\nfluminense, com Nilo Peçanha à frente, sustentou seu nome. Dias depois,\na Assembleia Legislativa do Estado do Rio de Janeiro aprovou uma moção\nde apoio à sua candidatura, seguindo-se, em 1902, novas manifestações no\nmesmo sentido por parte da comissão executiva do PRF e do diretório do\nPRRJ. Realizado em março, o pleito foi vencido por Rodrigues Alves, com\ncerca de 316 mil votos, contra aproximadamente 23 mil concedidos a\nQuintino.\n\nSeriamente constrangido pela grave situação econômica que o estado do\nRio vinha enfrentando desde meados da década anterior, que combinava\nreflexos da abolição da escravatura, da primeira crise de superprodução\nde café e da progressiva decadência das atividades ligadas ao açúcar,\nQuintino assumiu o governo, segundo suas próprias palavras, como o\n“síndico de uma massa falida”. Para enfrentar a carência de\ntrabalhadores, procurou estimular a imigração estrangeira e, para\ndiminuir a dependência do café, a diversificação agrícola.\n\nDo ponto de vista político, sua administração foi marcada por disputas\nentre facções estaduais em torno da localização da capital, que em 1894\nfora transferida de Niterói para Petrópolis por força das batalhas\ntravadas na baía da Guanabara durante a Revolta da Armada. Atuou em\nfavor do retorno à antiga localização, o que foi feito pela Lei n° 542,\nde 4 de agosto de 1902. Apoiou, ainda, a reforma da Constituição\nestadual de 1892, proposta por várias câmaras municipais fluminenses,\nque se consumaria no governo seguinte.\n\nAo final de seu mandato, fez um balanço totalmente negativo, dizendo-se\no primeiro a reconhecer que havia sido estéril a sua passagem pelo\ngoverno, o que teria acontecido porque todos os “elementos naturais” lhe\nhaviam sido adversos. Como indicador dos problemas não resolvidos,\nmencionou o quadro de desorganização da instrução pública, lamentando\nnada ter podido fazer diante da recusa de professores e funcionários a\ntrabalhar: “Nada se pode exigir daqueles a quem se não paga”.\n\nApós transmitir o governo a Nilo Peçanha em 31 de dezembro de 1903,\nafastou-se dos cargos públicos. Reeleito em abril de 1904 para o Senado,\npreferiu não tomar posse e voltou a se recolher à fazenda de\nPindamonhangaba. Para sustentar-se, e à sua numerosa família, contou com\no auxílio financeiro de Bernardo Caymari até sua morte, em 1907. De\nvolta ao Senado por eleição realizada em janeiro de 1909, foi escolhido,\nem junho, vice-presidente da casa, cargo que exerceria até 1912.\n\nDurante a campanha presidencial de 1910, apoiou a candidatura do\nmarechal Hermes da Fonseca, ex-ministro da Guerra, contra Rui Barbosa,\nlançado pela Campanha Civilista. A competição eleitoral que se travou\nentre os dois candidatos marcou um ponto de inflexão na história\npolítica brasileira, graças, em particular, aos métodos usados por Rui\nBarbosa, que tinha Manuel Joaquim de Albuquerque Lins, então presidente\ndo estado de São Paulo, como candidato a vice-presidente. Enquanto\nHermes se sustentava no prestígio militar e nos dispositivos eleitorais\nde muitos estados, em especial de Minas Gerais, que lhe dera o candidato\na vice-presidente, Venceslau Brás, a campanha de Rui exibiu perfil\ndiverso, refletindo alterações na composição do eleitorado, cuja parcela\nurbana crescia. Os civilistas organizaram caravanas que percorreram o\npaís realizando comícios e mobilizações em ruas e praças públicas.\nInaugurava-se no Brasil um estilo de campanha então conhecido como\n“americano”, distinto daquele até então predominante, restrito a acordos\nfechados entre chefes de máquinas políticas. Realizado em 1^o^ de março\nde 1910, o pleito, de resto marcado por denúncias recíprocas de fraude,\nfoi vencido por Hermes da Fonseca, empossado em 15 de novembro.\n\nPouco tempo depois da posse presidencial, Quintino liderou, com Pinheiro\nMachado, a fundação do Partido Republicano Conservador (PRC), agremiação\npolítica de âmbito nacional destinada a organizar o campo político que\napoiara Hermes da Fonseca. Em reunião realizada em 29 de novembro de\n1910, foi eleito presidente da comissão executiva, integrada também por\nCrispim Jaques Bias Fortes (MG), Urbano dos Santos (MA), Augusto Tavares\nde Lira (RN), Leopoldo Bulhões (GO), José Siqueira Meneses (SE) e\nAntônio Francisco Azeredo (MT). Os nove pontos programáticos\nfundamentais do PRC foram a defesa da Constituição contra projetos\nrevisionistas; da autonomia dos estados; da liberdade eleitoral; da\nestabilidade cambial e monetária, do equilíbrio orçamentário e da\nrevisão do sistema tributário; das atividades econômicas nacionais, por\nmeio da proteção aduaneira; do comércio nacional; dos programas de\nmodernização militar em execução; da liberdade de ensino superior; e de\numa mais perfeita organização civil da sociedade, por meio da decretação\nde códigos e leis necessários.\n\nAinda em 1910, amigos e correligionários seus, considerando precários os\nmeios materiais de que dispunha para viver, organizaram uma subscrição\npara a compra de um imóvel que lhe servisse de residência e constituísse\numa garantia futura para sua família. Coordenada por uma comissão\nformada pelos senadores Pinheiro Machado, Lauro Müller e Vitorino\nMonteiro, no ano seguinte a campanha já arrecadara a quantia considerada\nnecessária para a concretização dos seus objetivos.\n\nQuintino Bocaiúva faleceu em 11 de julho de 1912.\n\nO bairro do Rio de Janeiro onde morava, na freguesia de Inhaúma, foi\nbatizado com seu nome.\n\nPublicou várias traduções de peças teatrais e, além dos trabalhos de sua\nautoria já mencionados, escreveu *Estudos críticos e literários* (1858),\n*Sofismas constitucionais ou O sistema representativo entre nós* (1860),\n*A opinião e a Coroa* (1861), *A comédia constitucional* (1861), *Os\nnossos homens* (1864) e *A família* (drama, 1868). Sobre sua vida foram\nescritos vários trabalhos, entre os quais os de Ferreira Viana Filho,\n*Biografia do senador general Quintino Bocaiúva, chefe da propaganda\nrepublicana brasileira* (1900); de Afonso Costa, *Quintino Bocaiúva*\n(1943); de Hélio Sodré, *Quintino Bocaiúva* (1944); e de Ciro Silva,\n*Quintino Bocaiúva, o Patriarca da República* (1962).\n\nRenato Lemos\n\n**FONTES:** ABRANCHES, J. *Como*; ASSEMB. NAC. CONST. *Anais*\n(1890-1891); BLAKE, A. *Diccionario*; BOHERER, G. *Da monarquia*; BUENO,\nC. *República*; CARONE, E. *República*; COL. BRAS. GENEALOGIA.\nDisponível em: \\<www.cbg.org.br/arquivos\\_genealogicos\\_m\\_06.html\\>.\nAcesso em: 19/1/2011; *Época.* Disponível em:\n*\\<*http://epoca.globo.com/edic/541/Carta-0056.pdf\\>. Acesso em:\n23/1/2011; LAMARÃO, S. *Crise* (p.97-131); LEMOS, R. *Alternativa* (v.3,\np.401-444)*;* LEMOS, R. *Implantação* (p.25-94); MAGALHÃES JÚNIOR, R.\n*Deodoro* (v.2); *Mensagens do presidente do estado do Rio de Janeiro*,\n1901-1903; MIN. REL. EXT*. Relatório* (*1891*); NASCIMENTO, C.\n*Questão;* SANTOS, L. *Vovó;* SENADO*. Anais* (1890-1891, 1892 - 1899;\n1900, 1909-1912); SILVA, C. *Quintino* (v.1, p.47-102); SILVA, E*.\nQuintino*; SODRÉ, N. *História da imprensa*; TOIGO, D. *Princípios*;\nWITTER, J. *Partido.*\n","ref":"**FONTES:** ABRANCHES, J. *Como*; ASSEMB. NAC. CONST. *Anais*\n(1890-1891); BLAKE, A. *Diccionario*; BOHERER, G. *Da monarquia*; BUENO,\nC. *República*; CARONE, E. *República*; COL. BRAS. GENEALOGIA.\nDisponível em: \\<www.cbg.org.br/arquivos\\_genealogicos\\_m\\_06.html\\>.\nAcesso em: 19/1/2011; *Época.* Disponível em:\n*\\<*http://epoca.globo.com/edic/541/Carta-0056.pdf\\>. Acesso em:\n23/1/2011; LAMARÃO, S. *Crise* (p.97-131); LEMOS, R. *Alternativa* (v.3,\np.401-444)*;* LEMOS, R. *Implantação* (p.25-94); MAGALHÃES JÚNIOR, R.\n*Deodoro* (v.2); *Mensagens do presidente do estado do Rio de Janeiro*,\n1901-1903; MIN. REL. EXT*. Relatório* (*1891*); NASCIMENTO, C.\n*Questão;* SANTOS, L. *Vovó;* SENADO*. Anais* (1890-1891, 1892 - 1899;\n1900, 1909-1912); SILVA, C. *Quintino* (v.1, p.47-102); SILVA, E*.\nQuintino*; SODRÉ, N. *História da imprensa*; TOIGO, D. *Princípios*;\nWITTER, J. *Partido.*\n","dic":"DHBPR"}
