{"title":"BORGES, Frederico Augusto","cargoss":["Deputado federal"],"cargos_esp":[0],"datas_ini":[1891],"datas_fim":[1920],"estados":["CE"],"autor":[0],"content":"**BORGES, Frederico Augusto**\n\n\\* dep. fed. CE 1891-1920.\n\n*Frederico Augusto Borges* nasceu em Fortaleza no dia 7 de abril de\n1853, filho do coronel Vitoriano Augusto Borges e de Umbelina Moreira da\nRocha.\n\nEstudou no Ateneu Cearense, transferindo-se logo após para o Ginásio\nBaiano em Salvador. Daí saiu para cursar a Faculdade de Direito do\nRecife, onde se bacharelou em ciências jurídicas e sociais em 1875.\nEnquanto cursava direito, redigia, juntamente com seus companheiros\nSalvador Muniz e Moreira Alves, o semanário político conservador\n*Autoridade* e colaborava no jornal *A Constituição*, do Partido\nConservador de Ibiapaba (CE). Em 1876 obteve o grau de doutor em\ndireito.\n\nVoltando a Fortaleza, foi promotor público até 1881, quando foi\nexonerado e assumiu o cargo de diretor do jornal *A Constituição*. Em\n1884 elegeu-se deputado geral pelo Ceará, mas, com a dissolução da\nCâmara em 1885 pelo ministério de Cotegipe (1885-1888), mudou-se para o\nmunicípio de Sapucaia (RJ) e aí, além de abrir banca de advogado, fundou\no jornal *Gazeta de Sapucaia*. Redigiu também *A Revista*, do Instituto\nda Ordem dos Advogados Brasileiros.\n\nProclamada a República, elegeu-se continuadamente deputado federal pelo\nCeará a partir de 1891, o que o fez morar no Rio de Janeiro, então\nDistrito Federal. Assumiu também a direção do jornal *O Tempo* e fez\nparte da direção do jornal *Diário do Comércio*, todas funções exercidas\nquando morava no Rio. Foi ainda nomeado professor da Faculdade Livre de\nDireito do Rio de Janeiro, além de sócio-correspondente do Instituto\nHistórico do Ceará. Encerrou seu último mandato na Câmara dos Deputados\nem dezembro de 1920.\n\nFaleceu no Rio de Janeiro em março de 1921.\n\nEntre outros trabalhos, escreveu *Schiller-Guilherme Tell* (carta a\nRocha Lima publicada na *Constituição,* de Fortaleza, em 1872); *Teses e\ndissertações* (apresentadas na Faculdade de Direito do Recife em 1876),\ne *Limites entre o Ceará e o Rio Grande do Norte. Razões finais*\n(publicado na *Revista do Instituto Histórico do Ceará* em 1904).\n\nKleiton de Sousa Moraes\n\n**FONTES:** CÂM. DEP. *Deputados brasileiros;* STUDART, G. *Dicionário*\n(v.1, p.332-334).\n","ref":"**FONTES:** CÂM. DEP. *Deputados brasileiros;* STUDART, G. *Dicionário*\n(v.1, p.332-334).\n","dic":"DHBPR"}
