{"title":"BORGES, Pedro","cargoss":["Deputado federal","Presidente de associação ou confederação de empregados ou empregadores","Senador"],"cargos_esp":[0,0,0],"datas_ini":[1894,1900,1904],"datas_fim":[1900,1904,1917],"estados":["CE","CE","CE"],"autor":[0],"content":"**BORGES, Pedro**\n\n\\* dep. fed. CE 1894-1900; pres. CE 1900-1904; sen. CE 1904-1917.\n\n*Pedro Augusto Borges* nasceu em Fortaleza em 29 de abril de 1851, filho\nde Vitorino Augusto Borges e de Umbelina Rocha Moreira.\n\nFez os estudos preparatórios sob a direção de Abílio César Borges,\nconhecido mais tarde como barão de Macaúbas, e matriculou-se a seguir na\nFaculdade de Medicina da Bahia, pela qual se doutorou em 1873 com a tese\n“Os obstáculos ao parto provenientes do colo do útero e suas\nindicações”. Médico cirurgião do Corpo de Saúde do Exército, onde\ningressou em 1874 como segundo-tenente, chefiava o Hospital de\nJacarepaguá durante o período da seca de 1877-1879, e prestou socorro à\npopulação flagelada. Promovido a capitão em 1885, participou também da\ncampanha abolicionista no Ceará, razão pela qual foi desterrado para a\ncolônia Chopin, no extremo norte do país.\n\nJá após a proclamação da República, foi promovido a major em 1890 e a\ntenente-coronel em 1892. Eleito e reeleito deputado federal, exerceu o\nmandato de 1894 a 1900. Nesse foi escolhido presidente do estado do\nCeará para o quadriênio 1900-1904, sucedendo a Nogueira Acióli.\nInicialmente tentou sair do raio de influência do antecessor, mas acabou\nsendo cooptado por este. Em seu governo aconteceu a primeira grande\ngreve no Ceará, a dos estivadores do porto de Fortaleza. O movimento foi\nbrutalmente reprimido, o que fez com que Pedro Borges perdesse grande\nparte do apoio da população. Ainda na sua passagem pelo governo criou a\nFaculdade Livre de Direito do Ceará em 1903 e solucionou a questão de\nlimites do estado com o vizinho Rio Grande do Norte. Em 12 de julho de\n1904 passou o governo ao sucessor, mais uma vez Nogueira Acióli.\n\nAo deixar o governo foi eleito senador. Renovando o mandato, ocupou uma\ncadeira no Senado durante 13 anos, de 1904 a 1917. Em 1908 foi escolhido\nquarto-secretário da Casa, de 1909 a 1913 foi terceiro-secretário, em\n1914 segundo-secretário, e de 1915 a 1917 primeiro-secretário. Ao longo\ndesses anos recebeu suas últimas promoções na carreira militar: foi\npromovido a coronel em 1908 e a general de divisão em 1912, quando se\nreformou.\n\nMorreu no Rio de Janeiro no dia 11 de setembro de 1922.\n\nEra casado com Ludovina da Rocha Moreira.\n\nKleiton de Moraes\n\n**FONTES:** GIRÃO, V. *Ceará* (p.75-76); GUIMARÃES, H. *Deputados*\n(p.467-468); NOBRE, F. *1001 cearenses* (p.86-87); STUDART, G.\n*Dicionário* (v.1, p.17-18).\n","ref":"**FONTES:** GIRÃO, V. *Ceará* (p.75-76); GUIMARÃES, H. *Deputados*\n(p.467-468); NOBRE, F. *1001 cearenses* (p.86-87); STUDART, G.\n*Dicionário* (v.1, p.17-18).\n","dic":"DHBPR"}
