{"title":"BRAGA, Ramiro Saturnino","cargoss":["Deputado federal"],"cargos_esp":[0],"datas_ini":[1912],"datas_fim":[1923],"estados":["RJ"],"autor":[0],"content":"**BRAGA, Ramiro Saturnino**\n\n\\* dep. fed. RJ 1912-1923.\n\n*Ramiro Ferreira Saturnino Braga* nasceu em Campos (RJ) no dia 13 de\nnovembro de 1876, filho do coronel Antônio Ferreira Saturnino Braga e de\nAntônia Eugênia Torres Braga.\n\nEstudou no Liceu de Humanidades, em Campos, e formou-se na Faculdade de\nMedicina do Rio de Janeiro. A partir de então, passou a exercer a\nclínica médica em sua cidade natal.\n\nNa legislatura 1912-1914, obteve uma cadeira de deputado federal pelo\nestado do Rio de Janeiro, na vaga aberta após a saída do deputado\nFrancisco Portela, que conquistou uma cadeira no Senado Federal. Eleito\nem 19 de novembro de 1912, foi empossado em 21 de dezembro seguinte.\nSucessivamente reeleito para as legislaturas 1915-1917, 1918-1920 e\n1921-1923, pronunciou discursos e emitiu pareceres na Câmara dos\nDeputados que se destacaram pela defesa da moralização do ensino público\nbrasileiro, principalmente o primário.\n\nAlém de ter atuado por longos anos como deputado federal, Ramiro\nSaturnino Braga também exerceu, ao longo da vida, os cargos de\npresidente da Liga Campista contra a Tuberculose e de professor de\nhistória e geografia no Liceu de Humanidades de Campos. Atuou ainda como\njornalista, tendo colaborado para os jornais *Monitor*, *Tempo*,\n*Aurora* e *Campista*.\n\nCasou-se com Maria Adélia Saturnino Braga. Seu filho Francisco Saturnino\nBraga, engenheiro com importante atuação nos setores de saneamento e\nviário, foi deputado federal pelo Rio de Janeiro de 1951 a 1963. Seu\nneto, Roberto Saturnino Braga, foi deputado federal pelo Rio de Janeiro\nde 1963 a 1967, senador de 1975 a 1985, prefeito do Rio de Janeiro de\n1986 a 1989, e novamente senador de 1999 a 2007.\n\nIzabel Pimentel da Silva\n\n**FONTES:** ABRANCHES, J. *Governos* (v.1); CÂM. DEP. *Deputados\nbrasileiros*.\n","ref":"**FONTES:** ABRANCHES, J. *Governos* (v.1); CÂM. DEP. *Deputados\nbrasileiros*.\n","dic":"DHBPR"}
