{"title":"BRANT, MÁRIO","cargoss":["Deputado federal","Deputado federal","Revolucionário ou revoltoso","Presidente do Banco do Brasil","Revolucionário ou revoltoso","Constituinte","Deputado federal","Presidente do Banco do Brasil"],"cargos_esp":[0,0,0,0,0,0,0,0],"datas_ini":[1930,1921,1930,1930,1932,1946,1946,1955],"datas_fim":[1930,1922,1930,1931,1932,1946,1951,1956],"estados":["MG","MG",0,0,0,0,"MG",0],"autor":["Helena Faria"],"content":"BRANT, MÁRIO\n\n\\*dep. fed. MG 1921-1922 e 1930; rev. 1930; pres. Bco Bras. 1930-1931;\nrev. 1932; const. 1946; dep. fed. MG 1946-1951; pres. Bco Bras.\n1955-1956.\n\n*Augusto Mário Caldeira Brant* nasceu em Diamantina (MG) no dia 15 de\ndezembro de 1876, filho de Augusto Afonso Caldeira Brant, descendente de\ntradicional família de contratadores de diamantes, e de Maria Hermínia\nde Caldeira Brant. Também atuaram na política seu irmão João Edmundo\nCaldeira Brant, deputado constituinte estadual em Minas Gerais, João\nMata Machado, deputado federal, Álvaro da Mata Machado, senador\nconstituinte, e Pedro da Mata Machado, deputado federal.\n\nApós frequentar o curso de humanidades no Rio de Janeiro, então Distrito\nFederal, e em Barbacena (MG), matriculou-se em 1895 na Faculdade de\nDireito de Ouro Preto, na época capital de Minas Gerais. Transferindo-se\ndepois para a Faculdade de Direito de São Paulo, colou grau em dezembro\nde 1898. De volta a Minas, assumiu o cargo de provedor de justiça da\ncomarca de Diamantina, em que permaneceu até 1903. Ao mesmo tempo,\nexerceu a advocacia.\n\nEm 1905 transferiu-se para o Rio de Janeiro e foi nomeado delegado da\n5^a^ Circunscrição Policial da cidade. Em 1907 assumiu a chefia do\nserviço de informações da Diretoria de Povoamento do Ministério da\nAgricultura, e em 1911, tendo abandonado o cargo, assumiu a diretoria do\nboletim do Ministério da Viação, até 1917. Durante sua estada na capital\nfederal, deu prosseguimento à atividade jornalística iniciada ainda em\nSão Paulo, colaborando nos jornais *Gazeta de Notícias* e *A Noite* e na\nrevista *Kosmos*. Trabalhou tambémna redação de *O Imparcial*, do qual\nchegou a ser redator chefe.\n\nRetornando a Minas em 1919, fundou o jornal *Estado de Minas*.\nReintegrou-se à política local, e, no ano seguinte, assumiu uma cadeira\nna Câmara estadual, em substituição a Afonso Pena Júnior. Em 1921,\nporém, renunciou ao mandato por ter sido eleito deputado federal na\nlegenda do Partido Republicano Mineiro (PRM). Em 1922 foi nomeado\nsecretário de Finanças pelo presidente de Minas Gerais Raul Soares e\nrenunciou à cadeira na Câmara dos Deputados. Permaneceu na Secretaria de\nFinanças de Minas até 1925, quando, já no governo de Fernando de Melo\nViana, se exonerou por ter sido nomeado diretor do Banco do Brasil. Logo\ndepois, assumiu também uma diretoria da Companhia Sul América de\nSeguros.\n\nEm agosto de 1929, logo depois dos discursos dos representantes de Minas\ne do Rio Grande do Sul na Câmara, marcando o rompimento desses estados\ncom o presidente da República Washington Luís e dando início à campanha\nda Aliança Liberal, exonerou-se do cargo de diretor do Banco do Brasil e\npassou a se dedicar à campanha pela eleição de Getúlio Vargas e João\nPessoa para a presidência e à vice-presidência da República. Em\nsetembro, foi um dos políticos mineiros que participaram, no Distrito\nFederal, da convenção da Aliança Liberal que ratificou essas\ncandidaturas.\n\nNas eleições de março de 1930, foi eleito deputado federal na legenda do\nPRM. No final de abril, foi inteirado da conspiração revolucionária em\ncurso no país, comprometendo-se com a preparação do movimento em Minas\nGerais. No mês seguinte, participou da reunião da comissão executiva do\nPRM em que esta endossou os compromissos formais anteriormente assumidos\npelo presidente de Minas, Antônio Carlos Ribeiro de Andrada, com a\nrevolução.\n\nDurante o período mais intenso de preparação do movimento, tomou parte\nem inúmeras reuniões e encontros para a articulação das ações\nrevolucionárias no estado. Trocou ampla correspondência telegráfica com\nVirgílio de Melo Franco no período em que este permaneceu no Rio Grande\ndo Sul (julho a outubro de 1930), servindo assim como elemento de\nligação entre conspiradores mineiros e gaúchos e procurando coordenar os\nplanos dos dois grupos. Segundo o próprio Virgílio de Melo Franco, Mário\nBrant era também um “habilíssimo criptógrafo amador”, capaz de decifrar\nos despachos trocados pelo governo federal e os comandos militares de\nMinas Gerais que os revolucionários conseguiam interceptar.\n\nNo dia 3 de outubro a revolução eclodiu, e Mário Brant permaneceu na\nSecretaria do Interior, juntamente com Odilon Braga, Djalma Pinheiro\nChagas e Francisco Campos, na coordenação dos movimentos das forças\nrevolucionárias em Minas. Após a vitória da Revolução de 1930, foi\nnomeado, em novembro, presidente do Banco do Brasil, e transferiu-se\npara o Rio de Janeiro.\n\nEm agosto de 1931, a situação política de Minas Gerais agravou-se. O\npresidente do estado, Olegário Maciel, oscilava em relação ao PRM e\nestreitava suas ligações com a Legião Mineira, criada basicamente por\nelementos que só haviam assumido importância na vida política do estado\ndepois da revolução. No dia 15 de agosto, Mário Brant chegou a Belo\nHorizonte, junto com outros correligionários de Artur Bernardes que\nacompanhavam o ex-presidente, para participar de uma reunião do PRM. Na\nocasião revelou-se o favorecimento do secretário da Agricultura, José\nMonteiro Ribeiro Junqueira, pelo governo estadual, o que provocou certa\ncomoção no estado.\n\nNo dia 18 de agosto, houve uma tentativa de deposição de Olegário\nMaciel. A partir desse episódio, acirraram-se as divergências entre o\nPRM e os revolucionários mais radicais, tanto os da Legião Mineira\nquanto, em nível federal, os membros do Clube 3 de Outubro. Em\nconsequência dessa crise, em setembro exoneraram-se da alta\nadministração federal os perremistas Mário Brant, da presidência do\nBanco do Brasil, e Afonso Pena Júnior, da direção de uma das carteiras\ndo mesmo banco, bem como o ministro da Educação Francisco Campos, líder\nda Legião Mineira.\n\nEntretanto, com o desenrolar da crise, promoveu-se o chamado “Acordo\nMineiro”, visando a fundir a Legião com o PRM num partido único, que\ndesse apoio tanto ao governo estadual quanto ao governo federal. Em\nconsequência do acordo, foi fundado, em fevereiro de 1932, o Partido\nSocial Nacionalista (PSN), cujos estatutos foram elaborados por Mário\nBrant. A atividade do PSN, contudo, durou pouco, e logo depois de sua\ncriação Mário Brant e os demais seguidores de Artur Bernardes em Minas\njá mantinham os primeiros contatos com os constitucionalistas de São\nPaulo, conspirando para a derrubada do governo. Com a eclosão da\nRevolução Constitucionalista em julho, Mário Brant procurou inicialmente\ndificultar a ação da Força Pública mineira contra as forças paulistas.\nAo mesmo tempo, fez intensa propaganda em favor dos revoltosos em Belo\nHorizonte. Logo após a derrota do movimento, foi preso e exilado, e teve\nseus direitos políticos cassados.\n\nRetornando ao país, candidatou-se à Câmara dos Deputados nas eleições de\noutubro de 1934 e obteve uma suplência na bancada do PRM. Em 1943,\nintegrava a Resistência Democrática, que procurava aglutinar a oposição\na Getúlio Vargas. Foi um dos signatários do *Manifesto dos mineiros*\n(24/10/1943), uma das primeiras manifestações de oposição da elite\npolítica à ditadura do Estado Novo. Em consequência, devido a pressões\ngovernamentais, foi afastado do cargo de diretor do Banco Hipotecário\nLar Brasileiro, que era uma empresa privada.\n\nEm abril de 1945, participou da primeira reunião do diretório nacional\nda União Democrática Nacional (UDN). Foi então nomeado membro da\ncomissão de estudos administrativos e financeiros, uma das comissões\nconstituídas naquela oportunidade para colaborar na elaboração do\nanteprojeto de estatutos da UDN.\n\nEm dezembro do mesmo ano, foi eleito deputado por Minas Gerais à\nAssembleia Nacional Constituinte na legenda do Partido Republicano (PR),\ncom mandato até janeiro de 1951. Durante seu mandato foi membro da\nComissão de Finanças da Câmara. Em março de 1947 ausentou-se para\nassumir o posto de secretário de Educação e Saúde Pública em Minas\nGerais (governo Milton Campos), cargo em que permaneceu até dezembro do\nmesmo ano. Em novembro de 1949, como chefe da ala liberal do PR, apoiou\no lançamento da candidatura do udenista Mílton Campos à presidência da\nRepública pelo PR.\n\nEntre 1954 e 1956, ocupou por duas vezes a diretoria da Carteira de\nRedescontos do Banco do Brasil, tendo assumido também, interinamente, a\npresidência do banco entre novembro de 1955 e fevereiro de 1956.\n\nMorreu no Rio de Janeiro no dia 2 de dezembro de 1968.\n\nEra casado com Alice Dayrell Brant, que sob o pseudônimo Helena Morley\nescreveu a obra memorialística *Minha vida de menina*. Uma de suas\nfilhas, Inês Caldeira Brant, casou-se com Abgar Renault, ministro da\nEducação e Cultura (1955-1956) e do Tribunal de Contas da União\n(1967-1973).\n\nPublicou *Viagem a Buenos Aires* (1917) e *Catecismo cívico e ilusões\nfinanceiras* (discurso parlamentar).\n\nHelena Faria\n\n**FONTES:**ANDRADE, F. *Relação*; ARQ. GETÚLIO VARGAS; ARQ. MUSEU HIST.\nBANCO DO BRASIL; ARQ. OSVALDO ARANHA; CÂM. DEP. *Deputados*; CÂM. DEP.\n*Relação dos dep.*; CHAGAS, P. *Esse*; CONSULT. MAGALHÃES, B.; Diário do\nCongresso Nacional; DUARTE, P. *Prisão*; FIGUEIREDO, E. *Contribuição*;\nFONTOURA, J. *Memórias*; FRANCO, A. *Escalada*; FRANCO, V. *Outubro*;\nHEILBORN, M. *Oligarquia*; HIPÓLITO, L. *Campanha*; HIPÓLITO, L.\n*Manifesto*; *Ilustração Brasileira* (7/9/1922); LEITE, A. *História*;\nMONTEIRO, F. *Banco*; MONTEIRO, N. *Dicionário*; MORAIS, A. *Minas*;\nNABUCO, C. *Vida*; NOGUEIRA FILHO, P. *Ideais*; *Rev. Arq. Publ.\nMineiro* (12/1976); SILVA, G. *Constituinte*; SILVA, H. *1926*; SILVA,\nH. *1930*; SILVA, H. *1931*.\n","ref":"**FONTES:**ANDRADE, F. *Relação*; ARQ. GETÚLIO VARGAS; ARQ. MUSEU HIST.\nBANCO DO BRASIL; ARQ. OSVALDO ARANHA; CÂM. DEP. *Deputados*; CÂM. DEP.\n*Relação dos dep.*; CHAGAS, P. *Esse*; CONSULT. MAGALHÃES, B.; Diário do\nCongresso Nacional; DUARTE, P. *Prisão*; FIGUEIREDO, E. *Contribuição*;\nFONTOURA, J. *Memórias*; FRANCO, A. *Escalada*; FRANCO, V. *Outubro*;\nHEILBORN, M. *Oligarquia*; HIPÓLITO, L. *Campanha*; HIPÓLITO, L.\n*Manifesto*; *Ilustração Brasileira* (7/9/1922); LEITE, A. *História*;\nMONTEIRO, F. *Banco*; MONTEIRO, N. *Dicionário*; MORAIS, A. *Minas*;\nNABUCO, C. *Vida*; NOGUEIRA FILHO, P. *Ideais*; *Rev. Arq. Publ.\nMineiro* (12/1976); SILVA, G. *Constituinte*; SILVA, H. *1926*; SILVA,\nH. *1930*; SILVA, H. *1931*.\n","dic":"DHBPR"}
