{"title":"BRASIL, Antônio Americano do","cargoss":["Deputado federal"],"cargos_esp":[0],"datas_ini":[1921],"datas_fim":[1923],"estados":["GO"],"autor":["Adrianna Setemy"],"content":"**BRASIL, Antônio Americano do**\n\n\\*dep. fed. GO 1921-1923.\n\n*Antônio Americano do Brasil* nasceu em Bonfim, hoje Silvânia (GO), em\n18 de agosto de 1891, filho de Antônio Eusébio de Abreu e de Elisa de\nAbreu.\n\nIniciou os estudos no Colégio Bonfinense, fundado e dirigido por seu\npai, e prosseguiu-os no Rio de Janeiro, então capital federal, onde\nestudou no Colégio Morel. Em 1911 ingressou na Faculdade de Medicina do\nRio de Janeiro e formou-se em 1917. Nesse mesmo ano retornou a seu\nestado natal, onde ingressou no Exército como oficial médico. Ainda no\nRio de Janeiro, casou-se com Mirtes Caiado de Castro.\n\nEm 1918 iniciou sua vida pública em Goiás como secretário do Interior e\nJustiça no governo do desembargador João Alves de Castro (1917-1921). Em\n1921 elegeu-se deputado federal por Goiás e assumiu o mandato naquele\nmesmo ano. Em 1923, ao findar a legislatura, deixou a Câmara dos\nDeputados.\n\nEm 1925 transferiu-se para Santa Luzia, hoje Luziânia (GO), e aí passou\na se dedicar à medicina, ao magistério e também à advocacia. Em 1931\nfundou e dirigiu a Escola Normal de Luziânia e passou a dedicar-se\ntambém a sericultura. Faleceu em Santa Luzia em 20 de abril de 1932,\nassassinado pelo engenheiro agrônomo Aldovandro Gonçalves. Seus restos\nmortais foram trasladados do cemitério de Santa Luzia para o de Bonfim\nem 10 de julho de 1938.\n\nTendo atuado também como jornalista, poeta, historiador e escritor,\ntornou-se patrono da Academia Goiana de Letras, do Instituto Histórico e\nGeográfico de Goiás e da Academia Goianiense de Letras. Deixou muitos\ntrabalhos publicados, entre os quais se destacam sua tese de doutorado\nna Faculdade de Medicina, *A doutrina endocrinológica* (1917); *No\nconvívio com as traças* (1920); *Questão de limite Goiás – Pará* (1920);\n*Pela terra goiana* (1922); *Pela terra goiana II* (1923); *Puericultura\ne a cultura nacional* (1923); *Cunha Matos em Goiás* *(1823-1826)*\n(1924); *Cancioneiro de trovas do Brasil Central* (1925); *Súmula de\nhistória de Goiás* (1931); *Nos rosais do silêncio* (1947); *Romanceiro\ntrovas populares* (1979), e *Pela história de Goiás* (1980).\n\nAdrianna Setemy\n\n**FONTES:** CÂM. DEP. *Deputados brasileiros*; Projeto de imagem de\npublicações oficiais brasileiras do Center for Research Libraries e\nLatin-american Microfilm Project. *Mensagens dos Presidentes de\nProvíncia (1830-1930).* Disponível em:\n\\<www.crl.edu/content.asp?l1=4&l2=18&l3=33\\>. Acesso em: 8/1/2009.\n","ref":"**FONTES:** CÂM. DEP. *Deputados brasileiros*; Projeto de imagem de\npublicações oficiais brasileiras do Center for Research Libraries e\nLatin-american Microfilm Project. *Mensagens dos Presidentes de\nProvíncia (1830-1930).* Disponível em:\n\\<www.crl.edu/content.asp?l1=4&l2=18&l3=33\\>. Acesso em: 8/1/2009.\n","dic":"DHBPR"}
