{"title":"AGUIAR, João Juvêncio Ferreira de","cargoss":["Constituinte","Deputado federal","Deputado federal"],"cargos_esp":[0,0,0],"datas_ini":[1891,1897,1891],"datas_fim":[1891,1901,0],"estados":[0,"PE","PE"],"autor":["Raimundo Helio Lopes"],"content":"**AGUIAR, João Juvêncio Ferreira de**\n\n\\* dep. geral PE 1868-1875 e1886-1889; const. 1891; dep. fed. PE\n1891-1893e 1897-1901.\n\n*João Juvêncio Ferreira de Aguiar* nasceu em Pernambuco.\n\nFormou-se pela Faculdade de Direitodo Recife e iniciou sua vida\npolíticadurante o Império, quando ingressou nasfileiras do Partido\nConservador. Foi deputadogeral pelo estado de Pernambuco nas\nlegislaturascompreendidas entre os anos de 1868 e1875 e novamente na\nlegislatura 1886-1889.\n\nDepois de proclamada a República(15/11/1889), foi eleito deputado\nconstituinteem setembro de 1890. Assumiu sua cadeiraem 15 de novembro\nseguinte, quando foiinstalada a Assembleia Nacional Constituinteno Rio\nde Janeiro, agora Distrito Federal.Promulgada a nova Carta\nconstitucional em24 de fevereiro de 1891, em junhoseguinte passou a\ncumprir o mandato ordinário.Permaneceu na Câmara dos Deputados\natédezembro de 1893, quando se encerrou alegislatura.\n\nVoltou a ser eleito deputado federalpelo estado de Pernambuco para as\nlegislaturas1897-1899 e 1900-1902. Contudo, não concluiuseu último\nmandato, pois faleceu na cidadedo Rio de Janeiro em maio de 1901.\n\nRaimundo Helio Lopes\n\n**FONTES:** ABRANCHES, J. *Governos*;CÂM. DEP. *Deputados brasileiros*.\n","ref":"**FONTES:** ABRANCHES, J. *Governos*;CÂM. DEP. *Deputados brasileiros*.\n","dic":"DHBPR"}
