{"title":"BRITO, Eugênio Toscano de","cargoss":["Membro de junta governativa"],"cargos_esp":[0],"datas_ini":[1891],"datas_fim":[1892],"estados":["PB"],"autor":["Raimundo Helio Lopes"],"content":"**BRITO, Eugênio Toscano de**\n\n\\*junta gov. PB 1891-1892.\n\n*Eugênio Toscano de Brito* nasceu na cidade de Paraíba do Norte,\nposteriormente chamada João Pessoa, no dia 10 de outubro de 1850, filho\nde Felizardo Toscano de Brito e de Eugênia Acióli Toscano de Brito. Seu\npai foi um dos grandes líderes do Partido Liberal da Paraíba.\n\nFormou-se pela Faculdade de Medicina do Rio de Janeiro em 1879,\ndefendendo tese sobre o beribéri. Durante o curso colaborou com a\nrevista acadêmica de ciências, letras e artes *A Ideia*, ao lado de\nTeixeira de Sousa e Miguel Lemos. Depois de formado, retornou à Paraíba\ne exerceu os cargos de inspetor de Saúde Pública, inspetor do Porto,\nvacinador provincial, médico da Santa Casa de Misericórdia e\ncirurgião-mor da província. Em 1883 tornou-se diretor de Instrução\nPública e em 1884, diretor da Escola Normal. No ano seguinte passou a\nlecionar geometria e trigonometria no Liceu Paraibano e pedagogia na\nEscola Normal. Posteriormente foi professor de ciências físicas e\nnaturais, aritmética, álgebra, biologia e história natural nesses\nestabelecimentos.\n\nIniciou sua vida política ainda durante o Império, quando foi eleito\ndeputado provincial na legenda do Partido Liberal para a legislatura de\n1880 a 1881. Em 1888 fundou o jornal *Gazeta da Paraíba* e nesse\nperiódico, ao lado de Geminiano da Franca, Rodolfo Galvão, Cordeiro\nJúnior e Artur Aquiles, criticou intensamente o Partido Conservador.\nDepois que o marechal Deodoro da Fonseca, sustentado por setores do\nExército e por civis, depôs o gabinete de ministros do Império chefiado\npelo visconde de Ouro Preto e instalou o regime republicano, em 15 de\nnovembro de 1889, atuou na instalação do novo regime em seu estado e\napoiou o governo de Venâncio Neiva (1889-1891).\n\nEm 3 de novembro de 1891, quando o presidente Deodoro da Fonseca, diante\nda crise política que então se manifestava, dissolveu o Congresso\nNacional, a Marinha, apoiada pelos estados de São Paulo, Minas Gerais e\nRio Grande do Sul, iniciou uma revolta na baía de Guanabara. Diante da\nameaça de uma guerra civil, Deodoro renunciou ao cargo no dia 23 do\nmesmo mês, sendo substituído pelo vice-presidente Floriano Peixoto.\nEste, ao chegar ao poder, destituiu os governantes que apoiavam Deodoro,\ncomo era o caso de Venâncio Neiva, que deixou o governo paraibano em 27\nde dezembro de 1891. Em seu lugar assumiu uma junta governativa composta\npor Eugênio Toscano de Brito, o coronel Cláudio do Amaral Savaget e\nJoaquim Fernandes de Carvalho. A junta governou a Paraíba até 18 de\nfevereiro de 1892, quando foi substituída por Álvaro Lopes Machado,\nnomeado presidente do estado por Floriano Peixoto. Quando saiu do poder,\nEugênio Toscano de Brito fundou o jornal *O Paraibano*, que fez forte\noposição ao governo de Álvaro Lopes Machado (1892-1896).\n\nFoi também sócio-correspondente da Sociedade de Medicina Cirúrgica do\nRio de Janeiro e membro da Academia Paraibana de Letras.\n\nFaleceu na cidade de Paraíba do Norte no dia 31 de janeiro de 1903.\n\nFoi casado com Josefina Roy Toscano de Brito.\n\nMuitos de seus trabalhos foram publicados na *Revista do Instituto\nHistórico e Geográfico Paraibano*.\n\nRaimundo Helio Lopes\n\n**FONTES:**BARBOSA, S. *Pequeno*; MARIZ, C. *Apanhados*; MARTINS, E.\n*Tipografia.*\n","ref":"**FONTES:**BARBOSA, S. *Pequeno*; MARIZ, C. *Apanhados*; MARTINS, E.\n*Tipografia.*\n","dic":"DHBPR"}
