{"title":"BRITO, Luís Correia de","cargoss":["Deputado federal","Senador"],"cargos_esp":[0,0],"datas_ini":[1918,1927],"datas_fim":[1926,1930],"estados":["PE","PE"],"autor":["Raimundo Helio Lopes"],"content":"**BRITO, Luís Correia de**\n\n\\*dep. fed. PE 1918-1926; sen. PE 1927-1930.\n\n*Luís Correia de Brito* nasceu em Salvador no dia 21 de julho de 1859,\nfilho de João Correia de Brito e de Cândida Nolasco de Brito.\n\nFormou-se em engenharia na Escola Politécnica do Rio de Janeiro, então\ncapital do Império, em 1880. Depois de formado, trabalhou na Comissão de\nAbastecimento de Águas do Rio de Janeiro e na construção da Estrada de\nFerro Bagé-Uruguaiana, no Rio Grande do Sul. Também atuou na seção de\nhidráulica da Empresa de Obras Públicas do Brasil, quando fez parte da\nComissão de Melhoramentos dos Portos de Sergipe e Pernambuco.\n\nIniciou sua vida política em 1918, quando foi eleito deputado federal\npelo estado de Pernambuco. Assumiu sua cadeira na Câmara dos Deputados,\nno Rio de Janeiro, então Distrito Federal, em maio desse ano, e foi\nreeleito para as duas legislaturas seguintes, permanecendo no exercício\ndo mandato até dezembro de 1926. Durante esse período foi membro das\ncomissões de Finanças, Viação e Obras Públicas, Legislação, Obras Contra\na Seca e Tarifas da Câmara. Em abril de 1927 foi eleito senador.\nAssumindo sua cadeira no Senado Federal no mês seguinte, foi membro das\ncomissões de Obras Públicas e Empresas Privilegiadas e de Finanças.\n\nNo campo jornalístico, colaborou com o jornal *Diário de Pernambuco*.\nFoi também um dos fundadores e diretor da Companhia Industrial\nPernambucana (Fábrica de Tecidos Camaragibe e Usina de Açúcar de\nGoiana).\n\nFaleceu no dia 11 de setembro de 1930, no exercício do mandato de\nsenador.\n\nRaimundo Helio Lopes\n\n**FONTES:** CÂM. DEP. *Deputados brasileiros*; *Grande Encic. Delta\nLarousse*; LEITE NETO, L. *Catálogo biográfico*; NASCIMENTO, L.\n*História* (v.1).\n","ref":"**FONTES:** CÂM. DEP. *Deputados brasileiros*; *Grande Encic. Delta\nLarousse*; LEITE NETO, L. *Catálogo biográfico*; NASCIMENTO, L.\n*História* (v.1).\n","dic":"DHBPR"}
