{"title":"AGUIAR, Sousa","cargoss":["Prefeito"],"cargos_esp":[0],"datas_ini":[1906],"datas_fim":[1909],"estados":["DF"],"autor":[0],"content":"**AGUIAR, Sousa**\n\n\\* militar; pref. DF 1906-1909.\n\n*Francisco Marcelino de Sousa Aguiar* nasceu emSalvador no dia 2 de\njunho de 1855,filho do major baiano Francisco Primode Sousa Aguiar,\nengenheiro militar eprofessor da Escola Militar, e de JoannaMaria Freund\nde Aguiar, austríaca de Viena.O major, que em 1861 fora presidenteda\nprovíncia do Maranhão, faleceu em 1868,deixando viúva e seis filhos.\n\nPor intermédio de sua mãe, Franciscofoi matriculado gratuitamente aos 12\nanosno Colégio Pinheiro e depois no Mosteirode São Bento e no Colégio\nVitório.Em 1869 ingressou como cadete na EscolaMilitar, em 1871 concluiu\nos preparatóriospara o curso superior, e em 1874tornou-se alferes aluno.\nEm 1876 foi promovidoa primeiro- tenente e concluiu o cursode\nengenharia. No ano seguinte assumiuo posto de instrutor geral da\nEscolade Tiro de Campo Grande, no qualpermaneceu até ser promovido a\ncapitãoem 1879. Nesse mesmo ano foi transferidopara a Comissão de\nEngenharia do RioGrande do Sul, e entre 1880 e 1888demarcou as\nfronteiras brasileiras com oUruguai e construiu os quartéis de Bagée São\nGabriel. Também nesse período, em1883, casou-se com Maria Gabriela\nBica.Em 1888, ainda no Rio Grande doSul, recebeu a patente de major\neretornou em seguida ao Rio de Janeiro.\n\nEm 1891 foi promovido a tenente-coronele nomeado comandante do Batalhão\nde Engenharia,onde projetou os quartéis dos Batalhõesde Infantaria e\nCavalaria. Em 1892 foinomeado secretário do ministro da Guerra.Durante\nsua passagem pela secretaria, apedido do marechal Floriano Peixoto,\nprojetouo Hospital Central do Exército, que contavacom oito pavilhões\nisolados, os quaisforam sendo concluídos em etapas, sendoo último\ninaugurado em 1916; décadas depois,o hospital foi demolido. Ainda em\n1892integrou a comissão brasileira durante aExposição Universal de\nChicago, realizada paracomemorar os 400 anos do descobrimentoda América\npelos europeus. Em 1893 pediuexoneração do posto de secretário do\nministroda Guerra.\n\nEm 1894, assumiu a direção geraldos Telégrafos e foi promovido a\ncoronel.Em 1896 tornou-se comandante da EscolaMilitar do Rio Grande do\nSul eem 1897 comandou o Corpo de Bombeirosdo Distrito Federal. Foi autor\ndo projetodo quartel central da corporação, cujasobras foram iniciadas\nem 1898 e concluídasem 23 de maio de 1908. Em 1903deixou o comando do\nCorpo de Bombeirose recebeu a Medalha de Ouro doMérito Militar.\n\nEm 1904 foi presidente da Comissãode Representação do Brasil na\nExposiçãoUniversal de Saint Louis, EUA, na qualobteve o Grande Prêmio de\nArquiteturacom o projeto do Pavilhão do Brasil.Ao concebê-lo inspirou-se\nna arquitetura francesa,empregou elementos neoclássicos e *art\nnouveau*,e para construí-lo utilizou uma estruturatotalmente metálica, o\nque foi consideradouma inovação na época. Ainda nos EUA,a pedido do\nministro do Interior, criouo projeto do edifício da Biblioteca\nNacional.Por solicitação do ministro da Fazenda,estudou a fabricação de\ncédulas para aimplantação dos serviços da Casa da Moeda.Estudou também o\nsistema norte-americano defabrico da pólvora sem fumaça, a pedidodo\nministro da Guerra. Ao retornar aoBrasil, foi promovido a general de\nbrigadae encarregado da construção do edifícioda Biblioteca Nacional,\nque seria inauguradoem 1910, e da remontagem do Pavilhãodo Brasil. O\npavilhão foi remontado nofim da avenida Central, no Rio deJaneiro, e\ninaugurado em 23 de julhode 1906, com o nome de palácioMonroe. Nos anos\nseguintes abrigaria aCâmara dos Deputados, o Senado Federal,o Tribunal\nSuperior Eleitoral e o Estado-Maiordas Forças Armadas, até ser demolido\nem1976.\n\nNomeado pelo presidente Afonso Pena(1906-1909), foi empossado prefeito\ndo DistritoFederal em 16 de novembro 1906, sucedendoa Francisco Pereira\nPassos. Em seu novoposto deparou-se com problemas administrativose\nfinanceiros, entre eles dívidas, obrasinacabadas, salários atrasados,\ncompromissos vencidose contas a pagar até o fim doano de 1906, além dos\ncompromissos contratadospara 1907. A fim de regularizar asituação\nfinanceira da prefeitura, contraiu umempréstimo externo. A Lei\nn^o^1.620, de 31 de dezembro de 1906,que obteve do Congresso Nacional,\nautorizoua prefeitura a solicitar no exterior umempréstimo de no máximo\ndez milhões delibras para quitar as dívidas acumuladas.A Câmara\nMunicipal, por sua vez, tambémautorizou o prefeito a obter\nempréstimosaté o valor citado.\n\nDurante sua gestão, a arrecadaçãode rendas do Distrito Federal e\nopatrimônio municipal cresceram consideravelmente. Algunsavanços na\neducação foram obtidos, coma construção de novas escolas e acontratação\nde professores, o que resultouna ampliação do número de matrículas\noferecidaspela prefeitura às crianças em idade escolar,chegando-se ao\ntotal de 61.414 vagas em1908. Inaugurou-se o Externato Profissional\nSousaAguiar, instituto de educação profissional pararapazes e moças.\nCriaram-se também condiçõespara que a população contasse com umserviço\npúblico de assistência médica maiseficiente, através da inauguração do\nPostode Assistência Central na rua Camerino,em 1907, e do Posto de\nAssistênciada Praça da República, em 1909, umedifício mais amplo e bem\nequipado, queviria a se chamar Hospital Sousa Aguiar.\n\nO prefeito tomou ainda medidasde controle higiênico, sanitário e\necológico,entre as quais a análise da qualidadeda água nas escolas\nmunicipais, a utilizaçãode incineradores de lixo no aterro sanitárioda\nilha de Sapucaia e a proibiçãodo uso de lenha e carvão nas matasdo\ndistrito. Por meio do Decreto n^o^1.134, de 11 de julho de 1908,proibiu\no corte e derrubada das árvoresda mata. Foi responsável por\nregulamentara produção, o transporte e o armazenamentode produtos\ninflamáveis, explosivos e corrosivos.\n\nOutra marca de sua gestão foio estímulo à expansão da cidade nosentido\nZona Sul, isentando de taxas delicença quem construísse em Copacabana,\nLeme,Ipanema e Campo do Leblon. Construiu aavenida Atlântica, concluída\nem 5 de outubrode 1908. Concretizou também a ideia concebidaem gestões\nanteriores de erguer moradiaspara o proletariado, construindo três\nvilasoperárias, a primeira delas na avenidaSalvador de Sá, concluída em\n1908. Jáem 1907 assinara contratos para a construçãode prédios que\nabrigariam operários. Houveaumento considerável no número de\nconstruçõese reconstruções na cidade, bem como maiorfiscalização das\nconcessionárias de transportepúblico pela prefeitura, principalmente no\ntocanteà qualidade do serviço prestado.\n\nApós negociar com a construtoraresponsável pelas obras, Sousa Aguiar\ninaugurouo Mercado Municipal ainda em 1907. Apedido do presidente Afonso\nPena, concebeue conduziu a reforma do palácio Guanabara,reinaugurado em\n1908. Prosseguiu com aconstrução do Pavilhão Mourisco de\nManguinhos(principal prédio da Fundação Oswaldo Cruz),concluiu as obras\ndo Museu Nacional deBelas Artes em 1908 e do TeatroMunicipal em 30 de\njunho de 1909,sendo este inaugurado em 14 de julhoseguinte. Deu\ncontinuidade às obras depavimentação das ruas, promovendo o calçamentode\numa área equivalente a 149.596m².\n\nA Exposição Nacional de 1908, realizadapelo governo federal para\ncelebrar o Centenárioda Abertura dos Portos, teve a intençãode mostrar\naos visitantes uma face desconhecidada cidade: a de uma capital saneadae\nurbanizada graças à contribuição dosprefeitos Pereira Passos e Sousa\nAguiar.\n\nEm decorrência do falecimento dopresidente Afonso Pena, cujo lugar\nfoiocupado interinamente por Nilo Peçanha, SousaAguiar foi substituído\npelo general InocêncioSerzedelo Correia na prefeitura do\nDistritoFederal, deixando o cargo em 23 dejulho de 1909.\n\nEm 1910, exerceu pela última vezum cargo militar no Ministério da\nGuerra,o de inspetor da II Região de InspeçãoPermanente, com jurisdição\nsobre o Paráe Aricari. Em 1911 foi promovido ageneral de divisão e\nreformou-se no postode marechal.\n\nFaleceu em sua residência, na ruaPaissandu, em 10 de novembro de\n1935,deixando viúva Maria Gabriela de SousaAguiar e oito filhos.\n\nCláudia Mesquitta\n\n**FONTES:** ALMEIDA, A. *Vultos*; *Jornal do Brasil* (16/11/1906);\n*Notícia* (4/1, 12-13/8/1908); PINHEIRO,M. *Francisco*; REIS, J.\n*Administrações*.\n","ref":"**FONTES:** ALMEIDA, A. *Vultos*; *Jornal do Brasil* (16/11/1906);\n*Notícia* (4/1, 12-13/8/1908); PINHEIRO,M. *Francisco*; REIS, J.\n*Administrações*.\n","dic":"DHBPR"}
