{"title":"CALASANS, José","cargoss":["Presidente de associação ou confederação de empregados ou empregadores","Interventor"],"cargos_esp":[0,0],"datas_ini":[1892,1930],"datas_fim":[1894,1930],"estados":["SE","SE"],"autor":[0],"content":"**CALASANS, José**\n\n\\*militar; pres. SE 1892-1894; interv. SE 1930.\n\n*José de Calasans* nasceu em Itabaiana (SE) em 27 de agosto de 1863,\nfilho de Francisco Félix Ferreira e de Joana de Góis Ferreira.\n\nAprendeu as primeiras letras em sua cidade natal, assistido por\nprofessores particulares. Vivendo em Aracaju, estudou no Ateneu\nSergipense. Em 1881, transferiu-se para a capital do Império. Sentou\npraça na Escola Militar da Corte, instituição em que fez os estudos\npreparatórios e superiores. Alferes-aluno em 1886, promovido a\nsegundo-tenente em 1889, nesse ano fez o curso de engenharia militar,\nchegando a primeiro-tenente em 1890 e a capitão em 1892.\n\nPrimeiro presidente constitucional de Sergipe, eleito pela Assembleia\nLegislativa com o apoio do grupo político formado por antigos membros do\nPartido Conservador do Império que aderiram à República, entre os quais\nfiguravam Leandro Siqueira Maciel, José Luís Coelho Campos e monsenhor\nOlímpio Campos, tomou posse em 18 de maio de 1892, após a queda de\nDeodoro da Fonseca e a deposição do presidente estadual Vicente Ribeiro.\nEm seu governo, construiu as sedes do Poder Judiciário e do Tribunal da\nRelação. Enfrentou uma epidemia de varíola, tendo ordenado a construção\nde um hospital para atender os doentes. Estruturou a polícia militar\nsergipana, abriu escolas e construiu diversas pontes. Integrou as forças\nlegalistas que combateram o Arraial de Canudos, entre setembro de 1893 e\nmarço de 1894.\n\nNa eleição para o Senado da República em 1894, não atendeu à orientação\ndo presidente Floriano Peixoto para apoiar a candidatura de Manuel de\nOliveira Valadão, preferindo a de Leandro Maciel. Em consequência, teve\nseu governo hostilizado pelo grupo florianista de Sergipe, no qual se\ndestacava Sílvio Romero, que viera do Rio de Janeiro para fazer a\ncampanha de Valadão para o Senado. Meses depois, a situação política\nficaria ainda mais radicalizada em virtude da proximidade das eleições\npara o Executivo estadual, já que Manuel Valadão novamente se candidatou\ne venceu a disputa naquele que foi considerado pelos contemporâneos o\npleito mais violento e fraudulento da primeira década republicana em\nSergipe. Em meio à contenda, José Calasans transferiu a sede do governo\nsergipano de Aracaju para a cidade de Nossa Senhora do Rosário do\nCatete. Esse ato foi visto por seus opositores como de abandono do\npoder. Sílvio Romero, em praça pública, defendeu então a passagem do\ngoverno para o presidente da Assembleia Legislativa, João Vieira Leite,\nfavorável ao grupo valadonista, que foi de fato empossado em 11 de\nsetembro de 1894, antes do término constitucional do mandato de\nCalasans. A situação de duplicidade de poderes instalada nesse momento\nlevou ao surgimento dos apelidos que iriam identificar as rivalidades da\npolítica sergipana na Primeira República: os “pebas”, que ficaram nas\nareias de Aracaju, e os “cabaús”, reunidos na zona dos engenhos de\nRosário Catete. Afinal, Manuel Valadão tomou posse em 24 de outubro.\n\nDeixando Sergipe em 1895, Calasans serviu na Direção Geral das Obras\nMilitares, no Distrito Federal e, meses depois, tornou-se comandante\ngeral da fronteira do Amazonas. No ano seguinte, voltou à direção geral\ndas obras militares do Distrito Federal, cargo que ocupou também em\nSergipe durante o ano de 1898, até novamente obter transferência para o\nDistrito Federal, servindo na Direção Geral de Engenharia Militar entre\n1899 e 1909. Promovido a major em 1906, entre 1909 e 1915 fez parte da\ncomissão de construção da Vila Militar do Rio de Janeiro, como\ncomandante do 1^o^ Batalhão de Engenharia. Combateu o levante dos\nmarinheiros contra os castigos corporais sofridos durante o exercício de\nsuas atividades profissionais, a chamada Revolta da Chibata, liderada\npor João Cândido em 1910. Foi promovido a tenente-coronel em 1911 e a\ncoronel quatro anos depois. Passou à reserva em 1916, como general de\ndivisão.\n\nApós ter apoiado o movimento da Aliança Liberal, que lançou as\ncandidaturas de Getúlio Vargas a presidente da República e de João\nPessoa a vice-presidente, com a vitória da Revolução de 1930 foi nomeado\ngovernador provisório de Sergipe por indicação de José Américo de\nAlmeida, líder civil da revolução no Nordeste. Com a posse de Vargas em\n3 de novembro, escreveu ao chefe do governo provisório pedindo\nafastamento do cargo que ocupava desde 20 de outubro. Com o pedido\nrecusado, tomou posse em 14 de novembro de 1930 como interventor federal\nem seu estado. Não prosseguiu no cargo, passando-o dias depois ao\ntenente Augusto Maynard Gomes, principal liderança do tenentismo\nsergipano na década de 1920.\n\nFoi sócio-fundador do Clube Militar e sócio-correspondente do Instituto\nHistórico Geográfico de Sergipe.\n\nFaleceu em Aracaju em 31 de outubro de 1948.\n\nSérgio Montalvão\n\n**FONTES:** ABREU, A. *Dicionário* (p.934-935); DANTAS, J. *História*;\nGUARANÁ, M. *Dicionário*.\n","ref":"**FONTES:** ABREU, A. *Dicionário* (p.934-935); DANTAS, J. *História*;\nGUARANÁ, M. *Dicionário*.\n","dic":"DHBPR"}
