{"title":"CAMPOS, Bernardo de","cargoss":["Deputado federal"],"cargos_esp":[0],"datas_ini":[1903],"datas_fim":[1905],"estados":["SP"],"autor":[0],"content":"**CAMPOS, Bernardo de**\n\n\\*jornalista; dep. fed. SP 1903-1905.\n\n*Bernardo de Sousa Campos*nasceu em Campinas (SP) no dia 3 de março de\n1869, filho de José de Sousa Campos.\n\nFez os primeiros estudos no Colégio Culto à Ciência, em sua cidade, e os\npreparatórios na capital paulista. Ingressou em 1889 na Faculdade de\nDireito do Largo de São Francisco, diplomando-se em 1893. Logo depois de\nformado, em 1894, no governo de Bernardino de Campos em São Paulo, foi\nnomeado delegado de polícia na capital, chegando a ocupar o cargo de\nchefe de polícia. Em 1898 foi nomeado pelo presidente Campos Sales\n(1898-1902) procurador seccional da República em São Paulo.\n\nNas eleições de 18 de fevereiro de 1903, candidatou-se a deputado\nfederal pelo Partido Republicano Paulista (PRP) e foi eleito. Contudo,\ncomo ocupava o cargo de procurador seccional da República, sua eleição\nfoi impugnada por seu oponente Antônio Manuel Bueno de Andrada.\nReconhecido afinal pela Comissão de Poderes da Câmara dos Deputados,\nexerceu a mandato na legislatura 1903-1905, não se candidatando à\nreeleição. No pleito suplementar de julho de 1906, foi eleito deputado\nestadual pelo PRP na vaga aberta pela renúncia de João Nogueira\nJaguaribe, que fora eleito deputado federal. Em 1907 voltou a concorrer\na um cargo eletivo, sempre pelo PRP: foi eleito vereador à Câmara\nMunicipal da capital, para o período de 15 de janeiro de 1908 a 15 de\njaneiro de 1911. Ao término dos trabalhos legislativos, deixou a\natividade política para dedicar-se exclusivamente à sua banca de\nadvogado e à fazenda que possuía na cidade de Itatiba (SP).\n\nFoi também professor da Escola de Comércio Álvares Penteado. Como\njornalista, fez parte da redação dos jornais *Diário Mercantil*,\n*Correio Paulistano*, *Diário Popular*, *Correio de Campinas* e *Gazeta\nde Campinas*. No *Correio Paulistano* publicou em folhetins dramas e\ncomédias como “Força do acaso” e “Entrando na roça”. Dirigiu ainda o\njornal *A Democracia*, considerado à época um dos maiores defensores da\ncausa republicana. Colaborou também com a *Revista Moderna*, editada em\nSão Paulo, em 1895. Teatrólogo, foi membro da Academia Campinense de\nLetras, da qual é o patrono da cadeira n^o^ 13.\n\nFaleceu em São Paulo no dia 2 de agosto de 1930.\n\nEra casado com Maria Eulália Pinheiro de Campos, com quem teve duas\nfilhas.\n\nPublicou trabalhos jurídicos como *Liberdade profissional e espólio de\nestrangeiros*. Seus *Pareceres apresentados na Comissão de Constituição\ne Justiça da Câmara dos Deputados* foram publicados em forma de livro\npela Imprensa Nacional em 1905.\n\nAntônio Sérgio Ribeiro\n\n**FONTES:** ABRANCHES, J. *Governos*; CALIMAN, A. *Legislativo*;\n*Correio Paulistano* (3/8/1930); VELHO SOBRINHO, J. *Dicionário* (v.2).\n","ref":"**FONTES:** ABRANCHES, J. *Governos*; CALIMAN, A. *Legislativo*;\n*Correio Paulistano* (3/8/1930); VELHO SOBRINHO, J. *Dicionário* (v.2).\n","dic":"DHBPR"}
