{"title":"ALBERNAZ, Bernardo Antônio de Faria","cargoss":["Presidente de associação ou confederação de empregados ou empregadores","Deputado federal"],"cargos_esp":["GO 1891, 1898e",0],"datas_ini":[1901,1903],"datas_fim":[1901,1905],"estados":[0,"GO"],"autor":["Adrianna Setemy"],"content":"**ALBERNAZ, Bernardo Antônio de Faria**\n\n\\* pres. GO 1891, 1898e 1901; dep. fed. GO 1903-1905.\n\n*Bernardo Antônio de Faria Albernaz* nasceu emJaraguá (GO) no dia 22 de\nsetembrode 1847.\n\nAinda durante o Império foi juizde paz, de 1880 a 1882, e\ndeputadoprovincial em Goiás, de 1883 a 1885.Após a proclamação da\nRepública em 15de novembro de 1889, o então presidenteda província,\nEduardo Augusto Montandon, foisubstituído por uma junta governativa\nprovisóriaque tomou posse em 7 de dezembro.A junta governou até 24 de\nfevereirode 1890, quando cedeu o lugar aRodolfo Gustavo da Paixão,\nnomeado presidentede Goiás pelo governo provisório da Uniãochefiado pelo\nmarechal Deodoro da Fonseca.Por decreto do governo provisório de\nagostode 1890, Bernardo Albernaz foi nomeadosegundo vice-presidente do\nestado. De 1890a 1891, foi também presidente da intendênciamunicipal da\ncapital, Goiás Velho.\n\nDesde os primeiros tempos do novoregime, os políticos goianos, numa\ntentativade superar as divergências políticas, organizaram-seem torno do\nCentro Republicano, lideradopelas famílias Bulhões e Caiado, ao\nqualBernardo Albernaz se filiou. Entretanto, asantigas disputas logo\nafloraram e resultaramna formação de dois outros partidos, oPartido\nCatólico, liderado pelo cônego InácioXavier da Silva, e o Partido\nRepublicanoFederal, resultante de uma cisão no CentroRepublicano. O\nrompimento determinou o modocomo os grupos políticos locais se\nalinharam,uns aos militares que estavam no poder,outros às oligarquias\ncafeeiras que lhesfaziam oposição. O Centro Republicano constituiua\nprincipal expressão dos defensores daautonomia estadual e, por esse\nmotivo,se opôs a Rodolfo Gustavo da Paixão,cuja nomeação significou a\nderrota momentâneado poder político local perante o podercentral.\n\nEm 20 de janeiro de 1891,Rodolfo Gustavo da Paixão teve que deixaro\ngoverno de Goiás em vista deum telegrama do Ministério do Interiorque\nlhe concedia exoneração para que realizasseuma missão externa. Durante\nsua ausência,foi substituído por Bernardo Albernaz noperíodo de 21 de\njaneiro a 27 demarço. Sucederam a Albernaz como governadoresinterinos\nJoão Bonifácio Gomes de Siqueirae Constâncio Ribeiro da Maia, até\nqueRodolfo Gustavo da Paixão reassumisse apresidência do estado em 18 de\njulhode 1891.\n\nPor outro lado, concluídos os trabalhosda Assembleia Nacional\nConstituinte e promulgadaa Constituição federal em 24 de fevereirode\n1891, teve início o processo deelaboração das constituições estaduais.\nEm Goiás,diante dos sucessivos adiamentos do iníciodos trabalhos da\nAssembleia Constituinte estadual,uma maioria de 24 deputados se\nreuniuclandestinamente para votar e promulgar, a1^o^ de junho de 1891,\naConstituição do estado. Integrante desse grupo,Albernaz foi signatário\nda Constituição. Aoretomar a presidência em 18 de julho,Rodolfo Gustavo\nda Paixão tentou sem êxitoum acordo e acabou por baixar umdecreto pelo\nqual cassou o mandato dos24 constituintes dissidentes e os\nprocessoupelos crimes de desobediência, sedição eusurpação de funções.\nNo mesmo ato, convocoueleições para o dia 15 de setembroa fim de\npreencher as vagas dosdeputados cassados e manteve a data de15 de\nnovembro para o início dostrabalhos constituintes. Na ocasião foi\neleitopresidente constitucional de Goiás, e assimcontinuou no governo.\nEntretanto, em virtudeda renúncia do marechal Deodoro da Fonsecae da\nposse do vice-presidente FlorianoPeixoto em 23 de novembro, foi\ndestituídoem 7 de dezembro.\n\nNo governo de Francisco LeopoldoRodrigues Jardim, de 1895 a 1898,\nAlbernazvoltou a ocupar o cargo de segundovice-presidente de Goiás. De\ndezembro de1896 a setembro de 1899, foi tambémsecretário da Instrução,\nIndústria, Terras eObras Públicas. Em 9 julho de 1898assumiu mais uma\nvez o governo emvirtude do afastamento do titular e nelepermaneceu até\n1^o^ de novembro.Nessa data tomou posse o novo presidentedo estado,\nUrbano Coelho de Gouveia, quehavia sido eleito no pleito de 20de maio,\nenquanto Albernaz era eleitoprimeiro vice-presidente.\n\nEm 10 de junho de 1901,tendo Urbano Coelho de Gouveia se\nausentado,Bernardo Albernaz assumiu pela terceira vezo governo do estado\naté 12 de agosto,quando tomou posse o novo presidente eleito,José Xavier\nde Almeida. Foi novamenteprimeiro vice-presidente durante o governo\ndeXavier de Almeida (1901-1905), mas renunciouem 1903, quando foi eleito\ndeputado federalpelo estado de Goiás, para a legislatura1903-1905.\n\nFoi também coronel da Guarda Nacional.\n\nAdrianna Setemy\n\n**FONTES:** ABRANCHES, J. *Governos* (v.1);Projeto de imagem de\npublicações oficiaisbrasileiras do Center for Research Librariese\nLatin-american Microfilm Project. *Mensagens dos Presidentes de\nProvíncia (1830-1930).* Disponível em:\n\\<www.crl.edu/content.asp?l1=4&l2=18&l3=33\\>.Acesso em: 8/1/2009.\n","ref":"**FONTES:** ABRANCHES, J. *Governos* (v.1);Projeto de imagem de\npublicações oficiaisbrasileiras do Center for Research Librariese\nLatin-american Microfilm Project. *Mensagens dos Presidentes de\nProvíncia (1830-1930).* Disponível em:\n\\<www.crl.edu/content.asp?l1=4&l2=18&l3=33\\>.Acesso em: 8/1/2009.\n","dic":"DHBPR"}
