{"title":"ALBERTO, João","cargoss":["Revolucionário ou revoltoso","Revolucionário ou revoltoso","deleg mil","Interventor","Constituinte"],"cargos_esp":[0,0,0,0,0],"datas_ini":[1924,1930,1930,1930,1934],"datas_fim":[1924,1930,1930,1931,1934],"estados":[0,0,"SP","SP",0],"autor":["Jorge Miguel Mayer"],"content":"**ALBERTO, João**\n\n\\* militar; rev. 1924; Col. Prestes;rev. 1930; deleg. mil. SP\n1930;interv. SP 1930-1931; ch. pol. DF1932-1933; const. 1934; dir. ger.\nDFSP1945.\n\n*João Alberto Lins de Barros* nasceu em Recifeno dia 16 de junho de\n1897, filhode Joaquim Cavalcanti Leal de Barros ede sua segunda esposa,\nMaria CarmelitaLins de Barros. Embora descendendo detradicional família\nnordestina, seu pai recebiarendimentos como professor do Ginásio\ndoEstado de Pernambuco que asseguravam apenasmodestas condições de vida\nà sua numerosafamília de 15 filhos, cinco dos quaisdo primeiro\nmatrimônio.\n\nJoão Alberto iniciou o curso primáriona escola de Dona Amélia, no\nbairrode Caxangá, em Recife. Dois anos depois,foi expulso devido a um\natrito coma professora, prosseguindo os estudos como pai. Mais tarde\ningressou no GinásioPernambucano e aos 15 anos matriculou-sena Escola\nPolitécnica de Recife. Aos 18anos foi obrigado a interromper o cursopor\nmotivo de doença, o que lhepermitiu obter apenas o título de\nengenheiro-geógrafo.\n\nJá restabelecido da enfermidade, em1918 alistou-se como praça no Quadro\nSuplementardo Exército e logo foi promovido asargento e classificado no\n34^o^Batalhão de Caçadores, na capital pernambucana.Em princípios de\n1919 matriculou-se naEscola Militar do Realengo, no Rio deJaneiro, então\nDistrito Federal, da qualsaiu aspirante da arma de artilharia emjaneiro\nde 1922. Ainda nesse mês, apresentou-seao 1^o^ Regimento de\nArtilhariaMontada, na Vila Militar, no Rio deJaneiro, sendo designado\nsubalterno da 2^a^Bateria, então comandada pelo capitão JoãoBatista\nMascarenhas de Morais. Em abrildo mesmo ano foi promovido a\nsegundo-tenente.\n\nEm março de 1922, realizaram-seeleições para a sucessão de Epitácio\nPessoana presidência da República, disputadas porNilo Peçanha e Artur\nBernardes. Este último,embora não contasse com o apoio dosmilitares,\nsaiu vitorioso. No início dejulho Epitácio Pessoa ordenou o fechamentodo\nClube Militar – que se opuseraà candidatura e oferecia resistência\nàposse de Bernardes –, desencadeando inúmerosprotestos no meio militar.\nJoão Albertoaderiu a essas manifestações no cassinodo seu regimento e em\nseguida participouda preparação de um levante, deflagradoem 5 de julho\nde 1922 na EscolaMilitar, no forte de Copacabana e naVila Militar, no\nRio, e debelado nomesmo dia. Apesar de não ter participadoda sublevação,\nficou confinado durante cincomeses na fortaleza de Santa Cruz,\nondeentrou em contato com outros oficiaisrebeldes, que, sob a liderança\ndo tenenteJuarez Távora, preparavam um novo movimento.\n\nNa Revolta De 5 De Julho De1924\n\nApós sua libertação, João Albertofoi transferido para a guarnição de\nAlegrete(RS), travando conhecimento com outros oficiaisengajados no\nmovimento tenentista, entre osquais o capitão Luís Carlos Prestes,\ndoBatalhão Ferroviário de Santo Ângelo (RS).Em junho de 1923 foi\npromovido aprimeiro-tenente e ainda no mesmo anose casou com Cândida\nFortes. Logo emseguida partiu em viagem de núpcias paraRecife e aí\npermaneceu durante seis meses.Ao retornar a Alegrete, encontrou-se noRio\ncom o capitão Joaquim Távora, queo informou sobre os preparativos de\numlevante em São Paulo e lhe confioualgumas missões. O movimento,\ndeflagrado em5 de julho de 1924 sob a chefiado general Isidoro Dias\nLopes, alcançougrandes proporções, com a ocupação dacapital paulista\npelos rebeldes durante trêssemanas. A ação conjunta das tropas federaise\ndas forças policiais de Minas Gerais,São Paulo e do Rio Grande do\nSulforçou o deslocamento dos revoltosos parao interior, mas as\nrepercussões favoráveisda revolta nesse último estado fizeramcom que, em\n29 de outubro, fossemregistrados levantes nas cidades fronteiriçasde São\nBorja, Uruguaiana, São Luís Gonzagae Santo Ângelo.\n\nEncarregado pelo chefe militar deAlegrete, também adepto da revolta,\ndesimular o corte da ligação ferroviáriacom Uruguaiana, João Alberto\npara lá sedirigiu acompanhando um destacamento da BrigadaMilitar, de\nposições legalistas, comandado pelotenente Larré. Com a chegada ao\nlocalde um reforço revolucionário, prendeu otenente e desarmou seus\npoliciais, propondoem seguida ao comandante do grupo rebeldeque\natacassem Alegrete, o que este recusousob a alegação de que recebera\nordensde aguardar o restante da tropa revolucionária,chefiada por Juarez\nTávora. Em 30 deoutubro, após a chegada de reforços, JoãoAlberto\ncomandou uma unidade no ataquea Alegrete, repelido pela resistência\nlocal.Dirigiu-se então para as barrancas dorio Ibirocaí a fim de\nencontrar-se como resto da tropa e rumar para Uruguaiana.Nessa cidade,\nos revoltosos receberam aadesão de civis liderados por Honóriode Lemes,\nchefe local que se notabilizarana Revolução Gaúcha de 1923. Uma\nsemanadepois, ainda em território gaúcho, voltarama Ibirocaí e\ndeslocaram-se para Quaraíe Guaçuboi, onde sofreram um ataque dasforças\ndo general José Antônio Floresda Cunha. Conseguindo a custo conter\nadebandada de seus soldados, João Albertodeixou os feridos em Uruguaiana\ne seguiupara a Argentina.\n\nDe volta ao Brasil pouco tempodepois, dirigiu-se para São Borja, quese\nencontrava em poder dos revolucionários,e aí combinou com Prestes a\nconcentraçãodas forças revolucionárias na cidade deSão Luís Gonzaga. Na\nmesma ocasião ficouencarregado de contatar o grupo comandadopelo capitão\nAníbal Benévolo, que lutavacontra as tropas legalistas em Itaqui,mas em\nmeio à viagem recebeu anotícia da morte em combate do capitãoe retornou\na São Borja.\n\nNa Coluna Prestes\n\nJoão Alberto chegou a São LuísGonzaga comandando um corpo de mais\ndeduzentos homens e aí juntou-se às forçasremanescentes da revolução,\nconstituindo assimo contingente gaúcho composto de cercade mil militares\ne mil civis praticamentedesarmados que, em 27 de dezembro de1924,\niniciaram a marcha em direção aonorte para fazer a junção com asforças\nrevolucionárias paulistas estacionadas emCatanduvas (PR). Prestes\nassumiu o comandogeral da tropa sulista, dividida em trêsdestacamentos\nentregues à chefia dos tenentesMário Portela Fagundes, João Alberto\neAntônio de Siqueira Campos. Em Tupanciretã(RS), os revolucionários\nreceberam a adesãode cerca de cem voluntários mal armadose liderados\npelo coronel Nestor Veríssimo.Depois de travar combate com as\ntropaslegalistas concentradas na cidade, foram obrigadosa recuar até\nCarazinho, onde receberamde um emissário do general Isidoro aorientação\nde rumar para Foz do Iguaçu(PR) a fim de encontrar os paulistas.\n\nDeixando Nestor Veríssimo no comandodo seu destacamento, João Alberto\njuntou-sea Prestes para ajudar a penosa ocupaçãode Boqueirão da Ramada,\nponto obrigatóriode passagem para o norte, onde osrevolucionários\ntiveram 50 mortos e cemferidos. Outros cem combatentes desertaram\nquandoa tropa chegou a Barracão, na fronteiracom a Argentina e última\ncidade gaúchado trajeto. João Alberto e Siqueira Camposassumiram o\ncomando da vanguarda no deslocamentopara Porto Feliz e Clevelândia, no\nParaná,enquanto o tenente Osvaldo Cordeiro deFarias chefiava a\nretaguarda.\n\nUma parte do contingente gaúchojá havia atravessado o rio Iguaçu\nquandochegou a notícia de que os paulistas,atacados pelas tropas\nlegalistas do generalCândido Rondon, haviam abandonado em 30de março de\n1925 a região de Catanduvas.A travessia foi acelerada, e o\ndestacamentode João Alberto prosseguiu em marcha forçadapara a cidade de\nBenjamim Constant (PR),enquanto Prestes rumava em direção a SantaHelena,\nàs margens do rio Paraná, ondeocorreu o primeiro encontro entre gaúchose\npaulistas. Em reunião realizada no dia12 de abril de 1925, Isidoro\nDiasLopes apresentou um relato pessimista sobreas condições\npolítico-militares de prosseguimentoda luta e sugeriu que tomassem orumo\ndo exílio, mas foi contestado porPrestes e pelo major paulista Miguel\nCosta,defensores de uma estratégia de guerrade movimento. Esse ponto de\nvista prevaleceu,levando à formação da 1^a^ DivisãoRevolucionária, que\nnos anos seguintes percorreriagrandes extensões do território nacional\neficaria conhecida como Coluna Prestes. Isidoro,então com 60 anos, foi\nenviado paraa Argentina por ser muito idoso parao tipo de luta que se\ndesenvolveria.\n\nNa reorganização das forças rebeldes,as tropas gaúchas e paulistas\nformaraminicialmente duas brigadas independentes e todosos oficiais\nreceberam novas patentes, deacordo com suas funções na Coluna.\nMiguelCosta, comandante geral, foi promovido ageneral, Prestes passou a\ncoronel e continuouà frente da Brigada Rio Grande, compostapor cerca de\noitocentos homens divididosem quatro destacamentos sob a chefia\ndostenentes-coronéis João Alberto, Cordeiro de Fariase Siqueira Campos,\ne do capitão AriSalgado Freire.\n\nO destacamento João Alberto foicolocado na vanguarda da tropa\nrevolucionária,que atravessou um trecho do territórioparaguaio e\nreingressou no Brasil em 30de abril de 1925 através do rioIguatemi, ao\nsul de Mato Grosso. Depoisde um combate com o 2^o^Batalhão de Caçadores\n(2^o^ BC)em Pranchita, a Coluna se reagrupou emPonta Porã (MS),\nabandonada pelas forçaslegalistas em pânico. Miguel Costa\npretendiatravar um combate decisivo com o inimigo,mas sua proposta\nencontrou forte oposiçãode Prestes, que alegava inferioridade deforças.\nAcabou prevalecendo este último pontode vista e, pouco depois, a\ncadeiade comando e a estrutura operacional daColuna foram\nreestruturadas, com a indicaçãode Prestes para a chefia do\nestado-maior,a desativação das duas brigadas e aformação de quatro novos\ndestacamentos comandadospor João Alberto, Cordeiro de Farias,Siqueira\nCampos e Djalma Dutra.\n\nO contingente chefiado por JoãoAlberto sofreu um revés em 10 demaio de\n1925, mas conseguiu bater emretirada e reincorporar-se à Coluna, quese\ndeslocava para Goiás perseguida pelastropas do major Bertoldo Klinger.\nNesseestado, o destacamento João Alberto teveimportante participação na\nluta travada emAnápolis, decisiva para dispersar as forçaslegalistas e\npermitir à Coluna penetrarno sertão livre de perseguições\nimediatas.Entre agosto e dezembro, os revolucionáriospercorreram,\nsucessivamente, Minas Gerais, Bahia,Maranhão e Piauí, onde João Alberto\nchegoua flanquear com seus homens a margemesquerda do rio Parnaíba para\ncercar Teresina.Entretanto, diante da enorme concentração detropas\ngovernistas nessa cidade, o comandorevolucionário decidiu suspender a\nmanobra einiciar a marcha em direção ao Ceará,onde a Coluna foi obrigada\na enfrentaros jagunços de Floro Bartolomeu e dopadre Cícero Romão\nBatista.\n\nAtravessando o Rio Grande do Nortee a Paraíba, a Coluna chegou\naPernambuco no dia 12 de fevereiro de1926, pretendendo atacar Recife e\nreceberadesões de unidades militares ali sediadas.O fracasso do levante\nchefiado pelo tenenteCleto Campelo provocou uma mudança deplanos, com a\ncontinuação do deslocamentopelo interior. João Alberto participou\nnessaépoca de diversos combates contra tropasda polícia estadual,\nchefiada por seuantigo comandante, o coronel João Nunes.Depois de\natravessar novamente a Bahiae penetrar em Minas Gerais, os\nrevolucionáriosforam forçados a retornar em direção aoNordeste, já\nbastante desgastados pelo longotempo de marchas e combates. O\nestadogeral dos equipamentos também era bastanteprecário, limitando a\ncapacidade operacionalda tropa, então reduzida a oitocentoscombatentes.\nChegando a Formosa (BA), aColuna tomou o rumo de Goiás, e,depois, Mato\nGrosso, já com a perspectivade uma possível emigração, concretizada em3\nde fevereiro de 1927.\n\nAtuação Clandestina No Brasil\n\nA maior parte da Coluna acompanhouPrestes e se fixou na cidade\nbolivianade La Gaíba, passando a trabalhar nagrande empresa colonizadora\nBolívia ConcessionsLtda., ali sediada. João Alberto, MiguelCosta e\nCordeiro de Farias iniciaram emseguida uma penosa viagem através de\nSantaCruz de la Sierra em direção àcidade argentina de Paso de los\nLibres,para discutir com Isidoro Dias Lopes eoutros exilados os\ndesdobramentos possíveis daatividade revolucionária.\n\nDurante a permanência em Libres,João Alberto recebeu a visita de\nsuamulher Cândida e de seu filho Cláudio,e foi contatado também por\nSiqueira Campos,recém-chegado do Paraguai e disposto aincorporar-se ao\ntrabalho de reorganização dosemigrados. Entretanto, os resultados dessa\natividadeforam decepcionantes, levando ambos a resolver,com o apoio de\nPrestes, voltar clandestinamenteao Brasil e “recomeçar a conspiração\ncomgente nova, sobre quem a auréola dehomem da Coluna tivesse\ninfluência”.\n\nNo Rio de Janeiro, estabeleceramcontatos com o tenente Juraci Magalhãese\noutros jovens oficiais simpáticos àluta revolucionária, mas logo\nconstataram aimpossibilidade de organização de um novolevante. João\nAlberto resolveu então seafastar temporariamente do trabalho\nconspiratórioe, com a falsa identidade de Nélsonde Castro, viajou para\nRecife a fimde visitar a família. A convite deCarlos de Lima Cavalcanti,\nusineiro eproprietário do jornal oposicionista *Folha da Manhã*,fixou\nresidência em Pernambuco, mandou buscarno Rio Grande do Sul sua mulhere\nseu filho e passou a trabalharna usina Pedrosa. Com a descoberta desua\nidentidade em março de 1928, foiobrigado a viajar para o Rio deJaneiro\ne, em seguida, para o RioGrande do Sul, acompanhado da mulher\nemadiantado estado de gravidez. Depois devários sobressaltos, deixou a\nfamília emAlegrete (RS) e conseguiu sair do país,dirigindo-se a Buenos\nAires para encontrarPrestes. Duas semanas depois, recebeu anotícia do\nnascimento de sua filha eresolveu retornar ao país para visitá-lae, em\nseguida, procurar Siqueira Campose Juarez Távora no Rio de Janeiro,onde\nestes tentavam articular um novomovimento que contava com o apoio\ndocapitão Carlos da Costa Leite e tinhacomo quartel-general a casa de\nsaúde dePedro Ernesto Batista. Pouco depois, ogrupo percebeu a\ninviabilidade do projetoe resolveu aguardar a sucessão presidencialde\n1930, prevendo para essa época umaguçamento da crise política nacional.\n\nJoão Alberto retomou a profissãode engenheiro e, novamente com falsa\nidentidade,conseguiu trabalho na construção de rodoviasno interior do\nParaná. Mudou-se entãocom a família para Jaguariaíva, pequenacidade\npróxima à fronteira com São Paulo,onde permaneceu até receber um\nchamadourgente de Prestes para viajar a PortoAlegre. A campanha\npresidencial já estavaem curso, polarizada entre as candidaturasdo\npaulista Júlio Prestes, situacionista, edo gaúcho Getúlio Vargas,\nrepresentante dacoligação oposicionista Aliança Liberal. Algunslíderes\ndessa articulação estavam estabelecendocontatos com os exilados e jovens\noficiaisdas forças armadas para preparar uma alternativarevolucionária\nde tomada de poder casoas expectativas eleitorais fossem\nfrustradas.Depois de discutir esse projeto com OsvaldoAranha e outros\npolíticos aliancistas emPorto Alegre, João Alberto prosseguiu viagematé\nBuenos Aires a fim de encontrar-secom Prestes, que, ao contrário da\nmaioriados seus companheiros, considerava a AliançaLiberal uma frente\nlimitada às classesdominantes e, portanto, incapaz de realizaruma\nrevolução agrária e anti-imperialista. Mesmoassim, João Alberto,\nSiqueira Campos eoutros “tenentes” se integraram na preparaçãodo\nmovimento no Rio Grande do Suljunto com Newton Estillac Leal,\nHerculinoCascardo, Augusto Amaral Peixoto, os irmãosNélson e Alcides\nEtchegoyen e outros.Sua atividade foi intensificada depois davitória do\ncandidato situacionista no pleitode 3 de março de 1930.\n\nNa Revolução De 1930\n\nNos primeiros dias de maio, osantigos líderes da Coluna reuniram-se\nnacapital argentina e tomaram conhecimento daintenção de Prestes de\nlançar um manifestorompendo com a Aliança Liberal e conclamandoo povo à\nluta por uma verdadeirarevolução. João Alberto e Siqueira\nCamposconvenceram-no a esperar mais um mês antesde tomar essa iniciativa\ne obtiveram aadesão do até então indeciso Miguel Costa,que aceitou\nmanter sigilo sobre a reuniãoe combinou sua volta ao Brasil paraajudar a\narticulação revolucionária. Os dois“tenentes” partiram então em um\naviãomonomotor rumo a Porto Alegre, mas aviagem não chegou ao fim, pois\numapane precipitou o aparelho no rio daPrata. Os dois tripulantes\nconseguiram mergulharna água, mas, segundo o relato deJoão Alberto, “mal\nhavia recuperado acalma (talvez decorridos uns dez minutosde nado),\nouvi, perto de mim, ogrito angustiante de Siqueira: ‘Espera,\nJoão!’Voltei-me ainda em tempo de ver, aum metro de mim, ser tragado\nporuma onda”.\n\nJoão Alberto conseguiu nadar atéuma praia uruguaia, enquanto o corpo\ndeSiqueira Campos só foi encontrado diasmais tarde. Em fins de maio,\nJoãoAlberto rompeu definitivamente com Prestes, quelançara pouco antes\nseu manifesto, e,em seguida, criticou duramente a indecisãodas\nlideranças aliancistas, que se negavama deflagrar o movimento apesar da\nconjunturapropícia decorrente da crise econômica emcurso. Irritado,\nretirou-se para Buenos Aires,declarando que só voltaria a Porto\nAlegrequando todos estivessem preparados para aluta. A evolução da\nconjuntura políticabrasileira favoreceu o projeto revolucionário.Com o\nassassinato de João Pessoa em26 de julho de 1930, os ânimosse acirraram,\ne com a adesão dopresidente eleito de Minas, Olegário Maciel,cuja posse\nestava marcada para o dia7 de setembro, as condições materiaispara a\ndeflagração do levante se fortaleceram.Chamado de volta a Porto Alegre\nporOsvaldo Aranha e Maurício Cardoso, JoãoAlberto passou a integrar o\ngrupo decomando da revolução, composto também porPedro Aurélio de Góis\nMonteiro, Virgíliode Melo Franco, Newton Estillac Leal,os irmãos\nEtchegoyen, Augusto Amaral Peixoto,Herculino Cascardo, Pinheiro de\nAndrade, CíceroGóis Monteiro, Ricardo Holl, Adalberto Correiae Luís\nAranha.\n\nOficiais revolucionários e elementos civisdividiram então entre si as\nresponsabilidadesno levante, iniciado pela Brigada Militargaúcha em 3 de\noutubro de 1930,data combinada com as forças de MinasGerais e da Paraíba\ncomprometidas coma revolta. Coube a João Alberto comandaro ataque aos\ndois batalhões de infantariae ao esquadrão de cavalaria sediados nomorro\ndo Menino Deus e guardiães deum imenso paiol, a única grande reservade\nmunição existente no estado. Contandocom o apoio do capitão Argolo,\ndotenente Setembrino Palma e de outros oficiaisque serviam nessas\nunidades, os revolucionáriosobtiveram êxito em pouco tempo,\npermitindoque João Alberto se apresentasse no mesmodia ao chefe da\nrevolução, Getúlio Vargas,no palácio do governo. O Rio Grandedo Sul foi\ncompletamente dominado em 24horas e, com a vitória do movimentotambém em\nMinas e na Paraíba, osrevolucionários passaram a contar com\nimportantesbases para a operação de suas colunas.Os destacamentos\ngaúchos comandados por MiguelCosta invadiram e controlaram rapidamente\nSantaCatarina e, em seguida, o Paraná, avançandoem direção a São Paulo,\nprincipal focode resistência das tropas legalistas. Porordem de Góis\nMonteiro, João Alberto acompanhoua retaguarda desse deslocamento,\npartindo nodia 5 de outubro num trem especialcom cem homens, aos quais\nse somaramem Tupanciretã ex-combatentes da Coluna Presteschefiados por\nNestor Veríssimo. Ao chegara Curitiba, foi informado de que MiguelCosta\nse aproximara da fronteira com SãoPaulo, Alcides Etchegoyen obtivera uma\nimportantevitória contra tropas federais no nortedo Paraná e Vargas\nviajara para PontaGrossa (PR), onde instalaria o novo\nquartel-generalrevolucionário. A principal concentração de\nforçaslegalistas estava na cidade paulista deItararé, ponto necessário\nde passagem parao destacamento de Miguel Costa.\n\nA situação militar evoluía de formaclaramente favorável aos rebeldes em\ntodasas frentes de luta. Nesse contexto, oficiaisde alta patente lotados\nno Distrito Federalarticulavam um golpe militar contra ogoverno,\nfinalmente deflagrado no dia 24de outubro, com êxito. O presidente\nWashingtonLuís foi substituído por uma junta militar,o que, no entanto,\nnão solucionou imediatamentea questão do poder, pois os novosgovernantes\nnão se comprometeram claramente coma posse de Getúlio Vargas,\nreivindicadapelos revolucionários. Além disso, a juntaescolheu militares\npara exercer provisoriamenteos governos estaduais, cabendo ao\ncomandanteda 2^a^ Região Militar (2^a^RM), general Hastínfilo de Moura,\na chefiado Executivo paulista. Seu governo foiefêmero. Na noite do dia\n24, asforças legalistas estacionadas em Itararé renderam-seàs tropas de\nMiguel Costa, e representantesdo Partido Democrático (PD) de São\nPaulo,principal base de apoio da revolução noestado, começaram a\ndiscutir com Vargas,ainda em Ponta Grossa, a nomeação deFrancisco Morato\npara o cargo de interventore a formação de um secretariado compostopor\n“grandes nomes paulistas”. Essa propostado PD encontrava forte oposição\nentreos setores tenentistas, levando Vargas adeixar a questão em aberto.\nComeçava assima prolongada crise política em São Paulo.\n\nNa Interventoria Paulista\n\nNa condição de representante deVargas, João Alberto integrou o grupode\nlíderes revolucionários enviado à capitalpaulista para preparar a\nchegada posteriordo chefe da revolução e buscar umasolução para o\nproblema da reorganizaçãodo poder estadual. Vargas partiu de PontaGrossa\nno dia 25 e, durante a viagem,recebeu a visita de Francisco Morato\nque,apesar da ferrenha oposição de João Albertoe de Miguel Costa, estava\nconfiante emsua nomeação para a interventoria. Emmeio a um vazio de\npoder – poisHastínfilo de Moura já abandonara seucargo – a comitiva foi\nfestivamente recebidana capital paulista no dia 28 deoutubro. As\ndiversas correntes integrantes domovimento vitorioso chegaram em seguida\naum acordo, estabelecendo que, provisoriamente,o Executivo paulista\npermaneceria sem chefe,cabendo a José Maria Whitaker coordenaro\nsecretariado (responsável pelos negócios correntesdo governo), enquanto\nJoão Alberto ficariacomo delegado militar da revolução noestado.\nPretendendo manter o diálogo como PD, Vargas convidou Morato para\noMinistério da Fazenda de seu futuro governo,mas este não aceitou, ainda\nseguro desua indicação para a interventoria paulista.\n\nVargas partiu em seguida para oRio de Janeiro, onde, depois de\nsuperadasas resistências iniciais da junta militar,tomou posse em 3 de\nnovembro àfrente do governo provisório. Nesse mesmodia, Miguel Costa foi\nnomeado comandanteda Força Pública paulista, passando adeter, junto com\nJoão Alberto, o controledas decisões relativas à ordem públicae à\nsegurança no estado, fator depermanente conflito entre as lideranças\ntenentistase as forças políticas tradicionais deSão Paulo. No dia 6,\nPlínio Barreto,homem de confiança do PD, substituiu Whitakerna chefia do\nsecretariado paulista, masa influência de João Alberto se\nfortaleceuatravés da nomeação de muitos militaresligados a ele para\ndiversos órgãos deadministração estadual. Seu prestígio tambémcresceu\njunto às classes média e operária,duramente atingidas pela crise\neconômica emcurso.\n\nJoão Alberto autorizou o funcionamentolegal do Partido Comunista\nBrasileiro –então Partido Comunista do Brasil (PCB)– e a criação da\nSociedade dosAmigos da Rússia; ameaçou confiscar asfábricas que não\ncumprissem as primeirasmedidas sociais decretadas pelo novo\ngoverno(aumento salarial de 5% e redução dajornada semanal de trabalho\npara 40 horas);e, junto com Miguel Costa e coronelJoão Mendonça Lima,\nfundou em 13 denovembro a Legião Revolucionária, voltada paragarantir a\nrealização das reformas reivindicadaspelos “tenentes”, de modo a evitar\nquea revolução representasse apenas “uma derrubadade ocupantes de\nposições para dar lugara um assalto a essas mesmas posições”.Seu decreto\nde 14 de novembro de1930, permitindo ao governo paulista aposentare\nnomear livremente os juízes estaduais,provocou a intensificação dos\nprotestos doPD que temia o crescimento do poderdo delegado militar.\nConsiderando-se ultrapassadopelos acontecimentos, Plínio Barreto\nrenuncioua seu cargo em 25 de novembro,sendo acompanhado por todo o\nsecretariado.Vargas nomeou então João Alberto parao cargo de interventor\nfederal no estadoe, depois de algumas negociações, a renúnciacoletiva\ndos secretários foi provisoriamentesuspensa. Mesmo assim, as\ndivergências seaprofundaram com rapidez. Acusado pelo interventorde usar\nseu cargo para fazer políticapartidária contrária ao espírito da\nrevolução,Vicente Rao, membro do PD, foi demitidoda chefia da Polícia,\nprovocando um novopedido de demissão – desta vez concretizado– de todos\nos secretários. No dia4 de dezembro, João Alberto divulgou acomposição\nde seu novo governo, criandoinclusive uma nova secretaria, a de\nSegurançaPública, confiada a Miguel Costa, queacumulou o novo cargo com\no comandoda Força Pública. Para as outras funçõesde primeiro escalão\nforam chamados Marcosde Sousa Dantas (Secretaria da Fazenda),Artur Neiva\n(Interior), Florivaldo Linhares (Justiça),Edmundo Navarro de Andrade\n(Agricultura) eAlberto Coutinho (Viação), enquanto Luís deAnhaia Melo\npassava a ocupar a prefeiturada capital.\n\nAlém dos conflitos políticos, oestado enfrentava uma grave crise\neconômicae social. A lavoura cafeeira, com seusestoques invendáveis,\nexigia maiores medidasde amparo à sua atividade; a indústriareduzia seu\nritmo de produção; as mobilizaçõesoperárias assustavam as elites\ntradicionais.O início do governo de João Albertocoincidiu com uma greve\noperária em diversossetores, o que motivou uma enérgica proclamaçãosua\ncontrária à continuação do movimentoe a qualquer agitação social. O\nPDainda procurou estabelecer um entendimento como novo interventor,\ndivulgando nota nessesentido em 8 de dezembro. Três diasdepois, João\nAlberto declarou à imprensaque aceitaria de bom grado essa colaboraçãoe\naproveitaria os quadros do partido naadministração estadual. Mas as\ndemonstraçõesde boa vontade não foram suficientes paraimpedir o\nagravamento da crise. A Comissãode Organização Municipal, formada por\nJoãoAlberto, continuou substituindo prefeitos vinculadosàs forças\npolíticas tradicionais, enquanto aDelegacia de Ordem Política e\nSocial,também recém-criada, intensificava a censurae a vigilância sobre\nas atividades políticasno estado – agravando assim dois importantesfocos\nde tensão. No plano nacional, asposições do PD e de João Albertotambém\neram conflitantes. O primeiro defendiaa imediata reconstitucionalização\ndo país, eo interventor era partidário de uma maiorcentralização de\npoderes, participando inclusivedo chamado “Gabinete Negro”, grupo\ndelíderes da Revolução de 1930 que continuavaa se reunir periodicamente\ncom Vargasno palácio do Catete para discutir asituação nacional. Osvaldo\nAranha, Góis Monteiro,José Fernandes Leite de Castro, Ari Parreiras,José\nAmérico de Almeida e Juarez Távoratambém integravam o grupo, que\nliderouem janeiro de 1931 a formação doClube 3 de Outubro, organização\ntenentistade âmbito nacional defensora de um pontode vista centralizador\ne anticonstitucionalista.\n\nEm São Paulo, o crescimento daLegião Revolucionária junto à classe\nmédia,à oficialidade militar e a setores dooperariado acirrou a tensão\nexistente entreessa organização e as forças políticastradicionais,\nespecialmente o PD e o PartidoRepublicano Paulista (PRP). Esse conflito\nevoluiupara uma ruptura, configurada em 24 demarço de 1931, com a\nelaboração domanifesto em que o PD acusava JoãoAlberto de manter no\ngoverno “elementosinconvenientes à tranquilidade geral”,\nperseguir“ilustres paulistas” e estimular as atividadesda Legião\nRevolucionária. O documento defendeuainda a formação de uma frente\núnicaem São Paulo para lutar pela convocaçãode uma assembleia nacional\nconstituinte epela devolução da autonomia estadual. Apedido de Vargas, o\nmanifesto não foidivulgado imediatamente, vindo a público apenasno dia 7\nde abril, depois de umaofensiva de repressão que levou VicenteRao e\noutros líderes do PD à cadeiae provocou a invasão das sedes dopartido e\ndo seu jornal, o *Diário Nacional.* Em protesto contra a política\naplicadapor João Alberto e Miguel Costa, IsidoroDias Lopes pediu\ndemissão do comando da2^a^ RM dois dias depois, masnão foi atendido.\n\nHostilizado pelas forças paulistas tradicionais,João Alberto viajou ao\nRio de Janeiroe, em seguida, a Petrópolis (RJ), ondese reuniu com\nVargas, Osvaldo Aranha eFlores da Cunha. No dia 16 de abril,foi\ndivulgado um sucinto comunicado oficial:“O Governo Provisório decidiu\ndefinitivamentemanter em absoluto o *status quo* em SãoPaulo”.\nDescontentes, oficiais da Força Públicae membros do PD articularam um\nlevantecontra o interventor e o secretário deSegurança. Deflagrado em 28\nde abril de1931 o movimento foi rapidamente sufocadocom a prisão de mais\nde duzentosrevoltosos e a posterior transferência devários oficiais do\nExército para outrasregiões do país, inclusive o general IsidoroDias\nLopes, substituído pelo general GóisMonteiro no comando da 2^a^ RM.\n\nO crescimento da Legião Revolucionáriacausava atritos com diferentes\ngrupos políticose setores sociais. Acusada de comunistapor seus\nadversários conservadores e dedemagógica por Luís Carlos Prestes\n(aindaexilado no Uruguai e já adepto domarxismo), essa organização era\nalvo tambémde desconfiança dos setores mais organizadosda classe\noperária, que não aceitavamo enquadramento da estrutura sindical\nconformeos planos oficiais. O próprio João Albertopassou a temer o\ncrescimento da influênciade Miguel Costa e o poder paralelorepresentado\npela Legião, que conseguiu inclusivecolocar obstáculos à sua política de\naproximaçãocom os produtores de café. Em meadosde 1931, Miguel Costa\nviajou para oRio a fim de solicitar o afastamentode João Alberto, que,\nsentindo-se isolado,pediu demissão no dia 24 de julho.Entre as\nprincipais realizações do seugoverno no terreno da reorganização\nadministrativadestacaram-se a criação de novos órgãosvinculados à\nSecretaria de Agricultura, doConselho Consultivo Econômico, da Diretoria\ndeColonização, do Conselho de Educação eda Faculdade de Ciências\nEconômicas eSociais; a reforma da Escola Normal, doServiço Sanitário do\nEstado e do Departamentode Trabalho Industrial, Comercial e Doméstico;e\na alteração da legislação tributáriado estado.\n\nA Revolução Constitucionalista\n\nMesmo afastado da interventoria, JoãoAlberto continuou a interferir na\nsituaçãode São Paulo, marcada pelo agravamentodo conflito entre\nelementos tenentistas eas forças políticas tradicionais, agora\nrepresentadasno governo de Laudo de Camargo, próximodo PD e empossado em\n25 de julho.Além disso, procurou tornar-se intermediárioentre as\nreivindicações dos plantadores decafé e o governo federal, sendo\nsaudadono Congresso de Lavradores, reunidos emagosto de 1931, como o\n“patrono dalavoura paulista”.\n\nDepois de uma série de conflitos,a situação em São Paulo tornou-se\nmaistensa com a anistia decretada por Laudode Camargo para diversos\npolíticos comprometidoscom a situação anterior à Revolução de1930 e a\nnomeação de juízes afastadosde seus cargos por motivos políticos.O\ngoverno federal forçou a demissão dessesjuízes e, pouco depois, enviou\nJoão Albertoe Miguel Costa para intimarem Numa deOliveira, secretário da\nFazenda, a deporem juízo sobre as acusações de corrupçãoque existiam\ncontra ele. Do ponto devista do ex-interventor, esse episódio\nsignificavatambém uma reafirmação de sua posiçãofavorável aos\ncafeicultores, hostis ao secretárioda Fazenda, que se negara pouco\nantesa suspender suas dívidas com o bancodo estado. João Alberto chegou\na escreverum relatório a Vargas, datado de 4de novembro de 1931,\ndescrevendo a situaçãocrítica da lavoura cafeeira e solicitandomaior\nassistência do governo federal parao setor. Considerando essas medidas\numaviolência contra seu governo, Laudo deCamargo pediu demissão em 13 de\nnovembrode 1931, sendo acompanhado pelo ministroda Fazenda, José Maria\nWhitaker, que seafastou três dias depois.\n\nJoão Alberto e Miguel Costa viajaramentão para o Rio a fim de\ninfluenciara escolha do novo interventor. Depoisde uma série de reuniões\nno paláciodo Catete, obtiveram êxito com a nomeaçãodo coronel Manuel\nRabelo, simpático aotenentismo, o que levou as forças\npaulistastradicionais de volta à oposição, radicalizandosuas posições.\nEm 13 de janeiro de1932 o PD lançou manifesto rompendo como governo\nfederal e conclamando a populaçãoà luta pela imediata\nconstitucionalização dopaís e a devolução da autonomia estadual.Pouco\ndepois, o PRP fez o mesmo,iniciando o processo de união dos doisgrandes\npartidos locais que resultou naformação da Frente Única Paulista (FUP)em\n16 de fevereiro seguinte. Entrevistadopelo jornal *A Noite* três dias\ndepois, JoãoAlberto declarou, em nome do Clube 3de Outubro, que a luta\npela reconstitucionalizaçãoera encabeçada por elementos que\npretendiamdestruir a revolução, mas que, mesmo assim,os “tenentes” não\nafastavam a hipótesede “aceitar esse desafio”, transformar oclube em\npartido político e disputar opoder por meios legais.\n\nA intensificação das manifestações popularespromovidas pela FUP e a\nsimpatia despertadano Rio Grande do Sul e em Minaspelas reivindicações\npaulistas levaram Vargasa preparar um estudo para a\nconstitucionalizaçãodo país, que resultou no código eleitoraldecretado\nem 22 de fevereiro de 1932.Ao mesmo tempo, contrariando João Albertoe\nMiguel Costa, o chefe do governoprovisório começou a preparar a\nsubstituiçãode Manuel Rabelo por Pedro de Toledo,paulista, civil e\npróximo do PRP. Toledofoi empossado em 7 de março, quandoJoão Alberto se\nencontrava no Rio participandode uma reunião do Partido Autonomistado\nDistrito Federal, criado para defenderna futura constituinte a eleição\ndiretado prefeito e a formação de umcorpo legislativo na capital\nsemelhante aoscongressos estaduais. Junto com Pedro Ernesto,Edgar\nRomero, Ernesto Pereira Carneiro eLuís Aranha, João Alberto foi\nindicadopara integrar a comissão executiva dessepartido e, permanecendo\nno Rio, foi nomeadopor Vargas em 15 de abril chefede Polícia do Distrito\nFederal. Nessecargo, criou a Polícia Especial, destinadaa reprimir\ndistúrbios de rua, prendeudiversos políticos acusados de conspirar\ncontrao governo e se manteve atento àevolução da situação paulista, que\nsetornou crítica a partir da formação, em23 de maio, de um secretariado\ncompostoexclusivamente por membros da FUP. Nodia seguinte, Miguel Costa\nfoi reformadoe afastado do comando da Força Pública,enquanto Góis\nMonteiro, pressionado, deixavao comando da 2^a^ RM, levandoJoão Alberto\na defender a nomeação docoronel Manuel Rabelo para este últimoposto, a\nfim de promover a dissoluçãodo governo de Pedro de Toledo ea prisão dos\nlíderes da FUP.\n\nA situação de São Paulo seradicalizou de tal modo que não foipossível ao\ngoverno federal evitar a deflagraçãoda Revolução Constitucionalista em 9\ndejulho, dando início a uma guerra civilde grandes proporções. No começo\ndas operações,o comandante das tropas legalistas nafrente de batalha,\ngeneral Góis Monteiro,combinou com João Alberto a adoção demedidas\npreventivas de segurança na retaguarda,para evitar que as incipientes\nmanifestaçõespúblicas de simpatia aos rebeldes no DistritoFederal\nestimulassem generais descontentes arepetir contra Vargas a atitude\nadotadacontra Washington Luís em 1930. Poucodepois, João Alberto foi\nsubstituído interinamentepelo capitão Dulcídio do Espírito SantoCardoso,\nque ocupou o cargo durante todoo período de guerra civil, encerrada em2\nde outubro com a derrota paulista.\n\nA Constitucionalização Do País\n\nDepois da vitória sobre a RevoluçãoConstitucionalista, Vargas nomeou o\ngeneral ValdomiroLima para a interventoria em São Paulo,com a missão de\npacificar o estadoe promover a conciliação entre o governofederal e as\nforças derrotadas. Segundocarta de José Carlos de Macedo Soaresa Vargas,\na interferência de João Albertorepresentava um obstáculo ao trabalho\ndenormalização, pois este insistia em adotaruma posição repressiva,\nchegando a apresentarao novo interventor listas de proscrições.Macedo\nSoares passou a acusá-lo de “cigano,ambicioso e aventureiro”, afirmando\nque suainfluência continuava viva no estado graçasao “Instituto do Café\ncom seus formidáveisrecursos de dinheiro; ao Departamento dasPrefeituras\ncom seus enormes recursos políticos;à Chefatura de Polícia com seus\nterríveisrecursos de violência”.\n\nApesar da derrota militar dos constitucionalistas,o tenentismo não\nconseguiu se recuperarno estado durante a interventoria do\ngeneralValdomiro Lima, enquanto no plano nacionalVargas confirmava as\neleições constituintes paramaio de 1933, atendendo assim a\numareivindicação dos paulistas derrotados. O Clube3 de Outubro,\norganização tenentista maissignificativa naquele momento, criticou a\nmedida,considerada um “triunfo das velhas máquinasou mesmo das máquinas\nnovas, construídasde peças velhas e pela mesma técnica”.A restauração\nintegral da hierarquia militare o declínio das organizações\ntenentistasficaram evidenciados durante o Congresso\nRevolucionáriorealizado entre 16 e 25 de novembrode 1932, ocasião em que\nos setoresmais radicais dos “tenentes” não tiveramo menor espaço. João\nAlberto participoudo encontro, que resultou na fundaçãodo Partido\nSocialista Brasileiro (PSB), cujoprograma enfatizava a necessidade de\nsobreporos interesses nacionais aos regionais. Noinício de 1933, João\nAlberto e JuarezTávora tentaram dotar os agrupamentos políticosde\ntendência tenentista de uma plataformaúnica em nível nacional, tendo em\nvistaas eleições constituintes. Com esse objetivo,articularam a União\nCívica Nacional, oficialmentefundada em 24 de março de 1933,e tentaram,\nsem êxito, atrair o PSBpara esse projeto.\n\nJoão Alberto retornou à chefiada Polícia do Distrito Federal por umcurto\nperíodo no início de 1933. Ajudouentão a fundar o jornal *A Nação*,\ndestinadoa apoiar o governo Vargas e dirigidoà classe média. Segundo\nFrancisco de AssisBarbosa, os fundos mobilizados para oempreendimento\ntiveram origem, entre outras fontes,no “jogo do bicho” e em uma\nverbasecreta especialmente destinada a apoiar apropaganda do governo nos\nmeios de comunicação.João Alberto deixou a chefia de Políciaem abril de\n1933 para concorrer nomês seguinte à Assembleia Nacional Constituintepor\nPernambuco, na legenda do PartidoSocial Democrático (PSD) local. Eleito,\nparticipoudas sessões preparatórias em que foramexaminados os diplomas\ndos deputados efoi realizada a eleição do presidenteda Assembleia,\ncabendo ao mineiro AntônioCarlos Ribeiro de Andrada a maioria\nabsolutados votos. João Alberto absteve-se devotar, mas, mesmo assim,\nrecebeu oitovotos para o cargo em disputa.\n\nCom o início dos trabalhos constituintesem 15 de novembro de 1933, o\ngeneralGóis Monteiro organizou diversas reuniões entreos militares que\nhaviam sido eleitos,para aumentar sua força na Assembleiaatravés da\ndefesa de uma plataforma comum.João Alberto participou desses encontros,\ncujosdebates giraram principalmente em torno detrês pontos, relacionados\ncom o capítulosobre a defesa nacional: o papel doConselho Supremo de\nDefesa Nacional, ocritério de promoções militares e a manutençãoou não\ndas forças estaduais. Sobre oprimeiro ponto, houve consenso em tornode\nque o conselho deveria ser umórgão político, sem intromissão na\natividadenormal das forças armadas. Sobre os doisoutros assuntos, no\nentanto, houve divergências.Góis Monteiro defendia a preponderância\ndocritério de merecimento sobre o de antiguidadenas promoções, mas sua\nposição foi contestadapor possibilitar uma maior intromissão dapolítica\nna vida militar. Augusto AmaralPeixoto, por sua vez, defendia a\nextinçãodas forças estaduais, enquanto Góis Monteiroe outros eram\nfavoráveis à sua manutençãoem nome da redução dos encargos daUnião.\n\nO início dos trabalhos constituintescoincidiu com uma crise política em\nMinasGerais, onde Virgílio de Melo Franco eGustavo Capanema disputavam a\nnomeação paraa interventoria, vaga desde setembro coma morte de Olegário\nMaciel. João Albertodefendeu o primeiro pretendente, identificadocom\nposições tenentistas, mas o episódioterminou com a surpreendente\nnomeação doobscuro deputado Benedito Valadares, empossadoem 15 de\ndezembro de 1933.\n\nCom o atraso ocorrido no cronogramada Assembleia Constituinte,\nparlamentares governistasapresentaram a proposta de inversão naordem\noriginariamente prevista para os trabalhos,de modo que a eleição do\npresidenteda República precedesse a promulgação danova Constituição.\nJoão Alberto discursou nessaocasião, afirmando que, apesar de apoiara\neleição de Vargas, não concordava coma inversão dos trabalhos que, a\nseuver, significaria um aviltamento da AssembleiaConstituinte. Depois de\nalguma discussão, chegou-sea uma fórmula conciliatória que preservavaa\nordem original. A elaboração do textoconstitucional ocorreu em meio a um\npermanenteconflito entre as propostas que enfatizavamo fortalecimento da\nautonomia e dos poderesestaduais, defendidas pela representação\npaulistae outras grandes bancadas, e a ampliaçãoda centralização\npolítica e econômica emtorno da União, defendida pelos\nelementostenentistas presentes nas bancadas dos pequenosestados e\napoiada pela maior parte dosdeputados classistas. João Alberto se\nidentificavacom esse último bloco que, embora majoritário,fora obrigado\na fazer diversas concessõesaos defensores da descentralização. Assim,\naConstituição promulgada em 16 de julhode 1934, apesar de mais\ncentralizadorado que a de 1891, passou a serconsiderada por alguns\nsetores como umempecilho à ação do governo federal. Nodia seguinte,\nVargas foi eleito presidenteda República.\n\nNo Serviço Diplomático\n\nOs mandatos dos constituintes foramestendidos até maio de 1935, data\ndaposse dos deputados que seriam eleitosem outubro de 1934. Nessa\nocasião JoãoAlberto conquistou uma cadeira na AssembleiaConstituinte de\nPernambuco, reunida a partirde abril de 1935. Por essa época,a luta\npolítica ganhou novos rumos. AAção Integralista Brasileira (AIB), de\ntendênciafascista, experimentou notável crescimento, levandopartidos de\nesquerda, sindicatos e outrasorganizações a formar a Aliança\nNacionalLibertadora (ANL) para lutar contra oimperialismo, o latifúndio\ne o fascismo.Luís Carlos Prestes foi eleito, em marçode 1935, presidente\nde honra dessa entidade,e a seguir convidou muitos de seusantigos\ncompanheiros da Coluna e das rebeliõesda década de 1920 a aderir ao\nmovimento.Consultado, João Alberto respondeu em junhode 1935 que, embora\nconcordasse com diversospontos do programa e considerasse o\ngovernofederal desacreditado, não ingressaria na ANLporque precisava\nrecuperar-se dos desgastes sofridosnos últimos 13 anos. Pouco depois,\nPrestesescreveu a André Trifino Correia, veteranodas revoltas\ntenentistas da década de1920, chamando João Alberto de traidordos ideais\nde Siqueira Campos.\n\nA ANL foi declarada ilegal pelogoverno em julho de 1935 e, soba\ninfluência dominante do PCB, definiuuma orientação insurrecional que\nconduziu àrevolta de novembro do mesmo ano, rapidamentedominada. Luís\nGonzaga Lins de Barros,irmão de João Alberto, foi uma dasmilhares de\nvítimas da onda de repressãosubsequente, permanecendo preso até maio\nde1937. O ex-interventor em São Paulo, noentanto, não foi atingido pelas\nperseguições.\n\nAinda em 1935, equiparado no serviçodiplomático a ministro de primeira\nclasse,João Alberto viajou para os Estados Unidosa fim de estudar as\npossibilidades defomento das exportações de café. No anoseguinte, foi\nencarregado pelo presidente Vargasde inspecionar o funcionamento de\nconsuladose serviços consulares das missões diplomáticasbrasileiras na\nEuropa. De volta ao Rio,trabalhou de janeiro a outubro de 1937na\nSecretaria do Ministério das RelaçõesExteriores, sendo transferido, em\nfevereiro,para a reserva do Exército. Integrou tambéma Comissão de\nEficiência do ministérioaté ser nomeado, no início de\nnovembro,encarregado de negócios na Argentina emsubstituição ao\nembaixador José Bonifácio deAndrada e Silva. Recém-chegado a\nBuenosAires, ocorreu no Brasil o golpe militarque, sob a liderança do\npresidente Vargas,implantou o Estado Novo. Em fevereirode 1938, João\nAlberto foi substituídopelo embaixador Luís Guimarães Filho e,nos dois\nmeses seguintes, participou dachamada Missão Góis Monteiro, enviada\nàArgentina, Chile e Uruguai com o objetivode garantir boas relações\nentre o novoregime brasileiro e os governos dessespaíses.\n\nEnviado para representar o Brasilna Liga das Nações, em Genebra,\nintegrouos comitês financeiro e econômico da entidadeaté ser deslocado,\nem novembro de 1938,para Berna, também na Suíça, onde permaneceuaté\nsetembro de 1939, quando retornouao Brasil para assumir a chefia\ndarecém-criada Comissão de Defesa da EconomiaNacional, encarregada de\nlevantar estoques deprodutos básicos, fomentar exportações,\ncontrolarimportações, propor acordos econômicos com governosestrangeiros\ne coordenar o transporte marítimo,tendo em vista a nova conjuntura\nmundialcriada com a eclosão da Segunda GuerraMundial. Voltou a exercer\nmissão diplomáticano exterior entre abril de 1941 ejulho de 1942, como\nembaixador no Canadá,o primeiro que o Brasil enviou àquelepaís.\n\nNa Coordenação Da Mobilização Econômica\n\nA entrada formal do Brasil naSegunda Guerra, decretada em agosto de1942,\nreforçou as tendências intervencionistassobre a economia, manifestadas\ndesde aimplantação do Estado Novo. As dificuldadescrescentes no comércio\nmundial levaram ogoverno a extinguir a Comissão de Defesada Economia\nNacional e a criar, em28 de setembro de 1942, a Coordenaçãoda\nMobilização Econômica, com atribuições maisamplas do que as de sua\nantecessora.João Alberto foi chamado para presidiro novo órgão, que\npassou a funcionarcomo um superministério, com amplos poderespara\nintervir nas atividades econômicas, especialmentena fixação de preços e\nsalários, nadeterminação de metas de produção, nosproblemas de\nabastecimento e no planejamentodo sistema de transportes. Subordinada\ndiretamentea Vargas e sediada no Rio de Janeiro,a Coordenação estava\npresente em todoo país através de escritórios regionaisou\nrepresentantes, e possuía um conselhoconsultivo formado por João Neves\nda Fontoura,João Daudt d’Oliveira, Pedro da CostaRego, Roberto Simonsen,\nArtur Neiva eEuvaldo Lodi, entre outros.\n\nUma das primeiras preocupações donovo órgão foi coordenar o projeto,\nfinanciadopelo governo norte-americano, de fixar 50mil homens na\nprodução de borracha naregião amazônica. Foi criado então o\nServiçoEspecial de Migração de Trabalhadores paraa Amazônia (SEMTA),\nmas, apesar dos esforçosdespendidos, o número de trabalhadores nosetor\nnão ultrapassou os 10.500 em 1943devido à ausência de infraestrutura\nnaregião. Esse resultado levaria, em dezembrode 1943, à extinção do\nSEMTA eà criação da Comissão Administrativa deEncaminhamento de\nTrabalhadores para a Amazônia,que conseguiria fixar até 1945 um totalde\n22 mil pessoas na produção localde borracha.\n\nO início das atividades dos serviçosde racionamento e de abastecimento\ndaCoordenação, em maio de 1943, provocouo tabelamento do pão, açúcar e\ncarne,gerando protestos dos produtores e a rápidaformação de um\nsignificativo mercado negro.As indústrias de tecidos, aniagem, calçadose\nremédios foram submetidas a uma rigorosaregulamentação para garantir a\nprodução deartigos populares de qualidade e preçosinferiores. Apesar\ndessas medidas, a taxade inflação passou de 12% em 1942para 14,9% em\n1943, com o aumentosignificativo nos preços do vestuário, combustívele\nassistência médica.\n\nCom o objetivo de conhecer novasriquezas naturais e fixar brasileiros\nemterritórios não habitados das regiões Centro-Oestee Norte, João\nAlberto organizou uma grandeexpedição, conhecida como Roncador-Xingu,\nquepartiu em junho de 1943, fundou ascidades de Aragarças (GO) e\nXavantina(MT) e deu origem, em novembro, àFundação Brasil Central,\ntambém presidida porele. Sua gestão à frente deste órgãoseria duramente\ncriticada por Carlos Telesno livro *Retrato de João Alberto e de uma\népoca*, publicadoem 1946.\n\nDurante o ano de 1944, asvitórias aliadas na guerra e o avançodas\npressões pela redemocratização brasileiraenfraqueceram o Estado Novo e\ncomeçarama influir sobre o posicionamento de personalidadesligadas ao\nregime. No início de agosto,a polícia impediu a realização da\ncerimôniade posse de Osvaldo Aranha, ministro dasRelações Exteriores, na\nvice-presidência da SociedadeAmigos da América, entidade civil de\noposiçãoao Estado Novo. Osvaldo Aranha pediu demissãode seu cargo, sendo\nimediatamente acompanhadopor João Alberto, que também começavaa adotar\numa postura liberal.\n\nNum esforço de aproximação comsetores militares descontentes, liderados\npelogeneral Góis Monteiro, Vargas nomeou JoãoAlberto para a chefia de\nPolícia doDistrito Federal (o recém-criado DepartamentoFederal de\nSegurança Pública – DFSP) em9 de março de 1945, quando o esgotamentodo\nEstado Novo já era nítido eo processo de transição estava\nconfigurado.Cinco dias depois, em entrevista ao *Correio da Manhã*, João\nAlberto anunciou a quebrade incomunicabilidade do líder comunista\nLuísCarlos Prestes, preso desde 1936, e afirmouque sua libertação não\nconstituía ameaçaà ordem pública. Com a concessão daanistia em 18 de\nabril, fez questãode conduzir seu antigo comandante na Colunaaté a porta\nda prisão, onde a imprensao aguardava.\n\nO nome de João Alberto chegoua ser cogitado em uma conversa entreVargas\ne Cordeiro de Farias como umaalternativa para promover a conciliação\nentreas diversas correntes que se preparavampara concorrer à presidência\nda República,polarizadas principalmente em torno das candidaturasdo\ngeneral Eurico Dutra e do brigadeiroEduardo Gomes. Entretanto, a luta\npolíticanão caminhou em direção ao consenso. Comoresposta ao crescimento\nda oposição liberal,os comunistas e o recém-criado PartidoTrabalhista\nBrasileiro (PTB) passaram a apoiaro chamado “movimento queremista”, que\npediaa convocação de uma assembleia nacionalconstituinte com Vargas no\npoder. Em 12de agosto, João Alberto proibiu a realizaçãode novos\ncomícios queremistas, mas suaordem foi desobedecida por uma\ngrandemultidão três dias depois. No dia 16,os generais Góis Monteiro,\nOdílio Denis,Newton Estillac Leal, Cordeiro de Fariase Juarez Távora, os\ncoronéis Tasso deOliveira Tinoco e Nélson de Melo, ostenentes-coronéis\nJurandir de Bizarria Mamedee Landri Sales Gonçalves e outros\noficiaisreuniram-se na casa de João Alberto paradiscutir a ameaça\nrepresentada pelo queremismo.No dia 3 de outubro, uma manifestaçãode\nmais de cem mil pessoas dirigiu-seaté o palácio da Guanabara,\nresidênciaoficial do presidente da República, ondeVargas discursou\nreiterando que não seriacandidato.\n\nEntretanto, a intensa mobilização deapoio a Vargas e seu decreto de10 de\noutubro, antecipando as eleiçõesestaduais para 2 de dezembro\nseguinte,provocaram forte suspeita na oposição sobrea possibilidade de\nmanobras continuístas porparte do chefe do governo. João Albertoproibiu\nnovos comícios e Góis Monteiro,ministro da Guerra, garantiu publicamente\narealização das eleições, mas a intranquilidadepermaneceu.\n\nNa manhã de 29 de outubro,João Alberto comunicou a Góis Monteiroque\nassumiria a prefeitura do DistritoFederal em lugar de Henrique\nDodsworth,deslocado para a embaixada em Lisboa,cabendo a Benjamim\nVargas, irmão de Getúlioe simpático aos queremistas, a chefiada Polícia.\nEmbora soubesse desse remanejamentodesde o dia 25 e possuísse um pactode\ncomunicação imediata desse tipo denotícia com o ministro da Guerra,\nJoãoAlberto justificou sua demora alegando quefora expressamente\nproibido por Vargas devazar a informação. Por volta das 11horas, Góis\nMonteiro alertou todos oscomandantes de regiões militares sobre\nsuaiminente renúncia em protesto contra asmudanças, oficialmente\ncomunicadas por João Albertoe Benjamim Vargas às 14 horas. Horasdepois,\nos chefes das três armas decidiramdepor o presidente, fato concretizado\nnamadrugada do dia 30, quando Getúlio, pressionado,renunciou e deixou\ncom João Alberto umbreve manifesto ao povo brasileiro. Aindacomo chefe\nde Polícia, João Alberto acompanhouna manhã de 31 de outubro o\npresidentedeposto até seu embarque no avião queo levaria ao Rio Grande\ndo Sul.\n\nAfastado da chefia de Polícia,João Alberto ingressou no Partido\nSocialDemocrático (PSD) e apoiou a eleição dogeneral Dutra para a\npresidência da Repúblicano dia 2 de dezembro de 1945, tornando-seem\nseguida ferrenho partidário de seugoverno, iniciado em 31 de janeiro\nde1946. Em fevereiro, foi nomeado presidentedo Conselho de Imigração e\nColonização.Eleito vereador no Distrito Federal nalegenda do PTB em\n1947, chegou aexercer a presidência da Câmara Municipalaté renunciar ao\nmandato para organizaruma expedição à ilha de Trindade, nolitoral do\nEspírito Santo. Em 1949, ficouà disposição da secretaria da\nPresidênciada República.\n\nCom o início do segundo governoconstitucional de Getúlio Vargas em\njaneirode 1951, João Alberto voltou a ocuparcargos técnicos na\nadministração federal ea realizar missões no exterior.\nNomeadoinicialmente para a Comissão Nacional deAssistência Técnica,\npassou a chefiar em1952 o Departamento Econômico e Consulardo Ministério\ndas Relações Exteriores, órgãoque representou na missão econômica\nbrasileiraentão enviada à Europa e na Comissãode Desenvolvimento\nIndustrial. Em 1953, chefioua delegação enviada à Alemanha para\nnegociara renovação de acordos comerciais e depagamento, seguindo depois\npara Genebra afim de representar o Brasil na VIIIReunião do Acordo Geral\nsobre Tarifase Comércio (GATT) e coordenar missõesbrasileiras que\natuavam junto a organismosinternacionais ali sediados. No ano\nseguinte,retornou a Genebra para chefiar novamentea delegação brasileira\nà reunião anualdo GATT.\n\nJoão Alberto foi presidente dacompanhia Transcontinental de aviação,\ndiretor-superintendenteda Rádio Mayrink Veiga, fundador e\nprimeiropresidente do Centro Brasileiro de PesquisasFísicas. Participou\ntambém da criação daFundação Getulio Vargas. Pioneiro em históriasem\nquadrinhos, além disso foi músico ecompositor, chegando a tocar cítara,\npianoe violoncelo e a ocupar a presidênciada Orquestra Sinfônica\nBrasileira. Entre aspeças de sua autoria, destaca-se o *Hino ao Brasil\nCentral*, considerado muito harmônico porHeitor Villa-Lobos. Foi ainda\num dos fundadoresdo Clube Carnavalesco Bola Preta.\n\nFaleceu no Rio de Janeiro em26 de janeiro de 1955, quando\nestavapreparando o segundo volume de suas *Memórias de um\nrevolucionário*, cuja primeira parte, intitulada*A marcha da Coluna*,\nfoi publicada em 1954 elogo depois editada também sob a formade história\nem quadrinhos.\n\nSeu arquivo encontra-se depositado noCentro de Pesquisa e Documentação\nde HistóriaContemporânea do Brasil (Cpdoc) da FundaçãoGetulio Vargas.\n\nJorge Miguel Mayer\n\n**FONTES:**ARAÚJO, A. *Chefes*; ARQ.CASTELO BRANCO; ARQ. CLUBE 3 DE\nOUTUBRO;ASSEMB. NAC. CONST. 1934*. Anais*; BARROS,J. *Memórias*; BELLO,\nJ. *História*; BOMENY,H. *Estratégia*; CÂM. DEP*. Deputados*; *Câm. dep.\nseus componentes*; CARNEIRO, G. *História*; CARONE,E*. República nova*;\nCONSULT. MAGALHÃES, B.; *Correio da Manhã* (16/11/1930); CORTÉS, C.\n*Homens*; COUTINHO,L. *General*; *Cronologia da Assembleia*; *Encic.\nMirador*;FAUSTO, B. *Revolução*; FICHÁRIO PESQ. M.AMORIM; FLYNN, P.\n*Legião*; FONTOURA, J.*Memórias*; GODINHO, V. *Constituintes*; *Grande\nencic. Delta*;HIRSCHOWICZ, E. *Contemporâneos*; JARDIM, R.\n*Aventura*;*Jornal*; LEITE, A. *História*; LEITE, A.*Memórias*; LEVINE,\nR. *Vargas*; LOVE, J.*Regionalismo*; MIN. GUERRA. *Almanaque*; MIN.\nREL.EXT. *Almanaque* (1942); MORAIS, A. *Minas*; NOGUEIRAFILHO, P.\n*Ideais*; PEIXOTO, A. *Getúlio*;POPPINO, R. *Federal*; *Quem é quem no\nBrasil*; REISJÚNIOR, P. *Presidentes*; SILVA, H. *1922*;SILVA, H.*1926*;\nSILVA, H.*1930*; SILVA,H. *1932*; SILVA, H. *1933*; SILVA,\nH.*1934*;SILVA, H.*1935*; TAVARES, J. *Radicalização*;TÁVORA, J. *Vida*;\nTELES, C. *Retrato*; TRIB.SUP. ELEIT. *Dados* (1).\n","ref":"**FONTES:**ARAÚJO, A. *Chefes*; ARQ.CASTELO BRANCO; ARQ. CLUBE 3 DE\nOUTUBRO;ASSEMB. NAC. CONST. 1934*. Anais*; BARROS,J. *Memórias*; BELLO,\nJ. *História*; BOMENY,H. *Estratégia*; CÂM. DEP*. Deputados*; *Câm. dep.\nseus componentes*; CARNEIRO, G. *História*; CARONE,E*. República nova*;\nCONSULT. MAGALHÃES, B.; *Correio da Manhã* (16/11/1930); CORTÉS, C.\n*Homens*; COUTINHO,L. *General*; *Cronologia da Assembleia*; *Encic.\nMirador*;FAUSTO, B. *Revolução*; FICHÁRIO PESQ. M.AMORIM; FLYNN, P.\n*Legião*; FONTOURA, J.*Memórias*; GODINHO, V. *Constituintes*; *Grande\nencic. Delta*;HIRSCHOWICZ, E. *Contemporâneos*; JARDIM, R.\n*Aventura*;*Jornal*; LEITE, A. *História*; LEITE, A.*Memórias*; LEVINE,\nR. *Vargas*; LOVE, J.*Regionalismo*; MIN. GUERRA. *Almanaque*; MIN.\nREL.EXT. *Almanaque* (1942); MORAIS, A. *Minas*; NOGUEIRAFILHO, P.\n*Ideais*; PEIXOTO, A. *Getúlio*;POPPINO, R. *Federal*; *Quem é quem no\nBrasil*; REISJÚNIOR, P. *Presidentes*; SILVA, H. *1922*;SILVA, H.*1926*;\nSILVA, H.*1930*; SILVA,H. *1932*; SILVA, H. *1933*; SILVA,\nH.*1934*;SILVA, H.*1935*; TAVARES, J. *Radicalização*;TÁVORA, J. *Vida*;\nTELES, C. *Retrato*; TRIB.SUP. ELEIT. *Dados* (1).\n","dic":"DHBPR"}
