{"title":"CAPANEMA, GUSTAVO","cargoss":["Revolucionário ou revoltoso","Interventor","Ministro da Educação","Constituinte","Deputado federal","Ministro do Tribunal de Contas","Deputado federal","Senador"],"cargos_esp":[0,0,0,0,0,0,0,0],"datas_ini":[1930,1933,1934,1946,1946,1959,1961,1971],"datas_fim":[1930,1933,1945,1946,1959,1961,1970,1979],"estados":[0,"MG",0,0,"MG",0,"MG","MG"],"autor":["Paulo Brandi"],"content":"CAPANEMA, GUSTAVO\n\n\\*rev. 1930; interv. MG 1933; min. Educ. 1934-1945; const. 1946; dep.\nfed. MG 1946-1959; min. TCU 1959-1961; dep. fed. MG 1961-1970; sen. MG\n1971-1979.\n\n*Gustavo Capanema Filho* nasceu em Pitangui (MG) no dia 10 de agosto de\n1900, filho de Gustavo Xavier da Silva Capanema e de Marcelina Júlia de\nFreitas Capanema. Seu avô, o engenheiro e físico Guilherme Schuch de\nCapanema, barão de Capanema (1824-1908), instalou em 1855 a primeira\nlinha telegráfica do Brasil, e em seguida fundou a Repartição Geral dos\nTelégrafos, a qual dirigiu por mais de 30 anos, ao tempo do Império.\n\nIniciou seus estudos em Pitangui, transferindo-se em seguida para Belo\nHorizonte, onde cursou os colégios Azeredo, Arnaldo – dirigido por\npadres alemães – e o Ginásio Mineiro. Ingressou em 1920 na Faculdade de\nDireito de Minas Gerais e aí se tornou amigo de Abgar Renault, Mário\nCasassanta, Gabriel Passos e Emílio Moura, que mais tarde alcançariam\nrenome, quer como escritores, quer como políticos. Junto com esses\ncolegas de faculdade, formava o grupo conhecido como “os intelectuais da\nrua da Bahia”, integrado também por Carlos Drummond de Andrade, Mílton\nCampos, João Alphonsus e João Pinheiro Filho. Bacharelou-se em direito\nem dezembro de 1924.\n\nNo ano seguinte, retornou a Pitangui, onde lecionou e advogou até 1929.\nAo longo desse período, travou contato com a reforma educacional\niniciada por Francisco Campos em sua gestão como secretário do Interior\ndo governo mineiro de Antônio Carlos Ribeiro de Andrada (1926-1930).\nIngressou ao mesmo tempo na política, elegendo-se em 1927 vereador à\nCâmara Municipal de Pitangui.\n\nDa Revolução de 1930 às Eleições de 1933\n\nEm 1929, com o rompimento do pacto entre as oligarquias de Minas Gerais\ne São Paulo em torno da sucessão presidencial do ano seguinte, Capanema\naderiu à Aliança Liberal, coalizão oposicionista formada pelos governos\nde Minas Gerais, Rio Grande do Sul e Paraíba. Ainda em 1929, após a\nindicação de seu primo Olegário Maciel para a sucessão de Antônio\nCarlos, seu nome passou a ser citado entre os prováveis integrantes do\nfuturo governo mineiro.\n\nEm 1^o^ de março de 1930, Maciel elegeu-se presidente de Minas, ao mesmo\ntempo em que Getúlio Vargas, candidato da Aliança Liberal, era derrotado\npelo situacionista Júlio Prestes nas eleições para a presidência da\nRepública.\n\nAlgumas semanas depois, o gaúcho Osvaldo Aranha e o mineiro Virgílio de\nMelo Franco, jovens dirigentes da Aliança Liberal, reativaram seus\ncontatos com líderes tenentistas e aceleraram a conspiração para depor\nWashington Luís. Em Minas, a rebelião foi articulada por Virgílio de\nMelo Franco e os chefes políticos de maior expressão oligárquica, como\nAntônio Carlos e Artur Bernardes. Entretanto, tanto um como o outro\nmantiveram-se de início indecisos, retardando a marcha do movimento. Em\njunho, Antônio Carlos forçou o adiamento da revolução, não apenas por\ntemer a derrota, como declarou a Osvaldo Aranha, mas também porque não\ndesejava assumir os riscos de uma confrontação armada a apenas três\nmeses do término de seu mandato de presidente estadual. Em fins de\njulho, porém, impressionado com a repercussão nacional da morte de João\nPessoa, candidato derrotado da Aliança Liberal à vice-presidência da\nRepública, Antônio Carlos passou a apoiar decididamente a rebelião.\n\nEm 7 de setembro, já na fase final dos preparativos revolucionários,\nOlegário Maciel assumiu o governo mineiro, empossando Gustavo Capanema\nno cargo de oficial de gabinete. No dia 3 de outubro, os estados do Rio\nGrande do Sul, Minas e Paraíba levantaram-se em armas, conquistando\nrapidamente os estados vizinhos.\n\nTão logo se configurou a vitória do movimento, vieram à tona os\nantagonismos entre o espírito renovador dos jovens oficiais\nrevolucionários, os “tenentes”, e o conservadorismo das facções\noligárquicas a eles aliadas. Osvaldo Aranha voltou-se contra Olegário\nMaciel, defendendo ardorosamente a nomeação de Virgílio de Melo Franco\npara o cargo de interventor federal em Minas Gerais, enquanto a maior\nparte dos “tenentes” concentrava seus ataques em Artur Bernardes, que,\nenquanto da República (1922-1926), notabilizara-se pela perseguição aos\nparticipantes dos movimentos tenentistas do início da década de 1920.\n\nOlegário Maciel conseguiu resistir às pressões, tornando-se o único\ngovernante eleito antes da revolução a permanecer no cargo após a\nascensão de Vargas ao poder (3/11/1930). A ofensiva contra Bernardes,\nporém, produziu de imediato seus primeiros resultados. No dia 26 de\nnovembro, três secretários do governo mineiro pertencentes à sua facção\nforam demitidos: Cristiano Machado (Interior e Justiça), Alaor Prata\n(Finanças) e José Carneiro de Resende (Agricultura). Para seus lugares,\nOlegário Maciel nomeou respectivamente Gustavo Capanema, Amaro Lanari e\nCincinato Gomes de Noronha Guarani.\n\nEm dezembro de 1930, Capanema travou os primeiros entendimentos com\nFrancisco Campos a fim de destruir as bases de sustentação de Artur\nBernardes em Minas Gerais, organizadas principalmente no interior do\nPartido Republicano Mineiro (PRM). Ministro da Educação e Saúde, pasta\ncriada pelo governo provisório chefiado por Vargas, Campos exerceu uma\ninfluência decisiva nos rumos políticos de Minas após a Revolução de\n1930, tendo sido, segundo Simon Schwartzman, o “mentor político e\nintelectual de Capanema nesse período”.\n\nEm fevereiro de 1931, Capanema lançou, juntamente com Campos e Amaro\nLanari, o manifesto de fundação, em Minas, da Legião de Outubro,\norganização que vinha sendo criada em vários estados com o beneplácito\ndo governo provisório. Constituída como um corpo paramilitar, a Legião\nLiberal Mineira, tal como ficou conhecida no estado, adotou não apenas\nprincípios de caráter fascista em seu programa, como também o uniforme\nde camisas pardas que envergavam os nazistas, na época em ascensão na\nAlemanha.\n\nNa qualidade de secretário do Interior, Capanema valeu-se dos recursos\nde poder que seu cargo lhe conferia e dos instrumentos típicos de\npressão da política tradicional para implantar a Legião de Outubro em\nMinas Gerais. No intuito de desmobilizar a máquina política de Bernardes\n– alvo principal da Legião – Capanema chegou a aliar-se a elementos\ndissidentes do PRM que haviam apoiado em 1930 a Concentração\nConservadora e a candidatura oficial de Júlio Prestes. O PRM reagiu à\nofensiva, buscando apoio junto ao governo provisório e convocando seus\ncorreligionários para uma convenção regional do partido em 15 de agosto,\nem Belo Horizonte. Três dias mais tarde, o conflito entre o PRM e a\nLegião de Outubro chegou ao ponto culminante com a tentativa de\ndeposição do presidente Olegário Maciel, articulada a partir do Rio de\nJaneiro por Osvaldo Aranha, com o apoio velado de Getúlio Vargas.\n\nCapanema comandou a reação ao golpe. Após tomar conhecimento de que o\ncoronel Júlio Pacheco de Assis, comandante do 12^o^ Regimento de\nInfantaria de Belo Horizonte, tencionava assumir o governo do estado,\nguarneceu o palácio da Liberdade, sede do governo, com tropas da Força\nPública mineira. Ao mesmo tempo, alertou Francisco Campos, no Rio de\nJaneiro, para o movimento. Algumas horas mais tarde, o coronel Pacheco\nde Assis desmobilizou suas tropas em cumprimento de ordens enviadas pelo\nministro da Guerra, o general José Fernandes Leite de Castro.\n\nAos acontecimentos de agosto, seguiu-se um período de trégua e\nnegociações entre o governo mineiro e a facção bernardista. Com vistas à\npacificação do estado, Vargas procurou recuperar a confiança de Olegário\nMaciel, a fim de evitar uma possível aliança entre Minas Gerais e São\nPaulo, principal foco de oposição no novo regime.\n\nNos meses seguintes, Capanema atuou como principal intermediário entre\nVargas e Maciel, reaproximando Minas do governo provisório. Desempenhou\nainda importante papel nas negociações que deram origem ao chamado\n“Acordo Mineiro”, em fevereiro de 1932. O acordo, assinado por Capanema\n(pelo governo de Minas), Venceslau Brás (pelo conselho supremo da Legião\nde Outubro) e Virgílio de Melo Franco (pela comissão executiva do PRM),\ndeu origem ao Partido Social Nacionalista, efêmera tentativa de fusão da\nLegião Mineira com o PRM. O acordo deu ainda a Bernardes o direito de\nindicar o nome dos novos secretários estaduais da Agricultura e de\nFinanças.\n\nO apoio de Minas a Getúlio Vargas foi posto à prova em julho de 1932,\nquando eclodiu a Revolução Constitucionalista de São Paulo. Informado\npelo general Pedro Aurélio de Góis Monteiro, Capanema tomou conhecimento\nda deflagração do levante e imediatamente enviou um destacamento\npolicial para ocupar o túnel ferroviário situado perto da cidade de\nPassa Quatro, junto à divisa de Minas Gerais com São Paulo. Com essa\nmedida, as tropas paulistas foram impedidas de prosseguir o avanço em\ndireção a Minas Gerais. Em fins de julho, Capanema interceptou e\ndecifrou um aviso secreto de João Neves da Fontoura, solicitando a\nFilipe de Oliveira que concitasse Minas e Rio Grande do Sul à união com\nSão Paulo.\n\nNo entanto, em princípio de agosto, após o fracasso das articulações de\nArtur Bernardes em favor dos revoltosos, os paulistas propuseram a\nOlegário Maciel negociações em separado sobre o conflito. Capanema foi\nencarregado por Maciel de reunir-se com um emissário paulista, Fernando\nCosta, em Três Corações (MG). A proposta paulista previa a derrubada de\nGetúlio Vargas e a instituição de um governo federal chefiado por\nOlegário Maciel. Em resposta, Capanema reafirmou o compromisso de Maciel\ncom Vargas e a convicção de que seria cumprida a promessa de\nconstitucionalização do país feita pelo chefe do governo provisório. São\nPaulo continuou a luta, praticamente isolado, capitulando finalmente no\ninício de outubro de 1932.\n\nAs Eleições e a Sucessão Mineira (1933)\n\nCom o término da guerra civil paulista, Capanema e Maciel trataram de\norganizar um novo partido situacionista em Minas, em associação com os\nlíderes políticos que até então vinham apoiando o governo do estado e\nGetúlio Vargas. Em janeiro de 1933, fundaram o Partido Progressista (PP)\nde Minas Gerais, juntamente com Antônio Carlos, Venceslau Brás, José\nMonteiro Ribeiro Junqueira e Virgílio de Melo Franco. O PRM tornou-se\ndefinitivamente um partido de oposição, composto basicamente pelos\ncorreligionários de Bernardes, exilado do país juntamente com Mário\nBrant e Djalma Pinheiro Chagas, em decorrência de seu apoio à Revolução\nConstitucionalista.\n\nFrancisco Campos e Amaro Lanari, fundadores da extinta Legião Liberal\nMineira juntamente com Capanema, seguiram caminhos políticos diferentes.\nLanari ingressou na Ação Integralista Brasileira, onde mais tarde veio a\ntornar-se um quadro destacado. Francisco Campos, por sua vez,\nmarginalizado do jogo político desde sua saída do Ministério da Justiça\nem 1932, rompeu com Capanema em 1933, às vésperas das eleições para a\nConstituinte, acusando-o de haver prejudicado sua candidatura em\nPitangui, base política de ambos. Em 1937, Campos ressurgiria no cenário\npolítico nacional como autor da Constituição do Estado Novo.\n\nNas eleições de maio de 1933 para a Assembleia Nacional Constituinte, as\nprimeiras realizadas no país desde 1930, o PP elegeu 31 representantes,\ncontra seis do PRM. Detentora da maior bancada estadual da Constituinte,\nMinas emergiu no primeiro plano da política nacional no segundo semestre\nde 1933. No início de agosto, Juarez Távora, Juraci Magalhães, Carlos de\nLima Cavalcanti e Pedro Ernesto Batista viajaram a Belo Horizonte a fim\nde expressar apoio à candidatura de Antônio Carlos à presidência da\nAssembleia. Teve início então uma disputa entre Antônio Carlos,\ncandidato de Vargas, e Virgílio de Melo Franco, apoiado por Osvaldo\nAranha e uma ala minoritária do PP.\n\nEm 10 de agosto, na qualidade de membro da comissão executiva do PP,\nCapanema participou da reunião que fixou as diretrizes gerais da bancada\ndo partido na Constituinte que se reuniria a partir de 15 de novembro.\nNa ocasião, propôs a escolha dos prefeitos municipais por nomeação, como\ngarantia de “honestidade administrativa”, o que foi rejeitado por ampla\nmaioria. O encontro aprovou a instauração do regime representativo com\nduas câmaras eleitas pelo sufrágio universal, a manutenção do regime\nfederativo e a eleição do presidente da República pelo voto popular.\nNessas teses, revelava-se o espírito fortemente regionalista do PP,\ncolidindo em alguns casos com as propostas centralizadoras da Comissão\ndo Itamarati, encarregada por Vargas de elaborar um anteprojeto de\nConstituição.\n\nOlegário Maciel faleceu no dia 5 de setembro de 1933. Com sua morte,\nCapanema assumiu interinamente o cargo de interventor federal em Minas,\npostulando de imediato sua efetivação. Logo em seguida, Virgílio de Melo\nFranco lançou-se também na disputa sucessória, retirando sua candidatura\nà presidência da Constituinte.\n\nA sucessão mineira não mobilizou apenas as forças políticas do estado,\nmas também líderes de reconhecida projeção nacional, representantes de\ndiferentes facções do governo provisório. O interventor gaúcho José\nAntônio Flores da Cunha empenhou-se a fundo na nomeação de Capanema,\nenquanto Virgílio contava com o apoio ostensivo do ministro da Fazenda,\nOsvaldo Aranha, e de seu pai, o ministro das Relações Exteriores Afrânio\nde Melo Franco. Vargas adotou de início uma atitude de aparente\nneutralidade ante os dois candidatos, condicionando tacitamente a\nsolução do problema sucessório à prévia realização da eleição para a\npresidência da Constituinte. Desse modo, assegurou o apoio integral da\nbancada mineira à escolha de Antônio Carlos, que foi eleito no dia 12 de\nnovembro, e recebeu do líder progressista a confirmação de sua\nautoridade na escolha do novo interventor e o apoio à sua eleição para a\npresidência constitucional do país.\n\nEm 4 de dezembro, após se avistarem com Vargas no Rio de Janeiro,\nCapanema e Virgílio resolveram finalmente encerrar a disputa,\ncomprometendo-se a aceitar a decisão presidencial desde que a escolha\nrecaísse sobre um deles. No dia 12, após entendimentos mantidos com\nAntônio Carlos, Vargas deu uma solução inteiramente inesperada ao caso,\nnomeando interventor Benedito Valadares, deputado mineiro à Constituinte\nde expressão política muito inferior à dos principais postulantes ao\ngoverno estadual. Com essa nomeação, porém, Vargas não só garantiu a\npresença à frente do governo de Minas de um chefe sem muitas vinculações\ne influência entre as forças regionais, reservando-se assim a\npossibilidade de controlar a maior bancada estadual da Constituinte,\ncomo também conseguiu neutralizar a força de dois políticos de grande\nprestígio nacional: Flores da Cunha e Osvaldo Aranha.\n\nInconformados com a escolha de Valadares, Aranha e Afrânio de Melo\nFranco demitiram-se do ministério, abrindo uma grave crise no interior\ndo governo provisório. Enquanto isso, Capanema transmitiu o cargo a\nBenedito Valadares no dia 15 de dezembro, sem atender aos apelos em\nfavor da resistência feitos por Virgílio de Melo Franco. Em seguida,\nretornou a Pitangui com a perspectiva de sua futura nomeação para o\nMinistério da Educação e Saúde, compromisso que Vargas firmou em carta\ndo dia 20 de dezembro de 1933. Finalmente, em janeiro de 1934, Osvaldo\nAranha reconsiderou sua decisão e retornou ao ministério, pondo fim à\ncrise provocada no governo pela nomeação de Benedito Valadares.\n\nMinistro da Educação e Saúde\n\nEm 26 de julho de 1934, dez dias após a eleição de Vargas para a\npresidência da República pela Constituinte, Capanema foi efetivamente\nnomeado para a pasta da Educação e Saúde Pública.\n\nUma vez no cargo, deu andamento à reorganização do ministério iniciada\npor seu antecessor, Washington Pires, com vistas ao aparelhamento do\nórgão para as responsabilidades decorrentes de sua criação em 1930. Em\n1935, sua gestão caracterizou-se principalmente pela retomada das\ncampanhas sanitárias, interrompidas entre 1930 e 1934, e pelo início dos\nestudos visando à criação da Universidade do Brasil e à construção do\nedifício-sede do ministério no Rio de Janeiro.\n\nAo mesmo tempo, Capanema não permaneceu alheio ao grande debate travado\nem 1935 nos meios culturais e políticos do país, sobre o sentido e a\norientação do sistema educacional brasileiro. De um lado, os educadores\ndo chamado movimento escola-novista, como Anísio Teixeira, Manuel\nBergström, Lourenço Filho e Fernando de Azevedo, defendiam uma educação\nigualitária sob a responsabilidade do Estado. Do outro, situava-se o\nmovimento católico, liderado por Alceu Amoroso Lima, propugnando o\nensino religioso e livre da tutela do Estado. “Entre os extremos”, diz\nSimon Schwartzman, “Capanema jamais se decide de maneira totalmente\nexplícita, mas o peso da influência de Alceu é, sem dúvida, o\npredominante.” Desse modo, Capanema opôs-se à criação da Universidade do\nDistrito Federal (UDF), concebida por Anísio Teixeira durante a gestão\nde Pedro Ernesto na prefeitura da capital da República. Segundo o\nhistoriador Américo Jacobina Lacombe, a universidade só foi criada\nporque Pedro Ernesto recebeu autorização direta de Getúlio Vargas para\nassinar o decreto que a instituiu em abril de 1935.\n\nEm julho, Capanema formou uma comissão encarregada de estudar a\nampliação da Universidade do Rio de Janeiro, que passaria a denominar-se\nem 1937 Universidade do Brasil. A comissão foi composta de 12 membros,\nincluindo professores e intelectuais de diferentes tendências\nideológicas, como Inácio Azevedo Amaral, um dos principais defensores do\nEstado autoritário, e elementos do movimento escola-novista, como Edgar\nRoquete Pinto e Lourenço Filho. Em outubro, Capanema encaminhou ao\nCongresso o Plano de Reorganização do Ministério da Educação e Saúde\nPública, que só veio a ser aprovado em 13 de janeiro de 1937.\n\nNo dia 7 de dezembro de 1935, após o fracassado levante comunista de\nnovembro, Capanema participou de reunião ministerial que examinou a\nsituação política do país e as medidas repressivas a serem tomadas pelo\ngoverno. Segundo Alzira Vargas do Amaral Peixoto, Capanema “fez a\ncrítica da educação no Brasil… e reclamou contra a influência da\nUniversidade do Distrito Federal, de orientação comunista”. Em\ndecorrência do clima de anticomunismo reinante no país, o reitor Afrânio\nPeixoto e vários professores da UDF demitiram-se em dezembro de 1935. A\nuniversidade continuou funcionando até ser extinta e incorporada à\nUniversidade do Brasil, em 1939.\n\nDurante o ano de 1936, prosseguiram os trabalhos da comissão encarregada\nde estudar a organização da Universidade do Brasil. Aprovada a proposta\nde construção de uma cidade universitária no Rio de Janeiro, reunindo o\nconjunto dos institutos e faculdades da futura universidade, a comissão\nescolheu os terrenos da Quinta da Boa Vista para sua localização. Mais\ntarde, porém, optou-se por sua construção na ilha do Fundão.\n\nNas letras e nas artes plásticas, Capanema procurou colocar-se acima das\ndisputas políticas e ideológicas que agitavam o país. Assessorado por\nseu chefe de gabinete, o poeta Carlos Drummond de Andrade, cercou-se de\numa equipe diversificada, integrada, entre outros, por Mário de Andrade,\nCândido Portinari, Manuel Bandeira, Heitor Villa-Lobos, Cecília\nMeireles, Lúcio Costa, Vinícius de Morais, Afonso Arinos de Melo Franco\ne Rodrigo Melo Franco de Andrade.\n\nO projeto de construção do edifício-sede, do ministério foi o maior\nexemplo de sua abertura em relação à arte moderna. Empenhado em\ntransformar o prédio na “catedral da moderna arquitetura mundial”, como\ndefiniu o poeta e calculista Joaquim Cardoso, Capanema não hesitou em\nanular o concurso que aprovara o projeto de autoria do arquiteto\nArquimedes Memória e passar a incumbência da construção a uma equipe\nchefiada por Lúcio Costa e integrada por Oscar Niemeyer, Carlos Leão,\nAfonso Eduardo Reidy, Jorge Moreira e Ernâni Vasconcelos. A pedido do\ngrupo, Le Corbusier veio de Paris a fim de examinar o projeto. A obra\ncontou ainda com a participação de Portinari, encarregado dos afrescos e\ndo painel de azulejos, dos escultores Adriana Janacopoulos, Celso\nAntônio, Bruno Giorgi e Jacques Lipschitz, e do paisagista Roberto Burle\nMarx. Iniciada em 1937, ficou praticamente pronta em 1944, mas só foi\ninaugurada em 1945, após a queda do Estado Novo, quando Capanema não se\nencontrava mais à frente do ministério.\n\nA aprovação do plano de reorganização do ministério, pela lei de 17 de\njaneiro de 1937, permitiu a criação de novos organismos, contribuindo\ndecisivamente para a dinamização de seus serviços. Pela mesma lei, o\nministério teve sua designação alterada, passando a chamar-se\noficialmente Ministério da Educação e Saúde. Logo em seguida, o\nDepartamento Nacional de Saúde e Assistência Médico-Social, principal\nórgão executivo do ministério na área de saúde, assumiu plenamente a\ncoordenação dos departamentos estaduais de saúde, num importante\nmovimento no sentido da centralização.\n\n“É a partir desse momento”, afirma Sérgio Góis de Paula, “que se pode\nidentificar um relativo avanço da atenção à saúde para o interior do\npaís, com a criação em 1937 do Serviço Nacional de Febre Amarela – o\nprimeiro serviço de saúde pública de dimensão nacional – e, em 1939, do\nServiço de Malária do Nordeste, ambos em convênio com a Fundação\nRockefeller”.\n\nVários hospitais, colônias e asilos foram construídos para o tratamento\nde outras endemias, como a tuberculose e a lepra, e as doenças mentais.\nEm 1941, o Departamento Nacional de Saúde assumiu o controle da formação\nde técnicos em saúde pública, centralizando e integrando alguns cursos\njá existentes, inclusive no Instituto Osvaldo Cruz. Ainda em 1941, em\nconsequência de sua reestruturação, o Departamento Nacional de Saúde\npassou a ser integrado pelos serviços nacionais de Tuberculose, de\nPeste, de Malária, de Lepra, de Câncer e de Doenças Mentais,\nincorporando outros criados anteriormente, como o Serviço Nacional de\nFebre Amarela (1937), o Departamento Nacional da Criança (1940) e o\nServiço Nacional de Educação Sanitária (1941).\n\nEm 5 de julho de 1937, a Universidade do Brasil foi instituída com 15\nescolas ou faculdades que receberam a denominação de nacionais e 16\ninstitutos, alguns dos quais já existentes, além do Museu Nacional.\n\nApós o golpe de 10 de novembro de 1937 que instituiu o Estado Novo e a\nConstituição de 1937, da qual Capanema foi um dos signatários, a ação do\nMinistério da Educação e Saúde foi marcada pelo caráter fortemente\ncentralizador e autoritário do novo regime. Segundo Anísio Teixeira, “o\nministério transformou-se durante o período estado-novista no organismo\ncentral de controle e fiscalização da educação, em tudo equivalente a um\ncartório nacional”. Conforme palavras do próprio Capanema em dezembro de\n1937, a educação deveria constituir-se num dos “instrumentos do Estado e\nreger-se pelo sistema de diretrizes morais, políticas e econômicas que\nformaram a base ideológica da Nação e que, por isto, estão sob a guarda,\no controle ou a defesa do Estado”. Valores e atitudes como “o amor à\nPátria, o sereno otimismo quanto ao poder e o destino de nossa raça”\ntornaram-se recorrentes no discurso pedagógico dos ideólogos do Estado\nNovo e dos compêndios escolares, submetidos a partir de dezembro de 1938\nao prévio exame da Comissão Nacional do Livro Didático. Dentro da\natmosfera de nacionalismo que presidiu a concepção do novo regime, foram\nnacionalizadas mais de duas mil escolas nos núcleos de colonização\nalemã, particularmente no Sul do país e sobretudo depois de 1942, quando\no Brasil rompeu relações e declarou guerra à Alemanha.\n\nNo campo da cultura, a gestão de Capanema assinalou a criação de dois\nórgãos de destacada atuação ao longo do Estado Novo: o Serviço do\nPatrimônio Histórico e Artístico Nacional e o Instituto Nacional do\nLivro, fundados em novembro e dezembro de 1937, respectivamente. O\nprimeiro foi responsável pelo tombamento e preservação de centenas de\nmonumentos artísticos e históricos e pela criação do Museu Imperial, em\nPetrópolis (RJ), do Museu da Inconfidência, em Ouro Preto (MG), do Museu\ndas Missões, em São Miguel (RS), e do Museu do Ouro, em Sabará (MG). O\nInstituto Nacional do Livro foi responsável pela criação de mais de uma\ncentena de bibliotecas públicas no interior do país.\n\nEm 30 de julho de 1938, Capanema fundou o Instituto Nacional de Estudos\nPedagógicos (INEP), nomeando para sua direção o professor Lourenço\nFilho. Em 4 de abril de 1939, inaugurou a Faculdade Nacional de\nFilosofia da Universidade do Brasil, que viria a ter profunda influência\nno ensino médio e superior. Com efeito, tornou-se o modelo de todas as\nfaculdades que surgiram em seguida com o objetivo de preparar candidatos\nao magistério secundário. Até então, os professores do ensino médio e\nsuperior eram recrutados entre os profissionais que fracassavam ou\ndesistiam de suas profissões, através de um registro concedido, quase\nsempre graciosamente, pelo ministério. Com a criação da Faculdade\nNacional de Filosofia a carreira docente adquiriu o *status* de uma\nprofissão de nível superior. Ainda em 1939, foram fundadas a Faculdade\nNacional de Arquitetura e a Faculdade de Ciências Econômicas. Em 1941,\ncompletando o quadro das instituições componentes da Universidade do\nBrasil, Capanema inaugurou a Escola Nacional de Educação Física e\nDesportos, visando principalmente à formação de pessoal técnico em\neducação física, prática obrigatória nas escolas pela Constituição do\nEstado Novo.\n\nA partir de 1942, começaram a ser promulgadas, por iniciativa de\nCapanema, as leis orgânicas do ensino, reformando vários ramos do ensino\nmédio. Em relação ao ensino técnico-profissional, foram instituídas a\nLei Orgânica do Ensino Industrial, em 30 de janeiro de 1942, e a Lei\nOrgânica do Ensino Comercial, em 28 de dezembro de 1943. Entretanto,\ncomo o governo não possuía a infraestrutura necessária à implantação em\nlarga escala do ensino profissional, recorreu-se à criação de um sistema\nde ensino paralelo, em convênio com as indústrias, através de seu órgão\nmáximo de representação, a Confederação Nacional da Indústria (CNI). Em\n22 de janeiro de 1942, criou-se o então Serviço Nacional de Aprendizagem\ndos Industriários, mais tarde Serviço Nacional de Aprendizagem\nIndustrial (Senai), organizado e dirigido pela CNI e mantido pela\ncontribuição dos estabelecimentos industriais a ela filiados. Como\nescola-padrão do ensino industrial, foi inaugurada em maio de 1942 a\nEscola Técnica Nacional, no Rio de Janeiro, dirigida inicialmente por\numa equipe de professores suíços.\n\nEm 9 de abril de 1942, foi promulgada a Lei Orgânica do Ensino\nSecundário, instituindo um primeiro ciclo de quatro anos de duração,\ndenominado ginasial, e um segundo ciclo de três anos, que podia ser o\ncurso clássico ou o científico. Assim, este último ciclo, que na reforma\nFrancisco Campos apresentava três opções, passou a ter apenas duas. Os\nnovos currículos estabelecidos pela lei demonstravam, segundo Otaíza\nRomanelli, uma “preocupação excessivamente enciclopédica e a\npredominância das matérias de cultura geral e humanística”. Por\ninfluência da Segunda Guerra Mundial, a lei instituiu a educação militar\npara os alunos do sexo masculino, com diretrizes pedagógicas fixadas\npelo Ministério da Guerra. Reafirmou a educação religiosa facultativa, a\neducação moral e cívica como matéria obrigatória e a limitação às\nescolas mistas, recomendando que a educação secundária da mulher se\nfizesse em estabelecimento de frequência exclusivamente feminina. A Lei\nOrgânica do Ensino Secundário, também conhecida como Reforma Capanema,\npermaneceu em vigor até a aprovação da Lei de Diretrizes e Bases da\nEducação Nacional, em 1961.\n\nDiretamente vinculados ao ministério, foram criadas a Juventude\nBrasileira, em março de 1940, destinada a reunir a infância e a\nadolescência em uma “organização nacional de caráter cívico”, e a União\nNacional dos Estudantes (UNE), em fevereiro de 1942, como entidade\ncoordenadora e representativa dos estudantes universitários.\n\nA participação do Brasil na Segunda Guerra Mundial ao lado dos Aliados\nnão poderia deixar de repercutir no quadro político nacional. A\ndeclaração de guerra aos países do Eixo, em agosto de 1942, o envio de\numa força expedicionária aos campos de batalha na Itália, em julho de\n1944, e a aproximação do final da guerra, com a derrota das potências do\nEixo, criaram uma atmosfera política favorável à mudança do regime\npolítico. Em princípios de 1945, o movimento pela redemocratização do\npaís já se constituía numa importante frente, incluindo liberais,\ncomunistas e amplos setores da oficialidade das forças armadas.\n\nEm 28 de fevereiro, Vargas emitiu um ato adicional à Constituição de\n1937, comprometendo-se a realizar as eleições presidenciais. Logo em\nseguida, tratou de organizar um partido de sustentação do governo – o\nPartido Social Democrático (PSD) – articulado fundamentalmente pelos\ninterventores estaduais e os responsáveis mais diretos pela\nadministração do Estado Novo. Em 8 de abril, por ocasião da convenção de\nlançamento do PSD em Minas Gerais, Capanema foi eleito membro da\ncomissão executiva estadual do partido. Em poucos meses o PSD se\norganizou em todo o país e a 17 de julho realizou sua convenção\nnacional, lançando oficialmente a candidatura do ministro da Guerra,\ngeneral Eurico Gaspar Dutra, às eleições presidenciais de 2 de dezembro\nde 1945. Em contraposição, os constitucionalistas liberais reunidos em\ntorno da União Democrática Nacional (UDN) apresentaram o nome do\nbrigadeiro Eduardo Gomes à sucessão presidencial.\n\nEm agosto, um grupo de seguidores de Vargas que estava organizando o\nPartido Trabalhista Brasileiro (PTB) passou a defender o adiamento das\neleições presidenciais e a permanência de Vargas no poder. O movimento\ncontou com o apoio surpreendente do Partido Comunista e tornou-se\nconhecido como “queremismo”, devido ao seu refrão “Queremos Getúlio”. A\npartir desse momento, as posições de Vargas e da UDN tornaram-se cada\nvez mais conflituosas. A crise culminou em 29 de outubro com a deposição\nde Vargas pelas forças armadas, num golpe desfechado pelo ministro da\nGuerra, Góis Monteiro, com o apoio do general Dutra. Em consequência da\nqueda de Vargas, Capanema deixou o Ministério da Educação e Saúde, sendo\nsubstituído por Raul Leitão da Cunha, nomeado pelo novo presidente da\nRepública, José Linhares.\n\nDeputado Federal e Senador\n\nEm 2 de dezembro de 1945, Capanema elegeu-se deputado por Minas Gerais à\nAssembleia Constituinte na legenda do PSD, ao mesmo tempo em que Dutra\nera eleito presidente da República pela coligação PSD-PTB. Instalada a\nConstituinte em fevereiro de 1946, foi designado membro da Comissão\nConstitucional, encarregada de redigir o anteprojeto da nova Carta.\nParticipou assim dos trabalhos da terceira subcomissão, que elaborou o\ncapítulo referente ao Poder Legislativo.\n\nNos debates da Assembleia, Capanema foi um dos mais ardorosos defensores\ndo artigo que versava sobre a representação proporcional dos estados na\nCâmara dos Deputados. O artigo fixava um coeficiente de 150 mil\nhabitantes por deputado até o limite de 20 deputados, e de 230 mil\nhabitantes para os deputados seguintes, prejudicando dessa forma a\nrepresentação dos estados mais populosos do país. Esse dispositivo\nsuscitou duras críticas, mas foi aprovado, transformando-se no artigo 58\nda Constituição de 1946, “um dos mais importantes instrumentos de\nestruturação política do novo regime”, na opinião da socióloga Maria do\nCarmo Campelo de Sousa.\n\nA Constituição foi promulgada em 18 de setembro de 1946 e a Assembleia\ntransformou-se em Congresso ordinário. Dessa forma, os constituintes\ntiveram seus mandatos estendidos para a legislatura de 1946 a 1951. Nas\neleições para o governo de Minas, realizadas em janeiro de 1947,\nCapanema apoiou a candidatura udenista vitoriosa de Mílton Campos,\njuntamente com outros deputados pessedistas que divergiram da indicação\nde José Francisco Bias Fortes pelo PSD. De 1947 a 1950, foi membro da\nComissão de Justiça da Câmara, participando ainda da comissão\nencarregada de elaborar as leis complementares à Constituição. Em\njaneiro de 1948, acompanhou a maioria da Câmara ao votar favoravelmente\nà cassação dos mandatos dos parlamentares do Partido Comunista do\nBrasil, depois Partido Comunista Brasileiro (PCB), cujo registro havia\nsido cancelado, em maio de 1947, pelo Tribunal Superior Eleitoral (TSE).\nEm julho seguinte, propôs que a distribuição das cadeiras vacantes fosse\nfeita pelas legendas majoritárias, tal como se dava, então, com as\ncadeiras em sobra na apuração dos pleitos. Sua tese foi aprovada no\nCongresso, mas declarada inconstitucional pelo TSE. As vagas comunistas\npermaneceram em aberto até a renovação do Congresso, das assembleias\nestaduais e das câmaras de vereadores, em outubro de 1950.\n\nEm agosto de 1948, foi designado presidente da Comissão Parlamentar de\nInquérito sobre os contratos da Light e o governo federal para\nconstrução de um desvio do rio Paraíba, na altura de Barra do Piraí\n(RJ), com o objetivo de ampliar a usina de Fontes, no ribeirão das\nLajes. Um mês antes, o Congresso havia aprovado o aval do governo\nbrasileiro ao empréstimo de 90 milhões de dólares do Banco Mundial à\nLight para realização da obra, apesar das denúncias apresentadas pelo\ngeneral Juarez Távora. A comissão encerrou seus trabalhos em setembro de\n1949, chegando à conclusão de que a Light havia praticado uma série de\natos ilícitos como os do suborno para atingir seus objetivos.\n\nEm 1949, seu nome chegou a ser cogitado para a sucessão do presidente\nDutra, como candidato do PSD. Àquela altura, o partido encontrava-se\ndividido em duas correntes, e Capanema estava mais próximo do grupo\nmajoritário, que seguia a orientação do presidente Dutra. A segunda\ncorrente, integrada pelos seguidores de Vargas, lançou a candidatura de\nNereu Ramos, vetada pelo general Dutra. Desse impasse surgiu a\ncandidatura de Cristiano Machado e sua fracassada campanha, apoiada\napenas pelos elementos “dutristas”, entre os quais Capanema.\n\nEm outubro de 1950, Capanema reelegeu-se deputado federal pelo PSD, ao\nmesmo tempo em que Vargas, candidato do PTB e do Partido Social\nProgressista (PSP), derrotava por ampla diferença Cristiano Machado e o\ncandidato da UDN, Eduardo Gomes, nas eleições para a presidência da\nRepública. Empossado em janeiro de 1951, Vargas tratou inicialmente de\nfortalecer sua base de apoio no Congresso, fazendo inclusive gestos\nconciliatórios em direção à UDN. Dentro dessa estratégia, indicou\nCapanema para líder da maioria, devido à sua reconhecida habilidade\npolítica e ao seu bom relacionamento com figuras destacadas da UDN, como\nAfonso Arinos de Melo Franco, líder da minoria. Segundo Afonso Arinos,\num dos meios escolhidos por Vargas para aproximar a UDN do governo foi o\nprojeto de reforma administrativa, para cujo preparo foi constituída uma\ngrande comissão interpartidária da qual foi relator juntamente com\nCapanema.\n\nComo líder da maioria, Capanema teve uma atuação relevante no\nencaminhamento dos debates sobre o projeto da Petrobras e o Acordo\nMilitar Brasil-Estados Unidos. O projeto da Petrobras foi enviado por\nVargas ao Congresso em 8 de dezembro de 1951, suscitando de imediato\nreações críticas dos partidários do monopólio estatal do petróleo. As\nresistências não partiram apenas da oposição, representada pela UDN, mas\nda própria bancada do governo. Após ser examinado pelas comissões da\nCâmara, o projeto foi enviado ao plenário no princípio de maio de 1952.\nNo dia 12 desse mês, Capanema solicitou regime de urgência para a\ndiscussão e votação do projeto. O pedido foi aceito, apesar da grande\noposição dos deputados da UDN, do Partido Socialista Brasileiro (PSB) e\nde outras agremiações menores. Entretanto, a aceleração dos debates veio\napenas demonstrar as diminutas possibilidades de aprovação do projeto\ngovernamental.\n\nFora do Congresso, as forças nacionalistas também levavam vantagem sobre\nos defensores da livre iniciativa e da colaboração com os capitais\nestrangeiros. Entidades como a UNE e o Centro de Estudos e Defesa do\nPetróleo e da Economia Nacional conseguiam mobilizar o apoio da opinião\npública em favor do monopólio estatal através de uma intensa campanha em\ntodo o país. Em vista disso, o governo decidiu incorporar as\nmodificações propostas pelos deputados nacionalistas. O primeiro passo\nfoi o compromisso assumido por Capanema, em nome da maioria da Câmara,\nde apoiar a emenda Lúcio Bittencourt, vedando a participação de\nacionistas estrangeiros na Petrobras.\n\nEm 2 de setembro de 1952, o projeto da Petrobras foi aprovado em\nprimeira discussão na Câmara, com mais de 150 emendas, entre as quais a\nde Lúcio Bittencourt. Na ocasião, Capanema refutou as declarações do\ndeputado Raimundo Padilha a propósito da influência exercida pelo\nPartido Comunista nos debates sobre a Petrobras. “De forma alguma”,\ndeclarou, “podemos admitir que o fato de o Partido Comunista adotar uma\nideia possa ser considerado um aviltamento dessa ideia. Devemos\nregozijar-nos pelo fato de que uma grande ideia do país seja também\naceita pelo Partido Comunista.” Um ano mais tarde, o projeto foi\nnovamente submetido ao plenário da Câmara para discussão única das\nemendas do Senado. Em 3 de outubro de 1953, Vargas sancionou sem vetos o\nprojeto da Petrobras, instituindo o monopólio estatal da pesquisa,\nlavra, refino e transporte do petróleo e derivados.\n\nO Acordo Militar Brasil-Estados Unidos, assinado em 15 de março de 1952\npelo chanceler João Neves da Fontoura e o embaixador norte-americano\nHerschell Johnson, também provocou viva controvérsia no Congresso. A ala\nesquerda do PTB e deputados da UDN como Bilac Pinto concentraram suas\ncríticas nos dispositivos pelos quais o Brasil se comprometia a exportar\nmateriais estratégicos para os EUA e enviar tropas ao exterior em caso\nde ameaça à segurança continental. Segundo os adversários do acordo,\neste último ponto não deixava margem de dúvida quanto ao interesse do\ngoverno norte-americano em requisitar tropas brasileiras para a Guerra\nda Coreia. Em seus contatos com Capanema, o chanceler João Neves da\nFontoura buscou esclarecê-lo sobre todas as dimensões do acordo,\nsolicitando que apressasse sua votação, sem emendas ou interpretações. O\nacordo foi afinal ratificado pelo Congresso, em março de 1953, sem\ngrandes alterações.\n\nEm junho de 1953, Capanema foi incumbido por Vargas de propor ao\nCongresso a formação de uma comissão parlamentar de inquérito para\napurar as transações do Banco do Brasil com o jornal *Última Hora*.\nFundado em 1951 por Samuel Wainer, graças a um empréstimo do Banco do\nBrasil, *Última Hora* era o único jornal importante do país que tinha\numa orientação francamente favorável a Vargas e, por isso mesmo, vinha\nsendo apontado pela oposição como exemplo de malversação do dinheiro\npúblico em favor dos partidários do governo. No primeiro semestre de\n1953, o jornalista Carlos Lacerda havia conseguido transformar o assunto\nnum verdadeiro desafio a Vargas.\n\nDurante o desenrolar do inquérito, Capanema fez o possível para atenuar\nas acusações contra Wainer, embora não concordasse plenamente com suas\ntransações financeiras. A CPI encerrou seus trabalhos em novembro de\n1953, concluindo que os financiamentos haviam sido concedidos “à margem\ndas condições normais”. Em janeiro de 1954, a *Última Hora* foi obrigada\na executar, de imediato, suas dívidas com o Banco do Brasil, conseguindo\nsobreviver graças a empréstimos obtidos por Wainer junto ao conde\nFrancisco Matarazzo, Ricardo Jafet e Ernesto Simões Filho.\n\nEm julho, Vargas decidiu reorientar os rumos de seu governo, efetuando\numa reforma quase completa do ministério. A nova estratégia do governo\ncaracterizou-se, no plano econômico, pela ênfase no combate à inflação,\nconsubstanciada no programa elaborado pelo novo ministro da Fazenda,\nOsvaldo Aranha, e, no plano político, pela aproximação com a classe\ntrabalhadora, levada a cabo pelo novo ministro do Trabalho, João\nGoulart. Em 31 de agosto, Vargas encaminhou ao Congresso o projeto de\nreforma administrativa. Nos meses seguintes, a UDN intensificou o\nassédio ao governo, visando em particular o ministro João Goulart. A\nofensiva da UDN agravou sensivelmente o quadro político nacional,\nradicalizando os focos de oposição ao governo nas forças armadas e nas\nclasses médias urbanas.\n\nEm fevereiro de 1954, os militares contrários a Getúlio vieram a\npúblico, pela primeira vez, expressar seu descontentamento com a\npolítica governamental. Oitenta e dois coronéis e tenentes-coronéis\nlançaram manifesto protestando contra a “negligência do governo em\nrelação ao Exército” e criticando indiretamente o ministro João Goulart\npor sua proposta de elevação do salário mínimo em 100%, considerada\ndemasiadamente alta. Com a ajuda de Gustavo Capanema e de outros líderes\ndo PSD, como Benedito Valadares, Vargas afastou Goulart do Ministério do\nTrabalho em 22 de fevereiro, nomeando em seu lugar Hugo de Faria. O\nministro da Guerra, Ciro do Espírito Santo Cardoso, também foi afastado\ne substituído pelo general Zenóbio da Costa. Apesar do assédio da UDN,\nCapanema conseguiu preservar a aliança do PSD com o PTB, assegurando a\nmaioria parlamentar ao governo. Em abril, por exemplo, os dois partidos\nvotaram maciçamente contra a moção de impedimento de Vargas, apresentada\nao Congresso pela UDN.\n\nEm 1^o^ de maio, Vargas deu um tom nitidamente ofensivo à sua política,\nao pronunciar em Petrópolis um vigoroso discurso de apoio à classe\ntrabalhadora e assinar o aumento de 100% do salário mínimo. O discurso\nincitou os militares antigetulistas, principalmente os oficiais da Base\nAérea do Galeão, no Rio de Janeiro, à conspiração para a derrubada do\ngoverno. Em 5 de agosto, em meio a um quadro de tensão crescente,\nocorreu o atentado contra Carlos Lacerda, no qual morreu o major-aviador\nRubens Vaz. No dia 8, Capanema declarou o firme propósito do governo em\ndescobrir e punir os responsáveis pelo crime. Àquela altura, porém, a\nAeronáutica já havia instalado o seu próprio inquérito e detido alguns\ndos implicados no crime. A revelação de que o atentado fora planejado\npelo chefe da guarda pessoal do presidente, Gregório Fortunato, colocou\nGetúlio Vargas numa posição extremamente delicada. A partir desse\nmomento, os militares antigetulistas e os líderes da UDN passaram a\nexigir a renúncia de Vargas.\n\nEm 17 de agosto, Capanema discursou na Câmara rebatendo as acusações que\nprocuravam envolver o presidente e seus familiares na trama do atentado\nda rua Tonelero e criticando acerbamente a UDN. Considerou a renúncia de\nVargas como “uma exigência não do povo, mas de um partido político” e\nacusou Carlos Lacerda de instigar as forças armadas ao golpe contra o\npresidente. Logo em seguida, entretanto, o vice-presidente João Café\nFilho procurou Capanema, anunciando sua disposição de levar a Vargas a\nfórmula de uma renúncia conjunta a fim de solucionar a crise. Em 21 de\nagosto, Vargas declarou a Café Filho sua firme disposição de não ceder à\nexigência de renúncia. No dia seguinte, entretanto, Capanema anunciou\nque Vargas admitia deixar o poder, caso fosse necessário evitar uma\nguerra civil. No dia 23, Café Filho rompeu publicamente com Vargas\nrevelando, em um discurso no Congresso, a proposta que este lhe fizera.\n\nVinte e sete generais do Exército lançaram um manifesto à nação exigindo\na renúncia de Vargas. Na madrugada do dia 24, Vargas reuniu seu\nministério e concordou afinal em licenciar-se provisoriamente do cargo.\nOs militares antigetulistas mostraram-se, porém, irredutíveis. Na manhã\ndo dia 24, recusaram a fórmula proposta por Vargas e transmitiram o\nultimato final ao palácio presidencial. Impassível, Vargas retirou-se\npara seu quarto e suicidou-se com um disparo de revólver contra o\ncoração. No mesmo dia, Café Filho assumiu a chefia da nação para cumprir\no resto do mandato presidencial, em meio a um clima de forte comoção e\nde protestos populares em todo o país. Em outubro de 1954, Capanema\nreelegeu-se deputado federal na legenda do PSD.\n\nA crise político-militar de agosto de 1954 reabriu-se no ano seguinte\ncom a eleição de Juscelino Kubitschek e João Goulart para a presidência\ne a vice-presidência da República. A ala extremista da UDN, liderada\npelos deputados Carlos Lacerda e Aliomar Baleeiro, passou imediatamente\na advogar uma intervenção das forças armadas para impedir a posse dos\neleitos. No dia 11 de novembro, numa ação destinada a assegurar a posse\nde Kubitschek e Goulart, o ministro da Guerra Henrique Teixeira Lott\nassumiu o controle militar do Rio de Janeiro e anunciou a destituição do\npresidente Carlos Luz, provisoriamente instalado no cargo por motivo de\ndoença de Café Filho. Nesse mesmo dia, a Câmara dos Deputados legitimou\na ação do general Lott e aprovou por 182 votos a 72 requerimento de\nCapanema solicitando o impedimento de Carlos Luz e sua substituição pelo\nvice-presidente do Senado, Nereu Ramos.\n\nEm abril de 1956, já no governo Kubitschek, Capanema passou o cargo de\nlíder da maioria na Câmara ao deputado Tarcilo Vieira de Melo. Em\nnovembro do mesmo ano, chefiou a delegação brasileira à IV Conferência\nGeral da UNESCO, em Nova Délhi, na condição de embaixador\nextraordinário. Em outubro de 1958 candidatou-se à reeleição para a\nCâmara e obteve novo mandato na legenda do PSD. Em 1959, foi nomeado\npelo presidente Juscelino Kubitschek ministro do Tribunal de Contas da\nUnião (TCU). Ocupou o cargo até 1961, quando retornou à Câmara.\n\nNa sequência da crise provocada pela renúncia do presidente Jânio\nQuadros (25/8/1961), Capanema participou das discussões e da aprovação\nda Emenda Constitucional n^o^ 4, conhecida como Ato Adicional\n(2/9/1961), que instituiu o sistema parlamentarista. A mudança de\nsistema de governo foi a fórmula encontrada pelo Congresso para\ncontornar o veto dos ministros militares à posse do vice-presidente João\nGoulart.\n\nNo decorrer de 1962, Goulart travou uma obstinada luta para recuperar os\nplenos poderes, insistindo particularmente na antecipação do plebiscito,\nprevisto para 1965, que referendaria ou não o sistema parlamentarista.\nEm meados de 1962, a maioria do Congresso já admitia a necessidade de\nrestituir alguns dos poderes presidenciais suprimidos pelo Ato\nAdicional. Nesse período, Capanema presidiu a comissão especial\nencarregada de elaborar a legislação complementar ao Ato Adicional e\napresentou um projeto autorizando Goulart a nomear um Conselho de\nMinistros Provisório, sem prévia anuência do Congresso, nos momentos de\ncrise. Com base nesse projeto, o senador Benedito Valadares apresentou\numa emenda convocando o plebiscito para 6 de janeiro de 1963. Levada à\nvotação em setembro de 1962, a emenda Valadares foi aprovada, apesar da\noposição de dirigentes do PSD, da UDN e do PSP. Em outubro seguinte,\nCapanema reelegeu-se deputado federal, sempre na legenda do PSD.\n\nEm janeiro de 1963, o plebiscito aprovou por expressiva maioria a volta\nao sistema presidencialista. Goulart lançou-se então com todo vigor à\ncampanha pelas reformas de base, ao lado da ala esquerda do PTB e de\norganizações esquerdistas como o PCB. Como a maioria dos dirigentes do\nPSD, Capanema passou a encarar com reservas o governo Goulart. Em 19 de\nmarço de 1964, Capanema pronunciou na X Convenção Nacional do PSD um\ndiscurso em defesa da estrita observância da Constituição no\nencaminhamento das reformas de base. Em 31 de março, quando se verificou\no confronto final entre o governo e a oposição, Capanema colocou-se ao\nlado do movimento político-militar que depôs João Goulart.\n\nDurante a presidência de Humberto Castelo Branco, empossado a 15 de\nabril de 1964, Capanema manteve-se na defesa do governo, manifestando,\nporém, em diversas ocasiões, sua oposição às medidas de força assumidas\npelo novo regime. Em novembro de 1964, no auge da crise entre o\ngovernador de Goiás, Mauro Borges, e o governo federal, discursou na\nCâmara elogiando a decisão do Supremo Tribunal Federal de conceder\nhabeas corpus garantindo o mandato do governador goiano. A crise\nculminou com a intervenção federal em Goiás, decretada por Castelo\nBranco em 30 de novembro de 1964.\n\nEm outubro de 1965, Capanema e outros líderes do PSD, como Ernâni Amaral\nPeixoto e Vieira de Melo, colocaram-se contra o projeto governamental de\nemenda constitucional que ampliava a competência da Justiça Militar,\ncriava novos casos de intervenção federal e estabelecia o Estatuto dos\nCassados Políticos. O projeto fora enviado por Castelo Branco ao\nCongresso a fim de aliviar as pressões que vinha sofrendo por parte dos\nmilitares mais radicais no sentido de impedir a posse de Francisco\nNegrão de Lima e Israel Pinheiro, eleitos em 3 de outubro pelas\ncorrentes de oposição para os governos da Guanabara e de Minas Gerais,\nrespectivamente. Na Câmara, Capanema foi designado presidente da\ncomissão encarregada de opinar sobre o Estatuto dos Cassados Políticos.\nSegundo Luís Viana Filho, então chefe do Gabinete Civil da Presidência,\nCapanema “dissuadiu Castelo Branco da possibilidade de aprovação das\nmedidas governamentais na Câmara, onde a maioria, representada pelo PSD\ne o PTB, desejava preservar o ex-presidente Juscelino Kubitschek”, cujos\ndireitos políticos haviam sido suspensos pelo Ato Institucional n^o^ 1\n(9/4/1964). Em 27 de outubro de 1965, as medidas foram tomadas à revelia\ndo Congresso, através da decretação do Ato Institucional n^o^ 2 pelo\npresidente Castelo Branco.\n\nCom a extinção dos partidos políticos, também determinada pelo AI-2,\nCapanema ingressou em 1966 na Aliança Renovadora Nacional (Arena),\npartido de apoio ao governo, tornando-se membro de sua comissão\nexecutiva nacional. Após sua reeleição para a Câmara pela Arena em\nnovembro de 1966, o general Artur da Costa e Silva, candidato à sucessão\npresidencial, indicou-o para a vice-presidência da República, como\ncompanheiro de chapa. A escolha acabou porém recaindo em Pedro Aleixo,\nnome proposto pelo presidente Castelo Branco.\n\nEm 1969, durante o recesso do Congresso determinado pelo Ato\nInstitucional n^o^ 5 (13/12/1968), Capanema encaminhou ao presidente da\nArena, Rondon Pacheco, um plano de reforma eleitoral inspirado no\nsistema vigente na República Federal da Alemanha, em que procurava\nconciliar o princípio da representação proporcional com a eleição de\ndeputados federais e estaduais por distrito. O plano de reforma\neleitoral de Capanema pôde, assim, ser considerado uma tentativa de\nadaptar o funcionamento do sistema representativo ao regime de força\ninstituído pelo AI-5. Mais tarde, no início do governo do presidente\nJoão Figueiredo (1979), os líderes do Partido Democrático Social (PDS),\nsucessor da Arena, insistiriam na necessidade de implantação de um\nsistema eleitoral misto em bases semelhantes à proposta de Capanema, a\nfim de diminuir as possibilidades de acesso da oposição ao poder.\n\nEm novembro de 1970, Capanema elegeu-se senador por Minas Gerais na\nlegenda da Arena. Durante sua permanência no Senado, foi presidente da\nComissão de Educação e Cultura de 1971 a 1973 e vice-presidente da\nComissão de Constituição e Justiça a partir de 1975. Em janeiro de 1979,\nao término de seu mandato no Senado, encerrou sua carreira política,\nfixando residência no Rio de Janeiro. Em 1980, candidatou-se a uma\ncadeira na Academia Brasileira de Letras, tendo sido entretanto\nderrotado pela escritora Diná Silveira de Queirós.\n\nFoi presidente do Museu de Arte Moderna do Rio de Janeiro, membro do\nconselho deliberativo da Bienal de São Paulo, presidente do Círculo de\nArte Vera Ianacopoulos, no Rio de Janeiro, e membro do conselho\ndeliberativo da Fundação Mílton Campos, criada pela Arena em setembro de\n1975.\n\nFaleceu na cidade do Rio de Janeiro em 10 de março de 1985.\n\nEra casado com Maria de Alencastro Massot, filha do coronel Afonso\nEmílio Massot, comandante por mais de 20 anos da Brigada Militar do Rio\nGrande do Sul. Teve dois filhos.\n\nA maioria de seus trabalhos publicados é constituída por discursos\npronunciados ao longo de sua carreira política. Entre estes contam-se:\n*Os grandes dias do Brasil novo* (em colaboração com Francisco Campos e\nJoão Marques dos Reis, 1939), *A educação e a saúde* *no decênio\ngetuliano* (1941), *Algumas notas documentárias sobre o projeto da\nConstituição* (1946), *Panorama da educação nacional* (em colaboração\ncom Getúlio Vargas, 1957) e *Discursos e outros escritos* (1980). Heitor\nVilla-Lobos dedicou-lhe uma de suas importantes peças sinfônicas, a\n*Bachiana brasileira n^o^ 7*, composta em 1942.\n\nO arquivo de Gustavo Capanema encontra-se depositado no Centro de\nPesquisa e Documentação de História Contemporânea do Brasil (Cpdoc) da\nFundação Getulio Vargas. Com base nesse acervo, Simon Schwartzman\norganizou a obra *Estado Novo: um autorretrato* (arquivo Gustavo\nCapanema) (1982) e escreveu, com Helena Maria Bousquet Bomeny e Vanda\nMaria Aderaldo Costa, *Tempos de Capanema* (1984; 2. ed., 2000). Também\ncom base nesse material, Priscila Fraiz escreveu *A construção de um eu\nautobiográfico: o arquivo de Gustavo Capanema* (dissertação de mestrado,\nUERJ, 1994), Aline Lopes de Lacerda escreveu *Fotografia e discurso\npolítico no Estado Novo; uma análise do projeto editorial “Obra\nGetuliana”* (dissertação de mestrado, UFRJ, 1998), e Murilo Badaró\npublicou *Gustavo Capanema, a revolução na cultura* (2000).\n\nPaulo Brandi\n\n**FONTES:** ANDRADE, F. *Relação*; ARQ. INST. NAC. ESTUDOS PEDAGÓGICOS;\nARQ. OSVALDO ARANHA; *Arte Hoje* (22/4/79); BANDEIRA, L. *Governo*;\nBRANCO, C. *Energia*; CAFÉ FILHO, J. *Do* s*indicato*; CALMON, P.\n*História*; CÂM. DEP. *Deputados*; CÂM. DEP. *Deputados brasileiros.*\nRepertório (1963-1967 e 1967-1971); CÂM. DEP. *Relação dos dep*.; CÂM.\nDEP. *Relação nominal dos senhores*; CARNEIRO, G. *História*; CARONE, E.\n*República nova*; CASTELO BRANCO, C. *Introdução* (1); CISNEIROS, A.\n*Parlamentares*; COHN, G. *Petróleo*; CONSULT. MAGALHÃES, B.; *Correio\nda Manhã* (27/12/1931); CORRESP. ARQ. PÚBL. MINEIRO; CORTÉS, C.\n*Homens*; COSTA, M. *Cronologia*; COUTINHO, A. *Brasil*; *Cultura\nPolítica* (11/1942); Diário do congresso nacional; *Diário Oficial*\n(10/4/1932); DULLES, J. *Getúlio*; *Encic. Mirador*; *Estado de S.\nPaulo* (19/9/1976, 23/3/1984, 1/9/1985); FAVERO, M. *Universidade*;\nFLYNN, P. *Legião*; *Folha de S.Paulo* (21/10/1984); FRANCO, A.\n*Escalada*; *Globo* (11, 16, 17/3/1985); *Grande encic. Delta*;\nHIRSCHOWICZ, E. *Contemporâneos*; *Jornal* (27/2/1931); *Jornal do\nBrasil* (8/9/1974, 17/11/1975, 1/8/1976, 23/7/1983, 11, 12, 17/3/1985);\nLEITE, A. *História*; LEVINE, R. *Vargas*; MACEDO, N. *Aspectos*;\nMACHADO, F. *Últimos*; MAGALHÃES, B. Artur; MELO, O. *Marcha*; MIN.\nGUERRA. *Almanaque*; MIN. MAR. *Almanaque*; NABUCO, C. *Vida*; NOGUEIRA\nFILHO, P. *Ideais*; PAULA, S. *Acumulação*; PEIXOTO, A. *Getúlio*;\n*Perfil* (1972); *Personalidades*; POPPINO, R. *Federal*; *Quem é quem\nno Brasil*; *Regionalismo*; *Rev. Arq. Públ. Mineiro* (12/76);\nROMANELLI, O. *História*; SCHWARTZMAN, S. *Intelectual*;SENADO. *Dados\nbiográficos* (8); SENADO. *Endereços*; SENADO. *Relação*; SILVA, G.\n*Constituinte*; SILVA, H. *1931*; SILVA, H. *1934*; SILVA, H. *1935*;\nSILVA, H. *1937*; SILVA, H. *1938*; SILVA, H. *1945*; SILVA, H. *1954*;\nSODRÉ, N. *História* *da imprensa*; *Subsídios*; TÁVORA, J. *Vida*;\nTOBIAS, J. *História*; TORRES, J. *História de Minas*; *Veja* (20/3/85);\nVIANA FILHO, L. *Governo*; VÍTOR, M. *Batalha*; *Who’s who in Latin\nAmerica*.\n","ref":"**FONTES:** ANDRADE, F. *Relação*; ARQ. INST. NAC. ESTUDOS PEDAGÓGICOS;\nARQ. OSVALDO ARANHA; *Arte Hoje* (22/4/79); BANDEIRA, L. *Governo*;\nBRANCO, C. *Energia*; CAFÉ FILHO, J. *Do* s*indicato*; CALMON, P.\n*História*; CÂM. DEP. *Deputados*; CÂM. DEP. *Deputados brasileiros.*\nRepertório (1963-1967 e 1967-1971); CÂM. DEP. *Relação dos dep*.; CÂM.\nDEP. *Relação nominal dos senhores*; CARNEIRO, G. *História*; CARONE, E.\n*República nova*; CASTELO BRANCO, C. *Introdução* (1); CISNEIROS, A.\n*Parlamentares*; COHN, G. *Petróleo*; CONSULT. MAGALHÃES, B.; *Correio\nda Manhã* (27/12/1931); CORRESP. ARQ. PÚBL. MINEIRO; CORTÉS, C.\n*Homens*; COSTA, M. *Cronologia*; COUTINHO, A. *Brasil*; *Cultura\nPolítica* (11/1942); Diário do congresso nacional; *Diário Oficial*\n(10/4/1932); DULLES, J. *Getúlio*; *Encic. Mirador*; *Estado de S.\nPaulo* (19/9/1976, 23/3/1984, 1/9/1985); FAVERO, M. *Universidade*;\nFLYNN, P. *Legião*; *Folha de S.Paulo* (21/10/1984); FRANCO, A.\n*Escalada*; *Globo* (11, 16, 17/3/1985); *Grande encic. Delta*;\nHIRSCHOWICZ, E. *Contemporâneos*; *Jornal* (27/2/1931); *Jornal do\nBrasil* (8/9/1974, 17/11/1975, 1/8/1976, 23/7/1983, 11, 12, 17/3/1985);\nLEITE, A. *História*; LEVINE, R. *Vargas*; MACEDO, N. *Aspectos*;\nMACHADO, F. *Últimos*; MAGALHÃES, B. Artur; MELO, O. *Marcha*; MIN.\nGUERRA. *Almanaque*; MIN. MAR. *Almanaque*; NABUCO, C. *Vida*; NOGUEIRA\nFILHO, P. *Ideais*; PAULA, S. *Acumulação*; PEIXOTO, A. *Getúlio*;\n*Perfil* (1972); *Personalidades*; POPPINO, R. *Federal*; *Quem é quem\nno Brasil*; *Regionalismo*; *Rev. Arq. Públ. Mineiro* (12/76);\nROMANELLI, O. *História*; SCHWARTZMAN, S. *Intelectual*;SENADO. *Dados\nbiográficos* (8); SENADO. *Endereços*; SENADO. *Relação*; SILVA, G.\n*Constituinte*; SILVA, H. *1931*; SILVA, H. *1934*; SILVA, H. *1935*;\nSILVA, H. *1937*; SILVA, H. *1938*; SILVA, H. *1945*; SILVA, H. *1954*;\nSODRÉ, N. *História* *da imprensa*; *Subsídios*; TÁVORA, J. *Vida*;\nTOBIAS, J. *História*; TORRES, J. *História de Minas*; *Veja* (20/3/85);\nVIANA FILHO, L. *Governo*; VÍTOR, M. *Batalha*; *Who’s who in Latin\nAmerica*.\n","dic":"DHBPR"}
