{"title":"CARDOSO, Fausto","cargoss":["Deputado federal","Deputado federal"],"cargos_esp":[0,0],"datas_ini":[1906,1900],"datas_fim":[1906,1902],"estados":["SE","SE"],"autor":[0],"content":"**CARDOSO, Fausto**\n\n\\*dep. fed. SE 1900-1902 e 1906.\n\n*Fausto de Aguiar Cardoso* nasceu em Divina Pastora (SE) no dia 22 de\ndezembro de 1864, filho do tenente-coronel Félix Zeferino Cardoso e de\nMaria do Patrocínio de Aguiar Cardoso.\n\nFez os primeiros estudos em sua localidade de origem, nos municípios\nsergipanos de Maruim, Capela, na capital Aracaju, e concluiu o curso\nsecundário no Colégio Sete de Setembro, em Salvador. Ingressou em 1880\nna Faculdade de Direito do Recife e bacharelou-se em 1884. Enquanto\nestudante editou o jornal *Saara*. Frequentou os círculos literários e\nfilosóficos da chamada Escola do Recife, que abrigava as ideias\npositivistas e evolucionistas do final do século XIX, sendo considerado\ndiscípulo de Tobias Barreto. Logo depois de formado regressou a Sergipe\ne foi trabalhar como promotor público na cidade de Capela. Em junho de\n1887 foi designado para a promotoria de Laranjeiras, principal fórum\nsergipano, tendo encontrado a cidade em plena efervescência, envolvida\npela propaganda republicana. Reconduzido ao cargo de promotor pelo\nPartido Liberal em 1889, ironicamente foi destituído em 1890, após a\nproclamação da República (15/11/1889), apesar de ter sido um dos mais\ndestacados proselitistas da causa.\n\nSeguiu então para a cidade do Rio de Janeiro e dedicou-se à advocacia,\nao jornalismo e ao magistério. Nomeado professor de história universal\npor Benjamin Constant, em seguida passou a lente de história da Escola\nNormal e, mais tarde, do Pedagogium, do qual foi também diretor. Foi\nainda lente de história da arte na Escola de Belas Artes e de filosofia\ndo direito na Faculdade de Direito.\n\nAtivo participante da política republicana em Sergipe, esteve do lado de\noutros intelectuais, como Sílvio Romero, que apoiaram Manuel Valadão nas\ndisputas de 1894 e proclamaram a derrubada do governo constitucional de\nJosé Calazans. Representativo da ordem conservadora, que permitiu o\ncontrole da política sergipana pelo grupo liderado por Olímpio Campos,\nLeandro Siqueira Maciel e José Luís Coelho e Campos, o governo Calazans\nfoi hostilizado nos seus últimos meses pelos republicanos florianistas\nligados a Valadão. Refugiado na cidade de Rosário do Catete, ainda\nlegalmente no poder, Calazans conviveu com outro governo, instalado na\ncapital e entregue ao presidente da Assembleia Legislativa. A situação\nde duplicidade de poderes originou a divisão entre “pebas” (sinônimo de\npovo de Aracaju) e “cabaús” (referência à região canavieira do interior\ndo estado onde Calazans se refugiara), que iria marcar a política\nsergipana no final do século XIX.\n\nBeneficiado pelo acordo de pacificação entre Martinho Garcez e Olímpio\nCampos firmado em 1899, garantindo a este último o domínio da política\nestadual a partir do controle sobre o Partido Republicano Sergipense\n(PRS), Fausto Cardoso foi eleito deputado federal por seu estado em\n1900. Assumiu em maio desse ano sua cadeira na Câmara dos Deputados, e\ndestacou-se na tribuna parlamentar como principal crítico da política\neconômica do presidente Campos Sales (1898-1902) e do ministro da\nFazenda Joaquim Murtinho. Defensor das ideias de Rui Barbosa e do\nprotecionismo para incentivar o crescimento da indústria, protagonizou\nlongos debates na Câmara com Serzedelo Correia. Condenou o *funding\nloan* (acordo de renegociação da dívida externa brasileira), tratando-o\ncomo um atentado à soberania nacional, já que iria aumentar ainda mais a\ndependência de uma economia historicamente voltada para o comércio\nexterior. Segundo destaca Terezinha Oliva, “diante da unanimidade com\nque os políticos apoiavam o programa financeiro de Campos Sales,\nunanimidade, aliás, garantida pela ‘política dos governadores’, a voz\ndestoante de Fausto Cardoso soava esdrúxula e violenta”.\n\nNo ano final de seu mandato (1902), após ferrenha campanha movida na\nimprensa sergipana por Gumercindo Bessa contra o governo do monsenhor\nOlímpio Campos (1899-1902), Fausto Cardoso rompeu o acordo que lhe havia\npermitido eleger-se e divulgou na capital federal acusações de\ntruculência praticada pela política olimpista para manter-se no poder.\nEm discurso proferido no dia 30 de abril de 1902, afirmou que os\ndesmandos do presidente de Sergipe eram um “desrespeito à terra de\nTobias Barreto”. Apesar da divisão na política sergipana, o olimpismo\ncontinuou a predominar: assim, o sucessor indicado por Olímpio Campos,\nJosino de Meneses, foi eleito 1902, da mesma forma como seu irmão\nGuilherme de Sousa Campos em 1905.\n\nSurgido em 1906, o Partido Progressista (PP) iria reunir os descontentes\ncom o mando de Olímpio Campos. O *Jornal de Sergipe* estampava em suas\npáginas veementes protestos contra a situação, chegando a apontar, na\nedição de 11 de janeiro de 1906, a revolução como saída: “Só um remédio\nencontramos para sairmos deste estado de coisa: é a revolução. Não a\nrevolução pelas armas, que seria inoportuna, mas a revolução pacífica, a\nrevolução pelas urnas, de onde possam surgir homens que ouçam nossas\nqueixas.” Nas eleições daquele ano, Fausto Cardoso voltou a ser eleito\ndeputado federal Assumiu sua cadeira na Câmara dos Deputados em maio,\nmas ainda no mesmo ano retornou a Sergipe, com o objetivo de coordenar o\nmovimento popular que se projetava contra o olimpismo na política\nsergipana.\n\nA revolta contra o governo de Guilherme Campos foi articulada em meio ao\nassédio popular em torno do deputado – daí ter-se tornado conhecida como\na “revolta de Fausto Cardoso” –, mas o levante da polícia de Aracaju,\nque serviu para desencadeá-la na madrugada do dia 10 de agosto de 1906,\naconteceu enquanto ele se encontrava ausente da cidade, em viagem ao\nmunicípio de Divina Pastora, em visita aos pais. No retorno à capital,\nFausto Cardoso foi recebido como o “messias sergipano”: para seus\npartidários, representava a chegada da vontade popular ao poder. Após a\nrenúncia de Guilherme Campos, o governo de Sergipe foi entregue ao\ndesembargador João Maria Loureiro Tavares, representante do Poder\nJudiciário. Com essa transferência de poder, os progressistas buscavam\ndar um cunho de legalidade à revolta, denunciada na Câmara como golpe de\nestado pelo deputado situacionista José Rodrigues Dória. A intervenção\ndo presidente Rodrigues Alves (1902-1906) mudou, porém, o curso dos\nacontecimentos. Tropas federais estacionadas na Bahia partiram para\nAracaju e controlaram rapidamente os revoltosos, reempossando Guilherme\nCampos. Na retomada do palácio do governo em 28 de agosto de 1906,\nalvejaram Fausto Cardoso, que veio a falecer aos 42 anos de idade. Em\ndecorrência, em 9 de novembro de 1906 Olímpio Campos foi assassinado com\n11 tiros e duas facadas pelos filhos do deputado sergipano na praça XV\nde Novembro, na capital da República.\n\nO culto a Fausto Cardoso teve início logo após sua morte, mas foi\nduramente reprimido pelo olimpismo que ainda se manteve no poder, mesmo\ndepois do assassinato do monsenhor Olímpio Campos, até o governo de José\nRodrigues da Costa Dória (1909-1911), seu último representante no\nExecutivo sergipano. Nesses anos, muitos dos principais partidários do\nfaustismo refugiaram-se fora do estado, e o *Jornal de Sergipe* foi\nextinto. Com a “política das salvações” do presidente Hermes da Fonseca\n(1910-1914) e o consequente remanejamento oligárquico, a eleição de\nAntônio José Siqueira de Meneses para presidente do estado interrompeu o\ncontrole do grupo olimpista e permitiu que a memória do líder da revolta\nde 1906 circulasse livremente. Foi o próprio Siqueira de Meneses,\ndurante a campanha para suceder a Rodrigues Dória, que lançou a ideia de\nse construir um monumento em homenagem a Fausto Cardoso.\n\nEm abril de 1911, presidida por Olegário Dantas, surgiu a comissão\npromotora do monumento, que iria se empenhar para arrecadar fundos com\nvistas à realização da obra. Assim, segundo Giliard da Silva Prado, em\nnovembro de 1911, sem qualquer apoio financeiro do governo sergipano, os\npromotores da campanha celebraram um contrato com o escultor italiano\nLorenzo Petrucci, no valor de 25 contos e 500 mil réis. Após essa\nprimeira vitória, a escolha do local em que ficaria o monumento\napareceria como a batalha final pela memória de Fausto Cardoso. No\nprimeiro semestre de 1912, o intendente municipal de Aracaju, Napoleão\nde Carvalho, após requerimento da comissão, sancionou a lei alterando o\nnome da principal praça do centro da cidade, em frente ao palácio do\ngoverno, de praça Benjamim Constant para praça Fausto Cardoso, com as\nnovas placas indicativas afixadas em 17 de abril. Em 15 de agosto, os\nrestos mortais de Fausto Cardoso foram retirados do cemitério Santa\nIsabel e levados para a base do monumento. Finalmente, em 8 de setembro,\nSiqueira de Meneses inaugurou a estátua que consagrava a memória cívica\ndo político sergipano.\n\nAlém de artigos na imprensa e discursos parlamentares, Fausto Cardoso\npublicou *Cosmogenia política americana* (1892), *Concepção monista do\nuniverso* (1894), *Taxionomia social* (1898), *Lei e arbítrio* -\n*discurso em defesa de uma ditadura parlamentar, pelo Congresso\nNacional* (1902).\n\nSérgio Montalvão\n\n**FONTES:** BARRETO, L. *Pequeno*;BITTENCOURT, L. *Homens*; DANTAS, J.\n*História*; GUARANÁ, M.; PRADO, G. *Prólogo*; SOUZA, T. *Impasses.*\n","ref":"**FONTES:** BARRETO, L. *Pequeno*;BITTENCOURT, L. *Homens*; DANTAS, J.\n*História*; GUARANÁ, M.; PRADO, G. *Prólogo*; SOUZA, T. *Impasses.*\n","dic":"DHBPR"}
