{"title":"CARNEIRO, José Joaquim Domingues","cargoss":["Senador","Senador"],"cargos_esp":[0,0],"datas_ini":[1909,1891],"datas_fim":[1910,1892],"estados":["CE","CE"],"autor":[0],"content":"**CARNEIRO, José Joaquim Domingues**\n\n\\* sen. CE 1891-1892 e 1909-1910.\n\n*José Joaquim Domingues Carneiro* nasceu em São Mateus, atual Jucás\n(CE), em setembro de 1836, filho do vigário José Joaquim Domingues\nCarneiro.\n\nIniciou os estudos com o auxílio do pai. Mudou-se para Russas (CE) e daí\npara Fortaleza, matriculando-se no Liceu do Ceará em 1854. Seguiu para o\nColégio das Artes do Recife, onde concluiu os preparatórios. Cursou a\nFaculdade de Direto do Recife, formou-se em 1863 e retornou a Russas. Em\njunho de 1865 foi nomeado promotor público em Aquiraz (CE), cargo que\ndeixou no ano seguinte voltando a Russas como juiz municipal e de\nórfãos. Acumulou ainda as funções de inspetor das Escolas e delegado de\nPolícia. Foi nomeado juiz da comarca de Inhamuns em 1873, de Granja em\n1879 e de Baturité em 1881, todas no Ceará.\n\nFoi membro do Partido Liberal do Império e, com o fim da Monarquia e a\ninstalação da República em 15 de novembro de 1889, em 1891, logo após a\npromulgação da primeira Constituição republicana do Brasil (24/2/1891),\nfoi eleito senador pelo Ceará. Assumiu, em 6 de maio daquele ano, sua\ncadeira no Senado Federal no Rio de Janeiro, agora Distrito Federal, e\ncumpriu seu mandato até 1^o^ de outubro de 1892. Ainda em 1891 foi\nnomeado desembargador da Relação de Fortaleza e procurador da Soberania\ne Fazenda Nacional. Por ser o mais antigo magistrado em exercício,\nassumiu a presidência do Superior Tribunal Cearense. Também em 1891 foi\neleito deputado à Constituinte estadual cearense, a qual também\npresidiu. Aposentou-se da magistratura em julho de 1909 e no mesmo ano\nassumiu uma cadeira no Senado Federal no lugar de Francisco Sá, que\nhavia renunciado ao mandato por ter sido nomeado ministro da Viação.\nPermaneceu no Senado até 1910, quando renunciou ao mandato para\nfavorecer a volta de Francisco Sá, eleito em janeiro de 1911. Foi o\ncandidato da oligarquia comandada pela família Acióli nas eleições de\n1912, mas acabou sendo derrotado por Franco Rabelo.\n\nFoi ainda provedor da Santa Casa de Misericórdia do Ceará.\n\nFaleceu em Fortaleza no dia 9 de setembro de 1915.\n\nEra casado com Ana de Araújo Domingues Carneiro.\n\nKleiton de Sousa Moraes\n\n**FONTES:** GIRÃO, V. *Ceará* (p.79-80); GUIMARÃES, H. *Deputados*\n(p.362-363); LEITE NETO, L. *Catálogo biográfico* (v.3, p.1.639-40).\n","ref":"**FONTES:** GIRÃO, V. *Ceará* (p.79-80); GUIMARÃES, H. *Deputados*\n(p.362-363); LEITE NETO, L. *Catálogo biográfico* (v.3, p.1.639-40).\n","dic":"DHBPR"}
