{"title":"CARTAXO, Antônio Joaquim do Couto","cargoss":["Constituinte","Deputado federal"],"cargos_esp":[0,0],"datas_ini":[1891,1891],"datas_fim":[1891,1893],"estados":[0,"PB"],"autor":["Raimundo Helio Lopes"],"content":"**CARTAXO, Antônio Joaquim do Couto**\n\n\\*const. 1891; dep. fed. PB 1891-1893.\n\n*Antônio Joaquim do Couto Cartaxo* nasceu na cidade de Cajazeiras (PB).\n\nFormou-se em direito e exerceu a advocacia na Paraíba e no Ceará.\nIngressou na política ainda durante o Império, quando militou nas\nfileiras do Partido Conservador.\n\nDepois que o marechal Deodoro da Fonseca, sustentado por setores do\nExército e por civis, depôs o gabinete de ministros do Império chefiado\npelo visconde de Ouro Preto e instalou o regime republicano em 15 de\nnovembro de 1889, foi eleito deputado constituinte pelo estado da\nParaíba. Assumiu sua cadeira em 15 de novembro de 1890, quando foi\ninstalada a Assembleia Nacional Constituinte no Rio de Janeiro, agora\nDistrito Federal, e depois de promulgada a nova Carta constitucional, em\n24 de fevereiro de 1891, passou a cumprir em junho seguinte o mandato\nordinário, até dezembro de 1893.\n\nRaimundo Helio Lopes\n\n**FONTES:** ABRANCHES, J. *Governos*; CÂM. DEP. *Deputados brasileiros.*\n","ref":"**FONTES:** ABRANCHES, J. *Governos*; CÂM. DEP. *Deputados brasileiros.*\n","dic":"DHBPR"}
