{"title":"CARVALHO, Afonso de","cargoss":["Deputado Geral","Presidente de associação ou confederação de empregados ou empregadores","Presidente de associação ou confederação de empregados ou empregadores","Presidente de associação ou confederação de empregados ou empregadores","Ministro da Justiça","min Instrução"],"cargos_esp":[0,0,0,0,0,0],"datas_ini":[1869,1869,1870,1889,1891,1891],"datas_fim":[1869,1870,1871,1889,1891,1891],"estados":["BA","PR","MG","BA",0,0],"autor":["Luciana Pinheiro"],"content":"**CARVALHO, Afonso de**\n\n\\* dep. geral BA 1869; pres. PR 1869-1870; pres. MG 1870-1871; pres. BA\n1889; min. Just. 1891; min. Instrução 1891.\n\n*Antônio Luís Afonso de Carvalho*nasceu em Salvador no dia 5 de março de\n1828, filho de José Afonso de Carvalho e de Rosa Maria de Jesus\nCarvalho.\n\nFez seus primeiros estudos na capital baiana. Transferindo-se para\nPernambuco, matriculou-se na Faculdade de Ciências Jurídicas e Sociais\nde Olinda e graduou-se em 1849. Dois anos após sua formatura ingressou\nna magistratura, assumindo o posto de juiz municipal e de órfãos do\ntermo de Feira de Santana, na Bahia. Em 1854 foi removido para Salvador,\nmas retornou a Feira de Santana no ano seguinte como delegado. Entre\n1855 e 1856, durante a epidemia de cólera, trabalhou ativamente e, pelos\nserviços prestados à comunidade local, recebeu o título de cavaleiro da\nOrdem da Rosa.\n\nNa década de 1860 ingressou na política, estabelecendo uma relação\nestreita como o Partido Conservador. Eleito deputado provincial, exerceu\no mandato no biênio 1861-1862, mas não abandonou a magistratura. Assim,\nem 1862, retomou as funções de juiz de direito na comarca baiana de\nMonte Alto. Em maio de 1869 iniciou novo mandato, agora de deputado\ngeral pela Bahia, mas em novembro renunciou por ter sido nomeado\npresidente da província do Paraná. Exerceu o cargo até abril de 1870, e\nde outubro desse ano até 1871 foi presidente de Minas Gerais. Entre\njunho de 1872 e julho de 1875 foi juiz de direito em Inhambupe (BA).\nTransferiu-se então para Salvador e assumiu a 1^a^ Vara Cível,\ntornando-se em setembro auditor de guerra. Em fevereiro de 1886 foi\nnomeado desembargador do Tribunal da Relação e em maio de 1889 assumiu a\npresidência da província da Bahia.\n\nEm março de 1891, com a República já instaurada, assumiu o posto de\nsegundo vice-governador de seu estado natal durante a administração de\nJosé Gonçalves da Silva (1890-1891). Dois meses depois, no dia 22 de\nmaio, tomou posse como ministro da Justiça, nomeado pelo então\npresidente da República Deodoro da Fonseca (1890-1891) no lugar de\nHenrique Pereira de Lucena, o barão de Lucena. Comandou ainda como\ninterino a partir de julho a pasta da Instrução, Correios e Telégrafos,\nsucedendo a João Barbalho Uchoa Cavalcanti, e durante sua gestão as\nfaculdades de Direito instaladas no Rio de Janeiro e na Bahia foram\nreconhecidas pelo governo. Deixou os dois ministérios em 23 de novembro\nde 1891, quando Deodoro renunciou e foi substituído pelo vice-presidente\nFloriano Peixoto. Substituiu-o em ambos José Higino Duarte Pereira.\n\nAinda em novembro de 1891 regressou à Bahia e voltou a atuar como\ndesembargador. Ao longo de sua trajetória profissional militou também no\njornalismo, escrevendo para o *Jornal da Bahia*. Recebeu também a\ncondecoração de cavaleiro da Ordem de Cristo.\n\nFaleceu em Salvador no dia 25 de janeiro de 1892.\n\nLuciana Pinheiro\n\n**FONTES:** ABRANCHES, J. *Governos* (p.401); CASA CIVIL DO PARANÁ.\nDisponível em: \\<www.casacivil.pr.gov.br/\\>. Acesso em: 10/2/2011; VELHO\nSOBRINHO, J. *Dicionário* (v.1, p.87).\n","ref":"**FONTES:** ABRANCHES, J. *Governos* (p.401); CASA CIVIL DO PARANÁ.\nDisponível em: \\<www.casacivil.pr.gov.br/\\>. Acesso em: 10/2/2011; VELHO\nSOBRINHO, J. *Dicionário* (v.1, p.87).\n","dic":"DHBPR"}
