{"title":"CARVALHO, Antônio Pereira do Amaral","cargoss":["Deputado federal"],"cargos_esp":[0],"datas_ini":[1921],"datas_fim":[1923],"estados":["SP"],"autor":["Henrique Sugahara Francisco"],"content":"**CARVALHO, Antônio Pereira do Amaral**\n\n**\\***dep. fed. SP 1921-1923.\n\n*Antônio Pereira do Amaral Carvalho* nasceu em Jaú (SP) no dia 9 de\nagosto de 1876, filho de Domingos Pereira de Carvalho e de Ana Marcelina\nCampanhã de Carvalho.\n\nApós fazer o curso de humanidades no Seminário Episcopal de São Paulo,\ningressou na Faculdade de Medicina do Rio de Janeiro, formando-se em\n1904. No dia 9 de agosto do ano seguinte, defendeu na mesma instituição\ntese de doutorado intitulada *Tratamento cirúrgico das hemorroidas*.\nAinda na então capital federal, foi médico clínico-cirúrgico do Hospital\nda Real Benemérita Sociedade Portuguesa. Em seguida, retornou à cidade\nnatal para estabelecer uma clínica médica. Foi também o primeiro diretor\nclínico da Santa Casa de Misericórdia, entre 1906 e 1922. Além de\nexercer a Medicina, dedicou-se à agricultura, tendo sido um destacado\ncafeicultor.\n\nIniciou a carreira política sendo eleito deputado federal pelo segundo\ndistrito de São Paulo no início de 1921. Assumindo sua cadeira na Câmara\ndos Deputados, no Rio de Janeiro, em maio seguinte, nela permaneceu até\ndezembro de 1923, quando se encerraram seu mandato e a legislatura. Em 8\nde julho de 1924 foi eleito senador estadual na vaga aberta com o\nfalecimento de Uladislau Herculano de Freitas.\n\nFoi também médico da Maternidade de Jaú, inaugurada em 1936 e instituída\npor seus pais, que doaram um terreno de 25 mil metros quadrados para a\nconstrução do edifício, além de bens e recursos financeiros. Fundada em\nvirtude dos altos índices de mortalidade infantil e de gestantes na\ncidade, e visando atender às mulheres das camadas mais pobres, a\ninstituição, com o passar do tempo, ampliou suas atividades, tornando-se\nna década de 1950 um hospital geral. Na década seguinte começou a se\nespecializar no tratamento do câncer, o que a alçou à condição de\npioneira na área de oncologia no estado de São Paulo. Em homenagem a\nAntônio Pereira do Amaral Carvalho, em 1954 passou a denominar-se\nHospital Amaral Carvalho e Maternidade de Jaú. Vinte e um anos depois o\nconjunto adotou o nome atual, Hospital Amaral Carvalho.\n\nFaleceu em Jaú do dia 4 de janeiro de 1954.\n\nEra casado com Ana Marcelina do Amaral Carvalho e teve dois filhos.\n\nHenrique Sugahara Francisco\n\n**FONTES:** AZEVEDO, A; FONSECA, A*. Câmara*; *Diário Oficial do Estado\nde São Paulo* (17/8/1976, p.66-67); *Folha da Manhã* (6/1/1954); Jaú\nfatos e fotos. Disponível\nem:*\\<*http://jaufatosefotos.br.tripod.com/recursoshumanossaudepublica.htm\\>,\n\\<http://jaufatosefotos.br.tripod.com/de1901ate1950.htm\\>; MIRANDA, C.;\nDABAT, C. *Memórias*.\n","ref":"**FONTES:** AZEVEDO, A; FONSECA, A*. Câmara*; *Diário Oficial do Estado\nde São Paulo* (17/8/1976, p.66-67); *Folha da Manhã* (6/1/1954); Jaú\nfatos e fotos. Disponível\nem:*\\<*http://jaufatosefotos.br.tripod.com/recursoshumanossaudepublica.htm\\>,\n\\<http://jaufatosefotos.br.tripod.com/de1901ate1950.htm\\>; MIRANDA, C.;\nDABAT, C. *Memórias*.\n","dic":"DHBPR"}
