{"title":"CARVALHO, Carlos Antônio da França","cargoss":["Deputado Geral","Deputado Geral","Constituinte","Deputado federal"],"cargos_esp":[0,0,0,0],"datas_ini":[1885,1878,1891,1891],"datas_fim":[1885,1881,1891,1893],"estados":["RJ","RJ",0,"RJ"],"autor":["Adrianna Setemy"],"content":"**CARVALHO, Carlos Antônio da França**\n\n\\*dep. geral RJ 1878-1881 e 1885; const. 1891; dep. fed. RJ 1891-1893.\n\n*Carlos Antônio da França Carvalho* nasceu em Iguaçu (RJ) em 1845, filho\nde Carlos Antônio de Carvalho e de Maria Luísa de Azevedo Carvalho.\n\nFormou-se em ciências jurídicas na Faculdade de Direito de São Paulo.\nDefensor dos ideais abolicionistas, fundou a sociedade Fraternização,\nque logrou libertar muitos escravos. Consta em sua biografia que\nalforriou todos os escravos cativos na fazenda que pertencia a ele\npróprio e a seu irmão, o conselheiro Leôncio de Carvalho. Foi redator\nchefe da *Reforma*, órgão da imprensa liberal, de 1869 a 1879. Filiado\nao Partido Liberal, foi deputado provincial no Rio de Janeiro em algumas\nlegislaturas e também deputado geral, de 1878 a 1881 e, novamente, em\n1885.\n\nCom a proclamação da República em 15 de novembro de 1889 e a convocação\nde eleições para o Congresso Nacional Constituinte, foi eleito deputado\npelo estado do Rio de Janeiro em 15 de setembro de 1890. Tomou posse em\n15 de novembro, participou dos trabalhos de elaboração da primeira\nConstituição republicana, promulgada em 24 de fevereiro de 1891, e em\njunho seguinte, ao ter início a legislatura ordinária, assumiu sua\ncadeira na Câmara dos Deputados, até dezembro de 1893, quando se\nencerraram seu mandato e a legislatura.\n\nFundou a Faculdade Livre de Direito do Rio de Janeiro, da qual foi\ndiretor até morrer. Faleceu no Rio de Janeiro em maio de 1909.\n\nPublicou em três volumes os discursos que pronunciou na Assembleia Geral\ndo Império.\n\nAdrianna Setemy\n\n**FONTES:** ABRANCHES, J. *Governos* (v.1); BRITO, C. *Mulher.*\n","ref":"**FONTES:** ABRANCHES, J. *Governos* (v.1); BRITO, C. *Mulher.*\n","dic":"DHBPR"}
