{"title":"CARVALHO, Carlos Augusto de","cargoss":["Presidente de associação ou confederação de empregados ou empregadores","Presidente de associação ou confederação de empregados ou empregadores","Ministro das Relações Exteriores","Ministro das Relações Exteriores"],"cargos_esp":[0,0,0,0],"datas_ini":[1882,1885,1894,1893],"datas_fim":[1883,1885,1896,1893],"estados":["PR","PA",0,0],"autor":["Cristina Luna"],"content":"**CARVALHO, Carlos Augusto de**\n\n\\*magistrado; pres. PR 1882-1883; pres. PA 1885; min. Rel. Ext. 1893 e\n1894-1896.\n\n*Carlos Augusto de Carvalho* nasceu no Rio de Janeiro, então capital do\nImpério, em 20 de março de 1851, filho do tenente-coronel e engenheiro\nJosé Carlos de Carvalho e de Antônia Francisca Ferraz de Carvalho.\n\nBacharelou-se pela Faculdade de Direito do Largo de São Francisco, em\nSão Paulo, no ano de 1873. Durante o Império, participou da\nadministração pública e da política.\n\nNo governo de seu amigo Rodrigo Otávio na província do Paraná, entre os\nanos de 1878 e 1879, foi chefe de polícia. Posteriormente, foi\npresidente da província do Paraná de 6 de março de 1882 a 26 de maio de\n1883. Ao assumir o cargo, logo verificou que a receita arrecadada era\ninferior às necessidades previstas pelo orçamento. Assim, propôs à\nAssembleia provincial a aprovação de uma lei que estabelecia um imposto\nde 1,5% sobre a renda de cada cidadão paranaense. A lei foi aprovada,\nmas suscitou protestos, principalmente por parte dos comerciantes de\nCuritiba, que incitaram o movimento através da distribuição de panfletos\ninsufladores. Houve vandalismo, e o protesto ficou conhecido como\nRevolta dos Comerciantes ou Revolta do Vintém, mesmo nome dado à revolta\nque ocorrera no Rio de Janeiro em 1880. Sob forte pressão popular,\nCarlos Augusto de Carvalho se afastou do governo e entregou a\npresidência do Paraná ao seu vice, o comendador Antônio Alves de Araújo.\nEm 1885, assumiu a presidência da província do Pará, cargo que exerceu\npor pouco tempo.\n\nApós a proclamação da República em 15 de novembro de 1889, ocupou por\nduas vezes a pasta das Relações Exteriores, em outubro de 1893 e de 1894\na 1896, nas presidências de Floriano Peixoto (1891-1894) e de Prudente\nde Moraes (1894-1898). De acordo com Rodrigo Otávio, autor do livro\n*Minhas memórias dos outros*, ao irromper a Revolução Federalista no Rio\nGrande do Sul, em fevereiro de 1893, colocou-se ao lado da legalidade e\npublicou no *Jornal do Comércio* de 11 de setembro um artigo sobre o\nmovimento, intitulado *A defesa da cidade pelo direito internacional*.\nAinda de acordo com o mesmo autor, foi esse artigo que fez ser convidado\npara assumir o cargo de ministro das Relações Exteriores. Durante sua\nsegunda permanência na pasta, defendeu uma posição pan-americanista que\nse coadunou com a reorientação da política externa brasileira. Segundo\nClodoaldo Bueno, Carvalho declarou no jornal *El Diario* de Buenos Aires\nas boas relações do Brasil com a Argentina e com os demais países\namericanos.\n\nEsteve à frente de importantes acontecimentos, entre eles a resolução da\ncontenda em torno da posse da ilha de Trindade, localizada a 1.090\nquilômetros da costa do Espírito Santo e ocupada pela primeira vez com\ntropas militares pela Inglaterra em 1781. A partir de então, o conflito\nentre Portugal e Inglaterra por esse território se tornou perene, com\nperíodos de ocupação e desocupação. A última invasão inglesa ocorreu em\n1895, quando o governo inglês considerou a ilha propícia para a\ninstalação de equipamentos de uma companhia telegráfica transatlântica e\ndeclarou-a território britânico. Como ministro das Relações Exteriores,\nCarvalho reclamou a restituição da ilha por meio das notas de 22 e 23 de\njulho do mesmo ano, que foram enviadas ao representante diplomático da\nInglaterra creditado no Rio de Janeiro. A Inglaterra negou a restituição\ne enviou ao Brasil um enviado extraordinário, que propôs que a questão\nfosse internacionalmente arbitrada.\n\nNa elaboração da defesa brasileira, Carvalho contou com o auxílio de\nRaul Pompeia e Joaquim Portela, que, na época, eram diretores da\nBiblioteca Nacional e do Arquivo Público, respectivamente, e forneceram\ninformações relevantes para o caso, que teve a mediação de Portugal.\nContou, ainda, com a ajuda do barão do Rio Branco, que intermediou o\nauxílio de Portugal. Tal auxílio, além contribuir para dirimir o\nconflito, fez com que Portugal e Brasil se reaproximassem. Assim, o\nperíodo no qual Carvalho esteve à frente do Ministério das Relações\nExteriores foi marcado pelo reatamento das relações diplomáticas entre\nos dois países, que haviam sido rompidas oficialmente em 13 de maio de\n1894, devido ao deslocamento de revoltosos do movimento sedicioso da\nArmada, ocorrido no Rio de Janeiro, para o Rio Grande do Sul, em navios\nde bandeira portuguesa.\n\nDe acordo com Rodrigo Otávio, Carlos de Carvalho tentou, ainda,\ndesburocratizar o funcionamento do Ministério das Relações Exteriores ao\nevitar a procrastinação das soluções, advinda de determinadas exigências\nburocráticas do serviço. Dessa forma, despachava papéis sem que estes\nhouvessem corrido a via sacra das mesas da repartição e da Secretaria de\nEstado das Relações Exteriores, comandada pelo antigo diretor geral, o\nvisconde de Cabo Frio. Nesse sentido, Carlos de Carvalho tomou a\nprovidência, contrária à velha prática tradicional, de abrir a\ncorrespondência em seu gabinete e de lá encaminhá-la às diversas seções,\nmuitas vezes já com seu despacho, o que acelerou os trâmites da pasta e\nsuscitou certa tensão com Cabo Frio, que costumava centralizar as\ndecisões do ministério.\n\nEm 1904, Carlos de Carvalho voltou a servir ao Ministério das Relações\nExteriores, quando foi nomeado árbitro no tribunal brasileiro-boliviano\nque se dedicou à questão de limite do território do Acre. O tribunal se\ndedicou à resolução de conflitos remanescentes entre bolivianos e\nbrasileiros residentes na região e ao cumprimento das prerrogativas\nestabelecidas pelo Tratado de Petrópolis (1903), que abarcavam o\npagamento de indenizações e permutas de territórios entre os dois\npaíses. Em 1905, atuou como consultor do mesmo ministério.\n\nMorreu no Rio de Janeiro, então Distrito Federal, em 1905 e deixou\nfilhos do segundo casamento.\n\nCristina Luna\n\n**FONTES:** *Jornal do Comércio* (11/9/1893); MIN. REL. EXT.\n*Ministros*; MIN. REL. EXT*. Relatório* (1895, 1896); Fundação Casa de\nRui Barbosa (BR FCRB, Arquivos pessoais/Assuntos: Alto Purus, Acre/BR,\nTribunal Arbitral Brasileiro-Boliviano); OCTÁVIO, R. *Minhas memórias.*\n","ref":"**FONTES:** *Jornal do Comércio* (11/9/1893); MIN. REL. EXT.\n*Ministros*; MIN. REL. EXT*. Relatório* (1895, 1896); Fundação Casa de\nRui Barbosa (BR FCRB, Arquivos pessoais/Assuntos: Alto Purus, Acre/BR,\nTribunal Arbitral Brasileiro-Boliviano); OCTÁVIO, R. *Minhas memórias.*\n","dic":"DHBPR"}
