{"title":"CARVALHO, Joaquim Fernandes","cargoss":["Membro de junta governativa"],"cargos_esp":[0],"datas_ini":[1891],"datas_fim":[1892],"estados":["PB"],"autor":["Raimundo Helio Lopes"],"content":"**CARVALHO, Joaquim Fernandes**\n\n\\*junta gov. PB 1891-1892.\n\n*Joaquim Fernandes de Carvalho* fez parte da junta governativa que\nassumiu o poder na Paraíba com a destituição do presidente do estado\nVenâncio Neiva, no contexto de crise política que marcou o final do\ngoverno do presidente Deodoro da Fonseca (1889-1891) e o início do\ngoverno Floriano Peixoto (1891-1894).\n\nEm 3 de novembro de 1891, diante das dificuldades políticas que então\nenfrentava, o presidente Deodoro da Fonseca dissolveu o Congresso\nNacional. A Marinha, apoiada pelos estados de São Paulo, Minas Gerais e\nRio Grande do Sul, iniciou uma revolta na baía de Guanabara. Diante da\nameaça de uma guerra civil, Deodoro renunciou no dia 23 do mesmo mês,\nassumindo o vice-presidente Floriano Peixoto. Este, ao chegar ao poder,\ndestituiu os governantes que apoiavam Deodoro, como era o caso de\nVenâncio Neiva, que deixou o governo paraibano em 27 de dezembro de\n1891. Em seu lugar, assumiu uma junta governativa composta por Joaquim\nFernandes de Carvalho, o coronel Cláudio do Amaral Savaget e Eugênio\nToscano de Brito. A junta presidiu o estado até 18 de fevereiro de 1892,\nquando foi substituída por Álvaro Lopes Machado, nomeado presidente\nestadual por Floriano Peixoto.\n\nDepois dessa curta experiência no governo, Joaquim Fernandes de Carvalho\nfoi eleito deputado estadual na Paraíba para a legislatura de 1892 a\n1896.\n\nRaimundo Helio Lopes\n\n**FONTES:** MARIZ, C. *Apanhados*; PINTO, L. *Síntese.*\n","ref":"**FONTES:** MARIZ, C. *Apanhados*; PINTO, L. *Síntese.*\n","dic":"DHBPR"}
