{"title":"CASTRO, Agostinho Vidal Leite de","cargoss":["Deputado federal"],"cargos_esp":[0],"datas_ini":[1894],"datas_fim":[1899],"estados":["RJ"],"autor":["Luciana Pinheiro"],"content":"**CASTRO, Agostinho Vidal Leite de**\n\n\\* dep. fed. RJ 1894-1899.\n\n*Agostinho Vidal Leite de Castro* nasceu em Minas Gerais no dia 25 de\noutubro de 1841, filho de Francisco de Sales de Oliveira e Castro e de\nAna Teresa Vidal Leite Ribeiro.\n\nAinda jovem transferiu-se para São Paulo, cidade onde se diplomou\nbacharel em direito em 1866. Recém-formado, retornou a Minas Gerais e\nfixou residência em Monte Verde, município no qual exercia as atividades\nde fazendeiro e advogado. Reconhecido entusiasta da República, quando da\ninstauração do novo regime residia no Rio de Janeiro, onde foi delegado\nauxiliar e posteriormente chefe de polícia.\n\nEm 1891 foi eleito deputado estadual constituinte no Rio de Janeiro.\nParticipou da elaboração da primeira Constituição fluminense durante o\ngoverno de Francisco Portela, então presidente do estado do Rio de\nJaneiro. A Constituição estadual de 1891 foi, no entanto e anulada após\na renúncia de Portela, em dezembro do mesmo ano. Com isso a Constituinte\nestadual foi dissolvida e Agostinho Vidal Leite de Castro perdeu o\nmandato.\n\nNas eleições de 1894 foi eleito deputado federal pelo estado do Rio de\nJaneiro e tomou posse na Câmara dos Deputados em maio do mesmo ano. Foi\nreeleito para a legislatura seguinte e ocupou uma cadeira na Câmara até\ndezembro de 1899.\n\nFaleceu no Rio de Janeiro em 4 de dezembro de 1901.\n\nLuciana Pinheiro\n\n**FONTES:** ABRANCHES, J. *Governos* (p.562); CÂM. DEP. *Deputados\nbrasileiros* (p.11); FERREIRA, M. *República*; INST. HIST. PETRÓPOLIS.\nDisponível em: \\<www.ihp.org.br/ihp/site/\\>. Acesso em: 17/11/2010;\nMELLO, M. *Parlamento*; Referências Genealógicas de Antonio Augusto\nLeite de Castro. Disponível em:\n\\<http://referenciasgenealogicasaalecastro.blogspot.com/2010/05/familia-leite.html\\>.\nAcesso em: 17/11/2010.\n","ref":"**FONTES:** ABRANCHES, J. *Governos* (p.562); CÂM. DEP. *Deputados\nbrasileiros* (p.11); FERREIRA, M. *República*; INST. HIST. PETRÓPOLIS.\nDisponível em: \\<www.ihp.org.br/ihp/site/\\>. Acesso em: 17/11/2010;\nMELLO, M. *Parlamento*; Referências Genealógicas de Antonio Augusto\nLeite de Castro. Disponível em:\n\\<http://referenciasgenealogicasaalecastro.blogspot.com/2010/05/familia-leite.html\\>.\nAcesso em: 17/11/2010.\n","dic":"DHBPR"}
