{"title":"CASTRO, Augusto Olímpio Gomes de","cargoss":["Deputado Geral","Presidente de associação ou confederação de empregados ou empregadores","Deputado Geral","Presidente de associação ou confederação de empregados ou empregadores","Deputado Geral","Presidente de associação ou confederação de empregados ou empregadores","Deputado Geral","Deputado Geral","Governador de estado ou do Distrito Federal","Senador"],"cargos_esp":[0,0,0,0,0,0,0,0,0,0],"datas_ini":[1867,1868,1869,1870,1872,1873,1882,1877,1890,1894],"datas_fim":[1868,1869,1870,1872,1873,1875,1889,1877,1890,1909],"estados":["MA","MA","MA","MA","MA","MA","MA","MA","MA","MA"],"autor":["Alan Carneiro","Raimundo Helio Lopes"],"content":"**CASTRO, Augusto Olímpio Gomes de**\n\n\\*magistrado; dep. geral MA 1867-1868; pres. MA 1868-1869; dep. geral MA\n1869-1870; pres. MA 1870-1872; dep. geral MA 1872-1873; pres. MA\n1873-1875; dep. geral MA 1877 e 1882-1889; gov. MA 1890; sen. MA\n1894-1909.\n\n*Augusto Olímpio Gomes de Castro* nasceu em Alcântara (MA) no dia 7 de\nnovembro de 1836, filho de Januário Daniel Gomes de Castro e de Ana\nFrancisca Alves de Castro.\n\nCursou o secundário no Liceu Maranhense, em São Luís, bacharelou-se pela\nFaculdade de Direito do Recife em 1861 e foi promotor público em\nAlcântara de 1862 a 1864. Ainda no Império foi deputado provincial de\n1862 a 1863. Nesse último ano colaborou no jornal *A Situação*, órgão do\nPartido Conservador. Em 1867 foi eleito deputado geral, tomou posse na\nCâmara dos Deputados, no Rio de Janeiro, mas exerceu o mandato até o ano\nseguinte, quando se afastou para assumir a presidência da província do\nMaranhão, até 1869. Voltou a se eleger deputado geral para as\nlegislaturas 1869-1872 e 1872-1875 e a se licenciar em mais duas\noportunidades para exercer o governo da província: de 1870 a 1872 e de\n1873 a 1875. Foi deputado provincial de 1876 a 1877 e nesse último ano\nretomou o mandato de deputado geral. Em 1878 fundou o jornal *O tempo*,\ntambém ligado ao *Partido Conservador*. Ainda uma vez voltou à Câmara\ndos Deputados, em 1882, e nela permaneceu até o fim do Império. Presidiu\na Câmara de maio de 1887 a maio de 1888.\n\nLogo após a proclamação da República pelo marechal Deodoro da Fonseca,\nem 15 de novembro de 1889, aderiu ao novo regime. Iniciado o governo de\nPedro Augusto Tavares Júnior no Maranhão em 17 de dezembro do mesmo ano,\nfez parte da Junta Municipal então criada para gerir os negócios e\ninteresses do município de São Luís. A Junta Municipal foi composta\nainda por Francisco de Paula Belfort Duarte (presidente), José da Silva\nMaia, Manuel Bernardino da Costa Rodrigues e Joaquim de Sousa Andrade.\n\nEm 1890 fundou o jornal *O Nacional*, órgão do Partido Nacional, e foi\nnomeado vice-governador do Maranhão. Ocupava esse cargo quando assumiu o\ngoverno do estado, no dia 5 de julho de 1890, em substituição ao então\ntitular José Tomás da Porciúncula. Permaneceu à frente do governo\nmaranhense até o dia 25 do mesmo mês, quando foi substituído pelo novo\ngovernador, o capitão-tenente Manuel Inácio Belfort Vieira.\n\nEm 1894 foi eleito senador pelo Maranhão. Assumiu sua cadeira no Senado\nFederal, no Rio de Janeiro, e foi reeleito em 1903. Exerceu o mandato\naté falecer, no dia 31 de janeiro de 1909.\n\nFoi também sócio-honorário do Instituto Histórico e Geográfico\nBrasileiro e patrono da cadeira número 39 da Academia Maranhense de\nLetras.\n\nEra casado com Ana Rosa de Viveiros de Castro, filha de Francisco\nMariano de Viveiros Sobrinho, barão de São Bento. Seu filho Augusto\nOlímpio Viveiros de Castro foi ministro do Supremo Tribunal Federal de\n1915 a 1927. Outro filho, Francisco José Viveiros de Castro, governou a\nprovíncia do Piauí de 6 de julho de 1887 a 27 de julho de 1888, foi\nprofessor de direito criminal na Faculdade Livre de Direito e\ndesembargador da Corte de Apelação do Distrito Federal.\n\nAlan Carneiro/Raimundo Helio Lopes\n\n**FONTES:** CÂM. DEP. *Deputados brasileiros*; CÂM. DEP. Disponível em:\n\\<www.camara.gov.br/internet/infDoc/HistoriaPreservacao/Presidentes/PresImperio.htm\\>.\nAcesso em: 10/3/2010; MARQUES, C. *Dicionário*; MIN. PUB. MARANHÃO.\nDisponível em:\n\\<www2.mp.ma.gov.br/memorial/indememorialgaleriapromotpublicoimperio\\_augusto.asp\\>.\nAcesso em: 10/3/2010; PLANALTO. Disponível em:\n\\<www.planalto.gov.br/infger\\_07/governadores/GOV-MA.htm\\>. Acesso em:\n5/3/2010; SENADO. Disponível em:\n\\<www.senado.gov.br/sf/senadores/senadores\\_biografia.asp?codparl=1498&li=28&lcab=1909-1911&lf=28\\>.\nAcesso em: 10/3/2010.\n","ref":"**FONTES:** CÂM. DEP. *Deputados brasileiros*; CÂM. DEP. Disponível em:\n\\<www.camara.gov.br/internet/infDoc/HistoriaPreservacao/Presidentes/PresImperio.htm\\>.\nAcesso em: 10/3/2010; MARQUES, C. *Dicionário*; MIN. PUB. MARANHÃO.\nDisponível em:\n\\<www2.mp.ma.gov.br/memorial/indememorialgaleriapromotpublicoimperio\\_augusto.asp\\>.\nAcesso em: 10/3/2010; PLANALTO. Disponível em:\n\\<www.planalto.gov.br/infger\\_07/governadores/GOV-MA.htm\\>. Acesso em:\n5/3/2010; SENADO. Disponível em:\n\\<www.senado.gov.br/sf/senadores/senadores\\_biografia.asp?codparl=1498&li=28&lcab=1909-1911&lf=28\\>.\nAcesso em: 10/3/2010.\n","dic":"DHBPR"}
