{"title":"CASTRO, Eduardo de Lima","cargoss":["Deputado federal"],"cargos_esp":[0],"datas_ini":[1930],"datas_fim":[1930],"estados":["PE"],"autor":["Raimundo Helio Lopes"],"content":"**CASTRO, Eduardo de Lima**\n\n\\*dep. fed. PE 1930.\n\n*Eduardo de Lima Castro* foi prefeito da cidade de Recife de 1920 a\n1923. Em 1922 concorreu ao governo de Pernambuco, na sucessão de José\nRufino Bezerra Cavalcanti, mas foi derrotado por José Henrique Carneiro\nda Cunha. Esse resultado foi contestado, e a partir do dia seguinte\ncomeçaram as desordens, com a participação de forças militares de um e\nde outro lado. Diante da ameaça de intervenção em Pernambuco, as duas\nfacções entraram em acordo, e o juiz Sérgio Lins de Barros Loreto foi\neleito e empossado governador.\n\nEm 1930 foi eleito deputado federal por Pernambuco. Assumiu sua cadeira\nna Câmara dos Deputados, no Rio de Janeiro, então Distrito Federal, em\nmaio, mas teve seu mandato interrompido em outubro seguinte com a\nvitória da Revolução de 1930, que levou Getúlio Vargas ao poder e\nextinguiu todos os órgãos legislativos do país.\n\nNo campo jornalístico, colaborou com o periódico *O Estado de\nPernambuco*.\n\nRaimundo Helio Lopes\n\n**FONTES:** CÂM. DEP. *Deputados brasileiros*; LEVINE, R. *Velha*;\nNASCIMENTO, L. *História* (v.2, 3).\n","ref":"**FONTES:** CÂM. DEP. *Deputados brasileiros*; LEVINE, R. *Velha*;\nNASCIMENTO, L. *História* (v.2, 3).\n","dic":"DHBPR"}
