{"title":"CASTRO, Geminiano de Lira","cargoss":["Deputado federal","Deputado federal","Deputado federal","Ministro da Agricultura"],"cargos_esp":[0,0,0,0],"datas_ini":[1921,1920,1909,1926],"datas_fim":[1926,1920,1911,1930],"estados":["PA","PA","PA",0],"autor":["Adrianna Setemy"],"content":"**CASTRO, Geminiano de Lira**\n\n\\*dep. fed. PA 1909-1911, 1920 e 1921-1926; min. Agric. 1926-1930.\n\n*Geminiano de Lira Castro* nasceu na província do Pará em 1863.\n\nFoi vice-governador do Pará no primeiro governo de Augusto Montenegro,\nde 1901 a 1904. Nesse último ano, uma reforma na Constituição do estado\npermitiu que Augusto Montenegro se candidatasse à reeleição nas eleições\nde dezembro. Por essa razão, o governador teve que se afastar do governo\nem 31 de outubro. Geminiano de Lira Castro deveria assumir seu lugar,\nmas, como pretendia concorrer ao Senado, encontrava-se igualmente\nimpedido. Assumiu assim o governo João Antônio Luís Coelho. Montenegro\nfoi reeleito, mas Geminiano, não.\n\nFoi eleito deputado federal pelo Pará na legislatura 1909-1911. Estando\nem curso a legislatura 1918-1920, voltou a ocupar uma cadeira na Câmara\ndos deputados por curto espaço de tempo, de novembro a dezembro de 1920.\nRetornou ainda à Câmara nas legislaturas 1921-1923 e 1924-1926.\n\nDurante o governo de Washington Luís (1926-1930), foi ministro da\nAgricultura, Indústria e Comércio.\n\nFaleceu no Rio de Janeiro em 1936.\n\nAdrianna Setemy\n\n**FONTES:** CÂM. DEP. *Deputados brasileiros*; Projeto de imagem de\npublicações oficiais brasileiras do Center for Research Libraries e\nLatin-american Microfilm Project. *Mensagens dos Presidentes de\nProvíncia (1830-1930).* Disponível em:\n\\<www.crl.edu/content.asp?l1=4&l2=18&l3=33\\>. Acesso em: 8/1/2009.\n","ref":"**FONTES:** CÂM. DEP. *Deputados brasileiros*; Projeto de imagem de\npublicações oficiais brasileiras do Center for Research Libraries e\nLatin-american Microfilm Project. *Mensagens dos Presidentes de\nProvíncia (1830-1930).* Disponível em:\n\\<www.crl.edu/content.asp?l1=4&l2=18&l3=33\\>. Acesso em: 8/1/2009.\n","dic":"DHBPR"}
