{"title":"CASTRO, Miguel","cargoss":["Presidente de associação ou confederação de empregados ou empregadores","Deputado Geral","Deputado Geral","Constituinte","Governador de estado ou do Distrito Federal","Deputado federal"],"cargos_esp":[0,0,0,0,0,0],"datas_ini":[1882,1885,1889,1891,1891,1892],"datas_fim":[1883,1888,1889,1891,1891,1893],"estados":["PI","CE","RN",0,"RN","RN"],"autor":["Renato Amado Peixoto"],"content":"**CASTRO, Miguel**\n\n\\* pres. PI 1882-1883; dep. geral CE 1885-1888; dep. geral RN 1889;\nconst. 1891; gov. RN 1891; dep. fed. RN 1892-1893.\n\n*Miguel Joaquim de Almeida Castro* nasceu na fazenda Convento, freguesia\nde São Gonçalo da Serra dos Cocos, município de Ipu (CE), no dia 4 de\ndezembro de 1834, filho de Joaquim Felício de Almeida Castro e de Cosma\nRodrigues Veras. Era sobrinho-neto do padre Miguelinho, seu homônimo, um\ndos líderes da Revolução de 1817 em Pernambuco. Seu primo Francisco\nPinheiro de Almeida Castro também seguiu carreira política, exercendo o\nmandato de deputado federal pelo Rio Grande do Norte de 1921 a 1922.\n\nFormou-se bacharel em direito pela Faculdade do Recife em 1858, foi\nnomeado promotor público da comarca de Maioridade (RN) em 1859, e juiz\nmunicipal e de órfãos de Aracati (CE) em 1860. Em 1864 foi nomeado juiz\nde direito da comarca de Saboeiro (CE), e em 1868 foi designado inspetor\nliterário.\n\nIniciou a carreira política no ano em que se formou, sendo eleito\ndeputado provincial no Rio Grande do Norte na legenda do Partido Liberal\npara as legislaturas 1858-1859 e 1860-1861. Foi presidente da província\ndo Piauí de 1882 a 1883, e em 1885 foi eleito deputado geral pela\nprovíncia do Ceará na legenda do Partido Liberal para o período\n1885-1888. Em 1889 voltou para o Rio Grande do Norte, onde se aliou a\nJosé Bernardo de Medeiros, líder político da região do Seridó, e aí se\nelegeu deputado geral, sempre na legenda do Partido Liberal. Com a queda\nda monarquia, José Bernardo aliou-se ao líder republicano Pedro Velho de\nAlbuquerque Maranhão para montar o novo governo do Rio Grande do Norte.\nEm 15 de setembro de 1890 Miguel Castro foi eleito deputado federal\nconstituinte na legenda do Partido Republicano, novamente com o apoio de\nJosé Bernardo, e em 15 de novembro tomou posse.\n\nEm 1891 Miguel Castro foi um dos protagonistas da disputa pelo controle\ndo poder no Rio Grande do Norte a partir das divergências expostas pelo\nPartido Republicano durante a eleição para presidente da República pelo\nCongresso Nacional Constituinte, no dia 25 de fevereiro. Na ocasião,\ntoda a bancada do Rio Grande do Norte apoiou o marechal Deodoro da\nFonseca, com exceção de Pedro Velho e José Bernardo, que apoiaram\nPrudente de Morais. Em vista disso, depois de eleito Deodoro nomeou\nFrancisco Amintas da Costa Barros, um dos opositores de Pedro Velho e\nJosé Bernardo, para o governo do estado. Ligado por laços de família aos\nAlmeida Castro e aos Amorim Garcia, Amintas Barros realizou eleições\npara o Congresso Constituinte estadual, e este, uma vez instalado,\nelegeu Miguel Castro governador do Rio Grande do Norte. Como Miguel\nCastro se encontrava no Rio de Janeiro, Amintas Barros passou o governo\npara seu vice, José Inácio Fernandes Barros, que logo repassou o posto\npara o segundo-vice, Francisco Gurgel de Oliveira.\n\nChegando a Natal, Miguel Castro tomou posse em 9 de setembro de 1891 e\norganizou o governo tendo as famílias Almeida Castro e Amorim Garcia\ncomo base de apoio político, e nomeando seus membros para postos-chave\nem detrimento dos aliados de Pedro Velho e José Bernardo. No plano\nnacional, Miguel Castro e o Congresso estadual continuaram apoiando os\natos políticos do governo Deodoro da Fonseca, inclusive o chamado “golpe\nde Lucena” e o fechamento do Congresso Nacional (3/11/1891). Com a\nrenúncia de Deodoro à presidência (23/11/1891), Pedro Velho e José\nBernardo, à frente das tropas do Exército sediadas em Natal, promoveram\na derrubada de Miguel Castro, deportando-o depois de preso para\nFortaleza. O governo do estado foi então entregue a uma junta\ngovernativa que dissolveu o Congresso estadual e convocou eleições para\num novo Congresso Constituinte. Este, por sua vez, elegeu Pedro Velho\ngovernador.\n\nEm 1892 Miguel Castro voltou ao Rio de Janeiro para denunciar no\nCongresso Nacional o golpe perpetrado por Pedro Velho e José Bernardo,\nmas não encontrou audiência favorável. Em 1899 foi candidato ao Senado,\nmas foi derrotado pelo candidato “pedrovelhista”. Abandonando a vida\npública, estabeleceu-se em Recife, onde faleceu em 6 de maio de 1901.\n\nCasado com Rosa Maria Antunes de Oliveira, teve seis filhos.\n\nRenato Amado Peixoto\n\n**FONTES:** BUENO, A. *Visões*; CASCUDO, L. *Governo*; CASCUDO, L.\n*História*; CASCUDO, L. *Movimento*; CASCUDO, L. *História*; *República*\n(9-11/1891); MEDEIROS, J. *Rio Grande do Norte*; SOUZA, I. *República*.\n","ref":"**FONTES:** BUENO, A. *Visões*; CASCUDO, L. *Governo*; CASCUDO, L.\n*História*; CASCUDO, L. *Movimento*; CASCUDO, L. *História*; *República*\n(9-11/1891); MEDEIROS, J. *Rio Grande do Norte*; SOUZA, I. *República*.\n","dic":"DHBPR"}
