{"title":"CASTRO, Sousa","cargoss":["Deputado federal","Governador de estado ou do Distrito Federal","Senador"],"cargos_esp":[0,0,0],"datas_ini":[1918,1921,1925],"datas_fim":[1920,1925,1930],"estados":["PA","PA","PA"],"autor":["Adrianna Setemy"],"content":"**CASTRO, Sousa**\n\n\\*dep. fed. PA 1918-1920; gov. PA 1921-1925; sen. PA 1925-1930.\n\n*Antônio Emiliano de Sousa Castro* nasceu em Belém do Pará no dia 15 de\nagosto de 1875, filho de Antônio Emiliano de Sousa Castro e de\nMirandolina Fernandes de Sousa Castro, que, através de decreto assinado\nem 1888 pelo imperador dom Pedro II, receberiam o título de barão e\nbaronesa de Anajás. Seu pai, juntamente com o médico paraense Camilo\nHenrique Salgado, fundou em 9 de janeiro de 1919 a Faculdade de Medicina\ne Cirurgia do Pará, da qual foram, respectivamente, diretor e\nvice-diretor.\n\nFez os primeiros estudos no Liceu Paraense e formou-se pela Faculdade de\nMedicina e Cirurgia do Pará, da qual foi médico clínico e professor\ncatedrático. Ainda antes de formar-se iniciou a carreira política, sendo\neleito deputado estadual em 1912, e deputado federal em 1918.\n\nEm 1921, ao se encerrar o segundo governo de Lauro Sodré, foi eleito\ngovernador do Pará. Empossado em 1^o^ de fevereiro daquele ano, durante\nseu governo fundou a Lazarópolis do Prata, primeiro leprosário do\nBrasil, criado com o objetivo de isolar e oferecer atendimento aos\nleprosos do estado. Inaugurado em 1924, o leprosário ficava localizado a\n150 quilômetros de Belém, na colônia agrícola de Santo Antônio do Prata.\nAo final de seu mandato, em 1^o^ de fevereiro de 1925, teve como\nsucessor o senador paraense Dionísio Bentes, cuja vaga no Senado veio a\nocupar. Como senador, integrou a delegação do Brasil à Conferência\nInternacional do Comércio, realizada em Madri, Espanha, em 1930. Teve o\nmandato suspenso nesse mesmo ano decorrência da vitória revolução\ndeflagrada em outubro, que dissolveu todos os órgãos legislativos do\npaís.\n\nIniciado o governo do interventor Magalhães Barata no Pará em 12 de\nnovembro de 1930, foi posta em prática uma política de perseguição a\ntrês ex-governadores ligados às elites hegemônicas da Primeira\nRepública: Sousa Castro, Dionísio Bentes e Eurico Vale. Todos tiveram\nseus bens confiscados, e além disso Sousa Castro e Eurico Vale foram\npresos.\n\nNas eleições de outubro de 1934, Sousa Castro foi eleito deputado\nconstituinte estadual na legenda oposicionista da Frente Única Paraense\n(FUP), que congregou membros do Partido Republicano Federal, do Partido\nRepublicano Conservador, revolucionários descontentes com Magalhães\nBarata e uma parte representativa do operariado vinculada ao Partido\nTrabalhista e ao Partido Social Trabalhista. O resultado das eleições\ndemonstrou a supremacia do Partido Liberal (PL), de Magalhães Barata,\nque fez sete dos nove deputados federais e 21 dos 30 deputados\nestaduais. A eleição de Magalhães Barata para governador, a ser feita\npela Assembleia Constituinte estadual, parecia assim estar garantida.\nEntretanto, às vésperas da eleição ocorreu o episódio que ficou\nconhecido como a “dissidência do PL”, em que sete membros daquele\npartido, em virtude de desentendimentos com o interventor, se uniram aos\nnove deputados da FUP e lançaram Mário Chermont como candidato ao\ngoverno do estado.\n\nEm 4 de abril de 1935, data de instalação da Constituinte, temerosos de\nrepresálias, Mário Chermont e seus aliados, entre os quais Sousa Castro,\nbuscaram refúgio no quartel do Exército e solicitaram um habeas corpus\nao Tribunal de Justiça. Aproveitando a situação, o presidente da\nAssembleia, deputado Ápio Medrado, fiel ao interventor Barata, convocou\ntrês suplentes (padre Clotário de Alencar, Angelino Lima e João Lopes de\nBarro), garantiu quórum à sessão e elegeu Barata governador por maioria\nabsoluta de votos, empossando-o imediatamente. No dia 5 de abril,\nmunidos de habeas corpus e acompanhados pelo desembargador Dantas\nCavalcante, a maioria dos deputados, formada pelos representantes da FUP\ne pelos dissidentes do PL, seguiu em direção ao prédio da Assembleia\nacompanhada por uma turba que, aos gritos, os acusava de “traidores”.\nEntretanto, não conseguiram chegar a seu destino, pois foram\nsurpreendidos por um intenso tiroteio, no qual Sousa Castro foi baleado\nno tórax.\n\nApós esses acontecimentos, que tiveram intensa repercussão no cenário\npolítico nacional, Magalhães Barata foi imediatamente exonerado do cargo\nde interventor, para o qual foi nomeado temporariamente o major Carneiro\nde Mendonça. Após negociações com os grupos em luta, o nome escolhido\npara ocupar o governo do Pará foi José Carneiro da Gama Malcher, que\ngovernou o estado até 1943.\n\nDurante o Estado Novo, entre os anos de 1937 e 1942, Sousa Castro ocupou\no cargo de diretor administrativo do Instituto de Patologia Experimental\ndo Norte (IPEN), instituição criada em 1936 no Pará por uma equipe de\njovens médicos e farmacêuticos sob a coordenação de Evandro Chagas,\nfilho de Carlos Chagas, com o objetivo de desenvolver pesquisas a\nrespeito de micro-organismos e patologias da Amazônia. Em 1940, após o\nprecoce falecimento de Evandro Chagas em um acidente aéreo, o governo do\nestado do Pará deu ao IPEN o nome de Instituto Carlos Chagas (IEC), em\nreconhecimento ao trabalho desenvolvido pelo cientista na região. Em\n1942 o IEC foi incorporado, como laboratório central e órgão de\npesquisa, ao então criado Serviço Especial de Saúde Pública (SESP), do\nMinistério da Educação e Saúde, com respaldo em um acordo entre os\ngovernos brasileiro e norte-americano, cujo objetivo era criar condições\nsanitárias adequadas nos vales do Amazonas e do rio Doce que garantissem\naos norte-americanos o provimento de matérias-primas indispensáveis aos\nesforços dos Estados Unidos na Segunda Guerra Mundial. Sousa Castro\nexerceu as funções de consultor da Superintendência Nacional do SESP e\nconsultor do SESP da Amazônia.\n\nFaleceu no dia 1^o^ de julho de 1951, no Rio de Janeiro.\n\nAdrianna Setemy\n\n**FONTES:** CÂM. DEP. *Deputados brasileiros*; CAMPOS, A. *Políticas*;\nProjeto de imagem de publicações oficiais brasileiras do Center for\nResearch Libraries e Latin-american Microfilm Project. *Mensagens dos\nPresidentes de Província (1830-1930).* Disponível em:\n\\<www.crl.edu/content.asp?l1=4&l2=18&l3=33\\>. Acesso em: 8/1/2009;\nSIQUEIRA, E. *Formato.*\n","ref":"**FONTES:** CÂM. DEP. *Deputados brasileiros*; CAMPOS, A. *Políticas*;\nProjeto de imagem de publicações oficiais brasileiras do Center for\nResearch Libraries e Latin-american Microfilm Project. *Mensagens dos\nPresidentes de Província (1830-1930).* Disponível em:\n\\<www.crl.edu/content.asp?l1=4&l2=18&l3=33\\>. Acesso em: 8/1/2009;\nSIQUEIRA, E. *Formato.*\n","dic":"DHBPR"}
