{"title":"CATUNDA, José Nelson de Araújo","cargoss":["Deputado federal"],"cargos_esp":[0],"datas_ini":[1924],"datas_fim":[1930],"estados":["CE"],"autor":[0],"content":"**CATUNDA, José Nelson de Araújo**\n\n\\*dep. fed. CE 1924-1930.\n\n*José Nelson de Araújo Catunda* nasceu em Crateús (CE).\n\nFormou-se pela Faculdade de Medicina do Rio de Janeiro em 1916, e em\n1917 foi nomeado inspetor sanitário da Diretoria Geral de Higiene de\nFortaleza. Em 1922 foi primeiro-secretário do Centro Médico Cearense,\nassociação criada pelos médicos do Ceará em 1913.\n\nFoi eleito deputado federal pelo 1^o^ distrito do Ceará, com sede em\nFortaleza (CE), para as legislaturas 1924-1926, 1927-1929 e 1930-1932,\nmas teve o mandato interrompido em 23 de outubro de 1930 pela revolução\nque levou Getúlio Vargas ao poder e fechou os órgãos legislativos do\npaís.\n\nKleiton de Sousa Moraes\n\n**FONTES:** Almanach do Ceará (p.50); BARROS, Vinicius. História da\nmedicina; LEAL, V. História.\n","ref":"**FONTES:** Almanach do Ceará (p.50); BARROS, Vinicius. História da\nmedicina; LEAL, V. História.\n","dic":"DHBPR"}
