{"title":"ALBUQUERQUE, Pires e","cargoss":["Ministro do Supremo Tribunal Federal","Procurador-geral da República"],"cargos_esp":[0,0],"datas_ini":[1917,1919],"datas_fim":[1931,1931],"estados":[0,0],"autor":[0],"content":"**ALBUQUERQUE, Pires e**\n\n\\* magistrado; min. STF 1917-1931;proc.-ger. Rep. 1919-1931.\n\n*Antônio Joaquim Pires de Carvalho e Albuquerque* nasceuem Rio Fundo\n(BA) no dia 5 defevereiro de 1865, filho de Garcia DiasD’Ávila Pires de\nCarvalho e Albuquerque,deputado e senador estadual na Bahia,e de Maria\nde Argolo Pires. Descendiade famílias tradicionais baianas, os D’Ávilae\nos Pires de Carvalho e Albuquerque.Seu avô paterno e homônimo foi barãoe\nvisconde com grandeza da Torre deGarcia D’Ávila, e seus tios-avós,\nirmãosdeste, também receberam títulos de nobrezano Império,\ndestacando-se no período JoaquimPires de Carvalho e Albuquerque,\nviscondede Pirajá, e Francisco Estêvão Pires deCarvalho e Albuquerque,\nbarão de Jaguaribe.\n\nBacharel pela Faculdade de Direitode Recife em 1886, retornou à Bahiae\nfez carreira de promotor público entre1887 e 1890, em Salvador e\nnascidades de Maracás, Alagoinhas e São Francisco.Deputado à Assembleia\nConstituinte baiana de1891, com a transformação desta em Câmaraestadual\nordinária, teve o mandato estendidoaté 1893. Reeleito em 1894,\ncontinuoudeputado estadual até 1896. Nomeado juizfederal no estado do\nRio de Janeiroem 1897, foi removido em março de1904 para a recém-criada\n2^a^Vara do então Distrito Federal e de1913 a 1914 serviu no tribunal\narbitralque resolveu a questão dos limites entreMinas Gerais e Espírito\nSanto.\n\nEm maio de 1917 foi nomeadopelo presidente da República Venceslau\nBrás(1914-1918) ministro do Supremo Tribunal Federal(STF). Em 1919, foi\num dos relatoresdo pedido de habeas corpus impetrado pelo\ngeneralCoriolano de Carvalho e Silva em favorde Rui Barbosa, candidato\nderrotado porEpitácio Pessoa nas eleições presidenciais deabril daquele\nano. O pedido argumentavaque Epitácio não poderia ser consideradoeleito,\npor ter sido declarado inválidopara o serviço público e por terportado\ncondecoração estrangeira. O STF, porém,não aprovou o pedido. Em agosto\nde1919, poucos dias após tomar posse, Epitácionomeou-o procurador geral\nda República, cargoatribuído na época obrigatoriamente a umministro do\nSTF.\n\nEm 1920 presidiu o tribunal arbitralque decidiu a questão de limites\nentreGoiás e Mato Grosso, e em 1928,na qualidade de procurador geral da\nRepública,foi acusado pelo jornalista José Eduardode Macedo Soares,\ndiretor-responsável do *Diário Carioca,* de ter substituído e adulterado\nseuparecer no recurso extraordinário interpostopela Companhia\nTelefônica. Em seguida, MacedoSoares foi condenado por injúria,\ndecisãoconfirmada pelo STF.\n\nCom a vitória da Revolução de1930 e a constituição do governo\nprovisóriochefiado por Getúlio Vargas, Pires e Albuquerquefoi um dos\nseis ministros do STFaposentados compulsoriamente, através de\ndecreto(18/2/1931) que reduzia o número de juízesdaquela corte para\nnove. Na mesma data,foi aposentado compulsoriamente do cargo\ndeprocurador geral da República. Em sua defesa,publicou *Crime e castigo\nde um magistrado.*\n\nFaleceu no Rio de Janeiro em3 de setembro de 1954.\n\nSeu filho, o capitão de mare guerra Garcia D’Ávila Pires de Carvalhoe\nAlbuquerque, comandava o encouraçado *Bahia* quando a embarcação\nexplodiu em operaçãode guerra em julho de 1945, matando-oe a grande\nparte da tripulação. Outrodescendente da família, o general VálterPires\nde Carvalho e Albuquerque, foi ministrodo Exército de 1979 a 1985.\n\n**FONTES:** BALEEIRO,A. *Supremo*; CONSULT. MAGALHÃES, B.; CORRESP.PROC.\nGER. REP.; COSTA, E. *Efemérides*;COSTA, E. *Grandes*; *Encic. Mirador*;\n*Grande encic. Delta.*\n","ref":"**FONTES:** BALEEIRO,A. *Supremo*; CONSULT. MAGALHÃES, B.; CORRESP.PROC.\nGER. REP.; COSTA, E. *Efemérides*;COSTA, E. *Grandes*; *Encic. Mirador*;\n*Grande encic. Delta.*\n","dic":"DHBPR"}
