{"title":"CAVALCANTI, Amaro","cargoss":["Constituinte","Senador","Ministro da Justiça","Ministro do Supremo Tribunal Federal","Prefeito","Ministro da Fazenda"],"cargos_esp":[0,0,0,0,0,0],"datas_ini":[1891,1891,1897,1906,1917,1918],"datas_fim":[1891,1893,1898,1914,1918,1919],"estados":[0,"RN",0,0,"DF",0],"autor":["Eduardo Junqueira"],"content":"**CAVALCANTI, Amaro**\n\n\\*const. 1891; sen. RN 1891-1893; min. Just. 1897-1898; min. STF\n1906-1914; pref. DF 1917-1918; min. Faz. 1918-1919.\n\n*Amaro Bezerra Cavalcanti de Albuquerque* nasceu em Caicó, no sertão do\nSeridó, na província do Rio Grande do Norte, no dia 15 de agosto de\n1849, filho de Amaro Soares Cavalcanti de Brito e de Ana Cavalcanti.\n\nPor volta de 1876, matriculou-se na Escola de Direito da Union\nUniversity, em Albany, no estado de Nova York, EUA, obtendo grau na\nturma do ano acadêmico de 1880-1881. De vota ao Brasil, trazendo na\nbagagem não só o diploma universitário, como também a experiência da\nviagem e a admiração pelo regime do país que conheceu, foi nomeado, em\noutubro de 1881, diretor geral da Instrução Pública no Ceará. Profundo\nconhecedor do latim, língua clássica que aprendeu ao longo do curso de\nhumanidades em sua terra natal, no ano seguinte transferiu-se para a\nCorte, a fim de reger esta cadeira para a turma do segundo ano do\nImperial Colégio de Pedro II. De volta ao Ceará por um curto período,\nparticipou do pleito eleitoral de 1884 como candidato a deputado\nprovincial. Vitorioso, não chegou a tomar posse. Fixando mais uma vez\nresidência no Rio de Janeiro, dedicou-se à advocacia, ao jornalismo e ao\nestudo do direito.\n\nAdvinda a República, foi eleito senador constituinte pelo Rio Grande do\nNorte em setembro de 1890. Empossado em 15 de novembro seguinte, foi\nescolhido membro da comissão que formulou o projeto definitivo da\nprimeira Constituição republicana. Deixou o Senado em 1893, ao ser\nnomeado ministro plenipotenciário na República do Paraguai. Depois de\ndeixar o posto no exterior, retornou ao Brasil para assumir, durante o\ngoverno Prudente de Morais (1894-1898), a pasta da Justiça e Negócios\nInteriores, entre 19 de janeiro de 1897 e 15 de novembro de 1898.\nConsultor jurídico do Ministério das Relações Exteriores de 1905 a 1906,\nem junho desse último ano tornou-se ministro do Supremo Tribunal Federal\n(STF), ocupando a vaga aberta em decorrência da aposentadoria de João\nBarbalho Uchoa Cavalcanti.\n\nwww.famososquepartiram.com/2011/07/amaro-cavalcanti.html\n\n![Description:\nhttp://3.bp.blogspot.com/-u-JcK\\_Y9ncY/TjIshhAo0\\_I/AAAAAAAACck/8IZYQAjLcvk/s320/Amaro%2BCavalcanti2.jpg](CAVALCANTI,%20Amaro_arquivos/image003.jpg)\n\nAmaro Bezerra Cavalcanti (1918/1919).\n\n\\\n\nNo STF, foi relator em 1909 de um dos habeas corpus impetrados pelos\nintendentes municipais do Distrito Federal, impedidos de entrar no\nprédio do Conselho por ato do governo da União. De grande repercussão na\népoca, convencionou-se atribuir a esse processo judicial, e a outros\nimpetrados por outros intendentes, a base jurisprudencial para a\n“doutrina brasileira do habeas corpus”, na medida em que esse\ninstrumento jurídico tornava-se remédio para qualquer violação ao\ndireito individual por autoridade constituída, segundo interpretação\nabrangente do art. 72 da Constituição de 1891.\n\nCavalcanti foi relator de outro habeas corpus de grande repercussão,\nimpetrado por José Eduardo Macedo Soares, oficial de Marinha e membro de\numa das famílias mais influentes do estado do Rio de Janeiro, preso\ndurante estado de sítio decretado pelo presidente Hermes da Fonseca ao\nfinal de seu governo, em 1914. Foi vencido na demanda, porquanto\nentendeu que a ordem em favor de Macedo Soares merecia ser concedida e\njulgada procedente, ao passo que a maioria dos ministros foi do parecer\nde que sequer o STF tinha competência para examinar a matéria posta ali\nsob julgamento. Aposentando-se do STF em dezembro de 1914, foi delegado\ndo Brasil nos trabalhos da Conferência Financeira de Washington, reunida\nem maio de 1915.\n\nEm 15 de janeiro de 1917 foi nomeado prefeito do Distrito Federal pelo\npresidente Venceslau Brás, sucedendo a Azevedo Sodré. Acumulou o posto\ncom cargo na Corte Permanente de Arbitragem, em Haia. Iniciado o governo\nDelfim Moreira em 15 de novembro de 1918, deixou a prefeitura, onde foi\nsubstituído por Cícero Peregrino da Silva, e tomou posse no Ministério\nda Fazenda, onde permaneceu até 17 de janeiro de 1919.\n\nFaleceu na cidade do Rio de Janeiro em janeiro de 1922.\n\nFoi casado com Eponina de Sousa Ferreira.\n\nEntre vasta obra publicada, que versa sobre educação, finanças e\ndireito, figuram os títulos *A Religião* (1874), *New York* (1881),\n*Educação elementar nos Estados Unidos da América do Norte* (1883),\n*Ensino moral e religioso nas escolas públicas* (1883), *The Brazilian\nlanguage and its agglutination* (1884), *Notícia cronológica da educação\npopular no Brasil* e *O meio circulante no Brasil* (1888), *Finances du\nBrésil* (1890), *Resenha financeira do ex-Império do Brasil em 1889*\n(1890), *Projeto de Constituição de um estado, com várias notas e\nconceitos políticos* (1890), *Tributação constitucional, polêmica na\nimprensa* (1896), *Regime federativo e a República brasileira* (1900),\n*Breve relatório sobre direito das obrigações* (1901), *Responsabilidade\ncivil do Estado* (1905), *Revisão das sentenças dos tribunais estaduais\npela Suprema Corte dos Estados Unidos* (1910), *O caso do Conselho\nMunicipal perante o Supremo Tribunal Federal* (1911).\n\nEduardo Junqueira\n\n**FONTES:** CAMPANHOLE. *Constituições*; MATTOSO, P. *Supremo Tribunal\nFederal*; MELLO FILHO, J. *Notas*; RODRIGUES, L. *História*; SUP. TRIB.\nFED. Disponível em: \\<www.stf.jus.br/portal/ministros\\>.\n","ref":"**FONTES:** CAMPANHOLE. *Constituições*; MATTOSO, P. *Supremo Tribunal\nFederal*; MELLO FILHO, J. *Notas*; RODRIGUES, L. *História*; SUP. TRIB.\nFED. Disponível em: \\<www.stf.jus.br/portal/ministros\\>.\n","dic":"DHBPR"}
