{"title":"CAVALCANTI, João de Siqueira","cargoss":["Constituinte","Deputado federal","Deputado federal","Deputado federal","Deputado federal"],"cargos_esp":[0,0,0,0,0],"datas_ini":[1891,1906,1897,1891,1912],"datas_fim":[1891,1908,1899,1893,1912],"estados":[0,"PE","PE","PE","SE"],"autor":["Raimundo Helio Lopes"],"content":"**CAVALCANTI, João de Siqueira**\n\n\\*const. 1891; dep. fed. PE 1891-1893, 1897-1899 e 1906-1908; dep. fed.\nSE 1912.\n\n*João de Siqueira Cavalcanti* nasceu em Pernambuco no dia 24 de dezembro\nde 1855.\n\nFormou-se pela Faculdade de Direito do Recife em 1882. Depois de\nformado, foi nomeado juiz municipal na cidade de Pelotas (RS) e atuou na\nlibertação de escravos. Em 1888 transferiu-se para o estado de Mato\nGrosso, onde foi nomeado auditor de Guerra. Por esses serviços, recebeu\na patente de major do Exército.\n\nDepois de proclamada a República (15/11/1889), exerceu interinamente o\ncargo de chefe da polícia na Bahia em 1890. Em setembro desse ano foi\neleito deputado constituinte pelo estado de Pernambuco e assumiu sua\ncadeira em 15 de novembro, quando foi instalada a Assembleia Nacional\nConstituinte no Rio de Janeiro, agora Distrito Federal. Promulgada a\nnova Carta constitucional em 24 de fevereiro de 1891, em junho seguinte\npassou a cumprir o mandato ordinário, até dezembro de 1893. Voltou a ser\neleito deputado federal em 1897, com mandato até dezembro de 1899, e\ndepois disso, em 1904, foi nomeado juiz de apelação no território do\nAcre, cargo no qual se aposentou. Ainda uma vez ocupou uma cadeira na\nCâmara dos Deputados como representante de Pernambuco, entre 1906 e\n1908. Em janeiro de 1912 foi novamente eleito deputado federal, agora\npelo estado de Sergipe, mas exerceu o mandato por poucos meses, pois\nfaleceu na cidade do Rio de Janeiro no dia 10 de junho daquele ano.\n\nRaimundo Helio Lopes\n\n**FONTES:** ABRANCHES, J. *Governos*; CÂM. DEP. *Deputados brasileiros.*\n","ref":"**FONTES:** ABRANCHES, J. *Governos*; CÂM. DEP. *Deputados brasileiros.*\n","dic":"DHBPR"}
