{"title":"CAVALCANTI, José da Rocha","cargoss":["Deputado federal","Deputado federal"],"cargos_esp":[0,0],"datas_ini":[1912,1894],"datas_fim":[1913,1899],"estados":["AL","AL"],"autor":[0],"content":"**CAVALCANTI, José da Rocha**\n\n\\*dep. fed. AL 1894-1899 e 1912-1913.\n\n*José da Rocha Cavalcanti* nasceu na vila de Alagoas, atual município de\nMarechal Deodoro (AL), em 2 de abril de 1856.\n\nBacharelou-se pela Faculdade de Direito do Recife em 1880 e foi morar no\nPará, mas não demorou a regressar a Alagoas. Em 1882 foi nomeado juiz\nmunicipal em São Miguel dos Campos (AL), onde permaneceu até 1886. No\nano seguinte foi nomeado chefe de polícia em sua cidade natal.\n\nApós a proclamação da República em 15 de novembro de 1889, foi eleito\nsenador estadual em 1893. Em 1894 foi eleito deputado federal por\nAlagoas. Deixou o Senado estadual e assumiu, em maio, sua cadeira na\nCâmara dos Deputados, no Rio de Janeiro, então Distrito Federal. Foi\nreeleito em 1897 e exerceu seu mandato até dezembro de 1899, quando se\nencerrou a legislatura. Voltou à Câmara em 1912 e faleceu em janeiro de\n1913, no exercício do mandato.\n\nSeu filho José da Rocha Cavalcanti Filho foi deputado federal por\nAlagoas de 1921 a 1926 e em 1930.\n\nReynaldo de Barros\n\n**FONTES:** BARROS, F. *A B C das Alagoas* (v.2); CÂM. DEP. *Deputados\nbrasileiros*.\n","ref":"**FONTES:** BARROS, F. *A B C das Alagoas* (v.2); CÂM. DEP. *Deputados\nbrasileiros*.\n","dic":"DHBPR"}
