{"title":"CAVALCANTI, José Rufino Bezerra","cargoss":["Deputado federal","min Agr","Senador","Governador de estado ou do Distrito Federal"],"cargos_esp":[0,0,0,0],"datas_ini":[1906,1915,1918,1919],"datas_fim":[1914,1918,1919,1920],"estados":["PE",0,"PE","PE"],"autor":["Marcos Paulo Torres"],"content":"**CAVALCANTI, José Rufino Bezerra**\n\n\\*dep. fed. PE 1906-1914; min. Agr. 1915-1918; sen. PE 1918-1919; gov.\nPE 1919-1920.\n\n*José Rufino Bezerra Cavalcanti* nasceu em Vitória de Santo Antão (PE)\nem 16 de agosto de 1865, filho de José Rufino Bezerra Cavalcanti e de\nMaria Januária de Barros Lima.\n\nCursou humanidades no Recife e em 1880 matriculou-se na Escola\nPolitécnica do Rio de Janeiro, então capital do Império, na qual obteve\no título de engenheiro agrimensor em 1883. Nesse mesmo ano foi nomeado\npara uma comissão técnica da Estrada de Ferro Central de Pernambuco, mas\nexonerou-se de suas funções para se matricular na Faculdade de Direito\ndo Recife, pela qual se bacharelou em 1886. Foi então nomeado engenheiro\nda Estrada de Ferro do Sul. De 1887 a 1889 dedicou-se à advocacia e à\npolítica, militando no Partido Conservador do Império. Em 1889 casou-se\ncom Ercília Cavalcanti, com quem teria oito filhos.\n\nEm 1905 filiou-se ao Partido Republicano e no ano seguinte foi eleito\ndeputado federal por Pernambuco. Assumindo o mandato em maio de 1906,\nfoi reeleito em 1909 e 1912 e permaneceu na Câmara dos Deputados até\ndezembro de 1914. Convidado pelo presidente Venceslau Brás (1914-1918)\npara o Ministério da Agricultura, assumiu a pasta em 7 de agosto de\n1915, com a nova denominação de Ministério da Agricultura, Indústria e\nComércio, sucedendo a João Pandiá Calógeras. Durante sua gestão, foi\nsubstituído interinamente no cargo por Carlos Maximiliano Pereira dos\nSantos de 19 de janeiro a 22 de fevereiro de 1916. Permaneceu na pasta\naté 16 de novembro de 1917, quando a transferiu a João Gonçalves Pereira\nLima. No ano seguinte foi eleito senador por Pernambuco. Assumindo sua\ncadeira no Senado Federal em maio de 1918, permaneceu nessa casa\nlegislativa até 1919, quando renunciou ao mandato por ter sido eleito\ngovernador de Pernambuco na sucessão de Manuel Borba.\n\nEmpossado em 24 de dezembro de 1919, logo no início do seu governo pôs\nem prática um eficiente programa de harmonização da política estadual\nque assustou os adversários, unificando as várias alas da comunidade\nlocal. A concórdia reinava em Pernambuco, as obras públicas prosseguiam\nnormalmente, e tudo fazia crer que o governador José Rufino faria o seu\nsucessor, o senador José Henrique Carneiro da Cunha. Porém não conseguiu\ntal intento, pois foi acometido de uma grave doença e teve que deixar o\ngoverno no dia 28 de outubro de 1920, seguindo para a Europa para\ntratamento de saúde, e deixando em seu lugar o presidente da Assembleia\nLegislativa, Otávio Hamilton Tavares Barreto.\n\nVoltou a Pernambuco para falecer em Recife no dia 27 de março de 1922.\n\nMarcos Paulo Torres\n\n**FONTES:** LEITE NETO, L. *Catálogo biográfico* (v.3, p.1.741/2);\nSENADO. Disponível em:\n\\<www.senado.gov.br/senadores/senadores\\_biografia.asp?codparl=1979\\>.\nAcesso em: 9/12/2009; SILVA, J. *Vidas.*\n","ref":"**FONTES:** LEITE NETO, L. *Catálogo biográfico* (v.3, p.1.741/2);\nSENADO. Disponível em:\n\\<www.senado.gov.br/senadores/senadores\\_biografia.asp?codparl=1979\\>.\nAcesso em: 9/12/2009; SILVA, J. *Vidas.*\n","dic":"DHBPR"}
