{"title":"CAVALCANTI, Manuel Tavares","cargoss":["Deputado federal","Deputado federal"],"cargos_esp":[0,0],"datas_ini":[1921,1909],"datas_fim":[1929,1911],"estados":["PB","PB"],"autor":["Raimundo Helio Lopes"],"content":"**CAVALCANTI, Manuel Tavares**\n\n\\*dep. fed. PB 1909-1911 e 1921-1929.\n\n*Manuel Tavares Cavalcanti* nasceu na cidade de Alagoa Nova (PB) no dia\n16 de agosto de 1881, filho de João Tavares de Melo Cavalcanti e de\nMaria das Neves Pereira de Araújo Tavares Cavalcanti.\n\nFormou-se na Faculdade de Direito do Recife em dezembro de 1901 e passou\na advogar em seu estado natal. Em 1904 foi nomeado professor da Escola\nNormal da Paraíba e do Liceu Paraibano e, em 1906, delegado fiscal do\ngoverno junto ao Colégio Diocesano.\n\nEm 1907 foi eleito deputado estadual na Paraíba e, em 1909, deputado\nfederal. Ocupou uma cadeira na Câmara dos Deputados, no Rio de Janeiro,\nentão Distrito Federal, até o ano de 1911 e durante esse mandato fez\nparte da Comissão de Instrução Pública. No governo de Francisco Camilo\nde Holanda na Paraíba (1916-1920), foi nomeado chefe de polícia do\nestado. Em 1921 voltou a ser eleito deputado federal. Foi reeleito nos\npleitos de 1924 e 1927, exercendo o mandato até dezembro de 1929. Em\n1930 concorreu a uma vaga no Senado Federal na chapa da Aliança Liberal,\nque tinha como candidato a presidente da República o gaúcho Getúlio\nVargas e a vice o presidente da Paraíba João Pessoa, seu aliado\npolítico. Apesar de eleito, não tomou posse, pois não teve seu diploma\nreconhecido pela Comissão de Verificação de Poderes. Em seu lugar, foi\ndiplomado José Gaudêncio de Queiroz.\n\nFoi também diretor de Instrução Pública e chefe de polícia na Paraíba,\nsócio-fundador do Instituto Histórico e Geográfico Paraibano e membro\nAcademia Paraibana de Letras. No Rio de Janeiro, exerceu os cargos de\nescrivão do juízo de menores, primeiro inventariante judicial e\nprofessor de direito romano na Universidade Católica. Como jornalista,\ncolaborou nos periódicos *A União*, *A Notícia*, *O* *Combate*, *O\nNorte* e *Revista Era Nova*, todos da Paraíba, e ainda na *Revista do\nInstituto Histórico e Geográfico Paraibano*.\n\nFaleceu na cidade do Rio de Janeiro no dia 1^o^ de abril de 1950.\n\nPublicou *Memórias da fundação da Paraíba* (1906) e *Epítome de história\nda Paraíba* (1914).\n\nRaimundo Helio Lopes\n\n**FONTES:** ABRANCHES, J. *Governos*; *Grande encic.* *Delta Larousse*;\nINST. HIST. GEO. PARAIBANO. Disponível em: \\<www.ihgp.net\\>. Acesso em:\n8/12/2010; ODILON, M. *Pequeno*; PINTO, L. *Antologia.*\n","ref":"**FONTES:** ABRANCHES, J. *Governos*; *Grande encic.* *Delta Larousse*;\nINST. HIST. GEO. PARAIBANO. Disponível em: \\<www.ihgp.net\\>. Acesso em:\n8/12/2010; ODILON, M. *Pequeno*; PINTO, L. *Antologia.*\n","dic":"DHBPR"}
