{"title":"CÂMARA, José Antônio","cargoss":["Ministro da Guerra","Senador","Governador de estado ou do Distrito Federal","Governador de estado ou do Distrito Federal"],"cargos_esp":[0,0,0,0],"datas_ini":[1880,1880,1892,1889],"datas_fim":[1881,1889,1892,1890],"estados":[0,"RS","RS","RS"],"autor":[0],"content":"**CÂMARA, José Antônio**\n\n\\* militar; min. Guerra 1880-1881; sen. RS 1880-1889; gov. RS 1889-1890\ne 1892.\n\n*José Antônio Correia da Câmara*, futuro *visconde de Pelotas*, nasceu\nem Porto Alegre em 17 de fevereiro de 1824, filho do general José\nHipólito de Lima e de Maria Benedita Correia da Câmara. Seu avô,\nPatrício José Correia da Câmara, foi o primeiro visconde de Pelotas; seu\nirmão Leopoldo Augusto da Câmara Lima foi agraciado com o título de\nbarão de São Nicolau.\n\nEm 1839 ingressou na carreira militar, no 3^o^ Regimento de Cavalaria, e\nlogo tomou parte em batalha contra os revolucionários envolvidos na\nRevolução Farroupilha ou Guerra dos Farrapos, que conflagrou o Rio\nGrande do Sul entre 1835 e 1845. Em 1844 foi promovido a alferes, e em\n1850 a capitão. Entre 1851 e 1852, sob as ordens do brigadeiro Manuel\nMarques de Sousa, lutou na Guerra do Prata, também conhecida como Guerra\ncontra Rosas, episódio da longa disputa entre Brasil e Argentina pela\ninfluência no Uruguai e pela supremacia na região do rio da Prata, que\nterminou com a vitória brasileira.\n\nEntre os anos de 1855 e 1857 estudou na Escola Militar de Porto Alegre e\noptou pela arma de cavalaria. Em 1863 foi promovido a major e no ano\nseguinte participou mais uma vez de um confronto armado. Tratava-se\nagora da Guerra contra Aguirre, conflito inscrito na defesa dos\ninteresses do Brasil. As forças brasileiras depuseram então o presidente\nuruguaio Atanásio Aguirre, do Partido Blanco, que foi substituído por\nseu opositor Venâncio Flores. Ainda em 1864, após a vitória brasileira\nno Uruguai, o exército paraguaio invadiu a província brasileira de Mato\nGrosso, dando início à Guerra do Paraguai (1864-1870), que opôs, de um\nlado, Brasil, Argentina e Uruguai e, de outro, o Paraguai.\n\nEm 1865, José Antônio Câmara auxiliou na retomada da cidade de\nUruguaiana (RS), invadida por tropas paraguaias a mando do presidente\nFrancisco Solano Lopes com o objetivo de aumentar o território do\nParaguai e de obter uma saída para o oceano Atlântico. Em 1866\nparticipou da Batalha do Curupaiti, e em 1868, da Batalha do Avaí, em\nterritório paraguaio. Nesse mesmo ano foi promovido a brigadeiro. Com o\ntérmino da guerra, em 1870, reconhecido como um dos heróis do Exército\nbrasileiro, foi promovido a marechal e recebeu o título nobiliárquico de\nvisconde de Pelotas. Receberia ainda a medalha do Mérito Militar e as\ninsígnias da Ordem do Cruzeiro, de comendador de São Bento de Aviz e de\noficial da Imperial Ordem da Rosa.\n\nEm 28 de março de 1880 foi nomeado ministro de Estado dos Negócios da\nGuerra. Nesse mesmo ano assumiu uma cadeira no Senado pelo Partido\nLiberal. Deixou o ministério em 15 de maio de 1881, mas permaneceu no\nSenado até 1889. Como senador, defendeu, em 1887, os implicados na\nchamada Questão Militar. Advogou também a causa de emancipação dos\nescravos e desenvolveu a rede ferroviária no Rio Grande do Sul.\n\nCom a proclamação da República em 15 de novembro de 1889, e a instalação\ndo governo provisório chefiado pelo marechal Deodoro da Fonseca, foi por\neste indicado governador do Rio Grande do Sul. Substituiu assim o\nvice-presidente da província, Justo de Azambuja Rangel, que desde 6 de\nnovembro ocupava interinamente o lugar do titular Gaspar Silveira\nMartins. Permaneceu à frente do governo rio-grandense até 11 de\nfevereiro de 1890, quando foi substituído por Júlio Anacleto Falcão da\nFrota. Voltou a assumir o governo do estado entre 8 e 17 de junho de\n1892, em conjuntura de grande instabilidade, que conduziu, no início de\n1893, à eclosão da Revolução Federalista.\n\nFaleceu no Rio de Janeiro em 18 de agosto de 1893.\n\nCasado com Maria Rita Fernandes Pinheiro, teve cinco filhos.\n\nMirna Aragão\n\n**FONTES:** CÂMARA, R. *Marechal*; DONATO, H. *Dicionário*; LEITE NETO,\nL. *Catálogo biográfico* (p.1.781-1.782); MIN. GUERRA Almanaque (1885,\np.372); MOYA, S. *Anuário*; PORTO ALEGRE, A. *Homens*;\n","ref":"**FONTES:** CÂMARA, R. *Marechal*; DONATO, H. *Dicionário*; LEITE NETO,\nL. *Catálogo biográfico* (p.1.781-1.782); MIN. GUERRA Almanaque (1885,\np.372); MOYA, S. *Anuário*; PORTO ALEGRE, A. *Homens*;\n","dic":"DHBPR"}
