{"title":"CÉSAR, Antônio do Amaral","cargoss":["Deputado federal"],"cargos_esp":[0],"datas_ini":[1903],"datas_fim":[1906],"estados":["SP"],"autor":["Raimundo Helio Lopes"],"content":"**CÉSAR, Antônio do Amaral**\n\n\\*dep. fed. SP 1903-1906.\n\n*Antônio do Amaral César* nasceu em São Paulo.\n\nFormou-se na Faculdade de Direito de São Paulo e advogou por muitos anos\nna cidade de Botucatu (SP).\n\nDepois da proclamação da República (15/11/1889), foi eleito deputado\nestadual em São Paulo na legenda do Partido Republicano Paulista (PRP).\nNa mesma legenda foi eleito deputado federal pelo estado de São Paulo em\njaneiro de 1903 e assumiu em maio seguinte sua cadeira na Câmara dos\nDeputados, no Rio de Janeiro, então Distrito Federal. Em janeiro de 1906\nfoi reeleito, mas faleceu em julho desse ano no exercício do mandato.\n\nRaimundo Helio Lopes\n\n**FONTES:** ABRANCHES, J. *Governos*; CALIMAN, A. *Legislativo*; CÂM.\nDEP. *Deputados brasileiros.*\n","ref":"**FONTES:** ABRANCHES, J. *Governos*; CALIMAN, A. *Legislativo*; CÂM.\nDEP. *Deputados brasileiros.*\n","dic":"DHBPR"}
