{"title":"CHAVES, Carvalho","cargoss":["Deputado federal"],"cargos_esp":[0],"datas_ini":[1904],"datas_fim":[1914],"estados":["PR"],"autor":["Luciana Pinheiro"],"content":"**CHAVES, Carvalho**\n\n\\*dep. fed. PR 1904-1914.\n\n*Antônio Augusto de Carvalho Chaves* nasceu em Macaíba (RN) no dia 26 de\nmarço de 1875, filho de Joaquim Gonçalves Chaves Filho e de Francisca\nTeixeira de Carvalho Chaves.\n\nAinda na infância passou a residir em Curitiba, no Paraná, onde fez os\nprimeiros estudos. Em 1895 diplomou-se em ciências jurídicas e sociais\npela Faculdade de Direito de São Paulo. Nesse mesmo ano, pouco antes de\nse formar, tornou-se promotor público no município paulista de Ribeirão\nPreto. Ingressou na política em 1896, quando assumiu a Secretaria do\nInterior, Justiça e Instrução Pública do Paraná, a convite do presidente\nestadual José Pereira Santos Andrade (1896-1899). Em 1900, já no governo\nde Francisco Xavier da Silva (1900-1904), foi nomeado secretário de\nFinanças, Comércio e Indústria.\n\nEstando em curso a legislatura 1903-1905, foi eleito deputado federal\npelo Paraná e tomou posse em 23 de julho de 1904. Reeleito para as três\nlegislaturas seguintes, exerceu o mandato até dezembro de 1914. De\noutubro de 1930 a 1931, no governo de Mário Alves Monteiro Tourinho, o\nprimeiro após a Revolução de 1930, foi secretário da Fazenda, Indústria\ne Comércio do Paraná. Eleito deputado estadual em 1934, após a posse, em\n1935, foi escolhido presidente da Assembleia Legislativa. Em junho do\nmesmo ano ocupou interinamente, por um mês, o governo do estado,\nsubstituindo Manuel Ribas, então eleito governador. Já no Estado Novo\n(1937-1945), quando Manuel Ribas passou a interventor, tornou-se membro\ndo Conselho Administrativo do estado.\n\nAo longo de sua trajetória, também foi colaborador dos jornais *A\nRepública* e *O Estado*. Foi membro da Ordem dos Advogados do Brasil\n(OAB) do Paraná, do Instituto Histórico e Geográfico Paranaense e da\nSociedade Geográfica do Rio de Janeiro.\n\nFaleceu em Curitiba no dia 3 de junho de 1949.\n\nEra casado com Rosa de Carvalho Chaves.\n\nLuciana Pinheiro\n\n**FONTES:** ARQ. PUB. PARANÁ. Disponível em:\n\\<www.arquivopublico.pr.gov.br/\\>; BIB. NAC. Disponível em:\n\\<http://catalogos.bn.br/scripts/odwp032k.dll?t=bs&pr=cardcatalog\\_pr&db=cardcatalog&use=pn&disp=list&sort=off&ss=NEW&arg=nicolas,|maria\\>;\nCÂM. DEP. *Deputados brasileiros*; CASA CIVIL PARANÁ. Disponível em:\n\\<www.casacivil.pr.gov.br/\\>. Acesso em: 14/6/2010; NICOLAS, M. *Cem\nanos* (p.279-280).\n","ref":"**FONTES:** ARQ. PUB. PARANÁ. Disponível em:\n\\<www.arquivopublico.pr.gov.br/\\>; BIB. NAC. Disponível em:\n\\<http://catalogos.bn.br/scripts/odwp032k.dll?t=bs&pr=cardcatalog\\_pr&db=cardcatalog&use=pn&disp=list&sort=off&ss=NEW&arg=nicolas,|maria\\>;\nCÂM. DEP. *Deputados brasileiros*; CASA CIVIL PARANÁ. Disponível em:\n\\<www.casacivil.pr.gov.br/\\>. Acesso em: 14/6/2010; NICOLAS, M. *Cem\nanos* (p.279-280).\n","dic":"DHBPR"}
