{"title":"CHAVES, Elói","cargoss":["Deputado federal","Deputado federal"],"cargos_esp":[0,0],"datas_ini":[1919,1903],"datas_fim":[1930,1914],"estados":["SP","SP"],"autor":["Carlos Alberto Ungaretti Dias"],"content":"**CHAVES, Elói**\n\n\\*dep. fed. SP 1903-1914 e 1919-1930.\n\n*Elói de Miranda Chaves* nasceu em Pindamonhangaba (SP) em 27 de\ndezembro de 1876, filho do coronel José Guilherme de Miranda Chaves e de\nCândida Marcondes Chaves.\n\nEstudou humanidades no Colégio Meneses Vieira e no Colégio Pedro II.\nBacharelou-se em ciências jurídicas e sociais pela Faculdade de Direito\nde São Paulo em 1896, e no mesmo ano foi nomeado promotor em São Roque.\nFoi depois removido para Jundiaí, onde abriu escritório de advocacia. No\nano seguinte, já líder do Partido Republicano Paulista (PRP) local, foi\neleito vereador e escolhido presidente da Câmara Municipal, respondendo\ntambém pela administração da cidade.\n\nEm 1902 foi eleito deputado federal pelo PRP para a legislatura\n1903-1905, finda a qual reelegeu-se mais três vezes, cumprindo mandato\naté dezembro de 1914. Considerado um grande orador, teve presença\nconstante nos debates que trataram da exploração do potencial\nhidroelétrico e do sistema de serviço de força elétrica e luz do país.\nNo segundo governo de Rodrigues Alves em São Paulo (1912-1916) e no\ngoverno de Altino Arantes (1916-1920), foi secretário de Negócios da\nJustiça (1/11/1913 a 14/12/1918), esteve também à frente da Secretaria\nde Segurança Pública, e ainda acumulou a pasta da Agricultura nos\núltimos três meses de sua gestão. No período, a Segurança Pública de São\nPaulo passava por ampla reformulação, baseada em convênio que trouxe a\nMissão Militar francesa ao estado.\n\nEm 1919 foi novamente eleito deputado federal, iniciando nova sucessão\nde mandatos que só se encerraria com a Revolução de 1930. Apresentou\nentão o projeto que o tornaria conhecido como “o pai da previdência\nsocial” no Brasil. A iniciativa foi transformada no Decreto n^o^ 4.682,\nde 24 de janeiro de 1923, conhecido como “Lei Elói Chaves”, assinado\npelo então presidente Artur Bernardes (1922-1926). O decreto criava a\nCaixa de Aposentadoria e Pensões dos Ferroviários, considerada o embrião\ndo Instituto Nacional de Previdência Social, e a primeira aposentadoria\nfoi concedida menos de três meses após sua aprovação, em 14 de abril.\n\nCom o fechamento dos órgãos legislativos do país pela Revolução de\noutubro de 1930, afastou-se da vida pública e passou a se dedicar aos\nseus negócios. Fazendeiro com diversos empreendimentos em Jundiaí,\ntambém ganhou notoriedade como empresário do setor de energia elétrica,\naquele que mais construiu usinas hidrelétricas no país, expoente da\niniciativa privada nacional no início do século XX. Em sociedade com\nRodrigo Alves, fundou a Empresa Luz e Força de Jundiaí, em 1902, e\nconstruiu as hidrelétricas Monte Serrat e Quilombo, no rio Jundiaí, em\n1914. Seu conglomerado de usinas cresceu rapidamente, e em 1912 adquiriu\na Companhia de Rio Claro, que passou a se chamar Sociedade Anônima\nCentral Elétrica Rio Claro (Sacerc) e promoveu a construção de nove\nhidrelétricas, uma usina térmica, mais de mil quilômetros de linhas de\ntransmissão e cerca de quinhentos quilômetros de linhas de distribuição,\nservidas por 17 subestações estabelecidas no interior dos estados de São\nPaulo e Minas Gerais. Em 1923, passou a controlar a Empresa Água, Força\ne Luz de Mogi Mirim e, em 1926, associou-se à Empresa Melhoramentos de\nMogi Guaçu. No entanto, não resistiu à concorrência dos grupos\ninternacionais Light & Power e American & Foreign Power (Amforp), que\nexerciam um virtual controle da produção e distribuição de energia\nelétrica no país, e vendeu a empresa para o grupo da Light em 1927.\n\nSeu pioneirismo e esforço na geração e distribuição de energia elétrica\nrenderam-lhe diversas homenagens. Recebeu título de cidadão das cidades\nde Rio Claro e Jundiaí, onde tinha negócios, e em 1980 a Associação\nBrasileira de Concessionárias de Energia Elétrica (ABCE) instituiu a\nMedalha Elói Chaves, conferida à concessionária brasileira que, no\nperíodo de um ano, registrar o menor número de acidentes. Suas empresas\nlegaram rico acervo arquitetônico, como a Usina do Corumbataí, em Rio\nClaro, onde foi encontrada, sob a estátua de Elói Chaves, uma cápsula do\ntempo, datada de 1960, contendo diversos documentos. Esse patrimônio\ncultural hoje integra o acervo da Fundação Energia e Saneamento. Seu\nnome foi dado a uma escola pública em Jundiaí e a diversas ruas em\ncidades do interior de São Paulo.\n\nMorreu em 18 de abril de 1964.\n\nEra casado com Almerinda Mendes Pereira.\n\nCarlos Alberto Ungaretti Dias\n\n**FONTES:** ABRANCHES, J. *Governos* (v.2); Dicionário de ruas.\nDisponível em: \\<www.dicionarioderuas.com.br/\\>; FUND. EN. SAN.\nDisponível em:\n\\<www.energiaesaneamento.org.br/noticias/detalhe.php?uidn=54\\>; *Jornal\nCampos do Jordão*. Disponível em:\n\\<www2.uol.com.br/jornaldecampos/497/prev.htm\\>; Pindavale. Disponível\nem: \\<www.pindavale.com.br/filhosilustres/eloychaves.asp\\>; Requerimento\nn^o^ 151/1964, aprovado na Assembleia Legislativa de São Paulo.\n","ref":"**FONTES:** ABRANCHES, J. *Governos* (v.2); Dicionário de ruas.\nDisponível em: \\<www.dicionarioderuas.com.br/\\>; FUND. EN. SAN.\nDisponível em:\n\\<www.energiaesaneamento.org.br/noticias/detalhe.php?uidn=54\\>; *Jornal\nCampos do Jordão*. Disponível em:\n\\<www2.uol.com.br/jornaldecampos/497/prev.htm\\>; Pindavale. Disponível\nem: \\<www.pindavale.com.br/filhosilustres/eloychaves.asp\\>; Requerimento\nn^o^ 151/1964, aprovado na Assembleia Legislativa de São Paulo.\n","dic":"DHBPR"}
