{"title":"CHERMONT, Justo","cargoss":["Membro de junta governativa","Governador de estado ou do Distrito Federal","Ministro das Relações Exteriores","Senador","Senador"],"cargos_esp":[0,0,0,0,0],"datas_ini":[1889,1889,1891,1921,1894],"datas_fim":[1889,1891,1891,1926,1909],"estados":["PA","PA",0,"PA","PA"],"autor":["Adrianna Setemy"],"content":"**CHERMONT, Justo**\n\n\\*junta gov. PA 1889; gov. PA 1889-1891; min. Rel. Ext. 1891; sen. PA\n1894-1909 e 1921-1926.\n\n*Justo Pereira Leite Chermont* nasceu em Belém do Pará no dia 27 de\njunho de 1857, filho de Antônio Lacerda Chermont e de Catarina Leite\nChermont. Seu pai recebeu o título de visconde de Arari e distinguiu-se\ncomo primeiro vice-presidente da província do Pará no período de 1866 a\n1868. Seu irmão Pedro Leite Chermont foi constituinte de 1891 e deputado\nfederal pelo Pará nos períodos 1891-1893 e 1897-1902.\n\nFez os primeiros estudos no Liceu Paraense e formou-se pela Faculdade de\nDireito do Recife. De volta ao Pará, foi deputado provincial em 1880.\n\nUm dia após a proclamação da República em 15 de novembro de 1889,\nchefiou a junta provisória que assumiu o poder no Pará com a deposição\ndo então presidente da província, Antônio José Ferreira Braga. A junta\nera composta ainda pelo tenente-coronel Bento José Fernandes Júnior e\npelo capitão de fragata José Maria do Nascimento. Por ordem do governo\nprovisório da República, chefiado pelo marechal Deodoro da Fonseca, em\n17 de dezembro a junta foi desfeita e Justo Chermont foi nomeado\ngovernador do estado, enquanto Gentil Bittencourt era designado\nvice-governador. Justo Chermont governou até 7 de fevereiro de 1891,\nquando foi substituído por Gentil Bittencourt.\n\nDe 26 de fevereiro a 23 de novembro de 1891, no governo constitucional\nde Deodoro, Justo Chermont foi secretário de Estado dos Negócios\nEstrangeiros. Senador pelo estado do Pará de 1894 a 1909, nas eleições\npresidenciais de 1902 concorreu sem sucesso à vice-presidência da\nRepública, apoiado pelos Partidos Republicanos do Pará, Pernambucano e\nFluminense. Voltou ao Senado de 1921 a 1926, ano em que faleceu, no dia\n2 de abril.\n\nSeu sobrinho Mário Midosi Chermont, filho de seu irmão Antônio Leite\nChermont, foi constituinte em 1934 e deputado federal pelo Pará de 1935\na 1937.\n\nAdrianna Setemy\n\n**FONTES:** LEITE NETO, L. *Catálogo biográfico*; Projeto de imagem de\npublicações oficiais brasileiras do Center for Research Libraries e\nLatin-american Microfilm Project. *Mensagens dos Presidentes de\nProvíncia (1830-1930).* Disponível em:\n\\<www.crl.edu/content.asp?l1=4&l2=18&l3=33\\>. Acesso em: 8/1/2009;\nSENADO. Disponível em:\n\\<www.senado.gov.br/sf/senadores/senadores\\_biografia.asp?codparl=1998&li=23&lcab=1894-1896&lf=23\\>.\nAcesso em: 30/1/2009.\n","ref":"**FONTES:** LEITE NETO, L. *Catálogo biográfico*; Projeto de imagem de\npublicações oficiais brasileiras do Center for Research Libraries e\nLatin-american Microfilm Project. *Mensagens dos Presidentes de\nProvíncia (1830-1930).* Disponível em:\n\\<www.crl.edu/content.asp?l1=4&l2=18&l3=33\\>. Acesso em: 8/1/2009;\nSENADO. Disponível em:\n\\<www.senado.gov.br/sf/senadores/senadores\\_biografia.asp?codparl=1998&li=23&lcab=1894-1896&lf=23\\>.\nAcesso em: 30/1/2009.\n","dic":"DHBPR"}
