{"title":"CINTRA, Antônio Francisco de Araújo","cargoss":["Deputado federal"],"cargos_esp":[0],"datas_ini":[1901],"datas_fim":[1902],"estados":["SP"],"autor":["Raimundo Helio Lopes"],"content":"**CINTRA, Antônio Francisco de Araújo**\n\n\\*dep. fed. SP 1901-1902.\n\n*Antônio Francisco de Araújo Cintra* nasceu em São Paulo.\n\nFormou-se na Faculdade de Direito da capital paulista. Ainda durante o\nImpério, mesmo oriundo de uma família ligada ao Partido Liberal,\ningressou no Partido Republicano Paulista (PRP), na cidade de\nMogi-Mirim, onde defendeu a causa republicana e concorreu a uma vaga de\ndeputado geral pela província de São Paulo, mas não foi eleito.\n\nDepois da proclamação da República (15/11/1889), elegeu-se senador\nestadual em São Paulo em 1894, para um mandato de seis anos. Após deixar\no Legislativo estadual, e estando em curso a legislatura 1900-1902, foi\neleito, em abril de 1901, deputado federal pelo estado de São Paulo na\nlegenda do PRP na vaga aberta com a renúncia de Artur de Aguiar\nDiederichsen. Assumiu em maio seguinte sua cadeira na Câmara dos\nDeputados, no Rio de Janeiro, então Distrito Federal, e nela permaneceu\naté o final da legislatura, em dezembro de 1902.\n\nRaimundo Helio Lopes\n\n**FONTES:** ABRANCHES, J. *Governos*; CALIMAN, A. *Legislativo*; CÂM.\nDEP. *Deputados brasileiros.*\n","ref":"**FONTES:** ABRANCHES, J. *Governos*; CALIMAN, A. *Legislativo*; CÂM.\nDEP. *Deputados brasileiros.*\n","dic":"DHBPR"}
