{"title":"COELHO NETO, Henrique","cargoss":["Deputado federal"],"cargos_esp":[0],"datas_ini":[1909],"datas_fim":[1917],"estados":["MA"],"autor":["Renato Lanna Fernandez"],"content":"**COELHO NETO, Henrique**\n\n\\*escritor; dep. fed. MA 1909-1917.\n\n*Henrique Maximiano Coelho Neto* nasceu no município de Caxias (MA) no\ndia 21 de fevereiro de 1864, filho do comerciante Antônio da Fonseca\nCoelho e da índia Ana Silvestre Coelho. Em sua vida profissional foi\npolítico, mas também professor, romancista, contista, crítico,\nteatrólogo, memorialista e poeta. Além de assinar trabalhos com seu\npróprio nome, escrevia sob diferentes pseudônimos, entre eles Anselmo\nRibas, Caliban, Ariel, Amador Santelmo, Blanco Canabarro, Charles\nRouget, Democ, N. Puck, Tartarin, Fur-Fur e Manes.\n\nEm 1870 a família veio para a cidade do Rio de Janeiro, então capital do\nImpério, perseguida por problemas políticos no Maranhão. Coelho Neto\niniciou seus estudos em 1872 no Colégio Jordão, no Mosteiro de São\nBento, e depois no externato do Colégio Pedro II. Iniciou o curso de\nmedicina, mas logo desistiu. Em 1883 matriculou-se na Faculdade de\nDireito de São Paulo, em 1885 transferiu-se para a Faculdade de Direito\nde Pernambuco e no mesmo ano para a da cidade de Campinas (SP). Suas\nideias abolicionistas e republicanas o tornaram alvo de perseguições que\no impediram de concluir o curso. Retornou ao Rio de Janeiro ainda em\n1885.\n\nSeu primeiro trabalho na imprensa foi no *Jornal do Comércio,* onde, aos\n17 anos, escrevia poesia. A amizade com José do Patrocínio rendeu-lhe um\nemprego no jornal *Gazeta da Tarde*. A partir daí passou a escrever nos\nprincipais jornais da cidade, obtendo um sucesso vertiginoso. Nesse\nperíodo, conviveu com grandes nomes do movimento abolicionista como\nOlavo Bilac, Raul Pompeia, Paula Nei e seu amigo José do Patrocínio. A\nchamada “Boemia literária” se reunia nos cafés e confeitarias da rua do\nOuvidor, dos quais Coelho Neto era frequentador assíduo.\n\nO fim da fase boêmia se deu em 1890 com o casamento com Maria Gabriela\nBrandão, filha de Alberto Brandão, conhecido educador com boas relações\ncom as elites fluminenses – além de deputado provincial, Alberto Brandão\nseria também deputado federal de 1891 a 1893. Provavelmente o prestígio\ndo sogro foi responsável por sua nomeação, ainda em 1890, para o cargo\nde secretário de Governo do Estado do Rio de Janeiro, e no ano seguinte,\npara diretor dos negócios do Estado, da Justiça e Legislação, durante o\ngoverno de Francisco Portela (1889-1891). Depois desse período,\ntornou-se professor de história da arte na Escola Nacional de Belas\nArtes, em 1892. Por suas atividades jornalísticas e literárias e por sua\nrede de sociabilidade, em 1897 foi um dos fundadores, ao lado de Machado\nde Assis, da Academia Brasileira de Letras, ocupando a cadeira de número\n2 que tem como patrono Álvares de Azevedo.\n\nEntre 1901 e 1904 voltou a Campinas como lente de literatura no Ginásio\nde Campinas. Em 1904 retornou ao Rio de Janeiro como professor do\nColégio Pedro II. A atividade jornalística, contudo, era sua principal\nfonte de renda, responsável pelo sustento de uma família de sete filhos\nque sobreviveram de um total de 14. Em 1905, com melhor situação\nfinanceira, fixou residência na rua do Roso, no bairro das Laranjeiras.\nO sucesso como escritor nas primeiras décadas do século XX o levou a\ndesfrutar de enorme prestígio social e político nos meios burgueses e\nelegantes da sociedade carioca. Escrevia sobre tudo, abordando qualquer\ntema, desde culinária, moda, esporte e política. Seus críticos\nconsideravam-no um autor de moda que assumia o estilo impessoal e\nanódino da *Belle Époque.* Seu maior opositor foi Lima Barreto, que o\nvia como um escritor que punha a literatura a serviço dos modismos das\nelites, que aceitava fazer brindes de sobremesa para a satisfação de\nricaços incapazes de reconhecer a alma de uma criança negra.\n\nTais críticas não diminuíam o prestígio do escritor, que transformou sua\nresidência na rua do Roso em um verdadeiro salão literário, ponto de\nencontro de diversos intelectuais. Foi graças a esse prestígio que\nCoelho Neto recebeu o convite para candidatar-se a deputado federal pelo\nestado do Maranhão, o que acabou acontecendo em 1909. Nesse mesmo ano\ntornou-se lente do Ginásio Nacional e no ano seguinte assumiu o cargo de\nprofessor de história do teatro e literatura dramática na Escola de Arte\nDramática do Rio de Janeiro, da qual se tornou diretor. Foi reeleito\ndeputado em 1912 e novamente em 1915. Em 1917, ao final da legislatura,\nnão teve seu mandato renovado. Sua atuação como deputado se deu\nbasicamente através de discursos sobre a necessidade de fazer do Brasil\numa nação civilizada. Para tanto, propunha a criação de símbolos\nnacionais que representassem a defesa de valores ligados à disciplina e\nà eugenia.\n\nSua obra literária completa possui mais de 120 volumes publicados. Além\ndisso, produziu mais de três mil contos, fábulas, palestras,\nconferências, discursos, mensagens, saudações, poesias, hinos esportivos\ne patrióticos. Isso tudo sem deixar de escrever diariamente para\ndiversos jornais. Fundou, dirigiu e colaborou com cerca de 60 revistas e\njornais no Brasil e no exterior. Entre as revistas que fundou\ndestacam-se: *O Meio – Revista social, política, literária e artística*\n(1889), *A Política – Revista combativa e ilustrada* (1918) e *Atlética\n– Revista literária, artística e esportiva*.\n\nA família foi um fator importante na vida de Coelho Neto. Após perder\nvários de seus filhos por doenças na infância, desistiu de mantê-los em\nambientes fechados e resolveu expô-los a uma vida mais livre e dinâmica.\nIncentivando a prática da educação física, fez dos filhos grandes\ndesportistas. Violeta já era, aos 10 anos, uma das maiores atletas de\nnado *crawl* da cidade; João Coelho Neto, conhecido como Preguinho, foi\num atleta múltiplo, campeão em vários esportes, com destaque para a\nnatação e o futebol, onde se destacou por ser o autor do primeiro gol da\nseleção brasileira em uma copa do mundo em 1930; Georges e Paulo jogaram\n*water-polo* e Mano (Emanuel Coelho Neto) foi campeão sul-americano de\nfutebol em 1919. O incentivo ao esporte foi outra faceta do escritor,\nque se associou a vários clubes, recebendo as mais diversas homenagens.\nEntretanto, sua maior paixão foi o Fluminense Football Club*,* do qual\ncompôs o primeiro hino oficial, em 1915, e foi diretor artístico em\n1925.\n\nCoelho Neto possuía um profundo carinho pelo Rio de Janeiro, que sonhava\nver como uma das principais capitais do mundo, rivalizando com as da\nEuropa. Foi considerado o criador da expressão “Cidade maravilhosa” para\ndefinir o Rio de Janeiro, que inspirou o compositor André Filho a compor\numa marcha para o carnaval de 1935 com esse título.\n\nPor ser herdeiro da geração de 1870, caracterizada pelo espírito\ncientífico e militante, acreditava no poder transformador das ideias\ncientíficas e da educação para conquistar uma sociedade moderna\ncivilizada baseada na evolução e no progresso. Por esses ideais, em toda\na sua obra revela-se uma inquietação com a questão nacional. Para ele, o\nconceito de nação precisava ser construído a partir de três alicerces: a\neducação, voltada para os ensinamentos cívicos, a política, através de\numa ação política que valorizasse a história e os símbolos nacionais e,\npor fim, o esporte, cuja principal qualidade seria a disciplina. Esse\nideário nacional deveria ser elaborado por uma elite intelectual formada\npor homens de larga cultura e preparo para criar o “ideal do cidadão\nbrasileiro” que permitiria que o Brasil se revelasse como uma nação\ncivilizada. Dentro desse espírito, participou da fundação da Liga da\nDefesa Nacional em 7 de setembro de 1916, juntamente com Olavo Bilac,\nPedro Lessa, Félix Pacheco, Miguel Calmon, Rui Barbosa e o então\npresidente da República Venceslau Brás, entre outros. Tornou-se membro\ndo diretório central da liga.\n\nA morte trágica de seu filho Emanuel em 1922, após um acidente em um\njogo de futebol, marcou o início de uma nova fase em sua vida literária.\nConvertendo-se ao espiritismo, sua obra passou a abordar temáticas\nespirituais e religiosas. Além disso, sofreu fortes críticas na Semana\nde Arte Moderna de 1922 por seu estilo literário considerado\nultrapassado. As críticas, entretanto, não diminuíram o ritmo de sua\natividade intelectual. Membro do conselho consultivo do Teatro Municipal\ndesde 1921, em 1926 assumiu a presidência da Academia Brasileira de\nLetras, substituindo Afonso Celso. Em 1928 a revista *O Malho* promoveu\num concurso que o consagrou como o príncipe dos prosadores brasileiro.\nNesse mesmo ano a rua do Roso passou a chamar-se Coelho Neto, em sua\nhomenagem.\n\nApesar das diversas homenagens, sua carreira declinava vertiginosamente\ne, após o falecimento de sua esposa em 1931, passou a ter uma vida mais\nreclusa. Em 1932 a Academia Brasileira de Letras lançou oficialmente sua\ncandidatura ao Prêmio Nobel de Literatura de 1933, vencido pelo russo\nIvan Alekseyevich Bunin.\n\nFaleceu no dia 28 de novembro de 1934 na cidade do Rio de Janeiro.\n\nApós a morte seu nome caiu em esquecimento. Entretanto, na década de\n1940 voltou a ser lembrado, principalmente pelo filho Paulo Coelho Neto,\nque em 1942 escreveu uma biografia do pai e publicou uma série de\nantologias de seus textos. Em sua obra destacam-se *O meio* (1889),\n*Rapsódias*, *A capital federal – Impressões de um sertanejo*,\n*Baladilhas*, *O fruto*, *O rei fantasma*, *Miragem*, *Inverno em flor*,\n*Álbum de Caliban*, *Sertão*, *O morto* – *memórias de um fuzilado*, *O\nparaíso*, *A descoberta da Índia*, *O rajá de Pendjab*, *Romanceiro*, *A\nconquista*, *Tormenta*, *Turbilhão*, *O Arara*, *Jardim das oliveiras*,\n*Esfinge*, *Pátria brasileira – educação moral e cívica* (1909),\n*Banzo*, *O romance bárbaro* (1914), *Rei Negro*, *Patinho torto*, *Vida\nmundana*, *O mistério*, *Fogo de vista*, *Mano, Livro da saudade,\nromance*, *O polvo*, *Imortalidade*, *Contos da vida e da morte*, *A\ncidade maravilhosa*, *Fogo fátuo*, *Teatro III* (1907), *Teatro II*\n(1907), *Teatro IV* (1908), *Teatro I* (1911) e *Teatro V* (1918).\n\nEm sua homenagem, um município da região leste do Maranhão leva seu\nnome, assim como um bairro da Zona Norte da cidade do Rio de Janeiro.\n\nRenato Lanna Fernandez\n\n**FONTES:** BROCA, B. *Vida*; CANDIDO, D. *Último*; COELHO NETTO, P.\n*Coelho Netto*; COELHO NETTO, P. *Coelho Netto e os esportes*;\nFERNANDEZ, R. *Fluminense*; LIGA DA DEF. NAC. Disponível em:\n\\<www.ligadadefesanacional.org.br/principal.htm\\>. Acesso em: 26/1/2011;\nSEVCENKO, N. *Literatura*; Tigre de fogo. Disponível em:\n\\<http://tigredefogo.wordpress.com/2007/11/30/vencedores-do-premio-nobel-de-literatura/\\>.\nAcesso em: 26/1/2011.\n","ref":"**FONTES:** BROCA, B. *Vida*; CANDIDO, D. *Último*; COELHO NETTO, P.\n*Coelho Netto*; COELHO NETTO, P. *Coelho Netto e os esportes*;\nFERNANDEZ, R. *Fluminense*; LIGA DA DEF. NAC. Disponível em:\n\\<www.ligadadefesanacional.org.br/principal.htm\\>. Acesso em: 26/1/2011;\nSEVCENKO, N. *Literatura*; Tigre de fogo. Disponível em:\n\\<http://tigredefogo.wordpress.com/2007/11/30/vencedores-do-premio-nobel-de-literatura/\\>.\nAcesso em: 26/1/2011.\n","dic":"DHBPR"}
