{"title":"COELHO, Leovigildo de Sousa","cargoss":["Constituinte","Senador"],"cargos_esp":[0,0],"datas_ini":[1891,1891],"datas_fim":[1891,1893],"estados":[0,"AM"],"autor":["Inoã Pierre Carvalho Urbinati"],"content":"**COELHO, Leovigildo de Sousa**\n\n\\*militar; const.1891; sen. AM 1891-1893.\n\n*Joaquim Leovigildo de Sousa Coelho* nasceu em Salvador no dia 12 de\nmaio de 1837.\n\nFez seus estudos primários e secundários na capital baiana e depois\ningressou na Escola Militar do Rio de Janeiro, então capital do Império.\nEm 9 de março de 1857 foi declarado alferes-aluno e em 13 de março de\n1860 o governo imperial concedeu-lhe dispensa para se matricular na\nEscola Politécnica.\n\nEm 1861, por ordem do dia do ajudante-general do Exército datada de 22\nde julho, foi enviado para a guarnição do Amazonas. Em seguida, passou a\nintegrar, junto com Davi Canabarro, a Comissão de Exposição Científica\nchefiada por Gonçalves Dias. Essa comissão partiu do Rio de Janeiro,\npermaneceu alguns meses no Ceará e depois seguiu para o Amazonas,\nchegando a Manaus em 27 de fevereiro de 1861 e sendo recebida pelo\npresidente da província, Clementino Carneiro da Cunha. Em julho seguinte\nfoi nomeado adjunto do engenheiro Silva Coutinho, diretor de Obras\nPúblicas da província. De julho a outubro de 1862, por ordem do\npresidente do Amazonas, procedeu ao levantamento da planta cadastral de\nManaus. Em 30 de janeiro de 1863 foi nomeado delegado de polícia de\nManaus e, em 20 de junho seguinte, assumiu interinamente a direção das\nObras Públicas, na ausência de Silva Coutinho. Foi ainda nomeado segundo\njuiz substituto dos termos reunidos da capital e de Barcelos, e em 28 de\noutubro pediu exoneração do cargo de delegado. Em 1864 foi designado\npara examinar o forte de Tabatinga (AM), onde esteve em agosto. Em 1865\nfoi nomeado pelo presidente Epaminondas de Melo diretor efetivo das\nObras Públicas, em razão do afastamento definitivo do titular.\n\nEm 1866 foi eleito deputado provincial e no mesmo ano assumiu a\npresidência da Assembleia Legislativa do Amazonas, na qual permaneceria\naté o ano seguinte. Ainda em 1866 foi nomeado engenheiro interino pela\nCâmara Municipal de Manaus. Por decreto imperial de 18 de janeiro de\n1868, foi promovido a capitão graduado, com designação para continuar\nservindo na guarnição de Manaus. Foi promovido a major de engenheiros em\n31 de janeiro de 1877, assumindo várias vezes o posto de comandante das\nArmas.\n\nApós a proclamação da República, em 15 de novembro de 1889 e a\nconvocação de eleições para o Congresso Nacional Constituinte, foi\neleito senador pelo Amazonas em 15 de setembro de 1890. Assumindo sua\ncadeira em 15 de novembro seguinte, participou da elaboração da nova\nCarta que foi promulgada no dia 24 de fevereiro de 1891 e em março\nvoltou ao Amazonas, mas logo retornou ao Rio de Janeiro, agora Distrito\nFederal, para iniciar seu mandato ordinário no Senado Federal em junho\nseguinte. Apoiou o governo do marechal Floriano Peixoto (1891-1894) na\nconsolidação do regime republicano.\n\nFaleceu em Salvador no dia 3 de outubro de 1893, no exercício do\nmandato. Agnelo Bittencourt, no *Dicionário Amazonense,* dá o dia 10 de\noutubro como data de seu falecimento.\n\nInoã Pierre Carvalho Urbinati\n\n**FONTES:** ASSEMB. LEGISL. AMAZONAS. Disponível em:\n\\<www.aleam.gov.br/Institucional/AIGaleria\\_Presidentes.asp\\>. Acesso\nem: 10/3/2011; BITTENCOURT, A. *Dicionário*; LEITE NETO, L. *Catálogo\nbiográfico* (v.3, p.1.403-1.404); SENADO. Disponível em:\n\\<www.senado.gov.br/senadores/senadores\\_biografia.asp?codparl=1852&li=22&lcab=1891-1893&lf=22\\>.\nAcesso em: 10/3/2011.\n","ref":"**FONTES:** ASSEMB. LEGISL. AMAZONAS. Disponível em:\n\\<www.aleam.gov.br/Institucional/AIGaleria\\_Presidentes.asp\\>. Acesso\nem: 10/3/2011; BITTENCOURT, A. *Dicionário*; LEITE NETO, L. *Catálogo\nbiográfico* (v.3, p.1.403-1.404); SENADO. Disponível em:\n\\<www.senado.gov.br/senadores/senadores\\_biografia.asp?codparl=1852&li=22&lcab=1891-1893&lf=22\\>.\nAcesso em: 10/3/2011.\n","dic":"DHBPR"}
