{"title":"ABRANTES, Ovídio","cargoss":["Deputado federal"],"cargos_esp":[0],"datas_ini":[1894],"datas_fim":[1902],"estados":["GO"],"autor":["Adrianna Setemy"],"content":"**ABRANTES, Ovídio**\n\n\\* militar; dep. fed. GO 1894-1902.\n\n*Ovídio Abrantes* nasceu na província deGoiás no dia 22 de abril de\n1866.\n\nMilitar de carreira, cursou engenhariae bacharelou-se também em\nmatemática eciências físicas e naturais. Durante osprimeiros anos da\nRepública, foi ajudantede ordens do presidente Floriano\nPeixoto(1891-1894) e auxiliar técnico da Intendênciade Guerra.\n\nEm 1^o^ de março de1894 foi eleito deputado federal peloestado de Goiás\ne em maio assumindosua cadeira na Câmara dos Deputados, noRio de\nJaneiro, então Distrito Federal.Nas eleições de 30 de dezembro de1896\nfoi reeleito para a legislatura de1897 a 1899, e voltou a\ncandidatar-seno pleito de 31 de dezembro de1899. Entretanto, após a\napuração dosvotos, foram apresentadas atas falsas tantopara o Senado\nquanto para a Câmara,por meio das quais se pretendia impediros\nverdadeiros eleitos, entre eles OvídioAbrantes, de assumir seus\nmandatos. Desvendadaa fraude, Abrantes teve seu diploma reconhecidoe\niniciou mais um período no Legislativofederal em maio de 1900. Exerceu\nseumandato até o fim da legislatura, emdezembro de 1902.\n\nFaleceu em 15 de outubro de1906.\n\nEra casado com Diva Caiado, filhade Torquato Ramos Caiado, que foi\nsenadorestadual em Goiás (1905-1908).\n\nAdrianna Setemy\n\n**FONTES:** ABRANCHES, J. *Governos* (v.1);Projeto de imagem de\npublicações oficiaisbrasileiras do Center for Research Librariese\nLatin-american Microfilm Project. *Mensagens dos Presidentes de\nProvíncia (1830-1930).* Disponível em:\n\\<www.crl.edu/content.asp?l1=4&l2=18&l3=33\\>.Acesso em: 8/1/2009.\n","ref":"**FONTES:** ABRANCHES, J. *Governos* (v.1);Projeto de imagem de\npublicações oficiaisbrasileiras do Center for Research Librariese\nLatin-american Microfilm Project. *Mensagens dos Presidentes de\nProvíncia (1830-1930).* Disponível em:\n\\<www.crl.edu/content.asp?l1=4&l2=18&l3=33\\>.Acesso em: 8/1/2009.\n","dic":"DHBPR"}
