{"title":"ALMEIDA, Antônio Eusébio Gonçalvesde","cargoss":["Constituinte"],"cargos_esp":[0],"datas_ini":[1891],"datas_fim":[1891],"estados":[0],"autor":["Raimundo Helio Lopes"],"content":"**ALMEIDA, Antônio Eusébio Gonçalvesde**\n\n\\* const. 1891.\n\n*Antônio Eusébio Gonçalves de Almeida* nasceu emSalvador no dia 14 de\nagosto de1841, filho de Gonçalves de Almeida, conferentede alfândega.\n\nFormou-se na Faculdade de Direitodo Recife em 1860 e, de volta\naSalvador, logo se tonou promotor públicona capital baiana. Deixou o\ncargo devidoa divergências políticas no estado e passoua se dedicar à\nadvocacia e à política,sendo eleito deputado provincial em\ndiversaslegislaturas pelo Partido Liberal. Foi eleitodeputado geral em\n1889, mas não assumiuo mandato devido à proclamação da\nRepública(15/11/1889).\n\nSob o novo regime, em 15de setembro de 1890 foi eleito\ndeputadoconstituinte pela Bahia. Tomou posse em15 de novembro seguinte e\nintegrou aMesa Diretora da Assembleia Nacional Constituintecomo primeiro\nvice-presidente. Promulgada a novaCarta constitucional em 24 de\nfevereirode 1891, não chegou a participar dalegislatura ordinária\niniciada em junho, poisfaleceu em 26 de março de 1891.\n\nFoi também professor da Faculdadede Direito da Bahia e jornalista,\ntendocolaborado em vários jornais da Bahia,dentre eles o *Monitor*.\n\nRaimundo Helio Lopes\n\n**FONTES:** ABRANCHES, J. *Governos*;SAID, F. *Clã Almeida.*\n","ref":"**FONTES:** ABRANCHES, J. *Governos*;SAID, F. *Clã Almeida.*\n","dic":"DHBPR"}
