{"title":"COSTA NETO","cargoss":["Deputado federal"],"cargos_esp":[0],"datas_ini":[1903],"datas_fim":[1905],"estados":["MT"],"autor":[0],"content":"**COSTA NETO**\n\n\\*dep. fed. MT 1903-1905.\n\n*José da Silva Costa Neto*nasceu em Recife no dia 11 de abril de 1863.\n\nBacharel em direito, foi promotor público em Escada (PE) e advogou nessa\ncidade, como também em Recife, e ainda nos estados do Rio Grande do\nNorte, Sergipe e Mato Grosso. Colaborou no *Diário do Comércio* de\nMaceió em 1896 e no *Jornal do Recife* de 1897 a 1899.\n\nFoi deputado estadual em Pernambuco em 1898 e secretário de governo em\nMato Grosso de 1901 a 1902, durante a gestão de Antônio Alves de Barros.\nNesse mesmo período foi professor do Liceu Cuiabano. Em 1903 foi eleito\ndeputado federal por Mato Grosso. Assumindo sua cadeira na Câmara dos\nDeputados, no Rio de Janeiro, então Distrito Federal, em maio desse\nmesmo ano, exerceu seu mandato até dezembro de 1905, quando se encerrou\na legislatura.\n\nFaleceu em 26 de maio de 1912.\n\nJoão Edson Fanaia\n\n**FONTES:** ABRANCHES, J. *Governo*s; CÂM. DEP. *Deputados brasileiros.*\n","ref":"**FONTES:** ABRANCHES, J. *Governo*s; CÂM. DEP. *Deputados brasileiros.*\n","dic":"DHBPR"}
