{"title":"COSTA, João Gualberto Torreão da","cargoss":["Presidente de associação ou confederação de empregados ou empregadores"],"cargos_esp":[0],"datas_ini":[1898],"datas_fim":[1902],"estados":["MA"],"autor":["Raimundo Helio Lopes"],"content":"**COSTA, João Gualberto Torreão da**\n\n\\*magistrado; pres. MA 1898-1902.\n\n*João Gualberto Torreão da Costa* nasceu no Maranhão no dia 16 de maio\nde 1860.\n\nFormou-se aos 21 anos de idade na Faculdade de Direito do Recife e ainda\nno Império foi promotor público e juiz municipal. Depois da proclamação\nda República foi juiz de direito na cidade de Alto Parnaíba (MA). Também\ntrabalhou nas cidades maranhenses de Coroatá, Itapecuru e Rosário.\n\nIngressou na política ao lado do senador Benedito Pereira Leite. Eleito\npresidente do Maranhão para o quadriênio 1898-1902, durante sua\nadministração criou a Escola de Música, a Escola Modelo, e fez grandes\nreformas na Escola Normal e no Liceu Maranhense. Também promoveu um\nintenso combate à varíola e fez melhoramentos nos equipamentos de\nauxílio aos leprosos. Dois conflitos de relevância ocorreram durante a\nsua gestão: o primeiro, na cidade de Grajaú, envolvendo líderes\npolíticos locais; o segundo foi o ataque indígena à colônia de São José\nda Providência, na localidade de Alto Alegre, próxima da cidade de Barra\ndo Corda, quando as obras iniciadas pelos freis capuchinos foram\ndestruídas. Em 1^o^ de março de 1902 transmitiu o governo a Manuel Lopes\nda Cunha.\n\nApós deixar o governo, foi nomeado procurador geral do estado e\ndesembargador do Tribunal de Justiça estadual.\n\nFaleceu em 23 de setembro de 1916.\n\nRaimundo Helio Lopes\n\n**FONTES:** MARQUES, C. *Dicionário*; MEIRELES, M. *História.*\n","ref":"**FONTES:** MARQUES, C. *Dicionário*; MEIRELES, M. *História.*\n","dic":"DHBPR"}
