{"title":"COUTINHO, Ermírio César","cargoss":["Deputado federal"],"cargos_esp":[0],"datas_ini":[1897],"datas_fim":[1905],"estados":["PE"],"autor":["Marcos Paulo Torres"],"content":"**COUTINHO, Ermírio César**\n\n\\*dep. fed. PE 1897-1905.\n\n*Ermírio César Coutinho* nasceu no engenho Lagoa Dantas, em Nazaré da\nMata (PE), em 27 de março de 1839, filho de Antônio Aureliano Lopes\nCoutinho e de Antônia Florentina César Coutinho. Sua avó paterna, Rita\nNunes Machado, era irmã do político Joaquim Nunes Machado.\n\nDiplomou-se em medicina na Bahia em 1858 e, de regresso a Pernambuco,\ncasou-se com Joaquina Vitória Simões Coutinho, irmã do médico Adolfo\nSimões Barbosa. Dedicando-se também à medicina, foi um dos grandes\nmédicos de sua época. Interessava-se pelas doenças mentais e nervosas, e\nfoi um precursor da psiquiatria. Chegou a utilizar a hipnose em alguns\ncasos. Foi sócio-fundador e presidente da Sociedade de Medicina de\nPernambuco.\n\nParalelamente à medicina, exerceu intensa atividade política, ocupando,\nainda no Império, destacada posição no Partido Liberal e defendendo a\nabolição da escravatura. Já na República, foi senador estadual e\ndeputado federal por Pernambuco nas legislaturas 1897-1899, 1900-1902 e\n1903-1905. Pertencia, então, ao Partido Republicano, liderado por\nFrancisco de Assis Rosa e Silva.\n\nFaleceu na Paraíba no dia 7 de abril de 1904 e foi sepultado em Recife.\n\nPublicou vários trabalhos, entre os quais *A medicina em Pernambuco*,\n*Nevropatia cerebrocardíaca* e *Sífilis no sistema nervoso*.\n\nMarcos Paulo Torres\n\n**FONTES:** CÂM. DEP. *Deputados brasileiros*. *Diário de Pernambuco*\n(Coluna Opinião (1/1/2010)). Hélio Coutinho Filho.\n","ref":"**FONTES:** CÂM. DEP. *Deputados brasileiros*. *Diário de Pernambuco*\n(Coluna Opinião (1/1/2010)). Hélio Coutinho Filho.\n","dic":"DHBPR"}
