{"title":"COUTINHO, José Cândido de Lacerda","cargoss":["Constituinte","Deputado federal"],"cargos_esp":[0,0],"datas_ini":[1891,1891],"datas_fim":[1891,1893],"estados":[0,"SC"],"autor":["Carolina Vianna Dantas"],"content":"**COUTINHO, José Cândido de Lacerda**\n\n\\*const. 1891; dep. fed. SC 1891-1893.\n\n*José Cândido de Lacerda Coutinho* nasceu em Desterro (SC), atual\nFlorianópolis, no dia 15 de dezembro de 1841, filho de Francisco de\nSousa Coutinho e de Cândida Júlia de Lacerda Coutinho.\n\nFez os estudos primários e secundários em sua cidade natal, e em 1863\nmatriculou-se na Faculdade de Medicina do Rio de Janeiro, na então\ncapital do Império. Em seguida, no contexto da Guerra do Paraguai\n(1864-1870), assentou praça como voluntário e passou a servir no\nHospital de Sangue de Corrientes, na Argentina, quando obteve a patente\nde segundo-tenente. Formou-se em medicina em 1868 e no ano seguinte foi\nnomeado médico do Hospital Militar de Desterro. Após a morte de seu pai,\nem setembro de 1869, fixou residência no Rio de Janeiro, onde continuou\na exercer a medicina. Passou também a lecionar e a colaborar com suas\npoesias em vários periódicos da cidade, como o *Jornal do Comércio*, *O\nMosquito* e *Gazeta de Notícias*. Em 1875 casou-se com Adelaide da\nSilva, com quem teria filhos.\n\nCom a proclamação da República em 15 de novembro de 1889, em maio do ano\nseguinte foi nomeado segundo oficial da Secretaria de Estado de\nInstrução Pública, Correios e Telégrafos, na qual chegou a diretor da\nprimeira seção. Ainda em 1890 foi eleito, em 15 de setembro, deputado\npor Santa Catarina à Assembleia Nacional Constituinte. Assumiu sua\ncadeira no dia 15 de novembro seguinte e participou dos trabalhos de\nelaboração da primeira Constituição republicana do país. Promulgada a\nnova Carta no dia 24 de fevereiro de 1891, e iniciada em junho a\nlegislatura ordinária, passou a ocupar uma cadeira na Câmara dos\nDeputados, até dezembro de 1893.\n\nFaleceu na cidade do Rio de Janeiro no dia 2 de novembro de 1900.\n\nCarolina Vianna Dantas\n\n**FONTES:** ABRANCHES, J. *Governos*; PIAZZA, W. *Dicionário.*\n","ref":"**FONTES:** ABRANCHES, J. *Governos*; PIAZZA, W. *Dicionário.*\n","dic":"DHBPR"}
