{"title":"CUNHA JÚNIOR, Francisco Manuel da","cargoss":["Constituinte","Senador"],"cargos_esp":[0,0],"datas_ini":[1891,1891],"datas_fim":[1891,1895],"estados":[0,"MA"],"autor":["Raimundo Helio Lopes"],"content":"**CUNHA JÚNIOR, Francisco Manuel da**\n\n\\*militar; const. 1891; sen. MA 1891-1895.\n\n*Francisco Manuel da Cunha Júnior* nasceu em Cururupu (MA), filho de\nFrancisco Manuel da Cunha.\n\nIniciou sua vida profissional como professor no Maranhão. Com o início\nda Guerra do Paraguai, atuou ativamente em seu estado natal na\narregimentação de voluntários e na organização de tropas. Partiu para o\ncampo de lutas e participou de batalhas como as de Tuiuti e de Campo\nGrande. Depois da guerra, recebeu o título honorário de tenente-coronel.\nTambém foi, por muitos anos, tabelião na cidade do Rio de Janeiro, então\nDistrito Federal\n\nIngressou na política após a proclamação da República, quando foi eleito\nsenador constituinte pelo Maranhão em setembro de 1890. Tomou posse em\n15 de novembro seguinte e, após a promulgação da Constituição em 24 de\nfevereiro de 1891, passou a exercer o mandato ordinário. Por sua atuação\nna defesa do governo durante a Revolta da Armada, foi agraciado com o\ntítulo de general horário pelo presidente Floriano Peixoto (1891-1894).\n\nRecebeu os títulos de oficial da Ordem da Rosa e cavaleiro da Ordem de\nCristo.\n\nFaleceu no Rio de Janeiro no dia 31 de agosto de 1895.\n\nPublicou *Projeto de um banco de emissão sobre o crédito territorial e\npredial do Império do Brasil, apresentado à Assembleia Legislativa*\n(1877) e *Guerra do Paraguai. Tuiuti: ataque de 3 de maio de 1867*\n(1888).\n\nRaimundo Helio Lopes\n\n**FONTES:** ABRANCHES, J. *Governos*; LEITE NETO, L. *Catálogo\nbiográfico.*\n","ref":"**FONTES:** ABRANCHES, J. *Governos*; LEITE NETO, L. *Catálogo\nbiográfico.*\n","dic":"DHBPR"}
