{"title":"CUNHA, Ascendino Adélio Carneiro da","cargoss":["Deputado federal"],"cargos_esp":[0],"datas_ini":[1921],"datas_fim":[1923],"estados":["PB"],"autor":["Raimundo Helio Lopes"],"content":"**CUNHA, Ascendino Adélio Carneiro da**\n\n\\*dep. fed. PB 1921-1923.\n\n*Ascendino Adélio Carneiro da Cunha* nasceu no município de Santa Rita\n(PB) no dia 17 de setembro de 1881, filho de Francisco Pedro Carneiro da\nCunha e de Ana Adélia Carneiro da Cunha.\n\nIniciou seus estudos no Liceu Paraibano e depois ingressou na Faculdade\nde Direito do Recife, onde se formou em 1905. Depois de formado, foi\npromotor público nas cidades de Sousa (PB), Mamanguape (PB), Campina\nGrande (PB) e Itabaiana (PB), e juiz municipal em Serraria (PB). Em 1908\ntornou-se professor de história universal no Liceu Paraibano e, em 1912,\nprofessor de história da civilização na Escola Normal da Paraíba. Neste\nmesmo ano foi eleito deputado estadual na Paraíba pelo Partido\nRepublicano da Paraíba. Foi reeleito para diversas legislaturas, foi\nlíder de seu partido na Assembleia Legislativa e fez parte das comissões\nOrçamento e Justiça.\n\nPor seus estudos e trabalhos como professor e político, participou do I\nCongresso de História Nacional, realizado no Rio de Janeiro, então\nDistrito Federal, no ano de 1914, do Congresso Algodoeiro em 1916, e do\nCongresso de Pecuária em 1917. Nos ano de 1918 e 1919 viajou para\nFrança, onde atuou na Embaixada Brasileira da Paz, instituída no final\nda Primeira Guerra Mundial. De volta ao Brasil, em 1919, participou do\nCongresso Brasileiro de Geografia, realizado em Belo Horizonte, no qual\nassinou os acordos preliminares que estabeleceram as fronteiras do\nestado da Paraíba com o Ceará e o Rio Grande do Norte.\n\nEm 1921 foi eleito deputado federal pela Paraíba, com mandato até\ndezembro de 1923. Em 1922, foi comissionado por seu estado para estudar\na zona açucareira do estado de São Paulo e foi vice-presidente da\ncomissão promotora da Conferência Internacional Algodoeira.\n\nNo campo jornalístico, foi redator do jornal *A União* e colaborou com\nos periódicos *O Comércio*, *O Norte e* *A Notícia*, todos da Paraíba.\nFoi também colaborador do *Jornal do Comércio*, no Rio de Janeiro. Foi\nsócio do Instituo Histórico e Geográfico Paraibano.\n\nPublicou *Codificação das leis municipais da Paraíba do Norte*,\n*Revolução de 1817 na Paraíba do Norte* (1914), *O algodão na Paraíba do\nNorte* (1916) e *As secas no Nordeste.*\n\nRaimundo Helio Lopes\n\n**FONTES:** CÂM. DEP. *Deputados brasileiros*; INST. HIST. GEO.\nPARAIBANO. Disponível em: \\<www.ihgp.net\\>. Acesso em: 8/12/2010; VELHO\nSOBRINHO, J. *Dicionário.*\n","ref":"**FONTES:** CÂM. DEP. *Deputados brasileiros*; INST. HIST. GEO.\nPARAIBANO. Disponível em: \\<www.ihgp.net\\>. Acesso em: 8/12/2010; VELHO\nSOBRINHO, J. *Dicionário.*\n","dic":"DHBPR"}
