{"title":"CUNHA, Eurides","cargoss":["Deputado federal"],"cargos_esp":[0],"datas_ini":[1924],"datas_fim":[1928],"estados":["PR"],"autor":["Luciana Pinheiro"],"content":"**CUNHA, Eurides**\n\n\\*dep. fed. PR 1924-1928.\n\n*Eurides Cunha* nasceu em Campo Largo (PR) no dia 26 de junho de 1872,\nfilho de Domingos Cunha, chefe político do município, e de Maria Núncia\nPortela Cunha.\n\nFormado pela Faculdade de Direito de São Paulo em 1894, além da\nadvocacia dedicou-se à criação de gado bovino, equino e muar. Ingressou\nna política ao candidatar-se a deputado estadual no Paraná em 1895.\nMesmo eleito não tomou posse, em protesto contra a exclusão de outros\ncandidatos de sua chapa pelo sistema de rodízio do Partido Republicano.\nContinuou atuando como advogado em Curitiba até 1901, quando transferiu\nsuas atividades para o município paranaense de Jaguariaíva. Em 1910 foi\nnovamente eleito deputado estadual e dessa vez tomou posse na Assembleia\nLegislativa. Em 1912 elegeu-se prefeito de Jaguariaíva, sendo reeleito\nquatro anos depois.\n\nEm fevereiro de 1920 assumiu a vice-presidência do Paraná, ao lado do\npresidente estadual Caetano Munhoz da Rocha (1920-1928). Respondeu\ninterinamente pelo governo entre junho e setembro de 1923. Encerrado o\nquadriênio, em 1924 candidatou-se a deputado federal e foi eleito com\nlarga votação. Tomou posse em maio do mesmo ano, mantendo-se à frente da\nbancada paranaense na Câmara dos Deputados. Reeleito em 1927, deixou a\nCâmara em junho de 1928 ao ser nomeado prefeito de Curitiba pelo então\npresidente estadual Afonso Camargo. Em 5 de outubro de 1930, com o\ninício da revolução que levaria Getúlio Vargas ao poder, foi deposto,\nassim como Afonso Camargo.\n\nFaleceu em Curitiba no dia 26 de junho de 1955.\n\nLuciana Pinheiro\n\n**FONTES:** ARQ. PUB. PARANÁ. Disponível em:\n\\<www.arquivopublico.pr.gov.br/\\>. Acesso em: 22/6/2010; CAM. DEP.\n*Deputados brasileiros* (p.77); CASA CIVIL DO PARANÁ. Disponível em:\n\\<www.casacivil.pr.gov.br/\\>. Acesso em: 2/6/2010; NICOLAS, M. *Cem*\n(p.245-246); PREF. MUN. CURITIBA. Disponível em:\n\\<www.curitiba.pr.gov.br/\\>. Acesso em: 22/6/2010.\n","ref":"**FONTES:** ARQ. PUB. PARANÁ. Disponível em:\n\\<www.arquivopublico.pr.gov.br/\\>. Acesso em: 22/6/2010; CAM. DEP.\n*Deputados brasileiros* (p.77); CASA CIVIL DO PARANÁ. Disponível em:\n\\<www.casacivil.pr.gov.br/\\>. Acesso em: 2/6/2010; NICOLAS, M. *Cem*\n(p.245-246); PREF. MUN. CURITIBA. Disponível em:\n\\<www.curitiba.pr.gov.br/\\>. Acesso em: 22/6/2010.\n","dic":"DHBPR"}
