{"title":"CUNHA, Godofredo Xavier da","cargoss":["Ministro do Supremo Tribunal Federal"],"cargos_esp":[0],"datas_ini":[1909],"datas_fim":[1931],"estados":[0],"autor":[0],"content":"**CUNHA, Godofredo Xavier da**\n\n\\*magistrado; min. STF 1909-1931.\n\n*Godofredo Xavier de Cunha* nasceu em Porto Alegre no dia 25 de\nfevereiro de 1860, filho de Félix Xavier da Cunha e de Josefina Pinto\nBandeira. Seu pai, um dos principais líderes do Partido Liberal\nRio-Grandense, foi deputado federal de 1861 a 1864. Sua mãe descendia de\nRafael Pinto Bandeira, importante figura na luta para a expulsão dos\ncastelhanos da Colônia do Sacramento. Ao se casar com Emérita Bocaiúva,\ntornou-se genro de Quintino Bocaiúva, importante líder republicano que,\napós a proclamação da República, foi ministro das Relações Exteriores\n(1889-1891) senador (1890-1891, 1892-1899, 1900 e 1909-1912) e\npresidente do estado do Rio de Janeiro (1900-1903).\n\nTransferindo-se em 1872 para o Rio de Janeiro, então capital do Império,\naí iniciou o curso de humanidades, que concluiu em São Paulo. Também em\nSão Paulo ingressou na Faculdade de Direito, mas concluiu o curso na\nFaculdade do Recife, bacharelando-se em março de 1884. Ainda nesse ano\nfoi nomeado promotor público da comarca de Nova Friburgo (RJ), e em\nabril de 1885 passou a juiz municipal e de órfãos de Campos (RJ).\nAbolicionista, enfrentou fortes pressões dos senhores de engenho daquele\nmunicípio, que concentrava o maior contingente de escravos da província\ndo Rio de Janeiro.\n\nCom a proclamação da República em 15 de novembro de 1889, à qual deu seu\napoio, foi nomeado no mesmo dia, pelo governo provisório chefiado pelo\nmarechal Deodoro da Fonseca, chefe de polícia do estado do Rio de\nJaneiro. Afastado do cargo em janeiro do ano seguinte, assumiu o posto\nde juiz de direito da comarca de Santo Antônio de Pádua (RJ), passando\nem seguida a exercer idêntica função na cidade do Rio de Janeiro. Ainda\nem 1890 foi nomeado juiz federal da seção do estado do Rio de Janeiro.\nEm 1896, no exercício desse cargo, requisitou pela primeira vez no país\na força federal para garantir o cumprimento de um habeas corpus\npreventivo concedido aos presidentes das Mesas eleitorais de Campos,\nameaçados em sua liberdade pela polícia estadual. Responsável pela\neclosão de uma crise política, esse episódio ocasionou o pedido de\ndemissão do ministro da Justiça Alberto Torres (1896-1897). Provocou\ntambém o protesto no Senado Federal de seu sogro Quintino Bocaiúva pelo\ncaráter de intervenção federal de que se teria revestido.\n\nTransferido em 1897 para a seção do Distrito Federal, alcançou grande\npopularidade defendendo a autonomia do Poder Judiciário. Em setembro de\n1909 foi nomeado ministro do Supremo Tribunal Federal (STF) na vaga de\nAlberto Torres. Tornou-se vice-presidente dessa corte em 1924 e\npresidente em fevereiro de 1927, por ocasião do falecimento de André\nCavalcanti de Albuquerque. Após a Revolução de 1930, em fevereiro de\n1931 foi aposentado discricionariamente – embora sob a alegação de que\natingira o limite de idade – pelo governo provisório de Getúlio Vargas,\njuntamente com mais cinco magistrados, tendo protestado em vão contra a\nmedida.\n\nFaleceu no Rio de Janeiro no dia 2 de agosto de 1936.\n\nSeu filho Ranulfo Bocaiúva Cunha foi deputado federal de 1924 a 1930 e\nministro do Superior Tribunal Militar de 1946 a 1957. Seu neto Luís\nFernando Bocaiúva Cunha foi deputado federal de 1959 a 1964 e de 1983 a\n1990.\n\n**FONTES:** COSTA, E. *Grandes*; *Grande encic. Delta*; *Grande encic.\nportuguesa*; LAGO, L. *Supremo*.\n","ref":"**FONTES:** COSTA, E. *Grandes*; *Grande encic. Delta*; *Grande encic.\nportuguesa*; LAGO, L. *Supremo*.\n","dic":"DHBPR"}
