{"title":"CUNHA, Ranulfo Bocaiúva","cargoss":["Deputado federal","Ministro do Supremo Tribunal Militar"],"cargos_esp":[0,0],"datas_ini":[1924,1946],"datas_fim":[1930,1957],"estados":["RJ",0],"autor":[0],"content":"**CUNHA, Ranulfo Bocaiúva**\n\n**\\***dep. fed. RJ 1924-1930; min. STM 1946-1957.\n\n*Ranulfo Bocaiúva Cunha* nasceu em Campos (RJ) no dia 27 de maio de\n1888, filho de Godofredo Xavier da Cunha e de Emérita Bocaiúva Cunha.\nSeu pai foi o primeiro chefe de polícia do estado do Rio de Janeiro no\nregime republicano e, a seguir, ministro (1909-1931) e presidente\n(1927-1931) do Supremo Tribunal Federal (STF). Seu avô materno, o líder\nrepublicano Quintino Bocaiúva, foi ministro das Relações Exteriores\n(1889-1891), senador (1890-1891, 1892-1899, 1900 e 1909-1912) e\npresidente do estado do Rio de Janeiro (1909-1912). Seu ascendente pelo\nlado materno Rafael Pinto Bandeira foi importante figura nas lutas para\na expulsão dos castelhanos da Colônia do Sacramento.\n\nTendo aprendido as primeiras letras com sua mãe, ingressou no Externato\nJoaquim Serra, no Rio de Janeiro, então Distrito Federal, e, a seguir,\nno Colégio Militar dessa cidade, onde fez os estudos preparatórios entre\n1902 e 1905. Como pretendesse seguir a carreira militar e seus pais não\nconsentissem em sua matrícula na Escola Militar, transferida em 1906\npara Porto Alegre, ingressou naquele ano na Escola Naval, que abandonou\na seguir por motivo de doença. Matriculou-se então na Faculdade de\nCiências Jurídicas e Sociais do Rio de Janeiro e passou a dedicar-se ao\njornalismo, colaborando, ainda como universitário, nos jornais *O*\n*País* – fundado e dirigido por seu avô Quintino Bocaiúva –, *A Notícia*\ne *O Dia*, e na revista *A Época,* além de outras publicações. Trabalhou\ntambém no Ministério da Agricultura e, em 1912, concluiu o curso\nuniversitário.\n\nEm 1914 foi nomeado auxiliar de auditor de guerra pelo ministro da\nGuerra, general Vespasiano de Albuquerque e Silva (1912-1914). No mesmo\nano ingressou na política pela mão do ex-presidente Nilo Peçanha\n(1909-1910), elegendo-se deputado à Assembleia Legislativa do estado do\nRio de Janeiro na legenda do Partido Republicano Fluminense (PRF).\nDurante a legislatura que se iniciou em 1915 e terminou em 1917, ocupou\nos cargos de segundo e primeiro-secretário da Assembleia Fluminense e\nfoi autor da lei que criou o ensino profissional no estado do Rio e a\nEscola Profissional Visconde de Morais, atual Henrique Laje. Reeleito\npor duas vezes, exerceu seus novos mandatos de 1918 a 1920 e durante os\nprimeiros meses de 1921.\n\nNomeado prefeito de Niterói pelo presidente do estado do Rio de Janeiro,\nRaul de Morais Veiga (1918-1922), assumiu o cargo em maio de 1921. Nessa\nocasião apoiou em nível federal a campanha da Reação Republicana, que\npromoveu a candidatura de Nilo Peçanha à presidência da República em\noposição à de Artur Bernardes, afinal eleito em março de 1922. Durante\nsua administração realizou inúmeras obras públicas e criou a Diretoria\nMunicipal de Instrução Pública, atual Secretaria de Educação e Cultura.\nExonerou-se do cargo de prefeito em junho de 1922 para voltar a\npostulá-lo na legenda do PRF no pleito que se realizaria no mês\nseguinte. Entretanto, desistiu da candidatura em virtude de problemas\ncom a política federal relacionados com a eleição de Artur Bernardes,\nretornando então à Justiça Militar e às suas atividades como advogado e\njornalista.\n\nEm 1923 assumiu as funções de secretário do ministro da Justiça, seu\nsogro João Luís Alves, e em março de 1924 elegeu-se deputado federal na\nlegenda do PRF, sendo empossado em maio do mesmo ano. Reeleito em 1927,\napresentou na Câmara um projeto de criação do Instituto Nacional de\nPadrões e, durante a discussão do projeto de estabilização cambial,\nmanifestou-se a favor da adoção do cruzeiro. Após as eleições de março\nde 1930 – nas quais renovou mais uma vez seu mandato –, votou a favor do\nreconhecimento da bancada federal paraibana composta por políticos\nligados ao governo do presidente Washington Luís. Primeiro-secretário da\nCâmara dos Deputados, encontrava-se em Paris quando foi deflagrada em\noutubro a Revolução de 1930, que extinguiu seu mandato, assim como todos\nos órgãos legislativos do país. Em dezembro foi denunciado pelo Tribunal\nEspecial Revolucionário devido à sua posição favorável ao reconhecimento\ndos deputados paraibanos.\n\nAuditor de guerra da 3^a^ Auditoria da capital federal a partir de 1936,\nfoi nomeado em agosto de 1946 ministro do Superior Tribunal Militar\n(STM) e em 1948 participou do Congresso Jurídico realizado em\nMontevidéu, Uruguai. Permaneceu no STM até maio de 1957, quando se\naposentou.\n\nFoi um dos fundadores e presidentes do Instituto de Pensões e\nAposentadoria dos Servidores do Estado (IPASE) e da Sociedade Fluminense\nde Agricultura e Indústrias, assim como do Montepio dos Servidores do\nEstado. Foi também membro do Instituto dos Advogados do Brasil, da\nSociedade Brasileira de Direito e da Academia Fluminense de Letras.\n\nFaleceu no Rio de Janeiro no dia 25 de abril de 1976.\n\nEra casado com Maria Vitória Alves, de quem teve três filhos. Seu sogro,\nJoão Luís Alves, foi deputado federal por Minas Gerais de 1903 a 1908,\nsenador pelo Espírito Santo de 1909 a 1918, ministro da Justiça de 1922\na 1924 e ministro do Supremo Tribunal Federal (STF) de 1924 a 1925. Seu\nfilho Luís Fernando Bocaiúva Cunha foi deputado federal do Partido\nTrabalhista Brasileiro (PTB) de 1959 a 1964 e líder do governo de João\nGoulart na Câmara em 1962; foi cassado em abril de 1964 pelo movimento\npolítico-militar que depôs Goulart e posteriormente voltou a ser\ndeputado federal pelo Rio de Janeiro entre 1983 e 1990.\n\nO arquivo de Ranulfo Bocaiúva Cunha encontra-se depositado no Centro de\nPesquisa e Documentação de História Contemporânea do Brasil (Cpdoc) da\nFundação Getulio Vargas.\n\n**FONTES:** BARBOSA, R. *História*; CÂM. DEP.*Deputados*; CORRESP. SUP.\nMILITAR; CORTÉS, C. *Homens*; *Grande encic. Delta*; *Jornal do Brasil*\n(26/4/1976); SOARES, E. *Prefeitura.*\n","ref":"**FONTES:** BARBOSA, R. *História*; CÂM. DEP.*Deputados*; CORRESP. SUP.\nMILITAR; CORTÉS, C. *Homens*; *Grande encic. Delta*; *Jornal do Brasil*\n(26/4/1976); SOARES, E. *Prefeitura.*\n","dic":"DHBPR"}
