{"title":"CURADO, Sebastião Fleury","cargoss":["Constituinte","Deputado federal","Deputado federal"],"cargos_esp":[0,0,0],"datas_ini":[1891,1912,1891],"datas_fim":[1891,1914,1893],"estados":[0,"GO","GO"],"autor":["Adrianna Setemy"],"content":"**CURADO, Sebastião Fleury**\n\n\\*const. 1891; dep. fed. GO 1891-1893 e 1912-1914.\n\n*Sebastião Fleury Curado* nasceu na cidade de Goiás, capital da\nprovíncia de Goiás, em 22 de janeiro de 1864, filho do coronel João\nFleury de Campos Curado e de Mariana Augusta Fleury Curado.\n\nFez os estudos primários no Liceu de Goiás, em 1882 ingressou na\nFaculdade de Direito de São Paulo e em novembro de 1886 bacharelou-se.\nFormado, regressou à terra natal e filiou-se ao Partido Liberal. Foi\ndeputado provincial em Goiás em mais de uma legislatura.\n\nApós a proclamação da República em 15 de novembro de 1889, foi eleito em\nsetembro de 1890 deputado constituinte por Goiás. Tomou posse em 15 de\nnovembro seguinte e foi um dos signatários da Constituição de 24 de\nfevereiro de 1891. Em maio passou a exercer o mandato ordinário e\npermaneceu na Câmara dos Deputados até o fim da legislatura, em dezembro\nde 1893.\n\nEm 1903, participou da instalação da Academia de Direito na capital\ngoiana, onde lecionou quase todas as cadeiras. No pleito realizado em 7\nde setembro de 1904 elegeu-se deputado estadual em Goiás, para a\nlegislatura de 1905 a 1908. Em 1907 tornou-se presidente da Mesa\nDiretora da Assembleia Legislativa, mas renunciou ao mandato no final do\nano, antes de chegar ao fim a legislatura.\n\nEm 1909 filiou-se ao Partido Democrata, fundado em abril daquele ano, e\nelegeu-se deputado federal para a legislatura de 1912 a 1914. Em 1915\ntentou a reeleição, mas não teve êxito. A partir de então, não voltou a\ndisputar outra eleição.\n\nEm 1935, tornou-se diretor da Faculdade de Direito de Goiás. Exerceu\ntambém as funções de promotor público da cidade de Goiás e\njuiz-substituto da comarca da capital, e por mais de 20 anos foi\nprocurador da República, cargo no qual se aposentou. Participou também\nda comissão que elaborou o anteprojeto da Constituição de 1934.\nPertenceu ao Instituto Histórico e Geográfico de Goiás, à Academia\nGoiana de Letras, ao Instituto dos Advogados de Goiás e ao Instituto\nGenealógico Brasileiro, e foi sócio-honorário da Academia de Letras do\nRio Grande do Sul. Atuou na imprensa regional, como colaborador dos\njornais *Publicador Goiano* e *Goiás*. Fundou o jornal *O Goiano.*\n\nFaleceu no dia 4 de maio de 1944.\n\nEra casado com Augusta de Faro Fleury, com quem teve nove filhos.\n\nPublicou o livro *Memórias históricas* (1959).\n\nAdrianna Setemy\n\n**FONTES:**ABRANCHES, J. *Governos* (v.1); Projeto de imagem de\npublicações oficiais brasileiras do Center for Research Libraries e\nLatin-american Microfilm Project. *Mensagens dos Presidentes de\nProvíncia (1830-1930).* Acesso em: 8/1/2009. Disponível em:\n\\<www.crl.edu/content.asp?l1=4&l2=18&l3=33\\>.\n","ref":"**FONTES:**ABRANCHES, J. *Governos* (v.1); Projeto de imagem de\npublicações oficiais brasileiras do Center for Research Libraries e\nLatin-american Microfilm Project. *Mensagens dos Presidentes de\nProvíncia (1830-1930).* Acesso em: 8/1/2009. Disponível em:\n\\<www.crl.edu/content.asp?l1=4&l2=18&l3=33\\>.\n","dic":"DHBPR"}
