{"title":"DANTAS, Cristóvão Bezerra","cargoss":["Deputado federal"],"cargos_esp":[0],"datas_ini":[1930],"datas_fim":[1930],"estados":["RN"],"autor":["Renato Amado Peixoto"],"content":"**DANTAS, Cristóvão Bezerra**\n\n\\* dep. fed. RN 1930.\n\n*Cristóvão Bezerra Dantas* nasceu em Natal a 19 de abril de 1900, filho\nde Manuel Gomes de Medeiros Dantas e de Francisca Bezerra Dantas. Era\nsobrinho de Juvenal Lamartine de Faria, deputado federal (1906-1926),\nsenador (1927) e governador do Rio Grande do Norte (1928-1930).\n\nGraduou-se como engenheiro agrônomo pela Faculdade de Agronomia de\nLavras (MG) em 1919 e fez especialização em genética na Universidade de\nAtlanta, nos Estados Unidos, em 1921. Retornando ao Brasil, recebeu\nconvite do Ministério da Agricultura para dirigir no município de Tupi\n(SP) uma estação experimental de algodão, sendo então enviado ao Egito\npara estudar a produção do algodão de fibra longa. Em 1928 foi nomeado\nsecretário geral do estado do Rio Grande do Norte por seu tio Juvenal\nLamartine.\n\nEm 1930 foi eleito deputado federal pelo Rio Grande do Norte na legenda\ndo Partido Republicano Federal. Apoiado pelo governador Juvenal\nLamartine, que pensava fazê-lo seu sucessor, recebeu a maior votação do\nestado. Com a vitória da revolução de outubro de 1930 e o fechamento do\nCongresso Nacional, perdeu o mandato. Passou então a residir em São\nPaulo, assumindo uma das editorias do jornal *Diário de São Paulo* e\ntornando-se assessor da Federação das Indústrias do Estado de São Paulo\n(FIESP). Trabalhou ainda no Instituto do Café e no Departamento de\nPublicidade da Secretaria de Agricultura de São Paulo. Em 1951 assumiu o\nDepartamento de Agricultura do estado do Rio Grande do Norte, durante o\ngoverno de Sílvio Piza Pedrosa. Em 1955 retornou a São Paulo,\nreassumindo seu cargo na Secretaria de Agricultura daquele estado. Em\n1956 tornou-se também membro do conselho do Serviço Social da Indústria\n(SESI) do estado de São Paulo.\n\nEm 1960 recebeu o Prêmio Hipólito da Costa, concedido pela FIESP. Em\nseguida integrou-se à administração Aluísio Alves no estado do Rio\nGrande do Norte como consultor técnico e vice-presidente do Conselho\nEstadual de Desenvolvimento. Colaborou ainda com os jornais *A\nRepública* e *Diário de Natal* e com a revista *O Norte.*\n\nFaleceu em Natal a 17 de outubro de 1964.\n\nPublicou *A lavoura seca no Rio Grande do Norte* (1921) e *O algodão na\neconomia nacional* (1930).\n\nRenato Amado Peixoto\n\n**FONTES:** BRITO, R. *Viagem*; *Revista Brasileira de Geografia*\n(v.17); MAIA, A. *Parlamentares*; MELO, V. *Patronos*.\n","ref":"**FONTES:** BRITO, R. *Viagem*; *Revista Brasileira de Geografia*\n(v.17); MAIA, A. *Parlamentares*; MELO, V. *Patronos*.\n","dic":"DHBPR"}
