{"title":"DINIZ, Henrique","cargoss":["Senador"],"cargos_esp":[0],"datas_ini":[1928],"datas_fim":[1930],"estados":["MG"],"autor":["Vanessa Lana"],"content":"**DINIZ, Henrique**\n\n\\*sen. MG. 1928-1930.\n\n*Henrique Augusto de Oliveira Diniz* nasceu em Barbacena (MG) no dia 18\nde janeiro de 1865, filho de Francisco José Diniz, major da Guarda\nNacional, e de Guilhermina de Oliveira Pena Diniz.\n\nCompletou os estudos secundários no Colégio Providência em sua cidade\nnatal e formou-se pela Faculdade de Medicina do Rio de Janeiro em 1886,\ncom a tese intitulada “Esclerose hepática”. Após a formatura regressou a\nBarbacena, onde passou a clinicar e a lecionar história universal no\nGinásio Mineiro. Adepto do regime republicano, foi representante do\nnúcleo barbacenense no Congresso Republicano reunido em Ouro Preto (MG)\nem 1888. Em Barbacena, ocupou ainda os cargos de vereador, presidente da\nCâmara e agente executivo municipal.\n\nCom a proclamação da República em 15 de novembro de 1889 e a promulgação\nda primeira Constituição republicana em 24 de fevereiro de 1891, os\nestados elegeram representantes que teriam a incumbência de elaborar as\nCartas estaduais. Henrique Diniz foi então eleito deputado constituinte\nem Minas, com mandato de 1891 a 1895. Licenciou-se, contudo, por ter\nsido nomeado pelo então presidente estadual Crispim Jacques Bias Fortes\n(1894-1898) secretário do Interior e Justiça. Exerceu a função de\nsetembro de 1894 a setembro de 1898. Durante sua gestão, apoiou a\ncriação do Arquivo Público Mineiro, órgão que passou a ser vinculado à\nsua secretaria.\n\nEleito senador estadual, assumiu sua cadeira no Senado mineiro em 1905.\nNo ano seguinte, renunciou ao mandato por ter sido nomeado\nvice-presidente da recém-criada Caixa de Conversão pelo presidente da\nRepública Afonso Pena (1906- 1909). Voltou ao Senado em 1915, mas também\ndessa vez renunciou antes de completar o mandato em 1918.\n\nNo governo de Artur Bernardes (1922-1926), foi diretor do Banco do\nBrasil. Foi eleito senador federal em 1^o^ de novembro de 1928, para\npreencher a vaga aberta com o falecimento de Francisco Álvaro Bueno de\nPaiva. Exerceu o mandato até sua morte, no dia 23 de janeiro de 1930.\n\nFoi casado com Olga Tolentino Diniz.\n\nVanessa Lana\n\n**FONTES:** *Ensino médico*; MONTEIRO, N.*Dicionário*; SENADO.\nDisponível em:\n\\<www.senado.gov.br/sf/senadores/senadores\\_biografia.asp?codparl=1733&li=35&lcab=1930-1930&lf=35\\>.\nAcesso em: 11/11/2008; SENNA, L. *Médicos.*\n","ref":"**FONTES:** *Ensino médico*; MONTEIRO, N.*Dicionário*; SENADO.\nDisponível em:\n\\<www.senado.gov.br/sf/senadores/senadores\\_biografia.asp?codparl=1733&li=35&lcab=1930-1930&lf=35\\>.\nAcesso em: 11/11/2008; SENNA, L. *Médicos.*\n","dic":"DHBPR"}
