{"title":"DÓRIA, Meneses","cargoss":["Presidente de associação ou confederação de empregados ou empregadores","Deputado federal"],"cargos_esp":[0,0],"datas_ini":[1894,1906],"datas_fim":[1894,1908],"estados":["PR","PR"],"autor":["Luciana Pinheiro"],"content":"**DÓRIA, Meneses**\n\n\\*pres. PR 1894; dep. fed. PR 1906-1908.\n\n*João Meneses Dória* nasceu em Paranaguá (PR) no dia 27 de outubro de\n1857, filho de Luís Dória e de Adelaide de Meneses.\n\nFez os primeiros estudos em seu município natal, iniciou o secundário em\nCuritiba e concluiu-o no Rio de Janeiro, então capital do Império, onde\ntambém se formou em medicina. Em 1880 retornou ao Paraná e começou a\nclinicar, inicialmente em Ponta Grossa e depois em Curitiba.\n\nDeflagrada a Revolução Federalista no Rio Grande do Sul em fevereiro de\n1893, desde logo apoiou os revolucionários “maragatos”, que se opunham\nao presidente do estado e chefe do Partido Republicano Rio-Grandense\n(PRR) Júlio de Castilhos. Com o avanço dos federalistas pelos estados de\nSanta Catarina e Paraná, assumiu o governo paranaense em 21 de janeiro\nde 1894, substituindo Teófilo Soares Gomes. Entre 24 de março e 3 de\nabril constou nominalmente como seu sucessor na presidência do estado\nFrancisco José Cardoso Júnior. Com o término do confronto, deixou o\npaís, só retornando do exílio depois de anistiado.\n\nApós longo tempo afastado da política, em 1906 foi eleito deputado\nfederal pelo Paraná e em maio do mesmo ano tomou posse na Câmara dos\nDeputados, no Rio de Janeiro, então Distrito Federal. Permaneceu na\nCâmara até o término da legislatura, em dezembro de 1908.\n\nFaleceu no Rio de Janeiro em 4 de dezembro de 1934.\n\nCasou-se em primeiras núpcias com Delfina Machado Leal e anos mis tarde\nteve um segundo casamento.\n\nLuciana Pinheiro\n\n**FONTES:** ARQ. PUB. PARANÁ. Disponível em:\n\\<www.arquivopublico.pr.gov.br/\\>. Acesso em: 10/10/2010; CASA CIVIL\nPARANÁ. Disponível em: \\<www.casacivil.pr.gov.br/\\>. Acesso em:\n10/10/2010; GOULART, M. *Coronelismo*.\n","ref":"**FONTES:** ARQ. PUB. PARANÁ. Disponível em:\n\\<www.arquivopublico.pr.gov.br/\\>. Acesso em: 10/10/2010; CASA CIVIL\nPARANÁ. Disponível em: \\<www.casacivil.pr.gov.br/\\>. Acesso em:\n10/10/2010; GOULART, M. *Coronelismo*.\n","dic":"DHBPR"}
