{"title":"DUARTE, José Antônio","cargoss":["Deputado federal"],"cargos_esp":[0],"datas_ini":[1900],"datas_fim":[1902],"estados":["AL"],"autor":[0],"content":"**DUARTE, José Antônio**\n\n\\*dep. fed. AL 1900-1902.\n\n*José Antônio Duarte* nasceu em 1865.\n\nIngressou na política ao ser eleito deputado estadual em Alagoas em\n1894. Exerceu seu mandato na Assembleia Legislativa do estado até 1896.\nEm 5 de agosto de 1897 foi admitido como sócio do Instituto Arqueológico\ne Geográfico de Alagoas (IAGA) e no governo de Manuel José Duarte\n(1897-1899) foi secretário do Interior.\n\nEm 1900 foi eleito deputado federal por Alagoas e em maio assumiu sua\ncadeira na Câmara dos Deputados no Rio de Janeiro, então Distrito\nFederal. Permaneceu Câmara até dezembro de 1902, quando se encerraram o\nseu mandato e a legislatura.\n\nFaleceu em 1919. Publicou *Relatório que ao governador do estado de\nAlagoas Dr. Manuel José Duarte apresenta o secretário do Interior José\nAntônio Duarte, no dia 31 de Março de 1899.*\n\nReynaldo de Barros\n\n**FONTES:** BARROS, F. *A B C das Alagoas* (v.2); CÂM. DEP. *Deputados\nbrasileiros*.\n","ref":"**FONTES:** BARROS, F. *A B C das Alagoas* (v.2); CÂM. DEP. *Deputados\nbrasileiros*.\n","dic":"DHBPR"}
