{"title":"DUARTE, Manuel José","cargoss":["Governador de estado ou do Distrito Federal","Senador"],"cargos_esp":[0,0],"datas_ini":[1897,1900],"datas_fim":[1899,1908],"estados":["AL","AL"],"autor":[0],"content":"**DUARTE, Manuel José**\n\n\\*gov. AL 1897-1899; sen. AL 1900-1908.\n\n*Manuel José Duarte* nasceu em Maceió no dia 6 de abril de 1859, filho\nde Antônio José Duarte da Silva Braga e de Maria Margarida da Rocha\nDuarte Braga.\n\nEstudou no Colégio Pinheiro (RJ) e na Faculdade de Medicina do Rio de\nJaneiro, então capital do Império. Em 1880 passou a clinicar em Maceió,\ntornando-se diretor de enfermaria e, posteriormente, provedor da Santa\nCasa de Misericórdia (1900-1905). Como tal, dirigiu a construção do\nAsilo de Mendicidade. Alcançou renome como clínico e foi ainda professor\nde física e ciências naturais no Liceu de Alagoas.\n\nDois anos após a proclamação da República (15/11/1889), foi eleito\nsenador constituinte estadual em Alagoas. Assumindo o mandato em 1891,\nrenovou-o até 1898 e chegou a presidente do Senado Estadual. Assumiu o\ngoverno do estado em 12 de junho de 1897, sucedendo a Manuel Gomes\nRibeiro, e dois anos depois, em 17 de junho de 1899, renunciou para se\ncandidatar ao Senado, sendo substituído pelo vice-governador Francisco\nManuel dos Santos Pacheco. Em seu governo ampliaram-se os serviços da\nEmpresa Telefônica de Alagoas, iniciou-se a construção do Teatro 16 de\nSetembro, então no centro da praça Deodoro, instalou-se uma agência do\nBanco de Pernambuco e tentou-se, sem muito êxito, a exploração da\nplantação da seringueira. Presidente do diretório do Partido Republicano\nFederal (PRF) de Alagoas, viu o partido se cindir, com a criação de um\nagrupamento que se denominou Concentração, de oposição ao governo.\n\nExerceu o mandato no Senado Federal de 1900 a 1908.\n\nFoi sócio do Instituto Arqueológico e Geográfico de Alagoas (IAGA) e\nredator do jornal *A Tribuna.*\n\nFaleceu no Rio de Janeiro no dia 11de junho de 1914.\n\nPublicou *Operações reclamadas pelos cálculos vesicais* (dissertação,\n1877), *Do aborto criminoso* (tese apresentada à Faculdade de Medicina\ndo Rio de Janeiro, 1877), *Do organismo*,*Do sangue* (tese de\ndoutorado,1878), *Discurso pronunciado em 12 de junho de 1899 pelo dr.\nManuel José Duarte na ocasião de renunciar ao cargo de governador do\nestado de Alagoas* (1899) e *Obrigatoriedade da vacinação e revacinação.\nDiscurso do senador federal Manuel José Duarte* (1904).\n\nReynaldo de Barros\n\n**FONTES:** BARROS, F. *A B C das Alagoas* (v.2); DUARTE, M. *Mensagem*.\n","ref":"**FONTES:** BARROS, F. *A B C das Alagoas* (v.2); DUARTE, M. *Mensagem*.\n","dic":"DHBPR"}
