{"title":"DUARTE, Manuel","cargoss":["Deputado federal","Senador","Presidente de associação ou confederação de empregados ou empregadores"],"cargos_esp":[0,0,0],"datas_ini":[1924,1927,1927],"datas_fim":[1926,1927,1930],"estados":["RJ","RJ","RJ"],"autor":["Raimundo Helio Lopes"],"content":"**DUARTE, Manuel**\n\n\\*dep. fed. RJ 1924-1926; sen. RJ 1927; pres. RJ 1927-1930.\n\n*Manuel de Matos Duarte Silva* nasceu em Rio Bonito (RJ) no dia 1^o^ de\nnovembro de 1877, filho de Cândido Alves Duarte Silva e de Henriqueta\nAugusta de Matos e Silva.\n\nDesde muito jovem dedicou-se ao jornalismo e trabalhou em muitos jornais\ndo Rio de Janeiro, então Distrito Federal. Ingressou na política em\n1911, quando da reorganização do Legislativo fluminense, após a eleição\nde Francisco Chaves de Oliveira Botelho como sucessor do presidente\nestadual Alfredo Backer (1906-1910). Esse pleito foi marcado pelo\nrompimento político entre Backer e o então presidente da República Nilo\nPeçanha (1909-1910). O Executivo estadual defendeu a candidatura de\nManuel Edwiges Queirós Viana, enquanto Nilo Peçanha apoiou a de Oliveira\nBotelho. O antagonismo entre as duas facções culminou com a divisão da\nAssembleia Legislativa do Rio de Janeiro (ALERJ) em duas, uma backerista\ne outra nilista, tendo cada qual proclamado a eleição de seu candidato\nem 10 de julho de 1910. Depois de um complicado processo político, com a\ninterferência do Supremo Tribunal Federal (STF) e o envio de tropas do\ngoverno federal, Oliveira Botelho foi reconhecido presidente do estado\n(1910-1914), tendo a aprovação do novo presidente da República, Hermes\nda Fonseca (1910-1914). Em 3 de agosto de 1911, o Legislativo fluminense\nfoi reorganizado, quando o Congresso Nacional reconheceu a Assembleia\nLegislativa nilista, pondo fim à divisão surgida durante as eleições.\n\nCom essa reconfiguração, foram escolhidos novos deputados estaduais e\nManuel Queiroz foi eleito na legenda do Partido Republicano Conservador\nFluminense (PRCF). Foi reeleito em 1913, pelo 1^o^ distrito eleitoral,\ncom 6.577 votos, e durante seus anos na ALERJ defendeu o governo de\nOliveira Botelho. Na sucessão estadual de 1914, apoiou Feliciano Sodré,\ncandidato do PRCF, que concorreu contra Nilo Peçanha, que havia rompido\ncom o governo estadual e lançado sua própria candidatura.\n\nDurante a campanha eleitoral, Oliveira Botelho convocou a ALERJ para uma\nsessão extraordinária, na qual pretendia derrubar a Mesa Diretora da\ncasa, composta por políticos nilistas. Diante da ameaça, a oposição\nsolicitou um habeas corpus preventivo junto ao STF que, ao ser concedido\nem 6 de junho de 1914, provocou a divisão da Assembleia em dois grupos:\num nilista, apoiado pelo STF, e outro botelhista, sustentado pelos\ngovernos estadual e federal, e do qual fazia parte Manuel Duarte.\nEnquanto o primeiro buscava continuar a atividade legislativa, o segundo\nrecusava-se a participar. No dia 21 do mesmo mês, quando os nilistas\nconseguiram um quórum de 23 deputados para formar a sessão, os\nbotelhistas reuniram-se em local diferente, formando-se duas assembleias\nlegislativas, a exemplo das eleições estaduais de 1910.\n\nDepois do pleito de 12 de julho de 1914, os dois candidatos se\ndeclararam vencedores e foram reconhecidos pelas respectivas\nassembleias. Em outubro, ainda como presidente da República, Hermes da\nFonseca enviou mensagem à Câmara dos Deputados criticando a decisão do\nSTF na disputa eleitoral fluminense. Tal fato foi encarado como uma\ntentativa do presidente, apoiado por Pinheiro Machado, senador gaúcho\n(1890-1915) e um dos principais nomes da política nacional, de intervir\nno estado do Rio de Janeiro, mas como Hermes da Fonseca estava nos\núltimos dias do seu governo, a Câmara não aprovou a intervenção. Em 16\nde dezembro o STF homologou outro habeas corpus garantindo a eleição de\nNilo Peçanha para o seu segundo mandato como presidente do Rio de\nJaneiro (1914-1917). Entretanto, a contenda só foi resolvida quando o\nrecém-empossado presidente da República Venceslau Brás (1914-1918)\nassegurou a posse de Nilo Peçanha e colocou tropas à disposição do juiz\nfederal do estado.\n\nCom o início do novo governo de Nilo Peçanha, e a reabertura dos\ntrabalhos legislativos da ALERJ, em julho de 1915, Manuel Duarte passou\nà oposição ao governo, juntamente com o grupo botelhista. Em dezembro,\ncandidatou-se a mais uma reeleição, mas não foi vitorioso, pois os\nnilistas elegeram todos os seus candidatos, derrotando a oposição.\nDepois dessa derrota, continuou sua carreira jornalística e permaneceu\nfiel ao grupo político liderado por Oliveira Botelho, atuando na\noposição aos governos nilistas de Francisco Guimarães (1917), Agnelo\nGerard Collet (1917-1918) e Raul Veiga (1918-1922).\n\nEm 1919, a oposição ao nilismo fortaleceu-se após a vitória de Epitácio\nPessoa (1919-1922) no pleito presidencial. Como Nilo Peçanha apoiou o\ncandidato derrotado Rui Barbosa, a oposição estadual ganhou mais espaço\npolítico e teve mais força e recursos eleitorais, liderada,\nprincipalmente, por Feliciano Sodré e Oliveira Botelho. Nas eleições\nlegislativas de 18 de dezembro de 1921, Manuel Duarte candidatou-se a\numa vaga na ALERJ na chapa dos oposicionistas, concentrada na legenda do\nPRF, já que desde 1920, Nilo Peçanha e seus aliados tinham passado a\nutilizar a sigla do Partido Republicano do Rio de Janeiro (PRRJ).\nRealizada a apuração, foram declarados vitoriosos apenas os candidatos\nnilistas. Os oposicionistas não reconheceram a derrota, alegando fraude\ndas juntas apuradoras, controladas pelo governo. Em março de 1922, o\nnilismo sofreu mais um forte abalo, com a derrota de Nilo Peçanha para a\npresidência da República, pela chapa da Reação Republicana, e a vitória\nde Artur Bernardes (1922-1926). Depois dos sucessivos reveses na esfera\nfederal, o nilismo entrou em derrocada. Com essa nova conjuntura\nFeliciano Sodré concorreu novamente à presidência do estado, apoiado por\nOliveira Botelho, contra o candidato nilista Raul Fernandes, nas\neleições realizadas em 9 de julho de 1922.\n\nO pleito realizado em 9 de julho foi marcado pelo estado de sítio\ndecretado no estado do Rio de Janeiro e no Distrito Federal devido à\nrevolta irrompida em 5 de julho na Vila Militar, na Escola Militar do\nRealengo e no Forte de Copacabana. O movimento, que envolveu também a\nguarnição de Mato Grosso e iniciou o ciclo das revoltas tenentistas da\ndécada de 1920, foi deflagrado em protesto contra a eleição de Artur\nBernardes para a presidência da República e as punições impostas pelo\ngoverno Epitácio Pessoa aos militares, com o fechamento do Clube Militar\ne a prisão do marechal Hermes da Fonseca.\n\nRealizada a apuração, ambas as chapas concorrentes ao pleito, alegando\nfraude na contagem de votos do oponente, proclamaram eleitos os seus\ncandidatos. A oposição nilista, derrotada no pleito de dezembro\nanterior, pretendia comparecer à seção de reconhecimento e rebelar-se\ncontra a diplomação dos novos parlamentares. Tentando evitar essa\nmanifestação, no dia 17 as forças situacionistas colocaram tropas da\npolícia no prédio da ALERJ para impedir o ingresso de seus opositores,\nentre eles Manuel Duarte. Diante dessa proibição, os oposicionistas\nocuparam o prédio da Câmara Municipal de Niterói e formaram outra\nAssembleia, declarando-se o verdadeiro Poder Legislativo estadual. Como\no reconhecimento do presidente do estado era da competência da\nAssembleia, a dualidade de assembleias ensejou a dualidade de governos.\nComo temiam que o novo presidente Artur Bernardes decretasse a\nintervenção federal no estado do Rio, os nilistas apresentaram ao STF um\npedido de habeas corpusque assegurasse a posse de seu candidato.\nAtendido o pedido, Raul Fernandes foi investido na presidência do\nestado, recebendo o cargo de Raul Veiga, no dia 31 de dezembro de 1922.\nEntretanto, Feliciano Sodré também foi empossado por “sua” assembleia no\nmesmo dia. Logo depois, com a cobertura do governo federal, os\npartidários de Feliciano Sodré depuseram prefeitos adversários e\nfecharam câmaras municipais sob o controle dos nilistas. Enquanto isso\nacontecia, a Polícia Militar se recolheu aos quartéis, declarando só\nacatar ordens do governo central. Alegando a duplicidade de poderes no\nRio de Janeiro, Artur Bernardes decretou a intervenção federal no\nestado, entregando o Executivo fluminense a Aureliano Leal em 10 de\njaneiro de 1923. O interventor anulou as eleições legislativas de\ndezembro de 1921 e a executiva de julho de 1922, marcando outras para o\ndia 28 de outubro de 1923.\n\nNesse pleito, Manuel Duarte foi eleito deputado estadual pelo 5^o^\ndistrito eleitoral, assim como toda a chapa do PRF, com 5.111 votos.\nTambém nessa data Feliciano Sodré foi eleito presidente do estado do Rio\nde Janeiro (1923-1927). Manuel Duarte renunciou ao seu mandato na ALERJ\nem 17 de fevereiro de 1924, pois foi eleito deputado federal. Na Câmara\ndos Deputados foi líder da bancada fluminense e um dos principais nomes\ndo PRF na esfera federal. No início de 1926, lançou seu nome para a\nsucessão presidencial estadual, com o apoio de seu partido e de\nFeliciano Sodré. Além da situação, parte da oposição nilista, cada vez\nmais fraca desde a morte de Nilo Peçanha em 31 de maio de 1924, apoiou\nsua candidatura. Esse grupo foi chamado nesse momento de “nilistas\nacordistas” e se autodesignou “membros dissidentes do PRRJ”. Em\nfevereiro de 1927, buscando fortalecer ainda mais seu nome na política\nfluminense, Manuel Duarte foi eleito senador. Assumiu sua cadeira em\nmaio e nos poucos meses em que esteve no Senado Federal foi membro da\nComissão de Finanças e relator do orçamento dos ministérios da Marinha e\nda Fazenda. Nas eleições para o governo do estado, realizadas em abril,\nteve a ampla maioria dos votos e em 23 de dezembro de 1927 assumiu a\npresidência estadual, renunciando ao mandato de senador. Para sua vaga\nno Senado, foi eleito o antigo presidente estadual Feliciano Sodré\n(1928-1930).\n\nDurante seu governo, na esfera estadual, buscou fortalecer a aliança com\nos “nilistas acordistas”. Para tanto, participou pessoalmente das\nhomenagens realizadas por ocasião do quarto ano de morte de Nilo Peçanha\ne vetou o aumento de 50% nas passagens das barcas Rio-Niterói. As\nmanifestações populares com esse veto foram noticiadas na imprensa como\ndemonstrações de apoio ao seu governo. No setor econômico, assim como\nseu antecessor, apoiou a política nacional de valorização do café, mas,\ncom crise econômica de 1929, passou a demonstrar a necessidade de\ndiversificação agrícola do estado. No campo político federal, reiterou o\napoio do PRF ao presidente Washington Luís (1926-1930), o que garantiu à\nbancada federal fluminense 13 representantes nas 12 comissões\npermanentes da Câmara dos Deputados. Nas eleições federais de março de\n1930 foi contrário à Aliança Liberal, apoiou a chapa oficial formada por\nJúlio Prestes e Vital Soares e trabalhou na eleição de todos os\ncandidatos do PRF ao Congresso Nacional. Com o início do movimento\nrevolucionário de 3 de outubro, manteve-se fiel a Washington Luís e, com\na deposição deste, foi destituído do poder estadual pelo tenente-coronel\nDemétrio Barbosa.\n\nEm 1934 voltou a atuar no PRF, quando surgiram disputas pela direção do\npartido relacionadas à eleição da comissão executiva e à formulação de\num novo programa partidário. Nesse embate, pertencia a uma facção,\ntambém composta por Acúrcio Torres, Galdino do Vale Filho e Miguel de\nCarvalho, que defendia a total reformulação do partido e a elaboração de\num novo programa adequado às condições do país. Foi derrotado pelo grupo\nliderado por Oliveira Botelho e depois dessa derrota interna desligou-se\ndo PRF e fundou no mês de maio o Partido Evolucionista do Rio de\nJaneiro.\n\nNas eleições de outubro de 1934 para a Câmara dos Deputados e para a\nAssembleia Constituinte estadual, sua agremiação elegeu um deputado\nfederal, Acúrcio Torres, e dois deputados estaduais. Na campanha pela\nsucessão presidencial em 1937, o Partido Evolucionista sustentou a\ncandidatura de José Américo de Almeida, mas foi extinto junto com os\ndemais partidos do país com a instituição do Estado Novo.\n\nNo campo jornalístico, foi redator do *Correio da Manhã* e *Jornal do\nComércio* e redator-chefe de *A Imprensa*. Também colaborou com *O\nPaís*, *Século* e *A Notícia*, dirigiu os periódicos *A Tribuna*, *A\nIlustração Brasileira*, *O Malho* e *Leitura para todos*, e foi um dos\nfundadores da *Folha da Noite*.\n\nFaleceu no dia 14 de maio de 1944.\n\nFoi casado em primeiras núpcias com Jesuína Gertrudes de Andrade e\nposteriormente com Berenice César Vale.\n\nPublicou *Carlos Peixoto e o seu presidencialismo*, *Os alemães em Santa\nCatarina*, *Pinheiro Machado*, e *Quintino Bocaiúva, Silva Jardim e\nBenjamin Constant*.\n\nRaimundo Helio Lopes\n\n**FONTES:** ASSEMB. LEGISL. RJ. *Anais* (1911-1914, 1923-1924); ASSEMB.\nLEGISL. RJ. Disponível em:\n\\<www.alerj.rj.gov.br/memoria/historia/gov88975/manuel\\_duarte.html\\>.\nAcesso em: 28/3/2011; BELOCH, I.; ABREU, A. *Dicionário*; COL. BRAS.\nGENEALOGIA. Disponível em:\n\\<www.cbg.org.br/arquivos\\_genealogicos\\_r\\_02.html\\>. Acesso em:\n28/3/2011; FERREIRA, M. *Busca*; LACOMBE, L. *Chefes*; LEITE NETO, L.\n*Catálogo biográfico*.\n","ref":"**FONTES:** ASSEMB. LEGISL. RJ. *Anais* (1911-1914, 1923-1924); ASSEMB.\nLEGISL. RJ. Disponível em:\n\\<www.alerj.rj.gov.br/memoria/historia/gov88975/manuel\\_duarte.html\\>.\nAcesso em: 28/3/2011; BELOCH, I.; ABREU, A. *Dicionário*; COL. BRAS.\nGENEALOGIA. Disponível em:\n\\<www.cbg.org.br/arquivos\\_genealogicos\\_r\\_02.html\\>. Acesso em:\n28/3/2011; FERREIRA, M. *Busca*; LACOMBE, L. *Chefes*; LEITE NETO, L.\n*Catálogo biográfico*.\n","dic":"DHBPR"}
