{"title":"DUPRAT, Raimundo da Silva","cargoss":["Prefeito"],"cargos_esp":[0],"datas_ini":[1911],"datas_fim":[1914],"estados":["SP"],"autor":["Liliane Correa"],"content":"**DUPRAT, Raimundo da Silva**\n\n\\* pref. SP 1911-1914.\n\n*Raimundo da Silva Duprat*, futuro *barão de Duprat*, nasceu em Recife\nem 11 de dezembro de 1863, filho de Bernardino Augusto Duprat e de\nCândida de Carvalho. Era bisneto de Carlos Eduardo Duprat, o primeiro\nvisconde de Duprat no Brasil, e neto do comendador Luís Armand Duprat.\n\nMudou-se para São Paulo quando criança. Ainda no período imperial,\nrecebeu da Santa Sé o título de barão. Já nos primeiros anos do século\nXX, tornou-se sócio de seu irmão Alfredo Duprat em uma gráfica na cidade\nde São Paulo que funcionou até os anos 1930.\n\nSua vida política não foi muito extensa, e o cargo mais importante que\nexerceu foi o de prefeito de São Paulo. Sucedeu a Antônio da Silva\nPrado, em 1911, e teve como sucessor Washington Luís, em 1914. Durante\nsua gestão planejou modificações para o traçado urbano de São Paulo. Foi\nresponsável pela construção de um parque onde hoje está o Museu de Arte\nde São Paulo (MASP), o Trianon. Era um belvedere projetado pelo\narquiteto paulista Ramos de Azevedo. Ampliou a avenida São João,\nconstruiu o viaduto Santa Efigênia e urbanizou o vale do Anhangabaú.\nEssas últimas obras foram entregues ao arquiteto e urbanista francês\nJoseph Bouvard, o que desagradou aos profissionais da cidade. Entregou\numa capital reformada e reurbanizada para o sucessor.\n\nFaleceu em São Paulo em 17 de maio de 1926.\n\nLiliane Correa\n\n**FONTES:** BARATA, C.; BUENO, A. *Dicionário* (v.1);Galeria dos\nGovernadores**.** Disponível em\n**\\<**www.galeriadosgovernadores.sp.gov.br/08prefei/prefei.htm\\>. Acesso\nem: 13/4/2010; GAÚNA, R. *Rogério*; GENEALL. Raimundo Duprat. Disponível\nem: \\<www.geneall.net/P/per\\_page.php?id=267745\\>. Acesso em: 3/4/2010;\nMAGALHÃES, S. *Educação*; Portal do Ipiranga. *Parque Tenente Siqueira\nCampos – Trianon*. Disponível em: \\<www.independenciaoumorte.\ncom.br/node/291/\\>. Acesso em: 13/4/2010; SILVA, L. *Etnia* (v.8,\np.27-50).\n","ref":"**FONTES:** BARATA, C.; BUENO, A. *Dicionário* (v.1);Galeria dos\nGovernadores**.** Disponível em\n**\\<**www.galeriadosgovernadores.sp.gov.br/08prefei/prefei.htm\\>. Acesso\nem: 13/4/2010; GAÚNA, R. *Rogério*; GENEALL. Raimundo Duprat. Disponível\nem: \\<www.geneall.net/P/per\\_page.php?id=267745\\>. Acesso em: 3/4/2010;\nMAGALHÃES, S. *Educação*; Portal do Ipiranga. *Parque Tenente Siqueira\nCampos – Trianon*. Disponível em: \\<www.independenciaoumorte.\ncom.br/node/291/\\>. Acesso em: 13/4/2010; SILVA, L. *Etnia* (v.8,\np.27-50).\n","dic":"DHBPR"}
