{"title":"ESPÍNOLA, Manuel","cargoss":["Ministro do Supremo Tribunal Federal"],"cargos_esp":[0],"datas_ini":[1906],"datas_fim":[1912],"estados":[0],"autor":["Eduardo Junqueira"],"content":"**ESPÍNOLA, Manuel**\n\n\\*magistrado; min. STF 1906-1912.\n\n*Manuel José Espínola* nasceu na província da Bahia em 1841, filho de\nManuel José Espínola.\n\nObteve o título de bacharel em ciências jurídicas e sociais pela\nFaculdade de Direito do Recife em 1861, e iniciou sua vida pública ao\nser nomeado juiz municipal e de órfãos do termo de Rio Preto, na\nprovíncia de Minas Gerais, em 1863. Por decreto de março do ano de\nseguinte, foi removido para idêntico cargo no termo de Cantagalo, na\nprovíncia do Rio de Janeiro, sendo reconduzido em 1867. Em 1870 rumou\npara o Piauí, para desempenhar a função de chefe de polícia, cargo que\ndeixou ainda no mesmo ano para assumir a primeira vice-presidência da\nprovíncia. Em abril de 1871 o foi designado juiz de direito da comarca\nde Macapá, cargo em que permaneceu até agosto de 1872, quando foi\nnomeado chefe de polícia de Sergipe. Em fevereiro de 1874, foi removido\npara a província da Bahia, para lá exercer a mesma função. Dispensado em\nnovembro do mesmo ano, seguiu para o Rio de Janeiro, nomeado juiz de\ndireito da comarca de Santa Maria Madalena. Entre 1886 e 1889, foi chefe\nde polícia da província fluminense.\n\nProclamada República e organizada a justiça do Distrito Federal, em\nnovembro de 1890 foi nomeado juiz da Corte de Apelação, tribunal de\nsegunda instância sucessor das antigas relações do Império. Ali exerceu\na judicatura até setembro de 1906, quando foi nomeado ministro do\nSupremo Tribunal Federal (STF) pelo presidente Rodrigues Alves\n(1902-1906).\n\nFaleceu na cidade do Rio de Janeiro, então Distrito Federal, no dia 7 de\noutubro de 1912, no exercício de suas funções no STF.\n\nFoi casado com Ana Braga Espínola.\n\nEduardo Junqueira\n\n**FONTES:** MATTOSO, P. *Supremo Tribunal*; MELLO FILHO, J. *Notas*;\nRODRIGUES, L. *História*; SUP. TRIB. FED. Disponível em:\n\\<www.stf.jus.br/portal/ministros\\>.\n","ref":"**FONTES:** MATTOSO, P. *Supremo Tribunal*; MELLO FILHO, J. *Notas*;\nRODRIGUES, L. *História*; SUP. TRIB. FED. Disponível em:\n\\<www.stf.jus.br/portal/ministros\\>.\n","dic":"DHBPR"}
