{"title":"ESPÍRITO SANTO, Hermínio do","cargoss":["Ministro do Supremo Tribunal Federal"],"cargos_esp":[0],"datas_ini":[1894],"datas_fim":[1924],"estados":[0],"autor":["Eduardo Junqueira"],"content":"**ESPÍRITO SANTO, Hermínio do**\n\n\\*magistrado; min. STF 1894-1924.\n\n*Hermínio Francisco do Espírito Santo* nasceu em Recife no dia 9 de maio\nde 1841, filho de Vicente Antônio do Espírito Santo e de Francisca\nFausta do Espírito Santo.\n\nBacharel em ciências jurídicas e sociais pela Faculdade de Direito do\nRecife em 1862, iniciou a carreira na magistratura em 1865, ao ser\nnomeado juiz municipal e de órfãos do termo de São José do Norte, na\nprovíncia do Rio Grande do Sul. Em 1866 foi removido para o termo de\nCruz Alta, na mesma província, onde permaneceu até 1870. Em agosto de\n1872 foi nomeado juiz de direito da comarca de Barreirinhos, na\nprovíncia do Maranhão. Exerceu ali suas funções até 1873, quando foi\ndesignado vice-presidente da província de Santa Catarina. Ali ocupou, de\n1876 a 1878, o posto de chefe de polícia. De volta ao Maranhão em\njaneiro de 1881, voltou à magistratura como titular da vara do comércio.\nFoi ainda chefe de polícia do Maranhão (1885), do Paraná (1885-1888) e,\napós a proclamação da República, do Rio Grande do Sul (1889-1890). Com a\nmudança do regime, foi nomeado em 1890 desembargador da Relação de Porto\nAlegre, corte de justiça de segunda instância, depois denominada Corte\nde Apelação. Em novembro do ano seguinte tornou-se juiz federal no Rio\nGrande do Sul.\n\nNomeado ministro do Supremo Tribunal Federal (STF) na vaga proveniente\nda aposentadoria de Esperidião Elói de Barros Pimentel, tomou posse em\nnovembro de 1894. Nesse tribunal, em 1904, foi relator de um recurso de\nhabeas corpus preventivo, num dos vários processos que chegavam ao\nJudiciário e que visavam a impedir acesso de autoridades sanitárias a\nresidências para o combate dos vetores da febre amarela. Porquanto\nhouvesse a municipalidade disposto em regulamento (Decreto n^o^ 5.156,\nde 8/3/1904) sobre a possibilidade de invasão de domicílios, a fim de\nque fosse levada a efeito a política sanitarista patrocinada pelo\ngoverno Rodrigues Alves (1902-1906), o STF julgou inconstitucional tal\npossibilidade. Abriu-se assim uma crise institucional entre os poderes\nExecutivo e Judiciário, dado que o combate às endemias era ação\nfundamental da plataforma política do presidente da República.\n\nEspírito Santo foi eleito vice-presidente do STF em maio de 1908, e\npresidente, em janeiro de 1911. Foi sucessivamente reconduzido à\npresidência da corte até 1924.\n\nFaleceu na cidade do Rio de Janeiro, então Distrito Federal, no dia 11\nde novembro de 1924.\n\nEduardo Junqueira\n\n**FONTES:** MATTOSO, P. *Supremo Tribunal*; MELLO FILHO, J. *Notas*;\nRODRIGUES, L. *História*; SUP. TRIB. FED. Disponível em:\n\\<www.stf.jus.br/portal/ministros\\>.\n","ref":"**FONTES:** MATTOSO, P. *Supremo Tribunal*; MELLO FILHO, J. *Notas*;\nRODRIGUES, L. *História*; SUP. TRIB. FED. Disponível em:\n\\<www.stf.jus.br/portal/ministros\\>.\n","dic":"DHBPR"}
