{"title":"EUSÉBIO, José","cargoss":["Membro de junta governativa","Deputado federal","Senador"],"cargos_esp":[0,0,0],"datas_ini":[1891,1900,1909],"datas_fim":[1891,1908,1925],"estados":["PI","MA","MA"],"autor":["Alan Carneiro","Raimundo Helio Lopes"],"content":"**EUSÉBIO, José**\n\n\\*magistrado; junta gov. PI 1891; dep. fed. MA 1900-1908; sen. MA\n1909-1925.\n\n*José Eusébio de Carvalho Oliveira* nasceu em Campo Maior (PI) no dia 10\nde janeiro de 1869.\n\nDiplomado pela Faculdade de Direito do Recife em 1891, retornou a seu\nestado natal e assumiu a Procuradoria Fiscal da Fazenda do Piauí.\n\nA ascensão do vice-presidente da República, marechal Floriano Peixoto, à\npresidência, após a crise que culminou com a renúncia do marechal\nDeodoro da Fonseca em 23 de novembro de 1891, repercutiu diretamente no\nquadro político dos estados. No Piauí, o governador Gabriel Luís\nFerreira foi deposto em 21 de dezembro, sendo substituído por uma junta\ngovernativa presidida pelo tenente-coronel João Domingos Ramos. A junta\nera composta ainda por José Eusébio de Carvalho Oliveira, Clodoaldo\nFreitas, Higino Cunha, Elias Firmino de Sousa Martins e José Pereira\nLopes. Em 29 de dezembro, João Domingos Ramos assumiu sozinho o governo\ndo Piauí, mantendo-se no cargo até 11 de fevereiro de 1892, quando\nCoriolano de Carvalho e Silva foi nomeado governador.\n\nAinda em 1892, José Eusébio transferiu-se para o Maranhão e assumiu o\ncargo de promotor público no município de Codó. Nesse mesmo ano passou a\njuiz no município de Pedreiras, e aí permaneceu até 1895, quando foi\ntransferido para São Luís como juiz substituto. Foi também inspetor do\nTesouro Público e procurador geral do estado.\n\nFiliado ao Partido Republicano do Maranhão, elegeu-se, primeiro,\ndeputado estadual e, em março de 1900, deputado federal. Assumindo sua\ncadeira na Câmara dos Deputados, no Rio de Janeiro, então Distrito\nFederal, em maio de 1900, reelegeu-se para as duas legislaturas\nseguintes e exerceu o mandato até dezembro de 1908. Figura de destaque\nda política maranhense, liderou uma facção do partido situacionista após\na morte do presidente estadual Benedito Pereira Leite, em março de 1909.\nNesse mesmo mês lançou-se candidato a senador e foi eleito. Iniciando em\nabril seguinte um mandato de nove anos, integrou as comissões de Saúde\nPública, de Instrução Pública, de Constituição e Diplomacia, de Finanças\ne de Redação do Senado. Foi reeleito em março de 1918, com mandato até\ndezembro de 1926, mas faleceu antes de concluí-lo, em 25 de abril de\n1925.\n\nColaborou nos jornais *O Estado*, *A Legalidade* e *A República*.\n\nAlan Carneiro/Raimundo Helio Lopes\n\n**FONTES:** BASTOS, C. *Dicionário*; GONÇALVES, W. *Grande*; LEITE NETO,\nL. *Catálogo* *biográfico* (v.3, p.581/2); REGO NETO, H. *Fatos*; REIS,\nF. *Grupos*; SENADO. Disponível em:\n\\<www.senado.gov.br/sf/senadores/senadores\\_biografia.asp?codparl=1918&li=31&lcab=1918-1920&lf=31\\>.\nAcesso em: 22/9/2008.\n","ref":"**FONTES:** BASTOS, C. *Dicionário*; GONÇALVES, W. *Grande*; LEITE NETO,\nL. *Catálogo* *biográfico* (v.3, p.581/2); REGO NETO, H. *Fatos*; REIS,\nF. *Grupos*; SENADO. Disponível em:\n\\<www.senado.gov.br/sf/senadores/senadores\\_biografia.asp?codparl=1918&li=31&lcab=1918-1920&lf=31\\>.\nAcesso em: 22/9/2008.\n","dic":"DHBPR"}
