{"title":"FAGUNDES, Cirilo de Lemos Nunes","cargoss":["Constituinte","Deputado federal"],"cargos_esp":[0,0],"datas_ini":[1891,1891],"datas_fim":[1891,1893],"estados":[0,"RJ"],"autor":["Adrianna Setemy"],"content":"**FAGUNDES, Cirilo de Lemos Nunes**\n\n\\*const. 1891; dep. fed. RJ 1891-1893.\n\n*Cirilo de Lemos Nunes Fagundes* nasceu em Itaboraí (RJ), filho de\nCirilo Nunes Fagundes.\n\nBacharelou-se pela Faculdade de Direito do Recife em 1869. Ainda durante\no Império, foi deputado provincial por quatro legislaturas na província\ndo Rio de Janeiro.\n\nCom a proclamação da República em 15 de novembro de 1889, foi nomeado\nterceiro-vice-presidente do Rio de Janeiro durante o governo de\nFrancisco Portela (1889-1891). Convocadas as eleições para o Congresso\nNacional Constituinte, foi eleito deputado em 15 de setembro de 1890.\nEmpossado em 15 novembro seguinte, participou dos trabalhos de\nelaboração da Constituição, afinal promulgada em 24 de fevereiro de\n1891, e, com o início, em junho, da legislatura ordinária, assumiu sua\ncadeira na Câmara dos Deputados. Permaneceu na Câmara até dezembro de\n1893, quando se encerraram seu mandato e a legislatura.\n\nFaleceu em 10 de outubro de 1911.\n\nPoeta e literato, escreveu o livro *Suspiros d’alma* e traduziu *O\ncântico dos cânticos* (1865), de autoria de Ernesto Renan.\n\nAdrianna Setemy\n\n**FONTES:** ABRANCHES, J. *Governos* (v.1); CÂM. DEP. *Deputados\nbrasileiros*; Projeto de imagem de publicações oficiais brasileiras do\nCenter for Research Libraries e Latin-american Microfilm Project.\nDisponível em: \\<www.crl.edu/content.asp?l1=4&l2=18&l3=33\\>. Acesso em:\n8/1/2009.\n","ref":"**FONTES:** ABRANCHES, J. *Governos* (v.1); CÂM. DEP. *Deputados\nbrasileiros*; Projeto de imagem de publicações oficiais brasileiras do\nCenter for Research Libraries e Latin-american Microfilm Project.\nDisponível em: \\<www.crl.edu/content.asp?l1=4&l2=18&l3=33\\>. Acesso em:\n8/1/2009.\n","dic":"DHBPR"}
