{"title":"ALMENDRA, João Henrique de SousaGaioso e","cargoss":["Deputado federal"],"cargos_esp":[0],"datas_ini":[1900],"datas_fim":[1913],"estados":["PI"],"autor":["Raimundo Helio Lopes"],"content":"**ALMENDRA, João Henrique de SousaGaioso e**\n\n\\* dep. fed. PI 1900-1913.\n\n*João Henrique de Sousa Gaioso e Almendra* nasceu emJosé de Freitas (PI)\nno dia 9 dejunho de 1865, filho de Raimundo Joséde Sousa Gaioso e de\nInês LeonorAlmendra de Sousa Gaioso. Descendia deFrancisco da Cunha\nCastelo Branco, umdos pioneiros do povoamento do Piauí.\n\nIngressou em 1885 na Faculdadede Direito do Recife e envolveu-se coma\nmilitância política ao defender a causaabolicionista.\nFormou-seadvogadoem 1889. Nesse mesmo ano voltou aresidir em seu estado\nnatal e foipromotor público em Teresina até 1890,quando assumiu as\nmesmas funções na cidadede União (PI). De 1891 a 1896 foijuiz de direito\nde Barras (PI), ede 1896 a 1898 foi procurador daRepública no Piauí.\n\nEm março de 1900 foi eleitopela primeira vez deputado federal peloPiauí.\nFoi sucessivamente reeleito, em 1906,1909 e 1912.\n\nNo campo jornalístico, foi proprietáriodo jornal *A Notícia*. Também\ncolaborou comos periódicos *A República*, *A Democracia* e *O Piauí*.\n\nFaleceu na cidade do Rio deJaneiro, então Distrito Federal, no dia17 de\nsetembro de 1913, no exercíciodo mandato.\n\nEra casado com Josefina Pires deCastro Gaioso e Almendra, descendente\ndeGervásio Pires Ferreira, vulto de projeçãona Revolução Pernambucana de\n1817. Seufilho Jacó Manuel Gaioso e Almendra, generaldo Exército, foi\ngovernador do Piauí de1955 a 1959 e deputado federal de1963 a 1967.\n\nRaimundo Helio Lopes\n\n**FONTES:** ABRANCHES, J. *Governos*;BASTOS, C. *Dicionário*; CÂM. DEP.\n*Deputados brasileiros*;CHAVES, J. *Apontamentos.*\n","ref":"**FONTES:** ABRANCHES, J. *Governos*;BASTOS, C. *Dicionário*; CÂM. DEP.\n*Deputados brasileiros*;CHAVES, J. *Apontamentos.*\n","dic":"DHBPR"}
