{"title":"FARIA, José Bernardes de","cargoss":["Deputado federal"],"cargos_esp":[0],"datas_ini":[1903],"datas_fim":[1908],"estados":["MG"],"autor":["Luciana Pinheiro"],"content":"**FARIA, José Bernardes de**\n\n\\*dep. fed. MG 1903-1908.\n\n*José Bernardes de Faria* nasceu em Paracatu (MG) no dia 17 de outubro\nde 1859, filho de Bernardino de Faria Pereira e de Floricena Amélia de\nFaria Pereira.\n\nIniciou seus estudos no município mineiro de Mariana e concluiu o curso\npreparatório no Rio de Janeiro. De volta a Minas Gerais, após realizar\nestudos livres obteve carta de advogado provisionado em 1887 e assumiu,\nde então a 1889, a promotoria pública da comarca de Rio Grande. Eleito\ndeputado estadual, exerceu o mandato de 1895 a 1898. Em seguida foi\neleito vereador em Formiga e escolhido presidente da Câmara Municipal.\nConcomitantemente voltou à Assembleia estadual entre 1899 e 1902 e\nocupou a vice-presidência da casa.\n\nEm 1903 foi eleito deputado federal pelo Partido Republicano Mineiro e\nem maio do mesmo ano tomou posse na Câmara dos Deputados, no Rio de\nJaneiro, então Distrito Federal. Foi reeleito em 1906 e permaneceu na\nCâmara até dezembro de 1908. Voltou então a atuar em Formiga, onde\npresidiu a Câmara Municipal entre 1912 e 1913.\n\nFaleceu em Formiga em 9 de maio de 1934.\n\nCasou-se com Maria Amália de Faria Pereira e, posteriormente, com Maria\nGuilhermina de Faria Pereira. Dois de seus sobrinhos também atuaram na\npolítica: Washington Ferreira Pires foi deputado estadual e federal por\nMinas Gerais, ministro da Educação e Saúde entre setembro de 1932 e\njulho de 1934 e secretário estadual de Saúde e Assistência durante o\ngoverno de José Francisco Bias Fortes. Hilton Ferreira Pires foi\nvereador e prefeito da cidade de Formiga, e também deputado federal.\n\nLuciana Pinheiro\n\n**FONTES:** CAM. DEP. *Deputados brasileiros* (p.145); MONTEIRO, N.\n*Dicionário* (v.1, p.239, 554-555); PREF. FORMIGA. Disponível em:\n\\<www.formiga.mg.gov.br/\\>. Acesso em: 23/8/2010.\n","ref":"**FONTES:** CAM. DEP. *Deputados brasileiros* (p.145); MONTEIRO, N.\n*Dicionário* (v.1, p.239, 554-555); PREF. FORMIGA. Disponível em:\n\\<www.formiga.mg.gov.br/\\>. Acesso em: 23/8/2010.\n","dic":"DHBPR"}
