{"title":"FAUSTO, Elias","cargoss":["Deputado federal"],"cargos_esp":[0],"datas_ini":[1897],"datas_fim":[1901],"estados":["SP"],"autor":["Carlos Alberto Ungaretti Dias"],"content":"**FAUSTO, Elias**\n\n\\*dep. fed. SP 1897-1901.\n\n*Elias Fausto Pacheco Jordão*nasceu emSão João do Rio Claro (SP) em 18\nde fevereiro de 1849, filho de José Elias Pacheco Jordão e de Maria\nMarcolina. Seu pai foi deputado provincial em São Paulo.\n\nApós o curso primário em Rio Claro, matriculou-se no Seminário\nEpiscopal, na capital paulista, mas não se adaptou ao clima e mudou-se\npara Itu. Residiu um breve período no Rio de Janeiro e mais uma vez\nvoltou para Itu, onde estabeleceu uma casa de comércio. Para completar\nos estudos superiores, viajou para os Estados Unidos e formou-se em\nengenharia civil na Universidade de Cornell, em 2 de julho de 1874.\nPropagandista da República, ainda na época de estudante foi redator, de\n1873 a 1875, do periódico *Aurora Brasileira*, fundado pelos estudantes\npaulistas Tomás de Aquino e Castro e Francisco de Assis Vieira Bueno\nJúnior. De 1876 a 1881 foi diretor de Obras Públicas da província de São\nPaulo, mas demitiu-se do cargo por razões políticas. Voltou para Itu e\nfundou *A* *Imprensa Ituana*, o primeiro jornal organizado para a\npropaganda republicana na cidade. Em 1883 estabeleceu-se em Santa Rita\ndo Passa Quatro e tornou-se inspetor da Estrada de Ferro Ituana. Fundou\no Partido Republicano na cidade.\n\nApós a proclamação da República, iniciou a carreira política elegendo-se\nvereador na capital paulista em 1892. Várias vezes reeleito, ocupou uma\ncadeira na Câmara Municipal até 1899 e integrou as comissões de Obras\nMunicipais, Higiene e Saúde Pública, e de Finanças. Foi também diretor\nda Companhia Paulista de Estrada de Ferro de 1892 a 1893 e ganhou\nnotoriedade nacional como empresário ousado e inovador ao realizar um\ncomplexo plano de urbanização da praia de Pitangueiras, no Guarujá (SP).\nO projeto começou a ser concretizado com a transformação do povoado em\nvila balneária, em 4 de setembro de 1893. Para o empreendimento foi\ncriada a Companhia Balneária, que comprou nos Estados Unidos 46 chalés\nresidenciais desmontáveis, um hotel de luxo, um cassino e uma igreja,\ntodos de madeira. A pequena vila apresentava grande sofisticação para a\népoca, com confortos como água encanada, esgoto e luz elétrica, e foi\nbeneficiada com a aquisição de duas barcas e a construção de um ramal\nferroviário interligando-a ao porto de Santos. O empreendimento foi um\ngrande sucesso, e a vila logo foi transformada em ponto de encontro da\nelite do país, frequentada por figuras como Rui Barbosa, Washington Luís\ne Santos Dumont, além de personalidades internacionais. O grande êxito\ntrouxe para a região os mais poderosos empreendedores do ramo\nimobiliário, que promoveram intensa ocupação da praia, pouco restando do\nnúcleo pioneiro.\n\nTambém enquanto cumpria o mandato de vereador fundou, em 1895, a Prado &\nJordão, embrião da Vidraria Santa Marina, situada no bairro da Água\nBranca, em área próxima ao rio Tietê rica em jazidas de areia de cor e\nqualidade ideais para a fabricação de vidro. Tinha como sócio o\nconselheiro Antônio da Silva Prado, que mais tarde adquiriu sua parte na\nempresa.\n\nEm 1897 foi eleito deputado federal na vaga de Fernando Prestes, que\nrenunciara. Foi reeleito para a legislatura 1900-1902, mas morreu em\nParis no dia 26 de março de 1901, no exercício do mandato.\n\nAo longo da vida participou da construção de diversas ferrovias no\ninterior do estado de São Paulo, entre elas o ramal da Estrada de Ferro\nSorocabana que alcançou o distrito de Cardeal, hoje município de Elias\nFausto. Seu nome foi dado também à Escola Estadual Elias Fausto Pacheco\nJordão, na cidade de Capivari, e a uma rua no Guarujá.\n\nCarlos Alberto Ungaretti Dias\n\n**FONTES:** ABRANCHES, J. *Governos* (v.2); DAMASCENO, M.; MOTA, P.\n*Pérola*; Guia Guarujá. Disponível em:\n\\<www.guiaguaruja.com.br/vilabalnearia/index.htm\\>; Novo milênio.\nDisponível em: \\<www.novomilenio.inf.br/guaruja/gh010.htm\\>\n","ref":"**FONTES:** ABRANCHES, J. *Governos* (v.2); DAMASCENO, M.; MOTA, P.\n*Pérola*; Guia Guarujá. Disponível em:\n\\<www.guiaguaruja.com.br/vilabalnearia/index.htm\\>; Novo milênio.\nDisponível em: \\<www.novomilenio.inf.br/guaruja/gh010.htm\\>\n","dic":"DHBPR"}
