{"title":"ALVARENGA, Zoroastro Rodrigues de","cargoss":["Deputado federal"],"cargos_esp":[0],"datas_ini":[1918],"datas_fim":[1926],"estados":["MG"],"autor":["Luciana Pinheiro"],"content":"**ALVARENGA, Zoroastro Rodrigues de**\n\n\\* dep. fed. MG 1918-1926.\n\n*Zoroastro Rodrigues de Alvarenga* nasceu em Lavras(MG) no dia 15 de\njaneiro de 1878,filho de José Rodrigues Alvarenga e deMatilde de Resende\nAlvarenga.\n\nMédico diplomado pela Faculdade deMedicina do Rio de Janeiro, retornou\naseu município natal e iniciou a carreirapolítica sendo eleito vereador\ne, posteriormente,presidente da Câmara Municipal. Em 1907foi eleito\ndeputado estadual. Permaneceu noLegislativo mineiro até 1910, quando\nrenunciouao mandato para assumir o cargo dediretor de Higiene do estado,\na convitedo então presidente Júlio Bueno Brandão(1910-1914). Esteve à\nfrente da Diretoriade Higiene de Minas Gerais por oitoanos, atuando\ntambém durante o governode Delfim Moreira (1914-1918), sucessor deBueno\nBrandão. Nesse período teve aindamarcante participação na fundação da\nFaculdadede Medicina de Minas Gerais, criada em1911. Essa instituição,\nna qual atuariacomo docente da disciplina de clínicamédica por vários\nanos, mais tarde seriaincorporada à Universidade de Minas Gerais.\n\nEm 1918 foi eleito deputado federalpor Minas Gerais na legenda do\nPartidoRepublicano Mineiro (PRM). Assumindo em maiosua cadeira na Câmara\ndos Deputados, noRio de Janeiro, então Distrito Federal,integrou a\nComissão de Saúde. Reeleitoem 1921 e 1924, nesse último anotornou-se\nvice-presidente da Comissão de Saúde.Ainda em 1924 foi nomeado\nserventuárioda Justiça do Distrito Federal. Permaneceuna Câmara dos\nDeputados até dezembro de1926, quando se encerraram seu mandatoe a\nlegislatura.\n\nFora da esfera política, continuouatuando como serventuário de Justiça\naté1931, quando foi demitido em decorrênciadas transformações políticas\nque se sucederamno país após a vitória da Revoluçãode 1930.\n\nFaleceu no Rio de Janeiro nodia 15 de março de 1945.\n\nEra casado com Belmira da SilvaAlvarenga.\n\nLuciana Pinheiro\n\n**FONTES:**CÂM. DEP. *Deputados brasileiros*;MONTEIRO, N. *Dicionário*\n(v.1, p.21).\n","ref":"**FONTES:**CÂM. DEP. *Deputados brasileiros*;MONTEIRO, N. *Dicionário*\n(v.1, p.21).\n","dic":"DHBPR"}
