{"title":"FERNANDES, Francisco da Costa","cargoss":["Deputado federal","Constituinte","Deputado federal"],"cargos_esp":[0,0,0],"datas_ini":[1927,1934,1935],"datas_fim":[1930,1934,1937],"estados":["MA",0,"MA"],"autor":[0],"content":"**FERNANDES, Francisco da Costa**\n\n\\*dep. fed. MA 1927-1930; const. 1934; dep. fed. MA 1935-1937.\n\n*Francisco da Costa Fernandes* nasceu em Brejo (MA) no dia 17 de março\nde 1879, filho de Raimundo da Costa Fernandes e de Amália Fernandes\nBacelar, de tradicionais famílias maranhenses.\n\nIniciou os estudos em sua cidade natal e depois transferiu para a\ncapital do estado, onde cursou o Colégio São Luís e o Liceu Maranhense.\nIngressou em seguida na Faculdade de Medicina de Salvador, pela qual se\nformou em 1903. Mais tarde, aperfeiçoou-se em urologia e em obstetrícia\nna Faculdade de Medicina de Paris.\n\nPassou 16 anos no estado do Amazonas, clinicando no Hospital Português\nde Manaus e lecionando química na Faculdade de Farmácia e Odontologia do\nestado. Tornou-se membro da Sociedade de Medicina de Manaus. De volta ao\nMaranhão, dedicou-se à clínica e continuou no magistério como professor\nde física da Faculdade de Farmácia e Odontologia de São Luís.\n\nDeputado estadual em duas legislaturas, na última das quais chegou à\nvice-presidência da Câmara do estado, em 1927 elegeu-se deputado federal\npelo Maranhão, com mandato até 1929. Reeleito em março de 1930,\ncontinuou na Câmara até que a vitória do movimento revolucionário que\ndepôs o presidente Washington Luís (24/10/1930) viesse a dissolver os\ncorpos legislativos do país. Na ocasião, chegou a ser preso no Rio de\nJaneiro por forças revolucionárias, ficando detido por 24 horas no\nquartel do 3^o^ Regimento de Cavalaria.\n\nEm maio de 1933, elegeu-se deputado pelo Maranhão à Assembleia Nacional\nConstituinte na legenda da União Republicana Maranhense, com o apoio da\nLiga Eleitoral Católica (LEC). Assumiu o mandato em novembro e\nparticipou dos trabalhos constituintes, marcando sua atuação pela defesa\ndas posições da Igreja Católica. Após a promulgação da nova Constituição\n(16/7/1934) e a eleição (17/7/1934) de Getúlio Vargas para a presidência\nda República, permaneceu no exercício do mandato, estendido até a\ndiplomação dos deputados que seriam eleitos em outubro de 1934.\n\nEleito ele próprio deputado federal pelo Maranhão, ainda na legenda da\nUnião Republicana, iniciou novo mandato em maio de 1935. Nesse mesmo\nano, seu nome esteve envolvido no acordo celebrado entre o Partido\nRepublicano do Maranhão e a União Republicana Maranhense para a\nconstituição das Oposições Coligadas. O objetivo das oposições era obter\nmaioria na Constituinte estadual de 1935 e, desse modo, eleger o novo\ngovernador do Maranhão e os dois senadores do estado. Uma das condições\nexigidas pela União Republicana para formar o acordo foi a transformação\nda prefeitura da capital em cargo eletivo, para o qual seria sufragado\nFrancisco da Costa Fernandes. Entretanto, uma vez eleito, o candidato\napoiado pelas coligações, Aquiles Lisboa, desrespeitou o trato e nomeou\noutro prefeito para São Luís. Esse fato levou ao rompimento da coligação\nentre o Partido Republicano e a União Republicana, o que por sua vez\nresultou na decretação de intervenção federal no estado em junho de\n1936, quando o major Roberto Carneiro de Mendonça assumiu a chefia do\ngoverno. Costa Fernandes permaneceu na Câmara até a instauração do\nEstado Novo (10/11/1937), que suprimiu os órgãos legislativos do país.\n\nSócio do Centro Dom Vital, dedicou-se também a estudos de história e\npolítica. Publicou *O Senado reacionário,* tese apresentada ao Instituto\nHistórico e Geográfico Brasileiro, e *A revolução de Beckmann no\nMaranhão.*\n\nCasou-se com Luísa Martins Palhano da Costa Fernandes.\n\n**FONTES:** ASSEMB. NAC. CONST. 1934. Anais (1); CÂM. DEP. Deputados;\nCâm. Dep. seus componentes; Cronologia da Assembleia; GODINHO, V.\nConstituintes; Who’s who in Latin.\n","ref":"**FONTES:** ASSEMB. NAC. CONST. 1934. Anais (1); CÂM. DEP. Deputados;\nCâm. Dep. seus componentes; Cronologia da Assembleia; GODINHO, V.\nConstituintes; Who’s who in Latin.\n","dic":"DHBPR"}
