{"title":"FERNANDES, Raul","cargoss":["Deputado federal","Deputado federal","Presidente de associação ou confederação de empregados ou empregadores","Consultor-geral da República","Constituinte","Deputado federal","Ministro das Relações Exteriores","Ministro das Relações Exteriores"],"cargos_esp":[0,0,0,0,0,0,0,0],"datas_ini":[1921,1909,1923,1932,1934,1935,1954,1946],"datas_fim":[1922,1917,1923,1932,1934,1937,1955,1951],"estados":["RJ","RJ","RJ",0,0,"RJ",0,0],"autor":["Robert Pechman"],"content":"**FERNANDES, Raul**\n\n\\*dep. fed. RJ 1909-1917 e 1921-1922; pres. RJ 1923; consult.-ger. Rep.\n1932; const. 1934; dep. fed. RJ 1935-1937; min. Rel. Ext. 1946-1951 e\n1954-1955.\n\n*Raul Fernandes* nasceu na fazenda de São João, em Valença (RJ), em 24\nde outubro de 1877, filho de Antônio José Fernandes, educador, médico,\nproprietário agrícola e senador estadual no estado do Rio de Janeiro\ndurante a Primeira República, e de Isabel Peregrina Fernandes,\npertencente à família Werneck, tradicional na região. Era neto, pelo\nlado materno, de Peregrino José de Américo Pinheiro, visconde de\nIpiabas.\n\nEstudou no Colégio Alberto Brandão, em Vassouras (RJ), no Asilo São\nFrancisco, em São João del Rei (MG), e no Colégio Santa Efigênia, em São\nPaulo. Completou seus estudos preparatórios em 1894, no curso anexo à\nFaculdade de Direito de São Paulo, e matriculou-se nessa faculdade em\n1895. Bacharelou-se em ciências sociais em 1897 e em ciências jurídicas\nem 1898, com distinção em todas as cadeiras – por esse motivo, receberia\nem 1912 o título de laureado, o prêmio de viagem à Europa e o direito de\nter seu retrato no panteão da faculdade. Especializou-se em seguida em\ndireito comercial.\n\nComeçou a advogar em 1898 em Vassouras e em Barra do Piraí (RJ), num\nescritório montado com o irmão, José Avelar Fernandes, atraindo as mais\nimportantes causas da época. Logo adquiriu fama como orador no Tribunal\ndo Júri. De 1901 a 1906 foi vereador à Câmara Municipal de Vassouras, e\nde 1903 a 1909 foi deputado à Assembleia Legislativa do estado do Rio de\nJaneiro, tendo feito parte, em 1903, da chamada Comissão dos Cinco,\nrelatora do projeto de reforma da Constituição estadual.\n\nDepois da morte do irmão, transferiu em 1906 o escritório de advocacia\npara a cidade do Rio de Janeiro, então Distrito Federal, onde ocuparia o\ncargo de promotor até 1934. Em 1907, apoiou a campanha de oposição\nmovida pelo vice-presidente da República, Nilo Peçanha, ao presidente do\nestado do Rio, Alfredo Backer. Em maio de 1909 foi eleito deputado\nfederal, como representante do 3^o^ Distrito Eleitoral, que compreendia,\nentre outros, os municípios de Vassouras e Valença. Reeleito, ocupou uma\ncadeira na Câmara dos Deputados durante três legislaturas, até 1917. Foi\nmembro da Comissão dos 21, que ultimou a elaboração do Código Civil,\nparticipou das comissões de Finanças e de Constituição e Justiça e\ntornou-se um dos principais oradores da Câmara. Foi relator dos\norçamentos da Agricultura e do Exterior, líder de sua bancada e relator\nda comissão especial nomeada para dar parecer sobre a proposição dos\ndeputados Carlos Peixoto e Josino de Araújo de reforma do regimento da\nCâmara no tocante à verificação de poderes.\n\nEm 1919, com o fim da Primeira Guerra Mundial, foi nomeado delegado\nplenipotenciário à Conferência de Paz de Versalhes, integrando a\ndelegação chefiada pelo senador Epitácio Pessoa. De 1919 a 1920\nrepresentou o Brasil na Comissão de Reparações da Liga das Nações, com\nsede em Paris, que tratou das reparações de guerra. Foi delegado do\nBrasil nas assembleias da Liga das Nações em Genebra em 1919, 1920,\n1921, 1924 e 1925, tendo sido designado em 1920, pelo conselho da Liga,\num dos dez membros do conselho de jurisconsultos encarregado de elaborar\no estatuto da Corte Permanente de Justiça Internacional, reunida em Haia\n(Holanda). Nesse conselho, defendeu o princípio da igualdade jurídica\ndos Estados e a ampliação da competência da corte.\n\nEm maio de 1921, foi novamente eleito deputado federal pelo estado do\nRio de Janeiro. Empossado em maio, exerceu o mandato somente até\ndezembro de 1922.\n\nA Sucessão Fluminense de 1922\n\nEm julho de 1922, Raul Fernandes foi eleito presidente do estado do Rio\nde Janeiro para o período de 1922 a 1926, recebendo 33 mil votos, contra\n16.200 de Feliciano Sodré. Entretanto, ambas as chapas concorrentes ao\npleito se declararam vencedoras e, alegando fraude na apuração,\nproclamaram eleitos seus candidatos. A situação se repetiu em dezembro,\nnas eleições legislativas estaduais, quando se formaram duas\nassembleias. Já que o reconhecimento do presidente do estado era da\ncompetência da Assembleia, a dualidade de assembleias ensejou a\ndualidade de governos.\n\nSeguindo a orientação política do ex-presidente da República Nilo\nPeçanha, Raul Fernandes temia que o novo presidente Artur Bernardes, que\nfora empossado em novembro de 1922, e que era adversário de Nilo,\ndecretasse a intervenção federal no estado do Rio. Assim, apresentou ao\nSupremo Tribunal Federal um pedido de habeas corpus que assegurasse sua\nposse. Atendido o pedido, foi investido na presidência do estado,\nrecebendo o cargo de Raul Veiga no palácio do Ingá, em Niterói, no dia\n31 de dezembro de 1922. Entretanto, Feliciano Sodré também foi empossado\npor “sua” assembleia no mesmo dia. Logo depois, com a cobertura do\ngoverno federal, os partidários de Feliciano Sodré depuseram prefeitos\nadversários e fecharam câmaras municipais sob o controle dos partidários\nde Nilo Peçanha. Enquanto isso acontecia, a Polícia Militar se recolheu\naos quartéis, declarando só acatar ordens do governo central. Alegando a\nduplicidade de poderes no Rio de Janeiro, Artur Bernardes decretou a\nintervenção federal no estado e 11 de janeiro de 1923 entregou o\nExecutivo fluminense a Aurelino Leal. Raul Fernandes não lançou nenhum\nprotesto, e o interventor anulou a eleição de julho de 1922, marcando\noutra para meses depois. Feliciano Sodré concorreu novamente e foi\neleito com o apoio de Bernardes para o período de dezembro de 1923 a\ndezembro de 1927.\n\nEm 1926, Raul Fernandes foi escolhido consultor jurídico do Tribunal de\nJustiça Internacional de Haia. De julho de 1926 a janeiro de 1927, foi\nembaixador do Brasil em Bruxelas. Em janeiro de 1928, chefiou a\ndelegação brasileira na VI Conferência Pan-Americana, em Havana.\n\nComo integrante da corrente nilista (ligada a Nilo Peçanha), Raul\nFernandes participou da campanha da Aliança Liberal, em cuja legenda, em\nmarço de 1930, Getúlio Vargas disputou e perdeu as eleições\npresidenciais para Júlio Prestes, candidato da situação. Na época, o\ngrupo nilista, que caíra no ostracismo, procurava se rearticular\npoliticamente.\n\nCom a vitória da Revolução de 1930, Raul Fernandes foi nomeado consultor\ngeral da República, exercendo o cargo de fevereiro de 1932 a novembro do\nmesmo ano.\n\nNa Constituinte\n\nConvocadas as eleições para a Assembleia Nacional Constituinte, a\ncorrente nilista fundou no mês de março de 1933 o Partido Popular\nRadical (PPR), tendo à frente elementos da oligarquia tradicional, como\nRaul Fernandes e José Eduardo de Macedo Soares. Em maio, Raul Fernandes\nfoi eleito deputado à Constituinte pelo estado do Rio de Janeiro na\nlegenda do PPR, que elegeu ao todo dez parlamentares, contra oito dos\ndemais partidos do estado.\n\nOs trabalhos da Assembleia foram abertos no dia 15 de novembro de 1933.\nJá no dia seguinte, foi organizada uma Comissão Constitucional –\nconhecida como Comissão dos 26 –, formada por um elemento de cada\nbancada estadual e dos grupos profissionais, num total de 26 membros.\nEssa comissão tinha a incumbência de, após estudar o anteprojeto de\nConstituição elaborado pelo governo provisório e as emendas a ele\napresentadas, formular um anteprojeto substitutivo a ser apresentado em\nplenário para discussão e novas emendas. Raul Fernandes foi escolhido\nrelator geral da Comissão Constitucional e integrou também a Comissão\nRevisora Constitucional, que estudou, em janeiro de 1934, em fase final,\no capítulo da “Declaração de direitos” da futura Carta.\n\nNo dia 19 de janeiro de 1934, Raul Fernandes participou de uma reunião\nno gabinete do presidente da Assembleia, Antônio Carlos Ribeiro de\nAndrada, à qual também compareceram Antônio Garcia de Medeiros Neto,\nlíder da maioria, Carlos Maximiliano e José de Alcântara Machado. Com o\nobjetivo de acelerar os trabalhos, pensou-se em extrair do anteprojeto\nconstitucional e das emendas um projeto sucinto, que definisse a\norganização dos poderes e incluísse meras enunciações de princípios\nsobre questões econômicas e sociais, simplificando os debates. No dia 22\nde janeiro, a Comissão Constitucional iniciou a discussão do\nsubstitutivo elaborado por Raul Fernandes e José Pereira Lira, que\nacompanhava a linha geral do anteprojeto governamental. No dia 25,\ndecidiu-se, para maior eficiência, reduzir a Comissão dos 26 a seis\nintegrantes fixos, entre os quais o relator geral, Raul Fernandes. Em 31\nde janeiro, a chamada Comissão dos 26 concluiu a parte do projeto\nreferente à eleição do presidente da República. Essa questão suscitava\ndebates, sobretudo após a apresentação, também no mês de janeiro, da\nemenda Medeiros Neto, que propunha a inversão da ordem dos trabalhos da\nAssembleia, com a eleição do presidente da República antes da aprovação\ndefinitiva do texto constitucional. Em fevereiro, a Fórmula Simões Lopes\nveio propor a aceleração dos trabalhos, com a votação em bloco do\nanteprojeto substitutivo, seguida da eleição presidencial.\n\nEmbora nenhuma dessas previsões tenha chegado a se concretizar, a\nAssembleia estava politicamente dividida, e a maioria seria definida\npelos votos dos representantes classistas, o que Raul Fernandes\ndesaprovava. Anteriormente, como consultor geral da República, em\nparecer enviado ao governo provisório, ele já se manifestara contrário à\nrepresentação classista. A eleição presidencial seria influenciada,\nargumentava, por deputados que, por definição, não representavam\ninteresses políticos nacionais e sim interesses profissionais.\n\nNo dia 3 de março, uma comissão de operários, em nome de diversos\nsindicatos do Distrito Federal, de São Paulo e do estado do Rio,\nentregou um memorial ao líder dos representantes profissionais\nprotestando contra a exclusão do projeto de Constituição elaborado pela\nComissão dos 26 de medidas referentes à legislação social. Nesse mesmo\ndia, Raul Fernandes participou de uma conferência no palácio Rio Negro\ncom o presidente Vargas, Carlos Maximiliano e Levi Carneiro, em que\nforam tratados assuntos relativos à eleição presidencial e à votação, na\nAssembleia, da Constituição e da anistia ampla. No dia 8 de março, a\nComissão de Revisão Constitucional apresentou, com seu parecer, o\nsubstitutivo do anteprojeto de Constituição elaborado por Raul\nFernandes. No dia 14, encerraram-se os trabalhos da Comissão dos 26. O\nsubstitutivo foi assinado por toda a comissão, sendo que a maioria o fez\ncom restrições. No dia 22 de abril, houve um entendimento entre as\nprincipais bancadas para que se estabelecesse acordo em torno dos pontos\nque não apresentassem divergências essenciais. Constituiu-se uma\ncomissão para retomar, título por título, artigo por artigo, todo o\nsubstitutivo. Entre os mais assíduos membros dessa comissão estavam Raul\nFernandes, João Guimarães, Odilon Braga, Clemente Mariani e Agamenon\nMagalhães.\n\nEm 16 de junho, foi designada a comissão de redação da Constituinte:\nRaul Fernandes, Homero Pires e Godofredo Viana. Onze dias depois, a\ncomissão apresentou à Assembleia a redação final da Constituição,\nacompanhada de uma pormenorizada exposição do critério seguido. A nova\nCarta Magna ficou corporificada em 187 artigos e mais as disposições\ntransitórias.\n\nNo dia 16 de julho de 1934, foi promulgada a nova Constituição. No dia\nseguinte realizou-se a eleição indireta para a presidência da República,\ne Getúlio Vargas foi eleito com 175 votos. Embora não estivesse\ndisputando o pleito, Raul Fernandes obteve um voto simbólico.\n\nDe 1934 a 1946\n\nEm outubro de 1934, Raul Fernandes foi eleito deputado federal pelo Rio\nde Janeiro para a legislatura ordinária que se iniciaria no ano\nseguinte. Nesse momento foram também eleitas em todo o país as\nassembleias constituintes estaduais, que deveriam eleger em cada estado\no governador e dois senadores. No estado do Rio, a União Progressista\nFluminense (UPF), liderada pelo general Cristóvão Barcelos e por José\nEduardo Prado Kelly, elegeu 19 deputados estaduais, enquanto a coligação\nformada pelo PPR e o Partido Socialista Fluminense (PSF), liderada por\nRaul Fernandes e José Eduardo de Macedo Soares, conseguiu fazer 23\nrepresentantes.\n\nNa definição do candidato ao governo estadual, o PPR indicou ao PSF\ncinco nomes, entre os quais um deveria ser escolhido. Eram eles João\nGuimarães, Levi Carneiro, José Eduardo de Macedo Soares, Oscar\nWeinschenk e Raul Fernandes. O PSF não aceitou a lista, alegando já ter\num candidato próprio, o deputado Alípio Costallat. O PPR vetou Costallat\ne, com o prosseguimento das negociações, os nomes de Raul Fernandes e\nMacedo Soares ganharam força, continuando todavia a ser recusados pelo\nPSF. Finalmente, a Coligação Radical Socialista chegou a um acordo em\ntorno da indicação do almirante Protógenes Guimarães, então ministro da\nMarinha.\n\nEnquanto isso, Raul Fernandes, escolhido líder da maioria no Congresso,\npromoveu em março de 1935 a aprovação da Lei de Segurança Nacional,\ndando ao governo federal poderes especiais para reprimir atividades\npolíticas consideradas subversivas. Em agosto, atuou como advogado do\nchefe de polícia do Distrito Federal, Filinto Müller, num processo de\ncalúnia movido pela Aliança Nacional Libertadora (ANL), por iniciativa\ndo presidente da organização, Herculino Cascardo.\n\nEm outubro de 1935, realizaram-se as eleições para o governo do estado\ndo Rio, marcadas por atos de violência que chegaram a provocar ferimento\nà bala em um deputado do PSF e no general Cristóvão Barcelos, candidato\nda UPF. Protógenes Guimarães venceu o pleito, mas a UPF entrou com\nrecurso, alegando falta de segurança durante a votação, e conseguiu que\na Justiça Eleitoral anulasse o resultado e convocasse novas eleições.\nRealizadas estas em novembro de 1935, Protógenes Guimarães foi novamente\neleito por maioria de um voto.\n\nEm 1936, Raul Fernandes foi o candidato oficial do governo à presidência\nda Câmara dos Deputados, concorrendo com Antônio Carlos Ribeiro de\nAndrada, que foi eleito. Apoiou a seguir a candidatura de Armando Sales\nà presidência da República nas eleições que deveriam realizar-se em 1938\ne foram suspensas pelo golpe que implantou o Estado Novo em novembro de\n1937.\n\nA partir de então, Raul Fernandes tomou posição contrária ao novo\nregime. De 1944 a 1946, foi presidente da Ordem dos Advogados do Brasil.\nEm 1945, integrou-se à campanha pela redemocratização do país,\nconvocando uma reunião de seus antigos correligionários do PPR para\npromover a candidatura do brigadeiro Eduardo Gomes à presidência da\nRepública. Como um dos fundadores da União Democrática Nacional (UDN),\nparticipou da comissão executiva de partido. Em fevereiro, foi\nconsultado por João Neves da Fontoura, embaixador do Brasil em Portugal,\nsobre a atitude das oposições, reunidas sob a bandeira da UDN, ante a\npossível renúncia de Vargas e sua substituição pelo general Pedro\nAurélio de Góis Monteiro, chefe do Estado-Maior do Exército. Raul\nFernandes respondeu a João Neves que a entrega do governo a Góis\nMonteiro “não se lhe afigurava de modo a inspirar confiança às\noposições”, já que o general fora um dos coautores do golpe do Estado\nNovo. Mesmo assim, ficou de discutir a proposta com Eduardo Gomes e\noutros dirigentes da UDN. Dois dias depois, em novo encontro com João\nNeves, respondeu negativamente à consulta do embaixador.\n\nEm abril, Raul Fernandes participou da primeira reunião do diretório\nnacional da UDN, que lançou oficialmente a candidatura Eduardo Gomes à\npresidência e nomeou diversas comissões, como a de redação do projeto\ndos estatutos do partido e a comissão política, da qual fez parte. No\ndia 8 de julho, assumiu a presidência da seção fluminense da UDN.\n\nNo Ministério de Dutra\n\nEm 1946, no governo de Eurico Dutra, Raul Fernandes foi delegado do\nBrasil à Conferência de Paz, em Paris. Em dezembro daquele ano, Dutra,\nque fora eleito pelo Partido Social Democrático (PSD), convidou Raul\nFernandes – embora prócer e fundador da UDN – para a chefia do\nMinistério das Relações Exteriores. Raul Fernandes justificou a\ncolaboração, explicando que nada tinha de pessoal contra Vargas e seus\nseguidores do PSD, já que sua oposição era ao Estado Novo. Na medida em\nque este desaparecera, terminavam as discordâncias básicas, porque o PSD\npouco diferia da UDN no conteúdo ideológico. Segundo o senador Ernâni\nAmaral Peixoto, um dos fundadores do PSD, Raul Fernandes manteve\nentendimentos com ele até a última hora para ingressar no PSD, só não o\nfazendo devido ao prenúncio de uma conspiração de militares ligados a\nGóis Monteiro.\n\nNo dia 9 de dezembro de 1946, o secretário da embaixada do Brasil em\nMoscou, Soares de Pina, envolveu-se numa discussão num restaurante\ndaquela capital e acabou sendo preso. O incidente provocou um atrito\nentre os dois países, com troca de notas que resultaram num desgaste de\nsuas relações. Em 10 de maio de 1947, o Tribunal Superior Eleitoral\ncancelou o registro do Partido Comunista Brasileiro, então Partido\nComunista do Brasil (PCB), e o embaixador soviético no Rio foi chamado a\nseu país. Antes de partir, enviou carta ao ministro Raul Fernandes,\nlamentando o fechamento do PCB.\n\nEm agosto de 1947, Raul Fernandes presidiu a Conferência Interamericana\nde Manutenção da Paz e Segurança, no Hotel Quitandinha, em Petrópolis\n(RJ), em que os países do continente discutiram a assistência que todos\ndeveriam prestar em caso de ataque armado a qualquer uma das nações\nirmãs. A atuação do chanceler brasileiro nessa conferência foi\nfundamental para o acordo firmado, que influenciaria depois a elaboração\ndo Pacto do Atlântico Norte, na Europa.\n\nNo dia 8 de outubro, o Itamarati informou ao governo norte-americano que\numa onda de protestos se levantara no Brasil devido a um artigo\npublicado na *Gazeta Literária* de Moscou contra o presidente Dutra. O\ngoverno brasileiro instruíra seu embaixador em Moscou no sentido de que\nexigisse uma retratação; se o governo soviético se negasse a satisfazer\nàs exigências, o Brasil romperia relações diplomáticas com a URSS. Seis\ndias mais tarde, o governo brasileiro encaminhou nota confidencial a\nWashington, informando que, desde que o governo soviético “se recusara a\ndar qualquer satisfação pelos insultos publicados em Moscou contra as\nforças armadas brasileiras e o governo Dutra”, estavam sendo tomadas as\nprimeiras providências para o rompimento, que se consumaria,\nprovavelmente, em dois dias. A nota pedia também que os Estados Unidos\nse encarregassem dos interesses do Brasil na União Soviética e,\nespecialmente, ajudassem os membros da missão diplomática brasileira a\ndeixar o território russo sem dificuldades. Poucos dias depois, ainda em\noutubro, o rompimento das relações diplomáticas foi consumado.\n\nRaul Fernandes viajou para a Argentina e o Uruguai em missão oficial por\nocasião do encontro entre os presidentes Dutra, Perón e Berreta ainda em\n1947. No Uruguai, recebeu o título de doutor *honoris causa* da\nUniversidade de Montevidéu.\n\nAinda durante o governo Dutra, foi designada uma comissão especial para\na elaboração de um anteprojeto de lei sobre o petróleo. Constituída por\nRaul Fernandes, Clóvis Pestana, ministro da Viação, Morvan Dias\nFigueiredo, ministro do Trabalho, e Salvador César Obino, chefe do\nEstado-Maior Geral, essa comissão desenvolveu estudos, tendo por base o\nanteprojeto do Estatuto do Petróleo. Apesar de inicialmente\nmanifestar-se a favor das proposições básicas do estatuto, a comissão\ndefiniu uma série de limitações às concessões contidas no anteprojeto,\nmanifestando ainda a preocupação de que fossem dadas maiores garantias\naos proprietários dos solos onde se encontrassem as jazidas.\n\nEm setembro de 1948, Raul Fernandes chefiou a delegação brasileira à III\nSessão da Assembleia Geral das Nações Unidas, em Paris. Nesse mesmo ano,\ntornou-se presidente da Comissão Nacional do Trigo. Ainda em 1948,\nfalando em nome do chanceler brasileiro, o deputado Heitor Collet\napresentou parecer na Câmara, pedindo a aprovação do tratado de paz com\na Itália.\n\nRaul Fernandes defendeu o estabelecimento de relações diplomáticas com o\ngoverno espanhol do generalíssimo Francisco Franco, assinou na IX\nConferência Pan-Americana, em Bogotá, juntamente com os Estados Unidos e\no Chile, um projeto de resolução anticomunista, e acompanhou o\npresidente Dutra em sua visita aos Estados Unidos, em maio de 1949.\n\nEm abril de 1950, durante a reunião dos embaixadores dos países\namericanos realizada no Rio de Janeiro, o governo brasileiro reivindicou\num financiamento norte-americano para um vasto programa de reequipamento\ndos setores de infraestrutura. Os entendimentos entre os dois governos\nse processaram na ocasião por intermédio do embaixador norte-americano\nHerschell Johnson e do ministro Raul Fernandes. A proposta brasileira só\nviria a ser aceita em dezembro, quando já ocorrera a eleição de Vargas\npara a presidência e os EUA preparavam a IV Reunião Consultiva de\nChanceleres Americanos, convocada para março de 1951 em Washington, com\no objetivo básico de coordenar o apoio latino-americano à intervenção\nnorte-americana na guerra da Coreia. Para implementar o acordo então\nrealizado, foi criada a Comissão Mista Brasil-Estados Unidos, formada\npor técnicos dos dois países, com o objetivo de elaborar projetos\nespecíficos, favoráveis ao desenvolvimento do potencial econômico\nbrasileiro.\n\nRaul Fernandes deixou o Ministério das Relações Exteriores ao final do\ngoverno Dutra, em janeiro de 1951. No ano seguinte, recebeu o título de\ndoutor *honoris causa* da Universidade de São Paulo.\n\nNo Ministério de Café Filho\n\nEm agosto de 1954, com o suicídio do presidente Getúlio Vargas, o\nvice-presidente João Café Filho assumiu o governo e chamou Raul\nFernandes para ocupar novamente o Ministério das Relações Exteriores. Na\nqualidade de chanceler, Raul Fernandes presidiu, de agosto de 1954 a\nagosto de 1955, a Comissão de Exportação de Materiais Estratégicos.\n\nO novo governo, aproveitando a reunião do Fundo Monetário Internacional\n(FMI), procurou obter novos créditos nos Estados Unidos, já que os\nrecursos do empréstimo de 80 milhões de dólares feito pela administração\nanterior no Federal Reserve Bank estavam praticamente esgotados. Em\ncarta ao embaixador brasileiro nos EUA, João Carlos Muniz, Raul\nFernandes dizia que a demora no atendimento do pedido era sintoma de que\nos Estados Unidos não avaliavam a extensão real dos problemas\nenfrentados pelo governo brasileiro, já que sua ótica era puramente\neconômico-financeira.\n\nEm janeiro de 1955, Café Filho encontrou-se com o presidente da Bolívia,\nVictor Paz Estensoro, em Santa Cruz de la Sierra (Bolívia), para\ndiscutirem o tratado que os dois países haviam firmado em 1938 para a\nprospecção e a exploração de petróleo em território boliviano. Segundo\nesse tratado, ficava reservada ampla faixa de terra para a atuação de\nempresas mistas dos dois países. Alegando que se haviam passado 17 anos\ndesde a sua assinatura sem que tivesse sido tomada qualquer medida,\nEstensoro sugeriu o reexame do tratado, de modo a possibilitar a\nexploração também por empresas exclusivamente bolivianas. Café Filho\npediu ao presidente boliviano que mandasse através de sua embaixada uma\nnota sobre o assunto, de modo que o governo brasileiro, após estudar o\ncaso, pudesse se manifestar.\n\nApós ter sido objeto de estudo pelo Itamarati, a nota foi devolvida por\nRaul Fernandes com seu parecer: manifestava-se favorável à manutenção do\nacordo, desde que a exploração da reserva fosse imediata. Caso não\nhouvesse condições para tanto, tornava-se irrecusável a revisão do\ntratado, embora o Brasil decidisse manter o privilégio de fiscalização e\na prioridade no recebimento do petróleo.\n\nNo dia 4 de março de 1955, o Conselho de Segurança Nacional debateu a\nrevisão do tratado firmado entre Brasil e Bolívia. O chefe da Casa\nMilitar, Juarez Távora, sustentou que antes de se tomar qualquer decisão\nera preciso avaliar se o país possuía condições financeiras para iniciar\nos trabalhos. O ministro da Fazenda, Eugênio Gudin, declarou então ser\npraticamente impossível desviar recursos para o setor, já que as\nemissões de dinheiro tinham sido restringidas e as reservas cambiais\neram insuficientes. Em vista disso, o ministro da Guerra, Henrique Lott,\nmanifestou-se a favor da desistência da garantia geográfica obtida com o\ntratado e do estabelecimento de outro acordo, que assegurasse a compra\ndo petróleo excedente ao preço do mercado internacional. Posta a questão\nem votação, Raul Fernandes votou a favor da revisão, sendo esta a\nopinião vitoriosa. Em vista disso, o Itamarati iniciou gestões junto ao\ngoverno boliviano, após as quais o Conselho de Segurança Nacional\nvoltaria a se reunir. Quando o governo Café Filho caiu, em novembro de\n1955, o exame do assunto ainda não havia sido concluído. Na verdade, só\nem 1958 seria assinado o chamado Acordo de Roboré, atualizando o tratado\nde 1938. No entanto, por abrir espaço à atuação de empresas privadas na\nexploração do petróleo boliviano, o novo acordo suscitaria controvérsias\nnos meios políticos do país e jamais seria implementado.\n\nA crise que resultou na queda do governo Café Filho foi precipitada no\ndia 8 de novembro de 1955, quando o presidente da República, alegando\nenfermidade grave, transmitiu o governo ao presidente da Câmara dos\nDeputados, Carlos Luz. Este, na tarde do mesmo dia, reuniu o ministério\ne informou ser sua intenção manter todos os ministros em seus postos.\nEntretanto, o governo Carlos Luz foi deposto três dias depois pelo\nmovimento militar liderado pelo general Henrique Lott, que o acusava de\nmanter ligações com a corrente golpista que planejava impedir a posse do\npresidente eleito em outubro, Juscelino Kubitschek. Com isso, Raul\nFernandes foi destituído do Ministério das Relações Exteriores.\n\nEntre 1956 e 1958, Raul Fernandes foi chamado a depor na comissão\nparlamentar de inquérito da Câmara sobre energia atômica, Presidiu, de\n1958 a 1968, a Comissão Jurídica Interamericana. Foi também presidente\nda Sociedade Brasileira de Direito Internacional, membro da Comissão\nInternacional de Jurisconsultos para Codificação do Direito\nInternacional Público, membro honorário do Institut de Droit\nInternational, membro da Academia de Legislação e Jurisprudência de\nMadri e membro do Instituto para Unificação do Direito Privado, em Roma.\n\nFaleceu no Rio de Janeiro no dia 6 de janeiro de 1968.\n\nFoi casado com Lúcia Fernandes.\n\nPublicou, entre outros estudos e conferências, *Estudo sobre a\nmunicipalização dos serviços públicos no Brasil: relatório do II\nCongresso Jurídico, La comission des reparations et le droit du Brésil\naux bateaux allemands saisis dans ses ports* (1920),*L’Amérique du Sud\net la Société des Nations* (1924) e *O problema do café.* A seu respeito\nforam publicadas as obras *A* *política exterior do Brasil na gestão do\nchanceler Raul Fernandes* (1951) e *Raul Fernandes – homenagens oficiais\nprestadas pelo seu 90^o^ aniversário* (1967), além dos trabalhos de\nAntônio Gontijo de Carvalho, *Raul Fernandes, um servidor do Brasil*\n(1956) e de Ilmar Pena Marinho, *Contribuição de Raul Fernandes para o\ndesenvolvimento e aperfeiçoamento do sistema interamericano.*\n\nRobert Pechman\n\n**FONTES:** ABRANCHES, J. *Governos*; ASSEMB. NAC. CONST. 1934. *Anais*;\nBoletim Min. Trab. (5/1936): CAFÉ, FILHO, J. *Do sindicato*; CÂM. DEP.\n*Deputados*; CÂM. DEP. *Relação nominal*; Câm. Dep. seus componentes;\nCARONE, E. *República nova*; CARVALHO, A. *Ensaios*; COHN, G.\n*Petróleo*; CONSULT. MAGALHÃES, B.; *Correio da Manhã*; CORRESP.\nCONSULT. GER. REP.; CORTÉS, C. *Homens*; COSTA, M. *Cronologia*;\nCOUTINHO, A. *Brasil*; Cronologia da Assembleia; Diário do Congresso\nNacional; *Diário Oficial*; DULLES, J. *Getúlio*; *Encic. Barsa*;\n*Encic. Mirador*; ENTREV. PEREIRA, J.; GODINHO, V. *Constituintes*;\n*Grande encic. Delta*; GUIMARÃES, A. *Dic*.; HIRSCHOWICZ, E.\n*Contemporâneos*; *Ilustração brasileira* (10/1922); IÓRIO, L.\n*Valença*; *Jornal do Comércio*, Rio (7/1/1968); LEITE, A. *Páginas*;\nMIN. REL. EXT. *Anuário* (1950); MOURÃO, M. *Dutra*; *Novo dic. de\nhistória*; PEIXOTO, A. *Getúlio*; RACHE, P. *Outros*; *Rev. Inst.\nAdvogados Bras*.; SALES, D. *Razões*; SILVA, H. *1922*; SILVA, H.\n*1933*; SILVA, H. *1934*; SILVA, H. *1945*; SOUSA, J. *Índice*; TAVARES,\nJ. *Radicalização*; VAMPRÉ, S. *Memórias*; *Who’s who in Latin*.\n","ref":"**FONTES:** ABRANCHES, J. *Governos*; ASSEMB. NAC. CONST. 1934. *Anais*;\nBoletim Min. Trab. (5/1936): CAFÉ, FILHO, J. *Do sindicato*; CÂM. DEP.\n*Deputados*; CÂM. DEP. *Relação nominal*; Câm. Dep. seus componentes;\nCARONE, E. *República nova*; CARVALHO, A. *Ensaios*; COHN, G.\n*Petróleo*; CONSULT. MAGALHÃES, B.; *Correio da Manhã*; CORRESP.\nCONSULT. GER. REP.; CORTÉS, C. *Homens*; COSTA, M. *Cronologia*;\nCOUTINHO, A. *Brasil*; Cronologia da Assembleia; Diário do Congresso\nNacional; *Diário Oficial*; DULLES, J. *Getúlio*; *Encic. Barsa*;\n*Encic. Mirador*; ENTREV. PEREIRA, J.; GODINHO, V. *Constituintes*;\n*Grande encic. Delta*; GUIMARÃES, A. *Dic*.; HIRSCHOWICZ, E.\n*Contemporâneos*; *Ilustração brasileira* (10/1922); IÓRIO, L.\n*Valença*; *Jornal do Comércio*, Rio (7/1/1968); LEITE, A. *Páginas*;\nMIN. REL. EXT. *Anuário* (1950); MOURÃO, M. *Dutra*; *Novo dic. de\nhistória*; PEIXOTO, A. *Getúlio*; RACHE, P. *Outros*; *Rev. Inst.\nAdvogados Bras*.; SALES, D. *Razões*; SILVA, H. *1922*; SILVA, H.\n*1933*; SILVA, H. *1934*; SILVA, H. *1945*; SOUSA, J. *Índice*; TAVARES,\nJ. *Radicalização*; VAMPRÉ, S. *Memórias*; *Who’s who in Latin*.\n","dic":"DHBPR"}
