{"title":"FERRAZ JÚNIOR, Antônio Dias","cargoss":["Deputado federal"],"cargos_esp":[0],"datas_ini":[1894],"datas_fim":[1896],"estados":["MG"],"autor":["Liliane Correa"],"content":"**FERRAZ JÚNIOR, Antônio Dias**\n\n\\*dep. fed. MG 1894-1896.\n\n*Antônio Dias Ferraz Júnior* nasceu em Minas Gerais na década de 1850,\nfilho de Antônio Dias Ferraz e de Maria Arruda Ferraz. Sua família,\nradicada em Cristina (MG), produziu importantes políticos da região,\ncomo o coronel Silvério Dias Ferraz, líder político em Cristina, e o\nmédico Antônio Dias Ferraz da Luz, senador do Império (1848-1853).\n\nPerdeu a mãe quando criança, em 1857, e cresceu no interior de São\nPaulo. Formou-se em direito ainda no Império, morou em Itu (SP) e, nos\nanos de 1870, em Salto (SP).\n\nIngressou na política em 1894, quando foi eleito deputado federal por\nMinas Gerais. Assumindo sua cadeira na Câmara dos Deputados, no Rio de\nJaneiro, então Distrito Federal, em maio do mesmo ano, permaneceu no\nLegislativo até dezembro de 1896, quando se encerraram seu mandato e a\nlegislatura.\n\nEm 4 de agosto de 1897 foi nomeado juiz de direito da comarca de São\nJosé do Rio Pardo (SP), para onde se mudou. Era amigo do escritor e\nengenheiro Euclides da Cunha, que havia chegado naquela cidade em 1898\npara recuperar a ponte sobre o rio Pardo, que desmoronara um ano antes e\nprecisava ser desmontada e reerguida. Durante a estada de Euclides da\nCunha em São José do Rio Pardo, apresentou o escritor à sociedade local\ne participou da pequena festa organizada pelo engenheiro para comemorar\no encontro da laje sobre o rio Pardo. Em 24 de agosto de 1918, foi\nindicado, em lista no *Diário Oficial* de São Paulo, juiz de direito da\ncapital paulista.\n\nLiliane Correa\n\n**FONTES:** ARRUDA, M. *João*; CÂM. DEP. *Deputados brasileiros*;\nCARVALHO, N. *Escravos*; *Diário Oficial de São Paulo* (3/2/1905).\nDisponível em \\<www.jus\nbrasil.com.br/diarios/3673644/dosp-diario-oficial-03-02-1905-pg-316/pdfView\\>.\nAcesso em: 25/6/2010; *Diário Oficial de São Paulo* (24/8/1918).\nDisponível em:\n\\<www.jusbrasil.com.br/diarios/3819613/dosp-diario-oficial-24-08-1918-pg-4269\\>.\nAcesso em: 25/6/2010; ELOS CLUBE UBERABA. Cronologia da vida e obre de\nEuclides da Cunha, autor de ‘Os sertões’. Disponível em\n\\<www.uaisites.adm.br/iclas/biblioteca\\_ver.php?Cd Notici=69\\> Acesso\nem: 25/6/2010; MASCHIETTO, C. *Tradição*; MUS. REP. ITU. *Documentos\narquivados no Museu Republicano de Itu.* Disponível em:\n\\<www.marcopolo.pro.br/genealogia/sp/NotasItu\\_OrdemAlfab.pdf\\>. Acesso\nem: 25/6/2010.\n","ref":"**FONTES:** ARRUDA, M. *João*; CÂM. DEP. *Deputados brasileiros*;\nCARVALHO, N. *Escravos*; *Diário Oficial de São Paulo* (3/2/1905).\nDisponível em \\<www.jus\nbrasil.com.br/diarios/3673644/dosp-diario-oficial-03-02-1905-pg-316/pdfView\\>.\nAcesso em: 25/6/2010; *Diário Oficial de São Paulo* (24/8/1918).\nDisponível em:\n\\<www.jusbrasil.com.br/diarios/3819613/dosp-diario-oficial-24-08-1918-pg-4269\\>.\nAcesso em: 25/6/2010; ELOS CLUBE UBERABA. Cronologia da vida e obre de\nEuclides da Cunha, autor de ‘Os sertões’. Disponível em\n\\<www.uaisites.adm.br/iclas/biblioteca\\_ver.php?Cd Notici=69\\> Acesso\nem: 25/6/2010; MASCHIETTO, C. *Tradição*; MUS. REP. ITU. *Documentos\narquivados no Museu Republicano de Itu.* Disponível em:\n\\<www.marcopolo.pro.br/genealogia/sp/NotasItu\\_OrdemAlfab.pdf\\>. Acesso\nem: 25/6/2010.\n","dic":"DHBPR"}
