{"title":"FERREIRA, Bernardino","cargoss":["Ministro do Supremo Tribunal Federal"],"cargos_esp":[0],"datas_ini":[1893],"datas_fim":[1905],"estados":[0],"autor":["Eduardo Junqueira"],"content":"**FERREIRA, Bernardino**\n\n\\*magistrado; min. STF 1893-1905.\n\n*Bernardino Ferreira da Silva* nasceu em Santos (SP) em 1856, filho de\nBernardino Ferreira da Silva e de Basilissa Augusta Vieira Ferreira.\n\nApós cursar por algum tempo a Escola Militar, desistiu de seguir\ncarreira no Exército e ingressou na Faculdade de Direito de São Paulo,\nde onde saiu bacharel em ciências jurídicas e sociais em 1879. Em 1882,\nfoi nomeado juiz substituto da 2^a^ vara cível da comarca de São Paulo,\nsendo daí transferido, em junho de 1889, para o posto de delegado de\npolícia da Corte. Com o advento da República, foi nomeado, em 1892,\nchefe de polícia da capital federal, cargo que exerceu até 1893. Sua\natuação foi decisiva para a defesa do regime recém- implantado,\nprincipalmente no período conturbado de Floriano Peixoto (1891-1894), no\ncombate aos distúrbios de rua.\n\nAinda em 1893 foi nomeado ministro do Supremo Tribunal Militar, e a\nseguir, do Supremo Tribunal Federal (STF). Por decreto de 9 de novembro\nde 1894, recebeu honras de coronel do Exército. No STF, foi relator do\nhabeas corpus 300, no qual Rui Barbosa pretendia a soltura do senador\nJoão Cordeiro e outros, desterrados na ilha de Fernando de Noronha, por\ncrime de conspiração durante o estado de sítio decretado ao correr de\n1892. Por não aceitar a tese de Rui, que alegava constrangimento ilegal\npor continuarem os pacientes desterrados após término do estado de\nsítio, denegou a ordem. Foi ainda relator do inquérito criminal\ndestinado a apurar as circunstâncias do atentado ao presidente Prudente\nde Morais (1894-1898) em 1897, no qual morreu o ministro da guerra,\nmarechal Carlos Machado Bittencourt.\n\nFaleceu na cidade do Rio de Janeiro, então Distrito Federal, no dia 24\nde outubro de 1905, no exercício de suas funções no STF.\n\nEduardo Junqueira\n\n**FONTES:** MATTOSO, P. *Supremo Tribunal*; MELLO FILHO, J. *Notas*;\nRODRIGUES, L. *História*;SUP. TRIB. FED. Disponível em:\n\\<www.stf.jus.br/portal/ministros\\>.\n","ref":"**FONTES:** MATTOSO, P. *Supremo Tribunal*; MELLO FILHO, J. *Notas*;\nRODRIGUES, L. *História*;SUP. TRIB. FED. Disponível em:\n\\<www.stf.jus.br/portal/ministros\\>.\n","dic":"DHBPR"}
