{"title":"FERREIRA, Felizardo Toscano Leite","cargoss":["Deputado federal"],"cargos_esp":[0],"datas_ini":[1912],"datas_fim":[1914],"estados":["PB"],"autor":["Raimundo Helio Lopes"],"content":"**FERREIRA, Felizardo Toscano Leite**\n\n\\*dep. fed. PB 1912-1914.\n\n*Felizardo Toscano Leite Ferreira* nasceu na Paraíba, filho de João\nLeite Ferreira. Seu pai foi chefe do Partido Liberal na Paraíba durante\no Império.\n\nFormou-se em medicina e clinicou na cidade de Piancó (PB). Foi eleito\ndeputado estadual na Paraíba para diversas legislaturas e entre os anos\nde 1908 e 1910 foi presidente da Assembleia Legislativa. Em 1912 foi\neleito deputado federal. Ocupou uma cadeira na Câmara dos Deputados, no\nRio de Janeiro, então Distrito Federal, de maio desse ano até o fim da\nlegislatura, em dezembro de 1914.\n\nTambém foi membro do Instituto Histórico e Geográfico Paraibano.\n\nRaimundo Helio Lopes\n\n**FONTES:** ABRANCHES, J. *Governos*; ASSEMB. LEGISL. PARAÍBA.\nDisponível em: *\\<*www.al.pb.gov.br/\\>. Acesso em: 18/11/2010; CÂM. DEP.\n*Deputados brasileiros*; INST. HIST. GEO. PARAIBANO. Disponível em:\n\\<www.ihgp.net/fundacao2.htm\\>. Acesso em: 18/11/2010.\n","ref":"**FONTES:** ABRANCHES, J. *Governos*; ASSEMB. LEGISL. PARAÍBA.\nDisponível em: *\\<*www.al.pb.gov.br/\\>. Acesso em: 18/11/2010; CÂM. DEP.\n*Deputados brasileiros*; INST. HIST. GEO. PARAIBANO. Disponível em:\n\\<www.ihgp.net/fundacao2.htm\\>. Acesso em: 18/11/2010.\n","dic":"DHBPR"}
