{"title":"FERREIRA, João Lopes","cargoss":["Constituinte","Deputado federal"],"cargos_esp":[0,0],"datas_ini":[1891,1891],"datas_fim":[1891,1914],"estados":[0,"CE"],"autor":[0],"content":"**FERREIRA, João Lopes**\n\n\\*const. 1891; dep. fed. CE 1891-1914.\n\n*João Lopes Ferreira Filho* nasceu em Beberibe (CE) em agosto de 1854,\nfilho de João Lopes Ferreira e de Francisca de Paula Façanha Ferreira.\n\nEm seu estado natal, trabalhou na Repartição dos Correios e na\nSecretaria de Governo, e foi professor do Liceu do Ceará. Foi também\nsecretário do presidente Gama Rosa, em Santa Catarina, e de Teodureto\nSouto, no Amazonas. Estudou direito na Faculdade do Recife, mas logo\nabandonou o curso para se dedicar ao jornalismo. Defendeu a causa\nabolicionista nos jornais *O Cearense*, *Gazeta do Norte*, *Libertador*\ne *República*. No Rio de Janeiro, trabalhou nos periódicos *Tempo*,\n*Tribuna*, *Gazeta de Notícias* e *Dia*. Dirigiu também o *Correio\nMercantil*.\n\nCom o advento da República, foi indicado secretário do Interior do\ngoverno de Luís Antônio Ferraz (1889-1891) no Ceará, sendo\nposteriormente nomeado chefe intendente de Fortaleza entre janeiro e\noutubro de 1890. Eleito deputado ao Congresso Nacional Constituinte em\n15 de setembro de 1890, tomou posse em 15 de novembro seguinte,\nparticipou da elaboração da Constituição promulgada em 24 de fevereiro\nde 1891 e a partir de junho, com o início da legislatura ordinária,\nocupou uma cadeira na Câmara dos Deputados. Além de ter presidido a\nComissão de Orçamento, presidiu também a Câmara. Renovou o mandato sete\nvezes, só deixando a Câmara dos Deputados em dezembro de 1914.\n\nFaleceu no Rio de Janeiro em maio de 1928.\n\nFoi casado com Maria Amélia de Sousa, com quem teve quatro filhos.\n\nPublicou *Discurso pronunciado perante o Gabinete Cearense de Leitura na\nsessão solene de seu 2^o^ aniversário, a 2 de dezembro de 1877*.\n\nKleiton de Sousa Moraes\n\n**FONTES:** GUIMARÃES, H. *Deputados* (p.310-311); STUDART, G.\n*Dicionário* (v.1, p.494-495).\n","ref":"**FONTES:** GUIMARÃES, H. *Deputados* (p.310-311); STUDART, G.\n*Dicionário* (v.1, p.494-495).\n","dic":"DHBPR"}
