{"title":"FERREIRA, João Luís","cargoss":["Governador de estado ou do Distrito Federal","Deputado federal"],"cargos_esp":[0,0],"datas_ini":[1920,1925],"datas_fim":[1924,1927],"estados":["PI","PI"],"autor":["Raimundo Helio Lopes"],"content":"**FERREIRA, João Luís**\n\n\\*gov. PI 1920-1924; dep. fed. PI 1925-1927.\n\n*João Luís Ferreira* nasceu em Teresina no dia 23 de abril de 1881,\nfilho de Gabriel Luís Ferreira e de Maria Benedita Cândida da Conceição\nPacheco. Seu pai foi governador do Piauí em 1891 e deputado federal de\n1894 a 1895. Seu tio, Teodoro Alves Pacheco, foi senador constituinte de\n1891 pelo Piauí. Seu irmão, Félix Pacheco, foi deputado pelo Piauí de\n1909 a 1920, senador de 1921 a 1922 e ministro das Relações Exteriores\nde 1922 a 1926; além disso, dedicou-se ao jornalismo, no *Jornal do\nComércio*, e à literatura, tornando-se membro da Academia Brasileira de\nLetras; defensor da introdução no Brasil do método de identificação por\nimpressões digitais, teve seu nome dado ao Instituto de Identificação\nFélix Pacheco.\n\nFormou-se em engenharia na Escola Politécnica da cidade do Rio de\nJaneiro, então Distrito Federal, em 1901, e exerceu por muitos anos a\nprofissão de engenheiro. Foi chefe de locomoção da Estrada de Ferro\nTeresa Cristina, voltou ao Piauí como fiscal das Fazendas Nacionais,\nretornou à Região Sudeste, trabalhando no prolongamento da Estrada de\nFerro Oeste de Minas e nos estudos de levantamento para o traçado da\nEstrada de Ferro Transparaguai, e residiu por algum tempo no Paraguai e\nno estado do Paraná. No estado do Rio de Janeiro, chefiado por Sampaio\nCorreia, atuou na comissão de captação das águas do rio Xerém e foi\nnomeado por Feliciano Sodré, então prefeito de Niterói, chefe de um dos\ndistritos da cidade para a construção da rede de esgotos. Dirigiu a\nComissão de Obras Contra as Secas no Piauí e trabalhou diretamente com o\nengenheiro Aarão Reis. Trabalhou também na construção da estrada de\nrodagem que ligou as cidades piauienses de Floriano e Oeiras.\n\nIniciou sua vida política quando foi nomeado prefeito da cidade de Barra\nMansa (RJ) em 1914. Em 1920 foi eleito governador do Piauí, sucedendo a\nEurípedes Clementino de Aguiar. Sua administração foi marcada pela\nconstrução do primeiro posto de saúde da cidade de Teresina e do\nedifício da Escola Normal, pela realização do primeiro congresso das\nmunicipalidades do Piauí, pela criação da caixa beneficente dos\nservidores do estado, pelo restabelecimento da Junta Comercial, pela\ninauguração da estrada de ferro entre as cidades de Teresina e São Luís\ne do telégrafo Teresina-Rio de Janeiro, pela promulgação do Código de\nProcesso Civil e Comercial do estado e pela compra do prédio do palácio\nKarnak. Ao fim do quadriênio, em 1^o^ de julho de 1924, passou o governo\na Matias Olímpio de Melo e foi eleito deputado federal, exercendo o\nmandato de 1925 a 1927.\n\nFaleceu na cidade do Rio de Janeiro, então Distrito Federal, no dia 8 de\njulho de 1927.\n\nRaimundo Helio Lopes\n\n**FONTES:** BASTOS, C. *Dicionário*; CHAVES, J. *Apontamentos*;\nGONÇALVES, W. *Grande*; REGO NETO, H. *Fatos.*\n","ref":"**FONTES:** BASTOS, C. *Dicionário*; CHAVES, J. *Apontamentos*;\nGONÇALVES, W. *Grande*; REGO NETO, H. *Fatos.*\n","dic":"DHBPR"}
