{"title":"FIALHO, Anfrísio","cargoss":["Constituinte","Deputado federal"],"cargos_esp":[0,0],"datas_ini":[1891,1891],"datas_fim":[1891,1893],"estados":[0,"PI"],"autor":["Raimundo Helio Lopes"],"content":"**FIALHO, Anfrísio**\n\n\\* const. 1891; dep. fed. PI 1891-1893.\n\n*Anfrísio Fialho* nasceu no Piauí, filho do tabelião Francisco José\nFialho.\n\nIngressou no Exército e fez o curso de artilharia, chegando a\nsegundo-tenente em 1860, a primeiro-tenente em 1865 e a capitão no ano\nseguinte. Participou da Guerra do Paraguai (1864-1870) e foi condecorado\npor seus feitos. Abandou depois disso as forças armadas, mudou-se para a\nEuropa e, na Bélgica, formou-se em ciências políticas e administrativas.\nEm Bruxelas publicou em 1876 *Dom Pedro, Empereur du Brésil*.\n\nDepois de proclamada a República (15/11/1889) no Brasil, foi eleito\ndeputado constituinte pelo Piauí em setembro de 1890 e assumiu o mandato\nem 15 de novembro seguinte, quando foi instalada a Assembleia Nacional\nConstituinte no Rio de Janeiro. Promulgada a nova Carta constitucional\nem fevereiro de 1891, e iniciada a legislatura ordinária em junho\nseguinte, passou a ocupar uma cadeira na Câmara dos Deputados, até\ndezembro de 1893.\n\nAlém da obra citada, publicou *Planos das operações aliadas na Guerra do\nParaguai de abril a setembro de 1869* e *História da fundação da\nRepública no Brasil.*\n\nRaimundo Helio Lopes\n\n**FONTES:** ABRANCHES, J. *Governos*; CÂM. DEP. *Deputados brasileiros.*\n","ref":"**FONTES:** ABRANCHES, J. *Governos*; CÂM. DEP. *Deputados brasileiros.*\n","dic":"DHBPR"}
