{"title":"FIGUEIREDO JÚNIOR, Joaquim de","cargoss":["Ministro do Supremo Tribunal Federal"],"cargos_esp":[0],"datas_ini":[1895],"datas_fim":[1897],"estados":[0],"autor":["Eduardo Junqueira"],"content":"**FIGUEIREDO JÚNIOR, Joaquim de**\n\n\\*magistrado; min. STF 1895-1897.\n\n*Joaquim Antunes de Figueiredo Júnior* nasceu em Araruama (RJ) no dia 9\nde agosto de 1844, filho de Joaquim Antunes de Figueiredo.\n\nGraduou-se em ciências jurídicas e sociais na Faculdade de Direito de\nSão Paulo em 1864. Depois de breve período dedicado à advocacia e ao\njornalismo, ingressou na magistratura, em 1867, ao ser nomeado juiz\nmunicipal do termo de Araruama. Foi removido para a comarca de Cabo Frio\nem julho de 1869. Em 1871, deixou a magistratura e transferiu-se para\nJuiz de Fora, na província de Minas Gerais, onde se dedicou à sua banca\nde advocacia e ao jornalismo. Proclamado o regime republicano, voltou em\n1892 ao agora estado do Rio de Janeiro, sendo nomeado secretário das\nFinanças pelo presidente estadual recém-eleito José da Porciúncula.\nRevelou-se então um excepcional adepto da causa republicana, em período\nparticularmente conturbado pelo medo da restauração monárquica. Foi,\nainda, aliado do governo Floriano Peixoto (1891-1894) durante a Revolta\nda Aramada deflagrada em 6 de setembro de 1893, fato que lhe valeu\nreceber, em agosto de 1894, as honras de coronel do Exército.\n\nEm novembro de 1895, foi nomeado ministro do Supremo Tribunal Federal\n(STF), em vaga decorrente da aposentadoria de Anfilófio Botelho Freire\nde Carvalho. Foi o segundo ministro nomeado para o STF pelo presidente\nPrudente de Morais (1894-1898). Tomou posse em dezembro do mesmo ano, e\nfoi designado procurador geral da República em agosto de 1897, quando o\nocupante do cargo era escolhido entre os membros do STF. Pediu\nexoneração do cargo de ministro ainda em 1897, para se dedicar à\nadvocacia.\n\nColaborou na *Revista do Direito* e em outros periódicos, produzindo\ntrabalhos de grande valor.\n\nFaleceu na cidade de Niterói no dia 19 de abril de 1917.\n\nEduardo Junqueira\n\n**FONTES:** MATTOSO, P. *Supremo Tribunal*; MELLO FILHO, J. *Notas*;\nRODRIGUES, L. *História*; SUP. TRIB. FED. Disponível em:\n\\<www.stf.jus.br/portal/ministros\\>.\n","ref":"**FONTES:** MATTOSO, P. *Supremo Tribunal*; MELLO FILHO, J. *Notas*;\nRODRIGUES, L. *História*; SUP. TRIB. FED. Disponível em:\n\\<www.stf.jus.br/portal/ministros\\>.\n","dic":"DHBPR"}
