{"title":"FIGUEIREDO, Francisco de","cargoss":["Deputado federal"],"cargos_esp":[0],"datas_ini":[1891],"datas_fim":[1893],"estados":["DF"],"autor":["Evelyn Morgan Monteiro Paiva"],"content":"**FIGUEIREDO, Francisco de**\n\n\\*dep. fed. DF 1891-1893.\n\n*Francisco de Figueiredo*, futuro *conde de Figueiredo*, nasceu no Rio\nde Janeiro, à época capital do Império*,* em 15 de novembro de 1843,\nfilho do comendador José Antônio de Figueiredo Júnior, português natural\ndo Porto, e de Joaquina Carlota Pena de Figueiredo, natural do Rio de\nJaneiro.\n\nAos 13 anos completou o curso de humanidades e foi trabalhar no comércio\ncom o pai. Assumiu a gerência de um dos estabelecimentos comerciais da\nfamília ao completar 18 anos. Em 1879 tornou-se presidente da Companhia\nNacional de Paquetes a Vapor e, por seus préstimos na seca que atingiu o\nCeará, recebeu o título de visconde de Figueiredo por decreto imperial\nde 10 de julho daquele ano. Foi presidente do Banco do Brasil e fundador\nde dois outros bancos, ambos no Rio de Janeiro: o Banco Internacional do\nBrasil, criado em 1886, e o Banco Nacional do Brasil, fundado em 1889.\nTambém por decreto imperial, em 31 de outubro de 1889 foi elevado a\nconde de Figueiredo.\n\nJá no período republicano, exerceu o mandato de deputado pelo Distrito\nFederal de 3 de maio de 1891 a 31 de dezembro de 1893.\n\nOficial da Ordem da Rosa e comendador da Ordem de Nossa Senhora da\nConceição de Vila Viçosa, de Portugal, foi sócio do Instituto Histórico\ne Geográfico do Brasil.\n\nFaleceu em Paris em 25 de janeiro de 1917.\n\nFoi casado em segundas núpcias com Luísa Bernarda de Figueiredo,\ncondessa de Figueiredo.\n\nPublicou *Estatutos do Banco Internacional do Brasil* (1886); *Estatutos\ndo Banco Nacional do Brasil* (1889); *Allocution prononcée par le\nprésident du conseil de l´administration de la Banque Nationale du\nBrésil à la reunion des actionaires résidents en France le février*\n(1890).\n\nEvelyn Morgan Monteiro Paiva\n\n**FONTES:** BARATA, C.; BUENO; A. *Dicionário* (v.1); BLAKE, A.\n*Diccionario*; CÂM. DEP. *Deputados brasileiros.*\n","ref":"**FONTES:** BARATA, C.; BUENO; A. *Dicionário* (v.1); BLAKE, A.\n*Diccionario*; CÂM. DEP. *Deputados brasileiros.*\n","dic":"DHBPR"}
