{"title":"FLORES, Tomás","cargoss":["Constituinte","Deputado federal"],"cargos_esp":[0,0],"datas_ini":[1891,1891],"datas_fim":[1891,1893],"estados":[0,"RS"],"autor":["Raimundo Helio Lopes"],"content":"**FLORES, Tomás**\n\n\\*militar; const. 1891; dep. fed. RS 1891-1893.\n\n*Tomás Thompson Flores* nasceu em Porto Alegre no dia 10 de janeiro de\n1852.\n\nAssentou praça aos 14 anos para servir na Guerra do Paraguai\n(1864-1870), de onde voltou com o posto de Alferes. Pela participação\nnesse conflito, ganhou medalhas conferidas pelos governos do Brasil e da\nArgentina. Foi promovido a tenente em maio de 1878 e a capitão em abril\nde 1883. Cursou a Escola Militar, concluindo o curso de Infantaria e\nCavalaria em 1883.\n\nDepois de proclamada a República (15/11/1889), chegou ao posto de major\nem janeiro de 1890 e a tenente-coronel em março do mesmo ano. Em\nsetembro desse ano foi eleito deputado federal constituinte pelo estado\ndo Rio Grande do Sul na legenda do Partido Republicano Rio-Grandense\n(PRR), então liderado por Júlio de Castilhos. Assumiu sua cadeira em 15\nde novembro de 1890, quando foi instalada a Assembleia Nacional\nConstituinte (ANC) no Rio de Janeiro. Durante os trabalhos de elaboração\nda primeira Constituição republicana do país, fez oposição ao presidente\nDeodoro da Fonseca (1889-1891). Promulgada a nova Carta constitucional\nem 24 de fevereiro de 1891, em junho seguinte assumiu sua cadeira na\nCâmara dos Deputados no Rio de Janeiro, agora Distrito Federal, para\ncumprir o seu mandato ordinário, até o ano de 1893. Ainda em 1891 chegou\nao posto de coronel e, por decreto de julho desse ano, foi nomeado\ncomandante do 6^o^ Distrito Militar.\n\nEm novembro de 1891, com a chegada à presidência do marechal Floriano\nPeixoto (1891-1894), o poder no estado do Rio Grande do Sul foi entregue\na uma junta governativa e, posteriormente, a José Antônio Correia da\nCâmara, o visconde de Pelotas (1892), que, por sua vez, foi deposto em\njunho de 1892 por um movimento articulado por Júlio de Castilhos. Esse\nmovimento teve o apoio militar de Tomás Thompson Flores, ainda deputado\nfederal, e do marechal Falcão da Frota.\n\nApós concluir seu mandato de deputado federal em dezembro de 1893,\ncontinuou sua carreira militar e tornou-se comandante do 13^o^ Batalhão\nde Infantaria. Integrado a essa divisão, participou da Guerra de Canudos\n(1896-1897), rebelião popular de cunho messiânico, liderada por Antônio\nConselheiro, iniciada no sertão baiano em novembro de 1896. O governo\nenviou sucessivas expedições militares para debelar o movimento, até\nesmagá-lo em outubro de 1897. Foi um dos líderes de uma dessas\nexpedições e tornou-se comandante interino da Brigada de Cláudio do\nAmaral Savaget, quando este foi ferido em combate. Passou a liderar a\n7^a^ Brigada e, segundo Euclides da Cunha, “era um lutador de primeira\nordem. Embora lhe faltassem atributos essenciais de comando e,\nprincipalmente, a serenidade de ânimo, que permite a concepção fria das\nmanobras dentro do afogueamento de um combate, sobravam-lhe coragem a\ntoda prova e um quase desprezo pelo antagonista, por mais temeroso e\nforte, que o tornavam incomparável na ação”. Ainda segundo Euclides da\nCunha, Tomás Flores, em um dos combates, tomou a frente de sua brigada\npara “pessoalmente ordenar a linha de fogo. Por um requinte dispensável,\nde bravura, não arrancara dos punhos os galões que o tornavam alvo\npredileto dos jagunços. Ao reatar-se, logo depois, a avançada, baqueou,\nferido em pleno peito, morto”.\n\nFaleceu, assim, em Canudos (BA) no dia 22 de junho de 1897.\n\nRaimundo Helio Lopes\n\n**FONTES:** ABRANCHES, J. *Governos*; AITA, C.; AXT, G.; ARAÚJO, V.\n*Parlamentares*; CÂM. DEP. *Deputados brasileiros*; CUNHA, E. *Sertões*;\nMcCANN, F. *Soldados.*\n","ref":"**FONTES:** ABRANCHES, J. *Governos*; AITA, C.; AXT, G.; ARAÚJO, V.\n*Parlamentares*; CÂM. DEP. *Deputados brasileiros*; CUNHA, E. *Sertões*;\nMcCANN, F. *Soldados.*\n","dic":"DHBPR"}
