{"title":"FONSECA, Bento Borges da","cargoss":["Deputado federal"],"cargos_esp":[0],"datas_ini":[1912],"datas_fim":[1914],"estados":["PE"],"autor":["Raimundo Helio Lopes"],"content":"**FONSECA, Bento Borges da**\n\n\\*dep. fed. PE 1912-1914.\n\n*Bento Borges da Fonseca* nasceu em Pernambuco.\n\nFormou-se em ciências jurídicas e sociais. Depois de formado, dedicou-se\na atividades industriais e passou a morar na cidade do Rio de Janeiro,\nentão Distrito Federal.\n\nEm 1910 apoiou a candidatura de Hermes da Fonseca à presidência da\nRepública e no ano seguinte, a de Dantas Barreto ao governo\npernambucano. Por essa articulação política, foi eleito deputado federal\npor Pernambuco em 1912. Assumindo sua cadeira na Câmara dos Deputados,\nno Rio de Janeiro, em maio desse ano, nela permaneceu até dezembro de\n1914, quando se encerraram seu mandato e a legislatura.\n\nRaimundo Helio Lopes\n\n**FONTES:** ABRANCHES, J. *Governos*; CÂM. DEP. *Deputados brasileiros.*\n","ref":"**FONTES:** ABRANCHES, J. *Governos*; CÂM. DEP. *Deputados brasileiros.*\n","dic":"DHBPR"}
