{"title":"FONSECA, João Elísio de Castro","cargoss":["Deputado federal"],"cargos_esp":[0],"datas_ini":[1915],"datas_fim":[1930],"estados":["PE"],"autor":["Raimundo Helio Lopes"],"content":"**FONSECA, João Elísio de Castro**\n\n\\*dep. fed. PE 1915-1930.\n\n*João Elísio de Castro Fonseca* nasceu em São José (SC), filho de\nAugusto Elísio de Castro Fonseca e de Maria Rita de Aguiar Fonseca.\n\nSeu pai foi juiz municipal na cidade de Codó (MA), o que fez sua família\nse transferir para o Maranhão quando ainda era criança. Aí iniciou os\nestudos, mas logo depois acompanhou a família, que se mudou para\nPernambuco e se estabeleceu em Recife. Em março de 1879 ingressou na\nFaculdade de Direito do Recife e em 1883 bacharelou-se. No ano seguinte\nfoi nomeado promotor público em Manaus. Permaneceu pouco meses no cargo\npor ter sido nomeado chefe de seção da Secretaria de Governo da\nprovíncia do Amazonas, posto que ocupou até o ano de 1885. Voltou então\npara Pernambuco, onde advogou e lecionou. Em 1889 recebeu o grau de\ndoutor pela Faculdade de Direito do Recife e em 1890 foi nomeado\nprofessor substituto da mesma faculdade. No ano seguinte, tornou-se\nprofessor catedrático de teoria do processo civil, comercial e criminal.\n\nEm 1901 foi eleito deputado estadual em Pernambuco. Assumindo sua\ncadeira na Assembleia Legislativa, foi reeleito para mais duas\nlegislaturas. Durante esses anos foi líder da bancada que apoiou os\ngovernos estaduais ligados à facção política liderada por Francisco de\nAssis Rosa e Silva. Permaneceu na Assembleia estadual até 1909 e no ano\nseguinte foi eleito senador estadual. Foi reeleito em 1913 e nessa\nsegunda legislatura, que se estenderia até 1915, fez oposição ao governo\nde Dantas Barreto.\n\nEm 1915 foi eleito deputado federal por Pernambuco. Assumiu sua cadeira\nna Câmara dos Deputados, no Rio de Janeiro, então Distrito Federal, em\nmaio desse ano e foi reeleito para as legislaturas subsequentes.\nPermaneceu na Câmara até outubro de 1930, quando da vitória da revolução\nque levou Getúlio Vargas ao poder e extinguiu todos os órgãos\nlegislativos do país.\n\nNo campo jornalístico, colaborou com os periódicos *Folha do Norte*,\n*Opinião*, *Jornal do Recife* e *Pernambuco,* todos na capital\npernambucana. Foi um dos fundadores do jornal *Estado de* *Pernambuco*.\n\nPublicou *Interpretação das leis*, *Erro e ignorância do direito*,\n*Diferença entre a* *guerra continental e marítima*, *Adoção em nosso\ndireito* e *Fundamento da propriedade*.\n\n*Raimundo Helio Lopes*\n\n**FONTES:** ABRANCHES, J. *Governos*; CÂM. DEP. *Deputados brasileiros*;\nLEVINE, R. *Velha.*\n","ref":"**FONTES:** ABRANCHES, J. *Governos*; CÂM. DEP. *Deputados brasileiros*;\nLEVINE, R. *Velha.*\n","dic":"DHBPR"}
