{"title":"ALVES, Honorato José","cargoss":["Deputado federal"],"cargos_esp":[0],"datas_ini":[1906],"datas_fim":[1929],"estados":["MG"],"autor":["Luciana Pinheiro"],"content":"**ALVES, Honorato José**\n\n\\* dep. fed. MG 1906-1929.\n\n*Honorato José Alves* nasceu em Diamantina(MG) no dia 10 de novembro de\n1868,filho de Marciano José Alves e deAntônia Josefina de Oliveira\nAlves. Seuirmão João José Alves foi vereador, presidenteda Câmara\nMunicipal e agente executivoem Montes Claros (MG), além de\nconstituinteem 1934 e deputado federal em 1935.\n\nMédico formado pela Faculdade deMedicina do Rio de Janeiro, iniciou\nacarreira profissional clinicando em Montes Claros.Em 1893 elegeu-se\nvereador e logo emseguida assumiu a presidência da CâmaraMunicipal. No\ndecorrer de 1894, tornou-seagente executivo (prefeito) da cidade. Em1903\nfoi eleito deputado estadual e exerceuo mandato por um triênio.\n\nEm março de 1906 foi eleitodeputado federal por Minas Gerais e emmaio\nseguinte tomou posse na Câmara dosDeputados, no Rio de Janeiro, então\nDistritoFederal. Eleito para outras sete legislaturas,exerceu o mandato\nde deputado federalaté dezembro de 1929. No decorrer desseperíodo\nintegrou a Comissão de Obras Públicasda Câmara (1922-1924).\n\nFoi também fundador e redator doperiódico oficial *Montes Claros*. Como\nmédico,participou ativamente da criação da FaculdadeLivre de Medicina em\nBelo Horizonte, naqual inaugurou a cátedra de oftalmologia.Na capital\nmineira integrou ainda o Conselhode Saúde Pública.\n\nFaleceu no Rio de Janeiro em27 de novembro de 1948.\n\nEra casado com Violeta Melo FrancoAlves, filha de Virgílio Martins de\nMeloFranco, deputado provincial no Império esenador estadual em Minas\nentre 1892 e1923. Seu cunhado, o diplomata e professorAfrânio de Melo\nFranco, exerceu diversosmandatos como deputado estadual e federalpor\nMinas Gerais, foi ministro da Viaçãoe Obras Públicas (1918-1919) e\nministrodas Relações Exteriores (1930-1933). Seu filhoMárcio de Melo\nFranco Alves foi prefeitodo município fluminense de Petrópolis (RJ)e\nsecretário de Finanças do estado daGuanabara no governo Negrão de Lima\n(1966-1971).Seu neto Márcio Emanuel Moreira Alvesfoi deputado federal\npelo Rio de Janeirode 1967 a 1968, além de conhecidojornalista e\nescritor.\n\nLuciana Pinheiro\n\n**FONTES:**CÂM. DEP. *Deputados brasileiros* (p.112); MarcioMoreira\nAlves. Disponível em: \\<www.marciomoreiraalves.com/quem.htm\\>.Acesso em:\n16/8/2010; MONTEIRO, N. *Dicionário* (v.1, p. 23-24, 269-270, 273-274);\nPLANALTO.Disponível em: \\<www.planalto.gov.br/\\>. Acessoem: 16/8/2010.\n","ref":"**FONTES:**CÂM. DEP. *Deputados brasileiros* (p.112); MarcioMoreira\nAlves. Disponível em: \\<www.marciomoreiraalves.com/quem.htm\\>.Acesso em:\n16/8/2010; MONTEIRO, N. *Dicionário* (v.1, p. 23-24, 269-270, 273-274);\nPLANALTO.Disponível em: \\<www.planalto.gov.br/\\>. Acessoem: 16/8/2010.\n","dic":"DHBPR"}
