{"title":"FONTENELE, Oscar Pena","cargoss":["Deputado federal"],"cargos_esp":[0],"datas_ini":[1928],"datas_fim":[1930],"estados":["RJ"],"autor":[0],"content":"**FONTENELE, Oscar Pena**\n\n\\* dep. fed. RJ 1928-1930.\n\n*Oscar Pena Fontenele* foi eleito deputado federal pelo estado do Rio de\nJaneiro e exerceu o mandato de 9 de maio de 1928 a 31 de dezembro de\n1929. Novamente eleito em 1930, teve o mandato interrompido em outubro\npela revolução que levou Getúlio Vargas ao poder e extinguiu os órgãos\nlegislativos do país.\n\nEm 1946, já no governo de Eurico Gaspar Dutra (1946-1951), foi diretor\ndo Departamento Nacional de Informações (DNI), que desde maio de 1945\nsubstituíra o Departamento de Imprensa e Propaganda (DIP), criado por\nVargas. O DNI esteve, inicialmente, subordinado ao Ministério da Justiça\ne Negócios Interiores. Era composto por quatro divisões, e todo o seu\nquadro de funcionários fora transferido do antigo DIP, assim como\nalgumas de suas atribuições, como a de executar a censura\ncinematográfica no Brasil. O DNI só foi extinto meses depois da posse do\npresidente Dutra.\n\nIzabel Pimentel da Silva\n\n**FONTES:** CÂM. DEP. *Deputados brasileiros*; PEROSA, L. *Hora*; SIMIS,\nA. *Estado*.\n","ref":"**FONTES:** CÂM. DEP. *Deputados brasileiros*; PEROSA, L. *Hora*; SIMIS,\nA. *Estado*.\n","dic":"DHBPR"}
