{"title":"ALVES, João Luís","cargoss":["Deputado federal","Senador","Ministro da Justiça","Ministro do Supremo Tribunal Federal"],"cargos_esp":[0,0,0,0],"datas_ini":[1903,1909,1922,1924],"datas_fim":[1908,1918,1924,1925],"estados":["MG","ES",0,0],"autor":["Eduardo Junqueira"],"content":"**ALVES, João Luís**\n\n\\* dep. fed. MG 1903-1908;sen. ES 1909-1918; min. Just. 1922-1924;min.\nSTF 1924-1925.\n\nJoão Luís Alves nasceu em Juizde Fora (MG) no dia 23 de maiode 1870,\nfilho de João Luís Alvese de Bárbara Horta Barbosa Alves.\n\nBacharel em ciências jurídicas esociais pela Faculdade de Direito de\nSãoPaulo em novembro de 1889, regressou aMinas Gerais para, no ano\nseguinte, iniciarcarreira na magistratura, ao ser nomeadopromotor\npúblico e curador de órfãos dacomarca do Rio Verde. Em março de1891, foi\nnomeado juiz municipal e deórfãos do termo de Campanha, permanecendono\ncargo até junho de 1892. Aindanesse ano, após pequena reforma da\njustiçaestadual, foi nomeado juiz substituto dacomarca de Alfenas, cargo\nque exerceupor pouquíssimo tempo, em função de haverretornado a\nCampanha, cidade que fora,no passado, importante centro de\nexploraçãoaurífera.\n\nEm Campanha, afastou-se da magistraturae passou a se dedicar à\nadvocaciae a negócios particulares, além de ministrarcurso sobre\nlegislação de terras na escolade agrimensura local. Eleito prefeito\nparao triênio 1898-1900, foi concomitantemente inspetorda Instrução\nPública do município. Ligadoao grupo de Silviano Brandão, presidentede\nMinas de 1898 a 1902, foi eleitodeputado ao Congresso estadual e\nexerceuo mandato de junho de 1899 a dezembrode 1902. Em 1903 foi eleito\ndeputadogeral por Minas, e em 1906 renovouo mandato na Câmara dos\nDeputados, atédezembro de 1908.\n\nComo seu nome já despontasse comalguma evidência no cenário político\nnacional,depois de deixar a Câmara, elegeu-se senadorpelo estado do\nEspírito Santo em 1908,sendo reconduzido em 1912. Em dezembrode 1918,\nrenunciou ao mandato no Senadopara assumir a Secretaria de Finançasdo\ngoverno de Artur Bernardes em MinasGerais, onde permaneceu de janeiro\nde1919 a setembro de 1922. Eleito Bernardespara a presidência da\nRepública, retornouà capital federal a fim de assumira pasta da Justiça\ne Negócios Interiores.\n\nSem ser um literato, mas ligadoà justiça e ao estudo das leis,foi eleito\npara a Academia Brasileirade Letras em 1923. Ocupou a cadeira11, cujo\nantecessor fora o poeta, magistradoe educador Eduardo Ramos. Em\ndezembrodo ano seguinte foi nomeado pelo presidenteArtur Bernardes, a\nquem era ligado porlaços políticos e de amizade, ministrodo Supremo\nTribunal Federal (STF), navaga surgida com o falecimento de\nHermínioFrancisco do Espírito Santo. Deixou acorte em 1925 por problemas\nde saúde.Em viagem pela Europa para tratamentoda saúde, faleceu em Paris\nno dia15 de novembro desse ano.\n\nAo longo da carreira foi tambémlente de direito comercial da Faculdadede\nDireito de Belo Horizonte e membrodo Instituto Histórico e Geográfico\nBrasileiro.\n\nDe sua vasta obra, dispersa emvárias publicações especializadas do campo\njurídico,destacam-se “O estado de guerra e oestado de sítio” (1907),\n“Comentários doCódigo Civil” e “Código Civil Anotado”(1917), as duas\núltimas largamente utilizadascomo fonte doutrinária.\n\nEduardo Junqueira\n\n**FONTES:** MELLO FILHO, J. *Notas*;*Supremo Tribunal*; SENADO.\nDisponível em: \\<www.senado.gov.br/senadores/\\>.\n","ref":"**FONTES:** MELLO FILHO, J. *Notas*;*Supremo Tribunal*; SENADO.\nDisponível em: \\<www.senado.gov.br/senadores/\\>.\n","dic":"DHBPR"}
