{"title":"FRANCO, Afrânio de Melo","cargoss":["Deputado federal","Ministro da Viação e Obras Públicas","Deputado federal","Embaixador do Brasil - Liga","Deputado federal","Revolucionário ou revoltoso","Ministro das Relações Exteriores"],"cargos_esp":[0,0,0,"das Nações",0,0,0],"datas_ini":[1906,1918,1920,1924,1927,1930,1930],"datas_fim":[1918,1919,1923,1926,1929,1930,1933],"estados":["MG",0,"MG",0,"MG",0,0],"autor":["Paulo Brandi"],"content":"**FRANCO, Afrânio de Melo**\n\n\\*dep. fed. MG 1906-1918; min. Viação 1918-1919; dep. fed. MG 1920-1923;\nemb. Bras. Liga das Nações 1924-1926; dep. fed. MG 1927-1929; rev. 1930;\nmin. Rel. Ext. 1930-1933.\n\n*Afrânio de Melo Franco* nasceu em Paracatu (MG) no dia 25 de fevereiro\nde 1870, filho de Virgílio Martins de Melo Franco e de Ana Leopoldina de\nMelo Franco. Era descendente de Francisco de Melo Franco, escritor e\nmédico de renome que iniciou a tradição política e literária da família,\nautor da obra *O reino da estupidez*, e considerado o primeiro\npuericultor brasileiro. Sua avó paterna, Antônia de Melo Franco, era\nirmã de Manuel de Melo Franco, um dos líderes da Revolução Liberal de\n1842 em Minas e deputado geral no Império, assim como seus irmãos\nBernardo e Francisco de Melo Franco. Seu avô paterno, o tenente José\nMartins Ferreira, era proprietário de minas já decadentes na região de\nParacatu. Seus avós maternos, João Crisóstomo Pinto da Fonseca Júnior e\nFranklina Pimentel Barbosa, pertenciam a famílias de projeção política\nem Paracatu, rivais dos Melo Franco no tempo do Império. Seu pai foi\nmagistrado em várias cidades de Minas e Goiás, deputado provincial e\ngeral e, na República, senador estadual em Minas de 1892 a 1923. Afonso\nArinos de Melo Franco, seu irmão mais velho e homônimo de seu filho, foi\nescritor da escola regionalista, autor de *Pelo sertão* e membro da\nAcademia Brasileira de Letras.\n\nFGV/CPDOC\n\n![Descrição:\nhttp://www.novocpdoc.fgv.br/accessus/fotos/AA/AAFOTO001\\_2.jpg](FRANCO,%20Afr%c3%a2nio%20de%20Melo_arquivos/image001.jpg)\n\nAfrânio de Melo Franco (à direita).\n\nAfrânio fez os estudos básicos no Colégio da Conceição, em São João del\nRei, e no Colégio Abílio, em Barbacena, municípios de seu estado natal.\nEm 1887, ingressou na Faculdade de Direito de São Paulo, com o nome de\nAfrânio Camorim Jacaúna de Otingi, seguindo, por imposição do pai, uma\ntradição liberal e maçônica de adoção de nomes indígenas. Na faculdade\naderiu à causa republicana, junto com seu colega de turma Antônio Carlos\nRibeiro de Andrada, futuro presidente de Minas. Foi também membro da\nBucha*,* organização secreta de estudantes que prosperou na Faculdade de\nDireito de São Paulo na segunda metade do século XIX e que teve\nimportante papel na política paulista, inclusive na fase republicana. O\nnome da entidade surgiu da corruptela de *Burschenschaft*, corporação de\nestudantes alemã.\n\nIniciou sua vida pública em 1890, primeiro ano da República, quando,\nainda estudante, exerceu interinamente o cargo de promotor em Ouro\nPreto, na época capital de Minas. Em 1891, formou-se em direito e foi\nnomeado promotor em Queluz, atual Conselheiro Lafaiete (MG), pelo\npresidente estadual José Cesário de Faria Alvim, pai de Sílvia Cesário\nAlvim, com quem iria casar-se dois anos mais tarde. De volta a Ouro\nPreto em 1892, participou da fundação da Faculdade de Direito de Minas\nGerais, junto com seu pai, seu irmão Afonso Arinos e figuras destacadas\nda elite política mineira. Em 1894, foi removido para a promotoria de\nJuiz de Fora, sendo nomeado em março do ano seguinte procurador\nseccional da República em Minas pelo presidente Prudente de Morais.\n\nEm janeiro de 1896, foi designado secretário da legação do Brasil em\nMontevidéu, onde serviu até junho do ano seguinte. Nessa primeira fase\nde sua carreira diplomática, serviu também em Bruxelas, capital da\nBélgica, nos últimos meses de 1897. Extinto o cargo que ocupava,\nretornou ao Brasil em 1898, instalando-se como advogado em Belo\nHorizonte, nova capital de Minas, inaugurada no ano anterior.\n\nA eleição de Francisco Sales para a presidência de Minas em 1902\nfavoreceu a ascensão de Melo Franco na vida política estadual e\nnacional. Sales promoveu a reconciliação com os seguidores de Cesário\nAlvim e incluiu Melo Franco na chapa de candidatos do Partido\nRepublicano Mineiro (PRM), dominante no estado, às eleições de 1902 para\na Câmara Estadual.\n\nComo deputado estadual, com mandato entre 1903 e 1905, Melo Franco\ndestacou-se por seu trabalho na reforma constitucional e legislativa de\nMinas. As reformas colocaram a Justiça Estadual sob a dependência quase\nabsoluta do Poder Executivo estadual (contrariamente às teses de Melo\nFranco) e também reduziram a autonomia dos municípios mineiros,\ncompletando o processo de consolidação da estrutura de dominação\noligárquica no estado. Durante seu mandato, Melo Franco dedicou-se\ntambém ao magistério, como professor do Ginásio Mineiro e, a partir de\n1904, da Faculdade de Direito de Minas.\n\nEm 1906, foi eleito para a Câmara dos Deputados, onde passou a integrar\na Comissão de Diplomacia e Tratados. Na época, já se encontrava\nplenamente implantada a chamada “política dos governadores”, introduzida\nem 1900 pelo presidente Manuel de Campos Sales. Sob sua égide, Minas e\nSão Paulo, aliados durante quase toda a Primeira República, controlaram\na vida política nacional, assegurando aos governos federais o apoio\ndisciplinado de suas bancadas no Congresso e recebendo em troca a\ngarantia de autonomia estadual e o direito de controlar as nomeações\nfederais nos estados.\n\nEm 1909, Melo Franco foi reeleito deputado federal, sendo novamente\nreconduzido à Comissão de Diplomacia. Integrado à máquina do partido\noficial de Minas, apoiou a candidatura vitoriosa do marechal Hermes da\nFonseca nas eleições presidenciais de 1910. Esteve praticamente ausente\ndo Congresso em 1911, ano em que viajou com a família pela Europa. Não\nobstante, foi reeleito em 1912, passando a atuar na Comissão de\nConstituição e Justiça da Câmara, onde se posicionaria várias vezes nos\nanos seguintes contra as intervenções federais nos estados, notadamente\nnos casos do Ceará (1914), Rio de Janeiro (1916), e Piauí (1920).\n\nNa Câmara eleita em 1915, Melo Franco foi relator geral do projeto de\nCódigo Civil Brasileiro, de autoria de Clóvis Bevilacqua, sancionado em\njaneiro de 1916 pelo presidente Venceslau Brás. Em agosto de 1917,\nviajou a La Paz como representante do Brasil na posse do presidente da\nBolívia, José Gutierrez Guerra. Terminada a missão, visitou Santiago,\nBuenos Aires e Montevidéu, onde foi recebido pelos governos locais. Em\nnovembro, logo após a entrada do Brasil na Primeira Guerra Mundial, foi\nredator da Lei de Guerra, solicitada por Venceslau Brás ao Congresso.\n\nA “Regência Melo Franco” (1919) e a Eleição de Artur Bernardes (1922)\n\nReeleito mais uma vez em 1918, Melo Franco renunciou ao mandato para\nassumir em setembro a Secretaria de Finanças do novo governo de Minas,\nchefiado por Artur Bernardes. Pouco depois, foi escolhido para o\nMinistério da Viação e Obras Públicas por Francisco Rodrigues Alves,\npresidente da República de 1902 a 1906, eleito pela segunda vez em 1918.\nDessa vez, contudo, Rodrigues Alves não chegou a assumir a presidência\npor motivo de saúde. Em seu lugar, o vice-presidente eleito Delfim\nMoreira tomou posse, efetivando a nomeação de Melo Franco na pasta da\nViação em 15 de novembro de 1918. Nesse ínterim, Melo Franco perdeu a\nmulher e o filho Cesário, vítimas da epidemia de gripe espanhola que\nassolou o Brasil.\n\nEm janeiro de 1919, com a morte de Rodrigues Alves, foram convocadas\nnovas eleições presidenciais. Delfim Moreira, também afetado por\nproblemas de saúde, apoiou-se basicamente na ação de Melo Franco até o\nfinal de seu mandato interino, em julho de 1919. Foi o período chamado\nno Congresso de “Regência Republicana”, durante o qual Melo Franco\nexerceu praticamente as funções de primeiro-ministro. Na pasta da\nViação, sua gestão foi marcada principalmente pela encampação da Estrada\nde Ferro Teresópolis.\n\nCom a posse do novo presidente Epitácio Pessoa, Melo Franco foi\nsubstituído por José Pires do Rio no ministério em 29 de julho de 1919,\ne em outubro do mesmo ano viajou a Washington como delegado do Brasil à\nI Conferência Internacional do Trabalho promovida pela Liga das Nações,\norganização internacional criada após o término da Primeira Guerra\nMundial pelo Tratado de Paz de Versalhes. Em dezembro, antes de seu\nretorno ao Brasil, voltou a ser eleito deputado federal na vaga de João\nPandiá Calógeras, convidado a ocupar o Ministério da Guerra.\n\nNo início de 1920, assumiu a liderança do PRM na Câmara, tendo como\nprincipal missão assegurar o êxito da candidatura de Artur Bernardes à\nsucessão presidencial de 1922. Exerceu a liderança em estreita ligação\ncom Bernardes, atuando como mediador no conflito entre São Paulo e o\ngoverno federal a respeito da política financeira de Epitácio Pessoa.\nReeleito em 1921, renunciou à liderança do PRM em maio, deixando ao\nsenador Raul Soares a coordenação da campanha de Bernardes. A disputa\npelo cargo de vice-presidente provocou a união da Bahia, Pernambuco, Rio\nde Janeiro e Rio Grande do Sul no movimento da Reação Republicana, que\nlançou a chapa oposicionista Nilo Peçanha-José Joaquim Seabra.\n\nNo fim de 1921, Melo Franco dedicou-se a comprovar a falsidade dos\ndocumentos atribuídos a Artur Bernardes e ofensivos ao Exército,\npublicados em outubro no jornal carioca *Correio da Manhã,* com a\nfinalidade de incompatibilizar o candidato com as forças armadas. Em\njaneiro de 1922, por sugestão de Bernardes, os documentos foram levados\npor Virgílio de Melo Franco, filho de Afrânio, ao exame de peritos\nsuíços e italianos, que comprovaram a falsificação. Àquela altura já se\nhavia cristalizado forte movimento de oposição militar a Bernardes, que,\nmesmo assim, foi vitorioso no pleito de março de 1922.\n\nEm 5 de julho, irrompeu no Rio e em Mato Grosso uma rebelião militar,\nrapidamente sufocada, em protesto contra esse resultado, levando a\nCâmara a aprovar no fim do mês a proposta de Melo Franco no sentido de\nprorrogar o estado de sítio a fim de garantir a posse, em novembro, do\npresidente eleito. Bernardes governaria sob permanente estado de sítio,\nreprimindo duramente o movimento de oposição dos jovens oficiais\nrevolucionários – os “tenentes” – responsáveis pela rebelião de 5 de\njulho de 1922. Melo Franco não se envolveu diretamente nos\nacontecimentos de política interna ocorridos durante o quadriênio\nBernardes, pois durante quase todo esse período esteve em missões no\nexterior, das quais a mais importante foi a embaixada brasileira na Liga\ndas Nações.\n\nNa Conferência Pan-Americana de Santiago e na Liga das Nações\n(1923-1926)\n\nEm fevereiro de 1923, Melo Franco viajou a Santiago do Chile como chefe\nda delegação brasileira à V Conferência Pan-Americana, reunida de março\na maio. Durante os trabalhos, teve um sério confronto com a delegação\nargentina, não chegando a um acordo sobre os termos de um tratado entre\nBrasil, Argentina e Chile para a limitação dos navios de guerra. Também\nfoi adiada a discussão sobre a chamada Tese XII, de autoria do Chile,\nque recomendava aos países americanos a redução das despesas militares.\nDe concreto, o único resultado alcançado pela conferência foi a\naprovação do Pacto Gondra, apresentado pelo delegado paraguaio de mesmo\nnome, visando a submeter à investigação prévia por comissão\ninternacional toda questão suscitada entre países americanos que não\ntivesse tido solução através de negociações diretas ou arbitramento. Nos\ndebates da comissão que elaborou o Pacto Gondra, coube a Melo Franco\nconciliar as divergências entre vários países latino-americanos\n(Argentina, Chile e Uruguai) e os Estados Unidos, que, tendo retornado a\numa política isolacionista após a Primeira Guerra, a princípio\nmanifestaram-se contra o pacto.\n\nDe agosto a outubro de 1923, Melo Franco desempenhou sua primeira missão\nna Liga das Nações, em Genebra, como chefe da delegação brasileira à IV\nAssembleia da organização.\n\nReeleito deputado federal em fevereiro de 1924, foi conduzido à\npresidência da Comissão de Constituição e Justiça, mas não chegou\npraticamente a exercer o mandato. Em junho de 1924 viajou novamente a\nGenebra, dessa vez na condição de embaixador permanente do Brasil junto\nà Liga das Nações.\n\nSua missão revestia-se de especial importância devido à determinação do\ngoverno brasileiro de obter um posto permanente no Conselho da Liga, do\nqual o Brasil vinha fazendo parte desde 1920 como membro temporário.\nLogo ficou demonstrada a inviabilidade dessa pretensão em virtude da\nfalta de solidariedade dos países americanos e às injunções da política\ndas grandes potências europeias – Inglaterra e França – em relação à\nAlemanha.\n\nA par das negociações em prol da candidatura brasileira, Melo Franco\nparticipou com destaque do debate sobre o problema da proteção das\nminorias nos países pertencentes à Liga. Após a guerra de 1914, os\npaíses europeus tinham estabelecido um sistema de proteção das minorias\nnacionais, através de uma série de tratados colocados sob a garantia da\nLiga. Em 1925, a Lituânia propôs a inclusão de todos os países-membros\nda Liga no sistema de proteção das minorias, o que contrariava a\nsoberania de países, como o Brasil, que recebiam imigrantes. A Hungria\nfoi ainda mais longe ao sustentar o direito das minorias de se organizar\nautonomamente no interior dos estados. Em setembro de 1925, o Conselho\nda Liga aprovou no entanto o relatório de Melo Franco, preconizando a\nintegração dos imigrantes e sugerindo que a expressão minoria fosse\naplicada apenas aos agrupamentos nacionais transferidos de uma a outra\nsoberania. Dessa forma, Melo Franco conseguiu evitar que a situação da\nminoria alemã na Tchecoslováquia – os sudetos – fosse equiparada à\nsituação dos imigrantes estabelecidos em vários países do mundo, como os\nalemães no Brasil.\n\nEm dezembro de 1925, com a assinatura do Tratado de Locarno, Inglaterra\ne França consagraram sua política de conciliação com a Alemanha,\ncomprometendo-se a apoiar seu ingresso na Liga das Nações na condição de\nmembro permanente do Conselho. Em fevereiro de 1926, a Polônia, país de\nlonga tradição de lutas de resistência contra a Alemanha, apresentou\nidêntica reivindicação, com o apoio da França. A Alemanha opôs-se\nresolutamente ao ingresso da Polônia, fechando questão em torno da\ncriação de apenas uma nova cadeira no Conselho da Liga, o que criou um\nnovo e mais sério obstáculo à pretensão do Brasil. A atitude da Alemanha\nlevou o governo brasileiro a se posicionar contra seu ingresso na Liga,\nde nada adiantando os esforços conciliatórios de Melo Franco.\n\nEm 18 de março, o representante brasileiro utilizou o direito de veto\nreservado aos membros do Conselho para rejeitar a entrada da Alemanha na\norganização e, em 10 de junho, seguindo recomendações expressas de\nBernardes, anunciou a renúncia do Brasil a seu lugar no Conselho. Dois\ndias depois, o chanceler Félix Pacheco comunicou a retirada do Brasil da\nLiga das Nações. Ainda em 1926, a Alemanha foi recebida na Liga, tomando\nassento em seu Conselho.\n\nMelo Franco retornou ao Brasil em julho de 1926. Em 1927, já no governo\nde Washington Luís, foi reeleito deputado federal na legenda do PRM e\nreconduzido à presidência da Comissão de Constituição e Justiça da\nCâmara.\n\nA Aliança Liberal e a Revolução de 1930\n\nEm meados de 1928, Antônio Carlos Ribeiro de Andrada, presidente de\nMinas, decidiu aproximar-se do governo do Rio Grande do Sul com o\nobjetivo de preparar terreno para uma candidatura de oposição nas\neleições presidenciais de 1930. Àquela altura, já havia especulações nos\nmeios políticos sobre a escolha do governador de São Paulo, Júlio\nPrestes, como candidato de Washington Luís à sua sucessão. Sabia-se\ntambém que a candidatura oficial deveria ser lançada o mais tarde\npossível a fim de representar um fato consumado. O Rio Grande do Sul\ntransformava-se assim em peça-chave do processo sucessório, em\ndecorrência da ruptura da aliança Minas-São Paulo – o “café com leite” –\nque vinha garantindo desde 1914 a alternância dos dois estados no poder.\n\nEm agosto de 1928, Melo Franco fez as primeiras sondagens junto ao líder\ndo Partido Republicano Rio-Grandense (PRR) na Câmara, João Neves da\nFontoura, sobre a possibilidade de uma candidatura gaúcha ao palácio do\nCatete. João Neves não descartou a hipótese, mas lembrou os vínculos de\ncooperação existentes entre o governo gaúcho e Washington Luís, deixando\nclara a possibilidade de isolamento de Minas.\n\nEm fins de 1928, Melo Franco voltou a tratar do problema sucessório com\no industrial gaúcho João Daudt d’Oliveira, que, apesar de alheio à\npolítica, mantinha estreitas relações com os líderes republicanos de seu\nestado. Foi João Daudt quem, em janeiro de 1929, transmitiu a Getúlio\nVargas, presidente do Rio Grande do Sul, a proposta de Antônio Carlos,\noferecendo apoio de Minas a uma candidatura gaúcha à presidência da\nRepública. Tendo sido ministro da Fazenda de Washington Luís de 1926 a\n1928, Vargas respondeu a Antônio Carlos em termos evasivos, continuando\na manifestar publicamente seu apoio ao governo federal.\n\nEm 17 de junho de 1929, após muitas conversações e reticências, José\nBonifácio de Andrada e Silva, irmão de Antônio Carlos, e Francisco\nCampos, secretário do Interior de Minas, assinaram com João Neves da\nFontoura um pacto secreto assentando as bases de uma coligação\ndenominada Aliança Liberal. Pelo acordo, Minas e Rio Grande do Sul\nassumiram como principais compromissos o veto ao nome de Júlio Prestes e\na apresentação de uma candidatura gaúcha às eleições presidenciais.\n\nNo dia 22 de julho, Melo Franco entregou a Washington Luís uma carta de\nAntônio Carlos anunciando oficialmente o apoio de Minas à candidatura de\nGetúlio Vargas à presidência. Nos dias seguintes, Melo Franco tratou de\nobter o consentimento de Epitácio Pessoa à indicação de seu sobrinho,\nJoão Pessoa, presidente da Paraíba, como candidato da Aliança Liberal à\nvice-presidência da República. Segundo a versão de Laureta Raja\nGabaglia, filha de Epitácio Pessoa, o ex-presidente, que se encontrava\nno exterior, atendeu à solicitação de Melo Franco. Nesse ínterim,\nWashington Luís telegrafara a todos os chefes de executivos estaduais\ndando conhecimento da escolha de Júlio Prestes para concorrer à sua\nsucessão. Em 29 de julho, João Pessoa manifestou-se contra essa\ncandidatura, tornando-se assim o único entre os 18 governadores e\npresidentes estaduais consultados por Washington Luís a responder\nnegativamente a seu telegrama. Com a adesão de João Pessoa, a Aliança\nLiberal ficou definitivamente constituída pelos governos de Minas, Rio\nGrande do Sul e Paraíba e as oposições dos demais estados.\n\nEm agosto de 1929, Melo Franco renunciou à presidência da Comissão de\nConstituição e Justiça da Câmara e passou a integrar a comissão\nexecutiva da Aliança Liberal, encarregada de coordenar a campanha\neleitoral. Em 7 de setembro, escreveu a Epitácio Pessoa, que ainda se\nencontrava na Europa, solicitando sua intervenção junto a alguns\ngovernos do Nordeste, sobretudo o de Estácio Coimbra em Pernambuco, no\nsentido de que fosse tentada uma fórmula de conciliação, com a\napresentação de um terceiro candidato à presidência da República. A\ncarta, escrita a pedido de Vargas, chegou às mãos do governo e foi\ndivulgada pela imprensa com objetivo de demonstrar a fraqueza da Aliança\nLiberal. A tentativa de acordo falhou em virtude da intransigência de\nWashington Luís em manter a candidatura de Júlio Prestes.\n\nEm 20 de setembro, a comissão executiva da Aliança Liberal lançou\noficialmente a chapa Vargas-João Pessoa e seu programa de governo, que\npropunha, entre outros pontos, a anistia para todos os presos políticos\ne processados desde julho de 1922 e a adoção do voto secreto. Em\noutubro, Melo Franco foi eleito membro da comissão executiva do PRM – a\nfamosa “Tarrasca” – órgão que centralizava todas as decisões do partido\nsituacionista mineiro. Entrou na vaga de Fernando de Melo Viana,\nvice-presidente da República, que rompera com o PRM em protesto contra a\nindicação de Olegário Maciel como candidato oficial à sucessão de\nAntônio Carlos na presidência de Minas. Melo Viana tornou-se em seguida\ncandidato ao governo do estado e o principal líder da facção dissidente\ndo PRM que apoiou em Minas a campanha da Concentração Conservadora em\nprol da eleição de Júlio Prestes.\n\nA plataforma da Aliança Liberal teve grande receptividade entre as\ncamadas médias urbanas, como demonstraram as manifestações pró-Vargas\nocorridas nas grandes cidades durante sua campanha eleitoral. No\ninterior da coligação, uma tendência mais radical, representada\nprincipalmente por seus líderes mais jovens, como João Neves, Virgílio\nde Melo Franco e Osvaldo Aranha (secretário do Interior do Rio Grande do\nSul), passou então a admitir a hipótese de um movimento armado, no caso,\nbastante provável, da derrota de Vargas.\n\nAs eleições de 1^o^ de março de 1930 confirmaram esta hipótese. Virgílio\nde Melo Franco, João Neves, Osvaldo Aranha e outros partidários da\nsolução armada reativaram os contados com os líderes tenentistas e\nbuscaram o apoio dos chefes da Aliança Liberal. Em abril, o movimento\narmado começou a ser organizado com a aquiescência de Vargas, Antônio\nCarlos e Epitácio Pessoa. A participação de Melo Franco na conspiração\nfoi bastante limitada, comparada ao seu desempenho na fase eleitoral da\nAliança Liberal. No final de abril, embarcou para a Europa, com a\nincumbência de negociar um empréstimo para Minas nos mercados\nfinanceiros de Londres e Paris. Em maio, durante sua ausência do país, a\nComissão Legislativa de Reconhecimento de Poderes impugnou sua reeleição\npara a Câmara dos Deputados, diplomando em seu lugar um representante da\nConcentração Conservadora.\n\nMelo Franco retornou ao Brasil em agosto, sem nenhuma promessa de\nempréstimo para Minas. Afastado da Câmara, recolheu-se a seu estado.\nEncontrava-se no Rio em 3 de outubro, quando foi surpreendido pela\neclosão no Rio Grande do Sul, em Minas e na Paraíba do levante armado\ncontra o governo federal. Procurado pela polícia, asilou-se na embaixada\ndo Peru, onde permaneceu até a deposição de Washington Luís, no dia 24\nde outubro, por um golpe militar que levou ao poder uma junta\ngovernativa composta pelos generais João de Deus Mena Barreto e Augusto\nTasso Fragoso e pelo almirante Isaías de Noronha. Nesse mesmo dia, foi\nnomeado ministro das Relações Exteriores, passando a acumular\ninterinamente a partir de 26 de outubro a pasta da Justiça.\n\nDe Ponta Grossa (PR), onde se encontrava junto com o estado-maior das\nforças revolucionárias, Virgílio de Melo Franco telegrafou ao pai,\nsolicitando informações sobre as reais intenções dos novos governantes.\nEm sua resposta, Melo Franco sugeriu a vinda de Vargas ao Rio a fim de\nse integrar ao governo na condição de presidente da junta. Entretanto,\nVargas não pretendia partilhar o poder. Encarregou Osvaldo Aranha de\nnegociar com a junta sua posse no governo da República e, ao mesmo\ntempo, ordenou às tropas rebeldes que prosseguissem seu avanço rumo à\ncapital do país. No dia 28 de outubro, após entendimentos firmados com\nAranha, a junta divulgou uma proclamação ao país, redigida por Melo\nFranco, anunciando a decisão de transmitir o governo a Vargas, na\ncondição de chefe da revolução vitoriosa.\n\nAtuação no Itamarati (1930-1933)\n\nVargas tomou posse na chefia do governo provisório em 3 de novembro de\n1930. Durante as conversações para a formação de seu ministério, foi\ninformado por Artur Bernardes e Olegário Maciel de que a eventual\npermanência de Melo Franco à frente do Itamarati não significaria uma\nrepresentação de Minas Gerais no gabinete. Apesar dessa restrição, o\nministro das Relações Exteriores foi mantido no cargo, passando a\ndedicar-se imediatamente a obter o reconhecimento internacional da nova\nsituação. Os primeiros países a responder favoravelmente à continuidade\ndos laços diplomáticos com o Brasil foram Chile, Portugal, Uruguai,\nInglaterra, Vaticano, França, Argentina e Estados Unidos.\n\nSua primeira gestão internacional como chanceler foi o restabelecimento\ndas relações entre o Peru e o Uruguai, assinado por representantes dos\ndois países no dia 19 de novembro no palácio do Catete, com a presença\nde Vargas. No mesmo mês, Melo Franco tratou do “caso *Baden”*, navio\nalemão que fora atingido por um obus durante a revolução e tivera 31\nmortos entre seus tripulantes e passageiros.\n\nEm 15 de janeiro de 1931, com o decreto de reforma administrativa do\nItamarati, Melo Franco introduziu a aposentadoria compulsória, por\nlimite de idade e tempo de serviço, e o rodízio dos funcionários que\nserviam no exterior, obrigando-os a passar periodicamente algum tempo no\nBrasil. Essa reforma foi a primeira etapa do processo de fusão das três\ncarreiras do Itamarati (consular, diplomática e secretaria de Estado),\ncompletada em 1938 por Osvaldo Aranha.\n\nComo chanceler, Melo Franco dispôs de uma certa autonomia de ação, pois\nas preocupações de Vargas durante o governo provisório (1930-1934)\nvoltaram-se quase exclusivamente para os problemas políticos internos.\nSegundo Afonso Arinos de Melo Franco, filho de Afrânio, “Getúlio e seus\ncompanheiros gaúchos pouco entendiam de política internacional e pouco\nse interessaram por ela. Deixavam as mãos livres ao ocupante do\nItamarati”. Na falta de um novo programa de política internacional, Melo\nFranco deu continuidade ao que vinha sendo feito no campo das relações\nexternas desde o princípio do século. Segundo o historiador Ricardo\nSeitenfus, “a ação do Itamarati tomou duas direções pragmáticas: a\nprimeira foi o comércio exterior; a segunda foi o pan-americanismo do\ninício dos anos 1930”.\n\nA Política Comercial\n\nLogo no início de sua gestão, Afrânio de Melo Franco empenhou-se em\nobter novos mercados consumidores para o café, a fim de atenuar os\nefeitos da queda das exportações do produto causada pela crise econômica\nmundial deflagrada em 1929.\n\nComo primeiro passo, Melo Franco e José Maria Whitaker (ministro da\nFazenda até meados de 1931) propuseram aos chefes de missão diplomática\nacreditados no Brasil a negociação de tratados bilaterais de comércio\nque incluíssem a cláusula incondicional e ilimitada de nação mais\nfavorecida. Melo Franco manteve essa orientação de política comercial\ndurante os três anos de sua gestão, opondo-se às fórmulas protecionistas\njá dominantes nas relações comerciais. Como observou Seitenfus, “apesar\ndessa situação paradoxal, o Brasil assinou 27 tratados comerciais\ndurante os primeiros anos do governo revolucionário. Somente em 1935 o\nItamarati resolveu denunciá-los por falta de reciprocidade, ao constatar\nque os tratados não estavam sendo secundados por medidas concretas”.\n\nEm 1933, os Estados Unidos propuseram a assinatura de um acordo\ncomercial de reciprocidade com o Brasil. A proposta não oferecia nenhuma\nvantagem ao Brasil, pois baseava-se na manutenção dos livres direitos de\nentrada dos principais produtos brasileiros nos Estados Unidos (café e\nborracha) em troca da redução de tarifas para os produtos manufaturados\nnorte-americanos importados. Em agosto de 1933, Melo Franco assegurou ao\nembaixador norte-americano, Hugh Gibson, o interesse do Brasil em\nnegociar o acordo, procurando desfazer a impressão de que o governo\nbrasileiro dificultava o início das conversações. O Tratado de\nReciprocidade só seria firmado em 1935, depois da saída de Melo Franco\ndo Itamarati.\n\nA Guerra do Chaco\n\nA guerra entre a Bolívia e o Paraguai pela disputa do território do\nChaco irrompeu em junho de 1932, transformando-se no mais grave conflito\narmado ocorrido na América no século XX. A guerra foi desencadeada pela\nintenção da Bolívia de conquistar no Chaco uma abertura para o rio\nParaguai a fim de substituir o litoral marítimo perdido para os chilenos\nno final do século XIX. A intransigência dos governos de La Paz e\nAssunção, o apoio da Argentina ao Paraguai e os interesses de grandes\ncompanhias estrangeiras em torno de supostas reservas petrolíferas do\nChaco fizeram prolongar a guerra para além da capacidade de resistência\ndos dois países em conflito.\n\nA principal mediação de paz tentada por Melo Franco ocorreu no segundo\nsemestre de 1933, após o fracasso das gestões realizadas pela Comissão\ndos Neutros, formada em Washington em 1928, por ocasião dos primeiros\nincidentes militares no Chaco. Seu plano de paz consistia num acordo\npreliminar na base da limitação do território reconhecido\nindiscutivelmente como paraguaio e evacuação da parte restante pelos\ndois lados, com um armistício de 45 dias. Em julho de 1933, após a\ndissolução da Comissão dos Neutros, Melo Franco propôs confidencialmente\naos governos da Argentina, Chile e Peru que, associados ao Brasil,\nconstituíssem um bloco de nações vizinhas (ABCP) e que este bloco\nsolicitasse ao Conselho da Liga das Nações a adoção de sua fórmula de\npaz.\n\nNo início de agosto, o Conselho da Liga respondeu favoravelmente ao\nABCP. Em 25 de agosto, Melo Franco e os embaixadores Martinez Ferrari\n(Chile), Ramón Carcano (Argentina) e Garcia Calderón (Peru),\nrepresentantes do ABCP no Rio, transmitiram aos países beligerantes a\nproposta de paz. O plano foi aceito com ressalvas pela Bolívia e\nintegralmente pelo Paraguai. Os dois países não aceitaram posteriormente\nmodificar seus pontos de vista em relação ao plano de Melo Franco. Em\nface do impasse, o chanceler brasileiro decidiu encerrar sua mediação em\n1^o^ de outubro de 1933.\n\nA Guerra do Chaco estendeu-se por mais dois anos, terminando em junho de\n1935 com a derrota militar da Bolívia. Em julho de 1938, foi firmado o\ntratado de paz entre os dois países, segundo o laudo arbitral da\nArgentina, Brasil, Chile, Estados Unidos, Peru e Uruguai, pelo qual o\nParaguai ficou com a maior parte do Chaco, comprometendo-se porém a\ngarantir amplo e livre trânsito à Bolívia.\n\nSobre a Guerra do Chaco, Melo Franco publicou em 1936 o livro *Episódios\nda história internacional recente,* refutando as acusações feitas pelo\ndiplomata boliviano Luis Abelli de que em agosto de 1932 teria instigado\no governo de La Paz a intensificar a guerra contra o Paraguai,\ngarantindo-lhe ampla ajuda militar brasileira.\n\nA Questão de Letícia\n\nEm 31 de agosto de 1932, cerca de 250 peruanos, a maioria civis,\ninvadiram e ocuparam o porto fluvial colombiano de Letícia, situado\npróximo à fronteira dos dois países com o Brasil. A região, habitada\npelos peruanos por quase um século, tinha sido incorporada à Colômbia em\n1922 pelo tratado de limites chamado Salomón-Lozano, em homenagem aos\nministros que o negociaram. O Brasil tomara, na ocasião, atitude\nfrancamente contrária ao Tratado Salomón-Lozano, pois não desejava o\nacesso colombiano ao curso do rio Amazonas.\n\nO governo do Peru não apoiou diretamente o golpe de força, mas\nrecusou-se a tomar medidas para restituir o território à Colômbia,\nprocurando atribuir ao episódio a conotação de uma justa reação\nnacionalista.\n\nNo fim de dezembro de 1932, Melo Franco propôs uma fórmula preliminar de\nacordo que previa a entrega do território contestado ao Brasil e sua\nrestituição à Colômbia no menor tempo possível, enquanto se abriria no\nRio uma conferência para a revisão do Tratado Salomón-Lozano. A proposta\nfoi aceita em princípio pela Colômbia e o Peru, mas acabou não se\nefetivando em virtude das divergências entre os dois países sobre o\nprazo da administração brasileira sobre Letícia.\n\nEm fevereiro e março de 1933, a Colômbia tomou medidas de represália\ncontra o Peru, ocupando militarmente as cidades de Taparacá e Gueni. No\ndia 25 de março, o Conselho da Liga das Nações obteve um acordo\npreliminar entre os dois países beligerantes, em bases semelhantes à\nproposta formulada por Melo Franco no início de sua mediação. Pelo\nacordo, foi constituída uma comissão da Liga, incumbida de administrar\nLetícia durante o prazo de um ano, composta de representantes dos\nEstados Unidos (coronel Artur Brown), Espanha (capitão Francisco\nIglesias) e Brasil (capitão Alberto de Lemos Bastos).\n\nEm agosto de 1933, o chanceler brasileiro foi convidado para presidir as\nnegociações entre os dois países em conflito, iniciadas no Rio de\nJaneiro em outubro. Apesar do seu afastamento da chefia do Itamarati em\ndezembro, Melo Franco permaneceu na presidência da conferência de paz\naté a assinatura, em 24 de maio de 1934, do Protocolo da Amizade, que\nrestabeleceu a soberania da Colômbia sobre Letícia e decretou a livre\nnavegação dos rios Amazonas e Putumaio. Sua atuação nesse episódio lhe\nvaleu, em 1935, uma indicação ao Prêmio Nobel da Paz, apoiada pelos\ngovernos do Brasil e de outras 13 nações, bem como por diversas\ninstituições e personalidades internacionais. No entanto, o prêmio foi\nconcedido ao escritor alemão Carl von Ossietzky, militante pacifista e\nantinazista. O nome do ex-chanceler brasileiro foi novamente lembrado em\n1936, dessa vez, segundo Afonso Arinos, sem o apoio decidido do governo\nbrasileiro. A escolha recaiu então sobre o chanceler argentino Saavedra\nLamas.\n\nA Política Interna Durante a Permanência no Itamarati (1930-1933)\n\nDos membros do primeiro ministério de Vargas, formado em novembro de\n1930, Melo Franco foi o que mais tempo permaneceu no cargo. Nesse\nperíodo, influiu pouco nos rumos da política interna, pois ocupou-se\nbasicamente dos assuntos de sua pasta, embora acompanhasse a evolução\npolítica nacional, particularmente a de Minas.\n\nEm 31 de junho de 1931, Melo Franco foi designado pela comissão\nexecutiva do PRM como representante do partido junto ao governo\nprovisório. Tratava-se de uma clara inversão da posição assumida\ninicialmente pelo partido, que, basicamente reduzido à facção de\nBernardes, enfrentava a cerrada oposição da Legião Mineira, organização\npolítica de inspiração fascista criada em fevereiro de 1931 por\nFrancisco Campos, ministro da Educação, Gustavo Capanema e Amaro Lanari,\nsecretários do Interior e das Finanças do governo Olegário Maciel.\n\nFoi, no entanto, o ministro da Justiça Osvaldo Aranha quem se destacou\ncomo principal elemento de ligação entre o governo provisório e o PRM.\nComo “homem da revolução”, Aranha já demonstrara seu interesse em\ninfluir politicamente em Minas ao tentar, sem êxito, em novembro de\n1930, a nomeação de Virgílio de Melo Franco para interventor federal no\nestado em lugar de Olegário Maciel.\n\nO conflito entre as duas forças políticas em Minas culminou no dia 18 de\nagosto de 1931 com a tentativa de deposição de Olegário Maciel, ocorrida\ndurante um congresso do PRM em Belo Horizonte. O golpe, articulado por\nlíderes perremistas e Osvaldo Aranha, com o apoio discreto de Vargas,\nfracassou devido à resistência da Força Pública de Minas, mobilizada por\nGustavo Capanema.\n\nEm consequência da crise, exoneraram-se em setembro da alta\nadministração federal os perremistas Mário Brant (presidente do Banco do\nBrasil) e Afonso Pena Júnior (diretor de uma das carteiras do mesmo\nBanco), bem como o ministro da Educação Francisco Campos, fundador da\nLegião Mineira.\n\nEm 13 de dezembro de 1931, com a volta de Francisco Campos para o mesmo\nministério, Melo Franco pediu demissão do Itamarati. Prestigiado por\nVargas, o chanceler decidiu todavia rever sua posição e permanecer no\ncargo.\n\nNos meses seguintes, Vargas conduziu habilmente as negociações para um\nacordo de pacificação em Minas, conseguindo não apenas obter o consenso\nde seu ministério sobre a fórmula de conciliação, como também recuperar\na confiança de Olegário Maciel, abalada pelos acontecimentos de agosto\nde 1931. Surgiu assim o Acordo Mineiro, firmado em fevereiro de 1932,\nque implicou a dissolução da Legião e sua fusão com o PRM numa nova\nagremiação – o Partido Social Nacionalista (PSN). O acordo traduzia o\nprecário equilíbrio político existente em Minas. A luta política no\ninterior do estado convergiu nos meses seguintes para o debate em torno\nda convocação da Assembleia Constituinte. O governo Olegário Maciel\napoiou os rumos traçados por Vargas, enquanto Bernardes e um reduzido\ngrupo do PRM ligaram-se ao movimento constitucionalista, liderado pelas\nforças políticas tradicionais de São Paulo, comprometendo-se com a\nconspiração que ali se desenvolvia contra Vargas.\n\nMelo Franco colocou-se resolutamente contra a Revolução\nConstitucionalista, deflagrada em 9 de julho de 1932 em São Paulo. Como\nchanceler, tratou dos incidentes diplomáticos ocorridos durante a\nrevolução e procurou ainda desfazer a imagem positiva dada pela imprensa\nestrangeira ao movimento rebelde, através de uma intensa mobilização dos\nserviços diplomático e consular do Brasil no exterior. Logo após o\ninício do conflito, interveio junto ao encarregado de negócios dos\nEstados Unidos no Rio, Walter Thurston, para protestar contra a\nutilização da companhia de telégrafos All American Cables na propaganda\ndos insurretos no exterior e a entrada de dois navios norte-americanos\nno porto de Santos (SP), apesar do bloqueio decretado pelo governo\nprovisório. A All American Cables resolveu em seguida desligar sua linha\nem Montevidéu para evitar seu uso pelos rebeldes que controlavam Santos.\n\nNo princípio de agosto, Melo Franco distribuiu ao corpo diplomático e\nfez irradiar em ondas internacionais uma nota denunciando o caráter\nseparatista do movimento e refutando o pedido de reconhecimento de\nbeligerância entre o governo federal e São Paulo, solicitado pelo\ngovernador paulista Pedro de Toledo. Os paulistas contavam\nprincipalmente com o reconhecimento da beligerância por parte dos\nEstados Unidos, devido à simpatia do cônsul norte-americano em São\nPaulo, Charles Cameron, pelo movimento rebelde. O governo dos EUA não\natendeu porém à solicitação dos constitucionalistas, seguindo as\nrecomendações de seu embaixador no Rio, Edwin Morgan.\n\nEm setembro, o chanceler brasileiro recebeu, por sua vez, os protestos\ndo embaixador Morgan contra o bombardeio de instalações da empresa\nconcessionária de serviços públicos Bond & Share em São Paulo pela\naviação legalista.\n\nDe 17 de setembro a 7 de novembro de 1932, Melo Franco exerceu também a\npasta da Justiça, substituindo provisoriamente Francisco Campos. Nesse\nínterim, a revolução paulista chegou ao fim com a assinatura do\narmistício em 2 de outubro. Embora tenha derrotado as forças\nconstitucionalistas, o governo provisório tomou logo em seguida medidas\nefetivas para o retorno ao regime constitucional. Por determinação de\nVargas, o novo ministro da Justiça, Francisco Antunes Maciel Júnior,\nnomeou em 7 de novembro os membros da Comissão Constitucional, conhecida\ncomo Subcomissão do Itamarati, encarregada de elaborar o anteprojeto da\nfutura Constituição. Além de Melo Franco, designado seu presidente, a\nSubcomissão do Itamarati foi composta por Carlos Maximiliano Pereira dos\nSantos (relator geral), Temístocles Cavalcanti, Joaquim Francisco de\nAssis Brasil, Osvaldo Aranha, José Américo de Almeida, Antônio Carlos,\nJosé de Castro Nunes, Prudente de Morais Filho, Agenor de Roure,\nFrancisco Solano Carneiro da Cunha, Pedro Aurélio de Góis Monteiro e\nJoão Mangabeira.\n\nAlém da presidência dos trabalhos, Melo Franco foi também responsável\npela redação do capítulo sobre o Conselho da República e da parte sobre\na ordem judiciária, em colaboração com João Mangabeira. O Conselho da\nRepública, posteriormente rejeitado pela Assembleia Constituinte, tinha\ncomo modelo o Conselho do Império, com a diferença de que poderia\nassumir funções executivas nos casos de grave emergência nacional.\n\nOs trabalhos da Subcomissão do Itamarati se estenderam de novembro de\n1932 a maio de 1933 quando foi aprovado o anteprojeto que tinha como\npontos principais a adoção de eleições diretas para o Legislativo,\ncomposto de uma câmara única – a Assembleia Nacional – com a supressão\ndo Senado e a criação de um Conselho Federal; a rejeição da\nrepresentação de classes e a consagração da legislação trabalhista. A\nAssembleia Constituinte, instalada em novembro de 1933, aprovaria em\ngrande parte o anteprojeto da Subcomissão do Itamarati, mantendo, porém,\no sistema bicameral e incorporando a representação de classes.\n\nA Demissão do Itamarati\n\nA morte de Olegário Maciel em setembro de 1933 abriu uma disputa pelo\npoder em Minas que rapidamente ganhou dimensões nacionais, envolvendo\ndiferentes facções do governo provisório. Afrânio de Melo Franco,\napoiado por Osvaldo Aranha, passou a empenhar-se ativamente na nomeação\ndo filho Virgílio, contrapondo-se assim às articulações do interventor\nno Rio Grande do Sul, José Antônio Flores da Cunha, em favor de Gustavo\nCapanema.\n\nNo fim de novembro, o *Correio da Manhã* publicou dois violentos artigos\ntentando envolver os nomes de Afrânio e Virgílio em supostas negociatas\nrealizadas em torno da encampação da Estrada de Ferro Teresópolis,\nlevada a efeito na época em que o primeiro era ministro da Viação e o\nsegundo seu oficial de gabinete. Como a imprensa estava sob censura,\nMelo Franco suspeitou de alguma cumplicidade do governo e em 26 de\nnovembro pediu exoneração do ministério. Vargas não apenas insistiu em\nsua permanência no Itamarati, como também lhe mostrou o decreto de\nnomeação de Virgílio para a interventoria em Minas. Confiante na\npromessa do presidente, Melo Franco viajou no início de dezembro para\nMontevidéu como chefe da delegação brasileira à VII Conferência\nPan-Americana. Entretanto, Vargas decidiu escolher um terceiro nome para\no Executivo mineiro, descomprometido de qualquer facção política\nestadual ou nacional. Em 12 de dezembro, após entendimentos com Antônio\nCarlos, designou interventor Benedito Valadares, deputado relativamente\nobscuro na política mineira.\n\nDe Montevidéu, Melo Franco telegrafou imediatamente a Antunes Maciel,\ncolocando seu cargo à disposição. Ao regressar ao Rio, em 20 de\ndezembro, encontrou a crise formada no governo, pois Osvaldo Aranha\ntomara idêntica atitude, solicitando demissão do Ministério da Fazenda.\nEm 28 de dezembro de 1933, Melo Franco transmitiu a pasta a Félix de\nBarros Cavalcanti de Lacerda, encerrando sua missão no Itamarati.\nCavalcanti de Lacerda permaneceu como ministro interino das Relações\nExteriores até julho de 1934, quando José Carlos de Macedo Soares\nassumiu o ministério. Nessa época, com a consolidação da Revolução de\n1930, Vargas passou a centralizar as decisões da política externa,\nformulando uma orientação inovadora para as relações entre o Brasil e as\ngrandes potências.\n\nNos meses seguintes, Melo Franco foi apontado frequentemente pela\nimprensa como possível candidato à presidência da República no pleito\nindireto que seria realizado no âmbito da Assembleia Constituinte.\nSegundo o *Diário da Manhã,* de Pernambuco, sua candidatura contava com\no apoio do líder tenentista João Alberto Lins de Barros, deputado\nconstituinte pelo Partido Social Democrático de Pernambuco. Em julho, a\nbancada paulista, principal força de oposição à candidatura Vargas,\ndecidiu sufragar o nome de Borges de Medeiros. Promulgada a Constituição\nem 16 de julho, no dia seguinte Vargas foi eleito presidente da\nRepública pela Assembleia Constituinte. Melo Franco recebeu um voto,\napesar de ter recusado publicamente sua candidatura.\n\nDa Constituinte Mineira de 1935 à Conferência Pan-Americana de 1938\n\nEm outubro de 1934, Melo Franco foi eleito para a Assembleia\nConstituinte de Minas como candidato da chapa oposicionista organizada\npelo PRM. Além de Melo Franco, o PRM elegeu mais 13 candidatos contra 34\neleitos pelo Partido Progressista Mineiro (PPM), situacionista, fundado\nem janeiro de 1933.\n\nInstalada a Assembleia Constituinte estadual em maio de 1935, Melo\nFranco foi designado, junto com José Maria Lopes Cançado, representante\ndo PRM na comissão legislativa encarregada de elaborar o anteprojeto da\nnova Carta. Com a promulgação da Constituição de Minas em 30 de julho de\n1935 e a transformação da Constituinte em Assembleia Legislativa\nordinária, Melo Franco renunciou a seu mandato de deputado.\n\nEm 1937, foi eleito membro titular e presidente da Comissão\nInternacional de Jurisconsultos de Washington, encarregada de elaborar a\ncodificação progressiva do Direito Internacional Americano. Em abril de\n1937, participou dos trabalhos da comissão, reunida em Washington,\ncontinuando na sua presidência até a reunião de Lima, realizada em 1938,\nantes da VIII Conferência Pan-Americana.\n\nNo fim de 1938, já sob o Estado Novo, Melo Franco foi designado por\nVargas presidente da delegação brasileira à VIII Conferência\nPan-Americana, convocada para o mês de dezembro em Lima. Durante o\nencontro, Melo Franco alinhou-se com os EUA na defesa de uma decidida\npolítica de solidariedade continental, diante do perigo de uma guerra\nmundial. Os EUA buscavam consolidar sua posição na América Latina,\nameaçada pela crescente penetração das potências do Eixo (Alemanha e\nItália), através do comércio e da propaganda. Entretanto, a Argentina\nopôs-se tenazmente – com êxito – à proposta norte-americana de criação\nde um Comitê Consultivo Interamericano Permanente. A solução provisória,\nincluída finalmente na Declaração de Lima, instituiu o sistema de\nconsultas, mediante reuniões dos chanceleres americanos. Entre outras\nresoluções, a Conferência negou aos estrangeiros residentes nas Américas\na condição de minorias étnicas, raciais ou nacionais, consagrando,\nassim, a tese sustentada por Melo Franco na Liga das Nações.\n\nNo fim de 1939, Melo Franco foi designado pelo chanceler Osvaldo Aranha\nrepresentante do Brasil na Comissão Interamericana de Neutralidade,\ncriada em setembro, logo após o início da Segunda Guerra Mundial, pela I\nReunião de Consultas dos Chanceleres Americanos, realizada no Panamá. Em\njaneiro de 1940, a comissão foi instalada no Rio de Janeiro e Melo\nFranco foi escolhido seu presidente. A comissão teve a seu encargo o\nexame de vários casos de violação de neutralidade americana, praticados\npelos países beligerantes, como, por exemplo, a batalha naval\nanglo-germânica travada em Punta del Este, nas proximidades da costa\nuruguaia. A comissão não chegou entretanto a aprovar nenhuma resolução\nde peso. Naquela fase, vários governos americanos, inclusive o\nbrasileiro, resistiam à política antialemã dos Estados Unidos.\n\nEm janeiro de 1942, por resolução da III Reunião de Consultas dos\nChanceleres Americanos, realizada no Rio, a Comissão Interamericana de\nNeutralidade transformou-se na Comissão Jurídica Interamericana, cuja\npresidência foi novamente entregue a Melo Franco. Nessa mesma ocasião, o\nBrasil e a maioria dos países americanos, com exceção do Chile e da\nArgentina, decidiram romper suas relações diplomáticas com as potências\ndo Eixo.\n\nPresidente da Academia Nacional de História, membro titular do Instituto\nHistórico e Geográfico e da Sociedade Brasileira de Direito\nInternacional, Afrânio de Melo Franco faleceu no Rio de Janeiro no dia\n1^o^ de janeiro de 1943.\n\nAlém de Virgílio de Melo Franco, líder revolucionário na década de 1930\ne fundador da União Democrática Nacional (UDN) em 1945, teve mais nove\nfilhos, vários dos quais se destacaram na política, na diplomacia e na\nliteratura: Afonso Arinos de Melo Franco, deputado federal por Minas\nGerais desde a Constituinte de 1946 até 1959, senador pelo Distrito\nFederal e depois pelo estado da Guanabara de 1959 a 1967, ministro das\nRelações Exteriores em 1961 e em 1962 e membro da Academia Brasileira de\nLetras a partir de 1958; Caio de Melo Franco e Afrânio de Melo Franco\nFilho, ambos diplomatas de carreira, o primeiro embaixador na França de\n1953 a 1955, o segundo embaixador na Bélgica de 1963 a 1966. Sua filha\nZaide casou-se com o diplomata Jaime Sloan Chermont, embaixador na\nInglaterra de 1966 a 1968.\n\nPublicou os seguintes trabalhos: *Declaração de princípios do Brasil*\n(discurso, 1923), *Pela fraternidade continental americana* (discurso,\n1924), *Cláudio Manuel da Costa* (ensaio, 1930), Discursos (1932), *O\nTratado de Extradição do Brasil com a Itália* (documento, 1932),\n*Episódios da história internacional recente* (ensaio, 1936), *Espelho\nde três faces* (1937), *Minorias étnicas* e *O apóstolo das letras\nmineiras – Guido Tomas Marlière*. Seu filho Afonso Arinos de Melo Franco\nescreveu sua biografia: *Um estadista da República – Afrânio de Melo\nFranco e seu tempo* (1955).\n\nPaulo Brandi\n\n**FONTES:** ABRANCHES, J. *Governos*; BANDEIRA, L. *Presença*; BOMENY,\nH. *Estratégia*; CARONE, E. *República velha*; CASTRO, P.\n*Subdesenvolvimento*; COELHO, J. *Dicionário*;CONSULT. MAGALHÃES, B.;\n*Correio da Manhã* (4/7/1931); CORRESP. MIN. TRAB.; COSTA, S.\n*Diplomacia*; *Cronologia da Assembleia*; *Diário de Notícias,* Rio\n(26/5/1937); *Diário do Congresso Nacional*;*Digesto Econômico*\n(3/4/1970); DONGHI, T. *História*; DULLES J. *Anarquistas*;DULLES, J.\n*Getúlio*; *Encic. Mirador*; FONTOURA, J. *Memórias*;FRANCO, A.\n*Estadista*; GABAGLIA, L. *Epitácio*; GIFFIN, D. *Normal*; GOMES, A.\n*Regionalismo*; *Grande encic. Delta*;GUIMARÃES, A. *Dicionário*;\nHEILBORN, M. *Oligarquia*; HILTON, S. *Brasil e as grandes*;\nHIRSCHOWICZ, E. *Contemporâneos*;*Ilustração brasileira* (7/9/1922); M.\n*História*; PEIXOTO, A. *Getúlio*;*Personalidades*; QUADROS, J*.*;\nARINOS, A*. História*;*Relação dos ministros*; RESENDE, M. *Formação*;\n*Rev. Arq. Públ. Mineiro* (12/76); ROUT JÚNIOR, L. *Politics*;\nSEITENFUS, R. *Difícil*; SILVA, H. *1938*; SOUSA, J. *Índice*;\nWANDERLEY, N. *História*; *Who’s who in Brazil*.\n","ref":"**FONTES:** ABRANCHES, J. *Governos*; BANDEIRA, L. *Presença*; BOMENY,\nH. *Estratégia*; CARONE, E. *República velha*; CASTRO, P.\n*Subdesenvolvimento*; COELHO, J. *Dicionário*;CONSULT. MAGALHÃES, B.;\n*Correio da Manhã* (4/7/1931); CORRESP. MIN. TRAB.; COSTA, S.\n*Diplomacia*; *Cronologia da Assembleia*; *Diário de Notícias,* Rio\n(26/5/1937); *Diário do Congresso Nacional*;*Digesto Econômico*\n(3/4/1970); DONGHI, T. *História*; DULLES J. *Anarquistas*;DULLES, J.\n*Getúlio*; *Encic. Mirador*; FONTOURA, J. *Memórias*;FRANCO, A.\n*Estadista*; GABAGLIA, L. *Epitácio*; GIFFIN, D. *Normal*; GOMES, A.\n*Regionalismo*; *Grande encic. Delta*;GUIMARÃES, A. *Dicionário*;\nHEILBORN, M. *Oligarquia*; HILTON, S. *Brasil e as grandes*;\nHIRSCHOWICZ, E. *Contemporâneos*;*Ilustração brasileira* (7/9/1922); M.\n*História*; PEIXOTO, A. *Getúlio*;*Personalidades*; QUADROS, J*.*;\nARINOS, A*. História*;*Relação dos ministros*; RESENDE, M. *Formação*;\n*Rev. Arq. Públ. Mineiro* (12/76); ROUT JÚNIOR, L. *Politics*;\nSEITENFUS, R. *Difícil*; SILVA, H. *1938*; SOUSA, J. *Índice*;\nWANDERLEY, N. *História*; *Who’s who in Brazil*.\n","dic":"DHBPR"}
