{"title":"FREIRE, Felisbelo","cargoss":["Presidente de associação ou confederação de empregados ou empregadores","Constituinte","Deputado federal","Ministro da Fazenda","Deputado federal","Deputado federal","Deputado federal","Deputado federal"],"cargos_esp":[0,0,0,0,0,0,0,0],"datas_ini":[1889,1891,1891,1893,1916,1909,1903,1897],"datas_fim":[1890,1891,1892,1894,1916,0,1905,1899],"estados":["SE",0,"SE",0,"SE","SE","SE","SE"],"autor":[0],"content":"**FREIRE, Felisbelo**\n\n\\*pres. SE 1889-1890; const. 1891; dep. fed. SE 1891-1892; min. Faz.\n1893-1894; dep. fed. SE 1897-1899, 1903-1905 e 1909- 1916.\n\n*Felisbelo Firmo de Oliveira Freire* nasceu em Itaporanga (SE) em 30 de\njaneiro de 1858, filho do coronel Felisbelo Firmo de Oliveira Freire e\nde Rosa do Amarante Góis Freire.\n\nIniciou os estudos secundários no Ateneu Sergipense, em Aracaju,\ncompletando-os na cidade de Salvador. Prosseguiu os estudos na capital\nbaiana, onde obteve o grau de doutor em medicina em 1882 com a tese “Das\ncomplicações cardíacas nas diversas formas de nevrite e sua patogenia”.\nRecém-formado, regressou à província natal e trabalhou como clínico na\ncidade de Laranjeiras. Colaborou na imprensa política, defendendo ideias\nabolicionistas e contrárias ao regime monárquico. Fez contínua\npropaganda republicana, tendo como companheiros Baltasar de Araújo Góis,\nFausto Cardoso e Josino de Meneses. Fundou os periódicos *O Horizonte* e\n*O Laranjeirense*, este último, órgão do Clube Republicano local, ao\nqual pertencia.\n\nPassou a viver na cidade do Rio de Janeiro meses antes da queda do\ngabinete do visconde de Ouro Preto e do fim da monarquia, em 15 de\nnovembro de 1889. Voltou então para Sergipe, nomeado presidente do\nestado por decreto do governo provisório da República chefiado pelo\nmarechal Deodoro da Fonseca. Tomou posse 13 de dezembro de 1889, em\nsubstituição à junta provisória formada por Baltasar Góis e Antônio José\nde Siqueira Meneses, e exerceu o cargo durante oito meses, até 17 de\nagosto de 1890. Republicano histórico, mesmo evitando maiores confrontos\nna implantação do novo regime, buscou superar as dificuldades do serviço\npúblico local e adaptá-lo às novas instituições políticas. Recebeu o\napoio de Olímpio Campos, político oriundo das hostes do Partido\nConservador, que se tornou nesse período presidente do Conselho\nGovernativo da Intendência de Aracaju.\n\nTendo encontrado as finanças sergipanas com elevado déficit, mesmo nesse\nquadro de restrições iniciou obras de construção de diversos trechos de\nestradas de ferro. Reorganizou também a Biblioteca Pública de Aracaju.\nEnfrentou surtos de varíola e paludismo, que lhe valeram os primeiros\nataques da oposição. Forte campanha na imprensa foi feita contra o seu\ngoverno, principalmente após a decisão de diminuir o contingente da\nforça policial e o número de funcionários públicos, a fim de reduzir\ngastos. Desgastado politicamente, após negar o apoio esperado ao coronel\nRosa Júnior na chapa para o Senado, foi demitido pelo marechal Deodoro\nda Fonseca, sendo substituído pelo vice-presidente estadual Augusto\nCésar da Silva.\n\nEleito para a Assembleia Nacional Constituinte em setembro de 1890,\ntomou posse em novembro seguinte e esteve entre os participantes da\nComissão dos 21, que redigiu o anteprojeto de Constituição, tendo-se\nincumbido do capítulo da reorganização dos estados. Enquanto\nrepresentante de Sergipe, defendeu a necessidade de uma divisão mais\nequânime do território nacional, questionando a perda de terras de seu\nestado para a Bahia. Promulgada a Constituição em 24 de fevereiro de\n1891, em junho seguinte passou a exercer o mandato ordinário. Deixou,\nporém, a Câmara dos Deputados antes do fim da legislatura para assumir o\nMinistério da Fazenda de abril de 1893 a agosto de 1894, durante o\ngoverno do marechal Floriano Peixoto (1891-1894). Acumulou o cargo com o\nde secretário dos Negócios Exteriores de abril a junho de 1893.\n\nApós um grupo do alto oficialato da Marinha, entre os quais se incluíam\nos almirantes Custódio de Melo, Eduardo Wandenkolk e Saldanha da Gama,\nter contestado a permanência do marechal Floriano no governo e liderado\numa manifestação armada pela imediata convocação de eleições, conforme\nprevia a Constituição no caso de renúncia presidencial – o que havia\nocorrido com o marechal Deodoro em 23 de novembro de 1891 –, foi um dos\nresponsáveis pelas medidas de exceção contra o movimento, conhecido como\nRevolta da Armada.\n\nApós deixar o cargo de ministro, voltou a exercer a medicina e\ndedicou-se à pesquisa histórica e à divulgação científica. Em 1896,\nlançou *História do* *Brasil* e *Elementos de história natural: botânica\ne zoologia*, ambos para uso nas escolas primárias e com a aprovação\nConselho de Instrução da capital federal. Retornou à política no ano\nseguinte e reelegeu-se deputado federal para legislatura 1897-1899.\nNovamente candidato em 1900, não teve sucesso. Conquistou seu terceiro\nmandato na Câmara apenas quatro anos depois, na legislatura 1903-1905.\nDurante a sua trajetória, filiou-se ao Partido Republicano Sergipense e\nao grupo político do monsenhor Olímpio Campos – antigo político do\nImpério, organizador da política oligárquica em Sergipe com o apoio do\npresidente Campos Sales –, com o qual veio a romper mais tarde,\naproximando-se, em 1906, do Partido Progressista de Fausto Cardoso.\nConquistou mais três mandatos de deputado federal por Sergipe,\ncompletando-os nas legislaturas 1909-1911 e 1912-1914, e deixando o\núltimo interrompido devido à sua morte, em 7 de maio de 1916.\n\nFoi sócio-efetivo do Instituto Histórico e Geográfico Brasileiro,\nsócio-honorário do Instituto Histórico e Geográfico de São Paulo,\nsócio-correspondente do Instituto Histórico e Geográfico de Sergipe e\nmembro do Instituto Arqueológico de Pernambuco.\n\nEscreveu inúmeros artigos na imprensa e publicou, entre outros,\n*História de* *Sergipe: 1575-1855* (1891); *História constitucional da\nRepública dos Estados Unidos do Brasil* (3 v., 1895); *Noções de direito\npátrio e economia política* (1896); *História territorial do Brasil*\n(1906); *Direitos do Amazonas sobre o território do Acre: estudo\nhistórico e político* (1906); *História do Banco do* *Brasil* (1907);\n*Os portugueses no Brasil: estudo histórico e crítico* (1907); *Os\nbastidores da política no Brasil: vida íntima de D. Pedro II e os\ngrandes homens do segundo Império* (1911).\n\nSérgio Montalvão\n\n**FONTES:** DANTAS, J. *História*; FREIRE, A.; CASTRO, C. *Bases*;\nGUARANÁ, M. *Dicionário*; PASSOS, A. *Primeiro*.\n","ref":"**FONTES:** DANTAS, J. *História*; FREIRE, A.; CASTRO, C. *Bases*;\nGUARANÁ, M. *Dicionário*; PASSOS, A. *Primeiro*.\n","dic":"DHBPR"}
