{"title":"ALVES, Rodrigues","cargoss":["Deputado Geral","Presidente de associação ou confederação de empregados ou empregadores","Constituinte","Deputado federal","Ministro da Fazenda","Senador","Ministro da Fazenda","Senador","Presidente de associação ou confederação de empregados ou empregadores","Presidente da República","Presidente de associação ou confederação de empregados ou empregadores","Senador","Presidente da República"],"cargos_esp":[0,0,0,0,0,0,0,0,0,0,0,0,"eleito"],"datas_ini":[1885,1887,1891,1891,1891,1893,1894,1897,1900,1902,1912,1916,1918],"datas_fim":[1887,1888,1891,1891,1892,1894,1896,1900,1902,1906,1916,1917,1918],"estados":["SP","SP",0,"SP",0,"SP",0,"SP","SP",0,"SP","SP",0],"autor":[0],"content":"**ALVES, Rodrigues**\n\n\\* dep. geral SP 1885-1887; pres.SP 1887-1888; dep. geral SP1888-1889;\nconst. 1891; dep. fed. SP 1891;min. Faz. 1891-1892; sen. SP\n1893-1894;min. Faz. 1894-1896; sen. SP 1897-1900;pres. SP 1900-1902;\npres. Rep.1902-1906; pres.SP 1912-1916; sen. SP 1916-1917; pres.Rep.\neleito 1918.\n\n*Francisco de Paula Rodrigues Alve*s nasceu nafazenda de Pinheiro Velho,\npertencente aseu avô materno, no município de Guaratinguetá(SP), no vale\ndo Paraíba, em 7de julho de 1848, filho de DomingosRodrigues Alves e de\nIsabel Perpétua (NháBela) Alves. Seu pai, português de nascimento,veio\nsozinho para o Rio de Janeiroem 1832 e daí mudou-se para\nGuaratinguetá,onde se dedicou ao comércio e àlavoura e constituiu\nfamília. Sua mãeera filha do mineiro José de Paulae Silva e de Maria\nLuísa dos AnjosQuerido, de família da vila de Cunha(SP), onde parentes\nhaviam participado daadministração local. Seu irmão, coronel\nVirgílioRodrigues Alves, foi senador estadual emSão Paulo (1901-1919),\nvice-presidente do estado(1920-1922) e membro da comissão executivado\nPartido Republicano Paulista (PRP).\n\nTerceiro de 13 irmãos, Franciscofez os primeiros estudos em\nGuaratinguetá.Em 1859 foi matriculado no Colégio PedroII, no Rio de\nJaneiro, considerado amelhor escola secundária do país, ondefoi colega\nde internato de Joaquim Nabuco.Em 1866 ingressou na Faculdade de\nDireitode São Paulo. Fundada em 1827, juntamentecom a de Olinda, a\ninstituição tinhaentão o nome de Academia de CiênciasSociais e Jurídicas\ne foi um celeirode políticos, como o próprio RodriguesAlves e seus\ncontemporâneos Joaquim Nabuco,Rui Barbosa, Castro Alves e Afonso Pena.\n\nNa faculdade, destacou-se nos estudos,sempre aprovado com o grau máximo,\neiniciou a militância política na ala conservadora,que se opunha à dos\nliberais eda qual faziam parte Rui Barbosa eAfonso Pena. Pertenceu ao\ngrupo do jornal*Imprensa Acadêmica*, órgão dos conservadores, doqual foi\nredator-chefe em 1869 e ondeescrevia sobre assuntos internacionais, de\nmodoespecial sobre a Guerra do Paraguai (1865-1870).Entrou também para a\nmaçonaria e foium dos dirigentes da *Burschenschaft*, sociedadesecreta\natuante na Faculdade de Direito,da qual participaram muitos daqueles\nquese destacariam na política imperial erepublicana. Embora a chamada\n“Bucha” paulistafosse liberal, abolicionista e republicana,\nalgunsestudantes, quando se tornaram estadistas, optarampela orientação\nconservadora, escravocrata emonarquista. A loja *Fraternidade*, que\nfuncionavana academia e tinha como bandeira oabolicionismo,\ntransformou-se na associação pública*Fraternidade Primeira*, da qual\nparticiparam RodriguesAlves, Rui Barbosa e o ex-escravo LuísGama.\n\nRodrigues Alves formou-se em 1870e logo em seguida voltou para\nGuaratinguetá.Nomeado promotor público interino, no anoseguinte foi\nefetivado. Sua carreira políticateve início em 1872, quando foi\neleitodeputado provincial na legenda do PartidoConservador, com o apoio\nde Franciscode Assis de Oliveira Borges, viscondede Guaratinguetá, homem\nrico e chefe políticolocal. Em 1873 foi nomeado juiz municipale primeiro\nsubstituto do juiz de direitoda comarca, e no ano seguinte foireeleito\ndeputado provincial. Em seu primeiromandato, defendeu o ensino\nobrigatório. Jáno segundo, manifestou-se quanto à interpretaçãodo Ato\nAdicional, à questão religiosae ao problema servil, situando-se comoum\nemancipacionista moderado e contrário aoprojeto que criava um imposto\nprovincialsobre escravos.\n\nMIS-RJ\n\n![Description: G:\\\\Trabalho para a Mirna\\\\MIS\\\\Presidentes da República\n- Imagens MIS\\\\ALVES, (Francisco de Paula) Rodrigues (1902-\n1906).jpg](ALVES,%20Rodrigues%20_arquivos/image001.jpg)\n\nFrancisco de Paula Rodrigues Alves.\n\nEm 1875 casou-se com sua prima-irmãAna Guilhermina de Oliveira Borges,\nnetavisconde de Guaratinguetá. Por seu lado,seu irmão Virgílio casou-se\ncom MariaGuilhermina, irmã de Ana Guilhermina. Nãotendo conseguido\neleger-se para o biênio1876-1877, além de prosseguir na carreirade\nmagistrado, associou-se à sogra e aoirmão Virgílio para explorar a\nfazendade café Três Barras e abriu a firmaViúva Borges e Genros. Com a\ndecadênciada produção cafeeira na região, acompanhoujunto com o irmão a\nmarcha do cafépara o oeste paulista, onde abriu asfazendas São Manoel,\nSanta Ana e SantaMaria, entre os municípios de Jaú eBauru, e criou a\nfirma Rodrigues Alvese Irmão. Voltou à Assembleia provincialde 1878 a\n1879, junto com os republicanosPrudente de Morais e Martinho Prado.\n\nEm 1885 – época em que,pela Lei Saraiva, já existia o votodireto – foi\neleito deputado geral. Segundoseu biógrafo Afonso Arinos de Melo\nFranco,sem exercer mandatos no período anterior,pôde preparar\ncuidadosamente suas bases políticas.Transferindo-se com a família para o\nRiode Janeiro para ocupar uma cadeira naCâmara dos Deputados, de início\nteve umaparticipação apagada, mas foi reeleito parao biênio 1887-1888.\nLigou-se então à UniãoConservadora, ala dissidente criada no seiodo\nPartido Conservador e liderada porAntônio Prado, que tinha como\nporta-vozo *Correio Paulistano*.\n\nEm 8 de novembro de 1887foi nomeado pelo gabinete Cotegipe presidenteda\nprovíncia de São Paulo. Assumiu ogoverno 11 dias depois, em um momentode\nséria agitação decorrente de revoltasde escravos incentivadas pelos\nabolicionistas.No tocante à saúde, providências foramtomadas para\ndebelar a epidemia de varíolaque assolou a cidade de Santos, portode\nentrada dos imigrantes. Adotou medidaspara promover a imigração, mas não\nconseguiuconter as rebeliões de cativos.\n\nQuando o barão de Cotegipe pediudemissão do Conselho de Ministros,\nemmarço de 1888, deixou a presidência daprovíncia e voltou à Câmara dos\nDeputados,onde se discutia a emancipação dos escravos.Votou\nfavoravelmente à Lei Áurea e, emagosto do mesmo ano, recebeu o títulode\nconselheiro do Império, outorgado pelaprincesa Isabel. Nessa época,\npassou aser chamado de conselheiro Rodrigues Alvese a colaborar no\njornal *O Debate*, assinandoseus artigos com o pseudônimo de Gide,quando\nfalava de economia. Os caricaturistasda *Revista Ilustrada* e de *O\nMalho* insistiam naimagem de Rodrigues Alves dorminhoco.\n\nConstituinte, Ministro, Senador e Presidentede São Paulo\n\nProclamada a República em 15 denovembro de 1889, e convocada a\nAssembleiaNacional Constituinte, os políticos paulistasformaram sua\nchapa e convidaram para integrá-laos monarquistas Rodrigues Alves e\nAntônioPrado, a fim de contar com suaexperiência e garantir sua adesão\nao novoregime. Eleito e empossado em 15 denovembro de 1890, Rodrigues\nAlves teveuma participação apagada, mas foi um dossignatários da\nConstituição de 24 de fevereirode 1891. Com a transformação da\nConstituinteem Congresso Nacional, composto de SenadoFederal e Câmara\ndos Deputados, foi eleitopara a Comissão de Finanças desta últimacasa.\n\nEm 3 de novembro de 1891,o presidente da República, marechal Deodoroda\nFonseca, dissolveu o Congresso pordiscordar da votação da lei\nreguladorados crimes de responsabilidade. O Congressoe a Marinha\nreagiram e, em movimentochefiado por Custódio de Melo e\nEduardoWandenkolk, o navio *Aquidabã* bombardeou o Riode Janeiro. Em 23\nde novembro Deodororenunciou. Em seu lugar assumiu o\nvice-presidente,marechal Floriano Peixoto, que nomeou RodriguesAlves\nministro da Fazenda, com a missãode normalizar as finanças do país\nemface das graves consequências da políticado Encilhamento adotada pelo\nministro RuiBarbosa, integrante do governo de Deodoro.Era intento do\nnovo ministro encamparas emissões bancárias, retirar os\nprivilégiosconcedidos aos bancos emissores e pôrem prática um plano de\ncontenção, inclusivede divisas. Em 1892, quando Floriano Peixotorecusou\no plano proposto pelos banqueirosingleses da família Rothschild para\nrecuperara estabilidade financeira do país, o ministropediu demissão,\nsendo substituído por SerzedeloCorreia.\n\nTambém em 1892 a comissão executivado PRP foi reconstruída, com\nPrudentede Morais na presidência. Rodrigues Alves,ex-monarquista, passou\na integrá-la. Em marçode 1893, foi eleito senador por SãoPaulo, para\nterminar o mandato de RangelPestana, que renunciara para assumir\napresidência do Banco da República do Brasil.Suas intervenções foram\nsempre ligadas aotema das finanças. Em 1894, na renovaçãode um terço do\nSenado, foi reeleitopara um mandato de nove anos.\n\nNo dia 15 de novembro de1894, tomou posse na presidência da\nRepúblicaPrudente de Morais, primeiro presidente civil,que chegou ao\ncargo através de eleiçãodireta. Rodrigues Alves renunciou então\naomandato de senador para voltar a serministro da Fazenda. Enquanto, na\náreapolítica, Prudente de Morais tentava pacificaro Sul do país, o\nministro procuravareestruturar as finanças, defendendo internamenteo\npapel-moeda e, externamente, o câmbio,além de negociar com bancos\nestrangeiros.Em 1896, a situação do país seagravou com a queda das\nexportações eo aumento das importações, faltando divisaspara saldar os\ncompromissos externos. Iniciaram-seentão as negociações do *funding\nloan*, empréstimode consolidação, entre Londres e o governobrasileiro.\nNesse mesmo ano, em novembro,grave doença levou Prudente de Moraisao\nafastamento da presidência, e seu vice,Manuel Vitorino, assumiu o cargo.\nO ministériofoi reformulado e Rodrigues Alves foisubstituído pelo também\npaulista Bernardino deCampos.\n\nPrudente de Morais reassumiu ogoverno no dia 4 de março de\n1897,comunicando o ato a Manuel Vitorino pormeio de um bilhete lacônico,\ndadas asdifíceis relações entre ambos. Sua voltaao poder foi motivada\npelas agitaçõesdecorrentes dos insucessos das tropas federaisem Canudos.\nRodrigues Alves foi reeleitosenador em 26 de junho, em pleitorealizado\npara preencher a vaga abertacom a renúncia de Cerqueira César. Em5 de\nnovembro, ao comparecer à recepçãoaos militares que retornavam de\nCanudos,no cais do Arsenal da Guerra, Prudentefoi alvo de um atentado\nque custoua vida de seu ministro da Guerra,marechal Carlos Machado\nBittencourt. Prudentehavia sido avisado de que jacobinos, queidolatravam\nFloriano, ameaçavam sua vida.\n\nEleito presidente em março de 1898,antes de tomar posse Campos Sales\nviajouà Europa para ultimar negociações visandoa defender o país da\ncrise econômicaque o ameaçava. No Senado, Rodrigues Alvesassumiu várias\nvezes a tribuna para tratarde questões econômicas, além de ter\nproferidodiscurso em defesa de Prudente de Morais.Ao ser empossado na\npresidência em novembro,Campos Sales instituiu a política\ndosgovernadores, ou política dos estados, buscandoa concórdia\npartidária. Rodrigues Alves foiseu porta-voz no Senado, ao mesmo tempoem\nque, na política paulista, era membroda comissão executiva do PRP. Em\nfevereirode 1899, estava já assentada sua idapara o governo de São Paulo\nsucedendoa Fernando Prestes, chefe político deItapetininga.\n\nRodrigues Alves foi eleito presidentede São Paulo em 15 de fevereiroe\nempossado em 1^o^ de maiode 1900. Declarou em seu discurso deposse que\nestimularia a lavoura. Grande*s esforços* foram despendidos para\nenfrentar a questãosanitária, pois grassava uma epidemia defebre amarela\nem alguns municípios dointerior e casos de peste bubônica\nalarmavamSantos, porto de entrada dos imigrantes.Como medida\ncomplementar para prevenir osaneamento, criou o Instituto Butantã,\ndestinadoà seroterapia (pesquisa de soros terapêuticos).O serviço de\nhigiene pública no estadofoi dirigido pelo sanitarista Emílio Ribas.\n\nEram grandes as dificuldades financeirasoriundas da crise econômica\ncausada pelabaixa do preço do café nos mercadosinternacionais e pela\nsuperprodução decorrenteda enorme expansão dos cafezais. ParaRodrigues\nAlves, os problemas não se resumiamà oscilação dos preços do mercado\ninternacional;estavam também ligados à produção. Paragarantir mão de\nobra para a lavouracafeeira, tomou então medidas para estimulara\nimigração.\n\nNo início de 1902, renunciou aogoverno de São Paulo para candidatar-seà\npresidência da República na sucessãode Campos Sales, que o apoiava.\nSeuvice seria o mineiro Silviano Brandão,presidente do estado de Minas\nGerais.Para governar São Paulo, indicou o republicanohistórico\nBernardino de Campos. Deu-se entãoa cisão no seio do PRP, pois nemtodos\nos membros do partido aceitavama política dos governadores de\nCamposSales e sua imposição de candidatos aogoverno dos estados, vista\ncomo autoritária.Os dissidentes propunham também a revisãoda\nConstituição. Era um grupo de republicanoshistóricos que se unia em\ntorno dePrudente de Morais. O manifesto inauguraldo Partido Republicano\nDissidente de SãoPaulo, datado de 3 de setembro de1901, era assinado por\nCerqueira César,Júlio de Mesquita, Adolfo Gordo, AlbertoSales, irmão do\npresidente, e Manuel deMorais Barros, entre outros.\n\nPresidente da República\n\nApoiado por Campos Sales, RodriguesAlves foi eleito presidente da\nRepúblicaem 1^o^ de março e tomouposse em 15 de novembro de 1902.O\nvice-presidente Silviano Brandão faleceu antesda posse e, depois de\nmuitas tratativas,foi substituído pelo mineiro Afonso Pena.Para o\nMinistério do Exterior foi convidadoJosé Maria da Silva Paranhos Júnior,\nobarão do Rio Branco, que, depois demuitas negativas, aceitou o posto.\nParaa Fazenda, o indicado foi o republicanohistórico Leopoldo Bulhões.\nAo baiano JoséJoaquim Seabra coube a pasta do Interiore Justiça, e a\nLauro Müller, ada Viação, Indústria e Obras Públicas.O ministro da\nGuerra era o generalFrancisco de Paula Argolo e o daMarinha, o almirante\nJúlio César de Noronha.Embora sem o *status* de ministro, PereiraPassos,\nOsvaldo Cruz e Paulo de Frontinforam peças fundamentais na presidência\nRodriguesAlves, os dois primeiros na transformaçãoe saneamento do Rio de\nJaneiro eFrontin na remodelação do porto e urbanizaçãoda cidade.\n\nPrudente de Morais pacificara opaís, Campos Sales promovera a\nrecuperaçãofinanceira e Rodrigues Alves teve entãocondições de levar\navante um plano degoverno reformista. Sua proposta incluía opredomínio\ncivil, a atenção à políticaexterna, o saneamento da cidade do Riode\nJaneiro, com a erradicação da febreamarela, a reurbanização da cidade,\nomelhoramento do porto, a expansão da redeferroviária nacional, o\nincentivo à imigração,com a fixação dos estrangeiros no campo,e uma\nfirme gestão financeira para possibilitara realização do plano de obras.\n\nA missão do barão do RioBranco no Ministério do Exterior se inicioupela\nquestão da fixação das fronteiras,resolvida através de negociações.\nComeçou coma questão do Acre, região de seringaisque, pelo Tratado de\nLimites de 1867,pertencia juridicamente à Bolívia, mas forapovoada por\nbrasileiros, sendo o únicoacesso às vias fluviais do sistema\namazônicopertencentes ao Brasil. Uma rebelião ocorreraquando foi\nproclamada a República do Acrepor Luiz Galvez Rodrigues de Arias,\nexigindoa anexação do território ao Brasil. Ariasacabou expulso pelas\nforças armadas dosdois países. Nova rebelião ocorreu em1902, quando o\ngoverno boliviano arrendoua área para o Bolivian Syndicate ofNew York, e\nos brasileiros decretaramo Estado Independente do Acre. A questãofoi\nresolvida por Rio Branco através doTratado de Petrópolis, assinado com\naBolívia e o Peru. O Brasil comproua região, anexando o território do\nAcre,e comprometeu-se a indenizar o BolivianSyndicate of New York e a\nconstruira ferrovia Madeira-Mamoré, para possibilitaro escoamento da\nprodução da borracha pelosportos de Manaus e Belém.\n\nTambém as questões dos limitescom o Peru, Colômbia e Uruguai\nforamresolvidas em negociações diplomáticas. No últimocaso, apenas em\n1909 foi assinado otratado pelo qual o Brasil cedia aoUruguai a\ncossoberania das águas limítrofesda lagoa Mirim e do rio Jaguarão.\n\nOutra iniciativa importante de RioBranco foi a transformação da\nlegaçãobrasileira em Washington na primeira embaixadado Brasil. O\npresidente norte-americano eraTheodore Roosevelt, Joaquim Nabuco foi\nnomeadoembaixador brasileiro, e David E. Thompsonveio para o Brasil como\nembaixador dosEstados Unidos.\n\nQuanto à gestão financeira, a propostado governo era sanear a moeda,\nhonraro crédito e firmar o câmbio emalta, condições vistas como\nnecessárias paralevar a bom termo o programa deobras, que seria em\ngrande parte financiadopor bancos estrangeiros. O ministro\nLeopoldoBulhões procedeu à reforma do Tesouroe à reorganização do Banco\ndo Brasil,que se tornou uma espécie de BancoCentral, com a incumbência\nde regularas taxas cambiais.\n\nO Rio de Janeiro, capital dopaís, era uma cidade insalubre. Ruas\nestreitas,becos e falta de higiene propiciavam atransmissão de doenças.\nEpidemias de varíola,febre amarela e peste bubônica ocorriame atingiam\nem maior número a populaçãode baixa renda, cujas condições de\nhabitaçãoeram precárias. As condições da cidadedificultavam a vinda de\nimigrantes e afugentavamvisitantes. Rodrigues Alves pôs em práticaum\nprojeto de melhoramento do porto doRio de Janeiro, de reurbanização do\ncentroe de saneamento da cidade, recorrendopara isso a importantes\ncolaboradores.\n\nPara o melhoramento do porto, contoucom a eficiência do ministro da\nViaçãoLauro Müller. No porto do Rio deJaneiro só podiam atracar navios\nde pequenocalado. O embarque de passageiros erafeito na Prainha (praça\nMauá) ou nocais Pharoux (largo do Paço). RodriguesAlves atribuiu\nprioridade à reforma doporto, que requeria outras obras, comoabertura da\navenida Central e da avenidado Mangue, necessárias para o transportede\nmercadorias. Para a realização do projetofoi obtido empréstimo junto ao\nBanco Rothschild,de Londres. A obra seria entregue em1910.\n\nPara coordenar o processo de reformulaçãourbana, nomeou para a\nprefeitura do DistritoFederal o engenheiro Francisco Pereira Passos.A\nabertura da avenida Central, hoje avenidaRio Branco, marcou o início da\nremodelaçãodo Rio de Janeiro, num processo quederrubou cortiços e\nhabitações mais simplese expulsou a população mais pobre daárea, o que\nlevou à revolta popular.Ruas do centro foram alargadas e osmorros do\nCastelo e do Senado, demolidospara abrir espaço às novas vias.\nCuidou-sedo abastecimento de água, da renovaçãoda rede de esgotos e da\nexpansãoda iluminação pública. Em decorrência, usose costumes se\ntransformaram.\n\nOsvaldo Cruz, médico e sanitarista,foi designado para a chefia do\nDepartamentoNacional de Saúde Pública, com a missãode melhorar as\ncondições sanitárias dacidade. Em novembro de 1904, promoveuuma campanha\nde vacinação obrigatória contraa varíola que desencadeou violenta\nreação– a chamada Revolta da Vacina –pela forma autoritária como foi\nfeita,dado que agentes sanitários invadiam ascasas e vacinavam as\npessoas à força.As manifestações e conflitos espalharam-se pelasruas da\ncidade, populares destruíram bondese apedrejaram prédios públicos. Em\n16de novembro de 1904, Rodrigues Alves revogoua lei da vacinação\nobrigatória, colocandonas ruas o Exército, a Marinha ea polícia para\nacabar com os tumultos.A ordem voltou à cidade em poucosdias.\n\nEm 1906 teve lugar no Riode Janeiro a III Conferência Pan-Americana.A\ndelegação brasileira foi chefiada porJoaquim Nabuco e contou com a\npresençado secretário de Estado dos Estados Unidos,Elihu Root. Os\nresultados da conferênciaforam pequenos, sendo a maior conquistaa\nformação de uma comissão de jurisconsultospara proceder à codificação do\ndireitointernacional.\n\nNa segunda metade de seu governo,Rodrigues Alves enfrentou uma grave\ncriseeconômica decorrente da superprodução do café,que levou à queda dos\npreços doprincipal produto da pauta de exportações.Os políticos dos\nestados de São Paulo,Minas Gerais e Rio de Janeiro, empenhadosna adoção\nde uma política de valorizaçãodo café, propuseram o Convênio de\nTaubaté,que implicava uma política financeira deemissões de papel e\nbaixa de câmbio,o que requeria a participação do governofederal.\nPropuseram também a criação daCaixa de Conversão, mecanismo para\nfixarlegalmente a taxa de câmbio de formaa evitar oscilações bruscas,\nprejudiciais aosexportadores.\n\nRodrigues Alves não aceitou essasmedidas, que contrariavam a política\nadotada,dificultando o pagamento dos empréstimos contraídosno exterior\npara custear as obras realizadaspelo governo. Como o mandato\npresidencialterminaria em pouco tempo, adotou umasolução política e\ndeterminou que o Congressodecidisse a questão. Sua decisão de nãoapoiar\no convênio causou o descontentamentode seus conterrâneos, mas deixou\nclarasua orientação política: como presidente, deviaatender aos\ninteresses do país, aindaque contrariassem interesses regionais,\nmesmoque de seu estado.\n\nO governo de conquistas modernizadorasde Rodrigues Alves chegou ao fim\nem1906, e a sucessão foi agitada. Seucandidato era o também paulista e\nrepublicanohistórico Bernardino de Campos. Contudo, osenador gaúcho\nPinheiro Machado patrocinou acandidatura do mineiro Afonso Pena,\ntendocomo vice Nilo Peçanha, então presidentedo Rio de Janeiro. Pinheiro\nMachado haviaanteriormente tentado impor o nome deCampos Sales. Eleito\nem março, AfonsoPena tomou posse em 15 de novembro.\n\nDe Volta à Presidência de SãoPaulo\n\nRodrigues Alves deixou o governosem força política, embora ovacionado,\nevoltou para Guaratinguetá. Em 1907, desligadode qualquer função\npública, viajou à Europacom filhos e filhas. Foi a únicaviagem que fez\nao exterior. Durante cincoanos ficaria afastado de cargos públicos,mas\nnão da vida política. Já devolta da Europa, seu nome começou aser\ncogitado para o governo de SãoPaulo. Em 1909 faleceu Afonso Pena, sendoo\nquadriênio presidencial completado por NiloPeçanha. Para o período\nseguinte, colocaram-seas candidaturas do marechal Hermes daFonseca e de\nRui Barbosa, que desencadeoua Campanha Civilista. Realizada a eleiçãoem\nmarço de 1910, Rui Barbosa foiderrotado, apesar de ter recebido, emSão\nPaulo, o apoio do grupo deex-dissidentes e do jornal *O Estado de S.\nPaulo.*\n\nTambém em 1909, o presidente doestado de São Paulo, Albuquerque\nLins,passou o governo ao vice, Fernando Prestes.Para o período seguinte\nforam cogitadosos nomes de Fernando Prestes, sustentadopor Jorge\nTibiriçá, e de Olavo Egídiode Sousa Aranha, proposto pelos\nex-dissidentescom o apoio de Albuquerque Lins. Aescolha final recaiu\nsobre Rodrigues Alves,que aceitou a indicação. Foi eleito em1^o^ de\nmarco de 1912, tendocomo vice Carlos Guimarães, político ligadoà\ndissidência.\n\nUma das primeiras questões enfrentadaspelo novo governo dizia respeito à\ndefesado café paulista armazenado em Nova Iorquecomo garantia para os\nempréstimos referentesao plano de valorização do Convênio deTaubaté. O\nestoque estava ameaçado desequestro pelo governo americano, que\npressionavapela baixa do preço do produto, dadoque uma alta deveria\nocorrer com aprojetada cobrança de um imposto especialsobre o café.\nHavia uma ameaça deretaliação contra o Brasil nos impostosalfandegários.\nDepois de difíceis negociações,a solução encontrada foi a venda\ndoestoque armazenado em Nova Iorque, noprazo de seis meses. Os preços\nseriamos acordados no Convênio de Taubaté. Oestoque foi vendido\ncomercialmente a cidadesamericanas e não em leilões. RodriguesAlves, que\nfora contrário ao Convêniode Taubaté quando presidente da República,foi\nobrigado a defendê-lo como presidentedo estado de São Paulo.\n\nUma das obras de seu governofoi a construção da ponte sobre orio Tietê\nem Barra Bonita. A restauraçãoda rodovia Caminho do Mar, chamada\ndepoisestrada do Vergueiro, foi iniciada. OGabinete de Investigações e\nCapturas criadoem 1910 foi reorganizado, e a PolíciaCivil de São Paulo\nfoi modernizada ereequipada. Foi implantada a Faculdade deMedicina e\nCirurgia de São Paulo, tendocomo diretor o médico Arnaldo Vieira\ndeCarvalho. As primeiras aulas foram dadasem 1913. Posteriormente, em\n1925, a instituiçãoteve seu nome alterado para Faculdadede Medicina de\nSão Paulo e em 1934foi incorporada à recém-criada Universidade deSão\nPaulo.\n\nO estado físico de Rodrigues Alvesfê-lo licenciar-se para tratamento,\npassandoo governo ao vice-presidente Carlos Guimarãesem 11 de outubro de\n1913. Afastadodo governo, acompanhava pelos jornais epor conversas com\nvisitantes os acontecimentosnacionais e internacionais. Quando a\nPrimeiraGuerra Mundial irrompeu, no dia 14 deagosto de 1914, logo\nescreveu a CarlosGuimarães e recomendou o corte de despesas,prevendo que\no crédito para São Pauloficaria mais difícil. Apenas em 4 denovembro de\n1915 reassumiu o posto.\n\nO presidente a República, desdenovembro de 1914, era Venceslau Brás,e o\nvice-presidente era o político maranhenseUrbano Santos. A escolha de\nVenceslauresultara de um difícil processo, dadoque São Paulo não\naceitara o nomede Pinheiro Machado. Campos Sales chegoua ser lembrado,\nmas não foi aceito,vindo a falecer em 1913. Venceslau Brásapoiou o\nprojeto de revisão constitucionalque defendia a eleição do presidente\npeloCongresso e o controle dos empréstimosexternos estaduais. Rodrigues\nAlves opôs-se firmementeà reforma, achando-a inoportuna e\nconsiderandoque o presidente já dispunha de recursosnecessários ao\nexercício do governo.\n\nDurante o governo Venceslau Brás,deu-se a segunda dissidência paulista.\nAsucessão do presidente do estado de SãoPaulo já estava acordada em\ntorno donome de Rubião Júnior. Faleceu Rubião,e o grupo dos\nex-dissidentes não aceitoua indicação de Altino Arantes como\ncandidato;propunham o adiamento da convenção atéque um nome de consenso\nfosse encontrado.A proposta não foi aceita, desencadeandoa segunda\ndissidência.\n\nUm dos fatos marcantes do anode 1915 foi o assassinato do\nsenadorPinheiro Machado, líder gaúcho e republicanohistórico, criador do\nPartido Republicano Conservador(PRC), com grande influência em todasas\nsucessões presidenciais. Pinheiro Machado foiapunhalado pelas costas por\nFrancisco MansoPaiva, na porta do Hotel dos Estrangeiros,no Rio de\nJaneiro, no dia 8 desetembro.\n\nO mandato de Rodrigues Alves napresidência de São Paulo terminou em\n1916,e seu substituto foi Altino Arantes. Novamente,o ex-presidente\nvoltou a Guaratinguetá. Foilogo procurado para integrar a\ncomissãodiretora do PRP, que ficou assim composta:Rodrigues Alves\n(presidente), Jorge Tibiriçá,Albuquerque Lins, Pádua Sales, Carlos\ndeCampos, Lacerda Franco, Fernando Prestes, OlavoEgídio e Rodolfo\nMiranda.\n\nCom a morte do senador FranciscoGlicério, Rodrigues Alves foi convidado\nacandidatar-se no pleito realizado em 20de novembro de 1916 para\npreencher avaga aberta na representação paulista. Poucofrequentou o\nSenado, mas esteve presentena sessão de 26 de outubro de 1917,na qual\nfoi aprovado unanimemente o estadode guerra com a Alemanha. Renunciou\naomandato quando foi indicado para ser candidatoa presidente da\nRepública, e sua vagafoi ocupada por Álvaro de Carvalho.\n\nÚltima Eleição\n\nQuando se discutiam indicações paraa presidência da República, o nome\ndeRodrigues Alves era sempre lembrado. Nesseprocesso, terminou a segunda\ndissidência, porcompreenderem os situacionistas e os dissidentesque\nsomente unida a política paulistateria condições de sustentar Rodrigues\nAlvescomo candidato presidencial. Foi então reestruturadaa comissão\ndiretora do PRP e nelatomaram lugar dois ex-dissidentes, Adolfo Gordoe\nCesário Bastos. A convenção do partido,em 7 de junho de 1917,\ndesignouRodrigues Alves candidato à presidência eo mineiro Delfim\nMoreira candidato a vice.Ambos foram eleitos em 1^o^ demarço de 1918.\n\nDesde o fim de 1917, a saúdede Rodrigues Alves declinava. Em novembrode\n1918, a terrível epidemia de gripeespanhola atingiu o Brasil, causando\ninúmerasmortes. O presidente, já com a saúdedebilitada, foi atingido\npela gripe enão pôde tomar posse em 15 de novembro.Em seu lugar assumiu\no vice-presidenteDelfim Moreira, com o ministério compostopelo\npresidente eleito.\n\nRodrigues Alves faleceu no dia16 de janeiro de 1919. Segundo opreceito\nconstitucional, novas eleições foramconvocadas para 13 de abril daquele\nano.Foi eleito o paraibano Epitácio Pessoa,que colhia os louros de sua\natuaçãocomo chefe da delegação brasileira naConferência de Versalhes,\nque estabeleceu ascondições da paz após a Primeira GuerraMundial.\nEpitácio estava ainda na Françaquando se deu a eleição presidencial.\n\nNo decorrer de toda a suavida Rodrigues Alves exerceu o\njornalismopolítico. Nos tempos de estudante, colaborounos jornais\n*Imprensa Acadêmica* e *Opinião Conservadora*,este dirigido por João\nMendes de Almeida.A União Conservadora, ala dissidente formadapor\nAntônio Prado dentro do Partido Conservador,tinha como órgão o jornal\n*Correio Paulistano,* onde escrevia com frequência. Já no\nperíodorepublicano, colaborava com assiduidade no jornal*O Debate*,\nórgão oficioso do governo. No*Correio Paulistano,* alguns artigos sem\nassinatura lhesão atribuídos por seu biógrafo AfonsoArinos de Melo\nFranco. O jornalismo erapara Rodrigues Alves um instrumento deação\npolítica.\n\nNão publicou livros em vida, masdeixou cadernos manuscritos de anotações\neartigos de cunho político publicados emjornais. Nos anais dos\nLegislativos paulistae federal, encontram-se as mensagens\npresidenciaisenviadas a cada ano de seu governo,como presidente do\nestado de São Pauloe da República, assim como os discursospronunciados\nnas diferentes casas.\n\nA família de Rodrigues Alves tevegrande participação na política\npaulista nosúltimos anos do Império e na PrimeiraRepública. Entre seus\nfilhos, José dePaula Rodrigues Alves foi embaixador, Franciscode Paula\nRodrigues Alves Filho foi deputadofederal, e Oscar Rodrigues Alves foi\nconstituintede 1934. Sua filha Maria casou-se comÁlvaro Augusto da Costa\nCarvalho, quefoi secretário estadual de Agricultura, vereador,deputado\nestadual, deputado federal e senadorpor São Paulo. Joaquim José Cardoso\ndeMelo Neto, casado com outra filha, Celina,foi governador e interventor\nem São Paulo(1937-1938). Tempos mais tarde, o sobrinho-netoCarlos\nAlberto Alves de Carvalho Pintotambém foi secretário de Finanças e\ndaFazenda de São Paulo, governador do estado(1959-1963), ministro da\nFazenda no governode João Goulart e (1963) e senador(1967-1975).\n\nAlice Beatriz da Silva Gordo Lang\n\n**FONTES:** BELLO, J. *História*; CARONE,E*. República* (v.1); CASTRO,\nS. *República*; FRANCO,A. *Rodrigues*; LANG, A. *Adolpho*; LOVE,J.\n*Locomotiva.*\n","ref":"**FONTES:** BELLO, J. *História*; CARONE,E*. República* (v.1); CASTRO,\nS. *República*; FRANCO,A. *Rodrigues*; LANG, A. *Adolpho*; LOVE,J.\n*Locomotiva.*\n","dic":"DHBPR"}
