{"title":"GALVÃO, Oliveira","cargoss":["Constituinte","Senador"],"cargos_esp":[0,0],"datas_ini":[1891,1891],"datas_fim":[1891,1896],"estados":[0,"RN"],"autor":["Renato Amado Peixoto"],"content":"**GALVÃO, Oliveira**\n\n\\* militar; const. 1891; sen. RN 1891-1896.\n\n*José Pedro de Oliveira Galvão* nasceu no sítio Poção, em Goianinha\n(RN), no dia 10 de agosto de 1840, filho de José Pedro da Luz e de Maria\nJosefina da Luz.\n\nSentou praça em 1862 e participou da Guerra do Paraguai (1864-1870).\nAluno da Escola Central do Rio de Janeiro nas armas de infantaria e de\ncavalaria, em 1871 saiu alferes. Foi promovido a tenente em 1876 e a\ncapitão em 1879. Abolicionista e republicano, participou no Rio de\nJaneiro, então capital do Império, do grupo de oficiais que manifestou\nsolidariedade a Benjamin Constant às vésperas da queda da monarquia.\nAmigo do marechal Deodoro da Fonseca e comandante de um dos principais\nregimentos da então capital do Brasil, foi um dos responsáveis diretos\npelo sucesso dos acontecimentos que culminaram na proclamação da\nRepública (15/11/1889). Em 1890 foi promovido por merecimento a major e\na tenente-coronel.\n\nAinda em 1890, seu nome foi lembrado por Pedro Velho de Albuquerque\nMaranhão, principal liderança republicana no Rio Grande do Norte, para\nintegrar a chapa do Partido Republicano nas eleições para o Congresso\nNacional Constituinte. O interesse de Pedro Velho se explicava por seu\nprestígio militar, pelo fato de ser próximo a José Bernardo de Medeiros,\no líder da região do Seridó, e também pelo fato de sua irmã ser casada\ncom João Avelino Pereira de Vasconcelos, primo do próprio Pedro Velho.\nAssim, em 15 de setembro foi eleito senador constituinte na legenda do\nPartido Republicano do Rio Grande do Norte. Empossado em 15 de novembro,\nfoi signatário da Constituição promulgada em 24 de fevereiro de 1891 e\nno dia seguinte, na eleição para presidente realizada pelo Congresso\nConstituinte, votou em Deodoro da Fonseca. Apoiou depois a designação de\nFrancisco Amintas da Costa Barros para governador do Rio Grande do Norte\npor Deodoro e a subsequente eleição de Miguel Joaquim de Almeida Castro\npara governador pela Assembleia Constituinte estadual. Exercendo o\nmandato ordinário no Senado desde junho de 1891, participou da Comissão\nde Marinha e Guerra.\n\nA renúncia do marechal Deodoro à presidência e sua substituição pelo\nvice-presidente Floriano Peixoto em 23 de novembro de 1891 teve direta\nrepercussão nas situações políticas estaduais. No Rio Grande do Norte,\nMiguel Castro foi deposto por Pedro Velho e José Bernardo no dia 28 de\nnovembro. Já no governo de Pedro Velho (1892-1896), quando este lutava\npara eleger seu irmão Augusto Severo deputado federal, Oliveira Galvão\nfoi um dos signatários do manifesto que reuniu toda a oposição em torno\ndo nome de Tobias Monteiro. No plano federal, fiel à memória de Deodoro,\npassou a integrar a oposição ao governo do marechal Floriano Peixoto\n(1891-1894). Foi procurado por José Bernardo, então o principal líder da\noposição no Rio Grande do Norte, interessado em articular a derrubada de\nPedro Velho, mas, como Floriano Peixoto mandou prendê-lo durante a\nRevolta da Armada (1893-1894), a ruptura com José Bernardo tornou-se\ninevitável.\n\nFoi efetivado como coronel em 1895 e reformado como general de brigada\nem 1896.\n\nFaleceu no Rio de Janeiro em 2 de outubro de 1896.\n\nEra casado com Elvira Souto Galvão, com quem teve dois filhos.\n\nRenato Amado Peixoto\n\n**FONTES:** BUENO, A*. Visões*; CARVALHO, J. *Primeiras*; CASCUDO, L.\n*Antologia*; CASCUDO, L. *História da República*; CASCUDO, L. *História\ndo Rio Grande do Norte*; CASCUDO, L. *Vida*; LIRA, A. *História*;\nSILVEIRA, U. *Galeria.*\n","ref":"**FONTES:** BUENO, A*. Visões*; CARVALHO, J. *Primeiras*; CASCUDO, L.\n*Antologia*; CASCUDO, L. *História da República*; CASCUDO, L. *História\ndo Rio Grande do Norte*; CASCUDO, L. *Vida*; LIRA, A. *História*;\nSILVEIRA, U. *Galeria.*\n","dic":"DHBPR"}
