{"title":"GAMA, Domício da","cargoss":["Embaixador do Brasil - EUA","Ministro das Relações Exteriores","Embaixador do Brasil - Inglaterra"],"cargos_esp":[0,0,0],"datas_ini":[1910,1918,1919],"datas_fim":[1918,1919,1924],"estados":[0,0,0],"autor":[0],"content":"**GAMA, Domício da**\n\n\\*diplomata; emb. Bras. EUA 1910-1918; min. Rel. Ext. 1918-1919; emb.\nBras. Inglaterra 1919-1924.\n\n*Domício da Gama* nasceu em Maricá, na então província do Rio de\nJaneiro, em 13 de outubro de 1862. O nome civil era Domício Antônio\nForneiro, mas o sobrenome Gama foi adotado em homenagem ao padrinho, sem\ndescendentes e que lhe dera assistência.\n\nSeu pai, Domingos Afonso Forneiro, era português de nascimento, mas se\nestabeleceu no Brasil e criou sete filhos brasileiros. Era figura\nsevera, e enviou os filhos para estudar em Friburgo, no Colégio Interno\nde Visconde de São Valentim, e fazer os preparatórios na Corte, no\nColégio do Padre Guedes. Encaminhou os filhos mais moços, Domício e\nSebastião, para estudar engenharia no Rio de Janeiro. Domício cursou os\nprimeiros anos da Escola Politécnica, mas começou a frequentar as rodas\nboêmias e a escrever para jornais, inicialmente o *Jornal do Comércio* e\nem seguida a *Gazeta de Notícias*. Em 1889 foi enviado pela *Gazeta de\nNotícias*, de Ferreira de Araújo, como correspondente à Exposição\nInternacional Comemorativa do Centenário da Revolução Francesa em Paris.\nTeve então um encontro decisivo de sua vida, pois conheceu o barão do\nRio Branco e dele se tornou grande amigo e auxiliar.\n\nEm 1891 foi nomeado auxiliar da Superintendência Geral do Serviço de\nImigração no Brasil e na Europa, dirigida por Rio Branco e com sede em\nParis. Dois anos depois seria secretário da missão especial chefiada por\nRio Branco em Washington para a questão das Missões e, ao término desta,\nseria auxiliar, em 1895, do comissário Rio Branco, encarregado do Brasil\nna questão do limite com a França. Também fez parte da missão especial\nchefiada por Joaquim Nabuco para o arbitramento da questão da Guiana com\na Grã-Bretanha e em 1901 foi nomeado secretário da delegação em\nBruxelas. Nesse período publicou, em 1889, *Histórias curtas*, em 1901,\n*Contos a tinta*, e exerceu intensa colaboração na *Revista Brasileira*,\nna *Revista Moderna de Paris* e na *Ilustração Brasileira*. Tornou-se\ntambém amigo íntimo de Eça de Queiroz.\n\nOcupava a função de secretário da legação do Brasil em Bruxelas quando\nRio Branco foi nomeado ministro das Relações Exteriores e o chamou para\nser seu auxiliar. Nos quatro anos seguintes foi auxiliar direto do barão\ndo Rio Branco. Em 1906 foi designado ministro no Peru, função delicada\nno momento em que ainda estavam sem solução os problemas de limites do\nBrasil com aquele país. Em 1907 foi nomeado ministro da delegação do\nBrasil em Buenos Aires, participando do episódio do telegrama número\nnove.\n\nCom a morte de Joaquim Nabuco em 1910, primeiro embaixador do Brasil\njunto ao governo americano, foi nomeado para essa função, na qual\npermaneceria até 1918. Nesse período teve atuação destacada na defesa do\ncafé brasileiro contra as medidas protecionistas promovidas por\nautoridades norte-americanas. Com a posse do vice-presidente Delfim\nMoreira na presidência da República em novembro de 1918 no lugar do\npresidente eleito Rodrigues Alves – que, gravemente enfermo, viria a\nfalecer em janeiro de 1919 –, foi chamado para a chefia do Ministério\ndas Relações Exteriores. Nesse período ocorreu a escolha do\nrepresentante brasileiro à Conferência de Versalhes. Rui Barbosa recusou\na função, sendo nomeado Epitácio Pessoa.\n\nAo assumir a presidência da República em julho de 1919, Epitácio Pessoa\nnão o reconduziu ao ministério. Foi então nomeado embaixador do Brasil\nem Londres, onde permaneceu até 1924. Nesse período, de 1920 a 1925,\nparticipou de várias reuniões como delegado às sessões do conselho da\nLiga das Nações. Em 1922 presidiu a sessão realizada em Genebra no mês\nde setembro e participou das negociações para a obtenção de um lugar\npermanente para o Brasil no conselho da Liga.\n\nDe volta ao Brasil, veio a falecer pouco depois, em 5 de novembro de\n1925. A vida diplomática impediu que realizasse uma obra literária mais\nextensa, mas, além de dois livros, deixou numerosos artigos e uma\nimportante obra de contista e de ensaísta.\n\nAlberto Venâncio Filho\n\n**FONTES:** BENEVIDES, M. *Depoimento*; GUIMARÃES, A. *Dicionário*;\nPEREIRA, L. *História*; VENANCIO FILHO*,* A*. Domício*; VIANA FILHO, L.\n*Vida.*\n","ref":"**FONTES:** BENEVIDES, M. *Depoimento*; GUIMARÃES, A. *Dicionário*;\nPEREIRA, L. *História*; VENANCIO FILHO*,* A*. Domício*; VIANA FILHO, L.\n*Vida.*\n","dic":"DHBPR"}
