{"title":"ALVIM, Ildefonso Moreira de Faria","cargoss":["Deputado federal"],"cargos_esp":[0],"datas_ini":[1897],"datas_fim":[1902],"estados":["MG"],"autor":["Luciana Pinheiro"],"content":"**ALVIM, Ildefonso Moreira de Faria**\n\n\\* dep. fed. MG 1897-1902.\n\n*Ildefonso Moreira de Faria Alvim* nasceu em Tapiru(MG) no dia 21 de\njaneiro de 1867,filho de Ildefonso Moreira de Faria eSilva e de Maria\nCornélia de Fariae Silva.\n\nFez os estudos secundários nosmunicípios mineiros de Cataguases e Juizde\nFora. Transferindo-se para o Rio deJaneiro, cursou preparatório no\nColégio PedroII. Iniciou a formação superior na Faculdadede Direito de\nRecife, mas diplomou-seem ciências jurídicas e sociais pela Faculdadede\nDireito de São Paulo, em 1889.\n\nRecém-formado retornou ao estado natal,e em janeiro de 1890 tornou-se\npromotorpúblico e a curador geral dos órfãosna comarca de Pomba. Nesse\nmesmo anotransferiu-se para o município de Ubá,onde foi juiz municipal e\nde órfãose juiz de direito. Em 1891 foieleito deputado estadual\nconstituinte e fezparte da chamada “Comissão dos Onze”,grupo responsável\npelo projeto da Constituiçãoestadual. No ano seguinte renunciou\naomandato.\n\nEm março de 1897 foi eleitodeputado federal por Minas Gerais na\nlegendado Partido Republicano Mineiro (PRM). Empossadoem maio na Câmara\ndos Deputados, noRio de Janeiro, então Distrito Federal,foi reeleito em\n1900 e exerceu omandato até dezembro de 1902. Voltou entãopara Minas\nGerais, onde retomou suas atividadescomo advogado.\n\nFaleceu no Rio de Janeiro em10 de agosto de 1927.\n\nCasou-se com Amélia de ResendeAlvim.\n\nPublicou *Sequestro e anticrese; privilégios das sociedades de crédito\nreal* (1899).\n\nLuciana Pinheiro\n\n**FONTES:**CÂM. DEP. *Deputados brasileiros* (p.115); MONTEIRO, N.\n*Dicionário* (v.1, p.27-28);FUND. CASA RUI BARBOSA. Disponível\nem:\\<www.casaruibarbosa.gov.br/\\>. Acesso em: 17/8/2010.\n","ref":"**FONTES:**CÂM. DEP. *Deputados brasileiros* (p.115); MONTEIRO, N.\n*Dicionário* (v.1, p.27-28);FUND. CASA RUI BARBOSA. Disponível\nem:\\<www.casaruibarbosa.gov.br/\\>. Acesso em: 17/8/2010.\n","dic":"DHBPR"}
