{"title":"GODÓI, Gustavo de","cargoss":["Deputado federal"],"cargos_esp":[0],"datas_ini":[1894],"datas_fim":[1902],"estados":["SP"],"autor":[0],"content":"**GODÓI, Gustavo de**\n\n\\* dep. fed. SP 1894-1902.\n\n*Gustavo de Oliveira Godói* nasceu em Pindamonhangaba (SP) no dia 13 de\nmarço de 1848, filho de Antônio de Godói e de Inácia Cândida de Oliveira\nGodói.\n\nFez seus primeiros estudos no Seminário Episcopal de São Paulo, e depois\nno Colégio Marinho, na então capital do Império. Em 1868 matriculou-se\nna Faculdade de Medicina do Rio de Janeiro, formando-se em novembro 1872\ncom distinção nos últimos dois anos. Em 1873 obteve o grau de doutor com\na tese “Uretrotomia”. Retornando a Pindamonhangaba, começou a trabalhar\ncomo médico nessa cidade, e posteriormente em Guaratinguetá, onde abriu\numa clínica e prestou serviços ao hospital local.\n\nAinda durante o Império, em 1888, foi eleito vereador à Câmara Municipal\nde Pindamonhangaba com o apoio dos liberais. Participou ativamente dos\nmovimentos em favor da abolição da escravatura e da república, tendo\nsido fundador, em 29 de julho de 1889, e membro da diretoria do Centro\nRepublicano de sua cidade. Com o advento da República em 15 de novembro\ndaquele ano, foi incumbindo de organizar o governo provisório de seu\nmunicípio. Foi nomeado presidente da Intendência e exerceu o cargo de\n1889 a 1891, quando o então presidente de São Paulo Américo Brasiliense\nfoi forçado a renunciar, e o governo do estado foi transmitido ao vice\nCerqueira César.\n\nEm 7 de março de 1892 foi eleito pelo Partido Republicano Paulista (PRP)\npara o Senado de São Paulo na legislatura 1892-1897. Assumiu o mandato\nem 7 de abril seguinte, mas em 1^o^ de março de 1894 foi eleito deputado\nfederal para a período 1894-1896. Tomou posse na Câmara dos Deputados,\nno Rio de Janeiro, em 3 de maio, e nos anos seguintes foi reeleito para\nas legislaturas 1897-1899 e 1900-1902. Fez parte, na Câmara, da Comissão\nde Instrução Pública.\n\nRetornando a São Paulo, foi novamente eleito senador estadual em 31 de\nmaio de 1903. Tomou posse em 11 de julho e exerceu o mandato até 26 de\ndezembro de 1905, quando renunciou por ter sido nomeado secretário do\nInterior no governo de Jorge Tibiriçá Piratininga, substituindo José\nCardoso de Almeida. Foi ainda secretário interino da Agricultura,\nComércio e Obras Públicas em 1906 e 1907, quando do afastamento do\ntitular Carlos José Botelho, e permaneceu na Secretaria do Interior até\nabril de 1908. Foi então eleito para a vaga de Antônio Cândido Rodrigues\nno Senado estadual e assumiu sua cadeira em 28 de setembro, com mandato\naté fins de 1915. Em fevereiro de 1916 foi reeleito, com mandato até\ndezembro de 1924. Foi membro das comissões da Fazenda e Contas, Obras\nPúblicas, Higiene e Instrução Pública, e ainda da comissão incumbida de\nelaborar leis sobre Terras Públicas, Minas, e Fisco. Foi\nsegundo-secretário da Mesa Diretora entre 1905 e 1906,\nprimeiro-secretário de 1910 a 1916, vice-presidente de 1915 a 1924, e\npresidente interino do Senado estadual em 1915. Além de exercer o\nmandato de senador estadual, participou ativamente na capital de São\nPaulo, como médico voluntário, do combate à gripe espanhola no período\n1918-1919.\n\nFaleceu em Pindamonhangaba no dia 9 de janeiro de 1924, em pleno\nexercício de seu mandato de senador estadual.\n\nAntônio Sérgio Ribeiro\n\n**FONTES:** ABRANCHES, J. *Governos*; CALIMAN, A. *Legislativo*;\n*Correio Paulistano* (10/1/1924); FONSECA, A.; IGNÁCIO, A.; BRISOLLA, C.\n*São Paulo* (v.1); RIBEIRO, A. *Governos*.\n","ref":"**FONTES:** ABRANCHES, J. *Governos*; CALIMAN, A. *Legislativo*;\n*Correio Paulistano* (10/1/1924); FONSECA, A.; IGNÁCIO, A.; BRISOLLA, C.\n*São Paulo* (v.1); RIBEIRO, A. *Governos*.\n","dic":"DHBPR"}
