{"title":"GOMES, Horácio de Magalhães","cargoss":["Deputado federal","Deputado federal"],"cargos_esp":[0,0],"datas_ini":[1924,1915],"datas_fim":[1929,1917],"estados":["RJ","RJ"],"autor":["Luciana Pinheiro"],"content":"**GOMES, Horácio de Magalhães**\n\n\\* dep. fed. RJ 1915-1917 e 1924-1929.\n\n*Horácio de Magalhães Gomes* nasceu em Rio Novo (MG) no dia 22 de\nnovembro de 1867, filho de Antônio Magalhães Gomes e de Guilhermina\nMagalhães Gomes.\n\nFez o curso preparatório no Liceu Mineiro, localizado em Ouro Preto, e a\nseguir ingressou na Faculdade de Direito de São Paulo, diplomando-se em\nciências jurídicas e sociais em 1890. Recém-formado, retornou ao estado\nnatal e assumiu a promotoria pública do município de Rio Preto.\nTransferindo-se para Petrópolis, no estado do Rio de Janeiro, advogou,\nfoi delegado de polícia e promotor público interino. Em fins da década\nde 1890, durante o governo de Alberto Torres (1897-1900), assumiu o\ncargo de chefe de polícia. Foi também vereador em Petrópolis por 12\nanos.\n\nFoi eleito deputado estadual no Rio de Janeiro em dezembro de 1909 para\na legislatura 1910-1912. Nesse mandato integrou a Comissão da Guarda da\nConstituição e das Leis e de Poderes.\n\nNas eleições de 1915 foi eleito deputado federal pelo Rio de Janeiro.\nTomou posse de sua cadeira na Câmara dos Deputados na cidade do Rio de\nJaneiro, então Distrito Federal, em junho do mesmo ano e exerceu o\nmandato até dezembro de 1917, quando se encerrou a legislatura.\n\nEm outubro de 1923 voltou a ser eleito deputado estadual no Rio de\nJaneiro. Durante o mandato, iniciado no mesmo ano, foi eleito presidente\nda Mesa Diretora da Assembleia Legislativa do Estado do Rio de Janeiro.\nAfastou-se da ALERJ no ano seguinte por ter sido eleito deputado\nfederal. Assumiu, em maio de 1924, sua cadeira na Câmara dos Deputados\nno Rio de Janeiro, então Distrito Federal, e foi reeleito em 1927.\nPermaneceu no Legislativo Federal até dezembro de 1929, quando se\nencerraram o seu mandato e a legislatura.\n\nLuciana Pinheiro\n\n**FONTES:** ABRANCHES, J. *Governos*; ASSEMB. LEGISL.RJ. *Anais*\n(17/7-10/11/1910, 20/11/1923 a 16/1/1924); CÂM. DEP. *Deputados\nbrasileiros*; GOV. RJ. Disponível em: \\<www.governo.rj.gov.br/\\>. Acesso\nem: 18/12/2010.\n","ref":"**FONTES:** ABRANCHES, J. *Governos*; ASSEMB. LEGISL.RJ. *Anais*\n(17/7-10/11/1910, 20/11/1923 a 16/1/1924); CÂM. DEP. *Deputados\nbrasileiros*; GOV. RJ. Disponível em: \\<www.governo.rj.gov.br/\\>. Acesso\nem: 18/12/2010.\n","dic":"DHBPR"}
