{"title":"GONÇALVES, Joaquim Ribeiro","cargoss":["Senador"],"cargos_esp":[0],"datas_ini":[1909],"datas_fim":[1921],"estados":["PI"],"autor":["Raimundo Helio Lopes"],"content":"**GONÇALVES, Joaquim Ribeiro**\n\n\\*sen. PI 1909-1921.\n\n*Joaquim Ribeiro Gonçalves* nasceu em 1860 na cidade de Amarante (PI),\nfilho de João Ribeiro Gonçalves.\n\nComeçou seus estudos jurídicos em 1879 na Faculdade de Direito do\nRecife, concluindo-os em 1882. Depois de formado, transferiu-se\ninicialmente para o Amazonas e depois para o Maranhão, onde, em 1884,\nfoi juiz em São Bento. Foi nessa província que iniciou suas atividades\npolíticas, elegendo-se deputado provincial pelo Partido Conservador.\nComo deputado, foi autor da lei que elevava a vila de São Bento à\ncategoria de cidade e da que criava o primeiro grupo escolar do\nMaranhão. Ainda no Maranhão, dedicou-se a atividades empresariais, em\nespecial à pesca.\n\nApós a proclamação da República (15/11/1889), de volta ao Piauí,\ndesempenhou as funções de juiz de direito em Teresina. Em outubro de\n1891, na condição de procurador geral nomeado, participou da solenidade\nde instalação do Tribunal de Justiça do Piauí. Envolvido na vida\npolítica estadual, exerceu o cargo de vice-governador do Piauí entre\nfevereiro de 1892 e dezembro de 1896, durante o governo de Coriolano de\nCarvalho e Silva.\n\nEm 1909 candidatou-se a deputado federal e a senador, sendo eleito para\nambos os mandatos. Optou pelo Senado e concluiu seu primeiro mandato, de\nnove anos, em dezembro de 1917. Disputou com êxito a reeleição em 1918,\nmas faleceu em 1921, no exercício do mandato.\n\nTambém foi juiz em Recife, Barras (PI) e Amarante. Publicou os livros de\npoesia *Os mártires da vitória* (1880), *Vislumbres* (1880) e\n*Centelhas* (1892) e o poema *A emancipação* (1881). Sobre ele foi\nescrita a obra *Joaquim Ribeiro Gonçalves - poeta, político e\nparlamentar*, de autoria de Luís Mendes Ribeiro Gonçalves.\n\nRaimundo Helio Lopes\n\n**FONTES:** ABRANCHES, J. *Governos*; GONÇALVES, W. *Grande*; *Grande\nEncic. Delta Larousse*; LEITE NETO, L. *Catálogo biográfico*.\n","ref":"**FONTES:** ABRANCHES, J. *Governos*; GONÇALVES, W. *Grande*; *Grande\nEncic. Delta Larousse*; LEITE NETO, L. *Catálogo biográfico*.\n","dic":"DHBPR"}
