{"title":"GONÇALVES, Malaquias Antônio","cargoss":["Deputado federal"],"cargos_esp":[0],"datas_ini":[1897],"datas_fim":[1908],"estados":["PE"],"autor":["Raimundo Helio Lopes"],"content":"**GONÇALVES, Malaquias Antônio**\n\n\\*dep. fed. PE 1897-1908.\n\n*Malaquias Antônio Gonçalves* nasceu na cidade de Brejo (MA) no dia 11\nde dezembro de 1846.\n\nFormou-se pela Faculdade de Medicina do Rio de Janeiro, então capital do\nImpério, em 1868. Depois de formado, passou a clinicar em Recife, onde\ntrabalhou no Hospital Pedro II, a partir de 1870, e no Hospital\nPortuguês, a partir de 1889. Iniciou a vida política ainda durante o\nImpério ingressando no Partido Liberal, pelo qual foi eleito deputado\nprovincial em Pernambuco com mandato de 1878 a 1880. Depois da\nproclamação da República (15/11/1889), foi eleito senador estadual para\na legislatura de 1892 a 1894.\n\nEm 1897 foi eleito deputado federal por Pernambuco. Assumindo sua\ncadeira na Câmara dos Deputados, no Rio de Janeiro, então Distrito\nFederal, em maio desse ano, foi sucessivamente reeleito para as\nlegislaturas seguintes. Faleceu no exercício do mandato, no Rio de\nJaneiro, no dia 17 de agosto de 1908. Sua vaga foi preenchida por\nJoaquim José de Faria Neves Sobrinho.\n\nRaimundo Helio Lopes\n\n**FONTES:** ABRANCHES, J. *Governos*; CÂM. DEP. *Deputados brasileiros.*\n","ref":"**FONTES:** ABRANCHES, J. *Governos*; CÂM. DEP. *Deputados brasileiros.*\n","dic":"DHBPR"}
