{"title":"AMARAL, Aquilino do","cargoss":["Constituinte","Senador"],"cargos_esp":[0,0],"datas_ini":[1891,1891],"datas_fim":[1891,1899],"estados":[0,"MT"],"autor":[0],"content":"**AMARAL, Aquilino do**\n\n\\* const. 1891; sen. MT 1891-1899.\n\n*Aquilino Leite do Amaral Coutinho*nasceu emCuiabá em 1845, filho de\nManuel Leitedo Amaral Coutinho e de Francisca daSilva Prado.\n\nBacharel pela Faculdade de Direitode São Paulo e membro do\nPartidoConservador, foi deputado provincial em SãoPaulo em 1886-1887.\nFoi também diretorda Casa de Correção em São Paulode 1888 a 1889.\n\nCom a proclamação da República,mudou-se de São Paulo para Mato Grossoe,\nao lado de Caetano de Albuquerque,proferiu conferências a favor do\nnovoregime. Em 15 de setembro de 1890foi eleito senador por Mato Grosso\naoCongresso Nacional Constituinte e em 15de novembro seguinte tomou\nposse. Quandoda substituição do presidente republicano deMato Grosso,\nAntônio Maria Coelho, em16 de fevereiro de 1891, manifestou-secontra.\nApós a promulgação da Constituiçãoem 24 de fevereiro de 1891, e oinício,\nem maio, da legislatura ordinária,exerceu o mandato no Senado até\ndezembrode 1899.\n\nFaleceu no dia 11 de julhode 1911.\n\nJoão Edson Fanaia\n\n**FONTES:**ABRANCHES, J. *Governos*;CASTRO, A.; CASTAGNINO, A. *Senado*;\nCONG.NAC. *Anais* (13/1/1891); LEITE NETO, L. *Catálogo biográfico.*\n","ref":"**FONTES:**ABRANCHES, J. *Governos*;CASTRO, A.; CASTAGNINO, A. *Senado*;\nCONG.NAC. *Anais* (13/1/1891); LEITE NETO, L. *Catálogo biográfico.*\n","dic":"DHBPR"}
