{"title":"GOUVEIA, Urbano Coelho de","cargoss":["Deputado federal","Presidente de associação ou confederação de empregados ou empregadores","Deputado federal","Senador","Presidente de associação ou confederação de empregados ou empregadores"],"cargos_esp":[0,0,0,0,0],"datas_ini":[1892,1898,1901,1903,1909],"datas_fim":[1898,1901,1902,1909,1912],"estados":["GO","GO","GO","GO","GO"],"autor":["Adrianna Setemy"],"content":"**GOUVEIA, Urbano Coelho de**\n\n\\*militar; dep. fed. GO 1892-1898; pres. GO 1898-1901; dep. fed. GO\n1901-1902; sen. GO 1903-1909; pres. GO 1909-1912.\n\n*Urbano Coelho de Gouveia* nasceu em Cantagalo (RJ) no dia 8 de julho de\n1852. Seu cunhado Leopoldo Bulhões – irmão de sua mulher Leonor de\nBulhões Jardim – foi constituinte de 1891, várias vezes senador por\nGoiás entre 1894 e 1918, e ministro da Fazenda de 1902 a 1906 e de 1909\na 1910. Seu concunhado Francisco Leopoldo Rodrigues Jardim, casado com\nsua cunhada Maria Nazaré de Bulhões Jardim, foi seu antecessor no\ngoverno de Goiás, de 1895 a 1898, deputado federal em 1899 e senador de\n1899 a 1905 e de 1909 a 1910.\n\nCursou a Escola Militar do Rio de Janeiro e formou-se em engenharia.\n\nApós a promulgação da Constituição federal de fevereiro de 1891, foi\neleito deputado federal por Goiás em 6 de junho do mesmo ano, por ter\nsido aumentada a representação federal do estado na Câmara dos\nDeputados. Empossado em 15 de julho de 1892, foi reeleito em 1^o^ de\nmarço de 1894 e de 1897, com mandato até 1899.\n\nEm 20 de maio de 1898 foi eleito presidente do estado de Goiás e por\nesse motivo renunciou à sua cadeira na Câmara antes do final da\nlegislatura. Tomou posse no governo do estado em 1^o^ de novembro de\n1898, sucedendo a Bernardo Albernaz, que completava o mandato de\nFrancisco Leopoldo Rodrigues Jardim. Em março de 1901, último ano de seu\nmandato, foi eleito como seu sucessor José Xavier de Almeida, que havia\nsido secretário do Interior e Justiça de seu governo e do governo de\nFrancisco Leopoldo Jardim. Em junho seguinte, quando se afastou para ir\nao Rio de Janeiro, então capital federal, mais uma vez assumiu o governo\ndo estado o primeiro-vice-presidente, Bernardo Albernaz, que nele se\nmanteve até a posse Xavier de Almeida em 12 de agosto.\n\nEm 20 de outubro de 1901 foi eleito deputado federal por Goiás em\neleição realizada a fim de que fosse preenchida a vaga deixada na Câmara\npor Xavier de Almeida. Exerceu o mandato até dezembro de 1902, e em 18\nde fevereiro de 1903 foi eleito senador por Goiás para um mandato de\nnove anos. Deixou porém o Senado em 1909, antes do final da legislatura,\nao ser nomeado presidente de Goiás após a Revolução de 1909, movimento\npolítico liderado por Leopoldo Bulhões, que, com o apoio das lideranças\npecuaristas do estado, liquidou o domínio político do grupo de Xavier de\nAlmeida.\n\nEmpossado na presidência de Goiás em 24 de julho de 1909, teve sua\nadministração marcada por uma série de desentendimentos com o poder\ncentral, pois o presidente Hermes da Fonseca (1910-1914) queria quebrar\na hegemonia regional dos Bulhões, dos quais era aliado. As pressões\nfederais foram tão fortes que renunciou à presidência do estado em março\nde 1912, e a partir de então afastou-se da vida política. Foi\nsubstituído interinamente por Joaquim Rufino Ramos Jubé, que em maio\npassou o governo ao segundo-vice-presidente Herculano de Sousa Lobo.\n\nEm 1^o^ de abril de 1913, reformou-se na carreira militar como marechal\ngraduado.\n\nFaleceu em 17 de fevereiro de 1925.\n\nAdrianna Setemy\n\n**FONTES:** ABRANCHES, J. *Governos* (v.1); Projeto de imagem de\npublicações oficiais brasileiras do Center for Research Libraries e\nLatin-american Microfilm Project. *Mensagens dos Presidentes de\nProvíncia (1830-1930).* Disponível em:\n\\<www.crl.edu/content.asp?l1=4&l2=18&l3=33\\>. Acesso em: 8/1/2009.\n","ref":"**FONTES:** ABRANCHES, J. *Governos* (v.1); Projeto de imagem de\npublicações oficiais brasileiras do Center for Research Libraries e\nLatin-american Microfilm Project. *Mensagens dos Presidentes de\nProvíncia (1830-1930).* Disponível em:\n\\<www.crl.edu/content.asp?l1=4&l2=18&l3=33\\>. Acesso em: 8/1/2009.\n","dic":"DHBPR"}
