{"title":"GÓIS, Geminiano de","cargoss":["Deputado Geral","Presidente de associação ou confederação de empregados ou empregadores","Presidente de associação ou confederação de empregados ou empregadores","Deputado federal"],"cargos_esp":[0,0,0,0],"datas_ini":[1881,1886,1886,1894],"datas_fim":[1884,1886,1887,1899],"estados":["SE","AL","PB","SE"],"autor":[0],"content":"**GÓIS, Geminiano de**\n\n\\*dep. geral SE 1881-1884; pres. AL 1886; pres. PB 1886-1887; dep. fed.\nSE 1894-1899.\n\n*Geminiano Brasil de Oliveira Góis* nasceu no Engenho Cajá, pertencente\nao município do Espírito Santo (SE), no dia 30 de maio de 1844, filho de\nAntônio de Góis do Nascimento e de Maria Joaquina de Oliveira Góis.\n\nIniciou os estudos preparatórios na cidade de Estância (SE), mas\ntransferiu-se para Pernambuco e concluiu os estudos em Recife.\nBacharelou-se pela Faculdade de Direito da capital pernambucana em 1868.\nDepois de formado regressou a Sergipe e no ano seguinte foi nomeado\npromotor público da comarca de Itabaiana (SE). Designado, em 1870, juiz\nmunicipal dos termos reunidos de Lagarto e Campos, no interior da\nprovíncia, quatro anos depois foi nomeado juiz de direito da comarca de\nRio Real, à época pertencente ao território de Sergipe e depois\nmunicípio do estado da Bahia.\n\nParticipou da política imperial ao ser eleito deputado provincial em\nSergipe por duas vezes, de 1870 a 1871 e de 1874 a 1875, e deputado\ngeral de 1881 a 1884. Presidiu as províncias de Alagoas (1886) e Paraíba\n(1886-1887), indicado pelo imperador dom Pedro II, e em 1877 foi nomeado\nchefe de polícia da província de Sergipe.\n\nSua carreira política prosseguiu após o fim do Império e a proclamação\nda República em 15 de novembro de 1889. Foi eleito pela primeira vez\ndeputado federal por Sergipe para a legislatura 1894-1896 e foi reeleito\nno ano seguinte para um novo período, quando chegou à vice-presidência\nda Câmara. Permaneceu no Legislativo fFederal até dezembro de 1899,\nquando se encerraram seu mandato e a legislatura.\n\nCom o encerramento de suas atividades políticas, passou a se dedicar à\ndoutrina espírita. Assumiu, em 1902, a vice-presidência da Federação\nEspírita Brasileira, na vaga aberta com o falecimento de João Batista\nMaia Lacerda.\n\nFaleceu no Rio de Janeiro em 21 de maio de 1904.\n\nEm sua homenagem, uma rua na Freguesia, em Jacarepaguá, no Rio de\nJaneiro, recebeu seu nome.\n\nSérgio Montalvão\n\n**FONTES:** CÂM. DEP. *Deputados Brasileiros*; GUARANÁ, M.\n*Dicionário***.**\n","ref":"**FONTES:** CÂM. DEP. *Deputados Brasileiros*; GUARANÁ, M.\n*Dicionário***.**\n","dic":"DHBPR"}
