{"title":"GUILLON, Francisco Alberto","cargoss":["Deputado federal"],"cargos_esp":[0],"datas_ini":[1897],"datas_fim":[1900],"estados":["RS"],"autor":["Raimundo Helio Lopes"],"content":"**GUILLON, Francisco Alberto**\n\n\\*dep. fed. RS 1897-1900.\n\n*Francisco Alberto Guillon* nasceu no Maranhão em 21 de setembro de\n1851, filho de Henrique de Brito Guillon e de Rosa Mariana Ribeiro\nGuillon.\n\nAssentou praça em 1^o^ de dezembro de 1866, tonando-se alferes em 8 de\njaneiro de 1876. Foi promovido a segundo-tenente em 31 de janeiro de\n1877 e a capitão em 25 de julho de 1880. Em 27 de novembro de 1882\ncasou-se, no Rio Grande do Sul, com Águeda Francelina Salgado. Ainda\ndurante o Império, tornou-se professor da Escola Militar de Porto Alegre\ne, com a nomeação de Gaspar Silveira Martins para a presidência da\nprovíncia do Rio Grande do Sul em 1889, foi demitido do cargo, com a\njustificativa de reforçar a ordem e disciplina da tropa. Contudo, as\ndemissões significaram uma tentativa de diminuir a influência do\nrepublicanismo na tropa, doutrina que Francisco Alberto Guillon já\ndefendia nos meios militares.\n\nApós a proclamação da República (15/11/1889) continuou a carreira\nmilitar e foi promovido a major em 7 de janeiro de 1890. Com o novo\nregime, foi nomeado chefe de polícia no Rio Grande do Sul em 22 de\nnovembro de 1890. Permaneceu no cargo até 11 de novembro do ano seguinte\ne, 10 dias depois, chegou a tenente-coronel graduado, sendo promovido a\ntenente-coronel efetivo em 13 de janeiro de 1892. Durante sua atividade\nmilitar, fez o curso de engenharia, tornando-se doutor em matemática e\nciências físicas.\n\nEm janeiro de 1897 foi eleito deputado federal pelo Rio Grande do Sul e\nassumiu sua cadeira na Câmara dos Deputados na cidade do Rio de Janeiro,\nentão Distrito Federal, em maio desse mesmo ano. Foi reeleito em 1900,\niniciou em maio o novo mandato, mas não o concluiu, pois faleceu ainda\nnesse ano. Em seu lugar, foi eleito Francisco Antônio de Moura.\n\nFaleceu na cidade do Rio de Janeiro em setembro de 1900.\n\nRaimundo Helio Lopes\n\n**FONTES:** ABRANCHES, J. *Governos*; ARQ. PUB. PORTO ALEGRE. Registro\nde casamento da Igreja das Dores (livro 2, p.88); CASTRO, C*.\nMilitares*; POL. CIV. RS. *A história da polícia gaúcha.* Disponível em:\n\\<www.pc.rs.gov.br/upload/1293122838\\_historia\\_da\\_policia\\_civil.pdf\\>.\nAcesso em: 15/8/2011.\n","ref":"**FONTES:** ABRANCHES, J. *Governos*; ARQ. PUB. PORTO ALEGRE. Registro\nde casamento da Igreja das Dores (livro 2, p.88); CASTRO, C*.\nMilitares*; POL. CIV. RS. *A história da polícia gaúcha.* Disponível em:\n\\<www.pc.rs.gov.br/upload/1293122838\\_historia\\_da\\_policia\\_civil.pdf\\>.\nAcesso em: 15/8/2011.\n","dic":"DHBPR"}
